Date,Title,Source
2025-08-31T06:36:43Z,Best Hydrogen Stocks To Add to Your Watchlist – August 29th,ETF Daily News
2025-08-31T05:17:15Z,"Jeremy Lin retires from NBA: Net Worth in 2025, Personal Life, Career Achievements and More",The Times of India
2025-08-31T04:55:21Z,Jeremy Lin officially retires after 15 years in pro basketball: ‘Hardest decision I’ve ever made’,New York Post
2025-08-31T02:01:25Z,"Jeremy Lin announces retirement, more than a decade after 'Linsanity' captivated the NBA",Yahoo Entertainment
2025-08-31T01:06:36Z,Jeremy Lin Announces Retirement From Basketball,Realgm.com
2025-08-30T21:00:00Z,Paul Chiang Art Center / Behet Bondzio Lin Architekten,ArchDaily
2025-08-30T08:34:08Z,"MND submits PLA report, details possible scenarios for Taiwan campaign",Globalsecurity.org
2025-08-30T04:10:00Z,The Revenger’s Tragedy: ‘I love the idea that there’s a Jacobean revenge tragedy inside each bedroom rapper’s head’,The Irish Times
2025-08-29T22:30:00Z,‘Mortal Kombat II’ Will Now Rumble Next Summer,Deadline
2025-08-29T16:00:01Z,Wei-En Lin Is a Fast-Rising A’s Prospect Who Throws Strikes — Perhaps Too Many,Fangraphs.com
2025-08-29T14:00:00Z,"Low-dose aspirin is not effective as an adjunct treatment for HIV infection among people living with HIV on dolutegravir-based antiretroviral therapy: A randomised double-blind, parallel-group placebo-controlled trial",Plos.org
2025-08-29T11:29:01Z,"What are Carolina Marin, Tai Tzu-ying up to now? Relaxed time on beaches and in snow-capped mountains, learning to edit reels",The Indian Express
2025-08-29T09:27:15Z,Japan should honestly face up to its history of aggression: Defense Spokesperson,Globalsecurity.org
2025-08-29T09:26:44Z,Taiwan defense minister silent on reported U.S. defense posting,Globalsecurity.org
2025-08-29T05:06:58Z,Europe’s sanctions on Russia don’t bite,EURACTIV
2025-08-28T23:00:00Z,"Self-healing non-precious metal oxide anode in proton exchange membrane electrolysis beyond 1,000 h stability at 2 A cm−2",Royal Society of Chemistry
2025-08-28T23:00:00Z,Heteroatom Substitution and Molecular Configuration Engineering in Self-assembled Materials for High-efficiency and Stable Perovskite Solar Cells,Royal Society of Chemistry
2025-08-28T23:00:00Z,Regioselective Photodimerization As A Tool For Light-Regulated Catalyst Assembly,Royal Society of Chemistry
2025-08-28T23:00:00Z,Recent advances in nanozymes for organophosphorus pesticide detection in food,Royal Society of Chemistry
2025-08-28T23:00:00Z,Rational Cyano Functionalization of Copper Phenylacetylide Paves the Way for Superior Photogenerated Electron Transport Capability and Diclofenac Degradation,Royal Society of Chemistry
2025-08-28T23:00:00Z,Life cycle analysis of sustainable H2 production and hydrogenation of chemicals in a large-scale coupled photoelectrochemical system,Royal Society of Chemistry
2025-08-28T23:00:00Z,Catalytic Coproduction of Renewable Lubricant Base Oils and Diesel Fuels from Bio-Lipid and Aromatics via Alkylation and Hydrodeoxygenation,Royal Society of Chemistry
2025-08-28T23:00:00Z,B-site high valence cation co-doping boosts fast oxygen kinetics in a cobalt-free perovskite air electrode for reversible solid oxide cells,Royal Society of Chemistry
2025-08-28T17:27:33Z,Federal Way Link to open on Dec. 6,Seattletransitblog.com
2025-08-28T14:00:00Z,MiR-146a participates in regulating the progression of periodontitis through the Wnt/β-catenin signaling pathway,Plos.org
2025-08-28T09:17:43Z,Taiwan silent on reports foreign minister joined Philippines business trip,Globalsecurity.org
2025-08-28T06:08:24Z,"Journal of Chinese Cinemas Special Issue CFP: Before, Besides, and Beyond the Taiwanese New Cinema",Upenn.edu
2025-08-28T00:00:00Z,"GSoC 2025 Final Project Blog: Developing Karton, the KDE Virtual Machine Manager!",Kenoi.dev
2025-08-27T23:04:54Z,Wistron chairman sees going global as an opportunity for businesses,Digitimes
2025-08-27T23:00:00Z,Development of Single Crystalline Al-doped ZnS Nanodiscs as Efficient Photocatalysts for H2 Evolution Reaction†,Royal Society of Chemistry
2025-08-27T23:00:00Z,"Copper-catalyzed 1,4-alkylcyanation of CF3-containing 1,3-enynes: alkoxy radical-mediated selective cleavage of fused azabicycles",Royal Society of Chemistry
"Sun, 31 Aug 2025 16:22:00 GMT",Lin retires after living 'wildest childhood dreams' - ESPN,ESPN
"Sun, 31 Aug 2025 17:02:13 GMT",Jeremy Lin retires after trailblazing basketball career that sparked 'Linsanity' craze - NBC News,NBC News
"Mon, 01 Sep 2025 03:14:00 GMT",Former Rocket Jeremy Lin Retires From Basketball - The Dream Shake,The Dream Shake
"Mon, 01 Sep 2025 05:34:19 GMT",Jeremy Lin announces his retirement from basketball - NBC Sports,NBC Sports
"Sun, 31 Aug 2025 04:40:18 GMT",9-year NBA veteran Jeremy Lin announces retirement from professional basketball - NBA,NBA
"Sun, 31 Aug 2025 05:19:20 GMT",Jeremy Lin Retires After 15 Years That Included ‘Linsanity’ With the Knicks - The New York Times,The New York Times
"Mon, 01 Sep 2025 04:47:51 GMT",Bay Area native Jeremy Lin announces retirement from basketball - MSN,MSN
"Sun, 31 Aug 2025 14:41:00 GMT","Jeremy Lin retires: Ex-NBA standout sparked 'Linsanity' run with Knicks, won championship with Raptors - CBS Sports",CBS Sports
"Sun, 31 Aug 2025 17:03:45 GMT",Linsanity Forever: Jeremy Lin Has Officially Retired From The Game Of Basketball - Barstool Sports,Barstool Sports
"Sun, 31 Aug 2025 02:01:00 GMT","Jeremy Lin announces retirement, more than a decade after 'Linsanity' captivated the NBA - Yahoo Sports",Yahoo Sports
"Mon, 01 Sep 2025 00:21:15 GMT","‘He represented that underdog story’: Valkyries’ Chen, Nakase reflect on Jeremy Lin’s impact - The Mercury News",The Mercury News
"Sun, 31 Aug 2025 19:20:12 GMT",Former Nets G Jeremy Lin retires from basketball; spent 9 years in NBA - Nets Wire,Nets Wire
"Mon, 01 Sep 2025 05:26:56 GMT",Linde PLC $LIN Shares Sold by J. Stern & Co. LLP - MarketBeat,MarketBeat
"Mon, 01 Sep 2025 00:45:23 GMT",Former Net Jeremy Lin Retires: A Look Back at His Time in Brooklyn - Sports Illustrated,Sports Illustrated
"Sun, 31 Aug 2025 20:06:31 GMT",Jeremy Lin retires from professional basketball after 9-year NBA career - The Athletic - The New York Times,The New York Times
"Mon, 01 Sep 2025 02:40:17 GMT",Mitochondrial stress regulates phosphorylation of LIN-40 to coordinate chromatin remodeling and longevity - MSN,MSN
"Mon, 01 Sep 2025 05:23:05 GMT",Jump Financial LLC Reduces Holdings in Linde PLC $LIN - MarketBeat,MarketBeat
"Mon, 01 Sep 2025 05:23:04 GMT",Linde PLC $LIN Shares Sold by Epoch Investment Partners Inc. - MarketBeat,MarketBeat
"Mon, 01 Sep 2025 06:19:48 GMT","Kestra Advisory Services LLC Sells 2,203 Shares of Linde PLC $LIN - MarketBeat",MarketBeat
"Mon, 01 Sep 2025 05:21:03 GMT","Guggenheim Capital LLC Sells 19,786 Shares of Linde PLC $LIN - MarketBeat",MarketBeat
"Mon, 01 Sep 2025 00:59:10 GMT",Bay Area native Jeremy Lin announces retirement from basketball - KRON4,KRON4
"Mon, 01 Sep 2025 05:20:59 GMT",D L Carlson Investment Group Inc. Invests $2.13 Million in Linde PLC $LIN - MarketBeat,MarketBeat
"Sun, 31 Aug 2025 16:21:02 GMT","Former NBA star, Asian American trailblazer Jeremy Lin retires - East Bay Times",East Bay Times
"Sun, 31 Aug 2025 15:27:18 GMT",Former Knicks guard Jeremy Lin announces retirement from pro basketball - Yahoo Sports,Yahoo Sports
"Sun, 31 Aug 2025 20:26:15 GMT","Jeremy Lin Retires From Basketball After 15-Year Career, 'Linsanity' Fame - Yahoo Sports",Yahoo Sports
"Sun, 31 Aug 2025 17:15:00 GMT",Jeremy Lin Announces Retirement - Hoops Rumors,Hoops Rumors
"Sun, 31 Aug 2025 21:55:07 GMT",Former NBA champion Jeremy Lin announces retirement from professional basketball - MARCA,MARCA
"Sun, 31 Aug 2025 02:14:27 GMT","Ex-Warriors player Jeremy Lin, who launched 'Linsanity,' retires from basketball - SFGATE",SFGATE
"Sun, 31 Aug 2025 02:42:32 GMT",Jeremy Lin celebrates NBA retirement in perfect way after heartfelt goodbye - Sports Illustrated,Sports Illustrated
"Mon, 01 Sep 2025 05:20:59 GMT","Northwestern Mutual Wealth Management Co. Sells 3,485 Shares of Linde PLC $LIN - MarketBeat",MarketBeat
"Sun, 31 Aug 2025 21:23:53 GMT",Jeremy Lin calls it quits: Linsanity star retires after 15 year global career - MARCA,MARCA
"Sun, 31 Aug 2025 23:28:47 GMT",‘Hamilton’ turns 10: Lin-Manuel Miranda announces movie theater release to celebrate the Broadway musical’s anniversary - AOL.com,AOL.com
"Sun, 31 Aug 2025 19:44:49 GMT",Taiwanese-American NBA pioneer Jeremy Lin retires at age 37 - Newsbug.info,Newsbug.info
"Sun, 31 Aug 2025 16:19:58 GMT",Jeremy Lin announces retirement from professional basketball - AsAmNews,AsAmNews
"Sun, 31 Aug 2025 16:00:00 GMT",‘Linsanity’: Jeremy Lin announces his retirement - Taipei Times,Taipei Times
"Sun, 31 Aug 2025 17:39:53 GMT",Jeremy Lin officially retires after 15 years in pro basketball: ‘Hardest decision I’ve ever made’ - MSN,MSN
"Sun, 31 Aug 2025 14:55:00 GMT","Former Raptors guard, NBA champion Jeremy Lin retires from basketball - Sportsnet.ca",Sportsnet.ca
"Sun, 31 Aug 2025 23:09:01 GMT",Jeremy Lin announces his retirement - Yardbarker,Yardbarker
"Mon, 01 Sep 2025 02:03:05 GMT","Jeremy Lin, the guard who became the NBA's first American player of Taiwanese and Chinese heritage, announced his retirement from professional basketball - islandernews.com",islandernews.com
"Sun, 31 Aug 2025 19:44:49 GMT",Taiwanese-American NBA pioneer Jeremy Lin retires at age 37 - Caledonian Record,Caledonian Record
"Sun, 31 Aug 2025 12:05:00 GMT",Jeremy Lin’s Retirement Sparks Memories of Iconic Knicks Run - Sports Illustrated,Sports Illustrated
"Sun, 31 Aug 2025 16:36:50 GMT",Lin retires after living 'wildest childhood dreams' - ESPN Philippines,ESPN Philippines
"Sun, 31 Aug 2025 12:00:11 GMT",‘It’s time’: 9-year NBA veteran Jeremy Lin retires from professional basketball - South China Morning Post,South China Morning Post
"Sun, 31 Aug 2025 01:30:00 GMT","'Linsanity' Jeremy Lin retires after 15-year career in NBA, China, Taiwan - Focus Taiwan",Focus Taiwan
"Sun, 31 Aug 2025 19:44:49 GMT",Taiwanese-American NBA pioneer Jeremy Lin retires at age 37 - Indiana Gazette Online,Indiana Gazette Online
"Sun, 31 Aug 2025 19:44:49 GMT",Taiwanese-American NBA pioneer Jeremy Lin retires at age 37 - Northeast Mississippi Daily Journal,Northeast Mississippi Daily Journal
"Mon, 01 Sep 2025 02:55:02 GMT",‘Linsanity’ ends: Taiwanese-American NBA pioneer Jeremy Lin calls time on 15-year career - Malay Mail,Malay Mail
"Sun, 31 Aug 2025 05:16:00 GMT","Jeremy Lin retires from NBA: Net Worth in 2025, Personal Life, Career Achievements and More - Times of India",Times of India
"Sun, 31 Aug 2025 04:55:00 GMT",Jeremy Lin officially retires after 15 years in pro basketball: ‘Hardest decision I’ve ever made’ - New York Post,New York Post
"Sun, 31 Aug 2025 23:39:18 GMT",Jeremy Lin retires: Former face of NBA's 'Linsanity' retires from professional basketball - sportingnews.com,sportingnews.com
"Sun, 31 Aug 2025 11:00:03 GMT",Former Knicks Guard Jeremy Lin Announces Retirement - Sports Illustrated,Sports Illustrated
"Sun, 31 Aug 2025 12:07:00 GMT",Jeremy Lin ends 15-year basketball career - China Daily,China Daily
"Sun, 31 Aug 2025 19:44:49 GMT",Taiwanese-American NBA pioneer Jeremy Lin retires at age 37 - WV News,WV News
"Sun, 31 Aug 2025 14:00:00 GMT",Inside Fanglu Lin’s Zara Home collection – and the simple rule she lives by at home - Yahoo Life UK,Yahoo Life UK
"Sun, 31 Aug 2025 01:53:00 GMT",9-year NBA veteran Jeremy Lin announces retirement - Reuters,Reuters
"Sun, 31 Aug 2025 15:21:12 GMT",Jeremy Lin announces retirement after 15-year run - Yardbarker,Yardbarker
"Sun, 31 Aug 2025 03:41:00 GMT",Jeremy Lin Announces Retirement - Hoops Rumors,Hoops Rumors
"Sun, 31 Aug 2025 15:24:00 GMT",Jeremy Lin announces retirement after nine-year career in NBA - Sportstar,Sportstar
"Sun, 31 Aug 2025 01:43:57 GMT",How Many NBA Teams Did Jeremy Lin Play For? - Sports Illustrated,Sports Illustrated
"Sun, 31 Aug 2025 06:05:20 GMT",Jeremy Lin announces retirement - TalkBasket.net,TalkBasket.net
"Sun, 31 Aug 2025 19:44:49 GMT",Taiwanese-American NBA pioneer Jeremy Lin retires at age 37 - Citizen Tribune,Citizen Tribune
"Sun, 31 Aug 2025 12:03:47 GMT","Former NBA star, Asian American trailblazer Jeremy Lin retires - Chico Enterprise-Record",Chico Enterprise-Record
"Sun, 31 Aug 2025 19:44:49 GMT",Taiwanese-American NBA pioneer Jeremy Lin retires at age 37 - Iosco County News Herald,Iosco County News Herald
"Sun, 31 Aug 2025 19:44:49 GMT",Taiwanese-American NBA pioneer Jeremy Lin retires at age 37 - The Daily Post-Athenian,The Daily Post-Athenian
"Sun, 31 Aug 2025 02:47:00 GMT",Jeremy Lin retires: Former face of NBA's 'Linsanity' retires from professional basketball - Yahoo Sports,Yahoo Sports
"Sat, 30 Aug 2025 18:00:38 GMT",Lin’s Grand Buffet to reopen all-you-can-eat restaurant in west Phoenix - KTAR News 92.3 FM,KTAR News 92.3 FM
"Sun, 31 Aug 2025 02:01:35 GMT","Jeremy Lin retires: All on ex-Lakers star's wife, net worth, championship ring, other details - Hindustan Times - Hindustan Times",Hindustan Times
"Sun, 31 Aug 2025 19:44:49 GMT",Taiwanese-American NBA pioneer Jeremy Lin retires at age 37 - The Daily Gazette,The Daily Gazette
"Sun, 31 Aug 2025 19:44:49 GMT",Taiwanese-American NBA pioneer Jeremy Lin retires at age 37 - Shelby News,Shelby News
"Sun, 31 Aug 2025 23:02:53 GMT",Revisiting the best of Linsanity after Jeremy Lin's retirement announcement - FanSided,FanSided
"Sun, 31 Aug 2025 11:34:19 GMT",The Manufacturers Life Insurance Company Decreases Stock Holdings in Linde PLC $LIN - MarketBeat,MarketBeat
"Sun, 31 Aug 2025 06:38:05 GMT",9-year NBA veteran Jeremy Lin announces retirement - WHTC,WHTC
"Mon, 01 Sep 2025 00:45:23 GMT",Former Net Jeremy Lin Retires: A Look Back at His Time in Brooklyn - vlada.mk,vlada.mk
"Sun, 31 Aug 2025 23:11:53 GMT",The Broadway Lover's Guide to Dining Like Lin-Manuel Miranda in NYC - MSN,MSN
"Sun, 31 Aug 2025 19:44:49 GMT",Taiwanese-American NBA pioneer Jeremy Lin retires at age 37 - The Elkhart Truth,The Elkhart Truth
"Sun, 31 Aug 2025 01:00:00 GMT",Paul Chiang Art Center / Behet Bondzio Lin Architekten - ArchDaily,ArchDaily
"Mon, 01 Sep 2025 00:48:46 GMT",Taiwanese-American NBA pioneer Jeremy Lin retires at age 37 - ABS-CBN,ABS-CBN
"Sun, 31 Aug 2025 11:30:17 GMT","Canada Pension Plan Investment Board Sells 295,934 Shares of Linde PLC $LIN - MarketBeat",MarketBeat
"Sun, 31 Aug 2025 03:14:06 GMT",Jeremy Lin retires from professional basketball - theScore.com,theScore.com
"Sun, 31 Aug 2025 11:01:07 GMT",Parnassus Investments LLC Has $954.35 Million Position in Linde PLC $LIN - MarketBeat,MarketBeat
"Sun, 31 Aug 2025 07:15:31 GMT",Jeremy Lin has retired from basketball at 37 - BasketNews.com,BasketNews.com
"Sun, 31 Aug 2025 10:32:23 GMT",WPG Advisers LLC Takes Position in Linde PLC $LIN - MarketBeat,MarketBeat
"Sun, 31 Aug 2025 19:44:49 GMT",Taiwanese-American NBA pioneer Jeremy Lin retires at age 37 - Ashley County Ledger,Ashley County Ledger
"Sun, 31 Aug 2025 05:40:27 GMT","Former Raptors guard, NBA Champion Jeremy Lin retires from basketball - MSN",MSN
"Sun, 31 Aug 2025 12:03:57 GMT","Former NBA star, Asian American trailblazer Jeremy Lin retires - Oroville Mercury-Register",Oroville Mercury-Register
"Sun, 31 Aug 2025 15:41:15 GMT",Former Raptors NBA Champion Jeremy Lin Retires - Raptors Nation,Raptors Nation
"Sun, 31 Aug 2025 03:05:00 GMT",Jeremy Lin calls it quits: Linsanity star retires after 15-year basketball career - Global Times,Global Times
"Sun, 31 Aug 2025 02:05:14 GMT",Jeremy Lin announces his retirement - Yardbarker,Yardbarker
"Sun, 31 Aug 2025 16:42:42 GMT",Jeremy Lin announces retirement after 15-year run - MSN,MSN
"Sun, 31 Aug 2025 05:23:03 GMT",LINSANITY OUT 🏀 Jeremy Lin announced his retirement from basketball after a 15-year career highlighted by his 2012 “Linsanity” run with the New York Knicks and capped by a 2025 championship and Finals MVP with the New Taipei Kings. - Facebook,Facebook
"Thu, 28 Aug 2025 19:02:49 GMT","I Thought America Was the Thief: Mastery and Assimilation in Esther Lin’s ""Cold Thief Place"" - The Rumpus",The Rumpus
2025-08-31T17:08:32,"Week Recap: The month closed positive and extended winning streak 4-month. The S&P 500 had declined from 6,500 and broke 3-week winning streak. Rate cut hopes continues. August 25, 2025 – August 30, 2025",Reddit/r/StockMarket
