Date,Title,Source
2025-09-06T06:40:00Z,Liverpool complete brilliant signing AFTER deadline day,Anfieldwatch.co.uk
2025-09-06T05:50:00Z,Two Premier League Clubs Tried to Sign Liverpool star on Deadline Day,Anfieldindex.com
2025-09-06T05:07:38Z,$270: 2 Pack TP-Link Deco BE63 Tri-Band WiFi 7 BE10000 Whole Home Mesh System (6 replies),Slickdeals.net
2025-09-05T13:58:34Z,Stocks Higher as Weak US Unemployment Report Bolsters Case for Multiple Fed Rate Cuts,Barchart.com
2025-09-05T12:14:35Z,"RoadCraft's first expansion adds a bridge layer, two new maps, and the option to make your life much tougher",Rock Paper Shotgun
2025-09-05T00:19:51Z,"IIT-B third in country, MU & St Xavier’s in top 100: NIRF",The Times of India
2025-09-04T23:00:00Z,Data fusion of Laser-Induced Breakdown Spectroscopy and Diffuse Reflectance Spectroscopy for improved quantitative analysis of EAST-like plasma-facing materials,Royal Society of Chemistry
2025-09-04T17:51:50Z,RoadCraft Rebuild-RUNE,Rlsbb.cc
2025-09-04T17:38:06Z,RoadCraft Rebuild-RUNE,Rlsbb.ru
2025-09-04T17:02:29Z,The Occult Symbolism of “KPop Demon Hunters” and its Messages About the Music Industry,Vigilantcitizen.com
2025-09-04T11:00:00Z,Mizzou players ready for Border War after classes on meaning of KU rivalry,STLtoday.com
2025-09-03T18:44:28Z,"After KOMU sports director's death, GoFundMe campaign seeks to support his family",Columbiatribune.com
2025-09-03T18:33:49Z,Bullish Trendline Could Give Chip Stock A Boost,Forbes
2025-09-03T16:39:03Z,"Universal support crucial in supporting PAUD, minister says",Antaranews.com
2025-09-03T15:59:59Z,"No, Sigourney Weaver Does Not Play Muthur in Alien: Earth",Superherohype.com
2025-09-03T11:48:58Z,"In Taiwan, competing narratives over the meaning of China's massive military show",Yahoo Entertainment
2025-09-02T17:03:00Z,Did Missouri football climb into national polls after Week 1 slate of games? Where MU landed,Yahoo Entertainment
2025-09-02T14:45:03Z,Use of Maize (Zea mays L.) Mutator Transposon-Induced Mutants of the BonnMu Resource for Forward and Reverse Genetics Studies,Cshlp.org
2025-09-02T14:45:03Z,BonnMu: A Resource for Functional Genomics in Maize (Zea mays L.),Cshlp.org
2025-09-02T14:45:03Z,Identification of Transposon Insertion Sites in Maize Mu-Tagged Mutants Using Mu-Seq,Cshlp.org
2025-09-02T09:48:09Z,"Rowoon Discusses His “The Murky Stream” Character, Drastic Physical Change, And What Drew Him To The Drama",soompi
"Sat, 06 Sep 2025 18:45:00 GMT","Micron Stock Price Forecast: AI Momentum and HBM Growth, MU Surges to $131 - tradingnews.com",tradingnews.com
"Sat, 06 Sep 2025 23:04:00 GMT",Missouri rallies to beat Kansas 42-31 in first edition of the Border War in more than a decade - KOMU 8,KOMU 8
"Fri, 05 Sep 2025 18:23:00 GMT",Renewal of MU-KU rivalry extends beyond the football field: 'unlike any other' - KCUR,KCUR
"Sun, 07 Sep 2025 03:33:00 GMT","Kansas City metro become battleground for MU, KU fans as Border War returns - KMBC",KMBC
"Sat, 06 Sep 2025 04:55:00 GMT",Friday night drone show announces $2 billion campaign for MU - Columbia Missourian,Columbia Missourian
"Sun, 07 Sep 2025 04:22:01 GMT",SEC Nation takes over MU campus ahead Border Showdown’s return - ABC17NEWS,ABC17NEWS
"Sat, 06 Sep 2025 10:28:18 GMT","Micron Technology (MU) Reiterated Neutral at Goldman Sachs, $130 Target - Yahoo Finance",Yahoo Finance
"Fri, 05 Sep 2025 14:03:00 GMT",Micron Technology Stock (MU) Opinions on AI Memory Demand Surge - Quiver Quantitative,Quiver Quantitative
"Sat, 06 Sep 2025 18:25:10 GMT",Micron Stock vs Marvell Stock Forecast - MU Outpaces MRVL in AI Growth - tradingnews.com,tradingnews.com
"Sat, 06 Sep 2025 22:45:00 GMT",MU program sparks rise in student-led businesses - KOMU 8,KOMU 8
"Sat, 06 Sep 2025 22:00:00 GMT",MU program sparks rise in student-led businesses - KOMU 8,KOMU 8
"Thu, 04 Sep 2025 20:27:23 GMT","Micron Stock Price Forecast - MU at $124 as HBM Demand Lifts Outlook, Price Target $150–$200 - tradingnews.com",tradingnews.com
"Fri, 05 Sep 2025 00:30:00 GMT",MU commits to research reactor expansion - Columbia Missourian,Columbia Missourian
"Sat, 06 Sep 2025 00:51:00 GMT",MU announces largest fundraising campaign in school history - KOMU 8,KOMU 8
"Thu, 04 Sep 2025 03:00:00 GMT",MU Health Care workers protest for 'critical staff pay' - KOMU 8,KOMU 8
"Fri, 05 Sep 2025 15:55:00 GMT",MU President Mun Choi's contract extended until 2031 - KOMU 8,KOMU 8
"Sun, 07 Sep 2025 05:00:00 GMT",Business Bulletin: Case collaborates; Caravel opens; IWR rebrands; MU Health earns; Karpel wins - STLtoday.com,STLtoday.com
"Fri, 05 Sep 2025 17:59:52 GMT",MU plans to expand Springfield program into four-year medical school - Springfield Daily Citizen,Springfield Daily Citizen
"Thu, 04 Sep 2025 22:41:15 GMT","Groundbreaking at MU: Missouri’s Cancer Drug Hub Adds 30,000 Sq. Ft. for Production - Missourinet",Missourinet
"Sat, 06 Sep 2025 13:53:22 GMT",Micron Technology (MU) Up By 36% After Jim Cramer Said It Was “Insanely Cheap” - MSN,MSN
"Thu, 04 Sep 2025 01:00:00 GMT",Union workers rally for better pay in a contract with MU Health - Columbia Missourian,Columbia Missourian
"Sat, 06 Sep 2025 13:16:09 GMT",MU Extension: More than 90% of state in drought as harvest nears - Muddy River News,Muddy River News
"Wed, 03 Sep 2025 05:08:57 GMT",Long-range quantum entanglement in dielectric mu-near-zero metamaterials - Nature,Nature
"Sat, 06 Sep 2025 10:18:45 GMT","MU considering commercial development deals on ""nonessential"" properties around campus - ABC17NEWS",ABC17NEWS
"Fri, 05 Sep 2025 02:48:00 GMT",mu volleyball - huntingdondailynews.com,huntingdondailynews.com
"Fri, 05 Sep 2025 10:25:00 GMT",KU and MU Renew Football Border Rivalry Game - Kansas Public Radio,Kansas Public Radio
"Thu, 04 Sep 2025 15:37:35 GMT",MU Health Care union workers demand higher wages during rally at University Hospital - KRCG,KRCG
"Sat, 06 Sep 2025 07:57:26 GMT","Reviewing Me, Ma, Mu in Kiryat Ono - The Jerusalem Post",The Jerusalem Post
"Sat, 06 Sep 2025 09:24:42 GMT",MU Extension hosts 20th Annual Tomato Festival. - KRCG,KRCG
"Tue, 02 Sep 2025 14:52:16 GMT",What’s the all-time series record between KU & MU in football? They don’t agree - Kansas City Star,Kansas City Star
"Fri, 05 Sep 2025 05:09:34 GMT",MU Extension hosts 20th Annual Tomato Festival. - KRCG,KRCG
"Tue, 02 Sep 2025 16:51:05 GMT",CLSA Initiates Coverage on Micron Technology (MU) With an Outperform Rating - MSN,MSN
"Wed, 03 Sep 2025 11:55:56 GMT",What Micron Technology (MU)'s Upgraded Outlook and High Bandwidth Memory Demand Mean For Shareholders - simplywall.st,simplywall.st
"Wed, 03 Sep 2025 07:59:38 GMT",Micron Technology: Laggard Shovel Seller? (NASDAQ:MU) - Seeking Alpha,Seeking Alpha
"Tue, 02 Sep 2025 16:20:00 GMT",Earnings Estimates Moving Higher for Micron (MU): Time to Buy? - Nasdaq,Nasdaq
"Wed, 03 Sep 2025 17:38:28 GMT","Sept. 10 ComMUnity Fest brings together campus, community vendors - Millersville University",Millersville University
"Fri, 05 Sep 2025 17:09:03 GMT",iCook @ MRRL with the MU Extension - Jefferson City News Tribune,Jefferson City News Tribune
"Thu, 04 Sep 2025 08:15:00 GMT","How can Missouri football contain Jalon Daniels? Why QB is KU’s X-factor, MU's biggest problem - Columbia Daily Tribune",Columbia Daily Tribune
"Wed, 03 Sep 2025 22:02:13 GMT",MU Health Care union workers demand higher wages during rally at University Hospital - KRCG,KRCG
"Sat, 06 Sep 2025 16:21:00 GMT","Standoff over probe continues between VC, syndicate at MU - The Times of India",The Times of India
"Wed, 03 Sep 2025 01:58:14 GMT","Role of β-Arrestin 2 in the antinociceptive and side effect profile of morphine and the novel mu opioid receptor agonists, kurkinorin and kurkinol - Nature",Nature
"Sat, 06 Sep 2025 02:00:00 GMT",SEC Nation electrifies Mizzou campus ahead of border war showdown - KOMU 8,KOMU 8
"Fri, 05 Sep 2025 20:30:21 GMT",Invvlu Mu Incm Announces Monthly Dividend of $0.08 (NYSE:IIM) - MarketBeat,MarketBeat
"Tue, 02 Sep 2025 21:45:00 GMT",Did Missouri football climb into national polls after Week 1 slate of games? Where MU landed - Columbia Daily Tribune,Columbia Daily Tribune
"Fri, 05 Sep 2025 10:00:00 GMT","Darrell Stuckey reflects on his performance vs. MU in 2008, shares his message to KU players - 247Sports",247Sports
"Tue, 02 Sep 2025 21:32:52 GMT",Micron Stock Forecast: NASDAQ:MU Hits $122 With AI-Driven Growth - tradingnews.com,tradingnews.com
"Wed, 03 Sep 2025 10:22:00 GMT",Micron (MU): New Buy Recommendation for This Technology Giant - The Globe and Mail,The Globe and Mail
"Wed, 03 Sep 2025 03:27:00 GMT","Mizzou students with season pass struggle to buy tickets for KU, MU football game - KMBC",KMBC
"Tue, 02 Sep 2025 21:49:54 GMT",MU partners with CGE to release Marshall edition of Codenames boardgame - WCHS,WCHS
"Thu, 04 Sep 2025 09:12:30 GMT",MU Extension names new 4-H director - Jefferson City News Tribune,Jefferson City News Tribune
"Thu, 04 Sep 2025 15:09:06 GMT","Trey Lathan learned about MU rivalry, will face former teammate - On3",On3
"Fri, 05 Sep 2025 13:02:00 GMT",Why MU Top 100 is the go-to platform for MU Online gamers worldwide - herald-dispatch.com,herald-dispatch.com
"Tue, 02 Sep 2025 15:20:00 GMT",MU volleyball completes perfect weekend in win over Florida Gulf Coast - Central Oregon Daily,Central Oregon Daily
"Wed, 03 Sep 2025 22:58:00 GMT",Tiger great Martin Rucker shares his Rivalry Week experience from 2007 MU-KU classic - KOMU 8,KOMU 8
"Wed, 03 Sep 2025 02:09:57 GMT",MU:CON returns to Itaewon and Hannam this month - The Korea Herald,The Korea Herald
"Tue, 02 Sep 2025 19:01:23 GMT","Barclays Reaffirms ‘Overweight’ Rating on Micron Technology, Inc. (MU) With $140 PT - MSN",MSN
"Tue, 02 Sep 2025 18:18:00 GMT","MU track's Barrios qualifies for World Athletics Championships, joins Jacobs on global stage - The Norfolk Daily News",The Norfolk Daily News
"Tue, 02 Sep 2025 21:00:00 GMT",Mizzou students frustrated with football game ticket claim process ahead of Kansas game - KOMU 8,KOMU 8
"Sat, 06 Sep 2025 10:24:33 GMT",Umukuru wa Enabel ya Belgique yahawe amasaha 48 ngo ave mu Burundi - BBC,BBC
"Tue, 02 Sep 2025 17:20:00 GMT","Notable Tuesday Option Activity: GOOG, PEP, MU - Nasdaq",Nasdaq
"Tue, 02 Sep 2025 18:18:00 GMT","MU track's Barrios qualifies for World Athletics Championships, joins Jacobs on global stage - Eastern Progress",Eastern Progress
"Sat, 06 Sep 2025 00:15:31 GMT","Jeon Hyun-mu, Kwak Tube explore Chungju's hidden restaurants with Lee Seok-hoon - 조선일보",조선일보
"Fri, 05 Sep 2025 06:18:17 GMT",Joseph Malanji: Uwahoze ari umushikiranganji w'imigenderanire wa Zambia yaciriwe ibikorwa vy'agahato kubera ibiturire - BBC,BBC
"Tue, 02 Sep 2025 23:11:58 GMT",Here's Why Micron (MU) is a Strong Momentum Stock - sharewise.com,sharewise.com
"Tue, 02 Sep 2025 17:45:00 GMT","MU's top kicker out for season, Horn to miss extended time; Tigers narrowing focus on Kansas - The Norfolk Daily News",The Norfolk Daily News
"Sat, 06 Sep 2025 22:33:22 GMT",Real Madrid receives good news before El Clasico; MU loses 5 key players in match against Everton? - baonghean.vn,baonghean.vn
"Thu, 04 Sep 2025 07:00:00 GMT",Volleyball Recap: Tulare Western Falls Despite Big Games from Maliah Mu?oz and Belinda Sanchez - MaxPreps.com,MaxPreps.com
"Tue, 02 Sep 2025 11:16:11 GMT",HBM Drives Micron's Growth: Can MU Sustain the Momentum? - MSN,MSN
"Tue, 02 Sep 2025 11:00:00 GMT",Bringing Asia’s institutional yields to the onchain world — Interview with Mu Digital - Cointelegraph,Cointelegraph
"Tue, 02 Sep 2025 14:34:01 GMT","MU welcomes over 2,400 new graduates - Maynooth University",Maynooth University
"Tue, 02 Sep 2025 17:45:00 GMT","MU's top kicker out for season, Horn to miss extended time; Mizzou narrowing focus on Kansas - theprescotttimes.com",theprescotttimes.com
"Fri, 05 Sep 2025 18:11:02 GMT","MU researchers awarded over €500,000 in Research Ireland funding - Maynooth University",Maynooth University
"Tue, 02 Sep 2025 17:45:00 GMT","MU's top kicker out for season, Horn to miss extended time; Tigers narrowing focus on Kansas - KPVI",KPVI
"Thu, 04 Sep 2025 10:45:44 GMT",Udaipur: Igihano cy'urupfu ku mugabo wo muri India wishe umugore we amutwitse kubera ibara ry'uruhu rwe - BBC,BBC
"Thu, 04 Sep 2025 17:17:38 GMT","DR Congo: Ebola yongeye kwaduka, uwa mbere bayisanzemo ni umugore wari utwite - BBC",BBC
"Sat, 06 Sep 2025 23:00:30 GMT",Hai Long made a strong impression against MU; Chelsea made history - baonghean.vn,baonghean.vn
"Wed, 03 Sep 2025 05:03:45 GMT",Amashimutwa muri Tanzania: Impirimbanyi Sativa yabwiye BBC uko yarashwe agasigwa acyekwa ko yapfuye - BBC,BBC
"Sat, 06 Sep 2025 22:45:31 GMT","Ronaldo 'changes direction' to Chelsea, MU gets snatched from Ozil - baonghean.vn",baonghean.vn
"Thu, 04 Sep 2025 05:57:53 GMT",Vladimir Putin na Xi Jinping bumvirijwe baganira ku gusimbuza ingingo z'umubiri no kudapfa - BBC,BBC
2025-09-05T10:11:57,Jim Cramer Says Micron’s High Bandwidth Business is “Really Terrific”,Yahoo
2025-09-05T05:52:00,Micron pledges AI education investment to accelerate opportunities for America's youth,Yahoo
2025-09-03T16:24:00,Micron Rides on DRAM Demand Wave: Can the AI Boom Keep Aiding Growth?,Yahoo
2025-09-03T16:23:00,Micron vs. NVIDIA: Which AI Hardware Stock Should Investors Buy Now?,Yahoo
2025-09-03T05:59:38,Micron Technology: Laggard Shovel Seller?,SeekingAlpha
2025-09-02T19:20:01,Earnings Estimates Moving Higher for Micron (MU): Time to Buy?,Yahoo
2025-09-02T08:05:09,"Cantor Fitzgerald Maintains Overweight Rating on Micron (MU), Keeps $155 PT",Yahoo
