Date,Title,Source
2025-10-24T17:36:42Z,Long Leaf Partners Fund’s Comment on Regeneron (REGN),Biztoc.com
2025-10-24T17:14:24Z,Long Leaf Partners Fund’s Comment on Regeneron (REGN),Yahoo Entertainment
"Sat, 25 Oct 2025 21:02:19 GMT",Is REGN stock dividend yield sustainable - Market Risk Summary & Proven Capital Preservation Methods - newser.com,newser.com
"Fri, 24 Oct 2025 17:14:24 GMT",Long Leaf Partners Fund’s Comment on Regeneron (REGN) - Yahoo,Yahoo
"Sat, 25 Oct 2025 14:16:51 GMT","DDD Partners LLC Purchases Shares of 20,496 Regeneron Pharmaceuticals, Inc. $REGN - MarketBeat",MarketBeat
"Fri, 24 Oct 2025 15:08:00 GMT",REGN Q3 Earnings: Will Higher Dupixent Profits Offset Eylea Sales Decline? - The Globe and Mail,The Globe and Mail
"Sat, 25 Oct 2025 19:24:53 GMT",Is REGN stock dividend yield sustainable - July 2025 Earnings & Smart Investment Allocation Insights - newser.com,newser.com
"Thu, 23 Oct 2025 13:15:02 GMT","Exploring Analyst Estimates for Regeneron (REGN) Q3 Earnings, Beyond Revenue and EPS - Yahoo Finance",Yahoo Finance
"Sat, 25 Oct 2025 14:16:52 GMT","Regeneron Pharmaceuticals, Inc. $REGN Position Increased by Washington Trust Advisors Inc. - MarketBeat",MarketBeat
"Sun, 26 Oct 2025 00:46:42 GMT",Is REGN stock in correction or buying zone - July 2025 Big Picture & Risk Controlled Daily Plans - newser.com,newser.com
"Sat, 25 Oct 2025 09:06:57 GMT","Regeneron Pharmaceuticals, Inc. $REGN Stock Position Reduced by Whittier Trust Co. - MarketBeat",MarketBeat
"Tue, 21 Oct 2025 14:00:22 GMT",Earnings Preview: Regeneron (REGN) Q3 Earnings Expected to Decline - Yahoo Finance,Yahoo Finance
"Sun, 26 Oct 2025 03:09:52 GMT",What indicators show strength in REGN - 2025 Breakouts & Breakdowns & Daily Profit Maximizing Trade Tips - newser.com,newser.com
"Sat, 25 Oct 2025 10:46:25 GMT","Asset Management One Co. Ltd. Lowers Stock Holdings in Regeneron Pharmaceuticals, Inc. $REGN - MarketBeat",MarketBeat
"Sun, 26 Oct 2025 05:41:18 GMT",How REGN stock benefits from strong dollar - July 2025 PreEarnings & Long-Term Investment Growth Plans - newser.com,newser.com
"Sat, 25 Oct 2025 06:56:28 GMT",Can REGN hit a new high this month - 2025 Top Gainers & Daily Volume Surge Signals - newser.com,newser.com
"Fri, 24 Oct 2025 22:39:52 GMT",What indicators show strength in REGN - July 2025 Reactions & Safe Capital Preservation Plans - newser.com,newser.com
"Fri, 24 Oct 2025 17:42:35 GMT",Why REGN stock appeals to analysts - Buy Signal & Expert Approved Trade Ideas - newser.com,newser.com
"Sat, 25 Oct 2025 11:52:27 GMT",Is REGN stock dividend yield sustainable - Quarterly Trade Summary & Verified Entry Point Signals - newser.com,newser.com
"Sat, 25 Oct 2025 18:18:20 GMT",Is REGN stock dividend yield sustainable - 2025 Trade Ideas & Consistent Growth Equity Picks - newser.com,newser.com
"Fri, 24 Oct 2025 18:40:19 GMT",Is REGN stock dividend yield sustainable - Weekly Investment Summary & Expert Approved Trade Ideas - newser.com,newser.com
"Fri, 24 Oct 2025 17:37:44 GMT",Is REGN stock in correction or buying zone - Weekly Volume Report & Technical Pattern Recognition Alerts - newser.com,newser.com
"Thu, 23 Oct 2025 11:26:22 GMT","Regeneron Pharmaceuticals, Inc. $REGN Stock Holdings Increased by Ethic Inc. - MarketBeat",MarketBeat
"Fri, 24 Oct 2025 20:48:42 GMT",Can REGN hit a new high this month - Trade Signal Summary & Safe Capital Allocation Plans - newser.com,newser.com
"Thu, 23 Oct 2025 03:34:17 GMT",A Look at Regeneron (REGN) Valuation Following Key Libtayo Approval and Gene Therapy Milestones - simplywall.st,simplywall.st
"Thu, 23 Oct 2025 10:23:12 GMT","Cullen Frost Bankers Inc. Sells 445 Shares of Regeneron Pharmaceuticals, Inc. $REGN - MarketBeat",MarketBeat
"Thu, 23 Oct 2025 07:56:57 GMT",Can REGN stock maintain operating margins - 2025 Performance Recap & AI Powered Buy and Sell Recommendations - newser.com,newser.com
"Thu, 23 Oct 2025 15:04:00 GMT",December 5th Options Now Available For Regeneron Pharmaceuticals (REGN) - Nasdaq,Nasdaq
"Thu, 23 Oct 2025 14:04:09 GMT",Canaccord Genuity Maintains Buy Rating on REGN with $850 Target | REGN Stock News - GuruFocus,GuruFocus
"Wed, 22 Oct 2025 13:33:39 GMT","ARK Investment Management LLC Sells 1,088 Shares of Regeneron Pharmaceuticals, Inc. $REGN - MarketBeat",MarketBeat
"Thu, 23 Oct 2025 13:16:47 GMT",Canaccord Genuity Group Reaffirms Buy Rating for Regeneron Pharmaceuticals (NASDAQ:REGN) - MarketBeat,MarketBeat
"Wed, 22 Oct 2025 11:09:24 GMT","Private Capital Advisors Inc. Takes $323,000 Position in Regeneron Pharmaceuticals, Inc. $REGN - MarketBeat",MarketBeat
"Thu, 23 Oct 2025 11:31:00 GMT","TD Cowen Maintains Regeneron Pharmaceuticals(REGN.US) With Buy Rating, Maintains Target Price $780 - 富途牛牛",富途牛牛
"Fri, 24 Oct 2025 08:06:07 GMT",Why REGN stock appeals to analysts - July 2025 Breakouts & Real-Time Market Trend Scan - newser.com,newser.com
"Fri, 24 Oct 2025 22:54:25 GMT",How REGN stock benefits from strong dollar - 2025 AllTime Highs & Detailed Earnings Play Alerts - newser.com,newser.com
"Tue, 21 Oct 2025 09:32:19 GMT","Regeneron Pharmaceuticals, Inc. $REGN Shares Sold by DekaBank Deutsche Girozentrale - MarketBeat",MarketBeat
"Tue, 21 Oct 2025 20:00:56 GMT",Regeneron Pharmaceuticals (REGN) Joins ClearBridge's Select Stra - GuruFocus,GuruFocus
"Tue, 21 Oct 2025 09:10:18 GMT",Regeneron Pharmaceuticals (REGN) to Release Quarterly Earnings on Tuesday - MarketBeat,MarketBeat
"Sat, 25 Oct 2025 19:22:00 GMT","Sitapur leads in farmer’s regn, enrols 75% so far - Times of India",Times of India
"Sat, 25 Oct 2025 19:08:00 GMT",Increase no. of regn counters: Home secy to Sec 16 govt hosp - Times of India,Times of India
"Wed, 22 Oct 2025 02:34:25 GMT",Is now a turning point for REGN - July 2025 Fed Impact & Community Shared Stock Ideas - newser.com,newser.com
"Sat, 25 Oct 2025 13:14:00 GMT",Cotton Corp may extend regn deadline for Kapas Kisan app - Times of India,Times of India
"Tue, 21 Oct 2025 19:06:00 GMT",E-auction process of regn series ‘CH01DB’ begins today - Times of India,Times of India
"Thu, 23 Oct 2025 09:46:41 GMT","ClearBridge Select Strategy buys REGN, VRTX & VST; exits ICLR, PCTY & ADBE - MSN",MSN
"Thu, 23 Oct 2025 13:22:52 GMT","Loring Wolcott & Coolidge Fiduciary Advisors LLP MA Boosts Position in Regeneron Pharmaceuticals, Inc. $REGN - MarketBeat",MarketBeat
"Thu, 23 Oct 2025 13:24:37 GMT","Schaper Benz & Wise Investment Counsel Inc. WI Has $11.74 Million Holdings in Regeneron Pharmaceuticals, Inc. $REGN - MarketBeat",MarketBeat
2025-10-21T16:00:22,Earnings Preview: Regeneron (REGN) Q3 Earnings Expected to Decline,Yahoo
