Date,Title,Source
"Tue, 04 Nov 2025 11:29:57 GMT",Intuit (INTU): Exploring Valuation After Recent Modest Share Price Gain - simplywall.st,simplywall.st
"Tue, 04 Nov 2025 20:50:10 GMT","New Buy Rating for Intuit (INTU), the Technology Giant - The Globe and Mail",The Globe and Mail
"Tue, 04 Nov 2025 13:17:16 GMT",Intuit Inc. $INTU Shares Purchased by Bank of New York Mellon Corp - MarketBeat,MarketBeat
"Tue, 04 Nov 2025 06:21:03 GMT",Will INTU stock reach all time highs in 2025 - Stop Loss & Low Drawdown Investment Strategies - newser.com,newser.com
"Fri, 31 Oct 2025 15:27:22 GMT","Oracle Is Hyped, INTU Stock Is A Better Buy - Forbes",Forbes
"Fri, 31 Oct 2025 14:13:32 GMT",Intuit (INTU): Reviewing Valuation as Stock Momentum Stalls After Multi-Year Rally - Yahoo Finance,Yahoo Finance
"Mon, 03 Nov 2025 11:44:03 GMT",Discipline and Rules-Based Execution in INTU Response - news.stocktradersdaily.com,news.stocktradersdaily.com
"Tue, 04 Nov 2025 10:30:13 GMT","Bank of Montreal Can Sells 31,074 Shares of Intuit Inc. $INTU - MarketBeat",MarketBeat
"Tue, 04 Nov 2025 03:55:11 GMT",Is INTU forming a bottoming base - Weekly Stock Summary & Technical Buy Zone Confirmations - newser.com,newser.com
"Mon, 03 Nov 2025 11:22:17 GMT","Versor Investments LP Acquires 1,115 Shares of Intuit Inc. $INTU - MarketBeat",MarketBeat
"Sun, 02 Nov 2025 19:41:07 GMT",Is INTU stock ready for breakout - Fed Meeting & Weekly Momentum Picks - newser.com,newser.com
"Mon, 03 Nov 2025 12:21:21 GMT",Machina Capital S.A.S. Takes Position in Intuit Inc. $INTU - MarketBeat,MarketBeat
"Mon, 03 Nov 2025 10:33:46 GMT",Plato Investment Management Ltd Purchases 544 Shares of Intuit Inc. $INTU - MarketBeat,MarketBeat
"Mon, 03 Nov 2025 11:42:20 GMT","TIAA Trust National Association Buys 34,602 Shares of Intuit Inc. $INTU - MarketBeat",MarketBeat
"Mon, 03 Nov 2025 12:21:19 GMT",Verity Asset Management Inc. Sells 606 Shares of Intuit Inc. $INTU - MarketBeat,MarketBeat
"Sun, 02 Nov 2025 09:39:56 GMT",Intuit Inc. $INTU Stock Holdings Increased by World Investment Advisors - MarketBeat,MarketBeat
"Sun, 02 Nov 2025 11:42:16 GMT","Balentine LLC Makes New $323,000 Investment in Intuit Inc. $INTU - MarketBeat",MarketBeat
"Sun, 02 Nov 2025 09:12:08 GMT",Arkadios Wealth Advisors Acquires 412 Shares of Intuit Inc. $INTU - MarketBeat,MarketBeat
"Sun, 02 Nov 2025 11:42:11 GMT","Syverson Strege & Co Invests $349,000 in Intuit Inc. $INTU - MarketBeat",MarketBeat
"Mon, 03 Nov 2025 23:20:23 GMT","Citi Maintains Intuit(INTU.US) With Buy Rating, Maintains Target Price $803 - 富途牛牛",富途牛牛
"Mon, 03 Nov 2025 10:43:47 GMT",Gilbert & Cook Inc. Acquires New Stake in Intuit Inc. $INTU - MarketBeat,MarketBeat
"Mon, 03 Nov 2025 12:21:21 GMT","Tredje AP fonden Sells 5,543 Shares of Intuit Inc. $INTU - MarketBeat",MarketBeat
"Sat, 01 Nov 2025 11:37:02 GMT",435 Shares in Intuit Inc. $INTU Bought by Bordeaux Wealth Advisors LLC - MarketBeat,MarketBeat
"Mon, 03 Nov 2025 10:39:47 GMT",Intuit Inc. $INTU Shares Bought by GHP Investment Advisors Inc. - MarketBeat,MarketBeat
"Sat, 01 Nov 2025 04:51:27 GMT",Why INTU stock is considered a top pick - Gap Down & Safe Entry Point Alerts - newser.com,newser.com
"Mon, 03 Nov 2025 11:42:20 GMT","MUFG Securities EMEA plc Acquires Shares of 2,200 Intuit Inc. $INTU - MarketBeat",MarketBeat
"Mon, 03 Nov 2025 10:23:43 GMT",Welch & Forbes LLC Purchases 450 Shares of Intuit Inc. $INTU - MarketBeat,MarketBeat
"Sat, 01 Nov 2025 10:59:24 GMT",Scholtz & Company LLC Boosts Holdings in Intuit Inc. $INTU - MarketBeat,MarketBeat
"Sat, 01 Nov 2025 11:01:07 GMT","GAM Holding AG Sells 6,381 Shares of Intuit Inc. $INTU - MarketBeat",MarketBeat
"Sat, 01 Nov 2025 09:08:27 GMT","Assetmark Inc. Acquires 4,970 Shares of Intuit Inc. $INTU - MarketBeat",MarketBeat
"Fri, 31 Oct 2025 12:25:46 GMT",Strs Ohio Boosts Holdings in Intuit Inc. $INTU - MarketBeat,MarketBeat
"Sun, 02 Nov 2025 11:52:18 GMT",Geneva Capital Management LLC Has $27.88 Million Stake in Intuit Inc. $INTU - MarketBeat,MarketBeat
"Sun, 02 Nov 2025 11:42:17 GMT",Everest Management Corp. Invests $1.30 Million in Intuit Inc. $INTU - MarketBeat,MarketBeat
"Fri, 31 Oct 2025 12:25:45 GMT",Ledyard National Bank Grows Stock Holdings in Intuit Inc. $INTU - MarketBeat,MarketBeat
"Sun, 02 Nov 2025 09:39:55 GMT",Intuit Inc. $INTU Shares Purchased by Jennison Associates LLC - MarketBeat,MarketBeat
"Fri, 31 Oct 2025 12:21:06 GMT","Simon Quick Advisors LLC Purchases 1,593 Shares of Intuit Inc. $INTU - MarketBeat",MarketBeat
"Fri, 31 Oct 2025 11:26:39 GMT","Atria Investments Inc Purchases 3,094 Shares of Intuit Inc. $INTU - MarketBeat",MarketBeat
"Fri, 31 Oct 2025 09:52:17 GMT",Why INTU stock is favored by pension funds - 2025 Valuation Update & High Conviction Buy Zone Alerts - newser.com,newser.com
"Sat, 01 Nov 2025 08:04:18 GMT",Intuit Inc. $INTU Shares Purchased by AlphaQuest LLC - MarketBeat,MarketBeat
"Fri, 31 Oct 2025 18:33:02 GMT",Bank of America (BAC) Earnings Hint at Positive Outlook for Intuit's Credit Karma - GuruFocus,GuruFocus
"Fri, 31 Oct 2025 10:39:56 GMT",Intuit Inc. $INTU Shares Sold by Keybank National Association OH - MarketBeat,MarketBeat
"Fri, 31 Oct 2025 10:39:56 GMT",Spire Wealth Management Has $7.40 Million Stock Holdings in Intuit Inc. $INTU - MarketBeat,MarketBeat
"Tue, 04 Nov 2025 11:54:30 GMT",Market reaction to INTU’s recent news - 2025 Major Catalysts & Accurate Technical Buy Alerts - newser.com,newser.com
"Tue, 04 Nov 2025 10:52:15 GMT",Freestone Capital Holdings LLC Has $1.35 Million Stock Holdings in Intuit Inc. $INTU - MarketBeat,MarketBeat
"Mon, 03 Nov 2025 08:04:21 GMT",Market reaction to INTU’s recent news - Market Rally & Verified Momentum Stock Watchlist - newser.com,newser.com
"Mon, 03 Nov 2025 15:50:55 GMT",Payroll startup Deel names former Intuit executive Kauffman as CFO for IPO goal - Reuters,Reuters
"Fri, 31 Oct 2025 08:45:44 GMT",What data driven models say about INTU’s future - Trade Ideas & Weekly Hot Stock Watchlists - newser.com,newser.com
"Mon, 03 Nov 2025 11:21:21 GMT","Harel Insurance Investments & Financial Services Ltd. Acquires 1,586 Shares of Intuit Inc. $INTU - MarketBeat",MarketBeat
2025-11-03T17:34:00,Intuit Inc. stock outperforms competitors on strong trading day,MarketWatch
2025-11-03T11:42:55,Payroll startup Deel names former Intuit executive Kauffman as CFO for IPO goal,Yahoo
2025-10-31T15:13:32,Intuit (INTU): Reviewing Valuation as Stock Momentum Stalls After Multi-Year Rally,Yahoo
