Date,Title,Source
"Tue, 04 Nov 2025 19:40:19 GMT",A Fresh Look at CrowdStrike (CRWD) Valuation Following Recent Share Price Gains - simplywall.st,simplywall.st
"Tue, 04 Nov 2025 14:30:24 GMT",CrowdStrike: Defying Valuation Limits With Market Leadership And AI Edge (NASDAQ:CRWD) - Seeking Alpha,Seeking Alpha
"Tue, 04 Nov 2025 12:03:00 GMT",BTIG Maintains CrowdStrike Holdings (CRWD) Buy Recommendation - Nasdaq,Nasdaq
"Wed, 05 Nov 2025 03:45:19 GMT","CrowdStrike (NASDAQ:CRWD) CEO Sells $3,835,482.75 in Stock - MarketBeat",MarketBeat
"Tue, 04 Nov 2025 12:20:00 GMT",New Analyst Forecast: $CRWD Given $640.0 Price Target - Quiver Quantitative,Quiver Quantitative
"Tue, 04 Nov 2025 21:17:38 GMT",CrowdStrike Stock Price Forecast - CRWD Shares Targets $665 by 2026 as Growth Fuels $600 Breakout Momentum - TradingNEWS,TradingNEWS
"Tue, 04 Nov 2025 15:45:53 GMT",CrowdStrike Holdings Inc. (CRWD) Wedbush Securities Raises Valuation on Growth Optimism - The Globe and Mail,The Globe and Mail
"Mon, 03 Nov 2025 19:22:45 GMT",Jim Cramer Discusses CrowdStrike (CRWD)’s Shares - MSN,MSN
"Tue, 04 Nov 2025 13:09:00 GMT",CrowdStrike (NASDAQ: CRWD) enables EU distributors; up to $7 services per $1 sale - Stock Titan,Stock Titan
"Wed, 05 Nov 2025 02:24:29 GMT",Crowdstrike (CRWD) CEO Kurtz sells $3.8 million in stock By Investing.com - Investing.com India,Investing.com India
"Wed, 05 Nov 2025 05:18:41 GMT",Analyzing drawdowns of CRWD with statistical tools - 2025 Risk Factors & Accurate Intraday Trade Tips - newser.com,newser.com
"Tue, 04 Nov 2025 12:08:42 GMT",CRWD Stock Sees Target Price Hike by BTIG Analyst | CRWD Stock N - GuruFocus,GuruFocus
"Fri, 31 Oct 2025 11:51:52 GMT",Jim Cramer Discusses CrowdStrike (CRWD)’s Shares - Yahoo Finance,Yahoo Finance
"Tue, 04 Nov 2025 18:04:54 GMT",CrowdStrike's ARR Slowing Fast - That's About To Change (CRWD) - Seeking Alpha,Seeking Alpha
"Wed, 05 Nov 2025 03:45:19 GMT","Insider Selling: CrowdStrike (NASDAQ:CRWD) CFO Sells 1,957 Shares of Stock - MarketBeat",MarketBeat
"Wed, 05 Nov 2025 03:45:19 GMT","CrowdStrike (NASDAQ:CRWD) Director Sameer Gandhi Sells 5,000 Shares - MarketBeat",MarketBeat
"Mon, 03 Nov 2025 16:56:34 GMT","SA analyst upgrades/downgrades: AMZN, CRWD, BLDR, GOOG - Seeking Alpha",Seeking Alpha
"Tue, 04 Nov 2025 23:43:04 GMT",CrowdStrike (NASDAQ:CRWD) Trading Down 3.3% - Here's What Happened - MarketBeat,MarketBeat
"Tue, 04 Nov 2025 13:27:21 GMT",Milestone Asset Management LLC Increases Stake in CrowdStrike $CRWD - MarketBeat,MarketBeat
"Mon, 03 Nov 2025 11:09:55 GMT",Why Is CrowdStrike Stock Gaining Monday? - CrowdStrike Holdings (NASDAQ:CRWD) - Benzinga,Benzinga
"Tue, 04 Nov 2025 13:33:27 GMT",BTIG Research Issues Positive Forecast for CrowdStrike (NASDAQ:CRWD) Stock Price - MarketBeat,MarketBeat
"Tue, 04 Nov 2025 20:18:00 GMT","Noteworthy Tuesday Option Activity: ANDE, KRYS, CRWD - Nasdaq",Nasdaq
"Tue, 04 Nov 2025 14:27:36 GMT",Wedbush Increases CrowdStrike (NASDAQ:CRWD) Price Target to $600.00 - MarketBeat,MarketBeat
"Tue, 04 Nov 2025 12:28:23 GMT","Huntington National Bank Buys 50,288 Shares of CrowdStrike $CRWD - MarketBeat",MarketBeat
"Tue, 04 Nov 2025 05:43:20 GMT","SA analyst upgrades/downgrades: AMZN, CRWD, BLDR, GOOG - MSN",MSN
"Tue, 04 Nov 2025 11:52:18 GMT",Pacific Wealth Strategies Group Inc. Takes Position in CrowdStrike $CRWD - MarketBeat,MarketBeat
"Tue, 04 Nov 2025 05:17:21 GMT",How CRWD stock compares to industry benchmarks - Entry Point & Entry Point Confirmation Alerts - newser.com,newser.com
"Tue, 04 Nov 2025 10:59:22 GMT","Bank of New York Mellon Corp Sells 118,934 Shares of CrowdStrike $CRWD - MarketBeat",MarketBeat
"Tue, 04 Nov 2025 10:24:11 GMT","Intellectus Partners LLC Invests $605,000 in CrowdStrike $CRWD - MarketBeat",MarketBeat
"Mon, 03 Nov 2025 13:55:24 GMT","4 stocks to watch on Monday: KMB, NVDA, PLTR, CRWD (SP500:) - Seeking Alpha",Seeking Alpha
"Mon, 03 Nov 2025 06:22:09 GMT",Pricey CrowdStrike Breaks Out Ahead Of Q3 Earnings: $600 May Be In Play (NASDAQ:CRWD) - Seeking Alpha,Seeking Alpha
"Mon, 03 Nov 2025 23:01:21 GMT",CrowdStrike (NASDAQ:CRWD) Stock Price Up 1.6% - Should You Buy? - MarketBeat,MarketBeat
"Tue, 04 Nov 2025 10:59:22 GMT",CrowdStrike (NASDAQ:CRWD) Sets New 1-Year High - What's Next? - MarketBeat,MarketBeat
"Mon, 03 Nov 2025 13:00:00 GMT","CrowdStrike (NASDAQ: CRWD) opens global cybersecurity accelerator; apply by Nov 15, 2025 - Stock Titan",Stock Titan
"Sat, 01 Nov 2025 17:08:48 GMT",Is BT Partnership Expanding SMB-Focused AI Security Changing the Investment Case for CrowdStrike (CRWD)? - Yahoo Finance,Yahoo Finance
"Mon, 03 Nov 2025 13:00:00 GMT",CrowdStrike (NASDAQ: CRWD) to power EY global cyber managed services with Falcon Next‑Gen SIEM - Stock Titan,Stock Titan
"Tue, 04 Nov 2025 08:36:39 GMT",Hunter Associates Investment Management LLC Acquires New Holdings in CrowdStrike $CRWD - MarketBeat,MarketBeat
"Mon, 03 Nov 2025 08:02:00 GMT",CrowdStrike (NASDAQ: CRWD) reports Europe makes up 22% of global ransomware victims - Stock Titan,Stock Titan
"Sat, 01 Nov 2025 06:20:09 GMT",Did CrowdStrike's (CRWD) AI-Powered SMB Push with BT and NVIDIA Just Shift Its Cloud Security Trajectory? - simplywall.st,simplywall.st
"Sun, 02 Nov 2025 20:14:14 GMT",Why CRWD stock is recommended by analysts - Weekly Earnings Recap & Weekly Breakout Opportunity Watchlist - newser.com,newser.com
"Mon, 03 Nov 2025 18:32:02 GMT",How Crowdstrike Holdings Inc. (CRWD) Affects Rotational Strategy Timing - news.stocktradersdaily.com,news.stocktradersdaily.com
"Mon, 03 Nov 2025 09:33:37 GMT",498 Shares in CrowdStrike $CRWD Purchased by Mesirow Financial Investment Management Inc. - MarketBeat,MarketBeat
"Mon, 03 Nov 2025 13:42:54 GMT",How to read the order book for CRWD - 2025 Fundamental Recap & Weekly High Momentum Picks - newser.com,newser.com
"Mon, 03 Nov 2025 11:20:20 GMT",Telos Capital Management Inc. Grows Stake in CrowdStrike $CRWD - MarketBeat,MarketBeat
"Mon, 03 Nov 2025 11:25:08 GMT","Ceera Investments LLC Sells 14,746 Shares of CrowdStrike $CRWD - MarketBeat",MarketBeat
"Mon, 03 Nov 2025 12:01:51 GMT",CrowdStrike (CRWD) Price Target Raised to $600 by Wedbush - GuruFocus,GuruFocus
"Sun, 02 Nov 2025 20:36:57 GMT",Is it time to cut losses on CRWD - Forecast Cut & Growth-Oriented Investment Plans - newser.com,newser.com
"Mon, 03 Nov 2025 07:39:57 GMT",Pattern recognition hints at CRWD upside - July 2025 Decliners & Verified Short-Term Plans - newser.com,newser.com
"Sat, 01 Nov 2025 06:11:15 GMT",Did CrowdStrike's (CRWD) AI-Powered SMB Push with BT and NVIDIA Just Shift Its Cloud Security Trajectory? - Sahm,Sahm
"Mon, 03 Nov 2025 00:40:42 GMT",What risks investors should watch in CRWD stock - Trade Signal Summary & Safe Investment Capital Preservation Plans - newser.com,newser.com
"Sun, 02 Nov 2025 12:23:34 GMT",Nicholas Company Inc. Reduces Holdings in CrowdStrike $CRWD - MarketBeat,MarketBeat
"Sun, 02 Nov 2025 12:38:15 GMT","iA Global Asset Management Inc. Acquires 1,842 Shares of CrowdStrike $CRWD - MarketBeat",MarketBeat
"Sun, 02 Nov 2025 12:44:25 GMT",State of Michigan Retirement System Acquires 900 Shares of CrowdStrike $CRWD - MarketBeat,MarketBeat
"Sun, 02 Nov 2025 10:40:09 GMT",500 Shares in CrowdStrike $CRWD Bought by Regal Partners Ltd - MarketBeat,MarketBeat
"Tue, 04 Nov 2025 08:32:10 GMT",Why CRWD is moving today - Trade Ideas & Fast Moving Stock Watchlists - newser.com,newser.com
"Sun, 02 Nov 2025 10:27:04 GMT",Pattern recognition hints at CRWD upside - July 2025 Short Interest & High Conviction Trade Alerts - newser.com,newser.com
"Mon, 03 Nov 2025 11:02:04 GMT",Sigma Planning Corp Has $8.38 Million Stock Holdings in CrowdStrike $CRWD - MarketBeat,MarketBeat
"Sat, 01 Nov 2025 10:06:05 GMT","Haven Private LLC Invests $262,000 in CrowdStrike $CRWD - MarketBeat",MarketBeat
"Mon, 03 Nov 2025 10:21:52 GMT","TIAA Trust National Association Sells 15,232 Shares of CrowdStrike $CRWD - MarketBeat",MarketBeat
"Sat, 01 Nov 2025 09:33:40 GMT",CrowdStrike $CRWD Shares Sold by GAM Holding AG - MarketBeat,MarketBeat
"Mon, 03 Nov 2025 09:44:08 GMT",How to read the order book for CRWD - Trade Analysis Summary & Real-Time Price Movement Reports - newser.com,newser.com
"Sat, 01 Nov 2025 09:33:40 GMT",CrowdStrike $CRWD Shares Sold by Integrity Alliance LLC. - MarketBeat,MarketBeat
"Sat, 01 Nov 2025 11:31:09 GMT",Yong Rong HK Asset Management Ltd Acquires New Position in CrowdStrike $CRWD - MarketBeat,MarketBeat
"Mon, 03 Nov 2025 12:18:48 GMT",Pattern recognition hints at CRWD upside - Weekly Profit Report & AI Forecast Swing Trade Picks - newser.com,newser.com
"Sat, 01 Nov 2025 10:10:08 GMT","Hutchinson Financial Advisors INC Acquires Shares of 4,551 CrowdStrike $CRWD - MarketBeat",MarketBeat
"Sat, 01 Nov 2025 08:34:15 GMT",HBK Sorce Advisory LLC Cuts Stock Holdings in CrowdStrike $CRWD - MarketBeat,MarketBeat
"Fri, 31 Oct 2025 09:23:29 GMT",Retirement Systems of Alabama Boosts Stake in CrowdStrike $CRWD - MarketBeat,MarketBeat
"Fri, 31 Oct 2025 09:19:52 GMT",How CRWD stock compares to industry benchmarks - Portfolio Performance Report & AI Forecast Swing Trade Picks - newser.com,newser.com
"Mon, 03 Nov 2025 13:01:03 GMT",Does CRWD show high probability of rebound - Day Trade & Precise Buy Zone Tips - newser.com,newser.com
"Fri, 31 Oct 2025 08:24:29 GMT","GWN Securities Inc. Sells 1,396 Shares of CrowdStrike $CRWD - MarketBeat",MarketBeat
"Mon, 03 Nov 2025 11:00:46 GMT",CrowdStrike price prediction: CRWD targets $600 amid AI momentum - Traders Union,Traders Union
"Sun, 02 Nov 2025 09:27:54 GMT",CrowdStrike $CRWD Shares Bought by Atria Investments Inc - MarketBeat,MarketBeat
"Sun, 02 Nov 2025 09:09:50 GMT",Keybank National Association OH Has $3.40 Million Holdings in CrowdStrike $CRWD - MarketBeat,MarketBeat
"Sun, 02 Nov 2025 11:43:53 GMT",Elm Partners Management LLC Takes $4.58 Million Position in CrowdStrike $CRWD - MarketBeat,MarketBeat
"Sun, 02 Nov 2025 10:44:04 GMT","AlphaStar Capital Management LLC Makes New $269,000 Investment in CrowdStrike $CRWD - MarketBeat",MarketBeat
"Fri, 31 Oct 2025 11:04:09 GMT",Health Check: How Prudently Does CrowdStrike Holdings (NASDAQ:CRWD) Use Debt? - 富途牛牛,富途牛牛
"Fri, 31 Oct 2025 10:23:48 GMT","Kovack Advisors Inc. Acquires 2,225 Shares of CrowdStrike $CRWD - MarketBeat",MarketBeat
"Fri, 31 Oct 2025 08:40:40 GMT",World Investment Advisors Has $3.18 Million Stock Holdings in CrowdStrike $CRWD - MarketBeat,MarketBeat
"Fri, 31 Oct 2025 10:27:58 GMT",Creekmur Asset Management LLC Increases Position in CrowdStrike $CRWD - MarketBeat,MarketBeat
2025-11-04T14:09:00,CrowdStrike Accelerates European Partner Growth and Profitability with Expanded Distributor-Led Services,Yahoo
2025-11-04T14:04:54,CrowdStrike's ARR Slowing Fast - That's About To Change,SeekingAlpha
2025-11-03T14:00:00,"CrowdStrike, AWS, and NVIDIA Expand Global Cybersecurity Startup Accelerator to Drive Cloud and Agentic AI Innovation",Yahoo
2025-11-03T14:00:00,EY Selects CrowdStrike Falcon Next-Gen SIEM to Power Global Cybersecurity Managed Services,Yahoo
2025-11-03T09:02:00,CrowdStrike 2025 European Threat Landscape Report: Ransomware Hits Region at Record Pace,Yahoo
2025-11-03T02:22:09,Pricey CrowdStrike Breaks Out Ahead Of Q3 Earnings: $600 May Be In Play,SeekingAlpha
2025-11-02T21:11:08,CrowdStrike: Time To Take Chips Off The Table (Rating Downgrade),SeekingAlpha
2025-11-01T18:08:48,Is BT Partnership Expanding SMB-Focused AI Security Changing the Investment Case for CrowdStrike (CRWD)?,Yahoo
2025-10-31T12:51:52,Jim Cramer Discusses CrowdStrike (CRWD)’s Shares,Yahoo
2025-10-31T03:30:23,Jim Cramer Calls CrowdStrike as One of His Favorite Stocks,Yahoo
