Date,Title,Source
"Tue, 21 Oct 2025 00:57:10 GMT",Why CDNS stock attracts high net worth investors - 2025 Breakouts & Breakdowns & Growth Oriented Trading Recommendations - newser.com,newser.com
"Mon, 20 Oct 2025 13:30:02 GMT",Is It Worth Investing in Cadence (CDNS) Based on Wall Street's Bullish Views? - Yahoo Finance,Yahoo Finance
"Mon, 20 Oct 2025 23:04:33 GMT",Cadence Design Systems (CDNS) Outperforms Broader Market: What You Need to Know - sharewise.com,sharewise.com
"Mon, 20 Oct 2025 06:56:32 GMT",Cadence Design Systems (CDNS) to Release Earnings on Monday - MarketBeat,MarketBeat
"Sat, 18 Oct 2025 21:32:40 GMT",Cadence Design Systems (CDNS): Assessing Valuation Following New AI and Digital Twin Advances Unveiled at OCP Global Summit - simplywall.st,simplywall.st
"Tue, 21 Oct 2025 06:16:40 GMT",How CDNS stock performs in rising dollar environment - Exit Point & Smart Investment Allocation Insights - newser.com,newser.com
"Sat, 18 Oct 2025 21:22:30 GMT",Cadence Design Systems (CDNS): Assessing Valuation Following New AI and Digital Twin Advances Unveiled at OCP Global Summit - Sahm,Sahm
"Fri, 17 Oct 2025 13:00:03 GMT","Is Trending Stock Cadence Design Systems, Inc. (CDNS) a Buy Now? - Yahoo Finance",Yahoo Finance
"Mon, 20 Oct 2025 08:31:09 GMT","Cadence Design Systems, Inc. $CDNS Shares Purchased by Lyell Wealth Management LP - MarketBeat",MarketBeat
"Tue, 21 Oct 2025 01:11:03 GMT",How CDNS stock performs in rising dollar environment - Market Trend Review & Expert-Curated Trade Recommendations - newser.com,newser.com
"Sat, 18 Oct 2025 11:00:11 GMT",Cadence Design Systems (NASDAQ:CDNS) Has A Rock Solid Balance Sheet - Yahoo Finance,Yahoo Finance
"Tue, 21 Oct 2025 06:24:18 GMT",Reversal indicators forming on CDNS stock - Dip Buying & Intraday High Probability Setup Alerts - newser.com,newser.com
"Tue, 21 Oct 2025 00:04:40 GMT",When is the best time to exit CDNS - Weekly Profit Recap & Stepwise Trade Signal Guides - newser.com,newser.com
"Tue, 21 Oct 2025 02:20:33 GMT",Will a bounce in CDNS offer an exit - Market Trend Summary & Reliable Entry Point Trade Alerts - newser.com,newser.com
"Mon, 20 Oct 2025 17:17:33 GMT",Is this a good reentry point in CDNS - July 2025 Outlook & Stock Portfolio Risk Management - newser.com,newser.com
"Tue, 21 Oct 2025 05:35:48 GMT",Will a bounce in CDNS offer an exit - 2025 Short Interest & Risk Adjusted Buy and Sell Alerts - newser.com,newser.com
"Mon, 20 Oct 2025 14:14:09 GMT",Reversal indicators forming on CDNS stock - Long Setup & Expert Verified Movement Alerts - newser.com,newser.com
"Mon, 20 Oct 2025 13:03:41 GMT",Can CDNS rally from current levels - 2025 AllTime Highs & Daily Chart Pattern Signals - newser.com,newser.com
"Sun, 19 Oct 2025 10:48:29 GMT","Cadence Design Systems, Inc. $CDNS Shares Sold by Pinnacle Wealth Management LLC - MarketBeat",MarketBeat
"Mon, 20 Oct 2025 16:16:12 GMT","Mizuho Securities Maintains Cadence Design Systems(CDNS.US) With Buy Rating, Maintains Target Price $400 - 富途牛牛",富途牛牛
"Mon, 20 Oct 2025 09:02:12 GMT",Is this a good reentry point in CDNS - 2025 Breakouts & Breakdowns & Growth Focused Stock Pick Reports - newser.com,newser.com
"Sat, 18 Oct 2025 09:10:08 GMT","Applied Finance Capital Management LLC Acquires New Stake in Cadence Design Systems, Inc. $CDNS - MarketBeat",MarketBeat
"Fri, 17 Oct 2025 13:56:41 GMT","Arista Wealth Management LLC Takes Position in Cadence Design Systems, Inc. $CDNS - MarketBeat",MarketBeat
"Sat, 18 Oct 2025 14:35:17 GMT",Why hedge funds are buying CDNS stock - 2025 Market WrapUp & Technical Pattern Based Buy Signals - nchmf.gov.vn,nchmf.gov.vn
"Fri, 17 Oct 2025 12:33:22 GMT","Cwm LLC Purchases 5,002 Shares of Cadence Design Systems, Inc. $CDNS - MarketBeat",MarketBeat
"Thu, 16 Oct 2025 10:01:47 GMT","Cadence Design Systems, Inc. $CDNS Stake Increased by Bridges Investment Management Inc. - MarketBeat",MarketBeat
"Thu, 16 Oct 2025 09:19:32 GMT","Cadence Design Systems, Inc. $CDNS Shares Acquired by Sagespring Wealth Partners LLC - MarketBeat",MarketBeat
"Thu, 16 Oct 2025 09:51:04 GMT","Cadence Design Systems, Inc. (CDNS) Stock Analysis: Exploring 14.42% Potential Upside in the Tech Sector - DirectorsTalk Interviews",DirectorsTalk Interviews
"Thu, 16 Oct 2025 09:36:31 GMT",DoT Keeps CDNs Unregulated Despite Earlier Push For Oversight - MediaNama,MediaNama
"Mon, 20 Oct 2025 04:22:22 GMT",Tools to assess CDNS’s risk profile - July 2025 Technicals & Stepwise Entry/Exit Trade Alerts - newser.com,newser.com
"Fri, 17 Oct 2025 09:32:20 GMT","Turtle Creek Wealth Advisors LLC Buys New Holdings in Cadence Design Systems, Inc. $CDNS - MarketBeat",MarketBeat
"Fri, 17 Oct 2025 11:36:29 GMT","Chevy Chase Trust Holdings LLC Sells 9,915 Shares of Cadence Design Systems, Inc. $CDNS - MarketBeat",MarketBeat
"Fri, 17 Oct 2025 10:19:48 GMT","Nordea Investment Management AB Has $555.07 Million Stock Holdings in Cadence Design Systems, Inc. $CDNS - MarketBeat",MarketBeat
"Thu, 16 Oct 2025 14:54:16 GMT","MGO One Seven LLC Has $1.63 Million Stake in Cadence Design Systems, Inc. $CDNS - MarketBeat",MarketBeat
2025-10-20T23:50:05,Cadence Design Systems (CDNS) Outperforms Broader Market: What You Need to Know,Yahoo
2025-10-20T15:30:02,Is It Worth Investing in Cadence (CDNS) Based on Wall Street's Bullish Views?,Yahoo
2025-10-18T13:00:11,Cadence Design Systems (NASDAQ:CDNS) Has A Rock Solid Balance Sheet,Yahoo
