Date,Title,Source
2025-10-27T06:30:07Z,Best Microspikes and Crampons for Winter Hiking (2025-2026),Sectionhiker.com
2025-10-27T01:40:03Z,HANAとSnow Man 向井康二さんが初登場！『エル・ジャポン』12月号が10月28日に発売,Prtimes.jp
2025-10-26T23:51:43Z,Hobart suburbs wake to 'uncommon' low-altitude spring snowfall,ABC News (AU)
2025-10-26T19:34:19Z,Prediction: 1 Growth Stock Set to Bounce Next Year,Biztoc.com
2025-10-26T19:05:54Z,Remember when we old Farkers used to throw bags of sand in the trunk in our RWD cars and go driving in the snow? Marketers have convinced the younglings that AWD is essential [Murica],Fark.com
2025-10-26T18:00:00Z,"Ski Ballet, Long Overshadowed By Snowboarding, May Be Making A Comeback",Powder Magazine
2025-10-26T17:06:19Z,WATCH: Snow leopard cub treated to first pumpkin at Michigan zoo,ABC News
2025-10-26T16:00:29Z,Jeremy Renner admits snowplow accident brought 'so many blessings' despite brutal injuries,Fox News
2025-10-26T15:43:30Z,"Snowfall expected across northern Utah, Winter Weather Advisory in effect",ABC 4
2025-10-26T15:05:16Z,Porsche 912 Type 616/40 Engine at No Reserve,Bringatrailer.com
2025-10-26T14:00:17Z,Cat walks gingerly on snow.,Wimp.com
2025-10-26T12:34:59Z,Winter Storm Warning Issued As 18 Inches of Snow to Hit,Biztoc.com
2025-10-26T12:13:39Z,Traveling with Snow Man S01E09 1080p WEB h264-EDITH,Rlsbb.to
2025-10-26T12:02:41Z,Humans and dogs compete for glory at the World Championships of Dry Land Mushing,NPR
2025-10-25T23:47:11Z,11/23/25: 2025 Bay Area Sports Basement Snowfest (Redwood City) - FREE,Funcheap.com
2025-10-25T23:36:39Z,11/16/25: 2025 Bay Area Sports Basement Snowfest (Presidio) - FREE,Funcheap.com
2025-10-25T23:35:02Z,11/8/25: 2025 Sports Basement Snowfest (Stonetown) - FREE,Funcheap.com
2025-10-25T22:27:58Z,Florida father and son rescued from snowy Engineer Pass in Southwestern Colorado,The Denver Post
2025-10-25T18:53:19Z,8 ‘Outdoor Adventure’ Photo Winners From 2025’s Nature’s Best Photography Competition,Forbes
2025-10-25T16:46:41Z,"Colorado snow lovers, rejoice: A-Basin opens for the season Sunday",The Denver Post
2025-10-25T16:32:26Z,"CIFF 2025: “Wind, Talk to Me,” “Brand New Landscape,” “The Girl in the Snow”",Rogerebert.com
2025-10-25T14:30:52Z,Don’t Believe the Hype: The Evil Queen and Her Friends Aren’t Going Anywhere,Inside the Magic
"Tue, 28 Oct 2025 01:40:12 GMT",Snow prompts I-70 closure near Silverthorne - The Denver Post,The Denver Post
"Mon, 27 Oct 2025 23:06:27 GMT","Mt. Whitney has already claimed a hiker’s life, weeks into the snow season - Los Angeles Times",Los Angeles Times
"Mon, 27 Oct 2025 22:18:23 GMT","Volleyball Splits Trip to Idaho Against Cardinals, Golden Eagles - Snow College Athletics",Snow College Athletics
"Mon, 27 Oct 2025 18:05:30 GMT",First major snowfall in Cascades prompts winter driving reminders - KOMO,KOMO
"Mon, 27 Oct 2025 17:07:55 GMT",Signals for possible accumulating snow in northern Minnesota later this week - Bring Me The News,Bring Me The News
"Mon, 27 Oct 2025 23:47:00 GMT",Snow for some? | First Alert Weather+ Ep 37 - WSAZ,WSAZ
"Mon, 27 Oct 2025 12:00:00 GMT",Will Idaho see snow this winter? How cold will it be? What experts predict - Idaho Statesman,Idaho Statesman
"Tue, 28 Oct 2025 02:15:00 GMT",Weekend snow has resorts eyeing early start to the ski season - KING5.com,KING5.com
"Tue, 28 Oct 2025 06:45:00 GMT",How to Get to Snow's Blight Hideout (Fox Statue Puzzle Solution) - Ghost of Yotei Guide - IGN,IGN
"Mon, 27 Oct 2025 19:51:39 GMT",Spagnola: Avalanche of mistakes snow them under - Dallas Cowboys | Official Site of the Dallas Cowboys,Dallas Cowboys | Official Site of the Dallas Cowboys
"Mon, 27 Oct 2025 18:25:18 GMT",City seeks volunteers for 2025-26 snow shoveling program - Evanston RoundTable,Evanston RoundTable
"Tue, 28 Oct 2025 01:16:00 GMT","Wild start to the week with snow, rain, hail and freeze warnings! - CBS News",CBS News
"Mon, 27 Oct 2025 14:21:00 GMT",Winter Weather Warning As 20 Inches of Snow To Strike - Newsweek,Newsweek
"Tue, 28 Oct 2025 00:58:00 GMT",'A lot of snow up here': Fall snowstorm blankets the Cascades in feet of snow - KGW,KGW
"Mon, 27 Oct 2025 18:04:00 GMT","Anchorage sees first snow accumulation over the weekend, with more wintry mix through the week - Alaska's News Source",Alaska's News Source
"Tue, 28 Oct 2025 04:55:43 GMT",Snowfall Thresholds For School Cancellations Vary Across Washington State - NewsRadio 560 KPQ,NewsRadio 560 KPQ
"Mon, 27 Oct 2025 22:33:23 GMT",Badgers Win First Ever SWAC Championship - Snow College Athletics,Snow College Athletics
"Mon, 27 Oct 2025 19:32:53 GMT",More rain and Cascade mountain snow on tap for final week of October - KOMO,KOMO
"Mon, 27 Oct 2025 23:46:00 GMT",Snow for some? | First Alert Weather+ Ep 37 - WSAZ,WSAZ
"Mon, 27 Oct 2025 22:13:23 GMT","Women's Soccer Locks in No. 2 Seed for Region 18 Tournament with wins over CSI, TMCC - Snow College Athletics",Snow College Athletics
"Tue, 28 Oct 2025 06:12:45 GMT",Snowflake (SNOW): Evaluating Valuation After Guidance Reaffirmation and New AI Cloud Partnerships - simplywall.st,simplywall.st
"Mon, 27 Oct 2025 22:01:00 GMT",Rain showers Tuesday; snow-free Halloween for the first time in 3 years - MPR News,MPR News
"Mon, 27 Oct 2025 20:07:53 GMT",Letter: Dashing Through the Snow to Build a California FM - radioworld.com,radioworld.com
"Mon, 27 Oct 2025 19:28:39 GMT",Mountain snow showers diminish as a clear and cold night sets in - ABC4 Utah,ABC4 Utah
"Mon, 27 Oct 2025 19:07:33 GMT",Anita Snow - KTEP,KTEP
"Mon, 27 Oct 2025 23:53:34 GMT",CDOT’s snow plow driver vacancy reaches its best number in years - WesternSlopeNow.com,WesternSlopeNow.com
"Mon, 27 Oct 2025 22:05:00 GMT",City of Bella Vista accepting priority snow removal applications - 5newsonline.com,5newsonline.com
"Mon, 27 Oct 2025 18:04:00 GMT","Anchorage sees first snow accumulation through the weekend, with more wintry mix through the week - Alaska's News Source",Alaska's News Source
"Tue, 28 Oct 2025 02:35:25 GMT","Winter Olympics: high in the Alps, artificial snow will still play role - CBS 19 News",CBS 19 News
"Mon, 27 Oct 2025 16:15:00 GMT",Walmart’s ‘Sturdy’ $90 Windshield Snow Shovel Is Now 44% Off - autoblog.com,autoblog.com
"Mon, 27 Oct 2025 19:00:00 GMT",Brittany Snow Reacts to Theories About Her and Anna Kendrick's Pitch Perfect Characters - E! News,E! News
"Mon, 27 Oct 2025 23:42:00 GMT",Snow sparks rush for winter tires in Anchorage - Your Alaska Link,Your Alaska Link
"Mon, 27 Oct 2025 19:45:00 GMT",Bella Vista accepting priority snow removal applications - Northwest Arkansas Democrat-Gazette,Northwest Arkansas Democrat-Gazette
"Mon, 27 Oct 2025 10:35:07 GMT",Here's the date to expect NJ's first snow of the 2025-2026 season - New Jersey 101.5,New Jersey 101.5
"Mon, 27 Oct 2025 11:44:43 GMT","40 Inches Of Snow Predicted For Hudson Valley, Wild Temp Changes - Hudson Valley Post",Hudson Valley Post
"Tue, 28 Oct 2025 00:45:29 GMT","Early Snow, Big Risks: Rescuers urge backcountry skiers to stay alert - KTVZ",KTVZ
"Mon, 27 Oct 2025 18:54:56 GMT",Snow White Hits the New Victory Theater for a Limited Run This November - New York Family,New York Family
"Tue, 28 Oct 2025 06:50:54 GMT",Volleyball Recap: Snow Canyon Comes Up Short - MaxPreps.com,MaxPreps.com
"Mon, 27 Oct 2025 21:32:00 GMT",Did you wake up to snow this morning? Here is what to expect for this ‘Halloweekend.’ - East Idaho News,East Idaho News
"Mon, 27 Oct 2025 00:18:00 GMT","Rain and snow Monday in Colorado, then a big cooldown settles in - CBS News",CBS News
"Mon, 27 Oct 2025 16:31:35 GMT",Will it snow on Thanksgiving? Old Farmer's Almanac says plan for sun in Michigan - Detroit Free Press,Detroit Free Press
"Mon, 27 Oct 2025 16:20:00 GMT","Yellowstone roads closed due to 30+ car accidents in snow, ice - Buckrail - Jackson Hole, news","Buckrail - Jackson Hole, news"
"Mon, 27 Oct 2025 13:00:38 GMT",Hiker Rescued in the Mt. Washington Snow - nhfishgame.com,nhfishgame.com
"Mon, 27 Oct 2025 21:30:19 GMT",Colorado’s snowpack below average for October as a dry start to November looms - Colorado Springs Gazette,Colorado Springs Gazette
"Mon, 27 Oct 2025 22:09:46 GMT",[PHOTOS] Japan's Mount Fuji Receives First Snow of the 2025-26 Season as First Japanese Ski Resort Opens - SnowBrains,SnowBrains
"Tue, 28 Oct 2025 04:52:20 GMT",Soccer Recap: Friday's Win Is Snow Hill's Seventh in Last Eight Outings + How To Watch - MaxPreps.com,MaxPreps.com
"Mon, 27 Oct 2025 22:30:00 GMT",Be Prepared For Winter With 10 Snow Storm Essentials From Harbor Freight - House Digest,House Digest
"Mon, 27 Oct 2025 15:25:00 GMT","Sunny Skies Locally, Mountain Snow and Cold Front Across Colorado - KSJD",KSJD
"Mon, 27 Oct 2025 12:00:00 GMT","Snowed In, Chicago-Style: Our Audience Remembers the City’s Biggest Blizzards - WTTW",WTTW
"Mon, 27 Oct 2025 14:31:00 GMT",Windy conditions with rain and mountain snow chances - Wyoming News Now,Wyoming News Now
"Mon, 27 Oct 2025 20:25:00 GMT","Montana's ski resorts: A wide diversity of terrain, snow and cultures - Bozeman Daily Chronicle",Bozeman Daily Chronicle
"Mon, 27 Oct 2025 14:34:23 GMT","Mt. Bachelor gets early snowfall, paving the way for season opening - Central Oregon Daily",Central Oregon Daily
"Mon, 27 Oct 2025 17:00:59 GMT",6 to 8 more inches of snow could hit mountain range in Colorado - Denver Gazette,Denver Gazette
"Mon, 27 Oct 2025 14:13:00 GMT",Windy start to the week with mountain snow and plains showers - CBS News,CBS News
"Tue, 28 Oct 2025 02:35:25 GMT","Winter Olympics: high in the Alps, artificial snow will still play role - Iosco County News Herald",Iosco County News Herald
"Mon, 27 Oct 2025 22:37:00 GMT","AROUND ALASKA: Early Snow, Drug Takeback, and Octopus Release! - Your Alaska Link",Your Alaska Link
"Mon, 27 Oct 2025 14:26:15 GMT","NBC MT Today: Local shutdown impacts, Halloween events, rain & snow - NBC Montana",NBC Montana
"Mon, 27 Oct 2025 19:43:52 GMT",Volunteer To Shovel Snow For Your Elderly Or Disabled Neighbors - Patch,Patch
"Mon, 27 Oct 2025 21:02:32 GMT","Island Stewards | As the veil thins, before the snow flies - theOrcasonian.com",theOrcasonian.com
"Mon, 27 Oct 2025 19:22:07 GMT",Mountain snow showers diminish as a clear and cold night sets in - ABC4 Utah,ABC4 Utah
"Mon, 27 Oct 2025 19:19:45 GMT","Snowfall on Mount Washington, New Hampshire is Not Normal Right Now - 97.5 WOKQ",97.5 WOKQ
"Mon, 27 Oct 2025 04:04:00 GMT","Atmospheric river brings 3 days of rain, deadly wind and mountain snow to western Washington - KING5.com",KING5.com
"Mon, 27 Oct 2025 10:52:41 GMT","Morning rain and snow, Winter Weather Advisories; high pressure building for the work week - NBC Montana",NBC Montana
"Mon, 27 Oct 2025 20:45:57 GMT","Jacquline Snow Obituary (1936 - 2025) - Northford, CT - WFSB - Legacy obituary",Legacy obituary
"Mon, 27 Oct 2025 13:55:37 GMT",Early morning snow showers over western Montana - KTVH,KTVH
"Tue, 28 Oct 2025 05:31:20 GMT",Heavy snowfall hits Manang - kathmandupost.com,kathmandupost.com
"Tue, 28 Oct 2025 02:30:42 GMT",When will the first snowfall happen in Colorado Springs? How about La Niña? - Colorado Springs Gazette,Colorado Springs Gazette
"Sat, 25 Oct 2025 22:42:03 GMT",How much snow will NY get this winter? See NOAA's 2025-26 forecast - Democrat and Chronicle,Democrat and Chronicle
"Sun, 26 Oct 2025 21:27:57 GMT",Tedious Hiking With No Tracks in the Snow - The Trek,The Trek
"Mon, 27 Oct 2025 15:13:35 GMT",new suffolk beach snow fences - East End Beacon,East End Beacon
"Mon, 27 Oct 2025 12:11:00 GMT","Rain is on the way, but when and how much? Could it end as snow? If so, at what elevations? - WDTV 5",WDTV 5
"Tue, 28 Oct 2025 02:35:25 GMT","Winter Olympics: high in the Alps, artificial snow will still play role - Northwest Signal",Northwest Signal
"Mon, 27 Oct 2025 14:33:21 GMT","Mt. Bachelor received 12″ of snow over the weekend, opening day approaches - KTVZ",KTVZ
"Mon, 27 Oct 2025 05:50:20 GMT",Snoqualmie Pass sees early snowfall after first fall storm hits high country - KOMO,KOMO
"Tue, 28 Oct 2025 02:35:25 GMT","Winter Olympics: high in the Alps, artificial snow will still play role - Citizen Tribune",Citizen Tribune
"Mon, 27 Oct 2025 08:32:57 GMT",Deep Snow & Steep Fall Out in Oregon - The Trek,The Trek
"Mon, 27 Oct 2025 20:52:48 GMT",Nearly Two Dozen Hikers Were Left Stranded by Snow atop New England’s Highest Peak - Outside Magazine,Outside Magazine
"Mon, 27 Oct 2025 18:34:00 GMT",Snow at Snoqualmie Pass in WA - FOX 13 Seattle,FOX 13 Seattle
"Mon, 27 Oct 2025 06:22:57 GMT",Hiking in Snow Until After Midnight - The Trek,The Trek
"Mon, 27 Oct 2025 13:10:00 GMT",Mountain snow Monday morning ahead of a drier work week - krem.com,krem.com
"Sat, 25 Oct 2025 01:37:00 GMT",Snow potential moves in for lower elevations - Alaska's News Source,Alaska's News Source
"Sun, 26 Oct 2025 15:43:30 GMT","Snowfall expected across northern Utah, Winter Weather Advisory in effect - ABC4 Utah",ABC4 Utah
"Tue, 28 Oct 2025 02:00:00 GMT",This Week in History Oct. 27-31: County receives 3 inches of snow - Messenger-Inquirer,Messenger-Inquirer
"Tue, 28 Oct 2025 02:35:25 GMT","Winter Olympics: high in the Alps, artificial snow will still play role - The Mountain Press",The Mountain Press
"Mon, 27 Oct 2025 15:10:57 GMT",First Blast of Snow and Cold Coming Soon? - American Ag Network,American Ag Network
"Mon, 27 Oct 2025 12:26:03 GMT","Wind, snow and rain chances likely Monday afternoon in Casper area - Oil City News",Oil City News
"Tue, 28 Oct 2025 00:01:00 GMT",KELOLAND’s Scot Mundt’s annual snowfall prediction - KELOLAND.com,KELOLAND.com
"Tue, 28 Oct 2025 06:51:37 GMT",How to forecast Snow Lake Resources Ltd. trends using time series - July 2025 EndofMonth & Fast Entry High Yield Stock Tips - newser.com,newser.com
"Mon, 27 Oct 2025 23:06:46 GMT",Adventure Theatre MTC To Present FROSTY THE SNOW MAN This Holiday Season - BroadwayWorld.com,BroadwayWorld.com
"Sun, 26 Oct 2025 09:00:00 GMT",La Niña Map Shows Snowfall Forecast For Each State This Winter - Newsweek,Newsweek
"Sun, 26 Oct 2025 18:00:32 GMT","‘The Blob' over Pacific Ocean could lead to snowy, frigid winter in Chicago area - NBC 5 Chicago",NBC 5 Chicago
"Mon, 27 Oct 2025 09:15:00 GMT",Snow Is On The Way. Here's What AccuWeather Is Predicting For The Winter Season - Yahoo,Yahoo
2025-10-27T14:00:00,JPXI Launches TDnet Disclosures on Snowflake,Yahoo
2025-10-26T04:13:07,Snowflake (SNOW): Assessing Valuation After Wave of High-Profile AI Partnerships and Product Innovations,Yahoo
2025-10-25T14:00:56,"Tesla, AI Plays Lead Five Stocks Near Buy Points Without This Big Risk",Yahoo
2025-10-24T16:00:10,Snowflake: Big Market With An Equally Big Valuation,SeekingAlpha
2025-10-24T14:39:19,Snowflake: Strong Momentum And A Reasonable Valuation,SeekingAlpha
2025-10-23T20:56:35,"Wedbush Raises Snowflake (SNOW) Price Target to $270, Citing Expanding AI Integration",Yahoo
2025-10-23T20:21:20,Expanded AI Collaborations Could Be a Game Changer for Snowflake (SNOW),Yahoo
2025-10-23T18:41:00,"Buy Snowflake Stock, J.P. Morgan Says. It’s Critical for AI Agents.",Yahoo
2025-10-23T14:23:00,Can This Stock Be the New Snowflake of the Next Decade?,Yahoo
2025-10-23T13:29:10,WTW’s Radar platform integrates with Snowflake,Yahoo
