Date,Title,Source
2025-12-03T00:01:51Z,"Stock market today: Dow, S&P 500, Nasdaq futures climb as key ADP jobs data looms",Yahoo Entertainment
2025-12-03T00:01:51Z,"Stock market today: Dow, S&P 500, Nasdaq futures keep rebound alive as key ADP jobs data looms",Yahoo Entertainment
2025-12-03T00:01:51Z,"Stock market today: Dow and S&P 500 rise, Nasdaq pares losses as key ADP jobs data shows weakness",Yahoo Entertainment
2025-12-03T00:01:51Z,"Stock market today: Dow rises, S&P 500 and Nasdaq under pressure as key ADP jobs data shows weakness",Yahoo Entertainment
2025-12-03T00:01:51Z,"Stock market today: Dow, S&P 500, Nasdaq futures keep rebound alive as key ADP jobs data comes in soft",Yahoo Entertainment
2025-12-03T00:01:51Z,"Stock market today: Dow, S&P 500, Nasdaq under pressure as key ADP jobs data shows weakness",Yahoo Entertainment
2025-12-03T00:01:51Z,"Stock market today: Dow, S&P 500, Nasdaq futures slide as key ADP jobs data shows weakness",Yahoo Entertainment
2025-12-03T00:01:51Z,"Stock market today: Dow, S&P 500, Nasdaq rise as surprise ADP jobs decline reinforces Fed rate cut bets",Yahoo Entertainment
2025-12-02T21:34:45Z,November ADP Jobs Data Could Complicate the Fed’s Rate Decision,Biztoc.com
2025-12-02T19:23:12Z,Ontario workers are happier than ever,blogTO
2025-12-02T17:46:37Z,"Consensus vs. ARIMA(1,1,1): ADP Private Nonfarm Payroll",Econbrowser.com
2025-12-01T14:45:30Z,"Key Events This Busy Week: ISM Mfg and Services, ADP, Core PCE And More",Biztoc.com
2025-11-30T21:13:05Z,ADP Weekly Employment thru 11/8,Econbrowser.com
2025-11-30T17:02:00Z,Small Firm Employment Falls Again,Econbrowser.com
"Wed, 03 Dec 2025 18:56:33 GMT","Small businesses suffered major job losses in November, ADP says - NBC News",NBC News
"Wed, 03 Dec 2025 13:15:17 GMT","November private payrolls unexpectedly fell by 32,000, led by steep small business job cuts, ADP reports - CNBC",CNBC
"Wed, 03 Dec 2025 16:04:06 GMT","U.S. lost 32,000 private-sector jobs last month in surprise drop, ADP data shows - CBS News",CBS News
"Wed, 03 Dec 2025 13:15:00 GMT","ADP National Employment Report: Private Sector Employment Shed 32,000 Jobs in November; Annual Pay was Up 4.4% - PR Newswire",PR Newswire
"Wed, 03 Dec 2025 14:35:27 GMT","ADP: Private payrolls dropped 32,000 positions last month in slowing job market - Yahoo Finance",Yahoo Finance
"Wed, 03 Dec 2025 16:06:00 GMT","US private payrolls unexpectedly declined in November, ADP says - The Guardian",The Guardian
"Wed, 03 Dec 2025 15:34:00 GMT","Private sector unexpectedly lost 32,000 jobs in November, ADP says - Fox Business",Fox Business
"Wed, 03 Dec 2025 14:38:00 GMT",ADP Jobs Report Shows Surprise Drop In Private Payrolls; S&P 500 Wavers - Investor's Business Daily,Investor's Business Daily
"Wed, 03 Dec 2025 22:03:54 GMT","Companies cut 32,000 from payrolls as Fed debates trimming main rate: ADP - CFO Dive",CFO Dive
"Wed, 03 Dec 2025 13:24:00 GMT",ADP says U.S. economy lost jobs for third time in four months. Fed to weigh weak labor market in rate-cut vote. - MarketWatch,MarketWatch
"Wed, 03 Dec 2025 16:27:00 GMT","Companies shed 32,000 workers in November: ADP - The Hill",The Hill
"Wed, 03 Dec 2025 14:43:00 GMT",How Today’s ADP Jobs Report Makes a Fed Rate Cut All the More Likely - Barron's,Barron's
"Wed, 03 Dec 2025 13:15:00 GMT","ADP (NASDAQ: ADP) reports private jobs down 32,000 as pay growth slows to 4.4% - Stock Titan",Stock Titan
"Wed, 03 Dec 2025 15:07:57 GMT",ADP National Employment Report: 32K Private Jobs Lost in November - Advisor Perspectives,Advisor Perspectives
"Wed, 03 Dec 2025 18:56:00 GMT","Private Hiring Sank in November, ADP Says - The Wall Street Journal",The Wall Street Journal
"Wed, 03 Dec 2025 21:52:13 GMT","Stock market today: Dow, S&P 500, Nasdaq rise as weak ADP jobs data reinforces growing Fed rate cut bets - Yahoo Finance",Yahoo Finance
"Wed, 03 Dec 2025 13:04:40 GMT","Stock market today: Dow, S&P 500, Nasdaq futures keep rebound alive as key ADP jobs data looms - Yahoo Finance",Yahoo Finance
"Wed, 03 Dec 2025 19:17:20 GMT",ADP shock: Private payroll drop puts rate path under the microscope - Mortgage Professional America,Mortgage Professional America
"Wed, 03 Dec 2025 14:17:33 GMT","Stock market today: Dow, S&P 500, Nasdaq futures slide as key ADP jobs data shows weakness - Yahoo Finance",Yahoo Finance
"Wed, 03 Dec 2025 22:33:23 GMT",Watch ADP: Payrolls at US Companies Fall by Most Since 2023 - Bloomberg,Bloomberg
"Wed, 03 Dec 2025 20:55:00 GMT","ADP Report Shows Private Sector Cut 32,000 Jobs in November - NBC Palm Springs",NBC Palm Springs
"Wed, 03 Dec 2025 15:23:43 GMT",ADP: Small business drive large 32K private payroll drop in November - upi.com,upi.com
"Wed, 03 Dec 2025 14:24:00 GMT","Payrolls at U.S. companies fall by most since 2023, ADP says - The Detroit News",The Detroit News
"Wed, 03 Dec 2025 14:18:27 GMT",The biggest opportunity for AI at work - ADP Media Center,ADP Media Center
"Wed, 03 Dec 2025 22:24:00 GMT","ADP report shows private companies cut 32,000 jobs in Nov. 2025 - WCNC",WCNC
"Wed, 03 Dec 2025 16:56:38 GMT",ADP jobs report sees largest drop since early 2023 - Staffing Industry Analysts,Staffing Industry Analysts
"Wed, 03 Dec 2025 13:26:52 GMT","US ADP Employment Change falls by 32,000 in November vs. 5,000 expected gain - FXStreet",FXStreet
"Wed, 03 Dec 2025 15:09:43 GMT","Watch ADP Says US Payrolls in Nov. Fell by 32,000 - Bloomberg",Bloomberg
"Wed, 03 Dec 2025 16:14:23 GMT","Stock market today: Dow rises, S&P 500 and Nasdaq under pressure as key ADP jobs data shows weakness - Yahoo Finance UK",Yahoo Finance UK
"Wed, 03 Dec 2025 13:38:16 GMT","Stronger Start, Mostly Before ADP Data - Mortgage News Daily",Mortgage News Daily
"Wed, 03 Dec 2025 16:12:55 GMT","ADP Data Shows Unexpected Decline In Private Payrolls In November, Small Businesses Pull Back Sharply - Stocktwits",Stocktwits
"Wed, 03 Dec 2025 09:37:00 GMT","U.S. Futures Rise, Global Markets Mixed; ADP Payroll Data Eyed - The Wall Street Journal",The Wall Street Journal
"Wed, 03 Dec 2025 14:56:44 GMT","Stock market today: Dow, S&P 500, Nasdaq under pressure as key ADP jobs data shows weakness - Yahoo Finance UK",Yahoo Finance UK
"Wed, 03 Dec 2025 21:49:00 GMT",Stocks love the ADP miss – North American session Market Wrap for December 3 - marketpulse.com,marketpulse.com
"Wed, 03 Dec 2025 17:00:43 GMT",November ADP: ADP Signals Clear Labor Market Softening Ahead Of The Fed's December Decision - Seeking Alpha,Seeking Alpha
"Wed, 03 Dec 2025 13:32:21 GMT",Gold price jumps as ADP says 32K jobs lost in November - KITCO,KITCO
"Wed, 03 Dec 2025 15:32:51 GMT","AI race's new contenders, ADP reports loss of 32K jobs in November - Yahoo Finance",Yahoo Finance
"Wed, 03 Dec 2025 14:10:00 GMT",ADP: Employers Shed 32K Jobs in November | Personal Finance | U.S. News - Money US News.com,Money US News.com
"Wed, 03 Dec 2025 14:26:08 GMT","ADP reports decline of 32,000 private sector jobs in November - Yahoo Finance",Yahoo Finance
"Wed, 03 Dec 2025 20:05:26 GMT","Jobs Picture Deteriorates in ADP Report, Tilting Policy Outlook Toward More Cuts - Investing.com",Investing.com
"Wed, 03 Dec 2025 23:12:00 GMT",Stock Market Today: Nasdaq Slips While Bitcoin Rises; ADP Report Shows Job Losses — Live Updates - The Wall Street Journal,The Wall Street Journal
"Wed, 03 Dec 2025 14:32:14 GMT",Dow Jones Forecast: DJIA wobbles after weak ADP data - FOREX.com,FOREX.com
"Wed, 03 Dec 2025 18:09:51 GMT","Stock market today: Dow, S&P 500, Nasdaq rise as key ADP jobs data shows weakness - Yahoo Finance UK",Yahoo Finance UK
"Wed, 03 Dec 2025 14:08:15 GMT","Alphabet's AI, ADP job data, Macy's & Dollar Tree: 3 Things - Yahoo Finance",Yahoo Finance
"Wed, 03 Dec 2025 16:04:41 GMT",November ADP Jobs Data Could Complicate the Fed’s Rate Decision - MSN,MSN
"Wed, 03 Dec 2025 14:50:03 GMT","Stock market today: Dow, S&P 500, Nasdaq waver as key ADP jobs data shows weakness - Yahoo Finance",Yahoo Finance
"Wed, 03 Dec 2025 15:21:58 GMT",Fed rate cut 'already sealed' in spite of ADP's negative data - Yahoo Finance,Yahoo Finance
"Wed, 03 Dec 2025 14:36:51 GMT",Dow Jones Forecast: DJIA wobbles after weak ADP data - FOREX.com,FOREX.com
"Wed, 03 Dec 2025 13:55:43 GMT",Treasuries Gain Slightly After ADP Report. Stocks Barely Budge. - Barron's,Barron's
"Wed, 03 Dec 2025 13:37:36 GMT",ADP Jobs Report Shows Surprise Drop In Private Payrolls; S&P 500 Futures Rise - MSN,MSN
"Wed, 03 Dec 2025 16:50:00 GMT",ADP Jobs Report Contains a Shock - Newser,Newser
"Wed, 03 Dec 2025 14:14:12 GMT","November private payrolls unexpectedly fell by 32,000, led by steep small business job cuts, ADP reports - MSN",MSN
"Wed, 03 Dec 2025 15:59:18 GMT",Lutnick pushes back on tariff blame for negative ADP jobs print - Seeking Alpha,Seeking Alpha
"Wed, 03 Dec 2025 11:58:00 GMT",U.S. ADP Employment Report for November 2025 - Previous: 42k Forecast: 10k - EBC Financial Group,EBC Financial Group
"Wed, 03 Dec 2025 13:17:24 GMT",Private firms unexpectedly shed 32K jobs in November: ADP report - Seeking Alpha,Seeking Alpha
"Wed, 03 Dec 2025 10:03:00 GMT",'Bad news is good news' as weak ADP report boosts chances of Fed rate cut - MarketWatch,MarketWatch
"Wed, 03 Dec 2025 06:29:00 GMT","Stock market today: Dow, S&P 500, Nasdaq futures climb as key ADP jobs data looms - Yahoo Finance",Yahoo Finance
"Wed, 03 Dec 2025 17:46:52 GMT",US Open: U.S. indices open higher after ADP 🔎 - XTB.com,XTB.com
"Wed, 03 Dec 2025 17:41:20 GMT","Payrolls at US companies fall by most since 2023, ADP says - Orange County Register",Orange County Register
"Wed, 03 Dec 2025 10:12:25 GMT","U.S. Futures Rise, Global Markets Mixed; ADP Payroll Data Eyed - MSN",MSN
"Wed, 03 Dec 2025 08:37:00 GMT","Private Hiring Sank in November, ADP Says - The Wall Street Journal",The Wall Street Journal
"Wed, 03 Dec 2025 14:04:42 GMT",Stock Futures Higher Despite Dismal ADP Jobs Report - Schaeffer's Investment Research,Schaeffer's Investment Research
"Wed, 03 Dec 2025 23:06:34 GMT","ADP (ADP) November Report: 32K Jobs Lost, Wage Growth Slows but Remains Positive - parameter.io",parameter.io
"Wed, 03 Dec 2025 13:26:40 GMT",US ADP jobs shock with -32k drop as small businesses cut deeply - Action Forex,Action Forex
"Wed, 03 Dec 2025 14:00:06 GMT",BREAKING: ADP employment goes negative❗️EURUSD breaks over 1.167 📈 - XTB.com,XTB.com
"Wed, 03 Dec 2025 13:17:25 GMT",US Private Sector Cuts Jobs Again: ADP - TradingView,TradingView
"Wed, 03 Dec 2025 14:11:14 GMT","ADP: Private Payrolls Drop by 32,000 in November as Small Businesses Cut Jobs - VINnews",VINnews
"Wed, 03 Dec 2025 16:00:00 GMT",Headline ADP Payrolls Number Comes in Negative - TradingView,TradingView
"Wed, 03 Dec 2025 10:03:00 GMT","Treasurys rally after ADP report, led by 1-month T-bill - MarketWatch",MarketWatch
"Wed, 03 Dec 2025 23:03:00 GMT",Unexpected Job Losses Signal Economic Chill: ADP Report Shakes Market Expectations - Markets Financial Content,Markets Financial Content
"Wed, 03 Dec 2025 11:56:00 GMT","US Dollar poised ahead of Fed, ADP data in focus – Commerzbank - FXStreet",FXStreet
"Wed, 03 Dec 2025 13:44:20 GMT","Private Hiring Sank in November, ADP Says - MarketScreener",MarketScreener
"Wed, 03 Dec 2025 22:53:10 GMT",Fed rate-cut odds climb on softer-than-expected ADP data - equiti.com,equiti.com
"Wed, 03 Dec 2025 02:44:29 GMT",HCM Academy Visits ADP to Cap Mentorship Program - The University of Texas at El Paso - UTEP,The University of Texas at El Paso - UTEP
"Wed, 03 Dec 2025 13:28:54 GMT",Private firms unexdpectedly shed 32K jobs in November: ADP report - MSN,MSN
"Wed, 03 Dec 2025 13:16:00 GMT",ADP: US private payrolls down by 32K in November - breakingthenews.net,breakingthenews.net
"Tue, 02 Dec 2025 07:10:00 GMT",Gusto Vs. ADP (2025 Comparison) - Forbes,Forbes
"Wed, 03 Dec 2025 04:36:43 GMT",Revisiting ADP (ADP) Valuation After Recent Share Price Weakness - simplywall.st,simplywall.st
"Wed, 03 Dec 2025 17:08:00 GMT","U.S. Dollar Retreats As ADP Report Misses Estimates: Analysis For EUR/USD, GBP/USD, USD/CAD, USD/JPY - FXEmpire",FXEmpire
"Wed, 03 Dec 2025 09:58:00 GMT",US ADP Employment Report Today: What November Data May Show - EBC Financial Group,EBC Financial Group
"Wed, 03 Dec 2025 15:03:00 GMT",US Dollar Forecast: DXY Falls as Weak ADP Jobs Data Fuels Fed Cut Expectations - FXEmpire,FXEmpire
"Wed, 03 Dec 2025 10:03:00 GMT","S&P 500 futures edge higher with ADP, ISM reports on tap - MarketWatch",MarketWatch
"Wed, 03 Dec 2025 16:24:28 GMT",GBP/USD: Cable Surges on Disappointing US ADP Data - Action Forex,Action Forex
"Wed, 03 Dec 2025 13:23:00 GMT",ADP says U.S. economy loses jobs for third time in four months. Fed to weigh weak labor market in rate-cut vote. - Forex Factory,Forex Factory
2025-12-03T17:58:50,Inflation is still 'under control: Citizens CEO on the Fed,Yahoo
2025-12-03T17:00:00,Headline ADP Payrolls Number Comes in Negative,Yahoo
2025-12-03T16:29:00,ADP Disappoints: -32K Private Sector Jobs Last Month,Yahoo
2025-12-03T16:27:41,"Private Sector Unexpectedly Sheds Jobs in November, Likely Locking in December Rate Cut",Yahoo
2025-12-03T16:21:58,Fed rate cut 'already sealed' in spite of ADP's negative data,Yahoo
2025-12-03T16:04:34,"Private Hiring Sank in November, ADP Says",Yahoo
2025-12-03T15:43:00,How Today’s ADP Jobs Report Makes a Fed Rate Cut More Likely,Yahoo
2025-12-03T15:38:41,ADP Jobs Report Shows Surprise Drop In Private Payrolls; S&P 500 Wavers,Yahoo
2025-12-03T15:26:08,"ADP reports decline of 32,000 private sector jobs in November",Yahoo
2025-12-03T14:54:18,Treasuries Gain Slightly After ADP Report. Stocks Barely Budge.,Yahoo
2025-12-03T14:32:10,"ADP: Private payrolls dropped 32,000 positions last month in slowing job market",Yahoo
2025-12-03T14:15:00,"ADP National Employment Report: Private Sector Employment Shed 32,000 Jobs in November; Annual Pay was Up 4.4%",Yahoo
2025-12-03T13:50:09,"US Dollar Falls Early Wednesday Ahead of ADP Private Payrolls, Import Prices, Services Data",Yahoo
2025-12-03T13:27:32,Stocks Rise Pre-Bell as Investors Await ADP Employment Report,Yahoo
2025-12-03T10:37:00,"U.S. Futures Rise, Global Markets Mixed; ADP Payroll Data Eyed",Yahoo
2025-12-03T09:28:34,"November private payrolls unexpectedly fell by 32,000, led by steep small business job cuts: ADP",CNBC
2025-12-03T01:01:51,"Stock market today: Dow, S&P 500, Nasdaq under pressure as key ADP jobs data shows weakness",Yahoo
2025-12-03T01:01:51,"Stock market today: Dow, S&P 500, Nasdaq futures climb as key ADP jobs data looms",Yahoo
2025-12-02T04:33:11,Reflecting On Data & Business Process Services Stocks’ Q3 Earnings: ADP (NASDAQ:ADP),Yahoo
2025-12-01T18:11:14,Is Now the Right Moment for ADP Shares After a 2.1% Weekly Rebound?,Yahoo
2025-12-01T14:55:28,Treasury Yields Little Changed as Markets Position for Fed Cut,Yahoo
2025-12-01T13:57:44,"US Dollar Falls Early Monday, Focus on ADP Payrolls This Week",Yahoo
