Date,Title,Source
2025-10-27T05:30:00Z,Eamonn Sweeney: George Graham must be proud – old-school Arsenal are back in town,Independent.ie
2025-10-26T19:35:36Z,Guardiola: Too early to be worried about Arsenal,ESPN
2025-10-26T18:34:16Z,Pep Guardiola not worried that Manchester City have to chase down Arsenal,Independent.ie
2025-10-26T17:41:22Z,Guardiola satisfied with Man City's performance despite loss at Villa,CNA
2025-10-26T17:07:01Z,Man City fell short on finishing - Guardiola,BBC News
2025-10-26T16:00:00Z,Cash strikes as impressive Villa beat Man City,Sky Sports
2025-10-26T15:57:08Z,"Aston Villa 1-0 Man City: Report, result, goals as controversial Cash strike earns hosts fourth straight Premier League win",101 Great Goals
2025-10-26T15:35:42Z,Aston Villa vs Man City: See ‘brilliant’ Cash goal in Premier League after Guardiola complains over ‘big mistake’ by referee,101 Great Goals
2025-10-26T14:36:23Z,flowtrace added to PyPI,Pypi.org
2025-10-26T14:36:23Z,flowtrace 0.1.0,Pypi.org
2025-10-26T12:00:00Z,"How to watch Aston Villa vs Man City: live stream Premier League 2025/26 game, TV channels, preview",TechRadar
2025-10-25T22:05:05Z,Pep warns Norway boss Haaland won't be rested,ESPN
2025-10-25T10:42:53Z,Guardiola 'betrays' Messi and chooses another player as the best he has ever seen,Marca
2025-10-25T08:07:10Z,Quickpost: PEP 515 – Underscores in Numeric Literals,Didierstevens.com
2025-10-25T02:06:18Z,homeassistant-stubs 2025.10.4,Pypi.org
2025-10-24T17:08:16Z,Kylie Kelce Shares The 1 Unexpected Rule She Had For Her Husband In The NFL,HuffPost
2025-10-24T16:08:21Z,Roy Wood Jr. Shocks ‘The View’ With Reveal That He Went To “Pimps” For Advice: “Why Are You Crying About Getting Booed? I’ve Been Shot Three Times!”,Decider
2025-10-24T15:00:00Z,Pep Guardiola praises former Arsenal man after Champions League clash,Just Arsenal News
2025-10-24T13:06:34Z,Guardiola confident in title pursuit as Man City prepare for Villa,CNA
2025-10-24T12:03:59Z,Pep Guardiola issues Manchester City fitness update ahead of crucial Aston Villa clash,Cityxtra.co.uk
2025-10-24T06:17:41Z,"Friday's papers: Finland to host EU Eastern Flank conference, Stubb's pep talk to students, and the worst village road",YLE News
"Tue, 28 Oct 2025 00:50:50 GMT","Troy Women’s Basketball Set for Exhibition with AUM, Homecoming Pep Rally - Troy University Athletics",Troy University Athletics
"Mon, 27 Oct 2025 18:56:15 GMT",Peppy film festival crowd screens ‘Pep Banned’ documentary about a past UVA tradition - Cville Right Now,Cville Right Now
"Mon, 27 Oct 2025 19:45:00 GMT",Pep Guardiola Offers Guarded Four-Word Erling Haaland Injury Update - Sports Illustrated,Sports Illustrated
"Tue, 28 Oct 2025 02:07:50 GMT","Pep Guardiola Delivers Sweeping Arsenal, Liverpool Premier League Title Verdict - MSN",MSN
"Mon, 27 Oct 2025 19:18:45 GMT",PepsiCo (PEP): Evaluating Valuation After Recent Share Price Gains - simplywall.st,simplywall.st
"Mon, 27 Oct 2025 23:41:52 GMT","Dunkin’ will hold a World Series pep rally in LA on Tuesday, Oct. 28 - Los Angeles Daily News",Los Angeles Daily News
"Mon, 27 Oct 2025 19:03:56 GMT",A Look Into the Homecoming Pep Rally - vsuspectator.com,vsuspectator.com
"Mon, 27 Oct 2025 19:52:59 GMT",PHOTOS: Stephenville HS Heart of Gold Game Pep Rally - The Flash Today Erath County,The Flash Today Erath County
"Sun, 26 Oct 2025 17:03:45 GMT",Pep Guardiola reaction — Manchester City boss speaks after loss at Aston Villa - NBC Sports,NBC Sports
"Mon, 27 Oct 2025 22:38:23 GMT",Man City star echoes Pep Guardiola's verdict on Premier League title race - Yahoo,Yahoo
"Tue, 28 Oct 2025 05:31:34 GMT","PepsiCo, Inc. (NASDAQ:PEP) Given Average Rating of ""Hold"" by Brokerages - MarketBeat",MarketBeat
"Mon, 27 Oct 2025 22:54:41 GMT",Sterling Investment Management Opens New $3 Million Pepsi (NASDAQ: PEP) Position: Should Investors Buy Too? - sharewise.com,sharewise.com
"Mon, 27 Oct 2025 19:51:00 GMT",Sterling Investment Management Opens New $3 Million Pepsi (NASDAQ: PEP) Position: Should Investors Buy Too? - The Motley Fool,The Motley Fool
"Sun, 26 Oct 2025 19:56:28 GMT",How Unai Emery became Pep Guardiola’s kryptonite at Villa Park - The New York Times,The New York Times
"Mon, 27 Oct 2025 12:30:00 GMT","PepsiCo (NASDAQ: PEP) unveils CRP 2.0, adding 2 crops; Olam Agri and Bonsucro join - Stock Titan",Stock Titan
"Sun, 26 Oct 2025 18:48:00 GMT",Pep Guardiola sure Manchester City ‘still alive’ after latest loss at Aston Villa - The Guardian,The Guardian
"Mon, 27 Oct 2025 17:49:00 GMT","Rion Co., Ltd. Advances Clinical Study on PEP-TISSEEL for Chronic Radiation Ulcers - TipRanks",TipRanks
"Mon, 27 Oct 2025 22:39:09 GMT",Man City star echoes Pep Guardiola's verdict on Premier League title race - sportingnews.com,sportingnews.com
"Mon, 27 Oct 2025 10:01:54 GMT","First Command Advisory Services Inc. Reduces Stake in PepsiCo, Inc. $PEP - MarketBeat",MarketBeat
"Sat, 25 Oct 2025 21:30:13 GMT",Pep Guardiola: Lack of competition for places left Man City in a mess last season - The Athletic - The New York Times,The New York Times
"Mon, 27 Oct 2025 10:16:15 GMT","GoalVest Advisory LLC Reduces Stock Holdings in PepsiCo, Inc. $PEP - MarketBeat",MarketBeat
"Mon, 27 Oct 2025 15:32:50 GMT",MLB World Series: Max Scherzer's Pep Talk to Blue Jays Teammates - Al Bat,Al Bat
"Mon, 27 Oct 2025 10:16:15 GMT","Garland Capital Management Inc. Has $1.10 Million Holdings in PepsiCo, Inc. $PEP - MarketBeat",MarketBeat
"Sat, 25 Oct 2025 21:47:00 GMT",Pep warns Norway boss Haaland won't be rested - ESPN,ESPN
"Mon, 27 Oct 2025 11:07:40 GMT","PepsiCo, Inc. $PEP Position Boosted by Y Intercept Hong Kong Ltd - MarketBeat",MarketBeat
"Mon, 27 Oct 2025 11:26:08 GMT","SYM FINANCIAL Corp Increases Position in PepsiCo, Inc. $PEP - MarketBeat",MarketBeat
"Mon, 27 Oct 2025 11:07:04 GMT","Guinness Asset Management LTD Purchases 17,828 Shares of PepsiCo, Inc. $PEP - MarketBeat",MarketBeat
"Fri, 24 Oct 2025 15:15:00 GMT",PepsiCo (PEP) vs. Coca-Cola (KO): What's the Stronger Near-Term Buy? - Yahoo Finance,Yahoo Finance
"Mon, 27 Oct 2025 11:42:48 GMT",Teams Pep Guardiola has suffered the most defeats against as a manager - news.bet365.com,news.bet365.com
"Mon, 27 Oct 2025 10:26:03 GMT","Schmidt P J Investment Management Inc. Sells 2,097 Shares of PepsiCo, Inc. $PEP - MarketBeat",MarketBeat
"Tue, 28 Oct 2025 04:25:00 GMT",'We are still alive in title race': Pep despite City loss - Mid-day,Mid-day
"Sun, 26 Oct 2025 23:32:39 GMT",Is Pep's playing 'philosophy' the problem at Man City? - ESPN Singapore,ESPN Singapore
"Sun, 26 Oct 2025 02:27:18 GMT",No. 9 Water Polo Splits Doubleheader at Julian Fraser Tournament - Pepperdine University Athletics,Pepperdine University Athletics
"Mon, 27 Oct 2025 09:31:58 GMT","Envestnet Asset Management Inc. Lowers Stake in PepsiCo, Inc. $PEP - MarketBeat",MarketBeat
"Sun, 26 Oct 2025 19:38:11 GMT",Bridgeport celebrates Bulldogs football team with spirited pep rally - WTRF,WTRF
"Sun, 26 Oct 2025 19:47:32 GMT",Pep Guardiola addresses Erling Haaland injury fears after Man City striker's sickening collision with woodwork & admits 'our job is not to watch the title' after damaging Aston Villa defeat - Goal.com,Goal.com
"Mon, 27 Oct 2025 16:23:48 GMT",Revealed: Manchester City squad’s heartfelt Pep Guardiola chat that sparked resurgence - OneFootball,OneFootball
"Mon, 27 Oct 2025 09:17:10 GMT","Oppenheimer Asset Management Inc. Boosts Stock Holdings in PepsiCo, Inc. $PEP - MarketBeat",MarketBeat
"Mon, 27 Oct 2025 19:45:00 GMT",Pep Guardiola Offers Guarded Four-Word Erling Haaland Injury Update - FotMob,FotMob
"Sun, 26 Oct 2025 14:27:00 GMT","With a pep talk from Laube, UNH football team puts it all together - UnionLeader.com",UnionLeader.com
"Mon, 27 Oct 2025 10:46:05 GMT","Cobblestone Capital Advisors LLC NY Has $15.32 Million Stock Position in PepsiCo, Inc. $PEP - MarketBeat",MarketBeat
"Sat, 25 Oct 2025 21:30:46 GMT",Inside Man City's crisis talks among Pep Guardiola's leadership group that led to upturn fortunes - Daily Mail,Daily Mail
"Sun, 26 Oct 2025 13:30:38 GMT","Nisa Investment Advisors LLC Buys 52,075 Shares of PepsiCo, Inc. $PEP - MarketBeat",MarketBeat
"Sun, 26 Oct 2025 12:30:15 GMT","PepsiCo, Inc. $PEP Shares Bought by Saybrook Capital NC - MarketBeat",MarketBeat
"Sun, 26 Oct 2025 15:57:05 GMT",Pep Guardiola reaction — Manchester City boss speaks after loss at Aston Villa - Yahoo Sports,Yahoo Sports
"Sun, 26 Oct 2025 18:28:22 GMT",Pep Chavarria vs. Deportivo Alaves – Player props & odds to score a goal on October 26 - Pro Soccer Wire,Pro Soccer Wire
"Sun, 26 Oct 2025 11:31:12 GMT","Brighton Jones LLC Acquires 10,955 Shares of PepsiCo, Inc. $PEP - MarketBeat",MarketBeat
"Sun, 26 Oct 2025 18:12:16 GMT",Pep Guardiola makes Arsenal admission after Man City loss in honest Premier League title verdict - Football London,Football London
"Sun, 26 Oct 2025 10:32:11 GMT","Leavell Investment Management Inc. Trims Stock Position in PepsiCo, Inc. $PEP - MarketBeat",MarketBeat
"Mon, 27 Oct 2025 17:10:00 GMT",Daniel Farke’s chats with Jurgen Klopp and Pep Guardiola show 'appreciation' that could help Leeds - MOT Leeds News,MOT Leeds News
"Mon, 27 Oct 2025 21:30:26 GMT",Pep Guardiola divorce ‘imminent’ as Manchester City boss purchases new Barcelona home - City Xtra,City Xtra
"Sun, 26 Oct 2025 13:32:26 GMT","Wealthfront Advisers LLC Has $19.73 Million Position in PepsiCo, Inc. $PEP - MarketBeat",MarketBeat
"Sun, 26 Oct 2025 11:31:23 GMT","Interchange Capital Partners LLC Lowers Holdings in PepsiCo, Inc. $PEP - MarketBeat",MarketBeat
"Sun, 26 Oct 2025 11:30:30 GMT","Stegent Equity Advisors Inc. Buys Shares of 3,117 PepsiCo, Inc. $PEP - MarketBeat",MarketBeat
"Sun, 26 Oct 2025 20:30:31 GMT",Pep Guardiola not worried about chasing Arsenal for Premier League title - sportingnews.com,sportingnews.com
"Mon, 27 Oct 2025 11:27:00 GMT",What Pep Guardiola will do if Man City found guilty of 115 charges as 'hell could break loose' - The Mirror,The Mirror
"Mon, 27 Oct 2025 19:58:29 GMT","Meet the Cast of Shake, Rattle & Roll: Evil Origins - PEP.ph",PEP.ph
"Mon, 27 Oct 2025 00:08:00 GMT",Who needs a pep talk when Gemini on Speedy’s Pixel is there to help! #360withSpeedy - Yahoo,Yahoo
"Sat, 25 Oct 2025 14:37:52 GMT","Kornitzer Capital Management Inc. KS Increases Stock Holdings in PepsiCo, Inc. $PEP - MarketBeat",MarketBeat
"Mon, 27 Oct 2025 14:54:00 GMT",Khabib gave Tom Aspinall tactical pep talk before Ciryl Gane UFC fight - The Mirror,The Mirror
"Mon, 27 Oct 2025 20:21:38 GMT",K-Pop idols face off with Pinoy stars in basketball showdown - PEP.ph,PEP.ph
"Mon, 27 Oct 2025 17:26:15 GMT",Aspinall reveals Khabib pep talk ahead of UFC title defence - London Evening Standard,London Evening Standard
"Mon, 27 Oct 2025 16:32:51 GMT",Pep Guardiola issues ‘apology’ to national team coach over handling of Erling Haaland - City Xtra,City Xtra
"Mon, 27 Oct 2025 17:12:00 GMT",'The spirit in the second half was really hood': Pep Guardiola on Man City's performance vs Aston Villa - Tribuna.com,Tribuna.com
"Mon, 27 Oct 2025 01:10:04 GMT","Forget the pep talks, this is what real mentoring looks like - Elite Agent",Elite Agent
"Fri, 24 Oct 2025 21:58:38 GMT",Man City boss Pep Guardiola buys bachelor pad in Barcelona as he divorces wife of 30 years - The Sun,The Sun
"Sun, 26 Oct 2025 20:07:00 GMT",Pep Guardiola not worried that Manchester City have to chase down Arsenal - The Independent,The Independent
"Sun, 26 Oct 2025 17:45:04 GMT",Aston Villa 1-0 Man City: Erling Haaland fails to score as Pep Guardiola demands a 'step up' - BBC,BBC
"Mon, 27 Oct 2025 22:07:50 GMT",Aspinall reveals Khabib pep talk ahead of UFC title defence - MSN,MSN
"Sun, 26 Oct 2025 10:00:48 GMT","Glass Jacobson Investment Advisors llc Has $69,000 Stock Holdings in PepsiCo, Inc. $PEP - MarketBeat",MarketBeat
"Fri, 24 Oct 2025 16:00:28 GMT",Pep Guardiola makes Liverpool title promise as he sends clear message to pundits - Liverpool.com,Liverpool.com
"Sat, 25 Oct 2025 21:30:00 GMT","We’re a different team to last Villa trip, says Pep - Manchester City FC",Manchester City FC
"Mon, 27 Oct 2025 00:05:12 GMT",Pep says City must 'step up' to take goalscoring burden off Haaland - SportyTV App,SportyTV App
"Sun, 26 Oct 2025 19:54:24 GMT",Pep Guardiola addresses Erling Haaland injury fears after Man City striker's sickening collision with woodwork & admits 'our job is not to watch the title' after damaging Aston Villa defeat - Yahoo,Yahoo
"Mon, 27 Oct 2025 05:07:00 GMT","WATCH: Young weightlifter Pep Samantha Agosto shows huge potential in the sport with her first Batang Pinoy gold medal in General Santos City — the first step in emulating her father and coach, Southeast Asian Games bronze medalist Richard Pep Agosto. - facebook.com",facebook.com
"Mon, 27 Oct 2025 19:30:23 GMT",Manchester City defender warns rivals on ‘underestimating’ Pep Guardiola’s side in Premier League title race - City Xtra,City Xtra
"Fri, 24 Oct 2025 13:58:02 GMT",Pep Guardiola names the Manchester City star who can become 'one of the best' in the world - Daily Mail,Daily Mail
"Sun, 26 Oct 2025 00:44:57 GMT",Pep Guardiola warns Norway boss that Erling Haaland will not get much rest - Newswav,Newswav
"Mon, 27 Oct 2025 12:30:00 GMT",Pep Guardiola concedes Arsenal are now the team to beat in the title race - Just Arsenal News,Just Arsenal News
"Mon, 27 Oct 2025 09:22:25 GMT",Pep Guardiola concedes Arsenal are now the team to beat in the title race - OneFootball,OneFootball
"Sun, 26 Oct 2025 09:45:44 GMT",Pep Guardiola provides update on Rayan Aït-Nouri - OneFootball,OneFootball
"Sun, 26 Oct 2025 09:34:44 GMT",Pep Guardiola provides update on Rayan Aït-Nouri - Foot Africa,Foot Africa
"Sat, 25 Oct 2025 21:30:00 GMT",Pep Guardiola warns Norway boss that Erling Haaland will not get much rest - The Independent,The Independent
"Fri, 24 Oct 2025 11:40:00 GMT",Injury news: Pep on Nico and Khusanov fitness - Manchester City FC,Manchester City FC
"Sun, 26 Oct 2025 18:28:03 GMT",Pep Guardiola not worried that Manchester City have to chase down Arsenal - Newswav,Newswav
"Mon, 27 Oct 2025 03:00:00 GMT",Arsenal news: Pep Guardiola makes Gunners title prediction as vote made on captain - The Mirror,The Mirror
"Sun, 26 Oct 2025 17:05:00 GMT",'I was worried' - Pep Guardiola delivers Man City verdict as Arsenal open up title race advantage - Manchester Evening News,Manchester Evening News
"Sun, 26 Oct 2025 17:24:22 GMT",Pep Guardiola on Arsenal’s lead at the top of the Premier League and Man City’s loss to Aston Villa - hayters.com,hayters.com
"Mon, 27 Oct 2025 12:12:00 GMT",Pep Guardiola has already confirmed what he'd do if Man City found guilty of 115 charges - Manchester Evening News,Manchester Evening News
"Mon, 27 Oct 2025 06:34:41 GMT",Pep Guardiola praises former Arsenal man after Champions League clash - OneFootball,OneFootball
"Sun, 26 Oct 2025 21:45:00 GMT",Aston Villa silence their critics - and Pep Guardiola explains why Unai Emery should've never been doubted - Yahoo,Yahoo
"Mon, 27 Oct 2025 09:18:00 GMT",Man City boss Pep Guardiola makes Premier League title admission after Aston Villa loss - The Independent,The Independent
"Sat, 25 Oct 2025 09:41:49 GMT",Pep Guardiola makes major purchase with Man City boss divorcing wife after 30 years of marriage - GB News,GB News
"Mon, 27 Oct 2025 18:49:16 GMT",Pep Guardiola must learn from key mistake as Rodri returns to Man City training - Football Insider,Football Insider
"Fri, 24 Oct 2025 11:00:00 GMT",Pep on difficulty of Villa Park assignment - Manchester City FC,Manchester City FC
"Sun, 26 Oct 2025 18:58:00 GMT",Pep Guardiola makes telling Arsenal title admission after Man City defeat - The Mirror,The Mirror
"Sat, 25 Oct 2025 12:37:00 GMT",Pep Guardiola successor theory emerges over Man City exit clause - Manchester Evening News,Manchester Evening News
"Fri, 24 Oct 2025 15:15:00 GMT",PepsiCo (PEP) vs. Coca-Cola (KO): What's the Stronger Near-Term Buy? - sharewise.com,sharewise.com
"Mon, 27 Oct 2025 12:32:51 GMT",Pep Guardiola defends Manchester City performance in Aston Villa defeat despite glaring issues - City Xtra,City Xtra
2025-10-27T18:38:00,Coca-Cola Vs. PepsiCo: Which Beverage Giant is Poised for the Top Spot?,Yahoo
2025-10-27T13:48:00,Keurig Dr Pepper Stock Climbs After Earnings. It Woke Up and Smelled the Coffee.,Yahoo
2025-10-27T13:30:00,"PepsiCo, Alliance of Bioversity International, and CIAT Launch Major Update to Open-access Climate Resilience Platform to Accelerate Climate Adaptation",Yahoo
2025-10-24T17:15:00,PepsiCo (PEP) vs. Coca-Cola (KO): What's the Stronger Near-Term Buy?,Yahoo
2025-10-24T12:58:00,"United States Oats Forecast and Company Analysis Report 2025: A $2.92 Billion Market by 2033 Featuring General Mills, B&G Foods, Kellanova, Marico, PepsiCo, Nestle, Blue Lake Milling, Avena Foods",Yahoo
2025-10-23T11:50:00,"United States Cookies Market Report Forecast and Company Analysis 2025-2033 Featuring Mondelez, Ferrero, Campbell Soup, Mckee Foods, Grupo Bimbo, General Mills, PepsiCo, Meiji, Hostess Brands",Yahoo
2025-10-23T11:43:00,"United States Oatmeal Market Forecast and Company Analysis Report 2025-2033 Featuring PepsiCo, Nestle, Kellogg's, Hain Celestial, Marico, Unilever, Post, and General Mills",Yahoo
