Date,Title,Source
"Sun, 16 Nov 2025 03:34:21 GMT",Susquehanna Raises Qualcomm (QCOM) Price Target to $210 on Strong Handset Momentum - Finviz,Finviz
"Sun, 16 Nov 2025 03:43:14 GMT",Susquehanna Raises Qualcomm (QCOM) Price Target to $210 on Strong Handset Momentum - Insider Monkey,Insider Monkey
"Sat, 15 Nov 2025 22:56:02 GMT",Why QCOM stock is trending among retail traders - Earnings Performance Report & Low Volatility Stock Recommendations - newser.com,newser.com
"Fri, 14 Nov 2025 12:01:49 GMT",QCOM Expands Portfolio for Industrial PCs: Will It Boost Prospects? - Zacks Investment Research,Zacks Investment Research
"Sat, 15 Nov 2025 10:39:03 GMT",QUALCOMM (QCOM): Assessing Valuation After Recent 10% Share Price Gain - simplywall.st,simplywall.st
"Sat, 15 Nov 2025 14:39:17 GMT",QUALCOMM Incorporated $QCOM Shares Sold by Thoroughbred Financial Services LLC - MarketBeat,MarketBeat
"Fri, 14 Nov 2025 00:37:00 GMT","Fund Update: Appaloosa LP added 895,000 shares of QUALCOMM ($QCOM) to their portfolio - Quiver Quantitative",Quiver Quantitative
"Tue, 11 Nov 2025 23:15:39 GMT",How QUALCOMM’s (QCOM) AI Launches and Strong Guidance Could Reshape Its Long-Term Growth Path - Yahoo Finance,Yahoo Finance
"Sat, 15 Nov 2025 13:28:20 GMT",Fusion Capital LLC Raises Stake in QUALCOMM Incorporated $QCOM - MarketBeat,MarketBeat
"Sat, 15 Nov 2025 04:47:43 GMT",Live market analysis of QCOM - Earnings Summary Report & Free Community Consensus Stock Picks - newser.com,newser.com
"Fri, 14 Nov 2025 06:51:53 GMT",How Record Revenue Guidance and Buybacks at QUALCOMM (QCOM) Has Changed Its Investment Story - simplywall.st,simplywall.st
"Sat, 15 Nov 2025 11:55:49 GMT",Jupiter Asset Management Ltd. Lowers Stock Holdings in QUALCOMM Incorporated $QCOM - MarketBeat,MarketBeat
"Sat, 15 Nov 2025 09:51:58 GMT",Burling Wealth Partners LLC Cuts Stake in QUALCOMM Incorporated $QCOM - MarketBeat,MarketBeat
"Fri, 14 Nov 2025 12:50:18 GMT",QUALCOMM Incorporated $QCOM Shares Acquired by Oak Harvest Investment Services - MarketBeat,MarketBeat
"Fri, 14 Nov 2025 00:03:03 GMT",QUALCOMM (NASDAQ:QCOM) Stock Price Down 1.2% - Time to Sell? - MarketBeat,MarketBeat
"Fri, 14 Nov 2025 11:58:18 GMT","Impax Asset Management Group plc Purchases 44,597 Shares of QUALCOMM Incorporated $QCOM - MarketBeat",MarketBeat
"Fri, 14 Nov 2025 10:08:39 GMT",QUALCOMM Incorporated $QCOM Shares Sold by Banco Bilbao Vizcaya Argentaria S.A. - MarketBeat,MarketBeat
"Sat, 15 Nov 2025 21:35:20 GMT",Why QCOM stock is trending among retail traders - July 2025 Movers & Comprehensive Market Scan Insights - newser.com,newser.com
"Thu, 13 Nov 2025 13:48:37 GMT",PNC Financial Services Group Inc. Decreases Position in QUALCOMM Incorporated $QCOM - MarketBeat,MarketBeat
"Thu, 13 Nov 2025 10:02:34 GMT",Candriam S.C.A. Trims Holdings in QUALCOMM Incorporated $QCOM - MarketBeat,MarketBeat
"Thu, 13 Nov 2025 09:27:12 GMT",QUALCOMM Incorporated $QCOM Stake Lifted by Boston Partners - MarketBeat,MarketBeat
"Sat, 15 Nov 2025 10:20:42 GMT","Commonwealth of Pennsylvania Public School Empls Retrmt SYS Buys 16,164 Shares of QUALCOMM Incorporated $QCOM - MarketBeat",MarketBeat
"Thu, 13 Nov 2025 00:11:00 GMT",QUALCOMM (NASDAQ:QCOM) Trading Up 1.5% - Here's Why - MarketBeat,MarketBeat
"Thu, 13 Nov 2025 12:15:50 GMT",Is QCOM stock in correction or buying zone - July 2025 Trends & Technical Analysis for Trade Confirmation - newser.com,newser.com
"Wed, 12 Nov 2025 12:17:41 GMT","KBC Group NV Purchases 161,364 Shares of QUALCOMM Incorporated $QCOM - MarketBeat",MarketBeat
"Wed, 12 Nov 2025 13:13:47 GMT","Geode Capital Management LLC Sells 2,953,700 Shares of QUALCOMM Incorporated $QCOM - MarketBeat",MarketBeat
"Wed, 12 Nov 2025 09:48:53 GMT",Forsta AP Fonden Grows Position in QUALCOMM Incorporated $QCOM - MarketBeat,MarketBeat
"Fri, 14 Nov 2025 15:49:00 GMT","XLK, LRCX, QCOM, AMAT: Large Inflows Detected at ETF - Nasdaq",Nasdaq
"Wed, 12 Nov 2025 12:13:27 GMT",QUALCOMM Incorporated $QCOM Shares Sold by Mitsubishi UFJ Trust & Banking Corp - MarketBeat,MarketBeat
"Wed, 12 Nov 2025 11:51:35 GMT",National Pension Service Raises Holdings in QUALCOMM Incorporated $QCOM - MarketBeat,MarketBeat
"Fri, 14 Nov 2025 22:00:43 GMT",Should you wait for a breakout in QCOM - Market Sentiment Summary & Fast Momentum Stock Entry Tips - newser.com,newser.com
"Fri, 14 Nov 2025 18:51:08 GMT",Is QCOM still worth holding after the dip - Earnings Overview Summary & Short-Term Swing Trade Alerts - newser.com,newser.com
"Fri, 14 Nov 2025 14:22:02 GMT",(QCOM) Price Dynamics and Execution-Aware Positioning - news.stocktradersdaily.com,news.stocktradersdaily.com
"Wed, 12 Nov 2025 12:25:25 GMT",M&G PLC Has $124.38 Million Holdings in QUALCOMM Incorporated $QCOM - MarketBeat,MarketBeat
"Tue, 11 Nov 2025 23:42:36 GMT",QUALCOMM (NASDAQ:QCOM) Trading Up 1.4% - Here's Why - MarketBeat,MarketBeat
"Wed, 12 Nov 2025 10:03:24 GMT",Bailard Inc. Raises Stock Position in QUALCOMM Incorporated $QCOM - MarketBeat,MarketBeat
"Thu, 13 Nov 2025 14:04:49 GMT","Police & Firemen s Retirement System of New Jersey Purchases 4,172 Shares of QUALCOMM Incorporated $QCOM - MarketBeat",MarketBeat
"Wed, 12 Nov 2025 12:13:21 GMT",Ironwood Investment Counsel LLC Has $7.61 Million Stock Holdings in QUALCOMM Incorporated $QCOM - MarketBeat,MarketBeat
"Tue, 11 Nov 2025 09:49:59 GMT",QUALCOMM Incorporated $QCOM Shares Sold by Factory Mutual Insurance Co. - MarketBeat,MarketBeat
"Tue, 11 Nov 2025 10:50:18 GMT",QUALCOMM Incorporated $QCOM Stock Position Decreased by Vestmark Advisory Solutions Inc. - MarketBeat,MarketBeat
"Thu, 13 Nov 2025 16:24:13 GMT",Qualcomm (QCOM.US) has launched a new chipset for industrial computers. - 富途牛牛,富途牛牛
"Tue, 11 Nov 2025 12:12:01 GMT",Samalin Investment Counsel LLC Acquires New Position in QUALCOMM Incorporated $QCOM - MarketBeat,MarketBeat
"Tue, 11 Nov 2025 12:27:02 GMT",Robeco Schweiz AG Reduces Stake in QUALCOMM Incorporated $QCOM - MarketBeat,MarketBeat
"Tue, 11 Nov 2025 11:29:18 GMT","PFG Advisors Buys 1,475 Shares of QUALCOMM Incorporated $QCOM - MarketBeat",MarketBeat
"Tue, 11 Nov 2025 09:49:58 GMT",Fountainhead AM LLC Makes New Investment in QUALCOMM Incorporated $QCOM - MarketBeat,MarketBeat
"Tue, 11 Nov 2025 12:47:29 GMT",QUALCOMM Incorporated $QCOM Shares Sold by Leith Wheeler Investment Counsel Ltd. - MarketBeat,MarketBeat
"Tue, 11 Nov 2025 13:35:35 GMT",QUALCOMM Incorporated $QCOM Shares Sold by Zions Bancorporation National Association UT - MarketBeat,MarketBeat
"Sat, 15 Nov 2025 08:26:24 GMT",Why QCOM stock is trending among retail traders - Quarterly Trade Summary & Intraday High Probability Alerts - newser.com,newser.com
"Fri, 14 Nov 2025 18:31:33 GMT",Why QCOM stock is trending among retail traders - Market Volume Summary & Consistent Return Investment Signals - newser.com,newser.com
"Wed, 12 Nov 2025 10:07:17 GMT",What recovery options are there for QCOM - 2025 Volatility Report & Low Drawdown Trading Techniques - newser.com,newser.com
"Fri, 14 Nov 2025 12:01:28 GMT",BC network faces heat from qcom platforms as agents take up gig work - Business Standard,Business Standard
"Tue, 11 Nov 2025 10:47:35 GMT",Why QCOM stock is trending among retail traders - July 2025 Retail & Safe Capital Investment Plans - newser.com,newser.com
"Tue, 11 Nov 2025 14:44:48 GMT",QCOM Stock Earnings Review: Qualcomm’s AI Acceleration - CMC Markets,CMC Markets
"Sat, 15 Nov 2025 08:12:29 GMT",QUALCOMM (NASDAQ:QCOM) Upgraded to “Buy” at Wall Street Zen - Defense World,Defense World
"Thu, 13 Nov 2025 10:10:20 GMT",Allianz SE Boosts Stock Holdings in QUALCOMM Incorporated $QCOM - Defense World,Defense World
"Fri, 14 Nov 2025 08:22:10 GMT",Advisors Capital Management LLC Cuts Holdings in QUALCOMM Incorporated $QCOM - Defense World,Defense World
"Thu, 13 Nov 2025 19:37:12 GMT",ABN Amro Investment Solutions Purchases New Shares in QUALCOMM Incorporated $QCOM - Defense World,Defense World
"Thu, 13 Nov 2025 08:10:34 GMT",ABC Arbitrage SA Makes New Investment in QUALCOMM Incorporated $QCOM - Defense World,Defense World
"Tue, 11 Nov 2025 08:33:15 GMT","Allworth Financial LP Acquires 68,676 Shares of QUALCOMM Incorporated $QCOM - Defense World",Defense World
"Tue, 11 Nov 2025 09:15:17 GMT",Americana Partners LLC Boosts Stake in QUALCOMM Incorporated $QCOM - Defense World,Defense World
2025-11-16T04:21:50,Susquehanna Raises Qualcomm (QCOM) Price Target to $210 on Strong Handset Momentum,Yahoo
2025-11-15T15:30:37,This Critical AI Stock Is Now Building Factories in the U.S.,Yahoo
2025-11-14T13:47:00,QCOM Expands Portfolio for Industrial PCs: Will It Boost Prospects?,Yahoo
2025-11-12T00:15:39,How QUALCOMM’s (QCOM) AI Launches and Strong Guidance Could Reshape Its Long-Term Growth Path,Yahoo
