Date,Title,Source
2025-10-25T07:00:36Z,wmill-pg 1.566.1,Pypi.org
2025-10-25T01:56:08Z,testing-containers 0.3.1,Pypi.org
2025-10-25T01:48:40Z,testing-containers 0.3.0,Pypi.org
2025-10-25T00:48:33Z,testing-containers 0.2.0,Pypi.org
2025-10-25T00:48:28Z,testing-containers added to PyPI,Pypi.org
2025-10-24T19:48:43Z,wmill-pg 1.566.0,Pypi.org
2025-10-24T15:34:25Z,PG&E CEO sees no credit upgrades until California fire season ends,Biztoc.com
2025-10-24T13:22:11Z,"P&G beats profit estimates, halves expected annual tariff cost",Biztoc.com
2025-10-24T12:07:36Z,Morgan Stanley Raises PG&E (PCG) PT to $21 on Utilities’ Data Center Focus,Yahoo Entertainment
2025-10-24T11:42:04Z,How is PG&E Corporation (PCG) One of the Best Affordable Stocks to Buy Under $20?,Yahoo Entertainment
2025-10-24T11:20:03Z,Procter & Gamble beats earnings estimates but warns of higher costs from tariffs,Biztoc.com
2025-10-24T11:19:16Z,Procter & Gamble beats earnings estimates but warns of higher costs from tariffs,CNBC
2025-10-23T23:08:57Z,PG&E CEO Poppe Sees No Credit Upgrades Until Fire Season Ends,Biztoc.com
2025-10-23T22:27:15Z,"PG&E CEO Poppe on Earnings, Rates and AI Buildout",Yahoo Entertainment
2025-10-23T22:03:29Z,Youngster from Andhra Pradesh dies after inhaling insecticide in Bengaluru PG room,The Times of India
2025-10-23T15:00:14Z,"PG&E Tower, ‘Symbol of Environmental Racism,’ Removed From Bayview-Hunters Point",KQED
2025-10-23T11:53:09Z,PG&E 2026 profit forecast beats expectations amid strong power demand,Biztoc.com
2025-10-23T11:16:29Z,"65 days and counting: How legal battles, administrative gaps have delayed NEET PG counselling since 2019",The Indian Express
2025-10-23T10:46:23Z,PG&E Net Up on Higher Electricity Demand,Biztoc.com
2025-10-23T10:06:35Z,"PG&E sees FY26 core EPS $1.62-$1.66, consensus $1.63",Thefly.com
2025-10-23T10:02:51Z,"PG&E reports Q3 core EPS 50c, consensus 43c",Thefly.com
2025-10-23T00:00:00Z,Primordial germ cell specification and early developmental cell states in Pacific oyster,Biomedcentral.com
2025-10-22T23:24:33Z,Jim Cramer Makes Bold Revelation For PG&E Corporation (PCG) & AI Energy Shortage,Yahoo Entertainment
2025-10-22T18:14:41Z,wmill-pg 1.565.0,Pypi.org
2025-10-22T17:39:32Z,Magic PG Suggs (knee) set to return for opener,ESPN
"Sun, 26 Oct 2025 06:57:32 GMT",Will PG stock remain on Wall Street radar - Market Activity Report & Stepwise Entry and Exit Trade Signals - newser.com,newser.com
"Thu, 23 Oct 2025 03:02:00 GMT",Procter & Gamble (PG) Q3 Earnings Report Preview: What To Look For - Yahoo Finance,Yahoo Finance
"Sun, 26 Oct 2025 04:18:51 GMT",Decoding Procter & Gamble Co (PG): A Strategic SWOT Insight - GuruFocus,GuruFocus
"Sat, 25 Oct 2025 22:55:21 GMT",Jonny Fritz On Debbie Downers and PG Tips: 13th Floor MusicTalk Interview - 13thfloor.co.nz,13thfloor.co.nz
"Sun, 26 Oct 2025 06:05:20 GMT","PG County Firefighter Arrested, Charged With Possessing, Distributing Child Pornography: Police - AOL.com",AOL.com
"Sat, 25 Oct 2025 20:01:35 GMT",Mavericks’ ugly start creates questions about team’s depth at PG without Kyrie Irving - Dallas News,Dallas News
"Sat, 25 Oct 2025 12:35:31 GMT","P&G (PG) Net Margin Rises to 18.6%, Reinforcing Steady-Growth Narrative - simplywall.st",simplywall.st
"Sat, 25 Oct 2025 20:53:47 GMT",When will PG Jackson Shelstad return to Oregon men's basketball? Who fills in until then? - MSN,MSN
"Thu, 23 Oct 2025 12:51:20 GMT",Meta launches PG-13 settings for Instagram Teen Accounts - Mashable,Mashable
"Thu, 23 Oct 2025 14:54:53 GMT",18U PG WWBA Jupiter: New England’s 9 all-tournament selections - New England Baseball Journal,New England Baseball Journal
"Sun, 26 Oct 2025 05:36:08 GMT",Will PG stock remain on Wall Street radar - New Guidance & Verified Swing Trading Watchlist - newser.com,newser.com
"Sat, 25 Oct 2025 10:13:44 GMT","P&G (PG) Net Margin Rises, Reinforcing Narrative of Consistency Despite Slower Growth Outlook - Yahoo Finance",Yahoo Finance
"Fri, 24 Oct 2025 11:23:17 GMT",Procter & Gamble’s (NYSE:PG) Q3 Sales Beat Estimates - Yahoo Finance,Yahoo Finance
"Sat, 25 Oct 2025 18:37:01 GMT",Is PG stock in buy zone after pullback - July 2025 Drop Watch & Real-Time Volume Analysis - newser.com,newser.com
"Sun, 26 Oct 2025 01:00:02 GMT",How higher bond yields impact PG stock - Long Setup & Fast Entry and Exit Trade Plans - newser.com,newser.com
"Sat, 25 Oct 2025 05:31:00 GMT",PG Q3 Deep Dive: Innovation and Restructuring Shape Outlook Amid Flat Market Reaction - Yahoo,Yahoo
"Sun, 26 Oct 2025 03:50:07 GMT",Will PG stock remain on Wall Street radar - 2025 Biggest Moves & Weekly Watchlist for Hot Stocks - newser.com,newser.com
"Fri, 24 Oct 2025 09:20:55 GMT",Louisville basketball freshman PG Mikel Brown Jr. ready to meet the moment with Pat Kelsey - The Courier-Journal,The Courier-Journal
"Fri, 24 Oct 2025 13:02:10 GMT","4 stocks to watch on Friday: TGT, PG, VLO, GD - Seeking Alpha",Seeking Alpha
"Fri, 24 Oct 2025 11:24:50 GMT",PG Earnings: All you need to know about Procter & Gamble’s Q1 2026 earnings results - AlphaStreet,AlphaStreet
"Fri, 24 Oct 2025 16:48:02 GMT",WSU basketball: Kamie Ethridge says watch out for transfer PG Kenz Chatfield - 247Sports,247Sports
"Sat, 25 Oct 2025 11:59:42 GMT",Four-star PG Lucas Morillo commits to Illinois basketball - Tar Heel Times,Tar Heel Times
"Fri, 24 Oct 2025 22:41:24 GMT",How higher bond yields impact PG stock - 2025 Market Overview & Real-Time Volume Analysis Alerts - newser.com,newser.com
"Fri, 24 Oct 2025 13:30:03 GMT",P&G (PG) Q1 Earnings: Taking a Look at Key Metrics Versus Estimates - Yahoo,Yahoo
"Wed, 22 Oct 2025 13:30:03 GMT",Brokers Suggest Investing in P&G (PG): Read This Before Placing a Bet - Yahoo Finance,Yahoo Finance
"Fri, 24 Oct 2025 11:58:42 GMT",PG Earnings: Procter & Gamble Stock Jumps on a Fiscal Q1 Earnings Beat - TipRanks,TipRanks
"Fri, 24 Oct 2025 13:30:00 GMT",P&G (PG) Q1 Earnings: Taking a Look at Key Metrics Versus Estimates - Nasdaq,Nasdaq
"Fri, 24 Oct 2025 11:00:01 GMT",New York Knicks’ Tyler Kolek Fighting Off Backup PG Trade Threat - Sports Illustrated,Sports Illustrated
"Fri, 24 Oct 2025 15:42:00 GMT","Five-Star PG Deron Rippey Recaps Duke Visit, Blue Devils Pitch Development and Fit - 247Sports",247Sports
"Wed, 22 Oct 2025 17:19:00 GMT",Magic PG Suggs (knee) set to return for opener - ESPN,ESPN
"Wed, 22 Oct 2025 20:10:50 GMT",Why Kansas State coach Jerome Tang isn't afraid to call PJ Haggerty 'the best PG in America' - The Topeka Capital-Journal,The Topeka Capital-Journal
"Fri, 24 Oct 2025 19:58:00 GMT","Notable Friday Option Activity: PG, ALB, UNP - Nasdaq",Nasdaq
"Sat, 25 Oct 2025 20:10:32 GMT","PG County Firefighter Arrested, Charged With Possessing, Distributing Child Pornography: Police - dailyvoice.com",dailyvoice.com
"Sat, 25 Oct 2025 16:29:15 GMT","Procter & Gamble (NYSE:PG) Issues Quarterly Earnings Results, Beats Expectations By $0.09 EPS - MarketBeat",MarketBeat
"Thu, 23 Oct 2025 22:03:00 GMT",Bengaluru tragedy: Andhra Pradesh BTech graduate dies after inhaling insecticide fumes at PG room - Times of India,Times of India
"Thu, 23 Oct 2025 19:13:19 GMT",Faults and fluids activity controlled structural heterogeneity in the upper crust beneath the Xiaojiang fault system revealed from 2D Pg seismic tomography - Oxford Academic,Oxford Academic
"Sat, 25 Oct 2025 06:37:23 GMT",Kansas' Darryn Peterson gives Louisville PG Mikel Brown Jr. something to shoot for - The Courier-Journal,The Courier-Journal
"Fri, 24 Oct 2025 15:47:25 GMT","4-star PG Jason Gardner Jr on where things stand with Indiana, Purdue, Notre Dame & more - On3",On3
"Fri, 24 Oct 2025 18:11:03 GMT",Four-star PG Lucas Morillo commits to Illinois - On3,On3
"Sat, 25 Oct 2025 05:31:00 GMT",PG Q3 Deep Dive: Innovation and Restructuring Shape Outlook Amid Flat Market Reaction - TradingView,TradingView
"Tue, 21 Oct 2025 20:29:18 GMT",18U PG WWBA Jupiter: 20 prospects who threw at least 90 mph - New England Baseball Journal,New England Baseball Journal
"Sat, 25 Oct 2025 10:05:09 GMT",Carnegie Investment Counsel Grows Position in Procter & Gamble Company (The) $PG - MarketBeat,MarketBeat
"Sat, 25 Oct 2025 09:15:11 GMT",Paul Pierce Urges Spurs To Trade Injured Star PG Amid Rise Of Young Guards - sportingnews.com,sportingnews.com
"Tue, 21 Oct 2025 10:09:50 GMT",Detectives Seek Answers In Deadly PG County Shooting; $25K Reward Offered - The BayNet,The BayNet
"Sat, 25 Oct 2025 02:22:41 GMT",Procter & Gamble (PG) Q1 Earnings and Revenues Top Estimates - sharewise.com,sharewise.com
"Tue, 21 Oct 2025 18:45:00 GMT",Instagram keeps flubbing on teen safety. Will its new ‘PG-13’ guidelines make a difference? | Tayo Bero - The Guardian,The Guardian
"Sat, 25 Oct 2025 12:14:32 GMT",The Procter & Gamble Company (NYSE:PG) Q1 2026 Earnings Call Transcript - Insider Monkey,Insider Monkey
"Fri, 24 Oct 2025 11:45:36 GMT",RBC Capital Keeps Their Buy Rating on Procter & Gamble (PG) - The Globe and Mail,The Globe and Mail
"Fri, 24 Oct 2025 19:59:23 GMT",Four-Star PG Recruit Praises Iowa's Ben McCollum - Sports Illustrated,Sports Illustrated
"Fri, 24 Oct 2025 09:13:30 GMT",Louisville basketball freshman PG Mikel Brown Jr. ready to meet the moment with Pat Kelsey - Treasure Coast News,Treasure Coast News
"Fri, 24 Oct 2025 12:55:11 GMT",Procter & Gamble Company (The) $PG Shares Sold by GLOBALT Investments LLC GA - MarketBeat,MarketBeat
"Fri, 24 Oct 2025 07:44:20 GMT","""I don't like Amen Thompson as a point guard for 48 minutes"" - Tim Hardaway Sr. thinks the Rockets need a veteran PG - Basketball Network",Basketball Network
"Wed, 22 Oct 2025 16:03:52 GMT","SA analyst upgrades/downgrades: AMD, PG, GIS, EXEL (SP500:) (PG:NYSE) - Seeking Alpha",Seeking Alpha
"Fri, 24 Oct 2025 18:18:19 GMT",Jason Kidd’s Cooper Flagg-Mavericks PG experiment continues to draw backlash - ClutchPoints,ClutchPoints
"Fri, 24 Oct 2025 13:53:58 GMT",Procter & Gamble Company (The) $PG Shares Purchased by Sumitomo Mitsui Trust Group Inc. - MarketBeat,MarketBeat
"Thu, 23 Oct 2025 10:06:36 GMT","PG E earnings beat by $0.07, revenue fell short of estimates - Investing.com",Investing.com
"Wed, 22 Oct 2025 15:11:09 GMT",‘Predator: Badlands’ Is Now Officially Rated PG-13 for “Strong Sci-fi Violence” - Bloody Disgusting,Bloody Disgusting
"Tue, 21 Oct 2025 15:15:03 GMT",Instagram is going PG-13. Will that make a difference for teens? - Tech Xplore,Tech Xplore
"Fri, 24 Oct 2025 14:47:00 GMT","Noteworthy ETF Inflows: XLP, PG, MDLZ, MO - Nasdaq",Nasdaq
"Fri, 24 Oct 2025 12:23:02 GMT",Procter & Gamble Company (The) $PG Stake Reduced by Asset Management One Co. Ltd. - MarketBeat,MarketBeat
"Fri, 24 Oct 2025 11:03:32 GMT",Procter & Gamble (PG) Tops Q1 EPS by 9c; maintains guidance - StreetInsider,StreetInsider
"Fri, 24 Oct 2025 10:04:09 GMT","Dow Futures Rise Ahead Of Highly Awaited Inflation Data: INTC, F, PG, NEM Among Stocks To Watch - Stocktwits",Stocktwits
"Fri, 24 Oct 2025 16:04:56 GMT",‘Heaven Really Gained An Angel’: PG County Mom’s Legacy Lives On Through Her Son - AOL.com,AOL.com
"Wed, 22 Oct 2025 22:53:29 GMT",Nets' Danny Wolf (ankle) out vs. Hornets; Ben Saraf starts at PG - Nets Wire,Nets Wire
"Fri, 24 Oct 2025 11:01:33 GMT","Tennessee Basketball hosting 5-star PG, 4-star SG for huge recruiting weekend - On3",On3
"Fri, 24 Oct 2025 13:23:09 GMT","4 stocks to watch on Friday: TGT, PG, VLO, GD - MSN",MSN
"Thu, 23 Oct 2025 01:00:00 GMT",Suns PG Jalen Green’s Game Status Revealed Prior to Kings Matchup - Yahoo Sports,Yahoo Sports
"Fri, 24 Oct 2025 22:29:20 GMT",When will PG Jackson Shelstad return to Oregon men's basketball? Who fills in until then? - The Register-Guard,The Register-Guard
"Thu, 23 Oct 2025 12:25:10 GMT",Procter & Gamble Company (The) $PG Shares Sold by Strategic Blueprint LLC - MarketBeat,MarketBeat
"Fri, 24 Oct 2025 12:39:04 GMT",Procter & Gamble (NYSE:PG) Updates FY 2026 Earnings Guidance - MarketBeat,MarketBeat
"Thu, 23 Oct 2025 10:45:33 GMT",Procter & Gamble Company (The) $PG Shares Sold by Denali Advisors LLC - MarketBeat,MarketBeat
"Wed, 22 Oct 2025 23:58:30 GMT",Why Make Predator: Badlands PG-13? - JoBlo,JoBlo
"Fri, 24 Oct 2025 09:29:33 GMT",Procter & Gamble (PG) Faces Earnings – What To Expect - AskTraders.com,AskTraders.com
"Wed, 22 Oct 2025 14:01:33 GMT",Procter & Gamble Company (The) $PG Shares Purchased by Caliber Wealth Management LLC KS - MarketBeat,MarketBeat
"Tue, 21 Oct 2025 21:35:15 GMT",Embiid not on injury report for opener; PG officially ruled out - Liberty Ballers,Liberty Ballers
"Wed, 22 Oct 2025 02:49:08 GMT",Instagram says it’s safeguarding teens by limiting them to PG-13 content - KMIT 105.9 FM,KMIT 105.9 FM
"Fri, 24 Oct 2025 12:30:00 GMT",P&G (PG) Q1 2026 Earnings Call Transcript - The Globe and Mail,The Globe and Mail
"Sat, 25 Oct 2025 05:00:00 GMT",PG Spruce Kings lose 6-2 to Chilliwack Chiefs in BCHL - Prince George Citizen,Prince George Citizen
"Fri, 24 Oct 2025 00:14:13 GMT",Jason Kidd won’t shy away from Mavericks’ jumbo starting lineup with Cooper Flagg at PG - Dallas News,Dallas News
"Tue, 21 Oct 2025 21:05:00 GMT",PG Peyton Kemp talks Rutgers Basketball offer and weekend visit - 247Sports,247Sports
"Thu, 23 Oct 2025 11:35:37 GMT",Former Michigan State PG Tre Holloman getting chance to prove himself at NC State - On3,On3
"Sat, 25 Oct 2025 10:35:51 GMT",NEET PG 2025 Counselling: MCC Invites Applications For NRI Conversion - NDTV,NDTV
"Tue, 21 Oct 2025 10:06:22 GMT",JPMorgan Reduces PT on The Procter & Gamble Company (PG) Stock - Insider Monkey,Insider Monkey
"Fri, 24 Oct 2025 15:52:29 GMT",William Blair Maintains Procter & Gamble(PG.US) With Hold Rating - 富途牛牛,富途牛牛
2025-10-24T15:07:37,The Procter & Gamble Company (PG) Q1 2026 Earnings Call Transcript,SeekingAlpha
2025-10-23T05:02:10,Procter & Gamble (PG) Q3 Earnings Report Preview: What To Look For,Yahoo
2025-10-22T15:30:03,Brokers Suggest Investing in P&G (PG): Read This Before Placing a Bet,Yahoo
2025-10-22T15:12:19,Colgate-Palmolive: 2 Reasons Why The Share Price Drop Has Gone Too Far (Upgrade),SeekingAlpha
2025-10-22T11:20:16,Jim Cramer on Procter & Gamble: “You’ll Want to Own the Stock Ahead of Time”,Yahoo
2025-10-21T18:58:00,Here's How Procter & Gamble Looks Ahead of Q1 Earnings Release,Yahoo
2025-10-21T02:08:26,Raymond James Maintains Procter & Gamble (PG) Outperform Recommendation,Fintel
2025-10-24T21:36:50,30k into PG. Hasn’t done shit for 3 years.  52 week low,Reddit/r/wallstreetbets
2025-10-24T15:49:01,PG Q4 2025 Earnings Call | Live Transcript,Reddit/r/wallstreetbets
