Date,Title,Source
2025-10-15T14:40:48Z,HSBC Gives Lam Research (LRCX) Hold Rating,Biztoc.com
2025-10-15T14:20:15Z,HSBC Gives Lam Research (LRCX) Hold Rating,Yahoo Entertainment
2025-10-13T13:43:37Z,Lam Research (LRCX) Announces Breakthrough in Advanced Packaging Etch Technology,Yahoo Entertainment
2025-10-13T12:40:57Z,Heartland Mid Cap Value Fund: A Standout Quality Value Holding is Lam Research (LRCX),Biztoc.com
2025-10-13T12:19:52Z,Heartland Mid Cap Value Fund: A Standout Quality Value Holding is Lam Research (LRCX),Yahoo Entertainment
2025-10-12T07:40:35Z,Lam Research: A Key Enabler Of AI And HPC Growth With More Upside Ahead,Biztoc.com
"Thu, 16 Oct 2025 18:05:00 GMT",Mizuho Maintains Lam Research (LRCX) Outperform Recommendation - Nasdaq,Nasdaq
"Fri, 17 Oct 2025 04:47:11 GMT",How high can LRCX stock go - Quarterly Trade Report & Breakout Confirmation Alerts - newser.com,newser.com
"Thu, 16 Oct 2025 23:08:44 GMT",Lam Research (LRCX) Falls More Steeply Than Broader Market: What Investors Need to Know - sharewise.com,sharewise.com
"Wed, 15 Oct 2025 14:00:19 GMT",Lam Research (LRCX) Earnings Expected to Grow: What to Know Ahead of Next Week's Release - Yahoo Finance,Yahoo Finance
"Thu, 16 Oct 2025 13:44:25 GMT",Mizuho Raises Lam Research (LRCX) Price Target to $162 | LRCX St - GuruFocus,GuruFocus
"Wed, 15 Oct 2025 18:01:20 GMT","Lam Research (LRCX) Stock Is Up, What You Need To Know - TradingView",TradingView
"Tue, 14 Oct 2025 15:48:06 GMT","Vahedi, Lam Research SVP, sells $7.2 million in LRCX stock - Investing.com",Investing.com
"Mon, 13 Oct 2025 09:37:28 GMT",Lam Research: Priced For Perfection (NASDAQ:LRCX) - Seeking Alpha,Seeking Alpha
"Tue, 14 Oct 2025 15:45:00 GMT","Insider Sale: Senior Vice President of $LRCX Sells 52,190 Shares - Quiver Quantitative",Quiver Quantitative
"Wed, 15 Oct 2025 14:27:49 GMT",HSBC Gives Lam Research (LRCX) Hold Rating - Insider Monkey,Insider Monkey
"Thu, 16 Oct 2025 09:55:39 GMT",Callahan Advisors LLC Acquires New Position in Lam Research Corporation $LRCX - MarketBeat,MarketBeat
"Fri, 17 Oct 2025 05:57:12 GMT",Can LRCX hit a new high this month - Bull Run & Free Safe Entry Trade Signal Reports - newser.com,newser.com
"Wed, 15 Oct 2025 14:20:15 GMT",HSBC Gives Lam Research (LRCX) Hold Rating - Yahoo Finance,Yahoo Finance
"Mon, 13 Oct 2025 20:41:25 GMT","Lam Research (LRCX) Stock Is Up, What You Need To Know - TradingView",TradingView
"Fri, 17 Oct 2025 04:24:13 GMT",Can LRCX hit a new high this month - Quarterly Earnings Report & Weekly Sector Rotation Insights - newser.com,newser.com
"Mon, 13 Oct 2025 13:43:37 GMT",Lam Research (LRCX) Announces Breakthrough in Advanced Packaging Etch Technology - Yahoo Finance,Yahoo Finance
"Wed, 15 Oct 2025 09:18:46 GMT",Morningstar Investment Management LLC Takes Position in Lam Research Corporation $LRCX - MarketBeat,MarketBeat
"Tue, 14 Oct 2025 13:35:02 GMT",Lam Research (LRCX) Just Overtook the 20-Day Moving Average - Yahoo,Yahoo
"Tue, 14 Oct 2025 13:30:02 GMT",Why Lam Research (LRCX) is a Top Stock for the Long-Term - Yahoo,Yahoo
"Tue, 14 Oct 2025 13:00:49 GMT",Lam Research (LRCX) Just Overtook the 20-Day Moving Average - Zacks Investment Research,Zacks Investment Research
"Thu, 16 Oct 2025 09:35:37 GMT",Interchange Capital Partners LLC Trims Stock Holdings in Lam Research Corporation $LRCX - MarketBeat,MarketBeat
"Thu, 16 Oct 2025 10:33:43 GMT",Lam Research Corporation $LRCX Shares Acquired by Turtle Creek Wealth Advisors LLC - MarketBeat,MarketBeat
"Mon, 13 Oct 2025 16:20:00 GMT",New Analyst Forecast: $LRCX Given $135.0 Price Target - Quiver Quantitative,Quiver Quantitative
"Tue, 14 Oct 2025 13:36:17 GMT","Lam Research (NASDAQ:LRCX) Stock Price Expected to Rise, TD Cowen Analyst Says - MarketBeat",MarketBeat
"Wed, 15 Oct 2025 23:04:01 GMT",Trading Systems Reacting to (LRCX) Volatility - news.stocktradersdaily.com,news.stocktradersdaily.com
"Wed, 15 Oct 2025 10:15:08 GMT","Sterling Financial Planning Inc. Takes $216,000 Position in Lam Research Corporation $LRCX - MarketBeat",MarketBeat
"Tue, 14 Oct 2025 13:36:19 GMT",Cantor Fitzgerald Increases Lam Research (NASDAQ:LRCX) Price Target to $170.00 - MarketBeat,MarketBeat
"Tue, 14 Oct 2025 11:38:50 GMT",Lam Research Corporation $LRCX Shares Acquired by TD Asset Management Inc - MarketBeat,MarketBeat
"Tue, 14 Oct 2025 17:29:21 GMT","Insider Selling: Lam Research (NASDAQ:LRCX) SVP Sells 52,190 Shares of Stock - MarketBeat",MarketBeat
"Tue, 14 Oct 2025 09:47:51 GMT",NorthRock Partners LLC Reduces Position in Lam Research Corporation $LRCX - MarketBeat,MarketBeat
"Wed, 15 Oct 2025 19:31:00 GMT","Mizuho Securities Maintains Lam Research(LRCX.US) With Buy Rating, Announces Target Price $162 - 富途牛牛",富途牛牛
"Tue, 14 Oct 2025 09:31:43 GMT","Atria Wealth Solutions Inc. Sells 33,104 Shares of Lam Research Corporation $LRCX - MarketBeat",MarketBeat
"Mon, 13 Oct 2025 10:00:52 GMT",Vest Financial LLC Raises Stock Holdings in Lam Research Corporation $LRCX - MarketBeat,MarketBeat
"Tue, 14 Oct 2025 13:36:19 GMT",Lam Research (NASDAQ:LRCX) Given New $150.00 Price Target at Rothschild & Co Redburn - MarketBeat,MarketBeat
"Mon, 13 Oct 2025 16:56:35 GMT",LRCX Stock: Stifel Raises Price Target to $135 with Buy Rating | - GuruFocus,GuruFocus
"Mon, 13 Oct 2025 12:19:52 GMT",Heartland Mid Cap Value Fund: A Standout Quality Value Holding is Lam Research (LRCX) - Yahoo,Yahoo
"Mon, 13 Oct 2025 09:22:39 GMT",Lam Research Corporation $LRCX Shares Bought by Cypress Capital Group - MarketBeat,MarketBeat
"Mon, 13 Oct 2025 08:50:14 GMT",Lam Research Corporation $LRCX Shares Sold by Blair William & Co. IL - MarketBeat,MarketBeat
"Mon, 13 Oct 2025 09:02:35 GMT",Lam Research Corporation $LRCX Shares Purchased by Apollon Wealth Management LLC - MarketBeat,MarketBeat
"Sun, 12 Oct 2025 08:23:24 GMT",Lam Research Corporation $LRCX Shares Acquired by Callan Family Office LLC - MarketBeat,MarketBeat
"Sun, 12 Oct 2025 10:21:23 GMT",Means Investment CO. Inc. Reduces Stock Position in Lam Research Corporation $LRCX - MarketBeat,MarketBeat
"Mon, 13 Oct 2025 12:24:20 GMT",Lam Research (LRCX) PT Raised to $135 at Stifel on HBM & Advanced Foundry Growth - StreetInsider,StreetInsider
"Sun, 12 Oct 2025 08:13:27 GMT","Cyndeo Wealth Partners LLC Invests $295,000 in Lam Research Corporation $LRCX - MarketBeat",MarketBeat
"Wed, 15 Oct 2025 11:51:29 GMT","Vahedi, Lam Research SVP, sells $7.2 million in LRCX stock By Investing.com - Investing.com Australia",Investing.com Australia
"Sun, 12 Oct 2025 13:03:06 GMT",What analysts say about LRCX stock - Insider Trading Compliance & Affordable Trading Portfolio - earlytimes.in,earlytimes.in
"Thu, 16 Oct 2025 07:05:17 GMT",Cantor Fitzgerald Forecasts Strong Price Appreciation for Lam Research (NASDAQ:LRCX) Stock - Defense World,Defense World
"Thu, 16 Oct 2025 07:05:06 GMT",Rothschild & Co Redburn Forecasts Strong Price Appreciation for Lam Research (NASDAQ:LRCX) Stock - Defense World,Defense World
"Wed, 15 Oct 2025 05:57:41 GMT",TD Cowen Forecasts Strong Price Appreciation for Lam Research (NASDAQ:LRCX) Stock - Defense World,Defense World
"Wed, 15 Oct 2025 06:39:23 GMT",Lam Research (LRCX) Projected to Post Earnings on Wednesday - Defense World,Defense World
2025-10-16T23:50:04,Lam Research (LRCX) Falls More Steeply Than Broader Market: What Investors Need to Know,Yahoo
2025-10-15T20:01:20,"Lam Research (LRCX) Stock Is Up, What You Need To Know",Yahoo
2025-10-15T16:20:15,HSBC Gives Lam Research (LRCX) Hold Rating,Yahoo
2025-10-15T16:00:19,Lam Research (LRCX) Earnings Expected to Grow: What to Know Ahead of Next Week's Release,Yahoo
2025-10-14T15:35:02,Lam Research (LRCX) Just Overtook the 20-Day Moving Average,Yahoo
2025-10-14T15:30:02,Why Lam Research (LRCX) is a Top Stock for the Long-Term,Yahoo
2025-10-13T15:43:37,Lam Research (LRCX) Announces Breakthrough in Advanced Packaging Etch Technology,Yahoo
2025-10-13T14:19:52,Heartland Mid Cap Value Fund: A Standout Quality Value Holding is Lam Research (LRCX),Yahoo
2025-10-13T07:37:28,Lam Research: Priced For Perfection,SeekingAlpha
