Date,Title,Source
2025-09-26T14:16:53Z,Heartland Opportunistic Value Equity Strategy Initiated a Position in Applied Materials (AMAT) in Q2,Biztoc.com
2025-09-26T12:53:55Z,Jim Cramer Explains Morgan Stanley’s Coverage Of Applied Materials (AMAT),Yahoo Entertainment
2025-09-26T05:20:55Z,KeyCorp Lowers Earnings Estimates for Applied Materials,ETF Daily News
2025-09-25T07:04:42Z,KeyCorp Forecasts Strong Price Appreciation for Applied Materials (NASDAQ:AMAT) Stock,ETF Daily News
2025-09-25T05:42:54Z,"Applied Materials, Inc. (NASDAQ:AMAT) Receives $192.92 Consensus Price Target from Analysts",ETF Daily News
"Mon, 29 Sep 2025 11:20:28 GMT",Applied Materials rises as it discloses new $2B credit facility (AMAT:NASDAQ) - Seeking Alpha,Seeking Alpha
"Mon, 29 Sep 2025 16:18:45 GMT",Luis Amat Obituary and Online Memorial (2025) - Legacy.com,Legacy.com
"Sun, 28 Sep 2025 13:06:06 GMT","Subdued Growth No Barrier To Applied Materials, Inc. (NASDAQ:AMAT) With Shares Advancing 27% - simplywall.st",simplywall.st
"Fri, 26 Sep 2025 12:53:55 GMT",Jim Cramer Explains Morgan Stanley’s Coverage Of Applied Materials (AMAT) - Yahoo Finance,Yahoo Finance
"Sat, 27 Sep 2025 20:02:46 GMT",Key facts: Applied Materials (AMAT) rose over 2% on Friday as reports emerged about a new U.S. plan to cut reliance on foreign chips and enhance domestic production. - TradingView,TradingView
"Sun, 28 Sep 2025 15:02:22 GMT",Volleyball Recap: Bishop Amat Comes Up Short - MaxPreps.com,MaxPreps.com
"Sat, 27 Sep 2025 01:32:03 GMT",Applied Materials (AMAT) Surpasses Market Returns: Some Facts Worth Knowing - sharewise.com,sharewise.com
"Fri, 26 Sep 2025 13:28:15 GMT",Heartland Opportunistic Value Equity Strategy Initiated a Position in Applied Materials (AMAT) in Q2 - Yahoo Finance,Yahoo Finance
"Sun, 28 Sep 2025 12:00:07 GMT",Volleyball Recap: Bishop Amat Takes a Loss - MaxPreps.com,MaxPreps.com
"Sun, 28 Sep 2025 19:43:30 GMT",Flag Football Recap: Bishop Amat Comes Up Short - MaxPreps.com,MaxPreps.com
"Sun, 28 Sep 2025 19:50:35 GMT",Flag Football Recap: Notre Dame (SO) Beats Bishop Amat for Their Tenth Straight Victory - MaxPreps.com,MaxPreps.com
"Sun, 28 Sep 2025 09:08:58 GMT",Volleyball Recap: Bishop Amat Triumphs - MaxPreps.com,MaxPreps.com
"Sun, 28 Sep 2025 11:29:22 GMT",Volleyball Recap: Bishop Amat Takes a Loss - MaxPreps.com,MaxPreps.com
"Sun, 28 Sep 2025 11:35:42 GMT",Volleyball Recap: Bishop Amat Snags 15th Victory in Last 18 Games - MaxPreps.com,MaxPreps.com
"Sun, 28 Sep 2025 06:56:05 GMT",Volleyball Recap: Bishop Amat Find Success - MaxPreps.com,MaxPreps.com
"Sat, 27 Sep 2025 15:24:23 GMT",Volleyball Game Preview: Bishop Amat Lancers vs. Saint Joseph Jesters - MaxPreps.com,MaxPreps.com
"Sat, 27 Sep 2025 15:28:44 GMT",Volleyball Game Preview: Saint Joseph Jesters vs. Bishop Amat Lancers - MaxPreps.com,MaxPreps.com
"Sat, 27 Sep 2025 08:27:11 GMT",Flag Football Recap: Bishop Amat Takes a Loss - MaxPreps.com,MaxPreps.com
"Thu, 25 Sep 2025 15:07:00 GMT","QQQI, LRCX, TXN, AMAT: Large Inflows Detected at ETF - Nasdaq",Nasdaq
"Fri, 26 Sep 2025 07:00:00 GMT",Flag Football Game Preview: Bishop Amat Lancers vs. Ramona Convent Tigers - MaxPreps.com,MaxPreps.com
"Fri, 26 Sep 2025 07:00:00 GMT",Flag Football Game Preview: Ramona Convent Tigers vs. Bishop Amat Lancers - MaxPreps.com,MaxPreps.com
"Mon, 29 Sep 2025 19:18:06 GMT",Applying chart zones and confluence areas to AMAT - Trade Ideas & Low Risk Investment Opportunities - newser.com,newser.com
"Mon, 29 Sep 2025 11:04:53 GMT",Is AMAT forming a reversal pattern - Trade Signal Summary & Technical Pattern Alert System - newser.com,newser.com
"Mon, 29 Sep 2025 11:10:13 GMT",What insider trading reveals about AMAT stock - Quarterly Trade Report & Daily Growth Stock Tips - newser.com,newser.com
"Fri, 26 Sep 2025 16:03:23 GMT",What insider trading reveals about AMAT stock - Quarterly Earnings Summary & Community Consensus Stock Picks - newser.com,newser.com
"Mon, 29 Sep 2025 05:11:40 GMT",Head-To-Head Analysis: Applied Materials (NASDAQ:AMAT) and Infineon Technologies (OTCMKTS:IFNNY) - Defense World,Defense World
"Mon, 29 Sep 2025 08:59:05 GMT",Statistical indicators supporting AMAT’s strength - CPI Data & Expert Approved Momentum Ideas - newser.com,newser.com
2025-09-26T23:45:06,Applied Materials (AMAT) Surpasses Market Returns: Some Facts Worth Knowing,Yahoo
2025-09-26T15:28:15,Heartland Opportunistic Value Equity Strategy Initiated a Position in Applied Materials (AMAT) in Q2,Yahoo
2025-09-26T14:53:55,Jim Cramer Explains Morgan Stanley’s Coverage Of Applied Materials (AMAT),Yahoo
