Date,Title,Source
"Thu, 06 Nov 2025 03:12:59 GMT",What earnings revisions data tells us about ANSS - Stop Loss & Capital Protection Trade Alerts - newser.com,newser.com
"Wed, 05 Nov 2025 23:59:47 GMT",Is ANSS stock a top momentum play - 2025 Major Catalysts & High Conviction Investment Ideas - fcp.pa.gov.br,fcp.pa.gov.br
"Thu, 06 Nov 2025 04:00:58 GMT",What earnings revisions data tells us about ANSS - July 2025 Levels & Verified Chart Pattern Signals - newser.com,newser.com
"Thu, 06 Nov 2025 04:46:11 GMT","Assam Nepali Sahitya Sabha (ANSS) president receives commemorative coin of Bhupen Hazarika - The Sentinel - of this Land, for its People","The Sentinel - of this Land, for its People"
"Thu, 06 Nov 2025 04:01:05 GMT",Is ANSS reversing from oversold territory - July 2025 Summary & Weekly Stock Performance Updates - newser.com,newser.com
"Mon, 03 Nov 2025 20:25:05 GMT",Can ANSS stock sustain revenue growth - July 2025 Trends & Stepwise Entry and Exit Trade Signals - fcp.pa.gov.br,fcp.pa.gov.br
"Thu, 06 Nov 2025 04:00:54 GMT",Will ANSS bounce back from current support - Trade Ideas & Verified Technical Trade Signals - newser.com,newser.com
"Wed, 05 Nov 2025 06:54:11 GMT",How to escape a deep drawdown in ANSS - 2025 Retail Activity & Daily Profit Focused Stock Screening - newser.com,newser.com
"Wed, 05 Nov 2025 00:54:47 GMT",Using portfolio simulators with ANSS included - July 2025 Closing Moves & Fast Exit/Entry Strategy Plans - newser.com,newser.com
"Wed, 05 Nov 2025 01:46:13 GMT",Using portfolio simulators with ANSS included - July 2025 Market Mood & Verified Technical Trade Signals - newser.com,newser.com
"Wed, 05 Nov 2025 11:54:11 GMT",Strategies to average down on ANSS - Market Trend Review & Weekly Hot Stock Watchlists - newser.com,newser.com
"Wed, 05 Nov 2025 07:25:19 GMT",ANSS stock outlook for YEAR - July 2025 PostEarnings & Real-Time Volume Analysis - newser.com,newser.com
"Sun, 02 Nov 2025 18:36:07 GMT",Will ANSS bounce back from current support - CPI Data & AI Based Buy/Sell Signal Reports - newser.com,newser.com
"Tue, 04 Nov 2025 08:30:43 GMT",Will ANSS continue its uptrend - 2025 Technical Patterns & Precise Buy Zone Identification - newser.com,newser.com
"Sun, 02 Nov 2025 17:55:58 GMT",Using flow based indicators on ANSS - Quarterly Earnings Report & High Conviction Buy Zone Alerts - newser.com,newser.com
"Sun, 02 Nov 2025 10:50:31 GMT",What institutional flow reveals about ANSS - Profit Target & Verified Stock Trade Ideas - newser.com,newser.com
"Sun, 02 Nov 2025 06:19:42 GMT",Using flow based indicators on ANSS - July 2025 Analyst Calls & Weekly Chart Analysis and Trade Guides - newser.com,newser.com
"Wed, 05 Nov 2025 09:06:07 GMT",Statistical indicators supporting ANSS’s strength - July 2025 Reactions & Capital Efficient Trading Techniques - newser.com,newser.com
"Mon, 03 Nov 2025 12:33:00 GMT",Statistical indicators supporting ANSS’s strength - Portfolio Risk Report & Real-Time Market Trend Scan - newser.com,newser.com
