Date,Title,Source
2025-08-28T15:57:14Z,$1000 Invested In Texas Instruments 10 Years Ago Would Be Worth This Much Today,Biztoc.com
2025-08-27T18:58:10Z,Wall Street Is Having a ‘Chips and Dip’ Moment. Here Are the Top 3 Semiconductor Stocks to Buy Here.,Barchart.com
2025-08-27T09:16:04Z,Texas Instruments Incorporated (TXN): A Bull Case Theory,Yahoo Entertainment
"Sat, 30 Aug 2025 11:00:11 GMT",Those who invested in Texas Instruments (NASDAQ:TXN) five years ago are up 66% - Yahoo Finance,Yahoo Finance
"Sun, 31 Aug 2025 13:50:02 GMT",Responsive Playbooks and the TXN Inflection - news.stocktradersdaily.com,news.stocktradersdaily.com
"Thu, 28 Aug 2025 15:33:05 GMT","Texas Instruments: Short-Term Relief, Long-Term Concerns (NASDAQ:TXN) - Seeking Alpha",Seeking Alpha
"Wed, 27 Aug 2025 14:03:06 GMT",TXN's Analog Revenue Growth Picks Up: A Sign of More Upside? - Zacks Investment Research,Zacks Investment Research
"Fri, 29 Aug 2025 19:48:48 GMT",Why Texas Instruments (TXN) Remains a Must-Owning Semiconductor Staple in a Tech-Driven World - AInvest,AInvest
"Wed, 27 Aug 2025 16:32:00 GMT","Insider Sale: Sr. Vice President of $TXN Sells 1,500 Shares - Quiver Quantitative",Quiver Quantitative
"Wed, 27 Aug 2025 09:30:29 GMT",Texas Instruments Incorporated (TXN): A Bull Case Theory - MSN,MSN
"Wed, 27 Aug 2025 14:51:00 GMT","Noteworthy ETF Inflows: TQQQ, GOOG, TXN, APP - Nasdaq",Nasdaq
"Fri, 29 Aug 2025 17:06:04 GMT",(TXN) Movement Within Algorithmic Entry Frameworks - news.stocktradersdaily.com,news.stocktradersdaily.com
"Wed, 27 Aug 2025 13:00:03 GMT",Investors Heavily Search Texas Instruments Incorporated (TXN): Here is What You Need to Know - Yahoo Finance,Yahoo Finance
"Wed, 27 Aug 2025 09:35:14 GMT",Texas Instruments (TXN): A Compelling Long-Term Play in Analog and Embedded Processing Amid AI and Onshoring Megatrends - AInvest,AInvest
"Sun, 31 Aug 2025 01:14:47 GMT",TXN Club長線投資建議 getLinesFromResByArray error: size == 0 - sisain.net,sisain.net
2025-08-30T13:00:11,Those who invested in Texas Instruments (NASDAQ:TXN) five years ago are up 66%,Yahoo
2025-08-27T20:58:10,Wall Street Is Having a ‘Chips and Dip’ Moment. Here Are the Top 3 Semiconductor Stocks to Buy Here.,Yahoo
2025-08-27T16:48:00,TXN's Analog Revenue Growth Picks Up: A Sign of More Upside?,Yahoo
2025-08-27T15:00:03,Investors Heavily Search Texas Instruments Incorporated (TXN): Here is What You Need to Know,Yahoo
2025-08-27T11:16:04,Texas Instruments Incorporated (TXN): A Bull Case Theory,Yahoo
