Date,Title,Source
2025-11-04T21:34:51Z,Here's How Much You Would Have Made Owning O'Reilly Automotive Stock In The Last 10 Years,Biztoc.com
"Thu, 06 Nov 2025 04:21:08 GMT",Leading vs lagging indicators on ORLY performance - Market Rally & Advanced Technical Signal Analysis - newser.com,newser.com
"Wed, 05 Nov 2025 21:35:00 GMT",Fund Update: New $435.6M $ORLY stock position opened by Alphinity Investment Management Pty Ltd - Quiver Quantitative,Quiver Quantitative
"Mon, 03 Nov 2025 18:16:07 GMT",Why O'Reilly (ORLY) Shares Are Sliding Today - Yahoo Finance,Yahoo Finance
"Wed, 05 Nov 2025 13:30:35 GMT",Orly Guteza being ‘protected’ by ex-Marines —Defensor - MSN,MSN
"Mon, 03 Nov 2025 14:25:00 GMT","A Nail Tint As Unique As You, Introducing ORLY Beauty's pH Perfector - PR Newswire",PR Newswire
"Wed, 05 Nov 2025 12:57:26 GMT","Pointe Capital Management LLC Raises Stake in O'Reilly Automotive, Inc. $ORLY - MarketBeat",MarketBeat
"Thu, 06 Nov 2025 04:01:48 GMT",Why ORLY stock is trending among retail traders - Insider Buying & Short-Term Trading Alerts - newser.com,newser.com
"Tue, 04 Nov 2025 11:24:07 GMT","Athens Joins Charlotte Douglas, Frankfurt, Paris-Orly, Detroit, Incheon, and Other Major Airports Facing Slower Growth, Declining Profit Margins, and Rising Operational Costs Over the Last Nine Months in 2025 - Travel And Tour World",Travel And Tour World
"Wed, 05 Nov 2025 13:05:28 GMT","J. W. Coons Advisors LLC Raises Holdings in O'Reilly Automotive, Inc. $ORLY - MarketBeat",MarketBeat
"Thu, 06 Nov 2025 03:55:20 GMT",Chart based analysis of ORLY trends - 2025 Fundamental Recap & AI Driven Stock Reports - newser.com,newser.com
"Wed, 05 Nov 2025 11:35:14 GMT","O'Reilly Automotive, Inc. $ORLY is Simmons Bank's Largest Position - MarketBeat",MarketBeat
"Mon, 03 Nov 2025 03:30:00 GMT",Auto Parts Retailer Stocks Q3 Highlights: O'Reilly (NASDAQ:ORLY) - Yahoo Finance,Yahoo Finance
"Thu, 06 Nov 2025 04:15:00 GMT",Will ORLY benefit from macro trends - Weekly Gains Summary & Scalable Portfolio Growth Methods - newser.com,newser.com
"Wed, 05 Nov 2025 12:19:04 GMT","Huntington National Bank Grows Stock Holdings in O'Reilly Automotive, Inc. $ORLY - MarketBeat",MarketBeat
"Tue, 04 Nov 2025 23:30:02 GMT",How ORLY stock trades during market volatility - Trade Analysis Report & Low Drawdown Trading Strategies - newser.com,newser.com
"Wed, 05 Nov 2025 09:36:38 GMT","Versor Investments LP Makes New Investment in O'Reilly Automotive, Inc. $ORLY - MarketBeat",MarketBeat
"Tue, 04 Nov 2025 09:29:23 GMT","O'Reilly Automotive, Inc. $ORLY Shares Acquired by Pinnacle Associates Ltd. - MarketBeat",MarketBeat
"Tue, 04 Nov 2025 10:28:22 GMT","O'Reilly Automotive, Inc. $ORLY Shares Bought by Burney Co. - MarketBeat",MarketBeat
"Wed, 05 Nov 2025 08:48:58 GMT",Chart based analysis of ORLY trends - Weekly Profit Analysis & Fast Entry and Exit Trade Plans - newser.com,newser.com
"Tue, 04 Nov 2025 11:30:25 GMT","Levin Capital Strategies L.P. Grows Position in O'Reilly Automotive, Inc. $ORLY - MarketBeat",MarketBeat
"Tue, 04 Nov 2025 03:06:02 GMT",(ORLY) and the Role of Price-Sensitive Allocations - news.stocktradersdaily.com,news.stocktradersdaily.com
"Tue, 04 Nov 2025 11:30:14 GMT","Machina Capital S.A.S. Acquires 18,510 Shares of O'Reilly Automotive, Inc. $ORLY - MarketBeat",MarketBeat
"Wed, 05 Nov 2025 07:38:05 GMT",What MACD signals say about ORLY - 2025 Key Lessons & Weekly Top Gainers Trade List - newser.com,newser.com
"Tue, 04 Nov 2025 10:56:21 GMT","Bridgewater Advisors Inc. Increases Stock Position in O'Reilly Automotive, Inc. $ORLY - MarketBeat",MarketBeat
"Sun, 02 Nov 2025 17:33:58 GMT",Does Professional Growth and DIY Slowdown Shift O'Reilly Automotive's Investment Story (ORLY)? - simplywall.st,simplywall.st
"Mon, 03 Nov 2025 10:33:50 GMT","O'Reilly Automotive, Inc. $ORLY Shares Purchased by AMG National Trust Bank - MarketBeat",MarketBeat
"Mon, 03 Nov 2025 10:39:46 GMT","O'Reilly Automotive, Inc. $ORLY Shares Purchased by State of Michigan Retirement System - MarketBeat",MarketBeat
"Mon, 03 Nov 2025 12:25:19 GMT","Nicholas Company Inc. Acquires 1,006,707 Shares of O'Reilly Automotive, Inc. $ORLY - MarketBeat",MarketBeat
"Mon, 03 Nov 2025 10:35:50 GMT","Integrity Alliance LLC. Buys 4,725 Shares of O'Reilly Automotive, Inc. $ORLY - MarketBeat",MarketBeat
"Sun, 02 Nov 2025 11:50:20 GMT","O'Reilly Automotive, Inc. $ORLY Stake Raised by Geneva Capital Management LLC - MarketBeat",MarketBeat
"Tue, 04 Nov 2025 08:10:21 GMT",Is ORLY meeting your algorithmic filter criteria - 2025 Historical Comparison & Entry Point Strategy Guides - newser.com,newser.com
"Mon, 03 Nov 2025 07:17:21 GMT",Volume spikes in ORLY stock – what they mean - July 2025 Trade Ideas & Daily Stock Momentum Reports - newser.com,newser.com
"Sun, 02 Nov 2025 09:49:59 GMT","O'Reilly Automotive, Inc. $ORLY Shares Bought by Strs Ohio - MarketBeat",MarketBeat
"Mon, 03 Nov 2025 11:51:14 GMT","O'Reilly Automotive, Inc. $ORLY Shares Acquired by Gilbert & Cook Inc. - MarketBeat",MarketBeat
"Mon, 03 Nov 2025 10:01:39 GMT","O'Reilly Automotive, Inc. $ORLY Stock Position Boosted by Creative Financial Designs Inc. ADV - MarketBeat",MarketBeat
"Sun, 02 Nov 2025 09:52:05 GMT","Savvy Advisors Inc. Purchases 4,728 Shares of O'Reilly Automotive, Inc. $ORLY - MarketBeat",MarketBeat
"Sun, 02 Nov 2025 09:49:56 GMT","O'Reilly Automotive, Inc. $ORLY Holdings Boosted by Keybank National Association OH - MarketBeat",MarketBeat
"Sun, 02 Nov 2025 09:45:56 GMT","Retirement Systems of Alabama Increases Holdings in O'Reilly Automotive, Inc. $ORLY - MarketBeat",MarketBeat
"Wed, 05 Nov 2025 02:33:25 GMT",Senate President Pro Tempore Panfilo Lacson dared missing witness Orly Guteza to surface and present physical evidence to back up his allegation that he delivered millions of cash stuffed in Rimowa suitcases to the homes of former speaker Martin Romuald - facebook.com,facebook.com
"Sun, 02 Nov 2025 09:27:53 GMT","Atria Investments Inc Increases Holdings in O'Reilly Automotive, Inc. $ORLY - MarketBeat",MarketBeat
"Mon, 03 Nov 2025 11:25:05 GMT","O'Reilly Automotive, Inc. $ORLY Shares Bought by Torray Investment Partners LLC - MarketBeat",MarketBeat
"Mon, 03 Nov 2025 11:30:25 GMT","Welch & Forbes LLC Grows Holdings in O'Reilly Automotive, Inc. $ORLY - MarketBeat",MarketBeat
"Sun, 02 Nov 2025 09:52:05 GMT","World Investment Advisors Grows Stock Holdings in O'Reilly Automotive, Inc. $ORLY - MarketBeat",MarketBeat
"Sun, 02 Nov 2025 09:15:35 GMT","Arkadios Wealth Advisors Increases Stock Holdings in O'Reilly Automotive, Inc. $ORLY - MarketBeat",MarketBeat
"Sun, 02 Nov 2025 19:07:54 GMT",Is ORLY reversing from oversold territory - July 2025 Final Week & Community Consensus Stock Picks - newser.com,newser.com
"Sat, 01 Nov 2025 09:12:59 GMT","O'Reilly Automotive, Inc. $ORLY Shares Purchased by Assetmark Inc. - MarketBeat",MarketBeat
"Sat, 01 Nov 2025 18:02:04 GMT",O'Reilly Automotive (NASDAQ:ORLY) Earns Buy (B-) Rating from Weiss Ratings - MarketBeat,MarketBeat
"Sat, 01 Nov 2025 09:11:04 GMT","O'Reilly Automotive, Inc. $ORLY Shares Purchased by Hantz Financial Services Inc. - MarketBeat",MarketBeat
"Sat, 01 Nov 2025 10:52:19 GMT","UNIVEST FINANCIAL Corp Has $604,000 Stake in O'Reilly Automotive, Inc. $ORLY - MarketBeat",MarketBeat
"Sat, 01 Nov 2025 09:36:09 GMT","Amalgamated Bank Purchases 181,727 Shares of O'Reilly Automotive, Inc. $ORLY - MarketBeat",MarketBeat
"Sun, 02 Nov 2025 05:47:04 GMT",Why ORLY stock is trending among retail traders - July 2025 PreEarnings & Fast Entry High Yield Tips - newser.com,newser.com
"Tue, 04 Nov 2025 04:30:26 GMT",‘Mabuting tao’: Orly Guteza has no reason to falsify notarization – Marcoleta - politiko.com.ph,politiko.com.ph
2025-11-04T19:46:30,"O'Reilly Automotive, Inc. (ORLY) Presents at 49th Annual Automotive Symposium Transcript",SeekingAlpha
2025-11-04T16:17:24,How O'Reilly Automotive's (ORLY) Strong Q3 Results and Upgraded Guidance Could Influence Investors,Yahoo
2025-11-03T19:16:07,Why O'Reilly (ORLY) Shares Are Sliding Today,Yahoo
2025-11-03T04:30:51,Auto Parts Retailer Stocks Q3 Highlights: O'Reilly (NASDAQ:ORLY),Yahoo
