Date,Title,Source
2025-09-09T19:41:00Z,"Here's LSU baseball's full schedule in 2026, including matchups against Vanderbilt, Georgia",The Advocate
2025-09-09T19:41:00Z,Gigabyte MO27Q2A: QD-OLED gaming monitor with 1440p resolution and 280Hz launches,Notebookcheck.net
2025-09-09T19:39:09Z,NHL CBA establishes a fund for retired players' health care and wellness,Associated Press
2025-09-09T19:30:35Z,NHL CBA establishes a $4M annual fund for retired players' health care and wellness,Yahoo Entertainment
2025-09-09T19:30:03Z,Auburn trending for elite 2027 in-state prospect,On3.com
2025-09-09T19:30:00Z,Apple unveils its latest iPhone lineup amid Trump's trade war,Richmond.com
2025-09-09T19:30:00Z,Apple unveils its latest iPhone lineup amid Trump's trade war,Roanoke Times
2025-09-09T19:27:40Z,F80 M3-Converted 2014 BMW 328i Sports Wagon,Bringatrailer.com
2025-09-09T19:26:15Z,The One Thing You Can Do to Make Meditation a Habit,Mindful.org
"Tue, 09 Sep 2025 12:00:00 GMT",Strong care teams are key to boosting physician well-being - American Medical Association,American Medical Association
"Wed, 10 Sep 2025 04:15:27 GMT",Why has Jack Grealish started so well at Everton? - The Athletic - The New York Times,The New York Times
"Wed, 10 Sep 2025 05:39:15 GMT","Senior living helps older adults live well longer, NORC/NIC study finds - McKnight's Senior Living",McKnight's Senior Living
"Wed, 10 Sep 2025 05:26:15 GMT",Ohio EPA hosts early information session on proposed injection well - mariettatimes.com,mariettatimes.com
"Tue, 09 Sep 2025 14:02:29 GMT",Elevate Well-Being: Beyond the numbers — why well-being is everyone’s job (even mine) - Clemson News,Clemson News
"Wed, 10 Sep 2025 01:58:42 GMT",COLUMN: We know Taylor Swift’s greed ‘All Too Well’ - theappalachianonline.com,theappalachianonline.com
"Wed, 10 Sep 2025 06:31:25 GMT",Ethereum Core Developers Paid Well Under Market Levels Despite Running the Network: Report - Yahoo Finance,Yahoo Finance
"Wed, 10 Sep 2025 04:02:00 GMT",Why Finishing Well Matters More Than Visible Success - The Gospel Coalition,The Gospel Coalition
"Wed, 10 Sep 2025 04:00:00 GMT",Post-cancer well-being: Study explores role of ‘physically demanding’ jobs - Safety+Health magazine,Safety+Health magazine
"Tue, 09 Sep 2025 15:12:54 GMT",Join Us: Webinar on Indigenous Mothers’ and Babies’ Well-Being - The Annie E. Casey Foundation,The Annie E. Casey Foundation
"Wed, 10 Sep 2025 03:00:13 GMT","State Declares ‘Significant Drought’ in Region; Groveland, Using Only One Well, Bans Outdoor Watering - WHAV",WHAV
"Wed, 10 Sep 2025 05:01:00 GMT","Area of England well protected for nature is in decline, data shows - The Guardian",The Guardian
"Mon, 08 Sep 2025 21:23:23 GMT",Consortium awarded $8.5m for student well-being initiative - College of the Atlantic,College of the Atlantic
"Tue, 09 Sep 2025 19:22:40 GMT",Is following true crime bad for your well-being? - futurity.org,futurity.org
"Wed, 10 Sep 2025 06:12:41 GMT",Chiodos Confrim 2nd Leg of “All’s Well That Ends Well” 20th Anniversary Tour - V13.net,V13.net
"Tue, 09 Sep 2025 22:48:52 GMT",Chason Warren is adjusting well to life as a student-athlete - WALB,WALB
"Tue, 09 Sep 2025 08:55:00 GMT",Two Pennsylvania Towns Seek Public Funding for Water Systems Amid Claims That Gas Industry Contaminated Wells - Inside Climate News,Inside Climate News
"Tue, 09 Sep 2025 22:18:00 GMT",Marietta City Council committees discuss proposed injection well - WTAP,WTAP
"Wed, 10 Sep 2025 06:43:00 GMT",Aces’ latest milestone bodes well for WNBA Finals chances - Yahoo Sports,Yahoo Sports
"Wed, 10 Sep 2025 02:55:59 GMT",California American Water upgrades critical well infrastructure after 2024 storms - waterworld.com,waterworld.com
"Wed, 10 Sep 2025 00:55:05 GMT",$1.675 Million Raised for Maiden Music Well Drilling - Investing News Network,Investing News Network
"Wed, 10 Sep 2025 05:24:54 GMT","Henry Huber on football: BEA’s McCully has adapted well to increased role | News, Sports, Jobs - The Express - lockhaven.com",lockhaven.com
"Wed, 10 Sep 2025 03:40:14 GMT","Florida DEP, Mosaic meet with neighbors over proposed underground wastewater wells - FOX 13 Tampa Bay",FOX 13 Tampa Bay
"Tue, 09 Sep 2025 21:22:00 GMT",Free nitrate testing at Farmfest revealed issues in private well water - Austin Daily Herald,Austin Daily Herald
"Sun, 07 Sep 2025 13:37:00 GMT",Football Notebook: 'Our kids played really well and battled hard' - Central Michigan University Athletics,Central Michigan University Athletics
"Tue, 09 Sep 2025 16:48:32 GMT",Why food and murder pair so well in fiction - CrimeReads,CrimeReads
"Tue, 09 Sep 2025 19:16:33 GMT",RWJBarnabas Health and Rutgers Health Honored by American Medical Association for Their Commitment to Well-Being of Physicians - RWJBarnabas Health,RWJBarnabas Health
"Tue, 09 Sep 2025 09:20:24 GMT","Well-publicized polar geoengineering ideas will not help and could harm, warn experts - Frontiers",Frontiers
"Wed, 10 Sep 2025 04:17:52 GMT",Gardening’s hidden benefits: How digging in the dirt could bolster mental well-being - Butler Eagle,Butler Eagle
"Wed, 10 Sep 2025 01:48:58 GMT",Cross Country | Piedmont does well at invitational - Piedmont Exedra,Piedmont Exedra
"Wed, 10 Sep 2025 04:37:31 GMT","Rochester Public Schools discusses fate of two vacant buildings, as well as former Friedell Middle School - Post Bulletin",Post Bulletin
"Wed, 10 Sep 2025 06:09:16 GMT",Mathieu van der Poel watches MTB opponent perform well in Short Race: Victor Koretzky defends title - IDLprocycling.com,IDLprocycling.com
"Tue, 09 Sep 2025 01:05:00 GMT",New Report Calls for Culturally Responsive Programs to Support Youth Mental Health and Well-Being - The Annie E. Casey Foundation,The Annie E. Casey Foundation
"Wed, 10 Sep 2025 06:00:00 GMT",Air Forces In Focus: Mauritania’s Defense Budget Increases Enabling Well-Rounded Air Force - Aviation Week Network,Aviation Week Network
"Mon, 08 Sep 2025 18:25:00 GMT","Walmart, Costco, and Other Consumer Stocks That Should Do Well When the Economy Weakens - Barron's",Barron's
"Wed, 10 Sep 2025 00:02:07 GMT",The Nets Are Well Beneath the Cap Floor: What Does That Mean? - Sports Illustrated,Sports Illustrated
"Tue, 09 Sep 2025 06:32:25 GMT",Marietta City Council considering legal action over planned injection well - News and Sentinel,News and Sentinel
"Tue, 09 Sep 2025 19:43:46 GMT","Positive Athlete nominations now open for 2025–2026, recognizing well-rounded student-athletes - USA Wrestling",USA Wrestling
"Wed, 10 Sep 2025 00:07:56 GMT",Aon's Zakhary: How well-executed plans can sustain profitable growth through market cycles - The Insurer,The Insurer
"Tue, 09 Sep 2025 16:59:00 GMT","New data shows the US job market was much weaker than thought in 2024, and this year as well - AP News",AP News
"Tue, 09 Sep 2025 23:48:45 GMT","Chadiha reveals his top surprise from Week 1, as well as stock-watch updates | 'The Insiders' - NFL.com",NFL.com
"Tue, 09 Sep 2025 21:57:33 GMT","Morningstar DBRS Changes Trends on Four Classes of Wells Fargo Commercial Mortgage Trust 2018-C43 to Stable From Negative, Confirms Credit Ratings on All Classes - Morningstar DBRS",Morningstar DBRS
"Tue, 09 Sep 2025 19:08:21 GMT",Wellness Week 2025: Building Health and Well-being Together - Pan American Health Organization (PAHO),Pan American Health Organization (PAHO)
"Wed, 10 Sep 2025 07:00:00 GMT",Get the Well Enough newsletter by Emilie Lavinia and make sense of the wild world of wellness - Yahoo News New Zealand,Yahoo News New Zealand
"Mon, 08 Sep 2025 14:02:00 GMT",4 Simple Challenges That Reveal How Well Your Body Is Really Aging - Real Simple,Real Simple
"Tue, 09 Sep 2025 04:50:05 GMT",Monroe County duo steps up to help workers injured in well site explosion - News and Sentinel,News and Sentinel
"Tue, 09 Sep 2025 03:29:00 GMT","Multi-use tech campus at site of old KC Star building ‘well underway,’ officials say - KCTV",KCTV
"Tue, 09 Sep 2025 18:01:00 GMT",Chason Warren is adjusting well to life as a student athlete - WALB,WALB
"Tue, 09 Sep 2025 15:21:47 GMT",Financial Well-Being and Financial Stress as Predictors of Overall Well-Being and Life Satisfaction Among Peruvian Workers - Frontiers,Frontiers
"Tue, 09 Sep 2025 16:27:21 GMT","Wells Fargo says US consumer finances are strong, with good credit - Reuters",Reuters
"Wed, 10 Sep 2025 06:53:04 GMT",BP plans five-well Mediterranean drilling campaign off Egypt - Splash247,Splash247
"Tue, 09 Sep 2025 17:45:20 GMT",Effectiveness of Timely Implementation of Palliative Care on the Well-Being of Patients with Chronic Heart Failure - CU Anschutz newsroom,CU Anschutz newsroom
"Tue, 09 Sep 2025 09:00:00 GMT","Mosquito season extending, expected to last well into fall - Michigan Public",Michigan Public
"Tue, 09 Sep 2025 18:31:45 GMT",Wallowa Memorial Hospital welcomes Dr. Summer Szumski & announces Living Well program - Elkhorn Media Group,Elkhorn Media Group
"Wed, 10 Sep 2025 06:46:14 GMT","Inditex sales rise 1.6% in H1, second half starts well - FashionNetwork - The World's Fashion Business News",FashionNetwork - The World's Fashion Business News
"Mon, 08 Sep 2025 16:36:00 GMT","Riverton community looking into solutions after well collapse leaves dozens without water - KOLN | Nebraska Local News, Weather, Sports | Lincoln, NE","KOLN | Nebraska Local News, Weather, Sports | Lincoln, NE"
"Wed, 10 Sep 2025 06:07:56 GMT",Ethereum Core Developers Paid Well Under Market Levels Despite Running the Network: Report - Cryptonews,Cryptonews
"Mon, 08 Sep 2025 20:04:13 GMT","Expert: Zongertinib Offers Well-Tolerated, Convenient Oral Option for HER2-Mutant NSCLC - Pharmacy Times",Pharmacy Times
"Tue, 09 Sep 2025 00:11:15 GMT",Quantifying the relationship between physical performance and mental well-being in older adults: field research - Frontiers,Frontiers
"Tue, 09 Sep 2025 22:30:00 GMT",Finding balance: Lessons in holistic well-being - Wisconsin Muslim Journal,Wisconsin Muslim Journal
"Tue, 09 Sep 2025 13:23:27 GMT","Wells Fargo says US consumer finances are strong, with good credit - Yahoo Finance",Yahoo Finance
"Tue, 09 Sep 2025 17:45:00 GMT",Cleveland Fed program prepares high school students for financial well-being - News 5 Cleveland WEWS,News 5 Cleveland WEWS
"Tue, 09 Sep 2025 15:00:00 GMT",Surge Energy America Announces Completion of Seventeen Well Farm-In Development - PR Newswire,PR Newswire
"Wed, 10 Sep 2025 01:51:47 GMT",SISD performs well at Shiner XC meet - Schulenburg Sticker,Schulenburg Sticker
"Mon, 08 Sep 2025 14:50:57 GMT",FTC COPPA Enforcement - Still Alive and Well | Mintz - Privacy & Cybersecurity Viewpoints - JD Supra,JD Supra
"Tue, 09 Sep 2025 08:31:38 GMT","OPINION | Marcus: All’s well in Indiana, as long as we’re ahead of Kentucky - Courier & Press",Courier & Press
"Tue, 09 Sep 2025 14:30:51 GMT",New Hampshire Man Doing Well After Experimental Pig Kidney Transplant - U.S. News & World Report,U.S. News & World Report
"Tue, 09 Sep 2025 22:01:07 GMT",bp lines up five-well campaign offshore Egypt - Offshore Magazine,Offshore Magazine
"Sun, 07 Sep 2025 17:13:00 GMT",Opinion | Two Elite College Degrees Worked Well for Me - The Wall Street Journal,The Wall Street Journal
"Tue, 09 Sep 2025 23:38:51 GMT","Chadiha reveals his top surprise from Week 1, as well as stock-watch updates 'The Insiders' - Yahoo Sports",Yahoo Sports
"Tue, 09 Sep 2025 18:30:03 GMT",Drought in Upper Valley spurs well drilling demand - Valley News,Valley News
"Tue, 09 Sep 2025 15:32:36 GMT",A Summer Well Spent – Sandhills Ranch Internships Conclude for the Season - chadronradio.com,chadronradio.com
"Tue, 09 Sep 2025 03:21:00 GMT",Staying warm well into mid-September - Valley News Live,Valley News Live
"Tue, 09 Sep 2025 19:00:32 GMT",Early Medicare Advantage stars data bodes well for UnitedHealth - Healthcare Dive,Healthcare Dive
"Tue, 09 Sep 2025 15:51:31 GMT","Human remains found inside a Tesla registered to a well known singer, songwriter - WRAL.com",WRAL.com
"Mon, 08 Sep 2025 16:05:21 GMT",Pleasure Activism @ Village Well – Sept 9 - Culver City Crossroads,Culver City Crossroads
"Sun, 07 Sep 2025 23:45:00 GMT","Rick Davies, Supertramp Co-Founder Who Wrote and Sang ‘Bloody Well Right’ and ‘Goodbye Stranger,’ Dies at 81 - Variety",Variety
"Tue, 09 Sep 2025 23:15:00 GMT","This Habit May Raise Your Risk of Hemorrhoids by 46%, New Study Says - EatingWell",EatingWell
"Mon, 08 Sep 2025 16:21:04 GMT","Riverton community looking into solutions after well collapse leaves dozens without water - KOLN | Nebraska Local News, Weather, Sports | Lincoln, NE","KOLN | Nebraska Local News, Weather, Sports | Lincoln, NE"
"Tue, 09 Sep 2025 14:57:00 GMT",Belcher: New Opportunities for Orphan Well Reclamation - Hart Energy,Hart Energy
"Tue, 09 Sep 2025 20:51:58 GMT","Wells Fargo, BofA Execs Spotlight Cross-Selling Opportunities - AdvisorHub",AdvisorHub
"Mon, 08 Sep 2025 04:35:46 GMT","Trends in living, working, aging well highlighted in report - McKnight's Senior Living",McKnight's Senior Living
"Tue, 09 Sep 2025 17:26:20 GMT","Cleveland County Detention Center inmates receive tablets to boost education, well-being - KFOR",KFOR
"Mon, 08 Sep 2025 17:28:18 GMT",Annual checkups keep kids healthy and developing well - 6abc Philadelphia,6abc Philadelphia
"Mon, 08 Sep 2025 11:00:52 GMT",A Focus on Well-Known & Lesser-Known Dividend ETFs - ETF Trends,ETF Trends
"Mon, 08 Sep 2025 07:00:00 GMT",How Well Do You Know Mercedes-AMG F1 Test and Reserve Driver Fred Vesti? - Mercedes-AMG PETRONAS F1 Team,Mercedes-AMG PETRONAS F1 Team
"Tue, 09 Sep 2025 21:12:17 GMT",The iPhone 17 Pro’s orange is good — and well timed - The Verge,The Verge
"Tue, 09 Sep 2025 15:53:28 GMT",Chiodos announce second U.S. leg of All’s Well That Ends Well 20th Anniversary Tour - - // MELODIC Magazine,- // MELODIC Magazine
"Tue, 09 Sep 2025 03:28:00 GMT","Multi-use tech campus at site of old KC Star building ‘well underway,’ officials say - KCTV",KCTV
"Mon, 08 Sep 2025 20:26:15 GMT","""Emergency"" O-Line Holds Up Well in Atlanta - Tampa Bay Buccaneers",Tampa Bay Buccaneers
"Tue, 09 Sep 2025 16:28:09 GMT",Steelers' Mike Tomlin Rules Out Three Players Well Ahead of Week 2 - Newsweek,Newsweek
"Wed, 10 Sep 2025 02:26:03 GMT",Israeli strike on Hamas was ‘well-played:’ Hamas founder’s son - NewsNation,NewsNation
2025-09-06T15:00:05,"If You Invested $10K In Welltower Stock 10 Years Ago, How Much Would You Have Now?",Yahoo
2025-09-05T19:01:38,Is Welltower Stock Outperforming the Dow?,Yahoo
2025-09-10T15:12:33,"Trump calls for immediate Fed rate cuts, blasts Powell as total disaster",Reddit/r/StockMarket
2025-09-06T05:26:58,Lost 50k on Google.,Reddit/r/wallstreetbets
