Date,Title,Source
2025-09-28T05:48:42Z,Exxon Mobil Sees Unusually Large Options Volume (NYSE:XOM),ETF Daily News
2025-09-27T06:38:47Z,YieldMax XOM Option Income Strategy ETF (NYSEARCA:XOMO) Trading 1% Higher – Should You Buy?,ETF Daily News
2025-09-25T15:15:32Z,P/E Ratio Insights for Exxon Mobil,Biztoc.com
"Mon, 29 Sep 2025 21:45:00 GMT",Exxon Mobil (XOM) Stock Falls Amid Market Uptick: What Investors Need to Know - Nasdaq,Nasdaq
"Mon, 29 Sep 2025 21:56:02 GMT",(XOM) Risk Channels and Responsive Allocation - news.stocktradersdaily.com,news.stocktradersdaily.com
"Mon, 29 Sep 2025 08:29:21 GMT",Exxon Mobil Corporation $XOM Stock Holdings Reduced by ORG Wealth Partners LLC - MarketBeat,MarketBeat
"Thu, 25 Sep 2025 13:34:00 GMT",XOM's Guyana Push: Unlocking 11B Barrels and a Decade of Growth - Yahoo Finance,Yahoo Finance
"Mon, 29 Sep 2025 13:48:02 GMT",Price-Driven Insight from (XOM) for Rule-Based Strategy - news.stocktradersdaily.com,news.stocktradersdaily.com
"Mon, 29 Sep 2025 08:15:06 GMT","ORG Partners LLC Sells 4,627 Shares of Exxon Mobil Corporation $XOM - MarketBeat",MarketBeat
"Mon, 29 Sep 2025 08:25:12 GMT",Exxon Mobil Corporation $XOM Shares Acquired by Twelve Points Wealth Management LLC - MarketBeat,MarketBeat
"Sun, 28 Sep 2025 21:32:02 GMT",Understanding the Setup: (XOM) and Scalable Risk - news.stocktradersdaily.com,news.stocktradersdaily.com
"Mon, 29 Sep 2025 08:25:10 GMT",Signaturefd LLC Has $10.85 Million Stock Holdings in Exxon Mobil Corporation $XOM - MarketBeat,MarketBeat
"Mon, 29 Sep 2025 08:29:19 GMT",Exxon Mobil Corporation $XOM Stock Position Raised by Kiley Juergens Wealth Management LLC - MarketBeat,MarketBeat
"Mon, 29 Sep 2025 08:37:04 GMT",TBH Global Asset Management LLC Trims Holdings in Exxon Mobil Corporation $XOM - MarketBeat,MarketBeat
"Sun, 28 Sep 2025 10:23:37 GMT",Exxon Mobil Corporation $XOM Stock Position Lowered by Eagle Global Advisors LLC - MarketBeat,MarketBeat
"Sun, 28 Sep 2025 10:07:34 GMT",Exxon Mobil Corporation $XOM Shares Sold by FCG Investment Co - MarketBeat,MarketBeat
"Sun, 28 Sep 2025 10:23:41 GMT",Swisher Financial Concepts Inc. Raises Position in Exxon Mobil Corporation $XOM - MarketBeat,MarketBeat
"Sun, 28 Sep 2025 10:05:44 GMT","True North Advisors LLC Sells 6,606 Shares of Exxon Mobil Corporation $XOM - MarketBeat",MarketBeat
"Sun, 28 Sep 2025 10:07:36 GMT","Cove Private Wealth LLC Purchases 3,704 Shares of Exxon Mobil Corporation $XOM - MarketBeat",MarketBeat
"Fri, 26 Sep 2025 13:03:34 GMT","4 stocks to watch on Friday: META, COST, REGN, XOM (SP500:) - Seeking Alpha",Seeking Alpha
"Sat, 27 Sep 2025 11:15:10 GMT","2,517 Shares in Exxon Mobil Corporation $XOM Bought by Five Oceans Advisors - MarketBeat",MarketBeat
"Sun, 28 Sep 2025 10:19:38 GMT","State of Alaska Department of Revenue Sells 25,083 Shares of Exxon Mobil Corporation $XOM - MarketBeat",MarketBeat
"Sat, 27 Sep 2025 17:04:02 GMT",The Technical Signals Behind (XOM) That Institutions Follow - news.stocktradersdaily.com,news.stocktradersdaily.com
"Sat, 27 Sep 2025 11:13:23 GMT","CX Institutional Purchases 4,645 Shares of Exxon Mobil Corporation $XOM - MarketBeat",MarketBeat
"Sat, 27 Sep 2025 11:12:30 GMT",Exxon Mobil Corporation $XOM Shares Sold by Hartford Investment Management Co. - MarketBeat,MarketBeat
"Sat, 27 Sep 2025 11:06:35 GMT",Exxon Mobil Corporation $XOM Stock Holdings Cut by TCI Wealth Advisors Inc. - MarketBeat,MarketBeat
"Fri, 26 Sep 2025 17:03:27 GMT",Exxon Mobil Target of Unusually High Options Trading (NYSE:XOM) - MarketBeat,MarketBeat
"Sat, 27 Sep 2025 11:01:10 GMT",Exxon Mobil Corporation $XOM Shares Sold by Perigon Wealth Management LLC - MarketBeat,MarketBeat
"Sat, 27 Sep 2025 11:01:10 GMT","Magnus Financial Group LLC Sells 4,637 Shares of Exxon Mobil Corporation $XOM - MarketBeat",MarketBeat
"Sat, 27 Sep 2025 11:01:09 GMT",Exxon Mobil Corporation $XOM Shares Purchased by Ruffer LLP - MarketBeat,MarketBeat
"Sat, 27 Sep 2025 11:13:11 GMT","LS Investment Advisors LLC Sells 2,960 Shares of Exxon Mobil Corporation $XOM - MarketBeat",MarketBeat
"Sat, 27 Sep 2025 11:04:09 GMT","Congress Asset Management Co. Sells 2,234 Shares of Exxon Mobil Corporation $XOM - MarketBeat",MarketBeat
"Sat, 27 Sep 2025 11:01:10 GMT",Dakota Wealth Management Has $26.47 Million Stake in Exxon Mobil Corporation $XOM - MarketBeat,MarketBeat
"Sat, 27 Sep 2025 11:13:12 GMT",Randolph Co Inc Raises Holdings in Exxon Mobil Corporation $XOM - MarketBeat,MarketBeat
"Fri, 26 Sep 2025 10:23:12 GMT","Legacy Solutions LLC Purchases Shares of 2,277 Exxon Mobil Corporation $XOM - MarketBeat",MarketBeat
"Fri, 26 Sep 2025 10:23:26 GMT",Harrell Investment Partners LLC Grows Stock Holdings in Exxon Mobil Corporation $XOM - MarketBeat,MarketBeat
"Fri, 26 Sep 2025 14:15:26 GMT","CVX, XOM, SHEL: Oil Prices See Biggest Weekly Gain in Three Months - TipRanks",TipRanks
"Fri, 26 Sep 2025 10:25:13 GMT",Mather Group LLC. Has $9.53 Million Holdings in Exxon Mobil Corporation $XOM - MarketBeat,MarketBeat
"Fri, 26 Sep 2025 10:25:17 GMT",BostonPremier Wealth LLC Trims Stock Holdings in Exxon Mobil Corporation $XOM - MarketBeat,MarketBeat
"Fri, 26 Sep 2025 10:25:36 GMT",Beacon Investment Advisory Services Inc. Grows Stake in Exxon Mobil Corporation $XOM - MarketBeat,MarketBeat
"Fri, 26 Sep 2025 08:30:02 GMT",Why (XOM) Price Action Is Critical for Tactical Trading - news.stocktradersdaily.com,news.stocktradersdaily.com
"Thu, 25 Sep 2025 08:59:36 GMT","Lynch & Associates IN Purchases 2,290 Shares of Exxon Mobil Corporation $XOM - MarketBeat",MarketBeat
"Thu, 25 Sep 2025 19:22:24 GMT","XOM Boosts Oil Production in Guyana, Greenlights Hammerhead Project - MSN",MSN
"Thu, 25 Sep 2025 08:37:30 GMT","Norden Group LLC Sells 6,269 Shares of Exxon Mobil Corporation $XOM - MarketBeat",MarketBeat
"Fri, 26 Sep 2025 09:03:53 GMT",Exxon Mobil (XOM) Expands UK Trading Operations Amid Energy Mark - GuruFocus,GuruFocus
"Thu, 25 Sep 2025 08:32:57 GMT",Define Financial LLC Takes Position in Exxon Mobil Corporation $XOM - MarketBeat,MarketBeat
"Sun, 28 Sep 2025 10:23:39 GMT",Ipswich Investment Management Co. Inc. Has $9.91 Million Stock Holdings in Exxon Mobil Corporation $XOM - MarketBeat,MarketBeat
"Thu, 25 Sep 2025 08:30:40 GMT",Accurate Wealth Management LLC Raises Stock Position in Exxon Mobil Corporation $XOM - MarketBeat,MarketBeat
"Thu, 25 Sep 2025 08:28:35 GMT",Exxon Mobil Corporation $XOM Shares Bought by Waycross Partners LLC - MarketBeat,MarketBeat
"Thu, 25 Sep 2025 08:59:36 GMT","5,473 Shares in Exxon Mobil Corporation $XOM Acquired by IMS Capital Management - MarketBeat",MarketBeat
"Thu, 25 Sep 2025 16:14:02 GMT",Price-Driven Insight from (XOM) for Rule-Based Strategy - news.stocktradersdaily.com,news.stocktradersdaily.com
"Thu, 25 Sep 2025 08:28:36 GMT","Fifth Third Bancorp Buys 2,343 Shares of Exxon Mobil Corporation $XOM - MarketBeat",MarketBeat
"Thu, 25 Sep 2025 08:59:36 GMT",Northside Capital Management LLC Grows Position in Exxon Mobil Corporation $XOM - MarketBeat,MarketBeat
"Thu, 25 Sep 2025 08:55:38 GMT",Exxon Mobil Corporation $XOM Holdings Decreased by Public Employees Retirement System of Ohio - MarketBeat,MarketBeat
"Thu, 25 Sep 2025 08:46:49 GMT",Ballentine Partners LLC Has $6.35 Million Holdings in Exxon Mobil Corporation $XOM - MarketBeat,MarketBeat
"Thu, 25 Sep 2025 08:39:46 GMT",BCS Wealth Management Has $2.67 Million Stock Holdings in Exxon Mobil Corporation $XOM - MarketBeat,MarketBeat
"Thu, 25 Sep 2025 11:33:00 GMT","J.P. Morgan Maintains Exxon Mobil(XOM.US) With Buy Rating, Announces Target Price $124 - 富途牛牛",富途牛牛
"Thu, 25 Sep 2025 12:00:00 GMT",Exxon Mobil Share News (XOM.US) - London South East,London South East
"Tue, 30 Sep 2025 05:01:18 GMT",What hedge fund moves indicate for XOM stock - Quarterly Performance Summary & Risk Adjusted Swing Trade Ideas - newser.com,newser.com
"Mon, 29 Sep 2025 23:17:02 GMT",Is XOM stock overpriced at current multiples - 2025 Trading Volume Trends & Accurate Entry/Exit Alerts - newser.com,newser.com
"Mon, 29 Sep 2025 12:26:19 GMT",Will XOM stock profit from fiscal stimulus - Portfolio Value Summary & Low Volatility Stock Suggestions - newser.com,newser.com
"Tue, 30 Sep 2025 06:09:29 GMT",What hedge fund moves indicate for XOM stock - Trade Risk Report & Community Consensus Stock Picks - newser.com,newser.com
"Fri, 26 Sep 2025 17:43:02 GMT",How XOM stock trades pre earnings - July 2025 Weekly Recap & Low Risk Investment Opportunities - newser.com,newser.com
"Mon, 29 Sep 2025 08:02:30 GMT",Is XOM stock overpriced at current multiples - 2025 AllTime Highs & Stepwise Trade Signal Implementation - newser.com,newser.com
"Sat, 27 Sep 2025 21:05:48 GMT",Is XOM stock overpriced at current multiples - 2025 AllTime Highs & Free Technical Confirmation Trade Alerts - newser.com,newser.com
"Mon, 29 Sep 2025 10:35:32 GMT",Kooman & Associates Purchases 336 Shares of Exxon Mobil Corporation $XOM - Defense World,Defense World
2025-09-29T15:41:00,ExxonMobil's Advantaged Assets: A Hedge Against Oil Price Volatility?,Yahoo
2025-09-27T15:46:01,Does ExxonMobil’s Hammerhead Investment in Guyana Signal a New Long-Term Growth Phase for XOM?,Yahoo
2025-09-26T15:47:32,"Update: Eni, Exxon's Esso Among Companies Fined $1.09 Billion for Allegedly Forming Fuel Price 'Cartel'",Yahoo
2025-09-26T12:07:52,"Eni, Exxon's Esso Among Companies Fined $1.09 Billion for Allegedly Forming Fuel Price 'Cartel'",Yahoo
2025-09-25T15:34:00,XOM's Guyana Push: Unlocking 11B Barrels and a Decade of Growth,Yahoo
