Date,Title,Source
2025-10-16T10:04:56Z,Winter Storm Warning As 10 Inches of Snow To Strike,Biztoc.com
2025-10-16T08:26:13Z,7 European travel destinations celebrities can’t get enough of,Economictimes.com
2025-10-16T08:02:38Z,Winter is coming: First snow of the season falls in northwest Finland,YLE News
2025-10-16T07:28:57Z,Get these warm & stylish boots on the ground,Boston Herald
2025-10-16T04:30:00Z,National grid operator says electricity demand set to hit record high,Independent.ie
2025-10-15T20:00:00Z,Nike Zoom GT Cut 3 “Christmas” Has Pockets Of Snowy Glitter,Sneaker News
2025-10-15T19:28:32Z,Travel Warning Issued as Up to 10 Inches of Snow Forecast,Biztoc.com
2025-10-15T17:30:15Z,How does Lee Canyon’s first snowfall stack up to previous years for the Las Vegas ski resort,KLAS - 8 News Now
2025-10-15T17:12:13Z,Tougher challenges on the horizon for Aberdeen,BBC News
2025-10-15T16:56:49Z,Genomics Reveals Snow Leopards Have Always Been Rare,Forbes
2025-10-15T16:40:41Z,"Power's restored for most of Nisichawayasihk Cree Nation, but state of emergency remains",CBC News
2025-10-15T15:46:33Z,Powerful storm delivers wettest October day in years to California cities,Yahoo Entertainment
2025-10-15T14:45:00Z,"Stream It Or Skip It: ‘Murdaugh: Death In The Family’ On Hulu, A Scripted Drama About The Murder Case Against Alex Murdaugh",Decider
2025-10-15T13:11:31Z,Owner Can’t Cope As Great Pyrenees Experiences Snow for the First Time,Biztoc.com
2025-10-15T13:01:00Z,"Video: Apple TV Debuts First Look at ""Prehistoric Planet: Ice Age,"" Featuring the Playful Snow Sloths of the Pleistocene",Thefutoncritic.com
2025-10-15T13:00:00Z,New Snow Miku Kuromi Figure Wears a Gothic Lolita Dress,Siliconera
"Fri, 17 Oct 2025 06:11:15 GMT",OrthoFit Winter Ankle Boots Mens Waterproof Snow Boots Fur Lined Warm Ankle Boots Zipper Closure Slip on Comfortable Walking Shoes - The San Joaquin Valley Sun,The San Joaquin Valley Sun
"Thu, 16 Oct 2025 18:18:55 GMT",What forecasters expect for cold and snow in Philly this winter - Inquirer.com,Inquirer.com
"Thu, 16 Oct 2025 19:13:39 GMT",First snow? Here's where flakes have already fallen in the US - USA Today,USA Today
"Wed, 15 Oct 2025 23:57:38 GMT",Snow Days Headed to Colorado State - Colorado State Athletics,Colorado State Athletics
"Fri, 17 Oct 2025 05:18:00 GMT",NOAA Winter Outlook for Colorado shows good snow up north - CBS News,CBS News
"Fri, 17 Oct 2025 00:06:12 GMT","NOAA’s new winter outlook hints at a colder, snowier Minnesota - Bring Me The News",Bring Me The News
"Fri, 17 Oct 2025 03:42:00 GMT",Mount Washington sees first measurable snow of the season - WMUR,WMUR
"Thu, 16 Oct 2025 18:41:48 GMT",NOAA 2025–26 Winter Forecast: La Niña Brings Big Snow to the North - SnowBrains,SnowBrains
"Thu, 16 Oct 2025 20:18:00 GMT","New plows, more staff: Missouri plans for snow after last winter’s boondoggle - STLPR",STLPR
"Fri, 17 Oct 2025 00:47:31 GMT",Women's est Australian Classic Cowhide Wool Snow Boots Winter Waterproof Stain and Oil Resistant Warm Leather - The San Joaquin Valley Sun,The San Joaquin Valley Sun
"Thu, 16 Oct 2025 21:54:09 GMT",Christmas Snowman Crossbody Bag Let it Snow Christmas Gift for Her Christmas Party Gift Winter Snowflake Crossbody Purse - The San Joaquin Valley Sun,The San Joaquin Valley Sun
"Thu, 16 Oct 2025 21:01:02 GMT",Kids Skiing Snow Winter Gloves Teddy Fleece Scarf Hat Cute Beanie Gloves Neck Warmer for Cold Weather - The San Joaquin Valley Sun,The San Joaquin Valley Sun
"Thu, 16 Oct 2025 20:43:07 GMT",Girl's Boots Kids Glitter Snow Boots Slip Resistant Sequin Outdoor Ankle Boots for Toddler Little Kids/Big Kids - The San Joaquin Valley Sun,The San Joaquin Valley Sun
"Thu, 16 Oct 2025 20:39:08 GMT",HARENCE Girls Boys Snow Boots: Comfortable Warm Fur Lined Toddler Winter Boot Hook Loop Outdoor Waterproof Slip on Boots for Kids - The San Joaquin Valley Sun,The San Joaquin Valley Sun
"Thu, 16 Oct 2025 20:33:14 GMT","Winter Barefoot Shoes Women Men, Hiking Footwear Barefoot Snow Boots, Wide Toe Box Minimalist Sole Cotton Boots Sneakers for Hiking Walking Outdoor Unisex - The San Joaquin Valley Sun",The San Joaquin Valley Sun
"Thu, 16 Oct 2025 20:15:04 GMT",DREAM PAIRS Women's Knee High Boots Thick Faux Fur Lined Winter Snow Warm Boots with Zipper - The San Joaquin Valley Sun,The San Joaquin Valley Sun
"Thu, 16 Oct 2025 19:32:49 GMT","JAN & JUL Waterproof Fleece Lined Snow Suit, Coveralls for Toddlers and Kids - The San Joaquin Valley Sun",The San Joaquin Valley Sun
"Thu, 16 Oct 2025 17:21:35 GMT",ZZXXB Merry Christmas Rooster Snow Boys Long Pants Soft Trousers Elastic Waist Kids Lounge Bottoms with Pockets S-XL - The San Joaquin Valley Sun,The San Joaquin Valley Sun
"Thu, 16 Oct 2025 16:56:16 GMT",3 Pairs Kids Fleece Mittens Toddler Winter Warm Gloves Windproof Snow Ski Gloves for Boys and Girls Outdoor Activities - The San Joaquin Valley Sun,The San Joaquin Valley Sun
"Thu, 16 Oct 2025 16:18:46 GMT",Felabo Kids Snow Boots for Boys and Girls – Insulated Water Resistant Non Slip Easy On Winter Boots (Toddler/Little Kid/Big Kid) - The San Joaquin Valley Sun,The San Joaquin Valley Sun
"Thu, 16 Oct 2025 14:48:28 GMT",Olreco Toddler Snow Gloves Toddler Mittens Waterproof Kids Ski Gloves Thinsulate Baby Toddlers Winter Mittens for Kids 1-7Y - The San Joaquin Valley Sun,The San Joaquin Valley Sun
"Fri, 17 Oct 2025 01:18:20 GMT",Brittany Snow’s Ex-Husband Tyler Stanaland Engaged to Girlfriend - Us Weekly,Us Weekly
"Fri, 17 Oct 2025 01:25:00 GMT",Brittany Snow Has “Pie-In-The-Sky” ‘Hunting Wives’ Casting Idea For Aubrey Plaza - Deadline,Deadline
"Thu, 16 Oct 2025 21:58:53 GMT",Boreal Mountain Resort activates snow guns ahead of November opening - fox40.com,fox40.com
"Thu, 16 Oct 2025 22:59:03 GMT","Lingering showers this evening; two weather makers to bring rain, snow through the weekend - NBC Montana",NBC Montana
"Thu, 16 Oct 2025 15:22:30 GMT",Washington sees first snow of the season. When is snow expected in Puget Sound? - Kitsap Sun,Kitsap Sun
"Thu, 16 Oct 2025 19:54:40 GMT",How much snow to expect this winter in Delaware. What 3 forecasts are saying - The News Journal,The News Journal
"Fri, 17 Oct 2025 03:00:00 GMT",Study finds snow melts faster after wildfires - telluridenews.com,telluridenews.com
"Thu, 16 Oct 2025 23:44:03 GMT","WSDOT warns drivers after early snow causes closures, crashes on Blewett Pass - KIRO 7 News Seattle",KIRO 7 News Seattle
"Thu, 16 Oct 2025 13:49:37 GMT","Little Girls Winter 2-Piece Ski Snowsuit Set Puffer Jacket and Pants Girls Winter Jackets and Snow Pants (H, 9-10 Years) - The San Joaquin Valley Sun",The San Joaquin Valley Sun
"Thu, 16 Oct 2025 22:05:33 GMT","Mount Snow to reduce child care offerings, citing ‘long-term sustainability’ - VTDigger",VTDigger
"Thu, 16 Oct 2025 22:32:00 GMT","Lincoln city officials preview winter operations ahead of winter, snow season - KOLN | Nebraska Local News, Weather, Sports | Lincoln, NE","KOLN | Nebraska Local News, Weather, Sports | Lincoln, NE"
"Thu, 16 Oct 2025 20:07:30 GMT",More October Snow Blankets Utah Resorts as Ski Season Fast Approaches - POWDER Magazine,POWDER Magazine
"Thu, 16 Oct 2025 22:51:20 GMT",Gusty winds on Friday with scattered rain and mountain snow showers late in the day - KXLH News Helena,KXLH News Helena
"Thu, 16 Oct 2025 16:27:08 GMT",Big Girls Boys Ski Jacket and Pants Set Thicken Warm Winter Snowsuit Windproof Snowboarding 2 Pcs Snow Suit for Kids - The San Joaquin Valley Sun,The San Joaquin Valley Sun
"Thu, 16 Oct 2025 12:24:26 GMT","Kids Toddler Winter Snow Boots for Girls Boys Warm Fur Lined Shoes, Children's Cute Waterproof Outdoor Walking Boot - The San Joaquin Valley Sun",The San Joaquin Valley Sun
"Wed, 15 Oct 2025 20:03:50 GMT",Brad Paisley Shakes Up The Holidays With ‘Snow Globe Town’ Due In November - MusicRow.com,MusicRow.com
"Fri, 17 Oct 2025 04:38:05 GMT","Snoqualmie Pass, WA, Sees Earliest Snowfall In Years - SnowBrains",SnowBrains
"Thu, 16 Oct 2025 21:08:14 GMT",VIDEO: WSDOT warning drivers about snow in Blewitt Pass - KIRO 7 News Seattle,KIRO 7 News Seattle
"Thu, 16 Oct 2025 20:16:00 GMT",City of Ypsilanti's snow and ice enforcement goes into effect this week - WEMU,WEMU
"Thu, 16 Oct 2025 11:33:34 GMT",BMCiTYBM Baby Snow Boots Infant Boy Girl Winter Boots Nonslip Lightweight Outdoor Warm Shoes for Cold Weather 6 9 12 18 24 Months(Infant/Toddler) - The San Joaquin Valley Sun,The San Joaquin Valley Sun
"Thu, 16 Oct 2025 19:00:00 GMT","Town, County remind residents to clear sidewalks before winter snow removal - Buckrail - Jackson Hole, news","Buckrail - Jackson Hole, news"
"Wed, 15 Oct 2025 22:51:16 GMT","As first major snow falls on Tahoe, resorts announce opening dates - SFGATE",SFGATE
"Thu, 16 Oct 2025 15:03:55 GMT",Storm brings first big snow to Sierra - The Record Courier,The Record Courier
"Thu, 16 Oct 2025 10:38:16 GMT",IWIHMIV Snow Boots Toddler Boy Winter Shoes for Toddler Girls Toddler Snow Boots Comfortable Non Slip Outdoor Winter Boot Shoes - The San Joaquin Valley Sun,The San Joaquin Valley Sun
"Thu, 16 Oct 2025 11:02:46 GMT",FUDYNMALC Girls Boys Winter Snow Boots - Comfortable Warm Toddler Winter Shoes Waterproof Lightweight Kids Ankle Booties Outdoor Walking - The San Joaquin Valley Sun,The San Joaquin Valley Sun
"Thu, 16 Oct 2025 23:43:50 GMT","A Major Downhill Race at Snow Valley Resort in Big Bear, California, Has Been Announced for This Weekend - Mountain Bike Action",Mountain Bike Action
"Wed, 15 Oct 2025 17:22:20 GMT",Winter Has Arrived: See How Much Snow Fell at California’s Top Ski Resorts - POWDER Magazine,POWDER Magazine
"Thu, 16 Oct 2025 23:28:20 GMT",Weather changes ahead for eastern Montana with rain and snow expected - NonStop Local Billings,NonStop Local Billings
"Thu, 16 Oct 2025 17:32:16 GMT",MoDOT conducts annual winter weather drill to prepare for snow season - KTVO,KTVO
"Wed, 15 Oct 2025 15:13:56 GMT",Old Farmer’s Almanac releases Thanksgiving forecast. When could NY see its first snow? - Democrat and Chronicle,Democrat and Chronicle
"Thu, 16 Oct 2025 20:35:09 GMT",MoDOT snowplow drivers prepare for snow removal during annual Winter Operations Drill - KRCG,KRCG
"Tue, 14 Oct 2025 23:30:13 GMT",October storm brings fresh snow to Fresno County mountains - ABC30 Fresno,ABC30 Fresno
"Thu, 16 Oct 2025 21:15:08 GMT",Lincoln prepares for winter with enhanced snow removal fleet and community initiatives - KHGI,KHGI
"Thu, 16 Oct 2025 20:30:02 GMT",Are 'snow birds' going extinct? - WJAR,WJAR
"Thu, 16 Oct 2025 23:55:30 GMT",Mid-October snowfall fuels optimism about Lee Canyon's upcoming ski season - ktnv.com,ktnv.com
"Fri, 17 Oct 2025 05:56:35 GMT",Snowflake (SNOW) Partners with Palantir (PLTR): Is SNOW Stock a Buy Now? - Somos Hermanos -,Somos Hermanos -
"Thu, 16 Oct 2025 17:30:00 GMT","Rain, snow or sun? NOAA releases weather predictions for holidays, start of winter - The Hill",The Hill
"Wed, 15 Oct 2025 18:33:45 GMT",Storm totals: Here's how much rain and snow has fallen in Northern California - KCRA,KCRA
"Thu, 16 Oct 2025 17:52:43 GMT",How ski towns create snow ahead of ski season - FOX21 News Colorado,FOX21 News Colorado
"Thu, 16 Oct 2025 15:15:32 GMT",Erosion is washing away chunks of Snow's Cut shoreline. Here's how officials want to fix it. - Wilmington Star-News,Wilmington Star-News
"Thu, 16 Oct 2025 18:44:57 GMT",Kinston police arrest man for resisting and assaulting officers on Old Snow Hill Road - WCTI,WCTI
"Thu, 16 Oct 2025 16:34:49 GMT",Enhancing snow depth estimation with snow cover geometrical descriptors - Frontiers,Frontiers
"Thu, 16 Oct 2025 20:30:02 GMT",Are 'snow birds' going extinct? - WJAR,WJAR
"Thu, 16 Oct 2025 02:44:28 GMT","Pajama Pants Pajama Bottoms with Elastic Waistband Sleepwear Lounge Pants, Winter Snow Tree Print - The San Joaquin Valley Sun",The San Joaquin Valley Sun
"Thu, 16 Oct 2025 18:00:34 GMT","Mount Snow, VT, Shifts Childcare Model, Prompting Community Concern - SnowBrains",SnowBrains
"Wed, 15 Oct 2025 19:15:00 GMT",Travel Warning Issued as Up to 10 Inches of Snow Forecast - Newsweek,Newsweek
"Thu, 16 Oct 2025 16:51:39 GMT","Atmospheric river could bring rain, mountain snow to I-80 corridor near Reno - Reno Gazette Journal",Reno Gazette Journal
"Fri, 17 Oct 2025 06:43:46 GMT",Football Recap: Snow Hill Comes Up Short - MaxPreps.com,MaxPreps.com
"Fri, 17 Oct 2025 02:35:05 GMT",Brian Head sees first snowfall of the season - ABC4 Utah,ABC4 Utah
"Thu, 16 Oct 2025 00:17:01 GMT",MORENDL Kids' Snow Boots Insulated Waterproof Fur Lined Warm Anti-Slip Winter Shoes for Boys and Girls Outdoor Walking(Toddler/Little Kid) - The San Joaquin Valley Sun,The San Joaquin Valley Sun
"Wed, 15 Oct 2025 22:50:41 GMT","LONDON FOG Dex Boys and Girls Snow Boots - Insulated Waterproof Winter Kids Snow Boots - Size Toddler, Little Kid and Big Kid, Black, Navy and Pink Winter Boots for Boys and Girls - The San Joaquin Valley Sun",The San Joaquin Valley Sun
"Wed, 15 Oct 2025 15:47:00 GMT",Mountain snow to return this weekend as cold front hits western Washington - king5.com,king5.com
"Wed, 15 Oct 2025 12:50:42 GMT",Fall storm brings 1st snow to Southern California mountains - KTLA,KTLA
"Wed, 15 Oct 2025 22:18:51 GMT",Men's Genuine Leather Winter Hiking Boots Anti-Slip Waterproof Snow Booties with Faux Fur Lining Comfort Platform Lace-Up Warm Ankle Boots - The San Joaquin Valley Sun,The San Joaquin Valley Sun
"Wed, 15 Oct 2025 19:05:32 GMT","16-year-old allegedly covered his newborn in snow and shot her twice, leaving her to die - WKRC",WKRC
"Thu, 16 Oct 2025 18:02:22 GMT","20 Snow Attachments for Skid Steers, CTLs, Tractors, Trucks – Even UTVs - Equipment World",Equipment World
"Thu, 16 Oct 2025 20:13:11 GMT",Young Bison Jumps For Joy Celebrating First Snow Of The Year At Yellowstone National Park - whiskeyriff.com,whiskeyriff.com
"Thu, 16 Oct 2025 21:31:00 GMT","As Alamance County farmers pray for rain, Greensboro crews prepare for snow - wfmynews2.com",wfmynews2.com
"Wed, 15 Oct 2025 21:09:10 GMT",Up to 9 inches of snow could hit Colorado over upcoming days - Denver Gazette,Denver Gazette
"Thu, 16 Oct 2025 21:55:06 GMT",A few areas of rain and snow tonight; nicer weather for Friday and Saturday - Local News 8,Local News 8
"Wed, 15 Oct 2025 17:30:15 GMT",How does Lee Canyon’s first snowfall stack up to previous years for the Las Vegas ski resort - KLAS 8 News Now,KLAS 8 News Now
"Thu, 16 Oct 2025 21:56:00 GMT",Massachusetts snow: Data lays bare earliest winters in Boston and beyond as snow looms - The Mirror US,The Mirror US
"Fri, 17 Oct 2025 01:56:42 GMT","Jeannie Marie Snow Obituary (2025) - Bullard, TX - Boren-Conner Funeral Home - Bullard - legacy.com",legacy.com
"Thu, 16 Oct 2025 17:16:00 GMT",Snow in October? Here are all the times winter weather has started early in Mass. - MassLive.com,MassLive.com
"Thu, 16 Oct 2025 19:58:49 GMT","Old Farmer's Almanac Thanksgiving forecast 2025, when to expect first snow - Central New Jersey News",Central New Jersey News
"Thu, 16 Oct 2025 20:50:10 GMT",Snowflake Is Partnering With Palantir. Does That Make SNOW Stock A Buy Now? - Barchart.com,Barchart.com
"Thu, 16 Oct 2025 18:11:03 GMT",Snow dump and inactive landfills flagged as major methane polluters - Phys.org,Phys.org
"Fri, 17 Oct 2025 03:36:07 GMT","Chicago winter could be coldest, snowiest in years thanks to weather phenomenon called ""The Blob"" - CBS News",CBS News
"Fri, 17 Oct 2025 04:17:18 GMT",Soccer Recap: Snow Hill's Win on Thursday Extends Winning Streak to Three - MaxPreps.com,MaxPreps.com
"Thu, 16 Oct 2025 17:49:02 GMT",Cheyenne And Laramie Brace For The Season's First Snowfall This Weekend - KGAB,KGAB
"Thu, 16 Oct 2025 14:21:00 GMT","Lincoln city officials preview winter operations ahead of winter, snow season - KOLN | Nebraska Local News, Weather, Sports | Lincoln, NE","KOLN | Nebraska Local News, Weather, Sports | Lincoln, NE"
"Thu, 16 Oct 2025 19:29:40 GMT","Children's winter snow boots for boys and girls, wide toe barefoot snow boots, children's high-top cotton shoes, sneakers (D2506-Pink, Toddler, 9, Digital, US Shoe System, Wide Leg Pants) - The San Joaquin Valley Sun",The San Joaquin Valley Sun
"Thu, 16 Oct 2025 19:27:29 GMT",Isolated valley rain and mountain snow showers across northern Utah Thursday afternoon - ABC4 Utah,ABC4 Utah
"Thu, 16 Oct 2025 14:57:14 GMT","How cold, snowy will winter be? New NOAA forecast holds clues. - USA Today",USA Today
"Thu, 16 Oct 2025 17:57:00 GMT",How Triad snowplow drivers are training ahead of winter season - WXII,WXII
"Tue, 14 Oct 2025 19:14:00 GMT",California storm brings first heavy snow to Sierra Nevada with 2-3 feet along summits - FOX Weather,FOX Weather
2025-10-16T22:50:10,Snowflake Is Partnering with Palantir. Does That Make SNOW Stock a Buy Now?,Yahoo
2025-10-16T18:38:30,"Palantir, Snowflake Reverse Down Amid New AI Data Partnership",Yahoo
2025-10-16T16:55:00,"Snowflake & Palantir, Travelers, J.B. Hunt: Trending Tickers",Yahoo
2025-10-16T14:34:00,Snowflake Stock Jumps on Palantir AI Partnership,Yahoo
2025-10-16T14:22:06,"Palantir Rises, Snowflake Jumps On New AI Data Partnership",Yahoo
2025-10-16T14:00:44,Artisan Mid Cap Fund Trimmed Snowflake (SNOW) Following a Strong Performance And An Elevated Valuation,Yahoo
2025-10-16T12:59:00,Snowflake and Palantir Announce Strategic Partnership for Enterprise-Ready AI & Analytics,Yahoo
2025-10-16T01:25:56,Snowflake's Cash Flow Shows A Healthier Valuation Picture,SeekingAlpha
2025-10-15T17:30:00,Campfire Raises $65 Million Series B to Redefine How Finance Works in the AI Era,Yahoo
2025-10-15T17:09:00,Zip Named to LinkedIn’s 2025 Top Startups List in the U.S.,Yahoo
2025-10-15T16:15:17,Does Snowflake’s 96% Surge Signal Strong Growth or Investor Euphoria in 2025?,Yahoo
2025-10-15T15:00:12,Investors in Snowflake (NYSE:SNOW) have seen respectable returns of 96% over the past year,Yahoo
2025-10-14T17:27:05,Snowflake Stock: Try This Iron Condor Trade With A Bullish Tilt,Yahoo
2025-10-14T15:30:03,Wall Street Analysts Think Snowflake (SNOW) Is a Good Investment: Is It?,Yahoo
2025-10-14T15:05:00,Verato to Host Expert Panel on Master Data Management and AI-Ready Transformation at Gartner® IT Symposium/Xpo™ 2025,Yahoo
2025-10-14T15:00:00,Cognite and Snowflake Form Strategic Partnership to Unify Industrial Data for Enterprise-Wide AI at Scale,Yahoo
2025-10-13T19:56:43,Snowflake Looks Deeply Undervalued Here Based on Its Own FCF Margin Analysis,Yahoo
2025-10-13T18:44:10,Breakout Watch: This AI-Fueled Palantir Peer And Nvidia Partner Is No Flake,Yahoo
2025-10-13T15:28:50,Snowflake Launches Cortex AI for Financial Services with Secure AI Capabilities,Yahoo
2025-10-13T05:54:04,"UBS Raises Price Target on Snowflake (SNOW) to $310, Maintains Buy After Industry Events",Yahoo
2025-10-13T02:09:57,MEGMILK SNOW BRAND (TSE:2270): Evaluating Valuation After Completing Major Share Buyback,Yahoo
