Date,Title,Source
"Sat, 06 Sep 2025 14:12:13 GMT",Will New SOUR PATCH KIDS Strips Reveal Mondelez (MDLZ) Innovation Strength in the Candy Market? - simplywall.st,simplywall.st
"Sun, 07 Sep 2025 11:14:12 GMT","Investmark Advisory Group LLC Takes Position in Mondelez International, Inc. $MDLZ - MarketBeat",MarketBeat
"Wed, 03 Sep 2025 17:32:48 GMT",Mondelez International (MDLZ) Introduces SOUR PATCH KIDS Strips In Exciting New Format - sg.finance.yahoo.com,sg.finance.yahoo.com
"Sun, 07 Sep 2025 07:00:00 GMT","7,072 Shares in Mondelez International, Inc. $MDLZ Purchased by Belmont Capital LLC - MarketBeat",MarketBeat
"Sun, 07 Sep 2025 13:56:06 GMT","Advisors Asset Management Inc. Reduces Holdings in Mondelez International, Inc. $MDLZ - MarketBeat",MarketBeat
"Sun, 07 Sep 2025 10:48:05 GMT","Amundi Trims Stake in Mondelez International, Inc. $MDLZ - MarketBeat",MarketBeat
"Sun, 07 Sep 2025 13:11:56 GMT","Mondelez International, Inc. $MDLZ Shares Sold by AQR Capital Management LLC - MarketBeat",MarketBeat
"Sun, 07 Sep 2025 09:40:45 GMT","4,186 Shares in Mondelez International, Inc. $MDLZ Acquired by Aprio Wealth Management LLC - MarketBeat",MarketBeat
"Sat, 06 Sep 2025 11:41:26 GMT","Boothbay Fund Management LLC Increases Position in Mondelez International, Inc. $MDLZ - MarketBeat",MarketBeat
"Sun, 07 Sep 2025 00:43:48 GMT","DRW Securities LLC Buys 14,336 Shares of Mondelez International, Inc. $MDLZ - MarketBeat",MarketBeat
"Sat, 06 Sep 2025 11:30:51 GMT","Banque Transatlantique SA Buys 9,449 Shares of Mondelez International, Inc. $MDLZ - MarketBeat",MarketBeat
"Fri, 05 Sep 2025 19:30:00 GMT","MAI Capital Management Has $22.14 Million Stake in Mondelez International, Inc. $MDLZ - MarketBeat",MarketBeat
"Sat, 06 Sep 2025 09:55:25 GMT","Graham Capital Management L.P. Acquires New Stake in Mondelez International, Inc. $MDLZ - MarketBeat",MarketBeat
"Sat, 06 Sep 2025 10:57:56 GMT","Alyeska Investment Group L.P. Acquires New Holdings in Mondelez International, Inc. $MDLZ - MarketBeat",MarketBeat
"Sat, 06 Sep 2025 07:00:00 GMT","Baird Financial Group Inc. Acquires 5,815 Shares of Mondelez International, Inc. $MDLZ - MarketBeat",MarketBeat
"Fri, 05 Sep 2025 07:00:00 GMT","Panagora Asset Management Inc. Sells 224,229 Shares of Mondelez International, Inc. $MDLZ - MarketBeat",MarketBeat
"Fri, 05 Sep 2025 18:45:00 GMT","Landscape Capital Management L.L.C. Trims Position in Mondelez International, Inc. $MDLZ - MarketBeat",MarketBeat
"Fri, 05 Sep 2025 10:02:02 GMT","50,537 Shares in Mondelez International, Inc. $MDLZ Purchased by Dark Forest Capital Management LP - MarketBeat",MarketBeat
"Thu, 04 Sep 2025 07:00:00 GMT","Twin Tree Management LP Grows Stock Holdings in Mondelez International, Inc. $MDLZ - MarketBeat",MarketBeat
"Thu, 04 Sep 2025 07:00:00 GMT","Mondelez International, Inc. $MDLZ Shares Sold by CreativeOne Wealth LLC - MarketBeat",MarketBeat
"Thu, 04 Sep 2025 07:00:00 GMT","Ieq Capital LLC Sells 36,094 Shares of Mondelez International, Inc. $MDLZ - MarketBeat",MarketBeat
"Thu, 04 Sep 2025 07:00:00 GMT","Canada Pension Plan Investment Board Decreases Stake in Mondelez International, Inc. $MDLZ - MarketBeat",MarketBeat
"Wed, 03 Sep 2025 11:02:29 GMT","Mondelez International, Inc. $MDLZ Shares Purchased by Royal Bank of Canada - MarketBeat",MarketBeat
"Wed, 03 Sep 2025 07:00:00 GMT","Lansforsakringar Fondforvaltning AB publ Sells 11,519 Shares of Mondelez International, Inc. $MDLZ - MarketBeat",MarketBeat
"Wed, 03 Sep 2025 07:00:00 GMT","Mondelez International, Inc. $MDLZ Shares Purchased by Vident Advisory LLC - MarketBeat",MarketBeat
"Wed, 03 Sep 2025 12:09:43 GMT","First Manhattan CO. LLC. Has $163.75 Million Stock Position in Mondelez International, Inc. $MDLZ - MarketBeat",MarketBeat
"Sat, 06 Sep 2025 15:45:55 GMT",Is MDLZ forming a breakout pattern - 2025 Pullback Review & Long-Term Growth Portfolio Plans - خودرو بانک,خودرو بانک
"Fri, 05 Sep 2025 20:58:22 GMT",Can MDLZ stock outperform in a bear market - 2025 Risk Factors & Technical Buy Zone Confirmation - خودرو بانک,خودرو بانک
"Thu, 04 Sep 2025 13:21:46 GMT",Is MDLZ stock overvalued or fairly priced - Profit Target & Free Weekly Watchlist of Top Performers - خودرو بانک,خودرو بانک
"Wed, 03 Sep 2025 16:59:11 GMT",Can MDLZ navigate macro headwinds - 2025 Big Picture & Consistent Growth Stock Picks - خودرو بانک,خودرو بانک
"Wed, 03 Sep 2025 14:01:59 GMT",What drives MDLZ’s stock price - 2025 Institutional Moves & AI Forecast for Swing Trade Picks - خودرو بانک,خودرو بانک
"Mon, 08 Sep 2025 05:26:29 GMT",How hedge fund analytics apply to MDLZ stock - July 2025 Levels & Reliable Momentum Entry Alerts - Newser,Newser
"Mon, 08 Sep 2025 05:43:47 GMT",MDLZ stock trend outlook and recovery path - Weekly Investment Report & Reliable Entry Point Alerts - Newser,Newser
"Mon, 08 Sep 2025 05:26:18 GMT",Sector ETF performance correlation with MDLZ - Share Buyback & Free Daily Entry Point Trade Alerts - Newser,Newser
"Mon, 08 Sep 2025 06:46:19 GMT",Is MDLZ stock reversal real or fake - 2025 Dividend Review & Breakout Confirmation Trade Signals - Newser,Newser
"Thu, 04 Sep 2025 22:58:18 GMT",MDLZ Slumps 0.65% with 56.32% Volume Drop to $280M (Rank 382) Amid Revenue Woes and Dividend Adjustments - AInvest,AInvest
"Sat, 06 Sep 2025 21:06:40 GMT",What to do if you’re stuck in MDLZ - Quarterly Trade Summary & Low Drawdown Trading Strategies - Newser,Newser
2025-09-03T20:32:48,Mondelez International (MDLZ) Introduces SOUR PATCH KIDS Strips In Exciting New Format,Yahoo
2025-09-03T13:11:12,"Mondelez International, Inc. (MDLZ) Presents At Barclays 18th Annual Global Consumer Staples Conference 2025 Transcript",SeekingAlpha
