Date,Title,Source
2025-09-18T05:12:46Z,ETRACS Crude Oil Shares Covered Call ETN (NASDAQ:USOI) Sees Large Increase in Short Interest,ETF Daily News
2025-09-17T17:37:44Z,Jim Cramer Says Eaton Corporation plc (ETN) Suffers From Short Reporting Periods,Biztoc.com
2025-09-17T17:16:06Z,Jim Cramer Says Eaton Corporation plc (ETN) Suffers From Short Reporting Periods,Yahoo Entertainment
2025-09-17T06:55:06Z,iPath Bloomberg Commodity Index Total Return ETN (NYSEARCA:DJP) Sees Large Decrease in Short Interest,ETF Daily News
2025-09-17T05:16:45Z,Raymond James Financial Reaffirms “Strong-Buy” Rating for Market Vectors Indian Rupee/USD ETN (NYSEARCA:INR),ETF Daily News
2025-09-17T03:38:30Z,"Eaton (ETN) Set to Ride AI Data Center Boom, Analysts Reiterate Outperform",Yahoo Entertainment
2025-09-16T07:43:15Z,MAX Airlines 3x Leveraged ETN (NYSEARCA:JETU) Stock Price Down 2.8% – Here’s What Happened,ETF Daily News
2025-09-16T07:28:53Z,Eaton (NYSE:ETN) PT Set at $495.00 by Melius Research,ETF Daily News
2025-09-16T06:34:44Z,Melius Upgrades Eaton (NYSE:ETN) to “Buy”,ETF Daily News
2025-09-15T07:50:47Z,ETRACS Monthly Pay 2xLeveraged Preferred Stock ETN (NYSEARCA:PFFL) Short Interest Update,ETF Daily News
2025-09-15T06:44:48Z,MicroSectors FANG+ ETN (NYSEARCA:FNGS) Short Interest Down 33.9% in August,ETF Daily News
2025-09-14T07:52:49Z,MicroSectors Energy -3X Inverse Leveraged ETN (NYSEARCA:WTID) Short Interest Up 433.3% in August,ETF Daily News
"Thu, 18 Sep 2025 10:00:30 GMT",Eaton Corporation (ETN): Analysts Call It a “Secular Winner” Amid AI Boom - Yahoo Finance,Yahoo Finance
"Wed, 17 Sep 2025 19:54:15 GMT",Eaton (ETN): Assessing Current Valuation After Recent Strong Performance - simplywall.st,simplywall.st
"Thu, 18 Sep 2025 23:47:00 GMT",Eaton (ETN) Exceeds Market Returns: Some Facts to Consider - sharewise.com,sharewise.com
"Thu, 18 Sep 2025 10:39:23 GMT",Eaton Corporation (ETN): Analysts Call It a “Secular Winner” Amid AI Boom - MSN,MSN
"Tue, 16 Sep 2025 00:02:00 GMT",Melius Research Upgrades Eaton (ETN) - Nasdaq,Nasdaq
"Fri, 19 Sep 2025 04:22:29 GMT",Earnings Recap: Is ETRACS Monthly Pay 15x Leveraged Mortgage REIT ETN impacted by rising rates - July 2025 WrapUp & AI Enhanced Trade Execution Alerts - khodrobank.com,khodrobank.com
"Wed, 17 Sep 2025 07:24:28 GMT",ETRACS Crude Oil Shares Covered Call ETN (NASDAQ:USOI) Short Interest Update - MarketBeat,MarketBeat
"Wed, 17 Sep 2025 17:16:06 GMT",Jim Cramer Says Eaton Corporation plc (ETN) Suffers From Short Reporting Periods - Yahoo Finance,Yahoo Finance
"Thu, 18 Sep 2025 09:05:00 GMT","The Zacks Analyst Blog Highlights iPath Series B S&P 500 VIX Short-Term Futures ETN, ProShares VIX Short-Term Futures ETF and ProShares VIX Mid-Term Futures ETF - Nasdaq",Nasdaq
"Wed, 17 Sep 2025 11:35:10 GMT",Will Eaton’s (ETN) New Digital Partnerships Reshape Its Competitive Edge in Energy Management? - Yahoo Finance,Yahoo Finance
"Fri, 19 Sep 2025 04:32:37 GMT",Bond Watch: Will DB Gold Double Short ETN face regulatory challenges - Weekly Investment Report & Accurate Intraday Trade Tips - khodrobank.com,khodrobank.com
"Tue, 16 Sep 2025 14:48:00 GMT","GRID, ETN, JCI, PWR: ETF Inflow Alert - Nasdaq",Nasdaq
"Wed, 17 Sep 2025 03:47:25 GMT","Eaton (ETN) Set to Ride AI Data Center Boom, Analysts Reiterate Outperform - Yahoo Finance",Yahoo Finance
"Tue, 16 Sep 2025 13:00:03 GMT","Eaton Corporation, PLC (ETN) Is a Trending Stock: Facts to Know Before Betting on It - Yahoo Finance",Yahoo Finance
"Fri, 19 Sep 2025 06:51:26 GMT",Rate Hike: Whats the MACD signal for ETRACS Monthly Pay 15x Leveraged Mortgage REIT ETN - Profit Target & Low Risk High Reward Trade Ideas - khodrobank.com,khodrobank.com
"Fri, 19 Sep 2025 03:04:32 GMT",Quarterly Recap: Is iPath Series B S P 500 VIX Short Term Futures ETN part of any ETF - Profit Target & Expert Approved Momentum Trade Ideas - khodrobank.com,khodrobank.com
"Thu, 18 Sep 2025 20:06:09 GMT",IPO Launch: Is ETRACS 2xMonthly Pay Leveraged Index ETN attractive for institutional investors - Earnings Beat & Accurate Entry/Exit Alerts - khodrobank.com,khodrobank.com
"Mon, 15 Sep 2025 19:45:55 GMT",Eaton Corp (ETN) Upgraded to 'Buy' With Raised Price Target | ET - GuruFocus,GuruFocus
"Thu, 18 Sep 2025 15:36:36 GMT",Investment Review: Can ETRACS 2x Leveraged MSCI US Quality Factor TR ETN disrupt its industry - khodrobank.com,khodrobank.com
"Thu, 18 Sep 2025 22:06:18 GMT",Trend Recap: Is ETRACS MVIS Business Development Companies Index ETN part of any major index - Weekly Profit Recap & Verified Short-Term Trading Plans - khodrobank.com,khodrobank.com
"Thu, 18 Sep 2025 17:19:04 GMT",Aug Macro: Can ETRACS Monthly Pay 15x Leveraged Mortgage REIT ETN reach all time highs this year - khodrobank.com,khodrobank.com
"Tue, 16 Sep 2025 15:24:38 GMT",Aug Catalysts: Will ETRACS Quarterly Pay 15x Leveraged Alerian MLP Index ETN outperform its industry peers - 2025 Buyback Activity & Reliable Price Action Trade Plans - khodrobank.com,khodrobank.com
"Thu, 18 Sep 2025 16:54:03 GMT",Nasdaq Moves: Can ETRACS 2xMonthly Pay Leveraged Index ETN expand into new markets - Swing Trade & Real-Time Chart Pattern Alerts - khodrobank.com,khodrobank.com
"Thu, 18 Sep 2025 15:54:02 GMT",Patterns Watch: Is ETRACS 2x Leveraged US Value Factor TR ETN a turnaround story - Weekly Trade Summary & Verified Swing Trading Watchlists - khodrobank.com,khodrobank.com
"Thu, 18 Sep 2025 17:43:46 GMT",Whale Trades: How does ETRACS Quarterly Pay 1.5x Leveraged MVIS BDC Index ETN correlate with Nasdaq - 2025 Key Lessons & Long-Term Growth Portfolio Plans - khodrobank.com,khodrobank.com
"Wed, 17 Sep 2025 15:24:00 GMT",Patterns Watch: Is ETRACS Quarterly Pay 15x Leveraged MVIS BDC Index ETN benefiting from innovation trends - 2025 Earnings Impact & Short-Term Swing Trade Alerts - khodrobank.com,khodrobank.com
"Tue, 16 Sep 2025 23:43:03 GMT",Volatility Watch: Is ETRACS Quarterly Pay 15x Leveraged Alerian MLP Index ETN currently under institutional pressure - 2025 Market Trends & Weekly High Conviction Ideas - khodrobank.com,khodrobank.com
"Wed, 17 Sep 2025 16:48:28 GMT",Short Squeeze: How do insiders feel about ETRACS Quarterly Pay 15x Leveraged Alerian MLP Index ETN - July 2025 Earnings & Fast Moving Trade Plans - khodrobank.com,khodrobank.com
"Tue, 16 Sep 2025 01:41:33 GMT",Activity Recap: Is ETRACS Quarterly Pay 15x Leveraged Alerian MLP Index ETN forming a bullish divergence - July 2025 Sector Moves & Verified Chart Pattern Signals - khodrobank.com,khodrobank.com
"Tue, 16 Sep 2025 20:09:24 GMT",Performance Recap: Is ETRACS Quarterly Pay 15x Leveraged Alerian MLP Index ETN currently under institutional pressure - Weekly Profit Summary & Free Expert Approved Momentum Trade Ideas - khodrobank.com,khodrobank.com
"Tue, 16 Sep 2025 23:16:45 GMT",Rate Hike: Is ETRACS Monthly Pay 15x Leveraged Mortgage REIT ETN in accumulation or distribution phase - 2025 Performance Recap & Real-Time Volume Surge Alerts - khodrobank.com,khodrobank.com
"Wed, 17 Sep 2025 07:56:09 GMT",Inflation Data: Can ETRACS 2x Leveraged MSCI US Quality Factor TR ETN scale operations efficiently - July 2025 Analyst Calls & Free Real-Time Market Sentiment Alerts - khodrobank.com,khodrobank.com
"Wed, 17 Sep 2025 03:59:09 GMT",Weekly Recap: Will iPath Select MLP ETN stock go up in YEAR - July 2025 Big Picture & Safe Capital Investment Plans - khodrobank.com,khodrobank.com
"Wed, 17 Sep 2025 16:25:06 GMT",Portfolio Recap: Will ETRACS 2xMonthly Pay Leveraged Index ETN benefit from geopolitical trends - Earnings Trend Report & Fast Entry High Yield Stock Tips - khodrobank.com,khodrobank.com
"Tue, 16 Sep 2025 21:07:35 GMT",Analyst Calls: Will ETRACS 2x Leveraged MSCI US Momentum Factor TR ETN stock recover after earnings - July 2025 Closing Moves & Long-Term Growth Plans - khodrobank.com,khodrobank.com
"Wed, 17 Sep 2025 19:05:04 GMT",Profit Review: What is the earnings history of ETRACS MVIS Business Development Companies Index ETN - Share Buyback & AI Enhanced Trading Signals - khodrobank.com,khodrobank.com
"Tue, 16 Sep 2025 21:27:27 GMT",Is iPath Select MLP ETN stock heavily shorted - 2025 Trading Recap & Technical Analysis for Trade Confirmation - khodrobank.com,khodrobank.com
"Mon, 15 Sep 2025 20:54:08 GMT",Risk Analysis: Will ETRACS Quarterly Pay 15x Leveraged Alerian MLP Index ETN stock benefit from M A - 2025 EndofYear Setup & Fast Exit and Entry Trade Guides - khodrobank.com,khodrobank.com
"Wed, 17 Sep 2025 04:27:29 GMT",Moving Averages: Is ETRACS MVIS Business Development Companies Index ETN a cyclical or defensive stock - July 2025 Snapshot & Comprehensive Market Scan Reports - khodrobank.com,khodrobank.com
"Tue, 16 Sep 2025 07:09:03 GMT",Chipmakers Recap: Is ETRACS 2x Leveraged US Growth Factor TR ETN stock a smart retirement pick - 2025 Volume Leaders & Weekly High Return Stock Forecasts - khodrobank.com,khodrobank.com
"Tue, 16 Sep 2025 06:25:09 GMT",Swing Trade: Can DB Gold Short ETN expand its profit margins - Weekly Profit Summary & Technical Buy Zone Confirmations - khodrobank.com,khodrobank.com
"Tue, 16 Sep 2025 12:47:18 GMT",Nasdaq Moves: What’s the outlook for ETRACS 2xMonthly Pay Leveraged Index ETN’s sector - Recession Risk & Daily Entry Point Trade Alerts - khodrobank.com,khodrobank.com
"Wed, 17 Sep 2025 00:47:36 GMT",Gap Down: What is DB Gold Double Short ETN s 5 year growth outlook - Quarterly Growth Report & Weekly Hot Stock Watchlists - khodrobank.com,khodrobank.com
"Tue, 16 Sep 2025 15:25:06 GMT",Momentum Shift: Can ETRACS Quarterly Pay 15x Leveraged MVIS BDC Index ETN beat the S P 500 - Dip Buying & AI Powered Buy and Sell Recommendations - khodrobank.com,khodrobank.com
"Tue, 16 Sep 2025 10:25:31 GMT",Sentiment Recap: Is ETRACS Quarterly Pay 15x Leveraged Alerian MLP Index ETN a cyclical or defensive stock - July 2025 Weekly Recap & Risk Controlled Swing Alerts - khodrobank.com,khodrobank.com
"Wed, 17 Sep 2025 03:45:09 GMT",Take Profit: Is ETRACS 2xMonthly Pay Leveraged Index ETN exposed to political risk - Stop Loss & Expert Verified Stock Movement Alerts - khodrobank.com,khodrobank.com
"Tue, 16 Sep 2025 20:05:00 GMT",Bull Bear: Is now the right time to enter ETRACS Quarterly Pay 15x Leveraged Alerian MLP Index ETN - 2025 Top Gainers & Real-Time Chart Pattern Alerts - khodrobank.com,khodrobank.com
"Wed, 17 Sep 2025 00:54:35 GMT",Downgrade Watch: Will ETRACS 2x Leveraged MSCI US Momentum Factor TR ETN stock benefit from M A - Fed Meeting & Breakout Confirmation Alerts - khodrobank.com,khodrobank.com
"Tue, 16 Sep 2025 12:39:50 GMT",Aug Highlights: Is ETRACS 2x Leveraged MSCI US Momentum Factor TR ETN still a buy after recent gains - Portfolio Value Report & Long-Term Safe Investment Ideas - khodrobank.com,khodrobank.com
"Mon, 15 Sep 2025 22:54:03 GMT",Signal Recap: Can ETRACS 2x Leveraged US Value Factor TR ETN expand its profit margins - Bear Alert & AI Driven Price Predictions - khodrobank.com,khodrobank.com
"Mon, 15 Sep 2025 23:50:52 GMT",Stock Report: Is ETRACS Quarterly Pay 15x Leveraged MVIS BDC Index ETN forming a breakout pattern - khodrobank.com,khodrobank.com
"Wed, 17 Sep 2025 04:24:13 GMT",Portfolio Recap: Will ETRACS 2xMonthly Pay Leveraged Index ETN benefit from geopolitical trends - Earnings Trend Report & Fast Entry High Yield Stock Tips - khodrobank.com,khodrobank.com
"Tue, 16 Sep 2025 11:53:31 GMT",Aug Momentum: Can ETRACS 2xMonthly Pay Leveraged Index ETN sustain its profitability - Portfolio Gains Summary & Risk Controlled Swing Alerts - khodrobank.com,khodrobank.com
"Wed, 17 Sep 2025 23:41:55 GMT",Dow Update: What are the risks of holding ETRACS 2x Leveraged MSCI US Quality Factor TR ETN - Weekly Investment Report & Expert Curated Trade Setup Alerts - khodrobank.com,khodrobank.com
"Tue, 16 Sep 2025 19:14:22 GMT",Rally Mode: Can DB Gold Double Short ETN grow without dilution - Portfolio Growth Summary & Entry Point Confirmation Alerts - khodrobank.com,khodrobank.com
"Tue, 16 Sep 2025 19:58:16 GMT",Bank Watch: How much upside does DB Gold Double Long ETN have - Weekly Trading Summary & Risk Adjusted Buy/Sell Alerts - khodrobank.com,khodrobank.com
"Wed, 17 Sep 2025 01:03:20 GMT",Winners Losers: Is iPath Select MLP ETN affected by consumer sentiment - Quarterly Market Review & Real-Time Chart Pattern Alerts - khodrobank.com,khodrobank.com
"Wed, 17 Sep 2025 04:31:30 GMT",Risk Analysis: Is ETRACS 2x Leveraged MSCI US Momentum Factor TR ETN gaining market share - Portfolio Performance Report & Intraday High Probability Alerts - khodrobank.com,khodrobank.com
"Tue, 16 Sep 2025 18:01:53 GMT",Aug Ideas: Will ETRACS MVIS Business Development Companies Index ETN outperform during market rallies - Rate Hike & Reliable Breakout Forecasts - khodrobank.com,khodrobank.com
"Tue, 16 Sep 2025 01:17:58 GMT",Whale Trades: Is ETRACS 2x Leveraged US Growth Factor TR ETN stock a smart retirement pick - Market Trend Report & Accurate Buy Signal Notifications - khodrobank.com,khodrobank.com
"Mon, 15 Sep 2025 23:43:04 GMT",Can DB Gold Short ETN deliver consistent dividends - 2025 Bull vs Bear & AI Based Trade Execution Alerts - khodrobank.com,khodrobank.com
"Tue, 16 Sep 2025 11:44:52 GMT",Aug Selloffs: Can iPath Series B S P 500 VIX Short Term Futures ETN navigate macro headwinds - July 2025 Chart Watch & Daily Stock Momentum Reports - khodrobank.com,khodrobank.com
"Tue, 16 Sep 2025 03:54:15 GMT",Dow Update: Can DB Gold Double Long ETN outperform in the next rally - Breakout Watch & Expert Verified Movement Alerts - khodrobank.com,khodrobank.com
"Tue, 16 Sep 2025 10:34:44 GMT",Hedge Fund Moves: What are DB Gold Double Long ETN’s growth levers - Sell Signal & Free Fast Gain Swing Trade Alerts - khodrobank.com,khodrobank.com
"Tue, 16 Sep 2025 05:40:57 GMT",Insider Sell: Can DB Gold Double Short ETN keep up with sector leaders - Rate Hike & Target Return Focused Stock Picks - khodrobank.com,khodrobank.com
"Mon, 15 Sep 2025 11:45:54 GMT",New Highs: Is ETRACS 2xMonthly Pay Leveraged Index ETN likely to announce a buyback - Portfolio Risk Report & Verified Trade Idea Suggestions - khodrobank.com,khodrobank.com
"Mon, 15 Sep 2025 21:17:40 GMT",US Market Recap: Is ETRACS 2xMonthly Pay Leveraged Index ETN stock a good dividend stock - Weekly Earnings Recap & Daily Price Action Insights - khodrobank.com,khodrobank.com
"Tue, 16 Sep 2025 10:38:46 GMT",Take Profit: What is ETRACS 2x Leveraged MSCI US Quality Factor TR ETN s 5 year growth outlook - Trade Signal Summary & Weekly Top Gainers Alerts - khodrobank.com,khodrobank.com
"Mon, 15 Sep 2025 11:45:01 GMT",US Stocks Recap: Can DB Gold Double Short ETN stock outperform in a bear market - Trade Analysis Summary & High Yield Equity Trading Tips - khodrobank.com,khodrobank.com
"Mon, 15 Sep 2025 16:11:46 GMT",Profit Review: Can DB Gold Double Long ETN withstand a market correction - July 2025 Setups & Free AI Powered Buy and Sell Recommendations - khodrobank.com,khodrobank.com
"Mon, 15 Sep 2025 16:02:38 GMT",Revenue Check: Can DB Gold Double Short ETN navigate macro headwinds - 2025 Geopolitical Influence & Reliable Price Action Trade Plans - khodrobank.com,khodrobank.com
"Tue, 16 Sep 2025 10:09:55 GMT",Big Money Moves: How does iPath Series B S P 500 VIX Short Term Futures ETN compare to its peers - Weekly Risk Summary & Weekly Return Optimization Alerts - khodrobank.com,khodrobank.com
"Mon, 15 Sep 2025 19:55:56 GMT",Breakout Watch: What is the next catalyst for ETRACS 2x Leveraged US Value Factor TR ETN - July 2025 Recap & Trade Opportunity Analysis Reports - khodrobank.com,khodrobank.com
"Mon, 15 Sep 2025 22:28:07 GMT",Fund Flows: What are analysts’ price targets for DB Gold Double Long ETN - 2025 Key Highlights & Real-Time Volume Analysis Alerts - khodrobank.com,khodrobank.com
"Tue, 16 Sep 2025 00:37:51 GMT",Aug Final Week: Is iPath Series B S P 500 VIX Short Term Futures ETN gaining market share - Quarterly Market Review & Consistent Profit Trade Alerts - khodrobank.com,khodrobank.com
"Mon, 15 Sep 2025 17:01:51 GMT",Setup Watch: Is iPath Series B S&P 500 VIX Short Term Futures ETN stock influenced by commodity prices - khodrobank.com,khodrobank.com
"Fri, 19 Sep 2025 05:58:21 GMT",ETRACS 2x Leveraged US Growth Factor TR ETN stock chart pattern explained - Market Performance Summary & AI Powered Market Trend Analysis - newser.com,newser.com
"Fri, 19 Sep 2025 05:45:28 GMT",Using data models to predict DB Gold Double Short ETN stock movement - July 2025 Highlights & Fast Moving Market Watchlists - newser.com,newser.com
"Fri, 19 Sep 2025 04:48:28 GMT",P 500 VIX Short Term Futures ETN - Weekly Gains Report & Entry Point Strategy Guides - newser.com,newser.com
"Fri, 19 Sep 2025 06:38:41 GMT",Visual trend scoring systems applied to DB Gold Short ETN - July 2025 Analyst Calls & Daily Stock Trend Watchlist - newser.com,newser.com
"Fri, 19 Sep 2025 02:18:21 GMT",Has DB Gold Short ETN found a price floor - 2025 Institutional Moves & Accurate Trade Setup Notifications - newser.com,newser.com
"Fri, 19 Sep 2025 02:58:42 GMT",Comparing ETRACS 2x Leveraged MSCI US Quality Factor TR ETN in custom built stock radars - Trade Analysis Report & Community Consensus Trade Signals - newser.com,newser.com
"Fri, 19 Sep 2025 03:06:19 GMT",How to integrate ETRACS 2x Leveraged MSCI US Quality Factor TR ETN into portfolio analysis tools - Weekly Earnings Recap & AI Enhanced Trading Signals - newser.com,newser.com
"Fri, 19 Sep 2025 05:22:49 GMT",DB Gold Short ETN recovery potential after sell off - Wall Street Watch & Verified Momentum Stock Watchlist - newser.com,newser.com
"Fri, 19 Sep 2025 02:54:45 GMT",What’s the recovery path for long term holders of ETRACS 2xMonthly Pay Leveraged Index ETN - Market Weekly Review & Fast Entry High Yield Stock Tips - newser.com,newser.com
"Thu, 18 Sep 2025 22:13:24 GMT",ETRACS Quarterly Pay 1.5x Leveraged Alerian MLP Index ETN stock volume spike explained - Trade Performance Summary & Verified High Yield Trade Plans - newser.com,newser.com
"Thu, 18 Sep 2025 22:00:30 GMT",Is ETRACS Quarterly Pay 1.5x Leveraged Alerian MLP Index ETN stock reversal real or fake - Weekly Market Report & Safe Capital Preservation Plans - newser.com,newser.com
"Thu, 18 Sep 2025 21:19:21 GMT",Is DB Gold Short ETN meeting your algorithmic filter criteria - July 2025 Closing Moves & Advanced Swing Trade Entry Alerts - newser.com,newser.com
"Fri, 19 Sep 2025 01:49:24 GMT",ETRACS 2x Leveraged MSCI US Quality Factor TR ETN stock trendline breakdown - Quarterly Market Summary & Weekly Chart Analysis and Trade Guides - newser.com,newser.com
"Thu, 18 Sep 2025 22:23:38 GMT",Best data tools to analyze ETRACS Quarterly Pay 1.5x Leveraged Alerian MLP Index ETN stock - Fed Meeting & Real-Time Buy Signal Alerts - newser.com,newser.com
"Fri, 19 Sep 2025 02:43:57 GMT",Using Python tools to backtest ETRACS 2x Leveraged US Growth Factor TR ETN strategies - Quarterly Growth Report & Capital Efficient Trade Techniques - newser.com,newser.com
"Thu, 18 Sep 2025 18:51:28 GMT",P 500 VIX Short Term Futures ETN - Weekly Trade Report & AI Enhanced Trade Execution Alerts - newser.com,newser.com
"Thu, 18 Sep 2025 18:57:30 GMT",Tick level data insight on DB Gold Double Long ETN volatility - July 2025 Catalysts & Long-Term Capital Growth Strategies - newser.com,newser.com
"Thu, 18 Sep 2025 18:59:32 GMT",Custom watchlist performance reports with iPath Series B Carbon ETN - Quarterly Portfolio Report & Technical Confirmation Alerts - newser.com,newser.com
"Thu, 18 Sep 2025 17:13:01 GMT",Intraday pattern recognizer results for ETRACS MVIS Business Development Companies Index ETN - Weekly Gains Report & Real-Time Market Sentiment Alerts - newser.com,newser.com
"Thu, 18 Sep 2025 16:41:46 GMT",Applying big data sentiment scoring on ETRACS MVIS Business Development Companies Index ETN - July 2025 News Drivers & Intraday High Probability Setup Alerts - newser.com,newser.com
2025-09-18T13:00:30,Eaton Corporation (ETN): Analysts Call It a “Secular Winner” Amid AI Boom,Yahoo
2025-09-17T20:16:06,Jim Cramer Says Eaton Corporation plc (ETN) Suffers From Short Reporting Periods,Yahoo
2025-09-17T14:35:10,Will Eaton’s (ETN) New Digital Partnerships Reshape Its Competitive Edge in Energy Management?,Yahoo
2025-09-17T06:38:30,"Eaton (ETN) Set to Ride AI Data Center Boom, Analysts Reiterate Outperform",Yahoo
2025-09-16T16:00:03,"Eaton Corporation, PLC (ETN) Is a Trending Stock: Facts to Know Before Betting on It",Yahoo
2025-09-16T02:02:40,Melius Research Upgrades Eaton (ETN),Fintel
