Date,Title,Source
2025-09-13T05:43:12Z,Zacks Research Has Negative Outlook for TMO Q2 Earnings,ETF Daily News
2025-09-12T06:42:47Z,Thermo Fisher Scientific (NYSE:TMO) Rating Increased to Overweight at Barclays,ETF Daily News
2025-09-10T14:34:30Z,$100 Invested In Thermo Fisher Scientific 20 Years Ago Would Be Worth This Much Today,Biztoc.com
2025-09-10T14:11:56Z,Here’s What Dragged Thermo Fisher Scientific (TMO) in Q2,Biztoc.com
2025-09-10T13:53:21Z,Here’s What Dragged Thermo Fisher Scientific (TMO) in Q2,Yahoo Entertainment
"Sat, 13 Sep 2025 12:39:57 GMT",Will Thermo Fisher’s (TMO) CFO Transition Reshape Its Succession Strategy and Management Outlook? - Yahoo Finance,Yahoo Finance
"Sat, 13 Sep 2025 18:50:05 GMT",Will Thermo Fisher’s (TMO) CFO Transition Shape Its Long-Term Financial Strategy? - simplywall.st,simplywall.st
"Thu, 11 Sep 2025 13:33:00 GMT",Guru Fundamental Report for TMO - Nasdaq,Nasdaq
"Sat, 13 Sep 2025 11:04:28 GMT","Strs Ohio Acquires Shares of 197,951 Thermo Fisher Scientific Inc. $TMO - MarketBeat",MarketBeat
"Thu, 11 Sep 2025 12:20:00 GMT",New Analyst Forecast: $TMO Given $550.0 Price Target - Quiver Quantitative,Quiver Quantitative
"Thu, 11 Sep 2025 18:16:00 GMT",Why Thermo Fisher (TMO) Stock Is Trading Up Today - FinancialContent,FinancialContent
"Sat, 13 Sep 2025 07:18:08 GMT",Wallabies v Argentina: Winners and losers as TMO leaves fans 'shocked' and playmaker struggles with 'nerves' - Planet Rugby,Planet Rugby
"Sat, 13 Sep 2025 10:46:18 GMT",Thermo Fisher Scientific Inc. $TMO Holdings Lifted by Foresight Group Ltd Liability Partnership - MarketBeat,MarketBeat
"Wed, 10 Sep 2025 13:53:21 GMT",Here’s What Dragged Thermo Fisher Scientific (TMO) in Q2 - Yahoo Finance,Yahoo Finance
"Sat, 13 Sep 2025 12:19:23 GMT","Thermo Fisher Scientific (NYSE:TMO) Upgraded by Barclays to ""Overweight"" Rating - MarketBeat",MarketBeat
"Sat, 13 Sep 2025 07:00:00 GMT",Thermo Fisher Scientific (NYSE:TMO) CEO Marc N. Casper Sells 400 Shares - MarketBeat,MarketBeat
"Sat, 13 Sep 2025 08:38:27 GMT",Thermo Fisher Scientific Inc. $TMO Shares Bought by Ascent Group LLC - MarketBeat,MarketBeat
"Fri, 12 Sep 2025 12:22:03 GMT",Thermo Fisher Scientific Inc. $TMO Shares Purchased by Integrity Alliance LLC. - MarketBeat,MarketBeat
"Sat, 13 Sep 2025 06:00:21 GMT",Temasek Holdings Private Ltd Boosts Stake in Thermo Fisher Scientific Inc. $TMO - MarketBeat,MarketBeat
"Fri, 12 Sep 2025 18:00:00 GMT",Shellback Capital LP Takes Position in Thermo Fisher Scientific Inc. $TMO - MarketBeat,MarketBeat
"Fri, 12 Sep 2025 18:00:00 GMT",Select Equity Group L.P. Lowers Stake in Thermo Fisher Scientific Inc. $TMO - MarketBeat,MarketBeat
"Fri, 12 Sep 2025 12:19:58 GMT",Thermo Fisher Scientific Inc. $TMO Shares Sold by Glenview Trust co - MarketBeat,MarketBeat
"Sat, 13 Sep 2025 00:33:45 GMT",Thermo Fisher Scientific Inc. (NYSE:TMO) Receives $589.38 Consensus Target Price from Analysts - MarketBeat,MarketBeat
"Fri, 12 Sep 2025 07:00:00 GMT",Thermo Fisher Scientific Inc. $TMO Shares Purchased by Resources Management Corp CT ADV - MarketBeat,MarketBeat
"Fri, 12 Sep 2025 12:19:31 GMT",Ransom Advisory Ltd Buys New Shares in Thermo Fisher Scientific Inc. $TMO - MarketBeat,MarketBeat
"Fri, 12 Sep 2025 07:00:00 GMT",Thermo Fisher Scientific Inc. $TMO is Scientech Research LLC's 6th Largest Position - MarketBeat,MarketBeat
"Fri, 12 Sep 2025 07:00:00 GMT","NewEdge Advisors LLC Sells 8,509 Shares of Thermo Fisher Scientific Inc. $TMO - MarketBeat",MarketBeat
"Fri, 12 Sep 2025 07:34:47 GMT",Thermo Fisher Scientific Inc. $TMO Shares Purchased by Punch & Associates Investment Management Inc. - MarketBeat,MarketBeat
"Sat, 13 Sep 2025 10:36:19 GMT","Carderock Capital Management Inc. Purchases 1,262 Shares of Thermo Fisher Scientific Inc. $TMO - MarketBeat",MarketBeat
"Thu, 11 Sep 2025 16:16:28 GMT","11-14 Sept: Referee, AR & TMO Appts – RWC QFs, TRC, PNC and domestic - - rugbyreferee.net",rugbyreferee.net
"Sat, 13 Sep 2025 09:36:37 GMT",SCS Capital Management LLC Invests $1.34 Million in Thermo Fisher Scientific Inc. $TMO - MarketBeat,MarketBeat
"Sat, 13 Sep 2025 03:43:02 GMT",United Services Automobile Association Makes New $4.40 Million Investment in Thermo Fisher Scientific Inc. $TMO - MarketBeat,MarketBeat
"Sat, 13 Sep 2025 09:31:00 GMT",Watch: Australia’s ‘ridiculous’ forward pass causes TMO backlash - The Telegraph,The Telegraph
"Sat, 13 Sep 2025 10:36:18 GMT","Advisors Capital Management LLC Acquires 7,967 Shares of Thermo Fisher Scientific Inc. $TMO - MarketBeat",MarketBeat
"Tue, 09 Sep 2025 21:49:50 GMT",Thermo Fisher (TMO) CEO Casper sells $200k in shares - Investing.com,Investing.com
"Fri, 12 Sep 2025 07:00:00 GMT",Thermo Fisher Scientific (NYSE:TMO) Downgraded to Hold Rating by Wall Street Zen - MarketBeat,MarketBeat
"Fri, 12 Sep 2025 12:58:17 GMT",Focus Partners Wealth Has $109.28 Million Stock Position in Thermo Fisher Scientific Inc. $TMO - MarketBeat,MarketBeat
"Fri, 12 Sep 2025 13:33:36 GMT",Schmidt P J Investment Management Inc. Trims Holdings in Thermo Fisher Scientific Inc. $TMO - MarketBeat,MarketBeat
"Thu, 11 Sep 2025 10:34:01 GMT","American Trust Buys 1,718 Shares of Thermo Fisher Scientific Inc. $TMO - MarketBeat",MarketBeat
"Fri, 12 Sep 2025 11:42:52 GMT","Ilmarinen Mutual Pension Insurance Co Purchases 3,400 Shares of Thermo Fisher Scientific Inc. $TMO - MarketBeat",MarketBeat
"Wed, 10 Sep 2025 07:00:00 GMT",Thermo Fisher Scientific Inc. $TMO Position Trimmed by NFJ Investment Group LLC - MarketBeat,MarketBeat
"Tue, 09 Sep 2025 07:00:00 GMT",DnB Asset Management AS Cuts Position in Thermo Fisher Scientific Inc. $TMO - MarketBeat,MarketBeat
"Tue, 09 Sep 2025 17:15:34 GMT",Colgan Gets TMO Role For Women’s Rugby World Cup Quarter Final - Irish Rugby,Irish Rugby
"Fri, 12 Sep 2025 19:14:21 GMT",Cook Islands ‘can reverse’ world-high childhood obesity rates: TMO - cookislandsnews.com,cookislandsnews.com
"Sat, 13 Sep 2025 07:17:43 GMT",WATCH: Did the TMO overlook a clear forward pass from the Wallabies amid thrilling finish? - The Roar,The Roar
"Tue, 09 Sep 2025 08:51:37 GMT",BYD UK joins TMO New Car Code - motortrader.com,motortrader.com
"Fri, 12 Sep 2025 06:44:45 GMT",Thermo Fisher Scientific (NYSE:TMO) Upgraded to “Overweight” at Barclays - Defense World,Defense World
"Tue, 09 Sep 2025 18:26:35 GMT",TMO Expresses Concern Over Empowerment Scheme As Ploy To Compromise 2027 General Elections - pmexpressng.com,pmexpressng.com
2025-09-13T15:39:57,Will Thermo Fisher’s (TMO) CFO Transition Reshape Its Succession Strategy and Management Outlook?,Yahoo
2025-09-11T21:16:06,Why Thermo Fisher (TMO) Stock Is Trading Up Today,Yahoo
2025-09-11T21:13:17,"Micron, FedEx, Thermo Fisher Scientific: Analyst moves",Yahoo
2025-09-10T16:53:21,Here’s What Dragged Thermo Fisher Scientific (TMO) in Q2,Yahoo
2025-09-10T12:56:54,Thermo Fisher Expands Reach with Solventum Buy,Yahoo
