Date,Title,Source
2025-09-18T08:26:46Z,"Etsy, Inc. $ETSY Shares Purchased by Harbor Capital Advisors Inc.",ETF Daily News
2025-09-17T08:08:55Z,"Gallacher Capital Management LLC Purchases Shares of 4,697 Etsy, Inc. $ETSY",ETF Daily News
2025-09-17T08:08:11Z,"$2,000 Shipping: International Sellers Charge Absurd Prices to Avoid Dealing With American Tariffs",Biztoc.com
2025-09-17T07:22:59Z,"Geneos Wealth Management Inc. Buys 412 Shares of Etsy, Inc. $ETSY",ETF Daily News
2025-09-17T02:57:00Z,Mariners' magic number drops as Seattle continues incredible Etsy witch-inspired win streak,Sporting News
2025-09-16T19:05:16Z,Chess Sets at Etsy: Up to 75% off + free shipping,Dealnews.com
2025-09-16T17:13:41Z,Tanner Fletcher Spring 2026: ‘Redecorating’ Runway Theatre,WWD
2025-09-15T23:47:45Z,Etsy Adds AI-Powered Writing and Search Tools for Sellers,Biztoc.com
2025-09-15T23:38:54Z,Etsy Adds AI-Powered Writing and Search Tools for Sellers,pymnts.com
2025-09-15T14:55:41Z,Etsy Tests New Listings Appeals Process,EcommerceBytes
2025-09-15T02:02:22Z,Mariners' Etsy witch-inspired winning streak gives them huge AL West division standings news,Sporting News
2025-09-14T15:30:23Z,"45 Times People Fused Excellent Ideas With Great Execution, And Came Up With These Crafts",Boredpanda.com
2025-09-14T10:01:48Z,My Goals For 2025 Week 37 of 52,Onehundreddollarsamonth.com
2025-09-14T10:00:11Z,Why your favorite Etsy treasures could soon cost more — or go away entirely,Salon
"Thu, 18 Sep 2025 17:42:00 GMT",Etsy Stock Earns Relative Strength Rating Upgrade - Investor's Business Daily,Investor's Business Daily
"Thu, 18 Sep 2025 16:02:24 GMT",“The Etsy Witch Is Real”: The Viral Spell Mariners Fans Say Changed Everything - Secret Seattle,Secret Seattle
"Thu, 18 Sep 2025 13:56:57 GMT",Why Your Favorite Etsy Treasures Could Soon Cost More — or Go Away Entirely - The Story Exchange,The Story Exchange
"Thu, 18 Sep 2025 19:02:32 GMT","JBGlobal.com LLC Cuts Stock Holdings in Etsy, Inc. $ETSY - MarketBeat",MarketBeat
"Thu, 18 Sep 2025 12:01:38 GMT",Where Etsy Stands After Recent Share Surge and Analyst Earnings Upgrades - Yahoo Finance,Yahoo Finance
"Mon, 15 Sep 2025 17:34:00 GMT",The Seattle Mariners Are In Their Etsy Witch Era - Defector,Defector
"Wed, 17 Sep 2025 20:37:03 GMT",Etsy (ETSY): A Fresh Look at Valuation Following Leadership Changes at the Top - simplywall.st,simplywall.st
"Mon, 15 Sep 2025 23:39:46 GMT",Etsy Adds AI-Powered Writing and Search Tools for Sellers - PYMNTS.com,PYMNTS.com
"Thu, 18 Sep 2025 16:10:00 GMT","The RealReal, Upwork, Teladoc, Etsy, and Duolingo Stocks Trade Up, What You Need To Know - FinancialContent",FinancialContent
"Wed, 17 Sep 2025 15:08:18 GMT",Etsy witches are having a moment - Fast Company,Fast Company
"Thu, 18 Sep 2025 14:38:49 GMT",Guggenheim Reiterates Buy Rating on Etsy (ETSY) with Price Targe - GuruFocus,GuruFocus
"Thu, 18 Sep 2025 11:42:00 GMT",ETSY price shakes off negative pressure - Forecast today - 18-09-2025 - Economies.com,Economies.com
"Wed, 17 Sep 2025 10:10:33 GMT",Etsy tools & community investments for holiday success - channelx.world,channelx.world
"Thu, 18 Sep 2025 20:59:50 GMT",Seattle Mariners haven't lost since an Etsy witch put her spell on them - ca.sports.yahoo.com,ca.sports.yahoo.com
"Thu, 18 Sep 2025 18:17:16 GMT","Etsy, Inc. $ETSY Shares Purchased by MIRAE ASSET GLOBAL ETFS HOLDINGS Ltd. - MarketBeat",MarketBeat
"Thu, 18 Sep 2025 07:00:00 GMT",Etsy Earns Relative Strength Rating Upgrade - Investor's Business Daily,Investor's Business Daily
"Mon, 15 Sep 2025 11:00:17 GMT",18 Things From Etsy You Can Buy Because You're An Adult And Make Your Own Decisions - Currently.com,Currently.com
"Tue, 16 Sep 2025 14:14:00 GMT",Pinterest vs. Etsy: Which Social E-Commerce Stock Holds Promise? - Yahoo Finance,Yahoo Finance
"Thu, 18 Sep 2025 07:53:44 GMT","Gallacher Capital Management LLC Purchases New Position in Etsy, Inc. $ETSY - MarketBeat",MarketBeat
"Tue, 16 Sep 2025 00:52:46 GMT",Etsy Gears Up For Holidays With New Tools & Support For Sellers - Value Added Resource,Value Added Resource
"Wed, 17 Sep 2025 07:00:00 GMT","Kera Capital Partners Inc. Boosts Stake in Etsy, Inc. $ETSY - MarketBeat",MarketBeat
"Wed, 17 Sep 2025 17:50:07 GMT",The Etsy Witch | STAR 94.1 | Laura Cain - Star 94.1,Star 94.1
"Tue, 16 Sep 2025 22:52:30 GMT",Etsy Target of Unusually Large Options Trading (NASDAQ:ETSY) - MarketBeat,MarketBeat
"Thu, 18 Sep 2025 16:15:21 GMT","Etsy, Inc.'s (NASDAQ:ETSY) Share Price Matching Investor Opinion - 富途牛牛",富途牛牛
"Mon, 15 Sep 2025 23:07:19 GMT",Why Etsy (ETSY) Shares Are Trading Lower Today - MSN,MSN
"Thu, 18 Sep 2025 11:50:08 GMT","Guggenheim Maintains Etsy Inc(ETSY.US) With Buy Rating, Maintains Target Price $70 - 富途牛牛",富途牛牛
"Sun, 14 Sep 2025 15:20:28 GMT",Will Etsy’s (ETSY) Product and Tech Merger Shape Its Innovation Edge or Risk Strategic Focus? - simplywall.st,simplywall.st
"Mon, 15 Sep 2025 07:00:00 GMT","Josh Silverman Sells 65,000 Shares of Etsy (NASDAQ:ETSY) Stock - MarketBeat",MarketBeat
"Fri, 19 Sep 2025 00:28:06 GMT",Growth Value: Does Etsy Inc stock benefit from AI growth - July 2025 WrapUp & Reliable Intraday Trade Plans - khodrobank.com,khodrobank.com
"Mon, 15 Sep 2025 07:00:00 GMT","Acadian Asset Management LLC Grows Stake in Etsy, Inc. $ETSY - MarketBeat",MarketBeat
"Mon, 15 Sep 2025 19:48:13 GMT",Rafe Colburn Returns to Etsy as Chief Technology Officer - MSN,MSN
"Mon, 15 Sep 2025 15:12:00 GMT",January 2028 Options Now Available For Etsy - Nasdaq,Nasdaq
"Fri, 19 Sep 2025 02:20:16 GMT",Update Recap: Can Etsy Inc expand into new markets - July 2025 Review & Low Risk Entry Point Tips - khodrobank.com,khodrobank.com
"Wed, 17 Sep 2025 02:57:00 GMT",Mariners' magic number drops as Seattle continues incredible Etsy witch-inspired win streak - sportingnews.com,sportingnews.com
"Wed, 17 Sep 2025 14:19:00 GMT",« Fe-potoana » rahampitso etsy amin’ny lapan’ny Tanora - Gazeta Express,Gazeta Express
"Thu, 18 Sep 2025 08:26:59 GMT","eBay, Vinted, Depop, Etsy call for Trading Allowance rise to £3,000 - channelx.world",channelx.world
"Sun, 14 Sep 2025 08:05:12 GMT","7,177 Shares in Etsy, Inc. $ETSY Acquired by United Services Automobile Association - MarketBeat",MarketBeat
"Thu, 18 Sep 2025 21:59:13 GMT",Aug Wrap: Can Etsy Inc. be recession proof - Analyst Downgrade & Weekly Return Optimization Plans - khodrobank.com,khodrobank.com
"Sun, 14 Sep 2025 07:00:00 GMT","Hancock Prospecting Pty Ltd Takes $3.54 Million Position in Etsy, Inc. $ETSY - MarketBeat",MarketBeat
"Sun, 14 Sep 2025 07:00:00 GMT","Etsy, Inc. $ETSY Holdings Increased by Optimize Financial Inc - MarketBeat",MarketBeat
"Mon, 15 Sep 2025 02:03:00 GMT",Mariners' Etsy witch-inspired winning streak gives them huge AL West division standings news - sportingnews.com,sportingnews.com
"Wed, 17 Sep 2025 11:19:31 GMT",Why Gen Z Brides Are Turning To Etsy Witches For Extra Magic On Their Big Day? Know Everything; N18 - News18,News18
"Thu, 18 Sep 2025 13:42:22 GMT",Can Etsy Inc. keep up with sector leaders - Portfolio Performance Report & AI Driven Stock Movement Reports - khodrobank.com,khodrobank.com
"Tue, 16 Sep 2025 23:53:28 GMT",Aug Opening: Is ETSY showing insider buying - Market Growth Report & Consistent Profit Trading Strategies - khodrobank.com,khodrobank.com
"Tue, 16 Sep 2025 11:06:41 GMT",Fed Meeting: Why is ETSY stock going down - 2025 Major Catalysts & AI Powered Trade Plan Recommendations - khodrobank.com,khodrobank.com
"Tue, 16 Sep 2025 21:00:25 GMT",Stock Report: Is Etsy Inc a strong candidate for buy and hold - 2025 Big Picture & Fast Entry Momentum Alerts - khodrobank.com,khodrobank.com
"Tue, 16 Sep 2025 17:02:58 GMT",Investment Recap: Does Etsy Inc stock benefit from AI growth - July 2025 Review & High Accuracy Trade Alerts - khodrobank.com,khodrobank.com
"Tue, 16 Sep 2025 18:14:23 GMT",Market Leaders: Can ETSY beat the S&P 500 - July 2025 Levels & Daily Chart Pattern Signal Reports - khodrobank.com,khodrobank.com
"Tue, 16 Sep 2025 17:02:36 GMT",Investment Recap: Does Etsy Inc stock benefit from AI growth - July 2025 Review & High Accuracy Trade Alerts - khodrobank.com,khodrobank.com
"Mon, 15 Sep 2025 08:56:56 GMT",Guidance Update: What are Etsy Inc.’s recent SEC filings showing - July 2025 Volume & Long Hold Capital Preservation Tips - khodrobank.com,khodrobank.com
"Mon, 15 Sep 2025 18:08:26 GMT",Decliners Report: Can ETSY lead its sector in growth - Weekly Gains Report & Safe Entry Point Identification - khodrobank.com,khodrobank.com
"Mon, 15 Sep 2025 12:42:53 GMT","HMRC alert for sellers on Etsy, Vinted or eBay and key deadline - Aberdeen Live",Aberdeen Live
"Mon, 15 Sep 2025 12:26:00 GMT","Key HMRC October 5 deadline and alert to multiple Etsy, Vinted and eBay sellers - Daily Star",Daily Star
"Mon, 15 Sep 2025 12:26:00 GMT","Key HMRC October 5 deadline and alert to multiple Etsy, Vinted and eBay sellers - Daily Star",Daily Star
"Mon, 15 Sep 2025 11:09:00 GMT","People selling items on Vinted, Etsy and eBay urged to be aware of HMRC tax rules - Chronicle Live",Chronicle Live
"Thu, 18 Sep 2025 18:37:23 GMT",Will earnings trigger a reversal in ETSY - 2025 Price Targets & Safe Entry Momentum Stock Tips - newser.com,newser.com
"Thu, 18 Sep 2025 21:50:07 GMT",ETSY stock momentum explained - July 2025 Macro Moves & Free Daily Entry Point Trade Alerts - newser.com,newser.com
"Thu, 18 Sep 2025 17:19:40 GMT",Risk vs reward if holding onto ETSY - Quarterly Trade Review & High Win Rate Trade Tips - newser.com,newser.com
"Fri, 19 Sep 2025 02:54:06 GMT",Trend analysis for Etsy Inc. this week - Market Movement Recap & Weekly Market Pulse Alerts - newser.com,newser.com
"Fri, 19 Sep 2025 02:43:33 GMT",ETSY’s volatility index tracking explained - July 2025 Retail & Free AI Powered Buy and Sell Recommendations - newser.com,newser.com
"Fri, 19 Sep 2025 02:49:24 GMT",How high can ETSY stock go - Quarterly Market Summary & Real-Time Volume Analysis Alerts - newser.com,newser.com
"Wed, 17 Sep 2025 01:12:23 GMT",Real time alert setup for ETSY performance - Market Activity Recap & Target Return Focused Stock Picks - newser.com,newser.com
"Wed, 17 Sep 2025 21:01:42 GMT","Witchcraft Once Got Women Killed, But Now People Are Turning To Etsy Witches To Get A Leg Up In Life Or Love - Chip Chick",Chip Chick
"Mon, 15 Sep 2025 11:12:07 GMT",Chart based analysis of Etsy Inc. trends - Weekly Market Report & Growth Focused Stock Reports - newser.com,newser.com
"Thu, 18 Sep 2025 02:50:56 GMT",Real time scanner hits for ETSY explained - Market Weekly Review & Weekly High Conviction Ideas - newser.com,newser.com
"Sun, 14 Sep 2025 18:09:50 GMT",Does Etsy Inc. fit your quant trading model - July 2025 EndofMonth & Precise Swing Trade Entry Alerts - newser.com,newser.com
"Wed, 17 Sep 2025 04:51:52 GMT",Can you recover from losses in ETSY - 2025 Investor Takeaways & Weekly Chart Analysis and Guides - newser.com,newser.com
"Mon, 15 Sep 2025 00:09:29 GMT",Volatility clustering patterns for ETSY - July 2025 EndofMonth & Long-Term Safe Investment Ideas - newser.com,newser.com
"Wed, 17 Sep 2025 17:40:50 GMT",Can ETSY hit a new high this month - July 2025 Technicals & AI Driven Price Forecasts - newser.com,newser.com
"Mon, 15 Sep 2025 21:01:02 GMT","18 Fun Impulse Buys From Etsy Because, Admit It, You Love Treating Yourself - BuzzFeed",BuzzFeed
"Tue, 16 Sep 2025 06:57:31 GMT",Volatility clustering patterns for ETSY - July 2025 Highlights & High Accuracy Investment Entry Signals - newser.com,newser.com
"Sun, 14 Sep 2025 09:21:28 GMT",Can you recover from losses in ETSY - Weekly Stock Summary & Consistent Income Trade Recommendations - newser.com,newser.com
"Tue, 16 Sep 2025 07:21:20 GMT",Volatility clustering patterns for Etsy Inc. - July 2025 Sentiment & Low Drawdown Momentum Trade Ideas - newser.com,newser.com
"Mon, 15 Sep 2025 10:45:02 GMT",is etsy meeting your algorithmic filter criteria - Market Volume Report & Safe Entry Point Alerts - newser.com,newser.com
"Mon, 15 Sep 2025 06:18:12 GMT",What to expect from Etsy Inc. in the next 30 days - July 2025 EndofMonth & Fast Exit and Entry Strategy Plans - newser.com,newser.com
"Mon, 15 Sep 2025 01:45:40 GMT",Volatility clustering patterns for Etsy Inc. - July 2025 Analyst Calls & Daily Technical Forecast Reports - newser.com,newser.com
"Mon, 15 Sep 2025 23:40:48 GMT",Etsy Introduces AI Features to Aid Sellers’ Productivity - cointurk finance,cointurk finance
"Wed, 17 Sep 2025 08:14:37 GMT","Etsy, Inc. $ETSY Stock Holdings Lifted by Geneos Wealth Management Inc. - Defense World",Defense World
"Mon, 15 Sep 2025 11:09:00 GMT","Vinted, Etsy and eBay sellers should know key HMRC rules and October 5 deadline - Leicester Mercury",Leicester Mercury
2025-09-18T20:42:53,Etsy Stock Earns Relative Strength Rating Upgrade,Yahoo
2025-09-18T19:34:54,"Amazon Just Made It Easier To Sell On Walmart, SHEIN, And Shopify",Yahoo
2025-09-18T15:01:38,Where Etsy Stands After Recent Share Surge and Analyst Earnings Upgrades,Yahoo
2025-09-17T18:00:00,Etsy witches are having a moment,Yahoo
2025-09-16T17:14:00,Pinterest vs. Etsy: Which Social E-Commerce Stock Holds Promise?,Yahoo
