Date,Title,Source
2025-11-04T14:13:10Z,Here's How Much You Would Have Made Owning Thermo Fisher Scientific Stock In The Last 20 Years,Biztoc.com
2025-11-04T06:00:01Z,Gerry Thornley: Ireland’s Chicago adventure was deflating in more ways than one,The Irish Times
2025-11-03T14:39:17Z,Here’s Why Baron Health Care Fund Added Thermo Fisher Scientific (TMO) to Its Portfolio,Biztoc.com
2025-11-03T14:22:26Z,Here’s Why Baron Health Care Fund Added Thermo Fisher Scientific (TMO) to Its Portfolio,Yahoo Entertainment
"Thu, 06 Nov 2025 05:54:18 GMT",Why pension funds invest in TMO stock - Market Activity Report & Low Risk Entry Point Guides - newser.com,newser.com
"Wed, 05 Nov 2025 22:05:00 GMT",Fund Update: New $242.5M $TMO stock position opened by DIAMOND HILL CAPITAL MANAGEMENT INC - Quiver Quantitative,Quiver Quantitative
"Wed, 05 Nov 2025 15:47:00 GMT","Noteworthy ETF Outflows: XLV, ABT, MRK, TMO - Nasdaq",Nasdaq
"Mon, 03 Nov 2025 14:22:26 GMT",Here’s Why Baron Health Care Fund Added Thermo Fisher Scientific (TMO) to Its Portfolio - Yahoo Finance,Yahoo Finance
"Wed, 05 Nov 2025 09:56:03 GMT",Machina Capital S.A.S. Sells 651 Shares of Thermo Fisher Scientific Inc. $TMO - MarketBeat,MarketBeat
"Mon, 03 Nov 2025 00:37:38 GMT",How Investors Are Reacting To Thermo Fisher Scientific (TMO) Product Launches and Strong Quarterly Results - simplywall.st,simplywall.st
"Mon, 03 Nov 2025 10:39:31 GMT",Thermo Fisher Scientific Inc. (TMO) to Acquire Clario in $9.4 Billion Deal - Insider Monkey,Insider Monkey
"Tue, 04 Nov 2025 08:48:02 GMT",Why (TMO) Price Action Is Critical for Tactical Trading - news.stocktradersdaily.com,news.stocktradersdaily.com
"Mon, 03 Nov 2025 17:33:00 GMT","Stifel Maintains Thermo Fisher Scientific(TMO.US) With Buy Rating, Maintains Target Price $583 - 富途牛牛",富途牛牛
"Wed, 05 Nov 2025 11:06:45 GMT",Crestwood Advisors Group LLC Trims Position in Thermo Fisher Scientific Inc. $TMO - MarketBeat,MarketBeat
"Wed, 05 Nov 2025 04:13:57 GMT",Is TMO stock a top dividend aristocrat candidate - July 2025 Short Interest & Weekly Breakout Watchlists - newser.com,newser.com
"Sat, 01 Nov 2025 13:30:41 GMT",Thermo Fisher Scientific (TMO): Assessing Valuation After Recent 22% Share Price Surge - simplywall.st,simplywall.st
"Tue, 04 Nov 2025 13:15:13 GMT",Thermo Fisher Scientific Inc. $TMO Position Lessened by Bank of New York Mellon Corp - MarketBeat,MarketBeat
"Mon, 03 Nov 2025 08:25:40 GMT",Is TMO stock a top dividend aristocrat candidate - Quarterly Market Summary & Verified Swing Trading Watchlist - newser.com,newser.com
"Sun, 02 Nov 2025 09:09:50 GMT",Assetmark Inc. Cuts Stock Holdings in Thermo Fisher Scientific Inc. $TMO - MarketBeat,MarketBeat
"Sun, 02 Nov 2025 11:44:14 GMT",Thermo Fisher Scientific Inc. $TMO Stock Holdings Lifted by Mill Capital Management LLC - MarketBeat,MarketBeat
"Mon, 03 Nov 2025 11:28:18 GMT",South Dakota Investment Council Increases Holdings in Thermo Fisher Scientific Inc. $TMO - MarketBeat,MarketBeat
"Mon, 03 Nov 2025 11:28:20 GMT",Thermo Fisher Scientific Inc. $TMO Shares Sold by Welch & Forbes LLC - MarketBeat,MarketBeat
"Mon, 03 Nov 2025 10:27:42 GMT",Thermo Fisher Scientific Inc. $TMO Stake Raised by Geneva Capital Management LLC - MarketBeat,MarketBeat
"Mon, 03 Nov 2025 11:25:05 GMT","Triglav Investments D.O.O. Sells 2,550 Shares of Thermo Fisher Scientific Inc. $TMO - MarketBeat",MarketBeat
"Mon, 03 Nov 2025 20:31:00 GMT","BofA Securities Maintains Thermo Fisher Scientific(TMO.US) With Buy Rating, Maintains Target Price $650 - 富途牛牛",富途牛牛
"Sun, 02 Nov 2025 07:00:00 GMT","TMO Weekly #4: Apple News Roundup, October 20–26 - The Mac Observer",The Mac Observer
"Sun, 02 Nov 2025 14:21:31 GMT","TMO Weekly #5: Apple News Roundup (Oct 27 – Nov 02, 2025) - The Mac Observer",The Mac Observer
"Sat, 01 Nov 2025 21:02:43 GMT",Shambolic TMO Failure Summed Up Poor Chicago Venue For Ireland v New Zealand - Balls.ie,Balls.ie
"Sat, 01 Nov 2025 11:09:09 GMT",GAM Holding AG Decreases Holdings in Thermo Fisher Scientific Inc. $TMO - MarketBeat,MarketBeat
"Sat, 01 Nov 2025 09:49:38 GMT",Thermo Fisher Scientific Inc. $TMO Shares Sold by Simon Quick Advisors LLC - MarketBeat,MarketBeat
"Sun, 02 Nov 2025 11:57:31 GMT",Why pension funds invest in TMO stock - July 2025 Update & Low Drawdown Trading Techniques - newser.com,newser.com
"Wed, 05 Nov 2025 11:52:59 GMT","RFG Bristol Wealth Advisors LLC Sells 1,235 Shares of Thermo Fisher Scientific Inc. $TMO - MarketBeat",MarketBeat
"Tue, 04 Nov 2025 12:34:38 GMT",Wellington Shields Capital Management LLC Trims Position in Thermo Fisher Scientific Inc. $TMO - MarketBeat,MarketBeat
"Wed, 05 Nov 2025 10:20:11 GMT",Prosperity Consulting Group LLC Sells 530 Shares of Thermo Fisher Scientific Inc. $TMO - MarketBeat,MarketBeat
"Wed, 05 Nov 2025 11:26:50 GMT","Roffman Miller Associates Inc. PA Acquires 1,551 Shares of Thermo Fisher Scientific Inc. $TMO - MarketBeat",MarketBeat
"Tue, 04 Nov 2025 10:28:20 GMT","Bank of Montreal Can Sells 25,162 Shares of Thermo Fisher Scientific Inc. $TMO - MarketBeat",MarketBeat
"Mon, 03 Nov 2025 12:31:25 GMT",Aurdan Capital Management LLC Sells 976 Shares of Thermo Fisher Scientific Inc. $TMO - MarketBeat,MarketBeat
"Mon, 03 Nov 2025 10:50:41 GMT","Sumitomo Life Insurance Co. Acquires 1,841 Shares of Thermo Fisher Scientific Inc. $TMO - MarketBeat",MarketBeat
"Mon, 03 Nov 2025 12:27:13 GMT",Hunter Associates Investment Management LLC Has $4.53 Million Stock Holdings in Thermo Fisher Scientific Inc. $TMO - MarketBeat,MarketBeat
"Mon, 03 Nov 2025 10:17:42 GMT",Harel Insurance Investments & Financial Services Ltd. Buys 587 Shares of Thermo Fisher Scientific Inc. $TMO - MarketBeat,MarketBeat
"Sat, 01 Nov 2025 11:05:12 GMT",Lockheed Martin Investment Management Co. Has $3.11 Million Stake in Thermo Fisher Scientific Inc. $TMO - MarketBeat,MarketBeat
"Sun, 02 Nov 2025 10:07:58 GMT",Pinnacle Associates Ltd. Has $9.55 Million Stock Position in Thermo Fisher Scientific Inc. $TMO - MarketBeat,MarketBeat
"Sat, 01 Nov 2025 11:44:00 GMT",Mccarter Private Wealth Services LLC Reduces Stock Holdings in Thermo Fisher Scientific Inc. $TMO - MarketBeat,MarketBeat
"Sat, 01 Nov 2025 09:06:57 GMT",Arkadios Wealth Advisors Has $2.18 Million Holdings in Thermo Fisher Scientific Inc. $TMO - MarketBeat,MarketBeat
"Sat, 01 Nov 2025 11:05:09 GMT",Murphy Pohlad Asset Management LLC Makes New Investment in Thermo Fisher Scientific Inc. $TMO - MarketBeat,MarketBeat
"Mon, 03 Nov 2025 12:25:20 GMT",iA Global Asset Management Inc. Trims Position in Thermo Fisher Scientific Inc. $TMO - MarketBeat,MarketBeat
2025-11-03T15:22:26,Here’s Why Baron Health Care Fund Added Thermo Fisher Scientific (TMO) to Its Portfolio,Yahoo
2025-11-02T15:00:28,Investors in Thermo Fisher Scientific (NYSE:TMO) have seen returns of 15% over the past three years,Yahoo
