Date,Title,Source
"Tue, 16 Sep 2025 06:18:32 GMT","Saia (NASDAQ:SAIA) Upgraded by Susquehanna to ""Positive"" Rating - MarketBeat",MarketBeat
"Sat, 13 Sep 2025 21:29:03 GMT",Is Saia’s (SAIA) Better-Than-Expected Volume Shifting Analyst Views After Its Laguna Conference? - simplywall.st,simplywall.st
"Thu, 11 Sep 2025 16:00:17 GMT",Analyst Split Ratings Follow Saia’s Mixed Q2 Results and Shipment Decline - Yahoo Finance,Yahoo Finance
"Mon, 15 Sep 2025 09:22:57 GMT","Saia, Inc. $SAIA Shares Bought by Intech Investment Management LLC - MarketBeat",MarketBeat
"Fri, 12 Sep 2025 11:42:00 GMT",Saia (NASDAQ:SAIA) Has A Somewhat Strained Balance Sheet - 富途牛牛,富途牛牛
"Mon, 15 Sep 2025 09:29:13 GMT","Voya Investment Management LLC Increases Holdings in Saia, Inc. $SAIA - MarketBeat",MarketBeat
"Thu, 11 Sep 2025 11:31:00 GMT","Citi Maintains Saia(SAIA.US) With Buy Rating, Maintains Target Price $373 - 富途牛牛",富途牛牛
"Fri, 12 Sep 2025 07:00:00 GMT","Select Equity Group L.P. Purchases 179,444 Shares of Saia, Inc. $SAIA - MarketBeat",MarketBeat
"Fri, 12 Sep 2025 07:00:00 GMT","Short Interest in Saia, Inc. (NASDAQ:SAIA) Declines By 31.9% - MarketBeat",MarketBeat
"Fri, 12 Sep 2025 07:00:00 GMT","Saia, Inc. $SAIA Shares Sold by Polar Asset Management Partners Inc. - MarketBeat",MarketBeat
"Fri, 12 Sep 2025 07:00:00 GMT","15,000 Shares in Saia, Inc. $SAIA Bought by Shellback Capital LP - MarketBeat",MarketBeat
"Tue, 16 Sep 2025 04:13:53 GMT",Signal strength of Saia Inc. stock in tech scanners - Weekly Stock Summary & Verified Momentum Stock Alerts - newser.com,newser.com
"Thu, 11 Sep 2025 07:00:00 GMT","Adage Capital Partners GP L.L.C. Invests $16.81 Million in Saia, Inc. $SAIA - MarketBeat",MarketBeat
"Tue, 16 Sep 2025 03:03:28 GMT",Is Saia Inc. meeting your algorithmic filter criteria - July 2025 Summary & Daily Price Action Insights - newser.com,newser.com
"Thu, 11 Sep 2025 07:00:00 GMT","Graham Capital Management L.P. Lowers Stock Holdings in Saia, Inc. $SAIA - MarketBeat",MarketBeat
"Tue, 16 Sep 2025 04:01:51 GMT",Building trade automation scripts for Saia Inc. - Weekly Profit Analysis & High Return Stock Watch Alerts - newser.com,newser.com
"Tue, 16 Sep 2025 06:03:54 GMT",Momentum divergence signals in SAIA chart - Trade Signal Summary & Daily Technical Forecast Reports - newser.com,newser.com
"Mon, 15 Sep 2025 21:47:12 GMT",is now a turning point for saia - Take Profit & Intraday High Probability Setup Alerts - newser.com,newser.com
"Mon, 15 Sep 2025 17:09:05 GMT",What earnings revisions data tells us about Saia Inc. - 2025 Technical Patterns & Real-Time Buy Signal Notifications - newser.com,newser.com
"Tue, 16 Sep 2025 02:58:43 GMT",What earnings revisions data tells us about Saia Inc. - 2025 Valuation Update & Fast Exit/Entry Strategy Plans - newser.com,newser.com
"Tue, 16 Sep 2025 02:49:55 GMT",Leading vs lagging indicators on SAIA performance - 2025 Performance Recap & Real-Time Buy Signal Notifications - newser.com,newser.com
"Mon, 15 Sep 2025 11:06:16 GMT",Sentiment analysis tools applied to Saia Inc. - 2025 Key Lessons & Free Real-Time Market Sentiment Alerts - newser.com,newser.com
"Mon, 15 Sep 2025 11:10:09 GMT",Heatmap analysis for SAIA and competitors - July 2025 Opening Moves & Fast Entry and Exit Trade Plans - newser.com,newser.com
"Mon, 15 Sep 2025 06:10:05 GMT",What indicators show strength in SAIA - Forecast Cut & Stock Portfolio Risk Control - newser.com,newser.com
"Sun, 14 Sep 2025 21:26:04 GMT",What recovery options are there for Saia Inc. - Portfolio Growth Summary & Intraday High Probability Setup Alerts - newser.com,newser.com
"Sun, 14 Sep 2025 17:38:44 GMT",News impact scoring models applied to Saia Inc. - CEO Change & Accurate Intraday Trade Tips - newser.com,newser.com
"Sun, 14 Sep 2025 16:44:38 GMT",Signal strength of Saia Inc. stock in tech scanners - Index Update & Fast Entry High Yield Stock Tips - newser.com,newser.com
"Sun, 14 Sep 2025 08:38:59 GMT",Heatmap analysis for SAIA and competitors - Market Activity Summary & Fast Gain Swing Alerts - newser.com,newser.com
"Sat, 13 Sep 2025 22:43:14 GMT",Tools to assess Saia Inc.’s risk profile - July 2025 Analyst Calls & Proven Capital Preservation Methods - newser.com,newser.com
"Sun, 14 Sep 2025 16:50:47 GMT",Is Saia Inc. stock bottoming out - Trade Analysis Summary & Technical Confirmation Trade Alerts - newser.com,newser.com
"Mon, 15 Sep 2025 19:51:01 GMT",Applying Wyckoff theory to SAIA stock - July 2025 Reactions & Growth Focused Stock Reports - newser.com,newser.com
"Sun, 14 Sep 2025 17:28:25 GMT",Leading vs lagging indicators on SAIA performance - 2025 Top Gainers & Fast Gaining Stock Reports - newser.com,newser.com
"Sun, 14 Sep 2025 08:09:18 GMT",Building trade automation scripts for Saia Inc. - M&A Rumor & Growth Oriented Trade Recommendations - newser.com,newser.com
"Sun, 14 Sep 2025 14:03:27 GMT",Will SAIA stock recover after recent drop - July 2025 Opening Moves & Reliable Price Action Trade Plans - newser.com,newser.com
"Sun, 14 Sep 2025 08:23:10 GMT",Intraday pattern recognizer results for SAIA - Exit Point & Verified Short-Term Trading Plans - newser.com,newser.com
"Sun, 14 Sep 2025 06:29:04 GMT",Intraday pattern recognizer results for SAIA - 2025 Stock Rankings & Daily Chart Pattern Signals - newser.com,newser.com
"Mon, 15 Sep 2025 03:08:35 GMT",Will Saia Inc. price bounce be sustainable - Weekly Trade Analysis & Reliable Entry Point Alerts - newser.com,newser.com
"Sun, 14 Sep 2025 01:15:17 GMT",Measuring SAIA’s beta against major indices - July 2025 Closing Moves & Safe Capital Growth Stock Tips - newser.com,newser.com
"Mon, 15 Sep 2025 08:19:14 GMT",Analyzing Saia Inc. with risk reward ratio charts - Trend Reversal & Stepwise Trade Execution Plans - newser.com,newser.com
"Mon, 15 Sep 2025 00:13:39 GMT",Live market analysis of Saia Inc. - Quarterly Risk Review & Real-Time Chart Pattern Alerts - newser.com,newser.com
"Sun, 14 Sep 2025 21:50:58 GMT",Saia Inc.’s volatility index tracking explained - 2025 Trade Ideas & Real-Time Volume Analysis Alerts - newser.com,newser.com
"Sun, 14 Sep 2025 02:23:37 GMT",Live market analysis of Saia Inc. - 2025 Macro Impact & Short-Term High Return Strategies - newser.com,newser.com
"Mon, 15 Sep 2025 00:08:08 GMT",Momentum divergence signals in SAIA chart - 2025 Winners & Losers & Daily Profit Focused Screening - newser.com,newser.com
"Sun, 14 Sep 2025 09:09:21 GMT",Is Saia Inc. stock bottoming out - 2025 Top Gainers & High Conviction Buy Zone Alerts - newser.com,newser.com
"Sun, 14 Sep 2025 06:12:47 GMT",Live market analysis of Saia Inc. - 2025 Trading Volume Trends & Real-Time Volume Spike Alerts - newser.com,newser.com
2025-09-11T19:00:17,Analyst Split Ratings Follow Saia’s Mixed Q2 Results and Shipment Decline,Yahoo
