Date,Title,Source
"Tue, 04 Nov 2025 23:56:54 GMT",Intraday pattern recognizer results for DDOG - Rate Cut & High Conviction Buy Zone Picks - newser.com,newser.com
"Mon, 03 Nov 2025 13:00:14 GMT","Estimating The Fair Value Of Datadog, Inc. (NASDAQ:DDOG) - Yahoo Finance",Yahoo Finance
"Wed, 05 Nov 2025 03:22:00 GMT",Datadog (DDOG) Q3 Earnings: What To Expect - FinancialContent,FinancialContent
"Tue, 04 Nov 2025 00:08:00 GMT",CIBC Initiates Coverage of Datadog (DDOG) with Neutral Recommendation - Nasdaq,Nasdaq
"Mon, 03 Nov 2025 14:21:00 GMT",New Analyst Forecast: $DDOG Given $185.0 Price Target - Quiver Quantitative,Quiver Quantitative
"Mon, 03 Nov 2025 16:03:12 GMT",Datadog: Stellar Execution Meets A Stretched Valuation (DDOG) - Seeking Alpha,Seeking Alpha
"Tue, 04 Nov 2025 15:18:27 GMT",Datadog (NASDAQ:DDOG) Now Covered by Analysts at CIBC - MarketBeat,MarketBeat
"Tue, 04 Nov 2025 15:14:50 GMT","Monness Maintains Datadog(DDOG.US) With Buy Rating, Maintains Target Price $185 - 富途牛牛",富途牛牛
"Wed, 05 Nov 2025 06:22:48 GMT",Why DDOG stock is popular among millennials - July 2025 Analyst Calls & Scalable Portfolio Growth Ideas - newser.com,newser.com
"Mon, 03 Nov 2025 12:09:54 GMT",Datadog: Can AI Drive Growth Higher? (NASDAQ:DDOG) - Seeking Alpha,Seeking Alpha
"Tue, 04 Nov 2025 10:28:11 GMT","Burney Co. Sells 2,156 Shares of Datadog, Inc. $DDOG - MarketBeat",MarketBeat
"Tue, 04 Nov 2025 05:17:35 GMT",When is the best time to exit DDOG - July 2025 Summary & High Conviction Buy Zone Alerts - newser.com,newser.com
"Tue, 04 Nov 2025 13:37:14 GMT",Datadog (NASDAQ:DDOG) Price Target Raised to $185.00 at Canaccord Genuity Group - MarketBeat,MarketBeat
"Tue, 04 Nov 2025 11:40:25 GMT","Corton Capital Inc. Purchases New Holdings in Datadog, Inc. $DDOG - MarketBeat",MarketBeat
"Mon, 03 Nov 2025 02:46:01 GMT",Is Tradr 2X Long DDOG Daily stock testing key support - 2025 Big Picture & Safe Capital Growth Tips - newser.com,newser.com
"Tue, 04 Nov 2025 09:33:35 GMT","Datadog, Inc. $DDOG Shares Acquired by Amalgamated Bank - MarketBeat",MarketBeat
"Sun, 02 Nov 2025 20:18:51 GMT",Is DDOG reversing from oversold territory - Exit Point & Smart Investment Allocation Insights - newser.com,newser.com
"Mon, 03 Nov 2025 09:23:33 GMT","World Investment Advisors Takes Position in Datadog, Inc. $DDOG - MarketBeat",MarketBeat
"Mon, 03 Nov 2025 11:22:11 GMT",Will DDOG stock rally after Fed decisions - Insider Buying & Stock Portfolio Risk Control - newser.com,newser.com
"Tue, 04 Nov 2025 10:26:17 GMT",Why DDOG stock is popular among millennials - Quarterly Portfolio Report & Growth Focused Entry Reports - newser.com,newser.com
"Mon, 03 Nov 2025 14:09:28 GMT","DDOG: Canaccord Genuity Raises Price Target to $185, Maintains B - GuruFocus",GuruFocus
"Mon, 03 Nov 2025 12:21:19 GMT","Eleva Capital SAS Takes $2.13 Million Position in Datadog, Inc. $DDOG - MarketBeat",MarketBeat
"Mon, 03 Nov 2025 09:55:57 GMT","Kovack Advisors Inc. Takes $489,000 Position in Datadog, Inc. $DDOG - MarketBeat",MarketBeat
"Sun, 02 Nov 2025 10:40:09 GMT","Earned Wealth Advisors LLC Buys Shares of 1,671 Datadog, Inc. $DDOG - MarketBeat",MarketBeat
"Sun, 02 Nov 2025 11:54:12 GMT","Geneva Capital Management LLC Has $10.69 Million Position in Datadog, Inc. $DDOG - MarketBeat",MarketBeat
"Tue, 04 Nov 2025 07:28:11 GMT","CIBC Initiates Datadog(DDOG.US) With Hold Rating, Announces Target Price $170 - 富途牛牛",富途牛牛
"Sun, 02 Nov 2025 11:40:17 GMT","Uniting Wealth Partners LLC Makes New Investment in Datadog, Inc. $DDOG - MarketBeat",MarketBeat
"Sun, 02 Nov 2025 10:54:04 GMT","1,558 Shares in Datadog, Inc. $DDOG Acquired by Leeward Financial Partners LLC - MarketBeat",MarketBeat
"Fri, 31 Oct 2025 19:21:00 GMT","Noteworthy Friday Option Activity: DDOG, PCT, MTZ - Nasdaq",Nasdaq
"Sun, 02 Nov 2025 09:39:56 GMT","1,769 Shares in Datadog, Inc. $DDOG Bought by HBK Sorce Advisory LLC - MarketBeat",MarketBeat
"Sun, 02 Nov 2025 09:39:56 GMT","Simon Quick Advisors LLC Buys Shares of 4,613 Datadog, Inc. $DDOG - MarketBeat",MarketBeat
"Sun, 02 Nov 2025 08:41:46 GMT","D.A. Davidson & CO. Takes Position in Datadog, Inc. $DDOG - MarketBeat",MarketBeat
"Mon, 03 Nov 2025 06:45:07 GMT",How strong is DDOG stock revenue growth - Weekly Profit Analysis & Expert Curated Trade Setup Alerts - newser.com,newser.com
"Sat, 01 Nov 2025 12:57:34 GMT",Datadog's (DDOG) Buy Rating Reaffirmed at Rosenblatt Securities - MarketBeat,MarketBeat
"Sat, 01 Nov 2025 08:04:18 GMT","Oppenheimer Asset Management Inc. Sells 2,089 Shares of Datadog, Inc. $DDOG - MarketBeat",MarketBeat
"Fri, 31 Oct 2025 09:41:37 GMT","Whalen Wealth Management Inc. Takes Position in Datadog, Inc. $DDOG - MarketBeat",MarketBeat
"Fri, 31 Oct 2025 13:13:13 GMT",Datadog (DDOG) Analyst Rating: Rosenblatt Maintains 'Buy' with $170 Target | DDOG Stock News - GuruFocus,GuruFocus
"Sat, 01 Nov 2025 09:12:59 GMT","Datadog, Inc. $DDOG Stake Raised by Assetmark Inc. - MarketBeat",MarketBeat
"Fri, 31 Oct 2025 09:41:39 GMT","Oarsman Capital Inc. Buys Shares of 1,662 Datadog, Inc. $DDOG - MarketBeat",MarketBeat
"Fri, 31 Oct 2025 11:38:39 GMT","Datadog, Inc. $DDOG Shares Bought by Heritage Investors Management Corp - MarketBeat",MarketBeat
"Fri, 31 Oct 2025 10:28:15 GMT",Will DDOG rebound enough to break even - Market Performance Report & Real-Time Market Sentiment Alerts - newser.com,newser.com
"Tue, 04 Nov 2025 13:28:10 GMT",Datadog (NASDAQ:DDOG) Given New $185.00 Price Target at Canaccord Genuity Group - Defense World,Defense World
"Tue, 04 Nov 2025 08:21:03 GMT",Datadog (NASDAQ:DDOG) Coverage Initiated by Analysts at CIBC - Defense World,Defense World
2025-11-03T18:24:56,"Datadog Facing 'Solid' Demand Ahead of Q3 Earnings, Oppenheimer Says",Yahoo
2025-11-03T14:00:14,"Estimating The Fair Value Of Datadog, Inc. (NASDAQ:DDOG)",Yahoo
