Date,Title,Source
"Sat, 30 Aug 2025 00:31:27 GMT","Huskies Weather UNH Storm, Secure First Win of 2025 Season - University of Connecticut Athletics",University of Connecticut Athletics
"Thu, 28 Aug 2025 11:49:13 GMT",Here’s What Pulled Down UnitedHealth (UNH) in Q2 - Yahoo Finance,Yahoo Finance
"Thu, 28 Aug 2025 13:02:50 GMT",UnitedHealth Stock (UNH): Wall Street Stays Bullish While Waiting for a Turnaround - TipRanks,TipRanks
"Sat, 30 Aug 2025 05:12:34 GMT",UnitedHealth (UNH) Under Fire Again Over Loan Demands after Cyberattack - MSN,MSN
"Tue, 26 Aug 2025 11:34:27 GMT","UNH, colleges across the country deal with shooting hoaxes as classes resume - NBC Boston",NBC Boston
"Sat, 30 Aug 2025 05:20:01 GMT",Behavioral Patterns of UNH and Institutional Flows - news.stocktradersdaily.com,news.stocktradersdaily.com
"Wed, 27 Aug 2025 12:09:18 GMT",UnitedHealth: A Generational Buying Opportunity (NYSE:UNH) - Seeking Alpha,Seeking Alpha
"Tue, 26 Aug 2025 03:39:00 GMT",UNH police say active shooter report on campus was a hoax; no threat to community - WMUR,WMUR
"Mon, 25 Aug 2025 14:10:46 GMT",UnitedHealth: UNH Stock To $600? - Forbes,Forbes
"Fri, 29 Aug 2025 23:23:26 GMT",‘Nothing Is OK’ Says Bank of America on UnitedHealth Stock (UNH) Despite Warren Buffett’s New Bet - MSN,MSN
"Fri, 29 Aug 2025 19:32:56 GMT","INTC, SMCI, UNH: August’s Best and Worst-Performing Stocks - TipRanks",TipRanks
"Fri, 29 Aug 2025 19:44:04 GMT","August's Best and Worst-Performing Stocks: INTC, SMCI, UNH - AInvest",AInvest
"Sat, 30 Aug 2025 00:47:09 GMT",UnitedHealth Group (UNH) Laps the Stock Market: Here's Why - MSN,MSN
"Wed, 27 Aug 2025 04:06:01 GMT",UnitedHealth Stock (UNH) Slips as DOJ Broadens Criminal Probe - TipRanks,TipRanks
"Wed, 27 Aug 2025 12:51:41 GMT",Is UnitedHealth Stock (UNH) a Buy? AI Analyst Says Yes - TipRanks,TipRanks
"Fri, 29 Aug 2025 13:30:03 GMT",Wall Street Analysts See UnitedHealth (UNH) as a Buy: Should You Invest? - Yahoo Finance,Yahoo Finance
"Tue, 26 Aug 2025 20:45:00 GMT",UNH Launches Initiative to Improve Outcomes for STEM Ph.D. Students - University of New Hampshire,University of New Hampshire
"Thu, 28 Aug 2025 06:21:56 GMT",Bernstein Sees Attractive Entry in UnitedHealth (UNH) Stock Ahead of Q2 Earnings - MSN,MSN
"Fri, 29 Aug 2025 09:44:18 GMT",Factors That Lifted UnitedHealth Group’s (UNH) Performance in Q1 - MSN,MSN
"Mon, 25 Aug 2025 15:59:25 GMT",UnitedHealth: 2026 Repricing Will Be A Game Changer (NYSE:UNH) - Seeking Alpha,Seeking Alpha
"Thu, 28 Aug 2025 15:30:14 GMT",Why Is UnitedHealth (UNH) Up 14.2% Since Last Earnings Report? - Yahoo Finance,Yahoo Finance
"Wed, 27 Aug 2025 17:51:07 GMT",DOJ Probe Into $UNH Could Shake the Entire Health Insurance Industry - Hedgeye,Hedgeye
"Wed, 27 Aug 2025 12:47:17 GMT","Two former UNH football players make NFL rosters with Raiders, Vikings - Yahoo Sports",Yahoo Sports
"Mon, 25 Aug 2025 10:21:59 GMT",Is UnitedHealth’s (UNH) Capital Strategy Signaling Strength or Defensive Caution in a Shifting Sector? - Yahoo Finance,Yahoo Finance
"Tue, 26 Aug 2025 20:36:26 GMT",UnitedHealth Stock Falls As DOJ Criminal Probe Expands To Optum Rx: Report - UnitedHealth Group (NYSE:UNH) - Benzinga,Benzinga
"Fri, 29 Aug 2025 04:39:49 GMT",UnitedHealth (UNH) Under Fire Again Over Loan Demands after Cyberattack - TipRanks,TipRanks
"Thu, 28 Aug 2025 12:12:17 GMT",Why UnitedHealth (UNH) Remains a High-Risk Bet in 2025 Despite Strong Fundamentals - AInvest,AInvest
"Thu, 28 Aug 2025 08:25:37 GMT","Renaissance Technologies top Q2 moves include AMD, Walmart exits, new UNH buy, others - MSN",MSN
"Wed, 27 Aug 2025 06:15:00 GMT",A recruiter for the N.H. National Guard deceived and seduced young soldiers at UNH. Then they exposed him. - The Boston Globe,The Boston Globe
"Wed, 27 Aug 2025 19:50:58 GMT",J.P. Morgan Remains a Buy on UnitedHealth Group (UNH) With a $310 PT - MSN,MSN
"Tue, 26 Aug 2025 19:57:09 GMT",UNH dips after report that DOJ probe looking into more than just Medicare Advantage - Sherwood News,Sherwood News
"Mon, 25 Aug 2025 19:27:00 GMT","Santos: QBs Vezza, Bentley will both play in UNH football team's season opener - UnionLeader.com",UnionLeader.com
"Wed, 27 Aug 2025 16:21:02 GMT",UNH stock analysis: buy or sell UnitedHealth after the DoJ investigation news - Invezz,Invezz
"Thu, 28 Aug 2025 15:44:15 GMT",The UnitedHealth Probe Is Bigger Than Investors Previously Thought. What Does That Mean for UNH Stock? - Yahoo Finance,Yahoo Finance
"Wed, 27 Aug 2025 18:17:43 GMT","High Volume Option Trading in CRWD, LLY, and UNH on Wednesday - AInvest",AInvest
"Tue, 26 Aug 2025 19:23:44 GMT",UnitedHealth Stock (UNH) Rises as Investors Welcome Dividend Approval - MSN,MSN
"Tue, 26 Aug 2025 04:37:52 GMT",ACA Rule Pause Offers Relief to UnitedHealth (UNH) and Peers Facing Rising Costs - MSN,MSN
"Wed, 27 Aug 2025 18:10:00 GMT","Notable Wednesday Option Activity: CRWD, LLY, UNH - Nasdaq",Nasdaq
"Mon, 25 Aug 2025 11:56:52 GMT",How Will ACA Rule Pause and New CFO Shape UnitedHealth Group’s (UNH) Strategic Priorities? - simplywall.st,simplywall.st
"Mon, 25 Aug 2025 13:28:24 GMT","Despite Epstein files controversy, UNH poll finds Trump approval in NH unchanged - Seacoastonline.com",Seacoastonline.com
"Tue, 26 Aug 2025 15:56:03 GMT",Trading Systems Reacting to (UNH) Volatility - news.stocktradersdaily.com,news.stocktradersdaily.com
"Tue, 26 Aug 2025 17:21:39 GMT",UnitedHealth Group (NYSE:UNH) Will Want To Turn Around Its Return Trends - 富途牛牛,富途牛牛
"Mon, 25 Aug 2025 15:32:03 GMT",(UNH) Movement as an Input in Quant Signal Sets - news.stocktradersdaily.com,news.stocktradersdaily.com
"Tue, 26 Aug 2025 14:54:33 GMT","New Hampshire consumers brace for price increases, UNH poll shows - The Boston Globe",The Boston Globe
"Mon, 25 Aug 2025 07:00:00 GMT",Is UNH favored by institutional buyers? - AInvest,AInvest
"Mon, 25 Aug 2025 07:00:00 GMT",news UNH waiting for - AInvest,AInvest
"Mon, 25 Aug 2025 07:00:00 GMT","What unique patented technologies does UNH have, and are they valuable? - AInvest",AInvest
"Sat, 30 Aug 2025 06:21:57 GMT",UnitedHealth (UNH) Labeled a Battleground Stock by @StockMKTNewz — Trading Implications Now - Blockchain News,Blockchain News
"Thu, 28 Aug 2025 18:50:40 GMT",UNH stock analysis: buy or sell UnitedHealth after the DoJ investigation news - MSN,MSN
"Mon, 25 Aug 2025 13:15:11 GMT",TradeLeaks.ai Flags UNH and OPEN Market Rumors Days Before They Break - isstories.com,isstories.com
"Wed, 27 Aug 2025 06:46:56 GMT",UnitedHealth Group (NYSE:UNH) Given “Overweight” Rating at Cantor Fitzgerald - Defense World,Defense World
"Mon, 25 Aug 2025 14:40:12 GMT","UnitedHealth Group (UNH) Shows Strong Resilience, Surging 1.34% in a Volatile Trading Session - thekhabrilal",thekhabrilal
2025-08-29T15:30:03,Wall Street Analysts See UnitedHealth (UNH) as a Buy: Should You Invest?,Yahoo
2025-08-29T05:57:32,Jim Cramer on UnitedHealth: “They Got to Answer Some Tough Questions”,Yahoo
2025-08-28T22:18:00,AM Best Downgrades Credit Ratings of UnitedHealth Group Incorporated and Its Subsidiaries; Revises Outlooks to Stable,Yahoo
2025-08-28T17:44:15,The UnitedHealth Probe Is Bigger Than Investors Previously Thought. What Does That Mean for UNH Stock?,Yahoo
2025-08-28T17:30:14,Why Is UnitedHealth (UNH) Up 14.2% Since Last Earnings Report?,Yahoo
2025-08-28T13:49:13,Here’s What Pulled Down UnitedHealth (UNH) in Q2,Yahoo
2025-08-27T23:45:02,UnitedHealth Group (UNH) Laps the Stock Market: Here's Why,Yahoo
2025-08-27T16:31:00,"Not Just Medicare, UnitedHealth's Optum Rx Gets Its Own DOJ Checkup",Yahoo
2025-08-27T10:09:18,UnitedHealth: A Generational Buying Opportunity,SeekingAlpha
2025-08-27T05:53:48,"Morgan Stanley Lowers United Health Price Target to $325, Maintains Overweight",Yahoo
2025-08-26T22:41:11,DOJ's UnitedHealth probe includes more than Medicare: Report,Yahoo
2025-08-26T22:32:20,UnitedHealth stock ticks lower amid expanded Justice Department probe,Yahoo
2025-08-26T17:02:00,UnitedHealth's Misdiagnosis: Can Berkshire's Bet Spark a Recovery?,Yahoo
2025-08-25T18:15:00,UnitedHealth Invests in Behavioral Health: A Bet on Future Demand?,Yahoo
2025-08-25T12:21:59,Is UnitedHealth’s (UNH) Capital Strategy Signaling Strength or Defensive Caution in a Shifting Sector?,Yahoo
2025-08-26T22:43:13,UNH Criminal Probe wider than previously known,Reddit/r/wallstreetbets
2025-08-26T22:30:47,UNH Friday Calls,Reddit/r/wallstreetbets
