Date,Title,Source
2025-09-07T14:23:54Z,"QUALCOMM (QCOM) Launches Dragonwing Q-6690, World’s First Enterprise Mobile Processor",Yahoo Entertainment
2025-09-07T13:57:09Z,"Qualcomm Appoints Patricia Grech as Chief Accounting Officer, Neil Martin Shifts to Corporate Development",Yahoo Entertainment
"Mon, 08 Sep 2025 13:53:03 GMT",A Fresh Look at Qualcomm (QCOM) Valuation as Shares Climb Steadily Without Major News - Yahoo Finance,Yahoo Finance
"Mon, 08 Sep 2025 22:36:01 GMT",QUALCOMM INCORPORATED (QCOM) - MSN,MSN
"Mon, 08 Sep 2025 10:12:18 GMT",USS Investment Management Ltd Has $28.54 Million Stock Position in QUALCOMM Incorporated $QCOM - MarketBeat,MarketBeat
"Mon, 08 Sep 2025 09:38:40 GMT",Tesla unlikely competitor? Qualcomm (QCOM) stock to bring automated driving to BMW cars - Investorsobserver,Investorsobserver
"Tue, 09 Sep 2025 15:22:30 GMT",IBM vs. QCOM: Which Tech Stock Deserves a Spot in Your Portfolio Now? - Zacks Investment Research,Zacks Investment Research
"Wed, 10 Sep 2025 05:22:02 GMT",Trading Systems Reacting to (QCOM) Volatility - news.stocktradersdaily.com,news.stocktradersdaily.com
"Sat, 06 Sep 2025 17:30:00 GMT",Qualcomm Stock (QCOM) Opinions on Potential Takeover Rumors and Strategic Expansions - Quiver Quantitative,Quiver Quantitative
"Wed, 10 Sep 2025 00:20:00 GMT",Is QUALCOMM (QCOM) The Best AI Chip Stock to Buy Now? - MSN,MSN
"Tue, 09 Sep 2025 13:00:03 GMT",QUALCOMM Incorporated (QCOM) Is a Trending Stock: Facts to Know Before Betting on It - Yahoo Finance,Yahoo Finance
"Wed, 10 Sep 2025 04:44:25 GMT","3,156 Shares in QUALCOMM Incorporated $QCOM Acquired by Petrus Trust Company LTA - MarketBeat",MarketBeat
"Mon, 08 Sep 2025 16:32:28 GMT",QCOM Expands Automotive Portfolio: Will it Deliver Sustainable Growth? - Zacks Investment Research,Zacks Investment Research
"Sun, 07 Sep 2025 14:23:54 GMT","QUALCOMM (QCOM) Launches Dragonwing Q-6690, World’s First Enterprise Mobile Processor - Yahoo Finance",Yahoo Finance
"Tue, 09 Sep 2025 11:31:27 GMT",Caxton Associates LLP Makes New $5.37 Million Investment in QUALCOMM Incorporated $QCOM - MarketBeat,MarketBeat
"Tue, 09 Sep 2025 19:28:36 GMT",QUALCOMM Incorporated $QCOM Shares Purchased by Nissay Asset Management Corp Japan ADV - MarketBeat,MarketBeat
"Tue, 09 Sep 2025 10:10:09 GMT",Fred Alger Management LLC Grows Stock Position in QUALCOMM Incorporated $QCOM - MarketBeat,MarketBeat
"Tue, 09 Sep 2025 07:00:00 GMT","Integrated Wealth Concepts LLC Buys 4,531 Shares of QUALCOMM Incorporated $QCOM - MarketBeat",MarketBeat
"Tue, 09 Sep 2025 07:43:58 GMT","Gotham Asset Management LLC Sells 14,823 Shares of QUALCOMM Incorporated $QCOM - MarketBeat",MarketBeat
"Tue, 09 Sep 2025 12:11:51 GMT",Coppell Advisory Solutions LLC Has $2.80 Million Stock Holdings in QUALCOMM Incorporated $QCOM - MarketBeat,MarketBeat
"Tue, 09 Sep 2025 16:33:58 GMT",IBM vs. QCOM: Which Tech Stock Deserves a Spot in Your Portfolio Now? - The Globe and Mail,The Globe and Mail
"Sun, 07 Sep 2025 07:00:00 GMT",QUALCOMM Incorporated $QCOM Stock Holdings Trimmed by Amundi - MarketBeat,MarketBeat
"Mon, 08 Sep 2025 10:12:18 GMT",UniSuper Management Pty Ltd Raises Stake in QUALCOMM Incorporated $QCOM - MarketBeat,MarketBeat
"Mon, 08 Sep 2025 10:41:14 GMT",QUALCOMM Incorporated $QCOM Stock Holdings Trimmed by Teza Capital Management LLC - MarketBeat,MarketBeat
"Mon, 08 Sep 2025 17:17:23 GMT","What's Going On With Qualcomm Stock Monday? - Alphabet (NASDAQ:GOOGL), Qualcomm (NASDAQ:QCOM) - Benzinga",Benzinga
"Mon, 08 Sep 2025 11:26:10 GMT",Talon Private Wealth LLC Has $2.61 Million Stake in QUALCOMM Incorporated $QCOM - MarketBeat,MarketBeat
"Mon, 08 Sep 2025 10:59:01 GMT","Voleon Capital Management LP Buys 85,723 Shares of QUALCOMM Incorporated $QCOM - MarketBeat",MarketBeat
"Tue, 09 Sep 2025 12:32:04 GMT","Strait & Sound Wealth Management LLC Acquires 1,839 Shares of QUALCOMM Incorporated $QCOM - MarketBeat",MarketBeat
"Mon, 08 Sep 2025 07:01:32 GMT","QUALCOMM Incorporated (NASDAQ:QCOM) Receives Consensus Rating of ""Moderate Buy"" from Analysts - MarketBeat",MarketBeat
"Mon, 08 Sep 2025 12:30:33 GMT",Qualcomm and Google deepen partnership to bring agentic AI to auto industry (QCOM:NASDAQ) - Seeking Alpha,Seeking Alpha
"Mon, 08 Sep 2025 10:08:00 GMT",Shellback Capital LP Invests $20.22 Million in QUALCOMM Incorporated $QCOM - MarketBeat,MarketBeat
"Tue, 09 Sep 2025 14:57:25 GMT","Meiji Yasuda Asset Management Co Ltd. Sells 13,777 Shares of QUALCOMM Incorporated $QCOM - MarketBeat",MarketBeat
"Tue, 09 Sep 2025 13:06:02 GMT",Understanding Momentum Shifts in (QCOM) - news.stocktradersdaily.com,news.stocktradersdaily.com
"Sun, 07 Sep 2025 07:00:00 GMT",Bridgeway Capital Management LLC Boosts Position in QUALCOMM Incorporated $QCOM - MarketBeat,MarketBeat
"Sun, 07 Sep 2025 07:00:00 GMT",QUALCOMM Incorporated $QCOM Shares Bought by Ancora Advisors LLC - MarketBeat,MarketBeat
"Tue, 09 Sep 2025 17:10:01 GMT",Technical Reactions to QCOM Trends in Macro Strategies - news.stocktradersdaily.com,news.stocktradersdaily.com
"Sun, 07 Sep 2025 09:00:00 GMT","Focus Partners Advisor Solutions LLC Purchases 5,598 Shares of QUALCOMM Incorporated $QCOM - MarketBeat",MarketBeat
"Fri, 05 Sep 2025 19:15:13 GMT",BMW Plus Qualcomm Equals The Automated Driving Play (NASDAQ:QCOM) - Seeking Alpha,Seeking Alpha
"Sun, 07 Sep 2025 07:00:00 GMT","Alliancebernstein L.P. Sells 1,056,829 Shares of QUALCOMM Incorporated $QCOM - MarketBeat",MarketBeat
"Sun, 07 Sep 2025 07:00:00 GMT","AQR Capital Management LLC Acquires 707,615 Shares of QUALCOMM Incorporated $QCOM - MarketBeat",MarketBeat
"Mon, 08 Sep 2025 10:32:25 GMT",Ashton Thomas Private Wealth LLC Has $6.83 Million Position in QUALCOMM Incorporated $QCOM - MarketBeat,MarketBeat
"Sat, 06 Sep 2025 11:53:35 GMT","Nearwater Capital Markets Ltd Purchases Shares of 120,000 QUALCOMM Incorporated $QCOM - MarketBeat",MarketBeat
"Mon, 08 Sep 2025 18:40:21 GMT",QCOM Expands Automotive Portfolio: Will it Deliver Sustainable Growth? - sharewise.com,sharewise.com
"Mon, 08 Sep 2025 16:46:02 GMT",(QCOM) Movement Within Algorithmic Entry Frameworks - news.stocktradersdaily.com,news.stocktradersdaily.com
"Mon, 08 Sep 2025 08:38:03 GMT",Avoiding Lag: Real-Time Signals in (QCOM) Movement - news.stocktradersdaily.com,news.stocktradersdaily.com
"Sat, 06 Sep 2025 16:07:30 GMT",Appaloosa LP Lowers Stock Position in QUALCOMM Incorporated $QCOM - MarketBeat,MarketBeat
"Sat, 06 Sep 2025 07:00:00 GMT",EP Wealth Advisors LLC Boosts Stock Position in QUALCOMM Incorporated $QCOM - MarketBeat,MarketBeat
"Sat, 06 Sep 2025 07:00:00 GMT","QUALCOMM (NASDAQ:QCOM) CFO Akash J. Palkhiwala Sells 3,333 Shares - MarketBeat",MarketBeat
"Sat, 06 Sep 2025 09:43:18 GMT",Advisors Asset Management Inc. Has $5.88 Million Stake in QUALCOMM Incorporated $QCOM - MarketBeat,MarketBeat
"Sat, 06 Sep 2025 10:53:52 GMT",Jacobs Levy Equity Management Inc. Makes New Investment in QUALCOMM Incorporated $QCOM - MarketBeat,MarketBeat
"Sat, 06 Sep 2025 07:00:00 GMT",Adage Capital Partners GP L.L.C. Cuts Stock Position in QUALCOMM Incorporated $QCOM - MarketBeat,MarketBeat
"Fri, 05 Sep 2025 13:21:08 GMT",QUALCOMM Incorporated $QCOM Shares Bought by Hancock Whitney Corp - MarketBeat,MarketBeat
"Sat, 06 Sep 2025 11:41:24 GMT",MIRAE ASSET GLOBAL ETFS HOLDINGS Ltd. Increases Position in QUALCOMM Incorporated $QCOM - MarketBeat,MarketBeat
"Fri, 05 Sep 2025 07:00:00 GMT","GW Henssler & Associates Ltd. Buys 5,222 Shares of QUALCOMM Incorporated $QCOM - MarketBeat",MarketBeat
"Fri, 05 Sep 2025 07:00:00 GMT",QUALCOMM Incorporated $QCOM Stake Raised by Flputnam Investment Management Co. - MarketBeat,MarketBeat
"Fri, 05 Sep 2025 10:54:23 GMT",QUALCOMM Incorporated $QCOM Shares Bought by Alyeska Investment Group L.P. - MarketBeat,MarketBeat
"Fri, 05 Sep 2025 13:21:08 GMT",QUALCOMM Incorporated $QCOM Shares Sold by DnB Asset Management AS - MarketBeat,MarketBeat
"Fri, 05 Sep 2025 13:15:10 GMT",QUALCOMM Incorporated $QCOM Shares Purchased by Edmond DE Rothschild Holding S.A. - MarketBeat,MarketBeat
"Fri, 05 Sep 2025 15:13:09 GMT",Qualcomm (QCOM) and BMW Roll Out Automated Driving System - TipRanks,TipRanks
"Sun, 07 Sep 2025 16:22:11 GMT","QUALCOMM (QCOM) Launches Dragonwing Q-6690, World’s First Enterprise Mobile Processor - MSN",MSN
"Fri, 05 Sep 2025 07:00:00 GMT",Graham Capital Management L.P. Has $2.12 Million Stock Holdings in QUALCOMM Incorporated $QCOM - MarketBeat,MarketBeat
2025-09-08T16:53:03,A Fresh Look at Qualcomm (QCOM) Valuation as Shares Climb Steadily Without Major News,Yahoo
2025-09-08T13:20:45,Qualcomm And Valeo Broaden Collaboration To Speed Hands Off Driving Features,Yahoo
2025-09-07T17:23:54,"QUALCOMM (QCOM) Launches Dragonwing Q-6690, World’s First Enterprise Mobile Processor",Yahoo
2025-09-07T16:57:09,"Qualcomm Appoints Patricia Grech as Chief Accounting Officer, Neil Martin Shifts to Corporate Development",Yahoo
2025-09-05T17:15:13,BMW Plus Qualcomm Equals The Automated Driving Play,SeekingAlpha
2025-09-05T14:17:37,BMW Debuts Snapdragon Ride Pilot Powered By Qualcomm In New iX3,Yahoo
2025-09-05T12:30:00,Qualcomm and BMW Group Unveil Groundbreaking Automated Driving System with Jointly Developed Software Stack,Yahoo
2025-09-08T17:36:29,QCOM Calls are the next Lance Armstrong,Reddit/r/wallstreetbets
