Date,Title,Source
2025-10-29T23:25:53Z,"Microsoft Tops Quarterly Targets On Cloud, AI Strength",Biztoc.com
2025-10-29T22:08:39Z,Microsoft surpasses Q1 expectations as cloud revenue steals the spotlight,The Times of India
2025-10-29T20:17:25Z,Microsoft’s cloud surge lifts revenue above expectations,Biztoc.com
2025-10-29T19:55:50Z,Live: Microsoft (MSFT) Announces Earnings Tonight – Will Shares Soar?,Biztoc.com
2025-10-29T18:05:15Z,"Amazon AWS Is Down Again, Microsoft Azure Too",Biztoc.com
2025-10-29T16:59:51Z,"OpenAI Agreement Supports Microsoft’s (MSFT) Growth Prospects, Mizuho Says",Biztoc.com
2025-10-29T16:59:05Z,Microsoft Just Lit a Fuse Under Nebius (NBIS). Buy Now Before It Takes Off,Biztoc.com
2025-10-29T16:49:50Z,"OpenAI Agreement Supports Microsoft’s (MSFT) Growth Prospects, Mizuho Says",Yahoo Entertainment
2025-10-29T16:05:49Z,Amazon to report Q3 earnings as Wall Street looks for improved AI growth,Biztoc.com
2025-10-29T15:53:17Z,Here's How Much You Would Have Made Owning Microsoft Stock In The Last 5 Years,Biztoc.com
2025-10-29T15:42:07Z,Wall Street Bullish on ​Microsoft Corporation (MSFT) Ahead of its FQ1 2026 Earnings,Biztoc.com
2025-10-29T15:17:56Z,Wall Street Bullish on ​Microsoft Corporation (MSFT) Ahead of its FQ1 2026 Earnings,Yahoo Entertainment
2025-10-29T14:35:45Z,Apple Crushed by Other Tech Stocks,Biztoc.com
2025-10-29T13:56:59Z,"Microsoft (MSFT) Heads Into Earnings With Strong AI Tailwinds, Analysts Say",Yahoo Entertainment
2025-10-29T13:29:55Z,Apple Crushed by Other Tech Stocks,Biztoc.com
2025-10-28T18:33:11Z,Microsoft Reports Q4 Earnings on October 29. Is MSFT a Buy Now?,Biztoc.com
2025-10-28T18:26:49Z,Microsoft Reports Q4 Earnings on October 29. Is MSFT a Buy Now?,Barchart.com
2025-10-28T15:36:33Z,Big Tech has to 'walk the line' with AI spending this earnings season,Biztoc.com
2025-10-28T15:14:38Z,"Wall Street is Pounding the Table Over AAPL, AMZN, QCOM, GFI, MSFT",Biztoc.com
2025-10-28T15:03:32Z,BofA Maintains Buy Rating on Microsoft (MSFT) Stock,Biztoc.com
2025-10-28T15:02:59Z,"Wall Street is Pounding the Table Over AAPL, AMZN, QCOM, GFI, MSFT",Biztoc.com
2025-10-28T14:46:37Z,BofA Maintains Buy Rating on Microsoft (MSFT) Stock,Yahoo Entertainment
2025-10-28T14:34:02Z,What Microsoft's 27% OpenAI stake means for investors,Yahoo Entertainment
2025-10-28T14:07:06Z,"OpenAI restructures, Microsoft gets 27% stake in ChatGPT maker as companies sign new deal",Biztoc.com
2025-10-28T13:56:36Z,Brad Gerstner Says Microsoft (MSFT) ‘Misunderstood’ On AI Benefit,Biztoc.com
2025-10-28T13:56:32Z,Microsoft Stock Moves Higher On New Deal With OpenAI,Biztoc.com
2025-10-28T13:39:25Z,Brad Gerstner Says Microsoft (MSFT) ‘Misunderstood’ On AI Benefit,Yahoo Entertainment
2025-10-28T12:07:43Z,Microsoft (MSFT) Retains Buy Rating at UBS as Azure Growth Momentum Skews Positive,Yahoo Entertainment
2025-10-27T16:22:20Z,TD Cowen Keeps Buy Rating on Microsoft (MSFT) Ahead of Q1 Report,Biztoc.com
2025-10-27T16:04:09Z,Jim Cramer Expects a Great Quarter From Microsoft,Yahoo Entertainment
2025-10-27T15:54:12Z,TD Cowen Keeps Buy Rating on Microsoft (MSFT) Ahead of Q1 Report,Yahoo Entertainment
2025-10-27T15:48:36Z,"Wall Street is Pounding the Table Over HON, GOOG, AAPL, MSFT, BKNG, and TSLA",Biztoc.com
2025-10-27T14:30:00Z,Big Tech earnings: The 3 things Wall Street will be listening for,Yahoo Entertainment
"Thu, 30 Oct 2025 18:04:21 GMT",Microsoft: Q1 Earnings Were Overshadowed By Bigger Events (NASDAQ:MSFT) - Seeking Alpha,Seeking Alpha
"Thu, 30 Oct 2025 06:34:00 GMT",Microsoft (NASDAQ: MSFT) Stock Price Prediction for 2025: Where Will It Be in 1 Year - Yahoo Finance,Yahoo Finance
"Fri, 31 Oct 2025 05:44:53 GMT","Microsoft (MSFT): Annual Earnings Up 12.9%, Profit Growth Outpaces Market Narratives - simplywall.st",simplywall.st
"Wed, 29 Oct 2025 22:46:00 GMT",Microsoft (MSFT) Q1 2026 Earnings Call Transcript - The Motley Fool,The Motley Fool
"Wed, 29 Oct 2025 23:26:15 GMT",Live: Microsoft (MSFT) Announces Earnings Tonight – Will Shares Soar? - 24/7 Wall St.,24/7 Wall St.
"Fri, 31 Oct 2025 06:58:36 GMT","Dow Futures Decline Amid Mixed Big Tech Earnings: META, MSFT, GOOGL, AAPL Among Stocks To Watch - Stocktwits",Stocktwits
"Thu, 30 Oct 2025 18:08:41 GMT","Welcome to the $4 Trillion Market Cap, Microsoft! Are There More Gains for MSFT Stock in Store? - Barchart.com",Barchart.com
"Wed, 29 Oct 2025 18:02:47 GMT",Microsoft Stock (NASDAQ:MSFT) Slips as AI Vision Execution Falters - TipRanks,TipRanks
"Thu, 30 Oct 2025 15:47:08 GMT","Nasdaq 100 Forecast: QQQ eases from record level as META, MSFT tumble - FOREX.com",FOREX.com
"Thu, 30 Oct 2025 20:10:30 GMT",Microsoft Corp (MSFT) Q1 2026 Earnings Call Highlights: Strong Cloud Growth and AI Investments ... - Yahoo Finance,Yahoo Finance
"Thu, 30 Oct 2025 23:27:40 GMT","Microsoft: Q3 Earnings Were Flawless, Stock Is A Buy (MSFT) - Seeking Alpha",Seeking Alpha
"Thu, 30 Oct 2025 17:04:56 GMT",Microsoft Faces High Capex and AI Bubble Concerns: What Should MSFT Stock Investors Do? - Barchart.com,Barchart.com
"Wed, 29 Oct 2025 20:26:15 GMT",MSFT Earnings: Microsoft Stock Slips despite Q1 Beat and Strong Cloud Momentum - TipRanks,TipRanks
"Thu, 30 Oct 2025 15:25:00 GMT","Biggest stock movers Thursday: GOOG, META, MSFT, MKTW, and more - Seeking Alpha",Seeking Alpha
"Tue, 28 Oct 2025 15:09:30 GMT",Why Microsoft (MSFT) Shares Are Climbing Today? - Yahoo Finance,Yahoo Finance
"Wed, 29 Oct 2025 23:49:00 GMT","Microsoft slides as it boosts capex forecast for 2026, tops Q1 estimates (MSFT:NASDAQ) - Seeking Alpha",Seeking Alpha
"Wed, 29 Oct 2025 20:22:19 GMT","Earnings Snapshot: Microsoft tops expectations, with Cloud revenue up 26% (NASDAQ:MSFT) - Seeking Alpha",Seeking Alpha
"Thu, 30 Oct 2025 15:44:59 GMT",Microsoft Stock (MSFT) Slides as Xbox Console Sales Fall 30% Year-Over-Year - TipRanks,TipRanks
"Wed, 29 Oct 2025 16:49:50 GMT","OpenAI Agreement Supports Microsoft’s (MSFT) Growth Prospects, Mizuho Says - Yahoo Finance",Yahoo Finance
"Thu, 30 Oct 2025 12:23:01 GMT","GOOGL, MSFT and META Reiterate Enormous Spending in AI Infrastructure - Zacks Investment Research",Zacks Investment Research
"Fri, 31 Oct 2025 02:50:21 GMT",(MSFT) Investment Report (MSFT:CA) - news.stocktradersdaily.com,news.stocktradersdaily.com
"Wed, 29 Oct 2025 18:13:45 GMT",What's Going On With Microsoft Stock Wednesday? - Microsoft (NASDAQ:MSFT) - Benzinga,Benzinga
"Tue, 28 Oct 2025 18:26:49 GMT",Microsoft Reports Q4 Earnings on October 29. Is MSFT a Buy Now? - Yahoo Finance,Yahoo Finance
"Wed, 29 Oct 2025 18:00:00 GMT","After-Hours Earnings Report for October 29, 2025 : MSFT, META, GOOGL, GOOG, NOW, KLAC, MELI, SBUX, EQIX, AEM, DB, CP - Nasdaq",Nasdaq
"Wed, 29 Oct 2025 13:56:59 GMT","Microsoft (MSFT) Heads Into Earnings With Strong AI Tailwinds, Analysts Say - Yahoo Finance",Yahoo Finance
"Wed, 29 Oct 2025 21:15:03 GMT",Microsoft (MSFT) Surpasses Q1 Earnings and Revenue Estimates - Yahoo Finance,Yahoo Finance
"Wed, 29 Oct 2025 10:45:23 GMT",Microsoft’s New OpenAI Deal Knocks Down ‘Number One’ Obstacle for MSFT Stock - TipRanks,TipRanks
"Wed, 29 Oct 2025 22:00:03 GMT","Compared to Estimates, Microsoft (MSFT) Q1 Earnings: A Look at Key Metrics - Yahoo Finance",Yahoo Finance
"Mon, 27 Oct 2025 14:43:38 GMT",Microsoft: Golden Buying Opportunity Before Earnings (NASDAQ:MSFT) - Seeking Alpha,Seeking Alpha
"Tue, 28 Oct 2025 19:46:11 GMT",Microsoft’s (MSFT) Q1 Earnings Tomorrow: Options Market Braces for a 4.75% Move - TipRanks,TipRanks
"Thu, 30 Oct 2025 13:30:19 GMT",Microsoft: Double Beat Not Enough To Justify $4T Market Cap (NASDAQ:MSFT) - Seeking Alpha,Seeking Alpha
"Thu, 30 Oct 2025 12:13:00 GMT","GOOGL, MSFT and META Reiterate Enormous Spending in AI Infrastructure - Nasdaq",Nasdaq
"Tue, 28 Oct 2025 03:19:00 GMT",Microsoft (MSFT) Q3 Earnings Report Preview: What To Look For - Yahoo Finance,Yahoo Finance
"Thu, 30 Oct 2025 10:20:00 GMT",New Analyst Forecast: $MSFT Given $650.0 Price Target - Quiver Quantitative,Quiver Quantitative
"Wed, 29 Oct 2025 15:17:56 GMT",Wall Street Bullish on ​Microsoft Corporation (MSFT) Ahead of its FQ1 2026 Earnings - Yahoo Finance,Yahoo Finance
"Thu, 30 Oct 2025 13:16:51 GMT",MSFT Q3 Deep Dive: AI Investments Drive Growth Amid Capacity Constraints - Yahoo! Finance Australia,Yahoo! Finance Australia
"Thu, 30 Oct 2025 11:07:33 GMT","Stock Movers: Alphabet, Meta, MSFT - Bloomberg.com",Bloomberg.com
"Thu, 30 Oct 2025 21:12:19 GMT",Microsoft (NASDAQ:MSFT) Trading Down 2.9% on Analyst Downgrade - MarketBeat,MarketBeat
"Thu, 30 Oct 2025 12:13:00 GMT","U.S. Stock Futures Fall as Investors Digest META, MSFT Earnings and U.S.-China Trade Truce - TipRanks",TipRanks
"Thu, 30 Oct 2025 13:39:03 GMT",TD Cowen Forecasts Strong Price Appreciation for Microsoft (NASDAQ:MSFT) Stock - MarketBeat,MarketBeat
"Tue, 28 Oct 2025 13:39:25 GMT",Brad Gerstner Says Microsoft (MSFT) ‘Misunderstood’ On AI Benefit - Yahoo Finance,Yahoo Finance
"Thu, 30 Oct 2025 20:38:15 GMT",UBS Group Reiterates Buy Rating for Microsoft (NASDAQ:MSFT) - MarketBeat,MarketBeat
"Thu, 30 Oct 2025 20:38:15 GMT",DZ Bank Reiterates Buy Rating for Microsoft (NASDAQ:MSFT) - MarketBeat,MarketBeat
"Tue, 28 Oct 2025 14:46:37 GMT",BofA Maintains Buy Rating on Microsoft (MSFT) Stock - Yahoo Finance,Yahoo Finance
"Thu, 30 Oct 2025 11:30:00 GMT","Breakfast News: META, MSFT Fall On Capex - The Motley Fool",The Motley Fool
"Wed, 29 Oct 2025 20:38:15 GMT","MSFT sinks on beat, GOOGL surges 5%, META crashes 6% on EPS miss - FXStreet",FXStreet
"Fri, 31 Oct 2025 04:25:28 GMT",Pattern recognition hints at MSFT upside - Exit Point & High Accuracy Buy Signal Tips - newser.com,newser.com
"Thu, 30 Oct 2025 16:01:58 GMT",Microsoft Sees Unusually Large Options Volume (NASDAQ:MSFT) - MarketBeat,MarketBeat
"Fri, 31 Oct 2025 03:43:37 GMT",What makes Roundhill ETF Trust Roundhill MSFT stock appealing to growth investors - Weekly Loss Report & Free Long-Term Investment Growth Plans - newser.com,newser.com
"Fri, 31 Oct 2025 06:19:17 GMT",Is MSFT stock poised for growth - Swing Trade & Community Verified Trade Signals - newser.com,newser.com
"Thu, 30 Oct 2025 07:35:16 GMT",MSFT in charts: Intelligent Cloud revenue climbs 28% - MSN,MSN
"Mon, 27 Oct 2025 17:28:00 GMT",Microsoft (MSFT) Q3 2025 Earnings Preview: Azure Momentum and the High-Stakes CapEx Narrative - marketpulse.com,marketpulse.com
"Thu, 30 Oct 2025 11:32:52 GMT","New Buy Rating for Microsoft (MSFT), the Technology Giant - The Globe and Mail",The Globe and Mail
"Fri, 31 Oct 2025 05:38:34 GMT",How interest rate cuts could boost MSFT stock - Weekly Profit Analysis & Real-Time Sentiment Analysis - newser.com,newser.com
"Wed, 29 Oct 2025 19:47:06 GMT",Microsoft says Azure outage likely to have 'full mitigation within the next four hours' (MSFT:NASDAQ) - Seeking Alpha,Seeking Alpha
"Tue, 28 Oct 2025 12:07:43 GMT",Microsoft (MSFT) Retains Buy Rating at UBS as Azure Growth Momentum Skews Positive - Yahoo Finance,Yahoo Finance
"Thu, 30 Oct 2025 12:18:54 GMT","GOOGL, META, MSFT: Big Tech Fuels AI Boom with Aggressive Capital Spending - TipRanks",TipRanks
"Tue, 28 Oct 2025 16:43:56 GMT","Microsoft (MSFT) Earnings on Deck: Azure, AI Demand, Margins - tastylive",tastylive
"Thu, 30 Oct 2025 13:39:04 GMT",Microsoft (NASDAQ:MSFT) Price Target Raised to $575.00 - MarketBeat,MarketBeat
"Tue, 28 Oct 2025 07:00:00 GMT",MSFT vs. GOOGL: Which ‘Magnificent 7’ AI Stock Will Impress Wall Street This Earnings Season? - TipRanks,TipRanks
"Thu, 30 Oct 2025 10:01:37 GMT","Biggest stock movers Thursday: GOOG, META, MSFT, and more - MSN",MSN
"Wed, 29 Oct 2025 20:54:11 GMT",MSFT in charts: Intelligent Cloud revenue climbs 28% (NASDAQ:MSFT) - Seeking Alpha,Seeking Alpha
"Thu, 30 Oct 2025 13:11:39 GMT",Microsoft continues to add AI capacity as analysts expect Azure to accelerate (MSFT:NASDAQ) - Seeking Alpha,Seeking Alpha
"Thu, 30 Oct 2025 13:39:06 GMT",Raymond James Financial Cuts Microsoft (NASDAQ:MSFT) Price Target to $600.00 - MarketBeat,MarketBeat
"Thu, 30 Oct 2025 12:08:29 GMT",Microsoft (NASDAQ:MSFT) Stock Acquired Rep. Marjorie Taylor Greene - MarketBeat,MarketBeat
"Thu, 30 Oct 2025 12:39:46 GMT",Microsoft (NASDAQ:MSFT) Price Target Raised to $650.00 - MarketBeat,MarketBeat
"Thu, 30 Oct 2025 09:01:20 GMT",Jim Cramer Discusses Microsoft (MSFT)’s Control Over Productivity Software - Insider Monkey,Insider Monkey
"Thu, 30 Oct 2025 14:14:38 GMT",MSFT News Today: Strategic AI Moves Justify Buy Rating Amid Price Volatility - Meyka,Meyka
"Thu, 30 Oct 2025 12:27:43 GMT",Microsoft (NASDAQ:MSFT) Receives Overweight Rating from Piper Sandler - MarketBeat,MarketBeat
"Thu, 30 Oct 2025 15:14:07 GMT","Wedbush Maintains Microsoft(MSFT.US) With Buy Rating, Maintains Target Price $625 - 富途牛牛",富途牛牛
"Wed, 29 Oct 2025 22:00:00 GMT","Compared to Estimates, Microsoft (MSFT) Q1 Earnings: A Look at Key Metrics - Nasdaq",Nasdaq
"Thu, 30 Oct 2025 12:27:38 GMT",Microsoft (NASDAQ:MSFT) Price Target Lowered to $625.00 at BMO Capital Markets - MarketBeat,MarketBeat
"Wed, 29 Oct 2025 17:40:22 GMT",Microsoft Stock (NASDAQ:MSFT) Slides Despite Substantial AI Push - TipRanks,TipRanks
"Thu, 30 Oct 2025 00:47:28 GMT",How Investors Are Reacting To Microsoft (MSFT) Securing Extended Exclusive AI Rights With OpenAI - simplywall.st,simplywall.st
"Thu, 30 Oct 2025 13:00:01 GMT","A Quick Look at Today's Ratings for Microsoft(MSFT.US), With a Forecast Between $575 to $700 - 富途牛牛",富途牛牛
"Thu, 30 Oct 2025 14:17:02 GMT","MSFT, META stock sink on AI spending plans: analyst view only one as buy - Invezz",Invezz
"Mon, 27 Oct 2025 15:54:12 GMT",TD Cowen Keeps Buy Rating on Microsoft (MSFT) Ahead of Q1 Report - Yahoo Finance,Yahoo Finance
"Wed, 29 Oct 2025 18:15:00 GMT",Listen to the Microsoft (MSFT) Q1 2026 earnings call here - Shacknews,Shacknews
"Mon, 27 Oct 2025 21:58:17 GMT",Is Microsoft (MSFT) a Good Stock to Buy before Earnings? - TipRanks,TipRanks
"Thu, 30 Oct 2025 05:22:22 GMT",Microsoft restores Azure after global outage (MSFT:NASDAQ) - Seeking Alpha,Seeking Alpha
"Wed, 29 Oct 2025 21:00:00 GMT",Microsoft (NASDAQ:MSFT) Posts Better-Than-Expected Sales In Q3 - FinancialContent,FinancialContent
2025-10-30T21:10:30,Microsoft Corp (MSFT) Q1 2026 Earnings Call Highlights: Strong Cloud Growth and AI Investments ...,Yahoo
2025-10-30T21:08:00,US Equity Markets End Lower Amid Drop in Major Stocks,Yahoo
2025-10-30T20:27:40,"Microsoft: Q3 Earnings Were Flawless, Stock Is A Buy",SeekingAlpha
2025-10-30T19:11:00,"Microsoft Q1 Earnings & Revenues Beat on Cloud, AI Strength",Yahoo
2025-10-30T18:33:49,"US Equity Indexes Trade Mixed Amid Big-Tech Slump, Uncertainty Surrounding December Rate Cut",Yahoo
2025-10-30T18:30:00,"Google knocked earnings 'out of the park', Microsoft was 'decent'",Yahoo
2025-10-30T18:19:30,Microsoft's $35B AI Bet and OpenAI Deal Might Change The Case For Investing In MSFT,Yahoo
2025-10-30T17:35:52,"US Equity Indexes Mixed as Microsoft, Meta Platforms Slump While December Rate-Cut Not a Slam Dunk",Yahoo
2025-10-30T17:27:00,Microsoft Stock Dips As $35B AI Spending Plan Sparks Margin Concerns Despite Azure Strength,SeekingAlpha
2025-10-30T15:04:21,Microsoft: Q1 Earnings Were Overshadowed By Bigger Events,SeekingAlpha
2025-10-30T14:51:21,"Meta, Microsoft, Alphabet go all in on AI spending: What to know",Yahoo
2025-10-30T14:08:49,"US-China trade truce, Alphabet earnings, Fed rate cut: 3 Things",Yahoo
2025-10-30T13:13:00,"GOOGL, MSFT and META Reiterate Enormous Spending in AI Infrastructure",Yahoo
2025-10-30T10:30:19,Microsoft: Double Beat Not Enough To Justify $4T Market Cap,SeekingAlpha
2025-10-29T23:46:02,Microsoft (MSFT) Q1 2026 Earnings Call Transcript,Yahoo
2025-10-29T22:06:25,Microsoft Corporation (MSFT) Q1 2026 Earnings Call Transcript,SeekingAlpha
2025-10-29T21:31:09,Bill Gates Told Satya Nadella 'You're Going To Burn This Billion Dollars' By Investing In OpenAI — But Microsoft's Bet Became A 100-Bagger,Yahoo
2025-10-29T21:18:54,"Microsoft tops Q1 earnings estimates, boosted by cloud revenue",Yahoo
2025-10-29T21:15:01,Microsoft: Fiscal Q1 Earnings Snapshot,Yahoo
2025-10-29T21:14:11,Jim Cramer Says “Microsoft’s in a Tough Spot”,Yahoo
2025-10-29T20:45:00,"Microsoft continues to be best exposure to OpenAI, analyst says",Yahoo
2025-10-30T22:02:47,"Hyperscalers Cloud Revenue Growth: MSFT $49.1b (up 26%), AMZN $33b (up 20%) and GOOGL $15.2b (up 34%)",Reddit/r/stocks
2025-10-30T17:26:05,MSFT - How long do I have?,Reddit/r/investing
2025-10-29T18:14:34,Absolutely everything you need to know about MSFT earnings,Reddit/r/stocks
