Date,Title,Source
2025-09-06T06:14:58Z,FY2027 EPS Estimates for Novartis Raised by Zacks Research,ETF Daily News
2025-09-05T05:16:54Z,Brokerages Set Novartis AG (NYSE:NVS) Target Price at $123.50,ETF Daily News
"Tue, 09 Sep 2025 06:13:18 GMT",Novartis to acquire Tourmaline Bio in $1.4B all-cash deal (NVS:NYSE) - Seeking Alpha,Seeking Alpha
"Tue, 09 Sep 2025 06:55:56 GMT",Novartis (NVS) Acquires Tourmaline Bio for $1.4 Billion in Cash - GuruFocus,GuruFocus
"Tue, 09 Sep 2025 06:45:45 GMT","M&A Snapshot: Novartis to buy Tourmaline Bio for $1.4B, citing promise of pacibekitug (NVS:NYSE) - Seeking Alpha",Seeking Alpha
"Thu, 04 Sep 2025 17:09:56 GMT",Nagaland beat NVS 1–0 in Sub Junior Boys Subroto Cup - Eastern Mirror,Eastern Mirror
