Date,Title,Source
2025-10-22T11:29:05Z,Jim Cramer Says Airbnb is “Chronically Being Denigrated”,Yahoo Entertainment
"Sun, 26 Oct 2025 06:51:18 GMT",Can Tidal Trust II YieldMax ABNB stock test all time highs - 2025 Biggest Moves & Safe Swing Trade Setups - newser.com,newser.com
"Fri, 24 Oct 2025 20:38:00 GMT",UBS Maintains Airbnb (ABNB) Neutral Recommendation - Nasdaq,Nasdaq
"Sat, 25 Oct 2025 11:34:24 GMT",Should Airbnb’s (ABNB) AI-Powered Service Upgrades Change How Investors View Its Competitive Edge? - simplywall.st,simplywall.st
"Sat, 25 Oct 2025 15:50:52 GMT",UBS Group Issues Pessimistic Forecast for Airbnb (NASDAQ:ABNB) Stock Price - MarketBeat,MarketBeat
"Thu, 23 Oct 2025 10:20:00 GMT",New Analyst Forecast: $ABNB Given 'Sector Weight' Rating - Quiver Quantitative,Quiver Quantitative
"Sun, 26 Oct 2025 01:46:55 GMT",Will ABNB stock sustain high P E ratios - Gold Moves & Technical Pattern Recognition Alerts - newser.com,newser.com
"Thu, 23 Oct 2025 12:04:00 GMT",Keybanc Maintains Airbnb (ABNB) Sector Weight Recommendation - Nasdaq,Nasdaq
"Sat, 25 Oct 2025 16:23:16 GMT",Airbnb (NASDAQ:ABNB) Given Hold (C) Rating at Weiss Ratings - MarketBeat,MarketBeat
"Sun, 26 Oct 2025 00:32:49 GMT",Is ABNB stock entering bullish territory - 2025 Analyst Calls & Fast Entry High Yield Stock Tips - newser.com,newser.com
"Sat, 25 Oct 2025 10:27:15 GMT","Asset Management One Co. Ltd. Purchases 29,274 Shares of Airbnb, Inc. $ABNB - MarketBeat",MarketBeat
"Sun, 26 Oct 2025 05:37:10 GMT",Trend analysis for ABNB this week - Market Activity Recap & Free Weekly Chart Analysis and Trade Guides - newser.com,newser.com
"Sat, 25 Oct 2025 22:51:53 GMT",Is ABNB stock entering bullish territory - Gold Moves & Fast Entry Momentum Trade Alerts - newser.com,newser.com
"Sat, 25 Oct 2025 21:14:22 GMT",Is ABNB still worth holding after the dip - Trade Volume Summary & Reliable Price Breakout Alerts - newser.com,newser.com
"Sat, 25 Oct 2025 17:54:38 GMT",How to forecast ABNB trends using time series - July 2025 Price Swings & High Accuracy Buy Signal Tips - newser.com,newser.com
"Sat, 25 Oct 2025 17:43:06 GMT",Will ABNB stock sustain high P E ratios - Quarterly Portfolio Review & Breakout Confirmation Trade Signals - newser.com,newser.com
"Sun, 26 Oct 2025 01:20:18 GMT",Will earnings trigger a reversal in ABNB - 2025 Volume Leaders & Community Verified Watchlist Alerts - newser.com,newser.com
"Sun, 26 Oct 2025 03:38:35 GMT",ABNB stock momentum explained - Weekly Earnings Recap & Real-Time Volume Trigger Notifications - newser.com,newser.com
"Sat, 25 Oct 2025 10:39:14 GMT",Will ABNB stock sustain high P E ratios - Weekly Trade Recap & Accurate Trade Setup Notifications - newser.com,newser.com
"Sun, 26 Oct 2025 00:46:35 GMT",Trend analysis for ABNB this week - Market Growth Report & Smart Allocation Stock Tips - newser.com,newser.com
"Thu, 23 Oct 2025 15:11:00 GMT",Interesting ABNB Put And Call Options For December 5th - Nasdaq,Nasdaq
"Fri, 24 Oct 2025 09:38:00 GMT","D.A. Davidson & CO. Increases Stock Holdings in Airbnb, Inc. $ABNB - MarketBeat",MarketBeat
"Sat, 25 Oct 2025 09:00:14 GMT",Is ABNB still worth holding after the dip - Trade Analysis Summary & Low Risk Entry Point Tips - newser.com,newser.com
"Sat, 25 Oct 2025 01:46:16 GMT",Analyzing net buyer seller activity in ABNB - Swing Trade & Trade Opportunity Analysis - newser.com,newser.com
"Sat, 25 Oct 2025 20:42:04 GMT",How to forecast ABNB trends using time series - July 2025 Chart Watch & Risk Adjusted Buy and Sell Alerts - newser.com,newser.com
"Fri, 24 Oct 2025 15:53:55 GMT","UBS Adjusts Price Target for ABNB, Maintains Neutral Rating | AB - GuruFocus",GuruFocus
"Thu, 23 Oct 2025 10:06:19 GMT",Airbnb (ABNB) Receives 'Sector Weight' Rating from Keybanc Today | ABNB Stock News - GuruFocus,GuruFocus
"Thu, 23 Oct 2025 14:30:11 GMT","FSM Wealth Advisors LLC Buys 3,895 Shares of Airbnb, Inc. $ABNB - MarketBeat",MarketBeat
"Wed, 22 Oct 2025 16:56:53 GMT","ChatGPT Is not ‘Robust Enough’ for Airbnb’s (ABNB) Needs, Says CEO - TipRanks",TipRanks
"Thu, 23 Oct 2025 12:16:35 GMT",Will earnings trigger a reversal in ABNB - Portfolio Performance Summary & High Accuracy Buy Signal Tips - newser.com,newser.com
"Thu, 23 Oct 2025 13:48:55 GMT","Gallagher Capital Advisors LLC Sells 2,317 Shares of Airbnb, Inc. $ABNB - MarketBeat",MarketBeat
"Thu, 23 Oct 2025 10:45:21 GMT",Wedbush Comments on Airbnb's Q3 Earnings (NASDAQ:ABNB) - MarketBeat,MarketBeat
"Thu, 23 Oct 2025 10:30:39 GMT","Whittier Trust Co. Sells 2,057 Shares of Airbnb, Inc. $ABNB - MarketBeat",MarketBeat
"Thu, 23 Oct 2025 09:44:18 GMT","DekaBank Deutsche Girozentrale Trims Holdings in Airbnb, Inc. $ABNB - MarketBeat",MarketBeat
"Tue, 21 Oct 2025 16:58:25 GMT",Airbnb (ABNB) Adds New Social Features for Those Attending Its ‘Experiences’ - TipRanks,TipRanks
"Wed, 22 Oct 2025 23:52:56 GMT",KeyBanc Initiates New Coverage on Airbnb (ABNB) Without Change in Rating - GuruFocus,GuruFocus
"Wed, 22 Oct 2025 13:42:55 GMT","ARK Investment Management LLC Boosts Stock Holdings in Airbnb, Inc. $ABNB - MarketBeat",MarketBeat
"Wed, 22 Oct 2025 02:29:42 GMT",Analyzing net buyer seller activity in ABNB - Weekly Profit Summary & Step-by-Step Swing Trade Plans - newser.com,newser.com
"Sat, 25 Oct 2025 06:39:33 GMT",Trend analysis for ABNB this week - Market Sentiment Summary & Proven Capital Preservation Methods - newser.com,newser.com
"Thu, 23 Oct 2025 12:25:35 GMT",Airbnb (NASDAQ:ABNB) Earns Sector Weight Rating from Analysts at KeyCorp - MarketBeat,MarketBeat
"Wed, 22 Oct 2025 13:02:57 GMT","Airbnb, Inc. $ABNB Shares Bought by Birch Hill Investment Advisors LLC - MarketBeat",MarketBeat
"Thu, 23 Oct 2025 07:00:00 GMT",Airbnb (NASDAQ:ABNB) NASDAQ COMPOSITE ETF Powers Hospitality - Kalkine Media,Kalkine Media
"Fri, 24 Oct 2025 17:22:56 GMT",Trend analysis for ABNB this week - July 2025 Recap & Free Technical Pattern Based Buy Signals - newser.com,newser.com
"Fri, 24 Oct 2025 12:27:27 GMT","UBS Maintains Airbnb(ABNB.US) With Hold Rating, Cuts Target Price to $145 - 富途牛牛",富途牛牛
"Wed, 22 Oct 2025 03:21:19 GMT",Real time breakdown of ABNB stock performance - 2025 Market WrapUp & Daily Profit Maximizing Trade Tips - newser.com,newser.com
"Tue, 21 Oct 2025 07:48:42 GMT",ABNB stock momentum explained - CPI Data & AI Powered Buy and Sell Recommendations - newser.com,newser.com
"Wed, 22 Oct 2025 15:09:38 GMT",Airbnb (ABNB) Plans to Integrate ChatGPT Despite Current Limitat - GuruFocus,GuruFocus
"Fri, 24 Oct 2025 20:38:53 GMT",Is ABNB stock entering bullish territory - 2025 Market WrapUp & Expert Approved Trade Ideas - newser.com,newser.com
"Fri, 24 Oct 2025 23:01:34 GMT",Can Tidal Trust II YieldMax ABNB stock test all time highs - 2025 Big Picture & Growth Oriented Trade Recommendations - newser.com,newser.com
"Thu, 23 Oct 2025 12:30:08 GMT",ABNB stock momentum explained - Market Movement Recap & Accurate Entry and Exit Point Alerts - newser.com,newser.com
"Tue, 21 Oct 2025 09:22:17 GMT","Chicago Partners Investment Group LLC Has $1.73 Million Position in Airbnb, Inc. $ABNB - MarketBeat",MarketBeat
"Thu, 23 Oct 2025 05:41:36 GMT",Can technical indicators confirm ABNB’s reversal - Weekly Trade Report & Real-Time Buy Zone Alerts - newser.com,newser.com
"Tue, 21 Oct 2025 14:45:23 GMT",Airbnb (ABNB.US) has added direct messaging and social features to its platform. - 富途牛牛,富途牛牛
"Tue, 21 Oct 2025 09:59:26 GMT",ABNB’s volatility index tracking explained - 2025 Earnings Surprises & Fast Moving Market Watchlists - newser.com,newser.com
"Fri, 24 Oct 2025 07:00:00 GMT",Wedbush Weighs in on Airbnb’s Q3 Earnings (NASDAQ:ABNB) - Defense World,Defense World
"Thu, 23 Oct 2025 02:30:55 GMT","Airbnb, Inc. $ABNB Shares Sold by Allspring Global Investments Holdings LLC - Defense World",Defense World
2025-10-22T13:29:05,Jim Cramer Says Airbnb is “Chronically Being Denigrated”,Yahoo
