Date,Title,Source
2025-08-31T06:36:43Z,Best Medical Stocks To Watch Now – August 29th,ETF Daily News
2025-08-30T09:20:53Z,Hsbc Global Res Upgrades Eli Lilly and Company (NYSE:LLY) to Hold,ETF Daily News
2025-08-29T20:50:11Z,"Eli Lilly and Company (LLY) Needs To Get A Weight Loss Pill Out, Says Jim Cramer",Yahoo Entertainment
2025-08-29T19:05:30Z,Jim Cramer Sees Big Potential in Eli Lilly’s Weight-Loss and Diabetes Pill,Yahoo Entertainment
2025-08-29T11:17:55Z,Eli Lilly Stock: Is LLY Underperforming the Healthcare Sector?,Biztoc.com
2025-08-29T11:11:06Z,Eli Lilly Stock: Is LLY Underperforming the Healthcare Sector?,Barchart.com
2025-08-29T06:06:44Z,Top Pharmaceutical Stocks To Keep An Eye On – August 27th,ETF Daily News
2025-08-28T07:36:55Z,Medical Stocks To Add to Your Watchlist – August 25th,ETF Daily News
2025-08-27T14:18:50Z,Eli Lilly and Company (LLY): A Bull Case Theory,Biztoc.com
2025-08-27T14:02:46Z,Eli Lilly and Company (LLY): A Bull Case Theory,Yahoo Entertainment
2025-08-27T13:34:18Z,"Micron initiated, Eli Lilly upgraded: Wall Street's top analyst calls",Yahoo Entertainment
2025-08-27T07:44:24Z,Slides on Rival Weight Loss Pill News,Biztoc.com
2025-08-27T06:03:01Z,Best Pharmaceutical Stocks To Keep An Eye On – August 25th,ETF Daily News
2025-08-27T03:53:52Z,Goldman Sachs Remains Positive as Eli Lilly (LLY) Expands Obesity Drug Pipeline,Yahoo Entertainment
2025-08-27T00:49:29Z,Prepares for Weight Loss Pill Approval After Late-Stage Clinical Trial,Biztoc.com
"Mon, 01 Sep 2025 01:20:58 GMT","If You'd Invested $1,000 in Eli Lilly (LLY) Stock 5 Years Ago, Here's How Much You'd Have Today - AOL.com",AOL.com
"Sun, 31 Aug 2025 20:15:43 GMT",Eli Lilly Stock: Is LLY Underperforming the Healthcare Sector? - MSN,MSN
"Fri, 29 Aug 2025 20:10:00 GMT",Stock Quote & Chart | Eli Lilly and Company - Eli Lilly and Company,Eli Lilly and Company
"Mon, 01 Sep 2025 05:55:35 GMT",Stock Analysis | Eli Lilly Outlook - Navigating Volatility Amid Mixed Signals - AInvest,AInvest
"Fri, 29 Aug 2025 14:40:00 GMT",Lilly Is Angling For Approval Of Its Obesity Pill. Is It Now A Buy? - Investor's Business Daily,Investor's Business Daily
"Mon, 01 Sep 2025 00:42:01 GMT",(LLY) Volatility Zones as Tactical Triggers - news.stocktradersdaily.com,news.stocktradersdaily.com
"Sun, 31 Aug 2025 04:21:30 GMT","HSBC Upgrades Eli Lilly (LLY) to Hold, Lifts Price Target to $700 - Yahoo Finance",Yahoo Finance
"Wed, 27 Aug 2025 16:54:11 GMT",Eli Lilly’s Stock (LLY) Is Upgraded by HSBC as Weight-Loss Pill Moves Closer to Approval - TipRanks,TipRanks
"Fri, 29 Aug 2025 16:28:43 GMT",Eli Lilly (NYSE:LLY) Stock Price Trading at $732 as GLP-1 Sales Surge and Drug Pricing Risks Rise - tradingnews.com,tradingnews.com
"Fri, 29 Aug 2025 11:11:06 GMT",Eli Lilly Stock: Is LLY Underperforming The Healthcare Sector? - Barchart.com,Barchart.com
"Thu, 28 Aug 2025 17:47:01 GMT",Eli Lilly (LLY) Reports Positive Outcomes for Verzenio in Breast Cancer Trial - simplywall.st,simplywall.st
"Sun, 31 Aug 2025 12:52:52 GMT",Eli Lilly and Company (LLY): A Bull Case Theory - MSN,MSN
"Wed, 27 Aug 2025 11:23:57 GMT",LLY vs. PFE: Which Pharma Giant Is the Better Pick for Investors? - Zacks Investment Research,Zacks Investment Research
"Sat, 30 Aug 2025 12:36:41 GMT",Eli Lilly Stock: Is LLY Underperforming the Healthcare Sector? - AInvest,AInvest
"Fri, 29 Aug 2025 16:39:56 GMT",Eli Lilly (NYSE:LLY) vs Novo Nordisk (NYSE:NVO): Growth Premium vs Value Upside - tradingnews.com,tradingnews.com
"Fri, 29 Aug 2025 21:57:39 GMT","Eli Lilly and Company (LLY) Needs To Get A Weight Loss Pill Out, Says Jim Cramer - MSN",MSN
"Wed, 27 Aug 2025 12:08:00 GMT",LLY vs. PFE: Which Pharma Giant Is the Better Pick for Investors? - Yahoo Finance,Yahoo Finance
"Sat, 30 Aug 2025 06:14:19 GMT",Stock Analysis | Eli Lilly Outlook - Mixed Signals Amid Volatile Market Conditions - AInvest,AInvest
"Sat, 30 Aug 2025 00:50:26 GMT",Goldman Sachs Remains Positive as Eli Lilly (LLY) Expands Obesity Drug Pipeline - MSN,MSN
"Thu, 28 Aug 2025 15:51:15 GMT","Eli Lilly: In The Eye Of The Drug Pricing Storm - Expect Volatility, And Buy (NYSE:LLY) - Seeking Alpha",Seeking Alpha
"Wed, 27 Aug 2025 13:05:01 GMT",Eli Lilly stock upgraded at HSBC on obesity pill (LLY:NYSE) - Seeking Alpha,Seeking Alpha
"Thu, 28 Aug 2025 17:49:46 GMT",Eli Lilly (LLY) technical analysis - Eli Lilly (NYSE:LLY) - Benzinga,Benzinga
"Wed, 27 Aug 2025 10:20:11 GMT",Positive ATTAIN-2 Results for Oral GLP-1 Could Be a Game Changer For Eli Lilly (LLY) - Yahoo Finance,Yahoo Finance
"Thu, 28 Aug 2025 12:18:50 GMT",Eli Lilly: Why I'm Pairing It With My Novo Position (NYSE:LLY) - Seeking Alpha,Seeking Alpha
"Thu, 28 Aug 2025 15:07:09 GMT",Eli Lilly: Orals Unlock The Next Wave Of Obesity Drug Adoption (NYSE:LLY) - Seeking Alpha,Seeking Alpha
"Wed, 27 Aug 2025 18:17:43 GMT","High Volume Option Trading in CRWD, LLY, and UNH on Wednesday - AInvest",AInvest
"Fri, 29 Aug 2025 06:10:50 GMT",Stock Analysis | Eli Lilly Outlook - Mixed Signals Amid Rising Share Price - AInvest,AInvest
"Thu, 28 Aug 2025 07:14:02 GMT",How (LLY) Movements Inform Risk Allocation Models - news.stocktradersdaily.com,news.stocktradersdaily.com
"Fri, 29 Aug 2025 02:18:55 GMT",Decoding Insider Activity at Eli Lilly: A Closer Look at Recent Share Sales and Buying Conviction - AInvest,AInvest
"Wed, 27 Aug 2025 14:58:03 GMT",Why (LLY) Price Action Is Critical for Tactical Trading - news.stocktradersdaily.com,news.stocktradersdaily.com
"Wed, 27 Aug 2025 10:54:03 GMT",Responsive Playbooks and the LLY Inflection - news.stocktradersdaily.com,news.stocktradersdaily.com
"Wed, 27 Aug 2025 18:10:00 GMT","Notable Wednesday Option Activity: CRWD, LLY, UNH - Nasdaq",Nasdaq
"Wed, 27 Aug 2025 18:07:24 GMT","Top Analyst Forecasts for Wednesday: AAL, MDB, NCNO, PVH, OKTA, LLY, OMI, REGN, KDP, HEI. - AInvest",AInvest
"Thu, 28 Aug 2025 10:29:40 GMT","UK Patients Scramble For Mounjaro As Eli Lilly's 170% Price Hike Plan Sparks Shortages, Health Fears - Benzinga",Benzinga
"Wed, 27 Aug 2025 12:34:14 GMT",UBS Reiterates Buy Rating on Eli Lilly (LLY) - StreetInsider,StreetInsider
"Wed, 27 Aug 2025 12:56:14 GMT",BMO Capital: 'Eli Lilly (LLY) Shares Expected to Trade Higher Post ATTAIN-1 Data' - StreetInsider,StreetInsider
"Wed, 27 Aug 2025 09:08:14 GMT",HSBC Upgrades Eli Lilly (LLY) to Hold - StreetInsider,StreetInsider
"Wed, 27 Aug 2025 13:00:01 GMT","A Quick Look at Today's Ratings for Eli Lilly and Co(LLY.US), With a Forecast Between $840 to $1,190 - 富途牛牛",富途牛牛
"Wed, 27 Aug 2025 15:57:21 GMT",Eli Lilly (LLY) Sells Record $6.75 Billion of Corporate Bonds - MSN,MSN
"Thu, 28 Aug 2025 05:36:20 GMT","Eli Lilly and Company (LLY): I Would “Love” If Trump Praised The Company, Says Jim Cramer - MSN",MSN
"Thu, 28 Aug 2025 00:05:12 GMT",Eli Lilly (LLY) Launches Easy Mounjaro Pen in India Amid Growing Diabetes Market - MSN,MSN
"Wed, 27 Aug 2025 12:11:00 GMT",Does Lilly's New Obesity Pill Data Put It Back in the Weight Game? - TradingView,TradingView
"Thu, 28 Aug 2025 07:52:00 GMT",Eli Lilly halts UK shipments of Mounjaro diabetes and weight-loss drug - proactiveinvestors.co.uk,proactiveinvestors.co.uk
"Thu, 28 Aug 2025 03:18:54 GMT","4 stocks to watch on Tuesday: T, LLY, AMD, GM - MSN",MSN
"Wed, 27 Aug 2025 14:09:43 GMT",Eli Lilly and Company (LLY): A Bull Case Theory - Insider Monkey,Insider Monkey
"Sat, 30 Aug 2025 07:51:11 GMT",Eli Lilly and Company (NYSE:LLY) Upgraded by Wall Street Zen to Strong-Buy Rating - Defense World,Defense World
"Sat, 30 Aug 2025 06:00:58 GMT",Critical Comparison: Eli Lilly and Company (NYSE:LLY) and Johnson & Johnson (NYSE:JNJ) - Defense World,Defense World
"Fri, 29 Aug 2025 05:22:50 GMT",Eli Lilly and Company (NYSE:LLY) Stock Rating Upgraded by Hsbc Global Res - Defense World,Defense World
2025-08-29T22:50:11,"Eli Lilly and Company (LLY) Needs To Get A Weight Loss Pill Out, Says Jim Cramer",Yahoo
2025-08-29T21:06:08,Mounjaro Price Bomb Sparks UK Pharmacy Rebellion--Wegovy Cashes In,Yahoo
2025-08-29T21:05:30,Jim Cramer Sees Big Potential in Eli Lilly’s Weight-Loss and Diabetes Pill,Yahoo
2025-08-29T18:58:00,"The Zacks Analyst Blog Highlights Lilly, Oracle, Procter & Gamble and Comstock Holding Companies",Yahoo
2025-08-29T13:59:23,Cost of Mounjaro to be discounted in UK pharmacies,Yahoo
2025-08-29T13:11:06,Eli Lilly Stock: Is LLY Underperforming the Healthcare Sector?,Yahoo
2025-08-28T23:59:00,"Top Stock Reports for Eli Lilly, Oracle & Procter & Gamble",Yahoo
2025-08-28T19:34:45,Eli Lilly (LLY) Reports Positive Outcomes for Verzenio in Breast Cancer Trial,Yahoo
2025-08-28T17:10:49,Eli Lilly’s Verzenio boosts OS in breast cancer as Novartis rivalry heats up,Yahoo
2025-08-28T13:51:15,"Eli Lilly: In The Eye Of The Drug Pricing Storm - Expect Volatility, And Buy",SeekingAlpha
2025-08-28T13:07:09,Eli Lilly: Orals Unlock The Next Wave Of Obesity Drug Adoption,SeekingAlpha
2025-08-28T12:03:58,Eli Lilly said it would bring 750 jobs to Kenosha County. Contract with state calls for 560,Yahoo
2025-08-28T10:18:50,Eli Lilly: Why I'm Pairing It With My Novo Position,SeekingAlpha
2025-08-28T00:37:55,Eli Lilly temporarily halts UK shipments of weight-loss drug Mounjaro,Yahoo
2025-08-27T23:03:00,"Lilly's Verzenio® (abemaciclib) increases overall survival in HR+, HER2-, high-risk early breast cancer with two years of therapy",Yahoo
2025-08-27T22:20:00,NVIDIA Announces Financial Results for Second Quarter Fiscal 2026,Yahoo
2025-08-27T19:29:42,Eli Lilly (LLY) Highlights Positive Trial Results For Verzenio And Orforglipron,Yahoo
2025-08-27T16:32:09,2024 saw growth recovery for almost all top biopharma companies,Yahoo
2025-08-27T16:02:46,Eli Lilly and Company (LLY): A Bull Case Theory,Yahoo
2025-08-27T16:00:00,Billionaire Stanley Druckenmiller Just Bought the Dip on This Beaten-Down GLP-1 Stock (Hint: It's Not Eli Lilly or Novo Nordisk),Yahoo
2025-08-27T15:35:00,"Company News for Aug 27, 2025",Yahoo
2025-08-27T15:34:18,"Micron initiated, Eli Lilly upgraded: Wall Street's top analyst calls",Yahoo
2025-08-27T15:33:34,"Update: HSBC Upgrades Eli Lilly to Hold From Reduce, Adjusts Price Target to $700 From $675",Yahoo
2025-08-27T14:44:50,"HSBC upgrades Eli Lilly to Hold, says ’bear case has played out’",Yahoo
2025-08-27T14:11:00,Does Lilly's New Obesity Pill Data Put It Back in the Weight Game?,Yahoo
2025-08-27T14:08:00,LLY vs. PFE: Which Pharma Giant Is the Better Pick for Investors?,Yahoo
2025-08-27T14:00:00,"Binge Eating Disorders Global Market Research Report 2025-2035 Featuring Eli Lilly, Amneal, Takeda, Tryp Therapeutics, Tonix, Sumitomo, VIVUS, Novartis, and Pfize",Yahoo
2025-08-27T13:39:37,Eli Lilly eyes orforglipron approval after Phase III diabetes trial success,Yahoo
2025-08-27T12:20:11,Positive ATTAIN-2 Results for Oral GLP-1 Could Be a Game Changer For Eli Lilly (LLY),Yahoo
2025-08-27T09:25:00,"The bear case on Eli Lilly has played out, says only firm to have called it a sell",MarketWatch
2025-08-27T05:53:52,Goldman Sachs Remains Positive as Eli Lilly (LLY) Expands Obesity Drug Pipeline,Yahoo
2025-08-31T21:00:19,$LLY,Reddit/r/wallstreetbets
2025-08-30T05:27:45,LLY 10k Port,Reddit/r/wallstreetbets
