Date,Title,Source
"Thu, 11 Dec 2025 01:17:47 GMT",QUALCOMM Incorporated (QCOM) Updates Bylaws to Empower Shareholders - GuruFocus,GuruFocus
"Tue, 09 Dec 2025 14:04:00 GMT",Qualcomm Stock (QCOM) Opinions on AI Chip Launch and Market Growth - Quiver Quantitative,Quiver Quantitative
"Sun, 07 Dec 2025 08:24:53 GMT","Qualcomm (QCOM): Reassessing Valuation After Strong Results and Growing AI, Automotive and IoT Momentum - simplywall.st",simplywall.st
"Wed, 10 Dec 2025 19:43:05 GMT","QCOM news: AI chip expansion, $3.4B shareholder returns drive Qualcomm to new highs - Traders Union",Traders Union
2025-12-11T11:18:34,The Bull Case For QUALCOMM (QCOM) Could Change Following New Shareholder Meeting Rights And Governance Shift,Yahoo
