Date,Title,Source
2025-09-07T05:09:42Z,Oracle (ORCL) Projected to Post Quarterly Earnings on Tuesday,ETF Daily News
2025-09-06T15:55:14Z,"Oracle Corporation (ORCL) Building US Data Centers Could Make Trump Ask Others To Do The Same, Says Jim Cramer",Yahoo Entertainment
2025-09-05T17:31:18Z,Oracle and Adobe Earnings Showdown – Unveiling the Financial Landscape Ahead,Yahoo Entertainment
2025-09-03T12:28:02Z,Broad-Based Growth Drivers Lifted Oracle (ORCL) in Q2,Biztoc.com
2025-09-03T12:14:33Z,Broad-Based Growth Drivers Lifted Oracle (ORCL) in Q2,Yahoo Entertainment
"Mon, 08 Sep 2025 03:07:04 GMT",Oracle Stock (ORCL) Is About to Report Q1 Earnings Tomorrow. Here Is What to Expect - TipRanks,TipRanks
"Sat, 06 Sep 2025 11:29:49 GMT",Oracle (ORCL): Evaluating the Stock’s Valuation Following New Healthcare Cloud Deals and Technology Advances - Yahoo Finance,Yahoo Finance
"Sun, 07 Sep 2025 18:07:07 GMT",Microsoft Stock vs Oracle Stock Forecast: MSFT and ORCL Clash in Cloud and AI Growth - tradingnews.com,tradingnews.com
"Mon, 08 Sep 2025 04:18:02 GMT",Responsive Playbooks and the ORCL Inflection - news.stocktradersdaily.com,news.stocktradersdaily.com
"Sun, 07 Sep 2025 12:00:07 GMT","Earnings week ahead: ADBE, ORCL, GME, KR, CHWY, FCEL, and more (NASDAQ:ADBE) - Seeking Alpha",Seeking Alpha
"Sat, 06 Sep 2025 11:10:00 GMT",Oracle (ORCL): New Buy Recommendation for This Technology Giant - The Globe and Mail,The Globe and Mail
"Sun, 07 Sep 2025 17:44:12 GMT",Oracle Stock Price Forecast: NYSE:ORCL Cloud Momentum and AI Push Drive $273 Target - tradingnews.com,tradingnews.com
"Sun, 07 Sep 2025 16:39:07 GMT",Oracle Corp. (ORCL) Sheds 5.9% as AI Bubble Fears Linger - MSN,MSN
"Thu, 04 Sep 2025 18:04:19 GMT",Oracle Earnings Preview: The Fourth AI Hyperscaler Ready To Surprise Wall Street (ORCL) - Seeking Alpha,Seeking Alpha
"Wed, 03 Sep 2025 12:14:33 GMT",Broad-Based Growth Drivers Lifted Oracle (ORCL) in Q2 - Yahoo Finance,Yahoo Finance
"Sat, 06 Sep 2025 22:39:34 GMT","Oracle Corporation (ORCL) Building US Data Centers Could Make Trump Ask Others To Do The Same, Says Jim Cramer - MSN",MSN
"Wed, 03 Sep 2025 12:00:25 GMT",Oracle's (NYSE:ORCL) earnings growth rate lags the 34% CAGR delivered to shareholders - Yahoo Finance,Yahoo Finance
"Sat, 06 Sep 2025 03:49:59 GMT",Oracle (ORCL) Q1 Earnings on the Horizon: Analysts' Insights on Key Performance Measures - sharewise.com,sharewise.com
"Fri, 05 Sep 2025 16:47:53 GMT","Hundreds Laid Off at Salesforce (CRM), Oracle (ORCL) in New AI-Focused Cuts - TipRanks",TipRanks
"Thu, 04 Sep 2025 19:40:00 GMT","Noteworthy Thursday Option Activity: ORCL, AVAV, SGHC - Nasdaq",Nasdaq
"Thu, 04 Sep 2025 18:56:02 GMT",Discipline and Rules-Based Execution in ORCL Response - news.stocktradersdaily.com,news.stocktradersdaily.com
"Fri, 05 Sep 2025 15:52:59 GMT",ORCL's Cloud Database Gains Steam: Is it the Next Revenue Pillar? - MSN,MSN
"Fri, 05 Sep 2025 10:55:32 GMT",Oracle: Why I Loaded Up Before Earnings And What I'm Looking Out For (NYSE:ORCL) - Seeking Alpha,Seeking Alpha
"Fri, 05 Sep 2025 13:02:14 GMT",Oracle (ORCL) PT Raised to $400 at Global Equities Research - StreetInsider,StreetInsider
"Fri, 05 Sep 2025 15:09:21 GMT",Oracle (ORCL) call put ratio 1.6 calls to 1 put into quarter results - StreetInsider,StreetInsider
"Wed, 03 Sep 2025 12:11:58 GMT",Is Oracle’s New EHR Interoperability and AI Upgrade Shifting the Investment Case for ORCL? - simplywall.st,simplywall.st
"Fri, 05 Sep 2025 16:32:00 GMT","Global Equities Initiates Oracle(ORCL.US) With Buy Rating, Announces Target Price $400 - 富途牛牛",富途牛牛
"Thu, 04 Sep 2025 18:45:00 GMT",Oracle (ORCL) Q1 Results Nearing: Buy Now or Wait for Clarity - FXLeaders,FXLeaders
"Fri, 05 Sep 2025 10:08:26 GMT",Oracle (ORCL) call put ratio 1 call to 1 put into quarter results - StreetInsider,StreetInsider
"Thu, 04 Sep 2025 20:34:24 GMT",Short Interest Drops in ORCL After Rally - Quarterly Trade Review & Real-Time Buy Signal Notifications - beatles.ru,beatles.ru
"Wed, 03 Sep 2025 10:24:03 GMT",Technical Reactions to ORCL Trends in Macro Strategies - news.stocktradersdaily.com,news.stocktradersdaily.com
"Sat, 06 Sep 2025 05:30:09 GMT",Trade Report: Is ORCL in a long term uptrend - 2025 Pullback Review & High Accuracy Swing Trade Signals - 뉴스영,뉴스영
"Sat, 06 Sep 2025 08:24:20 GMT",What is ORCL’s valuation compared to sector - Market Growth Summary & Fast Entry Momentum Trade Alerts - خودرو بانک,خودرو بانک
"Fri, 05 Sep 2025 18:07:15 GMT",Can ORCL lead its sector in growth - Weekly Trade Recap & Community Driven Trade Alerts - خودرو بانک,خودرو بانک
"Wed, 03 Sep 2025 09:20:45 GMT",Will ORCL outperform during market rallies - Market Activity Summary & Community Supported Trade Ideas - خودرو بانک,خودرو بانک
"Sun, 07 Sep 2025 19:55:20 GMT",Oracle (ORCL.N) Surges 4.39% Despite Mixed Technicals and Lack of Fundamental Catalysts - AInvest,AInvest
"Mon, 08 Sep 2025 04:24:23 GMT",Analyzing recovery setups for ORCL investors - Recession Risk & Smart Swing Trading Techniques - Newser,Newser
"Mon, 08 Sep 2025 06:35:23 GMT",How sentiment analysis helps forecast ORCL - Trade Risk Summary & Long-Term Capital Growth Ideas - Newser,Newser
"Sat, 06 Sep 2025 16:01:55 GMT","Oracle Corporation (ORCL) Building US Data Centers Could Make Trump Ask Others To Do The Same, Says Jim Cramer - Insider Monkey",Insider Monkey
"Sat, 06 Sep 2025 15:48:25 GMT","Oracle (ORCL.N) Surges 4.39%: Technical Signal, Order-Flow, and Peer Insight Analysis - AInvest",AInvest
"Fri, 05 Sep 2025 20:51:53 GMT",Oracle (ORCL.N) Sees 4.64% Gains—What's Really Driving the Move? - AInvest,AInvest
"Sun, 07 Sep 2025 12:12:22 GMT","Key Earnings Week Ahead: ADBE, ORCL, GME, KR, CHWY, FCEL, and More - AInvest",AInvest
"Fri, 05 Sep 2025 07:37:17 GMT",Oracle Corporation (NYSE:ORCL) Given Average Rating of “Moderate Buy” by Brokerages - Defense World,Defense World
2025-09-05T20:31:18,Oracle and Adobe Earnings Showdown – Unveiling the Financial Landscape Ahead,Yahoo
2025-09-05T18:17:00,Oracle's NetSuite Momentum: Can It Boost Cloud Growth to New Heights?,Yahoo
2025-09-05T16:15:01,Oracle (ORCL) Q1 Earnings on the Horizon: Analysts' Insights on Key Performance Measures,Yahoo
2025-09-04T18:22:00,Oracle Stock Before Q1 Earnings: Buy Now or Wait for Results?,Yahoo
2025-09-04T16:04:19,Oracle Earnings Preview: The Fourth AI Hyperscaler Ready To Surprise Wall Street,SeekingAlpha
2025-09-03T15:14:33,Broad-Based Growth Drivers Lifted Oracle (ORCL) in Q2,Yahoo
2025-09-03T15:00:25,Oracle's (NYSE:ORCL) earnings growth rate lags the 34% CAGR delivered to shareholders,Yahoo
