Date,Title,Source
2025-09-28T20:33:54Z,A Bull Case Theory,Biztoc.com
2025-09-28T20:24:15Z,"Airbnb, Inc. (ABNB): A Bull Case Theory",Yahoo Entertainment
2025-09-28T05:57:04Z,"Brokerages Set Airbnb, Inc. (NASDAQ:ABNB) Price Target at $141.19",ETF Daily News
"Mon, 29 Sep 2025 22:25:41 GMT",Insider Selling: Airbnb (NASDAQ:ABNB) CTO Sells 600 Shares of Stock - MarketBeat,MarketBeat
"Tue, 30 Sep 2025 01:27:59 GMT","Mizuho Securities Initiates Airbnb(ABNB.US) With Buy Rating, Announces Target Price $151 - 富途牛牛",富途牛牛
"Sun, 28 Sep 2025 20:24:15 GMT","Airbnb, Inc. (ABNB): A Bull Case Theory - Yahoo",Yahoo
"Sat, 27 Sep 2025 01:32:04 GMT","Airbnb, Inc. (ABNB) Laps the Stock Market: Here's Why - sharewise.com",sharewise.com
"Mon, 29 Sep 2025 09:45:22 GMT","Scott & Selber Inc. Invests $2.47 Million in Airbnb, Inc. $ABNB - MarketBeat",MarketBeat
"Fri, 26 Sep 2025 20:30:01 GMT","Unusual Options Activity: ABNB, PCG and Others Attract Market Bets, ABNB V/OI Ratio Reaches 150.0 - 富途牛牛",富途牛牛
"Sun, 28 Sep 2025 12:19:15 GMT","Airbnb, Inc. $ABNB Shares Bought by Fort Washington Investment Advisors Inc. OH - MarketBeat",MarketBeat
"Sun, 28 Sep 2025 10:01:34 GMT","Perigon Wealth Management LLC Increases Holdings in Airbnb, Inc. $ABNB - MarketBeat",MarketBeat
"Sat, 27 Sep 2025 10:42:31 GMT","HS Management Partners LLC Decreases Stock Holdings in Airbnb, Inc. $ABNB - MarketBeat",MarketBeat
"Sat, 27 Sep 2025 10:09:26 GMT","Airbnb, Inc. $ABNB Holdings Decreased by Fifth Third Bancorp - MarketBeat",MarketBeat
"Fri, 26 Sep 2025 10:05:12 GMT","Airbnb, Inc. $ABNB Stake Trimmed by Public Employees Retirement System of Ohio - MarketBeat",MarketBeat
"Fri, 26 Sep 2025 10:07:09 GMT","Banque Pictet & Cie SA Sells 17,335 Shares of Airbnb, Inc. $ABNB - MarketBeat",MarketBeat
"Thu, 25 Sep 2025 09:21:49 GMT","Regatta Capital Group LLC Has $2.83 Million Holdings in Airbnb, Inc. $ABNB - MarketBeat",MarketBeat
"Thu, 25 Sep 2025 08:20:36 GMT","Counterpoint Mutual Funds LLC Makes New $297,000 Investment in Airbnb, Inc. $ABNB - MarketBeat",MarketBeat
"Thu, 25 Sep 2025 08:10:34 GMT","Airbnb, Inc. $ABNB Shares Sold by Sowell Financial Services LLC - MarketBeat",MarketBeat
"Mon, 29 Sep 2025 08:13:06 GMT","State of Alaska Department of Revenue Sells 2,210 Shares of Airbnb, Inc. $ABNB - MarketBeat",MarketBeat
"Tue, 30 Sep 2025 05:44:14 GMT",Will ABNB stock continue upward momentum - 2025 Historical Comparison & AI Enhanced Trading Signals - newser.com,newser.com
"Mon, 29 Sep 2025 12:41:57 GMT",Will ABNB stock continue upward momentum - Trade Analysis Summary & Target Return Focused Picks - newser.com,newser.com
"Mon, 29 Sep 2025 08:59:10 GMT",How ABNB stock benefits from strong dollar - Portfolio Return Summary & Daily Entry Point Trade Alerts - newser.com,newser.com
"Fri, 26 Sep 2025 20:44:38 GMT",Is ABNB stock bottoming out - July 2025 Earnings & Low Risk Entry Point Guides - newser.com,newser.com
"Mon, 29 Sep 2025 04:28:09 GMT",Using R and stats models for ABNB forecasting - Portfolio Risk Summary & Risk Adjusted Swing Trade Ideas - newser.com,newser.com
"Mon, 29 Sep 2025 09:32:22 GMT",Using R and stats models for ABNB forecasting - 2025 Market Outlook & High Conviction Buy Zone Alerts - newser.com,newser.com
"Thu, 25 Sep 2025 08:36:15 GMT","UMB Bank n.a. Decreases Stock Position in Airbnb, Inc. $ABNB - Defense World",Defense World
2025-09-28T22:24:15,"Airbnb, Inc. (ABNB): A Bull Case Theory",Yahoo
2025-09-26T23:45:05,"Airbnb, Inc. (ABNB) Laps the Stock Market: Here's Why",Yahoo
