Date,Title,Source
2025-09-13T16:25:18Z,"Jim Cramer Shares His Dicussion With Micron Technology, Inc. (MU)’s CEO For The Stock",Biztoc.com
2025-09-13T16:11:13Z,"Jim Cramer Shares His Dicussion With Micron Technology, Inc. (MU)’s CEO For The Stock",Yahoo Entertainment
2025-09-13T07:26:47Z,Citigroup Forecasts Strong Price Appreciation for Micron Technology (NASDAQ:MU) Stock,ETF Daily News
2025-09-13T06:28:48Z,Micron Technology (NASDAQ:MU) Downgraded to “Buy” Rating by Wall Street Zen,ETF Daily News
2025-09-13T05:46:42Z,Micron Technology (NASDAQ:MU) Reaches New 12-Month High Following Analyst Upgrade,ETF Daily News
2025-09-13T05:13:04Z,Micron Technology (NASDAQ:MU) Shares Gap Up After Analyst Upgrade,ETF Daily News
2025-09-12T15:59:21Z,Dell Pro Max 18 Plus: Blackwell RTX PRO 5000 Performance To Go!,Storagereview.com
2025-09-12T15:43:53Z,Jim Cramer Comments On Micron Technology (MU)’s Shares & Says Be Careful,Biztoc.com
2025-09-12T15:31:40Z,This Semiconductor Stock is Beating Broadcom and Nvidia So Far This Year And It Could Gain Another 34%,Biztoc.com
2025-09-12T15:18:59Z,Jim Cramer Comments On Micron Technology (MU)’s Shares & Says Be Careful,Yahoo Entertainment
2025-09-12T14:00:00Z,Role of c-Myc activating the transcription of PD-L1 in immune escape during benzene-induced malignant transformation of human lymphoblasts,Plos.org
2025-09-12T14:00:00Z,The modern expansion of Dscam1 isoform diversity in Drosophila is linked to fitness and immunity,Plos.org
2025-09-12T10:13:23Z,"Stock Index Futures Muted After Record Rally, U.S. Confidence Data on Tap",Barchart.com
2025-09-12T06:45:00Z,“I don’t think he’s a bad player” – Merson names Chelsea ace he would have kept this summer,Chelsea.news
2025-09-11T18:21:45Z,This Analyst Is Pounding the Table on Micron Stock. Should You Buy Shares Here?,Barchart.com
2025-09-11T18:07:36Z,"Micron Technology Stock Is Up 150% Since April, But This Option Strategy Still Offers a 4:1 Up/Down Tradeoff",Barchart.com
2025-09-11T16:34:19Z,Prediction: Micron Stock Will Soar Over the Next Three Years. Here's 1 Reason Why,Biztoc.com
2025-09-11T16:34:00Z,Could Micron’s Memory Boom Make It the New Oracle?,Biztoc.com
2025-09-11T16:11:53Z,Why Micron Stock Popped Today,Biztoc.com
2025-09-11T16:06:47Z,MU stock jumps 9.7% as Citi upgrades to buy: Here's why Wall Street is bullish on Micron,The Times of India
2025-09-11T14:00:00Z,Evaluating the effects of multimodal EEG-fNIRS neurofeedback for motor imagery: An experimental platform and study protocol,Plos.org
2025-09-11T06:58:14Z,Ministry sends aid to support Cileungsi school after roof collapse,Antaranews.com
2025-09-11T06:25:01Z,"Micron Technology, Inc. (NASDAQ:MU) Receives $147.54 Consensus Price Target from Brokerages",ETF Daily News
2025-09-10T22:34:50Z,"Otter Mods Intros Three Modules For MU, Eurorack Modular Synthesizers At Knobcon 2025",Synthtopia.com
2025-09-10T20:08:41Z,Stifel: Market Undervalues Micron’s (MU) Datacenter Revenue Shift,Yahoo Entertainment
2025-09-10T16:47:52Z,"Rowoon, Shin Ye Eun, Park Seo Ham, And Park Ji Hwan Become Entangled With Each Other In “The Murky Stream”",soompi
2025-09-10T13:53:42Z,"Heavy-duty EVs drive surge in public charging power consumption, says CEA data",BusinessLine
2025-09-10T11:45:44Z,"Up 14% Last Week, Time To Sell Micron Stock?",Forbes
2025-09-10T11:26:55Z,"Vocational students must be job-ready, globally competitive: Minister",Antaranews.com
2025-09-10T09:31:43Z,List predstaviteľom Smer -SD !,Pravda.sk
2025-09-09T23:00:00Z,A directional self-priming continuous-driven compartmentalized microfluidic chip for multiplexed pathogen detection,Royal Society of Chemistry
2025-09-09T23:00:00Z,Insight of Interfacial Water & Key Intermediates at Cu95Co5 Aerogels for Electrocatalytic Nitrate-to-Ammonia Conversion,Royal Society of Chemistry
2025-09-09T20:00:00Z,Eli Drinkwitz demands more improvement from Mizzou O-line; MU-KU refs suspended,STLtoday.com
2025-09-09T14:00:00Z,A volumetric modulated arc therapy-based dynamic conformal arc technique with limited monitor units (VMATliMU) to reduce multileaf collimator interplay effects: A computational phantom study for stage I non-small-cell lung cancer,Plos.org
"Fri, 12 Sep 2025 18:26:14 GMT",Why Micron (MU) Stock Is Trading Up Today - Yahoo Finance,Yahoo Finance
"Thu, 11 Sep 2025 20:56:18 GMT",Micron: Stock Reaches All-Time Highs - Here's What Comes Next (NASDAQ:MU) - Seeking Alpha,Seeking Alpha
"Sat, 13 Sep 2025 19:09:00 GMT",MU Motion Moves dances into second year on campus - - The Mercer Cluster,The Mercer Cluster
"Thu, 11 Sep 2025 19:45:35 GMT",MU Recognized for Inclusive Excellence - Millersville University,Millersville University
"Sat, 13 Sep 2025 23:11:53 GMT","MU Extension 'What the Hay?' webinar series beginning Thursday, Oct. 2, focuses on forages - Muddy River News",Muddy River News
"Sat, 13 Sep 2025 08:30:00 GMT",Bull of the Day: Micron Technology (MU) - Nasdaq,Nasdaq
"Fri, 12 Sep 2025 04:04:03 GMT",MU Turning Point USA Chapter reacts to death of Charlie Kirk - KRCG,KRCG
"Sat, 13 Sep 2025 21:41:47 GMT",Micron Technology (MU) Up By 36% After Jim Cramer Said It Was “Insanely Cheap” - MSN,MSN
"Sat, 13 Sep 2025 18:21:00 GMT",Why Micron Technology (MU) Is Up 19.7% After AI-Driven Demand Boosts Analyst Optimism and Data Center Revenue - simplywall.st,simplywall.st
"Fri, 12 Sep 2025 21:00:00 GMT",MU Health Care gives heat safety tips for Mizzou football game - KOMU 8,KOMU 8
"Wed, 10 Sep 2025 16:01:39 GMT",Why Micron (MU) Stock Is Up Today - Yahoo Finance,Yahoo Finance
"Fri, 12 Sep 2025 19:42:11 GMT",MU Prof Named CFR Education Ambassador - Millersville University,Millersville University
"Thu, 11 Sep 2025 15:56:05 GMT",Why Is Micron (MU) Stock Rocketing Higher Today - Yahoo Finance,Yahoo Finance
"Sat, 13 Sep 2025 16:11:13 GMT","Jim Cramer Shares His Dicussion With Micron Technology, Inc. (MU)’s CEO For The Stock - Yahoo Finance",Yahoo Finance
"Sat, 13 Sep 2025 12:55:47 GMT",Micron (MU) Is Up 19.7% After Analyst Upgrades Driven by Strong AI Data Center Memory Demand - Yahoo Finance,Yahoo Finance
"Fri, 12 Sep 2025 15:18:59 GMT",Jim Cramer Comments On Micron Technology (MU)’s Shares & Says Be Careful - Yahoo Finance,Yahoo Finance
"Thu, 11 Sep 2025 04:01:00 GMT",MU students hold vigil for Charlie Kirk - KOMU 8,KOMU 8
"Sat, 13 Sep 2025 14:17:51 GMT","Optimistic Investors Push Micron Technology, Inc. (NASDAQ:MU) Shares Up 25% But Growth Is Lacking - simplywall.st",simplywall.st
"Sat, 13 Sep 2025 16:27:04 GMT","Micron Stock Price Forecast: NASDAQ:MU Hits $157, Analysts Target $200 on AI Memory Boom - tradingnews.com",tradingnews.com
"Thu, 11 Sep 2025 23:30:00 GMT",MU embraces AI use with 'Show-Me AI' - Columbia Missourian,Columbia Missourian
"Sat, 13 Sep 2025 19:35:46 GMT","Micron (MU) Stock Is Up, What You Need To Know - MSN",MSN
"Sat, 13 Sep 2025 21:30:00 GMT",Photos: MU football fans tailgate before Eastern Kentucky game - herald-dispatch.com,herald-dispatch.com
"Fri, 12 Sep 2025 09:36:00 GMT",Strength Seen in Micron (MU): Can Its 7.6% Jump Turn into More Strength? - Nasdaq,Nasdaq
"Sun, 14 Sep 2025 00:33:56 GMT","Micron Technology (NASDAQ:MU) CEO Sells $1,054,350.00 in Stock - MarketBeat",MarketBeat
"Sat, 13 Sep 2025 16:27:06 GMT",Micron Stock vs Intel Stock - NASDAQ:MU Surges to $157 While INTC Slips to $24 Amid AI Divergence - tradingnews.com,tradingnews.com
"Wed, 10 Sep 2025 11:03:50 GMT",Missouri Memories: Chris Gervino Looks Back on Decades of MU Sports Coverage (LISTEN) - Missourinet,Missourinet
"Thu, 11 Sep 2025 13:40:03 GMT",Are Computer and Technology Stocks Lagging Micron Technology (MU) This Year? - Yahoo Finance,Yahoo Finance
"Wed, 10 Sep 2025 20:08:41 GMT",Stifel: Market Undervalues Micron’s (MU) Datacenter Revenue Shift - Yahoo Finance,Yahoo Finance
"Wed, 10 Sep 2025 21:00:00 GMT",MU Athletics prepares for Saturday’s scorching game day forecast - Columbia Missourian,Columbia Missourian
"Fri, 12 Sep 2025 20:34:00 GMT",MU Athletics prepares fans for football in high heat - KBIA,KBIA
"Wed, 10 Sep 2025 18:31:24 GMT",Defy the Odds: Breast-a-Ville Returns to MU - Millersville University,Millersville University
"Fri, 12 Sep 2025 03:06:00 GMT",WVU MU SOCCER - WSAZ,WSAZ
"Fri, 12 Sep 2025 09:30:00 GMT",Missouri teen beat cancer at 18 and rang the bell at MU-KU game in gratitude - Columbia Missourian,Columbia Missourian
"Fri, 12 Sep 2025 00:05:25 GMT",MU changes homecoming parade application policy amid lawsuit from Muslim rights group - ABC17NEWS,ABC17NEWS
"Fri, 12 Sep 2025 14:32:41 GMT","Theater Mu stages its first Muslim-centered play, ‘Maybe You Could Love Me’ - Sahan Journal",Sahan Journal
"Sat, 13 Sep 2025 16:32:49 GMT","Jim Cramer Shares His Dicussion With Micron Technology, Inc. (MU)’s CEO For The Stock - MSN",MSN
"Wed, 10 Sep 2025 19:30:41 GMT",MU Report: Sharp soybean yield decline possible in Missouri - Brownfield Ag News,Brownfield Ag News
"Wed, 10 Sep 2025 18:30:00 GMT","MU quarterback Horn has surgery on fractured tibia, out for season - Columbia Missourian",Columbia Missourian
"Fri, 12 Sep 2025 15:18:59 GMT",Jim Cramer Comments On Micron Technology (MU)’s Shares & Says Be Careful - ca.finance.yahoo.com,ca.finance.yahoo.com
"Tue, 09 Sep 2025 21:45:03 GMT",Micron (MU) Laps the Stock Market: Here's Why - Yahoo Finance,Yahoo Finance
"Fri, 12 Sep 2025 04:18:24 GMT",MU Manufacturing Day Symposium: No Cost to Attend! - KOMU 8,KOMU 8
"Thu, 11 Sep 2025 10:53:00 GMT",MU students hold vigil for Charlie Kirk - KOMU 8,KOMU 8
"Fri, 12 Sep 2025 11:38:32 GMT",Micron Stock (MU) Pops as Citi Hikes Price Target Ahead of Q4 Earnings - TipRanks,TipRanks
"Thu, 11 Sep 2025 17:56:46 GMT",Columbia man charged for alleged knife threat during incident near MU campus - KRCG,KRCG
"Thu, 11 Sep 2025 01:39:17 GMT",Vigil held for Charlie Kirk on MU’s campus - ABC17NEWS,ABC17NEWS
"Sat, 13 Sep 2025 10:46:18 GMT","Howe & Rusling Inc. Sells 22,029 Shares of Micron Technology, Inc. $MU - MarketBeat",MarketBeat
"Sat, 13 Sep 2025 11:02:23 GMT","Swedbank AB Has $280.55 Million Stock Holdings in Micron Technology, Inc. $MU - MarketBeat",MarketBeat
"Fri, 12 Sep 2025 13:34:00 GMT","New Buy Rating for Micron (MU), the Technology Giant - The Globe and Mail",The Globe and Mail
"Fri, 12 Sep 2025 15:28:33 GMT",Jim Cramer Comments On Micron Technology (MU)’s Shares & Says Be Careful - MSN,MSN
"Fri, 12 Sep 2025 14:30:00 GMT","MU Women stumble in conference opener, Men’s draw at LIU - The Riverdale Press",The Riverdale Press
"Fri, 12 Sep 2025 09:30:00 GMT",Missouri teen beat cancer at 18. He rang the bell at the MU-KU game in gratitude - Columbia Missourian,Columbia Missourian
"Sat, 13 Sep 2025 08:54:33 GMT","SageView Advisory Group LLC Boosts Holdings in Micron Technology, Inc. $MU - MarketBeat",MarketBeat
"Sat, 13 Sep 2025 10:54:55 GMT","Voya Investment Management LLC Acquires 525,596 Shares of Micron Technology, Inc. $MU - MarketBeat",MarketBeat
"Fri, 12 Sep 2025 12:52:33 GMT",Strength Seen in Micron (MU): Can Its 7.6% Jump Turn into More Strength? - MSN,MSN
"Fri, 12 Sep 2025 19:08:29 GMT",Why Micron (MU) Stock Is Trading Up Today - MSN,MSN
"Fri, 12 Sep 2025 01:52:30 GMT","Charlie Kirk’s influence reached campuses across the country, including MU - ABC17NEWS",ABC17NEWS
"Thu, 11 Sep 2025 16:20:00 GMT",New Analyst Forecast: $MU Given $175.0 Price Target - Quiver Quantitative,Quiver Quantitative
"Sat, 13 Sep 2025 07:00:00 GMT","Micron Technology, Inc. $MU Shares Purchased by Westbourne Investments Inc. - MarketBeat",MarketBeat
"Thu, 11 Sep 2025 14:35:00 GMT","Nasdaq 100 Movers: AMD, MU - Nasdaq",Nasdaq
"Thu, 11 Sep 2025 16:46:33 GMT",Micron (MU) Pops as Gen AI Demand Revitalizes the Tech Sector - Money Morning,Money Morning
"Sat, 13 Sep 2025 07:00:00 GMT","Micron Technology, Inc. $MU Shares Sold by AQR Capital Management LLC - MarketBeat",MarketBeat
"Sat, 13 Sep 2025 07:00:00 GMT","Woodline Partners LP Sells 166,479 Shares of Micron Technology, Inc. $MU - MarketBeat",MarketBeat
"Sat, 13 Sep 2025 07:00:00 GMT","Ascent Group LLC Has $504,000 Stock Holdings in Micron Technology, Inc. $MU - MarketBeat",MarketBeat
"Sat, 13 Sep 2025 07:00:00 GMT","Belpointe Asset Management LLC Sells 6,250 Shares of Micron Technology, Inc. $MU - MarketBeat",MarketBeat
"Sat, 13 Sep 2025 07:00:00 GMT","Aspen Investment Management Inc Purchases New Position in Micron Technology, Inc. $MU - MarketBeat",MarketBeat
"Sat, 13 Sep 2025 07:00:00 GMT","Micron Technology, Inc. $MU Holdings Decreased by Plato Investment Management Ltd - MarketBeat",MarketBeat
"Sat, 13 Sep 2025 07:00:00 GMT","Anchor Investment Management LLC Has $976,000 Position in Micron Technology, Inc. $MU - MarketBeat",MarketBeat
"Thu, 11 Sep 2025 00:57:00 GMT",MU fraternity and local organization plant flags ahead of 9/11 remembrance ceremony - KOMU 8,KOMU 8
"Fri, 12 Sep 2025 22:30:00 GMT","Clearline Capital LP Raises Stock Position in Micron Technology, Inc. $MU - MarketBeat",MarketBeat
"Sat, 13 Sep 2025 07:00:00 GMT","Empowered Funds LLC Increases Stock Holdings in Micron Technology, Inc. $MU - MarketBeat",MarketBeat
"Fri, 12 Sep 2025 23:54:42 GMT","Micron Technology, Inc. $MU Shares Purchased by Ashton Thomas Private Wealth LLC - MarketBeat",MarketBeat
"Fri, 12 Sep 2025 08:35:52 GMT",Stifel: Market Undervalues Micron’s (MU) Datacenter Revenue Shift - MSN,MSN
"Sat, 13 Sep 2025 07:00:00 GMT",Micron Technology (NASDAQ:MU) Trading Up 1.3% - Time to Buy? - MarketBeat,MarketBeat
"Thu, 11 Sep 2025 16:06:47 GMT",MU stock jumps 9.7% as Citi upgrades to buy: Here's why Wall Street is bullish on Micron - The Economic Times,The Economic Times
"Fri, 12 Sep 2025 13:03:58 GMT","Strs Ohio Acquires Shares of 663,229 Micron Technology, Inc. $MU - MarketBeat",MarketBeat
"Sun, 14 Sep 2025 05:12:45 GMT","Polish milk brands Mu, Meadow Star launch in Korea - MSN",MSN
"Fri, 12 Sep 2025 14:22:30 GMT",Citigroup Boosts Micron Technology (NASDAQ:MU) Price Target to $175.00 - MarketBeat,MarketBeat
"Fri, 12 Sep 2025 10:15:46 GMT","Integrity Alliance LLC. Boosts Stake in Micron Technology, Inc. $MU - MarketBeat",MarketBeat
"Thu, 11 Sep 2025 19:13:47 GMT","MU Extension Hosts 'Baled Late, Fed Smart' - Morning Ag Clips",Morning Ag Clips
"Fri, 12 Sep 2025 07:00:00 GMT","Micron Technology, Inc. $MU Shares Sold by Meiji Yasuda Life Insurance Co - MarketBeat",MarketBeat
"Wed, 10 Sep 2025 14:13:21 GMT",MU Soybean monitoring report predicts sharp decline in yield - High Plains Journal,High Plains Journal
"Fri, 12 Sep 2025 07:00:00 GMT","Great Lakes Advisors LLC Sells 55,793 Shares of Micron Technology, Inc. $MU - MarketBeat",MarketBeat
"Fri, 12 Sep 2025 07:00:00 GMT","Integrated Wealth Concepts LLC Cuts Holdings in Micron Technology, Inc. $MU - MarketBeat",MarketBeat
"Sat, 13 Sep 2025 10:21:43 GMT",Linksys WRT3200ACM MU-MIMO Wireless Router - MSN,MSN
"Fri, 12 Sep 2025 16:18:47 GMT",Micron Technology (NASDAQ:MU) Shares Gap Up Following Analyst Upgrade - MarketBeat,MarketBeat
"Wed, 10 Sep 2025 12:49:51 GMT",A Fresh Look at Micron Technology (MU) Valuation After High-Bandwidth Memory Demand Sparks Guidance Upgrade - simplywall.st,simplywall.st
"Fri, 12 Sep 2025 02:48:51 GMT",Are Computer and Technology Stocks Lagging Micron Technology (MU) This Year? - sharewise.com,sharewise.com
"Sat, 13 Sep 2025 10:47:24 GMT",Bull of the Day: Micron Technology (MU) - sharewise.com,sharewise.com
"Fri, 12 Sep 2025 05:31:58 GMT",Micron Technology (NASDAQ:MU) Reaches New 1-Year High After Analyst Upgrade - MarketBeat,MarketBeat
2025-09-13T19:11:13,"Jim Cramer Shares His Dicussion With Micron Technology, Inc. (MU)’s CEO For The Stock",Yahoo
2025-09-13T16:00:48,Does Intel's New Leadership and AI Push Signal a Strategic Shift for INTC?,Yahoo
2025-09-13T15:55:47,Micron (MU) Is Up 19.7% After Analyst Upgrades Driven by Strong AI Data Center Memory Demand,Yahoo
2025-09-13T11:30:00,Bull of the Day: Micron Technology (MU),Yahoo
2025-09-12T21:26:14,Why Micron (MU) Stock Is Trading Up Today,Yahoo
2025-09-12T18:18:59,Jim Cramer Comments On Micron Technology (MU)’s Shares & Says Be Careful,Yahoo
2025-09-12T16:15:00,Lam Research vs. Micron: Which Semiconductor Stock Is the Better Bet?,Yahoo
2025-09-12T12:36:00,Strength Seen in Micron (MU): Can Its 7.6% Jump Turn into More Strength?,Yahoo
2025-09-11T21:21:45,This Analyst Is Pounding the Table on Micron Stock. Should You Buy Shares Here?,Yahoo
2025-09-11T21:13:17,"Micron, FedEx, Thermo Fisher Scientific: Analyst moves",Yahoo
2025-09-11T21:07:36,"Micron Technology Stock Is Up 150% Since April,  But This Option Strategy Still Offers a 4:1 Up/Down Tradeoff",Yahoo
2025-09-11T18:56:18,Micron: Stock Reaches All-Time Highs - Here's What Comes Next,SeekingAlpha
2025-09-11T18:56:05,Why Is Micron (MU) Stock Rocketing Higher Today,Yahoo
2025-09-11T18:37:31,"Micron record high, Delta, Apple sentiment: Trending Tickers",Yahoo
2025-09-10T23:08:41,Stifel: Market Undervalues Micron’s (MU) Datacenter Revenue Shift,Yahoo
2025-09-10T19:01:39,Why Micron (MU) Stock Is Up Today,Yahoo
2025-09-10T00:45:03,Micron (MU) Laps the Stock Market: Here's Why,Yahoo
2025-09-09T23:30:50,"Micron (MU) Stock Is Up, What You Need To Know",Yahoo
2025-09-12T22:36:04,YOLO’d half my savings on $MU calls,Reddit/r/wallstreetbets
