Date,Title,Source
2025-08-31T06:24:35Z,Cooku With Comali fame Shabana joins the cast of web series ‘Police Police’,The Times of India
2025-08-31T05:20:51Z,Q3 EPS Estimates for ConocoPhillips Cut by Analyst,ETF Daily News
2025-08-31T05:18:07Z,Family reveals accused cop killer Dezi Freeman’s long-standing desire to ‘torture’ police in chilling text,7NEWS.com.au
2025-08-31T04:10:38Z,UBS Raises PT on ConocoPhillips (COP) to $123 From $116,Yahoo Entertainment
2025-08-31T01:33:47Z,Wife of accused cop killer Dezi Freeman pleads for his surrender as hunt for Porepunkah gunman continues,7NEWS.com.au
2025-08-31T01:01:40Z,"Man, 61, arrested as hunt for accused cop killer Dezi Freeman enters sixth day",7NEWS.com.au
2025-08-31T00:44:46Z,'Condemn this guy!' Outcry as MAGA rioter says he 'should have went harder' on Capitol cop,Raw Story
2025-08-30T20:38:28Z,On Dangerous Ground 1951 1080p AMZN WEB-DL H264-GPRS,Rlsbb.cc
2025-08-30T20:23:53Z,On Dangerous Ground 1951 1080p AMZN WEB-DL H264-GPRS,Rlsbb.ru
2025-08-30T20:00:00Z,"New Balance's Sugar-Coated Sneaker Is the Sweetest ""Barefoot"" Stepper",Highsnobiety
2025-08-30T18:30:43Z,"Copa: Los Angeles – Medellin, Colombia. $380 (Basic Economy / $490 (Regular Economy). Roundtrip, including all Taxes",Theflightdeal.com
2025-08-30T17:25:41Z,"Copa: San Francisco – Bogota, Colombia. $415 (Basic Economy / $585 (Regular Economy). Roundtrip, including all Taxes",Theflightdeal.com
2025-08-30T17:02:27Z,"We’re gonna take you up to McNairy County, Tennessee/Back in the days when Sheriff Buford Pusser ran things around there",Lawyersgunsmoneyblog.com
2025-08-30T15:23:41Z,On Dangerous Ground 1951 1080p AMZN WEB-DL H264-GPRS,Rlsbb.cc
2025-08-30T15:21:51Z,On Dangerous Ground 1951 1080p AMZN WEB-DL H264-GPRS,Rlsbb.ru
2025-08-30T12:47:46Z,Former state police sergeant arrested following investigation into viral Youtube confrontation (cop who spat in face of youtuber),Freerepublic.com
2025-08-30T06:01:59Z,"Netflix September 2025 India Releases: Aryan Khan's Debut, Manoj Bajpayee's Inspector Zende And More",Ndtvprofit.com
2025-08-29T23:24:46Z,"'Keep it peaceful,' Chicago top cop warns ahead of Trump National Guard deployment",USA Today
2025-08-29T21:37:39Z,How Tauranga cop Zac McKay caught serial thief Aimee Ravenswood,New Zealand Herald
2025-08-29T19:21:05Z,Cop caught on camera slapping civilian in Srinagar; probe ordered,Statetimes.in
2025-08-29T18:01:16Z,Head constable suspended for attempting to attack inspector in Bengaluru,The Times of India
2025-08-29T17:56:47Z,‘Largest police deployment of the year’ to keep the peace at NYC’s raucous J’Ouvert festival,New York Post
2025-08-29T17:00:13Z,The Mantis Go Hyun-jung hunts a copycat murderer,Dramabeans.com
2025-08-29T16:57:42Z,"Militsioner isn't just a weird and ambitious immersive sim, it's a game of titanic emotional labour",Rock Paper Shotgun
2025-08-29T16:25:27Z,Zach Edey Gets Put In His Place By Cop Who Stopped Him For Going 100 MPH After Pulling Out Weak Excuse In Body Cam Video,BroBible
2025-08-29T14:30:32Z,Ex-Capitol cop who retired after injuries slams choice to give full military honors to Jan. 6 rioter Ashli Babbitt,The Daily Dot
2025-08-29T14:14:57Z,How NCIS Helps Forensics Experts Explained,Screen Rant
2025-08-29T12:01:14Z,FBI cyber cop: Salt Typhoon pwned ‘nearly every American’,Databreaches.net
2025-08-29T12:00:00Z,Armed Felon In S550 Mustang Flees Arkansas Cop,Yahoo Entertainment
2025-08-29T11:51:04Z,"Cop Records Moment His Dog Arrives Back at Work, Response Doesn't Disappoint",Biztoc.com
2025-08-29T11:44:58Z,"Cop Records Moment His Dog Arrives Back at Work, Response Doesn't Disappoint",Newsweek
"Mon, 01 Sep 2025 02:08:55 GMT",Bail agent questions Wyandotte County DA’s remarks on accused cop killer - FOX4KC.com,FOX4KC.com
"Sun, 31 Aug 2025 17:42:16 GMT","Hateful robber on Manhattan subway train threatens to call ICE on victim, then beats him: cops - amNewYork",amNewYork
"Fri, 29 Aug 2025 13:11:27 GMT",From Lamborghinis to jail: Ex-LAPD cop accused of crypto heist with reputed Israeli mob figure - Los Angeles Times,Los Angeles Times
"Sun, 31 Aug 2025 21:28:50 GMT",NYPD cop killed in fiery BQE hit-and-run survived earlier motorcycle crash: friend - New York Daily News,New York Daily News
"Mon, 01 Sep 2025 01:00:00 GMT",10 Best Short Cop Shows Like 'NCIS' If You Don't Have Time for 20+ Seasons - MovieWeb,MovieWeb
"Sun, 31 Aug 2025 16:00:00 GMT",'Shop with a Cop' heads back-to-school - NorthcentralPA.com,NorthcentralPA.com
"Sat, 30 Aug 2025 01:48:33 GMT",Alleged cop killer back on streets after posting $5K bond - NewsNation,NewsNation
"Mon, 01 Sep 2025 06:30:00 GMT","'Vaa Vaathiyaar' release date, Karthi's cop drama locks December release, Will the lucky month bring anot - Times of India",Times of India
"Mon, 01 Sep 2025 05:25:37 GMT",Stirling Coffee with a Cop - SAPOL - Home,SAPOL - Home
"Sun, 31 Aug 2025 17:15:00 GMT",Messenger: Jefferson County's circuit clerk has a 2nd job. He's a cop in another county. - STLtoday.com,STLtoday.com
"Fri, 29 Aug 2025 17:26:15 GMT","Lawsuit seeks $27M from upstate town, cop over alleged police brutality - Times Union",Times Union
"Fri, 29 Aug 2025 17:59:00 GMT",City manager gets taste of cop life - WWNY,WWNY
"Sun, 31 Aug 2025 19:20:00 GMT",Superman Star David Corenswet's Favorite Movie Is A Buddy Cop Comedic Masterpiece - SlashFilm,SlashFilm
"Sun, 31 Aug 2025 16:01:00 GMT",Forensic Expert Breaks Down the Biggest Exaggerations in Cop Shows - Screen Rant,Screen Rant
"Fri, 29 Aug 2025 17:06:00 GMT",American Shrapnel Part 7: How a rookie cop caught the uncatchable Eric Rudolph - AL.com,AL.com
"Mon, 01 Sep 2025 05:53:08 GMT",Dezi Freeman LIVE updates: Top cop exposes the sinister secret being kept in hometown of fugitive accused... - Daily Mail,Daily Mail
"Fri, 29 Aug 2025 23:24:46 GMT","'Keep it peaceful,' Chicago top cop warns ahead of Trump deployment - USA Today",USA Today
"Sat, 30 Aug 2025 07:44:00 GMT",Cop buys ticket for stranded deaf traveler - fox10tv.com,fox10tv.com
"Mon, 01 Sep 2025 02:08:19 GMT",Bail agent questions Wyandotte County DA's remarks on accused cop killer - FOX4KC.com,FOX4KC.com
"Sun, 31 Aug 2025 22:07:00 GMT",Burning Man attendee found in ‘pool of blood’ as cops launch murder probe - New York Post,New York Post
"Sun, 31 Aug 2025 20:43:06 GMT",Superman Star David Corenswet's Favorite Movie Is A Buddy Cop Comedic Masterpiece - IMDb,IMDb
"Wed, 27 Aug 2025 20:57:00 GMT","Mansfield man gets body-slammed by cop after jaywalking, fractures seven ribs - Cleveland 19 News",Cleveland 19 News
"Mon, 01 Sep 2025 01:58:00 GMT",Next move in hunt for alleged cop killer - Yahoo News Australia,Yahoo News Australia
"Wed, 27 Aug 2025 19:48:16 GMT","Ex-Bridgeport cop fired for sexual misconduct arrested on stalking charges in Trumbull, police say - Connecticut Post",Connecticut Post
"Mon, 01 Sep 2025 03:19:18 GMT","Rogue drivers take over busy Secaucus intersection, lob fireworks at cops - New York Daily News",New York Daily News
"Thu, 28 Aug 2025 21:43:00 GMT",Box truck driver without license plate busted in hit-and-run death of off-duty NYPD cop: police - New York Post,New York Post
"Sat, 30 Aug 2025 09:00:00 GMT",Investigator in retired Rock Hill cop’s death questioned about taking handcuffs - Rock Hill Herald,Rock Hill Herald
"Fri, 29 Aug 2025 11:44:58 GMT","Cop Records Moment His Dog Arrives Back at Work, Response Doesn't Disappoint - Newsweek",Newsweek
"Fri, 29 Aug 2025 16:30:00 GMT",Former Henagar cop indicted on child porn charges - WAFF,WAFF
"Fri, 29 Aug 2025 22:03:39 GMT",Former Butte cop accused of threatening inmate - KXLF.com,KXLF.com
"Sat, 30 Aug 2025 12:39:22 GMT","Grandfather put pills in his granddaughters’ Dairy Queen ice cream, NC cops say - News & Observer",News & Observer
"Thu, 28 Aug 2025 22:47:47 GMT","Minneapolis top cop had admiration for shooting victims, contempt for shooter - KATU",KATU
"Sun, 31 Aug 2025 19:46:00 GMT",Bengaluru duo dupe cop of 4L in sewing machine deal - Times of India,Times of India
"Thu, 28 Aug 2025 17:35:52 GMT",Chicago's top cop explains how CPD will respond if National Guard deploys - NBC 5 Chicago,NBC 5 Chicago
"Thu, 28 Aug 2025 23:59:00 GMT",FBI cyber cop: Salt Typhoon pwned 'nearly every American' - theregister.com,theregister.com
"Fri, 29 Aug 2025 22:58:00 GMT",Prosecutors call more officers in Miami-Dade cop’s Stand Your Ground hearing - CBS News,CBS News
"Fri, 29 Aug 2025 17:12:00 GMT",More police testimony given in hearing for Miami-Dade cop charged in 2019 UPS shootout - CBS News,CBS News
"Fri, 29 Aug 2025 14:57:00 GMT",Cuyahoga judge demands answers: Did suspected cop killer get high in hospital? - Cleveland.com,Cleveland.com
"Thu, 28 Aug 2025 22:47:47 GMT","Minneapolis top cop had admiration for shooting victims, contempt for shooter - WBMA",WBMA
"Wed, 27 Aug 2025 20:54:00 GMT",Off-duty NYPD cop killed in fiery motorcycle crash after being struck by box truck - New York Post,New York Post
"Thu, 28 Aug 2025 23:55:09 GMT","Man charged with felony for throwing cups at cop settles case with fine, misdemeanor - Cap City News",Cap City News
"Mon, 01 Sep 2025 04:58:12 GMT",Next move in hunt for alleged cop killer - MSN,MSN
"Sun, 31 Aug 2025 04:32:35 GMT",UBS Raises PT on ConocoPhillips (COP) to $123 From $116 - MSN,MSN
"Sun, 31 Aug 2025 09:31:33 GMT",Letters: Closing Alcatraz only first victory | Beware human trafficking | No cop needed at crosswalk - Orlando Sentinel,Orlando Sentinel
"Mon, 01 Sep 2025 05:56:28 GMT",Manhunt for alleged cop killer Dezi Freeman extends no-fly zone - NZ Herald,NZ Herald
"Thu, 28 Aug 2025 22:58:00 GMT","After defense compares him to Wyatt Earp, jury acquits former cop charged with Mobile murder - fox10tv.com",fox10tv.com
"Mon, 01 Sep 2025 01:00:00 GMT",39-year-old man arrested after car crashes into Russian Consulate in Australia; cop injured - watch - Times of India,Times of India
"Sat, 30 Aug 2025 03:10:00 GMT",Former DC cop who survived J6 campaigning against masks on law enforcement - WUSA9,WUSA9
"Fri, 29 Aug 2025 11:54:38 GMT",DeBriefed 29 August 2025: Record wildfires; Solar myths factchecked; Climate veteran on COP reform - Carbon Brief,Carbon Brief
"Sun, 31 Aug 2025 22:04:24 GMT",AUDIO: WA cop laughs about suicide of Aboriginal prisoner - Australian Broadcasting Corporation,Australian Broadcasting Corporation
"Fri, 29 Aug 2025 17:44:06 GMT",This Shouldn’t Be A Thing – Ghost Cop Edition - Civic Media,Civic Media
"Thu, 28 Aug 2025 19:00:00 GMT",Mansfield man who was body slammed by cop after jaywalking is now suing police - Cleveland 19 News,Cleveland 19 News
"Sun, 31 Aug 2025 04:15:28 GMT",UBS Raises PT on ConocoPhillips (COP) to $123 From $116 - Yahoo Finance,Yahoo Finance
"Fri, 29 Aug 2025 14:45:11 GMT","Kinston man arrested after commenting, “A good cop is a dead cop” on social media post - WNCT",WNCT
"Thu, 28 Aug 2025 17:50:00 GMT",Douglas County Sheriff’s Office hosts ‘Tip a Cop’ today at Carson City to raise funds for Special Olympics Nevada - Carson Now,Carson Now
"Fri, 29 Aug 2025 21:08:14 GMT",Bolivar PD to host fishing tournament to benefit Shop with a Cop - OzarksFirst.com,OzarksFirst.com
"Mon, 01 Sep 2025 03:15:37 GMT","Huge ban begins TODAY in one state - and Aussies could cop a $47,000 fine - Daily Mail",Daily Mail
"Fri, 29 Aug 2025 18:39:00 GMT","Ben Gvir, pushing for crackdown on protests, said to weigh firing Tel Aviv’s top cop - The Times of Israel",The Times of Israel
"Mon, 01 Sep 2025 02:42:25 GMT",Missing cop found dead in Yerra Kaluva in Telangana - The New Indian Express,The New Indian Express
"Thu, 28 Aug 2025 03:46:00 GMT",4 New Mexico deputies fired in wake of viral video showing smiling cop chucking baby rabbit at cruiser - New York Post,New York Post
"Sun, 31 Aug 2025 18:07:00 GMT",Smugglers using new routes for drug trafficking: Manipur top cop - Times of India,Times of India
"Thu, 28 Aug 2025 17:00:00 GMT",How did an undocumented migrant get hired as a cop in Maine? - The Hill,The Hill
"Mon, 01 Sep 2025 05:23:09 GMT",Next move in hunt for alleged cop killer - MSN,MSN
"Wed, 27 Aug 2025 19:02:00 GMT",Ex-cop gets prison time for 2023 shotgun threat against wife in Easton - Lehighvalleylive.com,Lehighvalleylive.com
"Mon, 01 Sep 2025 06:00:00 GMT",Off-duty cop accused of assault - The Chronicle | The Chronicle,The Chronicle | The Chronicle
"Fri, 29 Aug 2025 17:24:06 GMT",Shopping Carts And Community Spirit: St. Mary’s Children Gear Up With Shop With A Cop - The BayNet,The BayNet
"Fri, 29 Aug 2025 10:00:00 GMT",Kitchen Cops: Malfunctioning cooler brings down the score for one Huntsville hot spot - WAFF,WAFF
"Sat, 30 Aug 2025 12:01:00 GMT",‘Just jump!’: Watch N.J. cops catch kid leaping from 2nd floor of burning house - Police1,Police1
"Sat, 30 Aug 2025 22:45:00 GMT",Cop Jumps in a Mario Kart-Equipped Rideshare Minivan To Catch a Suspect Fleeing On Foot - AOL.com,AOL.com
"Thu, 28 Aug 2025 16:26:00 GMT",Undercover officer testifies in hearing for Miami-Dade cop charged in 2019 Miramar shootout - CBS News,CBS News
"Thu, 28 Aug 2025 17:00:56 GMT","CPD Will Be Ready if Trump Sends National Guard, ICE Strike Team to Chicago: Top Cop - WTTW News",WTTW News
"Mon, 01 Sep 2025 05:42:00 GMT","Fake cop, 3 others nabbed for guns, grenade in Angeles City - Inquirer.net",Inquirer.net
"Mon, 01 Sep 2025 06:12:47 GMT",'People know' hideout for fugitive alleged cop-killer - The Canberra Times,The Canberra Times
"Fri, 29 Aug 2025 04:07:00 GMT",SEE IT: Cops Violently Arrest Teen Riding Citi Bike in Alphabet City - Streetsblog NYC,Streetsblog NYC
"Fri, 29 Aug 2025 16:20:00 GMT",Commentary: Newsom’s cops vs. Trump’s troops: A new showdown on America's streets - Los Angeles Times,Los Angeles Times
"Sun, 31 Aug 2025 21:25:20 GMT","Bronx tenant who shot super to death often called cops on neighbors, sued landlord - New York Daily News",New York Daily News
"Fri, 29 Aug 2025 11:24:24 GMT","Out & About: Woodbine Falls, Burn the Point, Flower Festival, Shop with a Cop - KTVQ",KTVQ
"Wed, 27 Aug 2025 19:26:16 GMT","New Haven cop resigns amid investigation into Tweed extra-duty assignment, officials say - New Haven Register",New Haven Register
"Sun, 31 Aug 2025 13:21:05 GMT",Thanal trailer: Atharvaa is a cop chasing a soldier-turned-criminal in this thriller - Cinema Express,Cinema Express
"Sun, 31 Aug 2025 14:59:58 GMT",St. Paul offers to put cops outside every school for week after Minneapolis school shooting - Pioneer Press,Pioneer Press
"Thu, 28 Aug 2025 22:47:47 GMT","Minneapolis top cop had admiration for shooting victims, contempt for shooter - KATV",KATV
"Fri, 29 Aug 2025 12:00:00 GMT",Armed Felon In S550 Mustang Flees Arkansas Cop - Yahoo! Autos,Yahoo! Autos
"Sun, 31 Aug 2025 20:00:00 GMT",WA cop laughs about suicide of Aboriginal prisoner - Australian Broadcasting Corporation,Australian Broadcasting Corporation
"Thu, 28 Aug 2025 22:47:47 GMT","Minneapolis top cop had admiration for shooting victims, contempt for shooter - KEYE",KEYE
"Mon, 01 Sep 2025 00:18:53 GMT",GSC will celebrate 10 years during COP 30 - Canal Solar,Canal Solar
"Mon, 01 Sep 2025 05:10:24 GMT",Self-described 'outlaw biker' arrested amid manhunt for alleged cop killer - NZ Herald,NZ Herald
"Thu, 28 Aug 2025 22:47:47 GMT","Minneapolis top cop had admiration for shooting victims, contempt for shooter - WCTI",WCTI
"Wed, 27 Aug 2025 21:00:00 GMT",Ex-Decatur cop accused of murder takes immunity fight to state Supreme Court - fox10tv.com,fox10tv.com
"Thu, 28 Aug 2025 14:04:00 GMT",Is the Current Oil Price Favorable for COP's Upstream Business? - Yahoo Finance,Yahoo Finance
"Fri, 29 Aug 2025 00:01:03 GMT",Greeley cop log: Man doing drugs acts indecent outside convenience store - Greeley Tribune,Greeley Tribune
"Thu, 28 Aug 2025 22:47:47 GMT","Minneapolis top cop had admiration for shooting victims, contempt for shooter - WPMI",WPMI
"Thu, 28 Aug 2025 22:47:47 GMT","Minneapolis top cop had admiration for shooting victims, contempt for shooter - WPMI",WPMI
2025-08-28T19:55:00,ConocoPhillips' Resilient Free Cash Flows Build Long-Term Value,Yahoo
2025-08-28T16:04:00,Is the Current Oil Price Favorable for COP's Upstream Business?,Yahoo
2025-08-27T16:47:00,"ConocoPhillips, EOG Showdown: LNG Growth Story or Shale Drilling Stock?",Yahoo
2025-08-27T16:13:00,ConocoPhillips' Marathon Oil Takeover: Is it Unlocking Superior Value?,Yahoo
