Date,Title,Source
2025-11-05T04:24:33Z,China doubles down on domestic oil and gas output with $470 billion investment,The Times of India
2025-11-05T02:34:57Z,Sequoia Capital's Botha steps down as top boss,The Times of India
2025-11-05T00:00:00Z,The new frontier in understanding human and mammalian brain development,Nature.com
2025-11-05T00:00:00Z,Gas-solid triboelectric nanogenerator formed by ionized air for harvesting energy of ionized air,Royal Society of Chemistry
2025-11-04T20:39:26Z,"Roelof Botha steps aside as Sequoia’s steward, passing the role to Alfred Lin and Pat Grady",Biztoc.com
2025-11-04T20:39:20Z,Sequoia names Alfred Lin and Pat Grady as new Co-Stewards as Roelof Botha steps down,Biztoc.com
2025-11-04T20:36:49Z,Sequoia names Alfred Lin and Pat Grady as new Co-Stewards as Roelof Botha steps down | TechCrunch,TechCrunch
2025-11-04T20:33:54Z,"Roelof Botha steps aside as Sequoia’s steward, passing the role to Alfred Lin and Pat Grady",Fortune
2025-11-04T20:33:44Z,Supercharging the ML and AI Development Experience at Netflix,Netflixtechblog.com
2025-11-04T20:06:45Z,Sequoia chief Roelof Botha steps down from Silicon Valley venture firm,Biztoc.com
2025-11-04T18:15:39Z,"Sequoia announces that Alfred Lin and Pat Grady will be elevated to firm stewards, succeeding Roelof Botha, who led Sequoia solo since 2022",Biztoc.com
2025-11-04T16:00:00Z,A new patch could help to heal the heart,Mit.edu
2025-11-04T14:00:00Z,Predictive value of neutrophil to lymphocyte ratio for clinical outcomes in liver cirrhosis: A systematic review and meta-analysis,Plos.org
2025-11-04T14:00:00Z,Foxi2 and Sox3 are master transcription regulators that control ectoderm germ layer specification in Xenopus,Plos.org
2025-11-04T13:06:42Z,Ruby Lin Says Her Frugal Husband Has Been Using Same Phone for 6 Years Despite Cracked Screen,8days.sg
2025-11-04T08:44:18Z,5 Irresistible Mini C-Dramas To Binge On,soompi
2025-11-04T08:42:40Z,Only some of 66 fighter jets ordered from U.S. may be delivered on time: Koo,Globalsecurity.org
2025-11-04T05:35:03Z,"Taiwan Creative Content Fest Opens With Fund Launches, Cross-Border Collaboration & Praise For Local Hit ‘96 Minutes’",Deadline
2025-11-04T00:00:00Z,Development of a Boron-Doping Strategy to Activate Luminescence in a Non-Emissive Silver-Incorporated Polyoxoniobate,Royal Society of Chemistry
2025-11-04T00:00:00Z,Weaving-inspired asymmetric entangled nodes in multi-component polymer networks,Nature.com
2025-11-04T00:00:00Z,Co-electroreduction of CO and glyoxal promotes C3 products,Nature.com
2025-11-04T00:00:00Z,Surface pH Modulation of Amorphous Manganese Oxide for Enhanced Supercapacitor Performance,Royal Society of Chemistry
2025-11-04T00:00:00Z,Use of rescue noninvasive ventilation for post-extubation respiratory failure,Biomedcentral.com
2025-11-04T00:00:00Z,Visible light photocatalytic reductive hydroalkylation and deuterium alkylation to access α-Silylated bicyclo[1.1.1]pentanes,Royal Society of Chemistry
2025-11-04T00:00:00Z,Synergistic bimetallic PdAg nanoalloy for electrocatalytic reduction of nitrate to ammonia in neutral solution,Royal Society of Chemistry
2025-11-04T00:00:00Z,Computational signatures of uncertainty are reflected in motor cortex excitatory neurochemistry,Nature.com
2025-11-04T00:00:00Z,Function and defense mechanisms of wheat 14-3-3 protein TaGF14a in stripe rust resistance,Biomedcentral.com
2025-11-03T17:07:52Z,Fortnite community reacts to rumored Harry Potter collaboration: ‘Incredibly disheartening’,Thepinknews.com
2025-11-03T16:55:47Z,"At Seoul’s Hansik Conference, Top Chefs Delve into the Past, Present and Future of Korean Food",Observer
2025-11-03T14:00:00Z,Socioeconomic markers of dengue mortality in the 100 Million Brazilian Cohort (2007–2018): A nationwide registry-based cohort study,Plos.org
2025-11-03T14:00:00Z,Surrogate modeling of Cellular-Potts agent-based models as a segmentation task using the U-Net neural network architecture,Plos.org
2025-11-03T14:00:00Z,A neural network approach to sarcopenia prediction based on bioelectrical impedance in community-dwelling older adults,Plos.org
2025-11-03T10:11:52Z,Japan's PM emphasizes cross-strait stability in meeting with Xi,Globalsecurity.org
2025-11-03T10:04:30Z,U.S. contractor working to speed up F-16V delivery to Taiwan: Ministry,Globalsecurity.org
2025-11-03T08:32:16Z,China Hits Out at Japan’s Takaichi for Meeting Taiwan’s Lin - Bloomberg.com,Slashdot.org
"Thu, 06 Nov 2025 02:07:00 GMT","Sequoia Plans for More AI, Less Partisanship Under Grady and Lin - Bloomberg.com",Bloomberg.com
"Thu, 06 Nov 2025 01:43:22 GMT",Eddie Lin wins Seattle City Council seat - The Seattle Times,The Seattle Times
"Thu, 06 Nov 2025 05:11:58 GMT",Kai Lin Art Fall Exhibition (fridays) - creativeloafing.com,creativeloafing.com
"Tue, 04 Nov 2025 20:34:41 GMT",Sequoia names Alfred Lin and Pat Grady as new co-stewards as Roelof Botha steps down - TechCrunch,TechCrunch
"Wed, 05 Nov 2025 20:26:26 GMT",Sequoia Capital elevates Alfred Lin and Pat Grady to lead venture capital firm - Pensions & Investments,Pensions & Investments
"Thu, 06 Nov 2025 01:00:00 GMT",Kelly Lin: Mother by Nature - Prestige Hong Kong,Prestige Hong Kong
"Tue, 04 Nov 2025 20:33:00 GMT","Roelof Botha steps aside as Sequoia’s steward, passing the role to Alfred Lin and Pat Grady - Fortune",Fortune
"Wed, 05 Nov 2025 17:52:48 GMT",Interview: Mandy Gonzalez On Bringing the Music of Lin-Manuel Miranda to Carnegie Hall - BroadwayWorld.com,BroadwayWorld.com
"Thu, 06 Nov 2025 06:26:13 GMT",Will Linde plc (LIN) stock justify high valuation - Rate Hike & Consistent Income Trade Ideas - newser.com,newser.com
"Thu, 06 Nov 2025 03:02:47 GMT",Hear rivers speak through Tsai Kuen-Lin's submerged recordings turned tangible clay and ceramic art - Time Out,Time Out
"Thu, 06 Nov 2025 03:18:00 GMT","Hornets shock Knights, advance to regional semifinals for first time since 2019 | High School | dnronline.com - dnronline.com",dnronline.com
"Wed, 05 Nov 2025 17:57:00 GMT","QQQM, LIN, SHOP, INTU: ETF Inflow Alert - Nasdaq",Nasdaq
"Wed, 05 Nov 2025 01:50:00 GMT",Meet LIN HU - Bold Journey Magazine,Bold Journey Magazine
"Wed, 05 Nov 2025 04:20:44 GMT",Seattle City Council position 2: Eddie Lin leads Adonis Ducksworth - The Seattle Times,The Seattle Times
"Thu, 06 Nov 2025 01:32:00 GMT",Volleyball: Turner Ashby vs. Wilson Memorial - dnronline.com,dnronline.com
"Mon, 03 Nov 2025 02:28:00 GMT",China Hits Out at Japan’s Takaichi for Meeting Taiwan’s Lin - Bloomberg.com,Bloomberg.com
"Wed, 05 Nov 2025 21:15:00 GMT",Team effort leads No. 4 Dukes to MAC semis - dnronline.com,dnronline.com
"Tue, 04 Nov 2025 22:25:59 GMT",Midas Stalwarts Alfred Lin And Pat Grady To Helm Sequoia After Roelof Botha Steps Down - Forbes,Forbes
"Tue, 04 Nov 2025 21:42:42 GMT","Sequoia’s Botha Hands Stewardship of VC Firm to Lin, Grady - Bloomberg.com",Bloomberg.com
"Mon, 03 Nov 2025 12:00:19 GMT",Newcomer Wei Lin to be Oregon men's basketball point guard until Jackson Shelstad's return - The Register-Guard,The Register-Guard
"Wed, 05 Nov 2025 11:42:14 GMT",Sequoia US Leadership Change: Lin Junrui from Midas Joins Grady to Guide the Future - 36Kr,36Kr
"Mon, 03 Nov 2025 15:25:18 GMT","Tommie Lin Kesten, Pittsburgh Ballet Theatre’s Hometown Ballerina - Pointe Magazine",Pointe Magazine
"Wed, 05 Nov 2025 15:39:43 GMT",Lin Xiaojun Vows Revival 100 Days Before 2026 Winter Olympics - 조선일보,조선일보
"Sun, 02 Nov 2025 10:39:58 GMT",Lin Peer murder arrest in Petah Tikva - www.israelhayom.com,www.israelhayom.com
"Wed, 05 Nov 2025 16:00:00 GMT",Lions’ Lin An-ko seeks opportunities overseas - Taipei Times,Taipei Times
"Mon, 03 Nov 2025 15:02:32 GMT",Co-Lin Alumni Association honors outstanding faculty and staff - Daily Leader,Daily Leader
"Tue, 04 Nov 2025 18:35:51 GMT","JJ Lin Drops 10th-Anniversary ‘Honor of Kings’ Theme Song ‘Atlas of Tomorrow,’ Marking Gaming’s Next Crossover Hit - billboard.com",billboard.com
"Mon, 03 Nov 2025 19:02:35 GMT",Co-Lin radiography students earn top MSRT awards - Daily Leader,Daily Leader
"Mon, 03 Nov 2025 12:22:00 GMT",Nina Lin breaks silence and apologizes after viral videos with Said and Disguised Toast spark major backl - Times of India,Times of India
"Wed, 05 Nov 2025 12:07:03 GMT",Linde PLC $LIN Shares Purchased by TKG Advisors LLC - MarketBeat,MarketBeat
"Wed, 05 Nov 2025 12:19:05 GMT",Huntington National Bank Grows Holdings in Linde PLC $LIN - MarketBeat,MarketBeat
"Wed, 05 Nov 2025 12:01:01 GMT",Linde PLC $LIN Shares Bought by Transatlantique Private Wealth LLC - MarketBeat,MarketBeat
"Wed, 05 Nov 2025 11:44:56 GMT",Marion Wealth Management Makes New Investment in Linde PLC $LIN - MarketBeat,MarketBeat
"Mon, 03 Nov 2025 17:42:00 GMT","Fund Update: 355,950 LINDE PLC (LIN) shares added to FLOSSBACH VON STORCH SE portfolio - Quiver Quantitative",Quiver Quantitative
"Wed, 05 Nov 2025 11:20:49 GMT",Main Street Research LLC Has $34.01 Million Stake in Linde PLC $LIN - MarketBeat,MarketBeat
"Wed, 05 Nov 2025 05:56:25 GMT","Foster, Mercedes Rinck, Lin take early leads in critical Seattle city council races - MyNorthwest.com",MyNorthwest.com
"Mon, 03 Nov 2025 14:21:00 GMT",New Analyst Forecast: $LIN Given $500.0 Price Target - Quiver Quantitative,Quiver Quantitative
"Wed, 05 Nov 2025 02:42:52 GMT",Is Linde’s (LIN) Record Project Backlog a Sign of Resilience or Growing Operational Pressure? - simplywall.st,simplywall.st
"Mon, 03 Nov 2025 22:13:01 GMT","Amber Cox named Indiana Fever COO and GM, Lin Dunn to senior advisor position - AOL.com",AOL.com
"Wed, 05 Nov 2025 01:03:25 GMT",Barbara Lin Parr - Benton County Enterprise,Benton County Enterprise
"Wed, 05 Nov 2025 10:16:04 GMT","Prosperity Consulting Group LLC Sells 2,951 Shares of Linde PLC $LIN - MarketBeat",MarketBeat
"Wed, 05 Nov 2025 09:48:01 GMT",Burney Co. Lowers Stock Holdings in Linde PLC $LIN - MarketBeat,MarketBeat
"Tue, 04 Nov 2025 16:16:32 GMT",Lin-Manuel Miranda's Dad Told Him Not to Sing “Hamilton” at the White House: 'Go with What We Know Works' (Exclusive) - AOL.com,AOL.com
"Wed, 05 Nov 2025 08:14:00 GMT",Lin-gang's latest step set to foster innovation - citynewsservice.cn,citynewsservice.cn
"Tue, 04 Nov 2025 00:46:54 GMT",How dovish Fed policy supports Linde plc (LIN) stock - Weekly Profit Recap & Reliable Volume Spike Alerts - newser.com,newser.com
"Tue, 04 Nov 2025 21:16:52 GMT",Sequoia Names Lin and Grady Co‑Stewards as Botha Leaves - findarticles.com,findarticles.com
"Tue, 04 Nov 2025 09:46:00 GMT",CPBL MVP finalist Lin An-ko exercises overseas free agency option - Focus Taiwan,Focus Taiwan
"Wed, 05 Nov 2025 00:52:21 GMT",Sydney Sweeney teams with Justin Lin for That Man From Rio remake - Flickering Myth,Flickering Myth
"Tue, 04 Nov 2025 11:45:00 GMT",FM Lin meets with Australia-bound Young Agriculture Ambassadors - Focus Taiwan,Focus Taiwan
"Mon, 03 Nov 2025 06:28:06 GMT",What downside risks could hit Linde plc (LIN) stock - Weekly Risk Summary & Community Verified Trade Signals - newser.com,newser.com
"Mon, 03 Nov 2025 09:17:11 GMT",Will Linde plc (LIN) stock justify high valuation - July 2025 Catalysts & Weekly Setup with ROI Potential - newser.com,newser.com
"Tue, 04 Nov 2025 13:19:06 GMT",Linde plc (NASDAQ:LIN) Q3 2025 Earnings Call Transcript - Insider Monkey,Insider Monkey
"Wed, 05 Nov 2025 02:34:57 GMT","Sequoia Capital’s Roelof Botha steps down; Alfred Lin, Pat Grady to lead Silicon Valley VC firm - The Economic Times",The Economic Times
"Sat, 01 Nov 2025 10:17:07 GMT",Linde (LIN) Margin Expansion Reinforces Bullish Narratives Despite Slower Earnings Growth - Yahoo Finance,Yahoo Finance
"Tue, 04 Nov 2025 13:05:12 GMT",Linde PLC $LIN Shares Sold by Bank of New York Mellon Corp - MarketBeat,MarketBeat
"Tue, 04 Nov 2025 16:00:00 GMT",Lin meets with Australia-bound Young Agriculture Ambassadors - Taipei Times,Taipei Times
"Tue, 04 Nov 2025 06:42:35 GMT",Linde (LIN): New Buy Recommendation for This Basic Materials Giant - The Globe and Mail,The Globe and Mail
"Mon, 03 Nov 2025 07:18:45 GMT","VP Hsiao, FM Lin meet with Atlantic Council delegation - Taiwan Today",Taiwan Today
"Wed, 05 Nov 2025 06:48:32 GMT",Why Linde plc (LIN) stock is upgraded to buy - July 2025 Snapshot & AI Forecasted Entry/Exit Points - newser.com,newser.com
"Sun, 02 Nov 2025 00:51:28 GMT","Linde (LIN) Margin Expansion Outpaces Expectations, Reinforces Quality Earnings Narrative - simplywall.st",simplywall.st
"Wed, 05 Nov 2025 01:16:38 GMT","Lin Xiaojun Vows to Overcome Slump, Seeks Olympic Redemption - 조선일보",조선일보
"Mon, 03 Nov 2025 04:43:00 GMT","BADMINTON Wang Chi-lin, Chiu Hsiang-chieh win Hylo Open men's doubles title - Focus Taiwan",Focus Taiwan
"Wed, 05 Nov 2025 07:50:01 GMT",Will Linde plc (LIN) stock justify high valuation - Weekly Stock Summary & Accurate Buy Signal Alerts - newser.com,newser.com
"Tue, 04 Nov 2025 20:59:22 GMT",Linde (NASDAQ:LIN) Price Target Cut to $520.00 by Analysts at Citigroup - MarketBeat,MarketBeat
"Tue, 04 Nov 2025 06:17:27 GMT","Exclusive Interview with Mr. Xiaoning Lin, Deputy General Manager of Unilumin: LED Display Giant Makes Successful Performance in LED Lighting - LEDinside",LEDinside
"Sat, 01 Nov 2025 15:05:29 GMT",Lana Lin - Los Angeles Review of Books,Los Angeles Review of Books
"Sun, 02 Nov 2025 21:26:00 GMT","Co-Lin running back Martavious Boswell picks up State offer, sets visit - 247Sports",247Sports
"Mon, 03 Nov 2025 03:41:36 GMT",Why Linde plc (LIN) stock is upgraded to buy - Weekly Market Report & Safe Entry Point Alerts - newser.com,newser.com
"Tue, 04 Nov 2025 11:05:21 GMT",Linde (NASDAQ:LIN) Raised to Strong-Buy at Seaport Res Ptn - MarketBeat,MarketBeat
"Mon, 03 Nov 2025 21:18:49 GMT","Citigroup Lowers Price Target for Linde (LIN) to $520.00, Mainta - GuruFocus",GuruFocus
"Tue, 04 Nov 2025 16:27:24 GMT",JPMorgan Chase & Co. Issues Pessimistic Forecast for Linde (NASDAQ:LIN) Stock Price - MarketBeat,MarketBeat
"Sat, 01 Nov 2025 23:18:03 GMT",'In The Heights' Film Rights Returned To Lin-Manuel Miranda And Quiara Alegría Hudes In Wake Of Weinstein Co. Bankruptcy - Blavity News,Blavity News
"Mon, 03 Nov 2025 17:05:55 GMT",JP Morgan Lowers Price Target for Linde (LIN) to $455 | LIN Stoc - GuruFocus,GuruFocus
"Sun, 02 Nov 2025 20:32:28 GMT",Chloe Lin Game Report: vs Madison - MaxPreps.com,MaxPreps.com
"Sun, 02 Nov 2025 10:16:05 GMT","Shannon Lin Allsopp Obituary (2025) - Carver, MA - Shepherd Funeral & Cremation Service - Legacy obituary",Legacy obituary
"Mon, 03 Nov 2025 14:09:25 GMT",Linde (LIN) Upgraded to Buy with a New Price Target by Seaport G - GuruFocus,GuruFocus
"Mon, 03 Nov 2025 12:23:06 GMT",Linde PLC $LIN Shares Acquired by iA Global Asset Management Inc. - MarketBeat,MarketBeat
"Mon, 03 Nov 2025 13:23:35 GMT",State of Michigan Retirement System Trims Position in Linde PLC $LIN - MarketBeat,MarketBeat
"Mon, 03 Nov 2025 12:19:57 GMT",Linde PLC $LIN Shares Bought by Machina Capital S.A.S. - MarketBeat,MarketBeat
"Mon, 03 Nov 2025 12:25:21 GMT","Tredje AP fonden Sells 135,076 Shares of Linde PLC $LIN - MarketBeat",MarketBeat
"Mon, 03 Nov 2025 10:27:42 GMT",Linde PLC $LIN Shares Acquired by TIAA Trust National Association - MarketBeat,MarketBeat
"Sun, 02 Nov 2025 04:20:21 GMT",How did Lin-Manuel Miranda become a global superstar? - Big Issue,Big Issue
"Mon, 03 Nov 2025 10:27:44 GMT","Great Lakes Retirement Inc. Has $306,000 Holdings in Linde PLC $LIN - MarketBeat",MarketBeat
"Mon, 03 Nov 2025 12:49:20 GMT","9,508 Shares in Linde PLC $LIN Bought by Regents Gate Capital LLP - MarketBeat",MarketBeat
2025-11-01T11:17:07,Linde (LIN) Margin Expansion Reinforces Bullish Narratives Despite Slower Earnings Growth,Yahoo
