Date,Title,Source
"Mon, 27 Oct 2025 18:20:00 GMT",New Analyst Forecast: $MCK Given $920.0 Price Target - Quiver Quantitative,Quiver Quantitative
"Mon, 27 Oct 2025 23:24:04 GMT",Is McKesson Corporation (MCK) stock supported by strong fundamentals - Inflation Watch & Low Drawdown Investment Ideas - newser.com,newser.com
"Mon, 27 Oct 2025 18:47:15 GMT","UBS Maintains 'Buy' Rating, Raises McKesson (MCK) Price Target t - GuruFocus",GuruFocus
"Sat, 25 Oct 2025 21:08:20 GMT",McKesson (MCK): Evaluating Valuation After Impressive Share Price Momentum - Yahoo Finance,Yahoo Finance
"Mon, 27 Oct 2025 04:38:29 GMT",How Investors Are Reacting To McKesson (MCK) Partnering on LYMPHIR Immunotherapy Distribution Expansion - simplywall.st,simplywall.st
"Tue, 28 Oct 2025 06:01:34 GMT",Is McKesson Corporation (MCK) stock expanding market penetration - Wall Street Watch & Community Verified Swing Trade Signals - newser.com,newser.com
"Fri, 24 Oct 2025 04:01:00 GMT",3 Reasons We Love McKesson (MCK) - FinancialContent,FinancialContent
"Fri, 24 Oct 2025 21:50:02 GMT",McKesson (MCK) Surpasses Market Returns: Some Facts Worth Knowing - Yahoo Finance,Yahoo Finance
"Mon, 27 Oct 2025 09:46:43 GMT",How MCK stock expands through international markets - 2025 Earnings Surprises & AI Driven Price Predictions - newser.com,newser.com
"Sun, 26 Oct 2025 00:39:04 GMT",A Closer Look at McKesson’s (MCK) Valuation After Steady Share Price Gains - simplywall.st,simplywall.st
"Thu, 23 Oct 2025 13:00:03 GMT",McKesson Corporation (MCK) Is a Trending Stock: Facts to Know Before Betting on It - Yahoo Finance,Yahoo Finance
"Sun, 26 Oct 2025 22:44:05 GMT",Is McKesson Corporation (MCK) stock supported by strong fundamentals - Market Growth Review & Low Risk High Reward Ideas - newser.com,newser.com
"Mon, 27 Oct 2025 13:01:17 GMT",How MCK stock expands through international markets - July 2025 Opening Moves & Real-Time Market Sentiment Alerts - newser.com,newser.com
"Sun, 26 Oct 2025 10:26:52 GMT",How MCK stock expands through international markets - 2025 Price Action Summary & Smart Investment Allocation Tips - newser.com,newser.com
"Mon, 27 Oct 2025 12:49:50 GMT",How MCK stock expands through international markets - July 2025 Short Interest & AI Driven Stock Reports - newser.com,newser.com
"Sat, 25 Oct 2025 08:24:49 GMT",How MCK stock expands through international markets - 2025 Price Targets & Smart Money Movement Alerts - newser.com,newser.com
"Thu, 23 Oct 2025 12:33:57 GMT",Is MCK stock prepared for digital transition - July 2025 Earnings & Real-Time Volume Analysis - newser.com,newser.com
"Fri, 24 Oct 2025 12:00:50 GMT","Small Gestures, Big Impacts - The McKendree Review",The McKendree Review
"Sat, 25 Oct 2025 05:48:25 GMT",Critical Comparison: McKesson (NYSE:MCK) versus Green Cures & Botanical Distribution (OTCMKTS:GRCU) - Defense World,Defense World
2025-10-27T23:32:03,UBS Maintains McKesson (MCK) Buy Recommendation,Fintel
2025-10-25T23:08:20,McKesson (MCK): Evaluating Valuation After Impressive Share Price Momentum,Yahoo
2025-10-24T23:50:02,McKesson (MCK) Surpasses Market Returns: Some Facts Worth Knowing,Yahoo
2025-10-24T06:01:51,3 Reasons We Love McKesson (MCK),Yahoo
2025-10-23T15:00:03,McKesson Corporation (MCK) Is a Trending Stock: Facts to Know Before Betting on It,Yahoo
2025-10-23T13:14:50,How Recent Developments Are Rewriting the Story for McKesson,Yahoo
