Date,Title,Source
"Sun, 07 Dec 2025 21:19:29 GMT",Is Q3 Beat And Higher Guidance Altering The Investment Case For Quanta Services (PWR)? - simplywall.st,simplywall.st
"Sun, 07 Dec 2025 19:26:36 GMT",PWR: Saracens 33-15 Loughborough Lightning - Rosie Galligan and Marlie Packer score for Sarries - BBC,BBC
"Sun, 07 Dec 2025 08:32:02 GMT",Discipline and Rules-Based Execution in PWR Response - news.stocktradersdaily.com,news.stocktradersdaily.com
"Wed, 03 Dec 2025 18:07:52 GMT",Record Backlog And Guidance Raise Might Change The Case For Investing In Quanta Services (PWR) - Yahoo Finance,Yahoo Finance
"Sat, 06 Dec 2025 16:21:48 GMT",PWR Report | Exeter Chiefs 41-10 Bristol Bears - Bristol Bears Rugby,Bristol Bears Rugby
"Thu, 04 Dec 2025 22:41:15 GMT",Podcast: Tarsh Ganley on her RWC experiences and how she’s heading to the PWR - - rugbyreferee.net,rugbyreferee.net
"Wed, 03 Dec 2025 14:38:07 GMT","Analysts Offer Insights on Industrial Goods Companies: XPO (XPO), Northrop Grumman (NOC) and Quanta Services (PWR) - The Globe and Mail",The Globe and Mail
"Fri, 05 Dec 2025 12:15:40 GMT","Women of Music India concludes a landmark second edition of PWR Pose in Mumbai, redefining community, access, and cultural representation in Indian music - Firstpost",Firstpost
"Fri, 05 Dec 2025 11:21:49 GMT",TEAM NEWS | Saracens Women Vs Loughborough Lightning (PWR R6) - Saracens,Saracens
"Sat, 06 Dec 2025 20:43:04 GMT",PWR side show claws against Quins - Leicester Tigers,Leicester Tigers
"Wed, 03 Dec 2025 12:04:38 GMT",PWR R9-R14 Fixtures Confirmed - Harlequins FC,Harlequins FC
"Fri, 05 Dec 2025 20:43:03 GMT",Quanta Services (PWR): Valuation Check After Double-Digit Growth and Record $39.2 Billion Backlog - simplywall.st,simplywall.st
"Fri, 05 Dec 2025 11:04:16 GMT",Team news: Exeter Chiefs vs Bristol Bears – PWR R6 - Bristol Bears Rugby,Bristol Bears Rugby
"Sat, 06 Dec 2025 19:18:59 GMT","PWR: Gloucester-Hartpury maintain winning start, Leicester Tigers remain bottom - BBC",BBC
"Wed, 03 Dec 2025 12:16:29 GMT",Layla Sae: New Zealand and Harlequins forward to miss rest of PWR season - BBC,BBC
"Thu, 04 Dec 2025 10:38:12 GMT",PWR announce fixtures for rounds 9-14 - Rugbypass.com,Rugbypass.com
"Wed, 03 Dec 2025 12:05:36 GMT",PWR fixtures confirmed for rounds nine to 14 - Exeter Chiefs,Exeter Chiefs
"Sun, 07 Dec 2025 09:59:25 GMT","Avestar Capital LLC Sells 1,229 Shares of Quanta Services, Inc. $PWR - Defense World",Defense World
"Sun, 07 Dec 2025 09:59:25 GMT","Baird Financial Group Inc. Sells 5,285 Shares of Quanta Services, Inc. $PWR - Defense World",Defense World
"Sun, 07 Dec 2025 08:47:20 GMT","Edgestream Partners L.P. Boosts Stock Position in Quanta Services, Inc. $PWR - Defense World",Defense World
"Sun, 07 Dec 2025 08:14:25 GMT","Amundi Trims Stock Holdings in Quanta Services, Inc. $PWR - Defense World",Defense World
"Fri, 05 Dec 2025 07:26:48 GMT","Quanta Services, Inc. (NYSE:PWR) Receives Average Recommendation of “Moderate Buy” from Analysts - Defense World",Defense World
"Wed, 03 Dec 2025 09:36:18 GMT","AMJ Financial Wealth Management Boosts Position in Quanta Services, Inc. $PWR - Defense World",Defense World
2025-12-03T19:07:52,Record Backlog And Guidance Raise Might Change The Case For Investing In Quanta Services (PWR),Yahoo
