Date,Title,Source
"Wed, 05 Nov 2025 07:19:00 GMT",Curry clinging to 184-vote lead while trying to hold onto circuit court seat - WDAM-TV,WDAM-TV
"Wed, 05 Nov 2025 05:00:35 GMT",North Tama moves onto the semifinals to face Janesville - thegazette.com,thegazette.com
"Wed, 05 Nov 2025 06:09:17 GMT",Risk vs reward if holding onto FLEX LNG Ltd. - Swing Trade & Advanced Technical Analysis Signals - newser.com,newser.com
"Wed, 05 Nov 2025 06:02:27 GMT",Holding onto warmer temperatures and a slight breeze for a couple more days - Post Bulletin,Post Bulletin
"Tue, 04 Nov 2025 09:25:32 GMT",Vandals Hold Onto Wire-to-Wire Victory over Washington State in Season Opener - University of Idaho Athletics,University of Idaho Athletics
"Tue, 04 Nov 2025 20:18:19 GMT","Middle school student brought gun magazine onto campus, no weapon involved - WWMT",WWMT
"Tue, 04 Nov 2025 23:08:39 GMT",AI performers are making it onto the Billboard charts - Tubefilter,Tubefilter
"Wed, 05 Nov 2025 03:12:00 GMT",Incumbents hold onto Springdale Council seats as data center debate continues - TribLIVE.com,TribLIVE.com
"Tue, 04 Nov 2025 23:09:06 GMT",Onto Innovation Inc expected to post earnings of 87 cents a share - Earnings Preview - TradingView,TradingView
"Tue, 04 Nov 2025 23:24:19 GMT",Howie Roseman Explains Why Eagles Held Onto A.J. Brown at NFL Trade Deadline - Sports Illustrated,Sports Illustrated
"Tue, 04 Nov 2025 21:04:00 GMT",Bengals hold onto Trey Hendrickson at the NFL trade deadline amid ongoing defensive issues - Cleveland.com,Cleveland.com
"Wed, 05 Nov 2025 02:39:00 GMT",Jets officially move onto the future with NFL trade deadline teardown - New York Post,New York Post
"Tue, 04 Nov 2025 20:49:11 GMT",VRacer Hoverbike Flies Onto PlayStation VR2 Today - UploadVR,UploadVR
"Wed, 05 Nov 2025 02:00:00 GMT",Ryan Reynolds' Forgotten 'Cars' Replacement Speeds Its Way Onto Netflix's Top 10 - Collider,Collider
"Wed, 05 Nov 2025 05:50:41 GMT",Risk vs reward if holding onto Ducommun Incorporated - 2025 EndofYear Setup & Low Risk High Reward Ideas - newser.com,newser.com
"Wed, 05 Nov 2025 06:50:23 GMT",Risk vs reward if holding onto OPKO Health Inc. - Portfolio Value Report & Stepwise Trade Execution Plans - newser.com,newser.com
"Wed, 05 Nov 2025 05:50:19 GMT",Risk vs reward if holding onto Rekor Systems Inc. - Trade Entry Report & Free Daily Entry Point Trade Alerts - newser.com,newser.com
"Wed, 05 Nov 2025 05:14:13 GMT",Risk vs reward if holding onto FSLR - 2025 Trading Volume Trends & Safe Entry Zone Tips - newser.com,newser.com
"Wed, 05 Nov 2025 07:44:28 GMT",Onto Innovation Inc. stock momentum explained - Earnings Risk Summary & Weekly Setup with High ROI Potential - newser.com,newser.com
"Wed, 05 Nov 2025 07:30:33 GMT",Risk vs reward if holding onto MSPRW - Options Play & Real-Time Volume Trigger Notifications - newser.com,newser.com
"Tue, 04 Nov 2025 13:00:00 GMT",How to Hold Onto Hope in Dark Times? A Popular Substacker Offers Advice - The Story Exchange,The Story Exchange
"Wed, 05 Nov 2025 05:27:48 GMT",Cook for Me Grandpa! Serves Onto Steam Today - COGconnected,COGconnected
"Tue, 04 Nov 2025 15:02:32 GMT",Woman charged with assault after pouring bleach onto a victim’s head - whopam.com,whopam.com
"Tue, 04 Nov 2025 18:00:00 GMT",Virginia hangs onto the top spot in this week’s ACC Power Rankings - Tar Heel Blog,Tar Heel Blog
"Wed, 05 Nov 2025 06:29:36 GMT",Risk vs reward if holding onto PENN Entertainment Inc. - Take Profit & Weekly High Potential Alerts - newser.com,newser.com
"Wed, 05 Nov 2025 05:50:05 GMT",Risk vs reward if holding onto Glaukos Corporation - Market Volume Summary & Fast Exit/Entry Strategy Plans - newser.com,newser.com
"Tue, 04 Nov 2025 19:55:22 GMT",Stay Wolk: Intel on Georgia's four commits still trying to be flipped that Georgia needs to hold onto - 247Sports,247Sports
"Tue, 04 Nov 2025 20:42:21 GMT",Onto Innovation price target raised to $160 from $115 at Evercore ISI - TipRanks,TipRanks
"Tue, 04 Nov 2025 20:41:15 GMT",Jets Are Holding Onto Garrett Wilson After Blockbuster Trades - Yahoo Sports,Yahoo Sports
"Tue, 04 Nov 2025 20:21:51 GMT",Vehicle goes off I-40 bridge onto Tramway in Albuquerque - KRQE,KRQE
"Wed, 05 Nov 2025 07:00:06 GMT",LEGO Speeds onto the Grid with the ‘F1 The Movie’ APXGP Team Race Car Set - hypebeast.com,hypebeast.com
"Wed, 05 Nov 2025 06:07:45 GMT",Minneapolis City Council progressives hang onto majority - Star Tribune,Star Tribune
"Wed, 05 Nov 2025 03:37:00 GMT",Nutrition coach warns rice is making you hold onto belly fat; shares best way to eat it: ‘You need what rice is missing’ | Health - Hindustan Times,Hindustan Times
"Mon, 03 Nov 2025 16:58:00 GMT",School officials identify weapon component brought onto Decatur HS campus; student detained - WAFF,WAFF
"Tue, 04 Nov 2025 17:00:28 GMT",Choose Your Own Adventure blasts onto comic shelves Summer 2026 with Space and Beyond! - Popverse,Popverse
"Tue, 04 Nov 2025 06:09:34 GMT",Montezuma’s Revenge – The 40th Anniversary Edition Jumping Onto Consoles Next Month - COGconnected,COGconnected
"Tue, 04 Nov 2025 03:19:34 GMT",Monroe driver escapes injury after a tree falls onto his pickup truck - The Monroe Sun,The Monroe Sun
"Tue, 04 Nov 2025 16:16:13 GMT",Top 10 Countries that have payment card info spilled onto the dark web in 2025 - Cybersecurity Insiders,Cybersecurity Insiders
"Tue, 04 Nov 2025 15:35:12 GMT",‘Blood Star’ Trailer – Gritty Desert Noir Runs Onto Digital This Month - Bloody Disgusting,Bloody Disgusting
"Tue, 04 Nov 2025 19:45:28 GMT",Cowboys hilariously offload biggest problem onto Jets in Quinnen Williams trade - The Landry Hat,The Landry Hat
"Mon, 03 Nov 2025 11:30:45 GMT",Bugonia Review: Hold Onto Our Humanity - MacGuffin or Meaning,MacGuffin or Meaning
"Tue, 04 Nov 2025 12:00:05 GMT",Washington Capitals Goalie Forcing His Way Onto Team Canada - Sports Illustrated,Sports Illustrated
"Wed, 05 Nov 2025 01:29:00 GMT",Vehicle goes off I-40 bridge onto Tramway in Albuquerque - Yahoo,Yahoo
"Mon, 03 Nov 2025 00:41:00 GMT",Vehicle rolled over onto embankment near I-580 - KOLO | 8 News Now,KOLO | 8 News Now
"Tue, 04 Nov 2025 15:07:00 GMT",Netflix's New Easy-to-Binge 'Homeland' Replacement Surges Onto Streaming Charts - Collider,Collider
"Mon, 03 Nov 2025 16:38:00 GMT","Truck crashes, spills dirt onto entrance ramp for Eisenhower Expressway in Schaumburg, Illinois - CBS News",CBS News
"Sun, 02 Nov 2025 00:34:38 GMT",Jackrabbits take down Mavericks to move onto #SummitWSOC semifinals - The Summit League,The Summit League
"Tue, 04 Nov 2025 20:35:12 GMT",‘Nobody Wants This’ Season 2 Remains Atop Netflix Weekly TV Rankings; ‘The Witcher’ Viewership Declines As ‘Stranger Things’ Creeps Back Onto Charts - Yahoo,Yahoo
"Mon, 03 Nov 2025 00:38:00 GMT",Vehicle rolled over onto embankment near I-580 - KOLO | 8 News Now,KOLO | 8 News Now
"Mon, 03 Nov 2025 13:21:19 GMT",Gómez holds onto WBA regional crown after draw with Ingram - World Boxing Association,World Boxing Association
"Tue, 04 Nov 2025 17:02:39 GMT","Lost Tesla Driver Wanders onto Track, Goes the Wrong Way, During Motorcycle Race - MotorBiscuit",MotorBiscuit
"Tue, 04 Nov 2025 14:49:32 GMT",IrishFest Atlanta Is Back This Weekend & You'll Feel Like You've Stepped Straight Onto The Streets Of Ireland — Here's What to Expect At This Beautiful Cultural Festival - Secret Atlanta,Secret Atlanta
"Mon, 03 Nov 2025 08:17:27 GMT",Local Leader is Brought Onto Board - Los Angeles Business Journal,Los Angeles Business Journal
"Sun, 02 Nov 2025 21:02:44 GMT",Person injured after falling 10 feet onto roof in Kaysville - KSL TV 5,KSL TV 5
"Tue, 04 Nov 2025 19:02:57 GMT","""Thieves climbed onto our garage and then onto the roof of the house"" – Lidl-Trek rider’s home ransacked as he enjoyed romantic holiday with girlfriend - CyclingUpToDate.com",CyclingUpToDate.com
"Mon, 03 Nov 2025 12:46:13 GMT",Iran says missile that killed Haniyeh locked onto his phone - JNS.org,JNS.org
"Tue, 04 Nov 2025 14:45:37 GMT",4 Hospitalized After School Bus Flips Over Onto Its Roof While Trying to Avoid an Oncoming Vehicle - AOL.com,AOL.com
"Tue, 04 Nov 2025 12:30:00 GMT","Konami's Octopus Platformer Swims Onto Switch 2 Next Year, While Switch 1 Version Goes MIA - Nintendo Life",Nintendo Life
"Tue, 04 Nov 2025 17:38:11 GMT",NFL insider just crushed the trade buzz Bears fans were holding onto - Bear Goggles On,Bear Goggles On
"Sat, 01 Nov 2025 03:21:42 GMT",Fan with American flag runs onto field in Toronto during Game 6 of World Series - USA Today,USA Today
"Tue, 04 Nov 2025 20:45:11 GMT","Car crashes onto parapet near Hamirpur, 2 killed - Tribune India",Tribune India
"Sun, 02 Nov 2025 23:20:37 GMT",One injured after falling onto roof in Kaysville - ABC4 Utah,ABC4 Utah
"Wed, 05 Nov 2025 02:42:06 GMT",Evercore ISI raises Onto Innovation stock price target to $160 on HBM growth - Investing.com India,Investing.com India
"Fri, 31 Oct 2025 20:28:06 GMT","Some top Trump officials are moving onto U.S. military bases, The Atlantic reports - MSNBC News",MSNBC News
"Sat, 01 Nov 2025 13:53:58 GMT",Trump admin officials move onto military bases amid political violence - Fox News,Fox News
"Tue, 04 Nov 2025 08:37:23 GMT",Risk vs reward if holding onto CVEO - July 2025 Breakouts & Fast Entry Momentum Alerts - newser.com,newser.com
"Tue, 04 Nov 2025 09:59:09 GMT",Further warning for waves crashing onto promenades on Isle of Man - BBC,BBC
"Tue, 04 Nov 2025 07:39:27 GMT",Risk vs reward if holding onto YOSH - Portfolio Gains Report & High Win Rate Trade Alerts - newser.com,newser.com
"Tue, 04 Nov 2025 09:55:41 GMT",Further warning for waves crashing onto promenades - Yahoo News New Zealand,Yahoo News New Zealand
"Tue, 04 Nov 2025 17:25:31 GMT",Tesla Model Y strays onto track during AMF motorcycle race - тарантас ньюс,тарантас ньюс
"Tue, 04 Nov 2025 16:19:09 GMT",Reese Witherspoon Says The Public Gets It Wrong About Jennifer Aniston: 'She's Just A High-Spiritual Integrity Person' (And Not Holding Onto Brad Pitt) - Cinemablend,Cinemablend
"Mon, 03 Nov 2025 21:32:58 GMT",Johnstown man charged with bringing weapons onto school grounds - WTAJ,WTAJ
"Fri, 31 Oct 2025 10:47:11 GMT",2 men charged with bringing guns onto University City high school property - WSOC TV,WSOC TV
"Mon, 03 Nov 2025 12:36:37 GMT",Truck Tractor Rollover Causing Delays at I-14 Flyover onto I-35 - FOX 44,FOX 44
"Sun, 02 Nov 2025 19:18:45 GMT",Researchers 3D print hydrogels directly onto vocal cords - VoxelMatters,VoxelMatters
"Fri, 31 Oct 2025 13:41:15 GMT",Overflowing U.S. shale gas increasingly streams to Mexico and onto global markets - Federal Reserve Bank of Dallas,Federal Reserve Bank of Dallas
"Tue, 04 Nov 2025 16:26:03 GMT",Marjorie Taylor Greene sparks instant clashes moments after stepping onto The View - Daily Mail,Daily Mail
"Fri, 31 Oct 2025 07:30:00 GMT",Chart: Batteries are set to surge onto the US grid - Canary Media,Canary Media
"Tue, 04 Nov 2025 10:05:57 GMT",Further warning for waves crashing onto promenades - AOL.com,AOL.com
"Mon, 03 Nov 2025 12:01:00 GMT",Spotted salamanders are finding their way onto former strip-mines in Southwest Virginia - WVTF,WVTF
"Mon, 03 Nov 2025 15:07:41 GMT",Risk vs reward if holding onto FSLR - 2025 Market Trends & Low Drawdown Investment Ideas - newser.com,newser.com
"Tue, 04 Nov 2025 00:54:21 GMT","Shutdown NC Food | Partial SNAP benefits to be added onto EBT cards by early next week in North Carolina, DHHS says - ABC11",ABC11
"Mon, 03 Nov 2025 15:01:00 GMT",Two African Women Voted Onto FIFPro Women’s World XI For First Time - Forbes,Forbes
"Tue, 04 Nov 2025 08:16:18 GMT",Risk vs reward if holding onto ECPG - Weekly Profit Report & Daily Volume Surge Trade Alerts - newser.com,newser.com
"Tue, 04 Nov 2025 04:53:08 GMT",Monday Sports Report: Little Falls Field Hockey is Moving onto the State Playoffs - WKTV,WKTV
"Sat, 01 Nov 2025 05:29:05 GMT",Commentary: Robin writes by Robin Garrison Leach — Dreaming about a hand to hold onto - Jacksonville Journal-Courier,Jacksonville Journal-Courier
"Mon, 03 Nov 2025 12:36:39 GMT",Seven Hills to alleviate Crossview Road traffic with right-turn lane onto Rockside Road - Cleveland.com,Cleveland.com
"Tue, 04 Nov 2025 06:35:33 GMT",Risk vs reward if holding onto CVEO - Portfolio Update Summary & Safe Capital Investment Plans - newser.com,newser.com
"Mon, 03 Nov 2025 10:00:00 GMT",Why the Bengals must hold onto Trey Hendrickson at the NFL trade deadline: Tim Bielik - Cleveland.com,Cleveland.com
"Sat, 01 Nov 2025 02:33:24 GMT",Fan Carrying American Flag Runs Onto Field at World Series Game 6 - Sports Illustrated,Sports Illustrated
"Mon, 03 Nov 2025 09:04:29 GMT",Risk vs reward if holding onto Locafy Limited - Weekly Gains Report & Daily Oversold Bounce Ideas - newser.com,newser.com
"Mon, 03 Nov 2025 09:14:39 GMT",Relative strength of Onto Innovation Inc. in sector analysis - Portfolio Value Summary & Weekly Market Pulse Updates - newser.com,newser.com
"Sat, 01 Nov 2025 20:38:01 GMT",Iowa HHS: SNAP benefits not being loaded onto cards despite federal ruling - KGAN,KGAN
"Mon, 03 Nov 2025 16:44:28 GMT",Winners and Losers: Kansas State hanging onto commits - On3,On3
"Mon, 03 Nov 2025 05:46:14 GMT",Risk vs reward if holding onto MMLP - Quarterly Earnings Summary & Safe Entry Zone Identification - newser.com,newser.com
"Mon, 03 Nov 2025 16:37:00 GMT",23-year-old woman dies after jumping out of pickup truck onto Interstate 95 in Port St.Lucie - WFLX,WFLX
