Date,Title,Source
"Thu, 16 Oct 2025 16:10:02 GMT",Will NXP (NXPI) Beat Estimates Again in Its Next Earnings Report? - Yahoo Finance,Yahoo Finance
"Fri, 17 Oct 2025 03:54:51 GMT",Risk vs reward if holding onto NXPI - July 2025 Technicals & Daily Stock Momentum Reports - newser.com,newser.com
"Tue, 14 Oct 2025 13:26:37 GMT",NXP Semiconductors (NXPI): Exploring Valuation After Trade War Fears Ease and Shares Rebound - simplywall.st,simplywall.st
"Sun, 12 Oct 2025 08:35:18 GMT","Aberdeen Group plc Sells 60,357 Shares of NXP Semiconductors N.V. $NXPI - MarketBeat",MarketBeat
"Tue, 14 Oct 2025 08:01:44 GMT",NXP Semiconductors N.V. (NASDAQ:NXPI) Receives $254.28 Average PT from Analysts - Defense World,Defense World
"Sun, 12 Oct 2025 07:23:17 GMT",Ameritas Advisory Services LLC Acquires New Holdings in NXP Semiconductors N.V. $NXPI - Defense World,Defense World
2025-10-16T18:10:02,Will NXP (NXPI) Beat Estimates Again in Its Next Earnings Report?,Yahoo
