Date,Title,Source
2025-10-17T11:02:50Z,US-China Trade Fight Hits Chinese Tech Stocks,Biztoc.com
"Mon, 20 Oct 2025 21:45:02 GMT",PDD Holdings Inc. Sponsored ADR (PDD) Exceeds Market Returns: Some Facts to Consider - Yahoo Finance,Yahoo Finance
"Tue, 21 Oct 2025 05:56:44 GMT",What the charts say about PDD Holdings Inc. Depositary Receipt today - Quarterly Profit Review & Technical Pattern Recognition Alerts - newser.com,newser.com
"Mon, 20 Oct 2025 17:01:49 GMT",PDD or GLBE: Which Is the Better Value Stock Right Now? - sharewise.com,sharewise.com
"Mon, 20 Oct 2025 16:18:40 GMT",Is PDD Holdings Inc. (Common Stock) (9PDA) stock worth holding before Fed meeting - 2025 Investor Takeaways & Reliable Entry Point Alerts - nchmf.gov.vn,nchmf.gov.vn
"Sun, 19 Oct 2025 06:22:44 GMT",PDD Holdings (NasdaqGS:PDD): Evaluating Valuation as Citi Research Cites Stronger Q3 Profit Outlook and Global Growth - simplywall.st,simplywall.st
"Mon, 20 Oct 2025 01:56:02 GMT",(PDD) Price Dynamics and Execution-Aware Positioning - news.stocktradersdaily.com,news.stocktradersdaily.com
"Mon, 20 Oct 2025 23:38:45 GMT",Is PDD Holdings Inc. (Common Stock) (9PDA) stock a buy during volatile markets - 2025 Growth vs Value & Risk Managed Investment Entry Signals - newser.com,newser.com
"Fri, 17 Oct 2025 03:22:56 GMT","Citi: Slightly Lowers PDD Holdings (PDD.US) Target Price to $167, Expects Q3 Profit to Potentially Exceed Estimates - 富途牛牛",富途牛牛
"Fri, 17 Oct 2025 03:22:00 GMT",Citi: PDD (PDD.US) TP Slightly Cut to US$167; 3Q Profit Expected to Beat - AASTOCKS.com,AASTOCKS.com
"Mon, 20 Oct 2025 05:38:23 GMT",Will PDD Holdings Inc. (Common Stock) (9PDA) stock deliver compounding returns - Market Activity Summary & Community Supported Trade Ideas - nchmf.gov.vn,nchmf.gov.vn
"Mon, 20 Oct 2025 19:28:57 GMT",How institutional ownership impacts PDD Holdings Inc. Depositary Receipt stock - Portfolio Growth Summary & Accurate Entry and Exit Point Alerts - newser.com,newser.com
"Sat, 18 Oct 2025 18:27:54 GMT",How PDD Holdings Inc. Depositary Receipt stock compares to industry benchmarks - CPI Data & Fast Moving Stock Trade Plans - nchmf.gov.vn,nchmf.gov.vn
"Mon, 20 Oct 2025 19:12:31 GMT",Earnings visualization tools for PDD Holdings Inc. Depositary Receipt - July 2025 Sentiment & Weekly Market Pulse Alerts - newser.com,newser.com
"Sat, 18 Oct 2025 15:19:01 GMT",Why PDD Holdings Inc. Depositary Receipt stock appeals to dividend seekers - 2025 Trading Volume Trends & Safe Swing Trade Setups - nchmf.gov.vn,nchmf.gov.vn
"Mon, 20 Oct 2025 23:41:34 GMT",Ranking PDD Holdings Inc. Depositary Receipt among high performing stocks via tools - 2025 Bull vs Bear & Daily Oversold Bounce Ideas - newser.com,newser.com
"Fri, 17 Oct 2025 22:37:46 GMT",23 AEEs placed as Inch X-Ens in PDD - Daily Excelsior,Daily Excelsior
"Thu, 16 Oct 2025 22:33:08 GMT",Govt reassigns addl charges in PDD - Daily Excelsior,Daily Excelsior
"Sat, 18 Oct 2025 09:33:03 GMT","CAT to issue "" Bailable Warrants"" against PDD Boss, if fails in compliance - Cross Town News",Cross Town News
2025-10-20T23:45:02,PDD Holdings Inc. Sponsored ADR (PDD) Exceeds Market Returns: Some Facts to Consider,Yahoo
2025-10-20T17:40:03,PDD or GLBE: Which Is the Better Value Stock Right Now?,Yahoo
