Date,Title,Source
2025-09-12T08:08:51Z,"Jones Financial Companies Lllp Purchases 8,927 Shares of MongoDB, Inc. $MDB",ETF Daily News
2025-09-12T07:34:48Z,"AQR Capital Management LLC Boosts Position in MongoDB, Inc. $MDB",ETF Daily News
2025-09-10T08:31:10Z,"MIRAE ASSET GLOBAL ETFS HOLDINGS Ltd. Purchases 4,692 Shares of MongoDB, Inc. $MDB",ETF Daily News
"Sun, 14 Sep 2025 06:56:15 GMT","Meiji Yasuda Life Insurance Co Has $701,000 Holdings in MongoDB, Inc. $MDB - MarketBeat",MarketBeat
"Tue, 09 Sep 2025 20:25:16 GMT",Options Flow: Should I average down on MDB Capital Holdings LLC stock - Market Performance Recap & Verified Short-Term Trading Plans - Lancaster City Council,Lancaster City Council
"Wed, 10 Sep 2025 15:51:57 GMT",ESG round-up: MDB climate finance hit record $137bn in 2024 - Responsible Investor,Responsible Investor
"Fri, 12 Sep 2025 13:56:33 GMT",MDB climate finance grew YoY 10% in 2024 to US$137 billion - The Asset,The Asset
"Wed, 10 Sep 2025 19:25:00 GMT","Noteworthy Wednesday Option Activity: CLOV, MDB, GSAT - Nasdaq",Nasdaq
"Tue, 09 Sep 2025 18:09:48 GMT",MongoDB (MDB): Evaluating Valuation After Q2 Earnings Beat and Raised Growth Outlook - simplywall.st,simplywall.st
"Sun, 14 Sep 2025 05:08:25 GMT","Jones Financial Companies Lllp Has $1.75 Million Stock Position in MongoDB, Inc. $MDB - MarketBeat",MarketBeat
"Sat, 13 Sep 2025 07:00:00 GMT","Acadian Asset Management LLC Buys 362,705 Shares of MongoDB, Inc. $MDB - MarketBeat",MarketBeat
"Sat, 13 Sep 2025 07:00:00 GMT",MongoDB (NASDAQ:MDB) Shares Up 1.4% - Still a Buy? - MarketBeat,MarketBeat
"Sat, 13 Sep 2025 07:00:00 GMT",MongoDB (NASDAQ:MDB) Trading 1.9% Higher - Still a Buy? - MarketBeat,MarketBeat
"Sat, 13 Sep 2025 07:00:00 GMT","Woodline Partners LP Increases Stock Position in MongoDB, Inc. $MDB - MarketBeat",MarketBeat
"Sat, 13 Sep 2025 07:00:00 GMT","MongoDB, Inc. $MDB Shares Bought by AQR Capital Management LLC - MarketBeat",MarketBeat
"Fri, 12 Sep 2025 07:00:00 GMT","Clearline Capital LP Takes Position in MongoDB, Inc. $MDB - MarketBeat",MarketBeat
"Fri, 12 Sep 2025 07:00:00 GMT",MongoDB (NASDAQ:MDB) Stock Price Down 1% - Here's Why - MarketBeat,MarketBeat
"Thu, 11 Sep 2025 07:00:00 GMT","Sender Co & Partners Inc. Purchases 5,604 Shares of MongoDB, Inc. $MDB - MarketBeat",MarketBeat
"Fri, 12 Sep 2025 00:45:25 GMT","MongoDB (NASDAQ:MDB) CAO Thomas Bull Sells 1,000 Shares - MarketBeat",MarketBeat
"Wed, 10 Sep 2025 01:30:00 GMT","Nomura Holdings Inc. Has $289,000 Stock Holdings in MongoDB, Inc. $MDB - MarketBeat",MarketBeat
"Tue, 09 Sep 2025 07:00:00 GMT","Amundi Grows Position in MongoDB, Inc. $MDB - MarketBeat",MarketBeat
"Tue, 09 Sep 2025 07:00:00 GMT","MongoDB, Inc. $MDB Stock Position Raised by Insight Holdings Group LLC - MarketBeat",MarketBeat
"Tue, 09 Sep 2025 07:00:00 GMT","Polar Asset Management Partners Inc. Reduces Stock Position in MongoDB, Inc. $MDB - MarketBeat",MarketBeat
"Tue, 09 Sep 2025 07:00:00 GMT","MongoDB, Inc. $MDB Holdings Raised by Curi RMB Capital LLC - MarketBeat",MarketBeat
"Tue, 09 Sep 2025 07:00:00 GMT","921,000 Shares in MongoDB, Inc. $MDB Purchased by Jericho Capital Asset Management L.P. - MarketBeat",MarketBeat
"Tue, 09 Sep 2025 16:50:58 GMT",Is MongoDB The Next Big AI Software Winner? Atlas Growth Signals Inflection (NASDAQ:MDB) - Seeking Alpha,Seeking Alpha
"Tue, 09 Sep 2025 12:33:07 GMT","MongoDB, Inc. (NASDAQ:MDB) Is Favoured by Institutional Owners Who Hold 87% of the Company - 富途牛牛",富途牛牛
"Tue, 09 Sep 2025 13:40:00 GMT","MDB climate finance hits record, majority flows to developing economies - Trend News Agency",Trend News Agency
"Sat, 13 Sep 2025 08:44:29 GMT","UBS AM A Distinct Business Unit of UBS Asset Management Americas LLC Boosts Stake in MongoDB, Inc. $MDB - MarketBeat",MarketBeat
"Sat, 13 Sep 2025 09:00:00 GMT","MIRAE ASSET GLOBAL ETFS HOLDINGS Ltd. Has $8.63 Million Stake in MongoDB, Inc. $MDB - MarketBeat",MarketBeat
"Thu, 11 Sep 2025 07:00:00 GMT","Infinitum Asset Management LLC Has $10.52 Million Stock Position in MongoDB, Inc. $MDB - MarketBeat",MarketBeat
"Thu, 11 Sep 2025 07:00:00 GMT","Nissay Asset Management Corp Japan ADV Has $3.22 Million Stake in MongoDB, Inc. $MDB - MarketBeat",MarketBeat
"Sun, 14 Sep 2025 05:53:08 GMT",How to forecast MDB Capital Holdings LLC trends using time series - Quarterly Performance Summary & Risk Adjusted Swing Trade Ideas - newser.com,newser.com
"Sat, 13 Sep 2025 22:17:04 GMT",How to recover losses in MDB Capital Holdings LLC stock - Portfolio Growth Summary & Long-Term Growth Stock Strategies - newser.com,newser.com
"Fri, 12 Sep 2025 07:35:30 GMT","AQR Capital Management LLC Has $7.20 Million Position in MongoDB, Inc. $MDB - Defense World",Defense World
"Tue, 09 Sep 2025 13:14:28 GMT","MDB Climate Finance Sees 10% Increase in 2024, Reaching Record $137 Billion - SSBCrack",SSBCrack
2025-09-11T23:05:00,"MongoDB, Inc. to Host Investor Session at MongoDB.local NYC 2025",Yahoo
2025-09-11T14:14:33,"MongoDB, Inc. (MDB) Presents At Piper Sandler 4th Annual Growth Frontiers Conference Transcript",SeekingAlpha
2025-09-09T16:23:41,"MongoDB, Inc. (MDB) Presents At Goldman Sachs Communacopia + Technology Conference 2025 Transcript",SeekingAlpha
