Date,Title,Source
2025-09-06T06:52:43Z,Walmart (NYSE:WMT) Price Target Raised to $125.00,ETF Daily News
2025-09-06T05:41:02Z,Walmart (NYSE:WMT) Trading Up 1.4% on Analyst Upgrade,ETF Daily News
2025-09-05T15:18:35Z,Tigress Financial Lifts Walmart (WMT) Price Target After Strong Q2 Results,Biztoc.com
2025-09-05T15:05:38Z,Tigress Financial Lifts Walmart (WMT) Price Target After Strong Q2 Results,Yahoo Entertainment
2025-09-05T14:55:13Z,What Is Going On With Walmart Stock On Friday?,Biztoc.com
2025-09-04T22:33:40Z,Here's How Much $100 Invested In Walmart 10 Years Ago Would Be Worth Today,Biztoc.com
2025-09-04T20:38:23Z,Jim Cramer Says Walmart Inc. (WMT) Made A Mistake When Discussing Tariffs,Yahoo Entertainment
2025-09-04T08:22:58Z,"C Douglas Mcmillon Sells 19,416 Shares of Walmart (NYSE:WMT) Stock",ETF Daily News
2025-09-03T00:58:08Z,Has its Sights on Amazon Prime Video as Streaming Wars Heats Up,Biztoc.com
"Sun, 07 Sep 2025 16:47:43 GMT","Walmart (NYSE:WMT) Stock Price Expected to Rise, Tigress Financial Analyst Says - MarketBeat",MarketBeat
"Thu, 04 Sep 2025 20:38:23 GMT",Jim Cramer Says Walmart Inc. (WMT) Made A Mistake When Discussing Tariffs - Yahoo Finance,Yahoo Finance
"Sun, 07 Sep 2025 17:38:02 GMT",Tigress Financial Lifts Walmart (WMT) Price Target After Strong Q2 Results - MSN,MSN
"Fri, 05 Sep 2025 20:16:53 GMT",Walmart snaps six straight sessions of gains (WMT:NYSE) - Seeking Alpha,Seeking Alpha
"Thu, 04 Sep 2025 17:39:11 GMT",Walmart (WMT) Launches Collector's Night Series For Hobby Enthusiasts - simplywall.st,simplywall.st
"Mon, 08 Sep 2025 02:55:45 GMT","Walmart Inc. (NYSE:WMT) Receives Average Recommendation of ""Buy"" from Brokerages - MarketBeat",MarketBeat
"Fri, 05 Sep 2025 17:17:28 GMT",Walmart (WMT) Expands With High-Tech Centers And Launches Collector's Night Series - Yahoo Finance,Yahoo Finance
"Sat, 06 Sep 2025 18:11:39 GMT",Citi Reaffirms Buy on Walmart (WMT) on Growth Momentum and E-Commerce Push - MSN,MSN
"Fri, 05 Sep 2025 20:32:51 GMT",Walmart CFO enters stock trading plan for 40K shares (WMT:NYSE) - Seeking Alpha,Seeking Alpha
"Sun, 07 Sep 2025 17:03:12 GMT","Amundi Purchases 173,057 Shares of Walmart Inc. $WMT - MarketBeat",MarketBeat
"Sun, 07 Sep 2025 15:28:16 GMT","Insider Selling: Walmart (NYSE:WMT) EVP Sells 2,200 Shares of Stock - MarketBeat",MarketBeat
"Sun, 07 Sep 2025 14:50:55 GMT",Curi RMB Capital LLC Trims Stock Holdings in Walmart Inc. $WMT - MarketBeat,MarketBeat
"Sat, 06 Sep 2025 21:29:20 GMT",Walmart (NYSE:WMT) Shares Down 1.1% - What's Next? - MarketBeat,MarketBeat
"Sun, 07 Sep 2025 13:43:12 GMT","Gotham Asset Management LLC Acquires 20,466 Shares of Walmart Inc. $WMT - MarketBeat",MarketBeat
"Sun, 07 Sep 2025 12:42:39 GMT",Sandler Capital Management Purchases New Stake in Walmart Inc. $WMT - MarketBeat,MarketBeat
"Sun, 07 Sep 2025 12:07:12 GMT",Walmart Inc. $WMT Shares Sold by Permanens Capital L.P. - MarketBeat,MarketBeat
"Sat, 06 Sep 2025 11:57:36 GMT",Nearwater Capital Markets Ltd Lowers Holdings in Walmart Inc. $WMT - MarketBeat,MarketBeat
"Sun, 07 Sep 2025 11:06:08 GMT",Plancorp LLC Boosts Stake in Walmart Inc. $WMT - MarketBeat,MarketBeat
"Sun, 07 Sep 2025 09:27:08 GMT",Walmart Inc. $WMT Shares Bought by Petrus Trust Company LTA - MarketBeat,MarketBeat
"Sun, 07 Sep 2025 07:36:30 GMT",Alliancebernstein L.P. Cuts Holdings in Walmart Inc. $WMT - MarketBeat,MarketBeat
"Sun, 07 Sep 2025 10:36:17 GMT",MIRAE ASSET GLOBAL ETFS HOLDINGS Ltd. Increases Stake in Walmart Inc. $WMT - MarketBeat,MarketBeat
"Sat, 06 Sep 2025 11:54:17 GMT",Walmart Inc. $WMT Stock Position Increased by Infusive Asset Management Inc. - MarketBeat,MarketBeat
"Sat, 06 Sep 2025 11:52:20 GMT",NewEdge Advisors LLC Grows Position in Walmart Inc. $WMT - MarketBeat,MarketBeat
"Sat, 06 Sep 2025 11:50:12 GMT",Walmart Inc. $WMT Shares Acquired by Integrated Wealth Concepts LLC - MarketBeat,MarketBeat
"Fri, 05 Sep 2025 12:20:52 GMT","Clark Capital Management Group Inc. Sells 157,548 Shares of Walmart Inc. $WMT - MarketBeat",MarketBeat
"Sat, 06 Sep 2025 10:26:31 GMT",Edmond DE Rothschild Holding S.A. Decreases Holdings in Walmart Inc. $WMT - MarketBeat,MarketBeat
"Sat, 06 Sep 2025 07:00:00 GMT","C Douglas Mcmillon Sells 19,416 Shares of Walmart (NYSE:WMT) Stock - MarketBeat",MarketBeat
"Fri, 05 Sep 2025 13:21:07 GMT",Hancock Whitney Corp Raises Position in Walmart Inc. $WMT - MarketBeat,MarketBeat
"Sat, 06 Sep 2025 12:40:51 GMT",Walmart Inc. $WMT Shares Sold by Nissay Asset Management Corp Japan ADV - MarketBeat,MarketBeat
"Fri, 05 Sep 2025 16:17:44 GMT",Walmart Stock (WMT) Fails to Go Bananas Despite OpenAI Deal to Train Millions of Workers - TipRanks,TipRanks
"Sat, 06 Sep 2025 09:02:00 GMT","Analysts Are Bullish on Top Consumer Goods Stocks: Walmart (WMT), Dollar Tree (DLTR) - The Globe and Mail",The Globe and Mail
"Fri, 05 Sep 2025 07:00:00 GMT",Flputnam Investment Management Co. Lowers Stock Position in Walmart Inc. $WMT - MarketBeat,MarketBeat
"Wed, 03 Sep 2025 16:21:00 GMT",New Analyst Forecast: $WMT Given 'Buy' Rating - Quiver Quantitative,Quiver Quantitative
"Sat, 06 Sep 2025 07:00:00 GMT",Banque Transatlantique SA Has $78.46 Million Position in Walmart Inc. $WMT - MarketBeat,MarketBeat
"Thu, 04 Sep 2025 12:35:55 GMT",Walmart (WMT) Taps Into AI Super Agents — Analysts Say It’s Leading the Pack - MSN,MSN
"Thu, 04 Sep 2025 12:09:18 GMT",Walmart Inc. $WMT Stock Position Raised by Bridgeway Capital Management LLC - MarketBeat,MarketBeat
"Thu, 04 Sep 2025 23:00:23 GMT",EP Wealth Advisors LLC Raises Position in Walmart Inc. $WMT - MarketBeat,MarketBeat
"Fri, 05 Sep 2025 13:15:13 GMT",Walmart Inc. $WMT Shares Sold by DoubleLine ETF Adviser LP - MarketBeat,MarketBeat
"Sat, 06 Sep 2025 07:00:00 GMT",Walmart Inc. $WMT Shares Acquired by Federation des caisses Desjardins du Quebec - MarketBeat,MarketBeat
"Thu, 04 Sep 2025 23:02:06 GMT",Walmart Inc. $WMT Shares Acquired by Focus Partners Advisor Solutions LLC - MarketBeat,MarketBeat
"Thu, 04 Sep 2025 23:58:21 GMT",Walmart Inc. $WMT Stock Position Increased by Unisphere Establishment - MarketBeat,MarketBeat
"Thu, 04 Sep 2025 20:40:50 GMT",‘U.S. Families Are Stressed’ – Walmart (WMT) Boss Warns of Lingering Tariff Impact on Shoppers - MSN,MSN
"Thu, 04 Sep 2025 10:08:42 GMT","Centric Wealth Management Purchases 5,800 Shares of Walmart Inc. $WMT - MarketBeat",MarketBeat
"Fri, 05 Sep 2025 11:58:51 GMT",Walmart Inc. $WMT Shares Sold by Concentric Capital Strategies LP - MarketBeat,MarketBeat
"Thu, 04 Sep 2025 07:00:00 GMT",Walmart Inc. $WMT Stock Position Reduced by Beck Mack & Oliver LLC - MarketBeat,MarketBeat
"Thu, 04 Sep 2025 23:58:22 GMT",Walmart Inc. $WMT Position Lessened by First Manhattan CO. LLC. - MarketBeat,MarketBeat
"Thu, 04 Sep 2025 10:08:43 GMT","Graham Capital Management L.P. Sells 27,107 Shares of Walmart Inc. $WMT - MarketBeat",MarketBeat
"Fri, 05 Sep 2025 07:00:00 GMT",Harris Associates L P Purchases New Position in Walmart Inc. $WMT - MarketBeat,MarketBeat
"Fri, 05 Sep 2025 07:00:00 GMT","First Financial Bankshares Inc Sells 5,805 Shares of Walmart Inc. $WMT - MarketBeat",MarketBeat
"Fri, 05 Sep 2025 07:00:00 GMT",Walmart Inc. $WMT Shares Sold by Ashton Thomas Securities LLC - MarketBeat,MarketBeat
"Thu, 04 Sep 2025 09:09:39 GMT",Benchstone Capital Management LP Reduces Stock Position in Walmart Inc. $WMT - MarketBeat,MarketBeat
"Thu, 04 Sep 2025 18:03:09 GMT",Calton & Associates Inc. Increases Stock Position in Walmart Inc. $WMT - MarketBeat,MarketBeat
"Thu, 04 Sep 2025 11:20:13 GMT",Walmart Inc. $WMT Stock Holdings Boosted by Advisors Asset Management Inc. - MarketBeat,MarketBeat
"Thu, 04 Sep 2025 23:02:04 GMT",Capital Investment Counsel LLC Trims Stake in Walmart Inc. $WMT - MarketBeat,MarketBeat
"Thu, 04 Sep 2025 17:04:53 GMT",‘U.S. Families Are Stressed’ – Walmart (WMT) Boss Warns of Lingering Tariff Impact on Shoppers - TipRanks,TipRanks
"Thu, 04 Sep 2025 11:39:43 GMT",Walmart Inc. $WMT Shares Sold by AQR Capital Management LLC - MarketBeat,MarketBeat
"Thu, 04 Sep 2025 10:08:42 GMT",Walmart Inc. $WMT Shares Sold by SRN Advisors LLC - MarketBeat,MarketBeat
"Thu, 04 Sep 2025 11:21:53 GMT","Atalanta Sosnoff Capital LLC Sells 179,987 Shares of Walmart Inc. $WMT - MarketBeat",MarketBeat
"Thu, 04 Sep 2025 18:22:56 GMT","Insider Sell: John Rainey Sells 2,200 Shares of Walmart Inc (WMT) - GuruFocus",GuruFocus
"Thu, 04 Sep 2025 07:13:09 GMT",Panagora Asset Management Inc. Decreases Holdings in Walmart Inc. $WMT - MarketBeat,MarketBeat
"Wed, 03 Sep 2025 12:04:20 GMT",Walmart Inc. $WMT Holdings Lifted by Adage Capital Partners GP L.L.C. - MarketBeat,MarketBeat
"Thu, 04 Sep 2025 07:00:00 GMT",Cyrus J. Lawrence LLC Trims Position in Walmart Inc. $WMT - MarketBeat,MarketBeat
"Wed, 03 Sep 2025 21:11:15 GMT","Night Squared LP Purchases Shares of 11,988 Walmart Inc. $WMT - MarketBeat",MarketBeat
"Wed, 03 Sep 2025 16:52:30 GMT",Holiday Cheer for Walmart (WMT) as Shoppers Look for Value Over Glitz - TipRanks,TipRanks
"Wed, 03 Sep 2025 07:00:00 GMT","Sassicaia Capital Advisers LLC Takes $296,000 Position in Walmart Inc. $WMT - MarketBeat",MarketBeat
"Wed, 03 Sep 2025 18:47:05 GMT",Walmart’s AI Super Agents Are The Threat Amazon Didn’t Price In - Walmart (NYSE:WMT) - Benzinga,Benzinga
"Wed, 03 Sep 2025 07:00:00 GMT",Kingdon Capital Management L.L.C. Invests $8.78 Million in Walmart Inc. $WMT - MarketBeat,MarketBeat
"Wed, 03 Sep 2025 15:16:00 GMT","Noteworthy ETF Inflows: SPMO, TSLA, WMT, PLTR - Nasdaq",Nasdaq
"Thu, 04 Sep 2025 20:40:48 GMT",Jim Cramer Says Walmart Inc. (WMT) Made A Mistake When Discussing Tariffs - Insider Monkey,Insider Monkey
"Fri, 05 Sep 2025 15:12:01 GMT",Tigress Financial Lifts Walmart (WMT) Price Target After Strong Q2 Results - Insider Monkey,Insider Monkey
2025-09-05T20:17:28,Walmart (WMT) Expands With High-Tech Centers And Launches Collector's Night Series,Yahoo
2025-09-05T18:05:38,Tigress Financial Lifts Walmart (WMT) Price Target After Strong Q2 Results,Yahoo
2025-09-05T03:30:26,Walmart's AI Super Agents Are The Threat Amazon Didn't Price In,Yahoo
2025-09-04T23:38:23,Jim Cramer Says Walmart Inc. (WMT) Made A Mistake When Discussing Tariffs,Yahoo
2025-09-04T20:28:38,Walmart (WMT) Launches Collector's Night Series For Hobby Enthusiasts,Yahoo
2025-09-04T15:37:09,Walmart Inc. (WMT) Presents At Barclays 18th Annual Global Consumer Staples Conference 2025 Transcript,SeekingAlpha
2025-09-03T16:45:16,Walmart Inc. (WMT) Presents At Goldman Sachs 32nd Annual Global Retailing Conference 2025 Transcript,SeekingAlpha
