Date,Title,Source
2025-11-22T11:59:50Z,Mistletoe Murders S02E06 720p AMZN WEB-DL H264-ForTheMrs,Rlsbb.to
2025-11-22T11:59:29Z,Mistletoe Murders S02E05 720p AMZN WEB-DL H264-ForTheMrs,Rlsbb.to
2025-11-22T11:49:34Z,Renovation Hunters S03 1080p AMZN WEB-DL H264-BurCyg,Rlsbb.to
2025-11-22T10:13:35Z,XXx Return Of Xander Cage 2017 1080p AMZN WEB-DL H264-PiRaTeS,Rlsbb.to
2025-11-22T01:38:39Z,Inside The Arrest S01E04 1080p AMZN WEB-DL H264-RAWR,Rlsbb.to
2025-11-22T00:45:01Z,"Final Trade: WMS, AMZN, META, ETH",Biztoc.com
2025-11-21T23:44:13Z,Yorkshire Air 999 S03E08 1080p AMZN WEB-DL H264-RAWR,Rlsbb.to
2025-11-21T23:18:01Z,AWS and HUMAIN Expand Partnership with NVIDIA AI Infrastructure and AWS AI Chip Deal to Drive Global AI Innovation,Antaranews.com
2025-11-21T21:29:37Z,Ek Radha Ek Meera 2025 1080p AMZN WEB-DL Marathi H264-DEXTER,Rlsbb.to
2025-11-21T20:51:39Z,Project Runway Canada S01E02 720p AMZN WEB-DL H264-RAWR,Rlsbb.to
2025-11-21T20:30:28Z,Blue Eyed Girl 2025 1080p AMZN WEB-DL H264-KyoGo,Rlsbb.to
2025-11-21T19:22:55Z,Jim Cramer Isn’t Worried by Analyst Downgrading Amazon.com (AMZN),Yahoo Entertainment
2025-11-21T18:09:44Z,Amazon’s (AMZN) Most Recent Round of Layoffs Hit Thousands of Engineers,Biztoc.com
2025-11-21T16:18:26Z,Caution Rises Around AWS as Redburn Lowers Amazon (AMZN) to Neutral,Biztoc.com
2025-11-21T15:22:27Z,Caution Rises Around AWS as Redburn Lowers Amazon (AMZN) to Neutral,Yahoo Entertainment
2025-11-21T15:14:15Z,Polar Park S01 1080p AMZN WEB-DL H264-playWEB,Rlsbb.to
2025-11-21T15:11:02Z,$1000 Invested In Amazon.com 15 Years Ago Would Be Worth This Much Today,Biztoc.com
2025-11-21T13:19:30Z,"Amazon (NASDAQ: AMZN) Stock Price Prediction in 2030: Bull, Bear, & Baseline Forecasts (Nov 21)",Biztoc.com
2025-11-21T13:14:52Z,Beneath 2025 1080p AMZN WEB-DL H264-SNAKE,Rlsbb.to
2025-11-21T12:54:03Z,31 Minutes One Hot Christmas 2025 720p AMZN WEB-DL H264-BiOMA,Rlsbb.to
2025-11-21T11:57:47Z,The Age Of Disclosure 2025 1080p AMZN WEB-DL H264-FLUX,Rlsbb.to
2025-11-21T10:02:58Z,Jim Cramer Says “Amazon’s a Company That Doesn’t Spend Unless It Needs To”,Yahoo Entertainment
2025-11-21T09:02:51Z,Killer Rental 2025 1080p AMZN WEB-DL H264-BobDobbs,Rlsbb.to
2025-11-21T08:25:26Z,Boxcutter 2024 720p AMZN WEB-DL H264-FLUX,Rlsbb.to
2025-11-21T08:20:54Z,Time Travel Is Dangerous 2024 1080p AMZN WEB-DL H264-FLUX,Rlsbb.to
2025-11-21T08:18:28Z,Altered 2025 1080p AMZN WEB-DL H264-FLUX,Rlsbb.to
2025-11-21T06:23:48Z,Diesel 2025 1080p AMZN WEB-DL H264-UNNiKUTTAN,Rlsbb.to
2025-11-21T04:02:50Z,Canadas Drag Race S06E01 720p AMZN WEB-DL H264-RAWR,Rlsbb.to
2025-11-20T23:11:31Z,The Bold And The Beautiful S39E49 720p AMZN WEB-DL H264-BLOOM,Rlsbb.to
2025-11-20T22:25:50Z,Salvage Hunters S20E19 720p AMZN WEB-DL H264-RAWR,Rlsbb.to
2025-11-20T22:04:34Z,"AWS Partners with Humain to Deploy 150,000 AI Chips in Saudi Arabia",Biztoc.com
2025-11-20T18:47:06Z,Lake Jesup Bonecrushers Revenge 2025 1080p AMZN WEB-DL H264-Gloft,Rlsbb.to
2025-11-20T17:26:54Z,Zara Larsson Up Close 2025 1080p AMZN WEB-DL H264-playWEB,Rlsbb.to
2025-11-20T16:30:05Z,The Challenge S41E17 720p AMZN WEB-DL H264-RAWR,Rlsbb.to
2025-11-20T16:11:16Z,THE CREEP TAPES S02E02 720p AMZN WEB-DL H264-RAWR,Rlsbb.to
2025-11-20T14:58:03Z,Microsoft and Amazon Got Hit With Huge Downgrades—Why I’d Buy Anyway,Biztoc.com
2025-11-20T14:24:17Z,Microsoft and Amazon Got Hit With Huge Downgrades—Why I’d Buy Anyway,Biztoc.com
2025-11-20T12:03:38Z,Carl Webers The Family Business S06E06 720p AMZN WEB-DL H264-RAWR,Rlsbb.to
2025-11-20T11:23:07Z,Forgetting Sarah Marshall 2008 1080p AMZN WEB-DL H264-GPRS,Rlsbb.to
2025-11-20T11:20:02Z,Adventure Time Fionna And Cake S02E05 1080p AMZN WEB-DL H264 DUAL-BiOMA,Rlsbb.to
2025-11-20T10:07:46Z,The Secret Santa Project 2025 1080p AMZN WEB-DL H264-GTM,Rlsbb.to
2025-11-20T09:04:26Z,Christmas On Every Page 2025 1080p AMZN WEB-DL H264-Kitsune,Rlsbb.to
2025-11-20T06:41:21Z,Mithra Mandali 2025 2160p AMZN WEB-DL H265-playWEB,Rlsbb.to
2025-11-20T06:26:26Z,The Boulet Brothers Dragula Titans S02E07 1080p AMZN WEB-DL H264-Kitsune,Rlsbb.to
2025-11-20T05:14:41Z,An Optimists Guide To The Planet S02E05 1080p AMZN WEB-DL H264-Kitsune,Rlsbb.to
2025-11-20T03:15:26Z,Amazon (AMZN) Gets Vote of Confidence After Rolling Out New AI Advertising Agent,Yahoo Entertainment
2025-11-19T22:41:35Z,MasterChef Canada S08E07 1080p AMZN WEB-DL H264-Kitsune,Rlsbb.to
2025-11-19T17:42:32Z,The Ghost Inside My Child S01-S02 1080p AMZN WEB-DL H264-playWEB,Rlsbb.to
2025-11-19T17:09:24Z,The Challenge S41E17 720p AMZN WEB-DL H264-Kitsune,Rlsbb.to
2025-11-19T16:23:52Z,AI data center projects drive up memory chip prices. Here's why.,Yahoo Entertainment
2025-11-19T15:58:10Z,Where Will Amazon Stock Trade in One Year — And What Will Drive AMZN?,Biztoc.com
2025-11-19T15:48:42Z,Where Will Amazon Stock Trade in One Year — And What Will Drive AMZN?,Barchart.com
2025-11-19T15:41:52Z,November 2025 720p AMZN WEB-DL H264-BiOMA,Rlsbb.to
2025-11-19T15:41:33Z,The Traitors Canada S03E05 720p AMZN WEB-DL H264-NTb,Rlsbb.to
2025-11-19T14:36:12Z,Aussie Shore S02E10 720p AMZN WEB-DL H264-RAWR,Rlsbb.to
2025-11-19T13:43:40Z,Amazon Stock (NASDAQ: AMZN) Price Prediction and Forecast 2025-2030 for November 19,Biztoc.com
2025-11-19T12:13:23Z,High-Probability AMZN Iron Condor with 13% Return Potential,Biztoc.com
2025-11-19T12:00:02Z,High-Probability AMZN Iron Condor with 13% Return Potential,Barchart.com
2025-11-19T08:51:32Z,Top Chef Canada S12E06 1080p AMZN WEB-DL H264-RAWR,Rlsbb.to
2025-11-19T06:12:24Z,One By One 2024 1080p AMZN WEB-DL H264-playWEB,Rlsbb.to
2025-11-19T05:54:45Z,"Amazon, Microsoft under EU probe for cloud computing services (AMZN:NASDAQ)",Biztoc.com
2025-11-19T05:32:25Z,The Real Housewives of Salt Lake City S06E10 720p AMZN WEB-DL H264-NTb,Rlsbb.to
2025-11-18T23:39:46Z,Hudson and Rex S08E07 720p AMZN WEB-DL H264-NTb,Rlsbb.to
"Fri, 21 Nov 2025 21:00:00 GMT",AMZN - Amazon.com Inc Stock Price and Quote - Finviz,Finviz
"Tue, 18 Nov 2025 22:25:40 GMT",Why Amazon (AMZN) Shares Are Trading Lower Today - Yahoo Finance,Yahoo Finance
"Thu, 20 Nov 2025 14:54:11 GMT",Amazon: OpenAI Deal Is A Game Changer (NASDAQ:AMZN) - Seeking Alpha,Seeking Alpha
"Thu, 20 Nov 2025 18:46:38 GMT",Amazon Stock (AMZN) Falls despite Plan to Build New $3B Data Center in Mississippi - TipRanks,TipRanks
"Fri, 21 Nov 2025 08:00:00 GMT",Why Is The Amazon Stock Falling? Real Reasons Behind AMZN Drop - EBC Financial Group,EBC Financial Group
"Sat, 22 Nov 2025 16:37:00 GMT",$AMZN stock fell 6% this week. Here's what we see in our data. - Quiver Quantitative,Quiver Quantitative
"Fri, 21 Nov 2025 00:29:45 GMT",Amazon.com (NASDAQ:AMZN) Shares Down 2.5% - Here's Why - MarketBeat,MarketBeat
"Wed, 19 Nov 2025 01:30:06 GMT",Amazon: A Google-Like Run Is Imminent (NASDAQ:AMZN) - Seeking Alpha,Seeking Alpha
"Fri, 21 Nov 2025 15:22:27 GMT",Caution Rises Around AWS as Redburn Lowers Amazon (AMZN) to Neutral - Yahoo Finance,Yahoo Finance
"Fri, 21 Nov 2025 19:22:55 GMT",Jim Cramer Isn’t Worried by Analyst Downgrading Amazon.com (AMZN) - Yahoo Finance,Yahoo Finance
"Fri, 21 Nov 2025 23:15:00 GMT","Final Trade: WMS, AMZN, META, ETH - CNBC",CNBC
"Sat, 22 Nov 2025 16:38:03 GMT",Will Analyst Doubts on AI Profitability Shift Amazon’s (AMZN) Long-Term Cloud Growth Narrative? - simplywall.st,simplywall.st
"Thu, 20 Nov 2025 14:55:02 GMT",Here's Why Amazon (AMZN) Looks Ripe for Bottom Fishing - Yahoo Finance,Yahoo Finance
"Thu, 20 Nov 2025 03:15:00 GMT",Amazon (AMZN) Gets Vote of Confidence After Rolling Out New AI Advertising Agent - Yahoo Finance,Yahoo Finance
"Sat, 22 Nov 2025 17:00:07 GMT",SA Asks: Can Amazon's Zoox catch up to Alphabet's Waymo? (AMZN:NASDAQ) - Seeking Alpha,Seeking Alpha
"Sun, 23 Nov 2025 04:24:04 GMT",(AMZN) Dynamic Trading Report (AMZN:CA) - news.stocktradersdaily.com,news.stocktradersdaily.com
"Wed, 19 Nov 2025 15:30:00 GMT",Amazon's Breakout Is Here - Outsized AWS & Advertising Performance (NASDAQ:AMZN) - Seeking Alpha,Seeking Alpha
"Fri, 21 Nov 2025 15:01:31 GMT",DASH vs. AMZN: Which E-Commerce Delivery Stock Is the Better Buy Now? - Zacks Investment Research,Zacks Investment Research
"Sat, 22 Nov 2025 13:54:41 GMT","William Allan Corp Purchases 1,867 Shares of Amazon.com, Inc. $AMZN - MarketBeat",MarketBeat
"Thu, 20 Nov 2025 14:03:00 GMT",Amazon Stock (AMZN) Opinions on AI Investments and AWS Growth - Quiver Quantitative,Quiver Quantitative
"Thu, 20 Nov 2025 16:53:19 GMT",Amazon: Scoop Up This Bargain Hiding In Plain Sight Now (NASDAQ:AMZN) - Seeking Alpha,Seeking Alpha
2025-11-21T20:22:55,Jim Cramer Isn’t Worried by Analyst Downgrading Amazon.com (AMZN),Yahoo
2025-11-21T19:39:03,This Is the Clearest Indication Amazon Is Going to Be the Next Decade’s Big AI Winner,Yahoo
2025-11-21T19:15:29,"Final Trade: WMS, AMZN, META, ETH",CNBC
2025-11-21T19:11:07,"Tesla sued over 2023 crash, Amazon layoffs impact engineers",Yahoo
2025-11-21T16:56:00,DASH vs. AMZN: Which E-Commerce Delivery Stock Is the Better Buy Now?,Yahoo
2025-11-21T12:38:25,"4 Reasons Stocks Plunged And ""The Big Buy Indicator"" That Was Just Triggered",SeekingAlpha
2025-11-21T05:30:49,Amazon Is Sending Automatic Refunds To Millions After Record $2.5 Billion FTC Settlement: Here's What You Must Do To Claim Yours,Yahoo
2025-11-20T15:55:02,Here's Why Amazon (AMZN) Looks Ripe for Bottom Fishing,Yahoo
2025-11-20T15:49:17,Microsoft and Amazon Got Hit With Huge Downgrades—Why I’d Buy Anyway,Yahoo
2025-11-22T19:20:09,Black Friday Sale List,Reddit/r/stocks
2025-11-22T07:28:41,Favorite correction buys,Reddit/r/stocks
