Date,Title,Source
2025-09-04T08:58:00Z,Gent’s Cape Verde winger set for move to Maccabi Tel Aviv,Getfootballnewsbene.com
2025-09-03T14:43:00Z,Polish youth international set to swap PSV for Westerlo,Getfootballnewsbene.com
"Sat, 06 Sep 2025 08:53:44 GMT",Is Haleon (LON:HLN) a Buy Amid Mixed Signals of Profit Growth and Insider Selling? - AInvest,AInvest
"Wed, 03 Sep 2025 08:11:48 GMT","Deutsche Bank AG Acquires 2,276 Shares of Haleon PLC Sponsored ADR $HLN - Defense World",Defense World
2025-09-02T23:32:32,Haleon plc (HLN) Presents at Barclays 18th Annual Global Consumer Staples Conference 2025 - Slideshow,SeekingAlpha
2025-09-02T16:31:10,Haleon Plc (HLN) Presents At Barclays 18th Annual Global Consumer Staples Conference 2025 Transcript,SeekingAlpha
