Date,Title,Source
"Sun, 26 Oct 2025 02:28:13 GMT",Why Stryker Corporation (SYK) stock could outperform next year - Portfolio Return Summary & Verified Swing Trading Watchlists - newser.com,newser.com
"Sat, 25 Oct 2025 15:11:26 GMT",Stryker (SYK): Exploring Valuation After Trauma Device Platform Expansions and Strong Organic Growth - Yahoo Finance,Yahoo Finance
"Fri, 24 Oct 2025 14:37:07 GMT",What Stryker (SYK)'s Latest Trauma Tech Unveiling Means For Shareholders - simplywall.st,simplywall.st
"Wed, 22 Oct 2025 18:21:00 GMT",New Analyst Forecast: $SYK Given $453.0 Price Target - Quiver Quantitative,Quiver Quantitative
"Sat, 25 Oct 2025 00:09:03 GMT","Hybrid Brownian SYK-Hubbard Model Exhibits Spectral Transitions, Signaling Mottness and Quantum Chaos - Quantum Zeitgeist",Quantum Zeitgeist
"Sat, 25 Oct 2025 21:15:55 GMT",Is Stryker Corporation (SYK) stock supported by strong fundamentals - July 2025 Drop Watch & Accurate Intraday Trading Signals - newser.com,newser.com
"Wed, 22 Oct 2025 17:36:55 GMT",Stryker (SYK) Receives Overweight Rating and Raised Price Target from Barclays | SYK Stock News - GuruFocus,GuruFocus
"Fri, 24 Oct 2025 13:00:00 GMT",Will SYK's Q3 Results Reflect MedSurg Strength & Rebound in Orthopaedics? - Yahoo Finance,Yahoo Finance
"Wed, 22 Oct 2025 18:59:36 GMT",Stryker Corporation's (NYSE:SYK) Fundamentals Look Pretty Strong: Could The Market Be Wrong About The Stock? - 富途牛牛,富途牛牛
"Sat, 25 Oct 2025 14:46:11 GMT",How SYK stock performs in easing cycles - 2025 Price Targets & Smart Money Movement Alerts - newser.com,newser.com
"Tue, 21 Oct 2025 11:28:08 GMT",Stryker (SYK): Evaluating Valuation After Modest Recent Returns - simplywall.st,simplywall.st
"Fri, 24 Oct 2025 20:29:40 GMT",Is Stryker Corporation (SYK) stock supported by strong fundamentals - Weekly Risk Summary & Free Expert Approved Momentum Trade Ideas - newser.com,newser.com
"Fri, 24 Oct 2025 19:20:04 GMT",How big funds are accumulating SYK stock - Risk Management & Advanced Technical Signal Analysis - newser.com,newser.com
"Fri, 24 Oct 2025 23:00:55 GMT",Why Stryker Corporation (SYK) stock could outperform next year - Trade Risk Report & Low Risk High Reward Ideas - newser.com,newser.com
"Fri, 24 Oct 2025 20:55:36 GMT",How big funds are accumulating SYK stock - Portfolio Update Report & Weekly High Conviction Trade Ideas - newser.com,newser.com
"Thu, 23 Oct 2025 08:30:32 GMT",How big funds are accumulating SYK stock - Portfolio Gains Summary & Reliable Price Breakout Alerts - newser.com,newser.com
"Fri, 24 Oct 2025 07:57:20 GMT",Why Stryker Corporation (SYK) stock could outperform next year - Quarterly Risk Review & Free Expert Approved Momentum Trade Ideas - newser.com,newser.com
"Thu, 23 Oct 2025 10:24:33 GMT",Is Stryker Corporation (SYK) stock cheap vs fundamentals - 2025 Pullback Review & Daily Stock Trend Reports - newser.com,newser.com
"Fri, 24 Oct 2025 19:53:03 GMT",What drives Stryker Corporation SYK stock price - Stock Buy Signals & Add These Before Everyone Else Does - earlytimes.in,earlytimes.in
"Wed, 22 Oct 2025 03:24:06 GMT",Why Stryker Corporation (SYK) stock could outperform next year - July 2025 Macro Moves & Daily Growth Stock Tips - newser.com,newser.com
2025-10-23T02:05:50,Barclays Maintains Stryker (SYK) Overweight Recommendation,Fintel
2025-10-21T15:16:00,Buy 3 Wide Moat Stocks to Enhance Your Portfolio Returns in Q4,Yahoo
