Date,Title,Source
2025-11-15T06:10:36Z,BofA Reaffirms Bullish Stance on Alphabet (GOOGL) As AI And Cloud Growth Accelerate,Yahoo Entertainment
2025-11-15T03:53:46Z,"NVDA, MSFT, GOOGL: Ray Dalio’s Bridgewater Loses Confidence in Big Tech, Trims Stakes in Q3",Biztoc.com
2025-11-14T22:08:21Z,"Druckenmiller Opens Position In Amazon, Closes Microsoft — Here's More Of Duquesne's Biggest Q3 Moves",Biztoc.com
2025-11-14T21:57:11Z,Barchart’s Technical Indicators Are Flashing ‘Buy’ as Warren Buffett Loads Up on 17.8 Million Shares of Google Stock,Biztoc.com
2025-11-14T21:53:30Z,Barchart’s Technical Indicators Are Flashing ‘Buy’ as Warren Buffett Loads Up on 17.8 Million Shares of Google Stock,Barchart.com
2025-11-14T21:43:36Z,Warren Buffett's Berkshire Hathaway bets on Alphabet,Yahoo Entertainment
2025-11-14T21:31:36Z,Google to invest $40 billion in new data centers in Texas,Yahoo Entertainment
2025-11-13T21:56:14Z,Palantir Stock vs. Alphabet Stock: Wall Street Says to Buy Only One,Biztoc.com
2025-11-13T14:29:43Z,"Nancy Pelosi Is Retiring up 595%, but She’s Still Holding on to These 3 Stocks",Biztoc.com
2025-11-12T18:09:59Z,"Alphabet’s (GOOGL) YouTube Didn’t Overpay For The Sunday Ticket, Believes Jim Cramer",Yahoo Entertainment
2025-11-12T16:33:32Z,Ex-Google (GOOGL) CEO Eric Schmidt Warns Free Chinese AI Could Erode U.S. Tech Lead,Biztoc.com
2025-11-12T08:44:36Z,"Alphabet: Keeps Delivering, So Deserves To Keep Spending",Biztoc.com
2025-11-11T17:52:37Z,Alphabet Generates Strong FCF and If It Continues GOOGL Stock is 40% Undervalued,Biztoc.com
2025-11-11T17:42:26Z,Alphabet Generates Strong FCF and If It Continues GOOGL Stock is 40% Undervalued,Barchart.com
2025-11-11T09:08:54Z,"Meta's,Tesla's, Alphabet's and Amazon are part of Zacks Earnings Preview",Biztoc.com
2025-11-11T09:08:48Z,"Zacks Investment Ideas feature highlights Nvidia, Tesla, Alphabet's and Baidu",Biztoc.com
"Fri, 14 Nov 2025 21:41:05 GMT",Berkshire Hathaway Reveals $4.3 Billion Stake in Alphabet Stock (GOOGL) - TipRanks,TipRanks
"Sat, 15 Nov 2025 06:10:00 GMT",BofA Reaffirms Bullish Stance on Alphabet (GOOGL) As AI And Cloud Growth Accelerate - Yahoo Finance,Yahoo Finance
"Sun, 16 Nov 2025 06:04:02 GMT",What institutional flow reveals about GOOGL - Portfolio Growth Summary & Community Supported Trade Ideas - newser.com,newser.com
"Fri, 14 Nov 2025 21:14:00 GMT",Fund Update: New $4.3B $GOOGL stock position opened by BERKSHIRE HATHAWAY INC - Quiver Quantitative,Quiver Quantitative
"Sat, 15 Nov 2025 03:30:00 GMT",Warren Buffett's Berkshire Hathaway reveals new $4.3 billion Alphabet (GOOGL) stock holding - Shacknews,Shacknews
"Tue, 11 Nov 2025 17:42:26 GMT",Alphabet Generates Strong FCF and If It Continues GOOGL Stock is 40% Undervalued - Barchart.com,Barchart.com
"Fri, 14 Nov 2025 15:15:00 GMT",Google: Holding A High Market Share In Search - Seeking Alpha,Seeking Alpha
"Sat, 15 Nov 2025 12:26:41 GMT",Alphabet (GOOGL) Stock: Google Commits $40 Billion to Texas Data Centers in AI Push - CoinCentral,CoinCentral
"Thu, 13 Nov 2025 23:10:00 GMT","Final Trade: GOOGL, UPS, DIS, F - CNBC",CNBC
"Sat, 15 Nov 2025 13:56:29 GMT",Alphabet Inc. $GOOGL Shares Sold by W.G. Shaheen & Associates DBA Whitney & Co - MarketBeat,MarketBeat
"Fri, 14 Nov 2025 14:00:05 GMT",Alphabet Inc. (GOOGL) is Attracting Investor Attention: Here is What You Should Know - Yahoo Finance,Yahoo Finance
"Sat, 15 Nov 2025 06:38:58 GMT",Is Roundhill ETF Trust Roundhill GOOGL stock inflation resilient - July 2025 Spike Watch & Weekly Top Performers Watchlists - newser.com,newser.com
"Thu, 13 Nov 2025 14:05:00 GMT",The Google Enterprise Story Finally Feels Real (GOOG) (GOOGL) - Seeking Alpha,Seeking Alpha
"Fri, 14 Nov 2025 18:26:46 GMT",Google (GOOGL) Ordered to Pay €573M to Two German Websites - TipRanks,TipRanks
"Sat, 15 Nov 2025 13:56:28 GMT",Alphabet Inc. $GOOGL Shares Acquired by Texas Bank & Trust Co - MarketBeat,MarketBeat
"Wed, 12 Nov 2025 18:09:59 GMT","Alphabet’s (GOOGL) YouTube Didn’t Overpay For The Sunday Ticket, Believes Jim Cramer - Yahoo Finance",Yahoo Finance
"Fri, 14 Nov 2025 21:45:46 GMT","Buffett's Berkshire Hathaway adds Google stake, exits D.R. Horton, among other Q3 trades (BRK.B:NYSE) - Seeking Alpha",Seeking Alpha
"Wed, 12 Nov 2025 17:32:00 GMT",Alphabet Inc. Stock (GOOGL) Opinions on AI Competition and Cloud Growth - Quiver Quantitative,Quiver Quantitative
"Sat, 15 Nov 2025 12:21:40 GMT",Is Roundhill ETF Trust Roundhill GOOGL stock inflation resilient - Trade Volume Summary & Consistent Profit Alerts - newser.com,newser.com
"Fri, 14 Nov 2025 06:35:17 GMT",What institutional flow reveals about GOOGL - Trade Risk Summary & Low Drawdown Trading Strategies - newser.com,newser.com
"Sat, 15 Nov 2025 13:56:29 GMT",Alphabet Inc. $GOOGL Shares Sold by Torray Investment Partners LLC - MarketBeat,MarketBeat
"Fri, 14 Nov 2025 13:30:15 GMT","Alphabet Rejects EU’s AdTech Breakup, Offers Changes; GOOGL Stock Falls - TipRanks",TipRanks
"Sat, 15 Nov 2025 13:56:29 GMT",Telos Capital Management Inc. Has $19.82 Million Holdings in Alphabet Inc. $GOOGL - MarketBeat,MarketBeat
"Sat, 15 Nov 2025 13:56:29 GMT",Alphabet Inc. $GOOGL Position Reduced by Wellington Shields Capital Management LLC - MarketBeat,MarketBeat
"Sat, 15 Nov 2025 13:56:28 GMT",Verity Asset Management Inc. Takes Position in Alphabet Inc. $GOOGL - MarketBeat,MarketBeat
"Sat, 15 Nov 2025 08:59:14 GMT","Burney Co. Sells 32,040 Shares of Alphabet Inc. $GOOGL - MarketBeat",MarketBeat
"Sat, 15 Nov 2025 13:43:24 GMT",Google (GOOGL) Updates AI Shopping Features in Time for the Holidays - MSN,MSN
"Sat, 15 Nov 2025 10:48:45 GMT",Alphabet Inc. $GOOGL Stock Holdings Lessened by EPG Wealth Management LLC - MarketBeat,MarketBeat
"Fri, 14 Nov 2025 15:50:08 GMT",Google stock split: What next for GOOGL shares? - Capital.com,Capital.com
"Thu, 13 Nov 2025 11:40:53 GMT",Did Alphabet's (GOOGL) Coral NPU and AI Partnerships Just Shift Its Edge Computing Narrative? - simplywall.st,simplywall.st
"Sat, 15 Nov 2025 10:48:45 GMT","Sigma Planning Corp Sells 3,483 Shares of Alphabet Inc. $GOOGL - MarketBeat",MarketBeat
"Sat, 15 Nov 2025 10:48:45 GMT",Alphabet Inc. $GOOGL Shares Acquired by Machina Capital S.A.S. - MarketBeat,MarketBeat
"Sat, 15 Nov 2025 10:48:45 GMT","K.J. Harrison & Partners Inc Sells 3,996 Shares of Alphabet Inc. $GOOGL - MarketBeat",MarketBeat
"Sat, 15 Nov 2025 10:48:45 GMT",Alphabet Inc. $GOOGL Shares Sold by South Dakota Investment Council - MarketBeat,MarketBeat
"Sat, 15 Nov 2025 10:48:44 GMT",Freestone Capital Holdings LLC Lowers Stake in Alphabet Inc. $GOOGL - MarketBeat,MarketBeat
"Thu, 13 Nov 2025 12:25:00 GMT","Waymo Expands To Highways, Snowy Cities, Adds New CFO. Is Google Stock A Buy? - Investor's Business Daily",Investor's Business Daily
"Sat, 15 Nov 2025 10:48:45 GMT",iA Global Asset Management Inc. Raises Stake in Alphabet Inc. $GOOGL - MarketBeat,MarketBeat
"Thu, 13 Nov 2025 18:24:29 GMT",Alphabet Inc. (GOOGL) Q3 9/25 Earnings Review (NASDAQ:GOOGL) - Seeking Alpha,Seeking Alpha
"Sat, 15 Nov 2025 08:59:13 GMT",Alphabet Inc. $GOOGL Stake Lifted by Colrain Capital LLC - MarketBeat,MarketBeat
"Fri, 14 Nov 2025 00:22:34 GMT","Final Trade: GOOGL, UPS, DIS, F - MSN",MSN
"Sat, 15 Nov 2025 08:59:14 GMT",Carson Advisory Inc. Purchases New Holdings in Alphabet Inc. $GOOGL - MarketBeat,MarketBeat
"Fri, 14 Nov 2025 14:19:00 GMT",GOOGL’s Market Challenges: What’s Next? - timothysykes.com,timothysykes.com
"Fri, 14 Nov 2025 22:57:15 GMT","NVDA, MSFT, GOOGL: Ray Dalio’s Bridgewater Loses Confidence in Big Tech, Trims Stakes in Q3 - TipRanks",TipRanks
"Fri, 14 Nov 2025 10:36:46 GMT",Plato Investment Management Ltd Raises Holdings in Alphabet Inc. $GOOGL - MarketBeat,MarketBeat
"Thu, 13 Nov 2025 14:32:02 GMT",Too Late To Buy Alphabet? -- Nope (NASDAQ:GOOGL) - Seeking Alpha,Seeking Alpha
"Fri, 14 Nov 2025 14:04:26 GMT","Westwood Wealth Management Purchases 5,760 Shares of Alphabet Inc. $GOOGL - MarketBeat",MarketBeat
"Fri, 14 Nov 2025 10:40:45 GMT",Is Roundhill ETF Trust Roundhill GOOGL stock inflation resilient - Market Trend Summary & Accurate Trade Setup Notifications - newser.com,newser.com
"Fri, 14 Nov 2025 23:35:23 GMT",What institutional flow reveals about GOOGL - Treasury Yields & AI Powered Market Entry Ideas - newser.com,newser.com
"Fri, 14 Nov 2025 14:04:29 GMT",Welch & Forbes LLC Decreases Stake in Alphabet Inc. $GOOGL - MarketBeat,MarketBeat
"Fri, 14 Nov 2025 14:04:28 GMT","Versor Investments LP Buys 5,838 Shares of Alphabet Inc. $GOOGL - MarketBeat",MarketBeat
"Fri, 14 Nov 2025 12:28:18 GMT",Alphabet Inc. $GOOGL Stock Position Lowered by SS&H Financial Advisors Inc. - MarketBeat,MarketBeat
"Fri, 14 Nov 2025 13:33:45 GMT","TIAA Trust National Association Purchases 30,205 Shares of Alphabet Inc. $GOOGL - MarketBeat",MarketBeat
"Fri, 14 Nov 2025 14:04:27 GMT",Alphabet Inc. $GOOGL Shares Purchased by Zweig DiMenna Associates LLC - MarketBeat,MarketBeat
"Fri, 14 Nov 2025 10:36:46 GMT",Alphabet Inc. $GOOGL Shares Bought by Integrity Financial Corp WA - MarketBeat,MarketBeat
"Fri, 14 Nov 2025 16:37:05 GMT",Automated trading signals detected on GOOGL - Sell Signal & High Yield Stock Recommendations - newser.com,newser.com
"Sat, 15 Nov 2025 04:10:22 GMT","GOOGL News Today, Nov 15: Surge in Alphabet Stock Volume Marks Market - Meyka",Meyka
"Fri, 14 Nov 2025 10:36:46 GMT","Gilbert & Cook Inc. Takes $799,000 Position in Alphabet Inc. $GOOGL - MarketBeat",MarketBeat
"Thu, 13 Nov 2025 18:26:01 GMT",Is Roundhill ETF Trust Roundhill GOOGL stock inflation resilient - July 2025 Opening Moves & High Conviction Buy Zone Alerts - newser.com,newser.com
"Fri, 14 Nov 2025 08:55:48 GMT",Cambiar Investors LLC Has $59.40 Million Position in Alphabet Inc. $GOOGL - MarketBeat,MarketBeat
"Fri, 14 Nov 2025 10:36:47 GMT",Greater Midwest Financial Group LLC Reduces Holdings in Alphabet Inc. $GOOGL - MarketBeat,MarketBeat
"Fri, 14 Nov 2025 13:54:42 GMT",Sumitomo Life Insurance Co. Boosts Stake in Alphabet Inc. $GOOGL - MarketBeat,MarketBeat
"Fri, 14 Nov 2025 08:55:48 GMT","Eleva Capital SAS Acquires Shares of 17,141 Alphabet Inc. $GOOGL - MarketBeat",MarketBeat
"Fri, 14 Nov 2025 15:15:44 GMT","GOOGL, NVDA, TSLA: Cathie Wood’s ARK Invest Loads Up Big on Mag 7 Stocks in Q3 - TipRanks",TipRanks
"Thu, 13 Nov 2025 08:49:04 GMT",Alphabet Inc. $GOOGL Stock Holdings Reduced by Bordeaux Wealth Advisors LLC - MarketBeat,MarketBeat
"Fri, 14 Nov 2025 11:21:00 GMT",Google stock split: What next for GOOGL shares? - Capital.com,Capital.com
"Thu, 13 Nov 2025 10:51:27 GMT","Saxony Capital Management LLC Makes New $468,000 Investment in Alphabet Inc. $GOOGL - MarketBeat",MarketBeat
"Thu, 13 Nov 2025 23:39:42 GMT",Automated trading signals detected on GOOGL - Weekly Earnings Recap & High Win Rate Trade Alerts - newser.com,newser.com
"Thu, 13 Nov 2025 08:49:04 GMT","Balentine LLC Sells 1,841 Shares of Alphabet Inc. $GOOGL - MarketBeat",MarketBeat
"Wed, 12 Nov 2025 14:08:17 GMT",Ex-Google (GOOGL) CEO Eric Schmidt Warns Free Chinese AI Could Erode U.S. Tech Lead - TipRanks,TipRanks
"Thu, 13 Nov 2025 08:49:03 GMT","Bridgewealth Advisory Group LLC Purchases Shares of 1,845 Alphabet Inc. $GOOGL - MarketBeat",MarketBeat
"Fri, 14 Nov 2025 00:11:12 GMT",Alphabet (NASDAQ:GOOGL) Trading Down 2.8% - Here's Why - MarketBeat,MarketBeat
"Thu, 13 Nov 2025 10:51:27 GMT",Alphabet Inc. $GOOGL Stock Holdings Lifted by NWK Group Inc. - MarketBeat,MarketBeat
"Thu, 13 Nov 2025 10:51:26 GMT",Haven Private LLC Grows Stock Holdings in Alphabet Inc. $GOOGL - MarketBeat,MarketBeat
"Thu, 13 Nov 2025 10:51:27 GMT",Great Lakes Retirement Inc. Raises Stake in Alphabet Inc. $GOOGL - MarketBeat,MarketBeat
"Thu, 13 Nov 2025 10:51:28 GMT",Alphabet Inc. $GOOGL Stock Position Boosted by Linscomb Wealth Inc. - MarketBeat,MarketBeat
"Wed, 12 Nov 2025 05:10:45 GMT","Alphabet: Keeps Delivering, So Deserves To Keep Spending (NASDAQ:GOOGL) - Seeking Alpha",Seeking Alpha
"Thu, 13 Nov 2025 10:51:27 GMT",Lifeworks Advisors LLC Sells 920 Shares of Alphabet Inc. $GOOGL - MarketBeat,MarketBeat
"Wed, 12 Nov 2025 16:34:11 GMT","Google’s (GOOGL) Waymo Offers Highway Robotaxi Rides in San Francisco, L.A. and Phoenix - TipRanks",TipRanks
"Thu, 13 Nov 2025 10:51:27 GMT",GAM Holding AG Has $51.18 Million Stock Holdings in Alphabet Inc. $GOOGL - MarketBeat,MarketBeat
"Thu, 13 Nov 2025 18:41:39 GMT",Google’s Hidden AI Arsenal: Unlocking GOOGL’s 2026 Stock Surge - WebProNews,WebProNews
"Thu, 13 Nov 2025 08:49:04 GMT","Fisher Funds Management LTD Buys 29,202 Shares of Alphabet Inc. $GOOGL - MarketBeat",MarketBeat
"Wed, 12 Nov 2025 19:24:54 GMT",Alphabet (GOOGL) Launches a New AI Platform Called Private AI Compute - TipRanks,TipRanks
"Thu, 13 Nov 2025 10:51:26 GMT",Syverson Strege & Co Increases Stock Position in Alphabet Inc. $GOOGL - MarketBeat,MarketBeat
"Thu, 13 Nov 2025 10:51:27 GMT",Integrity Alliance LLC. Trims Position in Alphabet Inc. $GOOGL - MarketBeat,MarketBeat
"Thu, 13 Nov 2025 10:51:29 GMT","Leeward Financial Partners LLC Purchases 3,982 Shares of Alphabet Inc. $GOOGL - MarketBeat",MarketBeat
"Tue, 11 Nov 2025 14:30:02 GMT",Earnings Growth & Price Strength Make Alphabet (GOOGL) a Stock to Watch - Yahoo Finance,Yahoo Finance
"Wed, 12 Nov 2025 08:56:00 GMT",Elite Life Management LLC Purchases New Shares in Alphabet Inc. $GOOGL - MarketBeat,MarketBeat
"Thu, 13 Nov 2025 00:16:33 GMT",Alphabet (NASDAQ:GOOGL) Stock Price Down 1.6% - Should You Sell? - MarketBeat,MarketBeat
"Tue, 11 Nov 2025 13:35:41 GMT","Alphabet: Quietly Dominating AI, One Layer At A Time (NASDAQ:GOOGL) - Seeking Alpha",Seeking Alpha
"Wed, 12 Nov 2025 10:32:16 GMT",Alphabet Inc. $GOOGL Stock Holdings Decreased by Mesirow Financial Investment Management Inc. - MarketBeat,MarketBeat
"Wed, 12 Nov 2025 23:16:19 GMT",Direxion Daily GOOGL Bull 2X Shares (NASDAQ:GGLL) Hits New 1-Year High - Here's Why - MarketBeat,MarketBeat
"Tue, 11 Nov 2025 13:10:00 GMT",Alphabet Inc (GOOGL) Insights Among Top Nasdaq Stocks in Nasdaq Composite - Kalkine Media,Kalkine Media
"Wed, 12 Nov 2025 10:32:13 GMT",Alphabet Inc. $GOOGL Position Increased by Simon Quick Advisors LLC - MarketBeat,MarketBeat
"Wed, 12 Nov 2025 10:23:27 GMT","Lockheed Martin Investment Management Co. Sells 49,740 Shares of Alphabet Inc. $GOOGL - MarketBeat",MarketBeat
"Wed, 12 Nov 2025 10:32:17 GMT",Provident Trust Co. Trims Stock Holdings in Alphabet Inc. $GOOGL - MarketBeat,MarketBeat
"Wed, 12 Nov 2025 10:32:15 GMT",Alphabet Inc. $GOOGL Shares Sold by Hutchinson Capital Management CA - MarketBeat,MarketBeat
"Wed, 12 Nov 2025 10:32:15 GMT",Alphabet Inc. $GOOGL Shares Purchased by UNIVEST FINANCIAL Corp - MarketBeat,MarketBeat
"Thu, 13 Nov 2025 17:01:27 GMT",Alphabet Options Trading: A Deep Dive into Market Sentiment - Alphabet (NASDAQ:GOOGL) - Benzinga,Benzinga
"Wed, 12 Nov 2025 10:28:12 GMT",Alphabet (GOOGL) Stock: Tech Giant Hits All-Time High on AI Momentum - CoinCentral,CoinCentral
2025-11-16T04:11:37,How Investors May Respond To SentinelOne (S) AI-Powered Cybersecurity Suite and Expanded AWS Partnerships,Yahoo
2025-11-15T23:02:18,Sundar Pichai responds to Polymarket predicting Gemini 3 update,Yahoo
2025-11-15T18:33:34,"Despite AI bubble fears, Warren Buffett’s Berkshire Hathaway loads up on shares of hyperscaler Alphabet amid huge rally",Yahoo
2025-11-15T16:11:22,Google to Lift India Data Hub Plan Above $15 Billion,Yahoo
2025-11-15T15:00:39,Alphabet’s Secret Portfolio Just Bought These 2 Stocks. Should You Buy Too?,Yahoo
2025-11-15T07:10:36,BofA Reaffirms Bullish Stance on Alphabet (GOOGL) As AI And Cloud Growth Accelerate,Yahoo
2025-11-15T02:13:57,"Disney reaches new deal with YouTube TV, ending a blackout that lasted over two weeks",Yahoo
2025-11-15T01:08:00,Berkshire Added $4 Billion Alphabet Stake and Further Pared Apple Stock,Yahoo
2025-11-14T23:50:31,Berkshire Hathaway Discloses Rare Tech Investment With $4 Billion Google Stake,Yahoo
2025-11-14T23:29:22,"Factbox-From OpenAI to Google, firms channel billions into AI infrastructure as demand booms",Yahoo
2025-11-14T23:29:09,"Berkshire Hathaway reveals $4.3 billion stake in Alphabet, cuts Apple",Yahoo
2025-11-14T23:23:50,"Google to invest $40 billion in Texas data centers through 2027, Bloomberg reports",Yahoo
2025-11-14T22:53:30,Barchart’s Technical Indicators Are Flashing ‘Buy’ as Warren Buffett Loads Up on 17.8 Million Shares of Google Stock,Yahoo
2025-11-14T22:43:36,Warren Buffett's Berkshire Hathaway bets on Alphabet,Yahoo
2025-11-14T22:42:49,"Stocks to Watch Recap: Alphabet, Walmart, Eli Lilly, Warner Bros.",Yahoo
2025-11-14T20:42:09,"Google and Disney reach deal to restore ESPN, ABC to YouTube TV",CNBC
2025-11-14T18:30:41,"Does Meta, Google's use of debt to finance AI signal a bubble?",Yahoo
2025-11-14T17:44:07,Google reportedly investing $40 billion in new Texas data centers,CNBC
2025-11-14T17:35:31,AI Voice Assistants Are Making Themselves Heard. Wall Street Is Paying Attention.,Yahoo
2025-11-14T17:23:00,Purdue and Google aim to grow a strategic AI partnership,Yahoo
2025-11-14T15:02:52,Google Offers EU Adtech Concessions to Avoid Business Divestment,Yahoo
2025-11-14T15:00:05,Alphabet Inc. (GOOGL) is Attracting Investor Attention: Here is What You Should Know,Yahoo
2025-11-14T11:15:00,Google: Holding A High Market Share In Search,SeekingAlpha
2025-11-14T10:00:00,Bending Spoons' Remini App Hits 1.16 Million Weekly Installs Following Integration of Google's 'Nano Banana' AI Model,Yahoo
2025-11-14T07:22:00,Squirrel Ai Founder Haoyang Li Highlights AI-Driven Talent Transformation and the Future of Education at Saudi Arabia's FII9,Yahoo
2025-11-14T07:12:00,Google Offers Remedies to EU After $3.4 Billion Ad Tech Fine,Yahoo
2025-11-14T07:03:56,"Google offers EU to change adtech policy, no divestment",Yahoo
2025-11-14T05:45:25,Top Analyst Says Oracle's 'Irresponsible' AI Bet Differs From 'Healthy' Microsoft And Google Demand: A 'Bad Business' With 'Very Low Margins',Yahoo
2025-11-14T03:20:42,"Amazon, Microsoft back effort to curb Nvidia's exports to China, WSJ reports",Yahoo
2025-11-14T01:47:00,Buy Alphabet Stock After Waymo Expands Robotaxi Services?,Yahoo
2025-11-13T20:06:00,CrowdStrike Named an Inaugural Google Unified Security Recommended Partner,Yahoo
2025-11-16T05:19:02Z,Elon Musk Says It's 'Mindblowing' How Much Money Is Being Spent On AI Compute As Google Announces $40 Billion Investment In Texas,Benzinga
2025-11-13T11:29:26Z,Top Analyst Says Oracle's 'Irresponsible' AI Bet Differs From 'Healthy' Microsoft And Google Demand: A 'Bad Business' With 'Very Low Margins',Benzinga
2025-11-13T08:51:23Z,Google Sues Chinese Hackers Behind 'Lighthouse' Phishing Scheme Allegedly Targeting Millions Of US Credit Cards,Benzinga
2025-11-15T02:16:51,Google loss porn -85k,Reddit/r/wallstreetbets
2025-11-12T01:41:35,AMZN or GOOG which is better to invest long term?,Reddit/r/investing
2025-11-11T22:19:35,$GOOGL,Reddit/r/wallstreetbets
