Date,Title,Source
2025-11-22T11:20:00Z,"Halper Sadeh LLC Encourages ACLS, VECO, CLCO Shareholders to Contact the Firm to Discuss Their Rights",GlobeNewswire
"Sat, 22 Nov 2025 11:20:11 GMT","Halper Sadeh LLC Encourages ACLS, VECO, CLCO Shareholders to Contact the Firm to Discuss Their Rights - GlobeNewswire",GlobeNewswire
"Sat, 22 Nov 2025 09:01:25 GMT","Creative Planning Raises Position in Axcelis Technologies, Inc. $ACLS - MarketBeat",MarketBeat
"Fri, 21 Nov 2025 22:30:00 GMT","$HAREHOLDER ALERT: The M&A Class Action Firm Continues to Investigate the Mergers-MRUS, ACLS, VECO, and CLCO - PR Newswire",PR Newswire
"Fri, 21 Nov 2025 22:22:18 GMT","The Rangers have non-tendered outfielder Adolis García. Former ACLS MVP and Gold Glove winner. Production has been down the past two seasons, but still had a 2.7 bWAR l - DK Pittsburgh Sports",DK Pittsburgh Sports
"Wed, 19 Nov 2025 22:39:08 GMT",Will ACLS stock recover after recent drop - Weekly Investment Summary & Technical Pattern Based Signals - newser.com,newser.com
"Fri, 21 Nov 2025 13:09:28 GMT","Primecap Management Co. CA Purchases 17,230 Shares of Axcelis Technologies, Inc. $ACLS - MarketBeat",MarketBeat
"Wed, 19 Nov 2025 08:42:36 GMT",Why ACLS stock is trending among retail traders - July 2025 PreEarnings & Community Shared Stock Ideas - newser.com,newser.com
"Thu, 20 Nov 2025 11:11:23 GMT","Savant Capital LLC Takes $283,000 Position in Axcelis Technologies, Inc. $ACLS - MarketBeat",MarketBeat
"Tue, 18 Nov 2025 08:45:43 GMT","Bank of New York Mellon Corp Boosts Stock Position in Axcelis Technologies, Inc. $ACLS - MarketBeat",MarketBeat
