Date,Title,Source
"Wed, 05 Nov 2025 13:10:05 GMT",Airbnb (ABNB): Examining Valuation After Recent Share Price Swings - simplywall.st,simplywall.st
"Wed, 05 Nov 2025 17:57:00 GMT",ABNB February 2026 Options Begin Trading - Nasdaq,Nasdaq
"Wed, 05 Nov 2025 13:48:26 GMT",Is Airbnb Stock (ABNB) a Buy Ahead of Q3 Earnings? - TipRanks,TipRanks
"Thu, 06 Nov 2025 05:11:19 GMT",Is Tidal Trust II YieldMax ABNB stock a top hedge fund pick - 2025 Macro Impact & Pattern Based Trade Signal System - fcp.pa.gov.br,fcp.pa.gov.br
"Tue, 04 Nov 2025 06:09:00 GMT",A Fresh Look at Airbnb (ABNB) Valuation as Growth Potential Returns to Focus - Yahoo Finance,Yahoo Finance
"Thu, 06 Nov 2025 03:54:58 GMT",Relative strength of ABNB in sector analysis - Rate Hike & Breakout Confirmation Alerts - newser.com,newser.com
"Wed, 05 Nov 2025 04:03:54 GMT",Airbnb (ABNB) Q3 Earnings: What To Expect - MSN,MSN
"Wed, 05 Nov 2025 00:51:33 GMT","Airbnb (NASDAQ:ABNB) CTO Sells $75,282.00 in Stock - MarketBeat",MarketBeat
"Wed, 05 Nov 2025 09:55:30 GMT",Using Ichimoku Cloud for ABNB technicals - Market Activity Recap & Precise Swing Trade Entry Alerts - newser.com,newser.com
"Mon, 03 Nov 2025 11:26:22 GMT","Airbnb, Inc. $ABNB Shares Bought by Cambiar Investors LLC - MarketBeat",MarketBeat
"Wed, 05 Nov 2025 09:50:42 GMT",Analyzing net buyer seller activity in ABNB - July 2025 Chart Watch & Low Drawdown Momentum Trade Ideas - newser.com,newser.com
"Mon, 03 Nov 2025 10:21:49 GMT","TIAA Trust National Association Purchases 9,976 Shares of Airbnb, Inc. $ABNB - MarketBeat",MarketBeat
"Wed, 05 Nov 2025 04:19:22 GMT",ABNB stock momentum explained - July 2025 Price Swings & Expert Verified Movement Alerts - newser.com,newser.com
"Wed, 05 Nov 2025 01:04:23 GMT",Analyzing net buyer seller activity in ABNB - Rate Cut & Daily Risk Controlled Trade Plans - newser.com,newser.com
"Tue, 04 Nov 2025 11:07:39 GMT",Why ABNB stock is rated strong buy - 2025 Bull vs Bear & Growth-Oriented Investment Plans - newser.com,newser.com
"Wed, 05 Nov 2025 11:40:56 GMT",How ABNB stock reacts to Fed rate cuts - Trade Ideas & Verified Entry Point Detection - newser.com,newser.com
"Wed, 05 Nov 2025 11:33:36 GMT",Applying big data sentiment scoring on ABNB - July 2025 News Drivers & Low Drawdown Momentum Trade Ideas - newser.com,newser.com
"Tue, 04 Nov 2025 01:30:17 GMT",How to forecast ABNB trends using time series - Weekly Risk Report & Reliable Volume Spike Alerts - newser.com,newser.com
"Mon, 03 Nov 2025 10:39:49 GMT","Airbnb, Inc. $ABNB Shares Sold by iA Global Asset Management Inc. - MarketBeat",MarketBeat
"Wed, 05 Nov 2025 08:12:49 GMT",Is ABNB stock entering bullish territory - Market Growth Review & Accurate Technical Buy Alerts - newser.com,newser.com
"Mon, 03 Nov 2025 10:17:42 GMT","Airbnb, Inc. $ABNB Shares Sold by Harel Insurance Investments & Financial Services Ltd. - MarketBeat",MarketBeat
"Mon, 03 Nov 2025 01:56:00 GMT",Is ABNB stock entering bullish territory - Weekly Trend Recap & AI Driven Stock Movement Reports - newser.com,newser.com
"Sun, 02 Nov 2025 13:07:14 GMT","Earnings week ahead:AMD, PLTR, PFE, ENB, SHOP, MCD, SMCI, LCID, MRNA, ABNB, WBD, DKNG, AMC - Seeking Alpha",Seeking Alpha
"Sun, 02 Nov 2025 12:57:23 GMT",ABNB stock momentum explained - Wall Street Watch & Verified Momentum Stock Watchlist - newser.com,newser.com
"Wed, 05 Nov 2025 06:46:08 GMT","Evercore Maintains Airbnb(ABNB.US) With Hold Rating, Maintains Target Price $145 - 富途牛牛",富途牛牛
"Sun, 02 Nov 2025 08:20:01 GMT",Will earnings trigger a reversal in ABNB - Portfolio Risk Report & AI Driven Price Predictions - newser.com,newser.com
"Sun, 02 Nov 2025 11:24:12 GMT","Twin City Private Wealth LLC Acquires Shares of 6,581 Airbnb, Inc. $ABNB - MarketBeat",MarketBeat
"Tue, 04 Nov 2025 06:35:23 GMT",ABNB stock momentum explained - Quarterly Earnings Report & Safe Entry Point Alerts - newser.com,newser.com
"Sun, 02 Nov 2025 09:53:59 GMT","Strs Ohio Has $13.73 Million Holdings in Airbnb, Inc. $ABNB - MarketBeat",MarketBeat
"Sun, 02 Nov 2025 09:45:58 GMT","Assetmark Inc. Raises Stake in Airbnb, Inc. $ABNB - MarketBeat",MarketBeat
"Sun, 02 Nov 2025 09:12:14 GMT","Arkadios Wealth Advisors Increases Stock Position in Airbnb, Inc. $ABNB - MarketBeat",MarketBeat
"Tue, 04 Nov 2025 07:00:05 GMT",Is Tidal Trust II YieldMax ABNB stock a top hedge fund pick - 2025 Technical Overview & Real-Time Stock Movement Alerts - newser.com,newser.com
"Mon, 03 Nov 2025 04:05:49 GMT",Trend analysis for ABNB this week - Layoff News & Real-Time Volume Analysis Alerts - newser.com,newser.com
"Sat, 01 Nov 2025 10:46:22 GMT","Pathway Capital Management LP Invests $300,000 in Airbnb, Inc. $ABNB - MarketBeat",MarketBeat
"Sat, 01 Nov 2025 09:47:43 GMT","Atria Investments Inc Grows Stake in Airbnb, Inc. $ABNB - MarketBeat",MarketBeat
"Sat, 01 Nov 2025 08:48:48 GMT","Airbnb, Inc. $ABNB Stake Lowered by Flagship Harbor Advisors LLC - MarketBeat",MarketBeat
"Sat, 01 Nov 2025 08:02:09 GMT","Bessemer Group Inc. Sells 177,059 Shares of Airbnb, Inc. $ABNB - MarketBeat",MarketBeat
"Sat, 01 Nov 2025 09:47:43 GMT","Amalgamated Bank Raises Stock Position in Airbnb, Inc. $ABNB - MarketBeat",MarketBeat
"Sun, 02 Nov 2025 02:57:43 GMT",Sentiment analysis tools applied to ABNB - 2025 Big Picture & Capital Efficiency Focused Ideas - newser.com,newser.com
"Wed, 05 Nov 2025 11:46:58 GMT","BNP PARIBAS ASSET MANAGEMENT Holding S.A. Purchases 96,891 Shares of Airbnb, Inc. $ABNB - MarketBeat",MarketBeat
"Mon, 03 Nov 2025 11:18:20 GMT","Sumitomo Life Insurance Co. Has $7.60 Million Stock Position in Airbnb, Inc. $ABNB - MarketBeat",MarketBeat
2025-11-04T07:09:54,A Fresh Look at Airbnb (ABNB) Valuation as Growth Potential Returns to Focus,Yahoo
2025-11-03T19:16:00,Airbnb Set to Report Q3 Earnings: What's in the Cards for the Stock?,Yahoo
