Date,Title,Source
"Fri, 31 Oct 2025 18:11:27 GMT",Why Monolithic Power Systems (MPWR) Stock Is Falling Today - Yahoo Finance,Yahoo Finance
"Tue, 04 Nov 2025 00:03:00 GMT",Citigroup Maintains Monolithic Power Systems (MPWR) Buy Recommendation - Nasdaq,Nasdaq
"Mon, 03 Nov 2025 14:30:12 GMT","Monolithic Power Systems (MPWR): Valuation in Focus After Strong Earnings, Record Revenue, and Post-Report Share Drop - simplywall.st",simplywall.st
"Tue, 04 Nov 2025 01:55:58 GMT",Is MPWR stock a contrarian buy - 2025 Price Targets & Low Risk Entry Point Tips - newser.com,newser.com
"Tue, 04 Nov 2025 06:48:32 GMT","Monolithic Power Systems, Inc. (NASDAQ:MPWR) Given Average Rating of ""Moderate Buy"" by Analysts - MarketBeat",MarketBeat
"Fri, 31 Oct 2025 14:48:00 GMT",$MPWR stock is down 13% today. Here's what we see in our data. - Quiver Quantitative,Quiver Quantitative
"Sat, 01 Nov 2025 10:17:08 GMT",Monolithic Power (MPWR) Margin Surge Reinforces Bullish Narrative Despite Cautious Earnings Outlook - Yahoo Finance,Yahoo Finance
"Sun, 02 Nov 2025 05:58:26 GMT",Why Is Monolithic Power (MPWR) Cautious on AI Despite Record Revenue Growth? - simplywall.st,simplywall.st
"Sun, 02 Nov 2025 20:08:54 GMT",Will MPWR stock attract ESG investors - Market Risk Analysis & Weekly Watchlist of Top Performers - newser.com,newser.com
"Fri, 31 Oct 2025 16:21:00 GMT",New Analyst Forecast: $MPWR Given $1250.0 Price Target - Quiver Quantitative,Quiver Quantitative
"Sun, 02 Nov 2025 09:45:56 GMT","Assetmark Inc. Increases Stock Holdings in Monolithic Power Systems, Inc. $MPWR - MarketBeat",MarketBeat
"Fri, 31 Oct 2025 12:41:30 GMT","MPWR Q3 Deep Dive: Broad-Based Growth, Margin Stability, and Solution Expansion - Yahoo Finance",Yahoo Finance
"Sun, 02 Nov 2025 22:40:55 GMT",Is MPWR stock a contrarian buy - Trade Exit Report & Community Consensus Picks - newser.com,newser.com
"Sat, 01 Nov 2025 13:54:52 GMT","Monolithic Power Systems (NASDAQ:MPWR) Stock Price Expected to Rise, KeyCorp Analyst Says - MarketBeat",MarketBeat
"Sun, 02 Nov 2025 12:47:37 GMT",Is MPWR trending in predictive chart models - Trend Reversal & Risk Adjusted Buy/Sell Alerts - newser.com,newser.com
"Sat, 01 Nov 2025 16:30:39 GMT",Monolithic Power Systems (NASDAQ:MPWR) Shares Gap Down - Here's What Happened - MarketBeat,MarketBeat
"Sat, 01 Nov 2025 10:01:53 GMT","Monolithic Power Systems, Inc. $MPWR Shares Acquired by Jennison Associates LLC - MarketBeat",MarketBeat
"Sat, 01 Nov 2025 13:56:05 GMT","Monolithic Power Systems (NASDAQ:MPWR) Given New $1,250.00 Price Target at TD Cowen - MarketBeat",MarketBeat
"Mon, 03 Nov 2025 10:41:53 GMT","Monolithic Power Systems, Inc. $MPWR Shares Sold by Tredje AP fonden - MarketBeat",MarketBeat
"Mon, 03 Nov 2025 11:30:25 GMT","Versor Investments LP Raises Stock Holdings in Monolithic Power Systems, Inc. $MPWR - MarketBeat",MarketBeat
"Mon, 03 Nov 2025 11:30:26 GMT","298 Shares in Monolithic Power Systems, Inc. $MPWR Acquired by Hutchens & Kramer Investment Management Group LLC - MarketBeat",MarketBeat
"Mon, 03 Nov 2025 09:51:35 GMT","Monolithic Power Systems, Inc. $MPWR Shares Sold by Plato Investment Management Ltd - MarketBeat",MarketBeat
"Sat, 01 Nov 2025 08:37:30 GMT","Monolithic Power Systems, Inc. $MPWR Shares Acquired by Oppenheimer Asset Management Inc. - MarketBeat",MarketBeat
"Sat, 01 Nov 2025 10:09:36 GMT","AdvisorShares Investments LLC Acquires Shares of 640 Monolithic Power Systems, Inc. $MPWR - MarketBeat",MarketBeat
"Sat, 01 Nov 2025 13:07:30 GMT",Rosenblatt Securities Forecasts Strong Price Appreciation for Monolithic Power Systems (NASDAQ:MPWR) Stock - MarketBeat,MarketBeat
"Fri, 31 Oct 2025 23:05:31 GMT",Monolithic Power Systems (NASDAQ:MPWR) Posts Earnings Results - MarketBeat,MarketBeat
"Mon, 03 Nov 2025 11:50:06 GMT",Why MPWR is moving today - Weekly Risk Summary & Capital Efficient Trading Techniques - newser.com,newser.com
"Tue, 04 Nov 2025 06:57:52 GMT",Will MPWR stock attract ESG investors - Quarterly Risk Review & Weekly Top Gainers Trade List - newser.com,newser.com
"Sun, 02 Nov 2025 04:17:34 GMT","Monolithic Power Systems, Inc. (NASDAQ:MPWR) Q3 2025 Earnings Call Transcript - Insider Monkey",Insider Monkey
"Sun, 02 Nov 2025 11:52:21 GMT","Geneva Capital Management LLC Boosts Position in Monolithic Power Systems, Inc. $MPWR - MarketBeat",MarketBeat
"Fri, 31 Oct 2025 09:17:58 GMT",Risk vs reward if holding onto MPWR - Chart Signals & Proven Capital Preservation Tips - newser.com,newser.com
"Tue, 04 Nov 2025 06:41:01 GMT",Relative strength of MPWR in sector analysis - Trade Entry Report & AI Forecasted Stock Moves - newser.com,newser.com
"Fri, 31 Oct 2025 12:31:47 GMT","Monolithic Power Systems, Inc. $MPWR Shares Purchased by BLB&B Advisors LLC - MarketBeat",MarketBeat
"Fri, 31 Oct 2025 13:13:09 GMT",Monolithic Power Systems (MPWR) Gets Price Target Boost by Rosen - GuruFocus,GuruFocus
"Fri, 31 Oct 2025 15:05:40 GMT",Monolithic Power Systems (MPWR) Shares Drop Despite Strong Q3 Pe - GuruFocus,GuruFocus
"Fri, 31 Oct 2025 07:33:27 GMT","337 Shares in Monolithic Power Systems, Inc. $MPWR Bought by D.A. Davidson & CO. - MarketBeat",MarketBeat
"Fri, 31 Oct 2025 13:35:52 GMT","MPWR: Keybanc Raises Price Target to $1300, Reiterates Overweigh - GuruFocus",GuruFocus
"Sun, 02 Nov 2025 12:05:23 GMT",Relative strength of MPWR in sector analysis - 2025 Price Momentum & Long-Term Safe Return Strategies - newser.com,newser.com
"Fri, 31 Oct 2025 18:44:00 GMT",MPWR Stock Drops Despite Strong Q3 2025 Earnings - News and Statistics - IndexBox,IndexBox
"Fri, 31 Oct 2025 12:38:42 GMT","Monolithic Power Systems, Inc. $MPWR Shares Sold by Strs Ohio - MarketBeat",MarketBeat
"Fri, 31 Oct 2025 13:31:00 GMT","TD Cowen Maintains Monolithic Power Systems(MPWR.US) With Buy Rating, Maintains Target Price $1,250 - 富途牛牛",富途牛牛
2025-11-02T14:08:41,"Results: Monolithic Power Systems, Inc. Exceeded Expectations And The Consensus Has Updated Its Estimates",Yahoo
2025-11-01T11:17:08,Monolithic Power (MPWR) Margin Surge Reinforces Bullish Narrative Despite Cautious Earnings Outlook,Yahoo
2025-11-01T07:57:46,Monolithic Power Systems - Structural Strength Meets Valuation Risk,SeekingAlpha
2025-10-31T19:11:27,Why Monolithic Power Systems (MPWR) Stock Is Falling Today,Yahoo
2025-10-31T17:45:28,Monolithic Power Systems Shares Fall Despite Analyst Price Target Raises,Yahoo
2025-10-31T15:05:00,Monolithic Power Surpasses Q3 Earnings Estimates on Record Revenues,Yahoo
2025-10-31T13:41:30,"MPWR Q3 Deep Dive: Broad-Based Growth, Margin Stability, and Solution Expansion",Yahoo
2025-10-31T04:06:35,Monolithic Power Systems Inc (MPWR) Q3 2025 Earnings Call Highlights: Record Revenue and ...,Yahoo
