Date,Title,Source
2025-08-30T18:43:32Z,Expanding in Japan Through Fujitsu Partnership to Drive AIP Adoption,Biztoc.com
2025-08-30T18:28:13Z,Palantir (PLTR) Expanding in Japan Through Fujitsu Partnership to Drive AIP Adoption,Yahoo Entertainment
2025-08-30T07:23:00Z,Palantir Technologies (NASDAQ:PLTR) Cut to Hold at Wall Street Zen,ETF Daily News
2025-08-29T21:43:27Z,"Palantir Technologies Inc. (PLTR)’s New Name Is “Karpe Diem,’ Says Jim Cramer",Yahoo Entertainment
2025-08-29T14:18:07Z,"Stock Market Today: Dow Falls After Fed Inflation Data; Nvidia, Palantir Slide (Live Coverage)",Biztoc.com
2025-08-29T14:06:22Z,3 Top-Performing Stocks Like Palantir to Buy Today,Biztoc.com
2025-08-29T08:02:55Z,Direxion Daily PLTR Bull 2X Shares (NASDAQ:PLTU) Trading 1.6% Higher – Still a Buy?,ETF Daily News
2025-08-28T19:02:39Z,1 ETF to Buy If You Want to Get In on the Short Selling Mania in Palantir Stock,Barchart.com
2025-08-28T12:48:58Z,"Palantir Stock Stays Above 50-Day Line, Bucks AI Software Worries. Is PLTR Stock A Buy?",Biztoc.com
2025-08-28T12:25:54Z,ClearBridge Mid Cap Growth Strategy Exited Palantir Technologies (PLTR) as It Left the Benchmark,Biztoc.com
2025-08-28T12:00:17Z,ClearBridge Mid Cap Growth Strategy Exited Palantir Technologies (PLTR) as It Left the Benchmark,Yahoo Entertainment
2025-08-27T15:13:33Z,CEO Alex Karp Just Sold $60 Million in Palantir Stock. Should You Ditch PLTR Here Too?,Biztoc.com
2025-08-27T15:08:36Z,CEO Alex Karp Just Sold $60 Million in Palantir Stock. Should You Ditch PLTR Here Too?,Barchart.com
2025-08-27T12:25:48Z,Analysts Now Think Palantir Stock Has One Way To Go,Biztoc.com
2025-08-27T06:57:57Z,Analyst on Palantir (PLTR): ‘This is More Than a Meme’,Yahoo Entertainment
"Mon, 01 Sep 2025 02:18:28 GMT","Palantir Technologies Inc. (PLTR)’s New Name Is “Karpe Diem,’ Says Jim Cramer - MSN",MSN
"Sun, 31 Aug 2025 21:45:28 GMT",What’s next for PLTR stock price - July 2025 Snapshot & AI Enhanced Market Trend Forecasts - Newser,Newser
"Fri, 29 Aug 2025 21:43:27 GMT","Palantir Technologies Inc. (PLTR)’s New Name Is “Karpe Diem,’ Says Jim Cramer - Yahoo Finance",Yahoo Finance
"Thu, 28 Aug 2025 12:37:00 GMT","Palantir Stock Stays Above 50-Day Line, Bucks AI Software Worries. Is PLTR Stock A Buy? - Investor's Business Daily",Investor's Business Daily
"Thu, 28 Aug 2025 13:13:42 GMT",Palantir Is Priced For Perfection (NASDAQ:PLTR) - Seeking Alpha,Seeking Alpha
"Mon, 01 Sep 2025 06:02:34 GMT",Jump Financial LLC Purchases New Holdings in Direxion Daily PLTR Bear 1X Shares $PLTD - MarketBeat,MarketBeat
"Sun, 31 Aug 2025 21:17:40 GMT",SoundHound (SOUN) Looks A Lot Like Palantir (PLTR) - AOL.com,AOL.com
"Sun, 31 Aug 2025 16:17:26 GMT",What moving averages say about PLTR - 2025 Earnings Impact & Low Volatility Stock Recommendations - Newser,Newser
"Sat, 30 Aug 2025 18:28:13 GMT",Palantir (PLTR) Expanding in Japan Through Fujitsu Partnership to Drive AIP Adoption - Yahoo Finance,Yahoo Finance
"Mon, 01 Sep 2025 00:10:16 GMT",What to do if you’re stuck in Themes Etf Trust Leverage Shares 2x Long Pltr Daily Etf - July 2025 Technicals & High Conviction Buy Zone Alerts - Newser,Newser
"Sun, 31 Aug 2025 17:47:57 GMT",Forecasting Themes Etf Trust Leverage Shares 2x Long Pltr Daily Etf price range with options data - 2025 Fundamental Recap & Technical Buy Zone Confirmations - Newser,Newser
"Sun, 31 Aug 2025 13:42:11 GMT",Historical volatility pattern of Themes Etf Trust Leverage Shares 2x Long Pltr Daily Etf visualized - Exit Point & Daily Technical Forecast Reports - Newser,Newser
"Mon, 01 Sep 2025 01:57:32 GMT",Real time pattern detection on PLTR stock - Product Launch & Daily Entry Point Alerts - Newser,Newser
"Sun, 31 Aug 2025 23:30:51 GMT",Using AI based signals to follow PLTR - July 2025 Sentiment & Weekly Breakout Stock Alerts - Newser,Newser
"Mon, 01 Sep 2025 04:34:45 GMT",Chart based analysis of Themes Etf Trust Leverage Shares 2x Long Pltr Daily Etf trends - Oil Prices & AI Optimized Trading Strategy Guides - Newser,Newser
"Mon, 01 Sep 2025 00:39:51 GMT",Sentiment analysis tools applied to PLTR - Options Play & Step-by-Step Trade Execution Guides - Newser,Newser
"Sun, 31 Aug 2025 23:55:19 GMT",Using AI based signals to follow PLTR - Trade Risk Report & Long-Term Safe Investment Plans - Newser,Newser
"Sun, 31 Aug 2025 17:32:08 GMT",What’s next for PLTR stock price - Earnings Summary Report & Long-Term Growth Plans - Newser,Newser
"Sun, 31 Aug 2025 20:08:54 GMT",Using data models to predict PLTR stock movement - 2025 Top Gainers & Risk Controlled Daily Trade Plans - Newser,Newser
"Sun, 31 Aug 2025 03:55:25 GMT",Is PLTR stock poised for growth - Quarterly Profit Summary & Consistent Growth Equity Picks - Newser,Newser
"Fri, 29 Aug 2025 21:11:15 GMT",Live Reactions: Palantir (Nasdaq: PLTR) Sinks 14% After Earnings - AOL.com,AOL.com
"Sat, 30 Aug 2025 21:45:13 GMT",Top chart patterns to watch in PLTR - Quarterly Performance Summary & Expert Curated Trade Ideas - Newser,Newser
"Sun, 31 Aug 2025 18:10:08 GMT",Trend analysis for PLTR this week - Watch List & Target Return Focused Picks - Newser,Newser
"Wed, 27 Aug 2025 13:19:20 GMT",Palantir Technologies (NASDAQ: PLTR) Stock Price Prediction for 2025: Where Will It Be in 1 Year - 24/7 Wall St.,24/7 Wall St.
"Sun, 31 Aug 2025 05:45:18 GMT",Using data models to predict Themes Etf Trust Leverage Shares 2x Long Pltr Daily Etf stock movement - Market Growth Review & High Accuracy Buy Signal Tips - Newser,Newser
"Sun, 31 Aug 2025 04:55:52 GMT",What recovery options are there for Themes Etf Trust Leverage Shares 2x Long Pltr Daily Etf - Trade Volume Summary & Reliable Price Breakout Alerts - Newser,Newser
"Sun, 31 Aug 2025 01:38:07 GMT",Chart based analysis of PLTR trends - Weekly Stock Summary & Safe Swing Trade Setup Alerts - Newser,Newser
"Sun, 31 Aug 2025 02:55:34 GMT",Using data models to predict Themes Etf Trust Leverage Shares 2x Long Pltr Daily Etf stock movement - 2025 Short Interest & Daily Profit Focused Screening - Newser,Newser
"Sat, 30 Aug 2025 20:19:52 GMT",Palantir (PLTR) Stock Under Fire as Citron Warns Valuation Still Too High - MSN,MSN
"Sat, 30 Aug 2025 20:55:24 GMT",Palantir (PLTR) Expanding in Japan Through Fujitsu Partnership to Drive AIP Adoption - MSN,MSN
"Sun, 31 Aug 2025 04:09:02 GMT",What recovery options are there for Themes Etf Trust Leverage Shares 2x Long Pltr Daily Etf - Earnings Risk Report & Reliable Volume Spike Alerts - Newser,Newser
"Sun, 31 Aug 2025 08:06:08 GMT",Direxion Daily PLTR Bull 2X Shares (NASDAQ:PLTU) Shares Up 1.6% - Here's Why - MarketBeat,MarketBeat
"Sat, 30 Aug 2025 02:25:16 GMT",Is PLTR A Good Stock To Trade Options With? - Barchart.com,Barchart.com
"Thu, 28 Aug 2025 17:31:00 GMT",Palantir Technologies Stock (PLTR) Opinions on Recent Price Volatility - Quiver Quantitative,Quiver Quantitative
"Sat, 30 Aug 2025 10:20:10 GMT",Applying chart zones and confluence areas to Themes Etf Trust Leverage Shares 2x Long Pltr Daily Etf - Quarterly Market Review & Long Hold Capital Preservation Plans - Newser,Newser
"Sat, 30 Aug 2025 18:34:03 GMT",Key metrics from PLTR’s quarterly data - Dip Buying & Long-Term Safe Investment Ideas - Newser,Newser
"Sun, 31 Aug 2025 19:37:45 GMT",What to do if you’re stuck in Themes Etf Trust Leverage Shares 2x Long Pltr Daily Etf - Weekly Trend Report & AI Enhanced Market Trend Forecasts - Newser,Newser
"Sun, 31 Aug 2025 14:46:21 GMT",Can momentum traders help lift Themes Etf Trust Leverage Shares 2x Long Pltr Daily Etf - 2025 Biggest Moves & AI Driven Stock Reports - Newser,Newser
"Sun, 31 Aug 2025 12:59:20 GMT",Risk adjusted return profile for Themes Etf Trust Leverage Shares 2x Long Pltr Daily Etf analyzed - 2025 Support & Resistance & Long-Term Safe Return Strategies - Newser,Newser
"Thu, 28 Aug 2025 12:00:17 GMT",ClearBridge Mid Cap Growth Strategy Exited Palantir Technologies (PLTR) as It Left the Benchmark - Yahoo Finance,Yahoo Finance
"Sat, 30 Aug 2025 01:24:41 GMT",Palantir’s PLTR Ranks 7th in U.S. Trading Amid AI Sector Volatility - AInvest,AInvest
"Sat, 30 Aug 2025 23:13:28 GMT",From tech to retail: PLTR and EBAY are among the top 10 most overbought stocks - MSN,MSN
"Sun, 31 Aug 2025 03:22:59 GMT",Is PLTR stock poised for growth - Weekly Trade Analysis & Reliable Entry Point Alerts - Newser,Newser
"Mon, 01 Sep 2025 02:53:40 GMT",PLTR Reversal Rally May Surprise Bears getLinesFromResByArray error: size == 0 - kangso.co.kr,kangso.co.kr
"Thu, 28 Aug 2025 15:50:38 GMT",Is Themes Etf Trust Leverage Shares 2x Long Pltr Daily Etf building a consolidation base - 2025 Price Action Summary & Low Drawdown Trading Strategies - Newser,Newser
"Sun, 31 Aug 2025 08:34:20 GMT",Tick level data insight on PLTR volatility - Market Sentiment Report & Weekly Sector Rotation Insights - Newser,Newser
"Sat, 30 Aug 2025 17:15:26 GMT",What’s next for PLTR stock price - Trade Risk Assessment & Low Risk High Reward Ideas - Newser,Newser
"Sun, 31 Aug 2025 03:30:41 GMT",Chart based analysis of PLTR trends - Sell Signal & Daily Growth Stock Tips - Newser,Newser
"Sun, 31 Aug 2025 06:50:54 GMT",When CSTM stock expected to show significant growthIs PLTR stock a good long term investment option - July 2025 Levels & Risk Controlled Daily Plans - Newser,Newser
"Sun, 31 Aug 2025 00:48:01 GMT",Statistical indicators supporting PLTR’s strength - Dip Buying & Verified Momentum Stock Watchlist - Newser,Newser
"Sun, 31 Aug 2025 03:07:51 GMT",Using economic indicators to assess PLTR potential - 2025 Key Lessons & Technical Pattern Based Signals - Newser,Newser
"Sun, 31 Aug 2025 04:40:10 GMT",Short interest data insights for Themes Etf Trust Leverage Shares 2x Long Pltr Daily Etf - Earnings Risk Report & Fast Gain Stock Tips - Newser,Newser
"Thu, 28 Aug 2025 04:41:15 GMT",Nvidia’s Q2 Beat Lifts Confidence in Palantir (PLTR) Growth - TipRanks,TipRanks
"Sun, 31 Aug 2025 01:07:45 GMT",Forecasting Themes Etf Trust Leverage Shares 2x Long Pltr Daily Etf price range with options data - July 2025 Market Mood & Weekly Momentum Picks - Newser,Newser
"Fri, 29 Aug 2025 13:17:00 GMT","TSLA, PLTR and SCMI Forecast – Major Tech Stocks Slightly Soft - FXEmpire",FXEmpire
"Wed, 27 Aug 2025 07:52:08 GMT",Using economic indicators to assess PLTR potential - July 2025 Setups & Step-by-Step Trade Execution Guides - Newser,Newser
"Sun, 31 Aug 2025 08:16:39 GMT",What to do if you’re stuck in Themes Etf Trust Leverage Shares 2x Long Pltr Daily Etf - Share Buyback & Weekly Watchlist for Consistent Profits - Newser,Newser
"Wed, 27 Aug 2025 19:07:12 GMT",Custom strategy builders for tracking PLTR - Market Growth Review & Risk Controlled Swing Alerts - Newser,Newser
"Sun, 31 Aug 2025 03:44:26 GMT",How moving averages guide Themes Etf Trust Leverage Shares 2x Long Pltr Daily Etf trading - Earnings Miss & Community Driven Trade Alerts - Newser,Newser
"Sat, 30 Aug 2025 15:35:41 GMT",Can PLTR recover in the next quarter - Gap Down & Stock Timing and Entry Methods - Newser,Newser
"Fri, 29 Aug 2025 19:21:22 GMT",Statistical indicators supporting Themes Etf Trust Leverage Shares 2x Long Pltr Daily Etf’s strength - July 2025 Snapshot & Fast Moving Market Watchlists - Newser,Newser
"Wed, 27 Aug 2025 15:08:36 GMT",CEO Alex Karp Just Sold $60 Million In Palantir Stock. Should You Ditch PLTR Here Too? - Barchart.com,Barchart.com
"Wed, 27 Aug 2025 07:04:31 GMT",Analyst on Palantir (PLTR): ‘This is More Than a Meme’ - Insider Monkey,Insider Monkey
"Sun, 31 Aug 2025 02:46:11 GMT",Short interest data insights for Themes Etf Trust Leverage Shares 2x Long Pltr Daily Etf - Weekly Investment Report & AI Optimized Trade Strategies - Newser,Newser
"Wed, 27 Aug 2025 13:37:43 GMT",How to interpret RSI for Themes Etf Trust Leverage Shares 2x Long Pltr Daily Etf stock - Weekly Market Report & Safe Capital Growth Tips - Newser,Newser
"Fri, 29 Aug 2025 17:57:25 GMT",Is now a turning point for Themes Etf Trust Leverage Shares 2x Long Pltr Daily Etf - Trade Risk Assessment & Weekly High Momentum Picks - Newser,Newser
"Wed, 27 Aug 2025 12:16:30 GMT",PLTR Stock Updates: Stunning Developments Every Smart Investor Must Know Today - Vocal,Vocal
"Sun, 31 Aug 2025 02:04:45 GMT",How moving averages guide Themes Etf Trust Leverage Shares 2x Long Pltr Daily Etf trading - July 2025 Institutional & Real-Time Stock Movement Alerts - Newser,Newser
"Wed, 27 Aug 2025 10:14:25 GMT",Palantir Technologies (PLTR) Stock: Is a Massive Price Drop Coming Soon? - parameter.io,parameter.io
"Fri, 29 Aug 2025 20:06:55 GMT",What recovery options are there for Themes Etf Trust Leverage Shares 2x Long Pltr Daily Etf - July 2025 News Drivers & Daily Profit Maximizing Tips - Newser,Newser
"Fri, 29 Aug 2025 18:57:52 GMT",What’s next for PLTR stock price - July 2025 Closing Moves & Fast Gain Stock Trading Tips - Newser,Newser
"Thu, 28 Aug 2025 14:31:11 GMT",Can PLTR recover in the next quarter - Swing Trade & Expert Verified Stock Movement Alerts - Newser,Newser
"Wed, 27 Aug 2025 19:05:16 GMT",Using data tools to time your Themes Etf Trust Leverage Shares 2x Long Pltr Daily Etf exit - July 2025 Market Mood & Safe Entry Trade Reports - Newser,Newser
"Sat, 30 Aug 2025 19:48:55 GMT","Despite Strong Q2, Palantir (PLTR) Faces Valuation Doubts from Wall Street - MSN",MSN
"Wed, 27 Aug 2025 15:52:29 GMT",Heatmap analysis for PLTR and competitors - Fed Meeting & Risk Managed Investment Strategies - Newser,Newser
"Wed, 27 Aug 2025 18:52:14 GMT",Popular stocks with increasing volume: PLTR WBA INTC HOOD AMD SOFI CRWV MSTR FL MRNA - StreetInsider,StreetInsider
"Thu, 28 Aug 2025 05:15:25 GMT",Palantir (PLTR) Expands Partnership with SOMPO in Japan - MSN,MSN
"Sun, 31 Aug 2025 06:37:38 GMT",PLTR Reversal Rally May Surprise Bears getLinesFromResByArray error: size == 0 - newsyoung.net,newsyoung.net
"Wed, 27 Aug 2025 19:31:53 GMT",Palantir (PLTR) Wins $100M U.S. Army Contract for Next-Gen Command and Control - MSN,MSN
"Sun, 31 Aug 2025 13:15:17 GMT",Applying chart zones and confluence areas to PLTR - Take Profit & Technical Pattern Based Buy Signals - Newser,Newser
"Sun, 31 Aug 2025 06:52:24 GMT",Applying chart zones and confluence areas to PLTR - Analyst Upgrade & Reliable Intraday Trade Alerts - Newser,Newser
"Sat, 30 Aug 2025 18:36:49 GMT",Palantir (PLTR) Expanding in Japan Through Fujitsu Partnership to Drive AIP Adoption - Insider Monkey,Insider Monkey
"Fri, 29 Aug 2025 21:46:36 GMT","Palantir Technologies Inc. (PLTR)’s New Name Is “Karpe Diem,’ Says Jim Cramer - Insider Monkey",Insider Monkey
"Sat, 30 Aug 2025 20:07:02 GMT",What are PLTR’s recent SEC filings showing getLinesFromResByArray error: size == 0 - sisain.net,sisain.net
"Sat, 30 Aug 2025 13:13:47 GMT",Palantir Technologies (NASDAQ:PLTR) Stock Rating Lowered by Wall Street Zen - Defense World,Defense World
"Wed, 27 Aug 2025 12:33:36 GMT",Palantir (PLTR) Stock: Why This Analyst Sees 70% Crash Coming - MoneyCheck,MoneyCheck
"Fri, 29 Aug 2025 07:00:00 GMT",Is Themes Etf Trust Leverage Shares 2x Long Pltr Daily Etf showing insider buying - Weekly Trade Review & Daily Profit Maximizing Trade Tips - sundaytimes.kr,sundaytimes.kr
2025-08-29T23:43:27,"Palantir Technologies Inc. (PLTR)’s New Name Is “Karpe Diem,’ Says Jim Cramer",Yahoo
2025-08-29T17:45:00,Palantir's AIP-Led Growth Places It Ahead in the AI Race,Yahoo
2025-08-28T21:02:39,1 ETF to Buy If You Want to Get In on the Short Selling Mania in Palantir Stock,Yahoo
2025-08-28T14:37:14,"Palantir Stock Stays Above 50-Day Line, Bucks AI Software Worries. Is PLTR Stock A Buy?",Yahoo
2025-08-28T14:00:17,ClearBridge Mid Cap Growth Strategy Exited Palantir Technologies (PLTR) as It Left the Benchmark,Yahoo
2025-08-27T23:33:39,Palantir Heavy Insider Selling Meets Strong Momentum -- What It Means,Yahoo
2025-08-27T23:30:47,Jim Cramer Sees Palantir Riding MongoDB's Momentum: Sets Bold 24% Upside Target — Says 'Bears Didn't See Mongo Coming!',Yahoo
2025-08-27T17:08:36,CEO Alex Karp Just Sold $60 Million in Palantir Stock. Should You Ditch PLTR Here Too?,Yahoo
2025-08-27T16:31:08,Nvidia stock needs 'perfect' Q2: How to trade a post-earnings dip,Yahoo
2025-08-27T08:57:57,Analyst on Palantir (PLTR): ‘This is More Than a Meme’,Yahoo
