Date,Title,Source
2025-09-08T08:24:57Z,Hubbell Inc $HUBB Stock Holdings Lowered by Royal Bank of Canada,ETF Daily News
"Wed, 10 Sep 2025 06:13:35 GMT","Amundi Acquires 50,191 Shares of Hubbell Inc $HUBB - MarketBeat",MarketBeat
"Mon, 08 Sep 2025 10:58:27 GMT",Some Shareholders Feeling Restless Over Hubbell Incorporated's (NYSE:HUBB) P/E Ratio - simplywall.st,simplywall.st
"Wed, 10 Sep 2025 05:58:38 GMT",Hubbell Inc $HUBB Shares Acquired by Curi RMB Capital LLC - MarketBeat,MarketBeat
"Sat, 06 Sep 2025 15:57:52 GMT",Is HUBB undervalued by DCF analysis - Day Trade & Verified High Yield Trade Plans - خودرو بانک,خودرو بانک
"Tue, 09 Sep 2025 12:46:38 GMT","Temasek Holdings Private Ltd Sells 2,715 Shares of Hubbell Inc $HUBB - MarketBeat",MarketBeat
"Tue, 09 Sep 2025 13:43:49 GMT",Shellback Capital LP Takes $8.23 Million Position in Hubbell Inc $HUBB - MarketBeat,MarketBeat
"Tue, 09 Sep 2025 11:46:14 GMT",Dynamic Technology Lab Private Ltd Increases Stock Position in Hubbell Inc $HUBB - MarketBeat,MarketBeat
"Tue, 09 Sep 2025 09:27:51 GMT",Hubbell Inc $HUBB Shares Sold by Royal Bank of Canada - MarketBeat,MarketBeat
"Tue, 09 Sep 2025 08:31:03 GMT","Advisors Asset Management Inc. Sells 1,245 Shares of Hubbell Inc $HUBB - MarketBeat",MarketBeat
"Tue, 09 Sep 2025 07:00:00 GMT","Hubbell Inc (NYSE:HUBB) Given Consensus Rating of ""Hold"" by Brokerages - MarketBeat",MarketBeat
"Mon, 08 Sep 2025 12:44:25 GMT",Sandler Capital Management Has $2.16 Million Holdings in Hubbell Inc $HUBB - MarketBeat,MarketBeat
"Wed, 10 Sep 2025 06:41:32 GMT",Relative strength of HUBB in sector analysis - Trade Volume Summary & Growth Focused Entry Point Reports - Newser,Newser
"Mon, 08 Sep 2025 10:57:45 GMT","Gotham Asset Management LLC Acquires 12,567 Shares of Hubbell Inc $HUBB - MarketBeat",MarketBeat
"Mon, 08 Sep 2025 14:12:16 GMT",What the charts say about HUBB today - 2025 Trade Ideas & Reliable Intraday Trade Alerts - Newser,Newser
"Sun, 07 Sep 2025 07:00:00 GMT",Hubbell (NYSE:HUBB) Upgraded at Wells Fargo & Company - MarketBeat,MarketBeat
"Tue, 09 Sep 2025 05:44:53 GMT",does hubb qualify in momentum factor screening - Quarterly Profit Summary & Verified Momentum Stock Alerts - Newser,Newser
"Tue, 09 Sep 2025 11:15:00 GMT",MIRAE ASSET GLOBAL ETFS HOLDINGS Ltd. Has $121.46 Million Stock Position in Hubbell Inc $HUBB - MarketBeat,MarketBeat
