Date,Title,Source
2025-09-10T13:54:52Z,"5.2L students sans Aadhaar, govt to set up spl regn camps",The Times of India
"Sun, 14 Sep 2025 05:15:00 GMT","BMO Capital Maintains a Buy on Regeneron Pharmaceuticals (REGN), Sets a $640 PT - Yahoo Finance",Yahoo Finance
"Sun, 14 Sep 2025 05:17:00 GMT","BMO Capital Maintains a Buy on Regeneron Pharmaceuticals (REGN), Sets a $640 PT - uk.finance.yahoo.com",uk.finance.yahoo.com
"Sun, 14 Sep 2025 00:45:16 GMT","Teza Capital Management LLC Sells 898 Shares of Regeneron Pharmaceuticals, Inc. $REGN - MarketBeat",MarketBeat
"Wed, 10 Sep 2025 10:00:49 GMT",A Look at Regeneron (REGN) Valuation After Positive Phase 3 Results in Myasthenia Gravis Trial - Sahm,Sahm
"Sat, 13 Sep 2025 09:00:31 GMT","Plato Investment Management Ltd Buys 1,116 Shares of Regeneron Pharmaceuticals, Inc. $REGN - MarketBeat",MarketBeat
"Sat, 13 Sep 2025 07:00:00 GMT","2,477 Shares in Regeneron Pharmaceuticals, Inc. $REGN Purchased by United Services Automobile Association - MarketBeat",MarketBeat
"Fri, 12 Sep 2025 01:18:45 GMT","Sepio Capital LP Grows Stock Holdings in Regeneron Pharmaceuticals, Inc. $REGN - MarketBeat",MarketBeat
"Sat, 13 Sep 2025 09:26:36 GMT","Fortis Capital Advisors LLC Reduces Position in Regeneron Pharmaceuticals, Inc. $REGN - MarketBeat",MarketBeat
"Fri, 12 Sep 2025 07:00:00 GMT","Scientech Research LLC Lowers Stock Holdings in Regeneron Pharmaceuticals, Inc. $REGN - MarketBeat",MarketBeat
"Fri, 12 Sep 2025 06:45:00 GMT","Samlyn Capital LLC Buys New Holdings in Regeneron Pharmaceuticals, Inc. $REGN - MarketBeat",MarketBeat
"Fri, 12 Sep 2025 11:28:51 GMT","Ascent Group LLC Purchases 937 Shares of Regeneron Pharmaceuticals, Inc. $REGN - MarketBeat",MarketBeat
"Fri, 12 Sep 2025 14:31:51 GMT","Acadian Asset Management LLC Acquires 56,816 Shares of Regeneron Pharmaceuticals, Inc. $REGN - MarketBeat",MarketBeat
"Thu, 11 Sep 2025 07:00:00 GMT","Banque Transatlantique SA Decreases Stock Position in Regeneron Pharmaceuticals, Inc. $REGN - MarketBeat",MarketBeat
"Fri, 12 Sep 2025 10:10:41 GMT","Voleon Capital Management LP Purchases 573 Shares of Regeneron Pharmaceuticals, Inc. $REGN - MarketBeat",MarketBeat
"Thu, 11 Sep 2025 07:00:00 GMT","Hancock Whitney Corp Sells 5,650 Shares of Regeneron Pharmaceuticals, Inc. $REGN - MarketBeat",MarketBeat
"Thu, 11 Sep 2025 11:13:00 GMT","Regeneron Pharmaceuticals, Inc. $REGN Shares Bought by Woodline Partners LP - MarketBeat",MarketBeat
"Thu, 11 Sep 2025 08:55:27 GMT","UniSuper Management Pty Ltd Acquires 496 Shares of Regeneron Pharmaceuticals, Inc. $REGN - MarketBeat",MarketBeat
"Thu, 11 Sep 2025 07:00:00 GMT","Regeneron Pharmaceuticals, Inc. $REGN Shares Acquired by Tamar Securities LLC - MarketBeat",MarketBeat
"Fri, 12 Sep 2025 11:04:42 GMT","UBS AM A Distinct Business Unit of UBS Asset Management Americas LLC Sells 41,728 Shares of Regeneron Pharmaceuticals, Inc. $REGN - MarketBeat",MarketBeat
"Wed, 10 Sep 2025 07:00:00 GMT","Regeneron Pharmaceuticals, Inc. $REGN Shares Purchased by Gotham Asset Management LLC - MarketBeat",MarketBeat
"Wed, 10 Sep 2025 07:00:00 GMT","MAI Capital Management Has $566,000 Holdings in Regeneron Pharmaceuticals, Inc. $REGN - MarketBeat",MarketBeat
"Wed, 10 Sep 2025 07:00:00 GMT","Focus Partners Advisor Solutions LLC Invests $538,000 in Regeneron Pharmaceuticals, Inc. $REGN - MarketBeat",MarketBeat
"Wed, 10 Sep 2025 07:00:00 GMT","DnB Asset Management AS Purchases 14,323 Shares of Regeneron Pharmaceuticals, Inc. $REGN - MarketBeat",MarketBeat
"Tue, 09 Sep 2025 07:00:00 GMT",Regeneron Pharmaceuticals (NASDAQ:REGN) Stock Rating Upgraded by Raymond James Financial - MarketBeat,MarketBeat
"Tue, 09 Sep 2025 07:00:00 GMT","AQR Capital Management LLC Purchases 28,865 Shares of Regeneron Pharmaceuticals, Inc. $REGN - MarketBeat",MarketBeat
"Tue, 09 Sep 2025 19:10:04 GMT",Regeneron's Libtayo Combo Achieves Nearly Double Survival Rate In Advanced Lung Cancer Compared To Chemotherapy - Regeneron Pharmaceuticals (NASDAQ:REGN) - Benzinga,Benzinga
"Wed, 10 Sep 2025 13:54:00 GMT","5.2L students sans Aadhaar, govt to set up spl regn camps - The Times of India",The Times of India
"Fri, 12 Sep 2025 11:42:52 GMT","Ilmarinen Mutual Pension Insurance Co Increases Stock Holdings in Regeneron Pharmaceuticals, Inc. $REGN - MarketBeat",MarketBeat
"Thu, 11 Sep 2025 07:00:00 GMT","Nissay Asset Management Corp Japan ADV Purchases 2,292 Shares of Regeneron Pharmaceuticals, Inc. $REGN - MarketBeat",MarketBeat
"Thu, 11 Sep 2025 07:00:00 GMT","MIRAE ASSET GLOBAL ETFS HOLDINGS Ltd. Boosts Stock Holdings in Regeneron Pharmaceuticals, Inc. $REGN - MarketBeat",MarketBeat
"Sat, 13 Sep 2025 07:37:44 GMT","Jacobs Levy Equity Management Inc. Lowers Stake in Regeneron Pharmaceuticals, Inc. $REGN - Defense World",Defense World
2025-09-14T08:17:06,"BMO Capital Maintains a Buy on Regeneron Pharmaceuticals (REGN), Sets a $640 PT",Yahoo
2025-09-09T22:10:04,Regeneron's Libtayo Combo Achieves Nearly Double Survival Rate In Advanced Lung Cancer Compared To Chemotherapy,Yahoo
2025-09-09T14:00:00,Libtayo® (cemiplimab) Plus Chemotherapy Results at Five Years Reinforce Significant and Durable Improvements in Survival Outcomes for Advanced Non-small Cell Lung Cancer,Yahoo
