Date,Title,Source
2025-09-29T09:04:47Z,Dakota Wealth Management Buys 16 Shares of Booking Holdings Inc. $BKNG,ETF Daily News
"Mon, 29 Sep 2025 22:00:00 GMT",Booking Holdings (BKNG) Stock Dips While Market Gains: Key Facts - Nasdaq,Nasdaq
"Mon, 29 Sep 2025 09:55:24 GMT",Booking Holdings Inc. $BKNG Shares Sold by V Square Quantitative Management LLC - MarketBeat,MarketBeat
"Mon, 29 Sep 2025 09:39:23 GMT",Capital Insight Partners LLC Trims Stake in Booking Holdings Inc. $BKNG - MarketBeat,MarketBeat
"Fri, 26 Sep 2025 19:19:00 GMT","Notable Friday Option Activity: UPST, SKYT, BKNG - Nasdaq",Nasdaq
"Mon, 29 Sep 2025 09:29:26 GMT","Overbrook Management Corp Purchases 1,098 Shares of Booking Holdings Inc. $BKNG - MarketBeat",MarketBeat
"Mon, 29 Sep 2025 09:03:19 GMT",Smith Salley Wealth Management Purchases 80 Shares of Booking Holdings Inc. $BKNG - MarketBeat,MarketBeat
"Mon, 29 Sep 2025 10:26:11 GMT",GC Wealth Management RIA LLC Has $5.93 Million Holdings in Booking Holdings Inc. $BKNG - MarketBeat,MarketBeat
"Sun, 28 Sep 2025 10:25:40 GMT",Booking Holdings Inc. $BKNG Shares Bought by Signaturefd LLC - MarketBeat,MarketBeat
"Sat, 27 Sep 2025 10:27:31 GMT",Congress Asset Management Co. Decreases Stake in Booking Holdings Inc. $BKNG - MarketBeat,MarketBeat
"Sat, 27 Sep 2025 10:36:20 GMT",Booking Holdings Inc. $BKNG Shares Purchased by SeaBridge Investment Advisors LLC - MarketBeat,MarketBeat
"Sun, 28 Sep 2025 12:19:13 GMT",Fort Washington Investment Advisors Inc. OH Boosts Position in Booking Holdings Inc. $BKNG - MarketBeat,MarketBeat
"Sat, 27 Sep 2025 10:27:31 GMT",State of Alaska Department of Revenue Sells 215 Shares of Booking Holdings Inc. $BKNG - MarketBeat,MarketBeat
"Sat, 27 Sep 2025 10:27:31 GMT",One Plus One Wealth Management LLC Purchases Shares of 63 Booking Holdings Inc. $BKNG - MarketBeat,MarketBeat
"Fri, 26 Sep 2025 11:07:36 GMT",Booking Holdings Inc. $BKNG Shares Sold by ST Germain D J Co. Inc. - MarketBeat,MarketBeat
"Fri, 26 Sep 2025 11:21:29 GMT",FCG Investment Co Sells 69 Shares of Booking Holdings Inc. $BKNG - MarketBeat,MarketBeat
"Sat, 27 Sep 2025 10:27:31 GMT",HS Management Partners LLC Has $60.54 Million Stock Position in Booking Holdings Inc. $BKNG - MarketBeat,MarketBeat
"Fri, 26 Sep 2025 11:07:25 GMT","Plancorp LLC Has $839,000 Stock Position in Booking Holdings Inc. $BKNG - MarketBeat",MarketBeat
"Sat, 27 Sep 2025 10:27:31 GMT","U.S. Capital Wealth Advisors LLC Makes New $266,000 Investment in Booking Holdings Inc. $BKNG - MarketBeat",MarketBeat
"Fri, 26 Sep 2025 11:05:20 GMT",Hartford Investment Management Co. Lowers Stock Position in Booking Holdings Inc. $BKNG - MarketBeat,MarketBeat
"Sat, 27 Sep 2025 10:27:31 GMT",Eagle Global Advisors LLC Has $16.94 Million Stock Position in Booking Holdings Inc. $BKNG - MarketBeat,MarketBeat
"Thu, 25 Sep 2025 09:39:53 GMT",Booking Holdings Inc. $BKNG Shares Sold by Beacon Investment Advisory Services Inc. - MarketBeat,MarketBeat
"Fri, 26 Sep 2025 11:05:20 GMT","Banque Pictet & Cie SA Sells 1,341 Shares of Booking Holdings Inc. $BKNG - MarketBeat",MarketBeat
"Fri, 26 Sep 2025 10:53:16 GMT",Bank Pictet & Cie Europe AG Purchases 51 Shares of Booking Holdings Inc. $BKNG - MarketBeat,MarketBeat
"Thu, 25 Sep 2025 08:40:36 GMT",Fifth Third Bancorp Boosts Stock Position in Booking Holdings Inc. $BKNG - MarketBeat,MarketBeat
"Thu, 25 Sep 2025 11:21:22 GMT",MEAG MUNICH ERGO Kapitalanlagegesellschaft mbH Sells 364 Shares of Booking Holdings Inc. $BKNG - MarketBeat,MarketBeat
"Sun, 28 Sep 2025 05:12:57 GMT",Is BKNG a good long term investment - Economic Indicators Overview & Download Our Free Trading Blueprint - earlytimes.in,earlytimes.in
"Sun, 28 Sep 2025 17:35:45 GMT",Is BKNG a good long term investment - Stock Price Divergence & Turn Bull Runs into Life-Changing Wealth - earlytimes.in,earlytimes.in
"Mon, 29 Sep 2025 17:43:11 GMT",How supply chain issues affect BKNG stock - Dividend Hike & Proven Capital Preservation Tips - newser.com,newser.com
"Mon, 29 Sep 2025 12:22:21 GMT",Is BKNG showing signs of accumulation - 2025 Macro Impact & Low Risk Entry Point Tips - newser.com,newser.com
"Tue, 30 Sep 2025 06:18:34 GMT",What sentiment indicators say about BKNG stock - Analyst Downgrade & Long-Term Safe Investment Plans - newser.com,newser.com
"Tue, 30 Sep 2025 04:11:16 GMT",What sentiment indicators say about BKNG stock - July 2025 Opening Moves & Reliable Price Action Trade Plans - newser.com,newser.com
"Mon, 29 Sep 2025 18:20:24 GMT",BKNG stock daily chart insights - Forecast Cut & Advanced Swing Trade Entry Plans - newser.com,newser.com
"Fri, 26 Sep 2025 19:37:23 GMT",What sentiment indicators say about BKNG stock - Weekly Market Summary & Real-Time Volume Triggers - newser.com,newser.com
"Sat, 27 Sep 2025 21:12:37 GMT",How supply chain issues affect BKNG stock - July 2025 Summary & Proven Capital Preservation Tips - newser.com,newser.com
"Fri, 26 Sep 2025 16:24:34 GMT",What sentiment indicators say about BKNG stock - CEO Change & Daily Entry Point Alerts - newser.com,newser.com
"Mon, 29 Sep 2025 03:19:28 GMT",What sentiment indicators say about BKNG stock - Portfolio Performance Summary & Weekly High Potential Stock Alerts - newser.com,newser.com
"Mon, 29 Sep 2025 05:24:18 GMT",BKNG stock daily chart insights - Rate Cut & AI Optimized Trading Strategy Guides - newser.com,newser.com
