Date,Title,Source
2025-09-06T14:34:55Z,Oldest Recorded Transaction,Avi.im
2025-09-04T18:49:13Z,Semiconductor Stock's Pullback Presents Buying Opportunity,Yahoo Entertainment
"Sun, 07 Sep 2025 18:22:46 GMT",Jim Cramer Reveals Why Texas Instruments Incorporated (TXN)’s Shares Dipped Lower - Yahoo Finance,Yahoo Finance
"Sun, 07 Sep 2025 14:53:14 GMT","Texas Instruments (NASDAQ:TXN) sheds 7.2% this week, as yearly returns fall more in line with earnings growth - simplywall.st",simplywall.st
"Mon, 08 Sep 2025 01:50:46 GMT",Texas Instruments (TXN) Semiconductors Enable NISAR Satellite Payloads - MSN,MSN
"Sun, 07 Sep 2025 20:44:02 GMT",Price-Driven Insight from (TXN) for Rule-Based Strategy - news.stocktradersdaily.com,news.stocktradersdaily.com
"Fri, 05 Sep 2025 08:36:42 GMT",Texas Instruments (TXN): Stock Drops 4% on Chip Demand Slowdown After Tariff-Driven Surge - CoinCentral,CoinCentral
"Thu, 04 Sep 2025 13:58:00 GMT","Biggest stock movers Thursday: CRM, AI, FIG, TXN and more - Seeking Alpha",Seeking Alpha
"Fri, 05 Sep 2025 21:13:53 GMT",Texas Instruments (TXN) Faces Volatility Amid Demand Concerns - GuruFocus,GuruFocus
"Thu, 04 Sep 2025 19:42:00 GMT","Noteworthy Thursday Option Activity: DJT, RH, TXN - Nasdaq",Nasdaq
"Thu, 04 Sep 2025 16:15:00 GMT",Why Texas Instruments (TXN) Stock Is Falling Today - FinancialContent,FinancialContent
"Sun, 07 Sep 2025 18:45:48 GMT",Texas Instruments Inc. (TXN) Semiconductors Tapped for NASA Radar Imaging - MSN,MSN
"Fri, 05 Sep 2025 12:04:15 GMT","B of A Securities Lowers Price Target for TXN, Maintains Neutral Rating | TXN Stock News - GuruFocus",GuruFocus
"Thu, 04 Sep 2025 14:50:00 GMT","QQQ, TXN, BKNG, APP: ETF Outflow Alert - Nasdaq",Nasdaq
"Thu, 04 Sep 2025 19:30:02 GMT",Precision Trading with Texas Instruments Incorporated (TXN) Risk Zones - news.stocktradersdaily.com,news.stocktradersdaily.com
"Wed, 03 Sep 2025 11:00:15 GMT",These 4 Measures Indicate That Texas Instruments (NASDAQ:TXN) Is Using Debt Reasonably Well - Yahoo Finance,Yahoo Finance
"Thu, 04 Sep 2025 15:26:02 GMT",TXN Demand Cools Post-April; CHIPS Act Funding Details - News and Statistics - IndexBox,IndexBox
"Thu, 04 Sep 2025 07:18:02 GMT",(TXN) Risk Channels and Responsive Allocation - news.stocktradersdaily.com,news.stocktradersdaily.com
"Thu, 04 Sep 2025 15:11:15 GMT",Texas Instruments Incorporated : TXN-USQ Transcript 2025-09-04 (1) - MarketScreener,MarketScreener
"Wed, 03 Sep 2025 23:10:02 GMT",Price-Driven Insight from (TXN) for Rule-Based Strategy - news.stocktradersdaily.com,news.stocktradersdaily.com
"Thu, 04 Sep 2025 18:40:08 GMT",Texas Instruments (TXN.US) reported a significant cooling of product demand in recent months. - 富途牛牛,富途牛牛
"Sun, 07 Sep 2025 18:32:22 GMT",Texas Instruments Incorporated (TXN) Shares Dipped Lower Amid Industry Slowdown Warning - AInvest,AInvest
"Sun, 07 Sep 2025 18:39:43 GMT",Assessing the Impact of Texas Instruments' (TXN) Soft Guidance on the Analog Semiconductor Sector - AInvest,AInvest
"Thu, 04 Sep 2025 18:57:22 GMT","Stock futures rise despite weak private payrolls report, with CRM, AI, FIG, TXN leading stock movers. - AInvest",AInvest
"Sun, 07 Sep 2025 06:18:02 GMT",Bank of America Lowers Texas Instruments (NASDAQ:TXN) Price Target to $208.00 - Defense World,Defense World
2025-09-04T21:49:13,Semiconductor Stock's Pullback Presents Buying Opportunity,Yahoo
2025-09-04T19:15:50,Why Texas Instruments (TXN) Stock Is Falling Today,Yahoo
2025-09-04T13:06:28,"Texas Instruments Incorporated (TXN) Presents at Citi's 2025 Global Technology, Media and Telecommunications Conference Transcript",SeekingAlpha
2025-09-03T14:00:15,These 4 Measures Indicate That Texas Instruments (NASDAQ:TXN) Is Using Debt Reasonably Well,Yahoo
