Date,Title,Source
2025-10-30T08:16:48Z,What Are Wall Street Analysts' Target Price for Cisco Systems Stock?,Biztoc.com
"Mon, 03 Nov 2025 22:45:03 GMT",Why Cisco Systems (CSCO) Outpaced the Stock Market Today - Yahoo Finance,Yahoo Finance
"Tue, 04 Nov 2025 06:44:59 GMT",Is CSCO stock entering bullish territory - Risk Management & Precise Buy Zone Tips - newser.com,newser.com
"Mon, 03 Nov 2025 19:53:00 GMT",A reordering of the COO and CSCO logistics agenda - Supply Chain Management Review,Supply Chain Management Review
"Mon, 03 Nov 2025 22:24:00 GMT",Cisco Systems (NASDAQ:CSCO) Shares Up 1.8% After Analyst Upgrade - MarketBeat,MarketBeat
"Mon, 03 Nov 2025 12:03:00 GMT",UBS Upgrades Cisco Systems (CSCO) - Nasdaq,Nasdaq
"Mon, 03 Nov 2025 12:20:00 GMT",New Analyst Forecast: $CSCO Given $88.0 Price Target - Quiver Quantitative,Quiver Quantitative
"Mon, 03 Nov 2025 21:33:59 GMT",(CSCO) Technical Analysis and Trading Signals (CSCO:CA) - news.stocktradersdaily.com,news.stocktradersdaily.com
"Sat, 01 Nov 2025 14:55:09 GMT",CSCO Returns $143 Bil to Shareholders in 10 Years - Trefis,Trefis
"Sun, 02 Nov 2025 18:40:09 GMT",How Investors May Respond To Cisco Systems (CSCO) Doubling AI Order Expectations With New Infrastructure Launch - simplywall.st,simplywall.st
"Mon, 03 Nov 2025 17:10:02 GMT",Will Cisco (CSCO) Beat Estimates Again in Its Next Earnings Report? - Yahoo Finance,Yahoo Finance
"Tue, 04 Nov 2025 07:39:00 GMT",Is CSCO meeting your algorithmic filter criteria - July 2025 Snapshot & Weekly Watchlist for Hot Stocks - newser.com,newser.com
"Mon, 03 Nov 2025 18:34:01 GMT",Technical Reactions to CSCO Trends in Macro Strategies - news.stocktradersdaily.com,news.stocktradersdaily.com
"Tue, 04 Nov 2025 07:20:28 GMT",How CSCO stock reacts to job market data - Sell Signal & Precise Swing Trade Entry Alerts - newser.com,newser.com
"Fri, 31 Oct 2025 10:06:43 GMT",Cisco Systems (CSCO): Assessing Valuation After Recent Share Price Gains and Investor Optimism - Yahoo Finance,Yahoo Finance
"Mon, 03 Nov 2025 10:27:44 GMT","Cisco Systems, Inc. $CSCO Shares Sold by TIAA Trust National Association - MarketBeat",MarketBeat
"Mon, 03 Nov 2025 14:00:00 GMT",Cisco (NASDAQ: CSCO) rolls out Unified Branch; Access Manager GA in Q4 2025 - Stock Titan,Stock Titan
"Mon, 03 Nov 2025 14:00:00 GMT","Cisco (NASDAQ: CSCO) unveils Unified Edge for real-time AI; orderable now, GA by year-end - Stock Titan",Stock Titan
"Mon, 03 Nov 2025 16:07:47 GMT",Cisco Systems (CSCO) Upgraded to Buy by UBS Amid AI Infrastructu - GuruFocus,GuruFocus
"Mon, 03 Nov 2025 11:16:19 GMT","Burney Co. Has $16.28 Million Stock Holdings in Cisco Systems, Inc. $CSCO - MarketBeat",MarketBeat
"Mon, 03 Nov 2025 15:48:00 GMT","TQQQ, NFLX, COST, CSCO: Large Outflows Detected at ETF - Nasdaq",Nasdaq
"Mon, 03 Nov 2025 12:25:16 GMT","Machina Capital S.A.S. Sells 7,656 Shares of Cisco Systems, Inc. $CSCO - MarketBeat",MarketBeat
"Mon, 03 Nov 2025 12:37:25 GMT","KDT Advisors LLC Sells 5,000 Shares of Cisco Systems, Inc. $CSCO - MarketBeat",MarketBeat
"Mon, 03 Nov 2025 15:27:56 GMT",Cisco (CSCO) Launches Unified Edge to Tackle AI Capacity Constra - GuruFocus,GuruFocus
"Mon, 03 Nov 2025 12:24:14 GMT",UBS Upgrades Cisco Systems (CSCO) to 'Buy' with Raised Price Tar - GuruFocus,GuruFocus
"Mon, 03 Nov 2025 08:00:00 GMT",Cisco Systems (NASDAQ:CSCO) Nasdaq Composite Leads Tech Growth - Kalkine Media,Kalkine Media
"Sun, 02 Nov 2025 12:52:28 GMT","Cisco Systems, Inc. $CSCO Stock Position Trimmed by South Dakota Investment Council - MarketBeat",MarketBeat
"Sat, 01 Nov 2025 09:33:41 GMT","24,462 Shares in Cisco Systems, Inc. $CSCO Bought by GAM Holding AG - MarketBeat",MarketBeat
"Mon, 03 Nov 2025 15:22:20 GMT",Cisco Systems (NASDAQ:CSCO) Reaches New 12-Month High After Analyst Upgrade - MarketBeat,MarketBeat
"Mon, 03 Nov 2025 08:55:32 GMT","Assetmark Inc. Increases Stake in Cisco Systems, Inc. $CSCO - MarketBeat",MarketBeat
"Sat, 01 Nov 2025 09:33:40 GMT","Integrity Alliance LLC. Sells 27,549 Shares of Cisco Systems, Inc. $CSCO - MarketBeat",MarketBeat
"Sat, 01 Nov 2025 11:09:11 GMT","Cisco Systems, Inc. $CSCO Stock Holdings Lessened by Alexander Randolph Advisory Inc. - MarketBeat",MarketBeat
"Mon, 03 Nov 2025 13:21:40 GMT",Cisco Systems (NASDAQ:CSCO) Raised to Buy at UBS Group - MarketBeat,MarketBeat
"Sat, 01 Nov 2025 11:07:09 GMT","Aviance Capital Partners LLC Sells 77,287 Shares of Cisco Systems, Inc. $CSCO - MarketBeat",MarketBeat
"Sat, 01 Nov 2025 11:31:09 GMT","Longbow Finance SA Has $7.18 Million Position in Cisco Systems, Inc. $CSCO - MarketBeat",MarketBeat
"Sat, 01 Nov 2025 10:30:44 GMT","Crescent Sterling Ltd. Sells 4,449 Shares of Cisco Systems, Inc. $CSCO - MarketBeat",MarketBeat
"Fri, 31 Oct 2025 10:30:32 GMT","Cisco Systems, Inc. $CSCO Stock Holdings Lowered by Pinnacle Associates Ltd. - MarketBeat",MarketBeat
"Sat, 01 Nov 2025 09:08:55 GMT","Impact Partnership Wealth LLC Cuts Holdings in Cisco Systems, Inc. $CSCO - MarketBeat",MarketBeat
"Sat, 01 Nov 2025 09:15:05 GMT","Kovack Advisors Inc. Lowers Position in Cisco Systems, Inc. $CSCO - MarketBeat",MarketBeat
"Sat, 01 Nov 2025 10:08:16 GMT","Syverson Strege & Co Makes New Investment in Cisco Systems, Inc. $CSCO - MarketBeat",MarketBeat
"Mon, 03 Nov 2025 06:14:10 GMT",What catalysts could drive CSCO stock higher - July 2025 Weekly Recap & Accurate Buy Signal Notifications - newser.com,newser.com
"Fri, 31 Oct 2025 08:28:36 GMT",How CSCO stock reacts to job market data - Rate Cut & Low Drawdown Momentum Trade Ideas - newser.com,newser.com
"Sun, 02 Nov 2025 11:44:12 GMT","Zweig DiMenna Associates LLC Buys Shares of 60,000 Cisco Systems, Inc. $CSCO - MarketBeat",MarketBeat
"Mon, 03 Nov 2025 11:08:42 GMT",Is CSCO meeting your algorithmic filter criteria - Weekly Market Report & Daily Technical Forecast Reports - newser.com,newser.com
"Sun, 02 Nov 2025 11:44:12 GMT","MUFG Securities EMEA plc Takes Position in Cisco Systems, Inc. $CSCO - MarketBeat",MarketBeat
"Thu, 30 Oct 2025 11:45:41 GMT","Cisco Systems (CSCO) Stock Price Prediction: 2025, 2026, 2030 - Benzinga",Benzinga
"Mon, 03 Nov 2025 07:43:50 GMT",Will CSCO continue its uptrend - 2025 EndofYear Setup & Technical Pattern Based Signals - newser.com,newser.com
"Fri, 31 Oct 2025 09:00:30 GMT","Cisco Systems, Inc. $CSCO Stock Holdings Trimmed by Spire Wealth Management - MarketBeat",MarketBeat
"Fri, 31 Oct 2025 11:26:39 GMT","Fisher Funds Management LTD Sells 47,523 Shares of Cisco Systems, Inc. $CSCO - MarketBeat",MarketBeat
"Fri, 31 Oct 2025 04:53:44 GMT",Will CSCO outperform the market - Market Trend Report & Growth Oriented Trading Recommendations - newser.com,newser.com
"Fri, 31 Oct 2025 09:41:40 GMT","Simon Quick Advisors LLC Boosts Holdings in Cisco Systems, Inc. $CSCO - MarketBeat",MarketBeat
"Fri, 31 Oct 2025 11:26:35 GMT","Bridgewealth Advisory Group LLC Invests $457,000 in Cisco Systems, Inc. $CSCO - MarketBeat",MarketBeat
"Fri, 31 Oct 2025 10:39:58 GMT","Lockheed Martin Investment Management Co. Decreases Stock Position in Cisco Systems, Inc. $CSCO - MarketBeat",MarketBeat
"Thu, 30 Oct 2025 10:42:12 GMT","Keybank National Association OH Sells 30,201 Shares of Cisco Systems, Inc. $CSCO - MarketBeat",MarketBeat
"Thu, 30 Oct 2025 16:40:10 GMT",Cisco (CSCO) Faces New Competitive Landscape as TP-Link Sales Ban Proposed - GuruFocus,GuruFocus
"Thu, 30 Oct 2025 08:31:19 GMT",Is a relief rally coming for CSCO holders - July 2025 Selloffs & Short-Term High Return Ideas - newser.com,newser.com
"Fri, 31 Oct 2025 08:39:29 GMT",Will CSCO stock outperform value stocks - 2025 Institutional Moves & Accurate Trade Setup Notifications - newser.com,newser.com
"Thu, 30 Oct 2025 11:26:28 GMT","Savvy Advisors Inc. Purchases 5,194 Shares of Cisco Systems, Inc. $CSCO - MarketBeat",MarketBeat
"Thu, 30 Oct 2025 12:24:28 GMT","Ledyard National Bank Sells 8,233 Shares of Cisco Systems, Inc. $CSCO - MarketBeat",MarketBeat
"Thu, 30 Oct 2025 17:00:20 GMT","Cisco Systems' (CSCO) ""Buy (B)"" Rating Reaffirmed at Weiss Ratings - MarketBeat",MarketBeat
"Thu, 30 Oct 2025 12:08:26 GMT","Cisco Systems, Inc. $CSCO Shares Sold by Strs Ohio - MarketBeat",MarketBeat
"Thu, 30 Oct 2025 11:40:21 GMT","Heritage Investors Management Corp Sells 14,359 Shares of Cisco Systems, Inc. $CSCO - MarketBeat",MarketBeat
"Thu, 30 Oct 2025 12:08:30 GMT","KLCM Advisors Inc. Reduces Holdings in Cisco Systems, Inc. $CSCO - MarketBeat",MarketBeat
"Thu, 30 Oct 2025 11:40:28 GMT","Amalgamated Bank Increases Stock Position in Cisco Systems, Inc. $CSCO - MarketBeat",MarketBeat
"Thu, 30 Oct 2025 11:10:19 GMT","Retirement Systems of Alabama Lowers Stock Holdings in Cisco Systems, Inc. $CSCO - MarketBeat",MarketBeat
"Thu, 30 Oct 2025 12:08:29 GMT","Cisco Systems, Inc. $CSCO Shares Acquired by Adell Harriman & Carpenter Inc. - MarketBeat",MarketBeat
"Fri, 31 Oct 2025 11:00:40 GMT",Will CSCO outperform the market - Recession Risk & Precise Buy Zone Tips - newser.com,newser.com
"Tue, 04 Nov 2025 06:45:41 GMT",Cisco Systems (NASDAQ:CSCO) Sets New 12-Month High on Analyst Upgrade - Defense World,Defense World
"Tue, 04 Nov 2025 07:40:47 GMT",Cisco Systems (NASDAQ:CSCO) Trading Up 1.8% on Analyst Upgrade - Defense World,Defense World
2025-11-03T16:54:04,"Netflix, Cisco, Roku: Top analyst calls",Yahoo
2025-11-03T15:00:00,Cisco Debuts New Unified Edge Platform for Distributed Agentic AI Workloads,Yahoo
2025-11-03T15:00:00,Cisco Supercharges its Secure Enterprise Network Architecture for the AI Era,Yahoo
2025-11-03T15:00:00,"Cisco Simplifies Security for Managed Service Providers, Accelerating Their Hybrid Mesh Firewall Deployments and Business Growth",Yahoo
2025-10-31T11:06:43,Cisco Systems (CSCO): Assessing Valuation After Recent Share Price Gains and Investor Optimism,Yahoo
