Date,Title,Source
2025-11-21T19:23:37Z,"I Liked Alphabet (GOOGL) CEO’s Skepticism, Says Jim Cramer",Yahoo Entertainment
2025-11-21T16:18:38Z,"Gemini 3 Launch Reinforces Alphabet (GOOGL)’s AI Edge, Says KeyBanc",Biztoc.com
2025-11-21T15:44:12Z,"Gemini 3 Launch Reinforces Alphabet (GOOGL)’s AI Edge, Says KeyBanc",Yahoo Entertainment
2025-11-21T10:03:03Z,Jim Cramer on Alphabet: “You’re Buying a Buffett-Endorsed Company”,Yahoo Entertainment
2025-11-20T19:04:58Z,"As AI Propels Alphabet Stock Upward, GOOGL Nears $4 Trillion Valuation",Biztoc.com
2025-11-20T18:50:50Z,"As AI Propels Alphabet Stock Upward, GOOGL Nears $4 Trillion Valuation",Barchart.com
2025-11-20T17:45:07Z,Google Pixel Buds Pro 2 at Google Store with mypixel app $10 discount $159,Slickdeals.net
2025-11-20T14:54:09Z,"Google, Meta, Amazon, Microsoft and Oracle issued $121 billion in debt to fund AI bets — 4x than usual: Report",Livemint
2025-11-20T08:13:48Z,Loop Turns Bullish on Alphabet (GOOGL): ‘Wall of Worry Obliterated Under Waves of AI Enthusiasm’,Yahoo Entertainment
2025-11-19T21:25:12Z,"Is GOOGL Stock a Buy, Sell, or Hold as Google Launches Gemini 3?",Biztoc.com
2025-11-19T21:15:26Z,"Is GOOGL Stock a Buy, Sell, or Hold as Google Launches Gemini 3?",Barchart.com
2025-11-19T20:48:57Z,Google Stock Is Crushing the Rest of the Magnificent Seven—Here's Why,Investopedia
2025-11-19T18:47:19Z,Gemini 3 Pushes Google Stock to New All-Time Highs. Is It Too Late to Buy GOOGL Here?,Biztoc.com
2025-11-19T18:39:24Z,Gemini 3 Pushes Google Stock to New All-Time Highs. Is It Too Late to Buy GOOGL Here?,Barchart.com
2025-11-19T18:36:25Z,"Large, Unusual Call Options Trading in GOOGL Stock Highlights Its Value",Biztoc.com
2025-11-19T18:30:02Z,"Large, Unusual Call Options Trading in GOOGL Stock Highlights Its Value",Barchart.com
2025-11-19T17:40:24Z,Hits All-Time High Days After Warren Buffett Stake Disclosed,Biztoc.com
2025-11-19T17:17:23Z,5-star analyst revamps Google stock target on three-shot case,Biztoc.com
2025-11-19T17:06:00Z,Loop Capital Says Ride the ‘Waves of AI Optimism’ and Buy Google Stock Here,Barchart.com
2025-11-19T16:23:52Z,AI data center projects drive up memory chip prices. Here's why.,Yahoo Entertainment
2025-11-19T16:05:52Z,Alphabet (GOOGL) stock jumps over 6% to hit $300 for the first time in history as Gemini 3 powers Alphabet’s biggest breakout of the year,The Times of India
2025-11-19T15:58:25Z,Live Nasdaq Composite: Markets Find Tailwinds on Nvidia Earnings Day,Biztoc.com
2025-11-19T12:36:21Z,"Loop Capital Upgrades Alphabet Inc. (GOOGL) To Buy, Raises PT",Biztoc.com
2025-11-19T12:11:12Z,"Loop Capital Upgrades Alphabet Inc. (GOOGL) To Buy, Raises PT",Yahoo Entertainment
2025-11-19T00:00:00Z,Google CEO drops a bombshell comment on AI bubble,TheStreet
2025-11-18T17:17:00Z,Alphabet: Buffett's Bet on Its Next Phase of Growth,MarketBeat
2025-11-18T15:22:00Z,"AI Bubble Burst Could Hit Every Company in the Industry, According to Alphabet CEO",Biztoc.com
2025-11-18T15:10:15Z,"Amazon downgraded, Alphabet upgraded: Wall Street's top analyst calls",Biztoc.com
2025-11-18T14:59:22Z,"AI Bubble Burst Could Hit Every Company in the Industry, According to Alphabet CEO",Biztoc.com
2025-11-18T14:37:39Z,"“What a Great Company,” Says Jim Cramer About Alphabet (GOOGL)",Biztoc.com
2025-11-18T13:46:13Z,"“What a Great Company,” Says Jim Cramer About Alphabet (GOOGL)",Yahoo Entertainment
2025-11-18T12:00:10Z,"Google CEO warns of ""irrationality"" in current AI boom, no companies ""immune"" to burst (GOOG:NASDAQ)",Biztoc.com
2025-11-18T11:16:29Z,Google earns the Berkshire Hathaway vote of confidence,Biztoc.com
2025-11-18T11:00:42Z,Google earns the Berkshire Hathaway vote of confidence,Yahoo Entertainment
"Fri, 21 Nov 2025 21:00:00 GMT",GOOGL - Alphabet Inc Stock Price and Quote - Finviz,Finviz
"Sun, 23 Nov 2025 05:56:00 GMT",Jim Cramer Wonders Whether OpenAI Will be Able to Beat Alphabet (GOOGL) - Yahoo Finance UK,Yahoo Finance UK
"Wed, 19 Nov 2025 11:31:05 GMT",Top Analyst Upgrades Alphabet Stock (GOOGL) to Buy and Lifts Price Target to $320. Here’s Why - TipRanks,TipRanks
"Wed, 19 Nov 2025 20:48:57 GMT",Google Stock Is Crushing the Rest of the Magnificent Seven—Here's Why - Investopedia,Investopedia
"Fri, 21 Nov 2025 14:30:36 GMT",Big Tech Firms Microsoft (MSFT) and Alphabet (GOOGL) Lead in Durable Carbon Removal Investments Exceeding $10 Billion - CarbonCredits.com,CarbonCredits.com
"Fri, 21 Nov 2025 12:21:04 GMT",Alphabet Cl A (GOOGL-Q) Stock Price and News - The Globe and Mail,The Globe and Mail
"Fri, 21 Nov 2025 16:07:43 GMT","Gemini 3 Launch Reinforces Alphabet (GOOGL)’s AI Edge, Says KeyBanc - MSN",MSN
"Sat, 22 Nov 2025 11:10:23 GMT",Alphabet (GOOGL) Stock: Google Tops Microsoft in Market Cap for First Time Since 2018 - CoinCentral,CoinCentral
"Sat, 22 Nov 2025 18:10:40 GMT",Direxion Daily GOOGL Bull 2X Shares (NASDAQ:GGLL) Trading 6.4% Higher - Time to Buy? - MarketBeat,MarketBeat
"Wed, 19 Nov 2025 21:15:26 GMT","Is GOOGL Stock a Buy, Sell, or Hold as Google Launches Gemini 3? - Yahoo Finance",Yahoo Finance
"Thu, 20 Nov 2025 21:22:16 GMT","Investor George Soros Increases Stake in Alphabet Stock (GOOGL) by 2,300% - TipRanks",TipRanks
"Thu, 20 Nov 2025 08:33:36 GMT",Loop Turns Bullish on Alphabet (GOOGL): ‘Wall of Worry Obliterated Under Waves of AI Enthusiasm’ - MSN,MSN
"Wed, 19 Nov 2025 17:46:50 GMT",Why Alphabet (GOOGL) Stock Is Up Today - Yahoo Finance,Yahoo Finance
"Fri, 21 Nov 2025 19:23:37 GMT","I Liked Alphabet (GOOGL) CEO’s Skepticism, Says Jim Cramer - Yahoo Finance",Yahoo Finance
"Thu, 20 Nov 2025 18:50:50 GMT","As AI Propels Alphabet Stock Upward, GOOGL Nears $4 Trillion Valuation - Yahoo Finance",Yahoo Finance
"Tue, 18 Nov 2025 13:46:13 GMT","“What a Great Company,” Says Jim Cramer About Alphabet (GOOGL) - Yahoo Finance",Yahoo Finance
"Wed, 19 Nov 2025 18:39:24 GMT",Gemini 3 Pushes Google Stock to New All-Time Highs. Is It Too Late to Buy GOOGL Here? - Yahoo Finance,Yahoo Finance
"Wed, 19 Nov 2025 16:05:52 GMT",Alphabet (GOOGL) stock jumps over 6% to hit $300 for the first time in history as Gemini 3 powers Alphabet - The Economic Times,The Economic Times
"Thu, 20 Nov 2025 14:15:03 GMT",Alphabet Inc. (GOOGL) Hits Fresh High: Is There Still Room to Run? - Yahoo Finance,Yahoo Finance
"Fri, 21 Nov 2025 16:28:20 GMT","Alphabet (GOOGL ) Has ‘Already Won the AI Game,’ Says Mizuho - TipRanks",TipRanks
"Wed, 19 Nov 2025 12:11:12 GMT","Loop Capital Upgrades Alphabet Inc. (GOOGL) To Buy, Raises PT - Yahoo Finance",Yahoo Finance
"Thu, 20 Nov 2025 22:43:57 GMT",How Investors May Respond To Alphabet (GOOGL) Boosting AI Leadership With Gemini 3 and Berkshire Backing - simplywall.st,simplywall.st
"Wed, 19 Nov 2025 15:24:41 GMT",Alphabet (GOOGL) Stock Climbs 5% to All-Time High as Tech Rally Accelerates - Yahoo Finance,Yahoo Finance
"Thu, 20 Nov 2025 18:35:43 GMT","Dow Futures Rise As Investors Cheer Nvidia’s Earnings Beat: NVDA, AMD, GOOGL, WMT Among Stocks To Watch - Stocktwits",Stocktwits
"Fri, 21 Nov 2025 17:39:37 GMT",Google rolls out ads in AI Mode results (GOOGL:NASDAQ) - Seeking Alpha,Seeking Alpha
"Fri, 21 Nov 2025 20:15:00 GMT",Google continues to test ads in AI Mode results (update) (GOOGL:NASDAQ) - Seeking Alpha,Seeking Alpha
"Sat, 22 Nov 2025 13:53:26 GMT","Zions Bancorporation National Association UT Buys 6,953 Shares of Alphabet Inc. $GOOGL - MarketBeat",MarketBeat
"Sat, 22 Nov 2025 13:54:34 GMT",Alphabet Inc. $GOOGL Stake Lifted by Sound View Wealth Advisors Group LLC - MarketBeat,MarketBeat
"Fri, 21 Nov 2025 12:55:46 GMT",Alphabet Inc. $GOOGL Shares Sold by ZEGA Investments LLC - MarketBeat,MarketBeat
"Sat, 22 Nov 2025 09:07:21 GMT","Bornite Capital Management LP Purchases Shares of 100,000 Alphabet Inc. $GOOGL - MarketBeat",MarketBeat
"Sat, 22 Nov 2025 09:07:22 GMT",Alphabet Inc. $GOOGL is CSM Advisors LLC's 8th Largest Position - MarketBeat,MarketBeat
"Sat, 22 Nov 2025 09:07:23 GMT",Alphabet Inc. $GOOGL Shares Sold by Brio Consultants LLC - MarketBeat,MarketBeat
"Sat, 22 Nov 2025 09:07:23 GMT",Alphabet Inc. $GOOGL Holdings Boosted by DJE Kapital AG - MarketBeat,MarketBeat
"Sat, 22 Nov 2025 10:26:08 GMT",Alphabet Inc. $GOOGL Shares Purchased by SFE Investment Counsel - MarketBeat,MarketBeat
"Thu, 20 Nov 2025 15:55:44 GMT",Google Stock (GOOGL) Jumps after Launching Nano Banana Pro - TipRanks,TipRanks
"Sat, 22 Nov 2025 09:07:21 GMT",BCK Capital Management LP Grows Stock Holdings in Alphabet Inc. $GOOGL - MarketBeat,MarketBeat
"Sat, 22 Nov 2025 09:01:29 GMT",Alphabet Inc. $GOOGL Shares Sold by Efficient Advisors LLC - MarketBeat,MarketBeat
"Sat, 22 Nov 2025 10:26:07 GMT",Alphabet Inc. $GOOGL Shares Purchased by Fonville Wealth Management LLC - MarketBeat,MarketBeat
"Sat, 22 Nov 2025 10:26:10 GMT",PFG Advisors Has $6.32 Million Position in Alphabet Inc. $GOOGL - MarketBeat,MarketBeat
"Sat, 22 Nov 2025 10:26:07 GMT",Midwest Trust Co Makes New $139.47 Million Investment in Alphabet Inc. $GOOGL - MarketBeat,MarketBeat
"Sat, 22 Nov 2025 10:26:07 GMT",Alphabet Inc. $GOOGL Shares Bought by Mirabaud Asset Management Ltd - MarketBeat,MarketBeat
"Sat, 22 Nov 2025 10:26:09 GMT",Alphabet Inc. $GOOGL Position Raised by Future Fund LLC - MarketBeat,MarketBeat
"Fri, 21 Nov 2025 17:16:30 GMT",Alphabet (GOOGL) Stock: Google Reclaims Third Place as Market Value Tops $3.6 Trillion - parameter.io,parameter.io
"Sat, 22 Nov 2025 10:26:09 GMT","Flossbach Von Storch SE Buys 1,014,638 Shares of Alphabet Inc. $GOOGL - MarketBeat",MarketBeat
"Fri, 21 Nov 2025 10:25:17 GMT","Rathbones Group PLC Acquires 153,945 Shares of Alphabet Inc. $GOOGL - MarketBeat",MarketBeat
"Sat, 22 Nov 2025 10:26:07 GMT",King Luther Capital Management Corp Decreases Holdings in Alphabet Inc. $GOOGL - MarketBeat,MarketBeat
"Sat, 22 Nov 2025 10:26:07 GMT",Rollins Financial Advisors LLC Has $26.60 Million Position in Alphabet Inc. $GOOGL - MarketBeat,MarketBeat
"Fri, 21 Nov 2025 16:50:56 GMT",Alphabet (GOOGL) Stock: Google Presents Final Defense in Ad Tech Antitrust Trial - parameter.io,parameter.io
"Thu, 20 Nov 2025 00:19:06 GMT",Is GOOGL stock cheap at current valuation - Weekly Trend Summary & Comprehensive Market Scan Insights - newser.com,newser.com
"Sat, 22 Nov 2025 03:08:09 GMT","Sundar Pichai Sells 32,500 Shares of Alphabet (NASDAQ:GOOGL) Stock - MarketBeat",MarketBeat
"Sat, 22 Nov 2025 17:22:34 GMT","Roundhill GOOGL WeeklyPay ETF To Go Ex-Dividend On November 24th, 2025 With 0.5305 USD Dividend Per Share - 富途牛牛",富途牛牛
"Wed, 19 Nov 2025 12:11:12 GMT","Loop Capital Upgrades Alphabet Inc. (GOOGL) To Buy, Raises PT - Yahoo Finance UK",Yahoo Finance UK
"Fri, 21 Nov 2025 12:55:43 GMT",Alphabet Inc. $GOOGL is Van Cleef Asset Management Inc's 6th Largest Position - MarketBeat,MarketBeat
"Fri, 21 Nov 2025 10:25:21 GMT",Alphabet Inc. $GOOGL Shares Bought by Summit Investment Advisors Inc. - MarketBeat,MarketBeat
"Wed, 19 Nov 2025 15:23:48 GMT",Alphabet Stock (GOOGL) Hits All-Time High Days After Warren Buffett Stake Disclosed - TipRanks,TipRanks
"Thu, 20 Nov 2025 21:10:30 GMT",Google touts voluntary exit deals to UK employees - report (GOOGL:NASDAQ) - Seeking Alpha,Seeking Alpha
"Fri, 21 Nov 2025 10:25:15 GMT",Parkside Financial Bank & Trust Grows Position in Alphabet Inc. $GOOGL - MarketBeat,MarketBeat
"Fri, 21 Nov 2025 10:25:19 GMT",Jackson Square Partners LLC Has $10.51 Million Holdings in Alphabet Inc. $GOOGL - MarketBeat,MarketBeat
"Fri, 21 Nov 2025 10:25:23 GMT",Alphabet Inc. $GOOGL Holdings Reduced by Magellan Asset Management Ltd - MarketBeat,MarketBeat
"Fri, 21 Nov 2025 10:25:17 GMT","Prospera Financial Services Inc Purchases 23,674 Shares of Alphabet Inc. $GOOGL - MarketBeat",MarketBeat
"Thu, 20 Nov 2025 10:36:21 GMT",Alphabet (GOOGL) Stock: Gemini 3 Launch Pushes Shares to All-Time High - CoinCentral,CoinCentral
"Tue, 18 Nov 2025 13:55:00 GMT",Warren Buffett Knew Google Was a Smart Investment. Berkshire Waited 8 Years to Buy. - Barron's,Barron's
"Fri, 21 Nov 2025 10:28:04 GMT",Alphabet Inc. $GOOGL Position Raised by Mitsubishi UFJ Asset Management Co. Ltd. - MarketBeat,MarketBeat
"Fri, 21 Nov 2025 22:22:18 GMT",Alphabet (NASDAQ:GOOGL) Trading 3.5% Higher - Should You Buy? - MarketBeat,MarketBeat
"Tue, 18 Nov 2025 14:04:00 GMT",Alphabet Inc. Stock (GOOGL) Opinions on AI Competition and Cloud Growth - Quiver Quantitative,Quiver Quantitative
"Thu, 20 Nov 2025 07:31:16 GMT",Why Roundhill ETF Trust Roundhill GOOGL stock stays on buy lists - July 2025 Review & Weekly Watchlist for Consistent Profits - newser.com,newser.com
"Fri, 21 Nov 2025 10:28:04 GMT","Los Angeles Capital Management LLC Purchases 100,694 Shares of Alphabet Inc. $GOOGL - MarketBeat",MarketBeat
"Fri, 21 Nov 2025 17:15:16 GMT",Direxion Daily GOOGL Bull 2X Shares (NASDAQ:GGLL) Shares Gap Up - Here's What Happened - MarketBeat,MarketBeat
"Tue, 18 Nov 2025 13:31:41 GMT",TTD vs. GOOGL: Which Ad Tech Stock Is the Better Pick for Now? - Zacks Investment Research,Zacks Investment Research
"Fri, 21 Nov 2025 10:25:15 GMT",Freemont Management S.A. Raises Holdings in Alphabet Inc. $GOOGL - MarketBeat,MarketBeat
"Thu, 20 Nov 2025 12:27:21 GMT",Will Roundhill ETF Trust Roundhill GOOGL stock outperform Dow Jones - 2025 Breakouts & Breakdowns & Weekly Market Pulse Updates - newser.com,newser.com
"Fri, 21 Nov 2025 08:55:26 GMT",Alphabet Inc. $GOOGL Holdings Lifted by Aviva PLC - MarketBeat,MarketBeat
"Thu, 20 Nov 2025 06:53:00 GMT",Alphabet (NASDAQ:GOOGL) New Gemini 3 AI Model Boosts Stock Momentum - Kalkine Media,Kalkine Media
"Fri, 21 Nov 2025 10:25:16 GMT",Alphabet Inc. $GOOGL Position Boosted by RWA Wealth Partners LLC - MarketBeat,MarketBeat
"Wed, 19 Nov 2025 21:03:28 GMT",Will Roundhill ETF Trust Roundhill GOOGL stock benefit from commodity supercycle - Trend Reversal & Safe Entry Momentum Tips - newser.com,newser.com
"Fri, 21 Nov 2025 10:25:22 GMT",Garrison Point Advisors LLC Has $3.54 Million Holdings in Alphabet Inc. $GOOGL - MarketBeat,MarketBeat
"Wed, 19 Nov 2025 17:04:03 GMT",Google’s (GOOGL) Gemini 3 Impresses Developers after Beating Anthropic in Early Tests - TipRanks,TipRanks
"Wed, 19 Nov 2025 18:30:02 GMT","Large, Unusual Call Options Trading in GOOGL Stock Highlights Its Value - Barchart.com",Barchart.com
"Thu, 20 Nov 2025 09:39:20 GMT",Alphabet Inc. $GOOGL Shares Sold by Sterling Capital Management LLC - MarketBeat,MarketBeat
"Thu, 20 Nov 2025 09:39:17 GMT",Alphabet Inc. $GOOGL Shares Acquired by Harvest Portfolios Group Inc. - MarketBeat,MarketBeat
"Thu, 20 Nov 2025 21:30:30 GMT","Alphabet (NASDAQ:GOOGL) Earns ""Buy"" Rating from DZ Bank - MarketBeat",MarketBeat
"Thu, 20 Nov 2025 00:27:12 GMT",Is Roundhill ETF Trust Roundhill GOOGL stock inflation resilient - Trade Analysis Report & Daily Risk Controlled Trade Plans - newser.com,newser.com
"Wed, 19 Nov 2025 19:17:43 GMT",Will Roundhill ETF Trust Roundhill GOOGL stock outperform Dow Jones - Volume Spike & Proven Capital Preservation Methods - newser.com,newser.com
"Thu, 20 Nov 2025 16:26:00 GMT","IVV, AMZN, GOOGL, AVGO: Large Inflows Detected at ETF - Nasdaq",Nasdaq
"Tue, 18 Nov 2025 14:59:00 GMT",Loop Capital Upgrades Alphabet (GOOGL) - Nasdaq,Nasdaq
"Wed, 19 Nov 2025 16:37:56 GMT",Alphabet (GOOGL) Stock: Gemini 3 Launch and Buffett’s Backing Push Shares to Record High - parameter.io,parameter.io
"Wed, 19 Nov 2025 17:04:03 GMT",Alphabet’s Google Stock (GOOGL) Soars Toward an All-Time High as Gemini 3 Outperforms Rivals - TipRanks,TipRanks
"Wed, 19 Nov 2025 19:13:22 GMT",Is Roundhill ETF Trust Roundhill GOOGL stock a top dividend aristocrat candidate - Long Setup & Real-Time Volume Spike Alerts - newser.com,newser.com
"Thu, 20 Nov 2025 17:37:46 GMT",Direxion Daily GOOGL Bull 2X Shares (NASDAQ:GGLL) Sees Large Volume Increase - Here's What Happened - MarketBeat,MarketBeat
"Fri, 21 Nov 2025 04:05:11 GMT","Alphabet (NASDAQ:GOOGL) Shares Acquired Rep. Gilbert Ray Cisneros, Jr. - MarketBeat",MarketBeat
"Thu, 20 Nov 2025 09:27:16 GMT","Quadrant Private Wealth Management LLC Acquires 1,112 Shares of Alphabet Inc. $GOOGL - MarketBeat",MarketBeat
"Thu, 20 Nov 2025 09:27:16 GMT",Alphabet Inc. $GOOGL Shares Sold by Princeton Capital Management LLC - MarketBeat,MarketBeat
"Thu, 20 Nov 2025 09:39:20 GMT",Alphabet Inc. $GOOGL Shares Acquired by Vestmark Advisory Solutions Inc. - MarketBeat,MarketBeat
"Thu, 20 Nov 2025 09:39:19 GMT",Nvwm LLC Decreases Stock Holdings in Alphabet Inc. $GOOGL - MarketBeat,MarketBeat
"Thu, 20 Nov 2025 09:27:17 GMT",Alphabet Inc. $GOOGL is Wedbush Securities Inc.'s 10th Largest Position - MarketBeat,MarketBeat
2025-11-22T15:16:26,These Are the 3 Biggest Stocks in Alphabet’s Secret Portfolio,Yahoo
2025-11-22T11:30:00,How Google Finally Leapfrogged Rivals With New Gemini Rollout,Yahoo
2025-11-22T09:00:01,"This week in AI: Brushing off new bubble warnings, Google’s AI comeback and Nvidia’s China threat",CNBC
2025-11-22T08:59:01,"Brushing off new bubble warnings, Google’s AI comeback and Nvidia’s China threat",CNBC
2025-11-22T08:00:01,"AI Christmas: The latest devices from Amazon, Meta, Google and more",CNBC
2025-11-21T20:23:37,"I Liked Alphabet (GOOGL) CEO’s Skepticism, Says Jim Cramer",Yahoo
2025-11-21T19:29:21,Why Shares in Alphabet Bucked The Trend Today,Yahoo
2025-11-21T19:26:43,Google Just Dodged Its Biggest Threat Yet -- And AI May Have Handed It the Lifeline,Yahoo
2025-11-21T18:41:55,"Stock Market Tumbles On Nvidia, Bitcoin; Walmart, Google Strong: Weekly Review",Yahoo
2025-11-21T18:40:00,Google Now Has a Larger Market Value Than Microsoft. Why Alphabet Stock Is Winning.,Yahoo
2025-11-21T17:42:08,Google cofounder Larry Page overtakes Jeff Bezos as the third richest person in the world following an Alphabet stock surge,Yahoo
2025-11-21T17:13:09,"Alphabet outperforms, Mizuho says Google ’already won the AI game’",Yahoo
2025-11-21T17:13:05,Alphabet Makes Final Case to Avoid Ad-Tech Breakup in U.S. Antitrust Trial,Yahoo
2025-11-21T17:03:44,Amazon And Google's 'OpenAI Dilemma' Sparks Debate On Wall Street After AI Cloud Deals,Yahoo
2025-11-21T13:08:33,Alphabet: Still Being Underestimated,SeekingAlpha
2025-11-21T09:00:01,"Nvidia is king in AI chips, but Google and Amazon want to catch up by making their own",CNBC
2025-11-21T08:59:01,Nvidia GPUs to Google TPUs: Breaking down all the AI chips,CNBC
2025-11-21T08:06:25,The 3 Key Reasons We're Downgrading Alphabet,SeekingAlpha
2025-11-20T23:43:10,Google Launches Unauthorized Pixel-to-iPhone File Sharing With Apple’s AirDrop,Yahoo
2025-11-20T22:26:38,"Bitcoin Miner Expands HPC, AI Deal With Fluidstack, Google",Yahoo
2025-11-20T19:50:50,"As AI Propels Alphabet Stock Upward, GOOGL Nears $4 Trillion Valuation",Yahoo
2025-11-20T18:00:00,Cipher Mining Stock Is Climbing. Google Backs Another Data Center Deal.,Yahoo
2025-11-20T16:51:30,"Palo Alto Networks slips despite Q1 beat, ByteDance valuation soars",Yahoo
2025-11-20T16:20:31,"Bitcoin Miner Rallies On Expanded HPC, AI Deal With Fluidstack, Google",Yahoo
2025-11-20T15:56:37,Buffett’s Alphabet Blessing Puts Valuation Paradox Back in Focus,Yahoo
2025-11-20T15:30:08,Cipher Mining Inks New 10-Year HPC Deal With Fluidstack; Shares Rise 13%,Yahoo
2025-11-20T15:15:03,Alphabet Inc. (GOOGL) Hits Fresh High: Is There Still Room to Run?,Yahoo
2025-11-20T15:12:17,"Cipher jumps 10%on 56 MW hosting contract with Fluidstack, adds $830 million revenue over the next 10 years",Yahoo
2025-11-20T13:12:36,"More Big Tech company debt ‘would increase the macro risks associated with the AI build-out,’ Goldman Sachs warns",Yahoo
2025-11-20T11:00:00Z,GS1 brings trusted medical product information to smartphones through collaboration with Google,GlobeNewswire Inc.
2025-11-22T22:43:22,Google says AI demand forcing 2x capacity growth every 6 months as it targets 1000x scale in 5 years,Reddit/r/wallstreetbets
2025-11-22T10:41:18,$GOOGL vs $MSFT: Alphabet's Market Cap Surpasses Microsoft's – First Time Since 2017 (End-of-Year Data),Reddit/r/stocks
2025-11-21T23:59:01,$GOOGL Deepmind entering into robotics with big hires from Boston dynamics.,Reddit/r/wallstreetbets
2025-11-21T01:29:28,OpenAi struggling against Google - Leaked email & $GOOGL dominance in Ai,Reddit/r/wallstreetbets
2025-11-21T01:28:26,OpenAI CEO Warns of ‘Headwinds’ From Resurgent Google,Reddit/r/StockMarket
2025-11-18T17:07:33,Google announces Gemini 3 as battle with OpenAI intensifies,Reddit/r/wallstreetbets
2025-11-18T17:03:53,Google announces Gemini 3 as battle with OpenAI intensifies,Reddit/r/stocks
