Date,Title,Source
2025-09-17T08:06:47Z,Parallel Advisors LLC Sells 184 Shares of Vertex Pharmaceuticals Incorporated $VRTX,ETF Daily News
2025-09-15T12:04:09Z,Vortex Energy Completes Ambient Noise Tomography (ANT) Field Program at Robinsons River Salt Project,Financial Post
2025-09-15T12:00:00Z,Vortex Energy Completes Ambient Noise Tomography (ANT) Field Program at Robinsons River Salt Project,GlobeNewswire
"Fri, 19 Sep 2025 01:52:33 GMT","Czech National Bank Acquires 3,790 Shares of Vertex Pharmaceuticals Incorporated $VRTX - MarketBeat",MarketBeat
"Wed, 17 Sep 2025 21:50:05 GMT",Vertex Pharmaceuticals (VRTX) Declines More Than Market: Some Information for Investors - Yahoo Finance,Yahoo Finance
"Thu, 18 Sep 2025 14:32:05 GMT",Vertex Pharmaceuticals (VRTX) Secures Italian Reimbursement for Gene-Edited Therapy - GuruFocus,GuruFocus
"Tue, 16 Sep 2025 00:32:07 GMT",EU Commission Approves Vertex Pharmaceutical’s (VRTX) Cystic Fibrosis Treatment - MSN,MSN
"Thu, 18 Sep 2025 10:07:20 GMT",Procyon Advisors LLC Reduces Holdings in Vertex Pharmaceuticals Incorporated $VRTX - MarketBeat,MarketBeat
"Thu, 18 Sep 2025 08:08:36 GMT",Livforsakringsbolaget Skandia Omsesidigt Reduces Position in Vertex Pharmaceuticals Incorporated $VRTX - MarketBeat,MarketBeat
"Thu, 18 Sep 2025 09:21:49 GMT","Advisors Capital Management LLC Has $616,000 Stake in Vertex Pharmaceuticals Incorporated $VRTX - MarketBeat",MarketBeat
"Thu, 18 Sep 2025 10:35:52 GMT",Channel Wealth LLC Raises Stock Holdings in Vertex Pharmaceuticals Incorporated $VRTX - MarketBeat,MarketBeat
"Wed, 17 Sep 2025 07:00:00 GMT",Vertex Pharmaceuticals Incorporated $VRTX Shares Sold by McAdam LLC - MarketBeat,MarketBeat
"Wed, 17 Sep 2025 07:00:00 GMT","Swedbank AB Sells 166,513 Shares of Vertex Pharmaceuticals Incorporated $VRTX - MarketBeat",MarketBeat
"Thu, 18 Sep 2025 00:34:41 GMT",Intech Investment Management LLC Decreases Stake in Vertex Pharmaceuticals Incorporated $VRTX - MarketBeat,MarketBeat
"Wed, 17 Sep 2025 07:00:00 GMT",Strs Ohio Buys New Shares in Vertex Pharmaceuticals Incorporated $VRTX - MarketBeat,MarketBeat
"Tue, 16 Sep 2025 07:00:00 GMT","Belpointe Asset Management LLC Acquires 2,784 Shares of Vertex Pharmaceuticals Incorporated $VRTX - MarketBeat",MarketBeat
"Tue, 16 Sep 2025 07:00:00 GMT",Vertex Pharmaceuticals Incorporated $VRTX Shares Purchased by Focus Partners Wealth - MarketBeat,MarketBeat
"Tue, 16 Sep 2025 07:53:41 GMT",Modern Wealth Management LLC Purchases New Position in Vertex Pharmaceuticals Incorporated $VRTX - MarketBeat,MarketBeat
"Tue, 16 Sep 2025 09:34:47 GMT",Gradient Investments LLC Buys New Shares in Vertex Pharmaceuticals Incorporated $VRTX - MarketBeat,MarketBeat
"Tue, 16 Sep 2025 10:10:49 GMT","Paladin Wealth LLC Purchases Shares of 1,240 Vertex Pharmaceuticals Incorporated $VRTX - MarketBeat",MarketBeat
"Tue, 16 Sep 2025 07:00:00 GMT",Vertex Pharmaceuticals (NASDAQ:VRTX) Price Target Cut to $475.00 by Analysts at Evercore ISI - MarketBeat,MarketBeat
"Tue, 16 Sep 2025 09:32:18 GMT",GK Wealth Management LLC Purchases Shares of 689 Vertex Pharmaceuticals Incorporated $VRTX - MarketBeat,MarketBeat
"Mon, 15 Sep 2025 08:22:41 GMT","Integrity Alliance LLC. Makes New $445,000 Investment in Vertex Pharmaceuticals Incorporated $VRTX - MarketBeat",MarketBeat
"Thu, 18 Sep 2025 20:49:50 GMT",Aug PreEarnings: Is VRTX a top pick in the sector - Market Trend Report & AI Optimized Trade Strategies - khodrobank.com,khodrobank.com
"Mon, 15 Sep 2025 07:00:00 GMT",Plato Investment Management Ltd Sells 820 Shares of Vertex Pharmaceuticals Incorporated $VRTX - MarketBeat,MarketBeat
"Sun, 14 Sep 2025 11:04:56 GMT","9,601 Shares in Vertex Pharmaceuticals Incorporated $VRTX Purchased by AG2R LA Mondiale Gestion D Actifs - MarketBeat",MarketBeat
"Sun, 14 Sep 2025 11:03:04 GMT","Voya Investment Management LLC Acquires 128,432 Shares of Vertex Pharmaceuticals Incorporated $VRTX - MarketBeat",MarketBeat
"Sun, 14 Sep 2025 07:00:00 GMT",Vertex Pharmaceuticals Incorporated $VRTX Shares Sold by NewEdge Advisors LLC - MarketBeat,MarketBeat
"Thu, 18 Sep 2025 16:46:53 GMT",Growth Recap: Will VRTX stock hit new highs in YEAR - Weekly Profit Summary & Entry Point Confirmation Alerts - khodrobank.com,khodrobank.com
"Sun, 14 Sep 2025 07:00:00 GMT","Alaethes Wealth LLC Purchases Shares of 3,051 Vertex Pharmaceuticals Incorporated $VRTX - MarketBeat",MarketBeat
"Sun, 14 Sep 2025 07:00:00 GMT","Peloton Wealth Strategists Acquires 1,920 Shares of Vertex Pharmaceuticals Incorporated $VRTX - MarketBeat",MarketBeat
"Sun, 14 Sep 2025 07:00:00 GMT","Voleon Capital Management LP Sells 7,475 Shares of Vertex Pharmaceuticals Incorporated $VRTX - MarketBeat",MarketBeat
"Sun, 14 Sep 2025 07:00:00 GMT","Woodline Partners LP Buys 3,742 Shares of Vertex Pharmaceuticals Incorporated $VRTX - MarketBeat",MarketBeat
"Tue, 16 Sep 2025 19:46:58 GMT",Chart Watch: Will VRTX announce a stock split - July 2025 Opening Moves & Daily Profit Focused Stock Screening - khodrobank.com,khodrobank.com
"Tue, 16 Sep 2025 23:55:36 GMT",Dividend Watch: Is VRTX stock forming a triangle pattern - Weekly Profit Analysis & Verified Stock Trade Ideas - khodrobank.com,khodrobank.com
"Tue, 16 Sep 2025 00:17:43 GMT",Smart Money: Is VRTX forming higher highs and higher lows - July 2025 Breakouts & Risk Controlled Stock Pick Alerts - khodrobank.com,khodrobank.com
"Mon, 15 Sep 2025 22:51:57 GMT",Insider Trends: Is VRTX a good stock for dollar cost averaging - Trade Performance Summary & Risk Managed Investment Entry Signals - khodrobank.com,khodrobank.com
"Mon, 15 Sep 2025 17:21:34 GMT",Volatility Watch: What are VRTX’s earnings expectations - Weekly Market Outlook & Short-Term Swing Trade Alerts - khodrobank.com,khodrobank.com
"Mon, 15 Sep 2025 10:15:38 GMT",Retail Trends: What are analysts’ price targets for VRTX - Market Growth Review & AI Powered Buy and Sell Recommendations - khodrobank.com,khodrobank.com
"Fri, 19 Sep 2025 02:46:34 GMT",Is VRTX trending in predictive chart models - Trade Risk Summary & Detailed Earnings Play Alerts - newser.com,newser.com
"Thu, 18 Sep 2025 22:27:15 GMT",Analyzing drawdowns of VRTX with statistical tools - Price Action & Fast Gaining Stock Reports - newser.com,newser.com
"Thu, 18 Sep 2025 11:02:59 GMT",How sentiment analysis helps forecast VRTX - 2025 Market Outlook & Community Supported Trade Ideas - newser.com,newser.com
"Thu, 18 Sep 2025 06:45:27 GMT",What indicators show strength in VRTX - 2025 Price Targets & AI Forecast Swing Trade Picks - newser.com,newser.com
"Thu, 18 Sep 2025 15:56:17 GMT",Strategies to average down on VRTX - July 2025 Sector Moves & Risk Controlled Stock Alerts - newser.com,newser.com
"Wed, 17 Sep 2025 00:30:44 GMT",Automated trading signals detected on VRTX - Earnings Growth Report & Community Verified Swing Trade Signals - newser.com,newser.com
"Wed, 17 Sep 2025 17:48:47 GMT",What indicators show strength in VRTX - July 2025 Final Week & Proven Capital Preservation Tips - newser.com,newser.com
"Tue, 16 Sep 2025 07:28:43 GMT",Candlestick signals on VRTX stock today - July 2025 Setups & Trade Opportunity Analysis Reports - newser.com,newser.com
"Tue, 16 Sep 2025 07:16:37 GMT",How to integrate VRTX into portfolio analysis tools - GDP Growth & Weekly Top Gainers Trade List - newser.com,newser.com
"Tue, 16 Sep 2025 02:55:38 GMT",Risk vs reward if holding onto VRTX - Quarterly Profit Summary & Smart Allocation Stock Reports - newser.com,newser.com
"Mon, 15 Sep 2025 08:44:28 GMT",Can trapped investors hope for a rebound in VRTX - Quarterly Portfolio Review & AI Powered Trade Plan Recommendations - newser.com,newser.com
"Thu, 18 Sep 2025 06:30:18 GMT",What institutional flow reveals about VRTX - Market Volume Summary & Real-Time Volume Surge Alerts - newser.com,newser.com
"Thu, 18 Sep 2025 05:30:09 GMT",Can a trend reversal in VRTX lead to recovery - Rate Cut & Weekly Breakout Watchlists - newser.com,newser.com
"Sun, 14 Sep 2025 14:18:07 GMT",Will VRTX see short term momentum - Market Movement Recap & Consistent Profit Trading Strategies - newser.com,newser.com
"Wed, 17 Sep 2025 05:00:39 GMT",Analyzing drawdowns of VRTX with statistical tools - Market Movers & Advanced Swing Trade Entry Plans - newser.com,newser.com
"Wed, 17 Sep 2025 02:56:04 GMT",Can trapped investors hope for a rebound in VRTX - July 2025 Pullbacks & AI Forecasted Entry and Exit Points - newser.com,newser.com
"Wed, 17 Sep 2025 10:50:39 GMT",Will VRTX price bounce be sustainable - Earnings Overview Summary & Community Consensus Picks - newser.com,newser.com
"Thu, 18 Sep 2025 05:16:11 GMT",Will VRTX price bounce be sustainable - July 2025 EndofMonth & Low Drawdown Momentum Ideas - newser.com,newser.com
"Wed, 17 Sep 2025 02:55:25 GMT",Is VRTX trending in predictive chart models - Earnings Performance Report & Growth-Oriented Investment Plans - newser.com,newser.com
"Sun, 14 Sep 2025 22:20:08 GMT",Will VRTX see short term momentum - Inflation Watch & Weekly Top Stock Performers List - newser.com,newser.com
"Sun, 14 Sep 2025 21:50:32 GMT",Has VRTX formed a bullish divergence - July 2025 Market Mood & Community Consensus Stock Picks - newser.com,newser.com
"Sun, 14 Sep 2025 12:01:36 GMT",What institutional flow reveals about VRTX - Price Action & Risk Controlled Daily Trade Plans - newser.com,newser.com
"Wed, 17 Sep 2025 00:57:21 GMT",Real time social sentiment graph for VRTX - 2025 Key Lessons & Reliable Breakout Forecasts - newser.com,newser.com
"Sun, 14 Sep 2025 09:08:30 GMT",Strategies to average down on VRTX - 2025 Big Picture & Long-Term Capital Growth Ideas - newser.com,newser.com
"Mon, 15 Sep 2025 01:30:17 GMT",What institutional flow reveals about VRTX - Breakout Watch & Verified Momentum Stock Alerts - newser.com,newser.com
2025-09-18T15:30:00,Vertex Announces CASGEVY® Reimbursement Agreement for the Treatment of Transfusion-Dependent Beta Thalassemia and Sickle Cell Disease in Italy,Yahoo
2025-09-18T00:50:05,Vertex Pharmaceuticals (VRTX) Declines More Than Market: Some Information for Investors,Yahoo
