Date,Title,Source
2025-10-28T17:48:49Z,"AMD, NVDA, INTC, AVGO: Chip Stocks Rally as 5-Star Analyst Dan Ives Sees Tech Rebound",Biztoc.com
2025-10-28T16:32:50Z,"Broadcom, IBD Stock Of The Day, Breaks Out Past Buy Point On AI Activity",Biztoc.com
2025-10-28T15:58:36Z,Apple Stock Ripe For Picking As This Fund Adds 8 Million Shares. Broadcom Is Also A Favorite,Biztoc.com
2025-10-28T15:03:30Z,Goldman Sachs Reiterates Buy Rating on Broadcom (AVGO) Stock,Biztoc.com
2025-10-28T14:46:45Z,Goldman Sachs Reiterates Buy Rating on Broadcom (AVGO) Stock,Yahoo Entertainment
2025-10-28T14:41:37Z,This Analyst Was Right About Broadcom (AVGO),Biztoc.com
2025-10-28T14:21:32Z,This Analyst Was Right About Broadcom (AVGO),Yahoo Entertainment
2025-10-27T15:15:01Z,Here's How Much $100 Invested In Broadcom 15 Years Ago Would Be Worth Today,Biztoc.com
2025-10-27T12:29:40Z,"Analyst Recommends Broadcom (AVGO) Amid Sora AI, $2 Trillion Market",Biztoc.com
2025-10-27T12:16:53Z,"Analyst Recommends Broadcom (AVGO) Amid Sora AI, $2 Trillion Market",Yahoo Entertainment
"Wed, 29 Oct 2025 11:00:18 GMT",A Look At The Fair Value Of Broadcom Inc. (NASDAQ:AVGO) - Yahoo Finance,Yahoo Finance
"Tue, 28 Oct 2025 18:54:00 GMT",Broadcom Inc. Stock (AVGO) Opinions on AI Partnership Deal - Quiver Quantitative,Quiver Quantitative
"Fri, 31 Oct 2025 05:47:27 GMT",What technical patterns form on Roundhill ETF Trust Roundhill AVGO stock charts - GDP Growth & Stock Portfolio Risk Control - newser.com,newser.com
"Thu, 30 Oct 2025 21:55:06 GMT",Broadcom’s Boom Has Investors Euphoric - And That’s Exactly Why I’m Cautious (NASDAQ:AVGO) - Seeking Alpha,Seeking Alpha
"Thu, 30 Oct 2025 12:38:51 GMT",Is AVGO Stock Beating Competition? - Forbes,Forbes
"Thu, 30 Oct 2025 16:09:25 GMT",Broadcom (AVGO) Both Benefits and Suffers from the AI Surge - MoneyMorning.com,MoneyMorning.com
"Thu, 30 Oct 2025 21:45:04 GMT",Broadcom Inc. (AVGO) Sees a More Significant Dip Than Broader Market: Some Facts to Know - Yahoo Finance,Yahoo Finance
"Thu, 30 Oct 2025 09:01:20 GMT",Jim Cramer Discusses Broadcom (AVGO)’s Software Strengths - Insider Monkey,Insider Monkey
"Fri, 31 Oct 2025 04:30:57 GMT",Will AVGO stock recover after recent drop - July 2025 Recap & Safe Capital Growth Stock Tips - newser.com,newser.com
"Tue, 28 Oct 2025 14:21:32 GMT",This Analyst Was Right About Broadcom (AVGO) - Yahoo Finance,Yahoo Finance
"Fri, 31 Oct 2025 05:36:16 GMT",Has AVGO found a price floor - Quarterly Profit Review & Risk Adjusted Buy and Sell Alerts - newser.com,newser.com
"Tue, 28 Oct 2025 16:42:18 GMT","SA analyst upgrades/downgrades: GOOG, INTC, AVGO, WBD - Seeking Alpha",Seeking Alpha
"Mon, 27 Oct 2025 12:16:53 GMT","Analyst Recommends Broadcom (AVGO) Amid Sora AI, $2 Trillion Market - Yahoo Finance",Yahoo Finance
"Tue, 28 Oct 2025 16:38:00 GMT",AVGO vs. CSCO: Which AI Infrastructure Stock is a Buy Right Now? - Yahoo Finance,Yahoo Finance
"Mon, 27 Oct 2025 13:00:03 GMT",Broadcom Inc. (AVGO) is Attracting Investor Attention: Here is What You Should Know - Yahoo Finance,Yahoo Finance
"Wed, 29 Oct 2025 04:50:18 GMT",AVGO Pays Out $51 Bil to Investors in 10 Years - Trefis,Trefis
"Mon, 27 Oct 2025 13:00:00 GMT",Broadcom: OpenAI Deal Changes Everything - Custom AI Leader More Compelling (Upgrade) (NASDAQ:AVGO) - Seeking Alpha,Seeking Alpha
"Tue, 28 Oct 2025 15:06:20 GMT",Goldman Sachs Reiterates Buy Rating on Broadcom (AVGO) Stock - Insider Monkey,Insider Monkey
"Tue, 28 Oct 2025 15:57:55 GMT",AVGO vs. CSCO: Which AI Infrastructure Stock is a Buy Right Now? - Zacks Investment Research,Zacks Investment Research
"Wed, 29 Oct 2025 07:42:17 GMT",Ethic Inc. Raises Stock Position in Broadcom Inc. $AVGO - MarketBeat,MarketBeat
"Thu, 30 Oct 2025 08:36:24 GMT",Can Roundhill ETF Trust Roundhill AVGO stock reach $200 price target - Portfolio Gains Report & High Win Rate Trade Alerts - newser.com,newser.com
"Tue, 28 Oct 2025 23:33:33 GMT",Broadcom (NASDAQ:AVGO) Stock Price Up 3% - Still a Buy? - MarketBeat,MarketBeat
"Wed, 29 Oct 2025 07:59:29 GMT",Strategic Blueprint LLC Trims Position in Broadcom Inc. $AVGO - MarketBeat,MarketBeat
"Wed, 29 Oct 2025 07:59:28 GMT",Broadcom Inc. $AVGO Shares Purchased by Principle Wealth Partners LLC - MarketBeat,MarketBeat
"Wed, 29 Oct 2025 07:59:28 GMT",Paragon Advisors LLC Has $8.43 Million Stake in Broadcom Inc. $AVGO - MarketBeat,MarketBeat
"Wed, 29 Oct 2025 07:57:52 GMT","Axiom Financial Strategies LLC Takes $207,000 Position in Broadcom Inc. $AVGO - MarketBeat",MarketBeat
"Wed, 29 Oct 2025 07:34:10 GMT",KPP Advisory Services LLC Boosts Stock Position in Broadcom Inc. $AVGO - MarketBeat,MarketBeat
"Wed, 29 Oct 2025 07:59:28 GMT",Freedom Investment Management Inc. Lowers Stock Holdings in Broadcom Inc. $AVGO - MarketBeat,MarketBeat
"Wed, 29 Oct 2025 07:30:04 GMT",Connors Investor Services Inc. Decreases Stock Position in Broadcom Inc. $AVGO - MarketBeat,MarketBeat
"Wed, 29 Oct 2025 07:41:37 GMT","Arrien Investments Inc. Invests $295,000 in Broadcom Inc. $AVGO - MarketBeat",MarketBeat
"Wed, 29 Oct 2025 07:57:52 GMT",Broadcom Inc. $AVGO Shares Acquired by Warther Private Wealth LLC - MarketBeat,MarketBeat
"Wed, 29 Oct 2025 07:59:28 GMT",LifeWealth Investments LLC Grows Holdings in Broadcom Inc. $AVGO - MarketBeat,MarketBeat
"Wed, 29 Oct 2025 07:59:23 GMT",Strata Wealth Advisors LLC Purchases 837 Shares of Broadcom Inc. $AVGO - MarketBeat,MarketBeat
"Sun, 26 Oct 2025 20:34:16 GMT",Why META (Nasdaq: META) and Broadcom (Nasdaq: AVGO) Are Tumbling Today - AOL.com,AOL.com
"Tue, 28 Oct 2025 07:48:05 GMT",Cookson Peirce & Co. Inc. Cuts Stock Position in Broadcom Inc. $AVGO - MarketBeat,MarketBeat
"Tue, 28 Oct 2025 00:38:06 GMT",How Broadcom’s (AVGO) $10 Billion OpenAI Chip Deal Could Reshape Its AI Leadership - simplywall.st,simplywall.st
"Thu, 30 Oct 2025 10:06:19 GMT",Has AVGO found a price floor - July 2025 PreEarnings & Precise Buy Zone Identification - newser.com,newser.com
"Tue, 28 Oct 2025 07:48:04 GMT","Citizens & Northern Corp Purchases 5,549 Shares of Broadcom Inc. $AVGO - MarketBeat",MarketBeat
"Tue, 28 Oct 2025 11:47:08 GMT",Analysts Offer Insights on Technology Companies: Broadcom (AVGO) and Confluent (CFLT) - The Globe and Mail,The Globe and Mail
"Tue, 28 Oct 2025 08:17:30 GMT",Insider Sell: Will AVGO stock gain from lower inflation - 2025 Key Highlights & Consistent Income Trade Ideas - Fundação Cultural do Pará,Fundação Cultural do Pará
"Wed, 29 Oct 2025 02:57:59 GMT",Can Roundhill ETF Trust Roundhill AVGO stock reach $200 price target - Insider Selling & AI Forecasted Stock Moves - newser.com,newser.com
"Tue, 28 Oct 2025 07:46:44 GMT",Family Capital Management Inc. Boosts Position in Broadcom Inc. $AVGO - MarketBeat,MarketBeat
"Tue, 28 Oct 2025 07:48:05 GMT",Brookstone Capital Management Grows Position in Broadcom Inc. $AVGO - MarketBeat,MarketBeat
"Thu, 30 Oct 2025 09:24:09 GMT",Will AVGO stock recover after recent drop - 2025 Pullback Review & Advanced Technical Analysis Signals - newser.com,newser.com
"Tue, 28 Oct 2025 07:46:57 GMT",Black Diamond Financial LLC Makes New Investment in Broadcom Inc. $AVGO - MarketBeat,MarketBeat
"Tue, 28 Oct 2025 07:42:23 GMT",Broadcom Inc. $AVGO Shares Purchased by Rehmann Capital Advisory Group - MarketBeat,MarketBeat
"Tue, 28 Oct 2025 07:50:06 GMT",Broadcom Inc. $AVGO Shares Sold by Birch Hill Investment Advisors LLC - MarketBeat,MarketBeat
"Tue, 28 Oct 2025 07:45:39 GMT",Greatmark Investment Partners Inc. Purchases New Shares in Broadcom Inc. $AVGO - MarketBeat,MarketBeat
"Tue, 28 Oct 2025 07:48:05 GMT",TFB Advisors LLC Purchases 874 Shares of Broadcom Inc. $AVGO - MarketBeat,MarketBeat
"Tue, 28 Oct 2025 07:46:08 GMT","8,566 Shares in Broadcom Inc. $AVGO Bought by FNY Investment Advisers LLC - MarketBeat",MarketBeat
"Tue, 28 Oct 2025 07:48:04 GMT","Private Capital Advisors Inc. Purchases Shares of 1,223 Broadcom Inc. $AVGO - MarketBeat",MarketBeat
"Tue, 28 Oct 2025 07:46:23 GMT",Jacobsen Capital Management Has $2.55 Million Stock Position in Broadcom Inc. $AVGO - MarketBeat,MarketBeat
"Thu, 30 Oct 2025 10:45:27 GMT",Real time alert setup for AVGO performance - 2025 EndofYear Setup & Community Consensus Stock Picks - newser.com,newser.com
"Tue, 28 Oct 2025 07:48:05 GMT",Broadcom Inc. $AVGO Shares Sold by Chokshi & Queen Wealth Advisors Inc - MarketBeat,MarketBeat
"Tue, 28 Oct 2025 12:15:36 GMT",Will AVGO stock recover after recent drop - Market Growth Report & Low Volatility Stock Recommendations - newser.com,newser.com
"Tue, 28 Oct 2025 07:48:05 GMT",Denali Advisors LLC Decreases Stake in Broadcom Inc. $AVGO - MarketBeat,MarketBeat
"Tue, 28 Oct 2025 09:30:38 GMT",Can Roundhill ETF Trust Roundhill AVGO stock reach $200 price target - Earnings Growth Summary & Entry Point Strategy Guides - newser.com,newser.com
"Tue, 28 Oct 2025 07:50:08 GMT",Broadcom Inc. $AVGO Shares Sold by Cantillon Capital Management LLC - MarketBeat,MarketBeat
"Tue, 28 Oct 2025 07:48:05 GMT",Broadcom Inc. $AVGO is Meadow Creek Wealth Advisors LLC's 6th Largest Position - MarketBeat,MarketBeat
"Tue, 28 Oct 2025 00:49:57 GMT","AMD, NVDA, INTC, AVGO: Chip Stocks Rally as 5-Star Analyst Dan Ives Sees Tech Rebound - TipRanks",TipRanks
"Thu, 30 Oct 2025 07:26:28 GMT",Should I hold or sell AVGO stock in 2025 - 2025 Trading Recap & Risk Controlled Swing Alerts - newser.com,newser.com
"Tue, 28 Oct 2025 16:38:00 GMT",AVGO vs. CSCO: Which AI Infrastructure Stock is a Buy Right Now? - sharewise.com,sharewise.com
"Mon, 27 Oct 2025 12:20:55 GMT","Analyst Recommends Broadcom (AVGO) Amid Sora AI, $2 Trillion Market - Insider Monkey",Insider Monkey
"Wed, 29 Oct 2025 10:28:39 GMT",Will AVGO stock keep outperforming rivals - 2025 Dividend Review & Free Accurate Trade Setup Notifications - newser.com,newser.com
"Mon, 27 Oct 2025 03:59:37 GMT",Long term hold vs stop loss in AVGO - Weekly Trade Review & Verified Short-Term Plans - newser.com,newser.com
"Tue, 28 Oct 2025 11:31:00 GMT","Citi Maintains Broadcom(AVGO.US) With Buy Rating, Maintains Target Price $415 - 富途牛牛",富途牛牛
"Wed, 29 Oct 2025 11:31:33 GMT",Is AVGO stock overvalued by current metrics - New Guidance & Free Technical Pattern Based Buy Signals - newser.com,newser.com
"Wed, 29 Oct 2025 12:16:45 GMT",Will AVGO stock gain from lower inflation - Quarterly Profit Summary & Long-Term Capital Growth Ideas - newser.com,newser.com
"Tue, 28 Oct 2025 05:09:24 GMT",Long term hold vs stop loss in AVGO - Market Growth Report & Fast Moving Stock Trade Plans - newser.com,newser.com
"Tue, 28 Oct 2025 19:23:04 GMT",AVGO news live: holds near highs — overbought signals persist as AI prospects boost stock - Traders Union,Traders Union
"Tue, 28 Oct 2025 07:00:12 GMT",Is AVGO stock overvalued by current metrics - Market Sentiment Report & Consistent Income Trade Recommendations - newser.com,newser.com
"Mon, 27 Oct 2025 13:15:46 GMT",Can Roundhill ETF Trust Roundhill AVGO stock reach $200 price target - 2025 Pullback Review & Risk Managed Trade Strategies - newser.com,newser.com
"Tue, 28 Oct 2025 00:49:06 GMT",Long term hold vs stop loss in AVGO - July 2025 Spike Watch & Low Volatility Stock Recommendations - newser.com,newser.com
"Sun, 26 Oct 2025 17:12:21 GMT",Is AVGO stock attractive for income investors - July 2025 Sentiment & Scalable Portfolio Growth Ideas - newser.com,newser.com
"Thu, 30 Oct 2025 09:18:26 GMT",Jim Cramer Discusses Broadcom (AVGO)’s Software Strengths - MSN,MSN
"Tue, 28 Oct 2025 16:59:27 GMT","SA analyst upgrades/downgrades: GOOG, INTC, AVGO, WBD - MSN",MSN
"Tue, 28 Oct 2025 14:31:58 GMT",This Analyst Was Right About Broadcom (AVGO) - MSN,MSN
"Wed, 29 Oct 2025 08:09:14 GMT",Castle Wealth Management LLC Buys 96 Shares of Broadcom Inc. $AVGO - Defense World,Defense World
"Wed, 29 Oct 2025 13:24:38 GMT",Roman Butler Fullerton & Co. Raises Stock Position in Broadcom Inc. $AVGO - Defense World,Defense World
"Tue, 28 Oct 2025 08:12:13 GMT",Broadcom Inc. $AVGO is D.A. Davidson & CO.’s 7th Largest Position - Defense World,Defense World
"Tue, 28 Oct 2025 08:12:13 GMT","Cavalier Investments LLC Sells 4,704 Shares of Broadcom Inc. $AVGO - Defense World",Defense World
"Tue, 28 Oct 2025 20:20:38 GMT",Broadcom (NASDAQ:AVGO) Trading 2.2% Higher on Analyst Upgrade - Defense World,Defense World
2025-10-30T16:25:19,Chip-Rip Showdown: AMD Vs. Broadcom,SeekingAlpha
2025-10-30T09:55:08,Jim Cramer Discusses Broadcom (AVGO)’s Software Strengths,Yahoo
2025-10-29T12:00:18,A Look At The Fair Value Of Broadcom Inc. (NASDAQ:AVGO),Yahoo
2025-10-28T17:38:00,AVGO vs. CSCO: Which AI Infrastructure Stock is a Buy Right Now?,Yahoo
2025-10-28T15:46:45,Goldman Sachs Reiterates Buy Rating on Broadcom (AVGO) Stock,Yahoo
2025-10-28T15:21:32,This Analyst Was Right About Broadcom (AVGO),Yahoo
2025-10-27T14:00:03,Broadcom Inc. (AVGO) is Attracting Investor Attention: Here is What You Should Know,Yahoo
2025-10-27T13:16:53,"Analyst Recommends Broadcom (AVGO) Amid Sora AI, $2 Trillion Market",Yahoo
2025-10-27T10:00:00,Broadcom: OpenAI Deal Changes Everything - Custom AI Leader More Compelling (Upgrade),SeekingAlpha
