Date,Title,Source
2025-09-09T18:40:22Z,What is Dallas Mavericks PG Kyrie Irving timetable to return from a torn ACL?,Sporting News
2025-09-09T17:47:27Z,Induction meetings for PG students of Patna University organised,The Times of India
2025-09-09T14:46:12Z,wmill-pg 1.540.2,Pypi.org
2025-09-09T12:09:40Z,"PG&E gives update on fire season, forecast technology",Biztoc.com
2025-09-09T05:30:45Z,Acorn Energy (NASDAQ:ACFN) Raised to “Strong-Buy” at Wall Street Zen,ETF Daily News
2025-09-08T20:25:53Z,Option traders moderately bearish in PG&E with shares down 3.55%,Thefly.com
2025-09-08T19:06:10Z,django-pg-sequences 1.0.0,Pypi.org
2025-09-08T19:06:06Z,django-pg-sequences added to PyPI,Pypi.org
2025-09-08T12:45:57Z,‘Full marks for efforts’: 4 Rajasthan students hire helicopter to reach exam centre in Uttarakhand amid flood,The Indian Express
2025-09-08T12:18:57Z,"NEET PG 2025: MCC to announce 50% AIQ counselling schedule soon, SC hearing awaited; check details here",The Times of India
2025-09-08T12:04:26Z,"NHAI likely to reconsider decision of recruiting lawyers based on CLAT-PG score, Delhi HC told",The Times of India
2025-09-08T10:05:44Z,How PG&E Plans to Power Ahead on Climate Goals,Biztoc.com
2025-09-08T10:00:02Z,How PG&E Plans to Power Ahead on Climate Goals,Newsweek
2025-09-08T09:48:29Z,pganalytics 1.0.19,Pypi.org
2025-09-08T04:53:48Z,"Varun Beverages, PG Electroplast among 7 F&O stocks saw a high increase in futures open interest",Economictimes.com
2025-09-07T10:20:15Z,Announcing Pg_duckdb Version 1.0 - MotherDuck Blog,Motherduck.com
2025-09-07T06:38:33Z,Delhi HC to decide on Sep 8 if CLAT-PG scores can be basis for jobs in NHAI,The Indian Express
2025-09-07T05:23:15Z,PG Medical Students To Be Deployed In Flood-Affected Areas,Ndtvprofit.com
2025-09-07T05:18:42Z,"NEET PG 2025: 50% AIQ scorecards expected to be released soon, Check details here",The Times of India
2025-09-06T20:44:55Z,NMC asks medical colleges to deploy PG students in flood-affected areas,The Times of India
2025-09-06T14:23:57Z,wmill-pg 1.539.1,Pypi.org
2025-09-06T12:09:53Z,"Tech Query: Gujarat Gas, HFCL, ACME Solar Holdings, PG Electroplast; what is the outlook and where are these stocks headed?",BusinessLine
2025-09-05T18:17:27Z,Option traders moderately bearish in PG&E with shares down 0.62%,Thefly.com
2025-09-05T13:00:00Z,Using ldap2pg to integrate between AD Groups and Postgres Roles,Cormachogan.com
2025-09-05T10:15:00Z,"5-star PG Deron Rippey Jr. narrows list to 10, drops Indiana and Kansas",A Sea Of Blue
"Tue, 09 Sep 2025 22:02:37 GMT",Iowa basketball PG Bennett Stirtz named to All-Big Ten preseason team - Hawkeyes Wire,Hawkeyes Wire
"Tue, 09 Sep 2025 22:31:45 GMT",Ben Simmons' Agent Reportedly Cut Ties After PG Dismissed Knicks Interest amid Rumors - Bleacher Report,Bleacher Report
"Wed, 10 Sep 2025 05:14:01 GMT",How (PG) Movements Inform Risk Allocation Models - news.stocktradersdaily.com,news.stocktradersdaily.com
"Wed, 10 Sep 2025 06:58:33 GMT",4-star PG Troy Kaufusi opens up on FIBA success and early Mississippi State offer - On3,On3
"Mon, 08 Sep 2025 20:31:32 GMT",Procter & Gamble Company (The) (PG) Is a Trending Stock: Facts to Know Before Betting on It - Yahoo Finance,Yahoo Finance
"Tue, 09 Sep 2025 17:54:07 GMT",Exploring Procter & Gamble’s (PG) Valuation After Recent Share Pullback and Shifting Investor Sentiment - simplywall.st,simplywall.st
"Wed, 10 Sep 2025 03:45:28 GMT",A $100 Million Extension For Josh Giddey? Chicago Bulls Sign PG To New Four-Year Extension - News18,News18
"Tue, 09 Sep 2025 20:46:15 GMT",Procter & Gamble Company (The) $PG Shares Sold by DoubleLine ETF Adviser LP - MarketBeat,MarketBeat
"Wed, 10 Sep 2025 06:17:10 GMT",PG Soft wins Best Slot Provider at SiGMA Euro-Med Awards 2025 - European Gaming Industry News,European Gaming Industry News
"Mon, 08 Sep 2025 21:32:51 GMT",Kentucky Basketball continues its push for 5-star PG Deron Rippey Jr. - A Sea Of Blue,A Sea Of Blue
"Tue, 09 Sep 2025 13:32:11 GMT",FOOD-HOMEMADE-CRACKERS-PG - timesdaily.com,timesdaily.com
"Mon, 08 Sep 2025 14:56:49 GMT",Louisville freshman PG Mikel Brown Jr. 'can't wait' for coming season - 247Sports,247Sports
"Tue, 09 Sep 2025 21:00:34 GMT",FOOD-HOMEMADE-CRACKERS-PG - Lincoln Journal Star,Lincoln Journal Star
"Tue, 09 Sep 2025 12:40:09 GMT",Should Investors Rethink GMO-PG After Recent 2% Price Gains Despite Long-Term Lows? - Yahoo Finance,Yahoo Finance
"Tue, 09 Sep 2025 21:25:40 GMT",Four-star PG Kaiden Bailey commits to Georgia Tech - On3,On3
"Tue, 09 Sep 2025 10:11:23 GMT",Procter & Gamble Company (The) $PG Shares Bought by Clark Capital Management Group Inc. - MarketBeat,MarketBeat
"Tue, 09 Sep 2025 10:41:11 GMT",Procter & Gamble Company (The) $PG Shares Acquired by UniSuper Management Pty Ltd - MarketBeat,MarketBeat
"Tue, 09 Sep 2025 21:07:01 GMT",Discipline and Rules-Based Execution in PG Response - news.stocktradersdaily.com,news.stocktradersdaily.com
"Tue, 09 Sep 2025 10:11:50 GMT",Procter & Gamble Company (The) $PG Shares Sold by USS Investment Management Ltd - MarketBeat,MarketBeat
"Tue, 09 Sep 2025 08:54:02 GMT",Responsive Playbooks and the PG Inflection - news.stocktradersdaily.com,news.stocktradersdaily.com
"Tue, 09 Sep 2025 11:25:16 GMT","Tamar Securities LLC Invests $281,000 in Procter & Gamble Company (The) $PG - MarketBeat",MarketBeat
"Mon, 08 Sep 2025 07:00:00 GMT",Procter & Gamble Company (The) $PG Shares Purchased by Bridgeway Capital Management LLC - MarketBeat,MarketBeat
"Tue, 09 Sep 2025 18:40:22 GMT",What is Dallas Mavericks PG Kyrie Irving timetable to return from a torn ACL? - sportingnews.com,sportingnews.com
"Sat, 06 Sep 2025 22:20:39 GMT",Sky PG Courtney Vandersloot indirectly responds to Angel Reese’s ‘age’ comments - Yahoo Sports,Yahoo Sports
"Mon, 08 Sep 2025 12:34:20 GMT",Procter & Gamble Company (The) $PG Shares Acquired by Plancorp LLC - MarketBeat,MarketBeat
"Mon, 08 Sep 2025 16:38:02 GMT",Behavioral Patterns of PG and Institutional Flows - news.stocktradersdaily.com,news.stocktradersdaily.com
"Mon, 08 Sep 2025 07:00:00 GMT",Procter & Gamble Company (The) $PG Shares Sold by Amundi - MarketBeat,MarketBeat
"Fri, 05 Sep 2025 18:42:00 GMT",'26 5-star PG Brandon McCoy visiting Arkansas basketball - Northwest Arkansas Democrat-Gazette,Northwest Arkansas Democrat-Gazette
"Tue, 09 Sep 2025 10:09:14 GMT","PG Electroplast shares rose 9,800% in five years but clocked zero returns in short term, price targets & more - MSN",MSN
"Mon, 08 Sep 2025 07:00:00 GMT",Procter & Gamble Company (The) $PG Shares Acquired by AQR Capital Management LLC - MarketBeat,MarketBeat
"Sat, 06 Sep 2025 10:10:00 GMT",Keone “K-Quick” Reed: PG County Rapper Mentored By Bone Thugs-N-Harmony - The BayNet,The BayNet
"Mon, 08 Sep 2025 10:45:04 GMT",Procter & Gamble Company (The) $PG Stock Position Decreased by Curi RMB Capital LLC - MarketBeat,MarketBeat
"Tue, 09 Sep 2025 06:14:38 GMT",PG Soft unveiled as Gold Headline Sponsor at SBC Summit Lisbon - European Gaming Industry News,European Gaming Industry News
"Tue, 09 Sep 2025 09:07:37 GMT","Gotham Asset Management LLC Acquires 21,566 Shares of Procter & Gamble Company (The) $PG - MarketBeat",MarketBeat
"Mon, 08 Sep 2025 07:00:00 GMT","Alliancebernstein L.P. Sells 1,756,137 Shares of Procter & Gamble Company (The) $PG - MarketBeat",MarketBeat
"Tue, 09 Sep 2025 06:26:18 GMT",PG Soft unveiled as Gold Headline Sponsor at SBC Summit Lisbon - iGaming Today,iGaming Today
"Sun, 07 Sep 2025 07:00:00 GMT",Procter & Gamble Company (The) $PG Holdings Boosted by Federation des caisses Desjardins du Quebec - MarketBeat,MarketBeat
"Sun, 07 Sep 2025 18:26:00 GMT",Four-star PG Ariyana Cradle commits to Louisville - 247Sports,247Sports
"Sat, 06 Sep 2025 18:40:45 GMT",Heartbreaking Update in Case of Missing Black PG County Teen Dacara Thompson - The Root,The Root
"Wed, 10 Sep 2025 05:38:00 GMT",Korea mandates external management of PG firms' settlement funds starting Jan. 1 - CHOSUNBIZ - Chosun Biz,Chosun Biz
"Sun, 07 Sep 2025 19:55:43 GMT",New York Knicks New PG Opens Up About Move to NYC - Sports Illustrated,Sports Illustrated
"Sun, 07 Sep 2025 11:34:53 GMT",Procter & Gamble Company (The) $PG Shares Acquired by Infusive Asset Management Inc. - MarketBeat,MarketBeat
"Sat, 06 Sep 2025 09:04:56 GMT",If the trade deadline is approaching and the PG … - HoopsHype,HoopsHype
"Mon, 08 Sep 2025 18:24:00 GMT","4-Star, 2026 PG, Amir Jenkins talks recruiting - 247Sports",247Sports
"Sun, 07 Sep 2025 05:03:35 GMT",James Gunn Addresses Fan Concerns About R-Rated and PG-13 Crossover - Superman Homepage,Superman Homepage
"Tue, 09 Sep 2025 15:47:33 GMT",Noel Tatt x Quitting Hollywood - PG Buzz,PG Buzz
"Fri, 05 Sep 2025 16:16:48 GMT",Boston College Hosts 4-Star PG Trey Beamer for Official Visit - Sports Illustrated,Sports Illustrated
"Sat, 06 Sep 2025 07:00:00 GMT","3,563 Shares in Procter & Gamble Company (The) $PG Bought by Magnetar Financial LLC - MarketBeat",MarketBeat
"Tue, 09 Sep 2025 20:36:22 GMT",NEET PG 2025 scorecards for All India Quota 50% seats to be out soon - MSN,MSN
"Mon, 08 Sep 2025 12:18:00 GMT","NEET PG 2025: MCC to announce 50% AIQ counselling schedule soon, SC hearing awaited; check details here - The Times of India",The Times of India
"Sat, 06 Sep 2025 13:34:19 GMT",Procter & Gamble Company (The) $PG Shares Acquired by DnB Asset Management AS - MarketBeat,MarketBeat
"Fri, 05 Sep 2025 16:45:17 GMT",Mr. PG - City of Prince George,City of Prince George
"Sat, 06 Sep 2025 13:38:42 GMT",Procter & Gamble Company (The) $PG Shares Sold by Hancock Whitney Corp - MarketBeat,MarketBeat
"Mon, 08 Sep 2025 19:18:45 GMT",Illegal immigrant ordered to remain in PG County jail on charges of killing 19-year-old woman - Washington Times,Washington Times
"Sat, 06 Sep 2025 16:07:30 GMT",Ameriflex Group Inc. Increases Holdings in Procter & Gamble Company (The) $PG - MarketBeat,MarketBeat
"Sun, 07 Sep 2025 08:13:00 GMT","""Paul George is more into podcasting than actually playing"" - Stacey King thinks the 76ers are better off rebuilding than trying to win with PG and Embiid - Yahoo Sports",Yahoo Sports
"Fri, 05 Sep 2025 10:15:00 GMT","5-star PG Deron Rippey Jr. narrows list to 10, drops Indiana and Kansas - Yahoo Sports",Yahoo Sports
"Sat, 06 Sep 2025 21:40:33 GMT",Tandem cyclists pass through PG on Mexico to Alaska journey - Prince George Citizen,Prince George Citizen
"Fri, 05 Sep 2025 20:03:45 GMT",Procter & Gamble Company (The) $PG Shares Purchased by Graham Capital Management L.P. - MarketBeat,MarketBeat
"Tue, 09 Sep 2025 18:45:00 GMT",Assembly speaker urges SCB PG students to uphold medical ethics - The Times of India,The Times of India
"Sat, 06 Sep 2025 07:00:00 GMT","1,668 Shares in Procter & Gamble Company (The) $PG Purchased by Core Wealth Advisors Inc. - MarketBeat",MarketBeat
"Sat, 06 Sep 2025 07:00:00 GMT",Procter & Gamble Company (The) $PG Shares Sold by DRW Securities LLC - MarketBeat,MarketBeat
"Mon, 08 Sep 2025 00:34:30 GMT",'26 PG Ariyana Cradle Commits to Louisville - Sports Illustrated,Sports Illustrated
"Sat, 06 Sep 2025 18:34:55 GMT","NEET PG Scorecards 2025 For All India Quota 50 Per Cent Seats To Be Out Today, Here's How To Download - NDTV",NDTV
"Tue, 09 Sep 2025 15:47:32 GMT",What’s hit all about! - PG Buzz,PG Buzz
"Sat, 06 Sep 2025 07:00:00 GMT",PG Courses: Your Guide To Choosing The Right PG Courses in 2025 - Simplilearn.com,Simplilearn.com
"Sun, 07 Sep 2025 06:03:03 GMT",NEET PG 2025 All India 50% Quota Scorecard Release Date: Here's What Official Notice Says - NDTV,NDTV
"Fri, 05 Sep 2025 09:30:00 GMT","Louisville Cardinals News: 5-star PG Taylen Kinney, JMU preview, ACC power rankings - Big Red Louie",Big Red Louie
"Fri, 05 Sep 2025 07:00:00 GMT",Procter & Gamble Company (The) $PG Stock Position Boosted by Royal Bank of Canada - MarketBeat,MarketBeat
"Fri, 05 Sep 2025 07:00:00 GMT",Procter & Gamble Company (The) $PG Shares Bought by Trace Wealth Advisors LLC - MarketBeat,MarketBeat
"Tue, 09 Sep 2025 06:55:57 GMT","Supreme Court Delays NEET PG 2025 Hearing, Students Anxious for Counseling Updates - MSN",MSN
"Fri, 05 Sep 2025 11:58:55 GMT",Belmont Capital LLC Boosts Position in Procter & Gamble Company (The) $PG - MarketBeat,MarketBeat
"Fri, 05 Sep 2025 15:57:00 GMT",Two women go missing in PG County; experts say to stay vigilant and seek the truth. - WUSA9,WUSA9
"Sun, 07 Sep 2025 05:18:00 GMT","NEET PG 2025: 50% AIQ scorecards expected to be released soon, Check details here - The Times of India",The Times of India
"Fri, 05 Sep 2025 07:00:00 GMT",Procter & Gamble Company (The) $PG Position Boosted by Calton & Associates Inc. - MarketBeat,MarketBeat
"Wed, 10 Sep 2025 05:43:22 GMT","NEET PG 2025: SC to Hear Plea on Answer Keys, Rank List Issues on September 12 - Times Now",Times Now
"Tue, 09 Sep 2025 19:23:59 GMT",PG County Police Arrest Man for Killing 19-Year-Old DaCara Thompson. What We Know - MSN,MSN
"Tue, 09 Sep 2025 07:46:00 GMT",PG Soft to Serve as Premier Sponsor at Upcoming SBC Summit in Lisbon - Casino Guardian,Casino Guardian
"Tue, 09 Sep 2025 15:50:10 GMT",Financial analysis: PG gears up for investment phase - Times of Malta,Times of Malta
"Mon, 08 Sep 2025 20:37:31 GMT",NHAI may revisit decision on using CLAT-PG scores for recruitment of lawyers - Tribune India,Tribune India
"Sun, 07 Sep 2025 21:38:56 GMT","Edwin Sifuna, Babu Owino skip ODM-Kenya Kwanza PG chaired by Ruto and Raila - MSN",MSN
"Sun, 07 Sep 2025 23:14:25 GMT",WWAY TV Events - 2nd Sunday Cinema: Captain Ron PG-13 - WWAYTV3,WWAYTV3
"Tue, 09 Sep 2025 16:51:23 GMT",BHU PG Admission 2025: New schedule released for mop-up round for BHU PG admission; Seat allotment on September 10.. - MSN,MSN
"Tue, 09 Sep 2025 15:47:31 GMT",Michelle Hindle to leave Belly Button Designs - PG Buzz,PG Buzz
"Mon, 08 Sep 2025 07:30:25 GMT","NMC directs PG medical students to serve in flood-hit areas, check details here - Education Times",Education Times
"Tue, 09 Sep 2025 05:19:50 GMT","Quant Small Cap Fund hikes stake in Gland Pharma & 2 other stocks, exits Siemens Energy, PG Electroplast i - The Economic Times",The Economic Times
"Tue, 09 Sep 2025 15:47:28 GMT",Bare Cards is top of the class! - PG Buzz,PG Buzz
"Fri, 05 Sep 2025 11:00:02 GMT",Louisville basketball jumps Kansas and Indiana after crucial update from 5-star PG - Big Red Louie,Big Red Louie
"Tue, 09 Sep 2025 14:06:00 GMT",Karnataka pitches for U.K.’s MRCP PG qualifier exams to be held in State - The Hindu,The Hindu
"Tue, 09 Sep 2025 11:53:31 GMT","IIT Delhi, AIIMS jointly offer online PG diploma in healthcare management - MSN",MSN
"Sun, 07 Sep 2025 16:15:19 GMT",Free movies for kids this summer (G and PG rated) - AOL.com,AOL.com
