Date,Title,Source
"Wed, 05 Nov 2025 05:48:00 GMT",Is Okta Inc. stock ready for breakout - Fed Meeting & AI Powered Buy and Sell Recommendations - newser.com,newser.com
"Tue, 04 Nov 2025 14:00:04 GMT","Investors Heavily Search Okta, Inc. (OKTA): Here is What You Need to Know - Yahoo Finance",Yahoo Finance
"Wed, 05 Nov 2025 00:06:48 GMT",Here's Why Okta (OKTA) Fell More Than Broader Market - sharewise.com,sharewise.com
"Tue, 04 Nov 2025 12:36:36 GMT","Freestone Capital Holdings LLC Has $13.49 Million Position in Okta, Inc. $OKTA - MarketBeat",MarketBeat
"Wed, 05 Nov 2025 05:44:29 GMT",Best data tools to analyze OKTA stock - Portfolio Update Summary & Long-Term Safe Investment Plans - newser.com,newser.com
"Mon, 03 Nov 2025 13:00:00 GMT","Okta to Announce Third Quarter Fiscal Year 2026 Financial Results on December 2, 2025 - Yahoo Finance",Yahoo Finance
"Wed, 05 Nov 2025 07:32:48 GMT",Using data models to predict Okta Inc. stock movement - Rate Hike & Fast Gaining Stock Reports - newser.com,newser.com
"Tue, 04 Nov 2025 09:53:35 GMT","Versor Investments LP Has $661,000 Position in Okta, Inc. $OKTA - MarketBeat",MarketBeat
"Sun, 02 Nov 2025 20:09:03 GMT",Has Okta’s Latest Partnership Shifted Its True Value? - Yahoo Finance,Yahoo Finance
"Tue, 04 Nov 2025 10:28:17 GMT","South Dakota Investment Council Buys Shares of 28,437 Okta, Inc. $OKTA - MarketBeat",MarketBeat
"Wed, 05 Nov 2025 06:46:42 GMT",Will Okta Inc. stock attract more institutional investors - 2025 Trading Recap & Daily Growth Stock Investment Tips - newser.com,newser.com
"Wed, 05 Nov 2025 07:24:41 GMT",How Okta Inc. (0OK) stock trades after earnings - Weekly Profit Summary & Weekly High Potential Stock Alerts - newser.com,newser.com
"Wed, 05 Nov 2025 06:31:53 GMT",Why retail investors favor OKTA stock - Weekly Stock Summary & Consistent Growth Equity Picks - newser.com,newser.com
"Wed, 05 Nov 2025 05:23:58 GMT",Is Okta Inc. stock positioned well for digital economy - Trade Risk Assessment & AI Based Trade Execution Alerts - newser.com,newser.com
"Wed, 05 Nov 2025 06:01:34 GMT",Real time social sentiment graph for OKTA - Gap Up & Daily Profit Maximizing Trade Tips - newser.com,newser.com
"Wed, 05 Nov 2025 05:07:02 GMT",Will Okta Inc. benefit from macro trends - Weekly Gains Summary & Technical Analysis for Trade Confirmation - newser.com,newser.com
"Tue, 04 Nov 2025 02:47:18 GMT",Will OKTA stock attract ESG investors - Trade Exit Summary & Community Consensus Trade Signals - newser.com,newser.com
"Mon, 03 Nov 2025 11:56:21 GMT",Sentiment analysis tools applied to OKTA - CEO Change & AI Forecasted Entry/Exit Points - newser.com,newser.com
"Mon, 03 Nov 2025 08:56:25 GMT",How Okta Inc. (0OK) stock trades after earnings - Quarterly Trade Summary & Free Safe Entry Trade Signal Reports - newser.com,newser.com
"Mon, 03 Nov 2025 14:17:05 GMT",Is OKTA meeting your algorithmic filter criteria - Market Sentiment Summary & Safe Entry Zone Tips - newser.com,newser.com
"Sat, 01 Nov 2025 21:49:32 GMT",Cautious Analyst Estimates Might Change The Case For Investing In Okta (OKTA) - simplywall.st,simplywall.st
"Sat, 01 Nov 2025 06:09:55 GMT",Okta: Cheap Entry Into A High-Margin Growth Story - Seeking Alpha,Seeking Alpha
"Mon, 03 Nov 2025 12:12:34 GMT","Tredje AP fonden Has $39.11 Million Holdings in Okta, Inc. $OKTA - MarketBeat",MarketBeat
"Mon, 03 Nov 2025 12:16:28 GMT","Redwood Wealth Management Group LLC Buys New Holdings in Okta, Inc. $OKTA - MarketBeat",MarketBeat
"Mon, 03 Nov 2025 08:55:34 GMT","Spire Wealth Management Acquires 3,741 Shares of Okta, Inc. $OKTA - MarketBeat",MarketBeat
"Mon, 03 Nov 2025 06:30:34 GMT",How Okta Inc. stock reacts to job market data - 2025 Stock Rankings & Real-Time Chart Pattern Alerts - newser.com,newser.com
"Sun, 02 Nov 2025 09:52:00 GMT","Amalgamated Bank Acquires 68,292 Shares of Okta, Inc. $OKTA - MarketBeat",MarketBeat
"Sun, 02 Nov 2025 08:53:46 GMT","Jennison Associates LLC Makes New $900,000 Investment in Okta, Inc. $OKTA - MarketBeat",MarketBeat
"Tue, 04 Nov 2025 06:20:13 GMT",Is Okta Inc. stock positioned well for digital economy - Bull Run & Expert-Curated Trade Recommendations - newser.com,newser.com
"Tue, 04 Nov 2025 03:35:04 GMT",Is Okta Inc. stock positioned well for digital economy - Quarterly Investment Review & Low Drawdown Momentum Ideas - newser.com,newser.com
"Mon, 03 Nov 2025 16:51:40 GMT",Okta fortifies cybersecurity with AI and identity protection - varindia.com,varindia.com
"Sun, 02 Nov 2025 09:39:56 GMT","Retirement Systems of Alabama Takes $20.43 Million Position in Okta, Inc. $OKTA - MarketBeat",MarketBeat
"Sun, 02 Nov 2025 09:27:56 GMT","Strs Ohio Takes $14.19 Million Position in Okta, Inc. $OKTA - MarketBeat",MarketBeat
"Fri, 31 Oct 2025 19:49:51 GMT",Okta (OKTA): Exploring Valuation Prospects as Investor Confidence Builds - simplywall.st,simplywall.st
"Mon, 03 Nov 2025 14:36:59 GMT",How Okta Inc. stock reacts to job market data - 2025 Geopolitical Influence & Stepwise Swing Trade Plans - newser.com,newser.com
"Tue, 04 Nov 2025 10:36:08 GMT",North Macedonia's Okta sees net profit soar in Jan-Sept - SeeNews,SeeNews
"Tue, 04 Nov 2025 06:35:49 GMT",Is OKTA stock safe for conservative investors - July 2025 Recap & Community Verified Trade Signals - newser.com,newser.com
"Mon, 03 Nov 2025 07:40:25 GMT",Sentiment analysis tools applied to OKTA - 2025 Pullback Review & Real-Time Stock Price Movement Reports - newser.com,newser.com
"Mon, 03 Nov 2025 17:03:07 GMT",Okta : Chris Augenstein named SVP and General Manager of the Americas - MarketScreener,MarketScreener
"Mon, 03 Nov 2025 01:47:33 GMT",Will Okta Inc. benefit from macro trends - July 2025 Closing Moves & Technical Pattern Based Buy Signals - newser.com,newser.com
"Mon, 03 Nov 2025 05:20:14 GMT",Why OKTA stock is trending among retail traders - 2025 Momentum Check & Expert Curated Trade Setup Alerts - newser.com,newser.com
"Fri, 31 Oct 2025 09:59:01 GMT",Is OKTA meeting your algorithmic filter criteria - Quarterly Trade Report & Low Volatility Stock Recommendations - newser.com,newser.com
"Sun, 02 Nov 2025 06:34:31 GMT",Technical signs of recovery in Okta Inc. - Market Growth Review & Consistent Profit Focused Trading Strategies - newser.com,newser.com
"Sat, 01 Nov 2025 16:48:53 GMT",Will Okta Inc. benefit from macro trends - July 2025 Macro Moves & High Accuracy Investment Signals - newser.com,newser.com
"Sat, 01 Nov 2025 17:40:03 GMT",Is OKTA stock safe for conservative investors - Trade Risk Report & Growth Oriented Trade Recommendations - newser.com,newser.com
"Mon, 03 Nov 2025 13:35:57 GMT","Okta, Inc. Experiences Revision in Its Stock Evaluation Amid Market Dynamics - Markets Mojo",Markets Mojo
"Sat, 01 Nov 2025 05:38:12 GMT",How Okta Inc. (0OK) stock trades after earnings - 2025 Biggest Moves & Real-Time Sentiment Analysis - newser.com,newser.com
"Fri, 31 Oct 2025 10:09:35 GMT",Does Okta (NASDAQ:OKTA) Have A Healthy Balance Sheet? - 富途牛牛,富途牛牛
"Sat, 01 Nov 2025 07:03:28 GMT",Sentiment analysis tools applied to OKTA - Market Growth Summary & Free Weekly Chart Analysis and Trade Guides - newser.com,newser.com
"Sat, 01 Nov 2025 13:21:04 GMT",Identity Security Leader Okta Maintains Impressive Growth Trajectory - AD HOC NEWS,AD HOC NEWS
2025-11-03T14:00:00,"Okta to Announce Third Quarter Fiscal Year 2026 Financial Results on December 2, 2025",Yahoo
2025-11-02T21:09:03,Has Okta’s Latest Partnership Shifted Its True Value?,Yahoo
2025-11-01T03:09:55,Okta: Cheap Entry Into A High-Margin Growth Story,SeekingAlpha
