Date,Title,Source
"Mon, 08 Dec 2025 05:31:00 GMT",Autodesk (ADSK) Reports Better-Than-Expected Earnings and Guidance Increase According to Baird - Yahoo Finance,Yahoo Finance
"Tue, 09 Dec 2025 20:15:59 GMT",Analyst continues to back Autodesk (ADSK) amid consistent growth momentum - MSN,MSN
"Sun, 07 Dec 2025 14:21:33 GMT","How Strong Q3 Results, Buybacks and Higher Guidance At Autodesk (ADSK) Has Changed Its Investment Story - simplywall.st",simplywall.st
"Fri, 05 Dec 2025 18:48:52 GMT","Autodesk: Incredible Moat And Great Opportunities, But Too Expensive (NASDAQ:ADSK) - Seeking Alpha",Seeking Alpha
"Sat, 06 Dec 2025 15:12:28 GMT",The Bull Case For Autodesk (ADSK) Could Change Following Raised Guidance And Buybacks Amid Cloud-AI Push - Yahoo Finance,Yahoo Finance
"Sat, 06 Dec 2025 17:40:02 GMT",(ADSK) Price Dynamics and Execution-Aware Positioning - news.stocktradersdaily.com,news.stocktradersdaily.com
"Tue, 09 Dec 2025 08:56:12 GMT","Bank of Nova Scotia Grows Stake in Autodesk, Inc. $ADSK - Defense World",Defense World
"Mon, 08 Dec 2025 09:44:02 GMT","Cerity Partners LLC Buys 9,694 Shares of Autodesk, Inc. $ADSK - Defense World",Defense World
2025-12-10T17:12:50,"Autodesk, Inc. (ADSK) Presents at Barclays 23rd Annual Global Technology Conference Transcript",SeekingAlpha
2025-12-08T07:48:54,Analyst Continues to Back Autodesk (ADSK) Amid Consistent Growth Momentum,Yahoo
2025-12-08T06:31:33,Autodesk (ADSK) Reports Better-Than-Expected Earnings and Guidance Increase According to Baird,Yahoo
2025-12-06T16:12:28,The Bull Case For Autodesk (ADSK) Could Change Following Raised Guidance And Buybacks Amid Cloud-AI Push,Yahoo
2025-12-05T14:48:52,"Autodesk: Incredible Moat And Great Opportunities, But Too Expensive",SeekingAlpha
2025-12-05T04:10:21,"Baird Lifts Autodesk, Inc. (ADSK) Price Target  on Solid Q3 Results",Yahoo
