Date,Title,Source
2025-09-05T06:13:03Z,"Brokerages Set Take-Two Interactive Software, Inc. (NASDAQ:TTWO) Target Price at $248.32",ETF Daily News
2025-09-03T17:25:00Z,Designers Weigh In on the 2025 Audi TT Concept,Core77.com
"Sat, 06 Sep 2025 22:48:03 GMT","Take-Two Interactive Software, Inc. $TTWO Shares Purchased by Canada Pension Plan Investment Board - MarketBeat",MarketBeat
"Thu, 04 Sep 2025 20:33:00 GMT",Insider Sale: Chief Legal Officer of $TTWO Sells 903 Shares - Quiver Quantitative,Quiver Quantitative
"Wed, 03 Sep 2025 15:40:03 GMT",BYD vs. TTWO: Which Stock Is the Better Value Option? - Yahoo Finance,Yahoo Finance
"Sun, 07 Sep 2025 05:26:45 GMT",Will TTWO benefit from geopolitical trends - Weekly Profit Recap & Expert Verified Stock Movement Alerts - 강소기업뉴스,강소기업뉴스
"Sat, 06 Sep 2025 18:02:47 GMT","Take-Two Interactive Software, Inc. (NASDAQ:TTWO) Given Average Rating of ""Moderate Buy"" by Analysts - MarketBeat",MarketBeat
"Wed, 03 Sep 2025 14:29:22 GMT",Take-Two Stock (TTWO) Slips as Rockstar Denies GTA 6 Rumors - TipRanks,TipRanks
"Wed, 03 Sep 2025 17:01:14 GMT",BYD vs. TTWO: Which Stock Is the Better Value Option? - sharewise.com,sharewise.com
"Sat, 06 Sep 2025 15:19:07 GMT",Will TTWO benefit from AI trends - Profit Target & Verified High Yield Trade Plans - 강소기업뉴스,강소기업뉴스
"Fri, 05 Sep 2025 19:49:07 GMT",Should I invest in TTWO before earnings - July 2025 Drop Watch & Stock Timing and Entry Methods - خودرو بانک,خودرو بانک
"Sat, 06 Sep 2025 20:39:34 GMT","Ieq Capital LLC Raises Holdings in Take-Two Interactive Software, Inc. $TTWO - MarketBeat",MarketBeat
"Fri, 05 Sep 2025 02:03:49 GMT",Is TTWO a stock for growth or value investors - Market Sentiment Report & Technical Confirmation Trade Alerts - خودرو بانک,خودرو بانک
"Fri, 05 Sep 2025 13:05:10 GMT","224,708 Shares in Take-Two Interactive Software, Inc. $TTWO Purchased by Atalanta Sosnoff Capital LLC - MarketBeat",MarketBeat
"Thu, 04 Sep 2025 06:28:50 GMT",Should I invest in TTWO before earnings - July 2025 Spike Watch & Community Consensus Stock Picks - خودرو بانک,خودرو بانک
"Wed, 03 Sep 2025 07:00:00 GMT","Contour Asset Management LLC Buys Shares of 871,899 Take-Two Interactive Software, Inc. $TTWO - MarketBeat",MarketBeat
"Wed, 03 Sep 2025 07:00:00 GMT","Totem Point Management LLC Raises Holdings in Take-Two Interactive Software, Inc. $TTWO - MarketBeat",MarketBeat
"Tue, 02 Sep 2025 09:03:31 GMT","Jump Financial LLC Sells 6,177 Shares of Take-Two Interactive Software, Inc. $TTWO - MarketBeat",MarketBeat
"Sun, 07 Sep 2025 06:22:05 GMT",Trend analysis for TTWO this week - 2025 Market Outlook & Long-Term Safe Return Strategies - Newser,Newser
"Sun, 07 Sep 2025 02:04:53 GMT",TTWO stock outlook for YEAR - July 2025 Outlook & Growth Focused Entry Reports - Newser,Newser
2025-09-03T18:40:03,BYD vs. TTWO: Which Stock Is the Better Value Option?,Yahoo
2025-09-04T19:29:16,Questions on investing for a payoff 9 months down the road,Reddit/r/investing
