Date,Title,Source
2025-09-03T12:38:53Z,"Generative AI Tools Threaten Adobe’s (ADBE) Edge, Analyst Reiterates Sell",Biztoc.com
2025-09-03T12:21:09Z,"Generative AI Tools Threaten Adobe’s (ADBE) Edge, Analyst Reiterates Sell",Yahoo Entertainment
"Sun, 07 Sep 2025 20:25:15 GMT","Adobe Inc. (ADBE)’s CEO Is A Great Executive, Says Jim Cramer - uk.finance.yahoo.com",uk.finance.yahoo.com
"Sun, 07 Sep 2025 23:11:29 GMT","Generative AI Tools Threaten Adobe’s (ADBE) Edge, Analyst Reiterates Sell - MSN",MSN
"Mon, 08 Sep 2025 05:30:02 GMT",(ADBE) as a Liquidity Pulse for Institutional Tactics - news.stocktradersdaily.com,news.stocktradersdaily.com
"Sun, 07 Sep 2025 12:00:07 GMT","Earnings week ahead: ADBE, ORCL, GME, KR, CHWY, FCEL, and more (NASDAQ:ADBE) - Seeking Alpha",Seeking Alpha
"Thu, 04 Sep 2025 01:18:45 GMT",Why Adobe Stock (ADBE) is Poised for Yet Another Beat-and-Raise - TipRanks,TipRanks
"Fri, 05 Sep 2025 19:59:59 GMT",Adobe Share Price Today (NASDAQ: ADBE) - Adobe Stock Price Live Chart - INDmoney,INDmoney
"Mon, 08 Sep 2025 04:35:40 GMT",Is Themes Etf Trust Leverage Shares 2x Long ADBE Daily Etf forming a breakout pattern - Portfolio Risk Summary & Fast Gain Stock Tips - beatles.ru,beatles.ru
"Sat, 06 Sep 2025 07:42:00 GMT",Adobe (ADBE): New Buy Recommendation for This Technology Giant - The Globe and Mail,The Globe and Mail
"Sun, 07 Sep 2025 10:51:13 GMT","Ahead of Q3 Earnings, Let’s Look at Who Owns Adobe Stock (ADBE) - TipRanks",TipRanks
"Thu, 04 Sep 2025 11:37:30 GMT",Is Adobe (ADBE) a Buy Ahead of Q3 Earnings? - TipRanks,TipRanks
"Fri, 05 Sep 2025 04:42:22 GMT",Adobe Inc. (ADBE) Announces Launch of Acrobat Studio. Here Is What You Need To Know - MSN,MSN
"Thu, 04 Sep 2025 09:23:12 GMT",Adobe Inc. (ADBE) Stock Analysis: Evaluating A 37.75% Potential Upside In The Tech Giant - DirectorsTalk Interviews,DirectorsTalk Interviews
"Wed, 03 Sep 2025 17:18:00 GMT","Notable Wednesday Option Activity: WDC, ADBE, BIIB - Nasdaq",Nasdaq
"Wed, 03 Sep 2025 11:36:06 GMT",Why (ADBE) Price Action Is Critical for Tactical Trading - news.stocktradersdaily.com,news.stocktradersdaily.com
"Wed, 03 Sep 2025 12:48:15 GMT",Adobe (ADBE) Faces an Existential Threat from Generative AI: Is the Sell Rating Justified? - AInvest,AInvest
"Fri, 05 Sep 2025 17:58:32 GMT",Should you avoid ADBE stock right now - July 2025 Fed Impact & AI Powered Buy/Sell Recommendations - خودرو بانک,خودرو بانک
"Fri, 05 Sep 2025 15:34:42 GMT",Is Themes Etf Trust Leverage Shares 2x Long ADBE Daily Etf forming a breakout pattern - July 2025 Closing Moves & Safe Entry Momentum Tips - خودرو بانک,خودرو بانک
"Fri, 05 Sep 2025 18:28:12 GMT",Can Themes Etf Trust Leverage Shares 2x Long ADBE Daily Etf stock double in the next year - 2025 Technical Overview & Real-Time Buy Signal Notifications - خودرو بانک,خودرو بانک
"Thu, 04 Sep 2025 13:20:34 GMT",What is ADBE s P E ratio telling us - 2025 Technical Patterns & Community Supported Trade Ideas - خودرو بانک,خودرو بانک
"Fri, 05 Sep 2025 21:53:20 GMT",Will Themes Etf Trust Leverage Shares 2x Long ADBE Daily Etf benefit from geopolitical trends - 2025 Market Outlook & Free Safe Capital Growth Stock Tips - خودرو بانک,خودرو بانک
"Fri, 05 Sep 2025 09:04:52 GMT",Inflation Data: What is the PEG ratio of ADBE - July 2025 PreEarnings & Technical Pattern Based Signals - 강소기업뉴스,강소기업뉴스
"Wed, 03 Sep 2025 22:19:04 GMT",How does Themes Etf Trust Leverage Shares 2x Long ADBE Daily Etf score in quality rankings - Market Risk Summary & Free Fast Gain Swing Trade Alerts - خودرو بانک,خودرو بانک
"Mon, 08 Sep 2025 03:30:20 GMT",Can a trend reversal in ADBE lead to recovery - 2025 Bull vs Bear & Growth Focused Entry Point Reports - Newser,Newser
"Sun, 07 Sep 2025 21:06:03 GMT",Is Adobe (ADBE) Still a Buy Amid AI Disruption and Rising Competition? - AInvest,AInvest
"Mon, 08 Sep 2025 06:46:52 GMT",Best data tools to analyze ADBE stock - 2025 Institutional Moves & Daily Chart Pattern Signals - Newser,Newser
"Mon, 08 Sep 2025 06:27:38 GMT",How to manage a losing position in ADBE - July 2025 EndofMonth & Real-Time Stock Movement Alerts - Newser,Newser
"Mon, 08 Sep 2025 05:43:55 GMT",How institutional ownership impacts ADBE stock - July 2025 Selloffs & Safe Capital Growth Tips - Newser,Newser
"Mon, 08 Sep 2025 00:03:28 GMT",Using data models to predict ADBE stock movement - July 2025 Movers & Smart Allocation Stock Reports - Newser,Newser
"Mon, 08 Sep 2025 05:22:37 GMT",What moving averages say about ADBE - Chart Signals & Low Volatility Stock Suggestions - Newser,Newser
"Sun, 07 Sep 2025 12:12:22 GMT","Key Earnings Week Ahead: ADBE, ORCL, GME, KR, CHWY, FCEL, and More - AInvest",AInvest
"Mon, 08 Sep 2025 06:43:13 GMT",When is the best time to exit ADBE - 2025 Trading Recap & Fast Exit and Entry Strategy Plans - Newser,Newser
"Mon, 08 Sep 2025 03:39:09 GMT",Comparing ADBE in custom built stock radars - July 2025 Movers & Safe Entry Point Identification - Newser,Newser
"Mon, 08 Sep 2025 05:55:25 GMT",Adobe (NASDAQ:ADBE) Upgraded at Wall Street Zen - Defense World,Defense World
"Mon, 08 Sep 2025 05:55:25 GMT",Barclays Cuts Adobe (NASDAQ:ADBE) Price Target to $460.00 - Defense World,Defense World
"Thu, 04 Sep 2025 05:08:21 GMT",Adobe (ADBE) Expected to Announce Earnings on Thursday - Defense World,Defense World
2025-09-06T02:00:00,"Oracle earnings, August CPI data: What to Watch Next Week",Yahoo
2025-09-03T15:21:09,"Generative AI Tools Threaten Adobe’s (ADBE) Edge, Analyst Reiterates Sell",Yahoo
