Date,Title,Source
2025-10-16T04:33:42Z,Some Business Cycle Observables,Econbrowser.com
2025-10-15T11:44:00Z,2025-26 Fantasy Basketball Sleepers: Late-Round Lottery Tickets,Yahoo Entertainment
2025-10-14T08:39:47Z,brynq-sdk-adp-decidium 1.0.2,Pypi.org
2025-10-14T03:23:20Z,JVNDB-2025-015844:zhilink の ADP Application Developer Platform におけるインジェクションに関する脆弱性,Jpcert.or.jp
2025-10-14T00:00:00Z,A survey of ADP-ribosyltransferase families in the pathogenic Legionella,Biomedcentral.com
"Thu, 16 Oct 2025 15:03:41 GMT",How ADP builds ventures that stay inside the business - - Global Venturing,Global Venturing
"Thu, 16 Oct 2025 08:28:32 GMT",How Investors Are Reacting To Automatic Data Processing (ADP) Steady Earnings Growth and Russell 1000 Influence - simplywall.st,simplywall.st
"Tue, 14 Oct 2025 12:01:25 GMT",What is an AI agent? - ADP Media Center,ADP Media Center
"Wed, 15 Oct 2025 12:02:29 GMT","ADP - ADP: ""Pace of Play"" - Little Black Book | LBBOnline",Little Black Book | LBBOnline
"Thu, 16 Oct 2025 15:57:55 GMT",ADP - September group traffic at 33.7 mln passengers - MarketScreener,MarketScreener
"Sun, 12 Oct 2025 12:00:16 GMT","With EPS Growth And More, Automatic Data Processing (NASDAQ:ADP) Makes An Interesting Case - Yahoo Finance",Yahoo Finance
"Mon, 13 Oct 2025 09:39:00 GMT",ADP stock price target unchanged at $315 as Jefferies maintains Hold rating - Investing.com,Investing.com
"Sun, 12 Oct 2025 16:01:00 GMT",ADP to relocate Miami office - The Business Journals,The Business Journals
"Sun, 12 Oct 2025 19:57:17 GMT","2025-26 Fantasy Basketball ADP Analysis: Exploiting Value on ESPN, Yahoo, and Fantrax - Fantasy Six Pack",Fantasy Six Pack
"Tue, 14 Oct 2025 09:03:47 GMT","Automatic Data Processing, Inc. $ADP Shares Bought by MGO One Seven LLC - MarketBeat",MarketBeat
"Mon, 13 Oct 2025 15:00:00 GMT",What is ADP in Fantasy Basketball? Average Draft Position Explained - RotoWire,RotoWire
"Mon, 13 Oct 2025 17:48:29 GMT",How to Prove HR ROI to Your Financial Leaders - ADP,ADP
"Mon, 13 Oct 2025 19:51:01 GMT","Holiday, Aldama among biggest fantasy ADP risers - NBC Sports",NBC Sports
"Mon, 13 Oct 2025 11:06:50 GMT","Automatic Data Processing, Inc. $ADP is Vest Financial LLC's 2nd Largest Position - MarketBeat",MarketBeat
"Sun, 12 Oct 2025 10:54:56 GMT","Automatic Data Processing, Inc. $ADP Shares Sold by Natural Investments LLC - MarketBeat",MarketBeat
"Sun, 12 Oct 2025 09:51:20 GMT","Automatic Data Processing, Inc. $ADP Position Raised by Vanguard Personalized Indexing Management LLC - MarketBeat",MarketBeat
"Sun, 12 Oct 2025 10:33:45 GMT","Bey Douglas LLC Acquires 4,012 Shares of Automatic Data Processing, Inc. $ADP - MarketBeat",MarketBeat
"Wed, 15 Oct 2025 14:46:53 GMT",US market today: Wall Street drifts on weak ADP jobs data; treasuries gain as yields fall - MSN,MSN
"Wed, 15 Oct 2025 13:12:03 GMT",Bloated ADPs fail to lift infrastructure - The Financial Express,The Financial Express
"Mon, 13 Oct 2025 20:20:48 GMT",Highestever block allocation in ADP for an election year - The Financial Express,The Financial Express
"Tue, 14 Oct 2025 03:37:46 GMT",Carryover 'political' projects weigh on ADP for FY '14 - The Financial Express,The Financial Express
"Mon, 13 Oct 2025 09:50:53 GMT",MoC may get highestever allocation under next ADP - The Financial Express,The Financial Express
"Wed, 15 Oct 2025 08:14:31 GMT",Govt set to include 1007 fresh projects in current ADP - The Financial Express,The Financial Express
"Mon, 13 Oct 2025 11:17:33 GMT",NEC approves Tk 658.70b ADP for next fiscal - The Financial Express,The Financial Express
"Mon, 13 Oct 2025 18:50:54 GMT",Next fiscal's ADP makes space for 1007 unapproved projects - The Financial Express,The Financial Express
"Mon, 13 Oct 2025 11:51:54 GMT",Tk 658.70b ADP for next fiscal to get govt nod today - The Financial Express,The Financial Express
"Mon, 13 Oct 2025 06:31:17 GMT",ADP in FY 14 to be around Tk 644.4b - The Financial Express,The Financial Express
"Mon, 13 Oct 2025 16:12:02 GMT",Power Division seeks Tk 90b ADP fund for next fiscal - The Financial Express,The Financial Express
"Mon, 13 Oct 2025 09:52:00 GMT",Power Div to get Tk 89.85b in ADP for FY 201314 - The Financial Express,The Financial Express
"Thu, 16 Oct 2025 06:05:31 GMT",ADP Values For 2025 Fantasy Basketball (Category Leagues) - RotoBaller,RotoBaller
"Fri, 17 Oct 2025 00:49:00 GMT","'2025 MAMA Awards' unveils first lineup of performing artists: Stray Kids, RIIZE, ZB1, ALD1, ADP, IVE, BABYMONSTER, & more - allkpop",allkpop
"Sun, 12 Oct 2025 15:34:39 GMT",Motability Scheme 2025 Update – Big Changes for PIP and ADP Claimants Begin This Week - sengol1947ignca.in,sengol1947ignca.in
2025-10-12T14:00:16,"With EPS Growth And More, Automatic Data Processing (NASDAQ:ADP) Makes An Interesting Case",Yahoo
