Date,Title,Source
2025-09-07T05:46:59Z,Zacks Research Has Strong Forecast for AMAT FY2025 Earnings,ETF Daily News
2025-09-06T05:58:58Z,Bishop Amat's Ryan Salcedo has five touchdowns in win over Valencia,Yahoo Entertainment
2025-09-03T04:35:51Z,TD Cowen Reiterates Buy Rating on Applied Materials (AMAT) Stock,Yahoo Entertainment
"Sun, 07 Sep 2025 13:57:13 GMT",Mizuho Downgrades Applied Materials (AMAT) to Hold with a $170 PT Despite Strong Q3 Results - Yahoo Finance,Yahoo Finance
"Sat, 06 Sep 2025 16:28:22 GMT",Bishop Amat football edges Valencia in thriller - Los Angeles Daily News,Los Angeles Daily News
"Sun, 07 Sep 2025 20:15:00 GMT","SGV football Top 30: Damien, La Habra hold top spots; Bishop Amat to No. 3 - San Gabriel Valley Tribune",San Gabriel Valley Tribune
"Sat, 06 Sep 2025 05:58:00 GMT",Bishop Amat’s Ryan Salcedo has five touchdowns in win over Valencia - Los Angeles Times,Los Angeles Times
"Sun, 07 Sep 2025 22:23:01 GMT",Volleyball Recap: Bishop Amat Extends Winning Streak to Nine - MaxPreps.com,MaxPreps.com
"Fri, 05 Sep 2025 13:18:45 GMT",AMAT Rides on the Strength in Semiconductor Systems: Will it Last? - Zacks Investment Research,Zacks Investment Research
"Sat, 06 Sep 2025 05:26:57 GMT",Bishop Amat stuns Valencia at home for heartbreak defeat - Santa Clarita Valley Signal,Santa Clarita Valley Signal
"Wed, 03 Sep 2025 18:22:30 GMT","SGV girls flag football: Bishop Amat, La Habra, California lead area rankings - Pasadena Star News",Pasadena Star News
"Sat, 06 Sep 2025 06:28:44 GMT",Bishop Amat Clinches Win Over Valencia On Final Play Of Game - KHTS Radio,KHTS Radio
"Mon, 08 Sep 2025 04:01:52 GMT",Football Recap: Strong Performance on D from KJ Paea and Mac Naughtin Leads Bishop Amat over Valencia + How To Watch - MaxPreps.com,MaxPreps.com
"Sun, 07 Sep 2025 00:29:21 GMT",Applied Materials Stock: Is AMAT Underperforming the Technology Sector? - MSN,MSN
"Sun, 07 Sep 2025 22:23:01 GMT",Volleyball Recap: Bishop Amat's Winning Streak Snapped at Seven Games - MaxPreps.com,MaxPreps.com
"Sun, 07 Sep 2025 02:10:20 GMT",Football Recap: Mac Naughtin's Menacing Defense Leads Bishop Amat over Valencia + How To Watch - MaxPreps.com,MaxPreps.com
"Sat, 06 Sep 2025 14:19:53 GMT",Volleyball Recap: Bishop Amat Picks Up Seventh Consecutive Victory - MaxPreps.com,MaxPreps.com
"Sat, 06 Sep 2025 14:19:53 GMT",Volleyball Recap: Bishop Amat Extends Winning Streak to Six - MaxPreps.com,MaxPreps.com
"Thu, 04 Sep 2025 01:28:17 GMT",Cantor Sebo to receive NA’AMAT USA Golda Meir Award - Cleveland Jewish News,Cleveland Jewish News
"Thu, 04 Sep 2025 09:17:58 GMT",Volleyball Recap: Bishop Amat's Win on Tuesday Extends Winning Streak to Four + How To Watch - MaxPreps.com,MaxPreps.com
"Wed, 03 Sep 2025 17:03:28 GMT",Volleyball Recap: Bishop Amat Victorious - MaxPreps.com,MaxPreps.com
"Wed, 03 Sep 2025 08:35:02 GMT",Volleyball Recap: Make It Four in a Row for Bishop Amat + How To Watch - MaxPreps.com,MaxPreps.com
"Fri, 05 Sep 2025 20:33:06 GMT",Does AMAT have pricing power - Dividend Hike & Verified Entry Point Detection - خودرو بانک,خودرو بانک
"Thu, 04 Sep 2025 07:37:43 GMT",Does AMAT offer margin of safety - Analyst Upgrade & Fast Gaining Stock Strategy Reports - خودرو بانک,خودرو بانک
"Fri, 05 Sep 2025 01:23:55 GMT",Does AMAT have declining or rising EPS - Quarterly Growth Report & Expert Curated Trade Ideas - خودرو بانک,خودرو بانک
"Thu, 04 Sep 2025 12:39:48 GMT",Is AMAT a potential multi bagger - Product Launch & Safe Swing Trade Setups - خودرو بانک,خودرو بانک
"Thu, 04 Sep 2025 01:24:40 GMT",Is AMAT a top pick in the sector - 2025 Geopolitical Influence & High Return Trade Opportunity Guides - خودرو بانک,خودرو بانک
"Wed, 03 Sep 2025 07:00:00 GMT",What’s next for AMAT stock - 2025 Performance Recap & Capital Efficiency Focused Ideas - خودرو بانک,خودرو بانک
"Wed, 03 Sep 2025 21:23:25 GMT",What’s AMAT’s historical return - Weekly Trend Recap & Entry Point Confirmation Signals - خودرو بانک,خودرو بانک
"Mon, 08 Sep 2025 06:57:14 GMT",When LPAAW stock expected to show significant growthIs AMAT stock a good long term investment option - Gold Moves & Smart Swing Trading Techniques - Newser,Newser
"Mon, 08 Sep 2025 05:17:26 GMT",Best data tools to analyze AMAT stock - 2025 Earnings Impact & Daily Market Momentum Tracking - Newser,Newser
"Mon, 08 Sep 2025 04:08:52 GMT",What machine learning models say about AMAT - 2025 Historical Comparison & Real-Time Stock Entry Alerts - Newser,Newser
"Mon, 08 Sep 2025 02:56:44 GMT",Detecting price anomalies in AMAT with AI - July 2025 Trends & Growth Oriented Trade Recommendations - Newser,Newser
"Mon, 08 Sep 2025 05:21:43 GMT",What machine learning models say about AMAT - Market Rally & High Yield Equity Trading Tips - Newser,Newser
"Mon, 08 Sep 2025 06:05:25 GMT",Equities Analysts Set Expectations for AMAT FY2027 Earnings - Defense World,Defense World
"Sat, 06 Sep 2025 05:49:11 GMT",Soitec (OTCMKTS:SLOIF) and Applied Materials (NASDAQ:AMAT) Critical Comparison - Defense World,Defense World
"Sat, 06 Sep 2025 05:44:11 GMT",Zacks Research Has Positive Outlook for AMAT FY2025 Earnings - Defense World,Defense World
2025-09-07T15:57:13,Mizuho Downgrades Applied Materials (AMAT) to Hold with a $170 PT Despite Strong Q3 Results,Yahoo
2025-09-05T16:52:00,AMAT Rides on the Strength in Semiconductor Systems: Will it Last?,Yahoo
2025-09-03T07:35:51,TD Cowen Reiterates Buy Rating on Applied Materials (AMAT) Stock,Yahoo
