Date,Title,Source
2025-10-15T14:06:28Z,Here's How Much You Would Have Made Owning Adobe Stock In The Last 20 Years,Biztoc.com
"Thu, 16 Oct 2025 11:00:12 GMT",Is There An Opportunity With Adobe Inc.'s (NASDAQ:ADBE) 36% Undervaluation? - Yahoo Finance,Yahoo Finance
"Thu, 16 Oct 2025 16:01:29 GMT",ORCL vs. ADBE: Which Software Powerhouse Has Better AI & Cloud Edge? - Zacks Investment Research,Zacks Investment Research
"Mon, 13 Oct 2025 17:34:00 GMT",Adobe Inc. Stock (ADBE) Opinions on Morgan Stanley Downgrade - Quiver Quantitative,Quiver Quantitative
"Thu, 16 Oct 2025 21:24:39 GMT",GreensKeeper Value Fund Takes New Stake in Adobe (ADBE) - GuruFocus,GuruFocus
"Thu, 16 Oct 2025 04:50:32 GMT",Can Adobe's (ADBE) AI Push in Travel Redefine Its Competitive Edge? - simplywall.st,simplywall.st
"Thu, 16 Oct 2025 17:18:16 GMT",Is Themes Etf Trust Leverage Shares 2x Long ADBE Daily Etf stock safe for conservative investors - July 2025 Gainers & Weekly High Return Forecasts - newser.com,newser.com
"Wed, 15 Oct 2025 10:23:05 GMT","Don’t Expect A Comeback: Adobe's Decline Is A Shift, Not A Dip (NASDAQ:ADBE) - Seeking Alpha",Seeking Alpha
"Tue, 14 Oct 2025 19:36:00 GMT","Notable Tuesday Option Activity: KSS, ADBE, PII - Nasdaq",Nasdaq
"Wed, 15 Oct 2025 00:02:01 GMT",Understanding the Setup: (ADBE) and Scalable Risk - news.stocktradersdaily.com,news.stocktradersdaily.com
"Sun, 12 Oct 2025 11:08:03 GMT",Adobe (ADBE): Evaluating Valuation as Shares Slide 3% This Month - Yahoo Finance,Yahoo Finance
"Mon, 13 Oct 2025 14:48:00 GMT","SCHG, DIS, ANET, ADBE: ETF Inflow Alert - Nasdaq",Nasdaq
"Mon, 13 Oct 2025 15:30:01 GMT",Liquidity Mapping Around (ADBE) Price Events - news.stocktradersdaily.com,news.stocktradersdaily.com
"Tue, 14 Oct 2025 14:25:44 GMT",Adobe (ADBE): Evaluating Valuation as New Commerce Optimizer Showcases AI-Driven Innovation and Strategic Partnerships - simplywall.st,simplywall.st
"Mon, 13 Oct 2025 11:26:02 GMT",(ADBE) and the Role of Price-Sensitive Allocations - news.stocktradersdaily.com,news.stocktradersdaily.com
2025-10-16T18:34:00,ORCL vs. ADBE: Which Software Powerhouse Has Better AI & Cloud Edge?,Yahoo
2025-10-16T13:00:12,Is There An Opportunity With Adobe Inc.'s (NASDAQ:ADBE) 36% Undervaluation?,Yahoo
2025-10-15T10:08:25,Adobe: The Market Is Misunderstanding The Company,SeekingAlpha
2025-10-12T13:08:03,Adobe (ADBE): Evaluating Valuation as Shares Slide 3% This Month,Yahoo
2025-10-15T22:58:58,ADBE - 8 LEAPS 2027 ! LFG ! 🚀🚀🚀,Reddit/r/wallstreetbets
