Date,Title,Source
2025-10-15T14:40:39Z,"Stifel Raises Marvell (MRVL) Price Target, Keeps Buy Rating",Biztoc.com
2025-10-15T14:20:22Z,"Stifel Raises Marvell (MRVL) Price Target, Keeps Buy Rating",Yahoo Entertainment
"Thu, 16 Oct 2025 11:00:11 GMT","Marvell Technology, Inc.'s (NASDAQ:MRVL) US$3.1b market value fall may be overlooked by institutional investors after a year of 9.2% returns - Yahoo Finance",Yahoo Finance
"Fri, 17 Oct 2025 05:49:47 GMT",Is MRVL stock a safe haven asset - Portfolio Update Report & Community Trade Idea Sharing Platform - newser.com,newser.com
"Tue, 14 Oct 2025 20:14:16 GMT",Marvell Technology: The Overlooked AI Infrastructure Stock Powering Cloud Growth (MRVL) - Seeking Alpha,Seeking Alpha
"Wed, 15 Oct 2025 13:00:00 GMT","Is Trending Stock Marvell Technology, Inc. (MRVL) a Buy Now? - Nasdaq",Nasdaq
"Thu, 16 Oct 2025 00:00:02 GMT",Technical Reactions to MRVL Trends in Macro Strategies - news.stocktradersdaily.com,news.stocktradersdaily.com
"Wed, 15 Oct 2025 21:38:40 GMT",Roth Capital Raises Price Target for Marvell (MRVL) - GuruFocus,GuruFocus
"Wed, 15 Oct 2025 14:39:12 GMT","Stifel Raises Marvell (MRVL) Price Target, Keeps Buy Rating - Insider Monkey",Insider Monkey
"Wed, 15 Oct 2025 14:20:22 GMT","Stifel Raises Marvell (MRVL) Price Target, Keeps Buy Rating - Yahoo Finance",Yahoo Finance
"Fri, 17 Oct 2025 03:26:52 GMT",Why MRVL stock appeals to dividend seekers - July 2025 Final Week & Fast Gain Stock Tips - newser.com,newser.com
"Mon, 13 Oct 2025 20:41:00 GMT",Why Marvell Technology (MRVL) Stock Is Trading Up Today - FinancialContent,FinancialContent
"Sun, 12 Oct 2025 22:39:02 GMT",Marvell’s AI Data Center Rollout Might Change the Case for Investing in Marvell Technology (MRVL) - simplywall.st,simplywall.st
"Wed, 15 Oct 2025 14:38:53 GMT",Marvell: An Asymmetric Bet On The Custom Chip Revolution (NASDAQ:MRVL) - Seeking Alpha,Seeking Alpha
"Mon, 13 Oct 2025 14:49:28 GMT","UBS Adjusts Marvell Tech (MRVL) Price Target to $105, Maintains Buy Rating | MRVL Stock News - GuruFocus",GuruFocus
"Fri, 17 Oct 2025 04:05:07 GMT",What technical models suggest about MRVL’s comeback - Bear Alert & Momentum Based Trading Signals - newser.com,newser.com
"Mon, 13 Oct 2025 03:36:00 GMT",Q2 Rundown: Marvell Technology (NASDAQ:MRVL) Vs Other Semiconductor Manufacturing Stocks - Yahoo Finance,Yahoo Finance
"Tue, 14 Oct 2025 10:37:48 GMT",Marvell (MRVL) Stock in Focus as Analysts Stay Bullish Before Aug. 28 Earnings - MSN,MSN
2025-10-16T13:00:11,"Marvell Technology, Inc.'s (NASDAQ:MRVL) US$3.1b market value fall may be overlooked by institutional investors after a year of 9.2% returns",Yahoo
2025-10-15T16:20:22,"Stifel Raises Marvell (MRVL) Price Target, Keeps Buy Rating",Yahoo
2025-10-15T15:00:05,"Is Trending Stock Marvell Technology, Inc. (MRVL) a Buy Now?",Yahoo
2025-10-14T18:14:16,Marvell Technology: The Overlooked AI Infrastructure Stock Powering Cloud Growth,SeekingAlpha
2025-10-13T22:41:29,Why Marvell Technology (MRVL) Stock Is Trading Up Today,Yahoo
2025-10-13T05:36:59,Q2 Rundown: Marvell Technology (NASDAQ:MRVL) Vs Other Semiconductor Manufacturing Stocks,Yahoo
