Date,Title,Source
"Fri, 26 Sep 2025 23:58:00 GMT","Red Cat Holdings Stock Price, Quotes and Forecasts | NASDAQ:RCAT - Benzinga",Benzinga
"Tue, 23 Sep 2025 17:16:16 GMT",Red Cat Holdings (RCAT): Valuation in Focus Following $172.5 Million Stock Offering and Maritime Expansion - simplywall.st,simplywall.st
"Wed, 24 Sep 2025 15:45:55 GMT",Red Cat (NASDAQ:RCAT) Stock Price Down 6.2% - Should You Sell? - MarketBeat,MarketBeat
"Wed, 24 Sep 2025 15:50:00 GMT",Safe Pro Group (NASDAQ: SPAI) Collaborates with Red Cat (NASDAQ: RCAT) to Equip Drones with AI-Powered Image Analysis Tech - The Globe and Mail,The Globe and Mail
"Tue, 23 Sep 2025 20:39:09 GMT",Red Cat (NASDAQ:RCAT) Sees Unusually-High Trading Volume - Here's What Happened - MarketBeat,MarketBeat
"Tue, 23 Sep 2025 07:00:00 GMT","Goldman Sachs Group Inc. Purchases 59,334 Shares of Red Cat Holdings, Inc. $RCAT - MarketBeat",MarketBeat
"Sun, 28 Sep 2025 06:23:39 GMT",Is RCAT stock gaining market share - IPO Watch & Accurate Technical Buy Alerts - newser.com,newser.com
"Sat, 27 Sep 2025 05:20:38 GMT",Why RCAT stock could benefit from AI revolution - 2025 Market Overview & AI Forecast for Swing Trade Picks - newser.com,newser.com
"Sat, 27 Sep 2025 22:12:34 GMT",Why RCAT stock attracts high net worth investors - Trade Exit Summary & Verified Short-Term Plans - newser.com,newser.com
"Sat, 27 Sep 2025 21:10:48 GMT",Is RCAT stock near bottom after decline - 2025 Macro Impact & Weekly Watchlist for Consistent Profits - newser.com,newser.com
"Fri, 26 Sep 2025 15:59:39 GMT",Why RCAT stock attracts high net worth investors - Market Volume Summary & Safe Capital Growth Trade Ideas - newser.com,newser.com
2025-09-28T13:03:02,Red Cat Holdings (RCAT): Valuation in Focus Following Strategic AI Partnership with Safe Pro Group,Yahoo
2025-09-24T15:28:37,Just a couple ideas...,Reddit/r/stocks
