Date,Title,Source
2025-12-02T21:57:49Z,Should You Buy the Post-Earnings AI Surge in MongoDB Stock?,Biztoc.com
2025-12-02T18:44:59Z,Why MongoDB Stock Is Skyrocketing in After-Hours Trading?,Biztoc.com
2025-12-02T15:56:42Z,MongoDB Stock Darts Higher After Q3 Earnings: Here's Why,Biztoc.com
2025-12-02T15:22:58Z,Live Nasdaq Composite: Tech Stocks Lead Markets Out of Doldrums,Biztoc.com
2025-12-01T21:41:11Z,"MongoDB Smashes Q3 Earnings Estimates, Raises FY26 Outlook, Shares Rip Higher",Biztoc.com
2025-12-01T21:08:02Z,Live: MongoDB (MDB) Q3 Earnings Coverage,Biztoc.com
"Wed, 03 Dec 2025 23:01:45 GMT",MDB Capital president Brandon buys $29k in shares - Investing.com,Investing.com
"Wed, 03 Dec 2025 17:23:01 GMT","Biggest stock movers Tuesday: CRDO, MDB, and more - MSN",MSN
"Wed, 03 Dec 2025 20:40:05 GMT","Citigroup Raises MongoDB (MDB) Price Target to $525, Maintains B - GuruFocus",GuruFocus
"Wed, 03 Dec 2025 15:50:24 GMT","MongoDB (MDB) Climbs to Fresh High on Stellar Earnings, Bullish Ratings - Insider Monkey",Insider Monkey
"Wed, 03 Dec 2025 17:26:52 GMT","MDB: Strong core growth, AI-driven opportunities, and robust customer gains fuel a positive outlook - TradingView",TradingView
"Wed, 03 Dec 2025 04:38:43 GMT","MongoDB (MDB) Q3: Losses Narrow Sharply, Testing Bullish Profitability Narratives - simplywall.st",simplywall.st
"Wed, 03 Dec 2025 18:36:23 GMT",Robert W. Baird Forecasts Strong Price Appreciation for MongoDB (NASDAQ:MDB) Stock - MarketBeat,MarketBeat
"Wed, 03 Dec 2025 15:19:06 GMT",Rosenblatt Securities Sticks to Their Buy Rating for MongoDB (MDB) - The Globe and Mail,The Globe and Mail
"Wed, 03 Dec 2025 22:37:54 GMT",MDB Stock: Will an Earnings Beat Help MongoDB Dominate Data Infrastructure? - CMC Markets,CMC Markets
"Wed, 03 Dec 2025 18:43:44 GMT",Goldman Sachs Raises MongoDB (MDB) Price Target to $475 | MDB St - GuruFocus,GuruFocus
"Wed, 03 Dec 2025 15:19:06 GMT",Piper Sandler Remains a Buy on MongoDB (MDB) - The Globe and Mail,The Globe and Mail
"Wed, 03 Dec 2025 16:47:50 GMT",MongoDB (NASDAQ:MDB) Price Target Raised to $450.00 - MarketBeat,MarketBeat
"Wed, 03 Dec 2025 17:26:07 GMT",MongoDB (NASDAQ:MDB) Price Target Raised to $450.00 at Stifel Nicolaus - MarketBeat,MarketBeat
"Wed, 03 Dec 2025 15:19:06 GMT","Analysts Offer Insights on Technology Companies: Amtech Systems (ASYS), MongoDB (MDB) and Credo Technology Group Holding Ltd (CRDO) - The Globe and Mail",The Globe and Mail
"Wed, 03 Dec 2025 09:18:24 GMT",MongoDB: Good Q3 But Not A Buy Now (Rating Upgrade) (NASDAQ:MDB) - Seeking Alpha,Seeking Alpha
"Wed, 03 Dec 2025 11:37:22 GMT","Norges Bank Makes New $164.34 Million Investment in MongoDB, Inc. $MDB - MarketBeat",MarketBeat
"Wed, 03 Dec 2025 14:13:02 GMT",MongoDB (NASDAQ:MDB) Price Target Raised to $480.00 at Bank of America - MarketBeat,MarketBeat
"Wed, 03 Dec 2025 14:13:04 GMT",MongoDB (NASDAQ:MDB) Given New $415.00 Price Target at Scotiabank - MarketBeat,MarketBeat
"Wed, 03 Dec 2025 14:07:07 GMT",MongoDB (NASDAQ:MDB) Given New $425.00 Price Target at Rosenblatt Securities - MarketBeat,MarketBeat
"Wed, 03 Dec 2025 14:51:11 GMT",MongoDB (NASDAQ:MDB) Price Target Raised to $455.00 - MarketBeat,MarketBeat
"Wed, 03 Dec 2025 14:06:04 GMT",MongoDB (NASDAQ:MDB) Price Target Raised to $475.00 at Citizens Jmp - MarketBeat,MarketBeat
"Wed, 03 Dec 2025 14:07:05 GMT",MongoDB (NASDAQ:MDB) Given New $480.00 Price Target at Needham & Company LLC - MarketBeat,MarketBeat
"Wed, 03 Dec 2025 19:53:49 GMT","Citi Maintains MongoDB(MDB.US) With Buy Rating, Raises Target Price to $525 - 富途牛牛",富途牛牛
"Wed, 03 Dec 2025 14:13:03 GMT","MongoDB (NASDAQ:MDB) Stock Price Expected to Rise, Monness Crespi & Hardt Analyst Says - MarketBeat",MarketBeat
"Wed, 03 Dec 2025 14:49:17 GMT",MongoDB (NASDAQ:MDB) Given New $440.00 Price Target at Wedbush - MarketBeat,MarketBeat
"Wed, 03 Dec 2025 15:19:06 GMT",Scotiabank Keeps Their Hold Rating on MongoDB (MDB) - The Globe and Mail,The Globe and Mail
"Tue, 02 Dec 2025 16:11:34 GMT",Why Are MongoDB (MDB) Shares Soaring Today - Yahoo Finance,Yahoo Finance
"Wed, 03 Dec 2025 00:52:27 GMT",Here's What Key Metrics Tell Us About MongoDB (MDB) Q3 Earnings - MSN,MSN
"Tue, 02 Dec 2025 14:46:00 GMT",$MDB stock is up 23% today. Here's what we see in our data. - Quiver Quantitative,Quiver Quantitative
"Wed, 03 Dec 2025 15:45:35 GMT",MongoDB (NASDAQ:MDB) Price Target Raised to $385.00 - MarketBeat,MarketBeat
"Wed, 03 Dec 2025 15:41:31 GMT",MongoDB (NASDAQ:MDB) Reaches New 12-Month High After Better-Than-Expected Earnings - MarketBeat,MarketBeat
"Wed, 03 Dec 2025 15:27:27 GMT",DA Davidson Increases MongoDB (NASDAQ:MDB) Price Target to $465.00 - MarketBeat,MarketBeat
"Wed, 03 Dec 2025 05:16:46 GMT",Decoding MongoDB Inc (MDB): A Strategic SWOT Insight - GuruFocus,GuruFocus
"Wed, 03 Dec 2025 15:45:34 GMT",MongoDB (NASDAQ:MDB) Given New $310.00 Price Target at Mizuho - MarketBeat,MarketBeat
"Wed, 03 Dec 2025 08:00:00 GMT",MongoDB (NASDAQ:MDB) Nasdaq Composite Etf Cloud-Native Advantage - Kalkine Media,Kalkine Media
"Tue, 02 Dec 2025 05:00:00 GMT",MongoDB Inc (MDB) Q3 2026 Earnings Call Highlights: Strong Atlas Growth and Strategic AI Positioning - Yahoo Finance,Yahoo Finance
"Wed, 03 Dec 2025 00:06:00 GMT",Citizens Maintains MongoDB (MDB) Market Outperform Recommendation - Nasdaq,Nasdaq
"Mon, 01 Dec 2025 22:20:03 GMT",MongoDB (MDB) Q3 Earnings and Revenues Surpass Estimates - Yahoo Finance,Yahoo Finance
"Tue, 02 Dec 2025 10:20:00 GMT",New Analyst Forecast: $MDB Given $490 Price Target - Quiver Quantitative,Quiver Quantitative
"Tue, 02 Dec 2025 15:02:00 GMT","Biggest stock movers Tuesday: CRDO, MDB, BA, and more - Seeking Alpha",Seeking Alpha
"Tue, 02 Dec 2025 12:41:00 GMT","Morning Market Movers: TAOP, JANX, MDB, ABTC See Big Swings - RTTNews",RTTNews
"Tue, 02 Dec 2025 23:33:37 GMT",Apple Hits All-Time High on AI Hiring | MDB +15% | BA Leads S&P! - MSN,MSN
"Mon, 01 Dec 2025 20:30:54 GMT",Live: MongoDB (MDB) Q3 Earnings Coverage - 24/7 Wall St.,24/7 Wall St.
"Mon, 01 Dec 2025 18:34:36 GMT","MongoDB (MDB) Stock on December 1, 2025: Earnings Preview, New CEO and Wall Street Forecasts - ts2.tech",ts2.tech
"Tue, 02 Dec 2025 23:19:39 GMT",Why Are MongoDB (MDB) Shares Soaring Today - The Globe and Mail,The Globe and Mail
"Tue, 02 Dec 2025 10:38:18 GMT",MongoDB Stock (MDB) Jumps 23% after Robust Q3 despite Little Help from AI - TipRanks,TipRanks
"Tue, 02 Dec 2025 16:09:45 GMT",MongoDB Stock (MDB) Analyst Roundup: All the Biggest Price Target Increases After Q3 - TipRanks,TipRanks
"Mon, 01 Dec 2025 21:47:52 GMT",MDB Earnings: MongoDB Stock Soars 16% as Profit and Sales Blow Past Estimates - TipRanks,TipRanks
"Tue, 02 Dec 2025 10:11:28 GMT",MDB Q3 Deep Dive: Atlas Growth and AI Positioning Drive Outperformance - Finviz,Finviz
"Tue, 02 Dec 2025 16:11:00 GMT",Why Are MongoDB (MDB) Shares Soaring Today - Markets Financial Content,Markets Financial Content
"Sun, 30 Nov 2025 03:00:00 GMT",Earnings To Watch: MongoDB (MDB) Reports Q3 Results Tomorrow - Yahoo Finance,Yahoo Finance
"Tue, 02 Dec 2025 05:44:03 GMT","MongoDB (NASDAQ:MDB) Surprises With Strong Q3 CY2025, Stock Soars - Finviz",Finviz
"Tue, 02 Dec 2025 09:41:03 GMT",MongoDB (MDB) Stock Rallies as Database Company Crushes Q3 Earnings - CoinCentral,CoinCentral
"Tue, 02 Dec 2025 16:28:36 GMT",MongoDB (MDB) Surges on Strong Q3 Performance and Upbeat Guidance - GuruFocus,GuruFocus
"Mon, 01 Dec 2025 19:27:29 GMT",What's Going On With MongoDB Shares Monday? - MongoDB (NASDAQ:MDB) - Benzinga,Benzinga
"Tue, 02 Dec 2025 22:05:40 GMT",MongoDB (MDB) Shares Surge Over 23% - GuruFocus,GuruFocus
"Tue, 02 Dec 2025 21:33:45 GMT",MongoDB (NASDAQ:MDB) Issues FY 2026 Earnings Guidance - MarketBeat,MarketBeat
"Tue, 02 Dec 2025 13:06:14 GMT",MongoDB (MDB) Sees Raised Price Target by Citizens Analyst | MDB Stock News - GuruFocus,GuruFocus
"Tue, 02 Dec 2025 20:14:30 GMT",MongoDB (MDB) Stock Soars Over 23% Following Strong Q3 Earnings - GuruFocus,GuruFocus
"Tue, 02 Dec 2025 14:04:19 GMT",MongoDB (MDB) Price Target Raised by Scotiabank to $415 | MDB St - GuruFocus,GuruFocus
"Tue, 02 Dec 2025 19:54:29 GMT",MongoDB (MDB) Sees Significant Surge With 26% Increase in Stock Price - GuruFocus,GuruFocus
"Tue, 02 Dec 2025 13:52:10 GMT",RBC Capital Raises Price Target for MongoDB (MDB) to $450 | MDB Stock News - GuruFocus,GuruFocus
"Tue, 02 Dec 2025 12:43:41 GMT","MongoDB, Inc. $MDB Shares Bought by Spyglass Capital Management LLC - MarketBeat",MarketBeat
"Tue, 02 Dec 2025 21:33:45 GMT",MongoDB (NASDAQ:MDB) Releases Q4 2026 Earnings Guidance - MarketBeat,MarketBeat
"Tue, 02 Dec 2025 15:03:46 GMT","MongoDB (MDB) Stock Rockets to New High After Blowout Q3 Earnings: Latest News, Forecasts and Analysis for December 2, 2025 - ts2.tech",ts2.tech
"Tue, 02 Dec 2025 07:19:48 GMT","MongoDB (NASDAQ:MDB) Surprises With Strong Q3 CY2025, Stock Soars - The Globe and Mail",The Globe and Mail
"Tue, 02 Dec 2025 13:06:10 GMT",Cantor Fitzgerald Raises MongoDB (MDB) Price Target to $454 | MD - GuruFocus,GuruFocus
"Tue, 02 Dec 2025 11:02:33 GMT","Korea Investment CORP Boosts Stake in MongoDB, Inc. $MDB - MarketBeat",MarketBeat
"Tue, 02 Dec 2025 11:51:59 GMT",MongoDB (MDB) Sees Significant Price Target Increase by Needham - GuruFocus,GuruFocus
"Tue, 02 Dec 2025 14:04:21 GMT","Barclays Raises MongoDB (MDB) Price Target to $415, Maintains Ov - GuruFocus",GuruFocus
"Tue, 02 Dec 2025 21:33:48 GMT",MongoDB (NASDAQ:MDB) Announces Quarterly Earnings Results - MarketBeat,MarketBeat
"Tue, 02 Dec 2025 09:04:11 GMT",MongoDB (MDB) Surges on Strong Q3 Results and Raised Guidance - GuruFocus,GuruFocus
"Tue, 02 Dec 2025 10:03:47 GMT",Piper Sandler Raises MongoDB (MDB) Price Target to $490 | MDB St - GuruFocus,GuruFocus
"Sun, 30 Nov 2025 14:01:00 GMT",MongoDB Stock (MDB) Opinions on Q3 Earnings Release - Quiver Quantitative,Quiver Quantitative
"Tue, 02 Dec 2025 13:02:09 GMT",MongoDB (MDB): Rosenblatt Analyst Raises Price Target to $425 | - GuruFocus,GuruFocus
"Tue, 02 Dec 2025 10:54:19 GMT","Russell Investments Group Ltd. Buys 45,057 Shares of MongoDB, Inc. $MDB - MarketBeat",MarketBeat
"Tue, 02 Dec 2025 17:52:33 GMT","MongoDB (MDB) Stock Soars Over 20% After Blowout Q3 Earnings and AI Momentum – Latest News, Analyst Upgrades & 2026–2027 Outlook - ts2.tech",ts2.tech
"Tue, 02 Dec 2025 11:08:01 GMT","Dow Futures Edge Higher As Fed’s Liquidity Boost, Bowman’s Testimony Take Center Stage: MDB, CRDO, WBD, CRWD Among Stocks To Watch - Stocktwits",Stocktwits
"Wed, 03 Dec 2025 02:58:01 GMT",Here's What Key Metrics Tell Us About MongoDB (MDB) Q3 Earnings - sharewise.com,sharewise.com
"Tue, 02 Dec 2025 05:07:57 GMT",MongoDB Inc (MDB) Q3 2026 Earnings Call Highlights: Strong Atlas Growth and Strategic AI Positioning - GuruFocus,GuruFocus
"Tue, 02 Dec 2025 13:05:23 GMT","MongoDB, Inc. (NASDAQ:MDB) Q3 2026 Earnings Call Transcript - Insider Monkey",Insider Monkey
"Tue, 02 Dec 2025 02:19:56 GMT",MongoDB (MDB) Surpasses Q3 Expectations with Strong Growth in At - GuruFocus,GuruFocus
"Mon, 01 Dec 2025 22:16:07 GMT",MongoDB (MDB) Surpasses Q3 Expectations with Robust Earnings and Revenue - GuruFocus,GuruFocus
"Mon, 01 Dec 2025 21:36:11 GMT","MongoDB (MDB) Surpasses Revenue Expectations, Raises Year-End Ou - GuruFocus",GuruFocus
"Mon, 01 Dec 2025 22:16:07 GMT",MongoDB (MDB) Shares Surge 15% After Beating Q3 Expectations - GuruFocus,GuruFocus
"Mon, 01 Dec 2025 21:36:11 GMT",MDB Increases FY26 Revenue Forecast to $2.434B-$2.439B - GuruFocus,GuruFocus
"Mon, 01 Dec 2025 21:36:12 GMT",MongoDB (MDB) Surges 14% Following Strong Q3 Results and Optimis - GuruFocus,GuruFocus
"Mon, 01 Dec 2025 21:09:14 GMT","(MDB) MongoDB Expects Fiscal 2026 Revenue Range $2.434B-$2.439B, vs. FactSet Est of $2.36B - MarketScreener",MarketScreener
"Sat, 29 Nov 2025 21:05:00 GMT","MONGODB Earnings Preview: Recent $MDB Insider Trading, Hedge Fund Activity, and More - Quiver Quantitative",Quiver Quantitative
"Tue, 02 Dec 2025 12:10:49 GMT",MongoDB (MDB) PT Raised to $415 at Scotiabank - StreetInsider,StreetInsider
"Mon, 01 Dec 2025 19:39:49 GMT",MongoDB (MDB) Set to Announce Earnings After Market Close - GuruFocus,GuruFocus
2025-12-03T14:13:25,"MongoDB, Inc. (MDB) Presents at UBS Global Technology and AI Conference 2025 Transcript",SeekingAlpha
2025-12-03T05:18:24,MongoDB: Good Q3 But Not A Buy Now (Rating Upgrade),SeekingAlpha
2025-12-01T21:13:26,"MongoDB, Inc. (MDB) Q3 2026 Earnings Call Transcript",SeekingAlpha
2025-12-03T03:31:20,MDB leaps up 400%+,Reddit/r/wallstreetbets
2025-12-01T21:14:39,Major Events in U.S. Stocks This Week,Reddit/r/stocks
2025-12-01T20:00:12,(MDB) MongoDB Q3 2026 Earnings Call | Live Transcript at 5:00pm ET,Reddit/r/wallstreetbets
