Date,Title,Source
2025-09-29T05:16:52Z,Leerink Partnrs Brokers Lower Earnings Estimates for VRTX,ETF Daily News
2025-09-28T06:32:52Z,Leerink Partnrs Has Negative Forecast for VRTX Q4 Earnings,ETF Daily News
2025-09-26T06:25:03Z,Leerink Partners Upgrades Vertex Pharmaceuticals (NASDAQ:VRTX) to Outperform,ETF Daily News
"Sat, 27 Sep 2025 13:54:10 GMT",What Vertex Pharmaceuticals (VRTX)'s FDA Breakthrough for Povetacicept Means for Kidney Disease Pipeline - Yahoo Finance,Yahoo Finance
"Mon, 29 Sep 2025 18:48:49 GMT",An Intrinsic Calculation For Vertex Pharmaceuticals Incorporated (NASDAQ:VRTX) Suggests It's 46% Undervalued - 富途牛牛,富途牛牛
"Mon, 29 Sep 2025 10:52:16 GMT",SWS Partners Has $1.11 Million Position in Vertex Pharmaceuticals Incorporated $VRTX - MarketBeat,MarketBeat
"Fri, 26 Sep 2025 23:25:45 GMT",Vertex Pharmaceuticals (VRTX) Surpasses Market Returns: Some Facts Worth Knowing - MSN,MSN
"Thu, 25 Sep 2025 12:03:00 GMT",Leerink Partners Upgrades Vertex Pharmaceuticals (VRTX) - Nasdaq,Nasdaq
"Thu, 25 Sep 2025 12:20:00 GMT",New Analyst Forecast: $VRTX Given $456.0 Price Target - Quiver Quantitative,Quiver Quantitative
"Thu, 25 Sep 2025 13:00:04 GMT",Vertex Pharmaceuticals Incorporated (VRTX) is Attracting Investor Attention: Here is What You Should Know - Yahoo Finance,Yahoo Finance
"Mon, 29 Sep 2025 05:26:53 GMT",Leerink Partnrs Brokers Lower Earnings Estimates for VRTX - MarketBeat,MarketBeat
"Fri, 26 Sep 2025 18:16:28 GMT",Vertex (VRTX) Is Considered a Good Investment by Brokers: Is That True? - sharewise.com,sharewise.com
"Sat, 27 Sep 2025 10:42:32 GMT","Dakota Wealth Management Sells 7,137 Shares of Vertex Pharmaceuticals Incorporated $VRTX - MarketBeat",MarketBeat
"Fri, 26 Sep 2025 01:19:02 GMT",Vertex Pharmaceuticals (VRTX) Ascends While Market Falls: Some Facts to Note - sharewise.com,sharewise.com
"Sat, 27 Sep 2025 10:42:32 GMT",Perigon Wealth Management LLC Boosts Stock Position in Vertex Pharmaceuticals Incorporated $VRTX - MarketBeat,MarketBeat
"Fri, 26 Sep 2025 09:55:12 GMT",Fifth Third Bancorp Lowers Stake in Vertex Pharmaceuticals Incorporated $VRTX - MarketBeat,MarketBeat
"Fri, 26 Sep 2025 09:55:12 GMT",TD Private Client Wealth LLC Cuts Holdings in Vertex Pharmaceuticals Incorporated $VRTX - MarketBeat,MarketBeat
"Fri, 26 Sep 2025 09:55:08 GMT",Vertex Pharmaceuticals Incorporated $VRTX Shares Purchased by Banque Pictet & Cie SA - MarketBeat,MarketBeat
"Fri, 26 Sep 2025 11:45:50 GMT",Leerink Partnrs Issues Pessimistic Outlook for VRTX Earnings - MarketBeat,MarketBeat
"Fri, 26 Sep 2025 11:17:34 GMT",Vertex Pharmaceuticals (NASDAQ:VRTX) Upgraded by Leerink Partnrs to Strong-Buy Rating - MarketBeat,MarketBeat
"Thu, 25 Sep 2025 09:31:50 GMT","4,352 Shares in Vertex Pharmaceuticals Incorporated $VRTX Purchased by Harrell Investment Partners LLC - MarketBeat",MarketBeat
"Thu, 25 Sep 2025 09:39:53 GMT",Beacon Investment Advisory Services Inc. Reduces Position in Vertex Pharmaceuticals Incorporated $VRTX - MarketBeat,MarketBeat
"Thu, 25 Sep 2025 08:39:00 GMT",Norden Group LLC Raises Stock Position in Vertex Pharmaceuticals Incorporated $VRTX - MarketBeat,MarketBeat
"Thu, 25 Sep 2025 12:17:31 GMT",Vertex Pharmaceuticals (NASDAQ:VRTX) Upgraded by Leerink Partners to Outperform Rating - MarketBeat,MarketBeat
"Thu, 25 Sep 2025 10:31:00 GMT","Leerink Partners Upgrades Vertex Pharmaceuticals(VRTX.US) to Buy Rating, Cuts Target Price to $456 - 富途牛牛",富途牛牛
"Mon, 29 Sep 2025 09:23:31 GMT",Moody Lynn & Lieberson LLC Boosts Stock Holdings in Vertex Pharmaceuticals Incorporated $VRTX - MarketBeat,MarketBeat
"Tue, 30 Sep 2025 05:56:49 GMT",How to interpret RSI for VRTX stock - Quarterly Market Review & Daily Profit Maximizing Trade Tips - newser.com,newser.com
"Tue, 30 Sep 2025 04:31:53 GMT",How to monitor VRTX with trend dashboards - Weekly Trade Recap & Accurate Trade Setup Notifications - newser.com,newser.com
"Mon, 29 Sep 2025 16:20:10 GMT",How to monitor VRTX with trend dashboards - Trade Risk Report & Detailed Earnings Play Alerts - newser.com,newser.com
"Mon, 29 Sep 2025 12:49:57 GMT",How to interpret RSI for VRTX stock - Volume Spike & Safe Capital Growth Tips - newser.com,newser.com
"Mon, 29 Sep 2025 12:15:41 GMT",Is now a turning point for VRTX - Quarterly Market Summary & Weekly Chart Analysis and Trade Guides - newser.com,newser.com
"Mon, 29 Sep 2025 12:00:36 GMT",Will VRTX stock go up soon - GDP Growth & Safe Capital Growth Tips - newser.com,newser.com
"Mon, 29 Sep 2025 11:27:45 GMT",Risk vs reward if holding onto VRTX - CPI Data & Low Volatility Stock Recommendations - newser.com,newser.com
"Mon, 29 Sep 2025 13:43:47 GMT",Will VRTX stock go up soon - 2025 Breakouts & Breakdowns & Verified Entry Point Detection - newser.com,newser.com
"Mon, 29 Sep 2025 15:45:03 GMT",How sentiment analysis helps forecast VRTX - July 2025 Outlook & Stepwise Trade Signal Implementation - newser.com,newser.com
"Mon, 29 Sep 2025 10:33:04 GMT",Will VRTX stock go up soon - Recession Risk & AI Forecast Swing Trade Picks - newser.com,newser.com
"Mon, 29 Sep 2025 10:51:36 GMT",Is now a turning point for VRTX - Weekly Trade Analysis & Fast Exit and Entry Strategy Plans - newser.com,newser.com
"Mon, 29 Sep 2025 06:32:17 GMT",Applying Elliott Wave Theory to VRTX - July 2025 Fed Impact & Advanced Technical Signal Analysis - newser.com,newser.com
"Mon, 29 Sep 2025 05:59:48 GMT",Risk vs reward if holding onto VRTX - July 2025 Sentiment & Community Verified Trade Alerts - newser.com,newser.com
"Mon, 29 Sep 2025 06:55:45 GMT",How sentiment analysis helps forecast VRTX - July 2025 Breakouts & Weekly Setup with High ROI Potential - newser.com,newser.com
"Sat, 27 Sep 2025 05:25:11 GMT",Vertex Pharmaceuticals (NASDAQ:VRTX) Stock Rating Upgraded by Leerink Partnrs - Defense World,Defense World
"Sat, 27 Sep 2025 06:05:11 GMT",Leerink Partnrs Has Pessimistic View of VRTX Q4 Earnings - Defense World,Defense World
"Fri, 26 Sep 2025 06:25:33 GMT",Vertex Pharmaceuticals (NASDAQ:VRTX) Upgraded by Leerink Partners to Outperform Rating - Defense World,Defense World
2025-09-27T15:54:10,What Vertex Pharmaceuticals (VRTX)'s FDA Breakthrough for Povetacicept Means for Kidney Disease Pipeline,Yahoo
2025-09-26T23:50:05,Vertex Pharmaceuticals (VRTX) Surpasses Market Returns: Some Facts Worth Knowing,Yahoo
2025-09-26T15:30:02,Vertex (VRTX) Is Considered a Good Investment by Brokers: Is That True?,Yahoo
2025-09-26T00:00:05,Vertex Pharmaceuticals (VRTX) Ascends While Market Falls: Some Facts to Note,Yahoo
2025-09-25T15:00:04,Vertex Pharmaceuticals Incorporated (VRTX) is Attracting Investor Attention: Here is What You Should Know,Yahoo
2025-09-25T13:45:00,Vertex Announces Key Advancements Across Kidney Portfolio,Yahoo
