Date,Title,Source
2025-09-27T07:02:52Z,Best Automotive Stocks Worth Watching – September 24th,ETF Daily News
2025-09-27T05:02:53Z,Artificial Intelligence Stocks To Follow Today – September 25th,ETF Daily News
2025-09-27T05:02:48Z,Top Automotive Stocks To Follow Now – September 25th,ETF Daily News
2025-09-25T08:05:59Z,"Upstart Holdings, Inc. $UPST Shares Sold by Voya Investment Management LLC",ETF Daily News
2025-09-24T13:04:34Z,Is Upstart Holdings (UPST) a Good Investment?,Yahoo Entertainment
"Wed, 24 Sep 2025 20:05:40 GMT",Why Upstart (UPST) Shares Are Trading Lower Today - Yahoo Finance,Yahoo Finance
"Sat, 27 Sep 2025 19:37:44 GMT",Upstart Holdings (UPST) Valuation in Focus as Short Interest Surges and Growth Prospects Face New Scrutiny - simplywall.st,simplywall.st
"Fri, 26 Sep 2025 19:19:00 GMT","Notable Friday Option Activity: UPST, SKYT, BKNG - Nasdaq",Nasdaq
"Fri, 26 Sep 2025 12:39:32 GMT",Upstart (UPST) Stock Drops Amid Rising Short Interest - GuruFocus,GuruFocus
"Tue, 23 Sep 2025 19:24:19 GMT",Upstart stock falls as Jefferies reports 606bps jump in short interest - Investing.com,Investing.com
"Wed, 24 Sep 2025 13:04:34 GMT",Is Upstart Holdings (UPST) a Good Investment? - Yahoo Finance,Yahoo Finance
"Tue, 23 Sep 2025 19:00:33 GMT","Upstart Holdings (UPST) Shares down 3pct at LOD, Jefferies on Consumer Finance Short Interest: 'the largest increase was UPST (up 606bps to 27.7%)' - StreetInsider",StreetInsider
"Wed, 24 Sep 2025 17:16:53 GMT",Upstart Holdings (UPST) Is Down 7.1% After Surging AI Platform Adoption and Earnings Anticipation - Has The Bull Case Changed? - simplywall.st,simplywall.st
"Fri, 26 Sep 2025 16:03:25 GMT",Men’s Soccer heads to Winthrop for Saturday night Big South action - upstatespartans.com,upstatespartans.com
"Fri, 26 Sep 2025 12:04:00 GMT",Why Upstart Holdings Stock Was Trading Down This Week - The Globe and Mail,The Globe and Mail
"Thu, 25 Sep 2025 07:57:00 GMT",Upstart Stock Eyes Recovery After 5-Day Losing Streak — Retail Wonders If A Short Squeeze Is Due - Stocktwits,Stocktwits
"Sun, 28 Sep 2025 01:25:07 GMT",Men’s Soccer moves their winning streak to three with a road win at Winthrop - upstatespartans.com,upstatespartans.com
"Tue, 23 Sep 2025 19:41:56 GMT",Women's Soccer Hosts High Point Tomorrow Evening in a Rematch of the Big South Championship Game - upstatespartans.com,upstatespartans.com
"Thu, 25 Sep 2025 18:38:46 GMT",Volleyball Begins Its Portion of Ingles I-26 Rivarly Series with Trip To UNC Asheville Friday Evening - upstatespartans.com,upstatespartans.com
"Fri, 26 Sep 2025 17:23:31 GMT",Is Tradr 2X Long UPST Daily stock worth buying before Fed action - Volume Spike & Weekly Breakout Watchlists - newser.com,newser.com
"Fri, 26 Sep 2025 16:31:41 GMT",How Tradr 2X Long UPST Daily stock reacts to Fed tightening - Quarterly Risk Review & Free Weekly Chart Analysis and Trade Guides - newser.com,newser.com
"Fri, 26 Sep 2025 18:17:56 GMT",Is Tradr 2X Long UPST Daily stock worth buying before Fed action - 2025 Volume Leaders & Verified Entry Point Signals - newser.com,newser.com
"Fri, 26 Sep 2025 12:06:22 GMT",Can Tradr 2X Long UPST Daily stock expand revenue streams - Quarterly Earnings Summary & Community Consensus Stock Picks - newser.com,newser.com
"Tue, 23 Sep 2025 18:46:34 GMT",Upstart Target of Unusually Large Options Trading (NASDAQ:UPST) - Defense World,Defense World
2025-09-26T14:04:17,Why Upstart Holdings Stock Was Trading Down This Week,Yahoo
2025-09-24T22:05:40,Why Upstart (UPST) Shares Are Trading Lower Today,Yahoo
2025-09-24T15:04:34,Is Upstart Holdings (UPST) a Good Investment?,Yahoo
2025-09-26T22:26:13,Leveraged $UPST shares yolo (~400k),Reddit/r/wallstreetbets
2025-09-25T21:15:50,UPST: AI + Finance with BIG squeeze potential at play!,Reddit/r/stocks
