Date,Title,Source
2025-09-05T14:43:56Z,uniQure's Investigational Gene Therapy Shows Promising Efficacy With Manageable Safety Risks For Fabry Disease,Biztoc.com
2025-09-05T11:08:41Z,uniQure announces initial AMT-191 Phase I/IIa data,Thefly.com
2025-09-05T11:05:00Z,uniQure Announces Initial AMT-191 Phase I/IIa Data Showing Sustained Increases in α-Gal A Enzyme Activity in Patients with Fabry Disease,GlobeNewswire
2025-09-04T14:44:34Z,Here's How Much You Would Have Made Owning American Tower Stock In The Last 20 Years,Biztoc.com
2025-09-04T14:31:07Z,"Decision: UK REACH authorisation for Linde AMT UK Ltd, 29 July 2025",Www.gov.uk
"Tue, 09 Sep 2025 02:50:05 GMT",Photos: Meet the Cast of LOST AND FOUND at AMT Theater - BroadwayWorld.com,BroadwayWorld.com
"Mon, 08 Sep 2025 14:05:51 GMT",SurfacePrep to Distribute AMT PostPro Vapor Smoothing Systems Across North America - 3D Printing Industry,3D Printing Industry
"Mon, 08 Sep 2025 14:42:10 GMT",2025 AMT Under 40: Auston Vandersteen - Aviation Pros,Aviation Pros
"Tue, 09 Sep 2025 01:36:07 GMT","Ancora Advisors LLC Acquires 2,836 Shares of American Tower Corporation $AMT - MarketBeat",MarketBeat
"Mon, 08 Sep 2025 13:14:46 GMT",American Tower (AMT): Evaluating Valuation Following Gene Reilly’s Appointment to the Board - simplywall.st,simplywall.st
"Mon, 08 Sep 2025 13:00:00 GMT",First-Ever Domestic CuNi Manufacturing Chain: Velo3D and Linde AMT Transform U.S. Navy Shipbuilding - Stock Titan,Stock Titan
"Mon, 08 Sep 2025 17:48:06 GMT","Gold Hit $3,650, Robinhood Spikes 15% On S&P 500 Inclusion - American Tower (NYSE:AMT) - Benzinga",Benzinga
"Mon, 08 Sep 2025 12:03:28 GMT","The Daily REITBeat | Monday, September 8th, 2025 (NYSE:AMT) - Seeking Alpha",Seeking Alpha
"Fri, 05 Sep 2025 11:07:06 GMT",uniQure Announces Initial AMT-191 Phase I/IIa Data Showing - GlobeNewswire,GlobeNewswire
"Mon, 08 Sep 2025 22:11:19 GMT","Amundi Purchases 743,617 Shares of American Tower Corporation $AMT - MarketBeat",MarketBeat
"Mon, 08 Sep 2025 12:36:37 GMT",Resolution Capital Ltd Makes New Investment in American Tower Corporation $AMT - MarketBeat,MarketBeat
"Mon, 08 Sep 2025 07:00:00 GMT",DoubleLine ETF Adviser LP Trims Stock Holdings in American Tower Corporation $AMT - MarketBeat,MarketBeat
"Mon, 08 Sep 2025 10:45:07 GMT",American Tower Corporation $AMT Shares Sold by Gotham Asset Management LLC - MarketBeat,MarketBeat
"Mon, 08 Sep 2025 10:45:07 GMT",Polar Asset Management Partners Inc. Takes Position in American Tower Corporation $AMT - MarketBeat,MarketBeat
"Mon, 08 Sep 2025 07:00:00 GMT","Alyeska Investment Group L.P. Purchases Shares of 745,070 American Tower Corporation $AMT - MarketBeat",MarketBeat
"Sun, 07 Sep 2025 12:40:07 GMT",American Tower Corporation $AMT Shares Sold by NFJ Investment Group LLC - MarketBeat,MarketBeat
"Sun, 07 Sep 2025 13:31:50 GMT",American Tower Corporation $AMT Stock Position Reduced by Curi RMB Capital LLC - MarketBeat,MarketBeat
"Sat, 06 Sep 2025 07:00:00 GMT",First Manhattan CO. LLC. Increases Stake in American Tower Corporation $AMT - MarketBeat,MarketBeat
"Sat, 06 Sep 2025 07:00:00 GMT","First Financial Bankshares Inc Purchases 4,690 Shares of American Tower Corporation $AMT - MarketBeat",MarketBeat
"Sat, 06 Sep 2025 07:00:00 GMT","FJ Capital Management LLC Invests $380,000 in American Tower Corporation $AMT - MarketBeat",MarketBeat
"Sat, 06 Sep 2025 07:00:00 GMT",American Tower Corporation $AMT Shares Bought by Graham Capital Management L.P. - MarketBeat,MarketBeat
"Thu, 04 Sep 2025 08:26:03 GMT",Ori Biotech’s IRO® Platform Receives FDA Advanced Manufacturing Technology (AMT) Designation - BioSpace,BioSpace
"Fri, 05 Sep 2025 11:10:00 GMT",Citi Sticks to Their Buy Rating for American Tower (AMT) - The Globe and Mail,The Globe and Mail
"Fri, 05 Sep 2025 09:19:00 GMT","Analysts Offer Insights on Real Estate Companies: American Tower (AMT), Lifestyle Communities Ltd (AU:LIC) and Terreno Realty (TRNO) - The Globe and Mail",The Globe and Mail
"Fri, 05 Sep 2025 07:00:00 GMT","American Tower Corporation (NYSE:AMT) Given Average Recommendation of ""Moderate Buy"" by Brokerages - MarketBeat",MarketBeat
"Thu, 04 Sep 2025 22:24:24 GMT","Panagora Asset Management Inc. Acquires 54,586 Shares of American Tower Corporation $AMT - MarketBeat",MarketBeat
"Thu, 04 Sep 2025 21:28:24 GMT","Ieq Capital LLC Purchases 3,477 Shares of American Tower Corporation $AMT - MarketBeat",MarketBeat
"Thu, 04 Sep 2025 22:24:11 GMT",American Tower Corporation $AMT Shares Sold by Brasada Capital Management LP - MarketBeat,MarketBeat
"Fri, 05 Sep 2025 11:58:56 GMT","Belmont Capital LLC Purchases 2,051 Shares of American Tower Corporation $AMT - MarketBeat",MarketBeat
"Fri, 05 Sep 2025 11:18:37 GMT",American Tower Corporation $AMT Shares Purchased by Advisors Asset Management Inc. - MarketBeat,MarketBeat
"Fri, 05 Sep 2025 10:20:02 GMT",American Tower Corporation $AMT Shares Purchased by Adage Capital Partners GP L.L.C. - MarketBeat,MarketBeat
"Thu, 04 Sep 2025 22:24:13 GMT",American Tower Corporation $AMT Holdings Boosted by Harber Asset Management LLC - MarketBeat,MarketBeat
"Thu, 04 Sep 2025 22:24:13 GMT","Benchstone Capital Management LP Buys 6,519 Shares of American Tower Corporation $AMT - MarketBeat",MarketBeat
"Fri, 05 Sep 2025 09:01:52 GMT","OLD Mission Capital LLC Takes $589,000 Position in American Tower Corporation $AMT - MarketBeat",MarketBeat
"Fri, 05 Sep 2025 11:40:05 GMT",uniQure announces initial AMT-191 Phase I/IIa data - TipRanks,TipRanks
"Fri, 05 Sep 2025 06:22:30 GMT",American Tower Corporation $AMT Stock Position Trimmed by Canada Pension Plan Investment Board - MarketBeat,MarketBeat
"Sat, 06 Sep 2025 07:00:00 GMT",Royal Bank of Canada Has $503.81 Million Stock Position in American Tower Corporation $AMT - MarketBeat,MarketBeat
"Thu, 04 Sep 2025 22:24:23 GMT",American Tower Corporation $AMT Stock Position Raised by Point72 Europe London LLP - MarketBeat,MarketBeat
"Thu, 04 Sep 2025 22:24:10 GMT",Tpg Gp A LLC Decreases Stock Holdings in American Tower Corporation $AMT - MarketBeat,MarketBeat
"Thu, 04 Sep 2025 22:24:12 GMT",MAI Capital Management Boosts Stock Holdings in American Tower Corporation $AMT - MarketBeat,MarketBeat
"Thu, 04 Sep 2025 07:00:00 GMT","Second Line Capital LLC Acquires 1,588 Shares of American Tower Corporation $AMT - MarketBeat",MarketBeat
"Thu, 04 Sep 2025 11:29:43 GMT","EP Wealth Advisors LLC Sells 50,913 Shares of American Tower Corporation $AMT - MarketBeat",MarketBeat
"Thu, 04 Sep 2025 09:17:47 GMT",Vident Advisory LLC Boosts Stake in American Tower Corporation $AMT - MarketBeat,MarketBeat
"Thu, 04 Sep 2025 11:31:00 GMT",Citi Maintains American Tower Corp(AMT.US) With Buy Rating - 富途牛牛,富途牛牛
"Fri, 05 Sep 2025 11:19:28 GMT",Hankinson can't wait for AMT Headingley return - Leeds Rhinos,Leeds Rhinos
"Fri, 05 Sep 2025 18:40:14 GMT",AMT Headingley set to host bumper day of youth rugby - Leeds Rhinos,Leeds Rhinos
"Fri, 05 Sep 2025 10:45:00 GMT",I need an AMT car for daily office commutes (around 50 km) and weekend family trips (about 500 km). - Autocar India,Autocar India
"Mon, 08 Sep 2025 13:45:00 GMT",SG Sigmundsherberg/Klein-Meiseldorf - Nur zwei Monate im Amt gewesen: Niedermayer nicht mehr SG-Trainer - NÖN.at,NÖN.at
"Sun, 07 Sep 2025 14:13:36 GMT",Das Auswärtige Amt verliert die Klima-Diplomatie an das Umweltministerium - FAZ,FAZ
"Sat, 06 Sep 2025 05:34:09 GMT",Head-To-Head Analysis: American Tower (NYSE:AMT) vs. Global Net Lease (NYSE:GNL) - Defense World,Defense World
"Sun, 07 Sep 2025 07:10:41 GMT",Top 5 Affordable Automatic Cars in India 2025 : Budget-Friendly AMT & CVT Models - Times Bull,Times Bull
2025-09-04T18:00:00,CoreSite to Explore the Future of Digital Infrastructure at Yotta 2025 and Be Recognized at the 2025 iMasons Awards Ceremony,Yahoo
