Date,Title,Source
2025-09-09T14:59:00Z,Reserve 30|HD Wheels Now Available With e*thirteen Sidekick Hubs,Vitalmtb.com
2025-09-09T14:43:12Z,[Early Release Articles] Ca2+ Fluxes across Membrane Contact Sites,Cshlp.org
2025-09-09T10:50:05Z,"The tiny, underrated London airport that has been named best in the UK",Time Out
2025-09-09T09:19:37Z,Max Healthcare Rated Bew 'Buy' At Nuvama - Check Target Price,Ndtvprofit.com
2025-09-09T08:54:30Z,Russia Hits Kiev Defense Hubs in Massive Precision Strike,Globalsecurity.org
2025-09-09T08:06:00Z,USA Augmented Reality Market Outlook Report 2025-2030 | Interactive Learning and Immersive Gaming Experiences Create Expanding Opportunities for Developers and Content Innovators,GlobeNewswire
"Mon, 08 Sep 2025 23:26:56 GMT",Treasury Department targets Southeast Asia scam hubs with sanctions - CyberScoop,CyberScoop
"Tue, 09 Sep 2025 23:42:54 GMT","Alabama defence sector advances with U.S. Space Command headquarters, innovation hubs and global outreach - Defence Industry Europe",Defence Industry Europe
"Wed, 10 Sep 2025 00:25:27 GMT",A Closer Look at HubSpot (HUBS) Valuation Following Sweeping AI Product Launches and Analyst Optimism - simplywall.st,simplywall.st
"Tue, 09 Sep 2025 17:23:11 GMT",Treasury Targets Southeast Asian Scam Hubs Behind Multi-Billion Dollar Thefts - Cyber Press,Cyber Press
"Tue, 09 Sep 2025 09:07:19 GMT",Libraries are public health hubs - WBUR,WBUR
"Tue, 09 Sep 2025 16:53:19 GMT",EV Realty and Prologis Mobility connect California EV charging hubs for commercial fleets - Charged EVs,Charged EVs
"Tue, 09 Sep 2025 00:47:41 GMT",Reserve Wheels Offering a Limited Run of its Burly 30|HD Carbon Rims with e*13 Sidekick Hubs - Bikerumor,Bikerumor
"Tue, 09 Sep 2025 14:50:36 GMT","Myanmar, Cambodia scam hubs subjected to US sanctions - SC Media",SC Media
"Tue, 09 Sep 2025 17:34:00 GMT",U.S. Treasury exposes reality of Southeast Asia’s scam hubs - Cryptopolitan,Cryptopolitan
"Tue, 09 Sep 2025 08:51:45 GMT",Switzerland’s compliance model sets the standard for private banking hubs - Professional Wealth Management,Professional Wealth Management
"Tue, 09 Sep 2025 08:03:01 GMT",US cracks down on Southeast Asia’s $10B scam hubs - Mitrade,Mitrade
"Tue, 09 Sep 2025 16:17:14 GMT",How Prologis Mobility's California EV Charging Hubs Could Shift the PLD Investment Narrative - simplywall.st,simplywall.st
"Wed, 10 Sep 2025 01:43:36 GMT",Startup Flight Takes Off: Vietjet Connects Vietnam and India’s Innovation Hubs - Vietcetera,Vietcetera
"Tue, 09 Sep 2025 09:23:00 GMT",Starbucks says it is creating 'interest-community hubs' - China Daily,China Daily
"Tue, 09 Sep 2025 19:31:17 GMT","Gas and Power Prices for Major US and European Hubs, Sep. 9, 2025 - energyintel.com",energyintel.com
"Mon, 08 Sep 2025 19:41:51 GMT",Julius Clinical sets up shop in ‘ideal hubs’ Spain and Germany - BioXconomy,BioXconomy
"Sat, 06 Sep 2025 15:58:16 GMT","Mountains Of Debt, Shrinking Hubs, Unhappy Employees: 10 Years That Broke American Airlines—The Blueprint For A Comeback - View from the Wing",View from the Wing
"Tue, 09 Sep 2025 13:43:57 GMT","US Targets $10 Billion Fraud, Trafficking Rings in Southeast Asia Casino Hubs - Casino.org",Casino.org
"Tue, 09 Sep 2025 02:32:03 GMT","Andhra Pradesh to build space city in Tirupati, two defence hubs - The Economic Times",The Economic Times
"Tue, 09 Sep 2025 20:05:01 GMT",This cSpace Program Turns Vacant Calgary Buildings Into Vibrant Cultural Hubs - Avenue Calgary,Avenue Calgary
"Fri, 05 Sep 2025 16:46:56 GMT","HubSpot (HUBS) Stock Is Up, What You Need To Know - Yahoo Finance",Yahoo Finance
"Mon, 08 Sep 2025 18:08:39 GMT",FedEx & DHL Expand Air Cargo Hubs in Istanbul and Helsinki - News and Statistics - IndexBox,IndexBox
"Tue, 09 Sep 2025 10:29:00 GMT",10 trafficking victims working in scam hubs rescued in Cambodia - Inquirer.net,Inquirer.net
"Mon, 08 Sep 2025 21:12:23 GMT","Santa Rosa, Sonoma serve as hubs for Hispanic Heritage and Latino Independence days - The Press Democrat",The Press Democrat
"Tue, 09 Sep 2025 11:09:34 GMT",Sesé opens safe cargo hubs in Zaragoza and Barcelona - Trans.INFO,Trans.INFO
"Tue, 09 Sep 2025 07:31:06 GMT",INVISIO announces H-Series: A new generation of tactical smart hubs that drastically improves battlefield efficiency - MarketScreener,MarketScreener
"Mon, 08 Sep 2025 14:37:12 GMT","Colive plans 12,000 beds in tech hubs under $100 million co-living platform | Company Business News - Mint",Mint
"Tue, 09 Sep 2025 17:49:42 GMT",Singapore data hubs face cost and capacity pressures: report - MSN,MSN
"Wed, 10 Sep 2025 01:43:43 GMT","Megaworld adds 30,000 sqm retail space with new hubs in Taguig, Makati, Boracay - InsiderPH",InsiderPH
"Tue, 09 Sep 2025 16:01:33 GMT",Is Indonesia or Vietnam More Politically Stable for Tech Hubs? - Tech in Asia,Tech in Asia
"Sun, 07 Sep 2025 23:41:00 GMT",More Filipinos in Cambodia seek rescue from scam hubs – PH envoy - Inquirer.net,Inquirer.net
"Tue, 09 Sep 2025 12:56:15 GMT",INVISIO announces H-Series: A new generation of tactical smart hubs that drastically improves battlefield efficiency - The Manila Times,The Manila Times
"Fri, 05 Sep 2025 12:14:00 GMT","Analysts Offer Insights on Technology Companies: HubSpot (HUBS), C3ai (AI) and Daqo New Energy (DQ) - The Globe and Mail",The Globe and Mail
"Mon, 08 Sep 2025 19:41:45 GMT","Andhra Pradesh to build space city in Tirupati, two defence hubs - The Economic Times",The Economic Times
2025-09-05T19:46:56,"HubSpot (HUBS) Stock Is Up, What You Need To Know",Yahoo
