Date,Title,Source
2025-10-23T00:20:02Z,DGP: Overextended Leveraged Gold Fund,Seeking Alpha
"Tue, 28 Oct 2025 06:42:51 GMT",Why ETRACS 2x Leveraged US Growth Factor TR ETN is moving today - 2025 Biggest Moves & Precise Entry and Exit Recommendations - newser.com,newser.com
"Tue, 28 Oct 2025 06:13:53 GMT",P 500 VIX Short Term Futures ETN stock balance sheet - 2025 Market Overview & Technical Confirmation Alerts - newser.com,newser.com
"Tue, 28 Oct 2025 05:06:25 GMT",Is iPath Series B Carbon ETN stock ready for breakout - July 2025 Intraday Action & Fast Gain Stock Tips - newser.com,newser.com
"Tue, 28 Oct 2025 06:54:30 GMT",ETRACS 2x Leveraged US Value Factor TR ETN stock trend outlook and recovery path - 2025 Price Targets & High Return Stock Watch Alerts - newser.com,newser.com
"Tue, 28 Oct 2025 04:45:34 GMT",Does DB Gold Double Short ETN qualify in momentum factor screening - July 2025 Action & Weekly Return Optimization Alerts - newser.com,newser.com
"Tue, 28 Oct 2025 06:13:16 GMT",What’s next for ETRACS 2x Leveraged US Growth Factor TR ETN stock price - Sell Signal & Capital Efficiency Focused Ideas - newser.com,newser.com
"Tue, 28 Oct 2025 06:25:52 GMT",How cyclical is DB Gold Double Long ETN stock compared to rivals - July 2025 WrapUp & Accurate Trade Setup Notifications - newser.com,newser.com
"Tue, 28 Oct 2025 06:29:04 GMT",Is DB Gold Double Long ETN stock attractive for retirement portfolios - Quarterly Portfolio Report & Trade Opportunity Analysis - newser.com,newser.com
"Tue, 28 Oct 2025 05:58:52 GMT",ETRACS 2x Leveraged US Value Factor TR ETN stock trend outlook and recovery path - Portfolio Risk Summary & Pattern Based Trade Signal System - newser.com,newser.com
"Tue, 28 Oct 2025 05:54:18 GMT",Is ETRACS 2x Leveraged MSCI US Quality Factor TR ETN stock a safe buy before earnings - July 2025 Retail & Free Reliable Trade Execution Plans - newser.com,newser.com
"Tue, 28 Oct 2025 06:29:31 GMT",Can ETRACS Alerian MLP Index ETN stock hit consensus price targets - Earnings Overview Summary & Safe Entry Point Identification - newser.com,newser.com
"Tue, 28 Oct 2025 05:06:26 GMT",Is ETRACS Quarterly Pay 1.5x Leveraged Alerian MLP Index ETN stock attractive after correction - Risk Management & Weekly High Conviction Ideas - newser.com,newser.com
"Tue, 28 Oct 2025 04:39:09 GMT",How cyclical is DB Gold Double Long ETN stock compared to rivals - Options Play & Free Community Supported Trade Ideas - newser.com,newser.com
"Tue, 28 Oct 2025 04:59:56 GMT",Will iPath Series B Carbon ETN stock rally after Fed decisions - Weekly Risk Report & Reliable Volume Spike Alerts - newser.com,newser.com
"Tue, 28 Oct 2025 04:40:11 GMT",Why DB Gold Short ETN stock could rally in 2025 - Portfolio Update Report & Stepwise Entry/Exit Trade Alerts - newser.com,newser.com
"Tue, 28 Oct 2025 04:42:56 GMT",How resilient is DB Gold Short ETN stock in market downturns - Portfolio Performance Summary & Fast Entry High Yield Tips - newser.com,newser.com
"Tue, 28 Oct 2025 05:10:50 GMT",Will ETRACS Quarterly Pay 1.5x Leveraged MVIS BDC Index ETN stock benefit from automation - July 2025 WrapUp & Long-Term Safe Return Strategies - newser.com,newser.com
"Tue, 28 Oct 2025 04:45:25 GMT",Applying Elliott Wave Theory to ETRACS 2xMonthly Pay Leveraged Index ETN - 2025 Market Sentiment & Weekly High Return Opportunities - newser.com,newser.com
"Tue, 28 Oct 2025 03:04:34 GMT",What’s next for ETRACS 2x Leveraged US Growth Factor TR ETN stock price - Analyst Upgrade & Smart Allocation Stock Tips - newser.com,newser.com
"Tue, 28 Oct 2025 03:23:23 GMT",Will ETRACS 2x Leveraged US Value Factor TR ETN stock gain from strong economy - Weekly Trend Recap & Fast Entry Momentum Alerts - newser.com,newser.com
"Tue, 28 Oct 2025 02:15:56 GMT",Will ETRACS 2x Leveraged MSCI US Quality Factor TR ETN rebound enough to break even - Quarterly Portfolio Summary & Daily Entry Point Alerts - newser.com,newser.com
"Tue, 28 Oct 2025 06:58:19 GMT",Is DB Gold Short ETN still worth holding after the dip - Entry Point & Expert Curated Trade Setup Alerts - newser.com,newser.com
"Tue, 28 Oct 2025 06:12:33 GMT",Is iPath Series B Carbon ETN stock reversal real or fake - July 2025 Highlights & Verified Entry Point Signals - newser.com,newser.com
"Tue, 28 Oct 2025 05:20:20 GMT",P 500 VIX Short Term Futures ETN stock could see breakout soon - 2025 Price Momentum & Fast Exit Strategy with Risk Control - newser.com,newser.com
"Tue, 28 Oct 2025 05:31:36 GMT",Why ETRACS 2x Leveraged US Growth Factor TR ETN stock is trending among retail traders - July 2025 Reactions & Accurate Buy Signal Alerts - newser.com,newser.com
"Tue, 28 Oct 2025 06:02:19 GMT",Will ETRACS 2x Leveraged US Growth Factor TR ETN stock go up soon - July 2025 Technicals & Long-Term Safe Investment Ideas - newser.com,newser.com
"Tue, 28 Oct 2025 05:45:16 GMT",Is DB Gold Short ETN stock trading near support levels - Weekly Profit Report & Fast Moving Stock Watchlists - newser.com,newser.com
"Tue, 28 Oct 2025 06:09:04 GMT",P 500 VIX Short Term Futures ETN show high probability of rebound - Quarterly Market Summary & Low Risk High Reward Trade Ideas - newser.com,newser.com
"Tue, 28 Oct 2025 05:06:38 GMT",How resilient is DB Gold Short ETN stock in market downturns - July 2025 Gainers & Expert Approved Momentum Trade Ideas - newser.com,newser.com
"Tue, 28 Oct 2025 05:22:34 GMT",Is DB Gold Double Short ETN stock a good hedge against inflation - Earnings Trend Report & Verified Short-Term Trading Plans - newser.com,newser.com
"Tue, 28 Oct 2025 05:26:10 GMT",Can iPath Series B Carbon ETN stock double in next 5 years - Trend Reversal & Risk Managed Trade Strategies - newser.com,newser.com
"Tue, 28 Oct 2025 05:36:59 GMT",Is iPath Select MLP ETN building a consolidation base - Weekly Market Report & Risk Controlled Swing Alerts - newser.com,newser.com
"Tue, 28 Oct 2025 05:34:03 GMT",Visual analytics tools that track DB Gold Short ETN performance - July 2025 Sentiment & Stepwise Trade Execution Plans - newser.com,newser.com
"Tue, 28 Oct 2025 05:16:01 GMT",Is ETRACS Alerian MLP Index ETN stock supported by strong fundamentals - Market Performance Recap & Low Risk Growth Stock Ideas - newser.com,newser.com
"Tue, 28 Oct 2025 01:48:31 GMT",What MACD signals say about DB Gold Double Long ETN - Portfolio Value Report & Weekly Momentum Picks - newser.com,newser.com
"Tue, 28 Oct 2025 05:30:17 GMT",How ETRACS Monthly Pay 1.5x Leveraged Mortgage REIT ETN stock performs during Fed tightening cycles - Sell Signal & Verified Short-Term Trading Plans - newser.com,newser.com
"Tue, 28 Oct 2025 04:53:18 GMT",Why ETRACS 2x Leveraged MSCI US Momentum Factor TR ETN stock could outperform in 2025 - Weekly Trade Summary & Stepwise Entry and Exit Trade Signals - newser.com,newser.com
"Tue, 28 Oct 2025 04:37:34 GMT",Can ETRACS 2x Leveraged US Value Factor TR ETN stock sustain revenue growth - Dollar Strength & Long-Term Capital Growth Strategies - newser.com,newser.com
"Tue, 28 Oct 2025 00:13:50 GMT",Will ETRACS Alerian MLP Index ETN stock extend growth story - Breakout Watch & AI Based Buy/Sell Signal Reports - newser.com,newser.com
"Tue, 28 Oct 2025 04:44:43 GMT",Using data tools to time your iPath Select MLP ETN exit - July 2025 News Drivers & Free High Accuracy Swing Entry Alerts - newser.com,newser.com
"Tue, 28 Oct 2025 03:06:23 GMT",P 500 VIX Short Term Futures ETN stock could see breakout soon - July 2025 Snapshot & Safe Capital Allocation Plans - newser.com,newser.com
"Tue, 28 Oct 2025 05:17:05 GMT",Can ETRACS 2x Leveraged MSCI US Quality Factor TR ETN hit a new high this month - 2025 Market WrapUp & Free Real-Time Market Sentiment Alerts - newser.com,newser.com
"Tue, 28 Oct 2025 05:01:35 GMT",Is iPath Series B Carbon ETN trending in predictive chart models - July 2025 Volume & Low Drawdown Investment Ideas - newser.com,newser.com
"Mon, 27 Oct 2025 23:58:45 GMT",P 500 VIX Short Term Futures ETN stock ready for a breakout - July 2025 Market Mood & AI Powered Market Entry Strategies - newser.com,newser.com
"Tue, 28 Oct 2025 00:17:33 GMT",Can ETRACS Quarterly Pay 1.5x Leveraged MVIS BDC Index ETN stock deliver strong Q4 earnings - Analyst Downgrade & Community Consensus Stock Picks - newser.com,newser.com
"Mon, 27 Oct 2025 23:42:37 GMT",Why ETRACS Monthly Pay 1.5x Leveraged Mortgage REIT ETN stock attracts global investors - Gap Down & Low Risk Growth Stock Ideas - newser.com,newser.com
"Mon, 27 Oct 2025 23:12:24 GMT",Will DB Gold Short ETN stock continue dividend increases - Market Sentiment Summary & Fast Exit/Entry Strategy Plans - newser.com,newser.com
"Mon, 27 Oct 2025 22:58:01 GMT",Is iPath Series B Carbon ETN stock ready for breakout - Earnings Beat & Risk Controlled Stock Alerts - newser.com,newser.com
"Tue, 28 Oct 2025 02:11:14 GMT",Can DB Gold Double Long ETN stock deliver surprise earnings beat - July 2025 Momentum & Low Risk High Reward Trade Ideas - newser.com,newser.com
"Tue, 28 Oct 2025 02:27:05 GMT",Will DB Gold Double Short ETN stock benefit from sector rotation - Weekly Stock Analysis & Short-Term Trading Alerts - newser.com,newser.com
"Mon, 27 Oct 2025 20:53:30 GMT",ETRACS 2x Leveraged US Value Factor TR ETN stock chart pattern explained - Portfolio Performance Summary & Weekly High Potential Stock Alerts - newser.com,newser.com
"Mon, 27 Oct 2025 22:26:42 GMT",Is iPath Series B Carbon ETN forming a reversal pattern - Options Play & Expert-Curated Trade Recommendations - newser.com,newser.com
"Mon, 27 Oct 2025 22:44:45 GMT",Is iPath Series B Carbon ETN trending in predictive chart models - 2025 Historical Comparison & AI Based Buy and Sell Signals - newser.com,newser.com
"Tue, 28 Oct 2025 00:30:08 GMT",Will ETN stock remain on Wall Street radar - 2025 AllTime Highs & High Accuracy Swing Trade Signals - newser.com,newser.com
"Mon, 27 Oct 2025 20:50:24 GMT",Why DB Gold Short ETN stock could rally in 2025 - 2025 Geopolitical Influence & Detailed Earnings Play Alerts - newser.com,newser.com
"Tue, 28 Oct 2025 01:43:27 GMT",Will DB Gold Short ETN stock benefit from upcoming earnings reports - Weekly Profit Report & AI Powered Buy/Sell Recommendations - newser.com,newser.com
"Tue, 28 Oct 2025 02:09:18 GMT",Can ETRACS 2xMonthly Pay Leveraged Index ETN recover in the next quarter - July 2025 Rallies & Real-Time Volume Analysis - newser.com,newser.com
"Mon, 27 Oct 2025 22:44:46 GMT",Heatmap analysis for ETRACS 2xMonthly Pay Leveraged Index ETN and competitors - Market Trend Review & Free Technical Confirmation Trade Alerts - newser.com,newser.com
"Tue, 28 Oct 2025 00:59:36 GMT",Is iPath Select MLP ETN stock poised for growth - 2025 Top Gainers & Daily Chart Pattern Signal Reports - newser.com,newser.com
"Tue, 28 Oct 2025 02:01:29 GMT",Will ETRACS 2x Leveraged MSCI US Quality Factor TR ETN rebound enough to break even - Wall Street Watch & Free Daily Entry Point Trade Alerts - newser.com,newser.com
"Tue, 28 Oct 2025 01:19:24 GMT",ETRACS 2x Leveraged MSCI US Momentum Factor TR ETN stock prediction for this week - Market Weekly Review & Daily Entry Point Alerts - newser.com,newser.com
"Mon, 27 Oct 2025 20:52:22 GMT",Will iPath Series B Carbon ETN stock rally after Fed decisions - 2025 Stock Rankings & Daily Entry Point Trade Alerts - newser.com,newser.com
"Mon, 27 Oct 2025 23:56:02 GMT",Is iPath Series B Carbon ETN stock ready for breakout - Market Activity Recap & Long-Term Growth Portfolio Plans - newser.com,newser.com
"Tue, 28 Oct 2025 06:43:34 GMT",Why DB Gold Short ETN stock could rally in 2025 - 2025 Historical Comparison & Verified Short-Term Plans - newser.com,newser.com
"Tue, 28 Oct 2025 06:52:33 GMT",Is DB Gold Short ETN due stock prepared for digital transition - July 2025 PostEarnings & Technical Pattern Alert System - newser.com,newser.com
"Mon, 27 Oct 2025 22:37:42 GMT",Can ETRACS 2xMonthly Pay Leveraged Index ETN stock continue upward trend - 2025 Short Interest & Verified Technical Signals - newser.com,newser.com
"Mon, 27 Oct 2025 21:26:51 GMT",How DB Gold Double Short ETN stock compares with market leaders - July 2025 Levels & Weekly High Return Opportunities - newser.com,newser.com
"Mon, 27 Oct 2025 22:57:48 GMT",Comparing ETRACS 2x Leveraged US Value Factor TR ETN in custom built stock radars - Trade Entry Summary & Weekly Watchlist of Top Performers - newser.com,newser.com
"Tue, 28 Oct 2025 05:43:10 GMT",Why ETRACS MVIS Business Development Companies Index ETN stock is rated strong buy - 2025 Key Lessons & Detailed Earnings Play Alerts - newser.com,newser.com
"Mon, 27 Oct 2025 21:31:44 GMT",Will DB Gold Double Short ETN stock deliver shareholder value - July 2025 Sentiment & Free Risk Controlled Daily Trade Plans - newser.com,newser.com
"Mon, 27 Oct 2025 22:59:56 GMT",Heatmap analysis for ETRACS 2xMonthly Pay Leveraged Index ETN and competitors - 2025 Big Picture & Community Trade Idea Sharing Platform - newser.com,newser.com
"Mon, 27 Oct 2025 23:04:01 GMT",Ranking ETRACS Monthly Pay 1.5x Leveraged Mortgage REIT ETN among high performing stocks via tools - Portfolio Return Report & Entry and Exit Point Strategies - newser.com,newser.com
"Tue, 28 Oct 2025 04:45:32 GMT",P 500 VIX Short Term Futures ETN stock is a value investor pick - Quarterly Market Summary & Free High Accuracy Swing Entry Alerts - newser.com,newser.com
"Mon, 27 Oct 2025 21:32:11 GMT",Can ETRACS MVIS Business Development Companies Index ETN stock surprise with earnings upside - 2025 Trading Recap & AI Driven Price Predictions - newser.com,newser.com
"Tue, 28 Oct 2025 04:28:52 GMT",How ETRACS 2xMonthly Pay Leveraged Index ETN stock responds to policy changes - Market Movement Recap & Free Low Drawdown Momentum Trade Ideas - newser.com,newser.com
"Tue, 28 Oct 2025 05:18:02 GMT",Can ETRACS 2xMonthly Pay Leveraged Index ETN recover in the next quarter - Weekly Market Report & Capital Efficiency Focused Ideas - newser.com,newser.com
"Tue, 28 Oct 2025 04:47:43 GMT",How buybacks impact ETRACS 2x Leveraged US Value Factor TR ETN stock value - Chart Signals & Consistent Profit Alerts - newser.com,newser.com
"Tue, 28 Oct 2025 04:36:10 GMT",Why DB Gold Short ETN stock could rally in 2025 - Quarterly Profit Summary & Safe Investment Capital Preservation Plans - newser.com,newser.com
"Tue, 28 Oct 2025 04:32:55 GMT",How geopolitical risks impact DB Gold Double Long ETN stock - Portfolio Value Report & Risk Controlled Swing Alerts - newser.com,newser.com
"Tue, 28 Oct 2025 00:20:05 GMT",Aug Sectors: Why iPath Select MLP ETN stock appeals to analysts - July 2025 Analyst Calls & Risk Controlled Swing Alerts - Fundação Cultural do Pará,Fundação Cultural do Pará
"Mon, 27 Oct 2025 20:53:51 GMT",Will ETRACS Quarterly Pay 1.5x Leveraged MVIS BDC Index ETN bounce back from current support - Weekly Investment Report & Free Growth Oriented Trading Recommendations - newser.com,newser.com
"Mon, 27 Oct 2025 14:10:34 GMT",How ETN stock performs in easing cycles - Market Growth Summary & Weekly Breakout Watchlists - newser.com,newser.com
"Tue, 28 Oct 2025 06:49:58 GMT",P 500 VIX Short Term Futures ETN stock could be next big winner - Portfolio Value Report & Technical Pattern Alert System - newser.com,newser.com
"Mon, 27 Oct 2025 13:08:34 GMT",Is ETRACS Quarterly Pay 1.5x Leveraged Alerian MLP Index ETN stock attractive after correction - Earnings Growth Report & Technical Pattern Recognition Alerts - newser.com,newser.com
"Tue, 28 Oct 2025 06:52:30 GMT",Is DB Gold Short ETN stock trading near support levels - July 2025 Patterns & Daily Technical Stock Forecast Reports - newser.com,newser.com
"Tue, 28 Oct 2025 03:00:24 GMT",Identifying reversal signals in ETRACS MVIS Business Development Companies Index ETN - July 2025 Gainers & Weekly Sector Rotation Insights - newser.com,newser.com
"Tue, 28 Oct 2025 02:31:47 GMT",Does DB Gold Double Short ETN qualify in momentum factor screening - 2025 Breakouts & Breakdowns & Safe Capital Allocation Plans - newser.com,newser.com
"Tue, 28 Oct 2025 05:27:36 GMT",Is DB Gold Double Long ETN stock ready for a breakout - Exit Point & Risk Controlled Swing Alerts - newser.com,newser.com
"Mon, 27 Oct 2025 13:39:42 GMT",How cyclical is DB Gold Double Long ETN stock compared to rivals - 2025 Macro Impact & Technical Confirmation Alerts - newser.com,newser.com
"Tue, 28 Oct 2025 02:25:18 GMT",Will ETRACS 2x Leveraged US Growth Factor TR ETN stock go up soon - 2025 Fundamental Recap & Expert Curated Trade Setup Alerts - newser.com,newser.com
"Tue, 28 Oct 2025 04:32:36 GMT",How hedge fund analytics apply to DB Gold Double Short ETN stock - 2025 Major Catalysts & Safe Capital Growth Trade Ideas - newser.com,newser.com
"Tue, 28 Oct 2025 02:34:50 GMT",P 500 VIX Short Term Futures ETN benefit from macro trends - 2025 Bull vs Bear & Stock Timing and Entry Methods - newser.com,newser.com
"Tue, 28 Oct 2025 02:07:05 GMT",What MACD signals say about DB Gold Double Long ETN - July 2025 Summary & Stock Timing and Entry Methods - newser.com,newser.com
"Tue, 28 Oct 2025 04:54:33 GMT",Will ETN stock remain on Wall Street radar - Volume Spike & Community Verified Swing Trade Signals - newser.com,newser.com
"Tue, 28 Oct 2025 05:29:51 GMT",How ETRACS 2x Leveraged MSCI US Momentum Factor TR ETN stock reacts to inflationary pressures - Share Buyback & Community Consensus Trade Alerts - newser.com,newser.com
"Tue, 28 Oct 2025 04:47:52 GMT",How ETRACS 2xMonthly Pay Leveraged Index ETN stock responds to policy changes - 2025 Analyst Calls & Growth Focused Entry Reports - newser.com,newser.com
"Tue, 28 Oct 2025 01:35:48 GMT",ETRACS 2x Leveraged US Growth Factor TR ETN stock prediction for this week - July 2025 EndofMonth & Safe Capital Growth Tips - newser.com,newser.com
"Tue, 28 Oct 2025 04:35:40 GMT",How DB Gold Double Long ETN stock compares with market leaders - July 2025 Closing Moves & Weekly Market Pulse Alerts - newser.com,newser.com
"Mon, 27 Oct 2025 12:59:45 GMT",Why iPath Select MLP ETN stock remains top rated - Stock Surge & Stock Portfolio Risk Control - newser.com,newser.com
"Tue, 28 Oct 2025 05:25:57 GMT",Can ETRACS 2x Leveraged MSCI US Quality Factor TR ETN hit a new high this month - 2025 Big Picture & Community Trade Idea Sharing Platform - newser.com,newser.com
2025-10-25T07:13:49,Eaton: My Favorite 2nd Derivative AI Investment Is A Buy,SeekingAlpha
2025-10-24T14:59:00,4 Manufacturing Electronics Stocks to Consider on Promising Industry Trends,Yahoo
2025-10-24T12:10:44,How Investors May Respond To Eaton (ETN) Expanding AI Data Center and Aviation Partnerships,Yahoo
