Date,Title,Source
"Mon, 08 Sep 2025 15:42:00 GMT",Can VST's Free Cash Flow Thrust It Toward Further Long-Term Growth? - The Globe and Mail,The Globe and Mail
"Thu, 04 Sep 2025 16:10:41 GMT",Vistra Corp (VST) Impressive EBITDA and Growing Portfolio Attracts Bullish Ratings - Yahoo Finance,Yahoo Finance
"Sun, 07 Sep 2025 11:17:10 GMT",Vistra Corp. (VST) Stock Rated Buy on 41 GW Power Capacity - MSN,MSN
"Fri, 05 Sep 2025 14:46:00 GMT",$VST stock is down 5% today. Here's what we see in our data. - Quiver Quantitative,Quiver Quantitative
"Fri, 05 Sep 2025 18:47:00 GMT","Notable Friday Option Activity: SCHW, VST, FSLR - Nasdaq",Nasdaq
"Tue, 09 Sep 2025 02:31:00 GMT","Synology, VST ECS partner to expand distribution network in PH - The Manila Times",The Manila Times
"Fri, 05 Sep 2025 14:03:00 GMT",Vistra Corp Stock (VST) Opinions on Recent Stock Rally and Energy Sector Growth - Quiver Quantitative,Quiver Quantitative
"Thu, 04 Sep 2025 20:38:09 GMT","Vistra (VST) Revises Credit Agreements, Expands Receivables Facility to $1.1B - ca.finance.yahoo.com",ca.finance.yahoo.com
"Fri, 05 Sep 2025 04:30:36 GMT","VST Tillers Standalone June 2025 Net Sales at Rs 284.55 crore, up 49.3% Y-o-Y - Moneycontrol",Moneycontrol
"Fri, 05 Sep 2025 09:26:29 GMT","GST 2.0: ITC, VST Industries shares fall as Govt eyes extra tobacco tax - Business Standard",Business Standard
"Thu, 04 Sep 2025 07:21:01 GMT","Escorts Kubota, VST Tillers Share Price Surge Up To 14% After GST Cuts | Stock Market Today - Samco",Samco
"Fri, 05 Sep 2025 06:08:17 GMT","ITC, VST Industries, Varun Beverages shares fall amid report of additional tax on sin goods - Business Today",Business Today
"Thu, 04 Sep 2025 20:47:58 GMT","Vistra (VST) Revises Credit Agreements, Expands Receivables Facility to $1.1B - MSN",MSN
"Thu, 04 Sep 2025 08:11:37 GMT","Tractor stocks rally up to 14% on GST rate cut: Here's how Mahindra, Escorts Kubota, VST Tillers shares are performing - Upstox",Upstox
2025-09-04T23:38:09,"Vistra (VST) Revises Credit Agreements, Expands Receivables Facility to $1.1B",Yahoo
2025-09-04T19:10:41,Vistra Corp (VST) Impressive EBITDA and Growing Portfolio Attracts Bullish Ratings,Yahoo
