Date,Title,Source
"Mon, 08 Dec 2025 13:45:00 GMT",Cisco Systems: An Overlooked Cash Machine Powering The AI Infrastructure Boom (CSCO) - Seeking Alpha,Seeking Alpha
"Mon, 08 Dec 2025 17:16:44 GMT",Cisco Stock Price Forecast - CSCO's AI Orders Push Stock Toward $92 Target After $79 Breakout - TradingNEWS,TradingNEWS
"Tue, 09 Dec 2025 15:32:32 GMT","SA analyst upgrades/downgrades: AMD, CSCO, SHOP, CHWY - MSN",MSN
"Mon, 08 Dec 2025 08:52:03 GMT",I Was Overly Cautious - Cisco Is An AI Winner (Rating Upgrade) (NASDAQ:CSCO) - Seeking Alpha,Seeking Alpha
"Tue, 09 Dec 2025 21:15:26 GMT","Cisco Stock (CSCO) Tests $80 Resistance as AI Demand Surges: Latest News, Analyst Ratings and Price Forecasts – December 9, 2025 - ts2.tech",ts2.tech
"Mon, 08 Dec 2025 21:14:36 GMT","Cisco Stock (CSCO) Today: AI Infrastructure Boom, Splunk Synergies and Fresh Analyst Upgrades Push Shares Toward 52‑Week Highs - ts2.tech",ts2.tech
"Sat, 06 Dec 2025 17:40:59 GMT","Cisco Systems (CSCO) Stock Near Record Highs on AI Boom: Latest News, Analyst Forecasts and 2026 Outlook as of December 6, 2025 - ts2.tech",ts2.tech
"Tue, 09 Dec 2025 22:55:08 GMT","Cisco Systems, Inc. $CSCO Shares Purchased by Baker Avenue Asset Management LP - Defense World",Defense World
2025-12-09T15:00:05,"Cisco Systems, Inc. (CSCO) is Attracting Investor Attention: Here is What You Should Know",Yahoo
2025-12-08T18:33:00,"Don't bet against the Fed, Oracle's Larry Ellison: Fmr. Cisco CEO",Yahoo
2025-12-08T11:11:00,"The Zacks Analyst Blog Highlights Dell Technologies, Hewlett-Packard, Cisco Systems and Super Micro Computers",Yahoo
2025-12-08T09:45:00,Cisco Systems: An Overlooked Cash Machine Powering The AI Infrastructure Boom,SeekingAlpha
2025-12-08T04:52:03,I Was Overly Cautious: Cisco Is An AI Winner (Rating Upgrade),SeekingAlpha
2025-12-09T14:00:05+00:00,"Cisco Systems, Inc. (CSCO) is attracting investor attention: Here is what you should know",Zacks Investment Research
2025-06-17T00:01:00+00:00,"Insider Sale: EVP of $CSCO Sells 8,526 Shares",Nasdaq
2025-12-05T23:04:27+00:00,"Cisco Systems, Inc. (CSCO): A bull case theory",Insider Monkey
2025-06-13T00:45:00+00:00,Insider Sale: President and CPO of $CSCO Sells 899 Shares,Nasdaq
2025-11-29T18:09:08+00:00,UBS Raises Cisco Systems (CSCO) Price Target After Strong Hyperscale Customer Growth,Insider Monkey
