Date,Title,Source
2025-09-15T12:35:29Z,Stripe’s crypto head leaves firm for Polygon amid Tempo blockchain build-up,Biztoc.com
2025-09-15T12:35:29Z,"UBS Lowers PT on Playtika Holding Stock from $5.5 to $4, Keeps Natural Rating",Biztoc.com
2025-09-15T12:35:28Z,The Fed faces economic uncertainty and political pressure as it decides whether to cut rates,Biztoc.com
2025-09-15T12:35:28Z,Hospital Under Fire After Doctors Blame Parents for Child's Condition — Later Revealed as Cancer,Medical Daily
2025-09-15T12:35:26Z,"New York Factory Activity Contracts on Weak Orders, Shipments",Biztoc.com
2025-09-15T12:35:24Z,BlackRock inks ₹410-cr lease with Indiqube for 1.43 lakh sq. ft. office in Bengaluru,BusinessLine
2025-09-15T12:35:24Z,Trump advocates that companies stop reporting earnings on a quarterly basis,Biztoc.com
2025-09-15T12:35:24Z,Mike Driscoll: Erys – A TUI for Jupyter Notebooks,Pythonlibrary.org
2025-09-15T12:35:22Z,Adani to build Kedarnath-Sonprayag ropeway in six years; journey time to drop to 36 minutes from 8 hours now,The Times of India
2025-09-15T12:35:20Z,"Trump Issues Major Update on China Trade, TikTok Deal",Biztoc.com
2025-09-15T12:35:20Z,Lakeland Industries subsidiary awarded $5.6M three-year contract from HKSFD,Thefly.com
2025-09-15T12:35:19Z,How Does Analysts Feel About Plug Power? BTIG Reiterates Hold Rating on PLUG,Biztoc.com
2025-09-15T12:35:18Z,These are the tasks Indeed’s new CEO says HR leaders should hand over to AI,Biztoc.com
2025-09-15T12:35:13Z,[Planned Maintenance] Sydney between 12:30 UTC and 13:45 UTC on September 22nd,Cisco.com
2025-09-15T12:35:11Z,"Apple AirPods Pro 3 review: significantly better fit, sound quality, noise cancellation, and battery life, but heart-rate monitoring is buried in fitness apps",Biztoc.com
2025-09-15T12:35:10Z,Wipro Targets Rising Cyber Threats With New CrowdStrike Backed Service,Biztoc.com
2025-09-15T12:35:08Z,Trump Calls for Ending Quarterly Earnings Reports,Biztoc.com
2025-09-15T12:35:08Z,"Tanger price target raised by $2 at Evercore ISI, here's why",Thefly.com
2025-09-15T12:35:04Z,Wall Street's Most Accurate Analysts Spotlight On 3 Energy Stocks With Over 9% Dividend Yields,Biztoc.com
2025-09-15T12:35:03Z,Progressive Country finds that Nvidia violated Anti-Monopoly laws. Say What? China? [Interesting],Fark.com
2025-09-15T12:35:00Z,Chelsea now scouting Ajax midfielder but have competition from big English clubs,Chelsea.news
2025-09-15T12:35:00Z,EU Grapples With How to Navigate Trump’s Demands on Russian Oil,Biztoc.com
2025-09-15T12:35:00Z,"Sabah disaster victims to receive compassionate aid of RM1,000 or RM10,000",The Star Online
2025-09-15T12:35:00Z," Modric on DAZN, Digne’s knock, Di Maria’s Olimpico goal  missed moments",Onefootball.com
2025-09-15T12:35:00Z,How to watch and follow United Women v Brann,Manchester United
2025-09-15T12:35:00Z,"Emergent BioSolutions Secures $17 Million Contract Modification for Oral Suspension TEMBEXA® (brincidofovir), a Smallpox Antiviral, and Strengthens Overall U.S. Supply Chain",GlobeNewswire
2025-09-15T12:34:58Z,When does iOS 26 come out? Date and time you can download the new iPhone operating system around the world,Biztoc.com
2025-09-15T12:34:58Z,GOP cuts leave low-income nutrition education programs searching for new funding recipe,Santa Fe New Mexican
2025-09-15T12:34:55Z,Surge in interest for Hong Kong’s HK$50 billion Silver Bonds,Biztoc.com
2025-09-15T12:34:53Z,NFL Week 3 Predictions: Projecting Every Game on NFL Schedule This Week,Sportsnaut
2025-09-15T12:34:53Z,Top S&P 500 Stock GEV Vernova Receives Bullish Upgrade But Is Still Below Buy Point,Biztoc.com
2025-09-15T12:34:49Z,Rubio meets with Netanyahu after Israeli attack on Hamas leaders in Qatar,CBS News
2025-09-15T12:34:48Z,Pantera and Summer Capital raise $1.25 billion to turn neurotech firm into Solana treasury company,Biztoc.com
2025-09-15T12:34:47Z,Ukraine's front line regains Starlink internet after a brief global outage that paused some drone flights,Biztoc.com
2025-09-15T12:34:44Z,Tropical Storm Gabrielle Spaghetti Models as Hurricane Chances Increase,Biztoc.com
2025-09-15T12:34:43Z,OnePlus 15 First Real-Life Image Leaks — With iPhone-Style Camera Twist,Android Headlines
2025-09-15T12:34:42Z,"National home sales in August hit 4-year high, says CREA",Biztoc.com
2025-09-15T12:34:41Z,"Natura to sell Avon CARD, exploring options for Avon International",Yahoo Entertainment
2025-09-15T12:34:37Z,Come to Web Day Out in Brighton on 12 March 2026 to learn all about what you can do in browsers today: https://webdayout.com/ Tickets are just £225+VAT,Adactio.com
2025-09-15T12:34:37Z,Trump advocates that companies stop reporting earnings on a quarterly basis,CNBC
2025-09-15T12:34:37Z,Trump takes issue with NFL's 'ridiculous-looking' dynamic kickoff,Fox News
2025-09-15T12:34:33Z,"Pastor Tobi Adegboyega Shares Proof of Life After Cancer Surgery, Gives Update About His Health",Latest News in Nigeria & Breaking Naija News 24/7 | LEGIT.NG
2025-09-15T12:34:33Z,Sarah Lavin misses out on 100m hurdles final at World Championships,The Irish Times
2025-09-15T12:34:31Z,Nokia announces changes in corporation's shares,Thefly.com
2025-09-15T12:34:28Z,"Show HN: Demochain, a toy blockchain network that runs on the browser",Github.com
2025-09-15T12:34:27Z,Is America’s Retirement System Failing Future Retirees? A Conversation With Teresa Ghilarducci,Forbes
2025-09-15T12:34:17Z,"LeBron James vs Luka Dončić salary comparison: How much Los Angeles Lakers stars get, contract details net worth and more",The Times of India
2025-09-15T12:34:14Z,Leading Independent Proxy Advisory Firms ISS and Glass Lewis Recommend Flint Corp. Shareholders Vote for the Recapitalization Transaction,Financial Post
2025-09-15T12:34:09Z,"More than 3.7 Million Teens Participate in Planet Fitness’ High School Summer Pass™ Program, Building Lifelong Health and Wellness Habits Through Fitness",Financial Post
2025-09-15T12:34:07Z,IceCure Medical receives approval in Israel for the XSense System,Thefly.com
2025-09-15T12:34:04Z,Sienna Announces September Dividend,Financial Post
2025-09-15T12:34:00Z,"Germany state elections: AfD makes gains, Greens fall behind",DW (English)
2025-09-15T12:34:00Z,"""The Martyrdom of Charlie Kirk"": Journalist Chris Hedges on the Weaponization of Kirk's Killing",Democracy Now!
2025-09-15T12:33:59Z,FBI Confirms DNA Found at Scene of Charlie Kirk Assassin's Hiding Spot Matches Suspect,Breitbart News
2025-09-15T12:33:53Z,Planet Fitness announces record-breaking participation in 2025 HS Summer Pass,Thefly.com
2025-09-15T12:33:53Z,The Latest Developments That Could Turn Bitcoin Bullish and Fuel Bitcoin Hyper’s $16M Presale,newsBTC
2025-09-15T12:33:53Z,28 Days Until Opening Night At NWA: The History Of Jersey #28,The Hockey News
2025-09-15T12:33:44Z,Trump GOP Redirected Essential Cybersecurity Funding To Give Rich Assholes More Tax Cuts,Slashdot.org
2025-09-15T12:33:43Z,The Moon is getting slightly farther away from the Earth each year − a physicist explains why,The Conversation Africa
2025-09-15T12:33:43Z,The Moon is getting slightly farther away from the Earth each year − a physicist explains why,Yahoo Entertainment
2025-09-15T12:33:37Z,"Regency Centers price target raised by $1 at Evercore ISI, here's why",Thefly.com
2025-09-15T12:33:28Z,How big a solar battery do I need to store *all* my home's electricity?,Shkspr.mobi
2025-09-15T12:33:19Z,"Lantheus price target lowered by $15 at TD Cowen, here's why",Thefly.com
2025-09-15T12:33:15Z,VisionWave signs MOU with India-based defense company,Thefly.com
2025-09-15T12:33:13Z,"As with every year, Apple’s launch event made waves — but this time, the AirPods Pro 3 took center stage - Ynetnews",Slashdot.org
2025-09-15T12:33:10Z,"[Eugene Volokh] Nina Jankowicz, Former ""Disinformation Governance Board"" Director, Loses Libel Suit Against Fox",Reason
2025-09-15T12:33:06Z,Democratic senator calls internet an 'accelerant' driving extremism after Kirk killing,Fox News
2025-09-15T12:33:03Z,"Public Storage price target raised by $3 at Evercore ISI, here's why",Thefly.com
2025-09-15T12:33:02Z,Travis Kelce’s ex Kayla Nicole gets sensual lap dance from Chris Brown onstage during LA concert,Page Six
2025-09-15T12:33:00Z,Big Ten Superlatives: Week 3,Black Shoe Diaries
2025-09-15T12:33:00Z,ShinyHunters linked to breach of French luxury goods house,ComputerWeekly.com
2025-09-15T12:33:00Z,"Congressional leaders, Trump administration officials remember Charlie Kirk at vigil",CBS News
2025-09-15T12:32:52Z,"The Pitt wins best TV drama Emmy, as war on Gaza echoes at ceremony - Al Jazeera",Slashdot.org
2025-09-15T12:32:51Z,‘Star Wars’ Quietly Buries Beloved Jedi Character From Non-Canon Series,Inside the Magic
2025-09-15T12:32:43Z,"Rolling Stone, Billboard Owner Penske Sues Google Over AI Overviews",Insurance Journal
2025-09-15T12:32:39Z,When All You Have Is a Robots.txt Hammer – Pixel Envy,Pxlnv.com
2025-09-15T12:32:38Z,"Prologis price target raised by $2 at Evercore ISI, here's why",Thefly.com
2025-09-15T12:32:36Z,"Winnipeg event shines light on treaties, looks to educate about their importance",CBC News
2025-09-15T12:32:25Z,"Choice Properties Real Estate Investment Trust Declares Cash Distribution for the Month of September, 2025",Financial Post
2025-09-15T12:32:20Z,Thales eyes more SAMP/T deals after Denmark picks European anti-missile system,Yahoo Entertainment
2025-09-15T12:32:20Z,"Harm-reduction vending machines offer free naloxone, pregnancy tests and hygiene kits",The Conversation Africa
2025-09-15T12:32:20Z,Trump suggests a TikTok deal has finally been reached with China | CNN Business,CNN
2025-09-15T12:32:19Z,"National Storage price target raised by $1 at Evercore ISI, here's why",Thefly.com
2025-09-15T12:32:13Z,New Gallery Assistant One UI 8 app brings powerful features,SamMobile
2025-09-15T12:32:11Z,DN Enuff: I Stayed At Hot 97 Way Too Long,Mediatakeout.com
"Mon, 15 Sep 2025 22:30:06 GMT",Seattle Reign FC Match Against Racing Louisville FC to Resume on September 16 at Lumen Field - Seattle Reign FC,Seattle Reign FC
"Tue, 16 Sep 2025 03:18:00 GMT",Savannah DeMelo in good spirits after collapsing on field; match rescheduled - CNN,CNN
"Tue, 16 Sep 2025 03:03:00 GMT",California man who landed plane on naval base twice and stole Navy truck pleads guilty - NBC News,NBC News
"Tue, 16 Sep 2025 02:01:02 GMT",NC State students on alert after report of a man inappropriately touching a person on campus - WRAL.com,WRAL.com
"Tue, 16 Sep 2025 03:24:00 GMT",Brady shown in Raiders' coaching booth on MNF - ESPN,ESPN
"Mon, 15 Sep 2025 23:25:04 GMT",New York's ban on addictive social media feeds for kids takes shape with proposed rules - ABC News,ABC News
"Mon, 15 Sep 2025 21:52:58 GMT",Iowa lawmakers call for termination of ISU employees for online comments on Charlie Kirk - Iowa Capital Dispatch,Iowa Capital Dispatch
"Tue, 16 Sep 2025 06:37:41 GMT",Opinion | Trump brings the war on terror to the Caribbean - The Washington Post,The Washington Post
"Mon, 15 Sep 2025 19:31:19 GMT",Sharing an Update on Federal Research Funding - UCLA Office of the Chancellor,UCLA Office of the Chancellor
"Tue, 16 Sep 2025 01:00:57 GMT",Republicans dare Democrats on avoiding government shutdown - Axios,Axios
"Mon, 15 Sep 2025 22:30:00 GMT",Oklahoma Supreme Court puts new social studies standards on hold - Oklahoma Voice,Oklahoma Voice
"Tue, 16 Sep 2025 00:18:58 GMT",Appeals Court Says Lisa Cook Can Remain on Fed Board - The New York Times,The New York Times
"Tue, 16 Sep 2025 01:25:03 GMT",City staff members set sights on 6th and Stoneridge for new Lawrence fire station - The Lawrence Times,The Lawrence Times
"Mon, 15 Sep 2025 20:18:17 GMT","Lawmakers press OPM on ‘critical’ staffing, funding issues in Postal insurance program - Federal News Network",Federal News Network
"Tue, 16 Sep 2025 00:57:53 GMT",Appeals court says Lisa Cook can stay on the Federal Reserve board — for now - NPR,NPR
"Mon, 15 Sep 2025 21:45:33 GMT","2 clowns arrested after brandishing guns, harassing women on Aurora Ave. - KOMO",KOMO
"Mon, 15 Sep 2025 17:47:00 GMT",Chargers LB Perryman put on IR with ankle injury - ESPN,ESPN
"Tue, 16 Sep 2025 06:50:38 GMT",Former Manchester United midfielder Juan Mata signs for Melbourne Victory on one-year deal - The Athletic - The New York Times,The New York Times
"Mon, 15 Sep 2025 20:12:46 GMT","In ‘Plainclothes,’ Russell Tovey and Tom Blyth play lovers on opposite sides of the law - NBC News",NBC News
"Tue, 16 Sep 2025 03:52:00 GMT",Chargers' Mack set for tests on elbow after exit - ESPN,ESPN
"Mon, 15 Sep 2025 23:57:42 GMT","Updates On Devon Witherspoon, Nick Emmanwori & Other Seahawks Injuries - Seattle Seahawks",Seattle Seahawks
"Tue, 16 Sep 2025 02:53:00 GMT","Charlie Kirk murder suspect appeared to confess to killing on Discord, company says - CBS News",CBS News
"Tue, 16 Sep 2025 00:52:55 GMT",House GOP zeroes in on lawmaker security plan in government shutdown patch - Politico,Politico
"Mon, 15 Sep 2025 22:53:16 GMT",Bichette getting second opinion on sprained left knee - MLB.com,MLB.com
"Mon, 15 Sep 2025 21:26:30 GMT",White House promises crackdown on left-wing ‘terror’ after Kirk killing - Al Jazeera,Al Jazeera
"Tue, 16 Sep 2025 01:18:00 GMT",Astros All-Star Yordan Álvarez sprains ankle while slipping on home plate during critical juncture of AL West race - Yahoo Sports,Yahoo Sports
"Tue, 16 Sep 2025 00:59:53 GMT","Can the EU and NATO impose tariffs on India and China, as Trump wants? - Al Jazeera",Al Jazeera
"Mon, 15 Sep 2025 20:13:40 GMT","U.S. and China reach a framework deal on TikTok, but details are sparse - PBS",PBS
"Tue, 16 Sep 2025 06:01:00 GMT",Steam baths and seaweed safaris on Sweden’s spa island | Sweden holidays - The Guardian,The Guardian
"Mon, 15 Sep 2025 19:31:24 GMT","Nasdaq supports reforms to reduce burden on public companies, CEO Friedman says - Reuters",Reuters
"Mon, 15 Sep 2025 22:30:53 GMT",Tamara Keith and Amy Walter on the political response to Charlie Kirk’s killing - PBS,PBS
"Mon, 15 Sep 2025 23:54:41 GMT",Trump Signs Off on Sending National Guard to Memphis to Crack Down on Crime - The New York Times,The New York Times
"Mon, 15 Sep 2025 19:40:00 GMT","Depleted Panthers will place Hunt, Corbett on IR - ESPN",ESPN
"Mon, 15 Sep 2025 21:46:00 GMT",Man says that large group of kids on bikes in Boston were aggressive toward his wife - CBS News,CBS News
"Mon, 15 Sep 2025 19:01:00 GMT",Arteta calls on team to rewrite Arsenal UCL history - ESPN,ESPN
"Mon, 15 Sep 2025 21:22:31 GMT","US military playing catchup, tackling insomnia, nuns on the run: Catch up on the day’s stories - CNN",CNN
"Mon, 15 Sep 2025 22:45:27 GMT",Firings over callous remarks on Kirk’s killing spark debate on limits of free speech - PBS,PBS
"Mon, 15 Sep 2025 23:15:00 GMT","3 killed in US strike on 2nd alleged Venezuelan drug boat, Trump says - ABC News",ABC News
"Tue, 16 Sep 2025 01:21:25 GMT",Maduro calls U.S. attack on boat ‘a heinous crime.’ Then Trump announces another - The Seattle Times,The Seattle Times
"Tue, 16 Sep 2025 07:00:00 GMT",Parkinson's is on the rise. Here's one future treatment giving researchers hope : Short Wave - NPR,NPR
"Mon, 15 Sep 2025 21:11:02 GMT",Trump announces second US strike on alleged drug traffickers - Politico,Politico
"Tue, 16 Sep 2025 00:06:00 GMT","Fume incidents on airplanes raise health concerns for passengers, crew members - CBS News",CBS News
"Mon, 15 Sep 2025 19:11:29 GMT",Oil settles higher as investors assess attacks on Russian energy facilities - Reuters,Reuters
"Mon, 15 Sep 2025 23:52:04 GMT",Shutdown talk heats up as Democrats insist on stopping health care cuts - ABC News,ABC News
"Mon, 15 Sep 2025 20:43:36 GMT",Wall Street Raises Alarm on Trump Ending Quarterly Earnings - Bloomberg.com,Bloomberg.com
"Mon, 15 Sep 2025 23:39:00 GMT","U.S. military conducts strike on second Venezuelan boat, Trump says - NBC News",NBC News
"Tue, 16 Sep 2025 06:04:16 GMT",WATCH: Clemson student caught on video appearing to mock Charlie Kirk after assassination - Fox News,Fox News
"Tue, 16 Sep 2025 02:03:00 GMT","Buccaneers-Texans, Chargers-Raiders on Monday night: What We Learned from Tampa Bay's, Los Angeles' wins - NFL.com",NFL.com
"Tue, 16 Sep 2025 02:03:45 GMT","Public employees’ comments on Charlie Kirk killing largely protected by law, analysts say - WRAL.com",WRAL.com
"Mon, 15 Sep 2025 21:58:02 GMT","Trump announces federal crackdown on crime in Memphis, Tennessee - BBC",BBC
"Tue, 16 Sep 2025 06:50:11 GMT","U.S. kills 3 in strike on alleged drug boat from Venezuela, Trump says - The Washington Post",The Washington Post
"Mon, 15 Sep 2025 23:32:27 GMT",The big-money Democrats with a different Yes on 50 strategy - Politico,Politico
"Tue, 16 Sep 2025 02:27:00 GMT","Vietnam says minister met LSE, FTSE Russell officials on market upgrade - Reuters",Reuters
"Mon, 15 Sep 2025 22:06:52 GMT",Boat owner will stay in jail on $1M bond after crash that killed girl - WRAL.com,WRAL.com
"Mon, 15 Sep 2025 18:04:07 GMT",Ex-British soldier on trial for Bloody Sunday killings in Northern Ireland - PBS,PBS
"Mon, 15 Sep 2025 23:43:12 GMT","Trump suggests TikTok deal, will talk to China's Xi on Friday - Axios",Axios
"Mon, 15 Sep 2025 22:00:21 GMT","US, China reach framework deal on TikTok; Trump and Xi to speak on Friday - Reuters",Reuters
"Mon, 15 Sep 2025 21:54:36 GMT",The White House Vowed a Vast Crackdown on Liberal Groups - The New York Times,The New York Times
"Mon, 15 Sep 2025 20:48:45 GMT","How to stream Bad Bunny’s final concert of his Puerto Rico residency, exclusively with Amazon - About Amazon",About Amazon
"Tue, 16 Sep 2025 04:00:05 GMT",Trump tramples Reagan’s tough-on-the-Kremlin legacy ahead of UK state visit - CNN,CNN
"Tue, 16 Sep 2025 05:00:00 GMT",Amazon to host Prime Big Deals Day sales event on October 7 and 8 - Yahoo Finance,Yahoo Finance
"Mon, 15 Sep 2025 20:25:24 GMT",Florida Says Ban on Openly Carrying Guns Is Invalid After Court Ruling - The New York Times,The New York Times
"Tue, 16 Sep 2025 05:42:05 GMT","Winners, losers from Chargers' Monday night win over the Raiders include nasty defense - USA Today",USA Today
"Tue, 16 Sep 2025 01:24:46 GMT","Details emerge on alleged kidnapping, molestation of 5-year-old girl at Seattle tent city - KOMO",KOMO
"Tue, 16 Sep 2025 01:51:41 GMT",Senate confirms Stephen Miran for seat on Federal Reserve board as Trump’s bid to oust Lisa Cook foiled by court - as it happened - The Guardian,The Guardian
"Mon, 15 Sep 2025 22:10:28 GMT",Seattle police officer rams oncoming car to stop potential attack on pedestrian - KOMO,KOMO
"Tue, 16 Sep 2025 05:14:28 GMT",U.S. targets China's grip on global ports in sweeping maritime mission - Reuters,Reuters
"Mon, 15 Sep 2025 18:22:30 GMT","Ludacris To Join Chapel Thrill Concert Series On Saturday, October 4 - University of North Carolina Athletics",University of North Carolina Athletics
"Mon, 15 Sep 2025 19:07:47 GMT","On Charlie Kirk Show, JD Vance Talks of Crackdown on Liberal Groups - The New York Times",The New York Times
"Mon, 15 Sep 2025 20:50:52 GMT","Clowney on joining Cowboys, potential impact & 2025 plan - Dallas Cowboys | Official Site of the Dallas Cowboys",Dallas Cowboys | Official Site of the Dallas Cowboys
"Tue, 16 Sep 2025 04:20:10 GMT",US says framework for deal on future of TikTok ownership agreed with China - BBC,BBC
"Mon, 15 Sep 2025 20:21:00 GMT",Trump announces deadly US strike on another alleged Venezuelan drug boat - The Guardian,The Guardian
"Tue, 16 Sep 2025 04:33:15 GMT","Clemente Award nominee Rodón inspires off the field, keeps delivering on it - MLB.com",MLB.com
"Mon, 15 Sep 2025 20:52:52 GMT",Trump’s cherry-picked claims on political violence ignore his own rhetoric - CNN,CNN
"Mon, 15 Sep 2025 14:54:29 GMT",Gang attack on armored vehicle in Haiti leaves 2 police officers injured and 1 driver dead - ABC News,ABC News
"Tue, 16 Sep 2025 00:22:30 GMT",Ben Johnson facing challenges on both sides of the ball in his first year as Bears coach - ABC News,ABC News
"Mon, 15 Sep 2025 18:18:26 GMT",Trump to GOP: Vote yes on the ‘clean’ CR - Politico,Politico
"Mon, 15 Sep 2025 15:06:00 GMT","Workers fired, placed on leave for Charlie Kirk comments after assassination - CBS News",CBS News
"Tue, 16 Sep 2025 03:19:00 GMT",Alleged cocaine-smuggling kingpin said to have earned €230m goes on trial - The Guardian,The Guardian
"Tue, 16 Sep 2025 04:16:54 GMT",Donald Trump accuses Colombia of failing to co-operate on drugs crackdown - Financial Times,Financial Times
"Mon, 15 Sep 2025 22:54:45 GMT",Elderly man dies after bear attacks him on lawnmower - USA Today,USA Today
"Mon, 15 Sep 2025 20:35:24 GMT",Thune wants quick Senate vote on stopgap as House timing slips - Politico,Politico
"Mon, 15 Sep 2025 19:52:00 GMT",JD Vance threatens crackdown on ‘far-left’ groups after Charlie Kirk shooting - The Guardian,The Guardian
"Mon, 15 Sep 2025 23:48:00 GMT","Shipping companies support a first-ever global fee on greenhouse gases, opposed by Trump officials - AP News",AP News
"Tue, 16 Sep 2025 01:30:00 GMT",‘Tinder Swindler’ Shimon Hayut arrested in Georgia on Interpol request - The Guardian,The Guardian
"Tue, 16 Sep 2025 00:18:00 GMT",Bengals coach Zac Taylor confirms Joe Burrow will have surgery on left toe. QB could miss 3 months - AP News,AP News
"Mon, 15 Sep 2025 23:26:52 GMT",Netanyahu refuses to rule out further strikes on Hamas leaders - BBC,BBC
"Tue, 16 Sep 2025 01:09:37 GMT","Kamala Harris will be Rachel Maddow's guest on Monday, Sept. 22 - MSNBC News",MSNBC News
"Mon, 15 Sep 2025 22:32:00 GMT",Minneapolis police say five people shot and injured on Lake Street - MPR News,MPR News
"Mon, 15 Sep 2025 20:27:23 GMT",Comcast sues Washington to block law imposing sales tax on advertising - MyNorthwest.com,MyNorthwest.com
"Mon, 15 Sep 2025 21:20:55 GMT",Republicans put tech firms in a vise on Kirk social-media posts - Politico,Politico
"Mon, 15 Sep 2025 19:47:00 GMT",CNN on the ground for massive military exercises for Russia and Belarus - CNN,CNN
2025-09-15T20:59:39,China’s tariff investigation could shift analog chip market dynamics: Bernstein,Yahoo
2025-09-15T15:26:00,"Texas Instruments, Analog Devices Stocks Fall. China Inquiry Targets U.S. Chip Makers.",Yahoo
2025-09-15T13:41:16,"Stocks to Watch Monday: Nvidia, Tesla, Corteva, Onsemi",Yahoo
2025-09-14T07:04:41,China launches probes targeting US semiconductors ahead of Madrid trade talks,Yahoo
2025-09-12T16:49:38,Is ON Semiconductor Stock Underperforming the S&P 500?,Yahoo
2025-09-11T20:38:06,3 Stocks Estimated To Be Trading Below Intrinsic Value By Up To 47.5%,Yahoo
2025-09-11T19:49:12,TD Cowen Remains Bullish on On Semiconductor Corporation (ON),Yahoo
2025-09-11T19:07:00,ON Semiconductor Corp. stock outperforms competitors on strong trading day,MarketWatch
2025-09-12T23:51:56,"Pfizer, Moderna shares fall on report that Trump officials will link child deaths to Covid shots",Reddit/r/stocks
2025-09-12T08:53:43,Real talk. Is the market rallying too much on a 0.25% cut or is it just me,Reddit/r/wallstreetbets
