Date,Title,Source
2025-09-13T17:43:33Z,Is O'Reilly Automotive Stock a Buy After Recent Earnings?,Biztoc.com
2025-09-13T08:36:49Z,"Ashton Thomas Private Wealth LLC Makes New Investment in O’Reilly Automotive, Inc. $ORLY",ETF Daily News
2025-09-11T23:16:26Z,"If You Invested $100 In O'Reilly Automotive Stock 20 Years Ago, You Would Have This Much Today",Biztoc.com
2025-09-10T14:15:03Z,This All-Star Stock Just Set New All-Time Highs,Barchart.com
2025-09-10T07:13:15Z,"O’Reilly Automotive, Inc. (NASDAQ:ORLY) Given Consensus Rating of “Buy” by Analysts",ETF Daily News
"Sat, 13 Sep 2025 21:20:32 GMT",How Does O’Reilly Automotive’s (ORLY) Ongoing Volatility Shape Its Long-Term Expansion Strategy? - simplywall.st,simplywall.st
"Sun, 14 Sep 2025 04:51:49 GMT","UBS AM A Distinct Business Unit of UBS Asset Management Americas LLC Grows Position in O'Reilly Automotive, Inc. $ORLY - MarketBeat",MarketBeat
"Wed, 10 Sep 2025 11:15:00 GMT",France Travel and Tourism Disruption Deepens as Charles de Gaulle and Paris Orly Airports See Several Flights Cancelled During September Strikes - Travel And Tour World,Travel And Tour World
"Wed, 10 Sep 2025 04:35:10 GMT",Air Caraibes to launch Paris Orly-Samana service from mid Dec-2025 - Centre for Aviation,Centre for Aviation
"Wed, 10 Sep 2025 15:17:36 GMT",Paris transport strike: how to get to Roissy and Orly airports? - Sortir à Paris,Sortir à Paris
"Fri, 12 Sep 2025 07:00:00 GMT","O'Reilly Automotive, Inc. $ORLY Shares Sold by Signature Estate & Investment Advisors LLC - MarketBeat",MarketBeat
"Wed, 10 Sep 2025 21:43:29 GMT","US and France Face New Travel Turmoil as Air France Cancels 5 New Flights Across Paris Orly, Raleigh-Durham, Charles de Gaulle, and Other Airports: Here is the New Update - Travel And Tour World",Travel And Tour World
"Fri, 12 Sep 2025 09:44:59 GMT",O'Reilly Automotive (NASDAQ:ORLY) Hits New 52-Week High - Time to Buy? - MarketBeat,MarketBeat
"Tue, 09 Sep 2025 18:40:26 GMT","Airport strikes on September 10 and 18, chaos looms at Roissy and Orly - Sortir à Paris",Sortir à Paris
"Wed, 10 Sep 2025 10:58:06 GMT",New Partnership Between Caribbean Airlines and Air Caraïbes Creates Direct Path to Paris Orly - Travel And Tour World,Travel And Tour World
"Thu, 11 Sep 2025 07:00:00 GMT","O'Reilly Automotive, Inc. $ORLY Shares Bought by MIRAE ASSET GLOBAL ETFS HOLDINGS Ltd. - MarketBeat",MarketBeat
"Wed, 10 Sep 2025 05:36:35 GMT",Caribbean Airlines and Air Caraïbes Forge Powerful New Travel Route Connecting the Caribbean to Paris Orly Airport - Travel And Tour World,Travel And Tour World
"Sat, 13 Sep 2025 03:32:20 GMT","UniSuper Management Pty Ltd Buys 11,875 Shares of O'Reilly Automotive, Inc. $ORLY - MarketBeat",MarketBeat
"Wed, 10 Sep 2025 11:28:50 GMT","Over Dozens of Cancellations Lead to Travel Setbacks in France, Switzerland, and Germany with EasyJet, Impacting Key Routes for Passengers at Nice Cote, Nantes, Paris Orly, Bordeaux, and Charles de Airports - Travel And Tour World",Travel And Tour World
"Tue, 09 Sep 2025 07:00:00 GMT","Centerstone Investors LLC Decreases Stake in O'Reilly Automotive, Inc. $ORLY - MarketBeat",MarketBeat
"Wed, 10 Sep 2025 07:00:00 GMT","Jacobs Levy Equity Management Inc. Invests $167.68 Million in O'Reilly Automotive, Inc. $ORLY - MarketBeat",MarketBeat
"Sun, 14 Sep 2025 03:53:32 GMT",How to use a screener to detect ORLY breakouts - 2025 Stock Rankings & AI Forecasted Stock Moves - newser.com,newser.com
"Sat, 13 Sep 2025 21:41:03 GMT",Will ORLY price bounce be sustainable - Market Activity Recap & Long-Term Growth Portfolio Plans - newser.com,newser.com
"Sat, 13 Sep 2025 16:10:00 GMT",does orly fit your quant trading model - July 2025 Intraday Action & Daily Volume Surge Trade Alerts - newser.com,newser.com
"Sat, 13 Sep 2025 16:06:08 GMT",Does ORLY fit your quant trading model - July 2025 News Drivers & Expert Approved Momentum Trade Ideas - newser.com,newser.com
2025-09-10T17:15:03,This All-Star Stock Just Set New All-Time Highs,Yahoo
