Date,Title,Source
"Thu, 04 Dec 2025 14:00:00 GMT",TT Podcasts: RoadSigns - Transport Topics,Transport Topics
"Sun, 07 Dec 2025 21:28:42 GMT",Kanye West and Bianca Censori Spotted Arriving in South K... - Complex,Complex
"Thu, 04 Dec 2025 23:15:00 GMT",2025 Ironman 70.3 Oceanside Pro Bike: Paula Findlay’s Specialized Shiv TT - Triathlete,Triathlete
"Sun, 07 Dec 2025 14:00:08 GMT",Institutional owners may take dramatic actions as Trane Technologies plc's (NYSE:TT) recent 4.8% drop adds to one-year losses - Yahoo Finance,Yahoo Finance
"Sat, 06 Dec 2025 07:21:54 GMT",Section of TT course closed at Union Mills for tree felling - BBC,BBC
"Sat, 06 Dec 2025 05:44:54 GMT",TT Electronics Unveils New State of the Art Electronics Manufacturing Facility in Malaysia - I-Connect007,I-Connect007
"Thu, 04 Dec 2025 23:15:00 GMT",From Road Bike to Aero Machine: The Evolution of Taylor Knibb’s TT Position - Triathlete,Triathlete
"Fri, 05 Dec 2025 04:31:00 GMT",TransThera Publishes Clinical Studies of Tinengotinib (TT-00420) against Cholangiocarcinoma on Lancet - Yahoo Finance,Yahoo Finance
"Fri, 05 Dec 2025 21:35:52 GMT",New Platts Policy Excludes Russian-Origin Fuel - Transport Topics,Transport Topics
"Thu, 04 Dec 2025 23:15:00 GMT","Triathlon News & Notes: Findlay Wins Canadian TT Title, Kienle Pulls Out of Roth, and Triathlete Survives Shark Attack - Triathlete",Triathlete
"Mon, 08 Dec 2025 07:27:16 GMT",Reynolds AR 80 & 50 TT/Triathlon Combo - Bike Hub,Bike Hub
"Thu, 04 Dec 2025 22:48:23 GMT",TT Vision Holdings Berhad's (KLSE:TTVHB) Shareholders May Want To Dig Deeper Than Statutory Profit - Yahoo Finance,Yahoo Finance
"Sun, 07 Dec 2025 12:10:06 GMT",Trane Technologies plc $TT Shares Purchased by Federated Hermes Inc. - MarketBeat,MarketBeat
"Fri, 05 Dec 2025 08:00:00 GMT",Terrinashjae 'TT' Burden Game Report: vs Cornwall Central - MaxPreps.com,MaxPreps.com
"Sat, 06 Dec 2025 14:12:38 GMT",Blow to City as TT Electronics rolls over for Swiss rival after snubbing Rothschild - MSN,MSN
"Fri, 05 Dec 2025 10:29:58 GMT",Will TT stock split increase liquidity - Sell Signal & AI Enhanced Trading Signals - Newser,Newser
"Mon, 08 Dec 2025 07:31:16 GMT",Salvation Army’s Kettle initiative: Ringing the bells of hope - Trinidad and Tobago Newsday,Trinidad and Tobago Newsday
"Thu, 04 Dec 2025 01:53:48 GMT",tt - Denton Record-Chronicle,Denton Record-Chronicle
"Sat, 06 Dec 2025 11:41:48 GMT","SCS Capital Management LLC Purchases 9,920 Shares of Trane Technologies plc $TT - MarketBeat",MarketBeat
"Sun, 07 Dec 2025 14:41:57 GMT",TT nat'l ranking c'ships to be held as scheduled amidst airline crisis - MSN,MSN
"Fri, 05 Dec 2025 17:25:19 GMT",UK Club and TT Club target 2027 deadline for merger - Lloyd's List,Lloyd's List
"Fri, 05 Dec 2025 09:56:18 GMT","Brown Advisory Inc. Sells 28,825 Shares of Trane Technologies plc $TT - MarketBeat",MarketBeat
"Thu, 04 Dec 2025 20:01:15 GMT",PepsiCo Nears Deal With Activist Investor Elliott - Transport Topics,Transport Topics
"Wed, 03 Dec 2025 15:47:00 GMT",Yellow Nears Long-Awaited Settlement With Pension Plans - Transport Topics,Transport Topics
"Fri, 05 Dec 2025 09:59:36 GMT",Barclays Reaffirms Their Buy Rating on Trane Technologies (TT) - The Globe and Mail,The Globe and Mail
"Sat, 06 Dec 2025 15:28:47 GMT","Lane Kiffin Demands Payment On Chef's Promise To ""Walk B*tt Naked"" Following Blockbuster LSU Move - College Sports Network",College Sports Network
"Thu, 04 Dec 2025 12:29:55 GMT","Invesco Ltd. Buys 256,486 Shares of Trane Technologies plc $TT - MarketBeat",MarketBeat
"Wed, 03 Dec 2025 11:58:15 GMT",What's Going On With Trane Technologies Stock Wednesday? - Trane Technologies (NYSE:TT) - Benzinga,Benzinga
"Sun, 07 Dec 2025 10:23:54 GMT",Into the Blue: Williamsville teen redefines freediving in TT - Trinidad and Tobago Newsday,Trinidad and Tobago Newsday
"Wed, 03 Dec 2025 11:58:56 GMT",Genuine race-used TT kit from Dean Harrison heads to auction - Visordown,Visordown
"Thu, 04 Dec 2025 11:58:41 GMT",TSX-V: TT appoints Christy Smith to Board of Directors - NAI500,NAI500
"Wed, 03 Dec 2025 15:18:00 GMT",Cash Dividend On The Way From Trane Technologies (TT) - Nasdaq,Nasdaq
"Wed, 03 Dec 2025 14:11:05 GMT",Westerkirk Capital Inc. Invests $1.65 Million in Trane Technologies plc $TT - MarketBeat,MarketBeat
"Wed, 03 Dec 2025 10:18:33 GMT","Groupe la Francaise Buys 44,424 Shares of Trane Technologies plc $TT - MarketBeat",MarketBeat
"Sat, 06 Dec 2025 13:04:32 GMT",Giant Contact Aero Clip On TT Bars Carbon - Bike Hub,Bike Hub
"Sat, 06 Dec 2025 21:38:57 GMT",Best audi tt minichamps Top Sale Minichamps 1 43 Scale 402 173900 Audi TT Smart Cabrio - biznestuba.pl,biznestuba.pl
"Sun, 07 Dec 2025 11:59:00 GMT",The glittering ceremony takes place on January 16 in Belfast when Michael Dunlop is among the leading candidates for the main accolade. - Belfast News Letter,Belfast News Letter
"Sat, 06 Dec 2025 07:13:41 GMT",UTT National Para Ranking TT C’hip: TG’s Hitesh Dolwani clinches men’s singles title - The Hans India,The Hans India
"Sun, 07 Dec 2025 15:23:00 GMT",The famous 7.4-mile course at Dundrod remains the fastest road racing venue in the world as the home of the Ulster Grand Prix. - Belfast News Letter,Belfast News Letter
"Fri, 05 Dec 2025 12:51:38 GMT",TT 2026: Father/Son LBS Racing Team Verified - Road Racing News,Road Racing News
"Thu, 04 Dec 2025 19:42:01 GMT",TT Stock Exchange introduces AI chatbot - Trinidad and Tobago Newsday,Trinidad and Tobago Newsday
"Thu, 04 Dec 2025 17:27:58 GMT",Ex-World Cup goalkeeper Shaka Hislop reveals cancer battle - Trinidad and Tobago Newsday,Trinidad and Tobago Newsday
"Sun, 07 Dec 2025 18:32:21 GMT",Is It Too Early to Call Recovery in TT Limited - Straddle and Strangle Trades & High Return Capital Gains - earlytimes.in,earlytimes.in
"Fri, 05 Dec 2025 00:30:28 GMT","Public School, Jagadhri, lad Daksh TT champ - Tribune India",Tribune India
"Fri, 05 Dec 2025 19:39:33 GMT",TT Nat'l Ranking C'ships to be held as scheduled amidst airline crisis - The New Indian Express,The New Indian Express
"Thu, 04 Dec 2025 23:07:47 GMT",TT Vision Holdings Berhad's (KLSE:TTVHB) Profits Appear To Have Quality Issues - simplywall.st,simplywall.st
2025-12-07T15:00:08,Institutional owners may take dramatic actions as Trane Technologies plc's (NYSE:TT) recent 4.8% drop adds to one-year losses,Yahoo
2025-12-03T08:10:01,Assessing Trane Technologies After Its Strong Multi Year Rally and Recent Share Price Pullback,Yahoo
