Date,Title,Source
"Tue, 28 Oct 2025 01:14:43 GMT","QCOM To Take On AMD, Nvidia With New Data Center AI Chips - Stocktwits",Stocktwits
"Mon, 27 Oct 2025 14:00:47 GMT","Qualcomm looks to take on Nvidia, AMD as it enters AI accelerator market (QCOM:NASDAQ) - Seeking Alpha",Seeking Alpha
"Tue, 28 Oct 2025 05:52:17 GMT","QUALCOMM Incorporated (NASDAQ:QCOM) Receives Consensus Rating of ""Moderate Buy"" from Brokerages - MarketBeat",MarketBeat
"Mon, 27 Oct 2025 14:54:30 GMT",AMD Stock Is Unfazed by Qualcomm’s (QCOM) AI Server Plans - TipRanks,TipRanks
"Mon, 27 Oct 2025 15:29:18 GMT",Qualcomm (QCOM) stock soars as company challenges Nvidia with new AI data center chips - Dataconomy,Dataconomy
"Mon, 27 Oct 2025 22:07:53 GMT",Qualcomm: Room For One More? (NASDAQ:QCOM) - Seeking Alpha,Seeking Alpha
"Mon, 27 Oct 2025 21:45:49 GMT","Qualcomm (QCOM) Stock Trades Up, Here Is Why - Yahoo Finance",Yahoo Finance
"Mon, 27 Oct 2025 23:08:32 GMT",Why QCOM Is Rallying After Saudi Arabia AI Deal and China’s Autotalks Probe – What’s Next - Yahoo Finance,Yahoo Finance
"Tue, 28 Oct 2025 05:45:53 GMT",Can QCOM stock resist sector downturns - July 2025 Rallies & Community Supported Trade Ideas - newser.com,newser.com
"Mon, 27 Oct 2025 19:30:00 GMT",Qualcomm (QCOM) Surges on the Next Evolution in the AI Chip Race - Cabot Wealth Network,Cabot Wealth Network
"Mon, 27 Oct 2025 19:31:52 GMT",Qualcomm Is Going Head to Head with Nvidia on New AI Chips. Should You Buy QCOM Stock Here? - Barchart.com,Barchart.com
"Mon, 27 Oct 2025 20:29:08 GMT",Qualcomm (QCOM) Stock Surges On New AI Data Center Chip Announcement: What Investors Need To Know - Benzinga,Benzinga
"Tue, 28 Oct 2025 06:37:45 GMT",Why QCOM stock is popular among millennials - Weekly Volume Report & Growth Focused Investment Plans - newser.com,newser.com
"Tue, 28 Oct 2025 02:18:40 GMT","AMZN, SOFI, GPUS, CLS, QCOM: 5 Trending Stocks Today - Amazon.com (NASDAQ:AMZN) - Benzinga",Benzinga
"Mon, 27 Oct 2025 17:40:54 GMT",Qualcomm Vs. Nvidia And AMD: The AI Battle Just Got Bigger (NASDAQ:QCOM) - Seeking Alpha,Seeking Alpha
"Tue, 28 Oct 2025 05:43:36 GMT",Using RSI to spot recovery in QCOM - Analyst Downgrade & Long Hold Capital Preservation Tips - newser.com,newser.com
"Tue, 28 Oct 2025 04:22:51 GMT",Applying sector rotation models to QCOM - July 2025 Trade Ideas & Daily Stock Momentum Reports - newser.com,newser.com
"Tue, 28 Oct 2025 05:54:53 GMT",How to monitor QCOM with trend dashboards - Earnings Recap Report & Consistent Return Strategy Ideas - newser.com,newser.com
"Tue, 28 Oct 2025 02:17:06 GMT",How QCOM stock reacts to oil prices - 2025 Geopolitical Influence & Verified Momentum Stock Alerts - newser.com,newser.com
"Mon, 27 Oct 2025 18:50:21 GMT",QUALCOMM (NASDAQ:QCOM) Price Target Raised to $175.00 - MarketBeat,MarketBeat
"Tue, 28 Oct 2025 03:21:11 GMT",Using RSI to spot recovery in QCOM - Gap Up & Free High Accuracy Swing Entry Alerts - newser.com,newser.com
"Mon, 27 Oct 2025 15:28:31 GMT",Qualcomm Stock (QCOM) Skyrockets after Announcing Plans to Launch AI Chips - TipRanks,TipRanks
"Mon, 27 Oct 2025 21:11:18 GMT",QUALCOMM (NASDAQ:QCOM) Trading Up 11.1% Following Analyst Upgrade - MarketBeat,MarketBeat
"Mon, 27 Oct 2025 14:47:00 GMT",$QCOM stock is up 19% today. Here's what we see in our data. - Quiver Quantitative,Quiver Quantitative
"Mon, 27 Oct 2025 15:24:00 GMT","Biggest stock movers Monday: RNA, QCOM, OGN, mining stocks, and more - Seeking Alpha",Seeking Alpha
"Mon, 27 Oct 2025 18:56:15 GMT",Qualcomm (QCOM) Could Net $2B from AI Chip Deal with Saudi Arabia’s Humain - TipRanks,TipRanks
"Mon, 27 Oct 2025 17:16:10 GMT",QUALCOMM (NASDAQ:QCOM) Sets New 52-Week High - Should You Buy? - MarketBeat,MarketBeat
"Tue, 28 Oct 2025 06:00:49 GMT",Signal strength of QCOM stock in tech scanners - Forecast Cut & Advanced Technical Analysis Signals - newser.com,newser.com
"Mon, 27 Oct 2025 21:54:50 GMT","Qualcomm (QCOM) Launches AI Chip, Competing with NVIDIA and AMD - GuruFocus",GuruFocus
"Mon, 27 Oct 2025 18:59:39 GMT",Qualcomm (QCOM) Surges as AI Chip Plans Unveiled - GuruFocus,GuruFocus
"Tue, 28 Oct 2025 05:31:53 GMT",Live market analysis of QCOM - 2025 Fundamental Recap & Free Fast Entry Momentum Trade Alerts - newser.com,newser.com
"Tue, 28 Oct 2025 04:55:08 GMT",Live market analysis of QCOM - July 2025 Momentum & Safe Investment Capital Preservation Plans - newser.com,newser.com
"Mon, 27 Oct 2025 18:47:16 GMT","QCOM: UBS Maintains Neutral Rating, Raises Price Target to $175 - GuruFocus",GuruFocus
"Mon, 27 Oct 2025 19:41:15 GMT",Qualcomm (QCOM) Shares Surge on New AI Processor Launch - GuruFocus,GuruFocus
"Mon, 27 Oct 2025 14:32:17 GMT",Qualcomm (QCOM) Stock Explodes 15% on New AI Data Center Play - parameter.io,parameter.io
"Mon, 27 Oct 2025 11:02:09 GMT",QUALCOMM Incorporated $QCOM Stock Position Lifted by Guinness Asset Management LTD - MarketBeat,MarketBeat
"Mon, 27 Oct 2025 16:34:08 GMT",Qualcomm (QCOM) Gains Attention with New AI Chip Offerings - GuruFocus,GuruFocus
"Mon, 27 Oct 2025 17:21:50 GMT",Qualcomm Stock Price (NASDAQ:QCOM) Soars 19% to $190 After AI200 Launch and Saudi AI Pact - TradingNEWS,TradingNEWS
"Mon, 27 Oct 2025 16:11:50 GMT","Stock Market Today: QCOM Stock, Nvidia, Tesla Rally as Dow Hits 47,458 and Nasdaq Surges to 23,569 - TradingNEWS",TradingNEWS
"Mon, 27 Oct 2025 17:17:00 GMT","Qualcomm (QCOM) announces new AI chips, competing directly with AMD & NVIDIA - Shacknews",Shacknews
2025-10-27T19:07:53,Qualcomm: Room For One More?,SeekingAlpha
2025-10-27T18:28:04,Qualcomm to Launch New AI Chips; Discloses Partnership With Saudi Arabia's Humain,Yahoo
2025-10-27T18:11:59,"New Qualcomm chips, Tesla board defends Elon Musk's $1T pay",Yahoo
2025-10-27T15:42:44,Qualcomm stock jumps after unveiling new AI chips to challenge Nvidia,Yahoo
2025-10-27T15:34:08,"Qualcomm unveils 2 new chips, part of foray into AI data centers",Yahoo
2025-10-27T15:20:23,"Wall Street Lunch: Qualcomm Enters Into AI Accelerator Market To Take On Nvidia, AMD",SeekingAlpha
2025-10-27T14:40:54,Qualcomm Vs. Nvidia And AMD: The AI Battle Just Got Bigger,SeekingAlpha
2025-10-23T16:19:00,GLW vs. QCOM: Which Tech-Materials Stock is the Better Buy Now?,Yahoo
2025-10-27T16:26:23,Little QCOM gain,Reddit/r/wallstreetbets
2025-10-27T16:09:36,Thank you $QCOM,Reddit/r/wallstreetbets
