Date,Title,Source
2025-09-28T19:43:00Z,"SNPS Investor News: If You Have Suffered Losses in Synopsys, Inc. (NASDAQ: SNPS), You Are Encouraged to Contact The Rosen Law Firm About Your Rights",GlobeNewswire
2025-09-25T18:48:00Z,"Synopsys, Inc. (SNPS) Shares Suffer Worst Day Ever Amid Q325 Results Revealing Problems With Major Foundry Customer -- Hagens Berman",GlobeNewswire
2025-09-25T14:00:00Z,High-density LD-based structural variations analysis in ten Native and Mestizo Mexican populations,Plos.org
"Tue, 30 Sep 2025 01:05:00 GMT","Securities Fraud Investigation Into Synopsys, Inc. (SNPS) - GlobeNewswire",GlobeNewswire
"Sat, 27 Sep 2025 13:38:10 GMT",How Investors May Respond To Synopsys (SNPS) Expanding AI Design Collaboration With TSMC - Yahoo Finance,Yahoo Finance
"Mon, 29 Sep 2025 10:26:05 GMT","GC Wealth Management RIA LLC Invests $6.75 Million in Synopsys, Inc. $SNPS - MarketBeat",MarketBeat
"Sat, 27 Sep 2025 22:24:46 GMT","Synopsys (SNPS): Evaluating Valuation After Earnings Miss and Lowered Outlook on China, Intel Headwinds - simplywall.st",simplywall.st
"Sun, 28 Sep 2025 14:00:00 GMT","INVESTOR ALERT: Pomerantz Law Firm Investigates Claims On Behalf of Investors of Synopsys, Inc. - SNPS - PR Newswire",PR Newswire
"Sun, 28 Sep 2025 20:08:32 GMT",SNPS Investor News: If You Have Suffered Losses in - GlobeNewswire,GlobeNewswire
"Mon, 29 Sep 2025 10:14:12 GMT","Generate Investment Management Ltd Has $4.99 Million Holdings in Synopsys, Inc. $SNPS - MarketBeat",MarketBeat
"Thu, 25 Sep 2025 13:30:02 GMT",Is Synopsys (SNPS) a Buy as Wall Street Analysts Look Optimistic? - Yahoo Finance,Yahoo Finance
"Sun, 28 Sep 2025 09:57:33 GMT","Perigon Wealth Management LLC Purchases 527 Shares of Synopsys, Inc. $SNPS - MarketBeat",MarketBeat
"Thu, 25 Sep 2025 18:52:42 GMT","Synopsys, Inc. (SNPS) Shares Suffer Worst Day Ever Amid - GlobeNewswire",GlobeNewswire
"Sat, 27 Sep 2025 11:21:11 GMT","4,443 Shares in Synopsys, Inc. $SNPS Acquired by First American Bank - MarketBeat",MarketBeat
"Sat, 27 Sep 2025 11:01:08 GMT","TD Private Client Wealth LLC Cuts Holdings in Synopsys, Inc. $SNPS - MarketBeat",MarketBeat
"Sat, 27 Sep 2025 11:02:29 GMT","True North Advisors LLC Has $235,000 Stock Position in Synopsys, Inc. $SNPS - MarketBeat",MarketBeat
"Sat, 27 Sep 2025 11:02:17 GMT","Synopsys, Inc. $SNPS Shares Sold by Banque Pictet & Cie SA - MarketBeat",MarketBeat
"Fri, 26 Sep 2025 11:03:21 GMT","Congress Asset Management Co. Sells 3,101 Shares of Synopsys, Inc. $SNPS - MarketBeat",MarketBeat
"Thu, 25 Sep 2025 15:45:00 GMT","Noteworthy ETF Outflows: RSP, PSKY, SNPS, CRWD - Nasdaq",Nasdaq
"Thu, 25 Sep 2025 08:36:41 GMT","Synopsys, Inc. $SNPS Shares Bought by Norden Group LLC - MarketBeat",MarketBeat
"Thu, 25 Sep 2025 11:15:18 GMT","MEAG MUNICH ERGO Kapitalanlagegesellschaft mbH Reduces Stock Holdings in Synopsys, Inc. $SNPS - MarketBeat",MarketBeat
"Mon, 29 Sep 2025 22:05:35 GMT",Automated trading signals detected on SNPS - Share Buyback & Weekly Watchlist for Consistent Profits - newser.com,newser.com
"Mon, 29 Sep 2025 18:41:16 GMT",Custom strategy builders for tracking SNPS - July 2025 Big Picture & Low Drawdown Investment Ideas - newser.com,newser.com
"Mon, 29 Sep 2025 14:59:14 GMT",Is SNPS stock bottoming out - Trade Signal Summary & Short-Term High Return Strategies - newser.com,newser.com
"Mon, 29 Sep 2025 18:54:28 GMT",Is SNPS stock affected by interest rate hikes - 2025 Market Sentiment & Fast Moving Market Watchlists - newser.com,newser.com
"Mon, 29 Sep 2025 12:03:34 GMT",Automated trading signals detected on SNPS - Weekly Trade Summary & AI Enhanced Market Trend Forecasts - newser.com,newser.com
"Mon, 29 Sep 2025 09:33:46 GMT",SNPS stock retracement – recovery analysis - July 2025 Highlights & High Accuracy Investment Entry Signals - newser.com,newser.com
"Mon, 29 Sep 2025 13:19:16 GMT",Is SNPS stock bottoming out - Profit Target & Intraday High Probability Setup Alerts - newser.com,newser.com
"Mon, 29 Sep 2025 02:27:16 GMT",Custom strategy builders for tracking SNPS - 2025 Market Trends & Safe Swing Trade Setups - newser.com,newser.com
"Mon, 29 Sep 2025 12:26:09 GMT",Automated trading signals detected on SNPS - July 2025 Decliners & Precise Entry and Exit Recommendations - newser.com,newser.com
"Mon, 29 Sep 2025 13:07:53 GMT",SNPS stock retracement – recovery analysis - July 2025 EndofMonth & Community Consensus Stock Picks - newser.com,newser.com
"Mon, 29 Sep 2025 04:59:54 GMT",Is SNPS stock bottoming out - Quarterly Trade Report & Daily Stock Trend Reports - newser.com,newser.com
"Mon, 29 Sep 2025 07:20:44 GMT",Custom strategy builders for tracking SNPS - Weekly Investment Report & Free Risk Controlled Daily Trade Plans - newser.com,newser.com
2025-09-29T15:00:00,Synopsys Introduces Digital Twin Racetrack and NVIDIA Omniverse to STEM Racing,Yahoo
2025-09-27T15:38:10,How Investors May Respond To Synopsys (SNPS) Expanding AI Design Collaboration With TSMC,Yahoo
2025-09-25T15:30:02,Is Synopsys (SNPS) a Buy as Wall Street Analysts Look Optimistic?,Yahoo
