Date,Title,Source
2025-10-17T15:44:50Z,Change of His Majesty’s Ambassador to Libya: Martin Reynolds,Www.gov.uk
2025-10-17T14:24:19Z,"Morgan Stanley, Truist, Stephens Cut Chipotle (CMG) PT Due to Expected Soft Q3 2025 Performance",Biztoc.com
2025-10-17T14:00:22Z,"Morgan Stanley, Truist, Stephens Cut Chipotle (CMG) PT Due to Expected Soft Q3 2025 Performance",Yahoo Entertainment
"Tue, 21 Oct 2025 00:22:21 GMT","CMG Worldwide Teams With Loti AI to Protect IP for Estates of Burt Reynolds, Jimmy Stewart, Judy Garland and More (EXCLUSIVE) - AOL.com",AOL.com
"Tue, 21 Oct 2025 00:20:22 GMT",Why CMG stock is listed among top recommendations - 2025 Institutional Moves & High Win Rate Trade Tips - nchmf.gov.vn,nchmf.gov.vn
"Mon, 20 Oct 2025 14:25:00 GMT",Chipotle (NYSE: CMG) Stock Price Prediction and Forecast 2025-2030 (Oct 2025) - 24/7 Wall St.,24/7 Wall St.
"Mon, 20 Oct 2025 23:44:05 GMT",Can CMG Cleantech S.A. (6PV) stock sustain breakout momentum - Earnings Recap Summary & Fast Entry High Yield Tips - newser.com,newser.com
"Mon, 20 Oct 2025 14:25:40 GMT",UBS warns Chipotle could fall short of expectations with its Q3 earnings report (CMG:NYSE) - Seeking Alpha,Seeking Alpha
"Mon, 20 Oct 2025 17:19:51 GMT","UBS Maintains Buy Rating on CMG, Lowers Price Target | CMG Stock News - GuruFocus",GuruFocus
"Fri, 17 Oct 2025 14:00:22 GMT","Morgan Stanley, Truist, Stephens Cut Chipotle (CMG) PT Due to Expected Soft Q3 2025 Performance - Yahoo Finance",Yahoo Finance
"Mon, 20 Oct 2025 09:39:13 GMT","SoFi Technologies, Inc. $SOFI Shares Purchased by CMG Global Holdings LLC - MarketBeat",MarketBeat
"Tue, 21 Oct 2025 06:50:32 GMT",Can CMG Cleantech S.A. (6PV) stock sustain breakout momentum - July 2025 PreEarnings & Verified Technical Trade Signals - newser.com,newser.com
"Mon, 20 Oct 2025 10:10:19 GMT",Why CMG stock is listed among top recommendations - Trade Exit Summary & Verified Momentum Watchlists - nchmf.gov.vn,nchmf.gov.vn
"Mon, 20 Oct 2025 08:40:59 GMT","CMG Global Holdings LLC Purchases 14,682 Shares of The Boeing Company $BA - MarketBeat",MarketBeat
"Thu, 16 Oct 2025 13:30:00 GMT",CMG vs. MCD: Which Restaurant Stock Is the Better Buy for Now? - Yahoo Finance,Yahoo Finance
"Mon, 20 Oct 2025 15:04:50 GMT",Chipotle (CMG) Faces Potential Earnings and Guidance Shortfall - GuruFocus,GuruFocus
"Tue, 21 Oct 2025 06:27:11 GMT",Will Kesselrun Resources Ltd. (CMG) stock rise with strong economy - 2025 AllTime Highs & Verified Chart Pattern Trade Signals - newser.com,newser.com
"Mon, 20 Oct 2025 06:57:46 GMT",Why CMG stock is listed among top recommendations - Market Performance Summary & Consistent Return Strategy Ideas - nchmf.gov.vn,nchmf.gov.vn
"Mon, 20 Oct 2025 08:59:08 GMT",CMG Global Holdings LLC Increases Holdings in GE Aerospace $GE - MarketBeat,MarketBeat
"Mon, 20 Oct 2025 11:45:51 GMT",Chipotle Mexican Grill (CMG): Keybanc Lowers Price Target to $52 - GuruFocus,GuruFocus
"Mon, 20 Oct 2025 13:19:58 GMT",Why CMG stock is listed among top recommendations - Trade Performance Summary & Community Verified Swing Trade Signals - nchmf.gov.vn,nchmf.gov.vn
"Mon, 20 Oct 2025 22:05:05 GMT",Why Kesselrun Resources Ltd. (CMG) stock stays on buy lists - Index Update & AI Driven Stock Movement Reports - newser.com,newser.com
"Sat, 18 Oct 2025 16:33:33 GMT",Is CMG Cleantech S.A. (6PV) stock good for long term investing - 2025 Biggest Moves & Growth Focused Entry Point Reports - nchmf.gov.vn,nchmf.gov.vn
"Sat, 18 Oct 2025 20:38:36 GMT",(CMG) Strategic Investment Guide (CMG:CA) - news.stocktradersdaily.com,news.stocktradersdaily.com
"Fri, 17 Oct 2025 14:08:38 GMT","Morgan Stanley, Truist, Stephens Cut Chipotle (CMG) PT Due to Expected Soft Q3 2025 Performance - Insider Monkey",Insider Monkey
"Thu, 16 Oct 2025 20:45:04 GMT",Is Softer Traffic and Slower Sales Growth Altering the Investment Case for Chipotle Mexican Grill (CMG)? - simplywall.st,simplywall.st
"Sun, 19 Oct 2025 10:28:55 GMT",Should You Consider Adding Chipotle Mexican Grill (CMG) to Your Portfolio? - MSN,MSN
"Thu, 16 Oct 2025 16:45:02 GMT",CMG Analyst Update: Raymond James Reiterates Rating but Lowers P - GuruFocus,GuruFocus
"Thu, 16 Oct 2025 13:38:31 GMT",Wells Fargo Lowers Price Target for Chipotle (CMG) While Maintai - GuruFocus,GuruFocus
"Thu, 16 Oct 2025 12:31:00 GMT","Raymond James Maintains Chipotle Mexican Grill(CMG.US) With Buy Rating, Cuts Target Price to $52 - 富途牛牛",富途牛牛
"Tue, 21 Oct 2025 01:50:24 GMT",Why Chipotle Mexican Grill (CMG) Dipped More Than Broader Market Today - MSN,MSN
"Tue, 21 Oct 2025 06:11:22 GMT",Chipotle Mexican Grill (NYSE:CMG) Given New $52.00 Price Target at KeyCorp - Defense World,Defense World
"Mon, 20 Oct 2025 17:39:13 GMT",SPDR S&P MidCap 400 ETF Trust $MDY Stock Position Raised by CMG Global Holdings LLC - Defense World,Defense World
"Mon, 20 Oct 2025 14:54:30 GMT","CMG Global Holdings LLC Sells 1,150 Shares of Sterling Infrastructure, Inc. $STRL - Defense World",Defense World
"Mon, 20 Oct 2025 10:01:11 GMT",CMG Global Holdings LLC Increases Stock Holdings in iShares MSCI EAFE ETF $EFA - Defense World,Defense World
"Mon, 20 Oct 2025 10:01:11 GMT",iShares Russell 2000 ETF $IWM Shares Acquired by CMG Global Holdings LLC - Defense World,Defense World
"Mon, 20 Oct 2025 07:21:04 GMT","CMG Global Holdings LLC Acquires Shares of 4,275 Vanguard Information Technology ETF $VGT - Defense World",Defense World
"Mon, 20 Oct 2025 09:26:08 GMT",Vanguard Total Stock Market ETF $VTI Stock Holdings Lessened by CMG Global Holdings LLC - Defense World,Defense World
"Sat, 18 Oct 2025 06:25:35 GMT",Chipotle Mexican Grill (NYSE:CMG) Earns Outperform Rating from Raymond James Financial - Defense World,Defense World
"Sat, 18 Oct 2025 06:25:35 GMT",Morgan Stanley Cuts Chipotle Mexican Grill (NYSE:CMG) Price Target to $59.00 - Defense World,Defense World
"Sat, 18 Oct 2025 06:25:35 GMT",Wells Fargo & Company Has Lowered Expectations for Chipotle Mexican Grill (NYSE:CMG) Stock Price - Defense World,Defense World
"Thu, 16 Oct 2025 11:41:43 GMT",CMG gala brings China’s Mid-Autumn charm to the world - Mapepeza News,Mapepeza News
2025-10-21T02:06:50,UBS Maintains Chipotle Mexican Grill (CMG) Buy Recommendation,Fintel
2025-10-20T14:04:50,Keybanc Maintains Chipotle Mexican Grill (CMG) Overweight Recommendation,Fintel
2025-10-17T16:00:22,"Morgan Stanley, Truist, Stephens Cut Chipotle (CMG) PT Due to Expected Soft Q3 2025 Performance",Yahoo
2025-10-17T02:06:54,Wells Fargo Maintains Chipotle Mexican Grill (CMG) Overweight Recommendation,Fintel
2025-10-17T02:04:23,Raymond James Reiterates Chipotle Mexican Grill (CMG) Outperform Recommendation,Fintel
2025-10-16T15:30:00,CMG vs. MCD: Which Restaurant Stock Is the Better Buy for Now?,Yahoo
