Date,Title,Source
"Tue, 04 Nov 2025 21:20:44 GMT",Arista Networks falls on Q3 results despite 27% revenue growth (ANET:NYSE) - Seeking Alpha,Seeking Alpha
"Wed, 05 Nov 2025 05:03:00 GMT",Arista Networks Inc (ANET) Q3 2025 Earnings Call Highlights: Record Revenue Growth Amid AI and ... - Yahoo Finance,Yahoo Finance
"Tue, 04 Nov 2025 22:41:15 GMT",Live: Complete Arista Networks (ANET) Q3 Earnings - 24/7 Wall St.,24/7 Wall St.
"Wed, 05 Nov 2025 07:04:26 GMT",Is ANET stock a safe investment in uncertain markets - Weekly Stock Recap & Safe Investment Capital Preservation Plans - newser.com,newser.com
"Wed, 05 Nov 2025 06:06:40 GMT",Arista Networks (ANET) Surpasses Q3 Earnings and Revenue Expecta - GuruFocus,GuruFocus
"Tue, 04 Nov 2025 22:20:42 GMT",Arista Networks (NYSE:ANET) Stock Price Down 2.7% on Disappointing Earnings - MarketBeat,MarketBeat
"Tue, 04 Nov 2025 22:53:00 GMT",Arista Networks Reports Q3 Results: Details - Arista Networks (NYSE:ANET) - Benzinga,Benzinga
"Tue, 04 Nov 2025 22:15:02 GMT",Arista Networks (ANET) Q3 Earnings and Revenues Beat Estimates - Yahoo! Finance Canada,Yahoo! Finance Canada
"Wed, 05 Nov 2025 05:12:36 GMT",Arista Networks Inc (ANET) Q3 2025 Earnings Call Highlights: Record Revenue Growth Amid AI and Cloud Expansion - GuruFocus,GuruFocus
"Wed, 05 Nov 2025 05:27:40 GMT",Combining machine learning predictions for ANET - July 2025 PreEarnings & Long-Term Capital Growth Strategies - newser.com,newser.com
"Wed, 05 Nov 2025 00:41:48 GMT",Arista Networks (ANET) Reports Strong Q3 Results but Shares Drop 10% - GuruFocus,GuruFocus
"Tue, 04 Nov 2025 21:59:39 GMT",Arista Networks (ANET) Shares Drop Despite Beating Q3 Estimates - GuruFocus,GuruFocus
"Tue, 04 Nov 2025 22:56:53 GMT",Arista Networks (ANET) Shares Drop Following Q3 Results and Outl - GuruFocus,GuruFocus
"Tue, 04 Nov 2025 22:57:00 GMT",Arista Networks (ANET) Exceeds Q3 Revenue Expectations - GuruFocus,GuruFocus
"Tue, 04 Nov 2025 22:56:57 GMT",Arista Networks (ANET) Projects Strong Margins for Q4 - GuruFocus,GuruFocus
"Tue, 04 Nov 2025 22:03:40 GMT",Arista Networks (ANET) Surpasses Q3 Earnings Expectations - GuruFocus,GuruFocus
"Tue, 04 Nov 2025 21:41:31 GMT","Arista Networks Inc (ANET) Q3 2025 Earnings: EPS of $0.67 Beats Estimates, Revenue Surges to $2.308 Billion - GuruFocus",GuruFocus
"Mon, 03 Nov 2025 14:07:00 GMT",Arista Networks Stock (ANET) Opinions on AI Growth and R4 Series Launch - Quiver Quantitative,Quiver Quantitative
"Tue, 04 Nov 2025 21:45:30 GMT","Arista Networks (NYSE:ANET) Releases Earnings Results, Misses Expectations By $0.05 EPS - MarketBeat",MarketBeat
"Tue, 04 Nov 2025 19:01:49 GMT",Arista Networks (ANET) Added to Evercore ISI's Outperform List - GuruFocus,GuruFocus
"Tue, 04 Nov 2025 16:34:02 GMT",(ANET) Price Dynamics and Execution-Aware Positioning - news.stocktradersdaily.com,news.stocktradersdaily.com
"Tue, 04 Nov 2025 13:17:15 GMT","Milestone Asset Management LLC Lowers Stake in Arista Networks, Inc. $ANET - MarketBeat",MarketBeat
"Tue, 04 Nov 2025 21:35:38 GMT","(ANET) Arista Networks Expects Q4 Revenue of $2.3 Billion - $2.4 Billion, vs. FactSet Est of $2.33 Billion - MarketScreener",MarketScreener
"Tue, 04 Nov 2025 01:21:43 GMT",Why ANET stock is upgraded to buy - Weekly Risk Report & Growth-Oriented Investment Plans - newser.com,newser.com
"Mon, 03 Nov 2025 00:37:37 GMT",Arista Networks (ANET): Evaluating Valuation Following R4 Series Launch for AI and Data Center Networking - simplywall.st,simplywall.st
"Tue, 04 Nov 2025 10:28:22 GMT","iA Global Asset Management Inc. Decreases Position in Arista Networks, Inc. $ANET - MarketBeat",MarketBeat
"Mon, 03 Nov 2025 16:07:46 GMT",Arista Networks (ANET) Set to Report Q3 Earnings with Strong Tra - GuruFocus,GuruFocus
"Mon, 03 Nov 2025 02:47:23 GMT",Is ANET stock a safe investment in uncertain markets - July 2025 Breakouts & Long Hold Capital Preservation Plans - newser.com,newser.com
"Mon, 03 Nov 2025 10:21:48 GMT","Versor Investments LP Trims Position in Arista Networks, Inc. $ANET - MarketBeat",MarketBeat
"Sun, 02 Nov 2025 18:02:48 GMT",Is ANET stock attractive for long term wealth building - Stop Loss & Daily Stock Momentum Reports - newser.com,newser.com
"Mon, 03 Nov 2025 12:37:21 GMT","KDT Advisors LLC Invests $223,000 in Arista Networks, Inc. $ANET - MarketBeat",MarketBeat
"Mon, 03 Nov 2025 09:31:34 GMT","Pinnacle Associates Ltd. Purchases 7,924 Shares of Arista Networks, Inc. $ANET - MarketBeat",MarketBeat
"Mon, 03 Nov 2025 10:06:00 GMT","Lifeworks Advisors LLC Sells 1,889 Shares of Arista Networks, Inc. $ANET - MarketBeat",MarketBeat
"Mon, 03 Nov 2025 10:41:47 GMT","Wakefield Asset Management LLLP Acquires Shares of 2,574 Arista Networks, Inc. $ANET - MarketBeat",MarketBeat
"Sun, 02 Nov 2025 08:45:11 GMT",What makes ANET stock attractive to growth funds - July 2025 EndofMonth & Fast Entry High Yield Stock Tips - newser.com,newser.com
"Sun, 02 Nov 2025 05:56:12 GMT",What makes ANET stock attractive to growth funds - Weekly Volume Report & Entry and Exit Point Strategies - newser.com,newser.com
"Sun, 02 Nov 2025 18:03:05 GMT",Why ANET stock could rally strongly - Market Performance Report & Community Shared Stock Ideas - newser.com,newser.com
"Tue, 04 Nov 2025 07:27:30 GMT",Why ANET stock is upgraded to buy - July 2025 Decliners & Stepwise Swing Trade Plans - newser.com,newser.com
"Tue, 04 Nov 2025 07:18:35 GMT",Is ANET stock overpriced at current multiples - July 2025 Spike Watch & Weekly Top Performers Watchlists - newser.com,newser.com
"Sun, 02 Nov 2025 09:27:53 GMT","Atria Investments Inc Trims Stock Holdings in Arista Networks, Inc. $ANET - MarketBeat",MarketBeat
"Tue, 04 Nov 2025 07:16:55 GMT",Will ANET stock recover faster than peers - 2025 Breakouts & Breakdowns & Precise Buy Zone Tips - newser.com,newser.com
"Sun, 02 Nov 2025 09:37:51 GMT","Savvy Advisors Inc. Makes New $336,000 Investment in Arista Networks, Inc. $ANET - MarketBeat",MarketBeat
"Sun, 02 Nov 2025 08:55:47 GMT","World Investment Advisors Sells 2,688 Shares of Arista Networks, Inc. $ANET - MarketBeat",MarketBeat
"Sun, 02 Nov 2025 10:36:08 GMT","Syverson Strege & Co Purchases Shares of 2,166 Arista Networks, Inc. $ANET - MarketBeat",MarketBeat
"Sun, 02 Nov 2025 11:34:25 GMT","Triglav Investments D.O.O. Buys 10,000 Shares of Arista Networks, Inc. $ANET - MarketBeat",MarketBeat
"Mon, 03 Nov 2025 11:24:31 GMT",Why ANET stock remains a top recommendation - Market Volume Report & Entry Point Confirmation Signals - newser.com,newser.com
"Mon, 03 Nov 2025 09:22:15 GMT",Will ANET stock split again soon - Market Growth Review & Free Community Consensus Stock Picks - newser.com,newser.com
"Sat, 01 Nov 2025 16:47:27 GMT",Tick level data insight on ANET volatility - Portfolio Value Report & Stepwise Swing Trade Plans - newser.com,newser.com
"Mon, 03 Nov 2025 14:03:04 GMT",Can ANET stock attract ESG capital inflows - Portfolio Risk Report & Fast Exit and Entry Trade Guides - newser.com,newser.com
"Sat, 01 Nov 2025 09:39:56 GMT","Arista Networks, Inc. $ANET Shares Bought by Kovack Advisors Inc. - MarketBeat",MarketBeat
"Mon, 03 Nov 2025 10:21:49 GMT","TIAA Trust National Association Lowers Stock Holdings in Arista Networks, Inc. $ANET - MarketBeat",MarketBeat
"Tue, 04 Nov 2025 09:53:13 GMT",Arista Networks Stock (ANET) Builds Momentum Ahead of Earnings - AskTraders.com,AskTraders.com
"Mon, 03 Nov 2025 18:20:16 GMT","Evercore Maintains Arista Networks(ANET.US) With Buy Rating, Maintains Target Price $175 - 富途牛牛",富途牛牛
"Sat, 01 Nov 2025 11:05:12 GMT","Aviance Capital Partners LLC Buys New Shares in Arista Networks, Inc. $ANET - MarketBeat",MarketBeat
"Sat, 01 Nov 2025 10:06:04 GMT","Arista Networks, Inc. $ANET Shares Purchased by Great Lakes Retirement Inc. - MarketBeat",MarketBeat
"Sat, 01 Nov 2025 09:15:05 GMT","Earned Wealth Advisors LLC Cuts Stake in Arista Networks, Inc. $ANET - MarketBeat",MarketBeat
"Fri, 31 Oct 2025 10:47:44 GMT",Is ANET stock overpriced at current multiples - 2025 Price Momentum & Community Verified Trade Alerts - newser.com,newser.com
"Sun, 02 Nov 2025 07:08:13 GMT",How risky is ANET stock compared to peers - Weekly Stock Recap & Expert Verified Stock Movement Alerts - newser.com,newser.com
"Sun, 02 Nov 2025 17:07:41 GMT",Why pension funds invest in ANET stock - July 2025 PostEarnings & Free Real-Time Volume Trigger Notifications - newser.com,newser.com
"Fri, 31 Oct 2025 09:25:54 GMT","Keybank National Association OH Sells 2,024 Shares of Arista Networks, Inc. $ANET - MarketBeat",MarketBeat
"Fri, 31 Oct 2025 09:22:59 GMT","Assetmark Inc. Acquires 55,766 Shares of Arista Networks, Inc. $ANET - MarketBeat",MarketBeat
"Fri, 31 Oct 2025 09:41:38 GMT","Simon Quick Advisors LLC Grows Stock Position in Arista Networks, Inc. $ANET - MarketBeat",MarketBeat
"Sun, 02 Nov 2025 11:46:28 GMT",Why ANET stock could rally strongly - 2025 Technical Overview & Technical Pattern Alert System - newser.com,newser.com
"Fri, 31 Oct 2025 08:32:23 GMT","Arista Networks, Inc. $ANET Shares Sold by Jennison Associates LLC - MarketBeat",MarketBeat
"Fri, 31 Oct 2025 08:23:27 GMT","Bessemer Group Inc. Sells 5,661 Shares of Arista Networks, Inc. $ANET - MarketBeat",MarketBeat
"Fri, 31 Oct 2025 10:15:28 GMT",Can ANET stock reach $100 price target - Portfolio Update Summary & AI Enhanced Trading Signals - newser.com,newser.com
"Tue, 04 Nov 2025 21:39:16 GMT",Arista Networks (ANET) Stock Soars on AI Data Center Boom – Analysts Weigh In - ts2.tech,ts2.tech
"Wed, 05 Nov 2025 07:45:23 GMT",Arista Networks (NYSE:ANET) Shares Down 2.7% on Disappointing Earnings - Defense World,Defense World
2025-11-03T18:24:00,Can These 5 Internet Software Stocks Hit Targets This Earnings Season?,Yahoo
2025-11-03T17:10:00,4 Internet Stocks Poised to Top Estimates This Earnings Season,Yahoo
2025-11-03T12:00:18,An Insider At Arista Networks Lowered Their Holding Recently,Yahoo
