Date,Title,Source
2025-09-15T07:46:53Z,Marvell Technology (NASDAQ:MRVL) Stock Rating Upgraded by Wall Street Zen,ETF Daily News
2025-09-15T06:52:53Z,Recent Investment Analysts’ Ratings Updates for Marvell Technology (MRVL),ETF Daily News
2025-09-12T07:00:55Z,"Marvell Technology, Inc. (NASDAQ:MRVL) Receives Consensus Recommendation of “Moderate Buy” from Analysts",ETF Daily News
2025-09-12T04:55:28Z,Jim Cramer on Marvell: “The Guidance Was Not What I Wanted”,Yahoo Entertainment
2025-09-11T08:29:39Z,"Integrated Wealth Concepts LLC Has $1.19 Million Holdings in Marvell Technology, Inc. $MRVL",ETF Daily News
"Tue, 16 Sep 2025 04:11:59 GMT","Marvell Technology, Inc. $MRVL Position Increased by Siren L.L.C. - MarketBeat",MarketBeat
"Mon, 15 Sep 2025 04:04:00 GMT",3 Reasons MRVL Has Explosive Upside Potential - FinancialContent,FinancialContent
"Mon, 15 Sep 2025 11:00:08 GMT","With 82% ownership, Marvell Technology, Inc. (NASDAQ:MRVL) boasts of strong institutional backing - Yahoo Finance",Yahoo Finance
"Mon, 15 Sep 2025 18:48:11 GMT",Marvell: Undervalued And Poised For Growth (NASDAQ:MRVL) - Seeking Alpha,Seeking Alpha
"Sun, 14 Sep 2025 23:21:05 GMT",Why Marvell Technology (MRVL) Is Up 6.3% After Structera CXL Achieves Industrywide Compatibility Validation - simplywall.st,simplywall.st
"Tue, 16 Sep 2025 04:12:07 GMT","Geneos Wealth Management Inc. Has $914,000 Stake in Marvell Technology, Inc. $MRVL - MarketBeat",MarketBeat
"Tue, 16 Sep 2025 01:07:30 GMT","Modus Advisors LLC Buys New Position in Marvell Technology, Inc. $MRVL - MarketBeat",MarketBeat
"Tue, 16 Sep 2025 01:07:30 GMT","Salem Investment Counselors Inc. Has $2.41 Million Position in Marvell Technology, Inc. $MRVL - MarketBeat",MarketBeat
"Mon, 15 Sep 2025 07:00:00 GMT","Swedbank AB Buys 93,386 Shares of Marvell Technology, Inc. $MRVL - MarketBeat",MarketBeat
"Mon, 15 Sep 2025 09:24:46 GMT","Red Spruce Capital LLC Buys Shares of 25,521 Marvell Technology, Inc. $MRVL - MarketBeat",MarketBeat
"Mon, 15 Sep 2025 11:30:30 GMT","Marvell Technology, Inc. $MRVL Shares Purchased by Parisi Gray Wealth Management - MarketBeat",MarketBeat
"Mon, 15 Sep 2025 07:00:00 GMT","Peterson Wealth Management Sells 4,256 Shares of Marvell Technology, Inc. $MRVL - MarketBeat",MarketBeat
"Mon, 15 Sep 2025 07:00:00 GMT","Woodline Partners LP Reduces Holdings in Marvell Technology, Inc. $MRVL - MarketBeat",MarketBeat
"Mon, 15 Sep 2025 07:00:00 GMT","Private Client Services LLC Acquires Shares of 4,463 Marvell Technology, Inc. $MRVL - MarketBeat",MarketBeat
"Thu, 11 Sep 2025 14:12:00 GMT",Can MRVL Sustain EPS Momentum as AI Competition Heats Up? - Yahoo Finance,Yahoo Finance
"Thu, 11 Sep 2025 11:00:07 GMT","Calculating The Intrinsic Value Of Marvell Technology, Inc. (NASDAQ:MRVL) - Yahoo Finance",Yahoo Finance
"Mon, 15 Sep 2025 07:00:00 GMT","Marvell Technology, Inc. $MRVL Shares Sold by Voya Investment Management LLC - MarketBeat",MarketBeat
"Sun, 14 Sep 2025 11:02:59 GMT","Norway Savings Bank Purchases Shares of 9,825 Marvell Technology, Inc. $MRVL - MarketBeat",MarketBeat
"Sun, 14 Sep 2025 10:40:56 GMT","Wesbanco Bank Inc. Purchases 24,000 Shares of Marvell Technology, Inc. $MRVL - MarketBeat",MarketBeat
"Sun, 14 Sep 2025 14:03:45 GMT","Integrated Wealth Concepts LLC Buys 9,155 Shares of Marvell Technology, Inc. $MRVL - MarketBeat",MarketBeat
"Sun, 14 Sep 2025 07:00:00 GMT","Westbourne Investments Inc. Makes New Investment in Marvell Technology, Inc. $MRVL - MarketBeat",MarketBeat
"Sun, 14 Sep 2025 07:00:00 GMT","Glenview Trust co Cuts Position in Marvell Technology, Inc. $MRVL - MarketBeat",MarketBeat
"Sat, 13 Sep 2025 07:00:00 GMT",Marvell Technology (NASDAQ:MRVL) Trading 1.4% Higher - What's Next? - MarketBeat,MarketBeat
"Sat, 13 Sep 2025 07:00:00 GMT","Alliancebernstein L.P. Has $25.09 Million Stake in Marvell Technology, Inc. $MRVL - MarketBeat",MarketBeat
"Sat, 13 Sep 2025 07:00:00 GMT","30,804 Shares in Marvell Technology, Inc. $MRVL Bought by Ascent Group LLC - MarketBeat",MarketBeat
"Fri, 12 Sep 2025 10:23:17 GMT","SWS Partners Raises Stake in Marvell Technology, Inc. $MRVL - MarketBeat",MarketBeat
"Fri, 12 Sep 2025 23:48:45 GMT","Marvell Technology, Inc. $MRVL Position Increased by Sciencast Management LP - MarketBeat",MarketBeat
"Sun, 14 Sep 2025 10:19:40 GMT","AG2R LA Mondiale Gestion D Actifs Takes $1.99 Million Position in Marvell Technology, Inc. $MRVL - MarketBeat",MarketBeat
"Mon, 15 Sep 2025 20:29:11 GMT",Gainers Report: How does MRVL compare to its peers - Price Action & AI Powered Market Trend Analysis - خودرو بانک,خودرو بانک
"Fri, 12 Sep 2025 07:00:00 GMT",Marvell Technology (NASDAQ:MRVL) Trading Up 2.8% - Should You Buy? - MarketBeat,MarketBeat
"Fri, 12 Sep 2025 07:00:00 GMT","UniSuper Management Pty Ltd Boosts Stock Holdings in Marvell Technology, Inc. $MRVL - MarketBeat",MarketBeat
"Fri, 12 Sep 2025 07:00:00 GMT","Fred Alger Management LLC Purchases 31,926 Shares of Marvell Technology, Inc. $MRVL - MarketBeat",MarketBeat
"Thu, 11 Sep 2025 07:00:00 GMT","USS Investment Management Ltd Raises Stock Position in Marvell Technology, Inc. $MRVL - MarketBeat",MarketBeat
"Thu, 11 Sep 2025 07:00:00 GMT","Select Equity Group L.P. Acquires 37,818 Shares of Marvell Technology, Inc. $MRVL - MarketBeat",MarketBeat
"Thu, 11 Sep 2025 07:00:00 GMT","Temasek Holdings Private Ltd Decreases Stake in Marvell Technology, Inc. $MRVL - MarketBeat",MarketBeat
"Mon, 15 Sep 2025 13:25:21 GMT",AI Stocks: Is MRVL forming higher highs and higher lows - July 2025 Gainers & Reliable Volume Spike Alerts - خودرو بانک,خودرو بانک
"Thu, 11 Sep 2025 07:00:00 GMT","Knightsbridge Asset Management LLC Sells 4,664 Shares of Marvell Technology, Inc. $MRVL - MarketBeat",MarketBeat
"Mon, 15 Sep 2025 21:45:10 GMT",using bollinger bands to evaluate mrvl - Weekly Investment Report & Growth Focused Stock Reports - newser.com,newser.com
"Mon, 15 Sep 2025 10:52:06 GMT",What to expect from MRVL in the next 30 days - Earnings Trend Report & Technical Buy Zone Confirmation - newser.com,newser.com
"Mon, 15 Sep 2025 00:14:33 GMT",Using Bollinger Bands to evaluate MRVL - Analyst Downgrade & Free High Return Stock Watch Alerts - newser.com,newser.com
"Sun, 14 Sep 2025 19:38:29 GMT",MRVL stock trend outlook and recovery path - July 2025 Sentiment & Safe Entry Point Alerts - newser.com,newser.com
"Sun, 14 Sep 2025 09:32:15 GMT",What to expect from MRVL in the next 30 days - Entry Point & Verified Momentum Watchlists - newser.com,newser.com
"Mon, 15 Sep 2025 19:23:19 GMT",Using Bollinger Bands to evaluate MRVL - 2025 AllTime Highs & Accurate Trade Setup Notifications - newser.com,newser.com
"Sun, 14 Sep 2025 18:24:33 GMT",Ranking MRVL among high performing stocks via tools - Market Movers & Weekly Consistent Profit Watchlists - newser.com,newser.com
"Sun, 14 Sep 2025 14:53:48 GMT",Leading vs lagging indicators on MRVL performance - Weekly Trade Summary & Safe Entry Momentum Tips - newser.com,newser.com
"Mon, 15 Sep 2025 07:14:57 GMT",MRVL stock trend outlook and recovery path - 2025 Growth vs Value & Long-Term Growth Plans - newser.com,newser.com
"Sat, 13 Sep 2025 21:49:14 GMT","NASDAQ 100 Worst Performers 2025 YTD: TTD, LULU, MRVL Lead Declines from -61.6% to -21.4% - Blockchain News",Blockchain News
"Mon, 15 Sep 2025 07:01:05 GMT",Recent Investment Analysts’ Ratings Updates for Marvell Technology (MRVL) - Defense World,Defense World
"Sun, 14 Sep 2025 07:39:05 GMT","Integrity Alliance LLC. Takes Position in Marvell Technology, Inc. $MRVL - Defense World",Defense World
"Sun, 14 Sep 2025 08:13:07 GMT","Advisors Capital Management LLC Buys 515 Shares of Marvell Technology, Inc. $MRVL - Defense World",Defense World
2025-09-15T16:48:11,Marvell: Undervalued And Poised For Growth,SeekingAlpha
2025-09-15T14:00:08,"With 82% ownership, Marvell Technology, Inc. (NASDAQ:MRVL) boasts of strong institutional backing",Yahoo
2025-09-15T07:04:10,3 Reasons MRVL Has Explosive Upside Potential,Yahoo
2025-09-12T07:55:28,Jim Cramer on Marvell: “The Guidance Was Not What I Wanted”,Yahoo
2025-09-11T17:12:00,Can MRVL Sustain EPS Momentum as AI Competition Heats Up?,Yahoo
2025-09-11T14:00:07,"Calculating The Intrinsic Value Of Marvell Technology, Inc. (NASDAQ:MRVL)",Yahoo
