Date,Title,Source
2025-08-29T08:44:04Z,efleetscheduler added to PyPI,Pypi.org
2025-08-29T07:54:59Z,"Wellington Management Group LLP Purchases Shares of 77,006 DuPont de Nemours, Inc. $DD",ETF Daily News
2025-08-29T04:47:35Z,Broadcasters body seeks transparent framework for DD Free Dish auction,The Times of India
2025-08-29T02:17:00Z,PREP BOYS TENNIS: Goshen edges Westview 3-2 with three-set win by freshman Beck,Goshen News
2025-08-28T18:00:07Z,How to tell Ubuntu there is a working logical volume on the drive?,Askubuntu.com
2025-08-28T08:06:49Z,"American Century Companies Inc. Acquires 2,659 Shares of DuPont de Nemours, Inc. $DD",ETF Daily News
2025-08-27T09:38:51Z,"Analysts Set DuPont de Nemours, Inc. (NYSE:DD) Target Price at $88.25",ETF Daily News
2025-08-27T08:00:35Z,Itsuno Left CAPCOM Because He Didn’t Want to Make DMC and DD Sequels Until Retirement,Wccftech
2025-08-26T17:43:12Z,arxivory added to PyPI,Pypi.org
2025-08-26T16:00:00Z,REVIEW: Dunkin’ Cereal N’ Milk Latte,Theimpulsivebuy.com
2025-08-26T03:47:00Z,"SOFTBALL: Stringfellow’s blast, 8 strikeouts send Verdigris past Claremore in rare meeting",Claremore Daily Progress
"Thu, 28 Aug 2025 07:00:00 GMT",DD214: What You Need to Know - Military.com,Military.com
"Fri, 29 Aug 2025 07:25:29 GMT",Ready Stock]1 PCS Maxxis Tire 29x2.40 Minion DHR II [3CG/DD/TR] Foldable Mountain Bike Tire - The Michigan Review,The Michigan Review
"Fri, 29 Aug 2025 17:39:01 GMT",Public feedback needed on ND Medicaid waiver for IID/DD services - KX News,KX News
"Sat, 30 Aug 2025 05:20:22 GMT","DuPont de Nemours, Inc. $DD Shares Bought by 1832 Asset Management L.P. - MarketBeat",MarketBeat
"Wed, 27 Aug 2025 21:00:00 GMT",Knox DD direct support professionals: A steady light - Knox Pages,Knox Pages
"Fri, 29 Aug 2025 12:47:30 GMT",What's Going On With DuPont Stock Friday? - DuPont de Nemours (NYSE:DD) - Benzinga,Benzinga
"Wed, 27 Aug 2025 09:00:00 GMT",Perco supports DD levy group - Perry County Tribune,Perry County Tribune
"Fri, 29 Aug 2025 11:13:09 GMT","DuPont to sell Aramids unit, including Kevlar and Nomex brands, in $1.8B deal (DD:NYSE) - Seeking Alpha",Seeking Alpha
"Tue, 26 Aug 2025 20:47:00 GMT",Senior living facility teams up with Board of DD for second annual Luau - Hometown Stations,Hometown Stations
"Thu, 28 Aug 2025 07:06:49 GMT","DD GROUP Co., Ltd. Announces Successful Tender Offer and Shareholder Changes - TipRanks",TipRanks
"Fri, 29 Aug 2025 07:00:00 GMT","DuPont de Nemours, Inc. $DD Shares Sold by Candriam S.C.A. - MarketBeat",MarketBeat
"Fri, 29 Aug 2025 09:54:05 GMT","DuPont de Nemours, Inc. $DD Shares Sold by Caisse DE Depot ET Placement DU Quebec - MarketBeat",MarketBeat
"Thu, 28 Aug 2025 07:00:00 GMT","CW Advisors LLC Acquires 13,240 Shares of DuPont de Nemours, Inc. $DD - MarketBeat",MarketBeat
"Thu, 28 Aug 2025 09:36:54 GMT","Allstate Corp Trims Holdings in DuPont de Nemours, Inc. $DD - MarketBeat",MarketBeat
"Fri, 29 Aug 2025 16:31:00 GMT","BMO Capital Maintains DuPont(DD.US) With Buy Rating, Raises Target Price to $107 - 富途牛牛",富途牛牛
"Sat, 30 Aug 2025 12:47:56 GMT",World’s first gene-edited horses are shaking up the genteel sport of polo - DD News,DD News
"Wed, 27 Aug 2025 07:00:00 GMT","AlphaQuest LLC Buys 3,775 Shares of DuPont de Nemours, Inc. $DD - MarketBeat",MarketBeat
"Wed, 27 Aug 2025 07:00:00 GMT","Quantbot Technologies LP Decreases Stake in DuPont de Nemours, Inc. $DD - MarketBeat",MarketBeat
"Wed, 27 Aug 2025 07:00:00 GMT","Raymond James Financial Inc. Increases Holdings in DuPont de Nemours, Inc. $DD - MarketBeat",MarketBeat
"Tue, 26 Aug 2025 07:00:00 GMT",DD 2 Education Foundation Launches 2 for 2 Campaign to Support Local Teachers - Citizen Portal AI,Citizen Portal AI
"Wed, 27 Aug 2025 07:00:00 GMT","Brokerages Set DuPont de Nemours, Inc. (NYSE:DD) Price Target at $88.25 - MarketBeat",MarketBeat
"Thu, 28 Aug 2025 18:28:31 GMT","Club DD's to open in old Blue Dog space, care of Champs staff and three Montreal musicians - Cult MTL",Cult MTL
"Tue, 26 Aug 2025 07:00:00 GMT","Northern Trust Corp Has $350.61 Million Stake in DuPont de Nemours, Inc. $DD - MarketBeat",MarketBeat
"Fri, 29 Aug 2025 04:47:35 GMT",Broadcasters' body seeks transparent framework for DD Free Dish auction - The Economic Times,The Economic Times
"Fri, 29 Aug 2025 03:30:52 GMT",IBDF calls for transparency in DD FreeDish slot auctions - Exchange4media,Exchange4media
"Thu, 28 Aug 2025 13:25:00 GMT","India, Bhutan sign MoU to boost cooperation in agriculture and allied sectors - DD News",DD News
"Sat, 30 Aug 2025 00:20:24 GMT",Former ADG DD Ashok Jailkhani passes away - Daily Excelsior,Daily Excelsior
"Wed, 27 Aug 2025 08:00:00 GMT",Itsuno Left CAPCOM Because He Didn’t Want to Make DMC and DD Sequels Until Retirement - Wccftech,Wccftech
2025-08-29T17:41:49,DuPont to Sell Synthetic Fibers Business to Arclin in $1.8 Billion Deal,Yahoo
2025-08-29T14:47:30,DuPont Divests Aramids Business In $1.8 Billion Deal To Sharpen Portfolio,Yahoo
2025-08-29T12:55:00,DuPont Announces Agreement to Divest Aramids Business to Arclin,Yahoo
2025-08-26T11:10:00,"Military Personal Protective Equipment Global Market Report 2025-2029 and 2034 | Rising Military Expenditure, Terrorism Threats, and Modernization Trends Fueling Expansion",Yahoo
2025-08-31T00:34:40,200k yolo $snap am I stupid? DD,Reddit/r/wallstreetbets
2025-08-26T23:30:33,Get in on SNOW with this dope DD,Reddit/r/wallstreetbets
