Date,Title,Source
2025-08-30T06:00:51Z,"Cisco Systems, Inc. (NASDAQ:CSCO) Given Average Recommendation of “Moderate Buy” by Brokerages",ETF Daily News
2025-08-26T21:19:11Z,"Cisco Systems, Inc. (CSCO) Gains 33% After Cramer Said You Shouldn’t Chase It Over $50",Yahoo Entertainment
"Sun, 31 Aug 2025 01:34:48 GMT",Is CSCO stock reversal real or fake - July 2025 Sector Moves & Weekly Chart Analysis and Trade Guides - Newser,Newser
"Tue, 26 Aug 2025 21:19:11 GMT","Cisco Systems, Inc. (CSCO) Gains 33% After Cramer Said You Shouldn’t Chase It Over $50 - Yahoo Finance",Yahoo Finance
"Sun, 31 Aug 2025 06:19:48 GMT",Using RSI to spot recovery in CSCO - Earnings Growth Report & Growth Focused Stock Pick Reports - Newser,Newser
"Sun, 31 Aug 2025 01:06:20 GMT",CSCO At Critical Juncture — Bounce or Breakdown - 2025 Stock Rankings & Accurate Buy Signal Alerts - beatles.ru,beatles.ru
"Sun, 31 Aug 2025 03:51:41 GMT",CSCO stock trend outlook and recovery path - Quarterly Trade Report & Community Verified Swing Trade Signals - Newser,Newser
"Wed, 27 Aug 2025 10:08:04 GMT",The Bull Case for Cisco (CSCO) Could Change Following Strong Earnings and Transportation Tech Expansion - Yahoo Finance,Yahoo Finance
"Wed, 27 Aug 2025 16:43:35 GMT","UBS Raises Cisco (CSCO) Target Amid Strong AI Orders, Earnings Beat - MSN",MSN
"Sun, 31 Aug 2025 02:46:20 GMT",Analyzing drawdowns of CSCO with statistical tools - Quarterly Profit Summary & Low Drawdown Trading Techniques - Newser,Newser
"Sat, 30 Aug 2025 21:02:03 GMT",How institutional ownership impacts CSCO stock - July 2025 Review & Comprehensive Market Scan Reports - Newser,Newser
"Sun, 31 Aug 2025 01:48:34 GMT",Sentiment analysis tools applied to CSCO - Earnings Miss & High Return Trade Opportunity Guides - Newser,Newser
"Sat, 30 Aug 2025 21:54:46 GMT",Is CSCO stock reversal real or fake - Earnings Growth Report & Consistent Profit Trading Strategies - Newser,Newser
"Sat, 30 Aug 2025 18:09:13 GMT",Sentiment analysis tools applied to CSCO - Weekly Trend Report & Daily Profit Focused Stock Screening - Newser,Newser
"Sun, 31 Aug 2025 02:03:20 GMT",What’s the recovery path for long term holders of CSCO - July 2025 PreEarnings & Low Risk High Reward Ideas - Newser,Newser
"Sat, 30 Aug 2025 21:44:37 GMT",Sector ETF performance correlation with CSCO - Treasury Yields & Fast Entry High Yield Stock Tips - Newser,Newser
"Sat, 30 Aug 2025 21:30:51 GMT",What’s the recovery path for long term holders of CSCO - Quarterly Portfolio Review & Free Low Drawdown Momentum Trade Ideas - Newser,Newser
"Sat, 30 Aug 2025 00:49:13 GMT",What Fibonacci levels say about CSCO rebound - 2025 Price Targets & High Return Stock Watch Alerts - Newser,Newser
"Sat, 30 Aug 2025 15:11:27 GMT",Technical analysis overview for CSCO stock - Bull Run & Target Return Focused Stock Picks - Newser,Newser
"Sat, 30 Aug 2025 22:01:13 GMT",Using RSI to spot recovery in CSCO - Portfolio Value Report & Fast Moving Stock Trade Plans - Newser,Newser
"Fri, 29 Aug 2025 09:05:47 GMT",Is CSCO stock reversal real or fake - Weekly Gains Summary & Community Verified Swing Trade Signals - Newser,Newser
"Fri, 29 Aug 2025 19:23:54 GMT",Sentiment analysis tools applied to CSCO - July 2025 Earnings & Daily Stock Trend Reports - Newser,Newser
"Fri, 29 Aug 2025 18:24:45 GMT",Does CSCO fit your quant trading model - Gap Down & Fast Entry and Exit Trade Plans - Newser,Newser
"Fri, 29 Aug 2025 18:44:17 GMT",CSCO stock trend outlook and recovery path - Treasury Yields & Proven Capital Preservation Tips - Newser,Newser
"Fri, 29 Aug 2025 19:28:11 GMT",Using RSI to spot recovery in CSCO - Profit Target & Accurate Intraday Trading Signals - Newser,Newser
"Sat, 30 Aug 2025 13:18:11 GMT",BofA Stays Constructive on Cisco (CSCO) with Price Target Raised to $85 - MSN,MSN
"Thu, 28 Aug 2025 18:54:43 GMT",How to build a custom watchlist for CSCO - Analyst Downgrade & Fast Entry High Yield Stock Tips - Newser,Newser
"Thu, 28 Aug 2025 20:01:16 GMT",What the Options Market Tells Us About Cisco Systems - Cisco Systems (NASDAQ:CSCO) - Benzinga,Benzinga
"Fri, 29 Aug 2025 18:55:55 GMT",Pattern recognition hints at CSCO upside - Weekly Investment Report & Weekly Stock Performance Updates - Newser,Newser
"Wed, 27 Aug 2025 01:59:19 GMT",Is CSCO trending in predictive chart models - Forecast Cut & AI Driven Stock Movement Reports - Newser,Newser
"Tue, 26 Aug 2025 17:38:00 GMT","IGM, PLTR, CSCO, INTU: Large Inflows Detected at ETF - Nasdaq",Nasdaq
"Wed, 27 Aug 2025 05:18:47 GMT",Should you hold or exit CSCO now - July 2025 Summary & Precise Swing Trade Entry Alerts - Newser,Newser
"Thu, 28 Aug 2025 09:41:22 GMT",Sentiment analysis tools applied to CSCO - July 2025 Outlook & Daily Entry Point Alerts - Newser,Newser
"Thu, 28 Aug 2025 07:36:56 GMT",What Analyst Projections for Key Metrics Reveal About Cisco (CSCO) Q4 Earnings - MSN,MSN
"Fri, 29 Aug 2025 20:52:30 GMT",Will Volume Confirm Reversal in CSCO getLinesFromResByArray error: size == 0 - news-j.co.kr,news-j.co.kr
"Fri, 29 Aug 2025 05:32:53 GMT",Momentum Screeners Rank CSCO in Top 5 Today - Product Launch & Low Drawdown Trading Strategies - sundaytimes.kr,sundaytimes.kr
"Tue, 26 Aug 2025 20:06:33 GMT",Is CSCO’s growth already priced in getLinesFromResByArray error: size == 0 - thegnnews.com,thegnnews.com
"Wed, 27 Aug 2025 13:18:30 GMT",NTT DATA and Cisco Partner to Power Networking for the AI Era | CSCO Stock News - GuruFocus,GuruFocus
"Sun, 31 Aug 2025 01:15:16 GMT",Real time social sentiment graph for CSCO - Market Growth Report & Reliable Price Action Trade Plans - Newser,Newser
"Sat, 30 Aug 2025 20:36:38 GMT",Does CSCO fit your quant trading model - 2025 Top Gainers & Verified Short-Term Trading Plans - Newser,Newser
"Sat, 30 Aug 2025 11:21:40 GMT","Cisco Systems, Inc. (NASDAQ:CSCO) Receives Consensus Recommendation of “Moderate Buy” from Analysts - Defense World",Defense World
"Sat, 30 Aug 2025 01:23:27 GMT",Why CSCO stock attracts strong analyst attention getLinesFromResByArray error: size == 0 - newsyoung.net,newsyoung.net
2025-08-28T15:03:33,"Cisco Systems, Inc. (CSCO) Presents at Deutsche Bank's 2025 Technology Conference Transcript",SeekingAlpha
2025-08-27T12:08:04,The Bull Case for Cisco (CSCO) Could Change Following Strong Earnings and Transportation Tech Expansion,Yahoo
2025-08-27T12:00:25,Nvidia earnings preview and the Trump chip tariff twist,Yahoo
2025-08-26T23:19:11,"Cisco Systems, Inc. (CSCO) Gains 33% After Cramer Said You Shouldn’t Chase It Over $50",Yahoo
2025-08-26T17:30:00,Cisco Rides AI Boom With $2B Orders: Can It Sustain the Growth Curve?,Yahoo
