Date,Title,Source
2025-10-15T21:30:56Z,Here's How Much $100 Invested In NVIDIA 15 Years Ago Would Be Worth Today,Biztoc.com
2025-10-15T18:33:29Z,Stock Market Today: Dow Gives Up Gains; Trade War Turns To Soybean Oil (Live Coverage),Biztoc.com
2025-10-15T16:09:54Z,"Mizuho Raises Nvidia (NVDA) Price Target to $225, Calls It the AI Market Leader",Biztoc.com
2025-10-15T16:09:38Z,"Silicon Valley is plowing money into AI, and the latest deals are eye-watering",Biztoc.com
2025-10-15T15:54:29Z,"Mizuho Raises Nvidia (NVDA) Price Target to $225, Calls It the AI Market Leader",Yahoo Entertainment
2025-10-15T14:51:05Z,Nvidia’s (NVDA) Relentless Deal Flow Opens Door to $250 Price Target,Biztoc.com
2025-10-15T14:40:24Z,US Approves NVDA Chip Exports to UAE,Biztoc.com
2025-10-15T14:20:09Z,US Approves NVDA Chip Exports to UAE,Yahoo Entertainment
2025-10-15T13:56:13Z,"Nvidia upgraded, Ibotta downgraded: Wall Street's top analyst calls",Biztoc.com
2025-10-15T12:35:00Z,NVDA vs. AMD: Which AI Hardware Stock Has Better Investment Potential?,Yahoo Entertainment
2025-10-15T12:27:14Z,Stock Market Today: Dow Jones Index Rises 200 Points As Nvidia Stock Rebounds (Live Coverage),Biztoc.com
2025-10-15T12:27:12Z,"Nvidia, Tesla Fuel Demand — And Buy Point — For This Turnaround AI Stock",Biztoc.com
2025-10-15T12:15:55Z,"AI consortium backed by BlackRock, Nvidia to buy Aligned Data Centers for $40-billion",Biztoc.com
2025-10-14T22:24:06Z,"Morgan Stanley Reiterates Overweight on NVIDIA (NVDA), Stays Positive on Growth Outlook",Yahoo Entertainment
2025-10-14T18:05:22Z,Tom Lee Says NVIDIA (NVDA) Valuation Still Attractive Amid ‘Powerful Tailwinds’,Yahoo Entertainment
2025-10-14T17:23:32Z,CoreWeave stock has one big hurdle to overcome,Biztoc.com
2025-10-14T16:05:17Z,Hammered Despite Launching Nvidia Rival Chip Thor Ultra,Biztoc.com
2025-10-14T14:14:06Z,CoreWeave stock has one big hurdle to overcome,Biztoc.com
2025-10-14T13:30:25Z,Polen Focus Growth Strategy Initiated a Position in NVIDIA (NVDA) in August,Biztoc.com
2025-10-14T13:19:15Z,"‘History Lesson’ – Nvidia (NVDA) Stock Up 4,600% Since Jim Cramer First Recommended It",Biztoc.com
2025-10-14T13:06:37Z,Polen Focus Growth Strategy Initiated a Position in NVIDIA (NVDA) in August,Yahoo Entertainment
2025-10-14T13:00:12Z,"‘History Lesson’ – Nvidia (NVDA) Stock Up 4,600% Since Jim Cramer First Recommended It",Yahoo Entertainment
2025-10-13T17:51:41Z,Prediction: This Will Be Nvidia's Market Cap 5 Years From Now,Biztoc.com
2025-10-13T16:56:28Z,Broadcom Stock Surges On OpenAI Chip Deal,Biztoc.com
2025-10-13T16:56:24Z,Breakout Watch: This AI-Fueled Palantir Peer And Nvidia Partner Is No Flake,Biztoc.com
2025-10-13T16:22:48Z,'Very troubling': AI's self-investment spree sets off bubble alarms on Wall Street,Biztoc.com
2025-10-13T16:11:17Z,Can NVDA Still Be a $300 Stock If Nvidia Loses Its Monopoly in AI GPUs?,Biztoc.com
2025-10-13T15:58:32Z,Can NVDA Still Be a $300 Stock If Nvidia Loses Its Monopoly in AI GPUs?,Barchart.com
"Thu, 16 Oct 2025 18:36:37 GMT",NVDA: This Analyst Sees Massive 80% Upside For Nvidia Stock -- Here's Why - Yahoo Finance,Yahoo Finance
"Thu, 16 Oct 2025 12:36:42 GMT","Nvidia: It's Not A Bubble, It's A Dam (NASDAQ:NVDA) - Seeking Alpha",Seeking Alpha
"Fri, 17 Oct 2025 04:39:33 GMT","NVDA, AVGO, MU: Chip Stocks Gain on TSMC’s Rosy Outlook and New AI Deals - TipRanks",TipRanks
"Wed, 15 Oct 2025 22:00:32 GMT",Nvidia CEO Huang Jen Hsun sells $41.3 million in NVDA stock - Investing.com,Investing.com
"Thu, 16 Oct 2025 17:32:52 GMT",Nvidia Stock Skyrockets on $100B AI Deal – Will NVDA Hit $320 Target? - ts2.tech,ts2.tech
"Wed, 15 Oct 2025 17:12:20 GMT","NVIDIA (NVDA) Stock: Gains Amid $40B Aligned Data Centers Acquisition With BlackRock, Microsoft & xAI - CoinCentral",CoinCentral
"Tue, 14 Oct 2025 21:24:01 GMT",NVIDIA (NASDAQ:NVDA) Stock Price Down 4.4% - Here's Why - MarketBeat,MarketBeat
"Thu, 16 Oct 2025 14:15:01 GMT",Analyst Says NVIDIA (NVDA) Valuation Still ‘Reasonable’ – Here’s Why - Yahoo Finance,Yahoo Finance
"Wed, 15 Oct 2025 13:39:02 GMT",NVIDIA Stock (NVDA) Wins Street-High $320 Price Target as Top HSBC Analyst Sees ‘Big AI Upside’ - TipRanks,TipRanks
"Thu, 16 Oct 2025 20:58:13 GMT",NVIDIA (NASDAQ:NVDA) Trading Up 1.1% on Analyst Upgrade - MarketBeat,MarketBeat
"Tue, 14 Oct 2025 18:05:22 GMT",Tom Lee Says NVIDIA (NVDA) Valuation Still Attractive Amid ‘Powerful Tailwinds’ - Yahoo Finance,Yahoo Finance
"Wed, 15 Oct 2025 22:07:46 GMT","AMD vs. NVDA vs. AVGO: Which “Strong Buy” Chip Stock Has the Highest Upside Potential, According to Wall Street? - TipRanks",TipRanks
"Thu, 16 Oct 2025 20:34:55 GMT",China Increases Enforcement of Import Restrictions on Chips from NVIDIA Corporation (NVDA) - Yahoo Finance,Yahoo Finance
"Tue, 14 Oct 2025 22:24:06 GMT","Morgan Stanley Reiterates Overweight on NVIDIA (NVDA), Stays Positive on Growth Outlook - Yahoo Finance",Yahoo Finance
"Thu, 16 Oct 2025 19:35:16 GMT","NVIDIA (NVDA) Has More Business Than It Can Handle Despite AMD’s OpenAI Deal, Says Jim Cramer - Yahoo",Yahoo
"Thu, 16 Oct 2025 13:45:03 GMT",Nvidia (NVDA) is a Top-Ranked Growth Stock: Should You Buy? - Yahoo Finance,Yahoo Finance
"Wed, 15 Oct 2025 14:20:09 GMT",US Approves NVDA Chip Exports to UAE - Yahoo Finance,Yahoo Finance
"Tue, 14 Oct 2025 13:30:02 GMT",Is Nvidia (NVDA) a Buy as Wall Street Analysts Look Optimistic? - Yahoo Finance,Yahoo Finance
"Wed, 15 Oct 2025 15:54:29 GMT","Mizuho Raises Nvidia (NVDA) Price Target to $225, Calls It the AI Market Leader - Yahoo Finance",Yahoo Finance
"Fri, 17 Oct 2025 03:36:48 GMT",Why NVDA stock remains resilient - July 2025 Opening Moves & AI Optimized Trade Strategies - newser.com,newser.com
"Thu, 16 Oct 2025 21:45:44 GMT","$1,000 In Nvidia Stock 5 Years Ago Is Now $12,000 & NVDA Is Still A Buy - Forbes",Forbes
"Fri, 17 Oct 2025 03:46:06 GMT",How to use a screener to detect NVDA breakouts - July 2025 Decliners & Stepwise Swing Trade Plans - newser.com,newser.com
"Thu, 16 Oct 2025 20:29:55 GMT",Why NVDA stock remains resilient - Global Markets & Proven Capital Preservation Tips - newser.com,newser.com
"Thu, 16 Oct 2025 15:49:04 GMT","Wall Street Analysts are Bullish on NVDA, MU, NFLX, TMUS - AOL.com",AOL.com
"Thu, 16 Oct 2025 20:05:58 GMT",Options Corner: Nvidia Just Flashed A Rare 'Buy' Signal One Month Ahead Of Earnings - NVIDIA (NASDAQ:NVDA) - Benzinga,Benzinga
"Fri, 17 Oct 2025 03:24:13 GMT","NVIDIA (NVDA) Stock Today October 16, 2025: Time to Buy the Dip? - Pintu",Pintu
"Tue, 14 Oct 2025 19:00:00 GMT",NVDA & PLTR Driving AI in Health: Top Health IT Stocks for Q3 Earnings - Yahoo Finance,Yahoo Finance
"Mon, 13 Oct 2025 20:41:58 GMT",Why Nvidia (NVDA) Stock Is Trading Up Today - Yahoo Finance,Yahoo Finance
"Tue, 14 Oct 2025 13:00:12 GMT","‘History Lesson’ – Nvidia (NVDA) Stock Up 4,600% Since Jim Cramer First Recommended It - Yahoo",Yahoo
"Mon, 13 Oct 2025 21:45:03 GMT",Nvidia (NVDA) Laps the Stock Market: Here's Why - Yahoo Finance,Yahoo Finance
"Thu, 16 Oct 2025 14:43:21 GMT","Wall Street Analysts are Bullish on NVDA, MU, NFLX, TMUS - 24/7 Wall St.",24/7 Wall St.
"Thu, 16 Oct 2025 14:18:43 GMT",Will AMD’s Helios Server Rack Challenge Nvidia’s (NVDA) AI Dominance? - TipRanks,TipRanks
"Tue, 14 Oct 2025 12:57:23 GMT",NVIDIA (NASDAQ: NVDA) Price Prediction and Forecast 2025-2030 for October 14 - 24/7 Wall St.,24/7 Wall St.
"Mon, 13 Oct 2025 13:43:28 GMT",Is NVIDIA (NVDA) One of the Best Performing NASDAQ Stocks According to Hedge Funds - Yahoo Finance,Yahoo Finance
"Wed, 15 Oct 2025 09:37:00 GMT","Zacks Investment Ideas feature highlights: IBIT, MP, JPM, BE, NVTS, NVDA and RGTI - Yahoo Finance",Yahoo Finance
"Mon, 13 Oct 2025 00:49:32 GMT",Can NVDA Stock Reach $300? Here’s What C.J. Muse Expects - TipRanks,TipRanks
"Thu, 16 Oct 2025 12:29:00 GMT","Pre-Market Most Active for Oct 16, 2025 : NIO, TSLL, BITF, SQQQ, CRML, IONZ, NVDA, LAC, TSM, ACHR, BBAI, SMR - Nasdaq",Nasdaq
"Tue, 14 Oct 2025 13:06:37 GMT",Polen Focus Growth Strategy Initiated a Position in NVIDIA (NVDA) in August - Yahoo Finance,Yahoo Finance
"Mon, 13 Oct 2025 14:29:59 GMT","Top Mizuho Analyst Lifts AMD, Nvidia (NVDA) Stock Price Targets. Here’s Why - TipRanks",TipRanks
"Tue, 14 Oct 2025 23:15:11 GMT",Nvidia’s $4.5 Trillion AI Juggernaut: NVDA Stock Volatile After Record Rally - ts2.tech,ts2.tech
"Thu, 16 Oct 2025 14:55:06 GMT",NVIDIA (NASDAQ: NVDA) Stock Rises as Institutional Investors Increase Holdings | NVIDIA Stock Price - Somos Hermanos -,Somos Hermanos -
"Mon, 13 Oct 2025 13:07:15 GMT",Nvidia (NVDA): Revisiting Valuation as Shares Continue Their Steady Upward Trend - Yahoo Finance,Yahoo Finance
"Thu, 16 Oct 2025 16:48:47 GMT",(NVDA) Advanced Trading Insights (NVDA:CA) - news.stocktradersdaily.com,news.stocktradersdaily.com
"Mon, 13 Oct 2025 04:03:00 GMT",Is Nvidia (NVDA) One of the AI Stocks on the Market’s Radar? - Yahoo Finance,Yahoo Finance
"Wed, 15 Oct 2025 11:45:16 GMT",Nvidia (NASDAQ: NVDA) Stock Price Prediction for 2025: Where Will It Be in 1 Year (Oct 15) - 24/7 Wall St.,24/7 Wall St.
"Thu, 16 Oct 2025 06:13:37 GMT",Nvidia joins $2.9 billion data center initiative in Australia (NVDA:NASDAQ) - Seeking Alpha,Seeking Alpha
"Thu, 16 Oct 2025 13:15:05 GMT",Think It's Too Late to Buy Nvidia (NVDA)? Here's the 1 Reason Why There's Still Time. - AOL.com,AOL.com
"Tue, 14 Oct 2025 14:07:00 GMT",AMD (AMD) Secures Oracle AI Chip Deal in Challenge to Nvidia’s (NVDA) Market Lead - Quiver Quantitative,Quiver Quantitative
"Thu, 16 Oct 2025 07:40:35 GMT",Nvidia (NVDA) Reshapes Leadership Team as AI Expansion Speeds Up - TipRanks,TipRanks
"Wed, 15 Oct 2025 12:01:11 GMT",NVDA vs. AMD: Which AI Hardware Stock Has Better Investment Potential? - Zacks Investment Research,Zacks Investment Research
"Tue, 14 Oct 2025 05:07:57 GMT","BBAI vs. PLTR vs. NVDA: Which AI Stock Is the Best Pick, According to Analysts? - TipRanks",TipRanks
"Thu, 16 Oct 2025 12:51:25 GMT",Nvidia (NVDA) Investors Are Playing With Fire - AOL.com,AOL.com
"Thu, 16 Oct 2025 14:52:00 GMT","OEF, NVDA, MSFT, AAPL: ETF Inflow Alert - Nasdaq",Nasdaq
"Thu, 16 Oct 2025 15:20:03 GMT",Nvidia (NVDA) is a Top-Ranked Growth Stock: Should You Buy? - sharewise.com,sharewise.com
"Thu, 16 Oct 2025 09:33:48 GMT",Wall Street piles into leveraged NVDA bets as analysts warn of systemic risk - Investorsobserver,Investorsobserver
"Wed, 15 Oct 2025 16:00:37 GMT",Active AI stocks comparison: NVIDIA (NVDA) stock VS AMD (AMD) stock - Markets.com,Markets.com
"Thu, 16 Oct 2025 11:37:29 GMT",Top Analyst Sees $5B Boost for CoreWeave (CRWV) from New NVDA-Backed AI Deal - TipRanks,TipRanks
"Thu, 16 Oct 2025 14:33:51 GMT",Analyst Says NVIDIA (NVDA) Valuation Still ‘Reasonable’ – Here’s Why - MSN,MSN
"Wed, 15 Oct 2025 06:54:01 GMT",(NVDA) Volatility Zones as Tactical Triggers - news.stocktradersdaily.com,news.stocktradersdaily.com
"Thu, 16 Oct 2025 15:09:35 GMT","NVIDIA (NVDA) Stock: Gains Amid $40B Aligned Data Centers Acquisition With BlackRock, Microsoft & xAI - parameter.io",parameter.io
"Tue, 14 Oct 2025 21:02:17 GMT",Nvidia’s (NVDA) Relentless Deal Flow Opens Door to $250 Price Target - TipRanks,TipRanks
"Thu, 16 Oct 2025 20:54:11 GMT",NVIDIA (NVDA) Powers World’s First GB300 NVL72 Supercluster with Microsoft Azure - MSN,MSN
"Thu, 16 Oct 2025 10:48:02 GMT","NVIDIA (NASDAQ:NVDA) Upgraded to ""Strong-Buy"" at Hsbc Global Res - MarketBeat",MarketBeat
"Wed, 15 Oct 2025 00:33:53 GMT",NVIDIA (NVDA) Up or Down - October 15 - Polymarket,Polymarket
"Mon, 13 Oct 2025 06:18:00 GMT",Jim Cramer Discusses NVIDIA (NVDA) & Circular AI Deals - Yahoo,Yahoo
"Wed, 15 Oct 2025 14:29:22 GMT",Nvidia (NVDA) and Microsoft Join BlackRock-Led Group in $40B Takeover of Aligned Data Centers - TipRanks,TipRanks
"Wed, 15 Oct 2025 14:15:19 GMT","Poolside, CoreWeave partners to build giant AI data center in Texas (NVDA:NASDAQ) - Seeking Alpha",Seeking Alpha
"Tue, 14 Oct 2025 07:47:24 GMT",NVIDIA Corporation $NVDA Stock Holdings Increased by Janney Montgomery Scott LLC - MarketBeat,MarketBeat
"Wed, 15 Oct 2025 07:19:10 GMT","Paradiem LLC Sells 8,680 Shares of NVIDIA Corporation $NVDA - MarketBeat",MarketBeat
"Wed, 15 Oct 2025 07:19:10 GMT",NVIDIA Corporation $NVDA is Park Place Capital Corp's 10th Largest Position - MarketBeat,MarketBeat
"Mon, 13 Oct 2025 10:39:00 GMT",Nvidia: Expect Big Updates For NVLink This Week (Rating Upgrade) (NASDAQ:NVDA) - Seeking Alpha,Seeking Alpha
"Wed, 15 Oct 2025 07:19:10 GMT",NVIDIA Corporation $NVDA Shares Acquired by Oak Family Advisors LLC - MarketBeat,MarketBeat
"Wed, 15 Oct 2025 23:21:03 GMT","Jen Hsun Huang Sells 75,000 Shares of NVIDIA (NASDAQ:NVDA) Stock - MarketBeat",MarketBeat
"Tue, 14 Oct 2025 13:38:23 GMT","NVIDIA (NASDAQ:NVDA) Stock Price Expected to Rise, Arete Analyst Says - MarketBeat",MarketBeat
"Mon, 13 Oct 2025 08:51:02 GMT","Perplexity CEO uses AI for investor pitches, ditches traditional decks (NVDA:NASDAQ) - Seeking Alpha",Seeking Alpha
"Tue, 14 Oct 2025 07:17:31 GMT","Venture Visionary Partners LLC Acquires 46,904 Shares of NVIDIA Corporation $NVDA - MarketBeat",MarketBeat
"Wed, 15 Oct 2025 07:19:10 GMT",NVIDIA Corporation $NVDA Shares Acquired by Hamilton Capital Partners LLC - MarketBeat,MarketBeat
"Wed, 15 Oct 2025 07:19:10 GMT","26,098 Shares in NVIDIA Corporation $NVDA Purchased by White Pine Investment CO - MarketBeat",MarketBeat
"Wed, 15 Oct 2025 07:19:10 GMT",NVIDIA Corporation $NVDA Shares Acquired by Mokosak Advisory Group LLC - MarketBeat,MarketBeat
"Wed, 15 Oct 2025 07:19:10 GMT","Legacy Wealth Management Inc Sells 1,959 Shares of NVIDIA Corporation $NVDA - MarketBeat",MarketBeat
"Wed, 15 Oct 2025 07:19:10 GMT",HCR Wealth Advisors Grows Stock Holdings in NVIDIA Corporation $NVDA - MarketBeat,MarketBeat
"Mon, 13 Oct 2025 16:00:56 GMT",Nvidia (NVDA) Stock is trading up today: What is the NVDA price target 2026? - Markets.com,Markets.com
"Wed, 15 Oct 2025 07:19:09 GMT",Emerald Advisors LLC Increases Stock Holdings in NVIDIA Corporation $NVDA - MarketBeat,MarketBeat
"Wed, 15 Oct 2025 10:55:33 GMT",Nvidia (NVDA) Gets a Buy from Piper Sandler - The Globe and Mail,The Globe and Mail
"Wed, 15 Oct 2025 07:19:09 GMT","Poinciana Advisors Group LLC Acquires 2,340 Shares of NVIDIA Corporation $NVDA - MarketBeat",MarketBeat
2025-10-17T01:01:03,"Reflection AI Lands $2 Billion From Nvidia, Eric Schmidt To Build Open Alternative To ChatGPT And Gemini Models",Yahoo
2025-10-16T22:34:55,China Increases Enforcement of Import Restrictions on Chips from NVIDIA Corporation (NVDA),Yahoo
2025-10-16T16:15:01,Analyst Says NVIDIA (NVDA) Valuation Still ‘Reasonable’ – Here’s Why,Yahoo
2025-10-16T15:45:03,Nvidia (NVDA) is a Top-Ranked Growth Stock: Should You Buy?,Yahoo
2025-10-16T14:05:05,"Salesforce, chips and a +2,800% stock:  Trending Tickers",Yahoo
2025-10-16T10:36:42,"Nvidia: It's Not A Bubble, It's A Dam",SeekingAlpha
2025-10-16T02:55:23,Congratulations! We have reached the Mania stage in this bull market. 5x leveraged ETF’s are coming,Reddit/r/stocks
2025-10-14T07:36:05,NVDA: META and ORCL adopt Nvidia Spectrum-X Ethernet networking platform,Reddit/r/stocks
