Date,Title,Source
2025-11-03T14:48:00Z,Forest Fire Deadwood Creates Opportunity for Two Global Biofuel Production Sites in Northern Alberta,GlobeNewswire
2025-11-03T14:44:11Z,Trump Approval Rating Slides to Just 37% — Within 1 Point of His All-Time Low: CNN Poll,Mediaite
2025-11-03T14:38:34Z,XPeng owners can enjoy 25% off at XPeng x Charge+ EV charging hubs,SoyaCincau.com
2025-11-03T14:37:03Z,SNL 51: Nashville Predators Respond to Miles Teller Hockey PSA Sketch,Bleeding Cool News
2025-11-03T14:32:52Z,Denmark inaugurates rare low-carbon hydrogen plant,RTE
2025-11-03T14:28:40Z,"Refurb Generators, Solar Panels & more at eBay: Up to 70% off + extra 20% off + free shipping",Dealnews.com
2025-11-03T14:20:29Z,There’s a new way to get a loan — but it comes at a cost,Vox
2025-11-03T14:18:04Z,Anker’s tiny 3-in-1 Qi2 15W fold-out travel charger hits 2025 low at $59.55 (Reg. $100),9to5Toys
2025-11-03T14:15:00Z,RYVU THERAPEUTICS S.A.: Prezentacja danych dotyczących romacyklibu (RVU120) oraz dapolsertibu (MEN1703) na dorocznej konferencji Amerykańskiego Towarzystwa Hematologicznego (ASH) 2025 / Presentation of data on Romacyclib (RVU120) and Dapolsertib (MEN1703) at the 2025 Annual Meeting of the American Society of Hematology (ASH),Bankier.pl
2025-11-03T14:14:28Z,Why Pepsi could be seeking a 'high' in India,The Times of India
2025-11-03T14:06:23Z,Why Target stock is hovering near a 52-week low before Black Friday,Biztoc.com
2025-11-03T14:03:49Z,Apple’s official iPhone 17/Pro/Max Silicone cases now starting from $37 (25% off),9to5Toys
2025-11-03T14:00:45Z,Frontegg unveils AgentLink to bridge SaaS products with agentic AI through secure MCP connections,SiliconANGLE News
2025-11-03T14:00:02Z,NVIDIA Sends a Powerful GPU to Space,Ieee.org
2025-11-03T14:00:00Z,Correction: Perturbing low dimensional activity manifolds in spiking neuronal networks,Plos.org
2025-11-03T14:00:00Z,"Designing interventions to scaffold emotional awareness, beliefs and action tendencies",Plos.org
"Tue, 04 Nov 2025 05:10:08 GMT",Scotty Cameron Launches New OC (Onset Center) Low-Torque Putters - Scotty Cameron,Scotty Cameron
"Tue, 04 Nov 2025 05:55:32 GMT",Low-Dose Ketamine Protocol for Chronic Refractory Pain - Cleveland Clinic,Cleveland Clinic
"Mon, 03 Nov 2025 20:00:00 GMT",Trump approval rating falls to second-term low of 37% - The Guardian,The Guardian
"Tue, 04 Nov 2025 07:36:00 GMT","U.S. Treasurys Seen Driving Eurozone Bonds, Volatility Is Low - The Wall Street Journal",The Wall Street Journal
"Tue, 04 Nov 2025 02:25:00 GMT","Pitkin County sees unusually low ‘juror rates,’ commissioner says - AspenTimes.com",AspenTimes.com
"Tue, 04 Nov 2025 07:18:00 GMT","RBI Intervenes Again, Lifting Indian Rupee From Near Record Low - Bloomberg.com",Bloomberg.com
"Tue, 04 Nov 2025 07:42:48 GMT","When They Go Low, We Go Low - The Dispatch",The Dispatch
"Tue, 04 Nov 2025 08:00:00 GMT","Beyond the Pint: Meeting the Demand for Low-ABV, NA, and Functional Craft Beverages - Craft Beer & Brewing",Craft Beer & Brewing
"Tue, 04 Nov 2025 02:19:54 GMT",Yakima County voter turnout remains low ahead of election - KNDU,KNDU
"Mon, 03 Nov 2025 19:51:37 GMT",Canadian dollar hits a near three-week low on wider yield spreads - Reuters,Reuters
"Tue, 04 Nov 2025 03:43:46 GMT","Manor residents face low water pressure, traffic delays after contractor hits water line - KEYE",KEYE
"Tue, 04 Nov 2025 00:20:00 GMT",Oboz Hyalite Low Waterproof Hiking Shoe Review (Tested) - Treeline Review,Treeline Review
"Tue, 04 Nov 2025 00:24:00 GMT","Louisiana hunters face challenges with deer disease, low duck numbers - KALB",KALB
"Mon, 03 Nov 2025 15:59:54 GMT",The Best Low-FODMAP Foods for Less Bloating and Better Digestion - Vogue,Vogue
"Tue, 04 Nov 2025 02:20:13 GMT","Low turnout, high price: Waste Watch learns cost of Tuesday's election in Jefferson Co. - KFDM",KFDM
"Mon, 03 Nov 2025 19:26:19 GMT",'Great stay' persists as home turnovers sink to 30-year low - RealEstateNews.com,RealEstateNews.com
"Tue, 04 Nov 2025 06:06:51 GMT",Trump Calls Jasmine Crockett ‘Low IQ’ Again—Kimmel Says Prove It - LateNighter,LateNighter
"Mon, 03 Nov 2025 22:48:19 GMT",Houston activists holding food drive as Fort Hood food pantries run low - Houston Public Media,Houston Public Media
"Mon, 03 Nov 2025 14:03:26 GMT",Low-sulfur bunker fuel sales have decreased since 2020 - U.S. Energy Information Administration (EIA) (.gov),U.S. Energy Information Administration (EIA) (.gov)
"Tue, 04 Nov 2025 00:12:26 GMT",Low turnout for early voting in Jefferson County alarms local officials - Beaumont Enterprise,Beaumont Enterprise
"Tue, 04 Nov 2025 05:21:45 GMT","Low turnout anticipated for Nov. 4 election, but stakes still high for voters - kiiitv.com",kiiitv.com
"Mon, 03 Nov 2025 17:22:00 GMT","Glucocorticoids lower death rates from pneumonia in low-resource settings, trial shows - CIDRAP",CIDRAP
"Tue, 04 Nov 2025 02:19:54 GMT",Yakima County faces low ballot return for another year - KNDU,KNDU
"Tue, 04 Nov 2025 07:57:00 GMT",Saudi Aramco's third-quarter profit slips on lower crude prices - Reuters,Reuters
"Mon, 03 Nov 2025 10:02:08 GMT",Low-dose aspirin linked to lower cardiovascular event risk for adults with Type 2 diabetes - www.heart.org,www.heart.org
"Mon, 03 Nov 2025 20:48:00 GMT",Cybercriminals are stooping to a new low by targeting job seekers when the market is already bad: 'Where’s the good sheep for the wolf to go attack?' - Fortune,Fortune
"Tue, 04 Nov 2025 04:37:00 GMT",Local food pantries face record lines and low supplies - InForum,InForum
"Mon, 03 Nov 2025 23:40:00 GMT",Free heating help available for low-income families as days get colder - WKYT,WKYT
"Mon, 03 Nov 2025 22:15:56 GMT","Subway crime hit a record low in October, NYPD says - amNewYork",amNewYork
"Mon, 03 Nov 2025 18:24:01 GMT",Trump admin quietly funds some nutrition aid for low-income moms and babies - Politico,Politico
"Mon, 03 Nov 2025 21:15:41 GMT",ExxonMobil expands low-cost site revamps as refining profits surge - Baton Rouge Business Report,Baton Rouge Business Report
"Tue, 04 Nov 2025 00:50:00 GMT",Franklin County election turnout low ahead of election day - KNDU,KNDU
"Tue, 04 Nov 2025 05:16:52 GMT","Low turnout anticipated for Nov. 4 election, but stakes still high for voters - kiiitv.com",kiiitv.com
"Mon, 03 Nov 2025 14:23:00 GMT",Trump approval at new low in second term: Survey - The Hill,The Hill
"Tue, 04 Nov 2025 01:26:01 GMT",Electric vehicle rebates for low-to-moderate income Oregonians will be suspended - KOIN.com,KOIN.com
"Mon, 03 Nov 2025 22:56:08 GMT",Sean ‘Diddy’ Combs assigned laundry duty after transfer to low-security prison - Straight Arrow News,Straight Arrow News
"Tue, 04 Nov 2025 01:35:00 GMT",Turnout Appears Low Ahead of November Election - Willamette Week,Willamette Week
"Mon, 03 Nov 2025 01:40:09 GMT",Column: “Low skilled” workers are a myth - Daily Tar Heel,Daily Tar Heel
"Mon, 03 Nov 2025 11:59:00 GMT",Donald Trump Approval Rating Hits New Low - Newsweek,Newsweek
"Mon, 03 Nov 2025 10:00:00 GMT","Democrats are more enthusiastic about the midterms as Trump’s approval hits a second-term low, CNN poll finds - CNN",CNN
"Mon, 03 Nov 2025 20:50:13 GMT",Reno agency opens low-income housing waitlists indefinitely amid shutdown - Reno Gazette Journal,Reno Gazette Journal
"Sun, 02 Nov 2025 18:36:00 GMT",Government shutdown threatens to delay home heating aid for millions of low-income families - AP News,AP News
"Mon, 03 Nov 2025 14:58:02 GMT",Razer Blackwidow v4 Low-Profile Hyperspeed Keyboard | Review - XboxEra,XboxEra
"Tue, 04 Nov 2025 00:18:33 GMT",Green shift: Korea steps up low-carbon farming push as climate risks and global rules intensify - AgTechNavigator.com,AgTechNavigator.com
"Tue, 04 Nov 2025 04:24:00 GMT",Low river levels disrupt harvest logistics - Newsbug.info,Newsbug.info
"Tue, 04 Nov 2025 01:27:00 GMT",Stats show Staten Island crime down; NYC shootings at record low - SILive.com,SILive.com
"Mon, 03 Nov 2025 20:16:00 GMT",Emerald Keepers Highlights Opportunities For Low-Water And Native Landscaping - Coronado Eagle & Journal,Coronado Eagle & Journal
"Tue, 04 Nov 2025 02:58:00 GMT","FORECAST: Clear, cool tonight in low 40s - WSOC TV",WSOC TV
"Mon, 03 Nov 2025 22:12:00 GMT",NYC shootings plummet to all-time low — as does subway crime for October: ‘We’re crushing it’ - New York Post,New York Post
"Mon, 03 Nov 2025 16:00:55 GMT",First Look At The Nike Kobe 9 Elite Low Protro “Perspective” - Sneaker News,Sneaker News
"Mon, 03 Nov 2025 20:46:28 GMT",Applications open for low-income home energy assistance program in Tennessee - Local 3 News,Local 3 News
"Mon, 03 Nov 2025 18:36:21 GMT",ComEd Partners with Clean Energy Developers on $10 Million Utility Low-Income Grant Program - The Chicago Crusader,The Chicago Crusader
"Tue, 04 Nov 2025 02:25:38 GMT","Tevogen Clarifies Reported Financials, Highlighting Strong Capital Efficiency and Low Cash Burn - BioSpace",BioSpace
"Tue, 04 Nov 2025 07:46:33 GMT",Defying gravity: how Pays d'Oc IGP is shifting focus to lower ABV wines - The Buyer,The Buyer
"Tue, 04 Nov 2025 00:45:00 GMT",ICP DAS-BMP Redefines Medical Material Performance with Low-Migration and Low-Friction TPU at COMPAMED 2025 - PR Newswire,PR Newswire
"Mon, 03 Nov 2025 19:42:53 GMT",NYPD touts record low shootings in first 10 months of 2025 - CBS News,CBS News
"Mon, 03 Nov 2025 23:02:10 GMT",64-year-old charged after leading police on low-speed chase - FOX 2,FOX 2
"Tue, 04 Nov 2025 07:46:48 GMT","BP in charts: Q3 revenue from oil production & operations -47%, gas & low carbon energy +15% Y/Y (BP:NYSE) - Seeking Alpha",Seeking Alpha
"Tue, 04 Nov 2025 06:45:00 GMT",Scouted: Which Low-THC Beverage Is Right For You? The Ultimate Guide to Legal Hemp Drinks - Yahoo,Yahoo
"Mon, 03 Nov 2025 21:14:00 GMT",Donations needed for third house being renovated in Waterville for low-income families - newscentermaine.com,newscentermaine.com
"Tue, 04 Nov 2025 00:56:00 GMT",Lions Trade Pitch Would Land ‘Low-Cost’ Edge Rusher at Deadline - Heavy Sports,Heavy Sports
"Tue, 04 Nov 2025 00:15:13 GMT","High demand, low supply: Groups work to keep West Tennesseans fed amid SNAP uncertainty - WBBJ TV",WBBJ TV
"Thu, 30 Oct 2025 14:23:14 GMT",Mizuno Wave Rebellion Pro 3 Low Review: Turning Heel - Believe in the Run,Believe in the Run
"Mon, 03 Nov 2025 23:35:22 GMT","Apple Has Dropped Its 11-inch iPad a New Record Low, Practically Giving It Away ⚡️ - Kotaku",Kotaku
"Sun, 02 Nov 2025 10:00:00 GMT",Donald Trump’s Approval Rating Falls to All-Time Low With White Voters - Newsweek,Newsweek
"Mon, 03 Nov 2025 21:02:58 GMT",Apple AirTag four-pack drops to a record low $64.99 - findarticles.com,findarticles.com
"Mon, 03 Nov 2025 12:36:00 GMT",Trump Net Job Approval Reaches Second-Term Low - New York Magazine,New York Magazine
"Mon, 03 Nov 2025 10:04:44 GMT",Sexual dimorphism in 137Cs accumulation after chronic low dose exposure in mice | Scientific Reports - Nature,Nature
"Mon, 03 Nov 2025 13:54:07 GMT",Why Target stock is hovering near a 52-week low before Black Friday - Yahoo Finance,Yahoo Finance
"Tue, 04 Nov 2025 07:30:00 GMT",UK borrowing costs fall and pound hits six-month low as Rachel Reeves pledges ‘iron clad’ commitment to budget fiscal rules – business live - The Guardian,The Guardian
"Mon, 03 Nov 2025 12:21:00 GMT",Low-dose aspirin helps reduce the incidence of major cardiovascular event among diabetic individuals - News-Medical,News-Medical
"Tue, 04 Nov 2025 07:07:30 GMT","Hugo Boss expects sales, profit at low end of guidance By Reuters - Investing.com",Investing.com
"Mon, 03 Nov 2025 23:40:09 GMT",Wizards' Justin Champagnie: Low output in first start of season - CBS Sports,CBS Sports
"Tue, 04 Nov 2025 03:43:00 GMT",Adtran Networks Expects 2025 Pro Forma Ebit In Low Negative To Positive Range - TradingView,TradingView
"Mon, 03 Nov 2025 21:13:00 GMT",Low voter turnout in Yakima County - KNDU,KNDU
"Tue, 04 Nov 2025 03:57:58 GMT",News Content Hub - Advances in low-pressure CO2 carriers - rivieramm.com,rivieramm.com
"Mon, 03 Nov 2025 20:05:06 GMT",Lucid Shares Near New All Time Low Ahead of Q3 Earnings Report - eletric-vehicles.com,eletric-vehicles.com
"Mon, 03 Nov 2025 16:14:57 GMT",Gold is the ultimate 'low-trust asset'. A look at 3 miners in our Best Stocks list - CNBC,CNBC
"Tue, 04 Nov 2025 04:50:00 GMT",China's yuan weakens to two-week low on broad dollar strength - TradingView,TradingView
"Tue, 04 Nov 2025 07:24:33 GMT",Equity Residential (NYSE:EQR) Hits New 52-Week Low on Analyst Downgrade - MarketBeat,MarketBeat
"Tue, 04 Nov 2025 05:03:59 GMT",Megan Low Game Report: vs Homestead - MaxPreps.com,MaxPreps.com
"Mon, 03 Nov 2025 20:44:58 GMT",Pueblo County seeing low voter turnout despite a loaded ballot - KOAA News 5,KOAA News 5
"Tue, 04 Nov 2025 02:42:00 GMT",A First Look At The Air Jordan 1 Low “Denim” - HotNewHipHop,HotNewHipHop
"Mon, 03 Nov 2025 13:47:07 GMT","Latest coastal low drops over 6 inches of rain on Outer Banks, eastern N.C. - Island Free Press",Island Free Press
"Mon, 03 Nov 2025 17:35:00 GMT",AMC Stock Nears Another All-Time Low. Could News on Nov. 5 Help Turn Things Around? - The Motley Fool,The Motley Fool
"Fri, 31 Oct 2025 18:37:45 GMT","US Air Force wants 1,558 fighters for low-risk wars. Can it get there? - Defense News",Defense News
"Mon, 03 Nov 2025 12:30:39 GMT",Patrick Mahomes hit a new low in Chiefs loss to the Bills - Missourinet,Missourinet
"Mon, 03 Nov 2025 14:38:36 GMT",All Time Low uncorks high-energy caper of joy & nostalgia; Josh Ritter shows off ‘Wild Ways’ - Local Spins,Local Spins
"Mon, 03 Nov 2025 22:00:19 GMT",Hogs Make New Low - Barchart.com,Barchart.com
"Mon, 03 Nov 2025 13:56:00 GMT",CNN Poll: Trump Slumps to New Job Approval Low - Insider NJ,Insider NJ
"Tue, 04 Nov 2025 07:04:00 GMT",Australian Shares Hit Over 1-Month Low - TradingView,TradingView
"Mon, 03 Nov 2025 01:03:00 GMT","Irish manufacturing growth slows to 10-month low in October, PMI shows - Reuters",Reuters
2025-11-02T16:00:00,Lowe's Pledges $1 Million to Support Hurricane Recovery and Rebuilding Efforts in Jamaica,Yahoo
2025-11-01T15:08:13,Is Lowe's (LOW) AI Collaboration With NVIDIA and Palantir Changing Its Investment Narrative?,Yahoo
2025-11-01T13:00:22,Why The 42% Return On Capital At Lowe's Companies (NYSE:LOW) Should Have Your Attention,Yahoo
2025-10-31T13:14:42,"Lowe's: Price May Follow Earnings And Recover With Consumers, But Upside Could Be Capped",SeekingAlpha
2025-10-30T16:45:02,Are You Looking for a High-Growth Dividend Stock?,Yahoo
2025-11-04T14:42:20,Pound crashes to 6 month low after Reeves speech investors brace for major tax hikes,Reddit/r/investing
2025-11-04T04:05:00,Why Does META drop to a 6 Month Low and Other Mag7 Hit All Time High?,Reddit/r/investing
2025-11-02T18:52:26,Advice on a low-performing IRA account,Reddit/r/investing
2025-10-31T05:31:52,"The Hindenburg Omen, an indicator that correctly detected the 1987 and 2008 stock market crashes, has been triggered! Thoughts?",Reddit/r/wallstreetbets
2025-10-31T05:22:59,"Stock Market Crash ""Hindenburg Omen"" Triggered 🚨 The Hindenburg Omen, an indicator that correctly detected the 1987 and 2008 stock market crashes, has been triggered!",Reddit/r/StockMarket
