Date,Title,Source
2025-11-03T14:09:20Z,Analyst Says NVIDIA (NVDA) Price/Sales Ratio is a ‘Big Number’ – ‘We Shall See’,Yahoo Entertainment
2025-11-03T14:07:26Z,NVIDIA Corporation (NVDA): Uniquely Positioned at the Center of the Global AI Computing Cycle,Yahoo Entertainment
2025-11-03T14:05:25Z,Stock Market Today: Dow Jones Index Wavers; Nvidia Rallies On Price Target Hike (Live Coverage),Biztoc.com
2025-11-03T13:22:34Z,Stock Market Today: Dow Jones Index Wavers; Nvidia Rallies On Price Target Hike (Live Coverage),Biztoc.com
2025-11-03T12:26:58Z,Iren Surges On $9.7 Billion AI Cloud Services Contract With Microsoft,Biztoc.com
2025-11-02T20:14:05Z,Nvidia Hit $5 Trillion This Week… and This New Strategy Could Find the Next Big Winner,Biztoc.com
2025-11-02T19:08:46Z,"5 American Companies Reshoring After Trump’s Tariffs (AAPl, GE, INTC, NVDA, WHR)",Biztoc.com
2025-11-02T19:08:27Z,Should You Buy Nvidia Before Nov. 19?,Biztoc.com
2025-11-02T17:11:15Z,Analyst Says Nvidia (NVDA) Has ‘Zeroed Out’ of China Revenue,Yahoo Entertainment
2025-11-02T16:33:12Z,Continues To Rise After Nvidia’s (NVDA) $1B Announcement,Biztoc.com
2025-11-02T11:24:40Z,Nvidia (NVDA) Remains Top Pick at Cantor Despite Market Bubble Concerns,Yahoo Entertainment
2025-11-01T22:53:26Z,Nvidia Just Made a Game-Changing Move,Biztoc.com
2025-11-01T19:30:12Z,"NVIDIA (NVDA) CEO Is Confident Chinese Military Won’t Use His GPUs, Says Jim Cramer",Yahoo Entertainment
2025-11-01T17:54:37Z,Continues To Rise After Nvidia’s (NVDA) $1B Announcement,Biztoc.com
2025-11-01T16:59:23Z,Continues To Rise After Nvidia’s (NVDA) $1B Announcement,Biztoc.com
2025-11-01T14:46:49Z,What Blackstone’s President Just Said About AI Should Get Nvidia Investors Really Excited,Biztoc.com
2025-10-31T23:38:53Z,Nvidia (NVDA) Seen Leading AI Race as Analysts Reaffirm Bullish Ratings,Yahoo Entertainment
2025-10-31T19:55:46Z,NVDA: Nvidia Stock Rises as Amazon Unleashes Massive AI Spending Wave,Yahoo Entertainment
2025-10-31T19:26:54Z,Nvidia CEO Jensen Huang Says You Can ‘Tokenize Anything’ But You’ll Need ‘Thousands of Chips.’ That’s Good News for NVDA Stock,Biztoc.com
2025-10-31T19:14:11Z,Nvidia CEO Jensen Huang Says You Can ‘Tokenize Anything’ But You’ll Need ‘Thousands of Chips.’ That’s Good News for NVDA Stock.,Barchart.com
2025-10-31T16:19:32Z,"As Apple Turns the Corner With the iPhone 17, Should You Buy AAPL Stock for 2026?",Biztoc.com
2025-10-31T15:24:13Z,"Trump Cools Nvidia’s China Hopes, Sending $5 Trillion AI Rally Into Pause Mode",Biztoc.com
2025-10-31T14:19:08Z,Analyst Sentiment Remains Broadly Bullish on NVIDIA (NVDA),Biztoc.com
2025-10-31T14:18:53Z,"Stock Market Today: Dow Rises On Amazon, Apple Earnings; Nvidia, Palantir Rebound (Live Coverage)",Biztoc.com
2025-10-31T13:58:29Z,Analyst Sentiment Remains Broadly Bullish on NVIDIA (NVDA),Yahoo Entertainment
2025-10-31T13:12:39Z,Can NVIDIA Become a $8 Trillion Stock By 2030?,Biztoc.com
2025-10-31T13:12:13Z,"Nvidia (NASDAQ: NVDA) Bull, Base, & Bear Price Prediction and Forecast (Oct 31)",Biztoc.com
2025-10-31T11:52:04Z,Jim Cramer Recalls When He “Doubted” NVIDIA (NVDA) CEO Jensen Huang,Yahoo Entertainment
2025-10-30T21:45:03Z,Nvidia (NVDA) Registers a Bigger Fall Than the Market: Important Facts to Note,Yahoo Entertainment
2025-10-30T08:53:45Z,Here’s What Jim Cramer Said About NVIDIA (NVDA) Ahead Of Its GTC Conference,Yahoo Entertainment
2025-10-30T02:53:06Z,Nvidia Becomes First $5 Trillion Company - WSJ - The Wall Street Journal,Slashdot.org
2025-10-30T02:22:56Z,Shares Surge 3% Today: Why One Picture Drove $400 Billion In Stock Gains,Biztoc.com
"Mon, 03 Nov 2025 22:53:23 GMT",6 Reasons You Should Sell Nvidia (NASDAQ:NVDA) - Seeking Alpha,Seeking Alpha
"Mon, 03 Nov 2025 15:51:27 GMT","Sentiment in Nvidia Turns Negative, Down to 41/100 At Market Open (NVDA) - Yahoo Finance",Yahoo Finance
"Tue, 04 Nov 2025 00:11:00 GMT",Loop Capital Maintains NVIDIA (NVDA) Buy Recommendation - Nasdaq,Nasdaq
"Mon, 03 Nov 2025 18:50:34 GMT",Nvidia Stock (NVDA) Jumps after Receiving New Street High Price Target - TipRanks,TipRanks
"Mon, 03 Nov 2025 12:06:00 GMT","NVDA Stock Has Doubled In Value So Far In 2025, But Loop Capital Sees 73% Upside - Stocktwits",Stocktwits
"Tue, 04 Nov 2025 07:24:36 GMT",Sen. Sheldon Whitehouse Sells NVIDIA Corporation (NASDAQ:NVDA) Stock - MarketBeat,MarketBeat
"Sun, 02 Nov 2025 17:11:15 GMT",Analyst Says Nvidia (NVDA) Has ‘Zeroed Out’ of China Revenue - Yahoo Finance,Yahoo Finance
"Mon, 03 Nov 2025 13:55:24 GMT","4 stocks to watch on Monday: KMB, NVDA, PLTR, CRWD (SP500:) - Seeking Alpha",Seeking Alpha
"Fri, 31 Oct 2025 13:03:32 GMT",Nvidia's CEO Shares Game-Changing News (NASDAQ:NVDA) - Seeking Alpha,Seeking Alpha
"Mon, 03 Nov 2025 14:09:20 GMT",Analyst Says NVIDIA (NVDA) Price/Sales Ratio is a ‘Big Number’ – ‘We Shall See’ - Yahoo Finance,Yahoo Finance
"Mon, 03 Nov 2025 12:52:12 GMT",Nvidia rises as Loop Capital sees $8.5T valuation with new Street high $350 price target (NVDA:NASDAQ) - Seeking Alpha,Seeking Alpha
"Mon, 03 Nov 2025 14:07:26 GMT",NVIDIA Corporation (NVDA): Uniquely Positioned at the Center of the Global AI Computing Cycle - Yahoo Finance,Yahoo Finance
"Thu, 30 Oct 2025 17:41:49 GMT",Nvidia Is Untouchable For 2026 (NASDAQ:NVDA) - Seeking Alpha,Seeking Alpha
"Sun, 02 Nov 2025 11:24:40 GMT",Nvidia (NVDA) Remains Top Pick at Cantor Despite Market Bubble Concerns - Yahoo Finance,Yahoo Finance
"Sat, 01 Nov 2025 19:30:12 GMT","NVIDIA (NVDA) CEO Is Confident Chinese Military Won’t Use His GPUs, Says Jim Cramer - Yahoo Finance",Yahoo Finance
"Fri, 31 Oct 2025 19:55:46 GMT",NVDA: Nvidia Stock Rises as Amazon Unleashes Massive AI Spending Wave - Yahoo Finance,Yahoo Finance
"Mon, 03 Nov 2025 22:17:55 GMT",NVIDIA (NASDAQ:NVDA) Trading Up 2.2% After Analyst Upgrade - MarketBeat,MarketBeat
"Fri, 31 Oct 2025 23:38:53 GMT",Nvidia (NVDA) Seen Leading AI Race as Analysts Reaffirm Bullish Ratings - Yahoo Finance,Yahoo Finance
"Tue, 04 Nov 2025 06:20:42 GMT","Michael Burry Warns AI Boom Is Repeat Of 2000's Dot-Com Bust After Revealing $1 Billion Bearish Bet On PLTR, NVDA - Benzinga",Benzinga
"Mon, 03 Nov 2025 14:07:00 GMT",NVIDIA Stock (NVDA) Opinions on AI Partnerships and Export Policies - Quiver Quantitative,Quiver Quantitative
"Mon, 03 Nov 2025 19:46:03 GMT",China to Remain Closed to Nvidia (NVDA) as Trump Officials Raise Concerns About Chip Sales - TipRanks,TipRanks
"Fri, 31 Oct 2025 13:58:29 GMT",Analyst Sentiment Remains Broadly Bullish on NVIDIA (NVDA) - Yahoo Finance,Yahoo Finance
"Tue, 04 Nov 2025 06:07:01 GMT",NVIDIA (NVDA) PT Raised to $240 at Jefferies - StreetInsider,StreetInsider
"Fri, 31 Oct 2025 07:56:03 GMT","NVDA Stock Rally Poised To Heat Up As Samsung Plans ‘AI Megafactory’ With 50,000 Nvidia GPUs - MSN",MSN
"Fri, 31 Oct 2025 12:20:47 GMT","Nvidia (NASDAQ: NVDA) Bull, Base, & Bear Price Prediction and Forecast (Oct 31) - 24/7 Wall St.",24/7 Wall St.
"Fri, 31 Oct 2025 16:18:14 GMT",Nvidia Stock (NVDA) Receives Price Target Boost from Goldman Sachs - TipRanks,TipRanks
"Fri, 31 Oct 2025 07:00:00 GMT",How to Buy Nvidia Stock (NVDA) - NerdWallet,NerdWallet
"Mon, 03 Nov 2025 14:51:27 GMT","Sentiment in Nvidia Turns Negative, Down to 41/100 At Market Open (NVDA) - 24/7 Wall St.",24/7 Wall St.
"Sat, 01 Nov 2025 17:40:37 GMT",Sentiment in Nokia (NOK) Continues To Rise After Nvidia’s (NVDA) $1B Announcement - Yahoo Finance,Yahoo Finance
"Thu, 30 Oct 2025 13:12:22 GMT",Tom Lee’s Prediction About NVIDIA (NVDA) Was Right - Insider Monkey,Insider Monkey
"Fri, 31 Oct 2025 10:24:16 GMT","Nvidia (NVDA) Set for Another ‘Beat-and-Raise’ Quarter, Says Top Goldman Sachs Analyst - TipRanks",TipRanks
"Mon, 03 Nov 2025 14:12:27 GMT",Analyst Says NVIDIA (NVDA) Price/Sales Ratio is a ‘Big Number’ – ‘We Shall See’ - Insider Monkey,Insider Monkey
"Tue, 04 Nov 2025 02:08:00 GMT",US Broker Sets NVIDIA (NVDA.US) TP at US$350 with Mkt Cap of US$8.5T - AASTOCKS.com,AASTOCKS.com
"Mon, 03 Nov 2025 05:00:42 GMT","Trump says China, others may face limits on access to Nvidia’s top AI chips (NVDA:NASDAQ) - Seeking Alpha",Seeking Alpha
"Fri, 31 Oct 2025 12:14:04 GMT",NVDA: Nvidia Seals Major Blackwell Chip Deal With South Korea - Yahoo Finance,Yahoo Finance
"Thu, 30 Oct 2025 21:45:03 GMT",Nvidia (NVDA) Registers a Bigger Fall Than the Market: Important Facts to Note - Yahoo Finance,Yahoo Finance
"Fri, 31 Oct 2025 11:52:04 GMT",Jim Cramer Recalls When He “Doubted” NVIDIA (NVDA) CEO Jensen Huang - Yahoo Finance,Yahoo Finance
"Sat, 01 Nov 2025 16:27:00 GMT",$NVDA stock rose 8% this week. Here's what we see in our data. - Quiver Quantitative,Quiver Quantitative
"Mon, 03 Nov 2025 14:43:07 GMT",Nvidia share price: NVDA stocks jump after $5 trillion AI giant gets mega boost from Donald Trump boost - The Economic Times,The Economic Times
"Mon, 03 Nov 2025 10:36:32 GMT",NVIDIA Corp (NVDA) Earns Buy Ratings on Strong Datacenter Outlook and Strategic Moves - Insider Monkey,Insider Monkey
"Thu, 30 Oct 2025 18:26:30 GMT",Nvidia: The AI Bubble Is About To Get Much Bigger (Rating Upgrade) (NASDAQ:NVDA) - Seeking Alpha,Seeking Alpha
"Mon, 03 Nov 2025 14:25:25 GMT","4 stocks to watch on Monday: KMB, NVDA, PLTR, CRWD - MSN",MSN
"Mon, 03 Nov 2025 15:10:47 GMT",Nvidia (NVDA) Stock: Trump Restricts Advanced Blackwell Chip Exports to U.S. Only - parameter.io,parameter.io
"Fri, 31 Oct 2025 16:09:33 GMT",NVDA celebrates 75 years - Vermont Business Magazine,Vermont Business Magazine
"Mon, 03 Nov 2025 18:19:00 GMT","Noteworthy Monday Option Activity: COST, NVDA, NOW - Nasdaq",Nasdaq
"Thu, 30 Oct 2025 08:53:45 GMT",Here’s What Jim Cramer Said About NVIDIA (NVDA) Ahead Of Its GTC Conference - Yahoo Finance,Yahoo Finance
"Mon, 03 Nov 2025 15:49:00 GMT","Noteworthy ETF Inflows: SMH, NVDA, TSM, MU - Nasdaq",Nasdaq
"Mon, 03 Nov 2025 10:30:57 GMT",Key resistance and support levels for NVDA - Market Trend Report & High Win Rate Trade Alerts - newser.com,newser.com
"Thu, 30 Oct 2025 14:08:03 GMT",Nvidia: The $5 Trillion Company To Buy Hand Over Fist (Rating Upgrade) (NASDAQ:NVDA) - Seeking Alpha,Seeking Alpha
"Mon, 03 Nov 2025 15:54:42 GMT","Sentiment in Nvidia Turns Negative, Down to 41/100 At Market Open (NVDA) - AOL.com",AOL.com
"Thu, 30 Oct 2025 13:30:03 GMT",Is It Worth Investing in Nvidia (NVDA) Based on Wall Street's Bullish Views? - Yahoo Finance,Yahoo Finance
"Mon, 03 Nov 2025 14:33:09 GMT",Microsoft (MSFT) Wins U.S. Green Light to Ship Nvidia (NVDA) AI Chips to UAE - TipRanks,TipRanks
"Sun, 02 Nov 2025 17:52:45 GMT","5 American Companies Reshoring After Trump’s Tariffs (AAPl, GE, INTC, NVDA, WHR) - 24/7 Wall St.",24/7 Wall St.
"Sat, 01 Nov 2025 23:53:40 GMT",Why NVIDIA (NVDA) Is Up 8.7% After Landmark AI Partnerships With Samsung and Hyundai in Korea - simplywall.st,simplywall.st
"Sat, 01 Nov 2025 16:40:37 GMT",Sentiment in Nokia (NOK) Continues To Rise After Nvidia’s (NVDA) $1B Announcement - 24/7 Wall St.,24/7 Wall St.
"Mon, 03 Nov 2025 14:20:33 GMT",Nvidia’s (NVDA) Jensen Huang Says Ignoring Huawei Is ‘Foolish’ as China Builds Its Own AI Chip Power - TipRanks,TipRanks
"Mon, 03 Nov 2025 18:37:24 GMT","NVDA Stock Rally Poised To Heat Up As Samsung Plans ‘AI Megafactory’ With 50,000 Nvidia GPUs - MSN",MSN
"Mon, 03 Nov 2025 08:23:31 GMT",NVIDIA Corporation $NVDA Shares Acquired by Richardson Financial Services Inc. - MarketBeat,MarketBeat
"Mon, 03 Nov 2025 08:23:30 GMT",One Degree Advisors Inc Raises Holdings in NVIDIA Corporation $NVDA - MarketBeat,MarketBeat
"Sun, 02 Nov 2025 19:03:25 GMT",Treasury Check - Live: Nasdaq Composite Falls 2% Premarket | NVIDIA (Nasdaq: NVDA) Down 3% - 24/7 Wall St.,24/7 Wall St.
"Fri, 31 Oct 2025 20:49:00 GMT",Nvidia (NVDA) is a Great Momentum Stock: Should You Buy? - Nasdaq,Nasdaq
"Mon, 03 Nov 2025 14:12:32 GMT",NVIDIA Corporation (NVDA): Uniquely Positioned at the Center of the Global AI Computing Cycle - Insider Monkey,Insider Monkey
"Fri, 31 Oct 2025 17:35:46 GMT","SA analyst upgrades/downgrades: AMZN, NVDA, CMG, NTLA - Seeking Alpha",Seeking Alpha
"Sun, 02 Nov 2025 17:14:52 GMT",Analyst Says Nvidia (NVDA) Has ‘Zeroed Out’ of China Revenue - Insider Monkey,Insider Monkey
"Mon, 03 Nov 2025 08:23:31 GMT",GFS Advisors LLC Raises Stock Position in NVIDIA Corporation $NVDA - MarketBeat,MarketBeat
"Mon, 03 Nov 2025 08:23:31 GMT",NVIDIA Corporation $NVDA Shares Sold by DSM Capital Partners LLC - MarketBeat,MarketBeat
"Thu, 30 Oct 2025 19:33:39 GMT",Nvidia to invest $1B in AI startup Poolside: report (NVDA:NASDAQ) - Seeking Alpha,Seeking Alpha
"Mon, 03 Nov 2025 13:39:38 GMT",Is ProShares Trust ProShares Ultra NVDA stock a defensive play amid uncertainty - July 2025 Pullbacks & Daily Stock Trend Watchlist - newser.com,newser.com
"Mon, 03 Nov 2025 08:23:32 GMT","Hemington Wealth Management Buys 1,577 Shares of NVIDIA Corporation $NVDA - MarketBeat",MarketBeat
"Sun, 02 Nov 2025 07:00:00 GMT","JPMorgan Expects Nvidia (NVDA), Other Chip Stocks to Gain from Elevated AI Spending - TipRanks",TipRanks
"Sun, 02 Nov 2025 20:15:37 GMT",Key resistance and support levels for NVDA - July 2025 PreEarnings & Intraday High Probability Alerts - newser.com,newser.com
"Fri, 31 Oct 2025 18:45:29 GMT",Nvidia: Is The $10T Market Cap Far Away? (NASDAQ:NVDA) - Seeking Alpha,Seeking Alpha
"Sun, 02 Nov 2025 21:53:34 GMT",NVIDIA Stock Price Forecast - NVDA Climbs to $202.49 as $4.92T Valuation Signal Next Leg of Growth - TradingNEWS,TradingNEWS
"Sat, 01 Nov 2025 17:51:39 GMT",Sentiment in Nokia (NOK) Continues To Rise After Nvidia’s (NVDA) $1B Announcement - AOL.com,AOL.com
"Sat, 01 Nov 2025 14:04:18 GMT",NVDA or CRWV: Top Investor Picks the Superior AI Stock to Buy - TipRanks,TipRanks
"Sun, 02 Nov 2025 06:21:37 GMT",Predicting NVDA trend using moving averages - Weekly Stock Analysis & Verified Chart Pattern Signals - newser.com,newser.com
"Sun, 02 Nov 2025 08:08:18 GMT",Eastern Bank Reduces Stock Position in NVIDIA Corporation $NVDA - MarketBeat,MarketBeat
"Mon, 03 Nov 2025 00:12:32 GMT",Trend Tracker for (NVDA) (NVDA:CA) - news.stocktradersdaily.com,news.stocktradersdaily.com
2025-11-04T08:39:23,NVDY: A Flawed Strategy On An Unstoppable Stock (Rating Upgrade),SeekingAlpha
2025-11-03T18:53:23,6 Reasons You Should Sell Nvidia,SeekingAlpha
2025-11-03T17:15:55,Is Rigetti Computing (RGTI) One of the Best Performing Stocks in the Last 3 Months?,Yahoo
2025-11-03T17:12:08,This Is Why AI Is Not a Bubble and Nvidia will Reach $10 Trillion,Yahoo
2025-11-03T16:51:27,"Sentiment in Nvidia Turns Negative, Down to 41/100 At Market Open (NVDA)",Yahoo
2025-11-03T16:42:46,"Wall Street Loves Nvidia, Palantir and Cisco",Yahoo
2025-11-03T15:09:20,Analyst Says NVIDIA (NVDA) Price/Sales Ratio is a ‘Big Number’ – ‘We Shall See’,Yahoo
2025-11-03T15:07:26,NVIDIA Corporation (NVDA): Uniquely Positioned at the Center of the Global AI Computing Cycle,Yahoo
2025-11-02T18:11:15,Analyst Says Nvidia (NVDA) Has ‘Zeroed Out’ of China Revenue,Yahoo
2025-11-02T12:24:40,Nvidia (NVDA) Remains Top Pick at Cantor Despite Market Bubble Concerns,Yahoo
2025-11-03T18:02:45,"Even if NVDA isnt in a bubble, its top can be determined by its exposure",Reddit/r/stocks
2025-11-03T16:21:23,NVDA and AMZN are in the spotlight again. Trump’s new AI chip stance might explain why,Reddit/r/stocks
2025-10-31T10:28:57,"Full port into NVDA, so now I just wait like 30 years?",Reddit/r/wallstreetbets
2025-10-31T03:21:00,Why I care more about Google than NVDA,Reddit/r/investing
2025-10-31T02:39:23,NVDA/BB & why META is a $3.2T Company,Reddit/r/investing
2025-10-30T17:25:29,"Customers cannot buy healthy fast food like CMG, CAVA; but market is telling us that $10,000 AI chips of NVDA are selling like hot cake?",Reddit/r/StockMarket
2025-10-30T16:21:10,Thoughts on selling NVDA in Roth IRA,Reddit/r/stocks
