Date,Title,Source
2025-09-15T08:40:50Z,Edwards Lifesciences (NYSE:EW) Cut to Buy at Wall Street Zen,ETF Daily News
2025-09-15T01:23:59Z,Global Stocks Hold Near Record As Focus Turns To Fed Meet: Markets Wrap,Ndtvprofit.com
2025-09-14T07:31:28Z,"3,168 Shares in Edwards Lifesciences Corporation $EW Purchased by Integrity Alliance LLC.",ETF Daily News
2025-09-13T14:34:48Z,Delta suspends employees for social media posts about Charlie Kirk,Atlanta Journal Constitution
2025-09-12T22:47:02Z,Marlon Wayans Teases Physical Transformation for 'Scary Movie 6' Return,Just Jared
2025-09-12T18:13:04Z,Marvel Zombies Teaser: Zombie Thanos with The Infinity Gauntlet? Uh-Oh,Bleeding Cool News
2025-09-12T13:33:46Z,Outlander: Blood of My Blood Recap: Everything’s Coming Up Lovat,TVLine
2025-09-12T08:08:51Z,Elbit Systems Ltd. $ESLT Stake Raised by Jones Financial Companies Lllp,ETF Daily News
2025-09-12T03:15:18Z,"An Annoying Cop Stopped This Truck Driver And Asked For Proof For His Small Breaks Every Few Hours, So He Showed Them Bottled Filled With How He Was Spending His Time",Twistedsifter.com
2025-09-12T01:07:03Z,"The Vampire Lestat: Eric Bogosian's ""Spoiler"" Has Big Twin Peaks Vibes",Bleeding Cool News
2025-09-11T21:32:50Z,‘Big Brother 27’ Brings Back BB Comics With a Superhero Twist,Buddytv.com
2025-09-11T21:04:02Z,"DSEI 2025 News Roundup: GCAP Updates, Royal Navy UAVs, Deep Strike Missiles, and More",Theaviationist.com
2025-09-11T18:56:04Z,Interview with the Vampire Season 2 Set for Sept. 30th Netflix Debut,Bleeding Cool News
2025-09-11T16:33:04Z,Bee Stingers Inspire Superior and Comfortable Continuous Drug Delivery - Good News Network,Good News Network
2025-09-11T15:40:22Z,"PEACEMAKER Season 2, Episode 4 ""Need I Say Door?"" Stills Reveal New Plot Details - SPOILERS",CBM (Comic Book Movie)
2025-09-11T15:21:00Z,Will ‘The Summer I Turned Pretty’ Finale Follow the Epilogue From the Books? Jenny Han Teases the Ending,Cosmopolitan.com
"Tue, 16 Sep 2025 05:23:43 GMT",Edwards Lifesciences Corporation $EW Shares Sold by Intech Investment Management LLC - MarketBeat,MarketBeat
"Mon, 15 Sep 2025 12:30:30 GMT","Institutional investors in Edwards Lifesciences Corporation (NYSE:EW) see US$1.5b decrease in market cap last week, although long-term gains have benefitted them. - Yahoo Finance",Yahoo Finance
"Tue, 16 Sep 2025 03:49:55 GMT",Fundamentals Check: How volatile is The EW Scripps Company stock - Weekly Profit Summary & Daily Growth Stock Tips - خودرو بانک,خودرو بانک
"Sun, 14 Sep 2025 22:51:00 GMT",Why The Bear's Jeremy Allen White Is Skipping Emmys 2025 - E! News,E! News
"Tue, 16 Sep 2025 02:38:42 GMT",MBB Public Markets I LLC Takes Position in Edwards Lifesciences Corporation $EW - MarketBeat,MarketBeat
"Mon, 15 Sep 2025 00:05:00 GMT",How to watch EW And PEOPLE's live red carpet show at the Emmys - Entertainment Weekly,Entertainment Weekly
"Fri, 12 Sep 2025 16:02:12 GMT","After budget limbo, Northrop Grumman is rapidly fielding F-16 EW suite to Middle East - Breaking Defense",Breaking Defense
"Mon, 15 Sep 2025 09:36:01 GMT",Capable of overcoming EW at 40+ km: Brave1 completes testing of kamikaze attack drones - Українські Національні Новини,Українські Національні Новини
"Mon, 15 Sep 2025 10:35:40 GMT","Jacobs & Co. CA Sells 7,261 Shares of Edwards Lifesciences Corporation $EW - MarketBeat",MarketBeat
"Mon, 15 Sep 2025 09:52:52 GMT","24,437 Shares in Edwards Lifesciences Corporation $EW Purchased by AG2R LA Mondiale Gestion D Actifs - MarketBeat",MarketBeat
"Mon, 15 Sep 2025 08:06:19 GMT",Edwards Lifesciences Corporation $EW Shares Sold by Swedbank AB - MarketBeat,MarketBeat
"Mon, 15 Sep 2025 07:56:21 GMT","Caxton Associates LLP Invests $370,000 in Edwards Lifesciences Corporation $EW - MarketBeat",MarketBeat
"Mon, 15 Sep 2025 07:48:24 GMT",Strs Ohio Makes New $9.49 Million Investment in Edwards Lifesciences Corporation $EW - MarketBeat,MarketBeat
"Tue, 16 Sep 2025 02:17:29 GMT",Is The EW Scripps Company impacted by rising rates - Earnings Recap Report & AI Enhanced Trading Signals - خودرو بانک,خودرو بانک
"Mon, 15 Sep 2025 09:28:43 GMT",Voya Investment Management LLC Lowers Position in Edwards Lifesciences Corporation $EW - MarketBeat,MarketBeat
"Fri, 12 Sep 2025 15:48:00 GMT","DSEI 2025: Leonardo confirm latest in EW – BriteCloud, BriteStorm - Airforce Technology",Airforce Technology
"Mon, 15 Sep 2025 08:54:32 GMT","Acadian Asset Management LLC Acquires 88,099 Shares of Edwards Lifesciences Corporation $EW - MarketBeat",MarketBeat
"Fri, 12 Sep 2025 09:32:42 GMT",Thales Eyes Nulka-Replacement Market With EW Drone - Aviation Week Network,Aviation Week Network
"Mon, 15 Sep 2025 20:59:11 GMT",Weekly Earnings: Will The EW Scripps Company face regulatory challenges - 2025 Retail Activity & Daily Volume Surge Signals - خودرو بانک,خودرو بانک
"Fri, 12 Sep 2025 19:00:00 GMT","Colman Domingo previews 'rollercoaster ride' of The Running Man , teases 'massive event in our cinemas' - Entertainment Weekly",Entertainment Weekly
"Mon, 15 Sep 2025 05:45:41 GMT",Edwards Lifesciences (NYSE:EW) Lowered to Buy Rating by Wall Street Zen - MarketBeat,MarketBeat
"Sun, 14 Sep 2025 10:46:51 GMT","Howe & Rusling Inc. Purchases 4,351 Shares of Edwards Lifesciences Corporation $EW - MarketBeat",MarketBeat
"Sun, 14 Sep 2025 07:00:00 GMT","Woodline Partners LP Acquires 814,917 Shares of Edwards Lifesciences Corporation $EW - MarketBeat",MarketBeat
"Sun, 14 Sep 2025 21:41:43 GMT","'Demon Slayer: Infinity Castle' topples 'The Conjuring: Last Rites,' sets new box office record - Entertainment Weekly",Entertainment Weekly
"Sun, 14 Sep 2025 10:10:43 GMT",Edwards Lifesciences Corporation $EW Stock Holdings Decreased by Militia Capital Partners LP - MarketBeat,MarketBeat
"Fri, 12 Sep 2025 13:35:36 GMT","Hanwha, BAE Systems EW protection for guided weapons - Airforce Technology",Airforce Technology
"Sat, 13 Sep 2025 08:05:30 GMT","NewEdge Advisors LLC Sells 71,678 Shares of Edwards Lifesciences Corporation $EW - MarketBeat",MarketBeat
"Sat, 13 Sep 2025 07:00:00 GMT",Vancity Investment Management Ltd Takes Position in Edwards Lifesciences Corporation $EW - MarketBeat,MarketBeat
"Fri, 12 Sep 2025 14:28:57 GMT",Emmys 2025 red carpet livestream: Watch EW and PEOPLE's pre-show - AOL.com,AOL.com
"Sat, 13 Sep 2025 07:00:00 GMT","Everstar Asset Management LLC Purchases Shares of 15,468 Edwards Lifesciences Corporation $EW - MarketBeat",MarketBeat
"Fri, 12 Sep 2025 09:11:55 GMT",Interim Report on the EW Equipment Fundraiser by PeoplesProject - People’s Project.com,People’s Project.com
"Fri, 12 Sep 2025 19:03:07 GMT","'Downton Abbey 3,' Jade's debut album, and 'Only Murders' season 5 top EW's Must List - Entertainment Weekly",Entertainment Weekly
"Mon, 15 Sep 2025 14:20:06 GMT",Will The EW Scripps Company outperform the market in YEAR - M&A Rumor & Technical Confirmation Alerts - خودرو بانک,خودرو بانک
"Sat, 13 Sep 2025 11:44:10 GMT",HENSOLDT South Africa’s GEW seals key EW deal with SAMI-AEC - Military Africa,Military Africa
"Fri, 12 Sep 2025 07:00:00 GMT",Edwards Lifesciences Corporation $EW Shares Sold by Alliancebernstein L.P. - MarketBeat,MarketBeat
"Fri, 12 Sep 2025 07:00:00 GMT",Hancock Whitney Corp Trims Stock Position in Edwards Lifesciences Corporation $EW - MarketBeat,MarketBeat
"Fri, 12 Sep 2025 07:00:00 GMT","Teza Capital Management LLC Sells 71,252 Shares of Edwards Lifesciences Corporation $EW - MarketBeat",MarketBeat
"Mon, 15 Sep 2025 13:21:24 GMT",Energy Moves: Can The EW Scripps Company reach all time highs this year - Quarterly Trade Report & Long-Term Capital Growth Ideas - خودرو بانک,خودرو بانک
"Thu, 11 Sep 2025 21:00:46 GMT","eXp World, Compass, RE/MAX, E.W. Scripps, and Cable One Stocks Trade Up, What You Need To Know - TradingView",TradingView
"Fri, 12 Sep 2025 07:00:00 GMT","Curi RMB Capital LLC Sells 12,262 Shares of Edwards Lifesciences Corporation $EW - MarketBeat",MarketBeat
"Thu, 11 Sep 2025 07:00:00 GMT",Edwards Lifesciences Corporation $EW Shares Purchased by Focus Partners Advisor Solutions LLC - MarketBeat,MarketBeat
"Thu, 11 Sep 2025 09:24:12 GMT","14,705 Shares in Edwards Lifesciences Corporation $EW Acquired by Voleon Capital Management LP - MarketBeat",MarketBeat
"Thu, 11 Sep 2025 07:00:00 GMT","Quarry LP Has $59,000 Holdings in Edwards Lifesciences Corporation $EW - MarketBeat",MarketBeat
"Fri, 12 Sep 2025 16:11:00 GMT","'SNL' cast changes: Here's everyone leaving, returning, or new for season 51 - Entertainment Weekly",Entertainment Weekly
"Thu, 11 Sep 2025 07:00:00 GMT",AQR Capital Management LLC Grows Stock Position in Edwards Lifesciences Corporation $EW - MarketBeat,MarketBeat
"Fri, 12 Sep 2025 05:47:00 GMT",Russia uses guided bombs to destroy Ukrainian electronic warfare systems — General Staff - The New Voice of Ukraine,The New Voice of Ukraine
"Thu, 11 Sep 2025 07:00:51 GMT",Thales and UK partner unveil drone-based EW solution - UK Defence Journal,UK Defence Journal
"Mon, 15 Sep 2025 03:01:25 GMT",Relative strength of The E.W. Scripps Company in sector analysis - 2025 Big Picture & Capital Efficiency Focused Ideas - newser.com,newser.com
"Mon, 15 Sep 2025 19:04:23 GMT",What machine learning models say about The E.W. Scripps Company - 2025 Technical Patterns & Free Community Supported Trade Ideas - newser.com,newser.com
"Sat, 13 Sep 2025 22:41:31 GMT",Is it time to cut losses on The E.W. Scripps Company - 2025 Top Decliners & Risk Controlled Daily Plans - newser.com,newser.com
"Sun, 14 Sep 2025 21:10:53 GMT",Backtesting results for The E.W. Scripps Company trading strategies - Weekly Volume Report & AI Driven Price Forecasts - newser.com,newser.com
2025-09-15T15:30:30,"Institutional investors in Edwards Lifesciences Corporation (NYSE:EW) see US$1.5b decrease in market cap last week, although long-term gains have benefitted them.",Yahoo
