Date,Title,Source
"Sat, 06 Sep 2025 14:19:51 GMT",Can New CHRO Appointment Signal a Shift in Kimberly-Clark (KMB)'s Talent Strategy? - simplywall.st,simplywall.st
"Sat, 06 Sep 2025 20:12:23 GMT",Kimberly-Clark Co. $KMB Shares Acquired by Royal Bank of Canada - MarketBeat,MarketBeat
"Thu, 04 Sep 2025 14:57:00 GMT",Interesting KMB Put And Call Options For October 24th - Nasdaq,Nasdaq
"Sat, 06 Sep 2025 13:11:01 GMT","DoubleLine ETF Adviser LP Sells 3,738 Shares of Kimberly-Clark Co. $KMB - MarketBeat",MarketBeat
"Sat, 06 Sep 2025 11:31:08 GMT","Banque Transatlantique SA Purchases Shares of 4,165 Kimberly-Clark Co. $KMB - MarketBeat",MarketBeat
"Sat, 06 Sep 2025 11:32:42 GMT",Kimberly-Clark Co. $KMB Shares Purchased by Advisors Asset Management Inc. - MarketBeat,MarketBeat
"Sat, 06 Sep 2025 10:53:08 GMT",Amundi Reduces Position in Kimberly-Clark Co. $KMB - MarketBeat,MarketBeat
"Sat, 06 Sep 2025 10:57:57 GMT","Alyeska Investment Group L.P. Purchases Shares of 284,219 Kimberly-Clark Co. $KMB - MarketBeat",MarketBeat
"Fri, 05 Sep 2025 07:00:00 GMT","Panagora Asset Management Inc. Acquires 14,990 Shares of Kimberly-Clark Co. $KMB - MarketBeat",MarketBeat
"Fri, 05 Sep 2025 07:00:00 GMT",Kimberly-Clark Co. $KMB Stock Holdings Decreased by OMERS ADMINISTRATION Corp - MarketBeat,MarketBeat
"Fri, 05 Sep 2025 07:00:00 GMT",Vident Advisory LLC Has $2.26 Million Position in Kimberly-Clark Co. $KMB - MarketBeat,MarketBeat
"Thu, 04 Sep 2025 07:00:00 GMT",Kimberly-Clark Co. $KMB Shares Sold by Rafferty Asset Management LLC - MarketBeat,MarketBeat
"Thu, 04 Sep 2025 07:00:00 GMT",Wellington Management Group LLP Increases Stake in Kimberly-Clark Co. $KMB - MarketBeat,MarketBeat
"Thu, 04 Sep 2025 07:00:00 GMT",Magnetar Financial LLC Takes Position in Kimberly-Clark Co. $KMB - MarketBeat,MarketBeat
"Thu, 04 Sep 2025 07:00:00 GMT","Ieq Capital LLC Buys 13,802 Shares of Kimberly-Clark Co. $KMB - MarketBeat",MarketBeat
"Wed, 03 Sep 2025 07:00:00 GMT","Quantbot Technologies LP Has $130,000 Holdings in Kimberly-Clark Co. $KMB - MarketBeat",MarketBeat
"Tue, 02 Sep 2025 07:00:00 GMT","Guggenheim Capital LLC Buys 3,832 Shares of Kimberly-Clark Co. $KMB - MarketBeat",MarketBeat
"Tue, 02 Sep 2025 07:00:00 GMT",Quadcap Wealth Management LLC Trims Stock Position in Kimberly-Clark Co. $KMB - MarketBeat,MarketBeat
"Wed, 03 Sep 2025 12:28:09 GMT",Kimberly Clark : KMB Barclays 2025 Presentation - MarketScreener,MarketScreener
"Sun, 07 Sep 2025 02:29:51 GMT",The Manufacturers Life Insurance Company Lowers Stock Holdings in Kimberly-Clark Co. $KMB - MarketBeat,MarketBeat
"Sat, 06 Sep 2025 22:07:01 GMT","Dark Forest Capital Management LP Purchases 7,354 Shares of Kimberly-Clark Co. $KMB - MarketBeat",MarketBeat
"Fri, 05 Sep 2025 07:00:00 GMT",Canada Pension Plan Investment Board Has $70.39 Million Stake in Kimberly-Clark Co. $KMB - MarketBeat,MarketBeat
"Wed, 03 Sep 2025 14:26:15 GMT","Freedom Investment Management Inc. Makes New $300,000 Investment in Kimberly-Clark Co. $KMB - MarketBeat",MarketBeat
"Wed, 03 Sep 2025 14:26:15 GMT",Landscape Capital Management L.L.C. Takes $1.70 Million Position in Kimberly-Clark Co. $KMB - MarketBeat,MarketBeat
"Sat, 06 Sep 2025 21:06:54 GMT",58-year-old KMB bus driver passes away at Sun Tin Wai Bus Terminus - Dimsum Daily,Dimsum Daily
2025-09-03T13:16:30,Kimberly-Clark Corporation (KMB) Presents At Barclays 18th Annual Global Consumer Staples Conference 2025 Transcript,SeekingAlpha
2025-09-03T13:15:43,Kimberly-Clark Corporation (KMB) Presents at Barclays 18th Annual Global Consumer Staples Conference 2025,SeekingAlpha
2025-09-02T23:10:00,Kimberly-Clark to Webcast its Presentation at Piper Sandler's Growth Frontiers Conference,Yahoo
