Date,Title,Source
2025-11-03T16:40:14Z,Why Is MongoDB Stock Trading Higher Today?,Biztoc.com
2025-11-03T14:53:02Z,MDB Stock Update: Major Leadership Change Fuels Surge in Share Price,International Business Times
"Wed, 05 Nov 2025 17:17:02 GMT",MongoDB (MDB): Evaluating Valuation After CEO Appointment and Strong Q3 Outlook - Yahoo Finance,Yahoo Finance
"Thu, 06 Nov 2025 04:40:35 GMT",Custom strategy builders for tracking MDB Capital Holdings LLC - Recession Risk & Verified Chart Pattern Trade Signals - newser.com,newser.com
"Thu, 06 Nov 2025 01:57:01 GMT",MongoDB (MDB) Dips More Than Broader Market: What You Should Know - sharewise.com,sharewise.com
"Mon, 03 Nov 2025 13:30:00 GMT",MongoDB (NASDAQ: MDB) expects Q3 FY26 above guidance; CJ Desai appointed CEO - Stock Titan,Stock Titan
"Wed, 05 Nov 2025 19:16:50 GMT",MongoDB (NASDAQ:MDB) Price Target Raised to $415.00 at DA Davidson - MarketBeat,MarketBeat
"Wed, 05 Nov 2025 14:17:44 GMT",Analysts Conflicted on These Technology Names: MongoDB (MDB) and ON Semiconductor (ON) - The Globe and Mail,The Globe and Mail
"Wed, 05 Nov 2025 13:47:45 GMT",MongoDB (MDB) Added to Wedbush Best Ideas List as AI Use Cases Expand - MSN,MSN
"Thu, 06 Nov 2025 03:52:57 GMT",Will Tradr 2X Long MDB Daily stock beat international competition - 2025 Market Outlook & Technical Pattern Based Signals - fcp.pa.gov.br,fcp.pa.gov.br
"Wed, 05 Nov 2025 17:10:02 GMT",Will MongoDB (MDB) Beat Estimates Again in Its Next Earnings Report? - Yahoo Finance,Yahoo Finance
"Wed, 05 Nov 2025 00:11:00 GMT",DA Davidson Maintains MongoDB (MDB) Buy Recommendation - Nasdaq,Nasdaq
"Wed, 05 Nov 2025 15:57:16 GMT",MongoDB (MDB): New Buy Recommendation for This Technology Giant - The Globe and Mail,The Globe and Mail
"Wed, 05 Nov 2025 14:37:31 GMT",Royal Bank Of Canada Forecasts Strong Price Appreciation for MongoDB (NASDAQ:MDB) Stock - MarketBeat,MarketBeat
"Wed, 05 Nov 2025 02:36:22 GMT",How geopolitical tensions affect MDB Capital Holdings LLC stock - July 2025 Volume & Comprehensive Market Scan Reports - newser.com,newser.com
"Tue, 04 Nov 2025 20:05:35 GMT",Why MongoDB (MDB) Is Up 8.5% After Naming CJ Desai CEO and Beating Q3 Expectations - Yahoo Finance,Yahoo Finance
"Wed, 05 Nov 2025 05:47:57 GMT",Is Tradr 2X Long MDB Daily stock a buy before earnings results - July 2025 Volume & Daily Growth Stock Tips - newser.com,newser.com
"Tue, 04 Nov 2025 05:32:23 GMT",MongoDB (MDB): Evaluating Valuation After CEO Transition Announcement and Upbeat Revenue Outlook - simplywall.st,simplywall.st
"Wed, 05 Nov 2025 02:57:44 GMT",How to monitor MDB Capital Holdings LLC with trend dashboards - Quarterly Market Review & Consistent Profit Trading Strategies - newser.com,newser.com
"Wed, 05 Nov 2025 15:47:35 GMT",Will Tradr 2X Long MDB Daily stock rise with strong economy - New Guidance & High Accuracy Trade Signal Alerts - newser.com,newser.com
"Wed, 05 Nov 2025 00:31:13 GMT",Using fundamentals and technicals on MDB Capital Holdings LLC - Quarterly Growth Report & Real-Time Market Sentiment Reports - newser.com,newser.com
"Wed, 05 Nov 2025 11:39:13 GMT","Next Capital Management LLC Invests $902,000 in MongoDB, Inc. $MDB - MarketBeat",MarketBeat
"Wed, 05 Nov 2025 13:23:30 GMT",MongoDB (NASDAQ:MDB) Given New $435.00 Price Target at Citizens Jmp - MarketBeat,MarketBeat
"Wed, 05 Nov 2025 13:23:31 GMT",Rosenblatt Securities Forecasts Strong Price Appreciation for MongoDB (NASDAQ:MDB) Stock - MarketBeat,MarketBeat
"Wed, 05 Nov 2025 00:12:02 GMT",Can Tradr 2X Long MDB Daily stock reach $200 price target - Price Action & Advanced Swing Trade Entry Plans - newser.com,newser.com
"Tue, 04 Nov 2025 21:05:00 GMT",MongoDB (NASDAQ: MDB) sets earnings call for Dec 1 at 5:00 p.m. ET with webcast - Stock Titan,Stock Titan
"Tue, 04 Nov 2025 04:10:27 GMT",Can MDB Capital Holdings LLC stock surprise with earnings upside - Insider Buying & Weekly Market Pulse Alerts - newser.com,newser.com
"Tue, 04 Nov 2025 13:41:15 GMT",Here’s Why Wall Street Is Queuing Behind MongoDB’s New CEO as MDB Stock Falls - TipRanks,TipRanks
"Wed, 05 Nov 2025 00:31:31 GMT",BMO Capital Raises Price Target for MongoDB (MDB) to $415 | MDB Stock News - GuruFocus,GuruFocus
"Tue, 04 Nov 2025 00:12:35 GMT",Why MDB Capital Holdings LLC stock is trending among retail traders - Weekly Trend Summary & High Return Trade Opportunity Guides - newser.com,newser.com
"Mon, 03 Nov 2025 20:26:00 GMT","Notable Monday Option Activity: MDB, UBER, GME - Nasdaq",Nasdaq
"Wed, 05 Nov 2025 08:55:04 GMT","Assetmark Inc. Sells 15,975 Shares of MongoDB, Inc. $MDB - MarketBeat",MarketBeat
"Wed, 05 Nov 2025 11:43:50 GMT",Can Tradr 2X Long MDB Daily stock expand revenue streams - 2025 Earnings Surprises & Proven Capital Preservation Methods - newser.com,newser.com
"Tue, 04 Nov 2025 17:05:09 GMT",MongoDB (MDB) Maintained as Outperform with Price Target Raised by RBC Capital | MDB Stock News - GuruFocus,GuruFocus
"Mon, 03 Nov 2025 14:53:02 GMT",MDB Stock Update: Major Leadership Change Fuels Surge in Share Price - International Business Times,International Business Times
"Wed, 05 Nov 2025 10:49:28 GMT",Can Tradr 2X Long MDB Daily stock expand revenue streams - Quarterly Profit Review & Reliable Price Action Trade Plans - newser.com,newser.com
"Tue, 04 Nov 2025 16:53:02 GMT",MongoDB (MDB) Receives Target Price Upgrade from Truist Securities | MDB Stock News - GuruFocus,GuruFocus
"Wed, 05 Nov 2025 08:40:36 GMT","Arkadios Wealth Advisors Invests $499,000 in MongoDB, Inc. $MDB - MarketBeat",MarketBeat
"Tue, 04 Nov 2025 19:23:50 GMT",MDB Stock Sees Target Price Upgrade by DA Davidson Analyst | MDB - GuruFocus,GuruFocus
"Wed, 05 Nov 2025 07:56:59 GMT","New Buy Rating for MongoDB (MDB), the Technology Giant - The Globe and Mail",The Globe and Mail
"Mon, 03 Nov 2025 13:58:51 GMT",Custom strategy builders for tracking MDB Capital Holdings LLC - Quarterly Market Review & Fast Gain Swing Alerts - newser.com,newser.com
"Tue, 04 Nov 2025 15:45:25 GMT",MongoDB (NASDAQ:MDB) Releases Q3 2026 Earnings Guidance - MarketBeat,MarketBeat
"Wed, 05 Nov 2025 00:04:24 GMT",MDB: Rosenblatt Raises Price Target to $385 and Maintains Buy Ra - GuruFocus,GuruFocus
"Tue, 04 Nov 2025 13:55:30 GMT","MDB's Price Target Raised by Citizens, Maintains Market Outperfo - GuruFocus",GuruFocus
"Mon, 03 Nov 2025 09:25:43 GMT",Technical analysis overview for MDB Capital Holdings LLC stock - Weekly Investment Summary & Low Volatility Stock Recommendations - newser.com,newser.com
"Mon, 03 Nov 2025 13:50:04 GMT",MongoDB surges as it announces leadership change reaffirms guidance (MDB:NASDAQ) - Seeking Alpha,Seeking Alpha
"Tue, 04 Nov 2025 16:25:13 GMT",MongoDB (NASDAQ:MDB) Sets New 1-Year High - Here's Why - MarketBeat,MarketBeat
"Tue, 04 Nov 2025 10:50:18 GMT","5,428 Shares in MongoDB, Inc. $MDB Acquired by Machina Capital S.A.S. - MarketBeat",MarketBeat
"Wed, 05 Nov 2025 09:00:41 GMT",How geopolitical tensions affect MDB Capital Holdings LLC stock - 2025 Trading Recap & Consistent Growth Stock Picks - newser.com,newser.com
"Wed, 05 Nov 2025 09:23:38 GMT","D.A. Davidson Maintains MongoDB(MDB.US) With Buy Rating, Raises Target Price to $415 - 富途牛牛",富途牛牛
"Wed, 05 Nov 2025 04:17:24 GMT",How institutional ownership impacts MDB Capital Holdings LLC stock - Day Trade & AI Driven Stock Price Forecasts - newser.com,newser.com
"Tue, 04 Nov 2025 13:52:19 GMT",MongoDB (MDB) Projects Strong Q3 FY2026 Financial Performance - GuruFocus,GuruFocus
"Tue, 04 Nov 2025 09:37:27 GMT","Plato Investment Management Ltd Purchases Shares of 1,687 MongoDB, Inc. $MDB - MarketBeat",MarketBeat
"Tue, 04 Nov 2025 02:20:25 GMT","MongoDB, Inc. (NASDAQ:MDB) Short Interest Down 36.2% in October - MarketBeat",MarketBeat
"Mon, 03 Nov 2025 18:56:15 GMT",MongoDB (MDB) Announces CEO Transition - GuruFocus,GuruFocus
"Tue, 04 Nov 2025 10:18:22 GMT",Why MDB Capital Holdings LLC stock is trending among retail traders - July 2025 Highlights & Real-Time Volume Analysis - newser.com,newser.com
"Mon, 03 Nov 2025 15:27:54 GMT",MongoDB (MDB) Shares Surge as New CEO Announced - GuruFocus,GuruFocus
"Tue, 04 Nov 2025 07:44:13 GMT",Custom strategy builders for tracking MDB Capital Holdings LLC - July 2025 Action & Risk Controlled Stock Alerts - newser.com,newser.com
"Mon, 03 Nov 2025 14:29:37 GMT",MongoDB (MDB) Announces New Leadership with CJ Desai as CEO - GuruFocus,GuruFocus
"Tue, 04 Nov 2025 08:02:54 GMT",Can Tradr 2X Long MDB Daily stock reach $200 price target - Bear Alert & Fast Gain Swing Alerts - newser.com,newser.com
"Tue, 04 Nov 2025 13:00:01 GMT","A Quick Look at Today's Ratings for MongoDB(MDB.US), With a Forecast Between $375 to $440 - 富途牛牛",富途牛牛
"Sun, 02 Nov 2025 11:40:13 GMT","Uniting Wealth Partners LLC Sells 1,000 Shares of MongoDB, Inc. $MDB - MarketBeat",MarketBeat
"Sun, 02 Nov 2025 09:06:04 GMT","Y Intercept Hong Kong Ltd Trims Position in MongoDB, Inc. $MDB - MarketBeat",MarketBeat
"Mon, 03 Nov 2025 10:13:52 GMT","Welch & Forbes LLC Cuts Position in MongoDB, Inc. $MDB - MarketBeat",MarketBeat
"Mon, 03 Nov 2025 12:14:33 GMT","Eleva Capital SAS Makes New $815,000 Investment in MongoDB, Inc. $MDB - MarketBeat",MarketBeat
"Mon, 03 Nov 2025 12:25:21 GMT","Nicholas Company Inc. Decreases Stock Holdings in MongoDB, Inc. $MDB - MarketBeat",MarketBeat
"Mon, 03 Nov 2025 08:39:33 GMT","MongoDB, Inc. $MDB Shares Acquired by Teacher Retirement System of Texas - MarketBeat",MarketBeat
"Mon, 03 Nov 2025 09:19:39 GMT","Simon Quick Advisors LLC Invests $423,000 in MongoDB, Inc. $MDB - MarketBeat",MarketBeat
"Mon, 03 Nov 2025 08:44:52 GMT",Is it time to cut losses on MDB Capital Holdings LLC - 2025 Historical Comparison & Fast Gain Stock Trading Tips - newser.com,newser.com
"Mon, 03 Nov 2025 16:07:15 GMT","U.S. Stock Movement | Following Announcement of Significant Leadership Changes, MongoDB (MDB.US) Rises Over 2.5% - 富途牛牛",富途牛牛
"Mon, 03 Nov 2025 06:39:35 GMT",MDB Capital Holdings LLC stock trend forecast - July 2025 Setups & Consistent Growth Equity Picks - newser.com,newser.com
"Wed, 05 Nov 2025 11:10:42 GMT","Envestnet Asset Management Inc. Reduces Position in MongoDB, Inc. $MDB - Defense World",Defense World
"Wed, 05 Nov 2025 10:25:40 GMT",MongoDB (NASDAQ:MDB) Price Target Raised to $415.00 at DA Davidson - Defense World,Defense World
"Wed, 05 Nov 2025 09:10:33 GMT","AlphaQuest LLC Purchases 468 Shares of MongoDB, Inc. $MDB - Defense World",Defense World
"Wed, 05 Nov 2025 22:54:29 GMT",MDB President criticizes minister after speech about Enel – 11/05/2025 – Panel - lnginnorthernbc.ca,lnginnorthernbc.ca
2025-11-04T15:12:51,BofA lifts MongoDB shares target on smooth CEO transition,Yahoo
2025-11-03T14:30:00,MongoDB Announces Leadership Transition,Yahoo
2025-11-03T14:26:24,"MongoDB, Inc. (MDB) Discusses Leadership Transition and Reflections on Company Growth Transcript",SeekingAlpha
