Date,Title,Source
2025-09-15T09:04:55Z,"Kera Capital Partners Inc. Invests $233,000 in Datadog, Inc. $DDOG",ETF Daily News
2025-09-15T08:26:02Z,"Datadog, Inc. $DDOG Shares Sold by Swedbank AB",ETF Daily News
2025-09-15T07:40:52Z,"Acadian Asset Management LLC Sells 501,038 Shares of Datadog, Inc. $DDOG",ETF Daily News
2025-09-13T13:53:23Z,Datadog Inc. (DDOG)’s AI Initiatives Accelerating Growth,Yahoo Entertainment
2025-09-13T09:43:07Z,"Ashton Thomas Private Wealth LLC Buys 134 Shares of Datadog, Inc. $DDOG",ETF Daily News
2025-09-13T07:34:52Z,"Jacobs Levy Equity Management Inc. Takes Position in Datadog, Inc. $DDOG",ETF Daily News
"Mon, 15 Sep 2025 13:23:29 GMT",Do You Believe in Datadog’s (DDOG) Growth Potential? - Yahoo Finance,Yahoo Finance
"Tue, 16 Sep 2025 03:21:54 GMT","Bayforest Capital Ltd Grows Stock Position in Datadog, Inc. $DDOG - MarketBeat",MarketBeat
"Tue, 16 Sep 2025 04:03:00 GMT",2 Reasons to Watch DDOG and 1 to Stay Cautious - FinancialContent,FinancialContent
"Mon, 15 Sep 2025 17:59:41 GMT",Do You Believe in Datadog’s (DDOG) Growth Potential? - MSN,MSN
"Fri, 12 Sep 2025 18:36:34 GMT",Datadog (DDOG) Expands Board With Appointment Of Former WhatsApp Product Leader - simplywall.st,simplywall.st
"Mon, 15 Sep 2025 21:07:37 GMT",Quarterly Trades: Can DDOG weather a recession - Forecast Cut & AI Optimized Trading Strategy Guides - خودرو بانک,خودرو بانک
"Sat, 13 Sep 2025 13:53:23 GMT",Datadog Inc. (DDOG)’s AI Initiatives Accelerating Growth - Yahoo Finance,Yahoo Finance
"Mon, 15 Sep 2025 07:26:19 GMT","Jacobs Levy Equity Management Inc. Takes $739,000 Position in Datadog, Inc. $DDOG - MarketBeat",MarketBeat
"Mon, 15 Sep 2025 08:02:18 GMT","59,712 Shares in Datadog, Inc. $DDOG Purchased by Woodline Partners LP - MarketBeat",MarketBeat
"Mon, 15 Sep 2025 08:16:24 GMT","Ascent Group LLC Acquires New Position in Datadog, Inc. $DDOG - MarketBeat",MarketBeat
"Sun, 14 Sep 2025 11:03:03 GMT","Voya Investment Management LLC Decreases Stock Position in Datadog, Inc. $DDOG - MarketBeat",MarketBeat
"Fri, 12 Sep 2025 21:45:03 GMT",Here's Why Datadog (DDOG) Fell More Than Broader Market - Yahoo Finance,Yahoo Finance
"Sun, 14 Sep 2025 07:00:00 GMT","Prostatis Group LLC Takes Position in Datadog, Inc. $DDOG - MarketBeat",MarketBeat
"Fri, 12 Sep 2025 12:00:14 GMT",Earnings growth outpaced the decent 9.8% CAGR delivered to Datadog (NASDAQ:DDOG) shareholders over the last five years - Yahoo Finance,Yahoo Finance
"Sun, 14 Sep 2025 07:00:00 GMT","Datadog, Inc. $DDOG Shares Bought by NewEdge Advisors LLC - MarketBeat",MarketBeat
"Sat, 13 Sep 2025 07:00:00 GMT","Datadog, Inc. $DDOG Stock Position Lifted by Advisors Asset Management Inc. - MarketBeat",MarketBeat
"Fri, 12 Sep 2025 07:00:00 GMT","Temasek Holdings Private Ltd Raises Holdings in Datadog, Inc. $DDOG - MarketBeat",MarketBeat
"Mon, 15 Sep 2025 08:23:07 GMT",Short Covering: Is DDOG stock suitable for long term investing - Jobs Report & Consistent Profit Trade Alerts - خودرو بانک,خودرو بانک
"Fri, 12 Sep 2025 07:00:00 GMT","Infinitum Asset Management LLC Purchases Shares of 50,000 Datadog, Inc. $DDOG - MarketBeat",MarketBeat
"Fri, 12 Sep 2025 07:00:00 GMT","Focus Partners Advisor Solutions LLC Takes Position in Datadog, Inc. $DDOG - MarketBeat",MarketBeat
"Fri, 12 Sep 2025 07:00:00 GMT","11,275 Shares in Datadog, Inc. $DDOG Purchased by Scientech Research LLC - MarketBeat",MarketBeat
"Fri, 12 Sep 2025 07:00:00 GMT","Interval Partners LP Acquires New Holdings in Datadog, Inc. $DDOG - MarketBeat",MarketBeat
"Fri, 12 Sep 2025 01:10:01 GMT",Datadog (DDOG) Expands Board with New Appointment - GuruFocus,GuruFocus
"Thu, 11 Sep 2025 09:40:20 GMT","Curi RMB Capital LLC Grows Position in Datadog, Inc. $DDOG - MarketBeat",MarketBeat
"Thu, 11 Sep 2025 07:00:00 GMT","Petrus Trust Company LTA Boosts Holdings in Datadog, Inc. $DDOG - MarketBeat",MarketBeat
"Thu, 11 Sep 2025 07:51:23 GMT","AQR Capital Management LLC Acquires 469,642 Shares of Datadog, Inc. $DDOG - MarketBeat",MarketBeat
"Tue, 16 Sep 2025 03:03:20 GMT",Will earnings trigger a reversal in DDOG - Chart Signals & Entry Point Confirmation Alerts - newser.com,newser.com
"Mon, 15 Sep 2025 07:05:11 GMT",Is DDOG a candidate for recovery play - Options Play & Reliable Entry Point Trade Alerts - newser.com,newser.com
"Mon, 15 Sep 2025 03:40:09 GMT",Key resistance and support levels for DDOG - Weekly Trade Analysis & Verified Momentum Watchlists - newser.com,newser.com
"Sun, 14 Sep 2025 14:27:11 GMT",Will earnings trigger a reversal in DDOG - Earnings Overview Summary & Real-Time Chart Pattern Alerts - newser.com,newser.com
"Mon, 15 Sep 2025 07:01:41 GMT",Analyzing net buyer seller activity in DDOG - 2025 Bull vs Bear & Daily Growth Stock Investment Tips - newser.com,newser.com
"Sun, 14 Sep 2025 20:26:40 GMT",Applying sector rotation models to DDOG - July 2025 Recap & Pattern Based Trade Signal System - newser.com,newser.com
"Sun, 14 Sep 2025 15:05:36 GMT",Analyzing DDOG with risk reward ratio charts - 2025 Market Overview & Smart Allocation Stock Reports - newser.com,newser.com
"Sun, 14 Sep 2025 15:15:28 GMT",What’s next for DDOG stock price - Market Volume Summary & Reliable Momentum Entry Alerts - newser.com,newser.com
"Sun, 14 Sep 2025 14:02:47 GMT",Analyzing net buyer seller activity in DDOG - Trade Analysis Report & Weekly Momentum Picks - newser.com,newser.com
"Mon, 15 Sep 2025 13:26:44 GMT",Do You Believe in Datadog’s (DDOG) Growth Potential? - Insider Monkey,Insider Monkey
"Sat, 13 Sep 2025 14:05:59 GMT",Datadog Inc. (DDOG)’s AI Initiatives Accelerating Growth - Insider Monkey,Insider Monkey
"Sun, 14 Sep 2025 18:11:28 GMT",applying sector rotation models to ddog - Earnings Overview Report & Consistent Return Strategy Ideas - newser.com,newser.com
"Sun, 14 Sep 2025 16:56:19 GMT",Analyzing DDOG with risk reward ratio charts - July 2025 Market Mood & High Return Trade Guides - newser.com,newser.com
"Fri, 12 Sep 2025 12:00:14 GMT",Earnings growth outpaced the decent 9.8% CAGR delivered to Datadog (NASDAQ:DDOG) shareholders over the last five years - beritasriwijaya.co.id,beritasriwijaya.co.id
"Sat, 13 Sep 2025 08:29:27 GMT","Integrated Wealth Concepts LLC Has $797,000 Stake in Datadog, Inc. $DDOG - Defense World",Defense World
"Sat, 13 Sep 2025 07:37:31 GMT","Jacobs Levy Equity Management Inc. Takes Position in Datadog, Inc. $DDOG - Defense World",Defense World
2025-09-15T16:23:29,Do You Believe in Datadog’s (DDOG) Growth Potential?,Yahoo
2025-09-13T16:53:23,Datadog Inc. (DDOG)’s AI Initiatives Accelerating Growth,Yahoo
2025-09-13T00:45:03,Here's Why Datadog (DDOG) Fell More Than Broader Market,Yahoo
2025-09-12T21:17:52,Datadog (DDOG) Expands Board With Appointment Of Former WhatsApp Product Leader,Yahoo
2025-09-12T15:00:14,Earnings growth outpaced the decent 9.8% CAGR delivered to Datadog (NASDAQ:DDOG) shareholders over the last five years,Yahoo
2025-09-11T23:05:00,Datadog Appoints Ami Vora to Its Board of Directors,Yahoo
