Date,Title,Source
"Fri, 29 Aug 2025 21:00:58 GMT","AMD Stock Price Eyes $223 (NASDAQ:AMD) Rides AI Surge, Gaming Rebound, and IBM Quantum Deal - tradingnews.com",tradingnews.com
"Fri, 29 Aug 2025 14:49:36 GMT",AMD: There Is Still Time To Accumulate Shares (NASDAQ:AMD) - Seeking Alpha,Seeking Alpha
"Fri, 29 Aug 2025 18:16:00 GMT","AMD Ryzen CPUs fry twice in the face of heavy math load, GMP says - theregister.com",theregister.com
"Sat, 30 Aug 2025 00:35:53 GMT",Outlook’s wet AMD candidate hit with second FDA snub in two years - Pharmaceutical Technology,Pharmaceutical Technology
"Fri, 29 Aug 2025 14:55:16 GMT",AMD Stock Dips as U.S. Government Invests $5.7B In Rival Chipmaker - TipRanks,TipRanks
"Fri, 29 Aug 2025 19:13:10 GMT",What Does Wall Street Think About Advanced Micro Devices (AMD)? - Yahoo Finance,Yahoo Finance
"Sat, 30 Aug 2025 05:25:29 GMT",AMD Stock Dips as U.S. Government Invests $5.7B In Rival Chipmaker - MSN,MSN
"Fri, 29 Aug 2025 18:47:00 GMT",Watch: AMD talks ROCm and how it’s a game-changer for Radeon PCs - PCWorld,PCWorld
"Tue, 26 Aug 2025 20:49:00 GMT",AMD Stock Upgraded To Buy. What Caused The Change In Sentiment? - Investor's Business Daily,Investor's Business Daily
"Tue, 26 Aug 2025 10:01:43 GMT",IBM and AMD reach quantum computing partnership - Axios,Axios
"Sat, 30 Aug 2025 01:22:03 GMT",AMD Stock Tumbles 3.53% on Sector-Wide Selling as $6.14B Volume Ranks 11th in Equity Market - AInvest,AInvest
"Sat, 30 Aug 2025 00:13:43 GMT",Intel admits 'we kind of fumbled the football' on desktop CPUs: Nova Lake to better fight AMD - TweakTown,TweakTown
"Fri, 29 Aug 2025 20:20:00 GMT",Intel CFO Says It Will Take The Fight To AMD With Nova Lake On Desktop - HotHardware,HotHardware
"Thu, 28 Aug 2025 17:09:59 GMT",ASRock releases new firmware for AMD 800-series motherboards to 'enhance CPU operating stability' — update may address the AM5 burning socket crisis - Tom's Hardware,Tom's Hardware
"Sat, 30 Aug 2025 04:00:00 GMT",AMD says goodbye to Wraith Prism and Wraith Spire: End of an era for boxed coolers - igor´sLAB,igor´sLAB
"Sat, 30 Aug 2025 03:46:27 GMT",Advanced Micro Devices Inc. (AMD) Partners with IBM to Advance Quantum Computing Technology - Yahoo Finance,Yahoo Finance
"Fri, 29 Aug 2025 16:09:29 GMT",AMD: Left In Nvidia's Dust As Valuations Reach Excessive Levels (Downgrade) (NASDAQ:AMD) - Seeking Alpha,Seeking Alpha
"Tue, 26 Aug 2025 14:37:00 GMT",IBM Teams Up With AMD For Quantum Computing Push. Stocks Rise. - Investor's Business Daily,Investor's Business Daily
"Fri, 29 Aug 2025 15:49:00 GMT",AMD's AI Journey Rides on Strong Partner Base: What's the Path Ahead? - Yahoo Finance,Yahoo Finance
"Tue, 26 Aug 2025 10:02:17 GMT",IBM and AMD Join Forces to Build the Future of Computing - IBM Newsroom,IBM Newsroom
"Fri, 29 Aug 2025 14:25:53 GMT","According to a Linkedin profile, AMD is working on another chiplet-based GPU — UDNA could herald the return of 2.5D/ 3.5D chiplet-based configuration - Tom's Hardware",Tom's Hardware
"Fri, 29 Aug 2025 12:41:35 GMT",AMD advances your potential at Adobe MAX 2025 - the Adobe Blog,the Adobe Blog
"Tue, 26 Aug 2025 16:17:00 GMT",2 Reasons AMD Stock Is Rising Today - Barron's,Barron's
"Tue, 26 Aug 2025 14:32:00 GMT",AMD’s stock is rising as the competitive battle with Nvidia enters a new dimension - MarketWatch,MarketWatch
"Sat, 30 Aug 2025 03:34:19 GMT",20th PC running AMD's flagship 16-core Ryzen AI Max+ 395 APU just launched - but I'm still waiting for Dell to finally release one - MSN,MSN
"Fri, 29 Aug 2025 17:46:31 GMT",Why AMD (AMD) Shares Are Sliding Today - Yahoo Finance,Yahoo Finance
"Thu, 28 Aug 2025 13:54:12 GMT",Trump's Nvidia-AMD deal adds to the legal questions about US trade policies - Peterson Institute for International Economics,Peterson Institute for International Economics
"Wed, 27 Aug 2025 00:16:21 GMT",AMD Dives Deep on CDNA 4 Architecture and MI350 Accelerator at Hot Chips 2025 - ServeTheHome,ServeTheHome
"Fri, 29 Aug 2025 17:29:26 GMT",A new 16GB AMD Radeon RX 9070 GPU is reportedly on the way with a cheaper price - PCGamesN,PCGamesN
"Thu, 28 Aug 2025 10:05:50 GMT","Intel and AMD’s Entire CPU Roadmap Until 2027 Revealed in Leak — Prepare for Core Ultra 400, Medusa Ryzen and More - Tom's Guide",Tom's Guide
"Thu, 28 Aug 2025 00:30:00 GMT",Disappointed AMD doesn't have a high-end GPU anymore? Good news - all rumors point to an incoming RTX 5090 rival - TechRadar,TechRadar
"Wed, 27 Aug 2025 14:48:12 GMT","Asus Vivobook S14 review (2025 M5406KA model, AMD Krackan Ryzen AI 7 350) - Ultrabookreview.com",Ultrabookreview.com
"Fri, 29 Aug 2025 20:40:59 GMT",AMD Stock Falls on Marvell Outlook | Semiconductor Sector Pullback - News and Statistics - IndexBox,IndexBox
"Fri, 29 Aug 2025 16:30:12 GMT",Broadcom Stock Has Been Flying. Does AMD Still Have More Room to Run? - TipRanks,TipRanks
"Thu, 28 Aug 2025 03:01:03 GMT","AMD's next-gen RDNA 5 flagship gaming GPU pictured, 96 Compute Units, 512-bit memory bus - TweakTown",TweakTown
"Fri, 29 Aug 2025 15:34:55 GMT",AMD Is Making A Big Bet On Quantum Computing. Should You Buy AMD Stock Here? - Barchart.com,Barchart.com
"Fri, 29 Aug 2025 16:00:00 GMT",AMD Ryzen CPUs just got stock cooler downgrades (or eliminations) - PCWorld,PCWorld
"Fri, 29 Aug 2025 17:42:58 GMT","‘Nvidia Should Watch Out,’ Says William Stein as He Upgrades AMD Stock - MSN",MSN
"Fri, 29 Aug 2025 15:14:27 GMT","Armed with AMD's latest SDK, DLSS Swapper, and one renamed file, you can apparently just drop FSR 4 into games that run FSR 3 - PC Gamer",PC Gamer
"Thu, 28 Aug 2025 10:10:00 GMT",Can AMD’s Recent AI Chip Momentum Justify Its Soaring 2025 Share Price? - Yahoo Finance,Yahoo Finance
"Mon, 25 Aug 2025 15:50:31 GMT",What's Going On With AMD Stock Monday? - Yahoo Finance,Yahoo Finance
"Fri, 29 Aug 2025 20:00:00 GMT","Trump Loves Intel. Top Funds Cozy Up To This Nvidia, AMD Partner. - Investor's Business Daily",Investor's Business Daily
"Fri, 29 Aug 2025 22:16:23 GMT","Nvidia and AMD to pay 15% of China chip sale revenues to US government, FT reports - MSN",MSN
"Wed, 27 Aug 2025 12:45:22 GMT","This new AMD Radeon gaming GPU leak looks amazing, could beat the RTX 6080 - PCGamesN",PCGamesN
"Wed, 27 Aug 2025 06:56:00 GMT",AMD Radeon RX 9070 GRE with 16GB memory reportedly launching between September and October - VideoCardz.com,VideoCardz.com
"Thu, 28 Aug 2025 14:29:17 GMT",AMD Stock Rallies as Nvidia Shares (NVDA) Fall Alongside Q2 Results - TipRanks,TipRanks
"Wed, 27 Aug 2025 12:37:53 GMT",The latest AMD RDNA 5 rumours are complicated but it looks like there really is going to be a high-end next-gen GPU to take on Nvidia's best graphics card - PC Gamer,PC Gamer
"Tue, 26 Aug 2025 12:24:16 GMT","Here are Tuesday's biggest analyst calls: Nvidia, Tesla, Netflix, AMD, Broadcom, American Eagle, Salesforce and more - CNBC",CNBC
"Tue, 26 Aug 2025 14:42:45 GMT",Some AMD Ryzen CPUs are still burning out - and the company looks to pin the blame on motherboard makers - TechRadar,TechRadar
"Wed, 27 Aug 2025 13:47:00 GMT","AMD and Intel mobile CPU roadmap leak: Core Ultra 300 and Medusa Ryzen in Q2 2026, Core Ultra 400 in Q2 2027 - VideoCardz.com",VideoCardz.com
"Tue, 26 Aug 2025 16:40:37 GMT",AMD just revealed that its current RDNA 4 GPUs have a clever 'modular' architecture—here's hoping it signals a broader range of next-gen graphics cards - PC Gamer,PC Gamer
"Mon, 25 Aug 2025 22:17:45 GMT",AMD RDNA 4 GPU Architecture at Hot Chips 2025 - ServeTheHome,ServeTheHome
"Wed, 27 Aug 2025 20:05:00 GMT",Exclusive: AMD Makes Big Channel Funding Boost As It Builds ‘True’ Partner Program - CRN Magazine,CRN Magazine
"Thu, 28 Aug 2025 15:40:36 GMT","AMD downgrades certain Ryzen CPUs to lesser stock coolers — Wraith Prism and Spire quietly retired, replaced with Wraith Stealth - Tom's Hardware",Tom's Hardware
"Fri, 29 Aug 2025 16:11:42 GMT","AMD Valuations Reach Excessive Levels, Deserving Downgrade - AInvest",AInvest
"Tue, 26 Aug 2025 08:02:52 GMT",AMD Zen 6 Ryzen CPU names Leak – Next-Gen motherboard benefits unveiled - OC3D,OC3D
"Fri, 29 Aug 2025 16:30:42 GMT",AMD vs Broadcom: Which Stock Has More Room to Run in the AI Boom? - AInvest,AInvest
"Wed, 27 Aug 2025 19:39:03 GMT",Palantir or AMD: Cathie Wood Banks on One Top AI Stock - TipRanks,TipRanks
"Tue, 26 Aug 2025 04:59:03 GMT",AMD blames motherboard makers for Ryzen 9800X3D CPU failures - TweakTown,TweakTown
"Tue, 26 Aug 2025 22:50:15 GMT","‘Nvidia Should Watch Out,’ Says William Stein as He Upgrades AMD Stock - TipRanks",TipRanks
"Tue, 26 Aug 2025 00:53:37 GMT",AMD Pollara 400 Details at Hot Chips 2025 - ServeTheHome,ServeTheHome
"Fri, 29 Aug 2025 04:18:04 GMT",Advanced Micro Devices (AMD): Somite.ai Announces Strategic Investment from AMD Ventures - Yahoo Finance,Yahoo Finance
"Thu, 28 Aug 2025 17:28:00 GMT",IBM and AMD team up to develop architectures blending quantum and high performance computing - TechRadar,TechRadar
"Fri, 29 Aug 2025 15:49:00 GMT",AMD's AI Journey Rides on Strong Partner Base: What's the Path Ahead? - Nasdaq,Nasdaq
"Fri, 29 Aug 2025 03:57:00 GMT","Nvidia, AMD will pay 15% to U.S. Gov - The Washington Post",The Washington Post
"Fri, 29 Aug 2025 11:30:40 GMT",IBM and AMD are teaming up to champion 'quantum-centric supercomputing' – but what is it? - IT Pro,IT Pro
"Fri, 29 Aug 2025 07:58:34 GMT",FDA Issues CRL to Outlook Therapeutics' ONS-5010 for the Treatment of Wet AMD - HCPLive,HCPLive
"Mon, 25 Aug 2025 16:11:55 GMT",AMD mobile CPU roadmap leak claims Zen 6 arrives in 2027 - Tom's Hardware,Tom's Hardware
"Fri, 29 Aug 2025 10:45:29 GMT",IBM and AMD Partner on Hybrid Quantum Supercomputing - WebProNews,WebProNews
"Thu, 28 Aug 2025 12:01:33 GMT",AMD details how it built a product line-up with just two RDNA 4 dies — Flexible design and asymmetric harvesting enables production of multiple models without new silicon - Tom's Hardware,Tom's Hardware
"Tue, 26 Aug 2025 19:17:16 GMT","IBM, AMD team on quantum computing - Network World",Network World
"Fri, 29 Aug 2025 15:04:03 GMT",AMD Stock Takes a Hit as US Invests $5.7B in Rival Intel - AInvest,AInvest
"Tue, 26 Aug 2025 14:36:44 GMT",This new AMD Ryzen CPU looks like it can beat the Nvidia GeForce RTX 5070 without a graphics card - PCGamesN,PCGamesN
"Fri, 29 Aug 2025 13:40:20 GMT","AMD Epyc Venice CPUs may exceed the 1,000W barrier and require advanced cooling - Club386",Club386
"Wed, 27 Aug 2025 12:01:16 GMT",AMD Ryzen Threadripper Workstations Shred Everything From AI to Gaming - EE Times,EE Times
"Mon, 25 Aug 2025 15:08:29 GMT",AMD Stock Slips Alongside New Radeon RDNA 5 GPU Leaks - TipRanks,TipRanks
"Tue, 26 Aug 2025 11:50:57 GMT",AMD blames toasted AM5 sockets on motherboard makers pushing their luck with CPU settings - PC Gamer,PC Gamer
"Wed, 27 Aug 2025 10:06:00 GMT",AMD B850 Motherboard Roundup: 23 Motherboards Tested Under $200 - TechSpot,TechSpot
"Wed, 27 Aug 2025 18:27:00 GMT",IBM and AMD explore quantum-centric supercomputing - RCR Wireless,RCR Wireless
"Fri, 29 Aug 2025 08:25:23 GMT",IBM and AMD plot quantum supercomputer that could kill Nvidia’s AI monopoly - Investorsobserver,Investorsobserver
"Fri, 29 Aug 2025 09:33:47 GMT","TD Cowen Raises PT on Advanced Micro Devices, Inc. (AMD) to $195; Maintains ‘Buy’ Rating - Yahoo Finance",Yahoo Finance
"Fri, 29 Aug 2025 11:05:11 GMT",IBM and AMD unite to build quantum-classical supercomputers - Digital Watch Observatory,Digital Watch Observatory
"Thu, 28 Aug 2025 18:40:00 GMT",AMD To Stop Bundling Wraith Spire And Prism Coolers With These Ryzen CPUs - HotHardware,HotHardware
"Thu, 28 Aug 2025 11:55:00 GMT",FDA again rejects Outlook Therapeutics’ version of Avastin for wet AMD - Endpoints News,Endpoints News
"Fri, 29 Aug 2025 14:55:38 GMT",FDA Rejects Outlook Therapeutics’ Wet AMD Treatment for Second Time in Two Years - geneonline.com,geneonline.com
"Fri, 29 Aug 2025 04:14:00 GMT",Advanced Micro Devices (AMD): Somite.ai Announces Strategic Investment from AMD Ventures - uk.finance.yahoo.com,uk.finance.yahoo.com
"Thu, 28 Aug 2025 10:13:00 GMT","Broadcom, AMD, Micron and Other Chip Stocks Fell After Nvidia Earnings. What They’re Doing Now. - Barron's",Barron's
"Mon, 25 Aug 2025 07:00:00 GMT",Does Advanced Micro Devices Stock (AMD) Have More Upside? Here’s What Wall Street Says - TipRanks,TipRanks
"Mon, 25 Aug 2025 08:54:14 GMT",AMD Blames Motherboard Vendors for Burning AM5 Sockets - TechPowerUp,TechPowerUp
"Wed, 27 Aug 2025 10:00:00 GMT",Will AMD Be a $1 Trillion Company by 2030? - The Motley Fool,The Motley Fool
"Fri, 29 Aug 2025 17:12:01 GMT",AMD Is Making a Big Bet on Quantum Computing. Should You Buy AMD Stock Here? - MSN,MSN
"Fri, 29 Aug 2025 09:29:58 GMT",ASRock issues new BIOS for AMD 800 Series motherboards to further improve CPU stability - Club386,Club386
"Fri, 29 Aug 2025 12:47:07 GMT",Linux 6.17 Yields 37% Performance Boost on AMD EPYC Turin - WebProNews,WebProNews
"Thu, 28 Aug 2025 09:59:53 GMT",AMD discontinues stock Wraith coolers on select Ryzen CPUs - Club386,Club386
"Wed, 27 Aug 2025 18:22:30 GMT",IBM And AMD Tag Team On Hybrid Classical-Quantum Supercomputers - The Next Platform,The Next Platform
"Fri, 29 Aug 2025 01:52:59 GMT",HPE Expands ‘Saudi Made’ Server Line with New AMD-Powered ProLiant Models - The Fast Mode,The Fast Mode
2025-08-30T05:42:43,Advanced Micro Devices Inc. (AMD) Partners with IBM to Advance Quantum Computing Technology,Yahoo
2025-08-29T21:13:10,What Does Wall Street Think About Advanced Micro Devices (AMD)?,Yahoo
2025-08-29T19:46:31,Why AMD (AMD) Shares Are Sliding Today,Yahoo
2025-08-29T17:49:00,AMD's AI Journey Rides on Strong Partner Base: What's the Path Ahead?,Yahoo
2025-08-29T17:34:55,AMD Is Making a Big Bet on Quantum Computing. Should You Buy AMD Stock Here?,Yahoo
2025-08-29T14:09:29,AMD: Left In Nvidia's Dust As Valuations Reach Excessive Levels (Downgrade),SeekingAlpha
2025-08-29T12:49:36,AMD: There Is Still Time To Accumulate Shares,SeekingAlpha
2025-08-29T11:33:47,"TD Cowen Raises PT on Advanced Micro Devices, Inc. (AMD) to $195; Maintains ‘Buy’ Rating",Yahoo
2025-08-29T06:14:17,Advanced Micro Devices (AMD): Somite.ai Announces Strategic Investment from AMD Ventures,Yahoo
2025-08-28T14:16:00,Broadcom Stock Rises After Nvidia Earnings. How the Results Impact the Chip Sector.,Yahoo
2025-08-28T14:01:10,"As Trump And Intel Make News, This Nvidia, AMD Partner Chips Away At A Breakout",Yahoo
2025-08-28T13:55:31,Mizuho Keeps Outperform on Advanced Micro Devices (AMD) and Boosts Earnings Projections,Yahoo
2025-08-28T12:10:00,Can AMD’s Recent AI Chip Momentum Justify Its Soaring 2025 Share Price?,Yahoo
2025-08-28T11:31:03,IBM and AMD to partner on quantum-centric supercomputing,Yahoo
2025-08-28T00:30:00,Beyond Nvidia: Analyst shares 3 other chip stock picks,Yahoo
2025-08-27T22:07:00,"Top analyst flags major AI shift in AMD, reboots price target",Yahoo
2025-08-27T20:30:09,"Stocks to Watch Recap: Nvidia, Cracker Barrel, RBC, Kohl's",Yahoo
2025-08-27T16:31:08,Nvidia stock needs 'perfect' Q2: How to trade a post-earnings dip,Yahoo
2025-08-27T15:35:37,"AMD upgraded, PDD downgraded: Wall Street’s top analyst calls",Yahoo
2025-08-27T15:34:47,"Saudi AI Firm Humain Begins Data Center Push With 18,000 Nvidia Chips, $10B AMD Deal in Tow",Yahoo
2025-08-27T15:26:00,"Zacks Investment Ideas feature highlights: Nvidia, Arm Holdings, CoreWeave, Advanced Micro Devices and Oklo",Yahoo
2025-08-27T14:46:00,"The Zacks Analyst Blog Highlights NVIDIA, AMD, Alphabet, Meta Platforms, Amazon.com and Microsoft",Yahoo
2025-08-27T14:15:15,"Stocks to Watch Wednesday: Nvidia, Cracker Barrel, Royal Bank of Canada",Yahoo
2025-08-27T12:30:00,IBM Joins Forces With AMD to Develop ‘Quantum-Centric Supercomputers’,Yahoo
2025-08-27T12:15:20,Should the IBM Quantum Partnership Prompt Action From Advanced Micro Devices (AMD) Investors?,Yahoo
2025-08-27T12:00:25,Nvidia earnings preview and the Trump chip tariff twist,Yahoo
2025-08-27T12:00:00,Will AMD Be a $1 Trillion Company by 2030?,Yahoo
2025-08-27T04:28:03,AMD And IBM: Quantum Computing's New Power Couple,SeekingAlpha
2025-08-26T23:44:56,"Stocks to Watch Recap: AMD, Eli Lilly, EchoStar, Trump Media",Yahoo
2025-08-26T23:17:38,"Advanced Micro Devices, Inc. (AMD)’s Shares Are An Example Of Volatility Since Cramer Said It Was Okay To Buy",Yahoo
2025-08-26T22:46:00,"These Stocks Moved the Most Today: EchoStar, AT&T, AMD, Lilly, Boeing, DJT, Talen, Semtech, and More",Yahoo
2025-08-26T19:47:29,"US could seek piece of defense companies, Commerce chief says",Yahoo
2025-08-26T18:53:01,Why Advanced Micro Devices (AMD) Stock Is Climbing Today,Yahoo
2025-08-26T18:04:02,"After falling behind in generative AI, IBM and AMD look to quantum for an edge",Yahoo
2025-08-26T17:51:00,Why AMD (AMD) Stock Is Trading Up Today,Yahoo
2025-08-26T17:40:27,"Defense stocks gain on Lutnick comments, AMD & IBM, Cracker Barrel",Yahoo
2025-08-29T06:47:08,IBM and AMD Join Forces to Build the Future of Computing,Reddit/r/stocks
2025-08-26T14:22:28,Do you think AMD goes back on bull run from IBM partnership and Nvidia earnings tomorrow?,Reddit/r/stocks
