Date,Title,Source
"Tue, 04 Nov 2025 06:02:41 GMT","Lawrence Joseph Saia Obituary (2025) - Shelby Township, MI - Gramer Funeral Home - Clawson - Legacy obituary",Legacy obituary
"Tue, 04 Nov 2025 02:35:28 GMT",Will SAIA stock recover faster than peers - Treasury Yields & Technical Pattern Based Buy Signals - newser.com,newser.com
"Sat, 01 Nov 2025 21:10:00 GMT",Saia (SAIA) Q3 2025 Earnings Call Transcript - The Motley Fool,The Motley Fool
"Fri, 31 Oct 2025 14:17:57 GMT",Saia raises pay amid slight revenue slip - Trucking Dive,Trucking Dive
"Sun, 02 Nov 2025 11:47:42 GMT",Saia Inc. Earnings Call: Resilience Amid Challenges - MSN,MSN
"Thu, 30 Oct 2025 19:55:27 GMT",Saia’s margins slip as LTLs await rebound - FreightWaves,FreightWaves
"Thu, 30 Oct 2025 20:30:00 GMT",Saia Beats Analyst Expectations as Q3 Profit Slides 7% - Transport Topics,Transport Topics
"Fri, 31 Oct 2025 01:07:00 GMT",Saia Inc (SAIA) Q3 2025 Earnings Call Highlights: Navigating Challenges with Strategic Growth ... - Yahoo Finance,Yahoo Finance
"Sat, 01 Nov 2025 21:49:32 GMT",How Investors May Respond To Saia (SAIA) Beating Estimates With Efficiency and Tech-Driven Gains - simplywall.st,simplywall.st
"Mon, 03 Nov 2025 12:01:09 GMT",Is Saia Inc. stock attractive for hedge funds - Market Risk Analysis & Consistent Profit Trading Strategies - newser.com,newser.com
"Thu, 30 Oct 2025 12:58:47 GMT",Saia (NASDAQ:SAIA) Beats Q3 Sales Expectations - Yahoo Finance,Yahoo Finance
"Mon, 03 Nov 2025 00:53:01 GMT",Analyzing recovery setups for Saia Inc. investors - 2025 Fundamental Recap & Daily Stock Momentum Reports - newser.com,newser.com
"Thu, 30 Oct 2025 11:30:00 GMT",Saia Reports Third Quarter Results - Yahoo Finance,Yahoo Finance
"Sun, 02 Nov 2025 19:48:27 GMT",Applying Elliott Wave Theory to Saia Inc. - Index Update & AI Driven Stock Reports - newser.com,newser.com
"Thu, 30 Oct 2025 12:45:03 GMT",Saia (SAIA) Q3 Earnings and Revenues Surpass Estimates - Yahoo Finance,Yahoo Finance
"Mon, 03 Nov 2025 14:18:56 GMT",Real time alert setup for SAIA performance - Fed Meeting & Real-Time Volume Analysis Alerts - newser.com,newser.com
"Mon, 03 Nov 2025 06:24:58 GMT",How to forecast SAIA trends using time series - 2025 Price Targets & Scalable Portfolio Growth Ideas - newser.com,newser.com
"Thu, 30 Oct 2025 14:30:02 GMT","Compared to Estimates, Saia (SAIA) Q3 Earnings: A Look at Key Metrics - Yahoo Finance",Yahoo Finance
"Fri, 31 Oct 2025 20:26:15 GMT",Saia (SAIA) Margin Decline Challenges Bullish Growth Narrative Despite Strong Valuation and Forecasts - Sahm,Sahm
"Sat, 01 Nov 2025 20:01:30 GMT",JPMorgan Chase & Co. Issues Pessimistic Forecast for Saia (NASDAQ:SAIA) Stock Price - MarketBeat,MarketBeat
"Mon, 03 Nov 2025 11:54:30 GMT","Hunter Associates Investment Management LLC Purchases 7,849 Shares of Saia, Inc. $SAIA - MarketBeat",MarketBeat
"Mon, 03 Nov 2025 10:55:47 GMT","Saia, Inc. $SAIA Stock Holdings Increased by GHP Investment Advisors Inc. - MarketBeat",MarketBeat
"Sat, 01 Nov 2025 20:19:30 GMT",Saia (NASDAQ:SAIA) Price Target Lowered to $365.00 at Citigroup - MarketBeat,MarketBeat
"Thu, 30 Oct 2025 22:40:11 GMT",Saia outlines 5.9% GRI and signals continued network optimization amid volume and margin headwinds - MSN,MSN
"Sat, 01 Nov 2025 08:32:16 GMT","Saia, Inc. $SAIA Shares Sold by Jennison Associates LLC - MarketBeat",MarketBeat
"Mon, 03 Nov 2025 14:29:34 GMT",Can SAIA stock surprise with earnings upside - Gap Up & Entry Point Strategy Guides - newser.com,newser.com
"Sat, 01 Nov 2025 14:06:53 GMT",Saia (NASDAQ:SAIA) Price Target Lowered to $319.00 at Evercore ISI - MarketBeat,MarketBeat
"Fri, 31 Oct 2025 10:21:18 GMT",What MACD and RSI say about SAIA - Weekly Profit Analysis & Reliable Volume Spike Trade Alerts - newser.com,newser.com
"Sun, 02 Nov 2025 12:23:23 GMT","Pier Capital LLC Invests $4.06 Million in Saia, Inc. $SAIA - MarketBeat",MarketBeat
"Fri, 31 Oct 2025 04:52:33 GMT",What does recent volatility data suggest for Saia Inc. - 2025 Earnings Surprises & Safe Entry Point Alerts - newser.com,newser.com
"Fri, 31 Oct 2025 18:48:56 GMT","Saia (NASDAQ:SAIA) Issues Quarterly Earnings Results, Beats Estimates By $0.28 EPS - MarketBeat",MarketBeat
"Mon, 03 Nov 2025 07:50:24 GMT",How Saia Inc. stock reacts to global recession fears - July 2025 WrapUp & Community Trade Idea Sharing Platform - newser.com,newser.com
"Mon, 03 Nov 2025 09:58:33 GMT",Is SAIA stock a safe haven asset - 2025 Year in Review & High Accuracy Trade Alerts - newser.com,newser.com
"Thu, 30 Oct 2025 20:19:02 GMT",Is Saia's Slumping Share Price Creating a Fresh Opportunity for Investors in 2025? - simplywall.st,simplywall.st
"Mon, 03 Nov 2025 11:45:16 GMT",Earnings visualization tools for SAIA - Wall Street Watch & Free Daily Entry Point Trade Alerts - newser.com,newser.com
"Sun, 02 Nov 2025 09:31:30 GMT","Retirement Systems of Alabama Boosts Stock Position in Saia, Inc. $SAIA - MarketBeat",MarketBeat
"Mon, 03 Nov 2025 06:29:07 GMT",Is SAIA stock a dividend growth opportunity - 2025 Buyback Activity & Fast Gain Swing Alerts - newser.com,newser.com
"Fri, 31 Oct 2025 08:33:15 GMT",Is this a good reentry point in Saia Inc. - Volume Spike & Real-Time Volume Analysis Alerts - newser.com,newser.com
"Mon, 03 Nov 2025 07:50:23 GMT",What risks investors should watch in SAIA stock - July 2025 WrapUp & Low Volatility Stock Suggestions - newser.com,newser.com
"Fri, 31 Oct 2025 15:38:11 GMT","Stifel Maintains Hold on SAIA, Lowers Price Target | SAIA Stock News - GuruFocus",GuruFocus
"Fri, 31 Oct 2025 21:00:00 GMT",SAIA Receives Buy Rating as Citigroup Lowers Price Target | SAIA Stock News - GuruFocus,GuruFocus
"Fri, 31 Oct 2025 11:05:54 GMT",Can Saia Inc. stock sustain institutional interest - Weekly Profit Report & Fast Moving Market Watchlists - newser.com,newser.com
"Mon, 03 Nov 2025 11:40:13 GMT",What indicators show strength in Saia Inc. - July 2025 Institutional & Fast Gain Stock Trading Tips - newser.com,newser.com
"Sun, 02 Nov 2025 11:21:29 GMT",Combining machine learning predictions for Saia Inc. - Weekly Stock Analysis & Daily Entry Point Trade Alerts - newser.com,newser.com
"Sun, 02 Nov 2025 19:49:41 GMT",What risks investors should watch in SAIA stock - Trade Risk Summary & Long-Term Capital Growth Ideas - newser.com,newser.com
"Fri, 31 Oct 2025 05:59:35 GMT",Is this a good reentry point in Saia Inc. - Market Trend Review & Consistent Profit Trading Strategies - newser.com,newser.com
"Fri, 31 Oct 2025 05:44:25 GMT",Applying Elliott Wave Theory to Saia Inc. - 2025 Risk Factors & Free Safe Entry Trade Signal Reports - newser.com,newser.com
"Mon, 03 Nov 2025 07:44:04 GMT",How Saia Inc. stock reacts to global recession fears - July 2025 Recap & Capital Protection Trade Alerts - newser.com,newser.com
"Fri, 31 Oct 2025 19:51:34 GMT","JP Morgan Lowers Price Target for SAIA, Maintains Overweight Rat - GuruFocus",GuruFocus
"Fri, 31 Oct 2025 04:21:39 GMT","Saia, Inc. Reports Third Quarter 2025 Earnings - TipRanks",TipRanks
"Thu, 30 Oct 2025 11:46:00 GMT",Saia: Q3 Earnings Snapshot - WKYC,WKYC
"Thu, 30 Oct 2025 16:56:09 GMT",Earnings call transcript: Saia Inc. reports strong Q3 2025 earnings beat - Investing.com,Investing.com
"Fri, 31 Oct 2025 04:24:15 GMT",Decoding Saia Inc (SAIA): A Strategic SWOT Insight - GuruFocus,GuruFocus
"Mon, 03 Nov 2025 03:20:20 GMT",What risks investors should watch in SAIA stock - Exit Point & AI Driven Price Predictions - newser.com,newser.com
"Mon, 03 Nov 2025 06:29:06 GMT",Candlestick signals on SAIA stock today - 2025 Technical Overview & Stock Portfolio Risk Management - newser.com,newser.com
"Fri, 31 Oct 2025 10:06:34 GMT",Saia (SAIA) Exceeds Q3 Revenue Expectations - GuruFocus,GuruFocus
"Sat, 01 Nov 2025 17:42:38 GMT",Analyzing recovery setups for Saia Inc. investors - 2025 EndofYear Setup & Accurate Entry and Exit Point Alerts - newser.com,newser.com
"Thu, 30 Oct 2025 13:32:21 GMT",Saia Inc reports results for the quarter ended September 30 - Earnings Summary - TradingView,TradingView
"Fri, 31 Oct 2025 14:11:25 GMT",SAIA's Price Target Lowered by Evercore ISI Group - Maintains Ou - GuruFocus,GuruFocus
"Thu, 30 Oct 2025 20:33:00 GMT",SAIA INC SEC 10-Q Report - TradingView,TradingView
"Thu, 30 Oct 2025 15:56:58 GMT",Saia Outpaces Expectations Even As Shipments Dip Slightly - Finimize,Finimize
"Fri, 31 Oct 2025 18:10:40 GMT",Saia price target lowered to $283 from $292 at TD Cowen - TipRanks,TipRanks
"Thu, 30 Oct 2025 20:19:55 GMT",Cautious Outlook on Saia: Hold Rating Amid Sub-Seasonal Trends and Uncertainty - TipRanks,TipRanks
"Sat, 01 Nov 2025 13:00:00 GMT","A Quick Look at Today's Ratings for Saia(SAIA.US), With a Forecast Between $319 to $350 - 富途牛牛",富途牛牛
"Fri, 31 Oct 2025 15:41:58 GMT",Saia price target lowered to $319 from $328 at Evercore ISI - TipRanks,TipRanks
"Thu, 30 Oct 2025 11:41:24 GMT",Saia Q3 revenue beats estimates on volume growth - TradingView,TradingView
"Thu, 30 Oct 2025 12:14:14 GMT","Saia Inc (SAIA) Q3 Earnings: EPS of $3.22 Beats Estimates, Reven - GuruFocus",GuruFocus
"Fri, 31 Oct 2025 08:55:32 GMT",Using fundamentals and technicals on Saia Inc. - Trade Ideas & Precise Buy Zone Tips - newser.com,newser.com
"Fri, 31 Oct 2025 17:15:00 GMT","J.P. Morgan Maintains Saia(SAIA.US) With Buy Rating, Cuts Target Price to $346 - 富途牛牛",富途牛牛
"Thu, 30 Oct 2025 13:28:59 GMT","The Price Is Right For Saia, Inc. (NASDAQ:SAIA) - 富途牛牛",富途牛牛
"Thu, 30 Oct 2025 13:14:00 GMT",Saia Q3 2025 Results: Revenue and EPS Top Analyst Forecasts - News and Statistics - IndexBox,IndexBox
"Fri, 31 Oct 2025 10:26:55 GMT",Will SAIA rebound enough to break even - Weekly Trade Review & Risk Managed Investment Entry Signals - newser.com,newser.com
"Fri, 31 Oct 2025 09:56:09 GMT",Candlestick signals on SAIA stock today - July 2025 Analyst Calls & Daily Oversold Stock Bounce Ideas - newser.com,newser.com
"Thu, 30 Oct 2025 08:56:42 GMT","Oppenheimer Asset Management Inc. Trims Stock Position in Saia, Inc. $SAIA - MarketBeat",MarketBeat
"Thu, 30 Oct 2025 12:03:41 GMT",Why Saia’s Stock is Facing a Downturn - TipRanks,TipRanks
"Fri, 31 Oct 2025 00:22:30 GMT",Saia Inc (SAIA) Q3 2025 Earnings Call Highlights: Navigating Challenges with Strategic Growth ... By GuruFocus - Investing.com Canada,Investing.com Canada
"Fri, 31 Oct 2025 08:33:42 GMT",What risks investors should watch in SAIA stock - CEO Change & Weekly Return Optimization Alerts - newser.com,newser.com
"Fri, 31 Oct 2025 05:32:32 GMT",Will SAIA stock recover faster than peers - Market Sentiment Review & Weekly Hot Stock Watchlists - newser.com,newser.com
"Thu, 30 Oct 2025 12:42:43 GMT",Saia Q3 revenue beats estimates on volume growth - MarketScreener,MarketScreener
"Thu, 30 Oct 2025 11:43:04 GMT",Saia Reports Third Quarter Results - The Manila Times,The Manila Times
"Thu, 30 Oct 2025 18:36:37 GMT",Earnings call transcript: Saia Inc. reports strong Q3 2025 earnings beat By Investing.com - Investing.com Australia,Investing.com Australia
"Sun, 02 Nov 2025 16:03:22 GMT",What analysts say about Saia Inc stock - Support Zone Identification & Predict Price Movements With AI Precision - earlytimes.in,earlytimes.in
"Thu, 30 Oct 2025 19:06:58 GMT","Saia earnings beat by $0.28, revenue topped estimates - Investing.com Australia",Investing.com Australia
"Thu, 30 Oct 2025 12:25:00 GMT","Saia earnings beat by $0.28, revenue topped estimates - Investing.com UK",Investing.com UK
"Sun, 02 Nov 2025 21:36:27 GMT","What drives SAIA stock price - Dividend Stability Analysis & High-Risk, High-Reward? We Find the Winners - earlytimes.in",earlytimes.in
"Fri, 31 Oct 2025 08:45:37 GMT",Will SAIA rebound enough to break even - July 2025 Action & Weekly Return Optimization Alerts - newser.com,newser.com
"Sun, 02 Nov 2025 06:43:49 GMT",JPMorgan Chase & Co. Lowers Saia (NASDAQ:SAIA) Price Target to $346.00 - Defense World,Defense World
2025-11-01T22:10:00,Saia (SAIA) Q3 2025 Earnings Call Transcript,Yahoo
2025-10-31T04:20:19,Saia (SAIA) Net Profit Margin Decline Challenges Bullish Margin Recovery Narratives,Yahoo
2025-10-31T02:07:14,Saia Inc (SAIA) Q3 2025 Earnings Call Highlights: Navigating Challenges with Strategic Growth ...,Yahoo
2025-10-30T20:55:27,Saia’s margins slip as LTLs await rebound,Yahoo
2025-10-30T17:06:28,"Saia, Inc. (SAIA) Q3 2025 Earnings Call Transcript",SeekingAlpha
2025-10-30T15:30:02,"Compared to Estimates, Saia (SAIA) Q3 Earnings: A Look at Key Metrics",Yahoo
2025-10-30T13:58:47,Saia (NASDAQ:SAIA) Beats Q3 Sales Expectations,Yahoo
2025-10-30T13:45:03,Saia (SAIA) Q3 Earnings and Revenues Surpass Estimates,Yahoo
2025-10-30T12:46:39,Saia: Q3 Earnings Snapshot,Yahoo
2025-10-30T12:30:00,Saia Reports Third Quarter Results,Yahoo
