Date,Title,Source
"Sun, 31 Aug 2025 04:30:46 GMT",Full technical analysis of PCAR stock - Weekly Trend Recap & High Return Trade Opportunity Guides - Newser,Newser
"Sun, 31 Aug 2025 05:59:50 GMT",Raymond James Financial Inc. Lowers Stock Holdings in PACCAR Inc. $PCAR - MarketBeat,MarketBeat
"Sun, 31 Aug 2025 01:09:14 GMT",Volume spikes in PCAR stock – what they mean - Quarterly Trade Report & Precise Buy Zone Tips - Newser,Newser
"Sun, 31 Aug 2025 05:01:20 GMT",PACCAR Inc. $PCAR Shares Sold by Comerica Bank - MarketBeat,MarketBeat
"Sun, 31 Aug 2025 05:21:32 GMT",Real time alert setup for PCAR performance - 2025 Technical Patterns & Low Drawdown Investment Ideas - Newser,Newser
"Sun, 31 Aug 2025 05:01:20 GMT",PACCAR Inc. $PCAR Shares Bought by Price T Rowe Associates Inc. MD - MarketBeat,MarketBeat
"Sun, 31 Aug 2025 01:14:37 GMT",How high can PCAR stock go - 2025 Market Trends & Scalable Portfolio Growth Methods - Newser,Newser
"Sun, 31 Aug 2025 04:24:22 GMT",MetLife Investment Management LLC Reduces Holdings in PACCAR Inc. $PCAR - MarketBeat,MarketBeat
"Sun, 31 Aug 2025 00:10:17 GMT",What high frequency data says about PCAR - Risk Management & Consistent Profit Alerts - Newser,Newser
"Sat, 30 Aug 2025 22:52:44 GMT",Tick level data insight on PCAR volatility - 2025 Top Decliners & Long-Term Safe Investment Plans - Newser,Newser
"Sat, 30 Aug 2025 22:51:47 GMT",Using data models to predict PCAR stock movement - Portfolio Risk Report & Free Fast Gain Swing Trade Alerts - Newser,Newser
"Sat, 30 Aug 2025 21:50:44 GMT",Intraday pattern recognizer results for PCAR - Jobs Report & Momentum Based Trading Signals - Newser,Newser
"Sat, 30 Aug 2025 22:07:33 GMT",Real time alert setup for PCAR performance - Market Performance Summary & Weekly High Conviction Ideas - Newser,Newser
"Sun, 31 Aug 2025 02:20:34 GMT",Momentum divergence signals in PCAR chart - Rate Cut & Community Trade Idea Sharing - Newser,Newser
"Sat, 30 Aug 2025 19:53:23 GMT",Tick level data insight on PCAR volatility - Portfolio Performance Report & Safe Capital Growth Plans - Newser,Newser
"Sun, 31 Aug 2025 06:16:02 GMT",Will earnings trigger a reversal in PCAR - 2025 Performance Recap & Real-Time Chart Breakout Alerts - Newser,Newser
"Sun, 31 Aug 2025 05:14:48 GMT",Visual trend scoring systems applied to PCAR - July 2025 News Drivers & Technical Analysis for Trade Confirmation - Newser,Newser
"Sun, 31 Aug 2025 00:26:55 GMT",Volume spikes in PCAR stock – what they mean - July 2025 Decliners & Growth Oriented Trading Recommendations - Newser,Newser
"Sun, 31 Aug 2025 00:18:36 GMT",Tick level data insight on PCAR volatility - Bond Market & Community Shared Stock Ideas - Newser,Newser
"Sat, 30 Aug 2025 18:23:18 GMT",Momentum divergence signals in PCAR chart - Oil Prices & Capital Efficient Trading Techniques - Newser,Newser
"Fri, 29 Aug 2025 19:35:09 GMT",Full technical analysis of PCAR stock - Market Volume Report & Long Hold Capital Preservation Tips - Newser,Newser
"Sat, 30 Aug 2025 09:28:51 GMT",Is PCAR building a consolidation base - July 2025 Sentiment & Accurate Technical Buy Alerts - Newser,Newser
"Sun, 31 Aug 2025 05:08:37 GMT",PCAR stock daily chart insights - Market Volume Report & Free Community Consensus Stock Picks - Newser,Newser
"Fri, 29 Aug 2025 12:10:57 GMT",What does recent volatility data suggest for PCAR - Market Risk Report & Pattern Based Trade Signal System - Newser,Newser
"Sat, 30 Aug 2025 01:58:54 GMT",PCAR Approaches Support With Recovery in Sight getLinesFromResByArray error: size == 0 - thegnnews.com,thegnnews.com
"Sun, 31 Aug 2025 04:24:40 GMT",Paccar (PCAR) Reports Q2 Earnings: What Key Metrics Have to Say - MSN,MSN
"Wed, 27 Aug 2025 18:58:54 GMT",What to expect from PCAR in the next 30 days - 2025 Earnings Surprises & Daily Technical Stock Forecast Reports - Newser,Newser
"Sat, 30 Aug 2025 09:32:37 GMT","6,136 Shares in PACCAR Inc. $PCAR Bought by FORA Capital LLC - MarketBeat",MarketBeat
"Sat, 30 Aug 2025 07:00:00 GMT",PACCAR Inc. $PCAR Holdings Lowered by Ameriprise Financial Inc. - MarketBeat,MarketBeat
"Sat, 30 Aug 2025 09:31:10 GMT",PACCAR Inc. $PCAR Shares Bought by Caisse DE Depot ET Placement DU Quebec - MarketBeat,MarketBeat
"Fri, 29 Aug 2025 22:18:45 GMT",Corebridge Financial Inc. Lowers Stock Holdings in PACCAR Inc. $PCAR - MarketBeat,MarketBeat
"Fri, 29 Aug 2025 23:26:15 GMT","Groupe la Francaise Sells 27,074 Shares of PACCAR Inc. $PCAR - MarketBeat",MarketBeat
"Fri, 29 Aug 2025 23:15:00 GMT","APG Asset Management N.V. Sells 9,900 Shares of PACCAR Inc. $PCAR - MarketBeat",MarketBeat
"Fri, 29 Aug 2025 16:45:38 GMT",What high frequency data says about PCAR - 2025 Trading Recap & Fast Gaining Stock Strategy Reports - Newser,Newser
"Fri, 29 Aug 2025 20:26:20 GMT",Evaluating PCAR with trendline analysis - Market Weekly Review & Long-Term Safe Investment Plans - Newser,Newser
"Thu, 28 Aug 2025 22:06:01 GMT",Will earnings trigger a reversal in PCAR - Entry Point & Low Drawdown Trading Strategies - Newser,Newser
"Fri, 29 Aug 2025 18:48:58 GMT",What high frequency data says about PCAR - Weekly Market Summary & Target Return Focused Stock Picks - Newser,Newser
"Fri, 29 Aug 2025 19:54:38 GMT",Candlestick signals on PCAR stock today - Oil Prices & Detailed Earnings Play Strategies - Newser,Newser
"Fri, 29 Aug 2025 06:41:16 GMT",Visual analytics tools that track PCAR performance - Day Trade & Free Community Consensus Stock Picks - Newser,Newser
"Thu, 28 Aug 2025 07:00:00 GMT",Candriam S.C.A. Cuts Holdings in PACCAR Inc. $PCAR - MarketBeat,MarketBeat
"Thu, 28 Aug 2025 07:00:00 GMT",Cresset Asset Management LLC Lowers Stock Holdings in PACCAR Inc. $PCAR - MarketBeat,MarketBeat
"Fri, 29 Aug 2025 20:43:19 GMT",Using data models to predict PCAR stock movement - 2025 Trade Ideas & Technical Buy Zone Confirmations - Newser,Newser
"Thu, 28 Aug 2025 02:03:45 GMT",PACCAR Inc. $PCAR Shares Bought by Allstate Corp - MarketBeat,MarketBeat
"Thu, 28 Aug 2025 22:35:05 GMT",Tick level data insight on PCAR volatility - Inflation Watch & Daily Oversold Bounce Ideas - Newser,Newser
"Wed, 27 Aug 2025 23:53:47 GMT",Trend analysis for PCAR this week - Rate Hike & High Accuracy Buy Signal Tips - Newser,Newser
"Thu, 28 Aug 2025 21:10:51 GMT",Using data models to predict PCAR stock movement - Earnings Risk Report & AI Enhanced Trading Alerts - Newser,Newser
"Fri, 29 Aug 2025 11:37:59 GMT",Momentum divergence signals in PCAR chart - 2025 Support & Resistance & Consistent Profit Alerts - Newser,Newser
"Thu, 28 Aug 2025 07:00:00 GMT",PACCAR Inc. $PCAR Shares Sold by Hotchkis & Wiley Capital Management LLC - MarketBeat,MarketBeat
"Wed, 27 Aug 2025 07:00:00 GMT",PACCAR Inc. $PCAR Stock Holdings Boosted by Norinchukin Bank The - MarketBeat,MarketBeat
"Wed, 27 Aug 2025 08:05:20 GMT",MACD Cross Could Confirm Trend in PCAR getLinesFromResByArray error: size == 0 - thegnnews.com,thegnnews.com
"Fri, 29 Aug 2025 17:11:15 GMT",Breakout Traders Target PCAR on Recovery Setup - July 2025 Drop Watch & Smart Swing Trading Techniques - beatles.ru,beatles.ru
"Tue, 26 Aug 2025 21:52:48 GMT",What does recent volatility data suggest for PCAR - Portfolio Risk Report & Free Long-Term Investment Growth Plans - Newser,Newser
"Tue, 26 Aug 2025 15:33:45 GMT","Credit Agricole S A Sells 125,762 Shares of PACCAR Inc. $PCAR - MarketBeat",MarketBeat
"Tue, 26 Aug 2025 07:00:00 GMT",PACCAR Inc. $PCAR Shares Bought by Quantbot Technologies LP - MarketBeat,MarketBeat
"Tue, 26 Aug 2025 07:00:00 GMT","Erste Asset Management GmbH Acquires 44,699 Shares of PACCAR Inc. $PCAR - MarketBeat",MarketBeat
"Tue, 26 Aug 2025 07:00:00 GMT",Steward Partners Investment Advisory LLC Reduces Stock Holdings in PACCAR Inc. $PCAR - MarketBeat,MarketBeat
"Tue, 26 Aug 2025 23:02:20 GMT",What does recent volatility data suggest for PCAR - 2025 Volatility Report & Real-Time Chart Pattern Alerts - Newser,Newser
"Sun, 31 Aug 2025 05:25:30 GMT",Epoch Investment Partners Inc. Has $174.81 Million Stock Holdings in PACCAR Inc. $PCAR - MarketBeat,MarketBeat
"Sat, 30 Aug 2025 13:05:59 GMT",Reversal indicators forming on PCAR stock - 2025 Top Decliners & Risk Controlled Daily Plans - Newser,Newser
"Sat, 30 Aug 2025 19:56:06 GMT",PCAR stock daily chart insights - 2025 Price Action Summary & Detailed Earnings Play Alerts - Newser,Newser
