Date,Title,Source
2025-09-29T02:46:52Z,odoo-addon-crm-stage-multi-team 16.0.1.0.0.3,Pypi.org
2025-09-28T13:36:08Z,Salesforce Inc. (NYSE: CRM) Price Prediction and Forecast 2025-2030 (September 2025),Biztoc.com
2025-09-28T13:22:25Z,US Mobile - CRM / Email Marketing Manager,Lever.co
2025-09-28T06:28:59Z,Reviewing Salesforce (NYSE:CRM) and Microsoft (NASDAQ:MSFT),ETF Daily News
2025-09-27T19:57:16Z,ForcedLeak flaw in Salesforce Agentforce exposes CRM data via Prompt Injection,Securityaffairs.com
2025-09-27T06:14:44Z,Q3 Earnings Estimate for Salesforce Issued By Zacks Research,ETF Daily News
2025-09-26T21:34:53Z,"Show HN: Curated N8n Workflows to Automate Marketing, CRM and Business Tasks",Seventeenlabs.io
2025-09-26T16:37:36Z,The Cyber Vulnerabilities Lurking in CRM Systems,Acm.org
2025-09-26T15:43:09Z,odoo-addon-crm-stage-multi-team 16.0.1.0.0.2,Pypi.org
2025-09-26T15:43:09Z,odoo-addon-crm-stage-multi-team added to PyPI,Pypi.org
2025-09-26T15:22:49Z,Salesforce facing multiple lawsuits after Salesloft breach,Biztoc.com
2025-09-26T15:15:13Z,Salesforce facing multiple lawsuits after Salesloft breach,Theregister.com
2025-09-26T04:07:12Z,Salesforce (CRM) to Invest $6 Billion in UK by 2030,Yahoo Entertainment
2025-09-26T02:00:47Z,Only 11% of business leaders see AI leading to major job cuts - for now,ZDNet
2025-09-25T20:48:00Z,DTA stands up new platform to track gov tech spending,iTnews
2025-09-25T20:21:02Z,Salesforce AI Hack Enabled CRM Data Theft,Databreaches.net
2025-09-25T19:29:00Z,"Battered by cyberattacks, Salesforce faces a trust problem - and a potential class action lawsuit",ZDNet
2025-09-25T16:00:00Z,Critical Vulnerability in Salesforce AgentForce Exposed,Infosecurity Magazine
2025-09-25T15:17:00Z,Salesforce Patches Critical ForcedLeak Bug Exposing CRM Data via AI Prompt Injection,Internet
2025-09-25T15:14:39Z,ForcedLeak Flaw in Salesforce Agentforce AI Agent Exposed CRM Data,HackRead
2025-09-25T14:00:42Z,"Battered by cyberattacks, is Salesforce facing a trust problem?",ZDNet
2025-09-25T12:00:14Z,How Do Admins Use Business Analysis Skills Effectively?,Salesforce.com
2025-09-25T04:40:02Z,ギリアド・サイエンシズが、Veeva Vault CRM 導入を決定,Prtimes.jp
2025-09-25T03:40:03Z,非会員CRMで購入率 2.5 倍、LINE 友だち数 1.9 倍に！,Prtimes.jp
2025-09-25T02:27:00Z,Australian Gas Infrastructure Group in second phase of CRM transformation,iTnews
"Tue, 30 Sep 2025 06:56:18 GMT",Rocket CRM Expands Intelligent Features to Advance Customer Relationship Management Practices - The Palm Beach Post,The Palm Beach Post
"Tue, 30 Sep 2025 04:49:50 GMT","What is CRM Marketing: What It Is, How It helps, and more - MobileAppDaily",MobileAppDaily
"Mon, 29 Sep 2025 21:16:33 GMT",Top Dynamics 365 CRM executive departs Microsoft for new leadership role - MSDynamicsWorld.com,MSDynamicsWorld.com
"Mon, 29 Sep 2025 19:50:19 GMT",Dan Niles on Salesforce (CRM) Agentic AI: ‘This Stuff Is Not Getting Deployed At the Rate CEO Thought’ - Yahoo Finance,Yahoo Finance
"Mon, 29 Sep 2025 15:52:11 GMT","Automation, Subservicing, DSCR, CRM Tools; Webinars and Events; CFPB Mortgage Stats - Mortgage News Daily",Mortgage News Daily
"Mon, 29 Sep 2025 19:06:02 GMT",(CRM) Volatility Zones as Tactical Triggers - news.stocktradersdaily.com,news.stocktradersdaily.com
"Mon, 29 Sep 2025 12:08:21 GMT","Android RCE, CRM Breach, Axiom Crypto Drainer, and Airbus Panel Interest - SOCRadar® Cyber Intelligence Inc.",SOCRadar® Cyber Intelligence Inc.
"Mon, 29 Sep 2025 09:21:07 GMT",Matthew Lloyd has been appointed Vice President Marketing Technology & CRM at Global Hotel Alliance (GHA) - Hospitality Net,Hospitality Net
"Mon, 29 Sep 2025 12:54:40 GMT","SA analyst upgrades/downgrades: TSLA, CRM, MU, and TJX - MSN",MSN
"Mon, 29 Sep 2025 17:18:09 GMT","Slotegrator: ""We’re focusing on AI-driven features and building a fully developed CRM system to rival leading providers"" - Yogonet",Yogonet
"Thu, 25 Sep 2025 15:17:00 GMT",Salesforce Patches Critical ForcedLeak Bug Exposing CRM Data via AI Prompt Injection - The Hacker News,The Hacker News
"Sat, 27 Sep 2025 05:37:30 GMT",Salesforce Patches CRM Data Exfiltration Vulnerability - BankInfoSecurity,BankInfoSecurity
"Thu, 25 Sep 2025 13:03:09 GMT",Vulnerability in Salesforce AI could be tricked into leaking CRM data - csoonline.com,csoonline.com
"Mon, 29 Sep 2025 11:00:29 GMT",Salesforce's (NYSE:CRM) investors will be pleased with their decent 66% return over the last three years - Yahoo Finance,Yahoo Finance
"Thu, 25 Sep 2025 07:00:00 GMT",Transform Customer Engagement with an AI-Powered CRM - appinventiv.com,appinventiv.com
"Sun, 28 Sep 2025 07:00:00 GMT",Salesforce Inc. (NYSE: CRM) Price Prediction and Forecast 2025-2030 (September 2025) - 24/7 Wall St.,24/7 Wall St.
"Mon, 29 Sep 2025 22:37:08 GMT","Salesforce CEO Benioff sells $546,547 in CRM stock By Investing.com - Investing.com South Africa",Investing.com South Africa
"Fri, 26 Sep 2025 11:13:57 GMT",AI in healthcare: Why CRM alone isn’t enough - cio.com,cio.com
"Mon, 29 Sep 2025 16:43:16 GMT","5 CRM Strategies Inspired by Online Casino Customer Engagement The Hype Magazine: Unveiling the Pulse of Urban Culture - From Hip Hop to Hollywood! Explore a Diverse Tapestry of Stories, Interviews, and Impactful Editorials Spanning Fashion, Gaming - The Hype Magazine",The Hype Magazine
"Sat, 27 Sep 2025 20:00:41 GMT",ForcedLeak flaw in Salesforce Agentforce exposes CRM data via Prompt Injection - Security Affairs,Security Affairs
"Sat, 27 Sep 2025 10:28:17 GMT",What Is a Mobile CRM? 8 Best Mobile CRMs in 2025 - Shopify,Shopify
"Fri, 26 Sep 2025 04:07:12 GMT",Salesforce (CRM) to Invest $6 Billion in UK by 2030 - Yahoo Finance,Yahoo Finance
"Mon, 29 Sep 2025 10:58:02 GMT",Precision Trading with Salesforce Inc. (CRM) Risk Zones - news.stocktradersdaily.com,news.stocktradersdaily.com
"Mon, 29 Sep 2025 09:33:01 GMT","CRM Software For Mac Market to Reach USD 2.5 billion by 2033, - openPR.com",openPR.com
"Mon, 29 Sep 2025 12:44:11 GMT","If EPS Growth Is Important To You, Salesforce (NYSE:CRM) Presents An Opportunity - 富途牛牛",富途牛牛
"Sun, 28 Sep 2025 17:22:03 GMT",Customer Relationship Management Crm Lead Management Market - openPR.com,openPR.com
"Sun, 28 Sep 2025 17:24:22 GMT",Candidate Relationship Management (CRM) Software System - openPR.com,openPR.com
"Sat, 27 Sep 2025 21:46:54 GMT","Salesforce (CRM): Examining Valuation After AI Expansion, CrowdStrike Partnership, and UK Investment - simplywall.st",simplywall.st
"Thu, 25 Sep 2025 16:15:26 GMT",Salesforce AI Hack Enabled CRM Data Theft - SecurityWeek,SecurityWeek
"Tue, 30 Sep 2025 02:01:00 GMT",MICROPORT Ticks Up ~8% After Announcing CRM Biz Overhaul - AASTOCKS.com,AASTOCKS.com
"Thu, 25 Sep 2025 11:32:39 GMT",The Best Defence Is a Good Offence: Why Salesforce Is Fortifying Its CRM with CrowdStrike - CX Today,CX Today
"Thu, 25 Sep 2025 19:28:15 GMT","SA analyst upgrades/downgrades: TSLA, COIN, CRM, and PYPL - Seeking Alpha",Seeking Alpha
"Sun, 28 Sep 2025 02:26:01 GMT",Understanding Momentum Shifts in (CRM) - news.stocktradersdaily.com,news.stocktradersdaily.com
"Fri, 26 Sep 2025 15:34:57 GMT","Leadership Shifts, Fintech Breakthroughs & AI-Powered CRM | CRTV Episode 114 - Constellation Research",Constellation Research
"Thu, 25 Sep 2025 15:14:39 GMT",ForcedLeak Flaw in Salesforce Agentforce AI Agent Exposed CRM Data - Hack Read,Hack Read
"Sat, 27 Sep 2025 14:12:02 GMT",How Salesforce Inc. (CRM) Affects Rotational Strategy Timing - news.stocktradersdaily.com,news.stocktradersdaily.com
"Fri, 26 Sep 2025 12:38:00 GMT","New Buy Rating for Salesforce (CRM), the Technology Giant - The Globe and Mail",The Globe and Mail
"Fri, 26 Sep 2025 17:33:11 GMT",AI-Tooled CRM: B2C Marketers Are Offered Two New Agents 09/26/2025 - MediaPost,MediaPost
"Thu, 25 Sep 2025 13:31:00 GMT",Klaviyo Advances AI-first B2C CRM with the Launch of Marketing Agent and Customer Agent - Business Wire,Business Wire
"Mon, 29 Sep 2025 14:12:06 GMT","Asta-Net, Promax, Gawex Media to use CRM system from Comfortel - Telecompaper",Telecompaper
"Tue, 30 Sep 2025 02:01:00 GMT",MICROPORT Ticks Up ~8% After Announcing CRM Biz Overhaul - AASTOCKS.com,AASTOCKS.com
"Thu, 25 Sep 2025 19:53:31 GMT","SA analyst upgrades/downgrades: TSLA, COIN, CRM, and PYPL - MSN",MSN
"Tue, 30 Sep 2025 02:01:00 GMT",MICROPORT Ticks Up ~8% After Announcing CRM Biz Overhaul - AASTOCKS.com,AASTOCKS.com
"Thu, 25 Sep 2025 17:13:35 GMT",Top Analyst Sticks with Bullish Rating on Salesforce Stock (NYSE:CRM) amid AI Momentum - TipRanks,TipRanks
"Fri, 26 Sep 2025 09:22:51 GMT",Klaviyo launches AI first B2C CRM marketing agent & customer agent - Home of Direct Commerce,Home of Direct Commerce
"Mon, 29 Sep 2025 21:43:51 GMT","Salesforce CEO Benioff sells $546,547 in CRM stock - Investing.com India",Investing.com India
"Sat, 27 Sep 2025 14:31:06 GMT",Building Purposeful AI: How LeadSquared is Redefining the Future of CRM - CXOToday.com,CXOToday.com
"Thu, 25 Sep 2025 18:21:00 GMT","Klaviyo, Inc. Unveils AI-Driven CRM Strategy - TipRanks",TipRanks
"Thu, 25 Sep 2025 09:20:01 GMT",Why (CRM) Price Action Is Critical for Tactical Trading - news.stocktradersdaily.com,news.stocktradersdaily.com
"Mon, 29 Sep 2025 10:13:25 GMT",How MamaCRM is redefining Social Media CRM - cbn.com.cy,cbn.com.cy
"Thu, 25 Sep 2025 13:31:00 GMT","Citizens JMP Maintains Salesforce(CRM.US) With Buy Rating, Maintains Target Price $430 - 富途牛牛",富途牛牛
"Mon, 29 Sep 2025 07:13:35 GMT",CRM Intern (Mandarin Speaker) at Ematic Solutions - Tech in Asia,Tech in Asia
"Thu, 25 Sep 2025 13:31:15 GMT",Klaviyo Advances AI-first B2C CRM with the Launch of Marketing Agent and Customer Agent - The Joplin Globe,The Joplin Globe
"Thu, 25 Sep 2025 22:16:20 GMT","Benioff Marc of Salesforce sells $553,162 in CRM stock - Investing.com India",Investing.com India
"Fri, 26 Sep 2025 06:30:00 GMT",CRM / Direct Marketing Specialist - South Africa - Remote Location - Bizcommunity,Bizcommunity
"Thu, 25 Sep 2025 08:17:16 GMT",PUBALI BANK INAUGURATES CRM BOOTH IN TONGI INDUSTRIAL AREA - The Financial Express,The Financial Express
"Tue, 30 Sep 2025 06:39:27 GMT",Is Themes Etf Trust Leverage Shares 2x Long CRM Daily Etf stock affected by interest rate hikes - 2025 Buyback Activity & Consistent Profit Focused Trading Strategies - newser.com,newser.com
"Tue, 30 Sep 2025 04:13:35 GMT",Is Themes Etf Trust Leverage Shares 2x Long CRM Daily Etf stock affected by interest rate hikes - Weekly Risk Report & Daily Chart Pattern Signals - newser.com,newser.com
"Mon, 29 Sep 2025 17:09:32 GMT",The best CRM with project management for small businesses - Softonic,Softonic
"Mon, 29 Sep 2025 19:53:42 GMT",Dan Niles on Salesforce (CRM) Agentic AI: ‘This Stuff Is Not Getting Deployed At the Rate CEO Thought’ - Insider Monkey,Insider Monkey
"Sun, 28 Sep 2025 10:19:57 GMT",Can Themes Etf Trust Leverage Shares 2x Long CRM Daily Etf stock sustain free cash flow growth - 2025 Buyback Activity & Expert Curated Trade Setup Alerts - newser.com,newser.com
"Mon, 29 Sep 2025 15:02:35 GMT",The best CRM software for lead and potential customer management in 2025 - Softonic,Softonic
"Mon, 29 Sep 2025 06:18:35 GMT",Can Themes Etf Trust Leverage Shares 2x Long CRM Daily Etf stock hit record highs again - Quarterly Portfolio Review & High Conviction Buy Zone Alerts - newser.com,newser.com
"Thu, 25 Sep 2025 23:19:53 GMT",Salesforce (CRM) Stock: Wall Street Reiterates Bullish Momentum - Watcher Guru,Watcher Guru
"Sat, 27 Sep 2025 05:07:29 GMT",HubSpot Inbound 2025: How AI is Transforming CRM and Marketing - Techiexpert.com,Techiexpert.com
"Thu, 25 Sep 2025 13:42:46 GMT",Can momentum traders help lift Themes Etf Trust Leverage Shares 2x Long CRM Daily Etf - Quarterly Portfolio Report & Real-Time Volume Analysis - newser.com,newser.com
"Fri, 26 Sep 2025 04:15:48 GMT",Salesforce (CRM) to Invest $6 Billion in UK by 2030 - Insider Monkey,Insider Monkey
"Sat, 27 Sep 2025 11:38:31 GMT",What high frequency data says about Themes Etf Trust Leverage Shares 2x Long CRM Daily Etf - July 2025 Momentum & Reliable Intraday Trade Plans - newser.com,newser.com
"Fri, 26 Sep 2025 17:45:25 GMT",Is Themes Etf Trust Leverage Shares 2x Long CRM Daily Etf stock affected by interest rate hikes - Earnings Performance Report & Risk Controlled Swing Alerts - newser.com,newser.com
"Sat, 27 Sep 2025 07:03:26 GMT","Tulbonne Liquid Factory Director Kim Oh-sung, CRM Ohana Team Leader, and Winning Cho Seung-ki Award - SportsChosun",SportsChosun
"Sat, 27 Sep 2025 13:26:52 GMT",How a mental health CRM solution helps optimise billing and revenue cycle management - London Daily News,London Daily News
"Mon, 29 Sep 2025 14:00:00 GMT","U.S. Healthcare CRM Market Towards USD 19.94 Billion by 2034, Experiences Data-Driven Patients - India Shorts",India Shorts
"Sun, 28 Sep 2025 06:31:32 GMT",Microsoft (NASDAQ:MSFT) versus Salesforce (NYSE:CRM) Head-To-Head Comparison - Defense World,Defense World
"Fri, 26 Sep 2025 14:07:38 GMT",CRM + AI: Redefining Engagement Metrics in 2025 - iTMunch,iTMunch
"Thu, 25 Sep 2025 13:51:44 GMT",ForcedLeak Vulnerability in Salesforce Agentforce Exposed CRM Data Through Indirect AI Prompt Injection - TechNadu,TechNadu
"Mon, 29 Sep 2025 09:33:53 GMT","""Issa Tchiroma is the strategic vote"": CRM vice-president campaigns for the FSNC candidate - Le bled parle",Le bled parle
"Thu, 25 Sep 2025 07:31:56 GMT",Salesforce (NYSE:CRM) Trading Down 2.1% After Insider Selling - Defense World,Defense World
2025-09-30T04:27:39,Salesforce (CRM) Discusses Data Cloud And Agentforce (Transcript),SeekingAlpha
2025-09-29T13:00:29,Salesforce's (NYSE:CRM) investors will be pleased with their decent 66% return over the last three years,Yahoo
2025-09-26T06:07:12,Salesforce (CRM) to Invest $6 Billion in UK by 2030,Yahoo
2025-09-25T23:49:51,Salesforce Is Now A Smart Buy (Upgrade),SeekingAlpha
2025-09-25T15:00:00,Stibo Systems Launches MDM SmartSync™ for Salesforce to Deliver AI-Ready Customer Data and Strengthen Trust,Yahoo
