Date,Title,Source
2025-09-14T08:46:51Z,"Modern Wealth Management LLC Has $984,000 Stock Holdings in Palo Alto Networks, Inc. $PANW",ETF Daily News
2025-09-13T14:10:30Z,Palo Alto Networks Inc. (PANW) Targets $15B in Recurring Revenue,Biztoc.com
2025-09-13T13:53:28Z,Palo Alto Networks Inc. (PANW) Targets $15B in Recurring Revenue,Yahoo Entertainment
2025-09-12T19:46:33Z,"Palo Alto Networks, Inc. (PANW) CEO Is A Great Example Of How To Convince Investors, Says Jim Cramer",Yahoo Entertainment
2025-09-11T05:33:47Z,"Palo Alto Networks, Inc. (NASDAQ:PANW) Short Interest Update",ETF Daily News
"Tue, 16 Sep 2025 06:52:44 GMT","Siren L.L.C. Increases Stake in Palo Alto Networks, Inc. $PANW - MarketBeat",MarketBeat
"Fri, 12 Sep 2025 14:03:00 GMT",Palo Alto Networks Stock (PANW) Opinions on Q4 2025 Earnings Report - Quiver Quantitative,Quiver Quantitative
"Mon, 15 Sep 2025 13:00:02 GMT","Investors Heavily Search Palo Alto Networks, Inc. (PANW): Here is What You Need to Know - Yahoo Finance",Yahoo Finance
"Mon, 15 Sep 2025 17:49:25 GMT",Wedbush Sees ‘Golden Buying Opportunity’ with Palo Alto Networks Stock (PANW) - TipRanks,TipRanks
"Mon, 15 Sep 2025 18:14:39 GMT",Palo Alto Networks Inc. (PANW) Targets $15B in Recurring Revenue - MSN,MSN
"Mon, 15 Sep 2025 11:19:18 GMT",Palo Alto Networks in focus as Wedbush adds to Best Ideas list (PANW:NASDAQ) - Seeking Alpha,Seeking Alpha
"Sun, 14 Sep 2025 16:30:11 GMT",How Prisma SASE 4.0’s AI Security Launch at Palo Alto Networks (PANW) Has Changed Its Investment Story - simplywall.st,simplywall.st
"Tue, 16 Sep 2025 05:41:34 GMT","Woodline Partners LP Sells 289,794 Shares of Palo Alto Networks, Inc. $PANW - MarketBeat",MarketBeat
"Mon, 15 Sep 2025 14:21:00 GMT",New Analyst Forecast: $PANW Given 'Outperform' Rating - Quiver Quantitative,Quiver Quantitative
"Tue, 16 Sep 2025 04:12:18 GMT","Integrity Alliance LLC. Invests $1.17 Million in Palo Alto Networks, Inc. $PANW - MarketBeat",MarketBeat
"Tue, 16 Sep 2025 03:50:57 GMT","Empowered Funds LLC Cuts Position in Palo Alto Networks, Inc. $PANW - MarketBeat",MarketBeat
"Tue, 16 Sep 2025 02:56:46 GMT","Palo Alto Networks, Inc. $PANW Shares Sold by Swedbank AB - MarketBeat",MarketBeat
"Mon, 15 Sep 2025 11:00:12 GMT","Are Strong Financial Prospects The Force That Is Driving The Momentum In Palo Alto Networks, Inc.'s NASDAQ:PANW) Stock? - Yahoo Finance",Yahoo Finance
"Mon, 15 Sep 2025 13:27:14 GMT","Palo Alto Networks' (PANW) ""Outperform"" Rating Reaffirmed at Wedbush - MarketBeat",MarketBeat
"Mon, 15 Sep 2025 10:57:56 GMT","1,721 Shares in Palo Alto Networks, Inc. $PANW Bought by Trust Co. of Oklahoma - MarketBeat",MarketBeat
"Mon, 15 Sep 2025 10:13:40 GMT","Gradient Investments LLC Acquires 7,423 Shares of Palo Alto Networks, Inc. $PANW - MarketBeat",MarketBeat
"Mon, 15 Sep 2025 09:34:52 GMT","Palo Alto Networks, Inc. $PANW Shares Sold by Quintet Private Bank Europe S.A. - MarketBeat",MarketBeat
"Sun, 14 Sep 2025 14:03:45 GMT","Great Lakes Advisors LLC Trims Position in Palo Alto Networks, Inc. $PANW - MarketBeat",MarketBeat
"Sun, 14 Sep 2025 11:10:21 GMT","Palo Alto Networks, Inc. $PANW Stock Position Lowered by Fox Hill Wealth Management - MarketBeat",MarketBeat
"Mon, 15 Sep 2025 11:06:27 GMT","Avity Investment Management Inc. Increases Stock Position in Palo Alto Networks, Inc. $PANW - MarketBeat",MarketBeat
"Sun, 14 Sep 2025 10:04:43 GMT","Palo Alto Networks, Inc. $PANW Stock Position Lessened by Legacy Wealth Management LLC MS - MarketBeat",MarketBeat
"Sun, 14 Sep 2025 11:58:27 GMT","Wesbanco Bank Inc. Purchases 14,618 Shares of Palo Alto Networks, Inc. $PANW - MarketBeat",MarketBeat
"Sun, 14 Sep 2025 10:16:57 GMT","Kera Capital Partners Inc. Takes Position in Palo Alto Networks, Inc. $PANW - MarketBeat",MarketBeat
"Sun, 14 Sep 2025 14:03:45 GMT","Palo Alto Networks, Inc. $PANW Shares Purchased by Ilmarinen Mutual Pension Insurance Co - MarketBeat",MarketBeat
"Sun, 14 Sep 2025 07:00:00 GMT","Ransom Advisory Ltd Acquires New Shares in Palo Alto Networks, Inc. $PANW - MarketBeat",MarketBeat
"Tue, 16 Sep 2025 04:49:02 GMT",Death Cross: What is Themes Etf Trust Leverage Shares 2x Long Panw Daily Etfs book value per share - July 2025 WrapUp & Capital Efficiency Focused Strategies - خودرو بانک,خودرو بانک
"Sun, 14 Sep 2025 07:00:00 GMT","Palo Alto Networks, Inc. $PANW Shares Acquired by Geneos Wealth Management Inc. - MarketBeat",MarketBeat
"Sun, 14 Sep 2025 12:12:05 GMT",PANW's SASE ARR Hits $1.3B: Is Prisma Browser the Key Driver? - MSN,MSN
"Sat, 13 Sep 2025 07:00:00 GMT","Optimize Financial Inc Takes Position in Palo Alto Networks, Inc. $PANW - MarketBeat",MarketBeat
"Sat, 13 Sep 2025 07:00:00 GMT","311,874 Shares in Palo Alto Networks, Inc. $PANW Acquired by Zurich Insurance Group Ltd FI - MarketBeat",MarketBeat
"Fri, 12 Sep 2025 13:48:01 GMT","Strs Ohio Invests $91.75 Million in Palo Alto Networks, Inc. $PANW - MarketBeat",MarketBeat
"Fri, 12 Sep 2025 18:56:15 GMT","Palo Alto Networks, Inc. $PANW Shares Bought by Meiji Yasuda Life Insurance Co - MarketBeat",MarketBeat
"Fri, 12 Sep 2025 07:00:00 GMT","Palo Alto Networks, Inc. $PANW Stock Holdings Increased by Meiji Yasuda Asset Management Co Ltd. - MarketBeat",MarketBeat
"Fri, 12 Sep 2025 07:00:00 GMT",Palo Alto Networks (NASDAQ:PANW) Trading Up 1.6% - Time to Buy? - MarketBeat,MarketBeat
"Fri, 12 Sep 2025 07:00:00 GMT","Palo Alto Networks, Inc. (NASDAQ:PANW) Short Interest Update - MarketBeat",MarketBeat
"Fri, 12 Sep 2025 14:47:00 GMT","Noteworthy ETF Outflows: IGV, NOW, PANW, APP - Nasdaq",Nasdaq
"Thu, 11 Sep 2025 19:16:18 GMT",Palo Alto Networks (NASDAQ:PANW) Trading 1.6% Higher - Should You Buy? - MarketBeat,MarketBeat
"Thu, 11 Sep 2025 12:25:07 GMT","Focus Partners Wealth Boosts Stock Position in Palo Alto Networks, Inc. $PANW - MarketBeat",MarketBeat
"Thu, 11 Sep 2025 07:00:00 GMT","Scientech Research LLC Trims Position in Palo Alto Networks, Inc. $PANW - MarketBeat",MarketBeat
"Tue, 16 Sep 2025 04:18:00 GMT",What institutional flow reveals about Themes Etf Trust Leverage Shares 2x Long Panw Daily Etf - July 2025 Earnings & Daily Market Momentum Tracking - newser.com,newser.com
"Mon, 15 Sep 2025 23:46:36 GMT",How institutional ownership impacts Themes Etf Trust Leverage Shares 2x Long Panw Daily Etf stock - Weekly Trend Report & Low Risk High Reward Trade Ideas - newser.com,newser.com
"Mon, 15 Sep 2025 15:43:14 GMT",Risk vs reward if holding onto PANW - Market Movement Recap & Daily Profit Focused Stock Screening - newser.com,newser.com
"Tue, 16 Sep 2025 06:45:48 GMT",Price momentum metrics for Themes Etf Trust Leverage Shares 2x Long Panw Daily Etf explained - Trade Risk Report & AI Driven Stock Reports - newser.com,newser.com
"Tue, 16 Sep 2025 04:20:42 GMT",Will Themes Etf Trust Leverage Shares 2x Long Panw Daily Etf stock go up soon - July 2025 Price Swings & High Return Trade Guides - newser.com,newser.com
"Mon, 15 Sep 2025 07:48:38 GMT",Real time pattern detection on Themes Etf Trust Leverage Shares 2x Long Panw Daily Etf stock - Market Trend Summary & Community Verified Trade Signals - newser.com,newser.com
"Sun, 14 Sep 2025 19:03:03 GMT",Live market analysis of Themes Etf Trust Leverage Shares 2x Long Panw Daily Etf - Portfolio Risk Report & Stepwise Entry and Exit Trade Signals - newser.com,newser.com
"Mon, 15 Sep 2025 03:37:12 GMT",Full technical analysis of Themes Etf Trust Leverage Shares 2x Long Panw Daily Etf stock - Options Play & Community Consensus Picks - newser.com,newser.com
"Sun, 14 Sep 2025 09:13:04 GMT",Is PANW stock reversal real or fake - 2025 Technical Patterns & AI Driven Price Predictions - newser.com,newser.com
"Sun, 14 Sep 2025 16:51:10 GMT",How sentiment analysis helps forecast PANW - Weekly Stock Recap & Free Community Consensus Stock Picks - newser.com,newser.com
"Sun, 14 Sep 2025 10:46:15 GMT",Real time pattern detection on Themes Etf Trust Leverage Shares 2x Long Panw Daily Etf stock - Market Activity Recap & Weekly High Conviction Trade Ideas - newser.com,newser.com
"Sun, 14 Sep 2025 07:29:36 GMT",Intraday pattern recognizer results for Themes Etf Trust Leverage Shares 2x Long Panw Daily Etf - 2025 Earnings Surprises & Safe Entry Point Alerts - newser.com,newser.com
"Mon, 15 Sep 2025 05:59:33 GMT",Smart tools for monitoring PANW’s price action - Trade Entry Summary & Weekly Breakout Stock Alerts - newser.com,newser.com
"Fri, 12 Sep 2025 19:51:36 GMT","Palo Alto Networks, Inc. (PANW) CEO Is A Great Example Of How To Convince Investors, Says Jim Cramer - Insider Monkey",Insider Monkey
"Mon, 15 Sep 2025 07:04:56 GMT",Smart tools for monitoring PANW’s price action - 2025 Earnings Impact & High Conviction Trade Alerts - newser.com,newser.com
"Sun, 14 Sep 2025 23:36:09 GMT",What machine learning models say about PANW - 2025 Market Sentiment & Safe Entry Point Alerts - newser.com,newser.com
"Mon, 15 Sep 2025 11:00:12 GMT","Are Strong Financial Prospects The Force That Is Driving The Momentum In Palo Alto Networks, Inc.'s NASDAQ:PANW) Stock? - beritasriwijaya.co.id",beritasriwijaya.co.id
"Sun, 14 Sep 2025 17:47:00 GMT",How sentiment analysis helps forecast PANW - July 2025 Highlights & Real-Time Market Sentiment Alerts - newser.com,newser.com
"Sat, 13 Sep 2025 22:51:00 GMT",Can a trend reversal in PANW lead to recovery - Product Launch & Verified Momentum Stock Alerts - newser.com,newser.com
"Sat, 13 Sep 2025 22:53:03 GMT",Comparing PANW in custom built stock radars - Global Markets & Reliable Intraday Trade Plans - newser.com,newser.com
"Sun, 14 Sep 2025 14:14:15 GMT",Risk vs reward if holding onto PANW - 2025 Trading Volume Trends & Reliable Price Action Trade Plans - newser.com,newser.com
"Sun, 14 Sep 2025 14:58:27 GMT",How sentiment analysis helps forecast PANW - Insider Buying & Short-Term Trading Alerts - newser.com,newser.com
"Sun, 14 Sep 2025 15:25:29 GMT",Live market analysis of Themes Etf Trust Leverage Shares 2x Long Panw Daily Etf - 2025 Sector Review & Growth Oriented Trade Recommendations - newser.com,newser.com
"Sun, 14 Sep 2025 07:16:41 GMT",Real time scanner hits for Themes Etf Trust Leverage Shares 2x Long Panw Daily Etf explained - Portfolio Performance Summary & Consistent Growth Equity Picks - newser.com,newser.com
2025-09-15T16:00:02,"Investors Heavily Search Palo Alto Networks, Inc. (PANW): Here is What You Need to Know",Yahoo
2025-09-15T14:00:12,"Are Strong Financial Prospects The Force That Is Driving The Momentum In Palo Alto Networks, Inc.'s NASDAQ:PANW) Stock?",Yahoo
2025-09-13T16:53:28,Palo Alto Networks Inc. (PANW) Targets $15B in Recurring Revenue,Yahoo
2025-09-12T21:46:33,"Palo Alto Networks, Inc. (PANW) CEO Is A Great Example Of How To Convince Investors, Says Jim Cramer",Yahoo
