Date,Title,Source
2025-09-07T14:48:07Z,Leerink Partners Maintained a Buy on Merck & Co (MRK),Biztoc.com
2025-09-07T14:23:49Z,Leerink Partners Maintained a Buy on Merck & Co (MRK),Yahoo Entertainment
2025-09-06T06:37:23Z,TN forms panel to probe alleged gas leak at Cuddalore SIPCOT unit,BusinessLine
2025-09-05T15:05:29Z,Merck (MRK) Impresses with New Cholesterol Drug in CORALreef Trial,Yahoo Entertainment
2025-09-04T06:40:59Z,"Merck & Co., Inc. (NYSE:MRK) Receives $107.44 Consensus Target Price from Brokerages",ETF Daily News
"Mon, 08 Sep 2025 17:28:09 GMT",Merck (MRK) Gains Breakthrough Therapy Designation For Lung Cancer Drug - Yahoo Finance,Yahoo Finance
"Tue, 09 Sep 2025 04:20:02 GMT",Liquidity Mapping Around (MRK) Price Events - news.stocktradersdaily.com,news.stocktradersdaily.com
"Tue, 09 Sep 2025 00:18:44 GMT",Merck (MRK) Impresses with New Cholesterol Drug in CORALreef Trial - MSN,MSN
"Mon, 08 Sep 2025 12:53:30 GMT",What Merck (MRK)'s Latest Oncology and Cardiovascular Trial Results Mean For Shareholders - simplywall.st,simplywall.st
"Thu, 04 Sep 2025 14:37:00 GMT",October 24th Options Now Available For Merck (MRK) - Nasdaq,Nasdaq
"Sun, 07 Sep 2025 14:23:49 GMT",Leerink Partners Maintained a Buy on Merck & Co (MRK) - Yahoo Finance,Yahoo Finance
"Sun, 07 Sep 2025 07:17:59 GMT",Could The Market Be Wrong About Merck KGaA (ETR:MRK) Given Its Attractive Financial Prospects? - simplywall.st,simplywall.st
"Sun, 07 Sep 2025 05:21:38 GMT","Goldman Sachs Slashes PT on Merck & Co. (MRK) to $94 From $99, Keeps a Buy Rating - MSN",MSN
"Sat, 06 Sep 2025 11:35:28 GMT",How Positive Phase 3 Results for Enlicitide Could Shape Merck’s (MRK) Cardiovascular Ambitions - Yahoo Finance,Yahoo Finance
"Fri, 05 Sep 2025 11:33:00 GMT","J.P. Morgan Maintains Merck & Co(MRK.US) With Buy Rating, Maintains Target Price $120 - 富途牛牛",富途牛牛
"Thu, 04 Sep 2025 07:00:00 GMT",Marks Electrical Group (LON:MRK) Trading 0.2% Higher - Here's What Happened - MarketBeat,MarketBeat
"Thu, 04 Sep 2025 07:00:00 GMT",Marks Electrical Group (LON:MRK) Trading Up 0.2% - What's Next? - MarketBeat,MarketBeat
"Fri, 05 Sep 2025 20:16:24 GMT",MRK SALES For Genie Grc-12 Seal Kit - Steering Cylinder 105550 India - Palawan News,Palawan News
"Fri, 05 Sep 2025 14:25:06 GMT","Merck & Co., Inc. (MRK) Stock Today: A Deep-Dive into Market Performance, Business Fundamentals, and Industry Outlook - thekhabrilal",thekhabrilal
2025-09-08T19:16:07,"Merck & Co., Inc. (MRK) Presents At Morgan Stanley 23rd Annual Global Healthcare Conference Transcript",SeekingAlpha
2025-09-07T17:23:49,Leerink Partners Maintained a Buy on Merck & Co (MRK),Yahoo
2025-09-06T14:35:28,How Positive Phase 3 Results for Enlicitide Could Shape Merck’s (MRK) Cardiovascular Ambitions,Yahoo
2025-09-05T18:05:29,Merck (MRK) Impresses with New Cholesterol Drug in CORALreef Trial,Yahoo
2025-09-04T16:30:55,"Merck & Co., Inc. (MRK) Presents At Wells Fargo 20th Annual Healthcare Conference 2025 Transcript",SeekingAlpha
