Date,Title,Source
2025-09-06T06:37:23Z,TN forms panel to probe alleged gas leak at Cuddalore SIPCOT unit,BusinessLine
2025-09-05T15:05:29Z,Merck (MRK) Impresses with New Cholesterol Drug in CORALreef Trial,Yahoo Entertainment
2025-09-04T06:40:59Z,"Merck & Co., Inc. (NYSE:MRK) Receives $107.44 Consensus Target Price from Brokerages",ETF Daily News
2025-09-02T07:27:23Z,"Merck & Co., Inc. (MRK) Launches $3B Plan to Reinvest Ahead of Keytruda Patent Expiry in 2028",Yahoo Entertainment
"Sun, 07 Sep 2025 05:21:37 GMT","Goldman Sachs Slashes PT on Merck & Co. (MRK) to $94 From $99, Keeps a Buy Rating - MSN",MSN
"Sat, 06 Sep 2025 11:35:28 GMT",How Positive Phase 3 Results for Enlicitide Could Shape Merck’s (MRK) Cardiovascular Ambitions - ca.finance.yahoo.com,ca.finance.yahoo.com
"Sat, 06 Sep 2025 15:18:04 GMT",Understanding the Setup: (MRK) and Scalable Risk - news.stocktradersdaily.com,news.stocktradersdaily.com
"Thu, 04 Sep 2025 14:37:00 GMT",October 24th Options Now Available For Merck (MRK) - Nasdaq,Nasdaq
"Wed, 03 Sep 2025 13:32:57 GMT","MRK Posts Cholesterol Drug Data, Focus Shifts Back to Its Pipeline - Zacks Investment Research",Zacks Investment Research
"Tue, 02 Sep 2025 12:58:44 GMT","4 stocks to watch on Tuesday: RACE, ZS, NIO, MRK - Seeking Alpha",Seeking Alpha
"Fri, 05 Sep 2025 06:45:10 GMT",Marks Electrical Group (LON:MRK) Trading 0.2% Higher - Here's What Happened - MarketBeat,MarketBeat
"Fri, 05 Sep 2025 15:05:29 GMT",Merck (MRK) Impresses with New Cholesterol Drug in CORALreef Trial - Yahoo Finance,Yahoo Finance
"Thu, 04 Sep 2025 06:22:01 GMT",Precision Trading with Merck & Company Inc. (MRK) Risk Zones - news.stocktradersdaily.com,news.stocktradersdaily.com
"Thu, 04 Sep 2025 07:00:00 GMT",Marks Electrical Group (LON:MRK) Trading Up 0.2% - What's Next? - MarketBeat,MarketBeat
"Tue, 02 Sep 2025 15:33:58 GMT",Leerink Partners Remains Bullish on Merck & Co. (MRK) - MSN,MSN
"Tue, 02 Sep 2025 17:24:35 GMT",Merck (MRK) Announces Positive Results From Phase 3 CORALreef Lipids Trial - Yahoo Finance,Yahoo Finance
"Tue, 02 Sep 2025 07:27:23 GMT","Merck & Co., Inc. (MRK) Launches $3B Plan to Reinvest Ahead of Keytruda Patent Expiry in 2028 - Yahoo Finance",Yahoo Finance
"Wed, 03 Sep 2025 18:56:54 GMT","PFE, MRK, LLY: Florida Become First U.S. State to End Vaccine Mandates, Including for Schools - TipRanks",TipRanks
"Tue, 02 Sep 2025 19:20:04 GMT",RFK Jr. sets out changes he wants at CDC in op-ed (MRK:NYSE) - Seeking Alpha,Seeking Alpha
"Tue, 02 Sep 2025 17:36:17 GMT",What's Going On With Merck Stock Tuesday? - Merck & Co (NYSE:MRK) - Benzinga,Benzinga
"Fri, 05 Sep 2025 20:16:24 GMT",MRK SALES For Genie Grc-12 Seal Kit - Steering Cylinder 105550 India - Palawan News,Palawan News
"Fri, 05 Sep 2025 15:12:01 GMT",Merck (MRK) Impresses with New Cholesterol Drug in CORALreef Trial - Insider Monkey,Insider Monkey
"Fri, 05 Sep 2025 14:25:06 GMT","Merck & Co., Inc. (MRK) Stock Today: A Deep-Dive into Market Performance, Business Fundamentals, and Industry Outlook - thekhabrilal",thekhabrilal
2025-09-05T18:05:29,Merck (MRK) Impresses with New Cholesterol Drug in CORALreef Trial,Yahoo
2025-09-04T16:30:55,"Merck & Co., Inc. (MRK) Presents At Wells Fargo 20th Annual Healthcare Conference 2025 Transcript",SeekingAlpha
2025-09-03T17:07:00,"MRK Posts Cholesterol Drug Data, Focus Shifts Back to Its Pipeline",Yahoo
2025-09-02T20:36:17,This Merck Pill Promises Powerful Cholesterol Reduction Without Injections,Yahoo
2025-09-02T20:24:35,Merck (MRK) Announces Positive Results From Phase 3 CORALreef Lipids Trial,Yahoo
2025-09-02T14:00:30,Merck's Verquvo Fails to Meet Primary Endpoint in Phase 3 Victor Trial,Yahoo
2025-09-02T10:27:23,"Merck & Co., Inc. (MRK) Launches $3B Plan to Reinvest Ahead of Keytruda Patent Expiry in 2028",Yahoo
