Date,Title,Source
2025-10-14T21:27:05Z,Here's How Much $1000 Invested In Cadence Design Systems 10 Years Ago Would Be Worth Today,Biztoc.com
2025-10-13T15:03:34Z,fastapi-offline 1.7.5,Pypi.org
"Tue, 14 Oct 2025 23:08:54 GMT",Can Cadence (CDNS) Maintain Its Innovation Edge Amid Evolving Trade Tensions and Supply Chain Risks? - Yahoo Finance,Yahoo Finance
"Wed, 15 Oct 2025 15:24:01 GMT",Trading Systems Reacting to (CDNS) Volatility - news.stocktradersdaily.com,news.stocktradersdaily.com
"Wed, 15 Oct 2025 09:18:58 GMT",Cadence Design Systems (CDNS) Declines More Than Market: Some Information for Investors - sharewise.com,sharewise.com
"Thu, 16 Oct 2025 09:36:31 GMT",DoT Keeps CDNs Unregulated Despite Earlier Push For Oversight - MediaNama,MediaNama
"Mon, 13 Oct 2025 07:00:00 GMT","Greg Brockman Says AI Models Prevented Chip Design Schedule Slip — Implications for EDA SNPS and CDNS, Nvidia NVDA, and BTC Mining Hardware - Blockchain News",Blockchain News
"Sun, 12 Oct 2025 07:18:17 GMT","Ameritas Advisory Services LLC Acquires New Position in Cadence Design Systems, Inc. $CDNS - Defense World",Defense World
2025-10-15T01:08:54,Can Cadence (CDNS) Maintain Its Innovation Edge Amid Evolving Trade Tensions and Supply Chain Risks?,Yahoo
2025-10-15T00:00:02,Cadence Design Systems (CDNS) Declines More Than Market: Some Information for Investors,Yahoo
2025-10-14T13:00:23,"Institutional investors in Cadence Design Systems, Inc. (NASDAQ:CDNS) lost 6.0% last week but have reaped the benefits of longer-term growth",Yahoo
2025-10-13T15:28:53,Cadence Molecular Sciences Launches AI-Enabled ROCS X for Multi-Trillion Molecule Virtual Screening,Yahoo
