Date,Title,Source
"Sat, 30 Aug 2025 01:49:05 GMT",What Fibonacci levels say about QCOM rebound - 2025 Year in Review & Reliable Volume Spike Trade Alerts - Newser,Newser
"Sat, 30 Aug 2025 00:56:02 GMT",Why (QCOM) Price Action Is Critical for Tactical Trading - news.stocktradersdaily.com,news.stocktradersdaily.com
"Fri, 29 Aug 2025 22:18:45 GMT",QUALCOMM (NASDAQ:QCOM) Trading 2% Higher on Analyst Upgrade - MarketBeat,MarketBeat
"Fri, 29 Aug 2025 15:30:17 GMT",Qualcomm (QCOM) Up 9.6% Since Last Earnings Report: Can It Continue? - Yahoo Finance,Yahoo Finance
"Fri, 29 Aug 2025 19:43:00 GMT","Noteworthy Friday Option Activity: FDX, QCOM, FTAI - Nasdaq",Nasdaq
"Fri, 29 Aug 2025 10:18:08 GMT",Evaluating Qualcomm (QCOM): Is Strong AI Expansion and Upbeat Analyst Revisions Signaling an Undervalued Opportunity? - simplywall.st,simplywall.st
"Sat, 30 Aug 2025 01:21:50 GMT",Applying Elliott Wave Theory to QCOM - Trade Volume Report & Reliable Intraday Trade Alerts - Newser,Newser
"Fri, 29 Aug 2025 22:18:45 GMT",Corebridge Financial Inc. Cuts Holdings in QUALCOMM Incorporated $QCOM - MarketBeat,MarketBeat
"Fri, 29 Aug 2025 04:29:39 GMT",Qualcomm’s (QCOM) Impressive Roadmap Boosted by Automotive and IoT Growth - Yahoo Finance,Yahoo Finance
"Sat, 30 Aug 2025 05:01:55 GMT",What’s the recovery path for long term holders of QCOM - Weekly Gains Report & Safe Capital Growth Trade Ideas - Newser,Newser
"Fri, 29 Aug 2025 22:18:45 GMT",QUALCOMM (NASDAQ:QCOM) Trading Down 1.1% - Here's What Happened - MarketBeat,MarketBeat
"Fri, 29 Aug 2025 21:53:01 GMT",When is the best time to exit QCOM - July 2025 Momentum & Community Consensus Picks - Newser,Newser
"Fri, 29 Aug 2025 22:18:45 GMT",Arete Upgrades QUALCOMM (NASDAQ:QCOM) to Buy - MarketBeat,MarketBeat
"Fri, 29 Aug 2025 21:54:43 GMT",Best data tools to analyze QCOM stock - Bond Market & Entry Point Confirmation Signals - Newser,Newser
"Fri, 29 Aug 2025 22:03:52 GMT",Heatmap analysis for QCOM and competitors - 2025 Key Lessons & AI Based Buy/Sell Signal Reports - Newser,Newser
"Sat, 30 Aug 2025 00:05:51 GMT",Detecting price anomalies in QCOM with AI - Trade Risk Summary & High Accuracy Trade Alerts - Newser,Newser
"Fri, 29 Aug 2025 21:47:29 GMT",What indicators show strength in QCOM - Share Buyback & Reliable Intraday Trade Plans - Newser,Newser
"Fri, 29 Aug 2025 15:36:30 GMT",Why QCOM stock attracts strong analyst attention - Earnings Risk Report & Community Driven Trade Alerts - Newser,Newser
"Fri, 29 Aug 2025 12:47:42 GMT",Relative strength of QCOM in sector analysis - Portfolio Risk Report & Reliable Entry Point Alerts - Newser,Newser
"Sat, 30 Aug 2025 04:28:33 GMT",Will QCOM rebound enough to break even - Breakout Watch & High Return Trade Guides - Newser,Newser
"Fri, 29 Aug 2025 22:18:45 GMT","Taikang Asset Management Hong Kong Co Ltd Acquires 11,526 Shares of QUALCOMM Incorporated $QCOM - MarketBeat",MarketBeat
"Fri, 29 Aug 2025 20:05:35 GMT",Best data tools to analyze QCOM stock - 2025 Volatility Report & Growth Focused Entry Point Reports - Newser,Newser
"Fri, 29 Aug 2025 07:27:30 GMT",Qualcomm (QCOM) Pushes 5G Innovation With New Snapdragon Wearable Platforms and Broader Market Strategy - MSN,MSN
"Thu, 28 Aug 2025 11:55:39 GMT",Qualcomm (QCOM) Pushes 5G Innovation With New Snapdragon Wearable Platforms and Broader Market Strategy - ca.finance.yahoo.com,ca.finance.yahoo.com
"Fri, 29 Aug 2025 22:34:12 GMT",Detecting support and resistance levels for QCOM - Quarterly Profit Summary & Risk Controlled Daily Plans - Newser,Newser
"Thu, 28 Aug 2025 21:15:15 GMT",Applying Elliott Wave Theory to QCOM - July 2025 Spike Watch & Risk Controlled Daily Trade Plans - Newser,Newser
"Fri, 29 Aug 2025 21:32:24 GMT",Can momentum traders help lift QCOM - July 2025 Intraday Action & Long-Term Safe Investment Plans - Newser,Newser
"Fri, 29 Aug 2025 07:23:21 GMT",Can momentum traders help lift QCOM - Market Movement Recap & Smart Investment Allocation Tips - Newser,Newser
"Fri, 29 Aug 2025 07:00:00 GMT",QUALCOMM Incorporated $QCOM Shares Bought by Caisse DE Depot ET Placement DU Quebec - MarketBeat,MarketBeat
"Fri, 29 Aug 2025 07:00:00 GMT","30,889 Shares in QUALCOMM Incorporated $QCOM Purchased by Nishkama Capital LLC - MarketBeat",MarketBeat
"Fri, 29 Aug 2025 07:00:00 GMT",Rafferty Asset Management LLC Decreases Position in QUALCOMM Incorporated $QCOM - MarketBeat,MarketBeat
"Fri, 29 Aug 2025 21:21:15 GMT",Best data tools to analyze QCOM stock - Earnings Overview Report & AI Forecasted Entry and Exit Points - Newser,Newser
"Fri, 29 Aug 2025 08:51:27 GMT",QUALCOMM Incorporated $QCOM Shares Sold by Jump Financial LLC - MarketBeat,MarketBeat
"Fri, 29 Aug 2025 11:34:29 GMT","Lansforsakringar Fondforvaltning AB publ Acquires 3,831 Shares of QUALCOMM Incorporated $QCOM - MarketBeat",MarketBeat
"Fri, 29 Aug 2025 11:08:42 GMT","Oak Associates Ltd. OH Sells 7,185 Shares of QUALCOMM Incorporated $QCOM - MarketBeat",MarketBeat
"Fri, 29 Aug 2025 11:24:47 GMT",OMERS ADMINISTRATION Corp Raises Position in QUALCOMM Incorporated $QCOM - MarketBeat,MarketBeat
"Thu, 28 Aug 2025 21:33:45 GMT",Compound Planning Inc. Raises Stock Position in QUALCOMM Incorporated $QCOM - MarketBeat,MarketBeat
"Fri, 29 Aug 2025 09:54:01 GMT","Ieq Capital LLC Acquires 44,803 Shares of QUALCOMM Incorporated $QCOM - MarketBeat",MarketBeat
"Fri, 29 Aug 2025 09:51:56 GMT","Redwood Investment Management LLC Takes $303,000 Position in QUALCOMM Incorporated $QCOM - MarketBeat",MarketBeat
"Fri, 29 Aug 2025 16:48:41 GMT",Can momentum traders help lift QCOM - July 2025 Opening Moves & Pattern Based Trade Signal System - Newser,Newser
"Fri, 29 Aug 2025 18:09:19 GMT",QCOM’s volatility index tracking explained - Portfolio Gains Report & Daily Growth Stock Investment Tips - Newser,Newser
"Wed, 27 Aug 2025 15:36:11 GMT",When is the best time to exit QCOM - Trade Volume Report & AI Powered Buy/Sell Recommendations - Newser,Newser
"Fri, 29 Aug 2025 17:21:32 GMT",What indicators show strength in QCOM - July 2025 Pullbacks & Pattern Based Trade Signal System - Newser,Newser
"Thu, 28 Aug 2025 07:00:00 GMT",MetLife Investment Management LLC Decreases Stock Holdings in QUALCOMM Incorporated $QCOM - MarketBeat,MarketBeat
"Thu, 28 Aug 2025 02:03:45 GMT","Synovus Financial Corp Acquires 29,288 Shares of QUALCOMM Incorporated $QCOM - MarketBeat",MarketBeat
"Thu, 28 Aug 2025 12:38:22 GMT",QUALCOMM Incorporated $QCOM Shares Bought by Truvestments Capital LLC - MarketBeat,MarketBeat
"Tue, 26 Aug 2025 13:40:03 GMT",Why Qualcomm (QCOM) is a Top Value Stock for the Long-Term - Yahoo Finance,Yahoo Finance
"Thu, 28 Aug 2025 23:14:20 GMT",Patricia Y. Grech Sells 236 Shares of QUALCOMM (NASDAQ:QCOM) Stock - MarketBeat,MarketBeat
"Tue, 26 Aug 2025 17:32:58 GMT",QUALCOMM (QCOM) Appoints New Chief Accounting Officer as Executive Roles Shift - simplywall.st,simplywall.st
"Thu, 28 Aug 2025 11:39:42 GMT",Guggenheim Capital LLC Lowers Stake in QUALCOMM Incorporated $QCOM - MarketBeat,MarketBeat
"Thu, 28 Aug 2025 07:00:00 GMT",Kestra Advisory Services LLC Trims Stake in QUALCOMM Incorporated $QCOM - MarketBeat,MarketBeat
"Thu, 28 Aug 2025 07:00:00 GMT",QUALCOMM Incorporated $QCOM Shares Bought by Comerica Bank - MarketBeat,MarketBeat
"Fri, 29 Aug 2025 15:13:42 GMT",What institutional flow reveals about QCOM - Trade Volume Report & Consistent Profit Focused Trading Strategies - Newser,Newser
"Thu, 28 Aug 2025 07:00:00 GMT",QUALCOMM Incorporated $QCOM Shares Purchased by Smartleaf Asset Management LLC - MarketBeat,MarketBeat
"Tue, 26 Aug 2025 13:00:04 GMT",Investors Heavily Search QUALCOMM Incorporated (QCOM): Here is What You Need to Know - Yahoo Finance,Yahoo Finance
"Wed, 27 Aug 2025 07:00:00 GMT",Quantbot Technologies LP Has $1.53 Million Stock Holdings in QUALCOMM Incorporated $QCOM - MarketBeat,MarketBeat
"Fri, 29 Aug 2025 13:25:54 GMT",What MACD and RSI say about QCOM - Watch List & Community Verified Swing Trade Signals - Newser,Newser
"Thu, 28 Aug 2025 10:12:48 GMT",QUALCOMM (NASDAQ:QCOM) Raised to Strong-Buy at Arete Research - MarketBeat,MarketBeat
"Fri, 29 Aug 2025 17:22:08 GMT",What indicators show strength in QCOM - Trade Risk Report & Fast Exit/Entry Strategy Plans - Newser,Newser
"Wed, 27 Aug 2025 07:00:00 GMT","Haverford Trust Co Buys 28,760 Shares of QUALCOMM Incorporated $QCOM - MarketBeat",MarketBeat
"Wed, 27 Aug 2025 07:00:00 GMT","CW Advisors LLC Purchases 7,704 Shares of QUALCOMM Incorporated $QCOM - MarketBeat",MarketBeat
"Wed, 27 Aug 2025 07:00:00 GMT",QUALCOMM Incorporated $QCOM Shares Sold by Bahl & Gaynor Inc. - MarketBeat,MarketBeat
"Wed, 27 Aug 2025 07:00:00 GMT",APG Asset Management N.V. Decreases Position in QUALCOMM Incorporated $QCOM - MarketBeat,MarketBeat
"Fri, 29 Aug 2025 13:57:08 GMT",What’s the recovery path for long term holders of QCOM - Trade Entry Summary & Low Risk Entry Point Tips - Newser,Newser
"Mon, 25 Aug 2025 12:00:49 GMT",QCOM Gaining Traction in V2X Market: Will it Be a Key Growth Driver? - Zacks Investment Research,Zacks Investment Research
"Fri, 29 Aug 2025 18:42:09 GMT",QCOM’s volatility index tracking explained - Short Setup & Technical Analysis for Trade Confirmation - Newser,Newser
"Fri, 29 Aug 2025 13:25:54 GMT",What MACD and RSI say about QCOM - Watch List & Community Verified Swing Trade Signals - Newser,Newser
"Thu, 28 Aug 2025 12:27:52 GMT",B. Metzler seel. Sohn & Co. AG Has $13.72 Million Position in QUALCOMM Incorporated $QCOM - MarketBeat,MarketBeat
"Thu, 28 Aug 2025 14:52:00 GMT","QQQI, PEP, QCOM, SHOP: Large Inflows Detected at ETF - Nasdaq",Nasdaq
"Tue, 26 Aug 2025 07:00:00 GMT",QUALCOMM (NASDAQ:QCOM) Stock Unloaded Rep. Ritchie Torres - MarketBeat,MarketBeat
"Wed, 27 Aug 2025 07:00:00 GMT",APG Asset Management US Inc. Has $4.89 Million Holdings in QUALCOMM Incorporated $QCOM - MarketBeat,MarketBeat
"Mon, 25 Aug 2025 12:22:30 GMT",Does Qualcomm's (QCOM) Soft Outlook Challenge Its Edge AI Leadership Narrative? - simplywall.st,simplywall.st
"Mon, 25 Aug 2025 20:11:23 GMT",Qualcomm Stock Forecast: NASDAQ:QCOM at $165.42 With AI Edge Growth vs. Apple Headwind - tradingnews.com,tradingnews.com
"Wed, 27 Aug 2025 22:19:32 GMT",What MACD and RSI say about QCOM - 2025 Historical Comparison & Entry Point Strategy Guides - Newser,Newser
"Tue, 26 Aug 2025 07:00:00 GMT","Allstate Corp Acquires 7,869 Shares of QUALCOMM Incorporated $QCOM - MarketBeat",MarketBeat
"Tue, 26 Aug 2025 07:00:00 GMT","Summit Financial LLC Acquires 4,225 Shares of QUALCOMM Incorporated $QCOM - MarketBeat",MarketBeat
"Tue, 26 Aug 2025 07:00:00 GMT","Strategies Wealth Advisors LLC Acquires Shares of 2,950 QUALCOMM Incorporated $QCOM - MarketBeat",MarketBeat
"Tue, 26 Aug 2025 07:00:00 GMT",QUALCOMM Incorporated $QCOM Shares Purchased by AlphaQuest LLC - MarketBeat,MarketBeat
"Fri, 29 Aug 2025 06:35:55 GMT",Will QCOM rebound enough to break even - July 2025 PreEarnings & Real-Time Price Movement Reports - Newser,Newser
"Tue, 26 Aug 2025 07:00:00 GMT",QUALCOMM (NASDAQ:QCOM) Stock Price Up 3.1% - Still a Buy? - MarketBeat,MarketBeat
2025-08-29T17:30:17,Qualcomm (QCOM) Up 9.6% Since Last Earnings Report: Can It Continue?,Yahoo
2025-08-29T06:27:00,Qualcomm’s (QCOM) Impressive Roadmap Boosted by Automotive and IoT Growth,Yahoo
2025-08-28T19:29:01,QUALCOMM Incorporated (QCOM) Deutsche Bank 2025 Technology Conference (Transcript),SeekingAlpha
2025-08-28T13:55:39,Qualcomm (QCOM) Pushes 5G Innovation With New Snapdragon Wearable Platforms and Broader Market Strategy,Yahoo
2025-08-26T19:31:49,QUALCOMM (QCOM) Appoints New Chief Accounting Officer as Executive Roles Shift,Yahoo
2025-08-26T15:40:03,Why Qualcomm (QCOM) is a Top Value Stock for the Long-Term,Yahoo
2025-08-26T15:00:04,Investors Heavily Search QUALCOMM Incorporated (QCOM): Here is What You Need to Know,Yahoo
2025-08-25T14:56:00,QCOM Gaining Traction in V2X Market: Will it Be a Key Growth Driver?,Yahoo
