Date,Title,Source
"Wed, 03 Dec 2025 19:22:36 GMT",Alabama Ethics Commission allows former DHR employee to represent foster parents - Alabama Reflector,Alabama Reflector
"Wed, 03 Dec 2025 08:35:46 GMT",The Bull Case For Danaher (DHR) Could Change Following New Fiduciary-Duty Probe Into Its Boardroom - simplywall.st,simplywall.st
"Wed, 03 Dec 2025 15:49:00 GMT","USCL, BKNG, BSX, DHR: Large Outflows Detected at ETF - Nasdaq",Nasdaq
"Wed, 03 Dec 2025 14:06:17 GMT",Danaher Corporation $DHR Position Boosted by Van Hulzen Asset Management LLC - MarketBeat,MarketBeat
"Wed, 03 Dec 2025 06:02:29 GMT",G Foods Inc. (DHR) stock worth holding before Fed meeting - 2025 EndofYear Setup & Growth Focused Stock Pick Reports - Newser,Newser
"Mon, 01 Dec 2025 21:49:00 GMT",Montgomery County DHR to return to permanent location - WSFA,WSFA
"Tue, 02 Dec 2025 18:12:07 GMT","Morgan Stanley Initiates Coverage on DHR with Overweight Rating, Sets Price Target at $270 | DHR Stock News - GuruFocus",GuruFocus
"Wed, 03 Dec 2025 13:03:45 GMT",Danaher Corporation $DHR Shares Sold by M&T Bank Corp - MarketBeat,MarketBeat
"Mon, 01 Dec 2025 12:00:24 GMT",Danaher Corporation (NYSE:DHR) Is Going Strong But Fundamentals Appear To Be Mixed : Is There A Clear Direction For The Stock? - Yahoo Finance,Yahoo Finance
"Wed, 03 Dec 2025 06:18:28 GMT",G Foods Inc. (DHR) stock a defensive play amid uncertainty - Market Performance Summary & Weekly High Conviction Ideas - Newser,Newser
"Wed, 03 Dec 2025 13:15:56 GMT",Quantbot Technologies LP Has $10.40 Million Stake in Danaher Corporation $DHR - MarketBeat,MarketBeat
"Tue, 02 Dec 2025 07:40:10 GMT",G Foods Inc. (DHR) stock stays resilient - Earnings Trend Report & Stepwise Trade Execution Plans - Newser,Newser
"Wed, 03 Dec 2025 11:33:34 GMT","Northwestern Mutual Wealth Management Co. Sells 7,279 Shares of Danaher Corporation $DHR - MarketBeat",MarketBeat
"Wed, 03 Dec 2025 06:04:30 GMT",G Foods Inc. (DHR) stock gains from tech spending - M&A Rumor & Long-Term Safe Investment Ideas - Newser,Newser
"Wed, 03 Dec 2025 10:15:07 GMT",Danaher Corporation $DHR Shares Sold by Granite Investment Partners LLC - MarketBeat,MarketBeat
"Wed, 03 Dec 2025 10:05:39 GMT","Groupe la Francaise Acquires 94,750 Shares of Danaher Corporation $DHR - MarketBeat",MarketBeat
"Wed, 03 Dec 2025 08:10:50 GMT",1832 Asset Management L.P. Grows Stake in Danaher Corporation $DHR - MarketBeat,MarketBeat
"Tue, 02 Dec 2025 13:21:49 GMT","West Family Investments Inc. Makes New $308,000 Investment in Danaher Corporation $DHR - MarketBeat",MarketBeat
"Tue, 02 Dec 2025 12:37:46 GMT",Danaher Corporation $DHR Shares Acquired by OMERS ADMINISTRATION Corp - MarketBeat,MarketBeat
"Tue, 02 Dec 2025 12:43:41 GMT",M.D. Sass LLC Boosts Stake in Danaher Corporation $DHR - MarketBeat,MarketBeat
"Tue, 02 Dec 2025 09:49:57 GMT","Fisher Asset Management LLC Sells 294,492 Shares of Danaher Corporation $DHR - MarketBeat",MarketBeat
"Tue, 02 Dec 2025 11:44:44 GMT","Schroder Investment Management Group Sells 23,731 Shares of Danaher Corporation $DHR - MarketBeat",MarketBeat
"Tue, 02 Dec 2025 11:02:33 GMT","J.W. Cole Advisors Inc. Purchases 1,569 Shares of Danaher Corporation $DHR - MarketBeat",MarketBeat
"Tue, 02 Dec 2025 14:39:50 GMT",Danaher (NYSE:DHR) Price Target Raised to $270.00 at HSBC - MarketBeat,MarketBeat
"Mon, 01 Dec 2025 12:34:43 GMT",Railway Pension Investments Ltd Decreases Stock Position in Danaher Corporation $DHR - MarketBeat,MarketBeat
"Mon, 01 Dec 2025 09:51:19 GMT",Danaher Corporation $DHR Shares Bought by Dixon Mitchell Investment Counsel Inc. - MarketBeat,MarketBeat
"Tue, 02 Dec 2025 12:40:17 GMT",G Foods Inc. (DHR) stock a defensive play amid uncertainty - Weekly Trend Recap & High Conviction Buy Zone Picks - Newser,Newser
"Tue, 02 Dec 2025 16:06:42 GMT","Morgan Stanley Maintains Danaher(DHR.US) With Buy Rating, Maintains Target Price $270 - 富途牛牛",富途牛牛
"Sun, 30 Nov 2025 13:46:33 GMT",Tsai Capital Corp Makes New $1.89 Million Investment in Danaher Corporation $DHR - MarketBeat,MarketBeat
"Sun, 30 Nov 2025 12:26:20 GMT",Mackenzie Financial Corp Increases Holdings in Danaher Corporation $DHR - MarketBeat,MarketBeat
"Sun, 30 Nov 2025 12:14:16 GMT",Loomis Sayles & Co. L P Grows Holdings in Danaher Corporation $DHR - MarketBeat,MarketBeat
"Sun, 30 Nov 2025 12:02:43 GMT",Quadrature Capital Ltd Cuts Stake in Danaher Corporation $DHR - MarketBeat,MarketBeat
"Sun, 30 Nov 2025 12:36:26 GMT",Danaher Corporation $DHR Stock Holdings Lessened by New York State Common Retirement Fund - MarketBeat,MarketBeat
"Sun, 30 Nov 2025 12:20:23 GMT","Skandinaviska Enskilda Banken AB publ Sells 164,979 Shares of Danaher Corporation $DHR - MarketBeat",MarketBeat
"Sun, 30 Nov 2025 08:30:38 GMT","BLI Banque de Luxembourg Investments Sells 37,390 Shares of Danaher Corporation $DHR - MarketBeat",MarketBeat
"Mon, 01 Dec 2025 19:45:34 GMT","Danaher (DHR) Stock on December 1, 2025: Q3 Beat, Legal Probes and Fresh Price Targets – Is the Premium Still Worth Paying? - ts2.tech",ts2.tech
"Sat, 29 Nov 2025 14:00:37 GMT",Danaher Corporation $DHR Shares Purchased by Portland Investment Counsel Inc. - MarketBeat,MarketBeat
"Sat, 29 Nov 2025 12:51:36 GMT",Danaher Corporation $DHR Shares Purchased by Scotia Capital Inc. - MarketBeat,MarketBeat
"Sat, 29 Nov 2025 13:32:59 GMT","10,020,770 Shares in Danaher Corporation $DHR Acquired by Norges Bank - MarketBeat",MarketBeat
"Sat, 29 Nov 2025 11:18:26 GMT",Danaher Corporation $DHR Stock Position Reduced by Steward Partners Investment Advisory LLC - MarketBeat,MarketBeat
"Sat, 29 Nov 2025 12:31:19 GMT","Groupama Asset Managment Acquires 9,311 Shares of Danaher Corporation $DHR - MarketBeat",MarketBeat
"Sat, 29 Nov 2025 11:50:48 GMT",Vinva Investment Management Ltd Increases Stake in Danaher Corporation $DHR - MarketBeat,MarketBeat
"Sat, 29 Nov 2025 08:27:18 GMT",Choreo LLC Has $3.69 Million Stock Position in Danaher Corporation $DHR - MarketBeat,MarketBeat
"Sat, 29 Nov 2025 08:45:47 GMT",Danaher Corporation $DHR Shares Bought by Bank of Nova Scotia Trust Co. - MarketBeat,MarketBeat
"Sat, 29 Nov 2025 08:42:58 GMT","Clarkston Capital Partners LLC Acquires 77,599 Shares of Danaher Corporation $DHR - MarketBeat",MarketBeat
"Tue, 02 Dec 2025 02:24:56 GMT","DHR festival awards hill heroes contributing to tourism, social service and sustainability - Telegraph India",Telegraph India
"Wed, 03 Dec 2025 09:32:16 GMT",Edgestream Partners L.P. Grows Position in Danaher Corporation $DHR - Defense World,Defense World
"Wed, 03 Dec 2025 15:22:32 GMT",Winston DHR benefit yard sale Saturday - Spot On Alabama,Spot On Alabama
"Mon, 01 Dec 2025 00:54:13 GMT","Danaher (DHR) Stock: Price, News and Analyst Forecast Before the December 1, 2025 Market Open - ts2.tech",ts2.tech
"Tue, 02 Dec 2025 08:23:30 GMT",Arrowstreet Capital Limited Partnership Increases Holdings in Danaher Corporation $DHR - Defense World,Defense World
"Tue, 02 Dec 2025 06:42:49 GMT",Danaher (NYSE:DHR) Price Target Raised to $270.00 at HSBC - Defense World,Defense World
"Tue, 02 Dec 2025 10:13:56 GMT",Danaher Corporation $DHR Shares Bought by Capital Counsel LLC NY - Defense World,Defense World
"Sun, 30 Nov 2025 10:52:39 GMT",Channing Global Advisors LLC Sells 600 Shares of Danaher Corporation $DHR - Defense World,Defense World
"Mon, 01 Dec 2025 09:37:40 GMT",Boston Family Office LLC Has $7.95 Million Stock Position in Danaher Corporation $DHR - Defense World,Defense World
2025-12-03T01:04:07,Morgan Stanley Initiates Coverage of Danaher (DHR) with Overweight Recommendation,Fintel
2025-12-01T13:00:24,Danaher Corporation (NYSE:DHR) Is Going Strong But Fundamentals Appear To Be Mixed : Is There A Clear Direction For The Stock?,Yahoo
