Date,Title,Source
"Mon, 08 Dec 2025 14:30:05 GMT",Home Depot (HD) Is Considered a Good Investment by Brokers: Is That True? - Yahoo Finance,Yahoo Finance
"Tue, 09 Dec 2025 17:01:25 GMT","Home Depot Stock (NYSE:HD) Gains Despite Ad Decline, Disappointing Forecast - TipRanks",TipRanks
2025-12-10T17:53:50,"Home Depot Offers 'Significant' Growth Prospects, UBS Says",Yahoo
2025-12-10T15:01:53,"The Home Depot, Inc. (HD) Shareholder/Analyst Call - Slideshow",SeekingAlpha
2025-12-09T22:10:00,"Home Depot cuts guidance at investor day, cites housing headwinds",Yahoo
2025-12-09T17:39:37,"Wall Street Has a Mixed Opinion on The Home Depot (HD), Since Q3 2026 Earnings",Yahoo
2025-12-09T15:28:06,"CVS lifts outlook, Home Depot remains cautious, AutoZone earnings",Yahoo
2025-12-10T17:01:49+00:00,"""We anticipate these pressures will persist"": Home Depot stock (NYSE:HD) gains despite housing market troubles",TipRanks
