Date,Title,Source
2025-11-22T14:06:10Z,Miraculous Les Aventures De Ladybug Et Chat Noir S06E14 1080p TF1 WEB-DL H264-LADYBUG,Rlsbb.to
2025-11-22T14:05:49Z,Zelensky is sending a very important signal about Trump’s peace plan,RT
2025-11-22T14:05:47Z,Miraculous Les Aventures De Ladybug Et Chat Noir S06E13 1080p TF1 WEB-DL H264-LADYBUG,Rlsbb.to
2025-11-22T14:01:32Z,Irish fashion designer Paul Costelloe dies aged 80,TheJournal.ie
2025-11-22T14:00:27Z,Many more are ready to leave MAGA — and I know how hard that is,Salon
2025-11-22T14:00:07Z,Boris Becker becomes new dad with wife Lilian de Carvalho Monteiro,The-independent.com
2025-11-22T14:00:00Z,Mrs Brown,Steynonline.com
2025-11-22T13:52:22Z,Bolsonaro detained by police days before start of 27-year prison sentence,CBC News
2025-11-22T13:50:30Z,Brazil's Bolsonaro arrested for allegedly plotting escape ahead of prison term,NPR
2025-11-22T13:35:00Z,"Serie A Preview: Napoli vs Atalanta – Team News, Line-ups & Prediction",Cultofcalcio.com
2025-11-22T13:30:00Z,"Fleur-de-Links, November 22: Could the Saints make a trade for Eagles RB in the offseason?",Canal Street Chronicles
2025-11-22T13:27:07Z,"[Catholic Caucus Devotional] My Catholic Life! Catholic Daily Reflections: Preparing for Eternity - Saturday, November 22, 2025",Freerepublic.com
2025-11-22T13:26:34Z,Brazil's ex-president Bolsonaro detained by police ahead of vigil,CNBC
2025-11-22T13:26:00Z,Ex-Brazil president 'tried to open ankle monitor' with soldering iron in 'escape attempt',Sky.com
2025-11-22T13:21:00Z,Breaking news: Two returns confirmed at Barça,Onefootball.com
2025-11-22T13:16:04Z,"In the NWSL, big momentum runs into big challenges",Yahoo Entertainment
2025-11-22T13:15:16Z,1990 Lancia Delta HF Integrale 16V Futurista by Automobili Amos,Bringatrailer.com
2025-11-22T13:15:00Z,"Speakers and Soundbars From Bose, JBL, Sony, and More Are Discounted Up to 50% Off With These Early Black Friday Deals",PCMag.com
2025-11-22T13:09:10Z,Kathmandu Gorhaks Suffer Second NPL Loss,Nep123.com
2025-11-22T13:06:35Z,Odds of December rate cut back above 70%: Are Bitcoin traders convinced this changes things?,CryptoSlate
2025-11-22T13:02:20Z,"Ukraine, US to start talks in Switzerland on Trump’s plan to end war",Digital Journal
2025-11-22T13:00:00Z,"Early Black Friday Deals: Up to 50% Off Headphones and Earbuds From Apple, Beats, JBL, and More",PCMag.com
2025-11-22T12:57:04Z,Dexter Soy's Last Issue On Nightwing Will Be In February 2026,Bleeding Cool News
2025-11-22T12:50:00Z,"Serie A Preview: Fiorentina vs Juventus – Team News, Line-ups & Prediction",Cultofcalcio.com
2025-11-22T12:45:48Z,Saturday: Hili dialogue,Whyevolutionistrue.com
2025-11-22T12:45:00Z,Revealed: Why Inter Milan Gave Up On Adrien Rabiot Pursuit To Rivals AC Milan In The Summer,SempreInter
2025-11-22T12:44:19Z,"Iberia 10% To 60% Award Sale For Travel Through March 25, 2026 (Book By December 2)",Loyaltylobby.com
2025-11-22T12:33:26Z,IS SEO DEAD OR ALIVE ?,Knowyourmeme.com
2025-11-22T12:30:42Z,eBay Barn Find: A Rare Fiat 125 Samantha,Silodrome.com
2025-11-22T12:30:32Z,"Fetus & Les Testarudes – “La gran xefla” / “Terra de secà” / “Au, jovent!” single cover",Fontsinuse.com
2025-11-22T12:30:00Z,"Iran’s Capital Must Relocate Due to Dire Water Situation, President Insists",Mother Jones
2025-11-22T12:30:00Z,Bolsonaro's House Arrest Just Lost the 'House' Part,Newser
2025-11-22T12:28:29Z,연합뉴스 미쳤을까,Tistory.com
2025-11-22T12:27:04Z,Bad Idea Full February 2026 Solicits Has Colin Farrell On Ordained #0,Bleeding Cool News
2025-11-22T12:21:13Z,2025 Vanderbilt Football Mailbag #11: Answers to Your Questions,Anchor Of Gold
2025-11-22T12:19:00Z,McTominay’s goal for Scotland ‘breathtakingly beautiful’ says ex-Napoli coach,Football Italia
2025-11-22T12:15:25Z,"Que horas estreia o 5º episódio de 'Robin Hood', série medieval sobre a clássica lenda inglesa?",Rollingstone.com.br
2025-11-22T12:15:17Z,"Premier League surprises: Liverpool's defending, Sunderland's success, Nottingham Forests's collapse and more",CBS Sports
2025-11-22T12:14:41Z,FO° Talks: Regenerative Design and How To Keep Your Garden Slug-Free,Fair Observer
2025-11-22T12:05:00Z,Inter Milan Coach Faces Defensive Dilemma Ahead Of AC Milan Derby Showdown,SempreInter
2025-11-22T12:04:48Z,Arsenal v Tottenham. Tottenham’s problem with managers and ex-players,Untold-arsenal.com
2025-11-22T12:00:00Z,Your Christmas tree may be pricier this year—but there are ways to get a deal,Fortune
2025-11-22T12:00:00Z,Deux Personnes échangeant de la Salive (Two People Exchanging Saliva),Shortoftheweek.com
2025-11-22T11:50:00Z,Hannah Hidalgo’s clutch game-winner delivered No. 24 Notre Dame a comeback victory over No. 11 USC,Swish Appeal
2025-11-22T11:50:00Z,AI vs. AI: Patients deploy bots to battle health insurers that deny care,STLtoday.com
2025-11-22T11:49:55Z,"Arsenal vs Tottenham: Premier League – team news, start, lineups",Al Jazeera English
2025-11-22T11:48:07Z,Brazil's Supreme Court orders Bolsonaro's arrest ahead of prison sentence,ABC News
2025-11-22T11:47:57Z,"Even as it keeps asking for more seats, Emirates has gone premium in India",Livemint
2025-11-22T11:46:25Z,"Tom Lee Says Bitcoin, Ethereum Crash Wasn't Macro But A 'Software Bug'",Yahoo Entertainment
2025-11-22T11:29:38Z,"Browns, Raiders final injury report: Maxx Crosby, Myles Garrett, David Njoku updates",Dawgs By Nature
2025-11-22T11:25:14Z,Brazil's Bolsonaro arrested days before starting 27-year prison sentence,CBS News
2025-11-22T11:19:00Z,He was shot during Brazil's deadliest police raid. Now his wife is fighting to clear his name,The Star Online
2025-11-22T11:17:11Z,"Tallinn Black Nights: 6 Takeaways From Hollywood Glamour to New Studios in Estonia, Fest Deals, Catalonia and a Producer’s Guide to Surviving Headwinds",Variety
2025-11-22T11:08:50Z,Türkiye’deki Bahis Siteleri,Line25.com
2025-11-22T11:07:01Z,"West De Pere's Greisen, Notre Dame's Allen finish off historic seasons",Green Bay Press Gazette
2025-11-22T11:00:00Z,Benavidez vs. Yarde Results: Live updates of the undercard and main event,MMA Fighting
2025-11-22T11:00:00Z,Christine Lagarde: Fiscal policy and growth in Europe,Europa.eu
2025-11-22T10:46:48Z,Penn and Teller Fool Us S11E19 1080p WEB h264-EDITH,Rlsbb.to
2025-11-22T10:39:54Z,Colours Of Time 2025 1080p WEB-DL H264-AOC,Rlsbb.to
2025-11-22T10:39:49Z,Rian Johnson ‘frustrated’ Knives Out 3 won’t be screening in biggest movie chain as he calls on fans for support,The-independent.com
2025-11-22T10:35:53Z,France pile more misery on winless Australia,RTE
"Sat, 22 Nov 2025 20:41:00 GMT",El Tour de Tucson wraps up with thousands of cyclists - KVOA,KVOA
"Sat, 22 Nov 2025 21:26:08 GMT","More than a ride: Cyclists brave wind, turmoil in 42nd El Tour de Tucson - Arizona Daily Star",Arizona Daily Star
"Sat, 22 Nov 2025 20:58:17 GMT","Javelina, cyclist collide during El Tour de Tucson, PCSD says - KGUN 9",KGUN 9
"Sat, 22 Nov 2025 23:25:00 GMT",DeWitt punches ticket to Ford Field behind 5 TD QB performance over Warren De La Salle - MLive.com,MLive.com
"Sun, 23 Nov 2025 04:07:30 GMT",Photos: DeWitt vs Warren De La Salle MHSAA semifinal football - Lansing State Journal,Lansing State Journal
"Sat, 22 Nov 2025 17:21:59 GMT","Les Arts Florissants, violinist de Swarte deconstruct Vivaldi’s “Four Seasons” at Library of Congress - Washington Classical Review",Washington Classical Review
"Sat, 22 Nov 2025 17:30:00 GMT",‘Stranger Things’ Stars Noah Schnapp & Millie Bobby Brown On De-Aging - Deadline,Deadline
"Sat, 22 Nov 2025 23:38:00 GMT",Utah DE Daley exits vs. Kansas St. with leg injury - ESPN,ESPN
"Sat, 22 Nov 2025 22:00:53 GMT",Mural de Cesária - Atlas Obscura,Atlas Obscura
"Sat, 22 Nov 2025 02:25:25 GMT",West De Pere beats Green Bay Notre Dame in WIAA D2 title game showdown - Green Bay Press-Gazette,Green Bay Press-Gazette
"Sun, 23 Nov 2025 02:59:44 GMT",De Zavala Elementary partners with local energy companies - Yourbasin,Yourbasin
"Thu, 20 Nov 2025 16:47:45 GMT",Homeland Security Task Force Operation Results in the Arrest of More than 150 Illegal Aliens at Tren de Aragua Nightclub in San Antonio - Homeland Security (.gov),Homeland Security (.gov)
"Sat, 22 Nov 2025 23:23:48 GMT",‘I Think Remco Would Win the Tour in the Right Conditions’: Sean Kelly Sees a Route to Glory for Evenepoel - Outside Magazine,Outside Magazine
"Sat, 22 Nov 2025 23:22:22 GMT",Brazil’s ex-president Bolsonaro arrested over alleged plot to avoid 27-year prison term - Politico,Politico
"Sat, 22 Nov 2025 19:46:22 GMT","Photos: 42nd annual El Tour de Tucson, 2025 - Arizona Daily Star",Arizona Daily Star
"Sat, 22 Nov 2025 21:20:39 GMT",Four downs from DeWitt football's state semi win over Warren DeLaSalle - Lansing State Journal,Lansing State Journal
"Sun, 23 Nov 2025 04:02:00 GMT",'The Winner's Circle;' El Tour De Tucson Award Ceremony - KGUN 9,KGUN 9
"Sat, 22 Nov 2025 23:47:00 GMT","A 'Tour' de force: Tucsonans take home first in premier men's, women's El Tour de Tucson races - KGUN 9",KGUN 9
"Fri, 21 Nov 2025 01:29:41 GMT","Brazilian steakhouse chain Fogo de Chão to open in Murray, its first Utah location - KSL.com",KSL.com
"Sun, 23 Nov 2025 03:43:35 GMT","David Benavidez pummels Anthony Yarde in seventh-round TKO, confirms opponent for Cinco de Mayo weekend - DAZN",DAZN
"Sat, 22 Nov 2025 07:17:28 GMT",De La Salle holds off Pittsburg again to claim 33rd consecutive NCS title - The Mercury News,The Mercury News
"Sat, 22 Nov 2025 18:55:30 GMT","The Family YMCA’s Día De Los Muertos Race Brings Community Together, Raises Over $12,000 For Local Youth - Los Alamos Daily Post",Los Alamos Daily Post
"Sat, 22 Nov 2025 16:04:53 GMT","Some Paris CDG Flights Delayed Due to Fog, Air France Says - Bloomberg.com",Bloomberg.com
"Sat, 22 Nov 2025 17:57:28 GMT",St. Louis whistleblower advocates for 'Ninos de Mexico' abuse survivors - KSDK,KSDK
"Wed, 19 Nov 2025 16:51:06 GMT",Semantic design of functional de novo genes from a genomic language model - Nature,Nature
"Sat, 22 Nov 2025 18:40:23 GMT","Casa de Peregrinos to give out 6,500 Thanksgiving boxes in annual ‘Hope for the Holidays’ event - KTSM 9 News",KTSM 9 News
"Sat, 22 Nov 2025 22:23:35 GMT","Shirley Pike avis de décès - Shepherdsville, KY - Dignity Memorial",Dignity Memorial
"Fri, 21 Nov 2025 12:05:46 GMT",De La Soul – Cabin In The Sky | Review - Hip Hop Golden Age,Hip Hop Golden Age
"Fri, 21 Nov 2025 01:02:45 GMT",De Pere priest embraces dual loyalties ahead of WIAA state football championship game - WLUK,WLUK
"Fri, 21 Nov 2025 20:10:30 GMT",The stuck gear: How mid-level de-professionalization hinders school reform in the Kyrgyz Republic - Brookings,Brookings
"Fri, 21 Nov 2025 21:24:00 GMT",Exclusive | Larry Summers forced out of consulting gig at 'woke' hedge fund DE Shaw after Jeffrey Epstein scandal - New York Post,New York Post
"Fri, 21 Nov 2025 16:28:44 GMT",Hegseth Says Designating Venezuelan Cartel as Terrorist Org Will Bring 'New Options' to Administration - U.S. Department of War (.gov),U.S. Department of War (.gov)
"Fri, 21 Nov 2025 02:01:13 GMT",Thousands of cyclists to roll out for this weekend's El Tour de Tucson - Arizona Daily Star,Arizona Daily Star
"Sat, 22 Nov 2025 22:57:00 GMT","Freshman DE, backup safety remain out for Penn State's bout with Nebraska - The Daily Collegian",The Daily Collegian
"Fri, 21 Nov 2025 00:39:00 GMT",Road closures and delays for 42nd Annual El Tour de Tucson - KVOA,KVOA
"Fri, 21 Nov 2025 21:54:29 GMT",Giada De Laurentiis Reveals Unexpected 1st Thanksgiving Dish in the U.S. - People.com,People.com
"Fri, 21 Nov 2025 08:30:00 GMT",De La Soul: Cabin in the Sky review – a full-colour celebration of Trugoy the Dove that never feels heavy - The Guardian,The Guardian
"Fri, 21 Nov 2025 17:41:17 GMT",Obituary: Elizabeth ‘Liz’ (De la Cruz) Romero - The Lawrence Times,The Lawrence Times
"Sun, 23 Nov 2025 02:24:20 GMT",Rice University turns to free beer to get students to this season's final home football game - ABC13 Houston,ABC13 Houston
"Fri, 21 Nov 2025 06:30:47 GMT",Las Noches de las Luminarias Through the Years - Desert Botanical Garden,Desert Botanical Garden
"Sat, 22 Nov 2025 22:56:47 GMT",Club Atlético de Madrid - Chasing a fifth consecutive win in Getafe - Club Atlético de Madrid,Club Atlético de Madrid
"Wed, 19 Nov 2025 22:30:00 GMT",De’Anthony Melton Injury Update – 11/19/25 - NBA,NBA
"Sat, 22 Nov 2025 05:23:27 GMT","Live update summary: De La Salle wins 33rd straight North Coast Section title (Nov. 21, 2025) - Sports Illustrated",Sports Illustrated
"Sun, 23 Nov 2025 07:00:47 GMT",Parents raise awareness for rare Cri De Chat syndrome - BBC,BBC
"Thu, 20 Nov 2025 16:24:00 GMT","Browns, DE Wright reach 3-year, $33M extension - ESPN",ESPN
"Sat, 22 Nov 2025 21:51:59 GMT",Kansas State football DE Ryan Davis ejected at Utah for targeting - The Topeka Capital-Journal,The Topeka Capital-Journal
"Sat, 22 Nov 2025 15:01:35 GMT",Review: Ballet BC’s collaborative tour de force - L.A. Dance Chronicle,L.A. Dance Chronicle
"Sun, 23 Nov 2025 07:13:48 GMT",David Benavidez looks to push Canelo Alvarez off Cinco de Mayo after KO of Anthony Yarde in Riyadh - thenationalnews.com,thenationalnews.com
"Sat, 22 Nov 2025 05:30:00 GMT",Repair coming to eroded area of Arroyo de los Chamisos Urban Trail - Santa Fe New Mexican,Santa Fe New Mexican
"Sat, 22 Nov 2025 16:19:57 GMT","De La Dance Company gears up for the Nutcracker, Jazzed Up! - FOX19 | Cincinnati",FOX19 | Cincinnati
"Thu, 20 Nov 2025 19:58:50 GMT",De La Soul Discuss New Album 'Cabin in the Sky' - Rolling Stone Australia,Rolling Stone Australia
"Wed, 19 Nov 2025 23:05:16 GMT",West De Pere football coach Chris Greisen says sideline altercation 'won't be a distraction' in title game - Green Bay Press-Gazette,Green Bay Press-Gazette
"Sat, 22 Nov 2025 12:15:44 GMT","Día De Los Muertos Race Brings Community Together, Raises Over $12,000 for Local Youth - Los Alamos Reporter",Los Alamos Reporter
"Sun, 23 Nov 2025 02:54:36 GMT","Billy Huskey avis de décès - Greenville, SC - Dignity Memorial",Dignity Memorial
"Sat, 22 Nov 2025 18:59:06 GMT","Maria Rubalcava de Ruesga Died in Santa Ana Trash Truck Collision Near Pio Pico Elementary School - Carrillo Law Firm, LLP","Carrillo Law Firm, LLP"
"Fri, 21 Nov 2025 21:25:16 GMT",De La Soul: 'Cabin In The Sky' review — hip-hop legends pay respect - Iowa Public Radio,Iowa Public Radio
"Sat, 22 Nov 2025 03:59:24 GMT","Review: ""Need Somebody"" - Chris de Sarandy - Pop Passion Blog",Pop Passion Blog
"Sun, 23 Nov 2025 02:34:03 GMT","Suspect targeted in nightclub raid identified, accused of selling cocaine to FBI informant - WOAI",WOAI
"Fri, 21 Nov 2025 06:30:47 GMT",Step into the Desert Dreamscape at Las Noches de las Luminarias - Desert Botanical Garden,Desert Botanical Garden
"Thu, 20 Nov 2025 21:20:33 GMT",Alexander De Croo of Belgium confirmed as Administrator of UNDP - Welcome to the United Nations,Welcome to the United Nations
"Wed, 19 Nov 2025 20:15:34 GMT",De Pere welcomes first downtown brewery - WLUK,WLUK
"Fri, 21 Nov 2025 16:34:34 GMT","Mandy Sells 9, Buys 2, De-Signs 3 Homes - New Haven Independent",New Haven Independent
"Sun, 23 Nov 2025 05:02:00 GMT","MÁS QUE UN JUEGO: Los fans reaccionan a el campeonato de FC Tulsa, esperan que más gente venga - Yahoo News Canada",Yahoo News Canada
"Sun, 23 Nov 2025 02:25:20 GMT",Thermal Comfort in Emergency Architectures - springerprofessional.de,springerprofessional.de
"Thu, 20 Nov 2025 02:14:32 GMT",DHS identifies 5 of 27 suspected Tren de Aragua members arrested in North Side immigration raid - KSAT,KSAT
"Fri, 21 Nov 2025 16:53:34 GMT",Tour de France 2026 - Cyclingnews,Cyclingnews
"Sat, 22 Nov 2025 13:05:08 GMT",Game Day notebook: Bison 7th-year DE Jack Iuliano appreciating FCS playoff hunt - InForum,InForum
"Sat, 22 Nov 2025 17:30:00 GMT",Walmart Has an 'Elegant' Oscar de la Renta Fragrance on Sale for $40 Ahead of Black Friday - parade.com,parade.com
"Fri, 21 Nov 2025 11:08:02 GMT","Reporter James De La Fuente to leave WTEN, felt underpaid - Times Union",Times Union
"Wed, 19 Nov 2025 23:44:24 GMT",Reds Star Elly De La Cruz Played Through Significant Injury Last Season - Sports Illustrated,Sports Illustrated
"Wed, 19 Nov 2025 11:15:41 GMT","Green Bay Notre Dame, West De Pere football set to make WIAA state title game history - Green Bay Press-Gazette",Green Bay Press-Gazette
"Sat, 22 Nov 2025 21:57:00 GMT",Cavaliers' De'Andre Hunter: Scores 20 points in win - CBS Sports,CBS Sports
"Wed, 19 Nov 2025 21:00:48 GMT",Expect fireworks when Notre Dame and West De Pere meet for a gold ball - WLUK,WLUK
"Sat, 22 Nov 2025 23:32:54 GMT","Man arrested, charged with bomb hoax at Fort Worth Dia De Los Muertos festival - Fort Worth Star-Telegram",Fort Worth Star-Telegram
"Sat, 22 Nov 2025 12:20:08 GMT",Willadean Mae De Franco Obituary - - The Ukiah Daily Journal,The Ukiah Daily Journal
"Fri, 21 Nov 2025 17:45:54 GMT",De Soto expresses interest in being site for new nuclear power plant - Johnson County Post,Johnson County Post
"Sat, 22 Nov 2025 00:54:00 GMT","Replay: Grafton, West De Pere, Arrowhead win state titles in thrilling day of state football - Milwaukee Journal Sentinel",Milwaukee Journal Sentinel
"Sat, 22 Nov 2025 18:30:00 GMT",The Robert De Niro Crime Thriller Flop You Need To Stream On Prime Video - SlashFilm,SlashFilm
"Wed, 19 Nov 2025 08:07:08 GMT",EXCLUSIVE: Inside the Tren de Aragua club targeted in task force raid - WOAI,WOAI
"Sat, 22 Nov 2025 00:32:16 GMT",Casa de Flores to hold holiday bash to benefit senior residents - KSBY News,KSBY News
"Thu, 20 Nov 2025 08:00:00 GMT","Michael Lynn Van De Perre Obituary November 20, 2025 - Smith Family Funeral Homes",Smith Family Funeral Homes
"Tue, 18 Nov 2025 21:14:38 GMT","Kering must downsize, reduce Gucci exposure and chase synergies, CEO de Meo says in memo - Reuters",Reuters
"Sat, 22 Nov 2025 22:28:17 GMT","Robert Lott avis de décès - Tuscaloosa, AL - Dignity Memorial",Dignity Memorial
"Fri, 21 Nov 2025 05:05:00 GMT",The best new albums out Nov. 21 : All Songs Considered - NPR,NPR
"Fri, 21 Nov 2025 18:50:36 GMT",International Student Week: Q&A with Field Hockey Standout Florance de Kroon - Lock Haven Athletics,Lock Haven Athletics
"Fri, 21 Nov 2025 13:48:00 GMT",Checking in on Tucson's youngest cyclists ahead of El Tour de Tucson - KGUN 9,KGUN 9
"Thu, 20 Nov 2025 00:34:15 GMT",Paws to De-Stress this Tuesday-Wednesday brings therapy dogs to calm campus nerves - OSU Today,OSU Today
"Sat, 22 Nov 2025 20:21:45 GMT","Ronald Cory avis de décès - Lagrange, KY - Dignity Memorial",Dignity Memorial
"Sat, 22 Nov 2025 13:00:47 GMT","Column: De Ridder, the bull; Mallory, the jet, save Virginia’s bacon - Jerry Ratcliffe",Jerry Ratcliffe
"Sat, 22 Nov 2025 10:30:00 GMT",De’Andre Hunter is transforming the Cavs’ offense while everyone’s watching the stars - Cleveland.com,Cleveland.com
"Thu, 20 Nov 2025 17:03:45 GMT",Notas de la actualización - Borderlands | Official Website,Borderlands | Official Website
"Fri, 21 Nov 2025 19:47:30 GMT",Festival International de Louisiane turns to GoFundMe to keep going amid rising costs - KATC,KATC
"Wed, 19 Nov 2025 17:24:13 GMT","Kering must kick Gucci habit, chief Luca de Meo tells staff - Financial Times",Financial Times
"Wed, 19 Nov 2025 10:00:00 GMT",Quantum physicists have shrunk and “de-censored” DeepSeek R1 - MIT Technology Review,MIT Technology Review
"Sat, 22 Nov 2025 15:52:47 GMT",Legacy of Tecos leader honored as family receives Laredo's Key to the City - Laredo Morning Times,Laredo Morning Times
2025-11-22T01:00:00,"Dell earnings, Sept. retail sales, jobless claims: What to Watch",Yahoo
2025-11-21T23:45:02,Deere (DE) Outperforms Broader Market: What You Need to Know,Yahoo
2025-11-21T22:23:38,"Earnings live: S&P 500 on track for highest revenue growth in 3 years, with reports from Deere, Zoom ahead",Yahoo
2025-11-21T20:44:30,"Deere Earnings, Inflation Data, Black Friday: What to Watch in the Next Week",Yahoo
2025-11-21T19:37:36,"Cramer's week ahead: Earnings from Burlington, Best Buy, Kohl's and Dell",CNBC
2025-11-21T18:27:00,Caterpillar vs. Deere: Which Equipment Stock is the Better Buy Now?,Yahoo
2025-11-21T18:21:00,Deere Ready to Report Q4 Earnings: Here's What to Expect for the Stock,Yahoo
2025-11-21T14:45:00,"Wall Street Roundup: Nvidia Dips, Bitcoin Cracks, Retail Winners Emerge",SeekingAlpha
2025-11-20T12:00:08,Deere & Company (NYSE:DE) is largely controlled by institutional shareholders who own 74% of the company,Yahoo
2025-11-20T04:10:00,"Global Farm Machinery Makers Face Another Tough Year, But A Turn May Be Coming",SeekingAlpha
2025-11-19T16:00:01,Earnings Preview: Deere (DE) Q4 Earnings Expected to Decline,Yahoo
2025-11-18T15:00:05,Deere & Company (DE) Is a Trending Stock: Facts to Know Before Betting on It,Yahoo
