Date,Title,Source
2025-09-11T17:08:24Z,Redburn Atlantic Initiates Coverage on Infosys (INFY) With a Sell Rating,Biztoc.com
2025-09-11T16:49:18Z,Redburn Atlantic Initiates Coverage on Infosys (INFY) With a Sell Rating,Yahoo Entertainment
2025-09-09T13:51:19Z,Tax threat to Indian IT; Infy weighs buyback,The Times of India
2025-09-09T08:04:57Z,"Amundi Sells 379,266 Shares of American Noble Gas Inc. $INFY",ETF Daily News
"Thu, 11 Sep 2025 16:49:18 GMT",Redburn Atlantic Initiates Coverage on Infosys (INFY) With a Sell Rating - ca.finance.yahoo.com,ca.finance.yahoo.com
"Sat, 13 Sep 2025 11:36:30 GMT",American Noble Gas Inc. $INFY Position Reduced by Rhumbline Advisers - MarketBeat,MarketBeat
"Fri, 12 Sep 2025 20:24:41 GMT",Investors Purchase Large Volume of American Noble Gas Call Options (NYSE:INFY) - MarketBeat,MarketBeat
"Fri, 12 Sep 2025 20:24:41 GMT",American Noble Gas Inc. $INFY Shares Sold by Amundi - MarketBeat,MarketBeat
"Fri, 12 Sep 2025 13:23:03 GMT",Acadian Asset Management LLC Boosts Position in American Noble Gas Inc. $INFY - MarketBeat,MarketBeat
"Thu, 11 Sep 2025 16:36:10 GMT",Infosys (INFY) Announces Significant Share Buyback Plan - GuruFocus,GuruFocus
"Wed, 10 Sep 2025 14:47:00 GMT","Noteworthy ETF Inflows: VEU, INFY, ITUB, KB - Nasdaq",Nasdaq
"Wed, 10 Sep 2025 10:38:00 GMT",Infosys Limited (INFY): New Buy Recommendation for This Technology Giant - The Globe and Mail,The Globe and Mail
"Wed, 10 Sep 2025 07:00:00 GMT",American Noble Gas Inc. $INFY Shares Bought by Millennium Management LLC - MarketBeat,MarketBeat
"Fri, 12 Sep 2025 06:01:19 GMT",Why are Infosys shares trending? INFY stock performance today: 2.3% up after share buyback announcement - theweek.in,theweek.in
2025-09-11T18:49:18,Redburn Atlantic Initiates Coverage on Infosys (INFY) With a Sell Rating,Yahoo
2025-09-11T16:21:00,Infosys and HanesBrands Inc. Collaborate to Unlock Hyper Productivity and AI-Driven Efficiency,Yahoo
