Date,Title,Source
2025-10-15T15:46:59Z,Dow Jones Tech Titan Apple Eyes Latest Buy Point Amid Stock Market Volatility,Biztoc.com
2025-10-15T09:19:45Z,"‘We don’t work hard, we work smart’: GenZs debunk workplace stereotypes, on Insta reels and real life",The Indian Express
"Thu, 16 Oct 2025 14:50:59 GMT","ZS 1 Pair Stainless Steel Ear Plug Tunnel, Tunnel Gauge for Ear 6/8/10/12/14MM, Mix Colors Ears Expander Body Piercing Jewelry for Women Men - The San Joaquin Valley Sun",The San Joaquin Valley Sun
"Fri, 17 Oct 2025 03:31:00 GMT",Q2 Rundown: Zscaler (NASDAQ:ZS) Vs Other Cybersecurity Stocks - Yahoo Finance,Yahoo Finance
"Fri, 17 Oct 2025 05:33:01 GMT",Gen Zs connect more with ChatGPT than colleagues - HRD America,HRD America
"Thu, 16 Oct 2025 13:01:00 GMT",eClinical Solutions and ZS Announce Strategic Partnership to Deliver a New Industry Standard for RBQM - Business Wire,Business Wire
"Fri, 17 Oct 2025 02:46:31 GMT",Nepal’s Gen-Zs And Dynamics Of Youth Uprising - The Rising Nepal,The Rising Nepal
"Mon, 13 Oct 2025 21:45:04 GMT",Zscaler (ZS) Advances But Underperforms Market: Key Facts - Yahoo Finance,Yahoo Finance
"Thu, 16 Oct 2025 01:38:00 GMT",Generation Zs embrace 'experience economy' - China Daily,China Daily
"Tue, 14 Oct 2025 20:42:45 GMT",Zscaler (ZS): Assessing Valuation After Recent Share Price Gains - simplywall.st,simplywall.st
"Tue, 14 Oct 2025 07:35:52 GMT",Jerry Zezima (opinion): Zez loses some Zs - New Haven Register,New Haven Register
"Tue, 14 Oct 2025 05:23:15 GMT","Gen Zs losing entry-level jobs to AI, report finds - HRD America",HRD America
"Wed, 15 Oct 2025 09:56:02 GMT",My interesting incident with my MG ZS EV that might help other owners - Team-BHP,Team-BHP
"Thu, 16 Oct 2025 21:49:16 GMT",Survey shows more Gen Zs are falling into phishing scam traps - IOL,IOL
"Mon, 13 Oct 2025 00:05:44 GMT","Gen Zs are seen as apparent heirs to the thrones at the MVP Group of Companies, with the big boss himself – business titan Manuel V. Pangilinan – acknowledging that they are the ones who are next in line. https://tinyurl.com/5f4d6adj | via ONE News - facebook.com",facebook.com
"Mon, 13 Oct 2025 16:02:41 GMT",Coca-Cola woos Gen Zs with ‘Share-a-Coke’ campaign - Businessday NG,Businessday NG
"Tue, 14 Oct 2025 14:09:06 GMT",Coca-Cola targets Gen Zs with Share-a-Coke campaign - Businessday NG,Businessday NG
"Mon, 13 Oct 2025 06:43:25 GMT","30,000 km in 2 years with my ZS EV: An unfiltered review - Team-BHP",Team-BHP
"Wed, 15 Oct 2025 05:25:31 GMT","Popular SUV’s upmarket makeover: Jaecoo J5 2026 is Chery Tiggo 4’s cousin with hybrid, petrol and electric power to rival GWM Haval Jolion, MG ZS, BYD Atto 2 and more - chasingcars.com.au",chasingcars.com.au
"Sun, 12 Oct 2025 16:00:00 GMT",Notes on the beat: Gen Zs emerging as heirs to MVP Group - Philstar.com,Philstar.com
"Thu, 16 Oct 2025 06:16:00 GMT",Generation Zs embrace 'experience economy' - The Star | Malaysia,The Star | Malaysia
"Sun, 12 Oct 2025 22:21:25 GMT",NOTES ON THE BEAT | Gen Zs Emerging As Heirs To MVP Group - OneNews.PH,OneNews.PH
"Tue, 14 Oct 2025 14:09:16 GMT","'Gen-Zs, Hear Me Out': Youth Icon Balen Shah Rallies Behind Sushila Karki To Take Interim Charge Of Nepal - MSN",MSN
"Thu, 16 Oct 2025 07:15:19 GMT",MG ZS Pro launched in South Africa: Here's what you get for your money - IOL,IOL
"Wed, 15 Oct 2025 05:55:55 GMT",2025 MG ZS Pro: SA Price & Specs - carmag.co.za,carmag.co.za
"Wed, 15 Oct 2025 09:54:36 GMT",Review: 2025 MG ZS Pro - carmag.co.za,carmag.co.za
"Fri, 17 Oct 2025 00:00:00 GMT",ZS Acquires Torrent Consulting to Enhance Healthcare and Salesforce Capabilities - Global Legal Chronicle,Global Legal Chronicle
"Wed, 15 Oct 2025 14:29:42 GMT",From Vietnam’s Hidden Caves To Thailand’s Luxe Retreats- Where Are Gen Zs Escaping To This Diwali 2025? - Free Press Journal,Free Press Journal
"Mon, 13 Oct 2025 07:43:31 GMT",Nelson Havi: We’ll retain our traditional voting blocs if Gen Zs fail to register - K24 Digital,K24 Digital
"Tue, 14 Oct 2025 07:29:50 GMT","Ameritas Advisory Services LLC Purchases Shares of 129 Zscaler, Inc. $ZS - Defense World",Defense World
"Tue, 14 Oct 2025 08:45:36 GMT",The rise of 'little treat culture' as Gen Zs splurge for pick-me-ups - MSN,MSN
"Thu, 16 Oct 2025 10:28:48 GMT","""Baba uko wapi?"": Heartbreaking video shows Gen Zs weeping over Raila's casket - Tuko News",Tuko News
"Sun, 12 Oct 2025 11:50:38 GMT",Gachagua Sends Message to Gen Zs As He Sets Eyes on 2027 - MSN,MSN
"Sun, 12 Oct 2025 10:45:04 GMT",What Is October Theory & Why Gen Zs Are Calling It Second New Year - Free Press Journal,Free Press Journal
"Mon, 13 Oct 2025 08:36:35 GMT",Zscaler (NASDAQ:ZS) Hits New 52-Week High – Here’s Why - Defense World,Defense World
"Mon, 13 Oct 2025 19:41:15 GMT",Ezekiel Mutua warns Gen Zs against complaining about gov't at global leadership forum - MSN,MSN
2025-10-16T20:13:00,HCLTech and Zscaler Expand Partnership for AI-Powered Security and Network Transformation,Yahoo
2025-10-15T07:06:51,Does Zscaler’s 66% Rally in 2025 Still Leave Room for Growth?,Yahoo
2025-10-14T20:57:08,Dow Jones Tech Titan Apple Eyes Latest Buy Point Amid Stock Market Volatility,Yahoo
2025-10-14T19:30:48,Cybersecurity Name Zscaler Stock Near A Buy Point Taunts Investors,Yahoo
2025-10-13T23:45:04,Zscaler (ZS) Advances But Underperforms Market: Key Facts,Yahoo
2025-10-12T12:30:00,3 Cybersecurity Stocks You Can Buy and Hold for the Next Decade,Yahoo
