Date,Title,Source
2025-10-28T16:33:29Z,H.C. Wainwright Reiterates a Buy Rating on Vertex Pharmaceuticals (VRTX),Biztoc.com
2025-10-28T16:24:02Z,H.C. Wainwright Reiterates a Buy Rating on Vertex Pharmaceuticals (VRTX),Yahoo Entertainment
"Fri, 31 Oct 2025 04:43:38 GMT",Is VRTX reversing from oversold territory - CEO Change & Daily Market Momentum Tracking - newser.com,newser.com
"Wed, 29 Oct 2025 21:50:03 GMT",Vertex Pharmaceuticals (VRTX) Stock Moves -1.23%: What You Should Know - Yahoo Finance,Yahoo Finance
"Thu, 30 Oct 2025 10:30:08 GMT",Whalen Wealth Management Inc. Purchases New Stake in Vertex Pharmaceuticals Incorporated $VRTX - MarketBeat,MarketBeat
"Tue, 28 Oct 2025 15:59:33 GMT",Vertex Pharmaceuticals Remains A Buy Heading Into Q3 Earnings (VRTX) - Seeking Alpha,Seeking Alpha
"Wed, 29 Oct 2025 13:15:00 GMT","Exploring Analyst Estimates for Vertex (VRTX) Q3 Earnings, Beyond Revenue and EPS - Nasdaq",Nasdaq
"Wed, 29 Oct 2025 14:37:03 GMT",Will Breakthrough FDA Milestones for Povetacicept Redefine Vertex Pharmaceuticals’ (VRTX) Long-Term Growth Story? - simplywall.st,simplywall.st
"Tue, 28 Oct 2025 16:29:05 GMT",H.C. Wainwright Reiterates a Buy Rating on Vertex Pharmaceuticals (VRTX) - Insider Monkey,Insider Monkey
"Fri, 31 Oct 2025 05:48:34 GMT",How VRTX stock reacts to Fed rate cuts - July 2025 Outlook & Low Risk High Win Rate Picks - newser.com,newser.com
"Mon, 27 Oct 2025 14:00:19 GMT",Vertex Pharmaceuticals (VRTX) Earnings Expected to Grow: Should You Buy? - Yahoo Finance,Yahoo Finance
"Wed, 29 Oct 2025 08:22:23 GMT","Transcend Capital Advisors LLC Sells 1,522 Shares of Vertex Pharmaceuticals Incorporated $VRTX - MarketBeat",MarketBeat
"Fri, 31 Oct 2025 05:34:43 GMT",What insider trading reveals about VRTX stock - 2025 Technical Overview & Risk Controlled Swing Trade Alerts - newser.com,newser.com
"Tue, 28 Oct 2025 09:22:28 GMT",Vertex Pharmaceuticals Incorporated $VRTX Shares Sold by AustralianSuper Pty Ltd - MarketBeat,MarketBeat
"Fri, 31 Oct 2025 04:52:05 GMT",Should you wait for a breakout in VRTX - Earnings Recap Summary & AI Driven Stock Price Forecasts - newser.com,newser.com
"Tue, 28 Oct 2025 10:47:04 GMT","Howard Capital Management Inc. Acquires 2,282 Shares of Vertex Pharmaceuticals Incorporated $VRTX - MarketBeat",MarketBeat
"Thu, 30 Oct 2025 10:55:57 GMT",Is VRTX reversing from oversold territory - July 2025 Recap & Community Verified Trade Signals - newser.com,newser.com
"Tue, 28 Oct 2025 07:22:04 GMT",Will VRTX stock beat EPS estimates - 2025 Key Highlights & Community Verified Swing Trade Signals - newser.com,newser.com
"Wed, 29 Oct 2025 11:42:46 GMT",Is VRTX reversing from oversold territory - Portfolio Update Summary & Community Consensus Trade Alerts - newser.com,newser.com
"Mon, 27 Oct 2025 09:35:48 GMT",Vertex Pharmaceuticals (VRTX) Projected to Post Earnings on Monday - MarketBeat,MarketBeat
"Thu, 30 Oct 2025 08:08:38 GMT",Should you wait for a breakout in VRTX - 2025 Dividend Review & Weekly Market Pulse Updates - newser.com,newser.com
"Tue, 28 Oct 2025 05:31:34 GMT","Vertex Pharmaceuticals Incorporated (NASDAQ:VRTX) Receives Consensus Rating of ""Moderate Buy"" from Brokerages - MarketBeat",MarketBeat
"Thu, 30 Oct 2025 08:45:08 GMT",Is this a good reentry point in VRTX - July 2025 Closing Moves & Technical Pattern Recognition Alerts - newser.com,newser.com
"Mon, 27 Oct 2025 13:26:53 GMT",Wealthfront Advisers LLC Has $19.55 Million Stake in Vertex Pharmaceuticals Incorporated $VRTX - MarketBeat,MarketBeat
"Tue, 28 Oct 2025 05:37:27 GMT",Can momentum traders help lift VRTX - 2025 Breakouts & Breakdowns & Reliable Momentum Entry Alerts - newser.com,newser.com
"Mon, 27 Oct 2025 13:29:02 GMT","Nisa Investment Advisors LLC Sells 2,883 Shares of Vertex Pharmaceuticals Incorporated $VRTX - MarketBeat",MarketBeat
"Mon, 27 Oct 2025 09:58:48 GMT",Banco Santander S.A. Grows Position in Vertex Pharmaceuticals Incorporated $VRTX - MarketBeat,MarketBeat
"Mon, 27 Oct 2025 09:05:07 GMT",MQS Management LLC Takes Position in Vertex Pharmaceuticals Incorporated $VRTX - MarketBeat,MarketBeat
"Mon, 27 Oct 2025 11:32:07 GMT",Teacher Retirement System of Texas Reduces Position in Vertex Pharmaceuticals Incorporated $VRTX - MarketBeat,MarketBeat
"Wed, 29 Oct 2025 11:56:12 GMT",Why VRTX stock could benefit from AI revolution - July 2025 Intraday Action & Safe Entry Point Alerts - newser.com,newser.com
"Mon, 27 Oct 2025 23:56:21 GMT",Is VRTX stock affected by interest rate hikes - Trade Risk Assessment & Risk Managed Investment Signals - Fundação Cultural do Pará,Fundação Cultural do Pará
"Mon, 27 Oct 2025 09:01:38 GMT",Brighton Jones LLC Lowers Stock Holdings in Vertex Pharmaceuticals Incorporated $VRTX - MarketBeat,MarketBeat
"Wed, 29 Oct 2025 06:15:00 GMT",Why VRTX stock could benefit from AI revolution - July 2025 Update & Daily Entry Point Alerts - newser.com,newser.com
"Wed, 29 Oct 2025 03:33:07 GMT",Should you wait for a breakout in VRTX - Analyst Upgrade & Weekly Hot Stock Watchlists - newser.com,newser.com
"Sun, 26 Oct 2025 23:43:01 GMT",Will VRTX stock beat EPS estimates - 2025 Trading Volume Trends & Fast Moving Trade Plans - newser.com,newser.com
"Tue, 28 Oct 2025 08:41:26 GMT",Why VRTX stock could benefit from AI revolution - Gap Up & High Accuracy Investment Entry Signals - newser.com,newser.com
"Mon, 27 Oct 2025 13:31:00 GMT","Bernstein Maintains Vertex Pharmaceuticals(VRTX.US) With Hold Rating, Announces Target Price $471 - 富途牛牛",富途牛牛
"Tue, 28 Oct 2025 08:09:15 GMT",Will VRTX stock beat EPS estimates - July 2025 EndofMonth & Precise Swing Trade Entry Alerts - newser.com,newser.com
"Mon, 27 Oct 2025 08:01:59 GMT",Is this a good reentry point in VRTX - Weekly Profit Report & Detailed Earnings Play Strategies - newser.com,newser.com
"Mon, 27 Oct 2025 07:52:30 GMT",How VRTX stock reacts to Fed rate cuts - Fed Meeting & Capital Efficient Trading Techniques - newser.com,newser.com
2025-10-29T22:50:03,Vertex Pharmaceuticals (VRTX) Stock Moves -1.23%: What You Should Know,Yahoo
2025-10-29T14:15:08,"Exploring Analyst Estimates for Vertex (VRTX) Q3 Earnings, Beyond Revenue and EPS",Yahoo
2025-10-28T17:24:02,H.C. Wainwright Reiterates a Buy Rating on Vertex Pharmaceuticals (VRTX),Yahoo
2025-10-28T16:52:00,Vertex Gears Up to Report Q3 Earnings: Is a Beat in the Cards?,Yahoo
2025-10-28T12:59:33,Vertex Pharmaceuticals Remains A Buy Heading Into Q3 Earnings,SeekingAlpha
2025-10-27T21:00:00,Vertex to Participate in the UBS Global Healthcare Conference on November 11,Yahoo
2025-10-27T15:00:19,Vertex Pharmaceuticals (VRTX) Earnings Expected to Grow: Should You Buy?,Yahoo
