Date,Title,Source
2025-10-30T07:03:20Z,YouTube Will Add ‘Super-Resolution’ to Some Videos,Madshrimps.be
2025-10-30T07:00:00Z,Dragon Quest I & II HD-2D Remake,Giantbomb.com
2025-10-30T06:00:00Z,Charlie Kaufman: ‘They told me Being John Malkovich would never get made’,The-independent.com
2025-10-30T01:41:40Z,Roccbox Propane Outdoor Portable Pizza Oven 12 in. Grey $249 YMMV *In Store Only* $249.99,Slickdeals.net
2025-10-29T23:39:51Z,AVENGERS: DOOMSDAY Promo Art Reveals An HD Look at Robert Downey Jr.'s Doctor Doom Armor - Possible SPOILERS,CBM (Comic Book Movie)
2025-10-29T23:06:30Z,AVENGERS: DOOMSDAY Promo Art Reveals An HD Look at Robert Downey Jr.'s Doctor Doom Armor,CBM (Comic Book Movie)
2025-10-29T23:04:27Z,Best Fansly Downloaders In 2025 – Download Fansly Videos Easily,redmondpie.com
2025-10-29T22:16:41Z,YouTube Is Using AI To Upscale Low-Quality Videos To HD,BGR
2025-10-29T22:00:02Z,YouTube starts AI upscaling videos,GSMArena.com
2025-10-29T21:47:34Z,You can get the Amazon Fire HD 10 tablet for up to $90 off with this sneaky deal - here's where,ZDNet
2025-10-29T19:00:00Z,「niko and ...」が、ブランドアンバサダー北村匠海と清原果耶出演のキャンペーンムービー最新作「旅のキオク」を10月30日（木）公開！,Prtimes.jp
2025-10-29T18:42:00Z,Dragon Quest I & II HD-2D Remake: Get Launch-Day Delivery And Bonuses,GameSpot
2025-10-29T18:01:00Z,YouTube Plans Automatic Upscaling for Low-Res Videos,Slashdot.org
2025-10-29T18:00:00Z,Round Up: The Reviews Are In For Dragon Quest I & II HD-2D Remake,Nintendo Life
2025-10-29T16:25:56Z,"If You Invested $100 In Home Depot Stock 15 Years Ago, You Would Have This Much Today",Biztoc.com
2025-10-29T15:09:44Z,YouTube on TV Will Use AI to Automatically Upscale SD Videos to HD,Thurrott.com
2025-10-29T15:02:18Z,‘Dragon Quest I & II HD-2D Remake’ Review: The Scions Of Erdrick,Forbes
2025-10-29T15:00:20Z,Dragon Quest 1+2 HD-2D Remake Review,Screen Rant
2025-10-29T15:00:04Z,Dragon Quest I & II HD-2D Remake Brought Me Back to When RPGs First Felt Magical,CNET
2025-10-29T15:00:00Z,DRAGON QUEST I & II HD-2D Remake Game Review,Anime News Network
2025-10-29T15:00:00Z,"I’ve spent more than 40 hours slaying fiends in Dragon Quest I & II HD-2D Remake, and it’s a triumphant revival of two legendary RPGs",TechRadar
2025-10-29T15:00:00Z,Review: Dragon Quest I & II HD-2D Remake Renews the Legend,Siliconera
2025-10-29T15:00:00Z,Review: Dragon Quest I & II HD-2D Remake (Switch 2) - Rounds Out The Erdrick Trilogy In Style,Nintendo Life
2025-10-29T15:00:00Z,Dragon Quest 1 & 2 HD Remake Game Review,Anime News Network
2025-10-29T15:00:00Z,Dragon Quest 1 & 2 HD Remake Review -,GameSpot
2025-10-29T15:00:00Z,Dragon Quest I & II HD-2D Remake Review – Classic RPGs At Their Best,Wccftech
2025-10-29T14:19:10Z,"Dragon Quest I & II HD-2D Remake review - swords, slimes, and stunning storytelling",Pockettactics.com
2025-10-29T13:30:00Z,"YouTube is using AI to upscale videos uploaded at between 240p and 720p to HD on TV screens, but users can opt out, and plans 4K upscaling ""in the near future"" (Jess Weatherbed/The Verge)",Mediagazer.com
2025-10-29T13:15:05Z,"Uno Minda launches 2-way, 3-way car dash Cams: Price, key features",The Times of India
2025-10-29T12:49:08Z,FDA rejects Regeneron’s pre-filled Eylea HD syringes amid filling facility woes,Yahoo Entertainment
2025-10-29T10:34:38Z,4K and 8K screens a waste of money? A new study claims those are just flashy promises,The Times of India
2025-10-29T10:13:00Z,In the Mouth of Madness 1994 2160p UHD BluRay H265-MALUS,Rlsbb.to
2025-10-29T08:19:53Z,Fast Video Downloader 4.0.0.77,Rlsbb.to
2025-10-29T08:18:55Z,OmniPlayer Pro 2.1.14,Rlsbb.to
2025-10-29T06:00:00Z,The First Review For Dragon Quest I & II HD-2D Remake Is In,Nintendo Life
"Fri, 31 Oct 2025 02:39:07 GMT",Dragon Quest I & II HD-2D Remake Reviews - OpenCritic,OpenCritic
"Thu, 30 Oct 2025 14:28:01 GMT",First Look: Dragon Quest 1 & 2 HD-2D Remake Features Familiar Gameplay With Modern Improvements - Restart.run,Restart.run
"Thu, 30 Oct 2025 18:23:20 GMT",UV400 HD TAC Polarized Trendy Sunglasses for Men - Superior Anti Glare Quality Stylish Driving Glasses - 100% UVA and UVB Protection for Camping Fishing SHTF Daysight Hunting or Sporty Night Vision - The San Joaquin Valley Sun,The San Joaquin Valley Sun
"Wed, 29 Oct 2025 15:00:02 GMT",Dragon Quest I & II HD-2D Remake is a more expansive reimagining than I expected - RPG Site,RPG Site
"Thu, 30 Oct 2025 17:55:26 GMT","Regeneron receives FDA CRL, delaying Eylea HD sBLA approval - Eyes On Eyecare",Eyes On Eyecare
"Fri, 31 Oct 2025 06:06:35 GMT",Dragon Quest I & II HD-2D Remake - Official Launch Trailer - IGN,IGN
"Thu, 30 Oct 2025 17:42:00 GMT","Dragon Quest I & II HD-2D Remake Now Available, Concluding the Legendary Erdrick Trilogy - Yahoo Finance",Yahoo Finance
"Thu, 30 Oct 2025 23:39:44 GMT",‘Dragon Quest I & II HD-2D Remake’ is a Dream Come True – Review - Cinelinx,Cinelinx
"Wed, 29 Oct 2025 16:00:00 GMT",Dragon Quest 1 & 2 HD Remake Review - One For All - GameSpot,GameSpot
"Thu, 30 Oct 2025 14:34:00 GMT",YouTube is upgrading old videos to HD and 4K automatically - but you can opt out - ZDNET,ZDNET
"Fri, 31 Oct 2025 01:10:37 GMT",Amazon Exclusive Dragon Quest I & II HD-2D Remake Apparel now Available - GoNintendo,GoNintendo
"Thu, 30 Oct 2025 19:31:44 GMT","Dragon Quest I & II HD-2D Remake Gets Day One Update, Here Are The Full Patch Notes - Nintendo Life",Nintendo Life
"Fri, 31 Oct 2025 02:22:09 GMT","Data, AI new engines of maritime growth: HD Hyundai Marine Solution executive - The Korea Herald",The Korea Herald
"Wed, 29 Oct 2025 15:00:00 GMT",Dragon Quest I + II HD-2D Review - Review - Nintendo World Report,Nintendo World Report
"Thu, 30 Oct 2025 19:58:45 GMT","Daimler exec bringing OEM insights to HD Aftermarket Dialogue - Trucks, Parts, Service","Trucks, Parts, Service"
"Thu, 30 Oct 2025 12:30:00 GMT",October 2025: This Month in Huntington’s Disease Research - HDBuzz,HDBuzz
"Fri, 31 Oct 2025 04:31:56 GMT",These Are The Post Game Secrets For ‘Dragon Quest I & II HD-2D Remake’ - Forbes,Forbes
"Wed, 29 Oct 2025 14:38:57 GMT","Dragon Quest I & II HD-2D Remake is great on Steam Deck and Switch 2, but could've been better on both - RPG Site",RPG Site
"Wed, 29 Oct 2025 15:01:57 GMT",Dragon Quest I & II HD-2D Remake Review - IGN,IGN
"Fri, 31 Oct 2025 02:22:09 GMT",Square Enix has revealed the Dragon Quest I & II HD-2D Remake day one patch notes - RPG Site,RPG Site
"Thu, 30 Oct 2025 22:00:00 GMT",Dragon Quest I and II HD-2D Remake Patch Adds Earrings - Siliconera,Siliconera
"Fri, 31 Oct 2025 01:46:00 GMT",Hd-Hyundai Marine Engine Wins 53 Billion Won Order - TradingView,TradingView
"Thu, 30 Oct 2025 00:17:09 GMT",Dragon Quest I & II HD-2D Remake: how to access the pre-order bonus and save data bonus DLC - RPG Site,RPG Site
"Wed, 29 Oct 2025 22:47:00 GMT",You can get the Amazon Fire HD 10 tablet for up to $90 off with this sneaky deal - here's where - ZDNET,ZDNET
"Thu, 30 Oct 2025 00:20:01 GMT","Dragon Quest I, II, and III recommended play order — HD-2D Remakes and originals - RPG Site",RPG Site
"Thu, 30 Oct 2025 00:20:03 GMT",Dragon Quest I & II HD-2D Remake new features list — the quality of life features not present in DQ3 remake - RPG Site,RPG Site
"Fri, 31 Oct 2025 03:00:22 GMT",Ultra HD TV Market: Addressing Challenges in Application Techniques and Equipment. - openPR.com,openPR.com
"Thu, 30 Oct 2025 22:08:01 GMT","We Bet You've Never Seen a GMC Sierra 2500 HD Like This One, Have You? - autoevolution",autoevolution
"Thu, 30 Oct 2025 18:10:13 GMT",DRAGON QUEST I & II HD-2D Remake updated to Version 1.0.1.0 - GoNintendo,GoNintendo
"Thu, 30 Oct 2025 18:23:18 GMT","Dragon Quest 1 & 2 HD-2D Remake 1.0.1.0 update out now, patch notes - Nintendo Everything",Nintendo Everything
"Thu, 30 Oct 2025 16:39:07 GMT",Home Depot Stock (NYSE:HD) Gains With New AI Connection - TipRanks,TipRanks
"Wed, 29 Oct 2025 16:00:00 GMT",Dragon Quest I & II HD-2D Remake Brought Me Back to When RPGs First Felt Magical - CNET,CNET
"Thu, 30 Oct 2025 00:12:09 GMT","Dragon Quest I HD-2D Remake Walkthrough: Where to go, all mini medals, secret spots, step-by-step guide - RPG Site",RPG Site
"Thu, 30 Oct 2025 00:12:09 GMT",Dragon Quest I HD-2D Remake: All Mini Medals Locations - RPG Site,RPG Site
"Thu, 30 Oct 2025 00:12:09 GMT",Dragon Quest I HD-2D Remake: All Scroll Locations - RPG Site,RPG Site
"Thu, 30 Oct 2025 13:12:49 GMT","Resident Evil HD Remaster and Resident Evil 0 join GOG's preservation program, tell 16 other new arrivals to budge up - Rock Paper Shotgun",Rock Paper Shotgun
"Thu, 30 Oct 2025 00:12:09 GMT",Dragon Quest I HD-2D Remake: How to inspire Zalen and find Erdrick's Helm - RPG Site,RPG Site
"Thu, 30 Oct 2025 16:15:00 GMT",WATCH LIVE: Cabell Midland vs. Huntington: High School Football on HD Media GameDay - The Logan Banner,The Logan Banner
"Thu, 30 Oct 2025 16:15:00 GMT",WATCH LIVE: Spring Valley vs. South Charleston: High School Football on HD Media GameDay - The Logan Banner,The Logan Banner
"Tue, 28 Oct 2025 15:52:31 GMT",Regeneron reports another manufacturing-related rejection for Eylea HD but says help is on the way - Fierce Pharma,Fierce Pharma
"Wed, 29 Oct 2025 15:00:00 GMT",Dragon Quest 1 & 2 HD-2D Remake review: A curious combo - Shacknews,Shacknews
"Wed, 29 Oct 2025 15:00:00 GMT",Dragon Quest I & II HD-2D Remake (PS5) Review - CGMagazine,CGMagazine
"Wed, 29 Oct 2025 10:28:51 GMT",The Dragon Quest I & II HD-2D Remake is quite long - Instant Gaming News,Instant Gaming News
"Thu, 30 Oct 2025 16:15:00 GMT",WATCH LIVE: Sherman vs. Scott: High School Football on HD Media GameDay - The Logan Banner,The Logan Banner
"Thu, 30 Oct 2025 22:33:52 GMT",Dragon Quest I & II HD-2D Remake Launches With Day One Update - Noisy Pixel,Noisy Pixel
"Thu, 30 Oct 2025 15:18:28 GMT",Amazon Fire HD 10 at its lowest effective price of the season - findarticles.com,findarticles.com
"Thu, 30 Oct 2025 01:37:21 GMT",Bushnell Wingman HD Review: The Golf Speaker That Doubles as a GPS Caddie - AmateurGolf.com,AmateurGolf.com
"Mon, 27 Oct 2025 23:41:00 GMT","Ultra-HD televisions not noticeably better for typical viewer, scientists say - The Guardian",The Guardian
"Tue, 28 Oct 2025 10:51:41 GMT","HD Supply to close La Vergne location by 2026, impacting 108 employees - WZTV",WZTV
"Fri, 31 Oct 2025 01:05:43 GMT","Americas eShop Update: DRAGON QUEST I & II HD-2D Remake, And More - NintendoSoup",NintendoSoup
"Thu, 30 Oct 2025 15:00:17 GMT","3D Hangouts – MagTag Pool Alert, 7.5in Eink, Mac Jam HD and Zero #3DThursday - Adafruit",Adafruit
"Thu, 30 Oct 2025 13:00:00 GMT",HD Map for Autonomous Vehicles Market to Hit USD 22.97 - GlobeNewswire,GlobeNewswire
"Thu, 30 Oct 2025 19:12:16 GMT",Dragon Quest I & II HD-2D Remake Update 1.0.1.0 Adds English Voices and AI Improvements - Twisted Voxel,Twisted Voxel
"Thu, 30 Oct 2025 00:10:00 GMT",AVENGERS: DOOMSDAY Promo Art Reveals An HD Look at Robert Downey Jr.'s Doctor Doom Armor - Possible SPOILERS - ComicBookMovie.com,ComicBookMovie.com
"Thu, 30 Oct 2025 16:15:00 GMT",WATCH LIVE: Princeton vs. Hurricane: High School Football on HD Media GameDay - waynecountynews.com,waynecountynews.com
"Wed, 29 Oct 2025 12:29:55 GMT",FDA rejects Regeneron’s Eylea HD amid filling facility woes - Pharmaceutical Technology,Pharmaceutical Technology
"Wed, 29 Oct 2025 16:00:19 GMT",Review: Dragon Quest I & II HD-2D Remake (Nintendo Switch 2) - Digitally Downloaded,Digitally Downloaded
"Wed, 29 Oct 2025 15:00:00 GMT",Dragon Quest I & II HD-2D Remake Review - RPGFan,RPGFan
"Wed, 29 Oct 2025 13:06:11 GMT",South Carolina Public Radio to launch new 24/7 HD broadcast radio and streaming music channel - South Carolina ETV,South Carolina ETV
"Fri, 31 Oct 2025 02:43:26 GMT",DRAGON QUEST I & II HD-2D Remake (PS5) - Blu-ray.com,Blu-ray.com
"Sun, 26 Oct 2025 10:01:28 GMT",HD Hyundai Heavy Industries and HII Execute Memorandum of Agreement to Collaborate on Distributed Shipbuilding and Pursue Teaming on Auxiliary and Commercial Vessels - HII,HII
"Thu, 30 Oct 2025 13:31:51 GMT",The Erdrick Trilogy is Finally Complete as DRAGON QUEST I & II HD-2D Remake is NOW AVAILABLE - TheXboxHub,TheXboxHub
"Thu, 30 Oct 2025 09:26:32 GMT",YouTube’s New Super Resolution Turns Blurry Uploads Into HD And 4K - Dataconomy,Dataconomy
"Thu, 30 Oct 2025 10:25:56 GMT",Resident Evil HD REMASTER and Resident Evil 0 now on GOG and in the Preservation Program - GamingOnLinux,GamingOnLinux
"Wed, 29 Oct 2025 15:05:12 GMT",REVIEW: Dragon Quest I & II HD-2D Remake is the definitive way to play two classics - GoNintendo,GoNintendo
"Thu, 30 Oct 2025 19:42:29 GMT",Dragon Quest I & II HD-2D Remake Update 1.0.1 Patch Notes - Nintendo Insider,Nintendo Insider
"Tue, 28 Oct 2025 19:37:43 GMT",WSU WBB VS NEWMAN - Shocker HD - Powered by SIDEARM Showcase - Wichita State Athletics,Wichita State Athletics
"Thu, 30 Oct 2025 14:19:13 GMT","Nintendo Download - October 30, 2025 (North America) - Dragon Quest 1 & 2 HD-2D Remake, Mortal Kombat: Legacy Kollection, more - Nintendo Everything",Nintendo Everything
"Thu, 30 Oct 2025 22:37:14 GMT",YouTube will use AI to turn millions of old videos into HD | Tap to know more | Inshorts - Inshorts,Inshorts
"Wed, 29 Oct 2025 17:15:00 GMT",Dragon Quest I & II HD-2D Remake Review - MMORPG.com,MMORPG.com
"Thu, 30 Oct 2025 11:49:54 GMT",HD Hyundai Chairman emphasizes need for shipbuilding innovation - Safety4Sea,Safety4Sea
"Thu, 30 Oct 2025 14:55:00 GMT","Noteworthy ETF Inflows: SPXL, JNJ, ABBV, HD - Nasdaq",Nasdaq
"Thu, 30 Oct 2025 20:05:52 GMT",Resident Evil 0 and HD Remaster Now Available on GOG - Final Weapon,Final Weapon
"Wed, 29 Oct 2025 15:04:25 GMT",Dragon Quest I & II HD-2D Remake Review - Nova Crystallis,Nova Crystallis
"Mon, 27 Oct 2025 10:38:14 GMT",Is your ultra-HD TV worth it? Scientists measure the resolution limit of the human eye - University of Cambridge,University of Cambridge
"Thu, 30 Oct 2025 16:15:00 GMT",WATCH LIVE: Sherman vs. Scott: High School Football on HD Media GameDay - Charleston Gazette-Mail,Charleston Gazette-Mail
"Wed, 29 Oct 2025 15:03:11 GMT",Review: Dragon Quest I & II HD-2D Remake (Switch 2) - Rounds Out The Erdrick Trilogy In Style - Nintendo Life,Nintendo Life
"Wed, 29 Oct 2025 17:25:49 GMT",Dragon Quest I & II HD-2D Remake Review: Revising The Past - Hey Poor Player,Hey Poor Player
"Wed, 29 Oct 2025 15:00:11 GMT",Review : Dragon Quest I & II HD 2D Remake : Full Circle - Seasoned Gaming,Seasoned Gaming
"Wed, 29 Oct 2025 22:47:00 GMT",YouTube unveils AI tool to boost low-quality videos to HD and 4K - Interesting Engineering,Interesting Engineering
"Wed, 29 Oct 2025 16:15:00 GMT",Walmart is selling a $160 curved HD monitor for $85 that displays 16.7 million colors - TheStreet,TheStreet
"Thu, 30 Oct 2025 11:09:53 GMT",Dragon Quest 1 & 2 HD-2D Remake - Steam Deck HQ,Steam Deck HQ
"Wed, 29 Oct 2025 15:07:44 GMT",Dragon Quest I & II HD-2D Remake Review - Level Up And Up - Game Informer,Game Informer
"Wed, 29 Oct 2025 02:37:00 GMT",HD Supply distribution center closing - WSMV,WSMV
"Wed, 29 Oct 2025 15:00:48 GMT",DRAGON QUEST I & II HD-2D Remake Review – Classics Reborn in HD-2D Glory - Twisted Voxel,Twisted Voxel
"Thu, 30 Oct 2025 10:20:00 GMT",Dragon Quest I & II HD-2D Remake – 5 Tips To Banish The Fiends - Wccftech,Wccftech
"Wed, 29 Oct 2025 15:00:19 GMT",Dragon Quest I & II HD-2D Remake Review - TheSixthAxis,TheSixthAxis
"Thu, 30 Oct 2025 00:17:09 GMT",Dragon Quest I & II HD-2D Remake: how to save your game - RPG Site,RPG Site
"Fri, 31 Oct 2025 06:35:48 GMT","Doctor Doom Needs Armour As His Body Is Broken? Avengers Doomsday Alleged Trailer Deets, RDJ's New HD Photo Go - Times Now",Times Now
"Wed, 29 Oct 2025 16:33:26 GMT",Home Depot Stock (NYSE:HD) Slips With Middle Tennessee Closure Plans - TipRanks,TipRanks
"Thu, 30 Oct 2025 12:24:05 GMT",Take 20 percent off these Q Acoustics M20 HD speakers from Peter Tyson's eBay store - Eurogamer,Eurogamer
"Wed, 29 Oct 2025 12:57:38 GMT",FDA Formally Rejects Regeneron’s Eylea HD Over Manufacturing Issues - BioSpace,BioSpace
2025-10-30T17:31:00,"Home Depot's Tech Edge: Faster Fulfillment, Stronger Loyalty",Yahoo
2025-10-29T06:25:17,Home Depot: Expected Return Profile Has Worsened Even Further,SeekingAlpha
2025-10-28T17:38:00,Home Depot vs. Lowe's: Which Home Improvement Titan Holds the Edge?,Yahoo
2025-10-27T14:00:04,"The Home Depot, Inc. (HD) Is a Trending Stock: Facts to Know Before Betting on It",Yahoo
2025-10-26T23:34:07,Home Depot: Home Improvements 'Winter' Lingers On,SeekingAlpha
