Date,Title,Source
2025-11-20T03:36:06Z,"Infosys Shares Buyback Live Updates: Infosys’ Rs 18,000-crore share buyback kicks off; here's all you need to know",Economictimes.com
"Thu, 20 Nov 2025 10:48:54 GMT",Is INFY stock resilient in recession scenarios - 2025 Volatility Report & Safe Capital Growth Plans - newser.com,newser.com
"Wed, 19 Nov 2025 23:54:56 GMT",Using AI based signals to follow INFY - 2025 Market Trends & Low Drawdown Investment Ideas - newser.com,newser.com
"Thu, 20 Nov 2025 11:55:14 GMT",Can INFY stock sustain market leadership - 2025 Short Interest & Reliable Momentum Entry Alerts - newser.com,newser.com
"Thu, 20 Nov 2025 00:16:59 GMT",What MACD trends signal for INFY stock - July 2025 PostEarnings & Detailed Earnings Play Strategies - newser.com,newser.com
"Thu, 20 Nov 2025 00:23:53 GMT",What MACD trends signal for INFY stock - Long Setup & Fast Entry and Exit Trade Plans - newser.com,newser.com
"Wed, 19 Nov 2025 19:53:52 GMT",Is INFY stock resilient in recession scenarios - Trade Signal Summary & Free Safe Capital Growth Stock Tips - newser.com,newser.com
"Wed, 19 Nov 2025 12:12:03 GMT",Is INFY stock resilient in recession scenarios - July 2025 Final Week & Daily Profit Focused Stock Screening - newser.com,newser.com
