Date,Title,Source
2025-09-29T07:12:25Z,Men Who Uploaded Movies to Extract Cash From Pirates Have Been Acquitted,Torrentfreak.com
2025-09-29T04:05:05Z,How to Strengthen the International Competitiveness of Capital Markets,Columbia.edu
2025-09-29T00:00:00Z,Large linear high-frequency strain by interlocked monoclinic polar nanoregions,Nature.com
2025-09-29T00:00:00Z,Stress Regulatory capabilities discovered in late embryogenesis abundant (LEA) proteins expressed during pecan (Carya illinoinensis) kernel development,Biomedcentral.com
2025-09-29T00:00:00Z,Bruce Blair Memorial Lecture: Nuclear Weapons In The Age Of Artificial Intelligence,Hoover.org
2025-09-29T00:00:00Z,"Little urchins, mischievous molluscs: my life as a sea champion",Nature.com
2025-09-28T23:00:00Z,Application of azacyclobutane modified perylene imide fluorescent probes targeting lipid droplets in the diagnosis of metabolic dysfunction-associated fatty liver,Royal Society of Chemistry
2025-09-28T23:00:00Z,A convenient strategy for tunable quasi-WGM lasing in pyramid structures enabled by Förster resonance energy transfer,Royal Society of Chemistry
2025-09-28T17:16:17Z,Ryan Gosling's Star Wars: Starfighter Breaks Franchise Rules in 3 Big Ways,Screen Rant
2025-09-28T16:00:00Z,Motorists welcome crackdown on traffic flouters,The Star Online
2025-09-28T14:31:16Z,Trump’s tariffs affecting small businesses in Los Gatos,The Mercury News
2025-09-28T08:56:26Z,Nosebleeds to cancer: A man's journey,The Straits Times
2025-09-28T07:14:08Z,"Why the brain lets some memories fade, and others last a lifetime",The Times of India
2025-09-28T05:12:45Z,Best Industrial Stocks Worth Watching – September 26th,ETF Daily News
2025-09-26T23:00:00Z,Dual-Functional Defect Passivation in Dion-Jacobson Perovskite for Low-Dose X-ray Detection and Imaging,Royal Society of Chemistry
2025-09-26T18:43:37Z,"Bitcoin's Final Act In Q4 Could Lift It Beyond $130,000, Analyst Says",Biztoc.com
2025-09-26T17:52:57Z,30+ Witty Single Panel Comics From New Yorker Cartoonist Hartley Lin,Pleated-jeans.com
2025-09-26T16:46:11Z,‘Air’s Alex Convery Enlisted To Adapt Tiger Woods Book ‘The Tiger Slam’ For Amazon MGM Studios,Deadline
2025-09-26T16:00:00Z,"BUILDING CHARACTER, SHAPING FUTURES",The Star Online
2025-09-26T14:00:00Z,Construction of an automated machine learning-based predictive model for postoperative pulmonary complications risk in non-small cell lung cancer patients undergoing thoracoscopic surgery,Plos.org
2025-09-26T05:50:37Z,James Van Der Beek’s wife says Dawson’s Creek reunion was ‘healing to the core’ despite his absence,The-independent.com
2025-09-26T00:00:00Z,Enhanced episodic memory and LTP-like plasticity in subjective cognitive decline following 10-Hz repetitive transcranial magnetic stimulation,Biomedcentral.com
2025-09-26T00:00:00Z,Transposable elements create distinct genomic niches for effector evolution among Magnaporthe oryzae lineages,Biomedcentral.com
2025-09-26T00:00:00Z,"Orogeny shapes the diversification of an ancient and relict spider family (Hypochilidae), with the stepwise uplift of the Qinghai-Tibetan plateau driving the radiation of Asian lineages",Biomedcentral.com
2025-09-26T00:00:00Z,Interaction of plant-derived metabolites and rhizobiome functions enhances drought stress tolerance,Biomedcentral.com
2025-09-25T23:00:00Z,Unlocking the mechanism of anharmonic lattice dynamics in ionic conductor β-Li3VO4,Royal Society of Chemistry
2025-09-25T23:00:00Z,Ytterbium-incorporated porphyrin nanostructure-modified carbon electrodes for ultra-sensitive detection of lead ions in water environments,Royal Society of Chemistry
2025-09-25T23:00:00Z,Environmentally persistent free radicals on micro- and nano-plastics: a double-edged sword to environmental and biological safety,Royal Society of Chemistry
2025-09-25T23:00:00Z,Single-atom alloys for photocatalytic applications: material innovation and light-driven reactivity,Royal Society of Chemistry
2025-09-25T23:00:00Z,Theoretical and Machine Learning Exploration of Electronic Factors Governing Ni-Centered CO2 Reduction Catalysts,Royal Society of Chemistry
2025-09-25T23:00:00Z,Development of a decellularized liver matrix-based nanomedicine for metabolic dysfunctionassociated steatotic liver disease,Royal Society of Chemistry
2025-09-25T18:43:52Z,'Curb Your Enthusiasm' Book Goes Inside 'Seinfeld' Reunion (Exclusive),Hollywood Reporter
2025-09-25T18:30:02Z,The Big Idea: L. D. Colter,Scalzi.com
2025-09-25T17:00:00Z,LDF 2025: Royal College of Art – Tender Revolution,Core77.com
"Tue, 30 Sep 2025 02:01:00 GMT",Thousands Make Their Way to Hamilton College to See Lin-Manuel Miranda - WKTV,WKTV
"Tue, 30 Sep 2025 03:09:34 GMT","Fans flock to Hamilton college to see 'Hamilton' creator, Lin-Manuel Miranda - WSTM",WSTM
"Mon, 29 Sep 2025 17:25:58 GMT","Fay Lin: Time Again for the Virtual Event ""The State of AI in Drug Discovery"" - Oncodaily",Oncodaily
"Mon, 29 Sep 2025 18:14:01 GMT",Review: A new biography of Lin-Manuel Miranda tells his creative origin story - America Magazine,America Magazine
"Tue, 30 Sep 2025 04:10:17 GMT",FM Lin witnesses signing of Ukraine MOU to assist children - Taiwan Today,Taiwan Today
"Tue, 30 Sep 2025 03:52:16 GMT",Lin-Manuel Miranda's ‘SNL' Cameo as Alexander Hamilton Interrupted by James Austin Johnson's Donald Trump - MSN,MSN
"Tue, 30 Sep 2025 00:27:03 GMT",Jeremy Lin calls TPBL title 'toughest' of his career - Yahoo,Yahoo
"Mon, 29 Sep 2025 23:18:50 GMT",‘Insidious 6’ – Lin Shaye Will Star Alongside Amelia Eve in Next Summer’s Sequel - IMDb,IMDb
"Tue, 30 Sep 2025 01:22:02 GMT","China's Lin, Wang sail into second round at WTT China Smash - chinadailyasia.com",chinadailyasia.com
"Mon, 29 Sep 2025 23:39:05 GMT",Berks girls tennis: Wilson’s Jin Lin Chen wins BCIAA singles title - Reading Eagle,Reading Eagle
"Sun, 28 Sep 2025 21:54:44 GMT",Lin Shaye: Telling a Story with the Godmother of Horror - iHorror,iHorror
"Mon, 29 Sep 2025 10:29:16 GMT","With EPS Growth And More, Linde (NASDAQ:LIN) Makes An Interesting Case - simplywall.st",simplywall.st
"Tue, 30 Sep 2025 03:11:31 GMT",Lin May Saeed : Untouchability - MutualArt,MutualArt
"Sun, 28 Sep 2025 00:00:00 GMT",Lin-Manuel Miranda on 10 years of ‘Hamilton’ - Spectrum News NY1,Spectrum News NY1
"Mon, 29 Sep 2025 14:33:48 GMT",Linde plc (LIN) Announces Leadership Changes: Chairman Retiremen - GuruFocus,GuruFocus
"Tue, 30 Sep 2025 02:18:00 GMT",Lin-Manuel Miranda speaks at Hamilton College - WKTV,WKTV
"Mon, 29 Sep 2025 11:37:00 GMT",Major Leadership Shift: Linde CEO Sanjiv Lamba to Become Chairman as 25-Year Veteran Steve Angel Retires - Stock Titan,Stock Titan
"Sun, 28 Sep 2025 03:49:49 GMT",'An exciting day for Enoch': Officials break ground on 8th Lin's Market grocery store - KSL.com,KSL.com
"Mon, 29 Sep 2025 13:21:34 GMT",Linde (LIN) Names Sanjiv Lamba as Future Chairman - GuruFocus,GuruFocus
"Mon, 29 Sep 2025 11:27:16 GMT",Linde PLC $LIN Shares Bought by Venture Visionary Partners LLC - MarketBeat,MarketBeat
"Mon, 29 Sep 2025 10:34:07 GMT",GC Wealth Management RIA LLC Increases Stake in Linde PLC $LIN - MarketBeat,MarketBeat
"Thu, 25 Sep 2025 17:20:36 GMT",What's in Zhu Lin's notebook that she brings to matches? - WTA Tennis,WTA Tennis
"Mon, 29 Sep 2025 10:03:28 GMT",V Square Quantitative Management LLC Lowers Stock Position in Linde PLC $LIN - MarketBeat,MarketBeat
"Sat, 27 Sep 2025 08:11:05 GMT",Andreeva moves past home favorite Zhu Lin to reach China Open third round - WTA Tennis,WTA Tennis
"Fri, 26 Sep 2025 19:51:37 GMT",Jeremy Lin's first practice with Raptors was a little awkward - Yahoo,Yahoo
"Thu, 25 Sep 2025 08:58:27 GMT",Taiwan foreign minister attends event on sidelines of UN assembly - Reuters,Reuters
"Fri, 26 Sep 2025 22:00:00 GMT",'An exciting day for Enoch': Officials break ground on 8th Lin's Market grocery store - St. George News,St. George News
"Fri, 26 Sep 2025 21:00:00 GMT","Daniel Pollack-Pelzner: ""Lin-Manuel Miranda: The Education of an Artist"" - KATU",KATU
"Sat, 27 Sep 2025 06:18:40 GMT",HIGHLIGHTS: Mirra Andreeva races past Zhu Lin | Beijing 2R - Tennis.com,Tennis.com
"Thu, 25 Sep 2025 15:03:24 GMT",4 Co-Lin students receive Blue Wave band scholarships - Daily Leader,Daily Leader
"Mon, 29 Sep 2025 11:35:41 GMT","Taiwan-based actress Ariel Lin reunites with husband, who resides in the US, only once every 2 months - VnExpress International",VnExpress International
"Sun, 28 Sep 2025 13:05:20 GMT",Linde PLC $LIN Stock Position Lifted by Addenda Capital Inc. - MarketBeat,MarketBeat
"Sun, 28 Sep 2025 13:17:49 GMT",Smith Salley Wealth Management Boosts Holdings in Linde PLC $LIN - MarketBeat,MarketBeat
"Mon, 29 Sep 2025 06:56:34 GMT","Week 4 Recap From Ireland: Steelers Get the Dub(lin), Mahomes Is Back, Giants Light Up a Dart, and Week 5 Waivers - The Ringer",The Ringer
"Fri, 26 Sep 2025 11:41:32 GMT",How Much He Loved Her from Mei Lin Heirendt - Bluegrass Today,Bluegrass Today
"Thu, 25 Sep 2025 22:00:46 GMT",AtlasIED Appoints Glenn Lin as Director of APAC Sales - Mixonline,Mixonline
"Fri, 26 Sep 2025 17:33:27 GMT","Lin Fai Leung Obituary (2025) - Colma, CA - Cypress Lawn Funeral Home & Memorial Park - Legacy.com",Legacy.com
"Sat, 27 Sep 2025 02:46:00 GMT",Lin-Manuel Miranda Shares Photos from Emotional Dawson's Creek Reunion After Stepping in for James Van Der Beek's Role - AOL.com,AOL.com
"Mon, 29 Sep 2025 12:56:56 GMT","Taiwanese actress Ariel Lin, who is active as an actress and singer, said she meets her husband Char.. - 매일경제",매일경제
"Sat, 27 Sep 2025 09:02:11 GMT","Novem Group Invests $847,000 in Linde PLC $LIN - MarketBeat",MarketBeat
"Thu, 25 Sep 2025 07:02:42 GMT","20 Walks: Lin Lisberger, an Art Review - The Gorham Times",The Gorham Times
"Fri, 26 Sep 2025 02:49:51 GMT",China deplores Lin Chia-lung's visit to New York during UN meeting - news.cgtn.com,news.cgtn.com
"Sat, 27 Sep 2025 07:00:00 GMT",Lin-Manuel Miranda replaces James Van Der Beek in 'Dawson's Creek' reunion due to illness - AOL.com,AOL.com
"Sat, 27 Sep 2025 09:02:11 GMT","Meridian Investment Counsel Inc. Invests $555,000 in Linde PLC $LIN - MarketBeat",MarketBeat
"Fri, 26 Sep 2025 09:16:22 GMT",LS Investment Advisors LLC Sells 610 Shares of Linde PLC $LIN - MarketBeat,MarketBeat
"Sun, 28 Sep 2025 16:30:00 GMT",Privacy concerns over LIN biometrics - eTNW,eTNW
"Fri, 26 Sep 2025 09:16:09 GMT","American National Bank & Trust Buys 1,914 Shares of Linde PLC $LIN - MarketBeat",MarketBeat
"Fri, 26 Sep 2025 06:50:00 GMT",Vivien Lin on Building BingX AI Master and Where AI in Trading Is Headed - BeInCrypto,BeInCrypto
"Mon, 29 Sep 2025 04:20:04 GMT","Lin Jian, Deputy General Manager of the Corporate Finance Headquarters of China Merchants Bank: The green financial market has vast space, and innovation in product services needs to catch up. - 富途牛牛",富途牛牛
"Tue, 30 Sep 2025 03:16:00 GMT","Fuzhou Metro Binhai Express becomes operational in Fujian, SE China - People's Daily Online",People's Daily Online
"Fri, 26 Sep 2025 16:28:57 GMT",WHL Quick Hits – Ryan Lin named to CHL USA Prospects Challenge - Canadian Hockey League,Canadian Hockey League
"Fri, 26 Sep 2025 16:58:51 GMT",WHL Weekly – Episode 3: Ryan Lin & the CHL USA Prospects Challenge; Big weeks for JP Hurlbert & Ethan Semeniuk - Canadian Hockey League,Canadian Hockey League
"Fri, 26 Sep 2025 09:16:10 GMT",Linde PLC $LIN Shares Sold by Bank Pictet & Cie Europe AG - MarketBeat,MarketBeat
"Fri, 26 Sep 2025 09:06:06 GMT",Linde PLC $LIN Stock Position Decreased by AAFMAA Wealth Management & Trust LLC - MarketBeat,MarketBeat
"Fri, 26 Sep 2025 09:38:19 GMT",Destiny Wealth Partners LLC Buys New Position in Linde PLC $LIN - MarketBeat,MarketBeat
"Fri, 26 Sep 2025 09:06:05 GMT","Banque Pictet & Cie SA Sells 5,587 Shares of Linde PLC $LIN - MarketBeat",MarketBeat
"Sat, 27 Sep 2025 00:49:00 GMT",Football: Harrisonburg vs. East Rockingham - dnronline.com,dnronline.com
"Fri, 26 Sep 2025 09:16:23 GMT",Hartford Investment Management Co. Sells 641 Shares of Linde PLC $LIN - MarketBeat,MarketBeat
"Sat, 27 Sep 2025 11:58:41 GMT","Jeremy Lin retires: All on ex-Lakers star's wife, net worth, championship ring, other details - MSN",MSN
"Sun, 28 Sep 2025 04:18:45 GMT",The truth about autism and Tylenol: Dr. Peter Lin - CBC,CBC
"Thu, 25 Sep 2025 12:05:00 GMT",China criticizes US for allowing Lin's visit - China Daily,China Daily
"Thu, 25 Sep 2025 13:22:18 GMT",Jia Lin Zheng Charged With Vehicular Manslaughter - thesfnews.com,thesfnews.com
"Fri, 26 Sep 2025 06:51:02 GMT","Professor Lin Xiang Xiong’s storied legacy of art, culture and peace finds a home in Penang - Tatler Asia",Tatler Asia
"Sat, 27 Sep 2025 07:09:28 GMT",Mirra Andreeva vs Lin Zhu | China Open highlights - Sky Sports,Sky Sports
"Thu, 25 Sep 2025 19:53:01 GMT",Qiu Lin Wins Philosophy of Religion Grant - Simon Fraser University,Simon Fraser University
"Thu, 25 Sep 2025 09:43:55 GMT",Riverbridge Partners LLC Has $4.95 Million Holdings in Linde PLC $LIN - MarketBeat,MarketBeat
"Sat, 27 Sep 2025 10:03:53 GMT","Mirra Andreeva vs. Lin Zhu prediction, odds, picks for WTA China Open 2025 - dimers.com",dimers.com
"Thu, 25 Sep 2025 08:37:34 GMT",Norden Group LLC Raises Holdings in Linde PLC $LIN - MarketBeat,MarketBeat
"Thu, 25 Sep 2025 08:25:50 GMT",Volleyball Recap: John Adams Academy Rsvl/Lin Triumphs - MaxPreps.com,MaxPreps.com
"Fri, 26 Sep 2025 17:07:21 GMT",Coast to Coast with Ryan Lin – CHL USA Prospects Challenge - Canadian Hockey League,Canadian Hockey League
"Mon, 29 Sep 2025 07:54:45 GMT",Targeting Portuguese-speaking markets: UM alumnus Lin Yuchu builds a large AI-powered Chinese-Portuguese language model - University of Macau,University of Macau
"Fri, 26 Sep 2025 03:46:24 GMT",Senate panel to invite Pogo boss Lin Xunhan to next hearing – Hontiveros - MSN,MSN
"Sun, 28 Sep 2025 11:43:58 GMT",Linde plc LIN Stock Analysis and Forecast - Gap Up/Gap Down Analysis & Budget Friendly Growth Tips - earlytimes.in,earlytimes.in
"Thu, 25 Sep 2025 16:00:00 GMT",Giants Lin first WHL player named to CHL Prospects Game - Langley Advance Times,Langley Advance Times
"Mon, 29 Sep 2025 07:38:57 GMT",Hong Kong Business Technology Excellence Awards 2025 Winner: Dr. Wilfred Lin of HerbMiners Informatics Limited - Hong Kong Business,Hong Kong Business
"Fri, 26 Sep 2025 03:55:02 GMT",Professor Lin Zhang Featured in TriplePundit Interview on Clean Cooking Fuel Innovation in China - City University of Hong Kong,City University of Hong Kong
"Fri, 26 Sep 2025 09:19:18 GMT","Apex Software: Controlling shareholder Yan Mengyu and his spouse Zhao Lin plan to donate 280,000 shares of the company to the Beijing Institute of Technology Education Foundation free of charge. - 富途牛牛",富途牛牛
"Thu, 25 Sep 2025 08:59:00 GMT","Those who engage in unjust actions will bring about their own downfall: Chinese FM warns DPP authorities, stubborn separatists on Lin Chia-lung's unauthorized visit to New York - Global Times",Global Times
"Fri, 26 Sep 2025 19:41:25 GMT",Il Teatro Rosso | NO HAY BANDA x Steven Kazuo Takasugi x Huei Lin | Festival MNM - cultmtl.com,cultmtl.com
"Fri, 26 Sep 2025 10:11:35 GMT",Mirra Andreeva vs Lin Zhu Prediction: Can Andreeva overpower Zhu on home soil? - Telecom Asia Sport,Telecom Asia Sport
"Sat, 27 Sep 2025 01:05:18 GMT",ONE 126: Thway Lin Htet loses on points to Sam A - Global New Light Of Myanmar,Global New Light Of Myanmar
"Fri, 26 Sep 2025 18:29:17 GMT","JJ Lin, Baey Yam Keng celebrate artists with disabilities at Kiat Lim-Shaping Hearts Award ceremony - MSN",MSN
2025-09-29T13:37:00,Linde Appoints Sanjiv Lamba as Chairman & CEO,Yahoo
2025-09-29T10:35:36,Sanjiv Lamba promoted to Chairman of Linde's Board,Finnhub
