Date,Title,Source
2025-09-08T15:50:00Z,Manchester City Transfer Window Recap and Pep’s January Priorities,English Premier League Index - Opta Stats
2025-09-08T11:36:00Z,A young City midfielder is already making an impression at Middlesbrough,Esteemedkompany.com
2025-09-08T11:30:00Z,Erling Haaland undergoes facial stitching after bus injury – Arsenal star jokingly blamed,Cityxtra.co.uk
2025-09-07T19:40:49Z,Composter $58.97,Slickdeals.net
2025-09-07T13:30:00Z,Pep Guardiola admits he made a Manchester City transfer mistake back in 2017,Cityxtra.co.uk
2025-09-07T07:31:23Z,PyAthena 3.18.0,Pypi.org
2025-09-06T23:04:40Z,Rory McIlroy drops reality check on Team USA ahead of Ryder Cup,Marca
2025-09-06T18:21:16Z,golemdb-sql 0.1.0,Pypi.org
2025-09-06T18:21:16Z,golemdb-sql added to PyPI,Pypi.org
2025-09-05T20:10:00Z,Pep Guardiola and Manchester City officials break silence on new sporting director Hugo Viana,Cityxtra.co.uk
2025-09-05T16:10:00Z,Manchester City signing’s training heroics raise questions over loan decision,Cityxtra.co.uk
2025-09-05T15:05:33Z,Why Texas A&M's Midnight Yell is one of the ultimate college football traditions,Yahoo Entertainment
2025-09-05T14:52:10Z,pyproject-external 0.1.9,Pypi.org
2025-09-05T14:28:22Z,pyproject-external 0.1.8,Pypi.org
"Mon, 08 Sep 2025 23:33:42 GMT",PepsiCo (PEP) Stock Sinks As Market Gains: Here's Why - Yahoo Finance,Yahoo Finance
"Mon, 08 Sep 2025 16:15:00 GMT",Yukon and Mustang Prepare For Rivalry Game With Schoolwide Pep Rallies - News 9,News 9
"Mon, 08 Sep 2025 22:34:56 GMT",Lofty dreams and a PEP scholarship power 12-year-old pilot in training - Next Steps Blog,Next Steps Blog
"Tue, 09 Sep 2025 04:46:02 GMT",How Pepsico Inc. (PEP) Affects Rotational Strategy Timing - news.stocktradersdaily.com,news.stocktradersdaily.com
"Sat, 06 Sep 2025 16:15:00 GMT",Man City Star Reveals Brutal Pep Guardiola Message That Resulted in Summer Move - Sports Illustrated,Sports Illustrated
"Sun, 07 Sep 2025 12:45:46 GMT",Sept. 2025 PEP Talk: Navigating a New Blood Clot Diagnosis - National Blood Clot Alliance,National Blood Clot Alliance
"Mon, 08 Sep 2025 12:03:00 GMT",‘Pep Rally’ Arts Walk set for Sept. 12 - West Virginia University,West Virginia University
"Mon, 08 Sep 2025 00:32:43 GMT",UTSA & UIW set to host joint pep rally at Pearl on Tuesday - UTSA Athletics,UTSA Athletics
"Sun, 07 Sep 2025 04:13:32 GMT","Gianluigi Donnarumma may not feel like a ‘Pep player’, but neither did Erling Haaland - The Athletic - The New York Times",The New York Times
"Mon, 08 Sep 2025 14:17:46 GMT",PepsiCo is on the hot seat with activist investor Elliott calling for big changes (PEP:NASDAQ) - Seeking Alpha,Seeking Alpha
"Mon, 08 Sep 2025 10:18:19 GMT","USS Investment Management Ltd Sells 161,900 Shares of PepsiCo, Inc. $PEP - MarketBeat",MarketBeat
"Mon, 08 Sep 2025 20:32:00 GMT",Literacy grant awarded to Gaffney Middle School during pep rally - FOX Carolina,FOX Carolina
"Sun, 07 Sep 2025 19:43:07 GMT",Pep Guardiola watches Spanish compatriot Carlos Alcaraz at the US Open final as he escapes the Man City blues on international break - amid security chaos for President Trump - Daily Mail,Daily Mail
"Mon, 08 Sep 2025 23:31:12 GMT",’Not Healthy’—Pep Guardiola Sends Warning to Man City Hierarchy - MSN,MSN
"Mon, 08 Sep 2025 17:24:13 GMT",King's Hawaiian - Pep Talk - 30s - Ad Age,Ad Age
"Tue, 09 Sep 2025 00:16:22 GMT",Los Angeles Rams Hold a Pep Rally at a LA High School - Sports Illustrated,Sports Illustrated
"Tue, 09 Sep 2025 01:54:23 GMT","Algorithmic Investment Models LLC Acquires Shares of 3,500 PepsiCo, Inc. $PEP - MarketBeat",MarketBeat
"Tue, 09 Sep 2025 02:54:07 GMT",Pep Guardiola and Xavi hoax! Indian Football Federation confirm pranksters applied for national team job claiming to be Man City boss and former Barcelona midfielder - au.sports.yahoo.com,au.sports.yahoo.com
"Tue, 09 Sep 2025 06:43:06 GMT",Pep Guardiola's warning about Jadon Sancho that Man Utd ignored - MSN,MSN
"Sun, 07 Sep 2025 11:44:32 GMT",PepsiCo (PEP) Valuation: Is Value Still on the Table After Recent Stock Moves? - Yahoo Finance,Yahoo Finance
"Sat, 06 Sep 2025 05:07:17 GMT",Leetonia Pep Rally - salemnews.net,salemnews.net
"Fri, 05 Sep 2025 20:26:15 GMT",Southside HS Pep Rally Rocks the Gym - Southside Independent School District,Southside Independent School District
"Mon, 08 Sep 2025 09:47:55 GMT","Scientech Research LLC Takes $958,000 Position in PepsiCo, Inc. $PEP - MarketBeat",MarketBeat
"Mon, 08 Sep 2025 10:57:02 GMT","Temasek Holdings Private Ltd Takes $27.38 Million Position in PepsiCo, Inc. $PEP - MarketBeat",MarketBeat
"Mon, 08 Sep 2025 02:03:37 GMT","PepsiCo, Inc. $PEP Shares Sold by Amundi - MarketBeat",MarketBeat
"Sun, 07 Sep 2025 15:41:35 GMT",Txiki Begiristain hits back at Manchester City sceptics over Pep Guardiola doubts - OneFootball,OneFootball
"Fri, 05 Sep 2025 20:03:45 GMT",FDA Accepts Shionogi’s Ensitrelvir NDA for COVID PEP - Infectious Disease Special Edition,Infectious Disease Special Edition
"Fri, 05 Sep 2025 07:00:00 GMT",UToledo Pep Rally at Levis Square - UToledo News,UToledo News
"Mon, 08 Sep 2025 04:12:41 GMT","PepsiCo, Inc. $PEP Stake Boosted by Federation des caisses Desjardins du Quebec - MarketBeat",MarketBeat
"Mon, 08 Sep 2025 16:34:01 GMT","Trading the Move, Not the Narrative: (PEP) Edition - news.stocktradersdaily.com",news.stocktradersdaily.com
"Mon, 08 Sep 2025 09:35:00 GMT",From Job Loss to Free Agent: A Financial Professional's Transition Playbook (and Pep Talk) - Kiplinger,Kiplinger
"Tue, 09 Sep 2025 05:38:24 GMT",Man City star James McAtee reveals Pep Guardiola will let him decide if he will play at the Club World Cup or U21 Euros this summer - MSN,MSN
"Sat, 06 Sep 2025 03:00:56 GMT",Statesboro's First Friday: Downtown Pep Rally - Statesboro Herald,Statesboro Herald
"Mon, 08 Sep 2025 17:13:52 GMT",Zinedine Zidane Settled Pep Guardiola vs Alex Ferguson Debate as 'Best' Manager Named - SPORTbible,SPORTbible
"Fri, 05 Sep 2025 12:00:10 GMT",Pep Zone: Belleville West High School - FOX 2,FOX 2
"Mon, 08 Sep 2025 17:16:53 GMT","Hires & Promotions: Coto, Anaptyss, PerformAce, Pep Brands - BW Marketing World",BW Marketing World
"Sun, 07 Sep 2025 11:34:53 GMT","Infusive Asset Management Inc. Purchases 5,743 Shares of PepsiCo, Inc. $PEP - MarketBeat",MarketBeat
"Mon, 08 Sep 2025 08:26:02 GMT",The Technical Signals Behind (PEP) That Institutions Follow - news.stocktradersdaily.com,news.stocktradersdaily.com
"Mon, 08 Sep 2025 11:28:17 GMT","New England Asset Management Inc. Purchases 2,170 Shares of PepsiCo, Inc. $PEP - MarketBeat",MarketBeat
"Mon, 08 Sep 2025 10:20:24 GMT","Edmond DE Rothschild Holding S.A. Lowers Stock Holdings in PepsiCo, Inc. $PEP - MarketBeat",MarketBeat
"Mon, 08 Sep 2025 09:01:05 GMT","Bridgeway Capital Management LLC Grows Stake in PepsiCo, Inc. $PEP - MarketBeat",MarketBeat
"Mon, 08 Sep 2025 12:18:18 GMT","Parkwood LLC Raises Stock Position in PepsiCo, Inc. $PEP - MarketBeat",MarketBeat
"Mon, 08 Sep 2025 06:43:31 GMT","PepsiCo, Inc. (NASDAQ:PEP) Receives $158.60 Consensus Price Target from Analysts - MarketBeat",MarketBeat
"Mon, 08 Sep 2025 10:59:00 GMT","Voleon Capital Management LP Boosts Holdings in PepsiCo, Inc. $PEP - MarketBeat",MarketBeat
"Mon, 08 Sep 2025 10:38:18 GMT","PepsiCo, Inc. $PEP Shares Sold by NewEdge Advisors LLC - MarketBeat",MarketBeat
"Mon, 08 Sep 2025 11:26:36 GMT","Financial Strategies Group Inc. Increases Stock Position in PepsiCo, Inc. $PEP - MarketBeat",MarketBeat
"Mon, 08 Sep 2025 10:43:13 GMT","UniSuper Management Pty Ltd Grows Holdings in PepsiCo, Inc. $PEP - MarketBeat",MarketBeat
"Mon, 08 Sep 2025 10:18:19 GMT","3,126 Shares in PepsiCo, Inc. $PEP Acquired by Angeles Investment Advisors LLC - MarketBeat",MarketBeat
"Sun, 07 Sep 2025 22:48:08 GMT","US Open final draws President Trump, Pep Guardiola and a sea of stars - India Today",India Today
"Mon, 08 Sep 2025 10:43:13 GMT","Integrated Wealth Concepts LLC Increases Stock Position in PepsiCo, Inc. $PEP - MarketBeat",MarketBeat
"Sun, 07 Sep 2025 07:00:00 GMT",PepsiCo (NASDAQ:PEP) Given Sector Perform Rating at Royal Bank Of Canada - MarketBeat,MarketBeat
"Fri, 05 Sep 2025 10:20:09 GMT","Kits, Cats and Kids converge for pep rally - Evanston Now",Evanston Now
"Mon, 08 Sep 2025 02:03:45 GMT","Chiron Capital Management LLC Boosts Holdings in PepsiCo, Inc. $PEP - MarketBeat",MarketBeat
"Fri, 05 Sep 2025 09:41:00 GMT",Manchester City need time to adapt to Pep Guardiola’s ambitious overhaul - The Guardian,The Guardian
"Fri, 05 Sep 2025 15:16:00 GMT",Kicking Off Our Saints Pep Rally With A DJ Battle - WWLTV.com,WWLTV.com
"Fri, 05 Sep 2025 15:42:00 GMT",Bourree Is Fixing A Smash Burger For Our Saints Pep Rally - WWLTV.com,WWLTV.com
"Thu, 04 Sep 2025 22:39:10 GMT","Big Country, we want to see your pep rallies - BigCountryHomepage.com",BigCountryHomepage.com
"Sat, 06 Sep 2025 22:30:00 GMT","PepsiCo, Inc. $PEP Shares Bought by Quarry LP - MarketBeat",MarketBeat
"Sun, 07 Sep 2025 20:09:55 GMT","5 stocks to watch on Friday: BABA, PEP, ULTA, APLD, CAT - MSN",MSN
"Sat, 06 Sep 2025 07:00:00 GMT",Citizens Pep Rally for Giants’ Season - njfamily.com,njfamily.com
"Sat, 06 Sep 2025 06:55:33 GMT",Week 3 Alarm Clock Pep Rally: Patrick Henry - fox5sandiego.com,fox5sandiego.com
"Sat, 06 Sep 2025 13:34:58 GMT","DnB Asset Management AS Buys 107,528 Shares of PepsiCo, Inc. $PEP - MarketBeat",MarketBeat
"Sun, 07 Sep 2025 10:46:25 GMT","PepsiCo, Inc. $PEP Shares Purchased by Banque Transatlantique SA - MarketBeat",MarketBeat
"Sun, 07 Sep 2025 12:06:11 GMT","Nearwater Capital Markets Ltd Makes New Investment in PepsiCo, Inc. $PEP - MarketBeat",MarketBeat
"Sun, 07 Sep 2025 12:35:00 GMT","Nissay Asset Management Corp Japan ADV Increases Holdings in PepsiCo, Inc. $PEP - MarketBeat",MarketBeat
"Sat, 06 Sep 2025 13:39:12 GMT","PepsiCo, Inc. $PEP Shares Sold by Hall Laurie J Trustee - MarketBeat",MarketBeat
"Sun, 07 Sep 2025 10:46:25 GMT","Hancock Whitney Corp Decreases Stock Position in PepsiCo, Inc. $PEP - MarketBeat",MarketBeat
"Fri, 05 Sep 2025 15:22:30 GMT","September fun in Ballantyne: Pep Rally, Markets, Concerts, Fitness & more! - WCCB Charlotte",WCCB Charlotte
"Sun, 07 Sep 2025 07:00:00 GMT","Belmont Capital LLC Takes Position in PepsiCo, Inc. $PEP - MarketBeat",MarketBeat
"Sun, 07 Sep 2025 10:43:48 GMT","PepsiCo, Inc. $PEP Shares Sold by Curi RMB Capital LLC - MarketBeat",MarketBeat
"Sun, 07 Sep 2025 07:00:00 GMT","Advisors Asset Management Inc. Has $12.90 Million Holdings in PepsiCo, Inc. $PEP - MarketBeat",MarketBeat
"Sun, 07 Sep 2025 07:00:00 GMT","EP Wealth Advisors LLC Increases Stock Holdings in PepsiCo, Inc. $PEP - MarketBeat",MarketBeat
"Sun, 07 Sep 2025 23:33:00 GMT","Photos: Steph Curry, Bruce Springsteen, Pep Guardiola, Donald Trump and plenty more attend US Open final - The Times of India",The Times of India
"Fri, 05 Sep 2025 19:09:18 GMT",RED FRIDAY Pep Rally For The Chiefs - yahoo.com,yahoo.com
"Mon, 08 Sep 2025 10:30:00 GMT","Hey Philly, Virginia Tourism invites you to visit the 'Pep - Culpeper Star-Exponent",Culpeper Star-Exponent
"Sat, 06 Sep 2025 07:00:00 GMT","PepsiCo, Inc. $PEP Shares Bought by Focus Partners Advisor Solutions LLC - MarketBeat",MarketBeat
"Sat, 06 Sep 2025 22:30:00 GMT","AQR Capital Management LLC Purchases 540,149 Shares of PepsiCo, Inc. $PEP - MarketBeat",MarketBeat
"Mon, 08 Sep 2025 00:39:54 GMT",Pep Guardiola casts ominous fear for new Premier League season with message for outcasts - MSN,MSN
"Sun, 07 Sep 2025 11:31:34 GMT",Pep Guardiola confirms Man City break to keep season 'in our own hands' - MSN,MSN
"Sat, 06 Sep 2025 19:33:42 GMT",Pregame fan pep talk: Novosad questionable - Autzen Zoo,Autzen Zoo
"Mon, 08 Sep 2025 11:38:10 GMT",Pep Brands Elevates Shashwat Jain to Chief Commercial Officer - MediaNews4U,MediaNews4U
"Sat, 06 Sep 2025 07:00:00 GMT",PepsiCo (NASDAQ:PEP) Shares Gap Up - Still a Buy? - MarketBeat,MarketBeat
"Sat, 06 Sep 2025 16:07:30 GMT","First Financial Bankshares Inc Buys 20,215 Shares of PepsiCo, Inc. $PEP - MarketBeat",MarketBeat
"Fri, 05 Sep 2025 04:01:00 GMT","PepsiCo (PEP): Buy, Sell, or Hold Post Q2 Earnings? - FinancialContent",FinancialContent
"Fri, 05 Sep 2025 20:03:45 GMT","Flputnam Investment Management Co. Sells 2,286 Shares of PepsiCo, Inc. $PEP - MarketBeat",MarketBeat
"Sat, 06 Sep 2025 07:00:00 GMT","First Manhattan CO. LLC. Acquires 30,778 Shares of PepsiCo, Inc. $PEP - MarketBeat",MarketBeat
"Sun, 07 Sep 2025 11:34:53 GMT","MIRAE ASSET GLOBAL ETFS HOLDINGS Ltd. Buys 238,463 Shares of PepsiCo, Inc. $PEP - MarketBeat",MarketBeat
"Sat, 06 Sep 2025 07:00:00 GMT","Rep. Marjorie Taylor Greene Purchases Shares of PepsiCo, Inc. (NASDAQ:PEP) - MarketBeat",MarketBeat
"Thu, 04 Sep 2025 13:20:00 GMT",Jeremy Doku reveals how Pep Guardiola is feeling about Manchester City’s struggling performances - Yahoo Sports,Yahoo Sports
"Thu, 04 Sep 2025 20:43:00 GMT",Toledo Rockets hold pep rally at Levis Square to celebrate Saturday's home opener - WTOL,WTOL
"Thu, 04 Sep 2025 14:57:00 GMT",Interesting PEP Put And Call Options For October 24th - Nasdaq,Nasdaq
"Mon, 08 Sep 2025 01:27:09 GMT",Pep Guardiola escapes Man City blues to cheer on Carlos Alcaraz in US Open men's final - MSN,MSN
"Mon, 08 Sep 2025 16:10:37 GMT",Manchester City Transfer Window Recap and Pep’s January Priorities - OneFootball,OneFootball
"Sun, 07 Sep 2025 08:56:58 GMT",Pep Guardiola Blocked Man City From Losing Star Player in Summer Window - SPORTbible,SPORTbible
"Sun, 07 Sep 2025 14:25:49 GMT",Ex-Manchester City star claims Pep Guardiola 'BRAINWASHED' him to make him better after playing 'completely the wrong way' - MSN,MSN
"Sun, 07 Sep 2025 19:43:07 GMT",Pep Guardiola escapes the Man City blues to cheer on compatriot Carlos Alcaraz as he takes on Jannik Sinner in mouth-watering US Open men's final - Daily Mail,Daily Mail
"Fri, 05 Sep 2025 14:52:00 GMT","Noteworthy ETF Inflows: SCHV, DIS, PEP, AMGN - Nasdaq",Nasdaq
2025-09-08T12:30:00,PepsiCo CEO’s Tall Order: Win Over Investor Calling for Strategy Reset,Yahoo
2025-09-07T14:44:32,PepsiCo (PEP) Valuation: Is Value Still on the Table After Recent Stock Moves?,Yahoo
2025-09-05T17:03:00,"Zacks Investment Ideas feature highlights: Celsius, Monster and PepsiCo",Yahoo
2025-09-05T11:15:00,Pepsi Has Lost Its Bubbles. Elliott Wants to Make It Pop Again.,Yahoo
2025-09-05T07:01:29,"PepsiCo (PEP): Buy, Sell, or Hold Post Q2 Earnings?",Yahoo
2025-09-04T19:17:50,Jim Cramer Discusses Elliot Management’s Stake in PepsiCo,Yahoo
2025-09-04T18:25:30,"Elliott Opts for 'Activist-Light' Approach to Get Pepsi on Road to Recovery, Analyst Says",Yahoo
2025-09-04T15:00:00,The National Geographic Society and PepsiCo Launch New Food for Tomorrow Program Focused on Regenerative Agriculture,Yahoo
2025-09-04T11:36:00,"Zacks Industry Outlook Highlights Coca-Cola, PepsiCo, Monster Beverage, Keurig Dr Pepper and Zevia",Yahoo
2025-09-04T10:49:59,Celsius Holdings: PepsiCo Partnership And Major Acquisitions Fuel Good Upside,SeekingAlpha
