Date,Title,Source
2025-08-30T10:33:55Z,Meta to add new AI safeguards after report raises teen safety concerns,The Times of India
2025-08-30T10:31:49Z,"Meta's AI leaders discuss using Google, OpenAI models in apps: Report",The Times of India
2025-08-30T09:45:08Z,nvidia-nat-profiling 1.3.0a20250830,Pypi.org
2025-08-30T09:44:51Z,nvidia-nat-ingestion 1.3.0a20250830,Pypi.org
2025-08-30T09:40:00Z,Longtime Meta AI lead staffers passed over by new hires threatening to quit unless Zuck puts them in charge [Awkward],Fark.com
2025-08-30T08:49:22Z,Head Strap for Meta Quest 3/Quest 3S $7.99 + Free Shipping w/ Prime,Slickdeals.net
2025-08-30T08:05:07Z,Chaya Nayak quits Meta to join OpenAI’s special initiatives team,The Times of India
2025-08-30T08:02:59Z,"Manoj Tumu, 23-year-old Indian-American techie with a ₹3 crore Meta package, reveals how he got the job, shares interview tips",The Times of India
2025-08-30T08:02:37Z,"India's Richest Man Now Going After Mark Zuckerberg's Meta Glasses — After Starbucks, Coca-Cola, Pepsi And Netflix",Biztoc.com
2025-08-30T07:45:40Z,synerty-peek 5.0.0,Pypi.org
2025-08-30T06:11:05Z,Meta updates chatbot rules to avoid inappropriate topics with teen users,Biztoc.com
2025-08-30T05:37:08Z,Meta In Talks With Google And OpenAI To Integrate AI Models As Hyperion Data Center Faces $5 Billion Cost Backlash: Report,Biztoc.com
2025-08-30T05:11:23Z,"Meta's AI leaders discuss using Google, OpenAI models in apps, The Information says",BusinessLine
2025-08-30T04:54:19Z,"Meta created flirty chatbots of Taylor Swift, other celebrities without permission",The Times of India
2025-08-30T04:18:48Z,Meta changes the way its AI chatbot responds to kids after senator launches probe into its conversations with teens,Biztoc.com
2025-08-30T04:08:06Z,Meta changes the way its AI chatbot responds to kids after senator launches probe into its conversations with teens,Business Insider
2025-08-30T03:48:11Z,"Jio Platforms set for market debut in first half of next year, says RIL Chairman Mukesh Ambani",The Times of India
2025-08-30T03:42:41Z,Elon Musk to Meta Platforms Inc. (META) Defense over $97.4B Bid Documents for OpenAI,Yahoo Entertainment
2025-08-30T01:42:20Z,Cracks are forming in Meta’s partnership with Scale AI,Biztoc.com
2025-08-30T01:35:23Z,Cracks are forming in Meta’s partnership with Scale AI | TechCrunch,TechCrunch
2025-08-30T01:08:13Z,"Did Meta cross the line? Flirty chatbots of Taylor Swift, child stars spark outrage over ‘no consent’; company responds",Livemint
2025-08-30T00:45:00Z,Meta Changes Teen AI Chatbot Responses as Senate Begins Probe Into 'Romantic' Conversations,Slashdot.org
2025-08-30T00:06:08Z,"Meta AI Bots Imitating Taylor Swift, Scarlett Johansson Made Sexual Advances, NSFW Images | Report",TheWrap
2025-08-30T00:03:23Z,"Meta's AI leaders discuss using Google, OpenAI models in apps, The Information says",CNA
2025-08-30T00:03:23Z,"Meta's AI leaders discuss using Google, OpenAI models in apps, The Information says",Yahoo Entertainment
2025-08-29T23:42:46Z,"WhatsApp, Apple iPhone, Android devices targeted by hackers, says Meta. Here's what has happened?",The Times of India
2025-08-29T22:45:53Z,"Meta created flirty chatbots using likeness of Taylor Swift, Selena Gomez, and more without permission",New York Post
2025-08-29T22:40:00Z,Meta Created Flirty Chatbots of Celebrities Without Permission,Slashdot.org
2025-08-29T22:38:00Z,Zero-click Apple and WhatsApp bug combo used to drop gov spyware,iTnews
2025-08-29T21:38:08Z,"Meta made flirty chatbots of celebrities without consent, Reuters says",Thefly.com
2025-08-29T21:30:00Z,"Exclusive: Meta created flirty chatbots of Taylor Swift, other celebrities without permission (Jeff Horwitz/Reuters)",Memeorandum.com
2025-08-29T21:02:00Z,This tech giant just surpassed Instagram parent Meta for the first time,Biztoc.com
2025-08-29T21:01:24Z,"Meta’s Unauthorized AI Chatbots for Taylor Swift, Scarlett Johansson, Anne Hathaway and Others Made ‘Sexual Advances,’ Sent Pics Showing Celebs ‘Dressed in Lingerie,’ Report Says",Variety
2025-08-29T20:40:00Z,WhatsApp Fixes 'Zero-Click' Bug Used To Hack Apple Users With Spyware,Slashdot.org
2025-08-29T20:34:55Z,What is causing Meta to ban accounts en masse?,Slashdot.org
2025-08-29T20:29:00Z,Meta will sell you refurbished Ray-Ban smart glasses for $76 off - how to find them,ZDNet
2025-08-29T20:18:49Z,WhatsApp Fixes 'Zero-Click' Bug Used to Hack Apple Users With Spyware,Slashdot.org
2025-08-29T20:15:01Z,Meta created and let users create flirty chatbots and intimate images using the names and likenesses of Taylor Swift and other celebs without their permission (Jeff Horwitz/Reuters),Techmeme.com
2025-08-29T20:05:21Z,Meta changes teen AI chatbot responses as Senate begins probe into 'romantic' conversations,Biztoc.com
2025-08-29T20:05:19Z,"Meta created flirty chatbots of Taylor Swift, other celebrities without permission",Biztoc.com
2025-08-29T19:53:13Z,"Exclusive-Meta created flirty chatbots of Taylor Swift, other celebrities without permission",CNA
2025-08-29T19:52:04Z,Zuckerberg’s AI hires disrupt Meta with swift exits and threats to leave,Slashdot.org
2025-08-29T19:48:16Z,Meta to add new AI safeguards after Reuters report raises teen safety concerns,CNA
2025-08-29T19:46:41Z,Meta changes teen AI chatbot responses as Senate begins probe into 'romantic' conversations,CNBC
2025-08-29T19:44:00Z,5 popular wearable devices that are sharing your private data (and the safest brands to buy from),ZDNet
"Fri, 29 Aug 2025 22:29:17 GMT","Exclusive: Meta created flirty chatbots of Taylor Swift, other celebrities without permission - Reuters",Reuters
"Sun, 31 Aug 2025 03:01:00 GMT",Meta director Chaya Nayak joins OpenAI; says in a long note on LinkedIn: What I didn’t know in my first f - Times of India,Times of India
"Fri, 29 Aug 2025 19:43:33 GMT",Meta changes teen AI chatbot responses as Senate begins probe into 'romantic' conversations - CNBC,CNBC
"Sat, 30 Aug 2025 18:22:09 GMT",Meta is reportedly looking at using competing AI models to improve its apps - Engadget,Engadget
"Fri, 29 Aug 2025 21:01:00 GMT","Meta’s Unauthorized AI Chatbots for Taylor Swift, Scarlett Johansson, Anne Hathaway and Others Made ‘Sexual Advances,’ Sent Pics Showing Celebs ‘Dressed in Lingerie,’ Report Says - Variety",Variety
"Sat, 30 Aug 2025 01:34:05 GMT",Cracks are forming in Meta’s partnership with Scale AI - TechCrunch,TechCrunch
"Thu, 28 Aug 2025 16:43:00 GMT","I quit Amazon for a $400,000 AI job offer from Meta at 22. Here's how I got into the industry and my advice for others. - Business Insider",Business Insider
"Sun, 31 Aug 2025 01:41:26 GMT",Meta’s $14.3B Scale AI Investment Hits Early Snags with Cultural Clashes - WebProNews,WebProNews
"Sat, 30 Aug 2025 00:06:08 GMT","Meta AI Bots Imitating Taylor Swift, Scarlett Johansson Made Sexual Advances, NSFW Images | Report - TheWrap",TheWrap
"Sun, 31 Aug 2025 06:22:27 GMT","Wealth Preservation Advisors LLC Makes New $1.08 Million Investment in Meta Platforms, Inc. $META - MarketBeat",MarketBeat
"Sun, 31 Aug 2025 01:28:48 GMT",Meta’s AI Chatbots Accused of Making Sexual Advances and Creating Explicit Images of Celebrities Without Permission - IMDb,IMDb
"Sat, 30 Aug 2025 20:30:00 GMT",ELD Asset Management on Meta Midjourney Pact - Yahoo Finance,Yahoo Finance
"Sat, 30 Aug 2025 09:00:00 GMT","In copyright fight, artists use white-hot AI report as weapon against Meta - Mashable",Mashable
"Sat, 30 Aug 2025 19:30:08 GMT",Kefah Mokbel Shared Meta-analysis on Immediate Breast Reconstruction (IBR) - Oncodaily,Oncodaily
"Fri, 29 Aug 2025 11:00:00 GMT",What’s really happening with the hires at Meta Superintelligence Labs - The Verge,The Verge
"Sat, 30 Aug 2025 01:03:00 GMT","Meta's AI leaders discuss using Google, OpenAI models in apps, The Information says - Reuters",Reuters
"Thu, 28 Aug 2025 18:20:00 GMT",Meta is racing the clock to launch its newest Llama AI model this year - Business Insider,Business Insider
"Sat, 30 Aug 2025 16:30:26 GMT",Meta reportedly allowed unauthorized celebrity AI chatbots on its services - Engadget,Engadget
"Sat, 30 Aug 2025 21:36:18 GMT",Meta’s $14.3B Scale AI Deal Hits Snags with Departures and Clashes - WebProNews,WebProNews
"Thu, 28 Aug 2025 16:43:55 GMT","Pure Storage stock soars 32% to record as Meta deal bolsters results, outlook - CNBC",CNBC
"Fri, 29 Aug 2025 10:00:04 GMT",Zuckerberg’s AI hires disrupt Meta with swift exits and threats to leave - Financial Times,Financial Times
"Fri, 29 Aug 2025 17:04:17 GMT",Meta updates chatbot rules to avoid inappropriate topics with teen users - TechCrunch,TechCrunch
"Fri, 29 Aug 2025 20:29:00 GMT",Meta will sell you refurbished Ray-Ban smart glasses for $76 off - how to find them - ZDNET,ZDNET
"Sat, 30 Aug 2025 19:52:08 GMT","Meta Eyes Integrating Gemini and ChatGPT into WhatsApp, Instagram - WebProNews",WebProNews
"Sat, 30 Aug 2025 20:40:49 GMT",Meta limits AI chatbots for teens - Shafaq News - شفق نيوز,شفق نيوز
"Sat, 30 Aug 2025 13:23:25 GMT",Bernstein Calls Meta the Top Consumer AI Play With Outperform Rating - Yahoo Finance,Yahoo Finance
"Sat, 30 Aug 2025 09:00:00 GMT",Meta locks down AI chatbots for teen users - Mashable,Mashable
"Sat, 30 Aug 2025 21:03:43 GMT",Meta’s AI Ambitions: Talent Volatility and Strategic Reorganization as a Double-Edged Sword for Investors - AInvest,AInvest
"Fri, 29 Aug 2025 13:00:00 GMT",The Only Reason I Travel With My VR Headset Is the One Thing Meta Needs to Focus on More: Fitness - CNET,CNET
"Sun, 31 Aug 2025 06:07:28 GMT","Meta created flirty chatbots of Taylor Swift, Anne Hathaway, other celebs without consent: Report | World News - Hindustan Times - Hindustan Times",Hindustan Times
"Sun, 31 Aug 2025 06:42:00 GMT",Meta loses top AI talent after forming new division to pursue superintelligence: Report - The Indian Express,The Indian Express
"Tue, 26 Aug 2025 18:00:37 GMT",Researchers Are Already Leaving Meta’s New Superintelligence Lab - WIRED,WIRED
"Fri, 29 Aug 2025 20:00:39 GMT",Meta to add new AI safeguards after Reuters report raises teen safety concerns - Reuters,Reuters
"Thu, 28 Aug 2025 10:25:44 GMT",Meta Platforms (NASDAQ: META) Stock Price Prediction for 2025: Where Will It Be in 1 Year (Aug 28) - 24/7 Wall St.,24/7 Wall St.
"Thu, 28 Aug 2025 14:00:25 GMT","Meta's Reported $800 Smart Glasses with Display Won't Shoot for the Stars, Claims Respected Analyst - Road to VR",Road to VR
"Wed, 27 Aug 2025 09:18:56 GMT","Musk's lawyers try to stop OpenAI obtaining bid documents from Meta, filing shows - Reuters",Reuters
"Fri, 29 Aug 2025 16:26:35 GMT",Vermont Supreme Court rules in state’s favor in Meta lawsuit appeal - VTDigger,VTDigger
"Tue, 26 Aug 2025 22:08:53 GMT",Meta to launch California super PAC backing pro-AI candidates - Reuters,Reuters
"Sat, 30 Aug 2025 14:06:10 GMT",Meta Leads the Charge: Smart Glasses Boom Spurs Tech Giants into Frenzy - AInvest,AInvest
"Sat, 30 Aug 2025 20:06:06 GMT","Btrfs Maintainer Josef Bacik Leaves Meta, Steps Back from Linux Dev - WebProNews",WebProNews
"Sat, 30 Aug 2025 15:15:19 GMT",Meta Platforms’ Bold AI Moves Boost Stock Prospects - TipRanks,TipRanks
"Thu, 28 Aug 2025 10:45:19 GMT",Trump Spills Meta's $50-Billion Secret—And Wall Street Is Asking This - Yahoo Finance,Yahoo Finance
"Tue, 26 Aug 2025 16:03:42 GMT",Meta to launch California super PAC focused on AI - Politico,Politico
"Sat, 30 Aug 2025 04:08:00 GMT",Meta changes the way its AI chatbot responds to kids after senator launches probe into its conversations with teens - Business Insider,Business Insider
"Fri, 29 Aug 2025 11:18:59 GMT","Meta’s AI hires disrupt company with swift exits, threats to leave, FT says - TipRanks",TipRanks
"Wed, 27 Aug 2025 12:11:24 GMT","Indonesia urges TikTok, Meta to act against harmful online content - Reuters",Reuters
"Wed, 27 Aug 2025 23:57:55 GMT",Meta AI employees reportedly jumping ship following billion-dollar hiring spree - KRON4,KRON4
"Sat, 30 Aug 2025 09:30:00 GMT",Meta Platforms Pauses AI Spend. Here's Why That's a Good Thing For Investors - The Motley Fool,The Motley Fool
"Sat, 30 Aug 2025 09:05:58 GMT",Meta enables dynamic media by default for catalog ads starting September 2025 - PPC Land,PPC Land
"Fri, 29 Aug 2025 13:19:10 GMT","Billionaire Ambani taps Google, Meta to build India’s AI backbone - TechCrunch",TechCrunch
"Sun, 31 Aug 2025 06:57:52 GMT",Who is Chaya Nayak? Indian origin techie quits Meta to ‘turn a new page’ with OpenAI - Mint,Mint
"Fri, 29 Aug 2025 13:20:00 GMT",ChatGPT co-creator Shengjia Zhao’s ‘threat’ that may have 'forced' Meta to appoint him as chief AI scient - Times of India,Times of India
"Fri, 29 Aug 2025 11:30:55 GMT",India's Reliance ties up with Google and Meta to drive AI push - CNBC,CNBC
"Sat, 30 Aug 2025 15:23:32 GMT",Meta Platforms (NASDAQ:META) Trading Down 1.5% After Insider Selling - MarketBeat,MarketBeat
"Tue, 26 Aug 2025 20:41:48 GMT","Meta's planned Louisiana AI data center to cost $50 billion, Trump says - Reuters",Reuters
"Sat, 30 Aug 2025 15:22:30 GMT",Meta just invested $14.3b in Scale AI in June. Is the deal already fraying? - The Basis Point,The Basis Point
"Thu, 28 Aug 2025 04:35:00 GMT",TikTok owner ByteDance eyes valuation of over $330 billion as revenue surpasses Meta - Reuters,Reuters
"Sat, 30 Aug 2025 19:55:44 GMT",Meta Backlash: AI Chatbots Impersonate Taylor Swift in Sexual Interactions - WebProNews,WebProNews
"Sat, 30 Aug 2025 18:55:44 GMT",Meta hosted AI chatbots that posed as celebrities without permission: Report - The Tech Portal,The Tech Portal
"Thu, 28 Aug 2025 10:09:05 GMT",Is Meta Platforms Still an Opportunity After Superintelligence Labs Team Exits? - Yahoo Finance,Yahoo Finance
"Sat, 30 Aug 2025 20:27:22 GMT",Meta Adds New Security Features In AI After Reuters Report Reveals Teen Safety Concerns - VOI.ID,VOI.ID
"Sat, 30 Aug 2025 08:10:00 GMT","Meta Platforms and Apple Just Gave This Fellow ""Magnificent Seven"" Stock Great News - The Motley Fool",The Motley Fool
"Thu, 28 Aug 2025 23:16:05 GMT",Meta is bringing AI-powered NPCs to the metaverse - Engadget,Engadget
"Fri, 29 Aug 2025 13:13:52 GMT","Indian Billionaire Mukesh Ambani’s Reliance Forges AI Deals With Google, Meta As Its Mobile Carrier Gears Up For IPO - Forbes",Forbes
"Sat, 30 Aug 2025 16:49:16 GMT","Meta Platforms, Inc. $META Shares Bought by Vident Advisory LLC - MarketBeat",MarketBeat
"Wed, 27 Aug 2025 00:08:00 GMT",Meta Superintelligence Labs is already losing key staff less than two months after launch - Business Insider,Business Insider
"Sun, 31 Aug 2025 03:22:00 GMT","Meta, RIL to form AI joint venture: Ambani, Zuckerberg join hands to build open-source AI models for Indian businesses - The Indian Express",The Indian Express
"Sat, 30 Aug 2025 03:46:27 GMT",Elon Musk to Meta Platforms Inc. (META) Defense over $97.4B Bid Documents for OpenAI - Yahoo Finance,Yahoo Finance
"Wed, 27 Aug 2025 15:14:00 GMT",Better Than Ray-Bans? Meta's 'Hypernova' Glasses Could Be Cheaper Than Expected - CNET,CNET
"Fri, 29 Aug 2025 16:23:00 GMT",Internal tensions rise as Meta races to beat the clock - Business Insider,Business Insider
"Wed, 27 Aug 2025 20:09:00 GMT",What's Going On With Meta Platforms Stock? - Benzinga,Benzinga
"Fri, 29 Aug 2025 17:01:59 GMT",How Meta acheives 120kW a rack in 20kW air-cooled data centers - Data Center Dynamics,Data Center Dynamics
"Sat, 30 Aug 2025 18:23:43 GMT","Elon Musk asked Meta CEO Mark Zuckerberg to join xAI bid to buy OpenAI, filing shows - Vocal",Vocal
"Fri, 29 Aug 2025 23:47:00 GMT","Meta’s AI Leaders Discuss Using Google, OpenAI Models in Apps - The Information",The Information
"Wed, 27 Aug 2025 14:42:00 GMT",5 Meta Ray-Ban upgrades I want to see on September 17 - ZDNET,ZDNET
"Tue, 26 Aug 2025 12:00:01 GMT","Meta used National PTA to promote child safety efforts, report finds - CNBC",CNBC
"Tue, 26 Aug 2025 09:00:00 GMT",Meta scoops up talent from Google DeepMind and Scale AI for its all-star superintelligence team - Business Insider,Business Insider
"Sun, 31 Aug 2025 03:31:34 GMT",Google and Meta unveil Major AI Partnerships with Reliance Industries - The Indian EYE,The Indian EYE
"Fri, 29 Aug 2025 13:43:07 GMT",Meta Connect Agenda All But Confirms A Smart Glasses SDK - UploadVR,UploadVR
"Sat, 30 Aug 2025 23:03:13 GMT",Sector ETF performance correlation with META - July 2025 WrapUp & Expert Curated Trade Setup Alerts - Newser,Newser
"Sat, 30 Aug 2025 19:03:17 GMT","Meta created flirty chatbots using characteristics of Taylor Swift, Selena Gomez and others without consent - NME",NME
"Sat, 30 Aug 2025 08:48:34 GMT",Meta updates its chatbots to block sensitive and romantic conversations with teens - the-decoder.com,the-decoder.com
"Fri, 29 Aug 2025 12:07:29 GMT",Meta's superintelligence hires left for OpenAI after only a few weeks - the-decoder.com,the-decoder.com
"Thu, 28 Aug 2025 14:37:11 GMT",Constellation-Meta agreement ensures future of Clinton plant - American Nuclear Society,American Nuclear Society
"Thu, 28 Aug 2025 18:06:45 GMT","Meta's Zuckerberg pressed Trump on digital taxes before tariff threat, Bloomberg News reports - Reuters",Reuters
"Thu, 28 Aug 2025 00:45:00 GMT","Meta’s move to Louisiana: Good for the state, and a big win for Entergy customers - Entergy",Entergy
"Sat, 30 Aug 2025 08:10:00 GMT","Meta Platforms and Apple Just Gave This Fellow ""Magnificent Seven"" Stock Great News - Yahoo Finance",Yahoo Finance
"Sun, 31 Aug 2025 01:52:07 GMT","Flirty Meta AI chatbots impersonated Taylor Swift, Selena Gomez, Scarlett Johansson and others, made sexual advances - Mint",Mint
"Thu, 28 Aug 2025 14:05:46 GMT",Trump points to Louisiana as global AI hub with massive Meta data center - Shreveport Times,Shreveport Times
"Fri, 29 Aug 2025 20:45:53 GMT",This tech giant just surpassed Instagram parent Meta for the first time - TheStreet,TheStreet
"Fri, 29 Aug 2025 18:24:18 GMT",Meta is re-training its AI so it won't discuss self-harm or have romantic conversations with teens - Engadget,Engadget
"Fri, 29 Aug 2025 11:05:01 GMT",Is Meta Platforms Stock Outperforming The Nasdaq? - Barchart.com,Barchart.com
"Fri, 29 Aug 2025 04:17:39 GMT",Meta Platforms (META) Pauses Hiring in AI Division - Yahoo Finance,Yahoo Finance
"Thu, 28 Aug 2025 16:47:00 GMT",This under-the-radar storage stock is cashing in on Meta’s AI spending - MarketWatch,MarketWatch
"Fri, 29 Aug 2025 12:53:09 GMT",Meta Platforms (META) Rose on Strong Revenue and Earnings - Yahoo Finance,Yahoo Finance
2025-08-30T15:23:25,Bernstein Calls Meta the Top Consumer AI Play With Outperform Rating,Yahoo
2025-08-30T11:30:00,Meta Platforms Pauses AI Spend. Here's Why That's a Good Thing For Investors,Yahoo
2025-08-30T10:29:00,2 Artificial Intelligence (AI) Stocks to Buy Before They Soar Under President Trump,Yahoo
2025-08-30T10:10:00,"Meta Platforms and Apple Just Gave This Fellow ""Magnificent Seven"" Stock Great News",Yahoo
2025-08-30T10:00:00,This Stock Is Crushing the S&P 500 in 2025 and Shows No Signs of Stopping,Yahoo
2025-08-30T05:42:41,Elon Musk to Meta Platforms Inc. (META) Defense over $97.4B Bid Documents for OpenAI,Yahoo
2025-08-30T03:34:05,Cracks are forming in Meta’s partnership with Scale AI,Yahoo
2025-08-30T02:03:23,"Meta's AI leaders discuss using Google, OpenAI models in apps, The Information says",Yahoo
2025-08-29T22:36:49,"Reliance Industries Strikes AI Deals With Google, Meta",Yahoo
2025-08-29T22:09:53,Meta Plans Llama 4.5 AI Model Launch This Year,Yahoo
2025-08-29T21:53:13,"Exclusive-Meta created flirty chatbots of Taylor Swift, other celebrities without permission",Yahoo
2025-08-29T21:00:00,"NVIDIA, Meta and Amazon: Top Momentum Plays in the Mag 7",Yahoo
2025-08-29T19:07:44,Meta Platforms Reportedly Seeing Some AI Hires Depart After Brief Tenures,Yahoo
2025-08-29T19:04:17,Meta updates chatbot rules to avoid inappropriate topics with teen users,Yahoo
2025-08-29T17:30:13,Why Is Meta Platforms (META) Down 2.9% Since Last Earnings Report?,Yahoo
2025-08-29T15:45:02,Here's Why Meta Platforms (META) is a Strong Growth Stock,Yahoo
2025-08-29T15:19:10,"Billionaire Ambani taps Google, Meta to build India’s AI backbone",Yahoo
2025-08-29T15:00:06,"Is Trending Stock Meta Platforms, Inc. (META) a Buy Now?",Yahoo
2025-08-29T14:53:09,Meta Platforms (META) Rose on Strong Revenue and Earnings,Yahoo
2025-08-29T13:05:01,Is Meta Platforms Stock Outperforming the Nasdaq?,Yahoo
2025-08-29T12:00:04,Zuckerberg’s AI hires disrupt Meta with swift exits and threats to leave,Yahoo
2025-08-29T11:59:00,"When You Look Back in a Few Years, You'll Wish You'd Bought These 2 ""Magnificent Seven"" Stocks",Yahoo
2025-08-29T10:59:15,Billionaire Ambani plans to take Reliance Jio public by mid-2026,Yahoo
2025-08-29T10:02:00,"Potential Stock Splits: 2 AI Stocks Up 160% and 190% in 2 Years to Buy Now, According to Wall Street",Yahoo
2025-08-29T06:20:00,Entergy Corp (ETR) Secures Approval to Support Meta’s Massive Data Center,Yahoo
2025-08-29T06:14:07,Meta Platforms (META) Pauses Hiring in AI Division,Yahoo
2025-08-28T22:38:00,This under-the-radar storage stock is cashing in on Meta’s AI spending,MarketWatch
2025-08-28T20:10:00,Meta Platforms Rides on Expanding User Base: A Sign of More Upside?,Yahoo
2025-08-28T20:06:45,"Meta's Zuckerberg pressed Trump on digital taxes before tariff threat, Bloomberg News reports",Yahoo
2025-08-28T19:49:55,Meta's Zuckerberg Lobbied Trump on Digital Taxes,Yahoo
2025-08-28T16:20:00,"Pure Storage Stock Rallies 29%. A Meta Deal Has Something to Do With It, Say Analysts.",Yahoo
2025-08-28T15:20:20,Microsoft vs. Meta: Which Stock Has Performed Better Since Trump Took Office?,Yahoo
2025-08-28T12:45:19,Trump Spills Meta's $50-Billion Secret—And Wall Street Is Asking This,Yahoo
2025-08-28T12:16:56,What Do Google's $10B Meta Cloud Deal and Recent Surge Mean for Its Shares in 2025?,Yahoo
2025-08-28T12:09:05,Is Meta Platforms Still an Opportunity After Superintelligence Labs Team Exits?,Yahoo
2025-08-28T11:00:00,Old AI is beating new AI. Here's why — and why it matters,Yahoo
2025-08-28T11:00:00,Even Nvidia Has Speed Limits,Yahoo
2025-08-28T09:20:00,Billionaires Buy 2 Monster AI Stocks Shaping the Future of Technology,Yahoo
2025-08-28T09:06:00,"Zacks Investment Ideas feature highlights: Apple, Meta Platforms and DoorDash",Yahoo
2025-08-28T05:33:33,Unpacking Q2 Earnings: Meta (NASDAQ:META) In The Context Of Other Social Networking Stocks,Yahoo
2025-08-28T05:32:32,TikTok owner ByteDance sets valuation at over $330 bln,Yahoo
2025-08-28T01:04:11,Tracking Terry Smith's Fundsmith 13F Portfolio - Q2 2025 Update,SeekingAlpha
2025-08-28T00:34:13,Meta Steps Into Politics With Big Bet on AI Policy,Yahoo
2025-08-28T00:19:15,Musk Tries to Block OpenAI From Getting Meta Docs in $97.4B Bid Fight,Yahoo
2025-08-27T22:12:08,"'More room to run' for AI-related stocks, market expert says",Yahoo
2025-08-27T20:22:35,Judge denies Meta’s request to dismiss sexual harassment lawsuit filed by early employee,Yahoo
2025-08-27T16:31:08,Nvidia stock needs 'perfect' Q2: How to trade a post-earnings dip,Yahoo
2025-08-27T16:01:10,Mark Zuckerberg's AI Bidding War: Lovable CEO Anton Osika Says 'He's Paying More For That Knowledge Than For These People',Yahoo
2025-08-30T01:58:42,"Meta’s AI Leaders Discuss Using Google, OpenAI Models in Apps",Reddit/r/StockMarket
