Date,Title,Source
2025-09-09T12:43:25Z,SaltLight Capital Management’s Updates on Its Recent Investment in Alphabet (GOOGL),Biztoc.com
2025-09-09T12:28:59Z,SaltLight Capital Management’s Updates on Its Recent Investment in Alphabet (GOOGL),Yahoo Entertainment
2025-09-09T08:18:50Z,Alphabet Inc. $GOOGL Shares Sold by Mizuho Securities USA LLC,ETF Daily News
2025-09-09T05:17:57Z,Google Stock: Why Digital Ads Are New Ballgame In Antitrust Battle,Biztoc.com
2025-09-08T21:35:25Z,Google Fined $3.45 Billion by EU in Adtech Case,Yahoo Entertainment
2025-09-08T17:33:04Z,Four Reasons To Watch Amazon Stock Now. A New Breakout Is Just One,Biztoc.com
2025-09-08T14:44:58Z,Oppenheimer Raises PT on Alphabet (GOOGL) Stock,Biztoc.com
2025-09-08T14:29:27Z,Oppenheimer Raises PT on Alphabet (GOOGL) Stock,Yahoo Entertainment
2025-09-08T10:17:26Z,Alphabet Stock Is Still a Genius Buy After Setting a New All-Time High,Biztoc.com
2025-09-08T10:05:36Z,Meet the Artificial Intelligence (AI) Stock With $368 Billion in Revenue Coming Down the Pipeline,Biztoc.com
2025-09-08T08:56:50Z,Axiom Investors LLC DE Reduces Stock Position in Alphabet Inc. $GOOGL,ETF Daily News
2025-09-08T04:01:53Z,Why Analysts See Limited Upside for Alphabet (GOOGL) Despite PT Boost,Yahoo Entertainment
2025-09-07T20:26:14Z,"Alphabet Inc. (GOOGL)’s “Bouncing Like You Wouldn’t Believe,” Says Jim Cramer",Yahoo Entertainment
2025-09-07T16:38:50Z,Sunday links: abandoning market capitalism,Biztoc.com
2025-09-06T10:12:37Z,KeyBanc Boosts Alphabet (GOOGL) PT Post DOJ Ruling,Yahoo Entertainment
2025-09-06T08:18:57Z,Wedbush Forecasts Strong Price Appreciation for Alphabet (NASDAQ:GOOGL) Stock,ETF Daily News
2025-09-06T08:18:57Z,Alphabet (NASDAQ:GOOGL) Price Target Raised to $260.00,ETF Daily News
2025-09-06T05:12:49Z,Jim Cramer on Selling Alphabet Stock for the Charitable Trust: “I Was a Fool”,Yahoo Entertainment
2025-09-05T15:47:04Z,"Google Hit With $381M Fine in France Over Gmail Ads, Cookies",Yahoo Entertainment
2025-09-05T14:21:24Z,"Nvidia Goes AWOL As Funds Feast On Broadcom, Google, Palantir — And Much More",Biztoc.com
2025-09-05T09:56:58Z,"Alphabet (NASDAQ:GOOGL) Stock Price Expected to Rise, Rosenblatt Securities Analyst Says",ETF Daily News
2025-09-05T09:56:57Z,Barclays Boosts Alphabet (NASDAQ:GOOGL) Price Target to $250.00,ETF Daily News
2025-09-05T09:56:56Z,Alphabet (NASDAQ:GOOGL) Price Target Raised to $250.00 at JMP Securities,ETF Daily News
2025-09-05T05:48:53Z,KeyCorp Increases Alphabet (NASDAQ:GOOGL) Price Target to $265.00,ETF Daily News
2025-09-05T05:15:39Z,Alphabet (NASDAQ:GOOGL) Shares Gap Up Following Analyst Upgrade,ETF Daily News
"Mon, 08 Sep 2025 04:12:00 GMT",Why Analysts See Limited Upside for Alphabet (GOOGL) Despite PT Boost - Yahoo Finance,Yahoo Finance
"Wed, 10 Sep 2025 02:46:44 GMT",GOOGL Is One of Many Bullish Stocks in XLC - Money & Markets,Money & Markets
"Wed, 10 Sep 2025 04:25:09 GMT",Alphabet Inc. $GOOGL Shares Sold by Axiom Investors LLC DE - MarketBeat,MarketBeat
"Tue, 09 Sep 2025 12:30:06 GMT",Alphabet: Nowhere Near Its Peak (NASDAQ:GOOGL) - Seeking Alpha,Seeking Alpha
"Mon, 08 Sep 2025 17:33:00 GMT",Alphabet Inc. Stock (GOOGL) Opinions on Favorable Chrome Antitrust Ruling - Quiver Quantitative,Quiver Quantitative
"Mon, 08 Sep 2025 15:08:53 GMT",Oppenheimer Raises PT on Alphabet (GOOGL) Stock - MSN,MSN
"Mon, 08 Sep 2025 12:43:09 GMT",Google (GOOGL): Taking Stock of Its Valuation Following Recent Share Price Momentum - simplywall.st,simplywall.st
"Tue, 09 Sep 2025 19:04:10 GMT","Bank of America Reiterates Buy on Alphabet (GOOGL), Calls It Apple’s Logical Search Partner - Yahoo Finance",Yahoo Finance
"Wed, 10 Sep 2025 02:21:55 GMT",Tigress Financial Forecasts Strong Price Appreciation for Alphabet (NASDAQ:GOOGL) Stock - MarketBeat,MarketBeat
"Sun, 07 Sep 2025 20:26:14 GMT","Alphabet Inc. (GOOGL)’s “Bouncing Like You Wouldn’t Believe,” Says Jim Cramer - Yahoo Finance",Yahoo Finance
"Tue, 09 Sep 2025 23:11:42 GMT",Alphabet Inc. $GOOGL Shares Acquired by NewEdge Advisors LLC - MarketBeat,MarketBeat
"Tue, 09 Sep 2025 12:28:59 GMT",SaltLight Capital Management’s Updates on Its Recent Investment in Alphabet (GOOGL) - Yahoo Finance,Yahoo Finance
"Tue, 09 Sep 2025 22:21:14 GMT",Alphabet Inc. $GOOGL Shares Purchased by Integrated Wealth Concepts LLC - MarketBeat,MarketBeat
"Tue, 09 Sep 2025 22:30:00 GMT",Alphabet Inc. $GOOGL Shares Acquired by Petrus Trust Company LTA - MarketBeat,MarketBeat
"Tue, 09 Sep 2025 11:54:37 GMT",Can Google’s (GOOGL) New Defense Pilot Reveal the True Depth of Its Government Ambitions? - Yahoo Finance,Yahoo Finance
"Sat, 06 Sep 2025 10:12:37 GMT",KeyBanc Boosts Alphabet (GOOGL) PT Post DOJ Ruling - Yahoo Finance,Yahoo Finance
"Sat, 06 Sep 2025 15:54:50 GMT","Alphabet Inc. (GOOGL) CEO Could’ve Said He’s Not Happy With Antitrust Lawsuit Outcome, Says Jim Cramer - Yahoo Finance",Yahoo Finance
"Tue, 09 Sep 2025 19:20:53 GMT","Bank of America Reiterates Buy on Alphabet (GOOGL), Calls It Apple’s Logical Search Partner - MSN",MSN
"Tue, 09 Sep 2025 15:21:39 GMT",JMP Reiterates Bullish Stance on Alphabet (GOOGL) With $225 Price Target - MSN,MSN
"Tue, 09 Sep 2025 12:30:13 GMT",Meiji Yasuda Asset Management Co Ltd. Lowers Stake in Alphabet Inc. $GOOGL - MarketBeat,MarketBeat
"Tue, 09 Sep 2025 12:35:58 GMT","Ascent Group LLC Acquires 23,638 Shares of Alphabet Inc. $GOOGL - MarketBeat",MarketBeat
"Tue, 09 Sep 2025 14:39:35 GMT",Cantor Fitzgerald Reaffirms Their Hold Rating on Alphabet Class A (GOOGL) - The Globe and Mail,The Globe and Mail
"Tue, 09 Sep 2025 11:45:42 GMT","Hamilton Capital LLC Acquires 1,341 Shares of Alphabet Inc. $GOOGL - MarketBeat",MarketBeat
"Tue, 09 Sep 2025 04:11:58 GMT",(09/09/25) META & GOOGL: Beneficiaries of Strong Digital Ad Growth - moneyshow.com,moneyshow.com
"Tue, 09 Sep 2025 12:03:45 GMT",Arete Wealth Advisors LLC Decreases Stock Position in Alphabet Inc. $GOOGL - MarketBeat,MarketBeat
"Tue, 09 Sep 2025 13:01:01 GMT","Meiji Yasuda Life Insurance Co Sells 8,472 Shares of Alphabet Inc. $GOOGL - MarketBeat",MarketBeat
"Tue, 09 Sep 2025 19:27:00 GMT","Noteworthy Tuesday Option Activity: ALK, GOOGL, AMZN - Nasdaq",Nasdaq
"Tue, 09 Sep 2025 10:59:24 GMT","Sciencast Management LP Acquires 17,568 Shares of Alphabet Inc. $GOOGL - MarketBeat",MarketBeat
"Tue, 09 Sep 2025 11:46:23 GMT",Caxton Associates LLP Invests $9.43 Million in Alphabet Inc. $GOOGL - MarketBeat,MarketBeat
"Tue, 09 Sep 2025 11:47:30 GMT",Great Lakes Advisors LLC Grows Holdings in Alphabet Inc. $GOOGL - MarketBeat,MarketBeat
"Tue, 09 Sep 2025 07:00:00 GMT","Rockport Wealth LLC Buys Shares of 77,027 Alphabet Inc. $GOOGL - MarketBeat",MarketBeat
"Fri, 05 Sep 2025 16:37:00 GMT",RDDT vs. GOOGL: Which Ad-Tech Powerhouse Stock Has Greater Upside? - Nasdaq,Nasdaq
"Tue, 09 Sep 2025 07:00:00 GMT",Alphabet Inc. $GOOGL Shares Acquired by Plancorp LLC - MarketBeat,MarketBeat
"Mon, 08 Sep 2025 21:02:59 GMT",Amazon Stock vs Alphabet Google Stock: NASDAQ:AMZN and NASDAQ:GOOGL Face Off on AI and Cloud Growth - tradingnews.com,tradingnews.com
"Tue, 09 Sep 2025 13:07:58 GMT",Vancity Investment Management Ltd Buys New Holdings in Alphabet Inc. $GOOGL - MarketBeat,MarketBeat
"Fri, 05 Sep 2025 15:33:45 GMT",GOOGL Rises on Favorable Antitrust Ruling: Buy or Hold the Stock? - Zacks Investment Research,Zacks Investment Research
"Tue, 09 Sep 2025 13:26:44 GMT",Is GOOGL impacted by rising rates - July 2025 Chart Watch & Fast Gaining Stock Reports - Lancaster City Council,Lancaster City Council
"Tue, 09 Sep 2025 07:00:00 GMT",Alphabet Inc. $GOOGL Stake Increased by Pershing Square Capital Management L.P. - MarketBeat,MarketBeat
"Mon, 08 Sep 2025 10:47:40 GMT",Alphabet Inc. $GOOGL is Unio Capital LLC's 6th Largest Position - MarketBeat,MarketBeat
"Mon, 08 Sep 2025 11:56:20 GMT",Sender Co & Partners Inc. Purchases New Stake in Alphabet Inc. $GOOGL - MarketBeat,MarketBeat
"Mon, 08 Sep 2025 12:10:09 GMT","Laidlaw Wealth Management LLC Sells 2,125 Shares of Alphabet Inc. $GOOGL - MarketBeat",MarketBeat
"Mon, 08 Sep 2025 10:47:40 GMT",Alphabet Inc. $GOOGL is Trybe Capital Management LP's 2nd Largest Position - MarketBeat,MarketBeat
"Mon, 08 Sep 2025 07:00:00 GMT",Direxion Daily GOOGL Bull 2X Shares (NASDAQ:GGLL) Reaches New 12-Month High - Here's What Happened - MarketBeat,MarketBeat
"Mon, 08 Sep 2025 11:38:14 GMT","Knightsbridge Asset Management LLC Sells 3,648 Shares of Alphabet Inc. $GOOGL - MarketBeat",MarketBeat
"Mon, 08 Sep 2025 10:34:23 GMT",Alphabet Inc. $GOOGL is UniSuper Management Pty Ltd's 7th Largest Position - MarketBeat,MarketBeat
"Mon, 08 Sep 2025 13:13:45 GMT","Resources Management Corp CT ADV Acquires 3,094 Shares of Alphabet Inc. $GOOGL - MarketBeat",MarketBeat
"Mon, 08 Sep 2025 10:32:25 GMT",Guardian Partners Inc. Has $7.72 Million Position in Alphabet Inc. $GOOGL - MarketBeat,MarketBeat
"Mon, 08 Sep 2025 11:24:50 GMT","Talon Private Wealth LLC Sells 1,853 Shares of Alphabet Inc. $GOOGL - MarketBeat",MarketBeat
"Mon, 08 Sep 2025 14:16:28 GMT","Nvidia’s Closest Friends Just Got Cozy With Google - Alphabet (NASDAQ:GOOGL), NVIDIA (NASDAQ:NVDA) - Benzinga",Benzinga
"Mon, 08 Sep 2025 07:18:45 GMT",Alphabet Inc. $GOOGL Shares Acquired by Ancora Advisors LLC - MarketBeat,MarketBeat
"Mon, 08 Sep 2025 10:36:42 GMT","Dynamic Technology Lab Private Ltd Purchases Shares of 6,306 Alphabet Inc. $GOOGL - MarketBeat",MarketBeat
"Mon, 08 Sep 2025 07:00:00 GMT",Chescapmanager LLC Cuts Holdings in Alphabet Inc. $GOOGL - MarketBeat,MarketBeat
"Mon, 08 Sep 2025 10:47:40 GMT","First Dallas Securities Inc. Acquires 4,796 Shares of Alphabet Inc. $GOOGL - MarketBeat",MarketBeat
"Tue, 09 Sep 2025 09:32:40 GMT",BIDU vs. GOOGL: Which AI Search Giant Has Better Investment Potential? - MSN,MSN
"Sun, 07 Sep 2025 07:00:00 GMT",Royal Bank Of Canada Issues Positive Forecast for Alphabet (NASDAQ:GOOGL) Stock Price - MarketBeat,MarketBeat
"Mon, 08 Sep 2025 10:59:01 GMT",Voleon Capital Management LP Has $50.20 Million Stake in Alphabet Inc. $GOOGL - MarketBeat,MarketBeat
"Fri, 05 Sep 2025 13:01:31 GMT",BIDU vs. GOOGL: Which AI Search Giant Has Better Investment Potential? - Zacks Investment Research,Zacks Investment Research
"Mon, 08 Sep 2025 17:17:23 GMT","What's Going On With Qualcomm Stock Monday? - Alphabet (NASDAQ:GOOGL), Qualcomm (NASDAQ:QCOM) - Benzinga",Benzinga
"Mon, 08 Sep 2025 10:32:25 GMT","Ashton Thomas Private Wealth LLC Acquires 8,013 Shares of Alphabet Inc. $GOOGL - MarketBeat",MarketBeat
"Mon, 08 Sep 2025 20:43:06 GMT",Alphabet Google Stock Price Forecast - Shares Surges on DOJ Win and $2.83T Market Cap - tradingnews.com,tradingnews.com
"Fri, 05 Sep 2025 19:36:55 GMT","Alphabet Google Stock Forecast – AI and Antitrust Win Fuel Growth , GOOGL Eyes $280 - tradingnews.com",tradingnews.com
"Mon, 08 Sep 2025 07:00:00 GMT",Alphabet (NASDAQ:GOOGL) Shares Down 1.2% - What's Next? - MarketBeat,MarketBeat
"Fri, 05 Sep 2025 18:26:52 GMT","SA analyst upgrades/downgrades: PLTR, GOOGL, LULU, and BEKE - Seeking Alpha",Seeking Alpha
"Mon, 08 Sep 2025 07:00:00 GMT",Alphabet (NASDAQ:GOOGL) Price Target Raised to $270.00 at Canaccord Genuity Group - MarketBeat,MarketBeat
"Mon, 08 Sep 2025 18:12:07 GMT",Google Meet Outage Reported: What To Know - Benzinga,Benzinga
"Fri, 05 Sep 2025 21:58:45 GMT",Alphabet CEO Pichai Sundar sells $7.4m in GOOGL stock - Investing.com,Investing.com
"Sun, 07 Sep 2025 07:00:00 GMT","15,166 Shares in Alphabet Inc. $GOOGL Acquired by Trexquant Investment LP - MarketBeat",MarketBeat
"Sun, 07 Sep 2025 17:14:22 GMT",Google (GOOGL) Stock: EU Slaps $3.45 Billion Fine on Tech Giant Over Ad Practices - CoinCentral,CoinCentral
"Sat, 06 Sep 2025 09:49:52 GMT",Alphabet Stock (GOOGL) Advances Despite Trump Defying $3.4B EU Fine - MSN,MSN
"Sun, 07 Sep 2025 07:00:00 GMT",Alphabet (NASDAQ:GOOGL) Given New $245.00 Price Target at Wedbush - MarketBeat,MarketBeat
"Sun, 07 Sep 2025 07:00:00 GMT","Alphabet (NASDAQ:GOOGL) Stock Price Expected to Rise, KeyCorp Analyst Says - MarketBeat",MarketBeat
"Sun, 07 Sep 2025 07:00:00 GMT",Needham & Company LLC Issues Positive Forecast for Alphabet (NASDAQ:GOOGL) Stock Price - MarketBeat,MarketBeat
"Fri, 05 Sep 2025 23:31:46 GMT",Alphabet Stock (GOOGL) Gears Up for New Highs After Clearing Antitrust Hurdle - TipRanks,TipRanks
"Sun, 07 Sep 2025 07:00:00 GMT",Alphabet (NASDAQ:GOOGL) Stock Price Up 9% on Analyst Upgrade - MarketBeat,MarketBeat
"Sun, 07 Sep 2025 07:00:00 GMT",Alphabet (NASDAQ:GOOGL) Shares Gap Up After Analyst Upgrade - MarketBeat,MarketBeat
"Sat, 06 Sep 2025 16:07:30 GMT",Paragon Private Wealth Management LLC Grows Position in Alphabet Inc. $GOOGL - MarketBeat,MarketBeat
"Sat, 06 Sep 2025 16:07:30 GMT",Adage Capital Partners GP L.L.C. Lowers Holdings in Alphabet Inc. $GOOGL - MarketBeat,MarketBeat
"Sat, 06 Sep 2025 16:07:30 GMT","Atreides Management LP Sells 254,544 Shares of Alphabet Inc. $GOOGL - MarketBeat",MarketBeat
"Fri, 05 Sep 2025 17:07:48 GMT",Alphabet Stock (GOOGL) Advances Despite Trump-Defying $3.4B EU Fine - TipRanks,TipRanks
"Sat, 06 Sep 2025 00:45:00 GMT",Alphabet Inc. $GOOGL Stock Holdings Reduced by Flputnam Investment Management Co. - MarketBeat,MarketBeat
"Mon, 08 Sep 2025 23:17:59 GMT",Google (GOOGL.US) is once again embroiled in an antitrust controversy! It is being sued by the advertising trading platform PubMatic for damages amounting to billions of dollars. - 富途牛牛,富途牛牛
"Sat, 06 Sep 2025 16:07:30 GMT",Barclays Issues Positive Forecast for Alphabet (NASDAQ:GOOGL) Stock Price - MarketBeat,MarketBeat
"Sat, 06 Sep 2025 16:07:30 GMT",Alphabet (NASDAQ:GOOGL) Given New $250.00 Price Target at JMP Securities - MarketBeat,MarketBeat
"Sat, 06 Sep 2025 16:07:30 GMT",Rosenblatt Securities Issues Positive Forecast for Alphabet (NASDAQ:GOOGL) Stock Price - MarketBeat,MarketBeat
"Sat, 06 Sep 2025 16:07:30 GMT",Alphabet (NASDAQ:GOOGL) Price Target Raised to $190.00 - MarketBeat,MarketBeat
"Sat, 06 Sep 2025 16:07:30 GMT",Alphabet (NASDAQ:GOOGL) Hits New 1-Year High on Analyst Upgrade - MarketBeat,MarketBeat
"Sat, 06 Sep 2025 07:00:00 GMT",Alphabet (NASDAQ:GOOGL) Shares Down 2.4% - Here's Why - MarketBeat,MarketBeat
"Fri, 05 Sep 2025 18:07:54 GMT",Alphabet’s (GOOGL) Google Fined €2.95B by EU in Latest Antitrust Crackdown - TipRanks,TipRanks
"Fri, 05 Sep 2025 15:11:52 GMT",BIDU vs. GOOGL: Which AI Search Giant Has Better Investment Potential? - sharewise.com,sharewise.com
"Fri, 05 Sep 2025 07:00:00 GMT",1248 Management LLC Cuts Position in Alphabet Inc. $GOOGL - MarketBeat,MarketBeat
"Fri, 05 Sep 2025 07:39:48 GMT",Waymo receives permit to operate at San Jose airport (GOOGL:NASDAQ) - Seeking Alpha,Seeking Alpha
"Fri, 05 Sep 2025 07:00:00 GMT",First Manhattan CO. LLC. Cuts Stock Position in Alphabet Inc. $GOOGL - MarketBeat,MarketBeat
"Tue, 09 Sep 2025 18:38:37 GMT","SA analyst upgrades/downgrades: PLTR, GOOGL, LULU, and BEKE - MSN",MSN
"Sat, 06 Sep 2025 12:46:24 GMT",Alphabet (GOOGL) Outlook: Analysts See Google TPUs as Strong NVIDIA Alternative - MSN,MSN
"Fri, 05 Sep 2025 18:03:04 GMT",Technical Analysis: Is GOOGL impacted by rising rates - Quarterly Profit Review & Momentum Based Trading Ideas - خودرو بانک,خودرو بانک
2025-09-09T17:36:41,Alphabet Inc. (GOOGL) Presents At Goldman Sachs Communacopia + Technology Conference (Transcript),SeekingAlpha
2025-09-09T10:30:06,Alphabet: Nowhere Near Its Peak,SeekingAlpha
2025-09-09T06:21:00,OpenAI Helps Google Win in Court,Yahoo
2025-09-09T00:35:25,Google Fined $3.45 Billion by EU in Adtech Case,Yahoo
2025-09-09T00:29:00,"Technical Interview Preparation Course For Software Engineers and Engineering Managers - Interview Kickstart's Roadmap to Google, Meta & Amazon Jobs in 2025 and Top Tech Salaries",Yahoo
2025-09-09T00:06:09,Google Meet outage disrupts thousands of users worldwide,Yahoo
2025-09-08T23:19:51,How to make Quartz a 'preferred source' in Google,Yahoo
2025-09-08T23:13:00,BEAUTY'S BIG SHAKE-UP: ICED MEDIA LAUNCHES SEARCH; TAPS VET EMILY ROSE CAMPBELL!,Yahoo
2025-09-08T21:46:10,"Google’s AI Mode adds 5 new languages including Hindi, Japanese, and Korean",Yahoo
2025-09-08T20:17:23,Qualcomm And Google Cloud Forge AI Alliance To Transform Cars Into Smart Agents,Yahoo
2025-09-08T20:10:07,"SpaceX & EchoStar $17B deal, PubMatic sues Google, CVS down",Yahoo
2025-09-08T18:01:05,"Alphabet: With DOJ Trial Behind Us, Maintain Strong Buy From Here",SeekingAlpha
2025-09-08T16:01:00,PubMatic Files Lawsuit Against Google to Restore Fair Competition and Innovation in Digital Advertising,Yahoo
2025-09-08T16:00:00,"WellSky® Expands AI Partnership With Google Cloud to Transform Post-Acute, Acute, and Community Care",Yahoo
2025-09-08T15:30:00,Qualcomm and Google Cloud Deepen Collaboration to Bring Agentic AI Experiences to the Auto Industry,Yahoo
2025-09-08T15:13:23,Google Stock: Why Digital Ads Are New Ballgame In Antitrust Battle,Yahoo
2025-09-08T14:53:56,British ‘Iron Dome’ technology backed by fund tied to Google billionaire,Yahoo
2025-09-08T13:41:26,Trump goes to bat for Google with the EU,Yahoo
2025-09-08T07:03:45,Why TD Cowen Stays Bullish on Apple (AAPL) Stock at $275 PT,Yahoo
2025-09-06T03:46:00,Trump Threatens More Tariffs Against EU After Google Fine,Yahoo
2025-09-06T00:57:55,Trump Threatens Trade Actions After EU Fines Google Over Ads,Yahoo
2025-09-06T00:32:00,Google Fined $3.5 Billion by EU Over Ad-Tech Business,Yahoo
2025-09-06T00:10:29,Trump lashes out at EU over Google fine and threatens tariff probe,Yahoo
2025-09-05T23:11:31,"Big Tech Titans Including Nvidia, Google And Bill Gates Back $863 Million Bet On Nuclear Fusion As Next Energy Revolution",Yahoo
2025-09-05T23:11:00,Trump threatens Brussels with tariffs over $3.5bn Google fine,Yahoo
2025-09-05T23:06:18,Trump threatens EU with tariff investigation after Google hit with $3.45 billion antitrust fine,Yahoo
2025-09-05T22:38:55,Trump Threatens Higher Tariffs Over EU Fine Against Google,Yahoo
2025-09-05T22:09:12,Google Gemini dubbed ‘high risk’ for kids and teens in new safety assessment,Yahoo
2025-09-05T21:39:30,"Google fined $3.5B, Kenvue sinks, Lululemon: Trending Tickers",Yahoo
2025-09-05T17:23:42,"Stock Market Hits New Highs On Google, Broadcom, Jobs Report: Weekly Review",Yahoo
2025-09-05T17:08:33,"Apple Inc. (AAPL): China’s The “Wildcard,” Says Jim Cramer",Yahoo
2025-09-05T15:50:51,"Quantum Startup IQM Raises $320 Million, Hits Unicorn Status",Yahoo
2025-09-05T15:16:00,Google’s Legal Problems Aren’t Over. Here Are 3 Overlooked Antitrust Risks.,Yahoo
2025-09-05T15:00:34,"Nvidia Goes AWOL As Funds Feast On Broadcom, Google, Palantir — And Much More",Yahoo
2025-09-05T14:00:00,Is Google Developing an XRP Killer?,Yahoo
2025-09-05T13:57:00,"Apple, Meta, Google CEOs Dined With Trump. Where AI Trade Goes From Here.",Yahoo
2025-09-05T13:10:02,Alphabet Within Striking Range of $3 Trillion as Key Risk Clears,Yahoo
2025-09-10T09:41:30Z,Google Cloud Expects Over 50% Of Its $106 Billion Backlog To Convert To Revenue In The Next Two Years,Benzinga
2025-09-09T16:00:00Z,XM Cyber Delivers Innovative Security Solutions for Digital Resilience with Google Cloud,GlobeNewswire Inc.
2025-09-09T03:21:00Z,OpenAI Helps Google Win in Court,The Motley Fool
2025-09-08T21:29:00Z,"Technical Interview Preparation Course For Software Engineers and Engineering Managers - Interview Kickstart's Roadmap to Google, Meta & Amazon Jobs in 2025 and Top Tech Salaries",GlobeNewswire Inc.
2025-09-08T18:12:07Z,Google Meet Outage Reported: What To Know,Benzinga
2025-09-08T10:00:00Z,MEXC Supports Apple Pay and Google Pay with 100% Fee Cashback Celebration Event,GlobeNewswire Inc.
2025-09-07T18:15:54Z,"Europe Slaps $3.5 Billion Fine On Google, Donald Trump Says Money Could Instead Go To American Investments and Jobs",Benzinga
2025-09-05T17:41:00Z,Pixalate Research Finds 253 EU & UK-Registered Mobile Apps Likely Violating GDPR-K & UK Children's Code: Apple App Store & Google Play Store Apps Endangering Privacy Rights of 104M+ Children Across Europe,GlobeNewswire Inc.
2025-09-05T13:14:47Z,Should Nvidia Stock Investors Be Worried About Recent Amazon and Google News?,The Motley Fool
2025-09-09T20:05:27,[Reuters] Google Cloud anticipates at least $58 billion revenue boost over next two years,Reddit/r/StockMarket
2025-09-08T14:20:14,"Companies in the EU are starting to look for ways to ditch Amazon, Google, and Microsoft cloud services. How real is this shift?",Reddit/r/stocks
2025-09-06T05:26:58,Lost 50k on Google.,Reddit/r/wallstreetbets
2025-09-05T21:26:23,"Trump threatens trade probe after ‘discriminatory’ EU fines against Google, Apple.",Reddit/r/stocks
