Date,Title,Source
"Tue, 16 Sep 2025 05:14:05 GMT","Swedbank AB Has $465.41 Million Stake in Cisco Systems, Inc. $CSCO - MarketBeat",MarketBeat
"Mon, 15 Sep 2025 15:20:11 GMT",Cisco-backed Cohere announces European expansion with Paris office (CSCO:NASDAQ) - Seeking Alpha,Seeking Alpha
"Sun, 14 Sep 2025 07:00:00 GMT",IT Services & Other Tech Stocks Q2 Recap: Benchmarking Cisco (NASDAQ:CSCO) - Yahoo Finance,Yahoo Finance
"Mon, 15 Sep 2025 15:07:00 GMT",Interesting CSCO Put And Call Options For January 2028 - Nasdaq,Nasdaq
"Tue, 16 Sep 2025 05:14:03 GMT","Cisco Systems, Inc. $CSCO Shares Sold by Pensionfund Sabic - MarketBeat",MarketBeat
"Fri, 12 Sep 2025 13:00:05 GMT","Cisco Systems, Inc. (CSCO) Is a Trending Stock: Facts to Know Before Betting on It - Yahoo Finance",Yahoo Finance
"Fri, 12 Sep 2025 15:30:00 GMT",Cisco (CSCO) Down 2.3% Since Last Earnings Report: Can It Rebound? - Nasdaq,Nasdaq
"Tue, 16 Sep 2025 05:09:09 GMT","Geneos Wealth Management Inc. Purchases 4,722 Shares of Cisco Systems, Inc. $CSCO - MarketBeat",MarketBeat
"Tue, 16 Sep 2025 05:14:09 GMT",Insider Selling: Cisco Systems (NASDAQ:CSCO) SVP Sells 428 Shares of Stock - MarketBeat,MarketBeat
"Tue, 16 Sep 2025 04:10:06 GMT","Deborah L. Stahlkopf Sells 2,718 Shares of Cisco Systems (NASDAQ:CSCO) Stock - MarketBeat",MarketBeat
"Tue, 16 Sep 2025 05:09:15 GMT","Guinness Asset Management LTD Lowers Stock Position in Cisco Systems, Inc. $CSCO - MarketBeat",MarketBeat
"Tue, 16 Sep 2025 05:14:09 GMT","McAdam LLC Has $454,000 Stock Holdings in Cisco Systems, Inc. $CSCO - MarketBeat",MarketBeat
"Mon, 15 Sep 2025 21:25:20 GMT","Thimaya Subaiya Sells 1,744 Shares of Cisco Systems (NASDAQ:CSCO) Stock - MarketBeat",MarketBeat
"Mon, 15 Sep 2025 10:31:39 GMT","Webster Bank N. A. Sells 8,724 Shares of Cisco Systems, Inc. $CSCO - MarketBeat",MarketBeat
"Mon, 15 Sep 2025 09:26:45 GMT","Cisco Systems, Inc. $CSCO Shares Sold by Mirabaud & Cie SA - MarketBeat",MarketBeat
"Mon, 15 Sep 2025 10:39:53 GMT","Cisco Systems, Inc. $CSCO Stock Position Increased by Martin Capital Partners LLC - MarketBeat",MarketBeat
"Mon, 15 Sep 2025 09:50:41 GMT","Cisco Systems, Inc. $CSCO Shares Sold by Adams Asset Advisors LLC - MarketBeat",MarketBeat
"Mon, 15 Sep 2025 11:30:32 GMT","Northstar Advisory Group LLC Has $575,000 Stake in Cisco Systems, Inc. $CSCO - MarketBeat",MarketBeat
"Mon, 15 Sep 2025 11:21:14 GMT","Arlington Trust Co LLC Acquires 3,911 Shares of Cisco Systems, Inc. $CSCO - MarketBeat",MarketBeat
"Sat, 13 Sep 2025 19:02:33 GMT",Did New AI and IoT Launches Just Shift Cisco Systems' (CSCO) Investment Narrative? - simplywall.st,simplywall.st
"Mon, 15 Sep 2025 09:17:56 GMT","Parallel Advisors LLC Grows Stock Position in Cisco Systems, Inc. $CSCO - MarketBeat",MarketBeat
"Mon, 15 Sep 2025 09:45:03 GMT","Legacy Private Trust Co. Cuts Position in Cisco Systems, Inc. $CSCO - MarketBeat",MarketBeat
"Mon, 15 Sep 2025 08:59:44 GMT","Douglas Lane & Associates LLC Lowers Stake in Cisco Systems, Inc. $CSCO - MarketBeat",MarketBeat
"Sun, 14 Sep 2025 10:04:46 GMT","Park National Corp OH Cuts Stock Position in Cisco Systems, Inc. $CSCO - MarketBeat",MarketBeat
"Sun, 14 Sep 2025 14:03:45 GMT","Cisco Systems, Inc. $CSCO Shares Acquired by Acadian Asset Management LLC - MarketBeat",MarketBeat
"Sun, 14 Sep 2025 11:03:00 GMT","InvesTrust Decreases Position in Cisco Systems, Inc. $CSCO - MarketBeat",MarketBeat
"Sun, 14 Sep 2025 07:00:00 GMT","Intech Investment Management LLC Trims Stake in Cisco Systems, Inc. $CSCO - MarketBeat",MarketBeat
"Sun, 14 Sep 2025 07:00:00 GMT","Belpointe Asset Management LLC Purchases 26,455 Shares of Cisco Systems, Inc. $CSCO - MarketBeat",MarketBeat
"Sun, 14 Sep 2025 11:13:03 GMT","Sage Capital Advisors llc Sells 13,649 Shares of Cisco Systems, Inc. $CSCO - MarketBeat",MarketBeat
"Sun, 14 Sep 2025 10:26:48 GMT","Jacobs & Co. CA Sells 6,898 Shares of Cisco Systems, Inc. $CSCO - MarketBeat",MarketBeat
"Sun, 14 Sep 2025 10:04:45 GMT","Cisco Systems, Inc. $CSCO Stock Holdings Lowered by Confluence Investment Management LLC - MarketBeat",MarketBeat
"Sun, 14 Sep 2025 14:03:45 GMT","Fortis Capital Advisors LLC Invests $1.29 Million in Cisco Systems, Inc. $CSCO - MarketBeat",MarketBeat
"Sun, 14 Sep 2025 07:00:00 GMT","Glenview Trust co Sells 14,899 Shares of Cisco Systems, Inc. $CSCO - MarketBeat",MarketBeat
"Sun, 14 Sep 2025 10:41:09 GMT","Cisco Systems, Inc. $CSCO Shares Acquired by Wesbanco Bank Inc. - MarketBeat",MarketBeat
"Sun, 14 Sep 2025 07:00:00 GMT","Ransom Advisory Ltd Invests $2.73 Million in Cisco Systems, Inc. $CSCO - MarketBeat",MarketBeat
"Sun, 14 Sep 2025 07:00:00 GMT","Focus Partners Wealth Sells 171,250 Shares of Cisco Systems, Inc. $CSCO - MarketBeat",MarketBeat
"Sun, 14 Sep 2025 07:00:00 GMT","Ilmarinen Mutual Pension Insurance Co Grows Position in Cisco Systems, Inc. $CSCO - MarketBeat",MarketBeat
"Mon, 15 Sep 2025 23:21:55 GMT",Update Report: Will CSCO stock benefit from M A - Portfolio Return Report & Daily Entry Point Trade Alerts - خودرو بانک,خودرو بانک
"Fri, 12 Sep 2025 00:01:00 GMT",Insider Sale: SVP & Chief Acctg Officer of $CSCO Sells 428 Shares - Quiver Quantitative,Quiver Quantitative
"Sat, 13 Sep 2025 07:00:00 GMT","Cisco Systems, Inc. $CSCO Shares Bought by Woodline Partners LP - MarketBeat",MarketBeat
"Sat, 13 Sep 2025 07:00:00 GMT","Empowered Funds LLC Buys 35,337 Shares of Cisco Systems, Inc. $CSCO - MarketBeat",MarketBeat
"Sat, 13 Sep 2025 07:00:00 GMT","Cisco Systems, Inc. $CSCO Shares Sold by Logan Capital Management Inc. - MarketBeat",MarketBeat
"Sat, 13 Sep 2025 02:37:30 GMT","RNC Capital Management LLC Sells 4,615 Shares of Cisco Systems, Inc. $CSCO - MarketBeat",MarketBeat
"Sat, 13 Sep 2025 07:00:00 GMT","HFM Investment Advisors LLC Makes New Investment in Cisco Systems, Inc. $CSCO - MarketBeat",MarketBeat
"Fri, 12 Sep 2025 19:07:30 GMT","Fred Alger Management LLC Acquires 39,161 Shares of Cisco Systems, Inc. $CSCO - MarketBeat",MarketBeat
"Tue, 16 Sep 2025 00:42:51 GMT",Entry Recap: What is the cash position of CSCO - Jobs Report & Safe Entry Zone Identification - خودرو بانک,خودرو بانک
"Fri, 12 Sep 2025 07:00:00 GMT","57,711 Shares in Cisco Systems, Inc. $CSCO Acquired by Sciencast Management LP - MarketBeat",MarketBeat
"Fri, 12 Sep 2025 07:00:00 GMT","Coppell Advisory Solutions LLC Raises Holdings in Cisco Systems, Inc. $CSCO - MarketBeat",MarketBeat
"Fri, 12 Sep 2025 07:00:00 GMT","602,881 Shares in Cisco Systems, Inc. $CSCO Acquired by Caxton Associates LLP - MarketBeat",MarketBeat
"Fri, 12 Sep 2025 13:00:05 GMT","Cisco Systems, Inc. (CSCO) Is a Trending Stock: Facts to Know Before Betting on It - sharewise.com",sharewise.com
"Thu, 11 Sep 2025 07:00:00 GMT","Ascent Group LLC Increases Stock Holdings in Cisco Systems, Inc. $CSCO - MarketBeat",MarketBeat
"Thu, 11 Sep 2025 14:58:00 GMT","VIG, COST, PG, CSCO: ETF Inflow Alert - Nasdaq",Nasdaq
"Thu, 11 Sep 2025 07:00:00 GMT","Kestra Investment Management LLC Raises Position in Cisco Systems, Inc. $CSCO - MarketBeat",MarketBeat
"Thu, 11 Sep 2025 07:00:00 GMT","USS Investment Management Ltd Decreases Stock Position in Cisco Systems, Inc. $CSCO - MarketBeat",MarketBeat
"Thu, 11 Sep 2025 07:00:00 GMT","UniSuper Management Pty Ltd Raises Stake in Cisco Systems, Inc. $CSCO - MarketBeat",MarketBeat
"Thu, 11 Sep 2025 07:00:00 GMT","CTC Alternative Strategies Ltd. Purchases Shares of 8,150 Cisco Systems, Inc. $CSCO - MarketBeat",MarketBeat
"Thu, 11 Sep 2025 07:00:00 GMT","Sepio Capital LP Cuts Stake in Cisco Systems, Inc. $CSCO - MarketBeat",MarketBeat
"Mon, 15 Sep 2025 17:06:58 GMT",Identifying reversal signals in CSCO - 2025 Earnings Surprises & Verified Entry Point Signals - newser.com,newser.com
"Mon, 15 Sep 2025 11:04:10 GMT",Is this a good reentry point in CSCO - Rate Cut & Consistent Return Strategy Ideas - newser.com,newser.com
"Mon, 15 Sep 2025 09:31:34 GMT",Automated trading signals detected on CSCO - 2025 Top Decliners & Step-by-Step Swing Trade Plans - newser.com,newser.com
"Sun, 14 Sep 2025 15:39:09 GMT",Applying Wyckoff theory to CSCO stock - Trade Volume Summary & AI Powered Buy and Sell Recommendations - newser.com,newser.com
"Mon, 15 Sep 2025 03:40:12 GMT",How hedge fund analytics apply to CSCO stock - Trade Analysis Report & Real-Time Volume Surge Alerts - newser.com,newser.com
"Sun, 14 Sep 2025 22:24:34 GMT",Is now a turning point for CSCO - Profit Target & Risk Controlled Stock Alerts - newser.com,newser.com
"Sun, 14 Sep 2025 10:19:19 GMT",Is this a good reentry point in CSCO - Quarterly Investment Review & AI Forecasted Stock Moves - newser.com,newser.com
"Sun, 14 Sep 2025 06:59:38 GMT",Heatmap analysis for CSCO and competitors - Quarterly Performance Summary & Accurate Trade Setup Notifications - newser.com,newser.com
"Sun, 14 Sep 2025 04:11:15 GMT",Is now a turning point for CSCO - 2025 Earnings Impact & Consistent Return Investment Signals - newser.com,newser.com
"Mon, 15 Sep 2025 06:25:30 GMT",How hedge fund analytics apply to CSCO stock - July 2025 Trade Ideas & Verified Short-Term Trading Plans - newser.com,newser.com
"Mon, 15 Sep 2025 01:00:25 GMT",Full technical analysis of CSCO stock - July 2025 Trends & Community Consensus Trade Alerts - newser.com,newser.com
"Sun, 14 Sep 2025 14:40:49 GMT",Heatmap analysis for CSCO and competitors - July 2025 Fed Impact & Verified Momentum Watchlists - newser.com,newser.com
"Sun, 14 Sep 2025 06:49:10 GMT",Will CSCO rebound enough to break even - July 2025 Spike Watch & Low Risk Profit Maximizing Plans - newser.com,newser.com
"Sun, 14 Sep 2025 14:44:57 GMT",Applying Wyckoff theory to CSCO stock - 2025 Biggest Moves & Long-Term Investment Growth Plans - newser.com,newser.com
2025-09-15T19:00:00,"MEDIA ALERT: Cisco's WebexOne Event Spotlights Global AI Brands and Ryan Reynolds, Acclaimed Actor, Film Producer, and Entrepreneur",Yahoo
2025-09-15T06:37:24,IT Services & Other Tech Stocks Q2 Recap: Benchmarking Cisco (NASDAQ:CSCO),Yahoo
2025-09-12T16:00:05,"Cisco Systems, Inc. (CSCO) Is a Trending Stock: Facts to Know Before Betting on It",Yahoo
