Date,Title,Source
2025-09-09T10:30:00Z,ジミ・ヘンドリックスが愛した“紫の煙”が令和に蘇る。VapeMania(R)︎が1960年代のカウンターカルチャーを象徴する「PURPLE HAZE」を完全再現。,Prtimes.jp
2025-09-09T08:36:56Z,Alliancebernstein L.P. Cuts Stock Holdings in Vulcan Materials Company $VMC,ETF Daily News
"Mon, 08 Sep 2025 11:04:19 GMT",Is Vulcan Materials Company (NYSE:VMC) Potentially Undervalued? - simplywall.st,simplywall.st
"Tue, 09 Sep 2025 07:48:14 GMT",Baird Financial Group Inc. Lowers Position in Vulcan Materials Company $VMC - MarketBeat,MarketBeat
"Wed, 10 Sep 2025 03:26:36 GMT",VMC begins preps for Dasara fete as lakhs to visit Kanaka Durga temple - The New Indian Express,The New Indian Express
"Tue, 09 Sep 2025 17:52:00 GMT",VMC releases water from Ajwa reservoir - Times of India,Times of India
"Mon, 08 Sep 2025 12:31:54 GMT",AQR Capital Management LLC Grows Position in Vulcan Materials Company $VMC - MarketBeat,MarketBeat
"Sun, 07 Sep 2025 03:36:36 GMT",LIVE: Vishwamitri River and Ajwa Sarovar Water Levels Update via VMC - DeshGujarat,DeshGujarat
"Sat, 06 Sep 2025 15:42:00 GMT",VMC adopts AI tech to crack down on illegal ads - Times of India,Times of India
"Sun, 07 Sep 2025 14:55:52 GMT",VMC launches 'The Events Calendar' - Edition.mv,Edition.mv
"Fri, 05 Sep 2025 07:00:00 GMT",Vulcan Materials Company (NYSE:VMC) Receives $308.36 Consensus Price Target from Analysts - MarketBeat,MarketBeat
"Fri, 05 Sep 2025 18:37:00 GMT","3.4 MT material used for each pothole, reveals VMC data - Times of India",Times of India
