Date,Title,Source
2025-11-15T01:32:37Z,granite-common 0.3.5,Pypi.org
2025-11-14T20:29:00Z,IBM goes all-in on quantum chips - new Nighthawk and Loon hardware look to bring the dream to life at last,TechRadar
2025-11-14T19:01:42Z,"IBM, UFC partner over AI-driven In-Fight Insights",Thefly.com
2025-11-14T19:00:00Z,Unanimous Decision: UFC and IBM Introduce New AI-Driven In-Fight Insights,PR Newswire UK
2025-11-14T17:20:24Z,ibm-watsonx-orchestrate-mcp-server 1.15.0,Pypi.org
2025-11-14T17:20:23Z,ibm-watsonx-orchestrate 1.15.0,Pypi.org
2025-11-14T16:30:00Z,IBM unveils two new quantum processors — including one that offers a blueprint for fault-tolerant quantum computing by 2029,Live Science
2025-11-14T16:13:27Z,Cramer Suggests International Business Machines “If You Crave Quantum Computing”,Yahoo Entertainment
2025-11-14T16:03:14Z,ibmsecurity 2025.11.14.0,Pypi.org
2025-11-14T12:37:01Z,"IBM Granite 4.0 : Smaller AI Model, Bigger Results, Slashes Memory & Latency",Geeky Gadgets
2025-11-13T20:28:18Z,ibm-metrics-plugin 5.1.2.16,Pypi.org
2025-11-13T18:41:33Z,IBM Patented Euler's 200 Year Old Math Technique for 'AI Interpretability',Substack.com
2025-11-13T17:05:54Z,IBM Is Staring Down Quantum Advantage. Should You Buy IBM Stock First?,Biztoc.com
2025-11-13T16:56:38Z,IBM Is Staring Down Quantum Advantage. Should You Buy IBM Stock First?,Barchart.com
2025-11-13T16:18:09Z,IBM unveils new 'Quantum Nighthawk' 120-qubit processor and software stack — company on track for 2029 fault-tolerance milestone,Tom's Hardware UK
2025-11-13T11:18:19Z,"Don't Chase Google, Meta: IBM Chief Scientist Urges Graduates To Examine Sectors Outside Silicon Valley",Ndtvprofit.com
2025-11-13T09:42:09Z,kcli 99.0.202511130942,Pypi.org
2025-11-13T06:28:15Z,ibm-watsonx-data-intelligence-mcp-server 0.3.1,Pypi.org
2025-11-13T04:52:57Z,isc-playbook-mcp-server 0.1.2,Pypi.org
2025-11-13T04:40:48Z,isc-playbook-mcp-server 0.1.1,Pypi.org
2025-11-13T04:22:13Z,isc-playbook-mcp-server added to PyPI,Pypi.org
2025-11-13T04:22:13Z,isc-playbook-mcp-server 0.1.0,Pypi.org
2025-11-13T03:50:26Z,Bitcoin Q-Day on the Horizon? New IBM Quantum Chip Expected to Hit Another Milestone,Biztoc.com
2025-11-13T02:08:56Z,IBM says 'Loon' chip shows path to useful quantum computers by 2029,Biztoc.com
2025-11-13T01:03:35Z,IBM Storage DS8000 Safeguarded Copy: Updated for DS8000 Release 10.1,Ibm.com
2025-11-12T22:31:02Z,Bitcoin Q-Day on the Horizon? New IBM Quantum Chip Expected to Hit Another Milestone,Decrypt
"Wed, 12 Nov 2025 11:02:56 GMT","IBM Delivers New Quantum Processors, Software, and Algorithm Breakthroughs on Path to Advantage and Fault Tolerance - IBM Newsroom",IBM Newsroom
"Fri, 14 Nov 2025 16:30:00 GMT",IBM unveils two new quantum processors — including one that offers a blueprint for fault-tolerant quantum computing by 2029 - Live Science,Live Science
"Sat, 15 Nov 2025 18:03:19 GMT","Own International Business Machines (IBM) if You Want to Own Quantum, Says Jim Cramer - Yahoo Finance",Yahoo Finance
"Wed, 12 Nov 2025 12:39:55 GMT",IBM says 'Loon' chip shows path to useful quantum computers by 2029 - Reuters,Reuters
"Wed, 12 Nov 2025 11:00:00 GMT",IBM launches IBM Quantum Nighthawk processor - Constellation Research,Constellation Research
"Wed, 12 Nov 2025 11:04:00 GMT",IBM sees a big milestone ahead for quantum computing — and it hinges on these new chips - MarketWatch,MarketWatch
"Wed, 12 Nov 2025 14:53:00 GMT",IBM's chief scientist has advice for entry-level engineers: Think beyond Big Tech - Business Insider,Business Insider
"Wed, 12 Nov 2025 15:01:20 GMT",IBM unveils one of the fastest computers on Earth - Fox Business,Fox Business
"Wed, 12 Nov 2025 21:36:03 GMT",IBM announces Nighthawk and Loon quantum chips - Engadget,Engadget
"Wed, 12 Nov 2025 11:01:16 GMT",IBM has unveiled two unprecedentedly complex quantum computers - New Scientist,New Scientist
"Sun, 16 Nov 2025 06:11:00 GMT","IBM News Today, Nov 16: AI Investment Surge and Market Impact - Meyka",Meyka
"Fri, 14 Nov 2025 19:00:00 GMT",Unanimous Decision: UFC and IBM Introduce New AI-Driven In-Fight Insights - PR Newswire,PR Newswire
"Sun, 16 Nov 2025 00:16:11 GMT",How International Business Machines Corporation (IBM) stock compares with top peers - 2025 Market WrapUp & Safe Capital Allocation Plans - newser.com,newser.com
"Thu, 13 Nov 2025 16:18:09 GMT",IBM unveils new 'Quantum Nighthawk' 120-qubit processor and software stack — company on track for 2029 fault-tolerance milestone - Tom's Hardware,Tom's Hardware
"Wed, 12 Nov 2025 11:17:19 GMT",IBM Just Announced a Massive Jump In Quantum Computing. These Industries Will Benefit Most - Inc.com,Inc.com
"Sat, 15 Nov 2025 02:25:18 GMT",Savoring Success: An Intimate FinOps Discussion with IBM – RSVP - worth.com,worth.com
"Wed, 12 Nov 2025 14:30:26 GMT",Scaling for quantum advantage and beyond - IBM,IBM
"Wed, 12 Nov 2025 14:30:26 GMT",Building quantum computers with leading-edge semiconductor fab - IBM,IBM
"Wed, 12 Nov 2025 12:36:36 GMT",The 2025 CDO Study: The AI multiplier effect - IBM,IBM
"Wed, 12 Nov 2025 15:26:53 GMT",IBM unveils new 'Nighthawk' quantum processor: 'Sci-fi come to life' - Fox Business,Fox Business
"Sat, 15 Nov 2025 21:30:02 GMT",IBM Announces Layoffs Amid AI Shift - MSN,MSN
"Tue, 11 Nov 2025 21:14:00 GMT","IBM, IBD Stock Of The Day, Near Buy Point Amid AI Software, Quantum Computing Push - Investor's Business Daily",Investor's Business Daily
"Fri, 14 Nov 2025 21:16:49 GMT",IBM’s Quantum Leap Could Be a Game Changer for International Business Machines (IBM) - Yahoo Finance,Yahoo Finance
"Tue, 11 Nov 2025 17:38:50 GMT",IBM watsonx Orchestrate recognized with 2025 Red Dot Design Award for Excellence in Enterprise AI Design - IBM,IBM
"Wed, 12 Nov 2025 15:05:39 GMT",IBM Lets Fly “Nighthawk” And “Loon” QPUs On The Way To Quantum Advantage - The Next Platform,The Next Platform
"Fri, 14 Nov 2025 21:20:39 GMT",Airline technology trends - IBM,IBM
"Thu, 13 Nov 2025 05:00:00 GMT",IBM Study: Chief Data Officers Redefine Strategies as AI Ambitions Outpace Readiness - PR Newswire,PR Newswire
"Wed, 12 Nov 2025 11:00:00 GMT",IBM unveils updated quantum computing products - Nextgov/FCW,Nextgov/FCW
"Fri, 14 Nov 2025 15:17:14 GMT",IBM using AI to unlock additional stats for UFC broadcasters during fights - Sports Business Journal,Sports Business Journal
"Thu, 13 Nov 2025 12:39:30 GMT",Haiqu Demonstrates Improved Anomaly Detection And Pattern Recognition with IBM Quantum Computer - The Quantum Insider,The Quantum Insider
"Thu, 13 Nov 2025 12:00:00 GMT",IBM and Polytechnique Montréal Launch AI Initiative to Strengthen Forestry Supply Chain - Yahoo Finance,Yahoo Finance
"Wed, 12 Nov 2025 14:40:34 GMT",Why Is IBM Stock Gaining Wednesday? - IBM (NYSE:IBM) - Benzinga,Benzinga
"Thu, 13 Nov 2025 11:38:56 GMT",IBM Stock Climbs Record Peak After Breakthrough in Quantum Computing - Yahoo Finance,Yahoo Finance
"Thu, 13 Nov 2025 13:58:57 GMT",Secure by design with AI for cyber resilience - IBM,IBM
"Thu, 13 Nov 2025 10:40:00 GMT",IBM Pushes Ahead in the Quantum Computing Race - The Motley Fool,The Motley Fool
"Wed, 12 Nov 2025 12:48:54 GMT",IBM pushes toward quantum advantage by 2026 with new Nighthawk processor - Help Net Security,Help Net Security
"Wed, 12 Nov 2025 19:55:46 GMT",Q-CTRL Connects Fire Opal With RIKEN’s IBM Quantum System Two For Hybrid Quantum-Classical Computing - The Quantum Insider,The Quantum Insider
"Thu, 13 Nov 2025 13:27:15 GMT",IBM: Data silos are holding back enterprise AI - AI News,AI News
"Fri, 14 Nov 2025 18:26:05 GMT",Don’t waste your compute: llm-d gains traction at KubeCon - IBM,IBM
"Fri, 14 Nov 2025 13:00:00 GMT",UFC and IBM reveal AI-powered 'In-Fight Insights' technology ahead of Madison Square Garden event - Fox Business,Fox Business
"Wed, 12 Nov 2025 19:31:13 GMT",IBM Announces Progress Toward More Reliable Quantum Computing - The National CIO Review,The National CIO Review
"Fri, 14 Nov 2025 10:45:52 GMT",Lula Mohanty on ADIPEC and IBM Consulting’s expertise in the energy landscape - Consultancy-me.com,Consultancy-me.com
"Fri, 14 Nov 2025 18:58:00 GMT",Agassi Sports and IBM Team Up to Build AI-Powered Global Racquet Sports Platform - CDO Magazine,CDO Magazine
"Tue, 11 Nov 2025 11:02:32 GMT",Unipol Assicurazioni Leverages IBM watsonx to Build a New AI-driven Automation Platform - IBM Newsroom,IBM Newsroom
"Sat, 15 Nov 2025 05:39:03 GMT",How Investors May Respond To IBM's Quantum Nighthawk Breakthrough and Its Impact on Long-Term Growth (IBM) - simplywall.st,simplywall.st
"Fri, 14 Nov 2025 23:00:56 GMT",IBM Builds an AI ‘Undo Button’ to Fix Cloud Outages Faster - TipRanks,TipRanks
"Fri, 14 Nov 2025 20:29:00 GMT",IBM quietly unveiled “Nighthawk” and “Loon” for quantum computing - TechRadar,TechRadar
"Wed, 12 Nov 2025 15:04:00 GMT",IBM’s ‘big bet’ on new quantum processors - https-//www.semafor.com,https-//www.semafor.com
"Wed, 12 Nov 2025 23:19:59 GMT",IBM Infrastructure: Continuous Risk & Compliance - www.trendmicro.com,www.trendmicro.com
"Wed, 12 Nov 2025 20:00:00 GMT",An ’undo-and-retry’ mechanism for agents - IBM Research,IBM Research
"Fri, 14 Nov 2025 02:27:42 GMT",The CIO’s guide to Microsoft application management with agentic AI - IBM,IBM
"Wed, 12 Nov 2025 17:35:05 GMT","After DARPA list shakes up quantum computing world, IBM has a message: We're doing great - Fast Company",Fast Company
"Thu, 13 Nov 2025 14:31:28 GMT",Can the Launch of an Advanced Quantum Processor Propel IBM Stock? - Zacks Investment Research,Zacks Investment Research
"Fri, 14 Nov 2025 20:02:39 GMT",IBM Study: Chief Data Officers Redefine Strategies as AI Ambitions Outpace Readiness - HPCwire,HPCwire
"Sat, 15 Nov 2025 08:45:41 GMT",Critical IBM AIX vulnerabilities in Network Installation Manager (NIM) - Security Boulevard,Security Boulevard
"Thu, 13 Nov 2025 16:56:38 GMT",IBM Is Staring Down Quantum Advantage. Should You Buy IBM Stock First? - Barchart.com,Barchart.com
"Wed, 12 Nov 2025 16:35:29 GMT","IBM unveils Loon and Nighthawk, next-generation processors for scalable, fault-tolerant quantum computing - SiliconANGLE",SiliconANGLE
"Thu, 13 Nov 2025 17:15:27 GMT",IBM Takes the Wraps Off Nighthawk and Loon Quantum Chips - extremetech.com,extremetech.com
"Fri, 14 Nov 2025 19:00:00 GMT","IBM (NYSE: IBM) and UFC debut AI In-Fight Insights at UFC 322, real-time milestones - Stock Titan",Stock Titan
"Thu, 13 Nov 2025 13:43:16 GMT","IBM unveils Nighthawk quantum processor, claims it will deliver large-scale, fault-tolerant quantum computer by 2029 - Data Center Dynamics",Data Center Dynamics
"Wed, 12 Nov 2025 17:01:22 GMT","IBM: ‘Verified Quantum Advantage’ By 2026, ‘Fault-Tolerant Quantum Computing By 2029 - Forbes",Forbes
"Thu, 13 Nov 2025 22:47:12 GMT",IBM Introduces Its New Quantum Nighthawk Chip - TipRanks,TipRanks
"Wed, 12 Nov 2025 12:00:41 GMT",Goodbye to thousands of jobs at IBM—the tech giant announces global cuts to adjust its workforce - Blanquivioletas,Blanquivioletas
"Thu, 13 Nov 2025 14:42:00 GMT","Rigetti, IonQ, and IBM Make Strides. What Quantum Investors Should Know. - Barron's",Barron's
"Wed, 12 Nov 2025 16:03:06 GMT",IBM and enGen Collaborate to Eliminate Errors in Member Enrollment - Healthcare IT Today,Healthcare IT Today
"Wed, 12 Nov 2025 10:09:00 GMT","IBM: 66% of organizations are reaping productivity gains from AI, with 1 in 5 seeing ROI - unleash.ai",unleash.ai
"Wed, 12 Nov 2025 16:50:13 GMT",Wall Street Lunch: IBM Unveils Quantum Nighthawk To Outpace Traditional Supercomputers - Seeking Alpha,Seeking Alpha
"Sat, 15 Nov 2025 12:50:49 GMT",IBM’s Quantum Dawn: Nighthawk and Loon Chips Push Toward Practical Supremacy - WebProNews,WebProNews
"Thu, 13 Nov 2025 09:28:15 GMT",IBM unveils new 'Nighthawk' quantum processor: 'Sci-fi come to life' - MSN,MSN
"Fri, 14 Nov 2025 01:34:37 GMT",Haiqu Demonstrates High-Dimensional Quantum Embedding for Anomaly Detection on IBM Quantum Heron - Quantum Computing Report,Quantum Computing Report
"Wed, 12 Nov 2025 15:59:25 GMT","AI slop in cybersecurity, OT security fails and lessons from the Louvre heist - IBM",IBM
"Wed, 12 Nov 2025 19:46:51 GMT","IBM Announces Quantum Processors, Software and Algorithms, Expects Quantum Advantage in 2026 - insidehpc.com",insidehpc.com
"Thu, 13 Nov 2025 05:00:00 GMT",IBM (NYSE: IBM): 81% prioritize AI; 26% say data supports AI revenue - Stock Titan,Stock Titan
"Wed, 12 Nov 2025 14:12:01 GMT","IBM Expands Quantum Roadmap with New Processors, Error-Corrected Architecture, and HPC-Integrated Qiskit - HPCwire",HPCwire
"Wed, 12 Nov 2025 11:00:25 GMT","IBM unveils new quantum processor, expects to offer fault-tolerant computing by 2029 (IBM:NYSE) - Seeking Alpha",Seeking Alpha
"Tue, 11 Nov 2025 23:36:02 GMT","How IBM Instana is making Observability smarter, faster and more predictive - IBM",IBM
"Wed, 12 Nov 2025 03:35:00 GMT",IBM (NYSE:IBM) Q3 Earnings: Leading The IT Services & Consulting Pack - Yahoo Finance,Yahoo Finance
"Wed, 12 Nov 2025 21:03:29 GMT",IBM announces new quantum computing chip Loon - The American Bazaar,The American Bazaar
"Sat, 15 Nov 2025 08:00:00 GMT",IBM (NYSE:IBM) S&P 500 Patterns Echo Hybrid Cloud Push - Kalkine Media,Kalkine Media
"Fri, 14 Nov 2025 19:01:31 GMT",UFC and IBM launch AI platform for real-time fight insights - StreetInsider,StreetInsider
"Fri, 14 Nov 2025 19:23:15 GMT","IBM, UFC partner over AI-driven In-Fight Insights - TipRanks",TipRanks
"Thu, 13 Nov 2025 05:00:00 GMT",IBM Study: Chief Data Officers Redefine Strategies as AI Ambitions Outpace Readiness - Yahoo Finance Singapore,Yahoo Finance Singapore
"Sat, 15 Nov 2025 17:01:49 GMT","Jamie Dimon Doesn't Read Texts During The Day From Anyone But These People: JPMorgan Chief Reveals What Happens When You Call Him - IBM (NYSE:IBM), JPMorgan Chase (NYSE:JPM) - Benzinga",Benzinga
"Thu, 13 Nov 2025 10:02:34 GMT",IBM introduces new processor as it targets quantum advantage by 2026 - Tech Wire Asia,Tech Wire Asia
"Wed, 12 Nov 2025 22:51:04 GMT",IBM Explains How AI Models Are Making a Familiar Human Mistake - TipRanks,TipRanks
"Wed, 12 Nov 2025 16:05:06 GMT",What's Going On With IBM Stock Today? - Benzinga,Benzinga
"Wed, 12 Nov 2025 13:29:00 GMT","IBM Launches Most Powerful Quantum Chip Yet, Eyes Fault-Tolerant Computer By 2029 - Stocktwits",Stocktwits
"Fri, 14 Nov 2025 19:42:10 GMT",IBM Unveils AI-Powered In-Fight Insights for UFC Events - GuruFocus,GuruFocus
"Sat, 15 Nov 2025 10:30:44 GMT",International Business Machines Corporation $IBM Shares Acquired by Creative Planning - MarketBeat,MarketBeat
"Sat, 15 Nov 2025 12:46:06 GMT",International Business Machines Corporation $IBM Shares Sold by Kane Investment Management Inc. - MarketBeat,MarketBeat
"Sat, 15 Nov 2025 10:56:46 GMT",International Business Machines Corporation $IBM Shares Acquired by Cetera Investment Advisers - MarketBeat,MarketBeat
"Wed, 12 Nov 2025 22:31:02 GMT",Bitcoin Q-Day on the Horizon? New IBM Quantum Chip Expected to Hit Another Milestone - Yahoo Finance,Yahoo Finance
"Sun, 16 Nov 2025 04:28:00 GMT",IBM’s New ‘Nighthawk’ Quantum Chip Targets Advantage by 2026 - Indianweb2.com,Indianweb2.com
"Wed, 12 Nov 2025 13:05:00 GMT",StorONE Integrates IBM Storage Scale (formerly GPFS) into Its Enterprise Storage Platform - Yahoo Finance,Yahoo Finance
"Fri, 14 Nov 2025 13:22:12 GMT",IBM at The Future of Insurance Canada 2025 - IBM,IBM
"Thu, 13 Nov 2025 11:45:29 GMT",Quantum Computing News: Microsoft Expands in Europe as IBM and IonQ Boost Global Quantum Investments - TipRanks,TipRanks
2025-11-15T19:03:19,"Own International Business Machines (IBM) if You Want to Own Quantum, Says Jim Cramer",Yahoo
2025-11-15T16:09:45,Beyond AI: Inside the Global Quantum Computer Race,Yahoo
2025-11-14T22:16:49,IBM’s Quantum Leap Could Be a Game Changer for International Business Machines (IBM),Yahoo
2025-11-14T20:00:00,Unanimous Decision: UFC and IBM Introduce New AI-Driven In-Fight Insights,Yahoo
2025-11-14T17:13:27,Cramer Suggests International Business Machines “If You Crave Quantum Computing”,Yahoo
2025-11-13T17:56:38,IBM Is Staring Down Quantum Advantage. Should You Buy IBM Stock First?,Yahoo
2025-11-13T15:59:00,Can the Launch of an Advanced Quantum Processor Propel IBM Stock?,Yahoo
2025-11-13T13:00:00,IBM and Polytechnique Montréal Launch AI Initiative to Strengthen Forestry Supply Chain,Yahoo
2025-11-13T12:38:56,IBM Stock Climbs Record Peak After Breakthrough in Quantum Computing,Yahoo
2025-11-13T11:40:00,IBM Pushes Ahead in the Quantum Computing Race,Yahoo
2025-11-13T06:00:00,IBM Study: Chief Data Officers Redefine Strategies as AI Ambitions Outpace Readiness,Yahoo
2025-11-12T23:31:02,Bitcoin Q-Day on the Horizon? New IBM Quantum Chip Expected to Hit Another Milestone,Yahoo
2025-11-12T18:30:00,"After DARPA list shakes up quantum computing world, IBM has a message: We’re doing great",Yahoo
2025-11-12T18:06:31,Why IBM (IBM) Stock Is Up Today,Yahoo
2025-11-12T17:26:03,"As IBM Rallies on a Quantum Computing Breakthrough, Here’s Where the Stock Could Be Headed Next",Yahoo
2025-11-12T14:00:00,Rocket Software Unveils Next Evolution of DevOps Tools That Evolve the Developer Experience to Bridge IT Skills Gap Across Core IT Systems,Yahoo
2025-11-12T13:38:19,IBM stock rises after unveiling Quantum Nighthawk processor,Yahoo
2025-11-12T12:52:15,"IBM Unveils Nighthawk Quantum Processor, Experiemental Chip Loon",Yahoo
2025-11-12T12:50:13,Wall Street Lunch: IBM Unveils Quantum Nighthawk To Outpace Traditional Supercomputers,SeekingAlpha
2025-11-12T12:00:00,"IBM Delivers New Quantum Processors, Software, and Algorithm Breakthroughs on Path to Advantage and Fault Tolerance",Yahoo
2025-11-12T04:35:45,IBM (NYSE:IBM) Q3 Earnings: Leading The IT Services & Consulting Pack,Yahoo
2025-11-12T04:13:58,Quantum computing will see more daily use from 2028-2029: IBM Fellow,CNBC
2025-11-11T18:21:38,"IBM, IBD Stock Of The Day, Near Buy Point Amid AI Software, Quantum Computing Push",Yahoo
2025-11-11T17:59:00,'That World Has Changed': Alex Gorsky on Shift to Regionalization,Yahoo
2025-11-11T15:00:00,OpenSearch Software Foundation Welcomes IBM as a Premier Member,Yahoo
2025-11-13T08:09:39,IBM has unveiled two unprecedentedly complex quantum computers,Reddit/r/stocks
2025-11-13T08:07:22,IBM has unveiled two unprecedentedly complex quantum computers,Reddit/r/investing
