Date,Title,Source
"Mon, 08 Dec 2025 22:22:57 GMT",Eli Lilly (LLY) Raises Dividend by 15% - TipRanks,TipRanks
"Mon, 08 Dec 2025 18:33:36 GMT","Guggenheim maintains buy on Eli Lilly (LLY) after ""another impressive year"" - MSN",MSN
"Tue, 09 Dec 2025 12:17:38 GMT",Mounjaro In China: Assessing Market Potential And Risks (NYSE:LLY) - Seeking Alpha,Seeking Alpha
"Tue, 09 Dec 2025 20:30:00 GMT",Eli Lilly (NYSE: LLY) sets $6B Alabama plant to produce oral GLP-1 orforglipron - Stock Titan,Stock Titan
"Wed, 10 Dec 2025 00:20:22 GMT",Eli Lilly (LLY) to Invest $6 Billion in New Alabama Manufacturin - GuruFocus,GuruFocus
"Tue, 09 Dec 2025 13:09:34 GMT","State Street Corp Purchases 69,018 Shares of Eli Lilly and Company $LLY - MarketBeat",MarketBeat
"Tue, 09 Dec 2025 16:43:21 GMT",Nobel Prize-Winning Chemist Carolyn Bertozzi Rejoins Eli Lilly’s (LLY) Board of Directors - TipRanks,TipRanks
"Tue, 09 Dec 2025 13:14:20 GMT",Lilly's Jaypirca succeeds in late-stage trial as a first-line option in lymphoma - Seeking Alpha,Seeking Alpha
"Mon, 08 Dec 2025 19:08:31 GMT",Eli Lilly & Co. (LLY) Declares $1.73 Quarterly Dividend; 0.7% Yield - StreetInsider,StreetInsider
"Mon, 08 Dec 2025 05:39:50 GMT","Eli Lilly, Pfizer drugs added to China's state insurance list (LLY:NYSE) - Seeking Alpha",Seeking Alpha
"Mon, 08 Dec 2025 07:35:17 GMT","LLY, PFE: Eli Lilly’s Mounjaro, Pfizer’s Cancer Drug Added to China’s State Insurance List - TipRanks",TipRanks
"Tue, 09 Dec 2025 15:06:36 GMT",Eli Lilly (LLY) Completes Acquisition of Adverum Biotechnologies - GuruFocus,GuruFocus
"Tue, 09 Dec 2025 14:02:12 GMT",Eli Lilly (LLY) Achieves Key Milestone with Jaypirca in Phase 3 Trial - GuruFocus,GuruFocus
2025-12-10T17:28:38,Eli Lilly and Company (LLY) Announces Results From Phase 3 BRUIN CLL-314 Trial Evaluating Jaypirca Versus Imbruvica,Yahoo
2025-12-10T16:53:47,Eli Lilly Plans $6B Investment in New Alabama Manufacturing Site,Yahoo
2025-12-10T12:20:41,Eli Lilly picks Alabama as home to $6bn orforglipron manufacturing facility,Yahoo
2025-12-09T21:30:00,Lilly to build $6 billion facility to manufacture active pharmaceutical ingredients in Alabama,Yahoo
2025-12-09T16:30:01,"Eli Lilly to build $6 billion manufacturing plant in Alabama to help make upcoming obesity pill, other drugs",CNBC
2025-12-09T14:28:00,Lilly and Adverum announce expiration and completion of Adverum tender offer and acquisition,Yahoo
2025-12-09T13:30:00,"Lilly's Jaypirca (pirtobrutinib) significantly improved progression-free survival, reducing the risk of progression or death by 80%, versus chemoimmunotherapy in patients with treatment-naïve CLL/SLL",Yahoo
2025-12-06T23:07:00+00:00,Eli Lilly's Stock Drops as It Slashes the Price of Zepbound: Time to Buy the Dip?,The Motley Fool
2025-12-09T14:00:06+00:00,Eli Lilly and Company (LLY) is a trending stock: Facts to know before betting on it,Zacks Investment Research
2025-12-10T16:28:38+00:00,Eli Lilly and Company (LLY) announces results from phase 3 BRUIN CLL-314 trial evaluating Jaypirca versus Imbruvica,Insider Monkey
2025-11-26T15:43:00+00:00,Stock Split Watch: Is Eli Lilly Next?,The Motley Fool
2025-11-28T15:14:00+00:00,"Don't expect much from Eli Lilly stock anymore, says Len Yaffee",Invezz
2025-12-08T17:36:45+00:00,"Guggenheim Maintains Buy on Eli Lilly (LLY) After ""Another Impressive Year""",Insider Monkey
2025-12-04T19:00:00+00:00,LLY Trading Above 50 & 200-Day SMAs for 2 Months: How to Play the Stock,Zacks.com
2025-11-21T18:39:00+00:00,Eli Lilly Stock Is Rising Today: Here's What You Need To Know,Benzinga
2025-11-28T10:26:00+00:00,Eli Lilly (LLY) Shares Soared Roughly 30% in November,FinanceFeeds
2025-08-07T15:32:00+00:00,LLY Stock Sinks Despite Q2 Earnings Beat as Obesity Pill Disappoints,Nasdaq
