Date,Title,Source
2025-10-29T02:42:12Z,"Foxconn expands US AI server buildout, joins Nvidia-Stellantis-Uber robotaxi effort",Digitimes
2025-10-29T01:26:54Z,"RBC Upgrades Honeywell (HON) to Outperform, Sees Catalyst-Rich Phase Ahead",Yahoo Entertainment
2025-10-28T19:17:26Z,"Dear Honeywell Stock Fans, Mark Your Calendars for October 30",Biztoc.com
2025-10-28T19:03:02Z,"Dear Honeywell Stock Fans, Mark Your Calendars for October 30",Barchart.com
2025-10-28T17:23:00Z,"HON Explores How Color, Sustainability, and Flexible Design Are Shaping K–12 Learning Environments",GlobeNewswire
2025-10-28T09:16:47Z,Foreign Secretary statement on Rapid Support Forces in El Fasher,Globalsecurity.org
2025-10-28T09:00:02Z,Judicial Appointments Commission reappointment,Www.gov.uk
2025-10-28T08:24:25Z,Nvidia Supplier Foxconn Goes All-In On AI With $1.37 Billion Supercomputing Investment,Biztoc.com
2025-10-28T06:31:03Z,Foxconn to invest up to $1.37 billion to expand cloud compute services and accelerate AI development,Livemint
2025-10-28T04:40:39Z,Hon Precision ramps AI GPU and ASIC testing equipment with orders through 1H26,Digitimes
2025-10-27T16:55:06Z,Foreign Secretary statement on Rapid Support Forces in El Fasher,Www.gov.uk
2025-10-27T16:22:24Z,Barclays Raises Honeywell (HON) PT After Q3 Earnings,Biztoc.com
2025-10-27T15:54:17Z,Barclays Raises Honeywell (HON) PT After Q3 Earnings,Yahoo Entertainment
2025-10-27T15:48:36Z,"Wall Street is Pounding the Table Over HON, GOOG, AAPL, MSFT, BKNG, and TSLA",Biztoc.com
2025-10-27T13:34:53Z,Correspondence: Skills England priorities for 2025 to 2026,Www.gov.uk
"Fri, 31 Oct 2025 05:00:10 GMT","How David Hon followed his dream to create Dahon, the world’s biggest folding bicycle maker - South China Morning Post",South China Morning Post
"Thu, 30 Oct 2025 11:00:00 GMT","Honeywell (NASDAQ: HON) completes Solstice spin-off; SOLS starts trading, 1-for-4 ratio - Stock Titan",Stock Titan
"Fri, 31 Oct 2025 03:45:29 GMT",Honeywell International Inc. (NASDAQ:HON) Sees Large Growth in Short Interest - MarketBeat,MarketBeat
"Thu, 30 Oct 2025 08:57:00 GMT",Jim Cramer Discusses Honeywell (HON)’s Split In Detail - Yahoo Finance,Yahoo Finance
"Wed, 29 Oct 2025 01:56:44 GMT",Hon. John Sweeny Jr. (1949-2025) - highlandscurrent.org,highlandscurrent.org
"Tue, 28 Oct 2025 17:30:15 GMT",Jamaica's Hon. Daryl Vaz shared updates on Melissa preparations and impacts | Latest Weather Clips - FOX Weather,FOX Weather
"Wed, 29 Oct 2025 16:14:36 GMT",A Fresh Look at Honeywell (HON) Valuation as Shares Trend Higher - Yahoo Finance,Yahoo Finance
"Thu, 30 Oct 2025 15:04:46 GMT",Honeywell International Inc. $HON Stake Raised by Savvy Advisors Inc. - MarketBeat,MarketBeat
"Wed, 29 Oct 2025 01:26:00 GMT","RBC Upgrades Honeywell (HON) to Outperform, Sees Catalyst-Rich Phase Ahead - Yahoo Finance",Yahoo Finance
"Thu, 30 Oct 2025 12:03:22 GMT","Strs Ohio Sells 144,710 Shares of Honeywell International Inc. $HON - MarketBeat",MarketBeat
"Tue, 28 Oct 2025 17:23:00 GMT","HON Explores How Color, Sustainability, and Flexible Design Are Shaping K–12 Learning Environments - Yahoo Finance",Yahoo Finance
"Thu, 30 Oct 2025 11:44:52 GMT","Amalgamated Bank Sells 5,459 Shares of Honeywell International Inc. $HON - MarketBeat",MarketBeat
"Thu, 30 Oct 2025 11:08:24 GMT","1,195 Shares in Honeywell International Inc. $HON Purchased by Noesis Capital Mangement Corp - MarketBeat",MarketBeat
"Mon, 27 Oct 2025 15:54:17 GMT",Barclays Raises Honeywell (HON) PT After Q3 Earnings - Yahoo Finance,Yahoo Finance
"Thu, 30 Oct 2025 11:10:19 GMT",Shorepath Capital Management LLC Decreases Stock Holdings in Honeywell International Inc. $HON - MarketBeat,MarketBeat
"Thu, 30 Oct 2025 09:17:29 GMT",Jim Cramer Discusses Honeywell (HON)’s Split In Detail - Insider Monkey,Insider Monkey
"Mon, 27 Oct 2025 15:40:01 GMT",MARUY or HON: Which Is the Better Value Stock Right Now? - Yahoo Finance,Yahoo Finance
"Thu, 30 Oct 2025 12:43:46 GMT",Simon Quick Advisors LLC Has $5.59 Million Stock Position in Honeywell International Inc. $HON - MarketBeat,MarketBeat
"Wed, 29 Oct 2025 05:15:10 GMT",Full-length Replay: Play-In 2nd Leg: FC Motagua (HON) vs CS Cartagines (CRC) - FOX Sports,FOX Sports
"Thu, 30 Oct 2025 09:42:02 GMT","Motco Sells 44,351 Shares of Honeywell International Inc. $HON - MarketBeat",MarketBeat
"Wed, 29 Oct 2025 14:43:45 GMT",Judge Lawrence Knipel honored by legal and civic leadership as he retires after 35 years of service - Brooklyn Eagle,Brooklyn Eagle
"Thu, 30 Oct 2025 02:21:58 GMT",Is FIT Hon Teng Limited (0FJ) stock a buy before earnings results - 2025 Sector Review & Stock Portfolio Risk Control - newser.com,newser.com
"Thu, 30 Oct 2025 02:33:26 GMT",Is Hon Hai Precision Industry Co. Ltd. (Common Stock) (HHP2) stock vulnerable to rate hikes - 2025 AllTime Highs & Consistent Return Strategy Ideas - newser.com,newser.com
"Wed, 29 Oct 2025 06:45:00 GMT","Hon Hai, Nvidia, Uber, Stellantis team up on robotaxi plan - Focus Taiwan",Focus Taiwan
"Mon, 27 Oct 2025 14:42:01 GMT","Wall Street is Pounding the Table Over HON, GOOG, AAPL, MSFT, BKNG, and TSLA - 24/7 Wall St.",24/7 Wall St.
"Wed, 29 Oct 2025 16:00:00 GMT",Hon Hai to join alliance building robotaxi service - Taipei Times,Taipei Times
"Wed, 29 Oct 2025 10:43:31 GMT",REG - Hon Hai Prec.Ind.Co - Company filed with CSRC for share exchange TECO - TradingView,TradingView
"Fri, 31 Oct 2025 05:23:52 GMT",Hon. Kofi Adams Commends Team Ghana for Impressive Showing at ANOCA Zone III Games - GBC Ghana Online,GBC Ghana Online
"Tue, 28 Oct 2025 12:00:00 GMT",Honeywell (NASDAQ: HON) to present: Baird Nov 11 and Goldman Sachs Dec 3 investor events - Stock Titan,Stock Titan
"Wed, 29 Oct 2025 10:59:03 GMT",Hon Hai files with China regulator for TECO share exchange - Investing.com,Investing.com
"Tue, 28 Oct 2025 16:28:07 GMT",Honeywell unveils new technology in potential boost to maritime decarbonization (HON:NASDAQ) - Seeking Alpha,Seeking Alpha
"Tue, 28 Oct 2025 06:17:00 GMT",Hon Hai to invest NT$42 billion in AI computing equipment - Focus Taiwan,Focus Taiwan
"Tue, 28 Oct 2025 12:04:33 GMT",Will Hon Hai Precision Industry Co. Ltd. (Common Stock) (HHP2) stock deliver stable dividends - Stop Loss & Long-Term Growth Stock Strategies - newser.com,newser.com
"Tue, 28 Oct 2025 20:29:26 GMT","Hon-Peng ""Phillip"" Lau Obituary (2025) - Wilmington, DE - Doherty Funeral Homes, Inc. - Pike Creek - Legacy obituary",Legacy obituary
"Tue, 28 Oct 2025 03:24:02 GMT",Is Hon Hai Precision Industry Co. Ltd. (Common Stock) (HHP2) stock vulnerable to rate hikes - Quarterly Market Review & Real-Time Sentiment Analysis - newser.com,newser.com
"Wed, 29 Oct 2025 10:50:25 GMT",Hon Hai Files for Share Exchange with TECO Electric - TipRanks,TipRanks
"Wed, 29 Oct 2025 10:56:13 GMT",REG - Hon Hai Prec.Ind.Co - Announcement on behalf of subsidiary FII - TradingView,TradingView
"Wed, 29 Oct 2025 11:17:58 GMT",Honeywell International Inc. $HON Holdings Raised by Robocap Asset Management Ltd - MarketBeat,MarketBeat
"Tue, 28 Oct 2025 11:30:00 GMT",Honeywell (NASDAQ: HON) debuts biocrude tech turning biomass to drop-in marine fuel - Stock Titan,Stock Titan
"Tue, 28 Oct 2025 16:00:00 GMT",Hon Hai to invest NT$42 billion in AI computing equipment - Taipei Times,Taipei Times
"Mon, 27 Oct 2025 14:14:51 GMT","Honeywell upgraded at RBC Capital on breakup values, earnings momentum (HON:NASDAQ) - Seeking Alpha",Seeking Alpha
"Tue, 28 Oct 2025 15:19:51 GMT",Hon Kwok Land Announces Major Disposal of Target Group - TipRanks,TipRanks
"Tue, 28 Oct 2025 16:36:18 GMT",What's Going On With Honeywell Stock Tuesday? - Honeywell Intl (NASDAQ:HON) - Benzinga,Benzinga
"Wed, 29 Oct 2025 15:44:10 GMT",Fireside Chat With the Hon. Hector Gonzalez '85 and Connor Flannery '16 - City Guide New York,City Guide New York
"Mon, 27 Oct 2025 19:47:48 GMT","Hon. John W. Sweeny Jr. Obituary (2025) - Mahopac, NY - Joseph J Smith Funeral Home Inc - Legacy obituary",Legacy obituary
"Tue, 28 Oct 2025 13:33:02 GMT",Morgan Stanley Issues Pessimistic Forecast for Honeywell International (NASDAQ:HON) Stock Price - MarketBeat,MarketBeat
"Wed, 29 Oct 2025 22:38:02 GMT",Is FIT Hon Teng (HKG:6088) Using Too Much Debt? - simplywall.st,simplywall.st
"Tue, 28 Oct 2025 02:21:25 GMT",Is FIT Hon Teng Limited (0FJ) stock a buy before earnings results - 2025 Key Lessons & Weekly Top Gainers Alerts - newser.com,newser.com
"Tue, 28 Oct 2025 10:36:53 GMT",Honeywell International Inc. $HON Shares Acquired by Purkiss Capital Advisors LLC - MarketBeat,MarketBeat
"Thu, 30 Oct 2025 05:41:00 GMT",The 5 Most Interesting Analyst Questions From Honeywell’s Q3 Earnings Call - The Globe and Mail,The Globe and Mail
"Tue, 28 Oct 2025 04:47:23 GMT",Is FIT Hon Teng Limited (0FJ) stock a buy before earnings results - Weekly Gains Summary & Technical Analysis for Trade Confirmation - newser.com,newser.com
"Tue, 28 Oct 2025 10:36:54 GMT","Howard Capital Management Inc. Acquires 1,934 Shares of Honeywell International Inc. $HON - MarketBeat",MarketBeat
"Tue, 28 Oct 2025 10:47:05 GMT","Private Wealth Partners LLC Sells 3,480 Shares of Honeywell International Inc. $HON - MarketBeat",MarketBeat
"Wed, 29 Oct 2025 09:59:30 GMT",Honotel ventures into the hybrid hospitality market with its new brand - Hospitality ON,Hospitality ON
"Tue, 28 Oct 2025 10:09:30 GMT","Logan Capital Management Inc. Sells 2,856 Shares of Honeywell International Inc. $HON - MarketBeat",MarketBeat
"Tue, 28 Oct 2025 10:36:53 GMT","Tevis Investment Management Acquires 5,620 Shares of Honeywell International Inc. $HON - MarketBeat",MarketBeat
"Tue, 28 Oct 2025 10:36:53 GMT",Trust Investment Advisors Invests $1.07 Million in Honeywell International Inc. $HON - MarketBeat,MarketBeat
"Tue, 28 Oct 2025 08:54:37 GMT",MARUY or HON: Which Is the Better Value Stock Right Now? - sharewise.com,sharewise.com
"Tue, 28 Oct 2025 09:17:42 GMT",Honeywell International Inc. $HON Shares Bought by Y Intercept Hong Kong Ltd - MarketBeat,MarketBeat
"Tue, 28 Oct 2025 07:00:01 GMT",REG - Hon Hai Prec.Ind.Co - Foxconn SG Subsidiary Bond Pricing Announcement - TradingView,TradingView
"Thu, 30 Oct 2025 15:59:49 GMT",Hon'ble Justice Surya Kant's Appointment As CJI A Moment Of Pride And Promise For Judiciary Says Senior Advocate Rajiv Bhatia - BW Legal World,BW Legal World
"Thu, 30 Oct 2025 07:37:26 GMT",Is Hon Hai Precision Industry Co. Ltd. (Common Stock) (HHP2) stock vulnerable to rate hikes - 2025 Pullback Review & Accurate Intraday Trading Signals - newser.com,newser.com
"Tue, 28 Oct 2025 03:00:00 GMT","Madame Secretary: Hon. Shirley N. Weber Reflects on Voting Rights, First Year in Office - Post News Group",Post News Group
"Mon, 27 Oct 2025 13:07:32 GMT",Honeywell International (HON) Receives Updated Price Target from Wells Fargo | HON Stock News - GuruFocus,GuruFocus
"Wed, 29 Oct 2025 10:25:57 GMT",Heroes of Newerth esports returns with HoN Reborn tournament - Esports News UK,Esports News UK
"Mon, 27 Oct 2025 16:00:00 GMT",Hon Precision to boost capacity 40 percent on surging AI chip demand - Taipei Times,Taipei Times
"Mon, 27 Oct 2025 15:04:11 GMT",Honeywell (HON) Upgraded by RBC: Breakup Sparks Optimism - GuruFocus,GuruFocus
"Mon, 27 Oct 2025 13:52:45 GMT",Hon Hai Precision Industry Announces NT$42 Billion Investment in AI Compute Cloud Business - TipRanks,TipRanks
"Mon, 27 Oct 2025 13:45:56 GMT","HON: RBC Capital Upgrades Honeywell Intl, Raises Price Target to $253 | HON Stock News - GuruFocus",GuruFocus
"Mon, 27 Oct 2025 10:36:05 GMT","Bessemer Group Inc. Purchases 4,417 Shares of Honeywell International Inc. $HON - MarketBeat",MarketBeat
"Mon, 27 Oct 2025 13:47:58 GMT",REG - Hon Hai Prec.Ind.Co - Budget Proposal - TradingView,TradingView
"Mon, 27 Oct 2025 10:36:04 GMT",Oak Grove Capital LLC Cuts Stock Holdings in Honeywell International Inc. $HON - MarketBeat,MarketBeat
"Wed, 29 Oct 2025 09:46:20 GMT",Honeywell Signal 29/10: A Buy After Earnings? (Chart) - DailyForex,DailyForex
"Tue, 28 Oct 2025 08:48:22 GMT","Ashton Thomas Private Wealth LLC Sells 2,642 Shares of Honeywell International Inc. $HON - MarketBeat",MarketBeat
"Mon, 27 Oct 2025 09:17:11 GMT",Wealthfront Advisers LLC Has $17.41 Million Position in Honeywell International Inc. $HON - MarketBeat,MarketBeat
"Tue, 28 Oct 2025 08:48:20 GMT",Envestnet Asset Management Inc. Has $196.72 Million Stock Position in Honeywell International Inc. $HON - MarketBeat,MarketBeat
"Thu, 30 Oct 2025 18:45:00 GMT",PSA: Service for Hon. Julius Timothy - Dominica News Online,Dominica News Online
"Thu, 30 Oct 2025 01:18:46 GMT","SPEECH BY PRIME MINISTER OF NEW ZEALAND, RT. HON CHRISTOPHER LUXON, PRIME MINISTER OF NEW ZEALAND DURING THE ASEAN-NEW ZEALAND COMMEMORATIVE SUMMIT - Press Releases - Portal - kln.gov.my",kln.gov.my
"Mon, 27 Oct 2025 16:16:24 GMT","Official Statement from Hon. Shaun D. Malcolm Minister of Home Affairs, Religious Affairs & Transportation on the Passing of Archbishop Drexel Wellington Gomez - TCI Sun",TCI Sun
2025-10-30T15:01:00,Solstice Advanced Materials Starts Trading. It’s a Play on AI and Nuclear Power.,Yahoo
2025-10-30T13:02:00,Honeywell completes spinoff of Solstice Advanced Materials,Yahoo
2025-10-30T12:00:00,HONEYWELL COMPLETES SPIN-OFF OF SOLSTICE ADVANCED MATERIALS,Yahoo
2025-10-30T12:00:00,SOLSTICE ADVANCED MATERIALS COMPLETES SPIN-OFF FROM HONEYWELL AND BEGINS TRADING ON NASDAQ,Yahoo
2025-10-30T09:57:00,Jim Cramer Discusses Honeywell (HON)’s Split In Detail,Yahoo
2025-10-30T08:15:38,How CarMax's (KMX) Shift from S&P 500 to S&P 600 May Affect Investor Positioning,Yahoo
2025-10-30T06:41:06,The 5 Most Interesting Analyst Questions From Honeywell’s Q3 Earnings Call,Yahoo
2025-10-29T17:14:36,A Fresh Look at Honeywell (HON) Valuation as Shares Trend Higher,Yahoo
2025-10-29T12:15:28,Honeywell International (NASDAQ:HON) Is Paying Out A Larger Dividend Than Last Year,Yahoo
2025-10-29T02:26:54,"RBC Upgrades Honeywell (HON) to Outperform, Sees Catalyst-Rich Phase Ahead",Yahoo
2025-10-28T20:03:02,"Dear Honeywell Stock Fans, Mark Your Calendars for October 30",Yahoo
2025-10-28T14:18:00,The S&P 500 Just Added 2 Stocks—and Booting 2 Other Stocks.,Yahoo
2025-10-28T13:00:00,HONEYWELL ANNOUNCES PARTICIPATION AT UPCOMING INVESTOR CONFERENCES,Yahoo
2025-10-28T12:30:00,"HONEYWELL INTRODUCES NEW, INNOVATIVE TECHNOLOGY THAT PRODUCES LOW-COST, HIGH QUALITY RENEWABLE FUELS FROM BIOMASS",Yahoo
2025-10-28T10:15:51,Is Honeywell Fairly Priced After Recent Sustainability Initiatives and 4.4% Weekly Gain?,Yahoo
2025-10-27T23:06:00,The S&P 500 Adds 2 Spinoffs to the Index. Here’s Who Is Leaving.,Yahoo
2025-10-27T16:54:17,Barclays Raises Honeywell (HON) PT After Q3 Earnings,Yahoo
2025-10-27T16:42:01,"Wall Street is Pounding the Table Over HON, GOOG, AAPL, MSFT, BKNG, and TSLA",Yahoo
2025-10-27T16:42:00,"Airspace and Procedure Design Industry Research Report 2025-2033 Featuring Adacel, Leonardo, Frequentis, Advanced Navigation and Positioning, Honeywell, L3Harris, Indra Sistemas, RTX, Saab, THALES",Yahoo
2025-10-27T16:40:01,MARUY or HON: Which Is the Better Value Stock Right Now?,Yahoo
2025-10-27T16:00:41,"Honeywell's Q3 Marks Start of Catalyst-Rich Phase Ahead of Breakup, RBC Says",Yahoo
2025-10-27T15:35:42,"Five Below, Honeywell, Booking: Top Analyst Calls",Yahoo
2025-10-27T13:44:00,"Aviation Cyber Security Market Trends and Growth Forecast (2025-2032) Featuring Profiles of Key Players - Honeywell International, Collins Aerospace, Thales, Leonardo, Safran and More",Yahoo
