Date,Title,Source
2025-09-18T10:11:41Z,"Hulk Hogan’s Ex-Wife Linda Thinks Emmys In Memoriam Snub Was Over Trump Support: ‘Just a Guess, but They Should Have Named Him’",Variety
2025-09-17T13:13:04Z,New Grand Strategy Game Systemic War Announced,Bleeding Cool News
2025-09-17T12:31:00Z,FRANKENSTEIN Image Teases a Chilling New Look At Jacob Elordi's Monster,GeekTyrant
2025-09-17T09:43:34Z,"Marvel Zombies New Poster & Spot Preview Captain America, Spider-Man & More",Superherohype.com
2025-09-17T09:00:10Z,Raffles unveils next chapter of ‘The Butler Did It’,Luxurydaily.com
2025-09-17T08:16:48Z,"2,778 Shares in Edwards Lifesciences Corporation $EW Purchased by Apella Capital LLC",ETF Daily News
2025-09-16T21:28:00Z,"EDWARDS (EW) ALERT: Bragar Eagel & Squire, P.C. is Investigating Edwards Lifesciences Corporation on Behalf of Long-Term Stockholders and Encourages Investors to Contact the Firm",GlobeNewswire
2025-09-16T20:00:00Z,What Time Is ‘The Summer I Turned Pretty’ Finale Out?,TheWrap
2025-09-16T19:37:03Z,Marvel Zombies Teaser: Who Can Stop Earth's Mightiest (Undead) Heroes?,Bleeding Cool News
2025-09-16T14:07:49Z,Tony Todd’s Wife Responds To The Late Actor Being Left Out Of The Emmys In Memoriam Segment,CinemaBlend
2025-09-16T14:00:00Z,The influence of investor sentiment on the Chinese stock market amid COVID-19: An event study analysis,Plos.org
2025-09-16T13:09:22Z,"FRANKENSTEIN Image Reveals A Chilling New Look At Jacob Elordi's ""Staggeringly Beautiful"" Monster",CBM (Comic Book Movie)
2025-09-15T22:00:00Z,"Casting News: Elsbeth Stages Good Wife Reunion, Stanley Tucci Joins NBC Winter Olympics Coverage and More",TVLine
2025-09-15T14:57:00Z,Ewan McGregor Recalls How His Obi-Wan Kenobi Stunt Double ‘Broke His Teeth’ Filming ATTACK OF THE CLONES,GeekTyrant
2025-09-15T14:00:00Z,The size-weight illusion and beyond: A new model of perceived weight,Plos.org
2025-09-15T08:40:50Z,Edwards Lifesciences (NYSE:EW) Cut to Buy at Wall Street Zen,ETF Daily News
2025-09-15T01:23:59Z,Global Stocks Hold Near Record As Focus Turns To Fed Meet: Markets Wrap,Ndtvprofit.com
2025-09-14T07:31:28Z,"3,168 Shares in Edwards Lifesciences Corporation $EW Purchased by Integrity Alliance LLC.",ETF Daily News
"Fri, 19 Sep 2025 04:35:11 GMT",Short Interest in Edwards Lifesciences Corporation (NYSE:EW) Expands By 27.1% - MarketBeat,MarketBeat
"Thu, 18 Sep 2025 16:34:00 GMT",EW May 2026 Options Begin Trading - Nasdaq,Nasdaq
"Thu, 18 Sep 2025 12:04:38 GMT","EDGE Showcases Advanced UAV, Radar, EW Systems at Partner 2025 - uasweekly.com",uasweekly.com
"Thu, 18 Sep 2025 06:24:04 GMT",Patria to introduce a newly developed situational awareness product at EW LIVE 2025 - patriagroup.com,patriagroup.com
"Wed, 17 Sep 2025 15:00:00 GMT",Collins Aerospace to Provide NATO With EW and Combat Monitoring Solution - The Defense Post,The Defense Post
"Fri, 19 Sep 2025 04:41:34 GMT",Association of Old Crows is Back in Asia: The AOC Asia Symposium is Back for the First Time Since the Pandemic! - Asian Military Review,Asian Military Review
"Wed, 17 Sep 2025 00:06:09 GMT","EDWARDS (EW) ALERT: Bragar Eagel & Squire, P.C. is - GlobeNewswire",GlobeNewswire
"Wed, 17 Sep 2025 16:23:01 GMT",'Wicked: For Good' reveals titles of 2 brand-new songs sung by Cynthia Erivo Ariana Grande - Entertainment Weekly,Entertainment Weekly
"Thu, 18 Sep 2025 10:08:11 GMT",Russian EW Systems Struggle Against Ukraine's New Fiber-Optic Drones - Военное дело,Военное дело
"Wed, 17 Sep 2025 15:46:15 GMT","Tampa Bay Lightning, E.W. Scripps Co. launch team’s new local TV home - Sports Business Journal",Sports Business Journal
"Thu, 18 Sep 2025 08:10:32 GMT",Edwards Lifesciences Corporation $EW Shares Bought by Czech National Bank - MarketBeat,MarketBeat
"Thu, 18 Sep 2025 20:54:39 GMT",It's a “Mamma Mia” reunion! Amanda Seyfried and Lily James hug it out at EW and PEOPLE's TIFF studio: 'Very proud of my daughter' - AOL.com,AOL.com
"Thu, 18 Sep 2025 17:30:00 GMT","Unusual Options Activity: SIRI, EW and Others Attract Market Bets, SIRI V/OI Ratio Reaches 115.3 - 富途牛牛",富途牛牛
"Fri, 19 Sep 2025 05:37:41 GMT",THULE EW G2 - 3 Bike Rack - Bike Hub,Bike Hub
"Mon, 15 Sep 2025 12:30:30 GMT","Institutional investors in Edwards Lifesciences Corporation (NYSE:EW) see US$1.5b decrease in market cap last week, although long-term gains have benefitted them. - uk.finance.yahoo.com",uk.finance.yahoo.com
"Tue, 16 Sep 2025 22:52:30 GMT",Edwards Lifesciences Corporation $EW Shares Sold by NewEdge Advisors LLC - MarketBeat,MarketBeat
"Wed, 17 Sep 2025 09:58:33 GMT",Bowman & Co S.C. Trims Stake in Edwards Lifesciences Corporation $EW - MarketBeat,MarketBeat
"Wed, 17 Sep 2025 07:00:00 GMT",Edwards Lifesciences Corporation $EW Shares Sold by Militia Capital Partners LP - MarketBeat,MarketBeat
"Wed, 17 Sep 2025 07:00:00 GMT","Intech Investment Management LLC Sells 93,151 Shares of Edwards Lifesciences Corporation $EW - MarketBeat",MarketBeat
"Mon, 15 Sep 2025 00:05:00 GMT",How to watch EW And PEOPLE's live red carpet show at the Emmys - Entertainment Weekly,Entertainment Weekly
"Wed, 17 Sep 2025 06:42:12 GMT","Edwards Lifesciences Corporation (NYSE:EW) Receives Consensus Rating of ""Moderate Buy"" from Brokerages - MarketBeat",MarketBeat
"Tue, 16 Sep 2025 10:08:15 GMT",Pacific Capital Partners Ltd Makes New Investment in Edwards Lifesciences Corporation $EW - MarketBeat,MarketBeat
"Tue, 16 Sep 2025 07:13:39 GMT",Focus Partners Wealth Grows Stock Holdings in Edwards Lifesciences Corporation $EW - MarketBeat,MarketBeat
"Tue, 16 Sep 2025 13:47:00 GMT",Ukraine says Russia's new jet-powered attack drone is full of foreign parts and immune to electronic warfare - Business Insider,Business Insider
"Tue, 16 Sep 2025 16:14:01 GMT",'The View' audience gasps as Whoopi Goldberg announces Robert Redford death - Entertainment Weekly,Entertainment Weekly
"Wed, 17 Sep 2025 11:00:24 GMT",East West Petroleum Announces Name Change and Consolidation - TradingView,TradingView
"Wed, 17 Sep 2025 11:00:00 GMT",East West Petroleum Announces Name Change and Consolidation - Newsfile,Newsfile
"Wed, 17 Sep 2025 09:18:35 GMT",Air Force Approves New Electronic Warfare Suite for F-15E Fighter - MSN,MSN
"Mon, 15 Sep 2025 10:35:40 GMT","Jacobs & Co. CA Sells 7,261 Shares of Edwards Lifesciences Corporation $EW - MarketBeat",MarketBeat
"Mon, 15 Sep 2025 07:00:00 GMT",Glenview Trust co Decreases Position in Edwards Lifesciences Corporation $EW - MarketBeat,MarketBeat
"Mon, 15 Sep 2025 09:52:52 GMT","24,437 Shares in Edwards Lifesciences Corporation $EW Purchased by AG2R LA Mondiale Gestion D Actifs - MarketBeat",MarketBeat
"Mon, 15 Sep 2025 08:06:19 GMT",Edwards Lifesciences Corporation $EW Shares Sold by Swedbank AB - MarketBeat,MarketBeat
"Mon, 15 Sep 2025 09:36:01 GMT",Capable of overcoming EW at 40+ km: Brave1 completes testing of kamikaze attack drones - Українські Національні Новини,Українські Національні Новини
"Mon, 15 Sep 2025 07:56:21 GMT","Caxton Associates LLP Invests $370,000 in Edwards Lifesciences Corporation $EW - MarketBeat",MarketBeat
"Mon, 15 Sep 2025 07:48:24 GMT",Strs Ohio Makes New $9.49 Million Investment in Edwards Lifesciences Corporation $EW - MarketBeat,MarketBeat
"Mon, 15 Sep 2025 07:00:00 GMT",MBB Public Markets I LLC Takes Position in Edwards Lifesciences Corporation $EW - MarketBeat,MarketBeat
"Mon, 15 Sep 2025 09:28:43 GMT",Voya Investment Management LLC Lowers Position in Edwards Lifesciences Corporation $EW - MarketBeat,MarketBeat
"Mon, 15 Sep 2025 08:54:32 GMT","Acadian Asset Management LLC Acquires 88,099 Shares of Edwards Lifesciences Corporation $EW - MarketBeat",MarketBeat
"Mon, 15 Sep 2025 05:45:41 GMT",Edwards Lifesciences (NYSE:EW) Lowered to Buy Rating by Wall Street Zen - MarketBeat,MarketBeat
"Sun, 14 Sep 2025 10:46:51 GMT","Howe & Rusling Inc. Purchases 4,351 Shares of Edwards Lifesciences Corporation $EW - MarketBeat",MarketBeat
"Sun, 14 Sep 2025 07:00:00 GMT","Woodline Partners LP Acquires 814,917 Shares of Edwards Lifesciences Corporation $EW - MarketBeat",MarketBeat
"Sun, 14 Sep 2025 07:00:00 GMT","14,705 Shares in Edwards Lifesciences Corporation $EW Bought by Voleon Capital Management LP - MarketBeat",MarketBeat
"Thu, 18 Sep 2025 08:18:49 GMT","Drone interceptors, missiles, and electronic warfare: Latvia tests new UAV defense systems - Мілітарний",Мілітарний
"Tue, 16 Sep 2025 03:49:55 GMT",Fundamentals Check: How volatile is The EW Scripps Company stock - Weekly Profit Summary & Daily Growth Stock Tips - khodrobank.com,khodrobank.com
"Wed, 17 Sep 2025 12:06:05 GMT",Thule 3 Bike Rack EW G2 - Bike Hub,Bike Hub
2025-09-15T15:30:30,"Institutional investors in Edwards Lifesciences Corporation (NYSE:EW) see US$1.5b decrease in market cap last week, although long-term gains have benefitted them.",Yahoo
