Date,Title,Source
"Wed, 03 Dec 2025 14:07:04 GMT",Van Hulzen Asset Management LLC Grows Stake in Stryker Corporation $SYK - MarketBeat,MarketBeat
"Wed, 03 Dec 2025 09:50:54 GMT","Groupe la Francaise Purchases 46,259 Shares of Stryker Corporation $SYK - MarketBeat",MarketBeat
"Mon, 01 Dec 2025 08:29:04 GMT","Boston Family Office LLC Purchases 1,882 Shares of Stryker Corporation $SYK - MarketBeat",MarketBeat
"Tue, 02 Dec 2025 10:04:03 GMT",Stryker Corporation $SYK Shares Sold by Fisher Asset Management LLC - MarketBeat,MarketBeat
"Tue, 02 Dec 2025 12:01:38 GMT",Lido Advisors LLC Raises Position in Stryker Corporation $SYK - MarketBeat,MarketBeat
"Tue, 02 Dec 2025 12:29:38 GMT","Panagora Asset Management Inc. Acquires 84,546 Shares of Stryker Corporation $SYK - MarketBeat",MarketBeat
"Mon, 01 Dec 2025 13:37:06 GMT",Railway Pension Investments Ltd Cuts Position in Stryker Corporation $SYK - MarketBeat,MarketBeat
"Sun, 30 Nov 2025 13:02:26 GMT",Mackenzie Financial Corp Lowers Stake in Stryker Corporation $SYK - MarketBeat,MarketBeat
"Sun, 30 Nov 2025 11:37:05 GMT","Groupama Asset Managment Buys 3,748 Shares of Stryker Corporation $SYK - MarketBeat",MarketBeat
"Sun, 30 Nov 2025 12:34:25 GMT",Stryker Corporation $SYK Shares Sold by New York State Common Retirement Fund - MarketBeat,MarketBeat
"Sun, 30 Nov 2025 08:42:47 GMT",Capital Fund Management S.A. Invests $9.81 Million in Stryker Corporation $SYK - MarketBeat,MarketBeat
"Sun, 30 Nov 2025 12:36:25 GMT","Schroder Investment Management Group Acquires 137,100 Shares of Stryker Corporation $SYK - MarketBeat",MarketBeat
"Sat, 29 Nov 2025 14:17:11 GMT",Virtus Investment Advisers LLC Acquires New Holdings in Stryker Corporation $SYK - MarketBeat,MarketBeat
"Sat, 29 Nov 2025 13:28:34 GMT","4,757,408 Shares in Stryker Corporation $SYK Bought by Norges Bank - MarketBeat",MarketBeat
"Sat, 29 Nov 2025 14:17:07 GMT",Skandinaviska Enskilda Banken AB publ Raises Stock Position in Stryker Corporation $SYK - MarketBeat,MarketBeat
"Sat, 29 Nov 2025 12:45:23 GMT",Scotia Capital Inc. Grows Stake in Stryker Corporation $SYK - MarketBeat,MarketBeat
"Sat, 29 Nov 2025 11:52:48 GMT",Stryker Corporation $SYK Shares Bought by Vinva Investment Management Ltd - MarketBeat,MarketBeat
"Sat, 29 Nov 2025 11:52:44 GMT",Quadrant Capital Group LLC Purchases 904 Shares of Stryker Corporation $SYK - MarketBeat,MarketBeat
