Date,Title,Source
"Sun, 31 Aug 2025 01:17:22 GMT",Can volume confirm reversal in CTVA - Trade Ideas & Detailed Earnings Play Alerts - Newser,Newser
"Sun, 31 Aug 2025 02:10:34 GMT",Real time alert setup for CTVA performance - Weekly Stock Report & Low Risk High Win Rate Stock Picks - Newser,Newser
"Sat, 30 Aug 2025 11:00:16 GMT",The Return Trends At Corteva (NYSE:CTVA) Look Promising - ca.finance.yahoo.com,ca.finance.yahoo.com
"Sat, 30 Aug 2025 22:53:02 GMT",Candlestick signals on CTVA stock today - Treasury Yields & Free Real-Time Volume Trigger Notifications - Newser,Newser
"Sat, 30 Aug 2025 22:05:38 GMT",Price momentum metrics for CTVA explained - 2025 Geopolitical Influence & Community Verified Trade Signals - Newser,Newser
"Sat, 30 Aug 2025 19:47:41 GMT",CTVA stock prediction for this week - 2025 Price Momentum & Fast Momentum Entry Tips - Newser,Newser
"Sun, 31 Aug 2025 06:38:51 GMT",Real time alert setup for CTVA performance - Rate Hike & Safe Capital Growth Trade Ideas - Newser,Newser
"Sun, 31 Aug 2025 03:28:09 GMT",How to read the order book for CTVA - July 2025 Opening Moves & Fast Entry and Exit Trade Plans - Newser,Newser
"Sun, 31 Aug 2025 04:58:25 GMT",CTVA stock momentum explained - 2025 Historical Comparison & Reliable Volume Spike Alerts - Newser,Newser
"Sun, 31 Aug 2025 04:44:18 GMT",Visual analytics tools that track CTVA performance - July 2025 Drop Watch & Fast Entry High Yield Stock Tips - Newser,Newser
"Sat, 30 Aug 2025 10:34:19 GMT",Can volume confirm reversal in CTVA - Earnings Summary Report & AI Driven Stock Movement Reports - Newser,Newser
"Sun, 31 Aug 2025 04:32:52 GMT",What earnings revisions data tells us about CTVA - July 2025 Action & Pattern Based Trade Signal System - Newser,Newser
"Sun, 31 Aug 2025 02:54:05 GMT",Price momentum metrics for CTVA explained - July 2025 Setups & Entry and Exit Point Strategies - Newser,Newser
"Sat, 30 Aug 2025 21:41:03 GMT",Candlestick signals on CTVA stock today - 2025 Valuation Update & Growth-Oriented Investment Plans - Newser,Newser
"Sat, 30 Aug 2025 00:40:13 GMT",How to read the order book for CTVA - Market Volume Report & AI Optimized Trading Strategy Guides - Newser,Newser
"Thu, 28 Aug 2025 22:19:04 GMT",CTVA stock daily chart insights - 2025 Market WrapUp & Safe Capital Allocation Plans - Newser,Newser
"Sat, 30 Aug 2025 23:10:08 GMT",Visual analytics tools that track CTVA performance - July 2025 Earnings & Smart Investment Allocation Insights - Newser,Newser
"Thu, 28 Aug 2025 12:21:46 GMT",Using AI based signals to follow CTVA - Quarterly Investment Review & Low Drawdown Momentum Ideas - Newser,Newser
"Sat, 30 Aug 2025 07:51:53 GMT",Backtesting results for CTVA trading strategies - Earnings Growth Summary & Safe Capital Growth Plans - Newser,Newser
"Sat, 30 Aug 2025 01:03:05 GMT",Real time alert setup for CTVA performance - Long Setup & Advanced Technical Analysis Signals - Newser,Newser
"Sat, 30 Aug 2025 04:20:58 GMT",CTVA stock chart pattern explained - Dip Buying & Fast Gain Stock Tips - Newser,Newser
"Sat, 30 Aug 2025 15:27:26 GMT",Forecasting CTVA price range with options data - Quarterly Trade Report & Precise Trade Entry Recommendations - Newser,Newser
"Fri, 29 Aug 2025 21:15:55 GMT",Candlestick signals on CTVA stock today - July 2025 Volume & Community Consensus Picks - Newser,Newser
"Fri, 29 Aug 2025 21:48:52 GMT",Is CTVA forming a bottoming base - Watch List & Trade Opportunity Analysis Reports - Newser,Newser
"Fri, 29 Aug 2025 19:52:27 GMT",What earnings revisions data tells us about CTVA - Portfolio Value Report & Real-Time Market Trend Scan - Newser,Newser
"Tue, 26 Aug 2025 11:18:31 GMT",Is CTVA stock entering bullish territory - Trade Risk Assessment & Fast Moving Stock Trade Plans - Newser,Newser
"Fri, 29 Aug 2025 11:22:31 GMT",Price momentum metrics for CTVA explained - Portfolio Gains Summary & Safe Capital Growth Trade Ideas - Newser,Newser
"Tue, 26 Aug 2025 18:27:02 GMT",Corteva's (NYSE:CTVA) Shareholders Will Receive A Bigger Dividend Than Last Year - simplywall.st,simplywall.st
"Thu, 28 Aug 2025 05:25:16 GMT",What institutional flow reveals about CTVA - July 2025 Patterns & Entry and Exit Point Strategies - Newser,Newser
"Fri, 29 Aug 2025 19:49:18 GMT",CTVA stock momentum explained - Trend Reversal & Fast Exit/Entry Strategy Plans - Newser,Newser
"Thu, 28 Aug 2025 17:38:30 GMT",What earnings revisions data tells us about CTVA - Portfolio Update Summary & High Conviction Buy Zone Alerts - Newser,Newser
"Sat, 30 Aug 2025 11:38:22 GMT",Applying Wyckoff theory to CTVA stock - July 2025 Macro Moves & Reliable Price Breakout Signals - Newser,Newser
"Fri, 29 Aug 2025 20:21:07 GMT",CTVA Stock Poised for Technical Comeback getLinesFromResByArray error: size == 0 - sisain.net,sisain.net
2025-08-30T13:00:16,The Return Trends At Corteva (NYSE:CTVA) Look Promising,Yahoo
2025-08-26T14:00:00,Corteva Appoints Jennifer Johnson Chief Legal Officer,Yahoo
