Date,Title,Source
2025-09-08T17:00:00Z,Mears Connect Standard – Late Night Arrival,Touringplans.com
"Mon, 08 Sep 2025 20:45:53 GMT",11 nonstop flights from Orlando's MCO to Canada - LALtoday,LALtoday
"Wed, 10 Sep 2025 04:34:01 GMT",Understanding Momentum Shifts in (MCO) - news.stocktradersdaily.com,news.stocktradersdaily.com
"Wed, 10 Sep 2025 01:17:36 GMT",Moody's Corporation $MCO Shares Sold by Ironvine Capital Partners LLC - MarketBeat,MarketBeat
"Fri, 05 Sep 2025 09:34:57 GMT",Nanoscope Nabs RMAT Designation for Retinitis Pigmentosa Gene Therapy MCO-010 - CGTLive®,CGTLive®
"Tue, 09 Sep 2025 04:41:36 GMT",Is Orlando International Airport (MCO) open after Hurricane Milton? - MSN,MSN
"Tue, 09 Sep 2025 12:18:02 GMT",(MCO) Price Dynamics and Execution-Aware Positioning - news.stocktradersdaily.com,news.stocktradersdaily.com
"Tue, 09 Sep 2025 09:39:40 GMT",Petrus Trust Company LTA Acquires New Shares in Moody's Corporation $MCO - MarketBeat,MarketBeat
"Tue, 09 Sep 2025 16:22:02 GMT",How Moody's Corporation (MCO) Affects Rotational Strategy Timing - news.stocktradersdaily.com,news.stocktradersdaily.com
"Tue, 09 Sep 2025 12:54:26 GMT","Select Equity Group L.P. Sells 5,728 Shares of Moody's Corporation $MCO - MarketBeat",MarketBeat
"Tue, 09 Sep 2025 11:24:16 GMT",Moody's Corporation $MCO Shares Bought by UniSuper Management Pty Ltd - MarketBeat,MarketBeat
"Mon, 08 Sep 2025 15:58:02 GMT",Liquidity Mapping Around (MCO) Price Events - news.stocktradersdaily.com,news.stocktradersdaily.com
"Tue, 09 Sep 2025 09:05:51 GMT","Alliancebernstein L.P. Acquires 5,942 Shares of Moody's Corporation $MCO - MarketBeat",MarketBeat
"Mon, 08 Sep 2025 07:50:01 GMT",(MCO) as a Liquidity Pulse for Institutional Tactics - news.stocktradersdaily.com,news.stocktradersdaily.com
"Tue, 09 Sep 2025 07:00:00 GMT",NatWest Group plc Makes New $10.31 Million Investment in Moody's Corporation $MCO - MarketBeat,MarketBeat
"Mon, 08 Sep 2025 11:30:11 GMT",Gotham Asset Management LLC Has $16.63 Million Holdings in Moody's Corporation $MCO - MarketBeat,MarketBeat
"Sun, 07 Sep 2025 17:37:30 GMT",Promethium Advisors LLC Raises Holdings in Moody's Corporation $MCO - MarketBeat,MarketBeat
"Fri, 05 Sep 2025 18:19:46 GMT",Nanoscope strengthens global regulatory pathways for MCO-010 with FDA RMAT and five EMA Orphan Designations - Eyes On Eyecare,Eyes On Eyecare
"Sat, 06 Sep 2025 16:07:30 GMT","Harris Associates L P Sells 5,031 Shares of Moody's Corporation $MCO - MarketBeat",MarketBeat
"Sat, 06 Sep 2025 16:07:30 GMT",Moody's Corporation $MCO Shares Acquired by Maverick Capital Ltd. - MarketBeat,MarketBeat
"Mon, 08 Sep 2025 01:08:57 GMT","MCO, EFCC strengthen collaboration to combat economic crimes in mining - Businessday NG",Businessday NG
"Sat, 06 Sep 2025 16:07:30 GMT",Moody's Corporation $MCO Stock Holdings Lifted by Dark Forest Capital Management LP - MarketBeat,MarketBeat
"Sat, 06 Sep 2025 07:00:00 GMT",The Manufacturers Life Insurance Company Reduces Holdings in Moody's Corporation $MCO - MarketBeat,MarketBeat
"Fri, 05 Sep 2025 17:24:13 GMT",Moody's: The Perpetual Cash Flow Machine (NYSE:MCO) - Seeking Alpha,Seeking Alpha
"Sat, 06 Sep 2025 16:07:30 GMT","Evergreen Quality Fund GP Ltd. Sells 84,048 Shares of Moody's Corporation $MCO - MarketBeat",MarketBeat
"Sat, 06 Sep 2025 10:57:57 GMT",AlTi Global Inc. Reduces Holdings in Moody's Corporation $MCO - MarketBeat,MarketBeat
"Sat, 06 Sep 2025 09:43:18 GMT","Baird Financial Group Inc. Buys 7,263 Shares of Moody's Corporation $MCO - MarketBeat",MarketBeat
"Sat, 06 Sep 2025 07:00:00 GMT",Moody's Corporation $MCO Shares Sold by First Manhattan CO. LLC. - MarketBeat,MarketBeat
"Sat, 06 Sep 2025 07:00:00 GMT",Hhlr Advisors LTD. Has $1.23 Million Holdings in Moody's Corporation $MCO - MarketBeat,MarketBeat
"Fri, 05 Sep 2025 10:15:59 GMT",Moody's Corporation $MCO Stake Increased by 11 Capital Partners LP - MarketBeat,MarketBeat
"Fri, 05 Sep 2025 07:00:00 GMT","Marshfield Associates Buys 2,779 Shares of Moody's Corporation $MCO - MarketBeat",MarketBeat
"Fri, 05 Sep 2025 07:00:00 GMT","Graham Capital Management L.P. Purchases 6,099 Shares of Moody's Corporation $MCO - MarketBeat",MarketBeat
"Fri, 05 Sep 2025 07:00:00 GMT",Benchstone Capital Management LP Cuts Stake in Moody's Corporation $MCO - MarketBeat,MarketBeat
"Fri, 05 Sep 2025 09:58:02 GMT",Perbak Capital Partners LLP Takes Position in Moody's Corporation $MCO - MarketBeat,MarketBeat
"Fri, 05 Sep 2025 07:00:00 GMT","Magnetar Financial LLC Purchases Shares of 2,535 Moody's Corporation $MCO - MarketBeat",MarketBeat
"Fri, 05 Sep 2025 07:00:00 GMT",Retirement Planning Co of New England Inc. Takes $1.56 Million Position in Moody's Corporation $MCO - MarketBeat,MarketBeat
