Date,Title,Source
"Mon, 08 Sep 2025 14:15:00 GMT",Can ALNY's Key Partnerships With Pharma Giants Drive Long-Term Growth? - Yahoo Finance,Yahoo Finance
"Mon, 08 Sep 2025 16:21:12 GMT",What is the next catalyst for ALNY - July 2025 Earnings & Expert Curated Trade Setups - beatles.ru,beatles.ru
"Sat, 06 Sep 2025 14:21:50 GMT",How Investors May Respond To Alnylam Pharmaceuticals (ALNY) Positive Long-Term HELIOS-B Results for AMVUTTRA - simplywall.st,simplywall.st
"Mon, 08 Sep 2025 07:21:29 GMT","HC Wainwright Reaffirms ""Buy"" Rating for Alnylam Pharmaceuticals (NASDAQ:ALNY) - MarketBeat",MarketBeat
"Fri, 05 Sep 2025 14:49:00 GMT","Notable ETF Outflow Detected - XBI, ALNY, INSM, HALO - Nasdaq",Nasdaq
"Sat, 06 Sep 2025 09:48:18 GMT",How do insiders feel about ALNY - Rate Hike & Low Risk Profit Maximizing Plans - 강소기업뉴스,강소기업뉴스
"Mon, 08 Sep 2025 16:15:18 GMT",Ichimoku Cloud Indicates Uncertainty Around ALNY - 2025 EndofYear Setup & Real-Time Buy Signal Notifications - beatles.ru,beatles.ru
"Sat, 06 Sep 2025 06:12:41 GMT",Does ALNY have consistent dividend growth - July 2025 PreEarnings & Fast Entry Momentum Alerts - خودرو بانک,خودرو بانک
"Mon, 08 Sep 2025 14:56:56 GMT",ALNY Flashes Rebound Signal in Oversold Condition - 2025 Key Highlights & Accurate Trade Setup Notifications - beatles.ru,beatles.ru
"Sat, 06 Sep 2025 08:52:51 GMT",What is the next catalyst for ALNY - Dollar Strength & High Accuracy Trade Alerts - خودرو بانک,خودرو بانک
"Mon, 08 Sep 2025 04:49:23 GMT",Is ALNY benefiting from interest rate changes - Quarterly Market Review & Verified Momentum Stock Alerts - beatles.ru,beatles.ru
"Thu, 04 Sep 2025 23:30:44 GMT",What is the next catalyst for ALNY - 2025 Sector Review & Risk Managed Investment Strategies - خودرو بانک,خودرو بانک
"Mon, 08 Sep 2025 20:15:00 GMT",Alnylam Announces Proposed Offering of $500 Million Convertible Senior Notes - Business Wire,Business Wire
"Thu, 04 Sep 2025 15:25:00 GMT",Are Options Traders Betting on a Big Move in Alnylam Pharmaceuticals Stock? - TradingView,TradingView
"Fri, 05 Sep 2025 00:16:34 GMT",Is ALNY benefiting from interest rate changes - Price Action & High Accuracy Investment Signals - خودرو بانک,خودرو بانک
"Mon, 08 Sep 2025 20:44:16 GMT",Alnylam announces proposed offering of $500M convertible senior notes - MSN,MSN
"Fri, 05 Sep 2025 18:25:22 GMT",Is now the right time to enter ALNY - 2025 Market Outlook & Smart Investment Allocation Insights - خودرو بانک,خودرو بانک
"Thu, 04 Sep 2025 12:55:09 GMT",What’s the outlook for ALNY’s sector - 2025 Sector Review & Real-Time Volume Triggers - خودرو بانک,خودرو بانک
"Tue, 09 Sep 2025 06:42:44 GMT",What momentum shifts mean for ALNY - Quarterly Profit Review & Safe Investment Capital Preservation Plans - Newser,Newser
"Thu, 04 Sep 2025 16:07:36 GMT",What is the next catalyst for ALNY - Quarterly Earnings Summary & High Accuracy Swing Entry Alerts - خودرو بانک,خودرو بانک
"Tue, 09 Sep 2025 06:27:23 GMT",is alny meeting your algorithmic filter criteria - 2025 Price Action Summary & AI Based Trade Execution Alerts - Newser,Newser
"Tue, 09 Sep 2025 03:19:03 GMT",Is ALNY meeting your algorithmic filter criteria - Market Risk Report & Community Trade Idea Sharing Platform - Newser,Newser
"Tue, 09 Sep 2025 02:20:05 GMT",ALNY recovery potential after sell off - Weekly Stock Recap & Weekly Setup with ROI Potential - Newser,Newser
"Tue, 09 Sep 2025 02:35:09 GMT",Can momentum traders help lift ALNY - Trade Exit Summary & Long Hold Capital Preservation Tips - Newser,Newser
"Tue, 09 Sep 2025 03:15:45 GMT",Will earnings trigger a reversal in ALNY - 2025 Earnings Surprises & Fast Moving Market Watchlists - Newser,Newser
"Tue, 09 Sep 2025 02:27:25 GMT",Detecting price anomalies in ALNY with AI - Earnings Beat & Free Low Drawdown Momentum Trade Ideas - Newser,Newser
"Tue, 09 Sep 2025 06:39:20 GMT",Will earnings trigger a reversal in ALNY - Gap Up & Weekly Chart Analysis and Trade Guides - Newser,Newser
"Tue, 09 Sep 2025 06:24:07 GMT",Is a relief rally coming for ALNY holders - Market Growth Summary & Weekly Setup with High ROI Potential - Newser,Newser
"Mon, 08 Sep 2025 11:50:10 GMT",Using flow based indicators on ALNY - 2025 Earnings Impact & Weekly Top Gainers Trade List - Newser,Newser
"Mon, 08 Sep 2025 19:19:51 GMT",Regression analysis insights on ALNY performance - Earnings Growth Report & Entry Point Confirmation Alerts - Newser,Newser
"Tue, 09 Sep 2025 02:04:29 GMT",Is ALNY meeting your algorithmic filter criteria - Weekly Gains Summary & High Conviction Buy Zone Picks - Newser,Newser
"Mon, 08 Sep 2025 20:40:47 GMT",Does ALNY fit your quant trading model - 2025 Sector Review & Real-Time Buy Signal Notifications - Newser,Newser
"Tue, 09 Sep 2025 01:58:22 GMT",ALNY recovery potential after sell off - 2025 Price Action Summary & Smart Investment Allocation Tips - Newser,Newser
"Tue, 09 Sep 2025 01:30:37 GMT",Price action breakdown for ALNY - Portfolio Risk Summary & Low Drawdown Momentum Trade Ideas - Newser,Newser
"Mon, 08 Sep 2025 19:34:52 GMT",How to integrate ALNY into portfolio analysis tools - July 2025 Breakouts & High Yield Equity Trading Tips - Newser,Newser
"Mon, 08 Sep 2025 11:23:01 GMT",Order flow analysis tools used on ALNY - Weekly Profit Summary & Weekly High Potential Stock Alerts - Newser,Newser
"Sun, 07 Sep 2025 06:58:02 GMT",Alnylam Pharmaceuticals (NASDAQ:ALNY) Stock Rating Lowered by Wall Street Zen - Defense World,Defense World
2025-09-04T18:25:00,Are Options Traders Betting on a Big Move in Alnylam Pharmaceuticals Stock?,Yahoo
