Date,Title,Source
2025-09-17T09:18:57Z,"Applied Materials, Inc. $AMAT Shares Acquired by NBC Securities Inc.",ETF Daily News
2025-09-17T06:16:45Z,"Short Interest in Applied Materials, Inc. (NASDAQ:AMAT) Increases By 37.3%",ETF Daily News
2025-09-17T03:01:09Z,Applied Materials (AMAT) Stock: Downgraded to Neutral as Competition Rises in China,Yahoo Entertainment
2025-09-16T08:01:00Z,"Wesbanco Bank Inc. Boosts Stock Holdings in Applied Materials, Inc. $AMAT",ETF Daily News
2025-09-14T08:34:53Z,"Applied Materials, Inc. $AMAT Shares Acquired by Belpointe Asset Management LLC",ETF Daily News
2025-09-14T07:14:50Z,Applied Materials (NASDAQ:AMAT) Given “Neutral” Rating at Mizuho,ETF Daily News
"Fri, 19 Sep 2025 04:41:15 GMT","Bishop Amat girls volleyball fights back, but Bishop Montgomery sweeps - San Gabriel Valley Tribune",San Gabriel Valley Tribune
"Thu, 18 Sep 2025 19:16:00 GMT",$AMAT stock is up 6% today. Here's what we see in our data. - Quiver Quantitative,Quiver Quantitative
"Thu, 18 Sep 2025 17:31:11 GMT","SA analyst upgrades/downgrades: AMAT, ACN, CL, and CRDO - Seeking Alpha",Seeking Alpha
"Wed, 17 Sep 2025 03:03:17 GMT",Applied Materials (AMAT) Stock: Downgraded to Neutral as Competition Rises in China - Yahoo Finance,Yahoo Finance
"Thu, 18 Sep 2025 15:15:00 GMT",AMAT's Advanced DRAM Gains Traction: Will it Sustain its Momentum? - Nasdaq,Nasdaq
"Thu, 18 Sep 2025 15:30:49 GMT","Why Are Analysts Downgrading Applied Materials, Inc. (AMAT)? - MSN",MSN
"Wed, 17 Sep 2025 19:00:00 GMT",NA’AMAT USA’s Cleveland Council honors Cantor Kathryn Wolfe Sebo - Cleveland Jewish News,Cleveland Jewish News
"Wed, 17 Sep 2025 04:52:30 GMT",Applied Materials' (AMAT) Neutral Rating Reiterated at Mizuho - MarketBeat,MarketBeat
"Sun, 14 Sep 2025 16:09:04 GMT",What Applied Materials (AMAT)'s Eighth Straight Annual Dividend Increase Means for Shareholders - simplywall.st,simplywall.st
"Wed, 17 Sep 2025 13:26:47 GMT",Applied Materials: Move To The Sidelines For Now (Downgrade) (NASDAQ:AMAT) - Seeking Alpha,Seeking Alpha
"Wed, 17 Sep 2025 15:05:00 GMT",Applied Materials Named Top Dividend Stock With Insider Buying and 1.06% Yield (AMAT) - Nasdaq,Nasdaq
"Wed, 17 Sep 2025 08:06:30 GMT","Gallacher Capital Management LLC Buys Shares of 2,238 Applied Materials, Inc. $AMAT - MarketBeat",MarketBeat
"Mon, 15 Sep 2025 14:09:00 GMT",ASYS vs. AMAT: Which Semiconductor Equipment Stock is the Better Buy? - Yahoo Finance,Yahoo Finance
"Mon, 15 Sep 2025 06:45:00 GMT","SGV football Top 30: Damien leaves no doubt; La Habra, Bishop Amat follow - San Gabriel Valley Tribune",San Gabriel Valley Tribune
"Wed, 17 Sep 2025 03:01:00 GMT",Applied Materials (AMAT) Stock: Downgraded to Neutral as Competition Rises in China - uk.finance.yahoo.com,uk.finance.yahoo.com
"Wed, 17 Sep 2025 09:18:00 GMT","Analysts Offer Insights on Technology Companies: WhiteFiber, Inc. (WYFI) and Applied Materials (AMAT) - The Globe and Mail",The Globe and Mail
"Wed, 17 Sep 2025 06:41:48 GMT",Volleyball Recap: Bishop Amat Extends Winning Streak to Five - MaxPreps.com,MaxPreps.com
"Mon, 15 Sep 2025 11:06:27 GMT","Avity Investment Management Inc. Acquires 8,680 Shares of Applied Materials, Inc. $AMAT - MarketBeat",MarketBeat
"Mon, 15 Sep 2025 07:00:00 GMT","Great Lakes Advisors LLC Sells 1,931 Shares of Applied Materials, Inc. $AMAT - MarketBeat",MarketBeat
"Mon, 15 Sep 2025 01:45:31 GMT",Cash Bryant Game Report: vs Bishop Amat + How To Watch - MaxPreps.com,MaxPreps.com
"Tue, 16 Sep 2025 09:38:18 GMT",Momentum Shift: Whats the fair value of AMAT stock - Profit Target & Safe Swing Trade Setup Alerts - khodrobank.com,khodrobank.com
"Tue, 16 Sep 2025 17:38:07 GMT",Rally Mode: Whats the fair value of AMAT stock - July 2025 Weekly Recap & Real-Time Buy Signal Notifications - khodrobank.com,khodrobank.com
"Tue, 16 Sep 2025 18:34:49 GMT",Ideas Watch: Will AMAT benefit from rising consumer demand - Portfolio Risk Report & Fast Gain Stock Tips - khodrobank.com,khodrobank.com
"Mon, 15 Sep 2025 18:58:37 GMT",Bond Watch: Will AMAT stock benefit from M&A - Market Activity Report & Weekly High Return Forecasts - khodrobank.com,khodrobank.com
"Fri, 19 Sep 2025 04:14:28 GMT",Should you hold or exit AMAT now - Earnings Risk Summary & Weekly Return Optimization Plans - newser.com,newser.com
"Thu, 18 Sep 2025 16:03:36 GMT",AMAT stock outlook for YEAR - Quarterly Profit Report & Risk Managed Investment Entry Signals - newser.com,newser.com
"Wed, 17 Sep 2025 20:42:36 GMT",Using RSI to spot recovery in AMAT - 2025 Price Momentum & Low Drawdown Investment Ideas - newser.com,newser.com
"Wed, 17 Sep 2025 02:59:40 GMT",Comparing AMAT in custom built stock radars - Weekly Loss Report & Fast Moving Trade Plans - newser.com,newser.com
"Thu, 18 Sep 2025 15:33:24 GMT",Can you recover from losses in AMAT - 2025 Stock Rankings & Community Consensus Stock Picks - newser.com,newser.com
"Tue, 16 Sep 2025 14:55:18 GMT",Can you recover from losses in AMAT - July 2025 Short Interest & AI Enhanced Trade Execution Alerts - newser.com,newser.com
"Sun, 14 Sep 2025 20:20:23 GMT",Building trade automation scripts for AMAT - Weekly Volume Report & Daily Price Action Insights - newser.com,newser.com
"Mon, 15 Sep 2025 00:59:23 GMT",Is now a turning point for AMAT - Rate Hike & Safe Capital Growth Trade Ideas - newser.com,newser.com
"Wed, 17 Sep 2025 02:54:14 GMT",Statistical indicators supporting AMAT’s strength - Market Rally & Verified Momentum Stock Watchlist - newser.com,newser.com
"Tue, 16 Sep 2025 05:23:04 GMT",Is AMAT stock ready for a breakout - Weekly Gains Report & Community Trade Idea Sharing - newser.com,newser.com
"Mon, 15 Sep 2025 19:07:21 GMT",Statistical indicators supporting AMAT’s strength - Share Buyback & AI Powered Market Entry Strategies - newser.com,newser.com
"Mon, 15 Sep 2025 10:48:04 GMT",Building trade automation scripts for AMAT - Bond Market & AI Driven Price Forecasts - newser.com,newser.com
"Mon, 15 Sep 2025 04:10:19 GMT",AMAT stock momentum explained - 2025 Price Momentum & Scalable Portfolio Growth Ideas - newser.com,newser.com
"Sun, 14 Sep 2025 07:57:18 GMT","Belpointe Asset Management LLC Has $610,000 Holdings in Applied Materials, Inc. $AMAT - Defense World",Defense World
"Sun, 14 Sep 2025 07:16:14 GMT",Applied Materials (NASDAQ:AMAT) Earns Neutral Rating from Mizuho - Defense World,Defense World
2025-09-18T18:23:36,"Why Are Analysts Downgrading Applied Materials, Inc. (AMAT)?",Yahoo
2025-09-18T18:15:00,AMAT's Advanced DRAM Gains Traction: Will it Sustain its Momentum?,Yahoo
2025-09-18T14:37:26,This Week In Energy Transition - Elcogen's New Factory Powers Europe's Clean Energy Future,Yahoo
2025-09-17T06:01:09,Applied Materials (AMAT) Stock: Downgraded to Neutral as Competition Rises in China,Yahoo
2025-09-15T17:09:00,ASYS vs. AMAT: Which Semiconductor Equipment Stock is the Better Buy?,Yahoo
