Date,Title,Source
2025-10-28T22:36:45Z,Here's How Much $1000 Invested In CrowdStrike Holdings 5 Years Ago Would Be Worth Today,Biztoc.com
2025-10-28T10:48:13Z,CrowdStrike’s Q3 2026 Earnings: What to Expect,Biztoc.com
2025-10-27T13:38:16Z,Time To Book Profits In CRWD Stock?,Forbes
"Thu, 30 Oct 2025 21:45:05 GMT",CrowdStrike Holdings (CRWD) Declines More Than Market: Some Information for Investors - Yahoo Finance,Yahoo Finance
"Thu, 30 Oct 2025 23:35:17 GMT",CrowdStrike (NASDAQ:CRWD) Shares Down 1.3% - Here's Why - MarketBeat,MarketBeat
"Fri, 31 Oct 2025 06:37:13 GMT",Does CRWD show high probability of rebound - Weekly Stock Report & Technical Analysis for Trade Confirmation - newser.com,newser.com
"Thu, 30 Oct 2025 07:31:01 GMT",Alphabet’s Investment Shift: Taking Profits on CRWD - NAI500,NAI500
"Tue, 28 Oct 2025 16:32:40 GMT",CrowdStrike (CRWD): Evaluating Valuation After Back-to-Back Leadership in 2025 SaaS Security Rankings - simplywall.st,simplywall.st
"Thu, 30 Oct 2025 09:53:12 GMT",CrowdStrike (CRWD) Joins Forces with BT for New Cybersecurity Se - GuruFocus,GuruFocus
"Tue, 28 Oct 2025 19:19:00 GMT","Noteworthy Tuesday Option Activity: BKNG, MSTR, CRWD - Nasdaq",Nasdaq
"Mon, 27 Oct 2025 13:38:16 GMT",Time To Book Profits In CRWD Stock? - Forbes,Forbes
"Tue, 28 Oct 2025 19:20:37 GMT","CrowdStrike (CRWD) Stock Is Up, What You Need To Know - Yahoo Finance",Yahoo Finance
"Fri, 31 Oct 2025 05:09:59 GMT",Can CRWD stock maintain operating margins - 2025 Market Outlook & High Conviction Buy Zone Alerts - newser.com,newser.com
"Tue, 28 Oct 2025 13:00:04 GMT",Investors Heavily Search CrowdStrike (CRWD): Here is What You Need to Know - Yahoo Finance,Yahoo Finance
"Thu, 30 Oct 2025 12:08:30 GMT",Strs Ohio Cuts Holdings in CrowdStrike $CRWD - MarketBeat,MarketBeat
"Tue, 28 Oct 2025 13:30:03 GMT",Is It Worth Investing in CrowdStrike (CRWD) Based on Wall Street's Bullish Views? - Yahoo Finance,Yahoo Finance
"Thu, 30 Oct 2025 12:08:27 GMT",Adell Harriman & Carpenter Inc. Sells 678 Shares of CrowdStrike $CRWD - MarketBeat,MarketBeat
"Wed, 29 Oct 2025 09:53:54 GMT",CrowdStrike $CRWD Shares Sold by Jennison Associates LLC - MarketBeat,MarketBeat
"Wed, 29 Oct 2025 10:39:42 GMT",L.M. Kohn & Company Has $1.16 Million Stock Holdings in CrowdStrike $CRWD - MarketBeat,MarketBeat
"Wed, 29 Oct 2025 02:26:54 GMT","CrowdStrike (NASDAQ:CRWD) Director Sells $2,643,850.00 in Stock - MarketBeat",MarketBeat
"Tue, 28 Oct 2025 10:45:42 GMT","Howard Capital Management Inc. Buys 1,319 Shares of CrowdStrike $CRWD - MarketBeat",MarketBeat
"Wed, 29 Oct 2025 11:18:00 GMT","Robocap Asset Management Ltd Sells 4,317 Shares of CrowdStrike $CRWD - MarketBeat",MarketBeat
"Wed, 29 Oct 2025 10:42:00 GMT",CrowdStrike $CRWD Shares Sold by Migdal Insurance & Financial Holdings Ltd. - MarketBeat,MarketBeat
"Tue, 28 Oct 2025 18:48:00 GMT",CrowdStrike (NASDAQ: CRWD) and NVIDIA to deliver always-on AI agents for edge security - Stock Titan,Stock Titan
"Tue, 28 Oct 2025 09:18:26 GMT",CrowdStrike $CRWD Shares Sold by Teacher Retirement System of Texas - MarketBeat,MarketBeat
"Tue, 28 Oct 2025 20:57:12 GMT",CrowdStrike (NASDAQ:CRWD) Shares Up 3.3% Following Analyst Upgrade - MarketBeat,MarketBeat
"Tue, 28 Oct 2025 10:47:07 GMT",Boyd Watterson Asset Management LLC OH Lowers Holdings in CrowdStrike $CRWD - MarketBeat,MarketBeat
"Tue, 28 Oct 2025 08:10:16 GMT",539 Shares in CrowdStrike $CRWD Bought by Leavell Investment Management Inc. - MarketBeat,MarketBeat
"Wed, 29 Oct 2025 09:09:31 GMT",Clark Asset Management LLC Buys New Shares in CrowdStrike $CRWD - MarketBeat,MarketBeat
"Tue, 28 Oct 2025 12:18:50 GMT",CrowdStrike (NASDAQ:CRWD) Rating Increased to Buy at Arete - MarketBeat,MarketBeat
"Wed, 29 Oct 2025 08:55:27 GMT",CrowdStrike $CRWD Stake Boosted by Fjarde AP Fonden Fourth Swedish National Pension Fund - MarketBeat,MarketBeat
"Wed, 29 Oct 2025 12:51:14 GMT","CrowdStrike (NASDAQ:CRWD) Cut to ""Hold"" at Zacks Research - MarketBeat",MarketBeat
"Wed, 29 Oct 2025 12:50:50 GMT",Arete Research Upgrades CrowdStrike (NASDAQ:CRWD) to Strong-Buy - MarketBeat,MarketBeat
"Wed, 29 Oct 2025 05:49:17 GMT",CrowdStrike (NASDAQ:CRWD) Sets New 52-Week High Following Analyst Upgrade - MarketBeat,MarketBeat
"Tue, 28 Oct 2025 11:08:04 GMT",CrowdStrike $CRWD Shares Bought by New York Life Investment Management LLC - MarketBeat,MarketBeat
"Tue, 28 Oct 2025 09:08:28 GMT",CrowdStrike $CRWD Shares Bought by Bessemer Group Inc. - MarketBeat,MarketBeat
"Tue, 28 Oct 2025 08:48:21 GMT","Envestnet Asset Management Inc. Buys 30,566 Shares of CrowdStrike $CRWD - MarketBeat",MarketBeat
"Thu, 30 Oct 2025 06:27:08 GMT",CRWD’s volatility index tracking explained - Market Sentiment Review & Weekly Consistent Profit Watchlists - newser.com,newser.com
"Tue, 28 Oct 2025 09:47:24 GMT",Liberty Wealth Management LLC Trims Stake in CrowdStrike $CRWD - MarketBeat,MarketBeat
"Tue, 28 Oct 2025 10:07:25 GMT",CrowdStrike $CRWD Shares Sold by IQ EQ FUND MANAGEMENT IRELAND Ltd - MarketBeat,MarketBeat
"Tue, 28 Oct 2025 10:07:29 GMT",Petra Financial Advisors Inc. Makes New Investment in CrowdStrike $CRWD - MarketBeat,MarketBeat
"Tue, 28 Oct 2025 20:33:00 GMT",CrowdStrike (CRWD) Partners with NVIDIA to Enhance AI-Driven Cyb - GuruFocus,GuruFocus
"Mon, 27 Oct 2025 10:16:14 GMT",Yukon Wealth Management Inc. Acquires Shares of 774 CrowdStrike $CRWD - MarketBeat,MarketBeat
"Mon, 27 Oct 2025 08:36:07 GMT",Focus Partners Advisor Solutions LLC Raises Stock Position in CrowdStrike $CRWD - MarketBeat,MarketBeat
"Mon, 27 Oct 2025 07:35:57 GMT",Cullen Frost Bankers Inc. Trims Holdings in CrowdStrike $CRWD - MarketBeat,MarketBeat
"Mon, 27 Oct 2025 08:18:15 GMT",First Citizens Bank & Trust Co. Acquires Shares of 589 CrowdStrike $CRWD - MarketBeat,MarketBeat
"Mon, 27 Oct 2025 11:19:06 GMT","Peregrine Capital Management LLC Sells 8,886 Shares of CrowdStrike $CRWD - MarketBeat",MarketBeat
"Thu, 30 Oct 2025 06:28:50 GMT",What recovery options are there for CRWD - July 2025 Retail & Fast Entry High Yield Tips - newser.com,newser.com
"Mon, 27 Oct 2025 10:02:47 GMT",CrowdStrike $CRWD Position Increased by Ashton Thomas Private Wealth LLC - MarketBeat,MarketBeat
"Mon, 27 Oct 2025 10:34:13 GMT",Oak Grove Capital LLC Reduces Holdings in CrowdStrike $CRWD - MarketBeat,MarketBeat
"Mon, 27 Oct 2025 09:17:14 GMT",Wealthfront Advisers LLC Has $12.81 Million Stock Holdings in CrowdStrike $CRWD - MarketBeat,MarketBeat
"Sun, 26 Oct 2025 12:15:13 GMT",Darden Wealth Group Inc Lowers Holdings in CrowdStrike $CRWD - MarketBeat,MarketBeat
"Mon, 27 Oct 2025 09:17:07 GMT",Oppenheimer Asset Management Inc. Has $15.22 Million Holdings in CrowdStrike $CRWD - MarketBeat,MarketBeat
"Thu, 30 Oct 2025 08:08:13 GMT",Pattern recognition hints at CRWD upside - July 2025 Highlights & Free Long-Term Investment Growth Plans - newser.com,newser.com
"Thu, 30 Oct 2025 06:20:32 GMT",Does CRWD show high probability of rebound - 2025 Bull vs Bear & AI Powered Buy and Sell Recommendations - newser.com,newser.com
"Tue, 28 Oct 2025 09:34:00 GMT","Arete Research Initiates CrowdStrike(CRWD.US) With Buy Rating, Announces Target Price $706 - 富途牛牛",富途牛牛
"Tue, 28 Oct 2025 04:44:17 GMT",What risks investors should watch in CRWD stock - 2025 Institutional Moves & Accurate Trade Setup Notifications - newser.com,newser.com
"Tue, 28 Oct 2025 02:41:06 GMT",How CRWD stock compares to industry benchmarks - Gap Down & Verified Stock Trade Ideas - newser.com,newser.com
"Tue, 28 Oct 2025 07:00:08 GMT",Is it time to cut losses on CRWD - Gold Moves & Technical Entry and Exit Tips - newser.com,newser.com
"Mon, 27 Oct 2025 08:47:20 GMT",Why CRWD stock is recommended by analysts - Weekly Trading Summary & Daily Profit Focused Stock Screening - newser.com,newser.com
"Mon, 27 Oct 2025 07:52:24 GMT",CRWD’s volatility index tracking explained - Dip Buying & Verified Momentum Stock Watchlist - newser.com,newser.com
"Mon, 27 Oct 2025 04:04:02 GMT",How CRWD stock compares to industry benchmarks - Options Play & Long-Term Capital Growth Ideas - newser.com,newser.com
"Mon, 27 Oct 2025 08:02:55 GMT",What recovery options are there for CRWD - Trade Exit Summary & Low Risk High Win Rate Picks - newser.com,newser.com
"Mon, 27 Oct 2025 04:14:23 GMT",What recovery options are there for CRWD - Earnings Miss & Weekly High Conviction Trade Ideas - newser.com,newser.com
"Thu, 30 Oct 2025 14:58:17 GMT",Arete Research Upgrades CrowdStrike (NASDAQ:CRWD) to Strong-Buy - Defense World,Defense World
"Thu, 30 Oct 2025 08:45:39 GMT","Sameer Gandhi Sells 5,000 Shares of CrowdStrike (NASDAQ:CRWD) Stock - Defense World",Defense World
"Thu, 30 Oct 2025 08:45:39 GMT",CrowdStrike (NASDAQ:CRWD) Cut to “Hold” at Zacks Research - Defense World,Defense World
"Wed, 29 Oct 2025 06:49:13 GMT",CrowdStrike (NASDAQ:CRWD) Shares Up 3.3% on Analyst Upgrade - Defense World,Defense World
2025-10-30T09:00:00,CrowdStrike and BT Partner to Transform UK SMB Cybersecurity,Yahoo
2025-10-29T20:00:00,Are Nvidia's new partnerships adding value to AI trade?,Yahoo
2025-10-28T21:23:09,"Nvidia partners with Palantir, Uber, & more, easing AI bubble fear",Yahoo
2025-10-28T20:20:37,"CrowdStrike (CRWD) Stock Is Up, What You Need To Know",Yahoo
2025-10-28T19:48:00,CrowdStrike and NVIDIA Redefine Cybersecurity with Always-On AI Agents Protecting the Nation’s Digital Infrastructure,Yahoo
2025-10-28T19:08:03,"Nvidia's Huang showcases AI latest, CrowdStrike stock upgraded",Yahoo
2025-10-28T14:30:03,Is It Worth Investing in CrowdStrike (CRWD) Based on Wall Street's Bullish Views?,Yahoo
2025-10-28T14:00:04,Investors Heavily Search CrowdStrike (CRWD): Here is What You Need to Know,Yahoo
2025-10-28T13:00:00,Fal.Con Europe 2025 Showcases the Power of Ecosystem in Cybersecurity’s Agentic Era,Yahoo
2025-10-27T17:28:00,CrowdStrike Named the Overall Frost Radar™ Leader for SaaS Security Posture Management (SSPM) for the Second Consecutive Time,Yahoo
