Date,Title,Source
2025-12-03T00:00:02Z,Solana Integration Boosts Kalshi’s Push Into Tokenized Event Contracts and Crypto Liquidity,Bitcoinist
2025-12-03T00:00:00Z,Electrocatalytic water oxidation with a tris-chelating bipyridine/bis-pyrimidinethiolate Co(III) complex covalently immobilized onto MoS2 nanosheets,Royal Society of Chemistry
2025-12-03T00:00:00Z,SANDMARC TELEPHOTO TETRAPRISM LENS,Blessthisstuff.com
2025-12-03T00:00:00Z,Episode #2068: Knot My Thing,Gizwiz.tv
2025-12-02T23:00:00Z,"‘The room went silent’: Backstabbing office employee drops the ball on a project, then throws their colleague under the bus, so the coworker reveals the truth in a company meeting",Cheezburger.com
2025-12-02T22:50:19Z,Top 50 Most Subscribed YouTube Channels Worldwide • Week Of 11/30/2025,Tubefilter
2025-12-02T22:37:39Z,"Car falls from bridge, lands on train tracks sparking lengthy rail delays",ABC News (AU)
2025-12-02T21:34:32Z,HBO Max Debuts ‘Mad Men’ in 4K With Hilarious Error Revealing Visible Tech Crew During Roger Sterling’s Iconic Barf Scene,Deadline
2025-12-02T21:01:55Z,These Dapper Boat Shoes Ain't Your Dad's Timbs,Highsnobiety
2025-12-02T20:58:35Z,Re: IPv6 Performance (was Re: IPv4 Pricing),Seclists.org
"Wed, 03 Dec 2025 21:48:19 GMT",Chicago man accused of pushing rider onto CTA Blue Line tracks as train approached: police - FOX 32 Chicago,FOX 32 Chicago
"Wed, 03 Dec 2025 22:23:24 GMT","Man knocked CTA rider onto Blue Line tracks after demanding cash, prosecutors say - CBS News",CBS News
"Wed, 03 Dec 2025 23:45:20 GMT",Orleans Sheriff: Holley woman threw urine onto corrections officer - TheDailyNewsOnline.com,TheDailyNewsOnline.com
"Wed, 03 Dec 2025 23:59:00 GMT",Hot Gold Stocks Lead A Dozen Newcomers Onto Best Stock Lists - Investor's Business Daily,Investor's Business Daily
"Wed, 03 Dec 2025 20:49:48 GMT","Aggressive Raccoon Reported in Watertown, Latched onto Person’s Leg - Watertown News",Watertown News
"Wed, 03 Dec 2025 20:47:00 GMT","MSU football holds onto, signs 3-star Illinois wide receiver prospect - Spartans Wire",Spartans Wire
"Thu, 04 Dec 2025 00:03:34 GMT","Huge Lemons Squeeze onto Tokyo Subway in ""Bonkers"" -196 Work - Little Black Book | LBBOnline",Little Black Book | LBBOnline
"Wed, 03 Dec 2025 18:12:51 GMT",Cyber Attacks Are the New Threat Creeping Onto Dairy Farms - Dairy Herd,Dairy Herd
"Wed, 03 Dec 2025 12:08:14 GMT",Republicans Hold Onto House Seat in Tennessee Special Election - Hungarian Conservative,Hungarian Conservative
"Wed, 03 Dec 2025 18:33:00 GMT","Temporary fix to I-196 ramp onto US-131 could be in place by early January, MDOT says - WZZM13.com",WZZM13.com
"Wed, 03 Dec 2025 18:47:34 GMT",Browns' Shedeur Sanders explains why he holds onto the football for so long - Sports Illustrated,Sports Illustrated
"Wed, 03 Dec 2025 12:47:00 GMT",Best Life: Ho-Ho-Hold Onto Your Money! Avoiding Holiday Scams - Action News 5,Action News 5
"Wed, 03 Dec 2025 14:24:03 GMT",Warning of waves crashing onto coastal roads on Isle of Man - BBC,BBC
"Wed, 03 Dec 2025 17:32:57 GMT",Docs: Man with disability pushed onto CTA tracks at Harlem Blue Line over $1; suspect detained - WGN-TV,WGN-TV
"Wed, 03 Dec 2025 14:34:42 GMT",How Stablecore Is Pulling U.S. Community Banks & Credit Unions onto Blockchain Rails - Disruption Banking,Disruption Banking
"Wed, 03 Dec 2025 13:01:07 GMT","Maxx Crosby, Brock Bowers Make Their Way Onto Notable List - Sports Illustrated",Sports Illustrated
"Tue, 02 Dec 2025 23:38:26 GMT","Chicago man charged with punching senior citizen, knocking him onto tracks at Blue Line stop in Forest Park - CBS News",CBS News
"Wed, 03 Dec 2025 02:16:46 GMT",Several injured in Stockton after vehicle leaves Highway 4 and crashes onto city street - CBS News,CBS News
"Wed, 03 Dec 2025 16:16:00 GMT",I-196 west ramp onto southbound US-131 closed through April after semi crash - grandhaventribune.com,grandhaventribune.com
"Wed, 03 Dec 2025 17:44:58 GMT",Chicago man charged after senior knocked onto Blue Line tracks - Hoodline,Hoodline
"Tue, 02 Dec 2025 23:15:00 GMT",Tree falls onto condos in Meriden - WFSB,WFSB
"Wed, 03 Dec 2025 17:32:57 GMT",Docs: Man with disability pushed onto CTA tracks at Harlem Blue Line over $1; suspect detained - chicagomonitor.com,chicagomonitor.com
"Wed, 03 Dec 2025 12:38:09 GMT",Red Sea ceasefire shifts pressure onto breakbulk shipping - FreshPlaza,FreshPlaza
"Wed, 03 Dec 2025 13:38:08 GMT",Onto Innovation Inc. $ONTO Shares Acquired by Quantbot Technologies LP - MarketBeat,MarketBeat
"Wed, 03 Dec 2025 19:11:20 GMT",Student reportedly brings pellet gun onto Prince George school bus - Yahoo,Yahoo
"Wed, 03 Dec 2025 14:34:10 GMT",Warning of waves crashing onto coastal roads - AOL.com,AOL.com
"Wed, 03 Dec 2025 04:51:57 GMT",Assassin's Creed Shadows parkours onto Switch 2 - GamingTrend,GamingTrend
"Wed, 03 Dec 2025 18:33:53 GMT",Letter to Editor: Mahoning Valley steps onto the global stage - Mahoning Matters,Mahoning Matters
"Wed, 03 Dec 2025 13:07:50 GMT",Panagora Asset Management Inc. Has $23.21 Million Stock Position in Onto Innovation Inc. $ONTO - MarketBeat,MarketBeat
"Wed, 03 Dec 2025 10:35:04 GMT",Prudential Financial Inc. Reduces Holdings in Onto Innovation Inc. $ONTO - MarketBeat,MarketBeat
"Wed, 03 Dec 2025 16:29:13 GMT",Democrats’ surge in Tennessee throws new uncertainty onto GOP’s 2026 House map - Fox News,Fox News
"Wed, 03 Dec 2025 09:27:36 GMT",Trump shifts sights onto New England wind farm - 4C Offshore,4C Offshore
"Wed, 03 Dec 2025 08:42:41 GMT","American Century Companies Inc. Sells 49,746 Shares of Onto Innovation Inc. $ONTO - MarketBeat",MarketBeat
"Wed, 03 Dec 2025 16:14:48 GMT",Anglo Eastern to roll out AI navigation tool onto 750 managed vessels - Tradewinds News,Tradewinds News
"Wed, 03 Dec 2025 10:12:35 GMT",A new dawn for F1 in the US – Apple steps onto the grid - Sportcal,Sportcal
"Tue, 02 Dec 2025 23:44:00 GMT",Ho-Ho-Hold onto your money! Avoiding holiday scams - WGEM,WGEM
"Wed, 03 Dec 2025 18:10:00 GMT","Branch crashes onto vehicle at Calangute, injures tourists - Times of India",Times of India
"Wed, 03 Dec 2025 14:24:07 GMT",Warning of waves crashing onto coastal roads - Yahoo News Canada,Yahoo News Canada
"Wed, 03 Dec 2025 13:48:12 GMT",What happens when you drop a bowling ball onto bulletproof glass from 150 feet - MSN,MSN
"Tue, 02 Dec 2025 16:39:50 GMT","William Blount student brings gun onto school property, facing charges, sheriff’s office says - WVLT",WVLT
"Wed, 03 Dec 2025 13:48:12 GMT",We dropped a bowling ball onto a giant axe blade from 150ft - MSN,MSN
"Wed, 03 Dec 2025 10:08:07 GMT","Your Wandering Mind’s Worst Thought: Overhead Highway Sign Falls Onto Car, Sending Two To Hospital - AOL.com",AOL.com
"Tue, 02 Dec 2025 15:54:00 GMT",Woman drives onto lawn and breaks windows at man’s home: Brunswick Hills Township Police Blotter - Cleveland.com,Cleveland.com
"Wed, 03 Dec 2025 00:52:00 GMT",School bus flips onto its side in Mat-Su while carrying students - Alaska's News Source,Alaska's News Source
"Tue, 02 Dec 2025 20:58:31 GMT",Living Christmas Trees: Hold onto the joy of the holidays for years to come - Blue Ribbon News,Blue Ribbon News
"Tue, 02 Dec 2025 23:28:00 GMT","Man charged with punching senior citizen, knocking him onto Blue Line tracks - CBS News",CBS News
"Wed, 03 Dec 2025 20:45:04 GMT",NASA’s Psyche Spacecraft Locks Onto Interstellar Comet 3I/ATLAS as Global Planetary‑Defense Drill Begins - ts2.tech,ts2.tech
"Tue, 02 Dec 2025 22:44:00 GMT",Adam Thielen Latches onto Contender - Vikings Territory,Vikings Territory
"Wed, 03 Dec 2025 18:38:00 GMT",Horror as weightlifter killed after barbell crashes onto his chest - Daily Express,Daily Express
"Wed, 03 Dec 2025 06:59:47 GMT",AIGCC signs onto Climate Principles for Grid Investment - theasset.com,theasset.com
"Tue, 02 Dec 2025 05:01:33 GMT",Column: Holding onto sanity — Trump’s absurdity overload agenda and what to do about it - Daily Tar Heel,Daily Tar Heel
"Wed, 03 Dec 2025 00:02:39 GMT",StanChart Headlines Asian Push onto CLSNet - The Full FX,The Full FX
"Tue, 02 Dec 2025 15:11:00 GMT","William Blount student brings gun onto school property, facing charges, sheriff’s office says - WVLT",WVLT
"Tue, 02 Dec 2025 05:12:48 GMT",Onto Innovation (ONTO): Evaluating Valuation After Strong Q3 Results and Upbeat AI Packaging Outlook - simplywall.st,simplywall.st
"Wed, 03 Dec 2025 02:00:00 GMT","Ole Miss up a spot, Notre Dame down onto bubble of new CFP rankings - Times Leader",Times Leader
"Mon, 01 Dec 2025 20:40:56 GMT",Arizona State point guard Moe Odum jumps onto Big 12 radar with award - azcentral.com and The Arizona Republic,azcentral.com and The Arizona Republic
"Mon, 01 Dec 2025 12:59:00 GMT",India demands Apple preinstall government security app onto iPhones - AppleInsider,AppleInsider
"Mon, 01 Dec 2025 22:22:58 GMT","UnitedHealth: Axing Another Distraction, Onto 2026 (NYSE:UNH) - Seeking Alpha",Seeking Alpha
"Mon, 01 Dec 2025 23:42:45 GMT",Preservationists oppose Leaflet Missal’s move onto Summit Avenue - myvillager.com,myvillager.com
"Wed, 03 Dec 2025 03:38:53 GMT",'Heated Rivalry' Slides Onto HBO Max: What You Need to Know - AOL.com,AOL.com
"Thu, 04 Dec 2025 00:05:40 GMT",Take Care Before Jumping Onto Vascon Engineers Limited (NSE:VASCONEQ) Even Though It's 30% Cheaper - simplywall.st,simplywall.st
"Tue, 02 Dec 2025 12:16:02 GMT",United Kingdom: Roanoke pushes casino plan onto 2026 agenda despite resistance from state delegation - Yogonet,Yogonet
"Mon, 01 Dec 2025 13:09:12 GMT","Overhead Sign Crashes onto Car on Charlotte, NC, Highway - firehouse.com",firehouse.com
"Mon, 01 Dec 2025 23:50:00 GMT",Two seriously injured after interstate sign falls onto vehicle in Charlotte - WYFF News 4,WYFF News 4
"Tue, 02 Dec 2025 18:08:56 GMT","Vehicle Collides With Livingston Police Car, Flips Onto Its Roof: PD - Patch",Patch
"Wed, 03 Dec 2025 18:48:24 GMT",Browns' Shedeur Sanders explains why he holds onto the football for so long - Yardbarker,Yardbarker
"Tue, 02 Dec 2025 02:00:00 GMT",LETTER: Rerouting plan would push traffic onto narrow neighborhood streets - Indiana Gazette Online,Indiana Gazette Online
"Wed, 03 Dec 2025 00:27:08 GMT",Ho-Ho-Hold onto your money! Avoiding holiday scams - WGEM,WGEM
"Tue, 02 Dec 2025 20:52:46 GMT",Alexander Skarsgård’s $180 Million Failed Fantasy Franchise-Starter Swings Onto New Streamer Next Month - IMDb,IMDb
"Tue, 02 Dec 2025 15:11:00 GMT",Blount County Schools releases statement after student accused of bringing gun onto school property - WVLT,WVLT
"Mon, 01 Dec 2025 23:31:00 GMT","Alleged drunk driver caused collision that collapsed sign onto innocent car on I-77, officials say - WBTV",WBTV
"Mon, 01 Dec 2025 13:30:02 GMT",Here's How Much a $1000 Investment in Onto Innovation Made 10 Years Ago Would Be Worth Today - Yahoo Finance,Yahoo Finance
"Tue, 02 Dec 2025 17:00:37 GMT",Hold onto Your Balls! The Million-Selling Mega Hit BALL x PIT is Getting Three New Content Updates in 2026 - COSMOCOVER,COSMOCOVER
"Mon, 01 Dec 2025 13:29:01 GMT",Gold forecast: Can XAU/USD hold onto gains with stocks and cryptos falling? - FOREX.com,FOREX.com
"Mon, 01 Dec 2025 16:56:57 GMT",Man arrested after walking onto Alcorn Central campus - WCBI TV,WCBI TV
"Wed, 03 Dec 2025 04:37:00 GMT",Republicans hold onto US House seat in Tennessee special election - The Tennessean,The Tennessean
"Mon, 01 Dec 2025 02:59:42 GMT",Tessa Thompson: 'Hedda' is struggling to hold onto her sense of self - upi.com,upi.com
"Tue, 02 Dec 2025 20:06:02 GMT",Russia sends animals onto battlefield to distract Ukrainian troops while assault teams attack from behind - Euromaidan Press,Euromaidan Press
"Tue, 02 Dec 2025 20:42:45 GMT",Chicago Bears Scouting Report: Caleb Williams holds onto the football - Acme Packing Company,Acme Packing Company
"Mon, 01 Dec 2025 19:03:00 GMT",Wisconsin men's basketball clings onto AP rankings voting amid slide - BadgerExtra,BadgerExtra
"Wed, 03 Dec 2025 00:49:35 GMT","Anacortes pledges $250,000 and signs onto regional North Star collaborative for homelessness and behavioral health - Citizen Portal AI",Citizen Portal AI
"Sun, 30 Nov 2025 09:35:42 GMT",A citizen reporter strayed onto a police gun range. Cops sought a warrant for his online newspaper. - Kansas Reflector,Kansas Reflector
"Tue, 02 Dec 2025 09:54:01 GMT",Fisher Asset Management LLC Lowers Stake in Onto Innovation Inc. $ONTO - MarketBeat,MarketBeat
2025-12-01T14:30:02,Here's How Much a $1000 Investment in Onto Innovation Made 10 Years Ago Would Be Worth Today,Yahoo
