Date,Title,Source
2025-10-29T17:10:05Z,"Thermo Fisher To Acquire Clario Holdings For $8.875 Billion, Expands Digital Pharma Capabilities",Biztoc.com
"Fri, 31 Oct 2025 03:59:59 GMT",Can TMO stock attract analyst upgrades - July 2025 EndofMonth & Reliable Price Action Trade Plans - newser.com,newser.com
"Thu, 30 Oct 2025 10:44:14 GMT",Thermo Fisher Scientific Inc. $TMO Shares Sold by Ownership Capital B.V. - MarketBeat,MarketBeat
"Thu, 30 Oct 2025 00:08:00 GMT",Argus Research Maintains Thermo Fisher Scientific (TMO) Buy Recommendation - Nasdaq,Nasdaq
"Tue, 28 Oct 2025 20:46:00 GMT",Insider Sale: Executive Vice President of $TMO Sells 400 Shares - Quiver Quantitative,Quiver Quantitative
"Thu, 30 Oct 2025 12:00:31 GMT","BofA Securities Maintains Thermo Fisher Scientific(TMO.US) With Buy Rating, Maintains Target Price $650 - 富途牛牛",富途牛牛
"Wed, 29 Oct 2025 06:50:36 GMT",M&A News: Thermo Fisher (TMO) Nears $10B Clario Takeover to Strengthen Clinical Trial Tech - TipRanks,TipRanks
"Wed, 29 Oct 2025 10:00:00 GMT","Thermo Fisher (NYSE: TMO) to acquire Clario at $8.88B, adds $0.45 adjusted EPS in year one - Stock Titan",Stock Titan
"Fri, 31 Oct 2025 04:19:58 GMT",Why pension funds invest in TMO stock - 2025 Market Overview & Safe Entry Point Identification - newser.com,newser.com
"Thu, 30 Oct 2025 10:12:03 GMT",Motco Has $9.16 Million Stock Position in Thermo Fisher Scientific Inc. $TMO - MarketBeat,MarketBeat
"Tue, 28 Oct 2025 22:03:00 GMT",Thermo Fisher Scientific (TMO) Price Target Increased by 10.29% to 624.54 - Nasdaq,Nasdaq
"Thu, 30 Oct 2025 09:11:54 GMT","Advisory Alpha LLC Has $436,000 Stake in Thermo Fisher Scientific Inc. $TMO - MarketBeat",MarketBeat
"Thu, 30 Oct 2025 11:26:06 GMT",How TMO stock trades pre earnings - CEO Change & Growth Oriented Trading Recommendations - newser.com,newser.com
"Wed, 29 Oct 2025 09:47:51 GMT",Thermo Fisher Scientific Inc. $TMO Shares Acquired by Mendel Money Management - MarketBeat,MarketBeat
"Wed, 29 Oct 2025 09:29:53 GMT",Thermo Fisher Scientific Inc. $TMO Shares Sold by Auto Owners Insurance Co - MarketBeat,MarketBeat
"Wed, 29 Oct 2025 09:19:47 GMT",Howard Capital Management Inc. Raises Stake in Thermo Fisher Scientific Inc. $TMO - MarketBeat,MarketBeat
"Wed, 29 Oct 2025 23:33:23 GMT","Insider Selling: Thermo Fisher Scientific (NYSE:TMO) CEO Sells 7,250 Shares of Stock - MarketBeat",MarketBeat
"Wed, 29 Oct 2025 07:49:25 GMT",AlphaQuest LLC Cuts Stock Holdings in Thermo Fisher Scientific Inc. $TMO - MarketBeat,MarketBeat
"Wed, 29 Oct 2025 23:35:13 GMT",Gianluca Pettiti Sells 400 Shares of Thermo Fisher Scientific (NYSE:TMO) Stock - MarketBeat,MarketBeat
"Wed, 29 Oct 2025 23:35:14 GMT","Insider Selling: Thermo Fisher Scientific (NYSE:TMO) CEO Sells 17,104 Shares of Stock - MarketBeat",MarketBeat
"Sun, 26 Oct 2025 23:41:34 GMT",Thermo Fisher Scientific (TMO) Is Up 6.2% After Beating Q3 Forecasts and Announcing OpenAI Collaboration - simplywall.st,simplywall.st
"Tue, 28 Oct 2025 04:42:39 GMT",Can TMO stock reach $200 price target - Weekly Stock Analysis & AI Driven Stock Movement Reports - newser.com,newser.com
"Tue, 28 Oct 2025 08:56:19 GMT",Thermo Fisher Scientific Inc. $TMO Shares Sold by Envestnet Asset Management Inc. - MarketBeat,MarketBeat
"Tue, 28 Oct 2025 10:47:07 GMT",Thermo Fisher Scientific Inc. $TMO Shares Bought by Private Wealth Partners LLC - MarketBeat,MarketBeat
"Wed, 29 Oct 2025 05:33:10 GMT","Thermo Fisher Scientific Inc. (NYSE:TMO) Receives Consensus Rating of ""Moderate Buy"" from Analysts - MarketBeat",MarketBeat
"Tue, 28 Oct 2025 10:47:05 GMT",Thermo Fisher Scientific Inc. $TMO Shares Sold by Integral Investment Advisors Inc. - MarketBeat,MarketBeat
"Tue, 28 Oct 2025 10:29:28 GMT",Purkiss Capital Advisors LLC Boosts Holdings in Thermo Fisher Scientific Inc. $TMO - MarketBeat,MarketBeat
"Wed, 29 Oct 2025 13:38:56 GMT","Thermo Fisher Scientific (TMO.US) focuses on digital clinical solutions, spending $8.875 billion in cash to acquire Clario. - 富途牛牛",富途牛牛
"Tue, 28 Oct 2025 09:22:27 GMT","AustralianSuper Pty Ltd Sells 2,791 Shares of Thermo Fisher Scientific Inc. $TMO - MarketBeat",MarketBeat
"Wed, 29 Oct 2025 09:06:00 GMT",Will TMO stock attract long term capital inflows - 2025 Earnings Surprises & Stepwise Trade Signal Guides - newser.com,newser.com
"Sun, 26 Oct 2025 12:22:30 GMT","TMO Weekly #4: Apple News Roundup, October 20–26 - The Mac Observer",The Mac Observer
"Sun, 26 Oct 2025 12:16:00 GMT",J.P. Morgan Keeps Their Buy Rating on Thermo Fisher (TMO) - The Globe and Mail,The Globe and Mail
"Mon, 27 Oct 2025 10:07:38 GMT",Thermo Fisher Scientific Inc. $TMO is Cryder Capital Partners LLP's 7th Largest Position - MarketBeat,MarketBeat
"Mon, 27 Oct 2025 11:06:52 GMT",Thermo Fisher Scientific Inc. $TMO Shares Acquired by Y Intercept Hong Kong Ltd - MarketBeat,MarketBeat
"Tue, 28 Oct 2025 08:41:51 GMT",Will TMO stock outperform energy sector in 2025 - Day Trade & AI Driven Stock Price Forecasts - newser.com,newser.com
"Mon, 27 Oct 2025 13:24:52 GMT",Nisa Investment Advisors LLC Decreases Stake in Thermo Fisher Scientific Inc. $TMO - MarketBeat,MarketBeat
"Sun, 26 Oct 2025 07:00:00 GMT","TMO Weekly #3: Apple News Roundup, October 12–19 - The Mac Observer",The Mac Observer
"Mon, 27 Oct 2025 10:32:13 GMT",Thermo Fisher Scientific Inc. $TMO Stake Trimmed by Bessemer Group Inc. - MarketBeat,MarketBeat
"Mon, 27 Oct 2025 10:16:19 GMT",Thermo Fisher Scientific Inc. $TMO Shares Bought by CCLA Investment Management - MarketBeat,MarketBeat
"Mon, 27 Oct 2025 11:14:22 GMT",Thermo Fisher Scientific Inc. $TMO Shares Sold by Guinness Asset Management LTD - MarketBeat,MarketBeat
"Mon, 27 Oct 2025 11:14:24 GMT",Lipe & Dalton Purchases New Holdings in Thermo Fisher Scientific Inc. $TMO - MarketBeat,MarketBeat
"Mon, 27 Oct 2025 10:32:06 GMT",Oak Grove Capital LLC Reduces Position in Thermo Fisher Scientific Inc. $TMO - MarketBeat,MarketBeat
"Mon, 27 Oct 2025 10:04:46 GMT",Banco Santander S.A. Boosts Stock Position in Thermo Fisher Scientific Inc. $TMO - MarketBeat,MarketBeat
"Mon, 27 Oct 2025 09:35:40 GMT",Solstein Capital LLC Sells 852 Shares of Thermo Fisher Scientific Inc. $TMO - MarketBeat,MarketBeat
"Sun, 26 Oct 2025 11:41:14 GMT",Thermo Fisher Scientific Inc. $TMO Shares Acquired by PKO Investment Management Joint Stock Co - MarketBeat,MarketBeat
"Sun, 26 Oct 2025 12:30:12 GMT",Thermo Fisher Scientific Inc. $TMO Shares Purchased by Leelyn Smith LLC - MarketBeat,MarketBeat
"Sun, 26 Oct 2025 12:30:12 GMT","Peterson Wealth Services Sells 8,626 Shares of Thermo Fisher Scientific Inc. $TMO - MarketBeat",MarketBeat
"Tue, 28 Oct 2025 19:30:36 GMT",Boost in 2025 MMR vaccinations: TMO implements strategies to address discrepancies - Cook Islands News,Cook Islands News
"Wed, 29 Oct 2025 17:03:16 GMT",Thermo Fisher Scientific Inc. (NYSE:TMO) Receives Consensus Rating of “Moderate Buy” from Analysts - Defense World,Defense World
"Mon, 27 Oct 2025 05:44:31 GMT",What is Leerink Partnrs’ Forecast for TMO FY2025 Earnings? - Defense World,Defense World
2025-10-30T01:08:06,Argus Research Maintains Thermo Fisher Scientific (TMO) Buy Recommendation,Fintel
2025-10-29T11:00:00,"Thermo Fisher Scientific to Acquire Clario Holdings, Inc., Enabling Pharma and Biotech Customers to Accelerate Innovation with Deeper Clinical Insights",Yahoo
2025-10-28T23:03:46,Thermo Fisher Scientific (TMO) Price Target Increased by 10.29% to 624.54,Fintel
2025-10-28T18:18:43,Thoughts on int’l funds and individual stocks,Reddit/r/investing
