Date,Title,Source
2025-09-26T07:37:10Z,"Accurate Wealth Management LLC Acquires Shares of 2,333 Limbach Holdings, Inc. $LMB",ETF Daily News
"Fri, 26 Sep 2025 07:00:00 GMT",LMB Interiors' Eichler Home in Walnut Creek - Diablo Magazine,Diablo Magazine
"Sat, 27 Sep 2025 12:20:05 GMT","Limbach Holdings, Inc.'s (NASDAQ:LMB) Stock Retreats 26% But Earnings Haven't Escaped The Attention Of Investors - simplywall.st",simplywall.st
"Fri, 26 Sep 2025 03:34:00 GMT",A Look Back at Construction and Maintenance Services Stocks’ Q2 Earnings: Limbach (NASDAQ:LMB) Vs The Rest Of The Pack - Yahoo Finance,Yahoo Finance
"Sat, 27 Sep 2025 12:01:56 GMT","With A 26% Price Drop For Limbach Holdings, Inc. (NASDAQ:LMB) You'll Still Get What You Pay For - 富途牛牛",富途牛牛
"Tue, 23 Sep 2025 20:42:45 GMT",Limbach (NASDAQ:LMB) Stock Price Down 3.8% - Time to Sell? - MarketBeat,MarketBeat
"Tue, 23 Sep 2025 07:37:56 GMT","Strs Ohio Buys New Holdings in Limbach Holdings, Inc. $LMB - MarketBeat",MarketBeat
"Fri, 26 Sep 2025 01:23:29 GMT",Life Sciences Breakthrough of the Year for Melina Schuh’s work to visualise ovulation - mrc-lmb.cam.ac.uk,mrc-lmb.cam.ac.uk
"Thu, 25 Sep 2025 13:49:01 GMT",DOWNLOAD mp3: DrummeRTee924 – Leave My Bass (LMB) - Fakaza,Fakaza
2025-09-26T05:34:20,A Look Back at Construction and Maintenance Services Stocks’ Q2 Earnings: Limbach (NASDAQ:LMB) Vs The Rest Of The Pack,Yahoo
