Date,Title,Source
2025-11-03T12:26:58Z,Iren Surges On $9.7 Billion AI Cloud Services Contract With Microsoft,Biztoc.com
2025-11-03T12:15:24Z,Analyst Says Microsoft (MSFT) at ‘Intersection’ of Software and AI,Biztoc.com
2025-11-03T12:04:07Z,Microsoft signs $9.7-billion cloud contract with IREN for Nvidia chips,Biztoc.com
2025-11-03T11:55:53Z,Analyst Says Microsoft (MSFT) at ‘Intersection’ of Software and AI,Yahoo Entertainment
2025-11-02T11:27:41Z,Microsoft (MSFT) Maintains Buy Rating at Truist After Solid Fiscal Q1 Results,Yahoo Entertainment
2025-11-01T19:30:55Z,"Microsoft (MSFT)’s Traditional Software “Was Extraordinary,” Says Jim Cramer",Yahoo Entertainment
2025-10-31T23:39:03Z,Morgan Stanley Turns More Bullish on Microsoft (MSFT) After Earnings Beat,Yahoo Entertainment
2025-10-31T20:32:34Z,“You’re Going to Burn This Billion Dollars.” Microsoft Stock (NASDAQ:MSFT) Slumps on Original Assessment of OpenAI,Biztoc.com
2025-10-31T17:59:05Z,A $135 Billion Reason to Buy Microsoft Stock Now,Biztoc.com
2025-10-31T13:41:17Z,Jim Cramer Says “Microsoft Reported What I Thought Was a Truly Strong Quarter”,Yahoo Entertainment
2025-10-31T00:06:45Z,Microsoft Stock Is Moving Lower Today: What's Going On?,Biztoc.com
2025-10-30T20:36:28Z,"Amazon Soars To Record High On Solid Guidance, Improving AWS Results",Biztoc.com
2025-10-30T19:53:12Z,Microsoft Stock (MSFT) Slides as Xbox Console Sales Fall 30% Year-Over-Year - TipRanks,Slashdot.org
2025-10-30T18:14:32Z,"Market Update: ADP, THRM, CNC, INCY, LAZ, MSFT, RCL, RJF, UNH, V, VLTO",Yahoo Entertainment
2025-10-30T18:12:50Z,"Welcome to the $4 Trillion Market Cap, Microsoft! Are There More Gains for MSFT Stock in Store?",Biztoc.com
2025-10-30T18:08:41Z,"Welcome to the $4 Trillion Market Cap Club, Microsoft! Are There More Gains for MSFT Stock in Store?",Barchart.com
2025-10-30T17:51:01Z,Microsoft Stock Is Moving Lower Today: What's Going On?,Biztoc.com
2025-10-30T17:17:30Z,Microsoft Faces High Capex and AI Bubble Concerns: What Should MSFT Stock Investors Do?,Biztoc.com
2025-10-30T17:04:56Z,Microsoft Faces High Capex and AI Bubble Concerns: What Should MSFT Stock Investors Do?,Barchart.com
2025-10-30T12:20:17Z,"Dow Jones Futures Fall After Trump-Xi Trade Truce; Microsoft, Meta, Google Step Up Capital Spending",Biztoc.com
2025-10-30T08:54:06Z,Jim Cramer Discusses Microsoft (MSFT)’s Control Over Productivity Software,Yahoo Entertainment
"Mon, 03 Nov 2025 22:20:05 GMT","Microsoft (MSFT)’s Traditional Software “Was Extraordinary,” Says Jim Cramer - MSN",MSN
"Mon, 03 Nov 2025 11:55:53 GMT",Analyst Says Microsoft (MSFT) at ‘Intersection’ of Software and AI - Yahoo Finance,Yahoo Finance
"Thu, 30 Oct 2025 23:27:40 GMT","Microsoft: Q3 Earnings Were Flawless, Stock Is A Buy (MSFT) - Seeking Alpha",Seeking Alpha
"Mon, 03 Nov 2025 14:07:00 GMT",Microsoft Stock (MSFT) Opinions on AI Growth and Xbox Sales Drop - Quiver Quantitative,Quiver Quantitative
"Mon, 03 Nov 2025 17:55:09 GMT",Microsoft Stock (MSFT) Up Alongside Delisted Xbox 360 Games News - TipRanks,TipRanks
"Sun, 02 Nov 2025 11:27:41 GMT",Microsoft (MSFT) Maintains Buy Rating at Truist After Solid Fiscal Q1 Results - Yahoo Finance,Yahoo Finance
"Thu, 30 Oct 2025 18:04:21 GMT",Microsoft: Q1 Earnings Were Overshadowed By Bigger Events (NASDAQ:MSFT) - Seeking Alpha,Seeking Alpha
"Mon, 03 Nov 2025 14:59:00 GMT","Fund Update: 401,000 MICROSOFT (MSFT) shares added to DekaBank Deutsche Girozentrale portfolio - Quiver Quantitative",Quiver Quantitative
"Mon, 03 Nov 2025 12:13:19 GMT",Morgan Stanley Turns More Bullish on Microsoft (MSFT) After Earnings Beat - MSN,MSN
"Fri, 31 Oct 2025 17:38:42 GMT",“You’re Going to Burn This Billion Dollars.” Microsoft Stock (NASDAQ:MSFT) Slumps on Original Assessment of OpenAI - TipRanks,TipRanks
"Mon, 03 Nov 2025 20:32:03 GMT","TRADING ALERTS: November 3, 2025 / RIG (NASDAQ:MSFT) - Seeking Alpha",Seeking Alpha
"Sat, 01 Nov 2025 19:30:55 GMT","Microsoft (MSFT)’s Traditional Software “Was Extraordinary,” Says Jim Cramer - Yahoo Finance",Yahoo Finance
"Mon, 03 Nov 2025 17:12:46 GMT",Microsoft inks multibillion dollar with Lambda to boost AI infrastructure (MSFT:NASDAQ) - Seeking Alpha,Seeking Alpha
"Fri, 31 Oct 2025 23:39:03 GMT",Morgan Stanley Turns More Bullish on Microsoft (MSFT) After Earnings Beat - Yahoo Finance,Yahoo Finance
"Tue, 04 Nov 2025 07:30:59 GMT",Is now a turning point for MSFT - 2025 Historical Comparison & Free Expert Approved Momentum Trade Ideas - newser.com,newser.com
"Mon, 03 Nov 2025 18:19:00 GMT","Noteworthy Monday Option Activity: PLTR, AAPL, MSFT - Nasdaq",Nasdaq
"Mon, 03 Nov 2025 12:32:02 GMT",(MSFT) and the Role of Price-Sensitive Allocations - news.stocktradersdaily.com,news.stocktradersdaily.com
"Tue, 04 Nov 2025 02:59:57 GMT","Microsoft (MSFT.US) Invests Billions in Partnership with Lambda, Adding Tens of Thousands of NVIDIA (NVDA.US) GPUs to Intensify the AI Arms Race - 富途牛牛",富途牛牛
"Fri, 31 Oct 2025 13:45:03 GMT",Why Microsoft (MSFT) is a Top Growth Stock for the Long-Term - Yahoo Finance,Yahoo Finance
"Mon, 03 Nov 2025 11:16:28 GMT",‘Enjoy the Ride’: Wedbush Urges Investors to Grab MSFT and GOOGL After Earnings - TipRanks,TipRanks
"Thu, 30 Oct 2025 08:54:06 GMT",Jim Cramer Discusses Microsoft (MSFT)’s Control Over Productivity Software - Yahoo Finance,Yahoo Finance
"Thu, 30 Oct 2025 20:10:30 GMT",Microsoft Corp (MSFT) Q1 2026 Earnings Call Highlights: Strong Cloud Growth and AI Investments ... - Yahoo Finance,Yahoo Finance
"Sat, 01 Nov 2025 23:33:15 GMT",Microsoft (MSFT) Valuation in Focus as Shares Pull Back After Notable Rally - simplywall.st,simplywall.st
"Sun, 02 Nov 2025 20:35:44 GMT",Is MSFT stock poised for growth - Weekly Market Outlook & AI Powered Trade Plan Recommendations - newser.com,newser.com
"Mon, 03 Nov 2025 14:33:09 GMT",Microsoft (MSFT) Wins U.S. Green Light to Ship Nvidia (NVDA) AI Chips to UAE - TipRanks,TipRanks
"Mon, 03 Nov 2025 08:15:37 GMT",Microsoft Corporation $MSFT Shares Sold by Advanced Asset Management Advisors Inc - MarketBeat,MarketBeat
"Sun, 02 Nov 2025 19:21:09 GMT","Biggest stock movers Thursday: GOOG, META, MSFT, MKTW, and more - MSN",MSN
"Mon, 03 Nov 2025 21:15:02 GMT",Microsoft (MSFT.US) has reached an AI infrastructure agreement with Lambda. - 富途牛牛,富途牛牛
"Mon, 03 Nov 2025 19:51:04 GMT","Barclays Maintains Microsoft(MSFT.US) With Buy Rating, Maintains Target Price $625 - 富途牛牛",富途牛牛
"Mon, 03 Nov 2025 11:32:02 GMT",Bitcoin (BTC) Miner IREN News: Microsoft (MSFT) Signs $9.7B AI Cloud Deal - CoinDesk,CoinDesk
"Sun, 02 Nov 2025 12:32:49 GMT",Microsoft (MSFT) to Resume Hiring after AI-Driven Productivity Shift - TipRanks,TipRanks
"Mon, 03 Nov 2025 12:28:24 GMT",Microsoft to spend $15.2B in UAE by 2029; unveils AI GPU export license (MSFT:NASDAQ) - Seeking Alpha,Seeking Alpha
"Mon, 03 Nov 2025 06:52:04 GMT",Is MSFT stock ready for breakout - Market Movement Recap & Low Risk Investment Opportunities - newser.com,newser.com
"Mon, 03 Nov 2025 08:29:23 GMT",Will MSFT stock attract ESG investors - Market Growth Report & Breakout Confirmation Trade Signals - newser.com,newser.com
"Sun, 02 Nov 2025 18:58:27 GMT",Institutional scanner results for MSFT - July 2025 Recap & High Accuracy Investment Entry Signals - newser.com,newser.com
"Fri, 31 Oct 2025 19:15:00 GMT","I OWN You, MSFT - Theo Trade",Theo Trade
"Mon, 03 Nov 2025 12:27:55 GMT",Regression analysis insights on MSFT performance - Bull Run & Technical Pattern Recognition Alerts - newser.com,newser.com
"Thu, 30 Oct 2025 15:25:00 GMT","Biggest stock movers Thursday: GOOG, META, MSFT, MKTW, and more - Seeking Alpha",Seeking Alpha
"Fri, 31 Oct 2025 13:45:00 GMT",Why Microsoft (MSFT) is a Top Growth Stock for the Long-Term - Nasdaq,Nasdaq
"Sat, 01 Nov 2025 11:10:39 GMT","SA analyst upgrades/downgrades: LLY, INTC, BILI, MSFT - MSN",MSN
"Mon, 03 Nov 2025 13:07:51 GMT",Analyst Says Microsoft (MSFT) at ‘Intersection’ of Software and AI - MSN,MSN
"Sun, 02 Nov 2025 08:09:41 GMT",Peak Financial Management Inc. Acquires 591 Shares of Microsoft Corporation $MSFT - MarketBeat,MarketBeat
"Sun, 02 Nov 2025 08:09:39 GMT",Microsoft Corporation $MSFT Position Trimmed by Ignite Planners LLC - MarketBeat,MarketBeat
"Sun, 02 Nov 2025 08:09:41 GMT",Cornerstone Enterprises LLC Reduces Stock Holdings in Microsoft Corporation $MSFT - MarketBeat,MarketBeat
"Fri, 31 Oct 2025 05:37:30 GMT","Microsoft (MSFT): Annual Earnings Up 12.9%, Profit Growth Outpaces Market Narratives - Sahm",Sahm
"Sun, 02 Nov 2025 08:09:41 GMT","Optas LLC Buys 2,167 Shares of Microsoft Corporation $MSFT - MarketBeat",MarketBeat
"Fri, 31 Oct 2025 20:00:01 GMT",Microsoft (Nasdaq:MSFT) Stock Quote - FinancialContent,FinancialContent
"Sun, 02 Nov 2025 04:49:35 GMT",Real time scanner hits for MSFT explained - Quarterly Profit Review & Daily Growth Stock Investment Tips - newser.com,newser.com
"Sun, 02 Nov 2025 23:36:58 GMT",Regression analysis insights on MSFT performance - 2025 Top Gainers & Expert Curated Trade Setups - newser.com,newser.com
"Sat, 01 Nov 2025 16:59:58 GMT",Pattern recognition hints at MSFT upside - 2025 Top Gainers & Fast Gain Stock Tips - newser.com,newser.com
"Mon, 03 Nov 2025 15:55:00 GMT","XLK, MSFT, AAPL, IBM: ETF Inflow Alert - Nasdaq",Nasdaq
"Thu, 30 Oct 2025 15:55:04 GMT","Nasdaq 100 Forecast: QQQ eases from record level as META, MSFT tumble - FOREX.com",FOREX.com
"Mon, 03 Nov 2025 00:14:35 GMT",Learn to Evaluate (MSFT) using the Charts (MSFT:CA) - news.stocktradersdaily.com,news.stocktradersdaily.com
"Fri, 31 Oct 2025 23:37:30 GMT",Morgan Stanley Turns More Bullish on Microsoft (MSFT) After Earnings Beat - Insider Monkey,Insider Monkey
"Thu, 30 Oct 2025 12:23:01 GMT","GOOGL, MSFT and META Reiterate Enormous Spending in AI Infrastructure - Zacks Investment Research",Zacks Investment Research
"Thu, 30 Oct 2025 17:04:56 GMT",Microsoft Faces High Capex and AI Bubble Concerns: What Should MSFT Stock Investors Do? - Barchart.com,Barchart.com
"Mon, 03 Nov 2025 07:21:00 GMT",Trump Says Will 'Not Let Anybody Have' Nvidia Chips—But Satya Nadella Reveals MSFT's Chips Are Lying In 'Inventory' Due To Power Shortage - Microsoft (NASDAQ:MSFT) - Benzinga,Benzinga
"Thu, 30 Oct 2025 18:08:41 GMT","Welcome to the $4 Trillion Market Cap, Microsoft! Are There More Gains for MSFT Stock in Store? - Barchart.com",Barchart.com
"Thu, 30 Oct 2025 13:16:51 GMT",MSFT Q3 Deep Dive: AI Investments Drive Growth Amid Capacity Constraints - Yahoo Finance,Yahoo Finance
"Thu, 30 Oct 2025 17:19:30 GMT",Microsoft's $35B AI Bet and OpenAI Deal Might Change The Case For Investing In MSFT - Yahoo Finance,Yahoo Finance
"Thu, 30 Oct 2025 10:20:00 GMT",New Analyst Forecast: $MSFT Given $650.0 Price Target - Quiver Quantitative,Quiver Quantitative
"Sun, 02 Nov 2025 08:09:39 GMT",Dempze Nancy E Has $8.07 Million Stock Position in Microsoft Corporation $MSFT - MarketBeat,MarketBeat
"Mon, 03 Nov 2025 11:12:04 GMT",Microsoft December Payout Set: 100 MSFT Shares Will Earn This Sum - parameter.io,parameter.io
"Mon, 03 Nov 2025 08:15:37 GMT","Baxter Bros Inc. Sells 1,279 Shares of Microsoft Corporation $MSFT - MarketBeat",MarketBeat
"Thu, 30 Oct 2025 13:30:19 GMT",Microsoft: Double Beat Not Enough To Justify $4T Market Cap (NASDAQ:MSFT) - Seeking Alpha,Seeking Alpha
"Fri, 31 Oct 2025 09:31:53 GMT",How MSFT stock performs during Fed tightening cycles - 2025 Key Lessons & Free Real-Time Market Sentiment Alerts - newser.com,newser.com
"Thu, 30 Oct 2025 09:24:21 GMT","The Daily Breakdown: GOOGL Rips, META Dips, and MSFT is in Between - eToro",eToro
"Thu, 30 Oct 2025 12:13:00 GMT","GOOGL, MSFT and META Reiterate Enormous Spending in AI Infrastructure - Nasdaq",Nasdaq
"Fri, 31 Oct 2025 13:38:00 GMT","New Buy Rating for Microsoft (MSFT), the Technology Giant - The Globe and Mail",The Globe and Mail
"Thu, 30 Oct 2025 11:07:33 GMT","Stock Movers: Alphabet, Meta, MSFT - Bloomberg.com",Bloomberg.com
"Sun, 02 Nov 2025 08:09:38 GMT",Microsoft Corporation $MSFT is First Merchants Corp's 7th Largest Position - MarketBeat,MarketBeat
"Fri, 31 Oct 2025 10:43:09 GMT","New Buy Rating for Microsoft (MSFT), the Technology Giant - The Globe and Mail",The Globe and Mail
"Mon, 03 Nov 2025 11:08:43 GMT",What makes Roundhill ETF Trust Roundhill MSFT stock appealing to growth investors - Trade Risk Report & Low Risk High Reward Ideas - newser.com,newser.com
"Fri, 31 Oct 2025 12:43:11 GMT",Microsoft (MSFT): New Buy Recommendation for This Technology Giant - The Globe and Mail,The Globe and Mail
"Thu, 30 Oct 2025 15:45:53 GMT",Microsoft Stock (MSFT) Slides as Xbox Console Sales Fall 30% Year-Over-Year - TipRanks,TipRanks
"Sun, 02 Nov 2025 08:09:38 GMT",Values Added Financial LLC Boosts Holdings in Microsoft Corporation $MSFT - MarketBeat,MarketBeat
"Fri, 31 Oct 2025 11:14:37 GMT","Analysts Are Bullish on These Technology Stocks: Guidewire (GWRE), Microsoft (MSFT) - The Globe and Mail",The Globe and Mail
"Sun, 02 Nov 2025 08:09:39 GMT","Capital Management Associates Inc Buys 3,209 Shares of Microsoft Corporation $MSFT - MarketBeat",MarketBeat
"Fri, 31 Oct 2025 07:27:28 GMT",Microsoft Corporation $MSFT is NBT Bank N A NY's Largest Position - MarketBeat,MarketBeat
"Sun, 02 Nov 2025 08:09:39 GMT",Microsoft Corporation $MSFT Shares Sold by Bar Harbor Wealth Management - MarketBeat,MarketBeat
"Mon, 03 Nov 2025 03:54:27 GMT","Goldman Sachs Research raised its target price for Microsoft (MSFT.US) to $667, believing it deserves a premium over its peers. - 富途牛牛",富途牛牛
"Fri, 31 Oct 2025 07:27:26 GMT",Microsoft Corporation $MSFT Stake Boosted by Mirova US LLC - MarketBeat,MarketBeat
"Sat, 01 Nov 2025 03:52:45 GMT",Morgan Stanley Turns More Bullish on Microsoft (MSFT) After Earnings Beat - MSN,MSN
"Sun, 02 Nov 2025 08:09:40 GMT",Sitrin Capital Management LLC Cuts Position in Microsoft Corporation $MSFT - MarketBeat,MarketBeat
"Fri, 31 Oct 2025 07:25:59 GMT",Focused Investors LLC Has $157.53 Million Holdings in Microsoft Corporation $MSFT - MarketBeat,MarketBeat
"Thu, 30 Oct 2025 11:30:00 GMT","Breakfast News: META, MSFT Fall On Capex - The Motley Fool",The Motley Fool
"Sun, 02 Nov 2025 08:09:38 GMT",Microsoft Corporation $MSFT Shares Sold by Hager Investment Management Services LLC - MarketBeat,MarketBeat
2025-11-03T19:15:05,"Amazon & OpenAI team up, Microsoft partners with startup Lambda",Yahoo
2025-11-03T18:32:47,Amazon Web Services Signs $38 Billion Cloud Deal With OpenAI,Yahoo
2025-11-03T17:10:36,700 Billion Reasons Why These Are 3 Must-Buy Stocks for 2026,Yahoo
2025-11-03T16:35:11,Amazon Stock Rallies To Record Highs On $38 Billion OpenAI Cloud Deal,Yahoo
2025-11-03T15:34:33,"Kimberly-Clark to buy Tylenol maker Kenvue, Iren & Microsoft deal",Yahoo
2025-11-02T12:27:41,Microsoft (MSFT) Maintains Buy Rating at Truist After Solid Fiscal Q1 Results,Yahoo
2025-11-01T20:30:55,"Microsoft (MSFT)’s Traditional Software “Was Extraordinary,” Says Jim Cramer",Yahoo
2025-10-31T18:15:11,Unlock AI’s Hidden Gems: 3 Must-Buy Stocks Fueling the Data Center Surge,Yahoo
2025-11-04T04:05:00,Why Does META drop to a 6 Month Low and Other Mag7 Hit All Time High?,Reddit/r/investing
2025-11-03T12:28:41,IREN Signs $9.7 billion deal with MSFT,Reddit/r/wallstreetbets
2025-11-01T00:05:30,It's never a bad idea to take profits right?,Reddit/r/investing
2025-10-30T22:02:47,"Hyperscalers Cloud Revenue Growth: MSFT $49.1b (up 26%), AMZN $33b (up 20%) and GOOGL $15.2b (up 34%)",Reddit/r/stocks
2025-10-30T17:26:05,MSFT - How long do I have?,Reddit/r/investing
