Date,Title,Source
2025-12-10T17:59:17,Deere Calls 2026 the Bottom as Caterpillar Rides Energy Growth Past Estimates,Yahoo
2025-12-10T13:32:00,Deere targets big sales goals as Trump pushes for lower equipment prices,Yahoo
2025-12-10T08:42:57,Deere: If Trump Says To Cut Prices The Stock Listens,SeekingAlpha
2025-12-10T01:03:07,Jefferies Maintains Deere (DE) Hold Recommendation,Fintel
2025-12-09T18:12:27,Is Deere Still a Smart Bet as Precision Agriculture Growth Accelerates in 2025?,Yahoo
2025-12-09T17:51:43,Deere Says It’s Helping Farmers Cut Costs After Trump Calls Out Expenses,Yahoo
2025-12-09T13:54:40,Farmers Warn of 2026 Crisis as Trump Aid Falls Short--Deere Caught in the Crosshairs,Yahoo
2025-12-09T00:10:34,Trump says US will help tractor makers by removing environmental rules,Yahoo
2025-12-08T22:33:32,Impact of Trump's $12B farmer bailout: Deere exec. weighs in,Yahoo
2025-12-08T22:16:00,Deere’s Aggressive Business Goals Land With a Thud,Yahoo
2025-12-08T21:05:06,Trump Urges Tractor Makers to Cut Costs as Vexed Farmers Get Aid,Yahoo
2025-12-08T19:07:18,Deere & Company (DE) Analyst/Investor Day Transcript,SeekingAlpha
2025-12-07T14:35:24,Deere (NYSE:DE) Will Pay A Dividend Of $1.62,Yahoo
2025-12-05T16:42:09,Deere CIO to retire after 28 years with the company,Yahoo
2025-12-05T03:29:02,Deere & Company (DE): A Bull Case Theory,Yahoo
2025-11-26T12:30:54+00:00,DE Earnings: Deere Stock Drops Despite Overcoming 'Challenges and Uncertainty',TipRanks
2025-08-12T14:45:00+00:00,Buy or Sell Deere Stock Ahead of Its Upcoming Earnings?,Forbes
2025-09-11T17:18:00+00:00,"If You Invested $100 In Deere Stock 10 Years Ago, You Would Have This Much Today",Benzinga
2025-11-10T22:45:00+00:00,Deere (DE) Stock Moves 1.54%: What You Should Know,Nasdaq
2025-10-28T09:35:00+00:00,Deere & Company: Still My Strongest Sell Due To The Huge Gap Between Market Hopes And Reality,Seeking Alpha
2025-08-27T14:50:00+00:00,CAT vs. DE: Which Heavy Machinery Stock Looks More Promising?,Nasdaq
2025-11-26T19:59:00+00:00,Deere stock: six ways AI could drive it much higher in 2026,Invezz
2025-08-14T20:35:00+00:00,Why Deere (DE) Stock Is Nosediving,MSN
