Date,Title,Source
"Mon, 08 Sep 2025 23:33:28 GMT","Take-Two Interactive Software, Inc. $TTWO Stake Reduced by Rip Road Capital Partners LP - MarketBeat",MarketBeat
"Mon, 08 Sep 2025 19:36:30 GMT","Take-Two (TTWO) Stock Trades Up, Here Is Why - Yahoo Finance",Yahoo Finance
"Thu, 04 Sep 2025 20:33:00 GMT",Insider Sale: Chief Legal Officer of $TTWO Sells 903 Shares - Quiver Quantitative,Quiver Quantitative
"Mon, 08 Sep 2025 08:19:03 GMT",TTWO Flashes Buy Signal on Multi Timeframe Chart - 2025 Trading Volume Trends & Fast Momentum Entry Tips - beatles.ru,beatles.ru
"Sat, 06 Sep 2025 15:19:07 GMT",Will TTWO benefit from AI trends - Profit Target & Verified High Yield Trade Plans - 강소기업뉴스,강소기업뉴스
"Mon, 08 Sep 2025 12:04:16 GMT","Nissay Asset Management Corp Japan ADV Acquires 5,732 Shares of Take-Two Interactive Software, Inc. $TTWO - MarketBeat",MarketBeat
"Fri, 05 Sep 2025 19:49:07 GMT",Should I invest in TTWO before earnings - July 2025 Drop Watch & Stock Timing and Entry Methods - خودرو بانک,خودرو بانک
"Sun, 07 Sep 2025 05:26:45 GMT",Will TTWO benefit from geopolitical trends - Weekly Profit Recap & Expert Verified Stock Movement Alerts - 강소기업뉴스,강소기업뉴스
"Sat, 06 Sep 2025 07:00:00 GMT","Take-Two Interactive Software, Inc. (NASDAQ:TTWO) Given Average Rating of ""Moderate Buy"" by Analysts - MarketBeat",MarketBeat
"Fri, 05 Sep 2025 02:03:49 GMT",Is TTWO a stock for growth or value investors - Market Sentiment Report & Technical Confirmation Trade Alerts - خودرو بانک,خودرو بانک
"Fri, 05 Sep 2025 13:05:10 GMT","224,708 Shares in Take-Two Interactive Software, Inc. $TTWO Purchased by Atalanta Sosnoff Capital LLC - MarketBeat",MarketBeat
"Sat, 06 Sep 2025 07:00:00 GMT","Ieq Capital LLC Increases Stock Holdings in Take-Two Interactive Software, Inc. $TTWO - MarketBeat",MarketBeat
"Tue, 09 Sep 2025 02:42:56 GMT",How to read the order book for TTWO - Portfolio Return Report & Low Risk High Reward Trade Ideas - Newser,Newser
"Tue, 09 Sep 2025 01:56:28 GMT",Live market analysis of TTWO - Oil Prices & Fast Exit/Entry Strategy Plans - Newser,Newser
"Tue, 09 Sep 2025 01:27:47 GMT",Is TTWO stock ready for a breakout - Market Sentiment Review & Community Trade Idea Sharing - Newser,Newser
"Tue, 09 Sep 2025 06:32:37 GMT",What makes TTWO stock price move sharply - Portfolio Performance Report & Long-Term Investment Growth Plans - Newser,Newser
"Mon, 08 Sep 2025 20:35:01 GMT",Combining machine learning predictions for TTWO - Quarterly Portfolio Summary & Smart Allocation Stock Tips - Newser,Newser
"Tue, 09 Sep 2025 02:33:33 GMT",Will TTWO benefit from macro trends - July 2025 Price Swings & High Return Trade Guides - Newser,Newser
2025-09-04T19:29:16,Questions on investing for a payoff 9 months down the road,Reddit/r/investing
