Date,Title,Source
2025-08-31T06:31:13Z,Ferguson plc (NASDAQ:FERG) Receives $220.64 Consensus PT from Brokerages,ETF Daily News
2025-08-29T12:09:59Z,Ferguson Enterprises (FERG) Surged Due to Improved Market Sentiment,Yahoo Entertainment
2025-08-29T03:21:27Z,Joey Bada$$ Explains Why He's 'Lonely At The Top' With New Album,HYPEBEAST
2025-08-27T20:58:03Z,Streetwear Rock Joint Capsules - The Palace x Him Capsule Merges Skate Style with Heartagram Energy (TrendHunter.com),Trendhunter.com
"Sun, 31 Aug 2025 23:02:28 GMT",Evaluating FERG with trendline analysis - July 2025 Review & Daily Technical Forecast Reports - Newser,Newser
"Mon, 01 Sep 2025 04:30:38 GMT",Teca Partners LP Has $11.66 Million Stock Position in Ferguson plc $FERG - MarketBeat,MarketBeat
"Fri, 29 Aug 2025 15:13:40 GMT",Nation’s best sports bar: Relationships propel Ferg’s - St Pete Catalyst,St Pete Catalyst
"Sun, 31 Aug 2025 20:25:55 GMT",Pattern recognition hints at FERG upside - Quarterly Performance Summary & Fast Entry and Exit Trade Plans - Newser,Newser
"Mon, 01 Sep 2025 05:26:56 GMT","FORA Capital LLC Purchases Shares of 34,700 Ferguson plc $FERG - MarketBeat",MarketBeat
"Sun, 31 Aug 2025 17:19:03 GMT",Long term hold vs stop loss in FERG - GDP Growth & Stepwise Trade Execution Plans - Newser,Newser
"Mon, 01 Sep 2025 05:24:53 GMT","ICONIQ Capital LLC Purchases Shares of 1,279 Ferguson plc $FERG - MarketBeat",MarketBeat
"Sun, 31 Aug 2025 16:37:56 GMT",Should you wait for a breakout in FERG - Stop Loss & Low Drawdown Investment Strategies - Newser,Newser
"Mon, 01 Sep 2025 06:21:39 GMT",Ferguson (LON:FERG) Stock Price Down 0.7% - Here's Why - MarketBeat,MarketBeat
"Mon, 01 Sep 2025 05:22:58 GMT",Brokerages Set Ferguson plc (NASDAQ:FERG) PT at $220.64 - MarketBeat,MarketBeat
"Sun, 31 Aug 2025 20:31:03 GMT",FERG stock outlook for YEAR - Dollar Strength & Consistent Return Investment Signals - Newser,Newser
"Mon, 01 Sep 2025 05:23:08 GMT",Findlay Park Partners LLP Has $131.25 Million Stock Position in Ferguson plc $FERG - MarketBeat,MarketBeat
"Sun, 31 Aug 2025 17:48:48 GMT",How to monitor FERG with trend dashboards - July 2025 Institutional & Growth Focused Entry Reports - Newser,Newser
"Sun, 31 Aug 2025 09:12:24 GMT",Chart based exit strategy for FERG - July 2025 PostEarnings & Advanced Swing Trade Entry Plans - Newser,Newser
"Mon, 01 Sep 2025 00:35:23 GMT",Chart based exit strategy for FERG - 2025 Buyback Activity & Fast Gain Stock Trading Tips - Newser,Newser
"Sun, 31 Aug 2025 03:47:34 GMT",Forecasting FERG price range with options data - 2025 Year in Review & Free High Accuracy Swing Entry Alerts - Newser,Newser
"Sun, 31 Aug 2025 03:54:39 GMT",How to monitor FERG with trend dashboards - Market Rally & Weekly Top Stock Performers List - Newser,Newser
"Sun, 31 Aug 2025 13:52:07 GMT",What institutional flow reveals about FERG - 2025 EndofYear Setup & Growth Focused Stock Pick Reports - Newser,Newser
"Fri, 29 Aug 2025 18:55:44 GMT",Evaluating FERG with trendline analysis - Weekly Trend Recap & Free Technical Pattern Based Buy Signals - Newser,Newser
"Fri, 29 Aug 2025 19:24:10 GMT",Is FERG stock reversal real or fake - Trade Entry Summary & High Yield Equity Trading Tips - Newser,Newser
"Mon, 01 Sep 2025 02:00:46 GMT",How to monitor FERG with trend dashboards - Market Trend Report & Fast Moving Stock Trade Plans - Newser,Newser
"Sun, 31 Aug 2025 11:55:41 GMT",Vident Advisory LLC Has $15.68 Million Holdings in Ferguson plc $FERG - MarketBeat,MarketBeat
"Sun, 31 Aug 2025 18:19:22 GMT",FERG stock outlook for YEAR - 2025 Price Momentum & Free Expert Approved Momentum Trade Ideas - Newser,Newser
"Sun, 31 Aug 2025 10:55:14 GMT",Ferguson plc $FERG Shares Sold by Parnassus Investments LLC - MarketBeat,MarketBeat
"Fri, 29 Aug 2025 08:07:13 GMT",FERG stock daily chart insights - Dollar Strength & Capital Efficiency Focused Ideas - Newser,Newser
"Sun, 31 Aug 2025 09:59:36 GMT","Eisler Capital Management Ltd. Buys Shares of 2,087 Ferguson plc $FERG - MarketBeat",MarketBeat
"Sun, 31 Aug 2025 21:17:13 GMT",Short Covering May Lift FERG in Near Term getLinesFromResByArray error: size == 0 - thegnnews.com,thegnnews.com
"Thu, 28 Aug 2025 13:06:15 GMT",Is FERG stock entering bullish territory - 2025 Investor Takeaways & Expert Approved Momentum Ideas - Newser,Newser
"Fri, 29 Aug 2025 12:09:59 GMT",Ferguson Enterprises (FERG) Surged Due to Improved Market Sentiment - Yahoo Finance,Yahoo Finance
"Sun, 31 Aug 2025 04:35:17 GMT",Using fundamentals and technicals on FERG - 2025 Earnings Surprises & Trade Opportunity Analysis Reports - Newser,Newser
"Sun, 31 Aug 2025 07:35:08 GMT",FERG stock outlook for YEAR - July 2025 Breakouts & Daily Technical Stock Forecast Reports - Newser,Newser
"Thu, 28 Aug 2025 13:46:53 GMT",St. Pete's Ferg's Sports Bar & Grill ranked top local sports bar in U.S. Here's why - FOX 13 Tampa Bay,FOX 13 Tampa Bay
"Sun, 31 Aug 2025 08:23:09 GMT",Ferguson plc $FERG Shares Sold by Ameriprise Financial Inc. - MarketBeat,MarketBeat
"Sat, 30 Aug 2025 10:15:55 GMT",Ferguson plc $FERG Position Increased by B. Metzler seel. Sohn & Co. AG - MarketBeat,MarketBeat
"Sat, 30 Aug 2025 22:38:08 GMT",Pattern recognition hints at FERG upside - Portfolio Gains Report & Daily Technical Forecast Reports - Newser,Newser
"Fri, 29 Aug 2025 22:18:45 GMT",Ferguson plc $FERG Shares Sold by Algert Global LLC - MarketBeat,MarketBeat
"Fri, 29 Aug 2025 22:18:45 GMT","Thematics Asset Management Purchases Shares of 74,804 Ferguson plc $FERG - MarketBeat",MarketBeat
"Fri, 29 Aug 2025 22:18:45 GMT",Ferguson plc $FERG Stake Cut by Banco Bilbao Vizcaya Argentaria S.A. - MarketBeat,MarketBeat
"Fri, 29 Aug 2025 07:00:00 GMT",Groupe la Francaise Has $3.20 Million Stock Position in Ferguson plc $FERG - MarketBeat,MarketBeat
"Sat, 30 Aug 2025 18:37:35 GMT",Does FERG qualify in momentum factor screening - Forecast Cut & Fast Exit/Entry Strategy Plans - Newser,Newser
"Fri, 29 Aug 2025 19:40:05 GMT",FERG stock daily chart insights - July 2025 Price Swings & Capital Efficient Trade Techniques - Newser,Newser
"Fri, 29 Aug 2025 08:30:47 GMT",Ferguson (NYSE:FERG) Shares Up 0.4% - Here's What Happened - MarketBeat,MarketBeat
"Thu, 28 Aug 2025 19:52:30 GMT",Price T Rowe Associates Inc. MD Raises Position in Ferguson plc $FERG - MarketBeat,MarketBeat
"Thu, 28 Aug 2025 19:52:30 GMT",Ferguson plc $FERG Shares Sold by Credit Agricole S A - MarketBeat,MarketBeat
"Wed, 27 Aug 2025 20:34:52 GMT",What institutional flow reveals about FERG - Stop Loss & Fast Gaining Stock Strategy Reports - Newser,Newser
"Thu, 28 Aug 2025 07:00:00 GMT",BRITISH COLUMBIA INVESTMENT MANAGEMENT Corp Grows Stake in Ferguson plc $FERG - MarketBeat,MarketBeat
"Thu, 28 Aug 2025 07:00:00 GMT",Martingale Asset Management L P Reduces Holdings in Ferguson plc $FERG - MarketBeat,MarketBeat
"Thu, 28 Aug 2025 07:00:00 GMT",HighTower Advisors LLC Has $2.57 Million Position in Ferguson plc $FERG - MarketBeat,MarketBeat
"Thu, 28 Aug 2025 18:38:06 GMT",Evaluating FERG with trendline analysis - July 2025 Earnings & Weekly Chart Analysis and Guides - Newser,Newser
"Wed, 27 Aug 2025 07:00:00 GMT",Ferguson plc $FERG is Fiduciary Management Inc. WI's 2nd Largest Position - MarketBeat,MarketBeat
"Wed, 27 Aug 2025 07:00:00 GMT",Ferguson plc $FERG Shares Sold by Candriam S.C.A. - MarketBeat,MarketBeat
"Wed, 27 Aug 2025 07:00:00 GMT",Northern Trust Corp Trims Position in Ferguson plc $FERG - MarketBeat,MarketBeat
"Fri, 29 Aug 2025 04:22:31 GMT","Joey Bada$$, A$AP Ferg & Kelz2busy – HIGHROLLER Lyrics - Genius",Genius
2025-08-29T14:09:59,Ferguson Enterprises (FERG) Surged Due to Improved Market Sentiment,Yahoo
