Date,Title,Source
2025-10-30T08:00:14Z,dicom-ups 0.0.3,Pypi.org
2025-10-30T07:03:32Z,5 vegetables that can help bring down uric acid levels in a month,The Times of India
2025-10-30T04:44:38Z,Mukul Agrawal purchases 10 new stocks in Q2; ups stake in 5. How many do you own?,The Times of India
2025-10-30T03:24:10Z,"Has the AI jobs bloodbath finally arrived? Amazon and UPS have each just replaced 14,000 jobs with AI",Freerepublic.com
2025-10-30T03:01:00Z,"Many MPs yet to do medical check-ups, says Speaker",The Star Online
2025-10-29T22:12:06Z,"Overexposure to Light at Night Ups CVD Risk, Study Finds - Medscape",Slashdot.org
2025-10-29T22:10:47Z,Dear FRiends and supporters of FR: Please send your donations in as early as you can. Thank you very much and God bless you. [FReepathon],Freerepublic.com
2025-10-29T20:29:58Z,New FBI files reveal Jack Smith’s ‘fishing expedition’ targeted ‘entire Republican political apparatus’: Sen. Chuck Grassley (430 individuals and organizations),Freerepublic.com
2025-10-29T19:13:56Z,Swansea v Man City: Confirmed line-ups as Haaland rested amid wholesale changes from visitors,101 Great Goals
"Thu, 30 Oct 2025 18:46:40 GMT","2,000 drivers left UPS after taking buyouts, analyst says - Yahoo Finance",Yahoo Finance
"Thu, 30 Oct 2025 19:15:00 GMT",UPS truck strikes bridge in Kelso - king5.com,king5.com
"Thu, 30 Oct 2025 20:43:00 GMT",Opinion | UPS Does Well When the Teamsters Do Best - The Wall Street Journal,The Wall Street Journal
"Wed, 29 Oct 2025 18:00:29 GMT","UPS, Postal Service reach ‘preliminary agreement’ in Ground Saver talks - Supply Chain Dive",Supply Chain Dive
"Tue, 28 Oct 2025 10:05:18 GMT",UPS Releases 3Q 2025 Earnings - UPS,UPS
"Thu, 30 Oct 2025 22:16:15 GMT","UPS Reaches ""Preliminary Understanding"" With USPS To Resume Ground Saver Delivery Partnership - Value Added Resource",Value Added Resource
"Wed, 29 Oct 2025 14:42:54 GMT",UPS Adds More Gig Drivers to Offset eCommerce Surges - PYMNTS.com,PYMNTS.com
"Tue, 28 Oct 2025 16:36:00 GMT","UPS cuts 48,000 jobs in the year to date as its turnaround continues - AP News",AP News
"Wed, 29 Oct 2025 21:05:00 GMT",UPS Receives Price-Target Hikes Amid Job Cuts But Analyst Makes This Warning - Investor's Business Daily,Investor's Business Daily
"Tue, 28 Oct 2025 13:27:55 GMT","UPS cut 48,000 jobs so far in 2025 - Reuters",Reuters
"Tue, 28 Oct 2025 14:00:00 GMT","Atlanta-based UPS cuts an additional 14,000 jobs - Atlanta News First",Atlanta News First
"Wed, 29 Oct 2025 12:27:00 GMT",UPS CFO on Amazon pullback and driving a growth strategy - Fortune,Fortune
"Fri, 31 Oct 2025 02:30:00 GMT",Jim Cramer Highlights Why UPS Reported “Much Better Than Expected Earnings” - Yahoo Finance,Yahoo Finance
"Thu, 30 Oct 2025 21:27:14 GMT",See how UPS delivers for one luxury bag brand crafted by African artistry - UPS,UPS
"Wed, 29 Oct 2025 09:30:00 GMT",Why UPS Is Increasingly Turning to Gig Drivers for Deliveries - The Wall Street Journal,The Wall Street Journal
"Tue, 28 Oct 2025 14:55:02 GMT","UPS job cuts reach 34K this year, aided by driver buyouts - Supply Chain Dive",Supply Chain Dive
"Wed, 29 Oct 2025 15:13:03 GMT","UPS, Postal Service to reunite for delivery of low-budget shipments - Yahoo Finance",Yahoo Finance
"Wed, 29 Oct 2025 14:05:10 GMT","UPS stock rallies after company discloses 48,000 layoffs in multibillion-dollar savings push - Yahoo Finance",Yahoo Finance
"Wed, 29 Oct 2025 17:37:40 GMT","Layoffs hit Amazon, UPS, Target, and more — what's fueling the cuts - Yahoo Finance",Yahoo Finance
"Tue, 28 Oct 2025 14:09:00 GMT","UPS cut more jobs than expected this year, shrinking its operational workforce by 34,000 with layoffs and buyouts - Business Insider",Business Insider
"Tue, 28 Oct 2025 21:53:00 GMT",Opinion | The Bad Teamsters Bargain With UPS - The Wall Street Journal,The Wall Street Journal
"Tue, 28 Oct 2025 11:16:00 GMT","UPS has cut 34,000 jobs — a lot more than planned — and earnings show the move paid off - MarketWatch",MarketWatch
"Tue, 28 Oct 2025 12:20:00 GMT","UPS Profit, Revenue Fall but Saw Strong International Growth - The Wall Street Journal",The Wall Street Journal
"Tue, 28 Oct 2025 16:35:00 GMT","UPS Cuts 48,000 Jobs in Management and Operations Through Layoffs and Buyouts - The Wall Street Journal",The Wall Street Journal
"Tue, 28 Oct 2025 14:58:51 GMT","UPS Has Cut 48,000 Workers Since Last Year - The New York Times",The New York Times
"Thu, 30 Oct 2025 23:04:42 GMT",Amazon Ups Quarterly Subscription Services Revenue 11% to $12.6 Billion - Media Play News,Media Play News
"Thu, 30 Oct 2025 18:44:00 GMT",Proton Data Breach Observatory to expose infosec cover-ups - theregister.com,theregister.com
"Thu, 30 Oct 2025 19:00:57 GMT","UPS Lays Off 48,000 Workers as It Walks Away From Old Growth Models - DesignRush",DesignRush
"Wed, 29 Oct 2025 16:23:00 GMT",UPS Driver Finds 3 St. Bernards in Truck—What He Does Next Caught on Camera - Newsweek,Newsweek
"Wed, 29 Oct 2025 19:06:06 GMT","Amazon, UPS Among Companies Announcing Mass Layoffs This Week - Cheapism",Cheapism
"Fri, 31 Oct 2025 02:36:48 GMT",Jim Cramer Highlights Why UPS Reported “Much Better Than Expected Earnings” - Insider Monkey,Insider Monkey
"Wed, 29 Oct 2025 08:15:00 GMT","Amazon, UPS, PwC, and others slash workforces - Morning Brew",Morning Brew
"Tue, 28 Oct 2025 16:41:07 GMT",UPS Earnings Report Showed Progress in Shipping Giant's Turnaround Effort - Investopedia,Investopedia
"Tue, 28 Oct 2025 10:15:14 GMT","UPS forecasts fourth-quarter revenue above estimates, shares surge - Yahoo Finance",Yahoo Finance
"Thu, 30 Oct 2025 12:15:49 GMT",What is Driving Job Cuts and a Strategic Shift at UPS? - Business Chief,Business Chief
"Thu, 30 Oct 2025 17:50:00 GMT",Neal H. Moritz’s Original Film Re-Ups Overall Deal With Sony Pictures Television - Deadline,Deadline
"Wed, 29 Oct 2025 21:53:45 GMT","How Houston is impacted with Amazon, UPS, Target layoffs - Houston Chronicle",Houston Chronicle
"Thu, 30 Oct 2025 21:11:24 GMT","Humor, Exhaustion, and Resilience in the Ups and Downs of a Delivery Worker in China - PEN America",PEN America
"Tue, 28 Oct 2025 11:26:04 GMT","UPS deepens job cutting amid turnaround, says 48,000 roles eliminated this year - CNBC",CNBC
"Tue, 28 Oct 2025 10:21:40 GMT","United Parcel Service (NYSE:UPS) Surprises With Q3 Sales, Stock Jumps 18% - Yahoo Finance",Yahoo Finance
"Tue, 28 Oct 2025 20:15:00 GMT",UPS Stock Soars After Earnings. Its Dividend Is Safe—For Now. - Barron's,Barron's
"Tue, 28 Oct 2025 21:47:00 GMT","UPS axes 48,000 workers in sweeping cost-cut push, sparking stock surge - New York Post",New York Post
"Tue, 28 Oct 2025 17:12:00 GMT",Brewer UPS employee says missing ballot incident was ‘honest mistake’ - WABI,WABI
"Thu, 30 Oct 2025 13:39:54 GMT",Record job cuts at Amazon and UPS as AI and reorganisation reshape logistics - Trans.INFO,Trans.INFO
"Thu, 30 Oct 2025 15:52:31 GMT","Lilly Ups Guidance on Weight Loss, Obesity Drugs’ Strength - Bloomberg.com",Bloomberg.com
"Thu, 30 Oct 2025 18:55:19 GMT",Sign-ups with higher Obamacare costs start Saturday: What that means for New Yorkers - Olean Times Herald,Olean Times Herald
"Tue, 28 Oct 2025 13:38:03 GMT",UPS Jumps After Sweeping Job Cuts Push Profit Above Estimates - Bloomberg.com,Bloomberg.com
"Thu, 30 Oct 2025 18:36:03 GMT",WhatsApp Adds Passkey Protection for Chat Back-Ups - Social Media Today,Social Media Today
"Thu, 30 Oct 2025 13:37:09 GMT","UPS Axes 14,000 More Jobs, Confirms Restructuring Plan Is Proceeding As Expected - Black Enterprise",Black Enterprise
"Thu, 30 Oct 2025 12:32:10 GMT",Comment Trade risk: UPS’s next stress test set to come from the Supreme Court? - The Loadstar,The Loadstar
"Thu, 30 Oct 2025 16:57:00 GMT","Lilly Beats on Q3 Earnings, Ups View, Mounjaro, Zepbound Drive Sales - Yahoo Finance",Yahoo Finance
"Tue, 28 Oct 2025 15:39:13 GMT",UPS stock surges: Cost-cutting & turnaround efforts pay off - Yahoo Finance,Yahoo Finance
"Tue, 28 Oct 2025 13:58:00 GMT","UPS Mass Layoffs as 48,000 Jobs Cut - Newsweek",Newsweek
"Thu, 30 Oct 2025 23:34:00 GMT",Extravagant set-ups decorate a packed RV City in last year before FL-GA game hits the road - firstcoastnews.com,firstcoastnews.com
"Tue, 28 Oct 2025 21:51:00 GMT","The ‘no-hire, no-fire’ job market may have ended, as Amazon, UPS make bold layoff moves - MarketWatch",MarketWatch
"Thu, 30 Oct 2025 16:58:42 GMT",Army 3-star general retires early from Pentagon role as shake-ups continue - Task & Purpose,Task & Purpose
"Tue, 28 Oct 2025 10:21:03 GMT","UPS shares surge after earnings, guidance beat expectations - Investing.com",Investing.com
"Thu, 30 Oct 2025 12:30:00 GMT","Sign-ups with higher Obamacare costs start Saturday: What that means for NYers, for now - Syracuse.com",Syracuse.com
"Wed, 29 Oct 2025 20:34:58 GMT","UPS Rakes in Profits, Cuts Union Jobs - Teamsters for a Democratic Union",Teamsters for a Democratic Union
"Tue, 28 Oct 2025 19:05:20 GMT","UPS and Amazon confirm it will slash 62,000 jobs ahead of busiest time of year - The US Sun",The US Sun
"Thu, 30 Oct 2025 14:00:00 GMT",Underscore Talent Ups Nadi Filsoof To Partner & Hires BuzzFeed Alum For Shorthand Studios - Deadline,Deadline
"Tue, 28 Oct 2025 13:16:12 GMT","UPS cuts 48,000 positions - WSB-TV",WSB-TV
"Fri, 31 Oct 2025 05:46:19 GMT",Blackpink to open pop-ups in collaboration with Musinsa and sports apparel brands - Korea JoongAng Daily,Korea JoongAng Daily
"Wed, 29 Oct 2025 15:17:05 GMT","UPS Reveals Massive Layoffs With 48,000 Jobs Cut This Year: Here's Breakdown - AOL.com",AOL.com
"Thu, 30 Oct 2025 20:14:47 GMT","Western Digital surges as AI demand fuels Q1 results, guidance; ups dividend (WDC:NASDAQ) - Seeking Alpha",Seeking Alpha
"Thu, 30 Oct 2025 06:07:00 GMT",UPS (UPS) Net Margin Miss Reinforces Investor Concern Over Dividend and Financial Strength - Yahoo Finance,Yahoo Finance
"Fri, 31 Oct 2025 03:13:46 GMT",Adah Sharma ups the Halloween vibe: Scaring people is my cardio | Hindustan Times - Hindustan Times,Hindustan Times
"Thu, 30 Oct 2025 14:41:34 GMT",Christmas Wish sign-ups now open - Ozark County Times |,Ozark County Times |
"Tue, 28 Oct 2025 19:00:25 GMT","Layoffs Hit Tens Of Thousands At Amazon, UPS, Chegg - Forbes",Forbes
"Wed, 29 Oct 2025 11:31:00 GMT",Where Will UPS Be in 5 Years? - The Motley Fool,The Motley Fool
"Thu, 30 Oct 2025 18:53:00 GMT","UPS Driver Buyout 2025: 2,000 Drivers Accept $175M Separation Package - News and Statistics - IndexBox",IndexBox
"Tue, 28 Oct 2025 18:07:55 GMT",Top 5 takeaways from UPS’s Q3 2025 earnings announcement - UPS,UPS
"Wed, 29 Oct 2025 11:40:09 GMT",Comment The brand new face of UPS Supply Chain Solutions - The Loadstar,The Loadstar
"Thu, 30 Oct 2025 11:07:00 GMT","Who employs Louisville? UPS, Norton and Kroger lead 2025 list - The Business Journals",The Business Journals
"Thu, 30 Oct 2025 17:10:59 GMT",Enjoy in-person meets ups during the Wild Area 2025: Global! - Pokémon GO Hub,Pokémon GO Hub
"Thu, 30 Oct 2025 18:17:05 GMT","Family of man shot, killed at Marlboro County nightclub ups reward in search of answers - WBTW",WBTW
"Fri, 31 Oct 2025 06:29:00 GMT","UPS Axes 48,000 Jobs in Brutal Restructuring — Shares Soar as Workers Pay the Price - International Business Times UK",International Business Times UK
"Thu, 30 Oct 2025 11:17:38 GMT",Six Halloween pop-ups in KC this weekend - Axios,Axios
"Wed, 29 Oct 2025 17:47:18 GMT","UPS Layoffs: Logistics Giant Cuts 48,000 Jobs In Efficiency Push And Profit Drive - Yahoo Finance",Yahoo Finance
"Thu, 30 Oct 2025 21:30:23 GMT","Colorado ups funding for food banks, WIC while SNAP funds are paused - The Coloradoan",The Coloradoan
"Thu, 30 Oct 2025 17:27:32 GMT","UPS Cuts 48,000 Jobs in Management and Operations - MSN",MSN
"Thu, 30 Oct 2025 17:30:00 GMT",Miami Hurricanes Match-ups of the Week: Week 10 vs. SMU - State of The U,State of The U
"Wed, 29 Oct 2025 06:14:00 GMT","UPS cuts 48,000 jobs in the year to date as its turnaround continues - WDAM-TV",WDAM-TV
"Wed, 29 Oct 2025 06:14:00 GMT","UPS cuts 48,000 jobs in the year to date as its turnaround continues - WSMV",WSMV
"Wed, 29 Oct 2025 06:14:00 GMT","UPS cuts 48,000 jobs in the year to date as its turnaround continues - KTTC | Rochester, MN","KTTC | Rochester, MN"
"Tue, 28 Oct 2025 17:26:08 GMT","UPS Layoffs: 34,000 workers laid off in first 9 months of 2025 amid turnaround efforts - livemint.com",livemint.com
"Wed, 29 Oct 2025 06:14:00 GMT","UPS cuts 48,000 jobs in the year to date as its turnaround continues - Dakota News Now",Dakota News Now
"Wed, 29 Oct 2025 11:31:00 GMT",Where Will UPS Be in 5 Years? - Yahoo Finance,Yahoo Finance
"Tue, 28 Oct 2025 13:54:43 GMT","UPS lay offs: Amazon, Target, now United Parcel Service cuts 34,000-48,000 high-profile jobs, claim report - The Economic Times",The Economic Times
"Tue, 28 Oct 2025 17:24:03 GMT",News UPS bullish for Q4 amid 'cost saving' initiatives - The Loadstar,The Loadstar
"Wed, 29 Oct 2025 06:14:00 GMT","UPS cuts 48,000 jobs in the year to date as its turnaround continues - FOX5 Vegas",FOX5 Vegas
"Wed, 29 Oct 2025 06:14:00 GMT","UPS cuts 48,000 jobs in the year to date as its turnaround continues - KEYC News Now",KEYC News Now
"Thu, 30 Oct 2025 17:03:07 GMT",NYC Pastry Chef Previews Upcoming Diner With Brooklyn Museum Pop-Ups - Eater New York,Eater New York
"Wed, 29 Oct 2025 06:14:00 GMT","UPS cuts 48,000 jobs in the year to date as its turnaround continues - Valley News Live",Valley News Live
"Thu, 30 Oct 2025 16:48:18 GMT","Watch Lilly Ups Guidance as Novo, Pfizer Face Off in Obesity-Drug Tussle - Bloomberg.com",Bloomberg.com
"Tue, 28 Oct 2025 19:53:48 GMT","UPS stuns Wall Street as it announces it has cut 34,000 jobs this year - far more than planned - Daily Mail",Daily Mail
2025-10-30T19:46:40,"2,000 drivers left UPS after taking buyouts, analyst says",Yahoo
2025-10-30T07:07:03,UPS (UPS) Net Margin Miss Reinforces Investor Concern Over Dividend and Financial Strength,Yahoo
2025-10-29T23:32:17,Susquehanna Maintains United Parcel Service (UPS) Neutral Recommendation,Fintel
2025-10-29T23:32:16,Wells Fargo Maintains United Parcel Service (UPS) Equal-Weight Recommendation,Fintel
2025-10-29T23:32:15,Citigroup Maintains United Parcel Service (UPS) Buy Recommendation,Fintel
2025-10-29T23:32:14,Stifel Maintains United Parcel Service (UPS) Buy Recommendation,Fintel
2025-10-29T23:32:13,UBS Maintains United Parcel Service (UPS) Buy Recommendation,Fintel
2025-10-29T23:32:11,Truist Securities Maintains United Parcel Service (UPS) Buy Recommendation,Fintel
2025-10-29T23:32:06,JP Morgan Maintains United Parcel Service (UPS) Neutral Recommendation,Fintel
2025-10-29T18:47:18,"UPS Layoffs: Logistics Giant Cuts 48,000 Jobs In Efficiency Push And Profit Drive",Yahoo
2025-10-29T16:13:03,"UPS, Postal Service to reunite for delivery of low-budget shipments",Yahoo
2025-10-29T14:34:26,UPS Receives Price Target Hikes Amid Job Cuts But Analyst Makes This Warning,Yahoo
2025-10-29T14:25:00,"Company News for Oct 29, 2025",Yahoo
2025-10-29T13:27:08,UPS CFO on Amazon pullback and driving a growth strategy,Yahoo
2025-10-29T13:26:19,"UPS, Postal Service reach ‘preliminary agreement’ in Ground Saver talks",Yahoo
2025-10-29T12:31:00,Where Will UPS Be in 5 Years?,Yahoo
2025-10-29T11:30:00,"UPS Eliminates 48,000 Jobs While Working Toward $3.5 Billion Cost-Cutting Target",Yahoo
2025-10-29T10:30:00,Why UPS Is Increasingly Turning to Gig Drivers for Deliveries,Yahoo
2025-10-29T09:10:03,Heard on the Street Tuesday Recap: Another Record,Yahoo
2025-10-29T08:19:36,United Parcel Service: Why This Turnaround Is Just Getting Started,SeekingAlpha
2025-10-29T07:45:00,Big Layoffs Look Scary. Why The Job Market Is Still Holding Up.,Yahoo
2025-10-29T06:33:27,UPS Q3 Deep Dive: Cost Actions and Network Reconfiguration Offset Volume Declines,Yahoo
2025-10-29T06:01:45,"Global firms slash jobs amid weak sentiment, AI push",Yahoo
2025-10-28T22:45:03,Podcast: AI Deals Boost U.S. Stocks to New Records,Yahoo
2025-10-28T21:59:00,"These Stocks Moved the Most Today: UPS, PayPal, Microsoft, Nokia, Skyworks, Royal Caribbean, Wayfair, Cameco, and More",Yahoo
2025-10-28T21:42:57,Heard on the Street Recap: Another Record,Yahoo
2025-10-28T17:11:57,"United Parcel Service, Inc. (UPS) Q3 2025 Earnings Call Transcript",SeekingAlpha
2025-10-28T15:29:04,"UPS cuts 34,000 jobs in the year to date as its turnaround continues",Yahoo
2025-10-28T14:21:42,"Amazon plans 14K job cuts, UPS lays off 34K workers",Yahoo
2025-10-28T14:15:00,Prediction: UPS Will Thrive in the AI Boom. Here's the Key Factor Driving Growth.,Yahoo
2025-10-28T14:08:00,"UPS Cuts 48,000 Jobs in Management and Operations",Yahoo
2025-10-28T14:05:17,"Fed lookahead, Amazon layoffs, earnings latest: 3 Things",Yahoo
2025-10-28T13:20:00,"UPS Profit, Revenue Fall but Saw Strong International Growth",Yahoo
2025-10-28T13:04:53,"Earnings live: PayPal stock soars on OpenAI partnership, UPS surges, UnitedHealth pops",Yahoo
2025-10-28T12:39:24,"United Parcel Service: Back On Track, Cash Flow Supports Dividend",SeekingAlpha
2025-10-28T12:33:00,"UPS Stock Soars After Earnings. Its Dividend Is Safe, For Now.",Yahoo
2025-10-28T12:10:02,United Parcel Service (UPS) Tops Q3 Earnings and Revenue Estimates,Yahoo
2025-10-28T12:02:28,"Earnings Roundup Today: PayPal, UPS, UnitedHealth",Yahoo
2025-10-28T11:49:23,"UPS shares surge after earnings, guidance beat expectations",Yahoo
2025-10-28T11:29:00,"These Stocks Are Moving the Most Today: UPS, UnitedHealth, Amazon, Newmont, Qorvo, NextEra Energy",Yahoo
2025-10-28T11:27:06,UPS shares jump as third quarter profit beats forecast,Fintel
2025-10-28T11:21:40,"United Parcel Service (NYSE:UPS) Surprises With Q3 Sales, Stock Jumps 18%",Yahoo
2025-10-28T11:19:00,UPS Stock Soars as Earnings Are a Relief,Yahoo
2025-10-28T11:08:25,UPS: Q3 Earnings Snapshot,Yahoo
2025-10-28T11:00:00,UPS Releases 3Q 2025 Earnings,Yahoo
2025-10-28T10:07:38,UPS EPS: down slightly in Q3,Finnhub
2025-10-27T20:05:48,What Does the 31% Share Price Drop Mean for UPS Investors in 2025?,Yahoo
2025-10-27T17:03:53,Jim Cramer on United Parcel: “Seems Like a Decent Risk Reward”,Yahoo
2025-10-27T13:00:00,Is United Parcel Service Stock a Buy Now?,Yahoo
2025-10-27T04:15:11,United Parcel Service (UPS) Q3 Earnings: What To Expect,Yahoo
2025-10-26T20:18:00,Is This 7.5%-Yielding Dividend Too Good to Be True?,Yahoo
2025-10-28T16:13:31,"UPS Cuts 48,000 Jobs in Management and Operations",Reddit/r/stocks
