Date,Title,Source
2025-09-15T02:02:22Z,Mariners' Etsy witch-inspired winning streak gives them huge AL West division standings news,Sporting News
2025-09-14T15:30:23Z,"45 Times People Fused Excellent Ideas With Great Execution, And Came Up With These Crafts",Boredpanda.com
2025-09-14T10:01:48Z,My Goals For 2025 Week 37 of 52,Onehundreddollarsamonth.com
2025-09-14T10:00:11Z,Why your favorite Etsy treasures could soon cost more — or go away entirely,Salon
2025-09-13T18:38:02Z,Etsy Witch Who Cursed Charlie Kirk Has Issued An Statement,Livejournal.com
2025-09-13T09:02:42Z,Traders Purchase High Volume of Etsy Call Options (NASDAQ:ETSY),ETF Daily News
2025-09-12T21:00:00Z,"Friday Feedbag: Hot streaks and Etsy Witches and Cutie Pie Power, Oh my!",Lookout Landing
2025-09-12T20:30:00Z,"Shuffle Board: Dick Exec Heads Foot Locker, Depop Exec Returns to Etsy",Sourcing Journal
2025-09-12T19:32:00Z,Seattle Mariners haven't lost since an Etsy witch put her spell on them,Sporting News
2025-09-12T14:47:03Z,Replicas of Charlie Kirk shooting suspect Tyler Robinson's T-shirt On Sale,Biztoc.com
2025-09-12T00:48:35Z,Jezebel Condemns Political Violence,Livejournal.com
2025-09-11T22:08:12Z,Required Reading,Hyperallergic
2025-09-11T19:09:02Z,‘Witch’ who put 'hex' on Charlie Kirk before he died speaks out following his death,LADbible
2025-09-11T17:35:03Z,When you hire a hex on Etsy and then get front-row seats to your own prophecy [Followup],Fark.com
2025-09-11T16:01:37Z,“Feminism is back”: Jezebel’s story about hiring “some Etsy witches” to curse Charlie Kirk two days before his death goes viral,The Daily Dot
2025-09-11T14:45:41Z,"Meet 3 Witches Hired To ‘Curse’ Charlie Kirk, Days Ago! (EXCLUSIVE)",Mediatakeout.com
2025-09-11T12:40:12Z,News website 'paid Etsy witches' to 'curse' Charlie Kirk before shooting,LADbible
2025-09-11T10:00:02Z,"Jezebel adds an editor's note to its September 8 story ""We Paid Some Etsy Witches to Curse Charlie Kirk"", condemning his shooting and removing the author's name (Todd Spangler/Variety)",Mediagazer.com
2025-09-11T08:13:29Z,Shipping Stocks To Research – September 9th,ETF Daily News
2025-09-11T05:28:52Z,"Jezebel paid witches on Etsy to curse Charlie Kirk just days before his assassination, sparking outrage",The Times of India
2025-09-11T03:53:38Z,Jezebel Adds Editor’s Note to Article About Hiring ‘Witches to Curse Charlie Kirk’ Published Two Days Before He Was Assassinated,Variety
2025-09-11T02:00:47Z,Leftist Rag Jezebel Scrambles to Add Editor’s Note to Article Boasting About Paying Witches to Curse Charlie Kirk Days Before His Assassination,Thegatewaypundit.com
2025-09-11T00:10:09Z,Famed feminist website Jezebel paid witches on Etsy to curse Charlie Kirk— 2 days before he was assassinated,New York Post
2025-09-11T00:06:36Z,Jezebel Adds Editor’s Note to Article About Hiring Witches to Curse Charlie Kirk Published Two Days Before He Was Killed,Mediaite
"Mon, 15 Sep 2025 17:34:00 GMT",The Seattle Mariners Are In Their Etsy Witch Era - Defector,Defector
"Tue, 16 Sep 2025 01:34:30 GMT",Etsy Adds AI-Powered Writing and Search Tools for Sellers - PYMNTS.com,PYMNTS.com
"Tue, 16 Sep 2025 00:52:46 GMT",Etsy Gears Up For Holidays With New Tools & Support For Sellers - Value Added Resource,Value Added Resource
"Mon, 15 Sep 2025 11:00:17 GMT",18 Things From Etsy You Can Buy Because You're An Adult And Make Your Own Decisions - Currently.com,Currently.com
"Sun, 14 Sep 2025 02:31:00 GMT","Ending Mariners' 20-year title drought may take mustaches, ‘Etsy witches’ - KING5.com",KING5.com
"Fri, 12 Sep 2025 20:57:13 GMT",'Etsy Witch' may be the secret to success of surging Mariners - KOMO,KOMO
"Fri, 12 Sep 2025 21:00:00 GMT","Friday Feedbag: Hot streaks and Etsy Witches and Cutie Pie Power, Oh my! - Lookout Landing",Lookout Landing
"Fri, 12 Sep 2025 21:02:39 GMT",'Etsy Witch' may be the secret to success of surging Mariners - KBOI,KBOI
"Thu, 11 Sep 2025 18:07:53 GMT",Mariners’ win streak at 5 after fan lifts ‘curse’ with an Etsy witch - KIRO 7 News Seattle,KIRO 7 News Seattle
"Mon, 15 Sep 2025 15:12:00 GMT",January 2028 Options Now Available For Etsy - Nasdaq,Nasdaq
"Sun, 14 Sep 2025 15:20:28 GMT",Will Etsy’s (ETSY) Product and Tech Merger Shape Its Innovation Edge or Risk Strategic Focus? - simplywall.st,simplywall.st
"Mon, 15 Sep 2025 19:01:25 GMT",Etsy Tests New Listings Appeals Process - EcommerceBytes,EcommerceBytes
"Sun, 14 Sep 2025 02:28:06 GMT",VIDEO: Could an Etsy witch be the reason for the Mariner's win streak? - KIRO 7 News Seattle,KIRO 7 News Seattle
"Mon, 15 Sep 2025 11:06:26 GMT","JBGlobal.com LLC Sells 6,577 Shares of Etsy, Inc. $ETSY - MarketBeat",MarketBeat
"Sun, 14 Sep 2025 10:00:11 GMT",Why your favorite Etsy treasures could soon cost more — or go away entirely - Salon.com,Salon.com
"Mon, 15 Sep 2025 07:00:00 GMT",Etsy Sees Unusually Large Options Volume (NASDAQ:ETSY) - MarketBeat,MarketBeat
"Mon, 15 Sep 2025 11:54:00 GMT",Why Etsy Stock Sank by Over 8% on Monday - AOL.com,AOL.com
"Mon, 15 Sep 2025 10:02:53 GMT","Kera Capital Partners Inc. Raises Stock Holdings in Etsy, Inc. $ETSY - MarketBeat",MarketBeat
"Thu, 11 Sep 2025 14:35:04 GMT",’Jezebel’ Writer Paid Etsy Witches To “Curse” Charlie Kirk 2 Days Before Shocking Assassination - yahoo.com,yahoo.com
"Mon, 15 Sep 2025 02:02:00 GMT",Mariners' Etsy witch-inspired winning streak gives them huge AL West division standings news - Yahoo Sports,Yahoo Sports
"Mon, 15 Sep 2025 08:17:50 GMT","MIRAE ASSET GLOBAL ETFS HOLDINGS Ltd. Grows Stock Holdings in Etsy, Inc. $ETSY - MarketBeat",MarketBeat
"Fri, 12 Sep 2025 19:32:45 GMT",Seattle Mariners haven't lost since an Etsy witch put her spell on them - sportingnews.com,sportingnews.com
"Sun, 14 Sep 2025 08:05:12 GMT","7,177 Shares in Etsy, Inc. $ETSY Acquired by United Services Automobile Association - MarketBeat",MarketBeat
"Thu, 11 Sep 2025 18:59:03 GMT",A News Website Apparently Hired An Etsy Witch To Curse Charlie Kirk - BuzzFeed,BuzzFeed
"Fri, 12 Sep 2025 13:43:30 GMT",The Social Skinny: Etsy witches hired to ‘curse Charlie Kirk’; NBC News tests Reddit tools; PlayStation adds parental controls - PRWeek,PRWeek
"Sun, 14 Sep 2025 05:20:00 GMT",Ending Mariners' 20-year title drought may take ‘Etsy witches’ - KING5.com,KING5.com
"Tue, 16 Sep 2025 05:51:27 GMT",Resistance Check: Will ETSY announce a stock split - Quarterly Profit Review & AI Driven Stock Reports - خودرو بانک,خودرو بانک
"Thu, 11 Sep 2025 09:57:24 GMT",Magazine forced to speak out after ‘paying Etsy witches to curse Charlie Kirk’ days before his assassination - UNILAD,UNILAD
"Sat, 13 Sep 2025 07:00:00 GMT",Etsy (NASDAQ:ETSY) Shares Up 6.6% - Here's What Happened - MarketBeat,MarketBeat
"Thu, 11 Sep 2025 20:18:12 GMT",Jezebel And An Etsy Witch Walk Into Charlie Kirk - Patheos,Patheos
"Fri, 12 Sep 2025 20:33:23 GMT","Shuffle Board: Dick Exec Heads Foot Locker, Depop Exec Returns to Etsy - Sourcing Journal",Sourcing Journal
"Fri, 12 Sep 2025 13:52:50 GMT","Acadian Asset Management LLC Has $132.27 Million Stock Position in Etsy, Inc. $ETSY - MarketBeat",MarketBeat
"Sat, 13 Sep 2025 07:00:00 GMT","Jacobs Levy Equity Management Inc. Purchases 72,226 Shares of Etsy, Inc. $ETSY - MarketBeat",MarketBeat
"Sat, 13 Sep 2025 07:00:00 GMT","Clearline Capital LP Increases Holdings in Etsy, Inc. $ETSY - MarketBeat",MarketBeat
"Sat, 13 Sep 2025 07:00:00 GMT","Teza Capital Management LLC Sells 21,522 Shares of Etsy, Inc. $ETSY - MarketBeat",MarketBeat
"Sat, 13 Sep 2025 07:00:00 GMT","EP Wealth Advisors LLC Acquires Shares of 5,866 Etsy, Inc. $ETSY - MarketBeat",MarketBeat
"Fri, 12 Sep 2025 21:03:25 GMT",'Etsy Witch' may be the secret to success of surging Mariners - KIMA,KIMA
"Thu, 11 Sep 2025 09:22:30 GMT",Top 10 'Etsy Witches' memes after the Jezebel Charlie Kirk article - The Express Tribune,The Express Tribune
"Fri, 12 Sep 2025 01:43:00 GMT",'Etsy Witch' Mariners on a hot streak - FOX 13 Seattle,FOX 13 Seattle
"Thu, 11 Sep 2025 19:28:00 GMT","Notable Thursday Option Activity: ETSY, AMD, RKLB - Nasdaq",Nasdaq
"Thu, 11 Sep 2025 10:59:33 GMT","Hancock Prospecting Pty Ltd Makes New Investment in Etsy, Inc. $ETSY - MarketBeat",MarketBeat
"Fri, 12 Sep 2025 21:02:14 GMT",'Etsy Witch' may be the secret to success of surging Mariners - KLEW TV,KLEW TV
"Thu, 11 Sep 2025 15:00:15 GMT",Charlie Kirk Dies Days After Etsy Witches 'Curse' Him and People Can’t Believe the Coincidence - Complex,Complex
"Thu, 11 Sep 2025 12:40:12 GMT",News website 'paid Etsy witches' to 'curse' Charlie Kirk before shooting - LADbible,LADbible
"Thu, 11 Sep 2025 11:29:02 GMT","Etsy, Inc. $ETSY Shares Acquired by Optimize Financial Inc - MarketBeat",MarketBeat
"Thu, 11 Sep 2025 10:22:37 GMT",Publication releases statement after writing about paying Etsy witches to curse Charlie Kirk - The Tab,The Tab
"Fri, 12 Sep 2025 06:56:15 GMT",Jezebel removes Etsy witches satire after Charlie Kirk assassination - The Express Tribune,The Express Tribune
"Thu, 11 Sep 2025 07:00:00 GMT","Etsy, Inc. $ETSY Shares Sold by Invenomic Capital Management LP - MarketBeat",MarketBeat
"Mon, 15 Sep 2025 08:56:56 GMT",Guidance Update: What are Etsy Inc.’s recent SEC filings showing - July 2025 Volume & Long Hold Capital Preservation Tips - خودرو بانک,خودرو بانک
"Thu, 11 Sep 2025 18:59:03 GMT",Here's Why People Are Talking About Etsy Witches Cursing Charlie Kirk Before He Was Fatally Shot - Yahoo News UK,Yahoo News UK
"Thu, 11 Sep 2025 18:47:19 GMT",Fury As Left-Wing Site Jezebel Paid 'Etsy Witches' To Curse Charlie Kirk Just 48 Hours Before His Assassination - International Business Times UK,International Business Times UK
"Mon, 15 Sep 2025 12:42:53 GMT","HMRC alert for sellers on Etsy, Vinted or eBay and key deadline - Aberdeen Live",Aberdeen Live
"Thu, 11 Sep 2025 13:43:18 GMT",Feminist website Jezebel paid witches at e-commerce site Etsy to curse Charlie Kirk two days before his murder - theweek.in,theweek.in
"Mon, 15 Sep 2025 12:26:00 GMT","Key HMRC October 5 deadline and alert to multiple Etsy, Vinted and eBay sellers - Daily Star",Daily Star
"Mon, 15 Sep 2025 12:26:00 GMT","Key HMRC October 5 deadline and alert to multiple Etsy, Vinted and eBay sellers - Daily Star",Daily Star
"Mon, 15 Sep 2025 11:09:00 GMT","People selling items on Vinted, Etsy and eBay urged to be aware of HMRC tax rules - Chronicle Live",Chronicle Live
"Tue, 16 Sep 2025 05:43:03 GMT",Ranking Etsy Inc. among high performing stocks via tools - IPO Watch & Weekly Watchlist for Hot Stocks - newser.com,newser.com
"Mon, 15 Sep 2025 23:31:57 GMT",Chart based analysis of Etsy Inc. trends - 2025 Support & Resistance & High Conviction Buy Zone Picks - newser.com,newser.com
"Tue, 16 Sep 2025 06:57:31 GMT",Volatility clustering patterns for ETSY - July 2025 Highlights & High Accuracy Investment Entry Signals - newser.com,newser.com
"Mon, 15 Sep 2025 16:55:23 GMT",Risk vs reward if holding onto ETSY - Portfolio Risk Report & Free Technical Pattern Based Buy Signals - newser.com,newser.com
"Mon, 15 Sep 2025 18:59:02 GMT",Real time alert setup for ETSY performance - July 2025 Selloffs & AI Enhanced Trading Alerts - newser.com,newser.com
"Mon, 15 Sep 2025 21:01:02 GMT","18 Fun Impulse Buys From Etsy Because, Admit It, You Love Treating Yourself - BuzzFeed",BuzzFeed
"Mon, 15 Sep 2025 11:00:09 GMT",Can you recover from losses in ETSY - Market Risk Analysis & Stock Portfolio Risk Management - newser.com,newser.com
"Mon, 15 Sep 2025 11:12:07 GMT",Chart based analysis of Etsy Inc. trends - Weekly Market Report & Growth Focused Stock Reports - newser.com,newser.com
"Mon, 15 Sep 2025 07:25:59 GMT",Real time alert setup for ETSY performance - 2025 Geopolitical Influence & Risk Controlled Daily Trade Plans - newser.com,newser.com
"Sun, 14 Sep 2025 18:09:50 GMT",Does Etsy Inc. fit your quant trading model - July 2025 EndofMonth & Precise Swing Trade Entry Alerts - newser.com,newser.com
"Sun, 14 Sep 2025 19:08:58 GMT",Chart overlay techniques for tracking ETSY - Trade Risk Assessment & Low Volatility Stock Recommendations - newser.com,newser.com
"Mon, 15 Sep 2025 03:09:31 GMT",Trend analysis for Etsy Inc. this week - July 2025 Review & Daily Technical Forecast Reports - newser.com,newser.com
"Mon, 15 Sep 2025 04:53:35 GMT",Risk vs reward if holding onto ETSY - July 2025 Closing Moves & Stepwise Entry and Exit Trade Signals - newser.com,newser.com
"Mon, 15 Sep 2025 00:09:29 GMT",Volatility clustering patterns for ETSY - July 2025 EndofMonth & Long-Term Safe Investment Ideas - newser.com,newser.com
"Sun, 14 Sep 2025 20:14:31 GMT",When is the best time to exit Etsy Inc. - July 2025 Market Mood & Safe Swing Trade Setups - newser.com,newser.com
"Sun, 14 Sep 2025 15:13:30 GMT",How high can ETSY stock go - Trade Ideas & Technical Pattern Based Signals - newser.com,newser.com
"Sun, 14 Sep 2025 09:21:28 GMT",Can you recover from losses in ETSY - Weekly Stock Summary & Consistent Income Trade Recommendations - newser.com,newser.com
"Sat, 13 Sep 2025 22:17:14 GMT",Volatility clustering patterns for ETSY - July 2025 Sentiment & Free Risk Controlled Daily Trade Plans - newser.com,newser.com
"Mon, 15 Sep 2025 10:45:02 GMT",is etsy meeting your algorithmic filter criteria - Market Volume Report & Safe Entry Point Alerts - newser.com,newser.com
"Mon, 15 Sep 2025 11:03:15 GMT",Volatility clustering patterns for Etsy Inc. - Dip Buying & Free Reliable Trade Execution Plans - newser.com,newser.com
"Sun, 14 Sep 2025 14:04:48 GMT",ETSY’s volatility index tracking explained - Weekly Volume Report & Free AI Powered Buy and Sell Recommendations - newser.com,newser.com
"Mon, 15 Sep 2025 06:18:12 GMT",What to expect from Etsy Inc. in the next 30 days - July 2025 EndofMonth & Fast Exit and Entry Strategy Plans - newser.com,newser.com
"Mon, 15 Sep 2025 23:40:48 GMT",Etsy Introduces AI Features to Aid Sellers’ Productivity - cointurk finance,cointurk finance
"Mon, 15 Sep 2025 01:45:40 GMT",Volatility clustering patterns for Etsy Inc. - July 2025 Analyst Calls & Daily Technical Forecast Reports - newser.com,newser.com
"Mon, 15 Sep 2025 03:36:48 GMT",Is ETSY meeting your algorithmic filter criteria - 2025 Growth vs Value & Scalable Portfolio Growth Methods - newser.com,newser.com
"Mon, 15 Sep 2025 00:15:00 GMT",Does Etsy Inc. fit your quant trading model - Weekly Risk Summary & High Yield Equity Trading Tips - newser.com,newser.com
"Sun, 14 Sep 2025 18:21:44 GMT",Trend analysis for Etsy Inc. this week - July 2025 Analyst Calls & Daily Technical Stock Forecast Reports - newser.com,newser.com
"Sun, 14 Sep 2025 09:45:23 GMT",Ranking Etsy Inc. among high performing stocks via tools - July 2025 Closing Moves & High Return Stock Watch Alerts - newser.com,newser.com
"Thu, 11 Sep 2025 14:34:46 GMT",Progressive Site's Writer Paid Etsy Witches to 'Curse' Charlie Kirk - He was Murdered 48 Hours Later - JFeed,JFeed
2025-09-12T23:30:00,"Shuffle Board: Dick Exec Heads Foot Locker, Depop Exec Returns to Etsy",Yahoo
2025-09-11T18:28:28,Jezebel Amends Recent Article That Detailed Effort to Curse Kirk,Yahoo
