Date,Title,Source
"Sun, 16 Nov 2025 07:03:03 GMT",Can PLD stock surprise with quarterly results - 2025 Key Lessons & AI Driven Price Predictions - newser.com,newser.com
"Sat, 15 Nov 2025 13:53:01 GMT","Prologis, Inc. $PLD Shares Sold by Wiser Advisor Group LLC - MarketBeat",MarketBeat
"Thu, 13 Nov 2025 15:29:10 GMT",Forum Thread of the Day: “New Ping PLD putters” - GolfWRX,GolfWRX
"Thu, 13 Nov 2025 22:03:00 GMT",SPORTS-BROWNS-LOSS-STEELERS-CONTINUES-UNCOMFORTABLE-4-PLD.jpg - The Courier Express,The Courier Express
"Sun, 16 Nov 2025 01:23:03 GMT",What earnings margins imply for PLD stock - July 2025 Review & Target Return Focused Picks - newser.com,newser.com
"Fri, 14 Nov 2025 14:16:02 GMT",Why (PLD) Price Action Is Critical for Tactical Trading - news.stocktradersdaily.com,news.stocktradersdaily.com
"Sat, 15 Nov 2025 12:25:57 GMT","2,106 Shares in Prologis, Inc. $PLD Acquired by Hibernia Wealth Partners LLC - MarketBeat",MarketBeat
"Sun, 16 Nov 2025 01:50:11 GMT",What earnings margins imply for PLD stock - Options Play & Fast Gain Stock Trading Tips - newser.com,newser.com
"Sat, 15 Nov 2025 11:55:53 GMT","PNC Financial Services Group Inc. Sells 3,849 Shares of Prologis, Inc. $PLD - MarketBeat",MarketBeat
"Sun, 16 Nov 2025 07:58:25 GMT",What earnings margins imply for PLD stock - Earnings Miss & Real-Time Volume Trigger Notifications - newser.com,newser.com
"Sat, 15 Nov 2025 10:24:43 GMT","Prologis, Inc. $PLD Holdings Decreased by Davis Selected Advisers - MarketBeat",MarketBeat
"Fri, 14 Nov 2025 21:06:15 GMT",Is PLD stock a buy during volatile markets - 2025 Investor Takeaways & Long-Term Growth Portfolio Plans - newser.com,newser.com
"Sat, 15 Nov 2025 10:10:35 GMT","Prologis, Inc. $PLD Shares Acquired by Burling Wealth Partners LLC - MarketBeat",MarketBeat
"Sat, 15 Nov 2025 08:29:05 GMT","44,320 Shares in Prologis, Inc. $PLD Purchased by ABN Amro Investment Solutions - MarketBeat",MarketBeat
"Sat, 15 Nov 2025 08:15:16 GMT","Advisors Capital Management LLC Acquires 8,693 Shares of Prologis, Inc. $PLD - MarketBeat",MarketBeat
"Fri, 14 Nov 2025 14:01:20 GMT","Prologis, Inc. $PLD Shares Acquired by Police & Firemen s Retirement System of New Jersey - MarketBeat",MarketBeat
"Fri, 14 Nov 2025 13:46:20 GMT","KBC Group NV Increases Stake in Prologis, Inc. $PLD - MarketBeat",MarketBeat
"Fri, 14 Nov 2025 14:10:23 GMT","Prologis, Inc. $PLD Shares Sold by Impax Asset Management Group plc - MarketBeat",MarketBeat
"Fri, 14 Nov 2025 10:12:38 GMT","Cherokee Insurance Co Invests $280,000 in Prologis, Inc. $PLD - MarketBeat",MarketBeat
"Fri, 14 Nov 2025 09:48:14 GMT","Forsta AP Fonden Sells 5,100 Shares of Prologis, Inc. $PLD - MarketBeat",MarketBeat
"Thu, 13 Nov 2025 07:18:59 GMT",Can PLD stock surprise with quarterly results - Market Trend Report & AI Optimized Trading Strategy Guides - newser.com,newser.com
"Sat, 15 Nov 2025 06:24:09 GMT",Why Is Prologis (PLD) Up 2.3% Since Last Earnings Report? - sharewise.com,sharewise.com
"Thu, 13 Nov 2025 13:13:10 GMT","Geode Capital Management LLC Buys 310,333 Shares of Prologis, Inc. $PLD - MarketBeat",MarketBeat
"Thu, 13 Nov 2025 12:08:09 GMT","National Pension Service Grows Holdings in Prologis, Inc. $PLD - MarketBeat",MarketBeat
"Fri, 14 Nov 2025 20:09:34 GMT",Can PLD stock surprise with quarterly results - Portfolio Growth Summary & Community Supported Trade Ideas - newser.com,newser.com
"Thu, 13 Nov 2025 14:04:44 GMT","Prologis, Inc. $PLD Shares Sold by Renasant Bank - MarketBeat",MarketBeat
"Thu, 13 Nov 2025 12:08:10 GMT","ProShare Advisors LLC Boosts Holdings in Prologis, Inc. $PLD - MarketBeat",MarketBeat
"Thu, 13 Nov 2025 08:09:06 GMT","Prologis, Inc. $PLD Shares Acquired by ABC Arbitrage SA - MarketBeat",MarketBeat
"Thu, 13 Nov 2025 11:05:50 GMT","Rathbones Group PLC Acquires 2,334 Shares of Prologis, Inc. $PLD - MarketBeat",MarketBeat
"Wed, 12 Nov 2025 11:09:52 GMT","Prologis, Inc. $PLD Shares Sold by Los Angeles Capital Management LLC - MarketBeat",MarketBeat
"Wed, 12 Nov 2025 11:47:22 GMT","King Luther Capital Management Corp Decreases Stock Position in Prologis, Inc. $PLD - MarketBeat",MarketBeat
"Wed, 12 Nov 2025 10:07:26 GMT","Bailard Inc. Sells 2,247 Shares of Prologis, Inc. $PLD - MarketBeat",MarketBeat
"Wed, 12 Nov 2025 10:32:15 GMT","Savant Capital LLC Buys 4,919 Shares of Prologis, Inc. $PLD - MarketBeat",MarketBeat
"Thu, 13 Nov 2025 07:14:46 GMT",Is PLD stock a top dividend aristocrat candidate - July 2025 Movers & Accurate Intraday Trading Signals - newser.com,newser.com
"Tue, 11 Nov 2025 13:47:41 GMT","Prologis, Inc. $PLD Position Trimmed by Laffer Tengler Investments Inc. - MarketBeat",MarketBeat
"Tue, 11 Nov 2025 12:49:33 GMT","Wedbush Securities Inc. Sells 2,323 Shares of Prologis, Inc. $PLD - MarketBeat",MarketBeat
"Tue, 11 Nov 2025 15:01:31 GMT",PING’s PLD Milled SE Ally Blue Onset Combines Blade Feel with Mallet Forgiveness - Golf Post - the digital home for golf enthusiasts,Golf Post - the digital home for golf enthusiasts
"Tue, 11 Nov 2025 15:37:56 GMT",Scotiabank Raises Prologis (NYSE:PLD) Price Target to $133.00 - MarketBeat,MarketBeat
"Tue, 11 Nov 2025 11:58:45 GMT","Midwest Trust Co Takes $14.08 Million Position in Prologis, Inc. $PLD - MarketBeat",MarketBeat
"Fri, 14 Nov 2025 12:56:25 GMT","Mitsubishi UFJ Trust & Banking Corp Raises Stock Position in Prologis, Inc. $PLD - MarketBeat",MarketBeat
"Thu, 13 Nov 2025 10:45:21 GMT","Allianz SE Sells 54,209 Shares of Prologis, Inc. $PLD - Defense World",Defense World
"Thu, 13 Nov 2025 09:33:01 GMT","Advyzon Investment Management LLC Takes $211,000 Position in Prologis, Inc. $PLD - Defense World",Defense World
"Thu, 13 Nov 2025 21:52:27 GMT","Avalon Trust Co Decreases Stock Holdings in Prologis, Inc. $PLD - Defense World",Defense World
"Wed, 12 Nov 2025 07:54:16 GMT",Scotiabank Forecasts Strong Price Appreciation for Prologis (NYSE:PLD) Stock - Defense World,Defense World
2025-11-14T17:30:05,Why Is Prologis (PLD) Up 2.3% Since Last Earnings Report?,Yahoo
2025-11-12T13:49:00,Prologis Stock Rises 20.4% in Three Months: Will the Trend Last?,Yahoo
