Date,Title,Source
"Mon, 08 Dec 2025 13:00:00 GMT","ZS acquires Torrent Consulting to fuel Salesforce's healthcare, life sciences AI solutions - Yahoo Finance",Yahoo Finance
"Tue, 09 Dec 2025 01:50:05 GMT",Zscaler (ZS) Valuation After CFO Retirement News and Slower Growth Concerns - simplywall.st,simplywall.st
"Mon, 08 Dec 2025 10:02:28 GMT",A Look Back at Cybersecurity Stocks' Q3 Earnings: Zscaler (NASDAQ:ZS) Vs The Rest Of The Pack - Finviz,Finviz
"Mon, 08 Dec 2025 15:52:20 GMT",ZS Acquires Torrent Consulting - FinSMEs,FinSMEs
2025-12-08T04:35:01,A Look Back at Cybersecurity Stocks’ Q3 Earnings: Zscaler (NASDAQ:ZS) Vs The Rest Of The Pack,Yahoo
2025-12-01T14:35:02+00:00,"Zscaler (ZS) Loses 24% in 4 Weeks, Here's Why a Trend Reversal May be Around the Corner",Zacks Investment Research
2025-11-26T17:45:44+00:00,"Zscaler (ZS) Stock Trades Down, Here Is Why",StockStory.org
2025-11-26T15:33:00+00:00,Zscaler Stock Tumbles Wednesday: Here's Why,Benzinga
2025-11-25T20:34:00+00:00,Zscaler Stock Sinks Despite Q1 Earnings Beat,Benzinga
2025-03-05T15:32:00+00:00,ZS Earnings: Zscaler Jumps on Strong Q2 Results and Guidance,Business Insider
2025-08-07T15:38:00+00:00,Is Zscaler (ZS) a Buy as Wall Street Analysts Look Optimistic?,Yahoo Finance
2025-03-07T13:30:00+00:00,"Zscaler: The Q2 Earnings Look Great, But I Keep My 'Hold' In Place",Seeking Alpha
2025-03-20T22:31:00+00:00,"Insider Sale: CRO and President of WW Sales of $ZS Sells 3,575 Shares",Nasdaq
