Date,Title,Source
2025-11-21T18:22:28Z,Big Money Walks the Datadog,Yahoo Entertainment
2025-11-21T16:51:59Z,"Tech Stocks That Are Down Today: AMD, Palo Alto Networks, DataDog and Micron Technology",Biztoc.com
"Sun, 23 Nov 2025 04:06:54 GMT",Datadog (DDOG) Valuation in Focus After Recent Pullback in Growth Stocks - simplywall.st,simplywall.st
"Fri, 21 Nov 2025 21:00:00 GMT",DDOG - Datadog Inc Stock Price and Quote - Finviz,Finviz
"Sat, 22 Nov 2025 05:46:16 GMT",Is 21.1% Fall In Datadog (DDOG) Stock A Buying Opportunity? - Trefis,Trefis
"Sat, 22 Nov 2025 10:57:12 GMT","Datadog, Inc. $DDOG Shares Sold by Rockefeller Capital Management L.P. - MarketBeat",MarketBeat
"Fri, 21 Nov 2025 06:41:32 GMT",Is Tradr 2X Long DDOG Daily stock bottoming after sell off - Portfolio Value Summary & Accurate Trade Setup Notifications - newser.com,newser.com
"Thu, 20 Nov 2025 19:20:00 GMT","Notable Thursday Option Activity: GEV, DDOG, ROST - Nasdaq",Nasdaq
"Sat, 22 Nov 2025 12:42:46 GMT","Datadog, Inc. $DDOG Shares Acquired by Mediolanum International Funds Ltd - MarketBeat",MarketBeat
"Fri, 21 Nov 2025 03:30:51 GMT",Is Tradr 2X Long DDOG Daily stock bottoming after sell off - 2025 Price Targets & Community Consensus Picks - newser.com,newser.com
"Sat, 22 Nov 2025 09:59:34 GMT","Datadog, Inc. $DDOG Position Cut by DNB Asset Management AS - MarketBeat",MarketBeat
"Thu, 20 Nov 2025 00:20:01 GMT",Will Tradr 2X Long DDOG Daily stock beat Nasdaq index returns - Inflation Watch & Verified Technical Signals - newser.com,newser.com
"Fri, 21 Nov 2025 12:17:37 GMT","Vanguard Group Inc. Purchases 740,457 Shares of Datadog, Inc. $DDOG - MarketBeat",MarketBeat
"Thu, 20 Nov 2025 12:50:38 GMT",What consensus target says about Tradr 2X Long DDOG Daily stock - newser.com,newser.com
"Fri, 21 Nov 2025 13:07:25 GMT","8,590 Shares in Datadog, Inc. $DDOG Bought by Greenland Capital Management LP - MarketBeat",MarketBeat
"Wed, 19 Nov 2025 23:04:06 GMT",What consensus target says about Tradr 2X Long DDOG Daily stock - Weekly Trade Recap & Fast Gain Swing Alerts - newser.com,newser.com
"Fri, 21 Nov 2025 09:22:55 GMT","Cetera Investment Advisers Reduces Stake in Datadog, Inc. $DDOG - MarketBeat",MarketBeat
"Fri, 21 Nov 2025 09:22:56 GMT","Foundations Investment Advisors LLC Purchases Shares of 1,764 Datadog, Inc. $DDOG - MarketBeat",MarketBeat
"Fri, 21 Nov 2025 16:33:20 GMT",Datadog (NASDAQ:DDOG) Shares Down 4.8% After Insider Selling - MarketBeat,MarketBeat
"Fri, 21 Nov 2025 08:24:57 GMT","ABN AMRO Bank N.V. Buys New Shares in Datadog, Inc. $DDOG - MarketBeat",MarketBeat
"Fri, 21 Nov 2025 12:01:40 GMT","2,418 Shares in Datadog, Inc. $DDOG Acquired by Portside Wealth Group LLC - MarketBeat",MarketBeat
"Wed, 19 Nov 2025 14:00:00 GMT",Datadog (NASDAQ: DDOG) names John Trapani Field CTO for financial services clients - Stock Titan,Stock Titan
"Thu, 20 Nov 2025 05:15:32 GMT",Will DDOG stock split attract more investors - July 2025 Selloffs & Smart Swing Trading Techniques - newser.com,newser.com
"Fri, 21 Nov 2025 09:28:56 GMT","Ensign Peak Advisors Inc Lowers Stock Position in Datadog, Inc. $DDOG - MarketBeat",MarketBeat
"Wed, 19 Nov 2025 15:43:48 GMT",Intraday pattern recognizer results for DDOG - Insider Buying & Real-Time Stock Price Movement Reports - newser.com,newser.com
"Thu, 20 Nov 2025 10:53:12 GMT","Kingsview Wealth Management LLC Reduces Stock Holdings in Datadog, Inc. $DDOG - MarketBeat",MarketBeat
"Wed, 19 Nov 2025 15:44:22 GMT",How strong is DDOG stock revenue growth - July 2025 Spike Watch & Low Risk High Win Rate Stock Picks - newser.com,newser.com
"Thu, 20 Nov 2025 13:40:24 GMT","Steadview Capital Management LLC Reduces Stake in Datadog, Inc. $DDOG - MarketBeat",MarketBeat
"Wed, 19 Nov 2025 17:30:46 GMT",Will DDOG rebound enough to break even - Weekly Gains Report & Growth Focused Entry Point Reports - newser.com,newser.com
"Thu, 20 Nov 2025 22:32:29 GMT","Olivier Pomel Sells 100,754 Shares of Datadog (NASDAQ:DDOG) Stock - MarketBeat",MarketBeat
"Thu, 20 Nov 2025 12:41:23 GMT","Inspire Advisors LLC Invests $707,000 in Datadog, Inc. $DDOG - MarketBeat",MarketBeat
"Thu, 20 Nov 2025 10:26:42 GMT","Creative Planning Has $6.94 Million Position in Datadog, Inc. $DDOG - MarketBeat",MarketBeat
"Wed, 19 Nov 2025 00:05:00 GMT",Why DDOG stock is popular among millennials - July 2025 PostEarnings & Verified Short-Term Plans - newser.com,newser.com
"Wed, 19 Nov 2025 11:46:05 GMT","Nomura Asset Management Co. Ltd. Buys 64,454 Shares of Datadog, Inc. $DDOG - MarketBeat",MarketBeat
"Fri, 21 Nov 2025 11:59:39 GMT",How analysts revise price targets for Tradr 2X Long DDOG Daily stock - Quarterly Trade Report & AI Driven Stock Movement Reports - newser.com,newser.com
"Tue, 18 Nov 2025 15:50:00 GMT","IGV, SNPS, ADSK, DDOG: ETF Outflow Alert - Nasdaq",Nasdaq
"Wed, 19 Nov 2025 18:06:20 GMT",Datadog (DDOG) Shares Decline Despite Strong Q3 Performance - GuruFocus,GuruFocus
"Wed, 19 Nov 2025 12:55:11 GMT","Datadog, Inc. $DDOG Shares Bought by Oberndorf William E - MarketBeat",MarketBeat
"Tue, 18 Nov 2025 17:26:11 GMT","DDOG: Sustained growth driven by platform expansion, security acceleration, and AI modernization - TradingView",TradingView
"Wed, 19 Nov 2025 10:03:39 GMT","Clal Insurance Enterprises Holdings Ltd Makes New Investment in Datadog, Inc. $DDOG - MarketBeat",MarketBeat
"Thu, 20 Nov 2025 10:35:09 GMT",Why DDOG stock remains resilient - July 2025 Breakouts & Fast Gain Swing Alerts - newser.com,newser.com
"Tue, 18 Nov 2025 14:52:59 GMT","Vise Technologies Inc. Invests $354,000 in Datadog, Inc. $DDOG - MarketBeat",MarketBeat
"Wed, 19 Nov 2025 12:32:00 GMT","Bernstein Maintains Datadog(DDOG.US) With Buy Rating, Raises Target Price to $180 - 富途牛牛",富途牛牛
"Tue, 18 Nov 2025 15:21:19 GMT","Universal Beteiligungs und Servicegesellschaft mbH Sells 2,131,941 Shares of Datadog, Inc. $DDOG - MarketBeat",MarketBeat
"Thu, 20 Nov 2025 00:22:02 GMT",Will Tradr 2X Long DDOG Daily stock announce special dividend - newser.com,newser.com
"Wed, 19 Nov 2025 20:23:05 GMT",How analysts revise price targets for Tradr 2X Long DDOG Daily stock - Trade Entry Report & Accurate Technical Buy Alerts - newser.com,newser.com
"Tue, 18 Nov 2025 15:09:39 GMT","Raiffeisen Bank International AG Sells 5,508 Shares of Datadog, Inc. $DDOG - MarketBeat",MarketBeat
"Thu, 20 Nov 2025 03:06:03 GMT",How strong is DDOG stock revenue growth - July 2025 Catalysts & Reliable Entry Point Trade Alerts - newser.com,newser.com
"Wed, 19 Nov 2025 19:47:40 GMT",Will Tradr 2X Long DDOG Daily stock beat Nasdaq index returns - July 2025 Price Swings & Weekly Breakout Stock Alerts - newser.com,newser.com
"Sat, 22 Nov 2025 15:56:36 GMT","NVDA, PANW, DDOG Earnings Reviews, PYPL CEO Interview, and UBER AV Update: Weekly Wrap With 30 More Reviews, S&P vs Portfolio, 1 New Holding and 1 Exit - Blockchain News",Blockchain News
"Fri, 21 Nov 2025 10:55:09 GMT","Avantax Advisory Services Inc. Has $2.68 Million Stake in Datadog, Inc. $DDOG - Defense World",Defense World
"Sat, 22 Nov 2025 08:12:22 GMT",Datadog (NASDAQ:DDOG) Trading Down 4.8% Following Insider Selling - Defense World,Defense World
"Fri, 21 Nov 2025 10:55:09 GMT","Bank Julius Baer & Co. Ltd Zurich Has $12.67 Million Stock Holdings in Datadog, Inc. $DDOG - Defense World",Defense World
2025-11-19T15:00:00,Datadog Welcomes John Trapani as Field CTO for Financial Services,Yahoo
2025-11-18T13:58:53,"Datadog, Inc. (DDOG) Presents at Global Technology, Internet, Media & Telecommunications Conference 2025 Transcript",SeekingAlpha
