Date,Title,Source
"Sun, 26 Oct 2025 05:07:00 GMT",How Q3 Results and Institutional Buying at Domino's (DPZ) Have Changed Its Investment Story - Yahoo Finance,Yahoo Finance
"Sun, 26 Oct 2025 09:47:53 GMT",AlphaQuest LLC Has $1.11 Million Holdings in Domino's Pizza Inc $DPZ - MarketBeat,MarketBeat
"Sat, 25 Oct 2025 07:22:02 GMT",Responsive Playbooks and the DPZ Inflection - news.stocktradersdaily.com,news.stocktradersdaily.com
"Thu, 23 Oct 2025 20:21:23 GMT","Oppenheimer Reiterates Buy Rating on Domino’s Pizza (DPZ), Maintains PT at $530 - Insider Monkey",Insider Monkey
"Sat, 25 Oct 2025 12:48:07 GMT",D.A. Davidson & CO. Increases Stock Holdings in Domino's Pizza Inc $DPZ - MarketBeat,MarketBeat
"Sat, 25 Oct 2025 05:24:20 GMT","Domino's Pizza (NASDAQ:DPZ) Downgraded by Weiss Ratings to ""Hold (C+)"" - MarketBeat",MarketBeat
"Thu, 23 Oct 2025 08:31:12 GMT","Atria Wealth Solutions Inc. Sells 1,100 Shares of Domino's Pizza Inc $DPZ - MarketBeat",MarketBeat
"Sun, 26 Oct 2025 09:34:01 GMT",DekaBank Deutsche Girozentrale Has $3.63 Million Stock Position in Domino’s Pizza Inc $DPZ - Defense World,Defense World
"Fri, 24 Oct 2025 08:17:25 GMT","Allspring Global Investments Holdings LLC Has $673,000 Position in Domino’s Pizza Inc $DPZ - Defense World",Defense World
"Thu, 23 Oct 2025 08:26:41 GMT",Cwm LLC Buys 942 Shares of Domino’s Pizza Inc $DPZ - Defense World,Defense World
2025-10-26T06:07:56,How Q3 Results and Institutional Buying at Domino's (DPZ) Have Changed Its Investment Story,Yahoo
