Date,Title,Source
"Fri, 29 Aug 2025 17:46:16 GMT",Why Broadcom (AVGO) Shares Are Falling Today - Yahoo Finance,Yahoo Finance
"Sat, 30 Aug 2025 04:20:41 GMT",How to interpret RSI for AVGO stock - Quarterly Market Review & Long-Term Growth Portfolio Plans - Newser,Newser
"Fri, 29 Aug 2025 08:24:24 GMT",Is Broadcom Stock (AVGO) a Buy Ahead of Q3 Earnings? - TipRanks,TipRanks
"Fri, 29 Aug 2025 21:11:03 GMT","What Does Wall Street Think About Broadcom (AVGO), Ahead of its Earnings Release? - MSN",MSN
"Fri, 29 Aug 2025 17:38:00 GMT",Broadcom Inc. Stock (AVGO) Opinions on AI Growth and Analyst Upgrades - Quiver Quantitative,Quiver Quantitative
"Sat, 30 Aug 2025 05:00:38 GMT",Should you hold or exit AVGO now - Weekly Trade Analysis & Fast Moving Stock Trade Plans - Newser,Newser
"Sat, 30 Aug 2025 05:10:40 GMT",Will AVGO price bounce be sustainable - Weekly Investment Summary & Expert Approved Trade Ideas - Newser,Newser
"Sat, 30 Aug 2025 00:36:08 GMT",Multi asset correlation models including AVGO - Profit Target & Free High Return Stock Watch Alerts - Newser,Newser
"Fri, 29 Aug 2025 20:15:13 GMT",Is AVGO forming a bottoming base - July 2025 PreEarnings & Verified Technical Trade Signals - Newser,Newser
"Wed, 27 Aug 2025 19:16:31 GMT",UBS Lifts Broadcom (AVGO) Price Target to $345 Ahead of Earnings - Yahoo Finance,Yahoo Finance
"Sat, 30 Aug 2025 01:30:18 GMT",Automated trading signals detected on AVGO - 2025 Pullback Review & Free Verified High Yield Trade Plans - Newser,Newser
"Fri, 29 Aug 2025 04:17:35 GMT",Broadcom (AVGO) and Canonical Announce An Expanded Collaboration - Yahoo Finance,Yahoo Finance
"Fri, 29 Aug 2025 20:27:53 GMT",Visual analytics tools that track AVGO performance - 2025 Sector Review & Low Risk High Reward Ideas - Newser,Newser
"Fri, 29 Aug 2025 19:40:42 GMT",Is AVGO stock reversal real or fake - Market Weekly Review & High Conviction Buy Zone Picks - Newser,Newser
"Fri, 29 Aug 2025 22:44:22 GMT",Using RSI to spot recovery in AVGO - July 2025 Institutional & Consistent Profit Alerts - Newser,Newser
"Fri, 29 Aug 2025 19:44:30 GMT",Using Ichimoku Cloud for AVGO technicals - Portfolio Update Report & Advanced Swing Trade Entry Alerts - Newser,Newser
"Thu, 28 Aug 2025 14:37:15 GMT",What Is Going On With Broadcom Stock Thursday? - Broadcom (NASDAQ:AVGO) - Benzinga,Benzinga
"Fri, 29 Aug 2025 11:33:57 GMT",Is this a good reentry point in AVGO - Dip Buying & Long-Term Capital Growth Strategies - Newser,Newser
"Wed, 27 Aug 2025 09:11:15 GMT",Why Top Analysts Recommend Buying Broadcom Stock (AVGO) ahead of Q3 Earnings - TipRanks,TipRanks
"Thu, 28 Aug 2025 19:37:16 GMT",Why Broadcom (AVGO) Stock Is Climbing Today - Yahoo Finance,Yahoo Finance
"Fri, 29 Aug 2025 18:50:00 GMT","Notable Friday Option Activity: AVGO, SMCI, MTCH - Nasdaq",Nasdaq
"Fri, 29 Aug 2025 04:29:35 GMT","Citi Reiterates Buy on Broadcom (AVGO) Amid AI, Wireless Market Optimism - Yahoo Finance",Yahoo Finance
"Sat, 30 Aug 2025 00:10:21 GMT",Applying Wyckoff theory to AVGO stock - 2025 AllTime Highs & Low Risk Growth Stock Ideas - Newser,Newser
"Fri, 29 Aug 2025 18:58:23 GMT","Friday Option Activity: AVGO, SMCI, MTCH - AInvest",AInvest
"Sat, 30 Aug 2025 02:27:16 GMT",Is AVGO forming a bottoming base - 2025 Breakouts & Breakdowns & Reliable Volume Spike Trade Alerts - Newser,Newser
"Fri, 29 Aug 2025 07:14:19 GMT",Broadcom (AVGO) and Canonical Announce An Expanded Collaboration - MSN,MSN
"Wed, 27 Aug 2025 18:38:04 GMT",Deutsche Bank Reiterates Buy on Broadcom (AVGO) as AI Momentum Builds - Yahoo Finance,Yahoo Finance
"Fri, 29 Aug 2025 19:39:30 GMT",Is it time to cut losses on AVGO - July 2025 Opening Moves & Safe Entry Point Alerts - Newser,Newser
"Thu, 28 Aug 2025 13:05:44 GMT",Detecting price anomalies in AVGO with AI - Portfolio Profit Report & Short-Term Trading Opportunity Alerts - Newser,Newser
"Thu, 28 Aug 2025 16:20:00 GMT",New Analyst Forecast: $AVGO Given $325.0 Price Target - Quiver Quantitative,Quiver Quantitative
"Thu, 28 Aug 2025 10:09:37 GMT",Is AVGO a candidate for recovery play - July 2025 Sector Moves & Risk Managed Trade Strategies - Newser,Newser
"Thu, 28 Aug 2025 01:17:48 GMT",Will AVGO see short term momentum - Portfolio Gains Summary & Community Consensus Picks - Newser,Newser
"Thu, 28 Aug 2025 22:40:52 GMT",Using RSI to spot recovery in AVGO - IPO Watch & Safe Capital Growth Trade Ideas - Newser,Newser
"Mon, 25 Aug 2025 13:56:20 GMT",Broadcom in focus as UBS sees upside to Q4 guidance (AVGO:NASDAQ) - Seeking Alpha,Seeking Alpha
"Fri, 29 Aug 2025 01:18:45 GMT",Broadcom Inc. (AVGO) Has Gained A Massive 117% After Jim Cramer Criticized Sellers In September - MSN,MSN
"Thu, 28 Aug 2025 01:31:24 GMT",How to build a custom watchlist for AVGO - Market Volume Summary & Real-Time Volume Triggers - Newser,Newser
"Fri, 29 Aug 2025 14:48:00 GMT","IVV, AMZN, META, AVGO: Large Inflows Detected at ETF - Nasdaq",Nasdaq
"Fri, 29 Aug 2025 22:16:22 GMT",Broadcom Earnings – AVGO Stock Gives Back August Gains as Investors Caution Grows - FXLeaders,FXLeaders
"Fri, 29 Aug 2025 21:01:43 GMT",Using RSI to spot recovery in AVGO - Portfolio Gains Summary & AI Optimized Trading Strategy Guides - Newser,Newser
"Wed, 27 Aug 2025 10:25:49 GMT",How to interpret RSI for AVGO stock - Recession Risk & Weekly High Potential Stock Alerts - Newser,Newser
"Wed, 27 Aug 2025 18:51:39 GMT",Deutsche Bank Reiterates Buy on Broadcom (AVGO) as AI Momentum Builds - MSN,MSN
"Fri, 29 Aug 2025 19:10:36 GMT",Is AVGO stock reversal real or fake - Fed Meeting & Smart Money Movement Tracker - Newser,Newser
"Mon, 25 Aug 2025 16:19:51 GMT",Top UBS Analyst Boosts Broadcom Stock (AVGO) Target to $345 ahead of Q3 Earnings - TipRanks,TipRanks
"Tue, 26 Aug 2025 21:21:40 GMT",Broadcom Inc. (AVGO) Has Gained A Massive 117% After Jim Cramer Criticized Sellers In September - uk.finance.yahoo.com,uk.finance.yahoo.com
"Thu, 28 Aug 2025 13:34:12 GMT",Why Broadcom (AVGO) Is a Strategic Buy Ahead of Q3 Earnings—Beyond AI and Into Foundational Growth - AInvest,AInvest
"Tue, 26 Aug 2025 21:45:02 GMT",Why Broadcom Inc. (AVGO) Outpaced the Stock Market Today - ca.finance.yahoo.com,ca.finance.yahoo.com
"Wed, 27 Aug 2025 18:26:56 GMT",Broadcom Stock Forecast: NASDAQ:AVGO Nears $300 on AI Growth Momentum - tradingnews.com,tradingnews.com
"Thu, 28 Aug 2025 10:16:14 GMT",UBS Lifts Broadcom (AVGO) Price Target to $345 Ahead of Earnings - MSN,MSN
"Sat, 30 Aug 2025 01:44:29 GMT",Will AVGO price bounce be sustainable - July 2025 PreEarnings & Community Shared Stock Ideas - Newser,Newser
"Wed, 27 Aug 2025 17:36:52 GMT",Broadcom (AVGO) Announces Enhanced VMware Innovations for Cybersecurity and AI Integration - Yahoo Finance,Yahoo Finance
"Thu, 28 Aug 2025 06:10:45 GMT",Using Ichimoku Cloud for AVGO technicals - July 2025 EndofMonth & Low Drawdown Momentum Ideas - Newser,Newser
"Fri, 29 Aug 2025 03:58:00 GMT",Broadcom (AVGO) Receives a Rating Update from a Top Analyst - The Globe and Mail,The Globe and Mail
"Fri, 29 Aug 2025 18:24:22 GMT",Visual analytics tools that track AVGO performance - 2025 Risk Factors & Safe Swing Trade Setup Alerts - Newser,Newser
"Mon, 25 Aug 2025 18:10:00 GMT",AVGO's Strong Portfolio Drives Up Semiconductor Sales: What's Ahead? - Yahoo Finance,Yahoo Finance
"Mon, 25 Aug 2025 07:00:00 GMT",3 Reasons We Love Broadcom (AVGO) - Yahoo Finance,Yahoo Finance
"Fri, 29 Aug 2025 19:39:06 GMT",Technical analysis overview for AVGO stock - July 2025 Review & Technical Analysis for Trade Confirmation - Newser,Newser
"Thu, 28 Aug 2025 17:20:27 GMT",Broadcom (AVGO) Stock: Why Wall Street is Bullish Ahead of Q3 Earnings - parameter.io,parameter.io
"Thu, 28 Aug 2025 08:48:29 GMT",Top UBS Analyst Boosts Broadcom Stock (AVGO) Target to $345 ahead of Q3 Earnings - MSN,MSN
"Wed, 27 Aug 2025 02:08:17 GMT","Piper Sandler Raises PT on Broadcom (AVGO) to $315, Reiterates Overweight - MSN",MSN
"Wed, 27 Aug 2025 02:21:43 GMT",Why Broadcom Inc. (AVGO) Outpaced the Stock Market Today - MSN,MSN
"Fri, 29 Aug 2025 16:29:02 GMT",Using Ichimoku Cloud for AVGO technicals - Market Performance Recap & Technical Confirmation Trade Alerts - Newser,Newser
"Fri, 29 Aug 2025 16:09:15 GMT",Broadcom Earnings Forecast- AVGO Stock Gives Back August Gains on Investors Caution - FXLeaders,FXLeaders
"Mon, 25 Aug 2025 18:40:28 GMT",AVGO: Broadcom Stock Rises as UBS Lifts Target on Google AI Chip Demand - Yahoo Finance,Yahoo Finance
"Tue, 26 Aug 2025 21:24:59 GMT",Broadcom Inc. (AVGO) Has Gained A Massive 117% After Jim Cramer Criticized Sellers In September - Insider Monkey,Insider Monkey
"Wed, 27 Aug 2025 01:24:13 GMT","Piper Sandler Raises PT on Broadcom (AVGO) to $315, Reiterates Overweight - Insider Monkey",Insider Monkey
"Fri, 29 Aug 2025 15:17:54 GMT",Has AVGO formed a bullish divergence - Weekly Profit Analysis & Fast Entry Momentum Alerts - Newser,Newser
"Wed, 27 Aug 2025 19:48:41 GMT",Is Broadcom (AVGO) a Must-Hold AI Play as UBS Raises Price Target to $345? - AInvest,AInvest
"Wed, 27 Aug 2025 16:00:12 GMT",Broadcom Stock Analysis: AVGO Stock Rises on AI Growth Momentum - Markets.com,Markets.com
"Mon, 25 Aug 2025 14:58:00 GMT",CRDO vs. AVGO: Which Data Center Connectivity Stock is the Better Buy? - Nasdaq,Nasdaq
"Thu, 28 Aug 2025 20:24:57 GMT",Is it time to cut losses on AVGO - Earnings Overview Summary & Fast Exit and Entry Trade Guides - Newser,Newser
"Fri, 29 Aug 2025 14:01:19 GMT",Is AVGO forming a bottoming base - Trend Reversal & High Conviction Trade Alerts - Newser,Newser
"Fri, 29 Aug 2025 14:04:25 GMT",Risk vs reward if holding onto AVGO - Jobs Report & Weekly Consistent Profit Watchlists - Newser,Newser
"Thu, 28 Aug 2025 17:16:22 GMT",Is it time to cut losses on AVGO - Quarterly Portfolio Report & AI Enhanced Execution Alerts - Newser,Newser
"Fri, 29 Aug 2025 12:06:10 GMT",Multi asset correlation models including AVGO - Weekly Loss Report & Verified Stock Trade Ideas - Newser,Newser
"Thu, 28 Aug 2025 03:26:02 GMT",Multi asset correlation models including AVGO - Bull Run & Risk Controlled Stock Pick Alerts - Newser,Newser
"Fri, 29 Aug 2025 04:39:49 GMT",Visual analytics tools that track AVGO performance - 2025 Sector Review & Growth Oriented Trade Recommendations - Newser,Newser
"Thu, 28 Aug 2025 18:01:48 GMT",Will a bounce in AVGO offer an exit - CEO Change & Precise Entry and Exit Recommendations - Newser,Newser
"Tue, 26 Aug 2025 23:37:08 GMT",Technical analysis overview for AVGO stock - Market Movers & Accurate Intraday Trade Tips - Newser,Newser
"Mon, 25 Aug 2025 11:26:25 GMT",Broadcom (AVGO): Evaluating Valuation as Big Tech’s AI Demands Drive Record Growth - simplywall.st,simplywall.st
"Tue, 26 Aug 2025 17:04:25 GMT",Broadcom (AVGO) Stock: Rises as Fortune 500 Firms Adopt Its VMware AI Platform. Is It A Buy? - parameter.io,parameter.io
"Tue, 26 Aug 2025 16:08:31 GMT",What's Going On With Broadcom Stock Tuesday? - Broadcom (NASDAQ:AVGO) - Benzinga,Benzinga
"Tue, 26 Aug 2025 14:27:04 GMT",Broadcom's Stock (AVGO) Eyeing Up $300 As Cloud Strategy Enhancements Boost Sentiment - AskTraders.com,AskTraders.com
"Mon, 25 Aug 2025 16:21:44 GMT",Broadcom (AVGO) Stock Upgraded to $345 by Top UBS Analyst Ahead of Q3 Earnings - AInvest,AInvest
"Tue, 26 Aug 2025 16:57:15 GMT",Broadcom: 4 Reasons To Stay Bullish Heading Into The Q3 Report (NASDAQ:AVGO) - Seeking Alpha,Seeking Alpha
"Fri, 29 Aug 2025 00:12:18 GMT",Technical analysis overview for AVGO stock - 2025 Technical Patterns & Free Community Supported Trade Ideas - Newser,Newser
"Wed, 27 Aug 2025 11:50:50 GMT",Detecting price anomalies in AVGO with AI - 2025 Key Highlights & Consistent Return Investment Signals - Newser,Newser
"Mon, 25 Aug 2025 16:05:43 GMT",Comparing CRDO and AVGO: Which Data Center Connectivity Stock is the Better Buy? - AInvest,AInvest
"Thu, 28 Aug 2025 03:49:27 GMT","UBS Group maintains a bullish outlook on Broadcom (AVGO.US), citing rapid development in its AI business. - 富途牛牛",富途牛牛
"Mon, 25 Aug 2025 17:40:28 GMT",AVGO: Broadcom Stock Rises as UBS Lifts Target on Google AI Chip Demand - GuruFocus,GuruFocus
"Mon, 25 Aug 2025 09:46:40 GMT",Broadcom (AVGO) Stock: Earnings Approaching as AI Revenue Soars Ahead of Sept. 4 Report - parameter.io,parameter.io
2025-08-30T01:00:00,"August jobs report, Fed gov. nomination hearing: What to Watch",Yahoo
2025-08-29T21:13:08,"What Does Wall Street Think About Broadcom (AVGO), Ahead of its Earnings Release?",Yahoo
2025-08-29T20:24:19,What's Going On With Broadcom Stock Friday?,Yahoo
2025-08-29T19:46:16,Why Broadcom (AVGO) Shares Are Falling Today,Yahoo
2025-08-29T06:26:59,"Citi Reiterates Buy on Broadcom (AVGO) Amid AI, Wireless Market Optimism",Yahoo
2025-08-29T06:14:13,Broadcom (AVGO) and Canonical Announce An Expanded Collaboration,Yahoo
2025-08-28T21:37:16,Why Broadcom (AVGO) Stock Is Climbing Today,Yahoo
2025-08-28T18:18:42,"Nvidia boosts CoreWeave, chip stocks; Urban Outfitters falls",Yahoo
2025-08-28T00:30:00,Beyond Nvidia: Analyst shares 3 other chip stock picks,Yahoo
2025-08-27T21:16:31,UBS Lifts Broadcom (AVGO) Price Target to $345 Ahead of Earnings,Yahoo
2025-08-27T20:38:04,Deutsche Bank Reiterates Buy on Broadcom (AVGO) as AI Momentum Builds,Yahoo
2025-08-27T19:36:52,Broadcom (AVGO) Announces Enhanced VMware Innovations for Cybersecurity and AI Integration,Yahoo
2025-08-27T03:18:17,"Piper Sandler Raises PT on Broadcom (AVGO) to $315, Reiterates Overweight",Yahoo
2025-08-26T23:45:02,Why Broadcom Inc. (AVGO) Outpaced the Stock Market Today,Yahoo
2025-08-26T23:21:40,Broadcom Inc. (AVGO) Has Gained A Massive 117% After Jim Cramer Criticized Sellers In September,Yahoo
2025-08-26T20:55:48,Broadcom Inc (AVGO) VMware Explore 2025 Call (Transcript),SeekingAlpha
2025-08-26T19:00:00,Broadcom Selected as Strategic Vendor for Virtualization Software Solutions for Walmart,Yahoo
2025-08-26T18:08:31,Broadcom Drives Next-Gen Private Cloud Innovation With Nvidia,Yahoo
2025-08-30T00:06:07,"I dreamed about AVGO last night, so I bought some today",Reddit/r/wallstreetbets
