Date,Title,Source
2025-09-08T17:30:46Z,4-meter-tall smooshy robot and friends coming to the Osaka Expo,SoraNews24
2025-09-08T17:27:58Z,Biju Patnaik International Airport implements measures to control wild animal presence,The Times of India
2025-09-08T17:21:20Z,What's Happening With Regeneron Pharmaceuticals Stock On Monday?,Biztoc.com
2025-09-08T17:18:57Z,"Whatcom County Humane's cat kennel is full. Here's where, why and who you should help [Cool]",Fark.com
2025-09-08T17:05:18Z,Perinton pair charged in cat-hoarding case,Rochester Democrat and Chronicle
2025-09-08T17:00:00Z,"'My [cat] literally just moved himself in': The online feline family share how their former-feral cats domesticated themselves, gaining the home and love they deserve",Cheezburger.com
2025-09-08T16:53:07Z,I took 100 cat photos with the Google Pixel 10; here’s what I learned about its cameras - Android Police,Slashdot.org
2025-09-08T16:52:47Z,Five key moments from MTV VMAs as Lady Gaga and Ariana Grande win big - BBC,Slashdot.org
2025-09-08T16:34:24Z,The Time A Lion Roared Into Walt Disney World … And It Wasn’t Simba,allears.net
2025-09-08T16:30:42Z,"Cat Threatens to Spoil Wedding Ceremony, Photographer Comes to the Rescue",PetaPixel
2025-09-08T16:02:17Z,Doja Cat Debuts as MAC Cosmetics’ New Ambassador by Taking a Bite of Lipstick at the MTV VMAs,WWD
2025-09-08T15:51:38Z,"Pallas’s cat spotted in Arunachal: Landmark survey reveals six wild cats thriving above 4,200 metres",Syllad.com
2025-09-08T15:43:05Z,"La Bahia Hotel & Spa Debuts in Santa Cruz, CA",Hospitality Net
2025-09-08T15:42:15Z,Doja Cat appears to eat lipstick in bizarre VMAs red carpet moment,The-independent.com
2025-09-08T15:29:17Z,Friend Checks on Cat While Owner's Away—Discovers He's Not Taking It Well,Biztoc.com
2025-09-08T15:24:20Z,Doja Cat Recruited Kenny G For An ’80s Nostalgia-Packed MTV VMAs Performance Of ‘Jealous Type’,UPROXX
2025-09-08T15:18:21Z,Friend Checks on Cat While Owner's Away—Discovers He's Not Taking It Well,Newsweek
2025-09-08T15:07:01Z,Owner Leaves Door Open Overnight—Security Cam Shows Cat Lived It Up,Biztoc.com
2025-09-08T14:56:10Z,Owner Leaves Door Open Overnight—Security Cam Shows Cat Lived It Up,Newsweek
2025-09-08T14:52:28Z,Snubs & Surprises at the 2025 VMAs - Billboard,Slashdot.org
2025-09-08T14:47:27Z,"2025 VMAs: Wizkid, Burna Boy, miss out as Tyla clinches ‘Best Afrobeats’ award, Nigerians react",Latest News in Nigeria & Breaking Naija News 24/7 | LEGIT.NG
2025-09-08T14:24:11Z,VMAs 2025 Winners: Every Category and Full List from UBS Arena [Video],Buddytv.com
2025-09-08T14:22:09Z,The 2025 VMAs Recap!,Egotastic.com
2025-09-08T14:00:00Z,Identification of silibinin and isotretinoin as potent up-regulators of sFRP4 (Wnt antagonist): In silico prediction and in vitro validation in breast cancer,Plos.org
2025-09-08T14:00:00Z,Hnf4α integrates AIF and caspase 3/9 signaling to restrict single and coinfecting pathogens in teleosts,Plos.org
2025-09-08T14:00:00Z,N460S in PB2 and I163T in nucleoprotein synergistically enhance the viral replication and pathogenicity of influenza B virus,Plos.org
2025-09-08T13:59:48Z,Laughter As Puppy With Older Cat Siblings Learns To Make Biscuits,Biztoc.com
2025-09-08T13:54:57Z,Laughter As Puppy With Older Cat Siblings Learns To Make Biscuits,Newsweek
2025-09-08T13:36:25Z,Julia X 2011 1080p AMZN WEB-DL H264-GPRS,Rlsbb.ru
2025-09-08T13:00:00Z,"'I guess he’s mine now': Stray cat shows up at woman's door, asking to be adopted, after 2 weeks of no one coming to take him, she finally decides to give him the warm home he deserves",Cheezburger.com
2025-09-08T12:20:24Z,Park Yong Woo Leads Relentless Narcotics Team Against Won Hyun Joon’s Drug Syndicate In “Walking On Thin Ice”,soompi
2025-09-08T12:07:09Z,Show HN: Dir2md – Convert Any Repo into AI-Ready Markdown Blueprints,Github.com
2025-09-08T12:00:00Z,"Corn Flakes: A Football Blowout, Pudge the Cat and Running Barefoot on Legos",Yahoo Entertainment
2025-09-08T12:00:00Z,"Corn Flakes: A Football Blowout, Pudge the Cat and Running Barefoot on Legos",Corn Nation
2025-09-08T12:00:00Z,A visit to the dentist.,Cheezburger.com
"Sat, 06 Sep 2025 10:00:00 GMT",The Mystery of the Cat Mystery - The New Yorker,The New Yorker
"Tue, 09 Sep 2025 02:52:50 GMT",CAT gearing up for National Week Without driving - Cville Right Now,Cville Right Now
"Tue, 09 Sep 2025 03:55:00 GMT",Ultra-Rare Chinchilla ‘Doll Face’ Persian Cat Plots Revenge During Routine Salon Session - ParadePets,ParadePets
"Mon, 08 Sep 2025 20:30:00 GMT","We Found the Exact Lipstick Doja Cat Ate (Yes, Ate) on the VMAs Red Carpet - ELLE",ELLE
"Tue, 09 Sep 2025 04:00:55 GMT",Feral Cat Colonies Public Health rabies - Infectious Disease Special Edition,Infectious Disease Special Edition
"Mon, 08 Sep 2025 20:40:57 GMT","No, Doja Cat Didn't Actually Eat Lipstick at the VMAs - Allure",Allure
"Mon, 08 Sep 2025 13:54:00 GMT","Regeneron's allergen-blocking antibodies score phase 3 wins against cat, pollen allergies - Fierce Biotech",Fierce Biotech
"Mon, 08 Sep 2025 22:04:34 GMT",Doja Cat’s Freaky Little Lipstick Stunt Was Actually Spon-con - The Cut,The Cut
"Mon, 08 Sep 2025 17:05:45 GMT","Maru the cat, who broke record by squishing himself into tiny cardboard boxes, dies at 18 - Guinness World Records",Guinness World Records
"Mon, 08 Sep 2025 19:37:10 GMT","Oh, So That's Why Doja Cat Ate Her Lipstick On the VMAs Red Carpet - marieclaire.com",marieclaire.com
"Mon, 08 Sep 2025 22:42:38 GMT","Peanut the Cat Goes Bar Hopping...Again! 30 Miles From Home, He Can't Deny Returning to His Favorite Hangout - Cole & Marmalade",Cole & Marmalade
"Mon, 08 Sep 2025 22:27:00 GMT",‘Everything is complete’: Cat believed to have died in an apartment fire found alive 2 months later - WLOX,WLOX
"Tue, 09 Sep 2025 03:35:06 GMT",VIDEO: Overcrowded Whatcom County cat kennel needs help from the public - KIRO 7 News Seattle,KIRO 7 News Seattle
"Mon, 08 Sep 2025 08:55:20 GMT",Claws out: Ohio lawmakers move to ban cat declawing - Ohio Capital Journal,Ohio Capital Journal
"Mon, 08 Sep 2025 23:19:26 GMT","Solar Animal Repellent Get Rid Of Cat Rabbit Raccoon Skunk Deer Rat Squirrel Dog, IP65 Waterproof Ultrasonic Animal Repeller, Cat Repellent Outdoor With Motion Detector Flashing Light Deer Repellent - michiganreview.com",michiganreview.com
"Tue, 09 Sep 2025 05:30:00 GMT",Medina approves funding for feral cat control - Cleveland.com,Cleveland.com
"Mon, 08 Sep 2025 22:55:00 GMT",If Monday Were a Cat: Tuxedo Kitty Gets Stuck in a Tissue Box and Steps in Water - ParadePets,ParadePets
"Mon, 08 Sep 2025 21:00:00 GMT",Cat Sweetly Rides Horse Friend in the Morning and They’re the Most Epic Duo - ParadePets,ParadePets
"Mon, 08 Sep 2025 15:17:00 GMT","See MTV VMAs 2025 red carpet looks: Sabrina Carpenter, Doja Cat and more arrive at the awards show - NBC News",NBC News
"Mon, 08 Sep 2025 18:43:00 GMT","Costs drive shift toward cat adoptions as dog ownership declines, report finds - KSHB 41 Kansas City",KSHB 41 Kansas City
"Fri, 05 Sep 2025 19:39:24 GMT",Wisconsin’s viral ‘Cat Napper’ is living every cat lover’s dream - WPR,WPR
"Tue, 09 Sep 2025 01:26:00 GMT",Why Doja Cat Ate Her Lipstick on the Video Music Awards Red Carpet - Entertainment Tonight,Entertainment Tonight
"Tue, 09 Sep 2025 01:55:00 GMT",Orange Cat Waiting Politely for Mom To Finish Shower Is True Devotion - ParadePets,ParadePets
"Mon, 08 Sep 2025 17:40:19 GMT",Maine Coon Cat’s Vocal First Meeting with Foster Kitten Brings All the Drama - ParadePets,ParadePets
"Sun, 07 Sep 2025 22:38:00 GMT",Exclusive | Meet the NYC shop cat working for over a decade — one of dozens of feline workers profiled in new book - New York Post,New York Post
"Sun, 07 Sep 2025 00:20:20 GMT",Pudge the Cat captures heart of Bowling Green football and the internet - USA Today,USA Today
"Tue, 09 Sep 2025 00:29:30 GMT","Whatcom Humane Society receives massive influx of stray cats, seeks community assistance - My Bellingham Now",My Bellingham Now
"Mon, 08 Sep 2025 00:23:03 GMT",Watch Doja Cat Perform “Jealous Type” at 2025 MTV VMAs - Pitchfork,Pitchfork
"Tue, 09 Sep 2025 06:03:30 GMT",Cat bond market yield drops ~0.60% to 10.22% in August on seasonal spread tightening - Artemis.bm,Artemis.bm
"Mon, 08 Sep 2025 23:20:21 GMT",James ‘Big Cat’ Williams on What’s in Store for the Chicago Bears and Their New Head Coach - WTTW News,WTTW News
"Mon, 08 Sep 2025 00:23:00 GMT",Doja Cat Goes Totally ‘80s to Open VMAs With Kenny G - Variety,Variety
"Mon, 08 Sep 2025 00:20:00 GMT","Mom Claims Her Cat Looks Like 'Art the Clown' From the 'Terrifier' Movies, and TBH, It's Pretty Scary - ParadePets",ParadePets
"Mon, 08 Sep 2025 18:06:18 GMT","Is declawing cats inhumane? Ohio bill would outlaw practice. Alternatives, what to know - The Columbus Dispatch",The Columbus Dispatch
"Tue, 09 Sep 2025 04:00:00 GMT",Dermot O’Leary: ‘Toto the cat is blind but has lightning-fast reactions’ - The Times,The Times
"Mon, 08 Sep 2025 20:28:00 GMT","Alley Cat Allies Offers $10,000 Reward for Information on a Kitten Shot in the Face with a Dart in Rowlett, Texas - PR Newswire",PR Newswire
"Sun, 07 Sep 2025 22:22:00 GMT",Doja Cat Eats Her Lipstick in Jaw-Dropping Red Carpet Moment at MTV VMAs 2025 - E! News,E! News
"Mon, 08 Sep 2025 15:18:21 GMT",Friend Checks on Cat While Owner's Away—Discovers He's Not Taking It Well - Newsweek,Newsweek
"Fri, 05 Sep 2025 17:01:46 GMT",California cat euthanized after getting bird flu from raw cat food - NBC News,NBC News
"Sat, 06 Sep 2025 17:30:26 GMT",San Antonio's getting a cat café (again). Here's the meow-down. - MySA,MySA
"Sat, 06 Sep 2025 09:00:01 GMT","16-Year-Old Cat Lost Owner, Then Spent 'Long Months' Alone in the House - Newsweek",Newsweek
"Mon, 08 Sep 2025 01:35:26 GMT",Doja Cat Applies And Eats Her Lipstick On 2025 VMAs Red Carpet - iHeart,iHeart
"Mon, 08 Sep 2025 22:55:20 GMT","Bumbershoot 2025 Roundup: Weezer, Witches, Wrestlers, and the Undeniable Power of Cats - VICE",VICE
"Mon, 08 Sep 2025 06:10:35 GMT",Red Cat unveils Blue Ops USV business - Janes,Janes
"Mon, 08 Sep 2025 13:55:00 GMT",Deaf Cat’s Polite Way of Asking for His Toy Will Melt Anyone’s Heart - ParadePets,ParadePets
"Sun, 07 Sep 2025 21:28:55 GMT",Exclusive: Doja Cat Is the New Face of MAC—After “Eating” Lipstick on the 2025 VMAS Red Carpet - instyle.com,instyle.com
"Tue, 09 Sep 2025 02:26:03 GMT",Feral #16 Preview: Pet City Trial Ends in Cat-astrophe - Bleeding Cool News,Bleeding Cool News
"Mon, 08 Sep 2025 00:19:15 GMT",Doja Cat Takes VMAs Back to the Eighties With Debut Performance of ‘Jealous Type’ - Rolling Stone,Rolling Stone
"Mon, 08 Sep 2025 18:32:50 GMT",Doja Cat's Reaction To Alex Warren's Performance At The 2025 VMAs Says It All - BuzzFeed,BuzzFeed
"Mon, 08 Sep 2025 13:54:57 GMT",Laughter As Puppy With Older Cat Siblings Learns To Make Biscuits - Newsweek,Newsweek
"Mon, 08 Sep 2025 10:00:00 GMT","Appleton landlords settle in case over access to emotional support cats, rats - WPR",WPR
"Mon, 08 Sep 2025 17:07:36 GMT",Perinton pair charged in cat-hoarding case - Democrat and Chronicle,Democrat and Chronicle
"Mon, 08 Sep 2025 21:52:47 GMT",M.A.C Cosmetics taps Doja Cat as new global brand ambassador - FashionNetwork USA,FashionNetwork USA
"Sun, 07 Sep 2025 21:53:01 GMT",Doja Cat Pulls a Bold Move on 2025 MTV VMAs Carpet by Applying Bright Red Lipstick — Then Eating It! - People.com,People.com
"Mon, 08 Sep 2025 19:12:41 GMT",Meet Orzo — Meow Mobile Cat of the Week - Capitol City Now,Capitol City Now
"Mon, 08 Sep 2025 19:05:39 GMT",Short story collection ‘The Blanket Cats’ emphasizes kindness and understanding - International Examiner,International Examiner
"Mon, 08 Sep 2025 13:44:55 GMT",Family’s cat was missing for a month. Then came good news — from 900 miles away - Miami Herald,Miami Herald
"Sun, 07 Sep 2025 14:35:35 GMT",Cat’s Secret Night Out Caught on Camera and It’s Hilarious - PetHelpful,PetHelpful
"Mon, 08 Sep 2025 14:56:10 GMT",Owner Leaves Door Open Overnight—Security Cam Shows Cat Lived It Up - Newsweek,Newsweek
"Mon, 08 Sep 2025 15:02:34 GMT",Whatcom County Humane’s cat kennel is full. Here’s how you can help. - MyNorthwest.com,MyNorthwest.com
"Mon, 08 Sep 2025 00:27:00 GMT","Doja Cat Cheekily Apologizes for ""Rude"" Interruption During LL Cool J's VMAs 2025 Monologue - E! News",E! News
"Mon, 08 Sep 2025 01:30:00 GMT",Doja Cat Brings the ’80s Back by Performing “Jealous Type” With Kenny G at 2025 MTV VMAs - The Hollywood Reporter,The Hollywood Reporter
"Mon, 08 Sep 2025 20:19:00 GMT",Here’s Why Doja Cat Quite Literally “Ate” at the VMAs—and You Can Shop the $25 Beauty Product Yourself - Biography: Historical and Celebrity Profiles,Biography: Historical and Celebrity Profiles
"Mon, 08 Sep 2025 03:08:47 GMT","10 Best Red Carpet Looks at the MTV VMAs: Doja Cat, Sabrina Carpenter & More - The New York Times",The New York Times
"Sat, 06 Sep 2025 17:00:00 GMT",How a cat named Pudge became a college football sensation - The Washington Post,The Washington Post
"Mon, 08 Sep 2025 22:58:54 GMT",Technician steps for stabilizing and preparing cats for unblocking - DVM360,DVM360
"Sun, 07 Sep 2025 11:45:00 GMT","We Tested the Best Cat Litter, Including Unscented and Clumping Grains — from $14 - People.com",People.com
"Sun, 07 Sep 2025 14:30:31 GMT",Orange Cat ‘Laughs At’ Healthy Golden Retriever While Going in To Swipe His Fry - ParadePets,ParadePets
"Tue, 09 Sep 2025 06:46:01 GMT",Price-Driven Insight from (CAT) for Rule-Based Strategy - news.stocktradersdaily.com,news.stocktradersdaily.com
"Mon, 08 Sep 2025 15:15:00 GMT",Playful Bunny Hanging Out With His Cat Siblings Like He’s One of the Gang Is as Adorable as It Gets - PetHelpful,PetHelpful
"Mon, 08 Sep 2025 03:20:18 GMT",Lisa’s ‘Born Again’ With Doja Cat And Raye Wins MTV VMA For Best K-Pop - Forbes,Forbes
"Sun, 07 Sep 2025 21:29:00 GMT","Doja Cat pairs sky-high platform heels with a $5,995 crystallized lipstick clutch on VMAs 2025 red carpet - Page Six",Page Six
"Mon, 08 Sep 2025 23:52:00 GMT",Hardin Posts - Black Cat - Watauga Democrat,Watauga Democrat
"Tue, 09 Sep 2025 01:52:00 GMT",How a cat named Pudge became a college football sensation - The Guam Daily Post,The Guam Daily Post
"Mon, 08 Sep 2025 02:31:22 GMT","Mom Claims Her Cat Looks Like 'Art the Clown' From the 'Terrifier' Movies, and TBH, It's Pretty Scary - AOL.com",AOL.com
"Mon, 08 Sep 2025 19:42:55 GMT",Photostory: Purrfect day at annual cat show - The Augusta Press,The Augusta Press
"Mon, 08 Sep 2025 15:32:39 GMT",Meet Nature Cat at Slightly Spooky Saturday - WTTW,WTTW
"Mon, 08 Sep 2025 22:17:38 GMT",Doja Cat’s lipstick stunt is the best celebrity endorsement of all time - The Times,The Times
"Mon, 08 Sep 2025 20:47:46 GMT",Wall Street Bulls Look Optimistic About Caterpillar (CAT): Should You Buy? - Yahoo Finance,Yahoo Finance
"Fri, 05 Sep 2025 01:38:10 GMT",Catastrophe! San Jose cat shelter closed after 2-car collision damages sanctuary - KTVU,KTVU
"Tue, 09 Sep 2025 03:01:56 GMT","Franklin Council to Vote Tuesday on Wildlife Feeding, Cat Colony Rules, Property Deal - TAPinto",TAPinto
"Tue, 09 Sep 2025 03:16:48 GMT",Happy Cat Month: Top Tips to Care for Your Feline Friend - MiNDFOOD,MiNDFOOD
"Mon, 08 Sep 2025 23:37:00 GMT",Fluffy Cat’s ‘Glitter Mishap’ Has Him Looking Ready for a ‘Twilight’ Convention - AOL.com,AOL.com
"Thu, 04 Sep 2025 20:25:50 GMT",FDA warns of H5N1 avian flu detection in raw cat food - CIDRAP,CIDRAP
"Mon, 08 Sep 2025 19:09:17 GMT",Big Cat's Official Season Prediction For The Bears In 2025 - Barstool Sports,Barstool Sports
"Fri, 05 Sep 2025 04:01:00 GMT",The cat mayoral race: meet 11 runners and riders in the US’s most furious – and furriest – election - The Guardian,The Guardian
"Sun, 07 Sep 2025 23:04:39 GMT",Missing cat found after apartment fire in Montgomery - WSFA,WSFA
"Mon, 08 Sep 2025 02:03:45 GMT",Doja Cat Dances Through ‘Jealous Type’ With Kenny G to Kick Off VMAs - Billboard,Billboard
"Fri, 05 Sep 2025 17:54:00 GMT",PETA says BGSU locker room cat 'Pudge' should stay home from games - WTOL,WTOL
"Mon, 08 Sep 2025 20:28:00 GMT","Alley Cat Allies Offers $10,000 Reward for Information on a Kitten Shot in the Face with a Dart in Rowlett, Texas - Star Local Media",Star Local Media
"Sun, 07 Sep 2025 23:33:12 GMT","Statement Hair and Makeup at the MTV VMAs: Doja Cat, Frankie Grande, Megan Stalter and More - WWD",WWD
"Mon, 08 Sep 2025 11:53:59 GMT",Hoosick Falls residents take on feral cat surge with little resources - MSN,MSN
"Fri, 05 Sep 2025 13:02:39 GMT","Woman Visits PetSmart, Horrified by What She Sees on Cat for Sale - Newsweek",Newsweek
"Mon, 08 Sep 2025 13:00:00 GMT",Desert Cat Rescue Cat of the Week - Eastern Arizona Courier,Eastern Arizona Courier
"Mon, 08 Sep 2025 18:09:33 GMT","The cat’s out of the bag in the new Aronofksy adventure, “Caught Stealing” - Coronado Times",Coronado Times
"Mon, 08 Sep 2025 02:07:00 GMT",Kenny G Crashes VMA’s Opening Act and Upstages Doja Cat - The Daily Beast,The Daily Beast
"Sun, 07 Sep 2025 07:00:00 GMT",English Dub Review: Nyaight of the Living Cat “Nyarmageddon” - Bubbleblabber,Bubbleblabber
"Fri, 05 Sep 2025 09:00:53 GMT",You’ve Got It All Wrong About Doja Cat - The New York Times,The New York Times
"Mon, 08 Sep 2025 13:00:00 GMT",University of Utah Asia Campus to Participate in CAT University Fair This September | Newswise - Newswise,Newswise
"Mon, 08 Sep 2025 20:11:43 GMT",Parents couldn't figure out why their cat avoided the bed. Then they saw the security footage. - good.is,good.is
2025-09-09T14:44:54,Caterpillar: Valuation Gap Continues Widednig,SeekingAlpha
2025-09-08T17:11:48,Caterpillar: Tariffs Continue To Wreak Havoc On Profitability,SeekingAlpha
2025-09-08T14:45:00,Caterpillar Stock Keeps Inching Along. Is It a Good Buy for Steady Growth?,Yahoo
2025-09-08T11:57:00,"Construction Equipment Company Evaluation Report 2025 | Advanced Product Portfolios, Electric Equipment Innovation, and Strategic Collaborations Strengthen Market Leadership for Top Players",Yahoo
2025-09-06T10:41:00,"Can $10,000 in Caterpillar Stock Turn Into $50,000 by 2030?",Yahoo
2025-09-05T21:47:48,Tariffs Are Hitting This Blue-Chip Dividend Stock. Should You Buy the Dip?,Yahoo
2025-09-05T17:09:35,Jim Cramer Keeps Silent About Caterpillar Inc. (CAT),Yahoo
2025-09-05T05:31:02,Trump Admin Slams Norway's $2 Trillion Wealth Fund Exit From Caterpillar Over Gaza Bulldozer Use,Yahoo
2025-09-04T15:36:06,Norway sparks row with Trump after dumping bulldozers used by Israel,Yahoo
2025-09-04T13:27:45,US Reportedly Voices Concern Over Caterpillar Divestment by Norway's Sovereign Wealth Fund,Yahoo
2025-09-04T02:31:46,US 'very troubled' by Norway wealth fund's divestment from Caterpillar,Yahoo
