Date,Title,Source
2025-08-29T09:00:59Z,Buy Or Fear HSBC Stock?,Forbes
2025-08-27T06:12:51Z,Raymond James Financial Begins Coverage on Ecolab (NYSE:ECL),ETF Daily News
"Sun, 31 Aug 2025 21:02:02 GMT",NRG and BLUEJAYS reach ECL S50 Cup #1 Finals after M80 forfeit remaining matches - Dust2.us,Dust2.us
"Thu, 28 Aug 2025 13:45:00 GMT",Richards delighted Palace into ECL proper: Fredrikstad through everything at us - TribalFootball,TribalFootball
"Fri, 29 Aug 2025 18:33:30 GMT",BOSS lose to BLUEJAYS in a DDOS-marred ECL S50 Cup 1 lower final - Dust2.us,Dust2.us
"Thu, 28 Aug 2025 13:33:00 GMT","Glasner hails ""huge achievement"" as Palace win ECL playoff - TribalFootball",TribalFootball
"Wed, 27 Aug 2025 17:35:22 GMT","M80 win ECL NA match despite playing from Europe, with nearly 100 ping - Dust2.us",Dust2.us
"Wed, 27 Aug 2025 14:02:54 GMT",Ramesh Chandra Mohapatra takes charge as Director (Technical) at SECL - PSU Watch,PSU Watch
"Wed, 27 Aug 2025 14:53:50 GMT","R C Mohapatra Assumes Charge as Director (Tech) – Project & Planning, SECL - The NewsMan of India.Com",The NewsMan of India.Com
"Wed, 27 Aug 2025 14:10:32 GMT","Shri Ramesh Chandra Mohapatra Assumes Charge as Director (Technical), SECL - PSU Connect",PSU Connect
"Sun, 31 Aug 2025 00:22:30 GMT",Shelbourne and Shamrock Rovers learn dates and kick-off times for ECL group games - Irish Mirror,Irish Mirror
