Date,Title,Source
2025-11-05T03:24:18Z,Cavaliers PG Darius Garland activated for season debut vs. 76ers,Yahoo Entertainment
2025-11-05T02:37:37Z,render-engine-pg 2025.11.1b2,Pypi.org
2025-11-04T23:03:25Z,render-engine-pg 2025.11.1b0,Pypi.org
2025-11-04T21:58:45Z,PREDATOR: BADLANDS Is the Best Alien/Robot Team-Up Ever (Review),Nerdist
2025-11-04T17:42:44Z,wmill-pg 1.572.2,Pypi.org
2025-11-04T17:01:41Z,"Predator Badlands Review: It’s Super Fun, but it’s also VERY PG-13 and Tame",JoBlo.com
2025-11-04T17:01:41Z,"Predator Badlands Review: It’s Super Fun, but it’s also VERY PG-13 and Tame",JoBlo.com
2025-11-04T16:54:00Z,wmill-pg 1.572.1,Pypi.org
2025-11-04T14:01:44Z,sai-pg 1.1.1,Pypi.org
2025-11-04T14:00:00Z,"Associations of serum pepsinogen and Gastrin-17 with Helicobacter pylori infection, sex, and age, in an asymptomatic coastal population: A cross-sectional study in Rizhao, China",Plos.org
2025-11-04T01:33:23Z,"‘Cameras failed to capture faces’: Out with boyfriend, PG student abducted, gang-raped in Coimbatore; 3 arrested after encounter",The Times of India
2025-11-03T14:32:56Z,wmill-pg 1.572.0,Pypi.org
2025-11-03T10:43:09Z,"Kerala NEET PG 2025 round 1 provisional merit list released: Over 5,800 candidates shortlisted, check direct link here",The Times of India
2025-11-03T09:29:19Z,ASRock Phantom Gaming Radeon RX 7900 XTX 24GB GDDR6 PCI Express 4.0 ATX Graphics Card $799.99 (7 replies),Slickdeals.net
2025-11-03T09:08:09Z,SRMJEEE PG 2026 registration begins at srmist.edu.in: Check important dates and direct link to apply here,The Times of India
2025-11-02T18:49:17Z,pg-helper 1.0.0,Pypi.org
2025-11-02T18:49:17Z,pg-helper added to PyPI,Pypi.org
2025-11-02T03:53:56Z,Uttar Pradesh adds 950 MBBS and 271 PG seats to medical colleges for 2025-26 session,The Times of India
2025-11-01T09:58:26Z,wmill-pg 1.571.0,Pypi.org
2025-11-01T08:49:28Z,"AIIMS INI CET January 2026 admit card out today: Download link, exam pattern, syllabus and key details",The Times of India
"Thu, 06 Nov 2025 04:50:08 GMT",PG Darius Garland makes season debut for Cleveland Cavaliers - NBA,NBA
"Wed, 05 Nov 2025 13:59:00 GMT",MPA Cease-and-Desist Letter to Meta Over Instagram PG-13 Teen Accounts - Variety,Variety
"Thu, 06 Nov 2025 04:55:12 GMT","Mavericks shake up lineup to move Cooper Flagg from PG, then lose to Pelicans as late Flagg floater misses mark - Yahoo Sports",Yahoo Sports
"Wed, 05 Nov 2025 13:00:00 GMT",Exclusive | Motion Picture Trade Group Pans Instagram’s Use of ‘PG-13’ With Cease and Desist - The Wall Street Journal,The Wall Street Journal
"Wed, 05 Nov 2025 18:56:48 GMT",Motion Picture Association demands Meta drop PG-13 label from Instagram teen filters - Reuters,Reuters
"Thu, 06 Nov 2025 04:45:27 GMT",PG Darius Garland makes season debut for Cleveland Cavaliers - yourvalley.net,yourvalley.net
"Thu, 06 Nov 2025 04:45:00 GMT",PG Darius Garland makes season debut for Cleveland Cavaliers - AP News,AP News
"Wed, 05 Nov 2025 15:35:08 GMT",Motion Picture Association hits Instagram with cease-and-desist over 'PG-13' label - NBC News,NBC News
"Thu, 06 Nov 2025 03:24:00 GMT","The MPA is pretty pissed about Instagram using ""PG-13"" to describe its teen accounts - AV Club",AV Club
"Thu, 06 Nov 2025 02:44:37 GMT",Joe Jonas Can Be Easily Distracted by ‘PG-13’ Signs in Crowd at Jonas Brothers Gigs - People.com,People.com
"Wed, 05 Nov 2025 17:42:52 GMT",The MPA tells Meta to stop using PG-13 to describe teen accounts - Engadget,Engadget
"Wed, 05 Nov 2025 20:45:00 GMT",Motion Picture Association tells Meta to stop using PG-13 to refer to Instagram teen account content - Spectrum News 1,Spectrum News 1
"Wed, 05 Nov 2025 15:46:58 GMT",Motion Picture Association hits Meta with cease-and-desist over use of ‘PG-13’ label - TechCrunch,TechCrunch
"Thu, 06 Nov 2025 06:50:15 GMT",Motion Picture Association tells Meta to stop using PG-13 to refer to Instagram teen account content - nashuatelegraph.com,nashuatelegraph.com
"Wed, 05 Nov 2025 18:48:01 GMT",MPA issues cease and desist to Meta after it uses PG-13 rating for teen accounts - Mashable,Mashable
"Thu, 06 Nov 2025 00:04:52 GMT",Cavaliers PG Darius Garland activated for season debut vs. 76ers - Yahoo Sports,Yahoo Sports
"Wed, 05 Nov 2025 17:52:00 GMT",E-Commerce Momentum Builds: Is Digital PG's Next Growth Engine? - Yahoo Finance,Yahoo Finance
"Wed, 05 Nov 2025 13:53:35 GMT",MPA Sends Cease and Desist Letter to Instagram Over “Literally False and Highly Misleading” PG-13 Rating - The Hollywood Reporter,The Hollywood Reporter
"Thu, 06 Nov 2025 02:27:27 GMT",Motion Picture Association issues cease-and-desist to Meta over ‘PG-13’ teen filters on Instagram - Marketing-Interactive,Marketing-Interactive
"Wed, 05 Nov 2025 10:58:25 GMT","“Proctor (PG)’s A Juggernaut,” Says Jim Cramer - Yahoo Finance",Yahoo Finance
"Wed, 05 Nov 2025 17:14:05 GMT",Instagram Got a Cease-and-Desist Over PG-13 Ratings - Vulture,Vulture
"Wed, 05 Nov 2025 20:59:28 GMT",Meta’s Use of the Term ‘PG-13’ Has Run Afoul of the U.S. Movie-Rating Organization - Gizmodo,Gizmodo
"Wed, 05 Nov 2025 16:15:00 GMT",MPA Sends Cease And Desist Letter To Instagram Parent Meta Over “PG-13” Teen Accounts - Deadline,Deadline
"Thu, 06 Nov 2025 07:11:02 GMT",MPA Sends Cease & Desist Letter To Instagram Over “Literally False” PG-13 Rating - 106.3 The Groove,106.3 The Groove
"Wed, 05 Nov 2025 23:05:34 GMT",Motion Picture Association demands Meta remove PG-13 label from Instagram - The San Joaquin Valley Sun,The San Joaquin Valley Sun
"Wed, 05 Nov 2025 22:14:20 GMT",Motion Picture Association Warns Meta To Stop Using 'PG-13' Ratings 11/06/2025 - MediaPost,MediaPost
"Wed, 05 Nov 2025 17:30:00 GMT",Meta’s Attempts to Use ‘PG-13′ Content Ratings Immediately Backfires - The Daily Beast,The Daily Beast
"Wed, 05 Nov 2025 20:45:54 GMT",Motion Picture Association tells Meta to stop using PG-13 to refer to Instagram teen account content - Daily Gate City,Daily Gate City
"Thu, 06 Nov 2025 04:41:15 GMT",PG Darius Garland makes season debut for Cleveland Cavaliers - The Killeen Daily Herald,The Killeen Daily Herald
"Wed, 05 Nov 2025 18:29:16 GMT",Motion Picture Association Issues Cease and Desist to Meta: Stop Using PG-13 - PetaPixel,PetaPixel
"Wed, 05 Nov 2025 14:21:09 GMT",Instagram slapped with cease and desist over its use of ‘PG-13’ teen accounts - The Verge,The Verge
"Thu, 06 Nov 2025 00:17:27 GMT",PG Darius Garland makes season debut for Cleveland Cavaliers - The Winchester Star,The Winchester Star
"Thu, 06 Nov 2025 03:27:07 GMT",MPA Sends Cease And Desist Letter To Instagram Parent Meta Over “PG-13” Teen Accounts - imdb.com,imdb.com
"Thu, 06 Nov 2025 05:59:36 GMT","MPA to Meta: Stop calling Instagram teen filters PG-13, that is our rating not yours - India Today",India Today
"Wed, 05 Nov 2025 20:24:09 GMT",No. 1 PG Deron Rippey ahead of NC State OV: 'I'm interested to see the culture Will Wade's building' - 247Sports,247Sports
"Thu, 06 Nov 2025 07:24:36 GMT",MPA Issues Cease-and-Desist Over Instagram PG-13 Claim - MediaNama,MediaNama
"Thu, 06 Nov 2025 04:33:53 GMT",How supply shortages influence PG stock - July 2025 Highlights & Verified Entry Point Signals - newser.com,newser.com
"Wed, 05 Nov 2025 14:55:22 GMT",Five-star PG Dylan Mingo visiting UNC this weekend - Tar Heel Times,Tar Heel Times
"Wed, 05 Nov 2025 04:01:00 GMT",2 Reasons to Like PG and 1 to Stay Skeptical - Yahoo Finance,Yahoo Finance
"Wed, 05 Nov 2025 16:32:25 GMT",Motion Picture Association to Meta: Stop saying Instagram teen content is “PG-13” - Sherwood News,Sherwood News
"Wed, 05 Nov 2025 23:56:27 GMT",MPA Sends Cease & Desist Letter To Instagram Over “Literally False” PG-13 Rating - WDEF,WDEF
"Thu, 06 Nov 2025 00:17:27 GMT",PG Darius Garland makes season debut for Cleveland Cavaliers - The Lufkin Daily News,The Lufkin Daily News
"Wed, 05 Nov 2025 17:05:39 GMT",MPA Slaps Meta With Cease and Desist Over PG-13 Designation - findarticles.com,findarticles.com
"Wed, 05 Nov 2025 15:37:00 GMT",February 2026 Options Now Available For Procter & Gamble (PG) - Nasdaq,Nasdaq
"Wed, 05 Nov 2025 20:06:32 GMT",MPA asks Meta to remove PG-13 tag from teen accounts - findarticles.com,findarticles.com
"Wed, 05 Nov 2025 15:09:49 GMT",Five-star PG Dylan Mingo visiting North Carolina this weekend - On3,On3
"Wed, 05 Nov 2025 20:45:54 GMT",Motion Picture Association tells Meta to stop using PG-13 to refer to Instagram teen account content - Ottumwa Courier,Ottumwa Courier
"Wed, 05 Nov 2025 20:45:00 GMT",Motion Picture Association tells Meta to stop using PG-13 to refer to Instagram teen account content - The Independent,The Independent
"Wed, 05 Nov 2025 22:10:49 GMT","MPA tells Meta to stop using the term ""PG-13"" to describe its new moderation policy or else - TechSpot",TechSpot
"Wed, 05 Nov 2025 14:37:30 GMT",MPA Sends Meta Cease-and-Desist Letter Demanding Instagram Stop Using PG-13 Rating to Describe New Teen Accounts - imdb.com,imdb.com
"Thu, 06 Nov 2025 04:45:27 GMT",PG Darius Garland makes season debut for Cleveland Cavaliers - thederrick.com,thederrick.com
"Wed, 05 Nov 2025 15:11:08 GMT",MPA Sends Meta Cease-and-Desist Letter Over Using ‘PG-13’ to Describe New Teen Instagram Settings - imdb.com,imdb.com
"Thu, 06 Nov 2025 00:27:29 GMT",PG Darius Garland makes season debut for Cleveland Cavaliers - AOL.com,AOL.com
"Thu, 06 Nov 2025 00:20:07 GMT",PG Darius Garland makes season debut for Cleveland Cavaliers - The Washington Post,The Washington Post
"Wed, 05 Nov 2025 20:44:19 GMT","MPA demands Meta drop PG-13 label from Instagram filters, WSJ reports - TipRanks",TipRanks
"Wed, 05 Nov 2025 19:49:39 GMT","Heading into his NC State visit, where is the momentum with 5-star PG Deron Rippey? - On3",On3
"Wed, 05 Nov 2025 14:17:40 GMT",Taika Waititi’s ‘Klara and the Sun’ is Finally Ready — Rated PG-13 - World of Reel,World of Reel
"Wed, 05 Nov 2025 15:13:35 GMT",MPA Sends Cease-and-Desist Letter to Meta Over Instagram’s Use of ‘PG-13’ Label for Teen Accounts - The Cinema Group,The Cinema Group
"Tue, 04 Nov 2025 13:15:38 GMT",Is Procter & Gamble's (PG) Strong Quarter Shifting Analyst Views on Its Long-Term Growth Story? - Yahoo Finance,Yahoo Finance
"Wed, 05 Nov 2025 17:52:00 GMT",E-Commerce Momentum Builds: Is Digital PG's Next Growth Engine? - sharewise.com,sharewise.com
"Wed, 05 Nov 2025 04:59:29 GMT",Lady Panthers sweep PG in 4A area volleyball - Longview News-Journal,Longview News-Journal
"Wed, 05 Nov 2025 18:05:00 GMT",Hollywood Pushes Back as Instagram Borrows PG-13 Rating - newser.com,newser.com
"Wed, 05 Nov 2025 16:08:22 GMT",MPA Sends Meta Cease-and-Desist Letter Over Using ‘PG-13’ to Describe New Teen Instagram Settings - imdb.com,imdb.com
"Wed, 05 Nov 2025 06:47:25 GMT",How supply shortages influence PG stock - July 2025 Sentiment & Verified Momentum Watchlists - newser.com,newser.com
"Wed, 05 Nov 2025 14:55:09 GMT",MPA Sends Meta Cease-and-Desist Letter Demanding Instagram Stop Using PG-13 Rating to Describe New Teen Accounts - imdb.com,imdb.com
"Wed, 05 Nov 2025 15:02:57 GMT",MPA Sends Meta Cease-and-Desist Letter Demanding Instagram Stop Using PG-13 Rating to Describe New Teen Accounts - imdb.com,imdb.com
"Wed, 05 Nov 2025 10:48:47 GMT",HFG Advisors Inc. Cuts Position in Procter & Gamble Company (The) $PG - MarketBeat,MarketBeat
"Wed, 05 Nov 2025 16:21:48 GMT",MPA challenges Meta over Instagram's use of PG-13 rating term - Букви,Букви
"Wed, 05 Nov 2025 10:48:47 GMT",Claro Advisors LLC Decreases Holdings in Procter & Gamble Company (The) $PG - MarketBeat,MarketBeat
"Wed, 05 Nov 2025 16:04:49 GMT","With a UNC visit now set, who is carrying the momentum for 5-star PG Dylan Mingo as signing day approaches? - On3",On3
"Tue, 04 Nov 2025 11:05:50 GMT",Procter & Gamble (PG): Exploring Valuation After Recent Share Price Softness - simplywall.st,simplywall.st
"Wed, 05 Nov 2025 07:35:15 GMT",How supply shortages influence PG stock - Chart Signals & High Conviction Buy Zone Picks - newser.com,newser.com
"Thu, 06 Nov 2025 00:17:27 GMT",PG Darius Garland makes season debut for Cleveland Cavaliers - The Daily Gazette,The Daily Gazette
"Tue, 04 Nov 2025 09:06:00 GMT",Arkansas men’s basketball: Freshman PG Acuff scores 20 in 1st half of debut - Northwest Arkansas Democrat-Gazette,Northwest Arkansas Democrat-Gazette
"Wed, 05 Nov 2025 11:35:13 GMT",Arrowroot Family Office LLC Buys New Shares in Procter & Gamble Company (The) $PG - MarketBeat,MarketBeat
"Thu, 06 Nov 2025 04:44:42 GMT",NEET PG 2025 Round 1 Choice Filling Deadline Extended! Revised Schedule Soon by MCC - Telegraph India,Telegraph India
"Thu, 06 Nov 2025 00:38:39 GMT",PG Darius Garland makes season debut for Cleveland Cavaliers - Bluefield Daily Telegraph,Bluefield Daily Telegraph
"Wed, 05 Nov 2025 15:40:07 GMT",Motion Picture Association hits Instagram with cease-and-desist over 'PG-13' label - AOL.com,AOL.com
"Thu, 06 Nov 2025 07:15:36 GMT",Punjab and Haryana HC allows provisional consideration of OCI candidate in general category for medical PG seat - The Indian Express,The Indian Express
"Tue, 04 Nov 2025 20:47:20 GMT",Procter & Gamble (NYSE:PG) Sets New 12-Month Low - Time to Sell? - MarketBeat,MarketBeat
"Tue, 04 Nov 2025 23:11:00 GMT",PREDATOR: BADLANDS Rotten Tomatoes Score Revealed - Is The PG-13 Rating An Issue? - Fear HQ,Fear HQ
"Wed, 05 Nov 2025 10:11:52 GMT","Parsons says J-Kidd needs to rethink the Flagg at PG experiment: ""The Nets don't have a win, and their offense is better"" - Basketball Network",Basketball Network
"Tue, 04 Nov 2025 16:32:05 GMT",Procter & Gamble (PG) Announces Successful Closure of Public Off - GuruFocus,GuruFocus
"Tue, 04 Nov 2025 17:33:21 GMT","Critics Mostly Positive on ‘Predator: Badlands’: Tame, Heartfelt, and Surprisingly PG-13 - World of Reel",World of Reel
"Thu, 06 Nov 2025 05:10:44 GMT",Mangalore University News: PG Courses Discontinued for 2025–26 & Tax Issues Explained - Deccan Herald,Deccan Herald
"Tue, 04 Nov 2025 19:36:00 GMT",FOOD-GUMBO-PG - timesdaily.com,timesdaily.com
"Tue, 04 Nov 2025 11:28:16 GMT",Procter & Gamble Company (The) $PG Shares Sold by Levin Capital Strategies L.P. - MarketBeat,MarketBeat
"Thu, 06 Nov 2025 07:51:51 GMT",NEET PG 2025 Round 1: Eligible NRI Candidates List Released; Check Names Here - Telegraph India,Telegraph India
"Wed, 05 Nov 2025 06:52:24 GMT",How higher bond yields impact PG stock - 2025 Volume Leaders & Real-Time Volume Analysis - newser.com,newser.com
"Mon, 03 Nov 2025 15:13:00 GMT",VIDEO: PG Tre Donaldson interview at media day - 247Sports,247Sports
"Tue, 04 Nov 2025 12:46:59 GMT",Advisors Preferred LLC Reduces Position in Procter & Gamble Company (The) $PG - MarketBeat,MarketBeat
"Tue, 04 Nov 2025 12:28:37 GMT",Procter & Gamble Company (The) $PG Shares Bought by Huntington National Bank - MarketBeat,MarketBeat
"Tue, 04 Nov 2025 10:56:01 GMT",Police Seeking Armed Suspects After Brinks Armored Truck Robbery in PG County - Southern Maryland News Net,Southern Maryland News Net
2025-11-04T14:15:38,Is Procter & Gamble's (PG) Strong Quarter Shifting Analyst Views on Its Long-Term Growth Story?,Yahoo
2025-11-04T06:16:11,Morgan Stanley Trims Price Target on P&G Despite Strong Fiscal Q1 Performance,Yahoo
2025-11-01T15:00:29,A Look At The Intrinsic Value Of The Procter & Gamble Company (NYSE:PG),Yahoo
2025-11-01T06:38:16,Procter & Gamble And Its Real Value,SeekingAlpha
