Date,Title,Source
2025-08-31T08:17:11Z,"Take-Two Interactive Software (NASDAQ:TTWO) CEO Sells $4,613,800.00 in Stock",ETF Daily News
2025-08-30T07:50:49Z,"American Century Companies Inc. Buys 1,303 Shares of Take-Two Interactive Software, Inc. $TTWO",ETF Daily News
"Mon, 01 Sep 2025 02:00:28 GMT",Analyzing TTWO with multi timeframe charts - Quarterly Profit Report & AI Enhanced Market Trend Forecasts - Newser,Newser
"Mon, 01 Sep 2025 04:50:51 GMT","Take-Two Interactive Software, Inc. $TTWO Holdings Boosted by Totem Point Management LLC - MarketBeat",MarketBeat
"Sun, 31 Aug 2025 22:59:12 GMT",TTWO stock daily chart insights - 2025 Trade Ideas & Weekly Setup with ROI Potential - Newser,Newser
"Fri, 29 Aug 2025 13:30:02 GMT",Take-Two Interactive (TTWO) Crossed Above the 50-Day Moving Average: What That Means for Investors - Yahoo Finance,Yahoo Finance
"Sun, 31 Aug 2025 23:15:15 GMT",TTWO stock outlook for YEAR - Weekly Investment Report & Entry Point Confirmation Signals - Newser,Newser
"Sun, 31 Aug 2025 23:11:20 GMT",Can TTWO stock recover from recent decline - Weekly Gains Summary & Growth Oriented Trading Recommendations - Newser,Newser
"Sun, 31 Aug 2025 21:22:21 GMT",Using portfolio simulators with TTWO included - GDP Growth & AI Forecast Swing Trade Picks - Newser,Newser
"Sun, 31 Aug 2025 18:01:52 GMT",Using portfolio simulators with TTWO included - Weekly Gains Summary & Verified Entry Point Signals - Newser,Newser
"Sun, 31 Aug 2025 16:35:15 GMT",What makes TTWO stock price move sharply - Stop Loss & Capital Protection Trade Alerts - Newser,Newser
"Sun, 31 Aug 2025 15:00:59 GMT",How to interpret RSI for TTWO stock - Market Risk Summary & Weekly High Potential Stock Alerts - Newser,Newser
"Sun, 31 Aug 2025 18:57:43 GMT",What does recent volatility data suggest for TTWO - Portfolio Growth Summary & Weekly Sector Rotation Insights - Newser,Newser
"Sun, 31 Aug 2025 02:56:27 GMT",Has TTWO formed a bullish divergence - July 2025 News Drivers & Safe Entry Trade Signal Reports - Newser,Newser
"Sun, 31 Aug 2025 03:09:09 GMT",TTWO stock trend outlook and recovery path - Quarterly Portfolio Summary & Reliable Intraday Trade Plans - Newser,Newser
"Sun, 31 Aug 2025 19:13:06 GMT",TTWO stock trend outlook and recovery path - CPI Data & Capital Protection Trade Alerts - Newser,Newser
"Sun, 31 Aug 2025 16:31:14 GMT",What does recent volatility data suggest for TTWO - Weekly Trade Recap & Daily Chart Pattern Signals - Newser,Newser
"Sat, 30 Aug 2025 20:12:45 GMT",How to build a custom watchlist for TTWO - 2025 Technical Overview & Fast Momentum Entry Tips - Newser,Newser
"Sun, 31 Aug 2025 23:42:30 GMT",Intraday pattern recognizer results for TTWO - Trade Risk Report & Free Expert Approved Momentum Trade Ideas - Newser,Newser
"Sun, 31 Aug 2025 11:10:56 GMT",Analyzing TTWO with multi timeframe charts - 2025 Bull vs Bear & Growth Focused Entry Point Reports - Newser,Newser
"Sun, 31 Aug 2025 19:49:13 GMT",Volatility clustering patterns for TTWO - Earnings Overview Report & Long Hold Capital Preservation Plans - Newser,Newser
"Sun, 31 Aug 2025 09:31:55 GMT",Is it too late to sell TTWO - Share Buyback & Verified Entry Point Detection - Newser,Newser
"Sun, 31 Aug 2025 09:44:08 GMT",What high frequency data says about TTWO - Quarterly Growth Report & Verified Trade Idea Suggestions - Newser,Newser
"Sat, 30 Aug 2025 22:17:17 GMT",TTWO stock outlook for YEAR - July 2025 Action & Weekly Setup with High ROI Potential - Newser,Newser
"Sat, 30 Aug 2025 11:00:10 GMT","OMERS ADMINISTRATION Corp Trims Stake in Take-Two Interactive Software, Inc. $TTWO - MarketBeat",MarketBeat
"Sun, 31 Aug 2025 04:51:00 GMT",How to interpret RSI for TTWO stock - Bond Market & Growth-Oriented Investment Plans - Newser,Newser
"Sat, 30 Aug 2025 23:07:56 GMT",Has TTWO formed a bullish divergence - July 2025 Highlights & Technical Entry and Exit Alerts - Newser,Newser
"Sun, 31 Aug 2025 08:22:37 GMT",What does recent volatility data suggest for TTWO - Weekly Loss Report & Fast Exit and Entry Trade Guides - Newser,Newser
"Fri, 29 Aug 2025 18:24:00 GMT",Visual analytics tools that track TTWO performance - Portfolio Profit Report & Safe Capital Growth Tips - Newser,Newser
"Sun, 31 Aug 2025 01:23:11 GMT",TTWO stock outlook for YEAR - Trade Exit Summary & Consistent Growth Stock Picks - Newser,Newser
"Sun, 31 Aug 2025 02:50:58 GMT",Advanced analytics toolkit walkthrough for TTWO - Quarterly Risk Review & Low Risk High Reward Ideas - Newser,Newser
"Fri, 29 Aug 2025 21:47:01 GMT",Using portfolio simulators with TTWO included - July 2025 Closing Moves & Consistent Income Trade Ideas - Newser,Newser
"Fri, 29 Aug 2025 07:46:21 GMT",Custom watchlist performance reports with TTWO - July 2025 Analyst Calls & Technical Entry and Exit Alerts - Newser,Newser
"Fri, 29 Aug 2025 06:41:48 GMT",Price action breakdown for TTWO - Weekly Trend Recap & Technical Pattern Based Signals - Newser,Newser
"Wed, 27 Aug 2025 10:23:21 GMT",Volatility clustering patterns for TTWO - July 2025 Pullbacks & Daily Stock Momentum Reports - Newser,Newser
"Fri, 29 Aug 2025 16:57:57 GMT",What high frequency data says about TTWO - 2025 Historical Comparison & Reliable Intraday Trade Plans - Newser,Newser
"Wed, 27 Aug 2025 17:51:51 GMT",Pattern Scan Adds TTWO to Watchlist getLinesFromResByArray error: size == 0 - thegnnews.com,thegnnews.com
"Sat, 30 Aug 2025 10:30:08 GMT","B. Metzler seel. Sohn & Co. AG Raises Stock Holdings in Take-Two Interactive Software, Inc. $TTWO - MarketBeat",MarketBeat
"Fri, 29 Aug 2025 10:32:09 GMT","Rafferty Asset Management LLC Sells 14,001 Shares of Take-Two Interactive Software, Inc. $TTWO - MarketBeat",MarketBeat
"Sat, 30 Aug 2025 13:08:44 GMT",Is TTWO stock bottoming out - July 2025 Opening Moves & Intraday High Probability Alerts - Newser,Newser
"Sat, 30 Aug 2025 18:22:02 GMT",Can trapped investors hope for a rebound in TTWO - 2025 Geopolitical Influence & AI Driven Price Predictions - Newser,Newser
"Sun, 31 Aug 2025 01:23:40 GMT",Has TTWO formed a bullish divergence - Trade Volume Report & Capital Protection Trade Alerts - Newser,Newser
"Sat, 30 Aug 2025 04:09:36 GMT",Technical Bounce Expected in TTWO Next Week getLinesFromResByArray error: size == 0 - sisain.net,sisain.net
2025-08-29T15:30:02,Take-Two Interactive (TTWO) Crossed Above the 50-Day Moving Average: What That Means for Investors,Yahoo
