Date,Title,Source
2025-09-05T22:30:04Z,2004 Audi TT Roadster 225 Quattro 6-Speed at No Reserve,Bringatrailer.com
2025-09-05T18:00:00Z,"Jackery HomePower 3000 + bundle at new lows from $1,499, Heybike Horizon full suspension folding e-bike $1,399, EcoFlow, more",Electrek
2025-09-05T14:00:00Z,"The impact of breast cancer awareness campaigns on the knowledge, attitudes, and practices of breast cancer screening among Saudi female employees",Plos.org
2025-09-05T12:34:56Z,Pogačar Adds Worlds Time Trial to Calendar: Why He Can Go Double Rainbow in Rwanda,Outside
2025-09-05T09:24:03Z,Pogačar Adds World Championship Time Trial to Calendar: Can He Go Double Rainbow in Rwanda?,Outside
2025-09-05T05:40:02Z,J.LEAGUE × WIND AND SEA Collaboration,Prtimes.jp
2025-09-04T23:00:06Z,2013 Audi TT RS,Bringatrailer.com
2025-09-04T16:56:37Z,"Audi’s Concept C gives us the best look yet at new TT and yes, it’s going to be electric",TechRadar
2025-09-04T15:51:18Z,tt-perf-report 1.1.1,Pypi.org
2025-09-04T15:02:13Z,Audi Concept C: a radical new style that may preview a new electric TT drop top sports car,Electrek
2025-09-04T15:01:22Z,Audi Concept C EV – is This the Audi TT Successor?,Geeky Gadgets
2025-09-04T11:10:23Z,"Audi Concept C unveiled – two-door battery-electric sports car between TT, R8 to enter production in 2027",Paul Tan's Automotive News
2025-09-04T10:45:20Z,Changes to 2026 Isle of Man TT schedule revealed,BBC News
2025-09-04T10:24:11Z,tt-badger 0.1.1,Pypi.org
2025-09-04T09:54:55Z,tt-badger 0.1.0,Pypi.org
2025-09-04T09:54:50Z,tt-badger added to PyPI,Pypi.org
2025-09-04T08:56:09Z,Trane Technologies Stock: Is TT Outperforming the Industrial Sector?,Biztoc.com
2025-09-04T08:44:23Z,Trane Technologies Stock: Is TT Outperforming the Industrial Sector?,Yahoo Entertainment
2025-09-04T06:54:11Z,FMCSA revokes registration of three more ELDs,Overdriveonline.com
2025-09-04T06:07:04Z,Trane Technologies plc (NYSE:TT) Given Consensus Recommendation of “Hold” by Analysts,ETF Daily News
2025-09-03T22:00:09Z,1926 Ford Model TT Stake Truck,Bringatrailer.com
2025-09-03T20:47:06Z,"More than 1,000 current, former HHS employees sign letter calling on RFK Jr. to resign",Freerepublic.com
2025-09-03T17:25:00Z,Designers Weigh In on the 2025 Audi TT Concept,Core77.com
2025-09-03T16:40:31Z,Why Are Sports Fans Calling Dylan Raiola 'Baby Mahomes?',TMZ
2025-09-03T15:30:00Z,Audi TT concept showcases the brand's new space-age design language,New Atlas
2025-09-03T15:00:00Z,Audi Has (Finally) Replaced the TT Roadster With an All-Electric Sports Car,Robb Report
2025-09-03T14:00:00Z,"How loneliness relates to health, wellbeing, quality of life, and healthcare resource utilisation and costs across multiple age groups in the UK",Plos.org
2025-09-03T11:00:00Z,New Audi TT? Stunning Audi Concept C previews stylish sports car for 2027,AutoExpress
2025-09-03T10:40:00Z,Call of Duty ska bli film,Feber.se
2025-09-03T09:09:14Z,Boyfriend arrested for slitting 19-year-old’s throat in Madhya Pradesh's Panchsheel Nagar,The Times of India
2025-09-03T08:51:04Z,Comerica Bank Trims Position in Hyatt Hotels Corporation $H,ETF Daily News
2025-09-02T22:42:25Z,You may soon be able to watch Instagram Reels in picture-in-picture mode,9to5Mac
2025-09-02T20:07:45Z,Audi Concept C Is A 'Radically Simple' Targa Roof Electric Sports Car Going Into Production In 2027,Jalopnik
2025-09-02T19:00:46Z,The Audi Concept C Previews A BMW i4 Coupe Rival,BMWBLOG
2025-09-02T19:00:00Z,The Concept C Is the All-Electric Sports Car Kickstarting Audi’s Design Future,Wired
2025-09-02T14:00:00Z,Identification of gene-sex hormone interactions associated with type 2 diabetes among men and women,Plos.org
2025-09-02T12:14:59Z,Here’s Why TAT Technologies Ltd. (TATT) is Growing Rapidly,Yahoo Entertainment
2025-09-02T12:00:00Z,"This week in the Orioles minors: Bradfield promoted, Baysox and Shorebirds pitchers step up",Camden Chat
2025-09-02T11:40:00Z,Nytt sportigt och eldrivet koncept från Hyundai,Feber.se
2025-09-02T08:15:25Z,"First Look: Audi Revives the Spirit of the TT With the ""Concept C""",HYPEBEAST
2025-09-02T02:00:00Z,★イベント情報★地獄の沙汰もシャツ次第!? 墓場の画廊 特選キャラクターTシャツ祭り in大阪 開催。9月4日(木)から、京阪百貨店守口店で開催！,Prtimes.jp
"Sun, 07 Sep 2025 03:33:29 GMT",tt - Denton Record-Chronicle,Denton Record-Chronicle
"Tue, 02 Sep 2025 19:42:43 GMT",2028 Audi TT: What We Know So Far - Car and Driver,Car and Driver
"Thu, 04 Sep 2025 13:00:00 GMT",TT Podcasts: RoadSigns - Transport Topics,Transport Topics
"Sun, 07 Sep 2025 05:30:00 GMT",Sportbike vs Supertwin: What will be faster at the TT? - Visordown,Visordown
"Tue, 02 Sep 2025 19:15:00 GMT",Audi's New 'TT Moment' Is an Electric 2-Door Sports Car Concept Called the 'Concept C' - Road & Track,Road & Track
"Wed, 03 Sep 2025 15:59:05 GMT",Audi’s New Future: Reborn TT Concept - Kelley Blue Book,Kelley Blue Book
"Thu, 04 Sep 2025 09:56:15 GMT",Designers Weigh In on the 2025 Audi TT Concept - Core77,Core77
"Fri, 05 Sep 2025 10:30:00 GMT",TT Electronics Unveils New State of the Art Electronics Manufacturing Facility in Malaysia - I-Connect007,I-Connect007
"Tue, 02 Sep 2025 19:00:00 GMT",Should this beautiful Audi Concept C be the next-gen TT? - Top Gear,Top Gear
"Thu, 04 Sep 2025 15:02:00 GMT",Audi Concept C: a radical new style that may preview a new electric TT drop top sports car - Electrek,Electrek
"Fri, 05 Sep 2025 18:10:58 GMT",tt - Denton Record-Chronicle,Denton Record-Chronicle
"Thu, 04 Sep 2025 16:18:45 GMT","You’ll Want To Drive The Electric TT, Says Audi Boss - Carscoops",Carscoops
"Sat, 06 Sep 2025 14:04:12 GMT",American tennis player Taylor Townsend wore her own TT brand at the US Open - IslanderNews.com,IslanderNews.com
"Tue, 02 Sep 2025 19:04:46 GMT",The Audi Concept C Looks Like a Retro-Modern TT With Electric Power - Edmunds,Edmunds
"Wed, 03 Sep 2025 08:38:41 GMT",Audi Concept C: The Electric TT is Coming After All - gtspirit.com,gtspirit.com
"Wed, 03 Sep 2025 15:00:00 GMT",Audi Has (Finally) Replaced the TT Roadster With an All-Electric Sports Car - Robb Report,Robb Report
"Tue, 02 Sep 2025 17:01:00 GMT",Hope for Audi TT Fans: Leaked Concept Photo Sparks Hope for Its Return - Autoweek,Autoweek
"Tue, 02 Sep 2025 20:39:17 GMT",Audi Concept C Previews Bold New Design Era as Electric TT Successor - Wards Auto,Wards Auto
"Fri, 05 Sep 2025 20:15:00 GMT",Two injured in Highway TT crash - missourian.com,missourian.com
"Tue, 02 Sep 2025 15:11:15 GMT",Audi’s New Coupe Looks Like A TT That Hooked Up With A Jaguar Concept - Carscoops,Carscoops
"Fri, 05 Sep 2025 07:00:00 GMT",Stats for Arkansas football's 2026 commitments - Northwest Arkansas Democrat-Gazette,Northwest Arkansas Democrat-Gazette
"Wed, 03 Sep 2025 13:35:26 GMT",ElecTTric Future? Audi’s Concept C Looks Picks Up Where TT Left Off - MotorTrend,MotorTrend
"Fri, 05 Sep 2025 22:26:03 GMT",Trane Technologies Stock: Is TT Outperforming the Industrial Sector? - MSN,MSN
"Thu, 04 Sep 2025 02:51:42 GMT",tt - Denton Record-Chronicle,Denton Record-Chronicle
"Thu, 04 Sep 2025 02:51:33 GMT",tt - Denton Record-Chronicle,Denton Record-Chronicle
"Thu, 04 Sep 2025 02:51:28 GMT",tt - Denton Record-Chronicle,Denton Record-Chronicle
"Tue, 02 Sep 2025 16:30:00 GMT",Audi’s TT Successor Leak Points to a Radical New Flagship EV - duPont REGISTRY News,duPont REGISTRY News
"Tue, 02 Sep 2025 17:45:00 GMT",Why Audi’s design chief took a day off to study the original TT - Automotive News,Automotive News
"Thu, 04 Sep 2025 15:48:26 GMT",The electric Audi TT: German car giant unveils striking concept model that signals its return to the sports... - MSN,MSN
"Fri, 05 Sep 2025 14:00:41 GMT",Audi TT-Replacing Electric Sports Car Gets Rendered With Concept C Styling Cues - autoevolution,autoevolution
"Tue, 02 Sep 2025 19:00:00 GMT",There’s a new Audi TT! Gorgeous concept previews future sports car - Carwow,Carwow
"Thu, 04 Sep 2025 18:38:43 GMT",This Awesome Concept Previews the Audi TT's Electric Successor and the Brand's New Design Direction - MSN,MSN
"Thu, 04 Sep 2025 08:44:23 GMT",Trane Technologies Stock: Is TT Outperforming The Industrial Sector? - Barchart.com,Barchart.com
"Wed, 03 Sep 2025 15:00:00 GMT",Audi Has (Finally) Replaced the TT Roadster With an All-Electric Sports Car - ca.finance.yahoo.com,ca.finance.yahoo.com
"Thu, 04 Sep 2025 16:56:37 GMT",Times are a-changin' as we're getting an all-electric Audi TT concept - TechRadar,TechRadar
"Tue, 02 Sep 2025 16:01:00 GMT","Audi Concept C previews next TT sports car, new design language - Automotive News",Automotive News
"Tue, 02 Sep 2025 15:28:47 GMT",Activist Investor Elliott Builds $4 Billion Stake in PepsiCo - Transport Topics,Transport Topics
"Fri, 05 Sep 2025 11:52:37 GMT",Sportbikes in as Isle of Man TT announces new 2026 schedule - Carole Nash,Carole Nash
"Thu, 04 Sep 2025 15:22:30 GMT",Isle of Man TT revamps schedule after 2025 disruption - The Race,The Race
"Tue, 02 Sep 2025 19:00:24 GMT","First Look: Audi Revives the Spirit of the TT With the ""Concept C"" - hypebeast.com",hypebeast.com
"Wed, 03 Sep 2025 00:20:31 GMT",tt - Denton Record-Chronicle,Denton Record-Chronicle
"Tue, 02 Sep 2025 11:39:35 GMT",Audi’s New TT Concept Accidentally Leaked: TDS - The Drive,The Drive
"Wed, 03 Sep 2025 15:34:35 GMT",Audi TT concept showcases the brand's new space-age design language - New Atlas,New Atlas
"Thu, 04 Sep 2025 16:07:30 GMT",Audi Concept C EV – is This the Audi TT Successor? - Geeky Gadgets,Geeky Gadgets
"Fri, 05 Sep 2025 08:13:25 GMT",TT 2026 will see a new class lining up on Bray Hill - Visordown,Visordown
"Thu, 04 Sep 2025 19:22:00 GMT","Audi Reveals Concept C, the TT Successor—and It’s Packed With Surprises - Men's Journal",Men's Journal
"Tue, 02 Sep 2025 19:00:00 GMT",Audi's Sports Car Rebirth Starts With This TT-Inspired Concept - CarBuzz,CarBuzz
"Tue, 02 Sep 2025 17:00:00 GMT",The Audi Concept C is an electric love letter to the TT - supercarblondie.com,supercarblondie.com
"Wed, 03 Sep 2025 00:56:15 GMT",The New Audi TT Concept Is Proof Halo Cars Matter - The Autopian,The Autopian
"Wed, 03 Sep 2025 12:00:20 GMT",Will Weakness in Trane Technologies plc's (NYSE:TT) Stock Prove Temporary Given Strong Fundamentals? - ca.finance.yahoo.com,ca.finance.yahoo.com
"Tue, 02 Sep 2025 12:53:28 GMT",Audi’s New TT Concept Accidentally Leaked: TDS - MSN,MSN
"Tue, 02 Sep 2025 11:30:00 GMT",Leaked: Audi’s New Sports Car Looks Like A TT And R8 Lovechild - autoblog.com,autoblog.com
"Thu, 04 Sep 2025 06:00:00 GMT",Major schedule and class changes made for 2026 Isle of Man TT - Crash.net,Crash.net
"Tue, 02 Sep 2025 15:51:00 GMT",This Is Audi's New TT Concept Before You're Supposed To See It - MSN,MSN
"Tue, 02 Sep 2025 13:44:00 GMT",The Audi TT Seems Poised For A Comeback - HotCars,HotCars
"Thu, 04 Sep 2025 08:17:57 GMT",Rider calls for Isle of Man TT organisers to “get creative” after recent cancellations - Crash.net,Crash.net
2025-09-04T15:00:00,The ROI of Sustainability: A CFO's Perspective,Yahoo
2025-09-04T11:44:23,Trane Technologies Stock: Is TT Outperforming the Industrial Sector?,Yahoo
2025-09-03T15:00:20,Will Weakness in Trane Technologies plc's (NYSE:TT) Stock Prove Temporary Given Strong Fundamentals?,Yahoo
