Date,Title,Source
2025-09-29T08:04:59Z,"Arista Networks, Inc. $ANET Shares Bought by Kathmere Capital Management LLC",ETF Daily News
2025-09-27T18:19:31Z,Arista Networks Delivers Strong Q2 Results as Price Target Rises Despite Headwinds,Yahoo Entertainment
2025-09-27T06:40:50Z,Arista Networks (NYSE:ANET) Upgraded to “Outperform” at BNP Paribas Exane,ETF Daily News
2025-09-27T04:58:50Z,Where is Arista Networks (ANET) Headed According to Analysts?,Yahoo Entertainment
2025-09-26T05:28:54Z,Arista Networks (NYSE:ANET) Shares Down 1.1% After Insider Selling,ETF Daily News
2025-09-25T20:05:48Z,$1000 Invested In Arista Networks 10 Years Ago Would Be Worth This Much Today,Biztoc.com
"Sat, 27 Sep 2025 04:58:50 GMT",Where is Arista Networks (ANET) Headed According to Analysts? - Yahoo Finance,Yahoo Finance
"Mon, 29 Sep 2025 10:52:45 GMT","Archford Capital Strategies LLC Trims Stock Holdings in Arista Networks, Inc. $ANET - MarketBeat",MarketBeat
"Fri, 26 Sep 2025 12:22:00 GMT",Arista Networks (ANET) was upgraded to a Buy Rating at Mizuho Securities - The Globe and Mail,The Globe and Mail
"Sun, 28 Sep 2025 11:00:11 GMT",Is Now An Opportune Moment To Examine Arista Networks Inc (NYSE:ANET)? - Yahoo Finance,Yahoo Finance
"Sat, 27 Sep 2025 05:19:56 GMT",Where is Arista Networks (ANET) Headed According to Analysts? - MSN,MSN
"Mon, 29 Sep 2025 09:18:42 GMT","Arista Networks, Inc. $ANET Stock Position Raised by Moody Lynn & Lieberson LLC - MarketBeat",MarketBeat
"Mon, 29 Sep 2025 10:14:12 GMT","Generate Investment Management Ltd Sells 56,161 Shares of Arista Networks, Inc. $ANET - MarketBeat",MarketBeat
"Mon, 29 Sep 2025 09:22:46 GMT","Clean Yield Group Increases Stock Holdings in Arista Networks, Inc. $ANET - MarketBeat",MarketBeat
"Mon, 29 Sep 2025 08:45:12 GMT","2,675 Shares in Arista Networks, Inc. $ANET Acquired by TBH Global Asset Management LLC - MarketBeat",MarketBeat
"Sun, 28 Sep 2025 13:03:18 GMT","2,769 Shares in Arista Networks, Inc. $ANET Purchased by Symmetry Partners LLC - MarketBeat",MarketBeat
"Sun, 28 Sep 2025 13:19:28 GMT","Arista Networks, Inc. $ANET Shares Acquired by Smith Salley Wealth Management - MarketBeat",MarketBeat
"Sat, 27 Sep 2025 09:43:26 GMT","Arista Networks, Inc. $ANET Shares Sold by TD Private Client Wealth LLC - MarketBeat",MarketBeat
"Sat, 27 Sep 2025 09:26:43 GMT","Spirepoint Private Client LLC Buys 132,657 Shares of Arista Networks, Inc. $ANET - MarketBeat",MarketBeat
"Sat, 27 Sep 2025 09:42:10 GMT","Patton Fund Management Inc. Invests $289,000 in Arista Networks, Inc. $ANET - MarketBeat",MarketBeat
"Fri, 26 Sep 2025 09:16:19 GMT","Owen LaRue LLC Acquires New Shares in Arista Networks, Inc. $ANET - MarketBeat",MarketBeat
"Fri, 26 Sep 2025 09:16:23 GMT","Five Oceans Advisors Makes New Investment in Arista Networks, Inc. $ANET - MarketBeat",MarketBeat
"Fri, 26 Sep 2025 09:16:09 GMT","Arista Networks, Inc. $ANET Shares Acquired by Dakota Wealth Management - MarketBeat",MarketBeat
"Fri, 26 Sep 2025 09:16:09 GMT","Congress Asset Management Co. Cuts Position in Arista Networks, Inc. $ANET - MarketBeat",MarketBeat
"Thu, 25 Sep 2025 09:31:48 GMT","Harrell Investment Partners LLC Boosts Position in Arista Networks, Inc. $ANET - MarketBeat",MarketBeat
"Thu, 25 Sep 2025 10:30:03 GMT","Arlington Capital Management Inc. Cuts Stake in Arista Networks, Inc. $ANET - MarketBeat",MarketBeat
"Thu, 25 Sep 2025 08:00:26 GMT","Arista Networks, Inc. $ANET Shares Sold by U.S. Capital Wealth Advisors LLC - MarketBeat",MarketBeat
"Thu, 25 Sep 2025 09:14:08 GMT","Signet Financial Management LLC Sells 13,252 Shares of Arista Networks, Inc. $ANET - MarketBeat",MarketBeat
"Thu, 25 Sep 2025 08:20:41 GMT","Counterpoint Mutual Funds LLC Buys Shares of 3,135 Arista Networks, Inc. $ANET - MarketBeat",MarketBeat
"Thu, 25 Sep 2025 12:55:44 GMT",Arista Networks (NYSE:ANET) Upgraded to Outperform at BNP Paribas Exane - MarketBeat,MarketBeat
"Thu, 25 Sep 2025 10:31:00 GMT","BNP Paribas Upgrades Arista Networks(ANET.US) to Buy Rating, Announces Target Price $172 - 富途牛牛",富途牛牛
"Mon, 29 Sep 2025 09:53:12 GMT","Norris Perne & French LLP MI Buys Shares of 62,671 Arista Networks, Inc. $ANET - MarketBeat",MarketBeat
"Mon, 29 Sep 2025 08:50:41 GMT","Sonora Investment Management Group LLC Makes New Investment in Arista Networks, Inc. $ANET - MarketBeat",MarketBeat
"Sun, 28 Sep 2025 09:17:25 GMT","State of Alaska Department of Revenue Trims Position in Arista Networks, Inc. $ANET - MarketBeat",MarketBeat
"Mon, 29 Sep 2025 19:46:13 GMT",How ANET stock trades during market volatility - 2025 Winners & Losers & High Win Rate Trade Tips - newser.com,newser.com
"Mon, 29 Sep 2025 18:14:37 GMT",How risky is ANET stock compared to peers - Market Movers & Advanced Swing Trade Entry Plans - newser.com,newser.com
"Mon, 29 Sep 2025 16:39:10 GMT",Will ANET stock outperform foreign stocks - July 2025 Trends & Community Consensus Trade Alerts - newser.com,newser.com
"Mon, 29 Sep 2025 10:18:00 GMT",How risky is ANET stock compared to peers - Market Risk Report & Daily Growth Stock Tips - newser.com,newser.com
"Tue, 30 Sep 2025 04:30:12 GMT",Will ANET stock outperform foreign stocks - Weekly Trade Recap & High Conviction Investment Ideas - newser.com,newser.com
"Mon, 29 Sep 2025 06:52:50 GMT",Candlestick signals on ANET stock today - Market Performance Summary & Low Drawdown Trading Techniques - newser.com,newser.com
"Fri, 26 Sep 2025 21:50:38 GMT",How ANET stock trades during market volatility - Fed Meeting & Weekly Momentum Picks - newser.com,newser.com
"Fri, 26 Sep 2025 18:38:18 GMT",Will ANET stock outperform foreign stocks - Dip Buying & Long-Term Growth Stock Strategies - newser.com,newser.com
"Mon, 29 Sep 2025 11:27:49 GMT",Why ANET stock could see breakout soon - July 2025 Snapshot & Risk Controlled Daily Trade Plans - newser.com,newser.com
"Mon, 29 Sep 2025 07:03:57 GMT",How risky is ANET stock compared to peers - July 2025 Pullbacks & Low Drawdown Investment Strategies - newser.com,newser.com
"Mon, 29 Sep 2025 06:05:20 GMT",How risky is ANET stock compared to peers - 2025 Trading Recap & Precise Trade Entry Recommendations - newser.com,newser.com
"Fri, 26 Sep 2025 14:07:29 GMT",Is ANET stock at risk of policy regulation - 2025 Key Lessons & Safe Entry Trade Signal Reports - newser.com,newser.com
"Mon, 29 Sep 2025 08:28:34 GMT",How ANET stock trades during market volatility - Entry Point & Risk Managed Investment Signals - newser.com,newser.com
"Fri, 26 Sep 2025 06:45:34 GMT",Arista Networks (NYSE:ANET) Rating Increased to Outperform at BNP Paribas Exane - Defense World,Defense World
"Thu, 25 Sep 2025 15:06:38 GMT",Arista Networks (NYSE:ANET) Trading Down 1.1% After Insider Selling - Defense World,Defense World
2025-09-28T13:00:11,Is Now An Opportune Moment To Examine Arista Networks Inc (NYSE:ANET)?,Yahoo
2025-09-27T20:19:31,Arista Networks Delivers Strong Q2 Results as Price Target Rises Despite Headwinds,Yahoo
2025-09-27T06:58:50,Where is Arista Networks (ANET) Headed According to Analysts?,Yahoo
