Date,Title,Source
"Thu, 30 Oct 2025 20:31:28 GMT",Merck & Co Inc (MRK) Q3 2025 Earnings Call Highlights: Strong Revenue Growth Amidst Challenges - Yahoo! Finance Singapore,Yahoo! Finance Singapore
"Fri, 31 Oct 2025 04:54:01 GMT",How buyback programs support Merck KGaA (MRK) stock - Gold Moves & Low Risk High Reward Ideas - newser.com,newser.com
"Thu, 30 Oct 2025 13:20:41 GMT","Merck: Wall Street Surprised By Q3 Strength, Keytruda Sales Surge (NYSE:MRK) - Seeking Alpha",Seeking Alpha
"Thu, 30 Oct 2025 16:41:00 GMT","MRK Beats Q3 Earnings Estimates, Narrows 2025 Sales View, Stock Down - Nasdaq",Nasdaq
"Fri, 31 Oct 2025 03:14:59 GMT","Merck & Co., Inc. (NYSE:MRK) Issues Earnings Results - MarketBeat",MarketBeat
"Thu, 30 Oct 2025 22:45:05 GMT",How Investors Are Reacting To Merck KGaA (XTRA:MRK) Partnering With Promega For 3D Drug Discovery Technologies - simplywall.st,simplywall.st
"Thu, 30 Oct 2025 18:06:12 GMT",Merck (MRK) Q3 Performance Highlights Growth and Strategic Acqui - GuruFocus,GuruFocus
"Thu, 30 Oct 2025 13:35:11 GMT",Merck (MRK) Q3 Earnings and Revenues Beat Estimates - sharewise.com,sharewise.com
"Thu, 30 Oct 2025 13:46:08 GMT",Merck’s (NYSE:MRK) Q3 Sales Top Estimates - Yahoo Finance,Yahoo Finance
"Thu, 30 Oct 2025 10:48:49 GMT",Merck stock dips after narrowing full-year sales outlook (MRK:NYSE) - Seeking Alpha,Seeking Alpha
"Thu, 30 Oct 2025 13:30:00 GMT",Merck (MRK) Reports Q3 Earnings: What Key Metrics Have to Say - Nasdaq,Nasdaq
"Thu, 30 Oct 2025 14:15:33 GMT",Merck (MRK) Shares Decline Despite Strong Q3 Earnings - GuruFocus,GuruFocus
"Thu, 30 Oct 2025 12:29:41 GMT","Merck & Co., Inc. (NYSE:MRK) Releases FY 2025 Earnings Guidance - MarketBeat",MarketBeat
"Mon, 27 Oct 2025 13:15:05 GMT",Merck (MRK) Q3 Earnings Preview: What You Should Know Beyond the Headline Estimates - Yahoo Finance,Yahoo Finance
"Thu, 30 Oct 2025 11:57:59 GMT",Merck (MRK) Stock Dips Despite Beating Q3 Expectations - GuruFocus,GuruFocus
"Tue, 28 Oct 2025 16:37:00 GMT","Buy, Sell or Hold MRK Stock Ahead of Q3 Earnings? Things to Know - Yahoo Finance",Yahoo Finance
"Thu, 30 Oct 2025 12:08:27 GMT","Strs Ohio Has $83.74 Million Position in Merck & Co., Inc. $MRK - MarketBeat",MarketBeat
"Thu, 30 Oct 2025 11:30:21 GMT","Atria Investments Inc Acquires 3,917 Shares of Merck & Co., Inc. $MRK - MarketBeat",MarketBeat
"Thu, 30 Oct 2025 12:16:06 GMT",Merck (MRK) Sees Earnings Beat Amid Sales Outlook Adjustment - GuruFocus,GuruFocus
"Thu, 30 Oct 2025 13:34:28 GMT","Merck & Co., Inc. (MRK) Stock: Q3 Profit Jumps 83% as Oncology and Animal Health Drive Growth - CoinCentral",CoinCentral
"Tue, 28 Oct 2025 15:57:55 GMT","Buy, Sell or Hold MRK Stock Ahead of Q3 Earnings? Things to Know - Zacks Investment Research",Zacks Investment Research
"Thu, 30 Oct 2025 11:32:34 GMT","Merck (MRK) Surpasses Q3 Expectations, Raises Full-Year Guidance - GuruFocus",GuruFocus
"Thu, 30 Oct 2025 11:32:32 GMT",Merck (MRK) Surpasses Q3 Earnings and Revenue Expectations - GuruFocus,GuruFocus
"Thu, 30 Oct 2025 11:44:48 GMT","Amalgamated Bank Has $38.42 Million Stake in Merck & Co., Inc. $MRK - MarketBeat",MarketBeat
"Thu, 30 Oct 2025 14:01:28 GMT",Merck (MRK.US) reported better-than-expected results for the previous quarter but lowered its full-year guidance. - 富途牛牛,富途牛牛
"Thu, 30 Oct 2025 10:58:29 GMT",Merck (MRK) Surpasses Revenue Expectations in Q3 with Strategic Developments - GuruFocus,GuruFocus
"Thu, 30 Oct 2025 11:10:21 GMT","Noesis Capital Mangement Corp Grows Holdings in Merck & Co., Inc. $MRK - MarketBeat",MarketBeat
"Thu, 30 Oct 2025 10:32:05 GMT","Hantz Financial Services Inc. Lowers Position in Merck & Co., Inc. $MRK - MarketBeat",MarketBeat
"Thu, 30 Oct 2025 10:12:03 GMT","Bristlecone Advisors LLC Sells 18,975 Shares of Merck & Co., Inc. $MRK - MarketBeat",MarketBeat
"Thu, 30 Oct 2025 11:32:32 GMT",Merck (MRK) Revises FY25 Revenue Forecast - GuruFocus,GuruFocus
"Thu, 30 Oct 2025 10:32:15 GMT",Merck (MRK) Tops Q3 EPS by 23c; narrows forecast - StreetInsider,StreetInsider
"Thu, 30 Oct 2025 12:00:42 GMT",Merck (MRK) Stock Dips on Earnings Beat — Will Pipeline Boost Spur a Rally? - ts2.tech,ts2.tech
"Thu, 30 Oct 2025 10:10:04 GMT","World Investment Advisors Cuts Stock Holdings in Merck & Co., Inc. $MRK - MarketBeat",MarketBeat
"Mon, 27 Oct 2025 13:19:00 GMT",JNJ vs. MRK: Which Blue-Chip Pharma Stock Should Be in Your Portfolio? - Yahoo Finance,Yahoo Finance
"Tue, 28 Oct 2025 11:10:25 GMT",Does FDA’s Broader WINREVAIR Approval Strengthen Merck’s (MRK) Cardio-Pulmonary Pipeline Narrative? - Yahoo Finance,Yahoo Finance
"Thu, 30 Oct 2025 15:51:37 GMT","5 stocks to watch on Thursday: MO, LLY, MRK, AMZN, AAPL - MSN",MSN
"Wed, 29 Oct 2025 03:16:00 GMT",Merck (MRK) Reports Earnings Tomorrow: What To Expect - Yahoo! Finance UK,Yahoo! Finance UK
"Tue, 28 Oct 2025 13:42:22 GMT",The Bull Case For Merck (MRK) Could Change Following Keytruda and WINREVAIR Milestones—Learn Why - simplywall.st,simplywall.st
"Tue, 28 Oct 2025 21:07:00 GMT","MERCK Earnings Preview: Recent $MRK Insider Trading, Hedge Fund Activity, and More - Quiver Quantitative",Quiver Quantitative
"Wed, 29 Oct 2025 11:45:23 GMT","Merck & Co., Inc. $MRK Shares Bought by Buck Wealth Strategies LLC - MarketBeat",MarketBeat
"Wed, 29 Oct 2025 02:33:00 GMT",Will MRK stock extend growth story - Portfolio Performance Report & Stock Market Timing Techniques - newser.com,newser.com
"Wed, 29 Oct 2025 17:10:27 GMT",Merck (MRK) Poised for Q3 Earnings Report as Keytruda Expansion Looms - GuruFocus,GuruFocus
"Thu, 30 Oct 2025 11:02:00 GMT",Merck Q3 2025 Earnings: Profit and Revenue Beat Forecasts | MRK - News and Statistics - IndexBox,IndexBox
"Wed, 29 Oct 2025 10:01:59 GMT","Merck & Co., Inc. $MRK Shares Acquired by Motco - MarketBeat",MarketBeat
"Mon, 27 Oct 2025 12:32:48 GMT",JNJ vs. MRK: Which Blue-Chip Pharma Stock Should Be in Your Portfolio? - Zacks Investment Research,Zacks Investment Research
"Thu, 30 Oct 2025 10:49:05 GMT","(MRK) Merck Expects Full-Year Adjusted EPS Range $8.93 to $8.98, vs. FactSet Est of $8.91 - MarketScreener",MarketScreener
"Thu, 30 Oct 2025 10:50:49 GMT","Earnings Flash (MRK) Merck & Co., Inc., Rahway, N.J., USA Reports Q3 Revenue $17.28B, vs. FactSet Est of $16.97B - MarketScreener",MarketScreener
"Thu, 30 Oct 2025 10:50:28 GMT","Earnings Flash (MRK) Merck & Co., Inc., Rahway, N.J., USA Posts Q3 Adjusted EPS $2.58 per Share, vs. FactSet Est of $2.35 - MarketScreener",MarketScreener
"Wed, 29 Oct 2025 08:55:28 GMT","GWN Securities Inc. Sells 54,349 Shares of Merck & Co., Inc. $MRK - MarketBeat",MarketBeat
"Wed, 29 Oct 2025 09:19:47 GMT","Howard Capital Management Inc. Boosts Holdings in Merck & Co., Inc. $MRK - MarketBeat",MarketBeat
"Wed, 29 Oct 2025 09:47:51 GMT","Auto Owners Insurance Co Trims Stake in Merck & Co., Inc. $MRK - MarketBeat",MarketBeat
"Wed, 29 Oct 2025 03:16:00 GMT",Merck (MRK) Reports Earnings Tomorrow: What To Expect - FinancialContent,FinancialContent
"Tue, 28 Oct 2025 09:18:25 GMT","Liberty Wealth Management LLC Reduces Holdings in Merck & Co., Inc. $MRK - MarketBeat",MarketBeat
"Wed, 29 Oct 2025 13:09:08 GMT",Merck (MRK) and Eisai Conclude Keytruda-Lenvima Trial for Liver Cancer - GuruFocus,GuruFocus
"Tue, 28 Oct 2025 11:15:56 GMT","Merck & Co., Inc. $MRK Shares Sold by Tevis Investment Management - MarketBeat",MarketBeat
"Tue, 28 Oct 2025 10:47:03 GMT","Merck & Co., Inc. $MRK Shares Sold by Private Wealth Partners LLC - MarketBeat",MarketBeat
"Tue, 28 Oct 2025 10:09:28 GMT","Merck & Co., Inc. $MRK Shares Sold by Logan Capital Management Inc. - MarketBeat",MarketBeat
"Tue, 28 Oct 2025 09:10:31 GMT","Bessemer Group Inc. Decreases Stock Position in Merck & Co., Inc. $MRK - MarketBeat",MarketBeat
"Tue, 28 Oct 2025 11:11:59 GMT","Merck & Co., Inc. $MRK Shares Purchased by New York Life Investment Management LLC - MarketBeat",MarketBeat
"Thu, 30 Oct 2025 09:14:15 GMT",Stocks expected to have increasing option volume: MRK LLY GILD MA STLA HSY RDDT CI MSTR AMZN AAPL CMG WOLF - StreetInsider,StreetInsider
"Wed, 29 Oct 2025 14:07:20 GMT",Merck (MRK) Ends Cancer Drug Trial Due to Lack of Survival Benef - GuruFocus,GuruFocus
"Wed, 29 Oct 2025 11:58:34 GMT",Merck (MRK) Gains EU Approval for Keytruda in Head and Neck Canc - GuruFocus,GuruFocus
"Tue, 28 Oct 2025 16:37:00 GMT","Buy, Sell or Hold MRK Stock Ahead of Q3 Earnings? Things to Know - sharewise.com",sharewise.com
"Tue, 28 Oct 2025 14:53:00 GMT","Notable ETF Outflow Detected - SCHD, LMT, PEP, MRK - Nasdaq",Nasdaq
"Tue, 28 Oct 2025 10:57:18 GMT","Merck, Eisai combo meets key goal in advanced kidney cancer trial (MRK:NYSE) - Seeking Alpha",Seeking Alpha
"Mon, 27 Oct 2025 13:15:26 GMT",Merck gets FDA nod to expand Winrevair label (MRK:NYSE) - Seeking Alpha,Seeking Alpha
"Mon, 27 Oct 2025 10:06:49 GMT","Banco Santander S.A. Grows Stock Holdings in Merck & Co., Inc. $MRK - MarketBeat",MarketBeat
"Mon, 27 Oct 2025 23:51:26 GMT",Panic Selling: Will MRK stock benefit from sector leadership - 2025 Market Outlook & Weekly Breakout Watchlists - Fundação Cultural do Pará,Fundação Cultural do Pará
"Mon, 27 Oct 2025 10:46:05 GMT","Merck & Co., Inc. $MRK Stock Position Trimmed by Transcend Capital Advisors LLC - MarketBeat",MarketBeat
"Tue, 28 Oct 2025 11:42:30 GMT",Merck (MRK) Phase 3 Trial Surpasses Key Milestones in Renal Canc - GuruFocus,GuruFocus
"Mon, 27 Oct 2025 11:02:09 GMT","Merck & Co., Inc. $MRK Shares Bought by AustralianSuper Pty Ltd - MarketBeat",MarketBeat
"Wed, 29 Oct 2025 07:52:15 GMT",Can MRK stock hit consensus price targets - 2025 Fundamental Recap & Safe Swing Trade Setup Alerts - newser.com,newser.com
"Sun, 26 Oct 2025 22:58:59 GMT",Why MRK stock fits value portfolios - 2025 Analyst Calls & Detailed Earnings Play Strategies - newser.com,newser.com
"Mon, 27 Oct 2025 10:30:16 GMT","Merck & Co., Inc. $MRK Position Trimmed by Schmidt P J Investment Management Inc. - MarketBeat",MarketBeat
"Mon, 27 Oct 2025 10:30:05 GMT","Oak Grove Capital LLC Decreases Position in Merck & Co., Inc. $MRK - MarketBeat",MarketBeat
"Tue, 28 Oct 2025 11:30:05 GMT","Redmond Asset Management LLC Increases Stock Position in Merck & Co., Inc. $MRK - MarketBeat",MarketBeat
"Mon, 27 Oct 2025 09:17:08 GMT","Merck & Co., Inc. $MRK Shares Acquired by Wealthfront Advisers LLC - MarketBeat",MarketBeat
"Tue, 28 Oct 2025 11:32:41 GMT",Merck (MRK) Achieves Positive Results in Keytruda Cancer Trial - GuruFocus,GuruFocus
"Mon, 27 Oct 2025 10:16:17 GMT","Garland Capital Management Inc. Cuts Position in Merck & Co., Inc. $MRK - MarketBeat",MarketBeat
"Tue, 28 Oct 2025 12:02:37 GMT",Merck (MRK) and Eisai Report Positive Results in Kidney Cancer T - GuruFocus,GuruFocus
"Tue, 28 Oct 2025 07:59:10 GMT",What RSI levels show for MRK stock - 2025 EndofYear Setup & Safe Swing Trade Setups - newser.com,newser.com
"Sun, 26 Oct 2025 13:18:49 GMT","QV Investors Inc. Buys 36,910 Shares of Merck & Co., Inc. $MRK - MarketBeat",MarketBeat
"Mon, 27 Oct 2025 14:05:56 GMT",Merck (MRK) Receives FDA Approval for Expanded Use of Winrevair - GuruFocus,GuruFocus
"Tue, 28 Oct 2025 11:16:41 GMT",What RSI levels show for MRK stock - July 2025 WrapUp & Community Trade Idea Sharing Platform - newser.com,newser.com
"Mon, 27 Oct 2025 13:19:00 GMT",JNJ vs. MRK: Which Blue-Chip Pharma Stock Should Be in Your Portfolio? - sharewise.com,sharewise.com
"Tue, 28 Oct 2025 07:32:00 GMT","Berenberg Bank Maintains Merck & Co(MRK.US) With Hold Rating, Maintains Target Price $90 - 富途牛牛",富途牛牛
"Mon, 27 Oct 2025 09:31:42 GMT","Envestnet Asset Management Inc. Has $296.48 Million Position in Merck & Co., Inc. $MRK - MarketBeat",MarketBeat
"Sun, 26 Oct 2025 11:31:12 GMT","Brighton Jones LLC Grows Stock Position in Merck & Co., Inc. $MRK - MarketBeat",MarketBeat
"Sun, 26 Oct 2025 12:11:05 GMT","Ingalls & Snyder LLC Decreases Stake in Merck & Co., Inc. $MRK - MarketBeat",MarketBeat
"Mon, 27 Oct 2025 07:52:37 GMT",Why MRK stock fits value portfolios - 2025 Retail Activity & Real-Time Volume Triggers - newser.com,newser.com
"Sun, 26 Oct 2025 13:10:35 GMT","Prudent Man Advisors LLC Buys 2,989 Shares of Merck & Co., Inc. $MRK - MarketBeat",MarketBeat
2025-10-30T17:41:00,"MRK Beats Q3 Earnings Estimates, Narrows 2025 Sales View, Stock Down",Yahoo
2025-10-30T14:46:08,Merck’s (NYSE:MRK) Q3 Sales Top Estimates,Yahoo
2025-10-30T14:36:24,"Merck & Co., Inc. (MRK) Q3 2025 Earnings Call Transcript",SeekingAlpha
2025-10-30T14:30:12,Merck (MRK) Reports Q3 Earnings: What Key Metrics Have to Say,Yahoo
2025-10-30T14:25:30,"Novo Nordisk's bid for Metsera, Eli Lilly boosts revenue outlook",Yahoo
2025-10-30T12:45:02,Merck (MRK) Q3 Earnings and Revenues Beat Estimates,Yahoo
2025-10-30T11:48:32,Merck: Q3 Earnings Snapshot,Yahoo
2025-10-30T10:20:41,"Merck: Wall Street Surprised By Q3 Strength, Keytruda Sales Surge",SeekingAlpha
2025-10-29T11:45:00,European Commission Approves KEYTRUDA® (pembrolizumab) as Part of a Treatment Regimen for Adults with Resectable Locally Advanced Head and Neck Squamous Cell Carcinoma (LA-HNSCC) Expressing PD-L1 (CPS >1),Yahoo
2025-10-29T04:16:15,Merck (MRK) Reports Earnings Tomorrow: What To Expect,Yahoo
2025-10-28T17:37:00,"Buy, Sell or Hold MRK Stock Ahead of Q3 Earnings? Things to Know",Yahoo
2025-10-28T12:10:25,Does FDA’s Broader WINREVAIR Approval Strengthen Merck’s (MRK) Cardio-Pulmonary Pipeline Narrative?,Yahoo
2025-10-27T16:45:02,Are You Looking for a High-Growth Dividend Stock?,Yahoo
2025-10-27T16:05:00,What's in Store for These 5 Pharma Bigwigs This Earnings Season?,Yahoo
2025-10-27T14:19:00,JNJ vs. MRK: Which Blue-Chip Pharma Stock Should Be in Your Portfolio?,Yahoo
2025-10-27T14:15:05,Merck (MRK) Q3 Earnings Preview: What You Should Know Beyond the Headline Estimates,Yahoo
2025-10-27T11:45:00,"U.S. FDA Approves Updated Indication for WINREVAIR™ (sotatercept-csrk) in Adults with Pulmonary Arterial Hypertension (PAH, WHO* Group 1 Pulmonary Hypertension) Based on Phase 3 ZENITH Study",Yahoo
