Date,Title,Source
2025-09-29T08:00:54Z,"CX Institutional Grows Holdings in Regeneron Pharmaceuticals, Inc. $REGN",ETF Daily News
2025-09-26T15:00:53Z,FDA Expands Use Of Regeneron's Evkeeza To Infants With Rare Cholesterol Disorder,Biztoc.com
"Mon, 29 Sep 2025 14:43:14 GMT",Here’s Why Regeneron Pharmaceuticals (REGN) Fell in Q2 - Yahoo Finance,Yahoo Finance
"Sat, 27 Sep 2025 20:52:57 GMT",REGN Stock Price and Chart — NASDAQ:REGN - TradingView,TradingView
"Mon, 29 Sep 2025 18:53:58 GMT",Regeneron (REGN) Gains Attention With Successful Phase 3 Garetosmab Trial for Rare Disease - Yahoo Finance,Yahoo Finance
"Mon, 29 Sep 2025 10:14:09 GMT","12,000 Shares in Regeneron Pharmaceuticals, Inc. $REGN Acquired by Generate Investment Management Ltd - MarketBeat",MarketBeat
"Sat, 27 Sep 2025 20:44:36 GMT",Revisiting Regeneron (REGN) Valuation After Court Setback on EYLEA and Regulatory Concerns - simplywall.st,simplywall.st
"Thu, 25 Sep 2025 15:19:00 GMT",November 7th Options Now Available For Regeneron Pharmaceuticals (REGN) - Nasdaq,Nasdaq
"Tue, 30 Sep 2025 02:39:55 GMT",What drives REGN stock price - Sector Performance Drivers & Low Entry Cost Investments - earlytimes.in,earlytimes.in
"Fri, 26 Sep 2025 13:12:38 GMT","4 stocks to watch on Friday: META, COST, REGN, XOM - MSN",MSN
"Fri, 26 Sep 2025 11:35:12 GMT",Regeneron (REGN) Gains FDA Approval for Evkeeza Expansion to You - GuruFocus,GuruFocus
"Fri, 26 Sep 2025 11:32:47 GMT",Regeneron wins FDA label expansion for Evkeeza (REGN:NASDAQ) - Seeking Alpha,Seeking Alpha
"Mon, 29 Sep 2025 12:28:00 GMT",FDA Approves Label Extension of REGN's Cholesterol Drug Evkeeza - Yahoo Finance,Yahoo Finance
"Sat, 27 Sep 2025 10:01:24 GMT","Perigon Wealth Management LLC Sells 1,432 Shares of Regeneron Pharmaceuticals, Inc. $REGN - MarketBeat",MarketBeat
"Thu, 25 Sep 2025 20:51:00 GMT",Why Regeneron (REGN) Shares Are Falling Today - The Globe and Mail,The Globe and Mail
"Sat, 27 Sep 2025 10:01:24 GMT","Flower City Capital Takes $262,000 Position in Regeneron Pharmaceuticals, Inc. $REGN - MarketBeat",MarketBeat
"Fri, 26 Sep 2025 10:49:48 GMT","Regeneron Pharmaceuticals, Inc. $REGN Shares Sold by Meyer Handelman Co. - MarketBeat",MarketBeat
"Fri, 26 Sep 2025 10:24:33 GMT","Fifth Third Bancorp Buys 2,443 Shares of Regeneron Pharmaceuticals, Inc. $REGN - MarketBeat",MarketBeat
"Fri, 26 Sep 2025 12:09:50 GMT",FDA Expands Use of Regeneron's (REGN) Evkeeza for Young Children - GuruFocus,GuruFocus
"Thu, 25 Sep 2025 09:31:52 GMT","Harrell Investment Partners LLC Makes New Investment in Regeneron Pharmaceuticals, Inc. $REGN - MarketBeat",MarketBeat
"Thu, 25 Sep 2025 09:39:51 GMT","Beacon Investment Advisory Services Inc. Has $12.35 Million Stock Position in Regeneron Pharmaceuticals, Inc. $REGN - MarketBeat",MarketBeat
"Thu, 25 Sep 2025 08:10:50 GMT",Forest Dept. Invalidated Experience Certificate due to Belated Regn. of Company: Chhattisgarh HC Holds GST Regn. Proves Employer’s Validity [Read Order] - Taxscan,Taxscan
"Tue, 30 Sep 2025 06:15:06 GMT",Why REGN stock could benefit from AI revolution - July 2025 Fed Impact & Stock Portfolio Risk Management - newser.com,newser.com
"Tue, 30 Sep 2025 05:02:27 GMT",Will REGN stock benefit from automation - Market Sentiment Review & Real-Time Stock Price Movement Reports - newser.com,newser.com
"Mon, 29 Sep 2025 19:04:27 GMT",Regeneron (REGN) Gains Attention With Successful Phase 3 Garetosmab Trial for Rare Disease - Insider Monkey,Insider Monkey
"Mon, 29 Sep 2025 16:16:08 GMT",Is it too late to sell REGN - Jobs Report & Free Accurate Trade Setup Notifications - newser.com,newser.com
"Mon, 29 Sep 2025 17:56:42 GMT",Will REGN stock go up soon - July 2025 Recap & Technical Pattern Based Buy Signals - newser.com,newser.com
"Mon, 29 Sep 2025 14:46:26 GMT",Here’s Why Regeneron Pharmaceuticals (REGN) Fell in Q2 - Insider Monkey,Insider Monkey
"Mon, 29 Sep 2025 12:02:33 GMT",Why retail investors pile into REGN stock - Portfolio Value Report & Expert Approved Momentum Ideas - newser.com,newser.com
"Mon, 29 Sep 2025 14:45:09 GMT",How high can REGN stock go - 2025 Momentum Check & Reliable Entry Point Trade Alerts - newser.com,newser.com
"Tue, 30 Sep 2025 05:40:22 GMT",Will REGN stock reach all time highs in 2025 - July 2025 Update & Consistent Profit Alerts - newser.com,newser.com
"Tue, 30 Sep 2025 04:58:12 GMT",Is it too late to sell REGN - Quarterly Portfolio Report & Technical Confirmation Alerts - newser.com,newser.com
"Sat, 27 Sep 2025 19:48:28 GMT",Will REGN stock reach all time highs in 2025 - Weekly Stock Recap & Low Drawdown Momentum Ideas - newser.com,newser.com
"Sat, 27 Sep 2025 21:13:35 GMT",Will REGN stock benefit from automation - July 2025 Snapshot & Capital Efficient Trading Techniques - newser.com,newser.com
"Mon, 29 Sep 2025 19:54:04 GMT",Why retail investors pile into REGN stock - July 2025 Review & AI Optimized Trade Strategies - newser.com,newser.com
"Sun, 28 Sep 2025 07:00:03 GMT",Why retail investors pile into REGN stock - Quarterly Market Summary & Stepwise Swing Trade Plans - newser.com,newser.com
"Mon, 29 Sep 2025 09:54:26 GMT",Is it too late to sell REGN - 2025 AllTime Highs & Verified Chart Pattern Trade Signals - newser.com,newser.com
"Mon, 29 Sep 2025 05:53:27 GMT",Risk vs reward if holding onto REGN - Earnings Growth Summary & Entry Point Strategy Guides - newser.com,newser.com
"Mon, 29 Sep 2025 12:55:27 GMT",Will REGN stock go up soon - 2025 Major Catalysts & Breakout Confirmation Trade Signals - newser.com,newser.com
"Mon, 29 Sep 2025 11:27:52 GMT",How REGN stock valuations compare to rivals - CEO Change & Fast Momentum Stock Entry Tips - newser.com,newser.com
"Mon, 29 Sep 2025 10:33:56 GMT",Risk vs reward if holding onto REGN - Portfolio Risk Report & Reliable Entry Point Alerts - newser.com,newser.com
"Mon, 29 Sep 2025 11:58:59 GMT",Why REGN stock is a value investor pick - July 2025 News Drivers & AI Based Buy/Sell Signal Reports - newser.com,newser.com
"Mon, 29 Sep 2025 04:19:58 GMT",Will REGN stock go up soon - Trade Exit Summary & Technical Confirmation Trade Alerts - newser.com,newser.com
"Mon, 29 Sep 2025 07:07:22 GMT",Why retail investors pile into REGN stock - 2025 Market Outlook & Fast Momentum Stock Entry Tips - newser.com,newser.com
"Mon, 29 Sep 2025 09:54:01 GMT",How REGN stock valuations compare to rivals - July 2025 Fed Impact & Advanced Technical Signal Analysis - newser.com,newser.com
"Mon, 29 Sep 2025 05:07:47 GMT",How REGN stock valuations compare to rivals - Take Profit & Expert Curated Trade Setup Alerts - newser.com,newser.com
"Mon, 29 Sep 2025 04:55:11 GMT",Why REGN stock could benefit from AI revolution - Options Play & Advanced Swing Trade Entry Plans - newser.com,newser.com
"Thu, 25 Sep 2025 09:26:23 GMT","Regeneron Pharmaceuticals, Inc. $REGN Shares Sold by Wealth Enhancement Advisory Services LLC - Defense World",Defense World
2025-09-29T16:43:14,Here’s Why Regeneron Pharmaceuticals (REGN) Fell in Q2,Yahoo
2025-09-29T14:28:00,FDA Approves Label Extension of REGN's Cholesterol Drug Evkeeza,Yahoo
2025-09-27T11:00:32,Regeneron: Strong R&D Pipeline Drives Growth Outlook,SeekingAlpha
2025-09-25T22:51:02,Why Regeneron (REGN) Shares Are Falling Today,Yahoo
