Date,Title,Source
"Tue, 09 Dec 2025 20:21:00 GMT",New Analyst Forecast: $NKE Given $70 Price Target - Quiver Quantitative,Quiver Quantitative
"Tue, 09 Dec 2025 00:17:16 GMT",Reassessing Nike (NKE) Valuation After a Steady Earnings Expansion and Share Price Pullback - simplywall.st,simplywall.st
"Tue, 09 Dec 2025 12:47:24 GMT","32,316 Shares in NIKE, Inc. $NKE Acquired by SVB Wealth LLC - MarketBeat",MarketBeat
"Tue, 09 Dec 2025 20:53:03 GMT","NKE: Citigroup Lowers Price Target, Maintains Neutral Rating | N - GuruFocus",GuruFocus
"Mon, 08 Dec 2025 01:19:42 GMT",Nike’s (NKE) Turnaround Heats Up at Just the Right Time - TipRanks,TipRanks
"Sun, 07 Dec 2025 15:00:02 GMT","As Nike Shakes Up Its C-Suite, Should You Buy, Sell, or Hold NKE Stock? - Yahoo Finance",Yahoo Finance
"Tue, 09 Dec 2025 20:46:02 GMT",NIKE (NYSE:NKE) Price Target Lowered to $70.00 at Citigroup - MarketBeat,MarketBeat
"Mon, 08 Dec 2025 12:57:32 GMT","WINTON GROUP Ltd Has $19.16 Million Holdings in NIKE, Inc. $NKE - MarketBeat",MarketBeat
"Tue, 09 Dec 2025 10:35:04 GMT","Fayez Sarofim & Co Has $150.12 Million Position in NIKE, Inc. $NKE - MarketBeat",MarketBeat
"Sun, 07 Dec 2025 08:15:29 GMT","Amundi Has $213.98 Million Stock Holdings in NIKE, Inc. $NKE - MarketBeat",MarketBeat
2025-12-10T13:03:39,Guggenheim Initiates Coverage of NIKE (NKE) with Buy Recommendation,Fintel
2025-12-08T15:14:24,Nike Beats Estimates by 81% While Under Armour Swings to Loss,Yahoo
2025-12-10T19:40:38,NKE vs LULU. Earnings coming up.,Reddit/r/StockMarket
