Date,Title,Source
"Tue, 09 Dec 2025 14:04:00 GMT",Qualcomm Stock (QCOM) Opinions on AI Chip Launch and Market Growth - Quiver Quantitative,Quiver Quantitative
"Sun, 07 Dec 2025 08:24:53 GMT","Qualcomm (QCOM): Reassessing Valuation After Strong Results and Growing AI, Automotive and IoT Momentum - simplywall.st",simplywall.st
"Sat, 06 Dec 2025 02:34:28 GMT",What QUALCOMM (QCOM)'s AI and Automotive Expansion Drive Means For Shareholders - simplywall.st,simplywall.st
2025-12-05T17:30:24,Why Is Qualcomm (QCOM) Up 0.7% Since Last Earnings Report?,Yahoo
2025-12-05T04:10:24,QUALCOMM Incorporated (QCOM) Gains Analyst Confidence as AI and Data Center Strategy Accelerates,Yahoo
2025-11-26T19:49:52+00:00,Citi Maintains a Hold on QUALCOMM Incorporated (QCOM),Insider Monkey
2025-09-03T00:35:00+00:00,Arete Upgrades QUALCOMM (QCOM) Stock to Buy From Neutral,Insider Monkey
2025-11-10T13:58:00+00:00,Should QCOM Stock Be Part of Your Portfolio Post Robust Q4 Earnings?,Nasdaq
