Date,Title,Source
2025-09-05T16:24:46Z,Why Broadcom Stock Popped on Earnings Today,Biztoc.com
2025-09-05T14:44:07Z,Is Broadcom the No. 1 AI Stock to Buy Now?,Biztoc.com
2025-09-05T14:22:48Z,"Broadcom CEO Stands Alongside Steve Jobs In Memorability, Says Analyst As He Hikes Target Price To $415",Wccftech
2025-09-05T14:21:24Z,"Nvidia Goes AWOL As Funds Feast On Broadcom, Google, Palantir — And Much More",Biztoc.com
2025-09-05T13:14:53Z,"Broadcom's Free Cash Flow Surges With Higher FCF Margins, Implying a 25% Higher Value for AVGO Stock",Biztoc.com
2025-09-05T13:09:47Z,AVGO: Broadcom Stock Climbs After Tops Estimates and Lifts Q4 Guide,Yahoo Entertainment
2025-09-05T13:00:02Z,"Broadcom's Free Cash Flow Surges With Higher FCF Margins, Implying a 25% Higher Value for AVGO Stock",Barchart.com
2025-09-05T12:41:19Z,"Futures: AI Giant Jumps Late, Jobs Data Due",Biztoc.com
2025-09-05T12:31:10Z,What's Going On With Marvell Technology Stock Friday?,Yahoo Entertainment
2025-09-05T10:54:26Z,What's Going On With Nvidia Stock Friday?,Yahoo Entertainment
2025-09-05T10:26:13Z,Broadcom: AVGO Stock’s Path To $600,Forbes
2025-09-05T09:20:17Z,Broadcom's CEO Hock Tan Declares 'The Network Is The Computer' — Says Ethernet Is The Backbone For AI Scale-Out,Biztoc.com
2025-09-05T06:03:09Z,Broadcom (NASDAQ:AVGO) Shares Acquired Rep. Cleo Fields,ETF Daily News
2025-09-05T06:03:06Z,Rep. Cleo Fields Buys Broadcom Inc. (NASDAQ:AVGO) Stock,ETF Daily News
2025-09-05T05:16:53Z,Broadcom (NASDAQ:AVGO) Trading 1.9% Higher Following Analyst Upgrade,ETF Daily News
2025-09-05T02:16:39Z,"Futures: AI Giant Jumps Late, Jobs Data Due",Biztoc.com
2025-09-05T01:42:59Z,OpenAI to produce own AI chips with Broadcom,Biztoc.com
2025-09-04T22:54:09Z,Broadcom (AVGO) Remains a Top Pick as Cantor Fitzgerald Lifts Price Target to $350,Yahoo Entertainment
2025-09-04T21:41:55Z,Broadcom Q3 earnings beat expectations driven by AI revenue - can its custom chips challenge Nvidia?,The Times of India
2025-09-04T21:04:30Z,"Wall Street's new semiconductor obsession, Broadcom, still has one thing that few other chipmakers company have",Biztoc.com
2025-09-04T20:53:01Z,"Broadcom forecasts fourth-quarter revenue above estimates, bolstered by strong demand",Biztoc.com
2025-09-04T20:32:29Z,Jim Cramer Believes Broadcom Inc. (AVGO) Just Has The Best CEO,Yahoo Entertainment
2025-09-04T19:12:29Z,Live: Complete Coverage of Broadcom (AVGO) Earnings Tonight?,Biztoc.com
2025-09-04T16:17:43Z,Jim Cramer Highlights Resilience of Leading Tech Stocks Like Broadcom,Yahoo Entertainment
2025-09-04T06:45:11Z,Morgan Stanley Forecasts Strong Price Appreciation for Broadcom (NASDAQ:AVGO) Stock,ETF Daily News
2025-09-03T04:35:48Z,Broadcom (AVGO) Works on Bringing Latest NVIDIA AI technology to VCF,Yahoo Entertainment
2025-09-02T16:35:47Z,"Time To Read Between The Lines For Nvidia, Broadcom And More",Biztoc.com
2025-09-02T14:44:30Z,Here’s What Lifted Broadcom (AVGO) in Q2,Biztoc.com
2025-09-02T14:19:16Z,Here’s What Lifted Broadcom (AVGO) in Q2,Yahoo Entertainment
2025-09-02T12:18:24Z,"Retail Investors' Top Stocks With Earnings This Week: Broadcom, NIO, Figma And More",Biztoc.com
2025-09-02T11:00:00Z,Buy AVGO Stock Ahead of Its Upcoming Earnings?,Forbes
"Sat, 06 Sep 2025 14:02:51 GMT","Broadcom (AVGO) Jumps to Record Highs on Earnings Blowout, $10-Billion AI Deal - Yahoo Finance",Yahoo Finance
"Fri, 05 Sep 2025 10:26:13 GMT",Broadcom: AVGO Stock To $600? - Forbes,Forbes
"Sat, 06 Sep 2025 13:34:00 GMT","New Buy Rating for Broadcom (AVGO), the Technology Giant - The Globe and Mail",The Globe and Mail
"Wed, 03 Sep 2025 19:47:57 GMT",Broadcom Q3 Earnings to Fuel the Next Leg Higher for AVGO? - tastylive,tastylive
"Thu, 04 Sep 2025 19:00:08 GMT",Live: Will Broadcom (AVGO) Beat Earnings Tonight? - 24/7 Wall St.,24/7 Wall St.
"Thu, 04 Sep 2025 18:00:00 GMT","After-Hours Earnings Report for September 4, 2025 : AVGO, CPRT, LULU, GWRE, DOCU, IOT, PATH, AGX, BRZE, PHR, NX, CANG - Nasdaq",Nasdaq
"Thu, 04 Sep 2025 20:48:45 GMT",AVGO Earnings: Broadcom Reports Record Q3 Revenue on AI Momentum - TipRanks,TipRanks
"Fri, 05 Sep 2025 16:04:13 GMT",Forget Nvidia: Broadcom Is The New Face Of AI (NASDAQ:AVGO) - Seeking Alpha,Seeking Alpha
"Sat, 06 Sep 2025 17:16:03 GMT",OpenAI Partners With Broadcom (AVGO) To Develop AI Chip For Internal Use In 2026 - Yahoo Finance,Yahoo Finance
"Tue, 02 Sep 2025 11:00:00 GMT",Broadcom: Buy AVGO Stock Now? - Forbes,Forbes
"Thu, 04 Sep 2025 20:25:53 GMT","Broadcom slips even as Q3 results, guidance top expectations (AVGO:NASDAQ) - Seeking Alpha",Seeking Alpha
"Thu, 04 Sep 2025 20:31:07 GMT","No Surprises In Broadcom’s (NASDAQ:AVGO) Q2 Sales Numbers, Provides Encouraging Quarterly Revenue Guidance - Yahoo Finance",Yahoo Finance
"Sat, 06 Sep 2025 11:32:08 GMT","Broadcom (AVGO): Rethinking Valuation After OpenAI Partnership, Record AI Chip Growth, and Major Enterprise Wins - Yahoo Finance",Yahoo Finance
"Sat, 06 Sep 2025 12:49:54 GMT",Broadcom: Multiple Expansion Still On The Table After Today's Pop (NASDAQ:AVGO) - Seeking Alpha,Seeking Alpha
"Fri, 05 Sep 2025 16:45:43 GMT",Why Is Broadcom (AVGO) Stock Rocketing Higher Today - Yahoo Finance,Yahoo Finance
"Fri, 05 Sep 2025 17:20:37 GMT","Broadcom (AVGO) Partners With OpenAI For AI Chip, Affirms US$0.59 Dividend - Yahoo Finance",Yahoo Finance
"Tue, 02 Sep 2025 15:29:00 GMT",Broadcom (AVGO) Thrives in Custom AI Explosion - Yahoo Finance,Yahoo Finance
"Sat, 06 Sep 2025 10:24:24 GMT",Broadcom (AVGO) Gets Fresh $382 Target — Can It Keep Pace With Nvidia? - Yahoo Finance,Yahoo Finance
"Wed, 03 Sep 2025 07:00:00 GMT",Broadcom (AVGO) Is About to Report Q3 Earnings. Here’s What to Expect from the Chip Stock - TipRanks,TipRanks
"Sat, 06 Sep 2025 11:04:20 GMT",Broadcom Continues To Take Nvidia's Lunch (NASDAQ:AVGO) - Seeking Alpha,Seeking Alpha
"Fri, 05 Sep 2025 13:09:47 GMT",AVGO: Broadcom Stock Climbs After Tops Estimates and Lifts Q4 Guide - Yahoo Finance,Yahoo Finance
"Sat, 06 Sep 2025 12:05:23 GMT",Broadcom (AVGO) Gets Fresh $382 Target — Can It Keep Pace With Nvidia? - MSN,MSN
"Thu, 04 Sep 2025 12:00:18 GMT",Is Broadcom Inc.'s (NASDAQ:AVGO) Latest Stock Performance A Reflection Of Its Financial Health? - Yahoo Finance,Yahoo Finance
"Fri, 05 Sep 2025 13:56:00 GMT","Biggest stock movers Friday: LULU, AVGO, DOCU, IOT, and more - Seeking Alpha",Seeking Alpha
"Fri, 05 Sep 2025 14:45:00 GMT",$AVGO stock is up 10% today. Here's what we see in our data. - Quiver Quantitative,Quiver Quantitative
"Wed, 03 Sep 2025 07:00:00 GMT",Is Broadcom Stock (AVGO) a Buy Ahead of Q3 Earnings? - TipRanks,TipRanks
"Fri, 05 Sep 2025 07:05:08 GMT",Broadcom Inc (AVGO) Q3 2025 Earnings Call Highlights: Record Revenue Driven by AI Semiconductor ... - Yahoo Finance,Yahoo Finance
"Fri, 05 Sep 2025 12:30:00 GMT",Broadcom's Q3 Earnings Silence Doubters (NASDAQ:AVGO) - Seeking Alpha,Seeking Alpha
"Fri, 05 Sep 2025 15:21:09 GMT",Another AI Home Run For Broadcom (NASDAQ:AVGO) - Seeking Alpha,Seeking Alpha
"Fri, 05 Sep 2025 14:20:00 GMT",New Analyst Forecast: $AVGO Given $355.0 Price Target - Quiver Quantitative,Quiver Quantitative
"Thu, 04 Sep 2025 14:04:00 GMT",Broadcom Inc. Stock (AVGO) Opinions on Upcoming Q3 Earnings Report - Quiver Quantitative,Quiver Quantitative
"Wed, 03 Sep 2025 16:43:00 GMT",Will Higher Semiconductor Revenues Help AVGO Stock Beat Q3 Earnings? - Nasdaq,Nasdaq
"Thu, 04 Sep 2025 22:54:09 GMT",Broadcom (AVGO) Remains a Top Pick as Cantor Fitzgerald Lifts Price Target to $350 - Yahoo Finance,Yahoo Finance
"Fri, 05 Sep 2025 16:26:32 GMT",AI-Driven Semiconductor Stocks: Why Broadcom (AVGO) Outperforms the Field - AInvest,AInvest
"Fri, 05 Sep 2025 16:26:12 GMT",Broadcom Stock Price Forecast – Is $400 Coming Next for AVGO? - tradingnews.com,tradingnews.com
"Fri, 05 Sep 2025 18:56:28 GMT",Broadcom: Strong Buy On AI Supercycle And Software (NASDAQ:AVGO) - Seeking Alpha,Seeking Alpha
"Fri, 05 Sep 2025 13:45:44 GMT",Broadcom: Powering OpenAI And The Next Wave Of AI Growth (NASDAQ:AVGO) - Seeking Alpha,Seeking Alpha
"Fri, 05 Sep 2025 12:33:45 GMT",‘Keep Buying’ Affirm Top Analysts for Broadcom Stock (AVGO) on Strong AI Momentum - TipRanks,TipRanks
"Wed, 03 Sep 2025 08:38:27 GMT",Broadcom Earnings: What To Look For From AVGO - Yahoo Finance,Yahoo Finance
"Fri, 05 Sep 2025 13:03:05 GMT",Broadcom Inc. ($AVGO) Stock: Q3 2025 Earnings Soar on AI Demand and Record Revenue - CoinCentral,CoinCentral
"Fri, 05 Sep 2025 01:31:00 GMT",Broadcom (AVGO) Remains a Top Pick as Cantor Fitzgerald Lifts Price Target to $350 - MSN,MSN
"Sat, 06 Sep 2025 04:32:49 GMT",Broadcom Stock (AVGO) Gains as Analysts Lift Price Targets After Strong Q3 Results - MSN,MSN
"Fri, 05 Sep 2025 12:33:45 GMT","Dow Futures Edge Lower Ahead Of Crucial August Jobs Report: TSLA, AVGO, LULU, DOCU Among Stocks To Watch - Stocktwits",Stocktwits
"Fri, 05 Sep 2025 20:14:00 GMT","Noteworthy Friday Option Activity: LULU, AVGO, U - Nasdaq",Nasdaq
"Fri, 05 Sep 2025 02:52:48 GMT",Is Broadcom (AVGO) a Must-Buy Ahead of Its Q3 Earnings Amid Surging AI Demand? - AInvest,AInvest
"Fri, 05 Sep 2025 15:23:45 GMT",Broadcom AVGO Soars on $10B OpenAI Chip Order; NVDA Slips - NAI500,NAI500
"Fri, 05 Sep 2025 15:13:50 GMT",Broadcom (AVGO) Tipped as No. 2 AI Franchise After Nvidia - MSN,MSN
"Fri, 05 Sep 2025 04:47:40 GMT",OpenAI Taps Broadcom (AVGO) to Build Its Own AI Chips - TipRanks,TipRanks
"Wed, 03 Sep 2025 04:35:00 GMT",Broadcom (AVGO) Works on Bringing Latest NVIDIA AI technology to VCF - ca.finance.yahoo.com,ca.finance.yahoo.com
"Fri, 05 Sep 2025 23:24:33 GMT","Broadcom (AVGO) Stock: Soars over 9% on $10B OpenAI Chip Deal, Eyes $40B AI Revenue in 2026 - parameter.io",parameter.io
"Fri, 05 Sep 2025 00:03:32 GMT",Is Now the Optimal Time to Buy Broadcom (AVGO) Amid Record Revenue and AI-Driven Growth? - AInvest,AInvest
"Fri, 05 Sep 2025 13:11:47 GMT",Broadcom (AVGO) Stock: Soars 9% on $10 Billion AI Chip Deal and Strong Q3 Earnings - parameter.io,parameter.io
"Fri, 05 Sep 2025 05:31:00 GMT",AVGO Q2 Deep Dive: AI Semiconductor and Infrastructure Software Demand Drive Guidance Upside - FinancialContent,FinancialContent
"Fri, 05 Sep 2025 12:00:15 GMT",Broadcom Stock (AVGO) Making Highs: Analysts Target $400 After Earnings Beat - AskTraders.com,AskTraders.com
"Sat, 06 Sep 2025 00:37:34 GMT","NVDA, AMD, AVGO: President Trump Again Threatens Big Tariffs on Semiconductors - MSN",MSN
"Fri, 05 Sep 2025 13:00:02 GMT","Broadcom's Free Cash Flow Surges With Higher FCF Margins, Implying a 25% Higher Value for AVGO Stock - Barchart.com",Barchart.com
"Fri, 05 Sep 2025 15:20:23 GMT","Chip Tariffs Jolt Sector as AVGO Jumps, AAPL Wins Carve-Out - NAI500",NAI500
"Tue, 02 Sep 2025 18:54:00 GMT","Buy, Sell or Hold AVGO Stock: Key Tips Ahead of Q3 Earnings? - The Globe and Mail",The Globe and Mail
"Fri, 05 Sep 2025 19:55:36 GMT","NVDA, AMD, AVGO: President Trump Again Threatens Big Tariffs on Semiconductors - TipRanks",TipRanks
"Thu, 04 Sep 2025 21:58:35 GMT",Broadcom (AVGO) Stock: Q3 Delivers 22% Revenue Growth and 47% Cash Flow Surge Powered by AI - parameter.io,parameter.io
"Fri, 05 Sep 2025 11:30:49 GMT",First Look: Broadcom (AVGO) Surges on AI Deal and Leadership Ass - GuruFocus,GuruFocus
"Tue, 02 Sep 2025 14:31:54 GMT",Broadcom (AVGO) Thrives in Custom AI Explosion - Zacks Investment Research,Zacks Investment Research
"Thu, 04 Sep 2025 17:08:06 GMT",Broadcom Earnings: Analysts Bullish on AI Revenue Beat | AVGO Stock - News and Statistics - IndexBox,IndexBox
"Thu, 04 Sep 2025 10:07:30 GMT",Broadcom Earnings On Deck – (AVGO) Stock Doubles Off April Low Leading In - AskTraders.com,AskTraders.com
"Wed, 03 Sep 2025 04:10:37 GMT",‘Sustained AI Demand’ Pushes Broadcom Stock (AVGO) to All-Time Record Highs - MSN,MSN
"Thu, 04 Sep 2025 20:47:23 GMT","Broadcom Tops Q3 Earnings, AI Momentum Ahead - Broadcom (NASDAQ:AVGO) - Benzinga",Benzinga
"Thu, 04 Sep 2025 20:51:24 GMT",Broadcom Inc (AVGO) Q3 Earnings: Non-GAAP EPS of $1.69 Beats Est - GuruFocus,GuruFocus
"Tue, 02 Sep 2025 07:09:41 GMT",Broadcom (AVGO) Enhances VMware Cloud Foundation With AI Services and Data Intelligence Launch - Yahoo Finance,Yahoo Finance
"Tue, 02 Sep 2025 23:32:25 GMT",‘Sustained AI Demand’ Pushes Broadcom Stock (AVGO) to All-Time Record Highs - TipRanks,TipRanks
"Fri, 05 Sep 2025 11:30:00 GMT",Breakfast News: AVGO's $10B OpenAI Deal - The Motley Fool,The Motley Fool
"Wed, 03 Sep 2025 02:07:24 GMT","Broadcom Stock (AVGO) Remains a ‘Top Pick,’ Says 5-Star Analyst, Lifts Price Target to $350 - MSN",MSN
"Tue, 02 Sep 2025 16:07:53 GMT",Video: Broadcom (AVGO) Earnings Preview: Can AI’s Engine Keep the Multiple Aloft? - AInvest,AInvest
"Thu, 04 Sep 2025 21:18:10 GMT","Broadcom (AVGO) Q2 Earnings Beat, Issues Strong $17.4B Guidance - News and Statistics - IndexBox",IndexBox
"Fri, 05 Sep 2025 09:30:11 GMT","Biggest stock movers Friday: LULU, AVGO, DOCU, and more - MSN",MSN
"Tue, 02 Sep 2025 17:21:45 GMT","AVGO vs TSM Stock Forecast: Broadcom $296, TSM $226 Target $300+ - tradingnews.com",tradingnews.com
2025-09-05T23:12:53,Should You Buy the Post-Earnings Pop in Broadcom Stock?,Yahoo
2025-09-05T22:51:00,Buy the Spike in Broadcom Stock After its Strong Q3 Earnings?,Yahoo
2025-09-05T21:18:16,"Powerball jackpot, Nvidia & AMD fall on Broadcom–OpenAI report",Yahoo
2025-09-05T16:56:28,Broadcom: Strong Buy On AI Supercycle And Software,SeekingAlpha
2025-09-05T16:09:47,AVGO: Broadcom Stock Climbs After Tops Estimates and Lifts Q4 Guide,Yahoo
2025-09-05T15:31:10,What's Going On With Marvell Technology Stock Friday?,Yahoo
2025-09-05T15:21:07,"Broadcom Set for Revenue Growth in Fiscal 2026 on AI Acceleration, Deutsche Bank Says",Yahoo
2025-09-05T13:54:26,What's Going On With Nvidia Stock Friday?,Yahoo
2025-09-05T11:38:12,"Stocks to Watch Friday: Broadcom, DocuSign, Lululemon",Yahoo
2025-09-05T10:30:00,Broadcom's Q3 Earnings Silence Doubters,SeekingAlpha
2025-09-05T01:54:09,Broadcom (AVGO) Remains a Top Pick as Cantor Fitzgerald Lifts Price Target to $350,Yahoo
2025-09-05T00:45:02,Broadcom Inc. (AVGO) Surpasses Q3 Earnings and Revenue Estimates,Yahoo
2025-09-04T23:54:58,"Broadcom earnings beat, Q4 revenue guidance wows Wall Street",Yahoo
2025-09-04T23:48:40,Broadcom Tops Third-Quarter Views Amid AI Chip Demand,Yahoo
2025-09-04T23:41:58,Broadcom Inc.: Fiscal Q3 Earnings Snapshot,Yahoo
2025-09-04T23:32:29,Jim Cramer Believes Broadcom Inc. (AVGO) Just Has The Best CEO,Yahoo
2025-09-04T23:31:07,"No Surprises In Broadcom’s (NASDAQ:AVGO) Q2 Sales Numbers, Provides Encouraging Quarterly Revenue Guidance",Yahoo
2025-09-04T23:15:00,Broadcom Inc. Announces Third Quarter Fiscal Year 2025 Financial Results and Quarterly Dividend,Yahoo
2025-09-04T22:20:44,Broadcom Inc. (AVGO) Q3 2025 Earnings Call Transcript,SeekingAlpha
2025-09-03T19:43:00,Will Higher Semiconductor Revenues Help AVGO Stock Beat Q3 Earnings?,Yahoo
2025-09-03T14:30:00,Broadcom earnings: Why this expert is 'incrementally concerned',Yahoo
2025-09-03T07:35:48,Broadcom (AVGO) Works on Bringing Latest NVIDIA AI technology to VCF,Yahoo
2025-09-06T01:41:21,AVGO Gains +1639% First big win,Reddit/r/wallstreetbets
2025-09-05T20:39:15,$AVGO more like $AVGains,Reddit/r/wallstreetbets
2025-09-05T18:03:28,$90k profit from AVGO ITM calls,Reddit/r/wallstreetbets
2025-09-05T16:04:28,AVGO GAINS!!,Reddit/r/wallstreetbets
2025-09-05T15:52:12,330$ -> 3000$. Thank you AVGO!,Reddit/r/wallstreetbets
2025-09-05T09:36:01,AVGO is always bullish,Reddit/r/wallstreetbets
