Date,Title,Source
2025-11-03T14:19:52Z,Here’s What Drove Baron Health Care Fund to Add AbbVie (ABBV) to Its Portfolio,Yahoo Entertainment
2025-11-03T13:21:41Z,Analyst on AbbVie (ABBV): ‘Stay Long’,Yahoo Entertainment
"Fri, 31 Oct 2025 17:02:24 GMT",Why AbbVie (ABBV) Shares Are Falling Today - Yahoo Finance,Yahoo Finance
"Mon, 03 Nov 2025 20:20:00 GMT",New Analyst Forecast: $ABBV Given $235.0 Price Target - Quiver Quantitative,Quiver Quantitative
"Tue, 04 Nov 2025 04:30:09 GMT",How ABBV stock trades before earnings - CPI Data & Accurate Technical Buy Alerts - newser.com,newser.com
"Mon, 03 Nov 2025 23:48:25 GMT","How MRK, ABBV, and BMY Could Rescue Investor Portfolios in a Downturn - TipRanks",TipRanks
"Fri, 31 Oct 2025 16:19:46 GMT",AbbVie says Trump pressing for larger Medicare drug price cuts - Reuters,Reuters
"Mon, 03 Nov 2025 23:14:14 GMT",AbbVie (NYSE:ABBV) Stock Price Down 2.8% - Here's Why - MarketBeat,MarketBeat
"Mon, 03 Nov 2025 20:50:30 GMT",Citigroup Lowers Price Target for AbbVie (ABBV) to $235 Amidst N - GuruFocus,GuruFocus
"Fri, 31 Oct 2025 14:46:00 GMT",AbbVie Beats Third-Quarter Estimates. There’s More to the Drugmaker’s Earnings. - Barron's,Barron's
"Mon, 03 Nov 2025 13:34:11 GMT",Analyst on AbbVie (ABBV): ‘Stay Long’ - MSN,MSN
"Sat, 01 Nov 2025 14:43:05 GMT","AbbVie (ABBV) Reports $14.5 Billion One-Off Loss, Undercutting Bullish Margin Recovery Narratives - simplywall.st",simplywall.st
"Sat, 01 Nov 2025 10:15:00 GMT",Why AbbVie Stock Flopped on Friday - The Motley Fool,The Motley Fool
"Mon, 03 Nov 2025 13:21:41 GMT",Analyst on AbbVie (ABBV): ‘Stay Long’ - Yahoo Finance,Yahoo Finance
"Mon, 03 Nov 2025 11:46:22 GMT",AbbVie Inc. $ABBV Shares Sold by Bank of Montreal Can - MarketBeat,MarketBeat
"Mon, 03 Nov 2025 14:19:52 GMT",Here’s What Drove Baron Health Care Fund to Add AbbVie (ABBV) to Its Portfolio - Yahoo Finance,Yahoo Finance
"Mon, 03 Nov 2025 14:35:47 GMT",ABBV Q3 Deep Dive: Immunology Growth and Pipeline Expansion Offset Margin Pressure - Yahoo Finance,Yahoo Finance
"Sat, 01 Nov 2025 00:26:00 GMT",AbbVie (ABBV) Margin Compression Reinforces Investor Caution After $14.5 Billion One-Off Loss - Yahoo Finance,Yahoo Finance
"Fri, 31 Oct 2025 12:11:30 GMT",AbbVie’s (NYSE:ABBV) Q3 Sales Beat Estimates - Yahoo Finance,Yahoo Finance
"Mon, 03 Nov 2025 15:33:43 GMT","JP Morgan Raises Price Target on AbbVie (ABBV) to $260, Maintains Overweight Rating | ABBV Stock News - GuruFocus",GuruFocus
"Fri, 31 Oct 2025 15:00:00 GMT",AbbVie (ABBV) Q3 Earnings: How Key Metrics Compare to Wall Street Estimates - Nasdaq,Nasdaq
"Mon, 03 Nov 2025 11:56:29 GMT",AbbVie Inc. $ABBV Holdings Lifted by Tsfg LLC - MarketBeat,MarketBeat
"Mon, 03 Nov 2025 11:16:19 GMT",Burney Co. Has $11.59 Million Stock Position in AbbVie Inc. $ABBV - MarketBeat,MarketBeat
"Fri, 31 Oct 2025 14:03:06 GMT",Does RINVOQ’s Vitiligo Success Broaden AbbVie’s (ABBV) Long-Term Growth Potential? - simplywall.st,simplywall.st
"Fri, 31 Oct 2025 12:01:42 GMT",ABBV Earnings: A snapshot of AbbVie’s Q3 2025 report - AlphaStreet,AlphaStreet
"Sat, 01 Nov 2025 19:46:00 GMT",TD Cowen Remains a Buy on AbbVie (ABBV) - The Globe and Mail,The Globe and Mail
"Sun, 02 Nov 2025 13:46:55 GMT",Forecasting ABBV price range with options data - Earnings Recap Summary & Proven Capital Preservation Methods - newser.com,newser.com
"Mon, 03 Nov 2025 14:38:02 GMT",(ABBV) as a Liquidity Pulse for Institutional Tactics - news.stocktradersdaily.com,news.stocktradersdaily.com
"Mon, 03 Nov 2025 05:48:30 GMT",Is ABBV stock supported by strong fundamentals - Trade Risk Summary & Weekly High Return Stock Opportunities - newser.com,newser.com
"Mon, 03 Nov 2025 06:43:01 GMT",Why ABBV stock could see breakout soon - Earnings Miss & Safe Swing Trade Setups - newser.com,newser.com
"Sat, 01 Nov 2025 16:39:58 GMT",ABBV Stock: $250 May Be the New Floor After Big Q3 Earnings Beat - MarketBeat,MarketBeat
"Mon, 03 Nov 2025 04:20:53 GMT",Sell List - November 3rd 2025 (NYSE:ABBV) - Seeking Alpha,Seeking Alpha
"Mon, 03 Nov 2025 08:47:00 GMT",Earnings visualization tools for ABBV - Quarterly Market Review & Weekly Return Optimization Plans - newser.com,newser.com
"Mon, 03 Nov 2025 14:58:23 GMT",AbbVie (NYSE:ABBV) Given New $260.00 Price Target at JPMorgan Chase & Co. - MarketBeat,MarketBeat
"Sat, 01 Nov 2025 09:41:42 GMT",Haven Private LLC Takes Position in AbbVie Inc. $ABBV - MarketBeat,MarketBeat
"Sat, 01 Nov 2025 10:03:36 GMT",Can ABBV stock surprise with earnings upside - 2025 Price Momentum & Target Return Focused Stock Picks - newser.com,newser.com
"Sun, 02 Nov 2025 19:50:00 GMT",What MACD and RSI say about ABBV - Earnings Overview Report & Growth Focused Entry Point Reports - newser.com,newser.com
"Sat, 01 Nov 2025 10:10:08 GMT",Leeward Financial Partners LLC Buys New Stake in AbbVie Inc. $ABBV - MarketBeat,MarketBeat
"Sat, 01 Nov 2025 10:10:10 GMT",AbbVie Inc. $ABBV Shares Bought by Syverson Strege & Co - MarketBeat,MarketBeat
"Fri, 31 Oct 2025 14:39:51 GMT",AbbVie: Why Q3 Confirms Its Immunology Dominance (NYSE:ABBV) - Seeking Alpha,Seeking Alpha
"Sat, 01 Nov 2025 08:42:16 GMT",Assetmark Inc. Decreases Position in AbbVie Inc. $ABBV - MarketBeat,MarketBeat
"Sat, 01 Nov 2025 10:34:00 GMT",Center for Financial Planning Inc. Boosts Stake in AbbVie Inc. $ABBV - MarketBeat,MarketBeat
"Sat, 01 Nov 2025 10:42:20 GMT","Lifeworks Advisors LLC Purchases 1,575 Shares of AbbVie Inc. $ABBV - MarketBeat",MarketBeat
"Mon, 03 Nov 2025 12:38:23 GMT",Street View: Immunology strength holds at AbbVie despite aesthetics drag - TradingView,TradingView
"Sat, 01 Nov 2025 11:39:10 GMT","Longbow Finance SA Purchases 37,626 Shares of AbbVie Inc. $ABBV - MarketBeat",MarketBeat
"Sat, 01 Nov 2025 10:40:15 GMT",Crescent Sterling Ltd. Has $2.90 Million Stake in AbbVie Inc. $ABBV - MarketBeat,MarketBeat
"Sat, 01 Nov 2025 01:12:52 GMT",AbbVie Inc. (NYSE:ABBV) to Issue Quarterly Dividend of $1.73 - MarketBeat,MarketBeat
"Mon, 03 Nov 2025 10:15:28 GMT",Abbvie (ABBV) PT Raised to $256 at Raymond James - StreetInsider,StreetInsider
"Mon, 03 Nov 2025 12:52:47 GMT",Bank of New York Mellon Corp Cuts Position in AbbVie Inc. $ABBV - MarketBeat,MarketBeat
"Mon, 03 Nov 2025 13:17:51 GMT","Citi Maintains AbbVie(ABBV.US) With Hold Rating, Announces Target Price $235 - 富途牛牛",富途牛牛
"Mon, 03 Nov 2025 10:50:43 GMT","Sigma Planning Corp Sells 4,396 Shares of AbbVie Inc. $ABBV - MarketBeat",MarketBeat
"Mon, 03 Nov 2025 11:40:23 GMT",AbbVie Inc. $ABBV Shares Sold by Texas Bank & Trust Co - MarketBeat,MarketBeat
"Mon, 03 Nov 2025 12:25:21 GMT",AbbVie Inc. $ABBV Shares Acquired by Machina Capital S.A.S. - MarketBeat,MarketBeat
"Mon, 03 Nov 2025 13:15:30 GMT","Obermeyer Wealth Partners Sells 12,006 Shares of AbbVie Inc. $ABBV - MarketBeat",MarketBeat
"Sat, 01 Nov 2025 18:17:01 GMT",AbbVie (ABBV) Surpasses Q3 Expectations with Strong Revenue Growth - GuruFocus,GuruFocus
"Fri, 31 Oct 2025 19:44:21 GMT","AbbVie Stock (ABBV) Wobbles as Humira Sales Take a Hit, Dims Q3 Glow - TipRanks",TipRanks
"Fri, 31 Oct 2025 12:15:19 GMT",AbbVie Inc (ABBV) Q3 Earnings: Adjusted EPS of $1.86 Surpasses E - GuruFocus,GuruFocus
"Mon, 03 Nov 2025 11:32:19 GMT",Torray Investment Partners LLC Increases Stock Position in AbbVie Inc. $ABBV - MarketBeat,MarketBeat
"Sat, 01 Nov 2025 07:14:16 GMT",How strong is ABBV stock balance sheet - Trade Entry Summary & Long-Term Safe Return Strategies - newser.com,newser.com
"Fri, 31 Oct 2025 13:13:13 GMT",AbbVie (ABBV) Surpasses Q3 Earnings Expectations - GuruFocus,GuruFocus
"Mon, 03 Nov 2025 09:06:57 GMT",How ABBV stock performs after earnings - July 2025 Selloffs & Real-Time Volume Analysis - newser.com,newser.com
"Mon, 03 Nov 2025 07:10:25 GMT",Can ABBV stock surprise with earnings upside - July 2025 Earnings & Safe Capital Growth Tips - newser.com,newser.com
"Fri, 31 Oct 2025 11:26:32 GMT","1,128 Shares in AbbVie Inc. $ABBV Acquired by Bridgewealth Advisory Group LLC - MarketBeat",MarketBeat
"Fri, 31 Oct 2025 14:01:26 GMT",ABBV Revenue Forecast Sees a Boost in Outlook - GuruFocus,GuruFocus
"Fri, 31 Oct 2025 11:29:57 GMT","Cottage Street Advisors LLC Buys 4,693 Shares of AbbVie Inc. $ABBV - MarketBeat",MarketBeat
"Fri, 31 Oct 2025 10:26:44 GMT",Multi asset correlation models including ABBV - Weekly Gains Summary & Detailed Earnings Play Strategies - newser.com,newser.com
"Fri, 31 Oct 2025 11:52:02 GMT","AbbVie (ABBV) Tops Q3 EPS by 8c, Beats on Revenue; Offers FY25 EPS Guidance - StreetInsider",StreetInsider
"Fri, 31 Oct 2025 11:26:33 GMT",Integrity Alliance LLC. Trims Position in AbbVie Inc. $ABBV - MarketBeat,MarketBeat
"Fri, 31 Oct 2025 13:03:19 GMT","AbbVie (ABBV) Surpasses Q3 Earnings Expectations, Raises 2025 Gu - GuruFocus",GuruFocus
"Fri, 31 Oct 2025 15:07:39 GMT",AbbVie (ABBV) Faces EPS Guidance Shortfall Despite Q3 Revenue Be - GuruFocus,GuruFocus
"Fri, 31 Oct 2025 11:44:36 GMT",AbbVie Inc. $ABBV Shares Acquired by Linscomb Wealth Inc. - MarketBeat,MarketBeat
"Sun, 02 Nov 2025 12:30:23 GMT",Nicholas Company Inc. Cuts Holdings in AbbVie Inc. $ABBV - MarketBeat,MarketBeat
"Fri, 31 Oct 2025 10:13:57 GMT","IFG Advisory LLC Purchases 1,297 Shares of AbbVie Inc. $ABBV - MarketBeat",MarketBeat
"Fri, 31 Oct 2025 05:21:07 GMT",ABBV stock retracement – recovery analysis - Quarterly Trade Review & AI Driven Stock Movement Reports - newser.com,newser.com
"Fri, 31 Oct 2025 10:14:14 GMT",AbbVie Inc. $ABBV Shares Bought by Pinnacle Associates Ltd. - MarketBeat,MarketBeat
"Fri, 31 Oct 2025 10:30:29 GMT",AbbVie Inc. $ABBV Stake Boosted by Creekmur Asset Management LLC - MarketBeat,MarketBeat
"Sun, 02 Nov 2025 12:52:26 GMT","State of Michigan Retirement System Buys 1,400 Shares of AbbVie Inc. $ABBV - MarketBeat",MarketBeat
"Sun, 02 Nov 2025 11:12:06 GMT",Welch & Forbes LLC Cuts Stock Holdings in AbbVie Inc. $ABBV - MarketBeat,MarketBeat
"Fri, 31 Oct 2025 10:14:14 GMT","FWG Investments LLC. Invests $283,000 in AbbVie Inc. $ABBV - MarketBeat",MarketBeat
"Fri, 31 Oct 2025 10:14:14 GMT",Mesirow Financial Investment Management Inc. Lowers Stock Position in AbbVie Inc. $ABBV - MarketBeat,MarketBeat
"Fri, 31 Oct 2025 07:39:14 GMT",Does ABBV qualify in momentum factor screening - 2025 Support & Resistance & Free Technical Pattern Based Buy Signals - newser.com,newser.com
"Sun, 02 Nov 2025 11:44:10 GMT","TIAA Trust National Association Sells 10,325 Shares of AbbVie Inc. $ABBV - MarketBeat",MarketBeat
"Sun, 02 Nov 2025 11:54:12 GMT",Triglav Investments D.O.O. Lowers Stake in AbbVie Inc. $ABBV - MarketBeat,MarketBeat
"Sun, 02 Nov 2025 11:12:06 GMT","Accuvest Global Advisors Sells 1,690 Shares of AbbVie Inc. $ABBV - MarketBeat",MarketBeat
"Fri, 31 Oct 2025 18:13:01 GMT",AbbVie Inc (ABBV) Q3 2025 Earnings Call Highlights: Strong Finan - GuruFocus,GuruFocus
"Sun, 02 Nov 2025 11:54:13 GMT",Tredje AP fonden Cuts Position in AbbVie Inc. $ABBV - MarketBeat,MarketBeat
"Fri, 31 Oct 2025 11:19:36 GMT",AbbVie Inc. $ABBV Shares Sold by Bordeaux Wealth Advisors LLC - MarketBeat,MarketBeat
"Sun, 02 Nov 2025 11:44:11 GMT","SS&H Financial Advisors Inc. Buys 8,330 Shares of AbbVie Inc. $ABBV - MarketBeat",MarketBeat
"Fri, 31 Oct 2025 09:14:33 GMT","Spire Wealth Management Sells 13,508 Shares of AbbVie Inc. $ABBV - MarketBeat",MarketBeat
"Sun, 02 Nov 2025 10:12:02 GMT",AbbVie Inc. $ABBV Shares Purchased by Great Lakes Retirement Inc. - MarketBeat,MarketBeat
"Fri, 31 Oct 2025 23:03:02 GMT",AbbVie (NYSE:ABBV) Updates Q4 2025 Earnings Guidance - MarketBeat,MarketBeat
"Fri, 31 Oct 2025 20:51:36 GMT","AbbVie Inc. (ABBV) Stock Slides 4.45% as Q3 EPS Plunges 88%, Despite 9% Revenue Growth and Strong Immunology Sales - CoinCentral",CoinCentral
"Thu, 30 Oct 2025 12:29:35 GMT","Simon Quick Advisors LLC Buys 4,205 Shares of AbbVie Inc. $ABBV - MarketBeat",MarketBeat
"Fri, 31 Oct 2025 20:45:49 GMT",AbbVie (ABBV) Reports Strong Linzess Sales in Q3 - GuruFocus,GuruFocus
"Thu, 30 Oct 2025 09:29:55 GMT","Jennison Associates LLC Sells 135,764 Shares of AbbVie Inc. $ABBV - MarketBeat",MarketBeat
"Fri, 31 Oct 2025 20:59:50 GMT","AbbVie (ABBV) Exceeds Q3 Expectations, Raises 2025 Outlook - GuruFocus",GuruFocus
"Fri, 31 Oct 2025 10:48:03 GMT",Why ABBV stock could see breakout soon - Trade Risk Assessment & Consistent Income Trade Recommendations - newser.com,newser.com
"Fri, 31 Oct 2025 13:57:19 GMT",ABBV: Promising Future with Strategic Investments and Approvals - GuruFocus,GuruFocus
"Thu, 30 Oct 2025 23:35:12 GMT",AbbVie (NYSE:ABBV) Shares Up 1.4% - Should You Buy? - MarketBeat,MarketBeat
"Fri, 31 Oct 2025 11:58:00 GMT",AbbVie: Q3 Earnings Snapshot - WKYC,WKYC
2025-11-04T01:09:21,JP Morgan Maintains AbbVie (ABBV) Overweight Recommendation,Fintel
2025-11-03T15:35:47,ABBV Q3 Deep Dive: Immunology Growth and Pipeline Expansion Offset Margin Pressure,Yahoo
2025-11-03T15:19:52,Here’s What Drove Baron Health Care Fund to Add AbbVie (ABBV) to Its Portfolio,Yahoo
2025-11-03T14:21:41,Analyst on AbbVie (ABBV): ‘Stay Long’,Yahoo
2025-11-03T11:12:00,"United States Multiple Myeloma Market Research Report 2025-2033, Profiles of Key Players - Novartis, Abbvie, Sanofi, Johnson and Johnson, Baxter, Pfizer, Takeda, and Bristol-Myers Squibb",Yahoo
2025-11-01T11:15:00,Why AbbVie Stock Flopped on Friday,Yahoo
2025-11-01T01:26:24,AbbVie (ABBV) Margin Compression Reinforces Investor Caution After $14.5 Billion One-Off Loss,Yahoo
2025-10-31T20:04:54,AbbVie Inc (ABBV) Q3 2025 Earnings Call Highlights: Strong Financial Performance Amidst Humira ...,Yahoo
2025-10-31T19:08:34,"AbbVie raises full-year forecast, Newell Brands stock plunges",Yahoo
2025-10-31T19:06:00,"AbbVie Q3 Earnings & Sales Beat, 2025 EPS Outlook Raised",Yahoo
2025-10-31T18:02:24,Why AbbVie (ABBV) Shares Are Falling Today,Yahoo
2025-10-31T16:56:23,AbbVie Inc. (ABBV) Q3 2025 Earnings Call Transcript,SeekingAlpha
2025-10-31T16:08:11,"Reddit, AbbVie, Western Digital: Earnings in focus",Yahoo
2025-10-31T16:00:02,AbbVie (ABBV) Q3 Earnings: How Key Metrics Compare to Wall Street Estimates,Yahoo
2025-10-31T15:57:07,"AbbVie Lifts Outlook Even as Humira, Imbruvica Weakness Limits Quarterly Revenue Growth",Yahoo
2025-10-31T15:51:00,Demographic Megatrend: Stocks Poised to Benefit From Global Aging,Yahoo
2025-10-31T14:00:02,AbbVie (ABBV) Q3 Earnings and Revenues Surpass Estimates,Yahoo
2025-10-31T13:42:00,AbbVie Lifts Profit Outlook as Sales Rise,Yahoo
2025-10-31T13:30:41,"AbbVie quarterly profit drops on costs but ups 2025 outlook, dividend",Fintel
2025-10-31T13:28:28,AbbVie lifts full-year profit outlook amid strong psoriasis drug demand,Yahoo
2025-10-31T13:22:29,AbbVie Beats Third-Quarter Forecasts As Immunology Kingpin Grows 47%,Yahoo
2025-10-31T13:20:00,AbbVie Beats Third-Quarter Estimates. There’s More to the Drugmaker’s Earnings.,Yahoo
2025-10-31T13:11:30,AbbVie’s (NYSE:ABBV) Q3 Sales Beat Estimates,Yahoo
2025-10-31T12:58:40,AbbVie: Q3 Earnings Snapshot,Yahoo
2025-10-31T12:49:00,AbbVie Reports Third-Quarter 2025 Financial Results,Yahoo
2025-10-31T11:39:51,AbbVie: Why Q3 Confirms Its Immunology Dominance,SeekingAlpha
2025-10-31T10:51:27,AbbVie raises its annual forecast despite sluggish quarterly earnings,Finnhub
2025-10-31T09:34:00,"Exxon Mobil, Berkshire Earnings and Fed Speakers: Still to Come This Week",Yahoo
2025-10-30T13:32:12,AbbVie posts another win for Rinvoq in Phase III vitiligo trials,Yahoo
2025-10-30T12:01:00,ELAHERE® Receives Positive Reimbursement Recommendation by Canada's Drug Agency for Certain Types of Platinum-Resistant Ovarian Cancers,Yahoo
2025-10-30T04:01:41,AbbVie (ABBV) Reports Earnings Tomorrow: What To Expect,Yahoo
